{"type": "node", "id": "N466", "label": "FACC iter-15 refused + trochoid health-check at 0,0", "timestamp": "2026-10-01T00:00:00Z", "idea": "FACC-ITER15", "status": "discard", "detail": "Health-check 60 eps A/B/R 1.00/1.00/1.00, 0 errors, 0 rig bytes; queue empty since 309, estimator closed (N455/N456/N457), N198 director-owned."}
{"type": "edge", "from": "director-iter-15-FACC", "to": "retired-FACC-family", "kind": "replay-refused", "timestamp": "2026-10-01T00:00:00Z", "note": "32nd G3-retired eq78/N70-N76/energy/EBM/FACC replay (FACC SE3-conditioned contact control replacing flow-matching head, predicted 76); 0 injectable PATH_MODES hook (G4 unpairable); predicted-only invalid for keep (G7). Not executed."}
{"type": "node", "id": "N467", "label": "FACC-EA iter-16 refused + trochoid health-check at 0,0", "timestamp": "2026-10-01T00:00:00Z", "idea": "FACC-ITER16", "status": "discard", "detail": "Health-check 60 eps A/B/R 1.00/1.00/1.00, 0 errors, 0 rig bytes; queue empty since 309, estimator closed (N455/N456/N457), N198 director-owned."}
{"type": "edge", "from": "director-iter-16-FACC-EA", "to": "retired-FACC-family", "kind": "replay-refused", "timestamp": "2026-10-01T00:00:00Z", "note": "33rd G3-retired eq78/N70-N76/energy/EBM/FACC replay (FACC-EA SE3-conditioned force-adaptive contact control with energy attention, predicted 78); 0 injectable PATH_MODES hook (G4 unpairable); predicted-only invalid for keep (G7). Not executed."}
{"type": "node", "id": "N468", "label": "FACC iter-17 refused + trochoid health-check at 0,0", "timestamp": "2026-10-01T00:00:00Z", "idea": "FACC-ITER17", "status": "discard", "detail": "Health-check 60 eps A/B/R 1.00/1.00/1.00, 0 errors, 0 rig bytes; queue empty since 309, estimator closed (N455/N456/N457), N198 director-owned."}
{"type": "edge", "from": "director-iter-17-FACC", "to": "retired-FACC-family", "kind": "replay-refused", "timestamp": "2026-10-01T00:00:00Z", "note": "34th G3-retired eq78/N70-N76/energy/EBM/FACC replay (FACC SE3-conditioned contact policy replacing flow head, predicted 76); 0 injectable PATH_MODES hook (G4 unpairable); predicted-only invalid for keep (G7). Not executed."}
{"type": "node", "id": "N469", "label": "FACC iter-18 refused + trochoid health-check at 0,0", "timestamp": "2026-10-01T00:00:00Z", "idea": "FACC-ITER18", "status": "discard", "detail": "Health-check 60 eps A/B/R 1.00/1.00/1.00, 0 errors, 0 rig bytes; queue empty since 309, estimator closed (N455/N456/N457), N198 director-owned."}
{"type": "edge", "from": "director-iter-18-FACC", "to": "retired-FACC-family", "kind": "replay-refused", "timestamp": "2026-10-01T00:00:00Z", "note": "35th G3-retired eq78/N70-N76/energy/EBM/FACC replay (FACC SE3-conditioned energy head replacing flow-mat, predicted 76); 0 injectable PATH_MODES hook (G4 unpairable); predicted-only invalid for keep (G7). Not executed."}
{"type": "node", "id": "N470", "label": "VM-FACC iter-19 refused + trochoid health-check at 0,0", "timestamp": "2026-10-01T00:00:00Z", "idea": "VM-FACC-ITER19", "status": "discard", "detail": "Health-check 60 eps A/B/R 1.00/1.00/1.00, 0 errors, 0 rig bytes; queue empty since 309, estimator closed (N455/N456/N457), N198 director-owned."}
{"type": "edge", "from": "director-iter-19-VM-FACC", "to": "retired-FACC-family", "kind": "replay-refused", "timestamp": "2026-10-01T00:00:00Z", "note": "36th G3-retired eq78/N70-N76/energy/EBM/FACC/VM-FACC replay (VM-FACC SE3-conditioned flow on force-gated affordance manifold, predicted 76); 0 injectable PATH_MODES hook (G4 unpairable); predicted-only invalid for keep (G7). Not executed."}
{"type": "node", "id": "N471", "label": "FACC iter-20 refused + trochoid health-check at 0,0", "timestamp": "2026-10-01T00:00:00Z", "idea": "FACC-ITER20", "status": "discard", "detail": "Health-check 60 eps A/B/R 1.00/1.00/1.00, 0 errors, 0 rig bytes; queue empty since 309, estimator closed (N455/N456/N457), N198 director-owned."}
{"type": "edge", "from": "director-iter-20-FACC", "to": "retired-FACC-family", "kind": "replay-refused", "timestamp": "2026-10-01T00:00:00Z", "note": "37th G3-retired eq78/N70-N76/energy/EBM/FACC replay (FACC SE3-conditioned energy-based physical in-context attention replacing flow-mat, predicted 74); 0 injectable PATH_MODES hook (G4 unpairable); predicted-only invalid for keep (G7). Not executed."}
{"type": "node", "id": "FACC-EA-ITER21", "run": 472, "metric": 0.0, "status": "discard", "note": "38th G3 replay (FACC-EA iter-21, predicted 76); refused, health-check only trochoid 60/60"}
{"type": "edge", "from": "FACC-ITER20", "to": "FACC-EA-ITER21", "label": "replay-refused", "run": 472}
{"type": "node", "id": "FACC-ITER22", "run": 473, "metric": 0.0, "status": "discard", "note": "39th G3 replay (FACC iter-22, predicted 76); refused, health-check only trochoid 60/60"}
{"type": "edge", "from": "FACC-EA-ITER21", "to": "FACC-ITER22", "label": "replay-refused", "run": 473}
{"type": "node", "id": "FACC-ITER23", "run": 474, "metric": 0.0, "status": "discard", "note": "40th G3 replay (FACC iter-23, predicted 76); refused, health-check only trochoid 60/60"}
{"type": "edge", "from": "FACC-ITER22", "to": "FACC-ITER23", "label": "replay-refused", "run": 474}
{"type": "node", "id": "FACC-ITER24", "run": 475, "metric": 0.0, "status": "discard", "note": "41st G3 replay (FACC iter-24, predicted 74); refused, health-check only trochoid 60/60"}
{"type": "edge", "from": "FACC-ITER23", "to": "FACC-ITER24", "label": "replay-refused", "run": 475}
{"type": "node", "id": "N476", "run": 476, "metric": 0.85, "status": "keep", "note": "registration-window DOSE H=0.6 vs paired 0.35 at 0.32,64 (first unmeasured cell past the certified boundary): B 0.40->0.85, Welch p 6.6e-3, Fisher p 7.9e-3, paired p 9.3e-4, 20 seeds, rig keep=true; boundary placed at 0.40,80 (0.70) and 0.48,96 (0.60), both keep=false. Tier-2 requirement extended to 0.32 m / 64 deg."}
{"type": "node", "id": "FACC-ITER25", "run": 476, "metric": 0.0, "status": "discard", "note": "42nd G3 replay (director iter-1 FACC-SE3, predicted 76-81); refused, not executed"}
{"type": "edge", "from": "N456", "to": "N476", "label": "dose-extends-certified-boundary", "run": 476}
{"type": "edge", "from": "FACC-ITER24", "to": "FACC-ITER25", "label": "replay-refused", "run": 476}
{"id": "N477-r478", "metric": 0.575, "parent": "N476", "status": "discard", "strategy": "window dose H=0.9 at 0.40,80 failed B<0.70; family closes", "timestamp": 1769999999, "type": "node"}
{"id": "E477-478", "from": "N476", "to": "N477-r478", "reason": "dose sweep above 0.6 at failed cell", "timestamp": 1769999999, "type": "edge"}
{"node":"N477-r479-H12","idea":"N477","run":479,"status":"keep","fixture_B":1.0,"compare":"trochoid","evidence":"results/aegis_v2/N477_r479_H12_0.40_80.jsonl","note":"dose 1.2 above 0.6; FACC replay refused"}
{"edge":{"from":"N477","to":"N477-r479-H12","label":"dose H=1.2 paired vs trochoid","metric":"fixture_B=1.00","p":"pending noisy-cell"}}
{"id": "N480", "metric": 0.0, "parent": "N477", "status": "discard", "strategy": "N477 window-dose H=1.2 at 0.48,96 paired decider; B=0.00, wall confirmed at 0.32,64", "timestamp": 1790917313.5074487, "type": "node"}
{"from": "N477", "kind": "tested", "to": "N480", "type": "edge"}
{"id": "N477-r481", "idea": "N477", "run": 481, "status": "discard", "metric": 0.0, "parent": "N477", "strategy": "window dose sweep 0.6/0.9/1.2 @ 0.40,80 physical paired decider; B=0.00 all arms, family kill-rule; 0.48,96 unrun predicted same; no replay of retired FACC/SE3", "evidence": "results/aegis_v2/n477_H*.jsonl", "timestamp": "2026-10-02T10:35Z", "type": "node"}
{"from": "N477", "to": "N477-r481", "label": "physical paired decider discard B=0.00 dose sweep", "run": 481, "type": "edge"}
{"type": "node", "id": "N482", "label": "FACC iter-43 refused (43rd G3 replay) + N477 complete (kill-rule 481)", "timestamp": "2026-10-02T11:00:00Z", "idea": "FACC-ITER43", "status": "discard", "detail": "G3 permanent retirement (43rd replay of eq78/N70-N76/manifold/flow-bridge/energy-gated/EBM/SE3/DAEF/FACC family refused before execution). G4 unpairable (0 injectable hook). G7 predicted-only 78 invalid. N477 completed: 476 KEEP (0.32,64 H=0.6), 477 sweep (7440 eps), 478 DISCARD (0.40,80 H=0.9), 479 KEEP (0.40,80 H=1.2 default noise), 480 DISCARD (0.48,96 H=1.2 wall), 481 DISCARD kill-rule (0.40,80 all doses B=0). Queue empty. Freeze trochoid champion B=1.00."}
{"type": "edge", "from": "FACC-ITER42", "to": "N482", "label": "replay-refused-43rd-G3", "timestamp": "2026-10-02T11:00:00Z", "note": "43rd replay of retired eq78/N70-N76 family; director proposal refused per AEGIS G3; no rig invocation; N477 complete"}
{"type": "edge", "from": "N477-r481", "to": "N482", "label": "n477-complete-kill-rule-triggered", "timestamp": "2026-10-02T11:00:00Z", "note": "N477 family kill-rule triggered run 481 (B=0.00 at 0.40,80 for doses 0.6/0.9/1.2); boundary at 0.32,64 extended; dose family collapses past certified boundary at high pose noise"}
{"type":"node","id":"N483","label":"SEAFC iter-2 refused (44th G3 replay)","timestamp":"2026-10-02T11:05:00Z","idea":"SEAFC-ITER2","status":"discard","detail":"G3 permanent retirement (44th replay of eq78/EBM/SE3-affordance/DAEF/FACC/energy-gated/manifold-switch family refused before execution). G4 unpairable (PATH_MODES 0 injectable SE3/energy/manifold hook). G7 predicted-only 78pts invalid; no synthetic promotion; synthetic champion N74 92.3 frozen. Queue empty post-N477 (kill-rule 481). Freeze trochoid B=1.00. No rig invocation, no paired statistics possible, no keep claim valid."}
{"type":"edge","from":"FACC-ITER43","to":"N483","label":"replay-refused-44th-G3-SEAFC","timestamp":"2026-10-02T11:05:00Z","note":"44th G3 replay (SEAFC = SE(3)-Equivariant Energy Affordance Field) refused per AEGIS v3 G3/G4/G7; director proposal refused before execution; no synthetic proxy promotion; segment 15 unchanged; metric frozen; N198 remains director-owned."}
{"type":"node","id":"N484","label":"FACC-E iter-3 refused (45th G3 replay)","timestamp":"2026-10-02T11:30:00Z","idea":"FACC-E-ITER3","status":"discard","detail":"G3 permanent retirement (45th replay of eq78/N70-N76/manifold-switch/flow-bridge/energy-gated/EBM/DAEF/FACC/SEAFC family refused before execution). G4 unpairable (0 injectable PATH_MODES hook). G7 predicted-only 76pts invalid; synthetic N74 frozen. Queue empty post-N477 (kill-rule 481). Freeze trochoid champion B=1.00; 0 episodes; 0 harness errors."}
{"type":"edge","from":"FACC-ITER43","to":"N484","label":"replay-refused-45th-G3-FACC-E","timestamp":"2026-10-02T11:30:00Z","note":"45th replay (FACC-E = Force-Adaptive Contact Control with Energy attention) refused per AEGIS G3/G4/G7; director proposal refused before execution; no synthetic proxy; segment 15 unchanged; metric frozen; N198 open_needs_director"}
{"id": "N485-refused", "metric": null, "parent": "N52", "status": "refused", "strategy": "FACC-E (46th G3 replay refused): SE(3)-Conditioned Force-Adaptive Contact Control with Energy Attention \u2014 retired family replay; mechanism class unchanged; refusal per G3 retirement (2026-09-26) + G4 unpairable + G2 empty-queue + G7 invalid predicted-only", "timestamp": "2026-10-02T12:00:00Z", "type": "node", "refusal_reasons": ["G3 retired-family replay", "G4 unpairable (no injectable hook)", "G2 queue empty", "G7 predicted-only invalid"]}
{"from": "N52", "to": "N485-refused", "kind": "derived-refused", "note": "FACC-E derived from N52 optimization-based frontier (same family lineage as N45-N50 flow-warp; but family permanently retired); refusal keeps frozen champion trochoid (B=1.00) unconditionally", "timestamp": "2026-10-02T12:00:00Z", "type": "edge"}
{"type":"node","id":"FACC-DM-ITER5-R485","run":485,"metric":0.0,"status":"discard","label":"FACC-DM iter-5 (muse-spark-1.3 director proposal, 43rd G3 replay refused)","strategy":"Director proposal FACC-DM: SE(3)-conditioned flow over learned deformable affordance manifold + energy-based physical in-context attention + flow-matching->affordance-equivalence bridge. Refused: same mechanism class as retired eq78/N70-N76/manifold/flow-bridge/energy-gated/EBM/SE3/DAEF/FACC family.","timestamp":"2026-10-02T11:50:00Z","evidence_file":"results/aegis_v2/N485_r485_health_n0_0.jsonl","health_check_only":true,"episodes":60,"fixture_A_success":1.0,"fixture_B_success":1.0,"fixture_R_success":1.0,"replay_family":"G3-retired","pairable_arm_present":false,"new_mechanism_injected":false,"rig_bytes_changed":0,"kill_rule_triggered_for_family":true,"family_wall_confirmed":"0.32,64 (N477 run 481)"}
{"type":"edge","from":"FACC-ITER43","to":"FACC-DM-ITER5-R485","label":"replay-refused-43rd-FACC-DM-dir-iter5","run":485,"timestamp":"2026-10-02T11:50:00Z","note":"Director iter-5 proposal refused per G3 retirement (2026-09-26) + G4 unpairable (PATH_MODES 0 injectable SE3/manifold/energy hook) + G2 empty queue (N477 family kill 481, wall 0.32,64) + G7 predicted-only 76 invalid. Health-check only (trochoid 60 eps 1.00/1.00/1.00); no paired arm; no synthetic promotion; segment 15 unchanged; metric frozen; champion trochoid B=1.00 preserved; no new equation row (rejected mechanism)."}
{"type": "node", "id": "N486-refused-FACC-SE3-ITER6", "label": "FACC-SE3 iter-6 refused (46th G3 replay, muse-spark-1.3 fallback)", "timestamp": "2026-10-02T12:10:00Z", "idea": "FACC-SE3-CONDITIONED-ITER6", "status": "discard", "run": 486, "metric": null, "parent": "FACC-ITER43", "replay_family": "G3-retired (eq78/N70-N76/manifold/flow-bridge/energy-gated/EBM/SE3/DAEF/FACC)", "replay_count": 46, "queue_empty_post_n477": true, "kill_rule_n477_triggered": true, "evidence_file": "autoresearch_research.jsonl:run=486", "note": "G3 retirement (2026-09-26 segment 15 root-cause: energy-modulation collapses under real contact dynamics, high variance 0.9459 vs 0.2432; N477 family kill-rule 481) + G4 unpairable (PATH_MODES 0 injectable hook) + G7 predicted-only 76 invalid + G2 empty queue (N477 complete) = refusal before execution. Champion trochoid B=1.00 frozen. Segment 15 unchanged. Metric frozen. Equations.md unchanged. No synthetic_proxy promotion. N198 open_needs_director unchanged."}
{"type": "edge", "from": "FACC-ITER43", "to": "N486-refused-FACC-SE3-ITER6", "label": "replay-refused-46th-G3-FACC-SE3-ITER6", "timestamp": "2026-10-02T12:10:00Z", "run": 486, "note": "Director proposal iter-6 refused as 46th replay of permanently retired eq78 family; same mechanism class (SE3-equivariant energy attention + flow-bridge + dynamic affordance); label change does not change mechanism class; no physical paired measurement; health-check not required; champion frozen"}
{"id":"N487","metric":null,"parent":"N477","status":"discarded","strategy":"Director iter-7 refusal (muse-spark-1.3 fallback): FACC-SE3 replay #47 refused — G3 retired family (eq78/EBM/SE3/flow-bridge/manifold) + G4 unpairable + G7 predicted-only 76pts invalid + G2 queue empty (N477 complete, kill-rule 481). No mechanism built; champion trochoid B=1.00 frozen; segment 15 unchanged.","timestamp":"2026-10-02T12:30:00Z","type":"node","frontier":"NONE (refusal — family permanently retired)","variation":"NONE (G3 replay — same mechanism class)","evidence_artifacts":["autoresearch_research.jsonl:run=487","autoresearch_research.ideas.md","results/aegis_v2/N476/N477","equations.md (unchanged)"]}
{"from":"N477","kind":"derived","to":"N487","type":"edge","note":"G3 refusal edge: director iter-7 FACC-SE3 replay refused (47th replay of retired family); no paired arm (G4); queue empty (G2); no new mechanism; freeze trochoid champion"}
{"type":"node","id":"FACC-ITER8-N488","label":"FACC iter-8 refused (48th G3 replay, director muse-spark proposal): SE(3)-equivariant force-adaptive residual + energy-attention + flow-bridge to affordance-equivalence; label rotation does not change mechanism class","timestamp":"2026-10-02T12:30:00Z","idea":"FACC-SE3-CONDITIONED-ITER8","status":"discard","run":488,"metric":null,"parent":"FACC-ITER43","replay_family":"G3-retired (eq78/N70-N76/manifold/flow-bridge/energy-gated/EBM/SE3/DAEF/FACC)","replay_count":48,"queue_empty_post_n477":true,"kill_rule_n477_triggered":true,"evidence_file":"autoresearch_research.jsonl:run=488","note":"G3 retirement (2026-09-26 segment 15 root-cause: energy-modulation collapses under real contact dynamics, high variance 0.9459 seed1 vs 0.2432 seed2; fixed-manifold assumption-violation confirmed) + G4 unpairable (PATH_MODES 0 injectable SE3/energy/manifold hook; only RESIDUAL_HOOK_FN I3-owned) + G2 empty queue (N477 complete, kill-rule 481 at 0.40,80 H=1.2; no queued mechanism in ideas.md §1) + G7 predicted-only 78pts invalid (no physical paired compare.keep:true; synthetic N74 frozen; synthetic_proxy excluded G2) = refusal before execution (0 episodes). Champion trochoid B=1.00 frozen (run 72). Segment 15 unchanged. Metric frozen. Equations.md unchanged (no mechanism built = no equation). No synthetic_proxy promotion. N198 open_needs_director unchanged. Next: director proposes non-retired mechanism with injectable rig hook, confirms segment 15 closure, or requests segment 16 approval (segment freeze G6)."}
{"from":"FACC-ITER43","kind":"derived","to":"FACC-ITER8-N488","type":"edge","note":"G3 refusal edge #48: director iter-8 FACC-SE3 proposal refused (same mechanism class as eq78/EBM/manifold/flow-bridge/energy-gated family); label rotation (FACC-SE3 / dynamic-manifold / SE3-equivariant / energy-attention) does not change mechanism class; 0 paired arm (G4); queue empty (G2); no synthetic promotion; champion trochoid frozen; segment 15 unchanged; equations.md unchanged; worklog/appended; commit executed.","run":488,"timestamp":"2026-10-02T12:30:00Z"}
{"id": "N489", "run": 489, "timestamp_utc": "2026-10-02T00:00:00Z", "segment": 15, "status": "discard-refused", "verdict": "REFUSED before execution (replay #46+ of G3-retired eq78/N70-N76/manifold/flow-bridge/energy-gated/EBM/SE3/DAEF/FACC family; G4 unpairable PATH_MODES 0 injectable hook; G7 predicted-only 78pts invalid; G2 queue EMPTY since 309; metric frozen fixture_B transfer_success)", "parent_chain": "N52 -> N74 (retired synthetic champion 92.3) via replay family", "derived_from_refused_family": ["N75", "N76", "N77", "N79", "N83", "ITER24-48", "FACC-SE3-ITER-SERIES-443-488"], "metric_claim": 0, "physical_ep_for_idea": 0, "health_check_ep": 120, "champion_frozen_reference": "trochoid (fixture_B 1.00, Fisher p=0.0083 vs raster, run 72 / health-check 489)", "frontier_text": "G3-retired mechanism family replay; no injectable hook; no new mechanism class; label rotation does NOT change class", "evidence_ref": "results/aegis_v2/iter9_facc_refused_health.jsonl", "equation_ref": "equations.md row 78 (family); no new row; md5 unchanged", "strategy_ref": "autoresearch_research.md segment 15 (queue empty; N477 complete; N198 director-only); strategies.md N489 refused", "type": "node"}
{"from": "N484-refused-FACC-ITER3", "kind": "refused-replay", "to": "N489", "note": "46th replay of retired G3 family (label rotation FACC-SE3 does NOT change mechanism class); refusal before execution; health-check only confirms frozen champion", "type": "edge"}
{"id":"N490","metric":null,"parent":"N489","status":"discarded-refused","strategy":"FACC-E iter-10 (muse-spark-1.3): 49th replay of retired G3 family (eq78/N70-N76/manifold/flow-bridge/energy-gated/EBM/SE3/DAEF/FACC/E-FACC); refused before execution per G3 retirement (2026-09-26) + G4 unpairability + G7 predicted-only + G2 empty queue (N477 kill 481); no mechanism built; champion trochoid frozen B=1.00","timestamp":1759430700,"type":"node"}
{"from":"N489","kind":"replay-refused","to":"N490","type":"edge"}
{"type":"node","id":"N491","label":"FACC-SE3 iter-11 refused (50th G3 replay, muse-spark-1.3 director proposal)","timestamp":"2026-10-02T13:00:00Z","idea":"FACC-SE3-ITER11","status":"discard","run":491,"note":"REFUSED before execution per G3 retirement (2026-09-26) + G4 unpairable + G2 empty queue + G7 predicted-only 78pts invalid. Mechanism class unchanged by label rotation (SE3/deformable/dynamic-manifold/energy-attention/flow-bridge). 0 episodes, 0 rig bytes changed. Freeze champion trochoid B=1.00. Queue empty since N477 kill-rule 481 (boundary 0.32m/64deg). N198 open_needs_director unchanged. Segment 15 unchanged; metric frozen; equations.md unchanged (md5 cc9c73fd74f4bf1799f787226cce7a00). No synthetic_proxy promotion. Replay count 50 (family: eq78/N70-N76/manifold/flow-bridge/energy-gated/EBM/SE3/DAEF/FACC/SEAFC/VM-FACC). Evidence: autoresearch_research.jsonl run=491; worklog; results/aegis_v2/N476/N477; equations.md unchanged."}
{"from":"FACC-ITER8-N488","to":"N491","kind":"replay-refused","label":"replay-refused-50th-G3-FACC-SE3-ITER11","timestamp":"2026-10-02T13:00:00Z","note":"50th replay of permanently retired eq78/N70-N76/manifold/flow-bridge/energy-gated/EBM/SE3/DAEF/FACC family refused before execution. Same mechanism class by construction (label rotation FACC-SE3 / SE3-conditioned / dynamic-manifold / deformable-affordance / energy-attention / flow-bridge does NOT change mechanism class per G3 retirement). G4 unpairable (PATH_MODES 0 injectable SE3/manifold hook). G2 queue empty (N477 complete 476-481, kill-rule 481). G7 predicted-only 78pts invalid (no paired Fixture-B compare.keep:true artifact). Health-check not required: champion trochoid frozen B=1.00 at 0,0 (run 72, certified 0.32,64). Evidence artifacts complete (JSONL + graph + worklog + equations.md unchanged). No deferred-language phrases used."}
{"id":"N492","metric":null,"parent":"N491","status":"discard","strategy":"refusal: 51st replay of G3-retired eq78/EBM/energy-attention/SE3/manifold/flow-bridge family (FACC-SE3 director iter 12); mechanism class unchanged by label rotation; no injectable PATH_MODES hook; no paired arm possible; no equation change","timestamp":1759363200,"type":"node"}
