{"id": "N255-N99", "type": "node", "parent": "N255-next", "run": 289, "idea": "N99", "metric": 1.0, "status": "discarded", "strategy": "N99 EIGA-FACC adjudicated-not-executed (47th G3-retired re-derivation; energy-gated/info-attention FACC-switcher keeps energy-gated/manifold/flow-bridge class; FACC closed r232/r233); frozen-champion confirmation B 1.00 Welch p=5.26e-06 keep=true; 120/120 identical r288", "timestamp": 1790743850}
{"type": "edge", "from": "N255-N99", "to": "N256-next", "kind": "derived", "run": 289, "idea": "N99", "label": "next frontier: Tier-2 registration beyond 0.01,2 (I9); force-compliance floor (I11); path family closed"}
{"id": "N256-next", "type": "node", "parent": "N255-N99", "run": 289, "idea": "N100", "metric": 1.0, "status": "frontier", "strategy": "next slot after N99", "timestamp": 1790743851}
{"id": "N256-N100", "type": "node", "parent": "N256-next", "run": 290, "idea": "N100", "metric": 1.0, "status": "discarded", "strategy": "N100 FACC-DAM adjudicated-not-executed (48th G3-retired re-derivation; force-adaptive deformable affordance manifold = energy-gated/manifold/flow-bridge class; FACC closed r232/r233); frozen-champion confirmation B 1.00 Welch p=5.26e-06 keep=true; 120/120 identical r289", "timestamp": 1790744003}
{"type": "edge", "from": "N256-N100", "to": "N257-next", "kind": "derived", "run": 290, "idea": "N100", "label": "next frontier: Tier-2 registration beyond 0.01,2 (I9); force-compliance floor (I11); path family closed"}
{"id": "N257-next", "type": "node", "parent": "N256-N100", "run": 290, "idea": "N101", "metric": 1.0, "status": "frontier", "strategy": "next slot after N100", "timestamp": 1790744004}
{"id": "N257-N101", "type": "node", "parent": "N257-next", "run": 291, "idea": "N101", "metric": 1.0, "status": "discarded", "strategy": "N101 FACC-EAM adjudicated-not-executed (49th G3-retired re-derivation; SE(3)-warp outside Pi0 = energy-gated/manifold/flow-bridge class; FACC closed r232/r233); frozen-champion confirmation B 1.00 Welch p=5.26e-06 keep=true; 120/120 identical r290", "timestamp": 1790744187}
{"type": "edge", "from": "N257-N101", "to": "N258-next", "kind": "derived", "run": 291, "idea": "N101", "label": "next frontier: Tier-2 registration beyond 0.01,2 (I9); force-compliance floor (I11); path family closed"}
{"id": "N258-next", "type": "node", "parent": "N257-N101", "run": 291, "idea": "N102", "metric": 1.0, "status": "frontier", "strategy": "next slot after N101", "timestamp": 1790744187}
{"id": "N258-N102", "type": "node", "parent": "N258-next", "run": 292, "idea": "N102", "metric": 1.0, "status": "discarded", "strategy": "N102 FACC-Live adjudicated-not-executed (50th G3-retired re-derivation; SE(3) force-error contact-energy attention live-remap = energy-gated/manifold/flow-bridge class; FACC closed r232/r233); frozen-champion confirmation B 1.00 Welch p=5.26e-06 keep=true; 120/120 identical r291", "timestamp": 1790744287}
{"type": "edge", "from": "N258-N102", "to": "N259-next", "kind": "derived", "run": 292, "idea": "N102", "label": "next frontier: Tier-2 registration beyond 0.01,2 (I9); force-compliance floor (I11); path family closed"}
{"id": "N259-next", "type": "node", "parent": "N258-N102", "run": 292, "idea": "N103", "metric": 1.0, "status": "frontier", "strategy": "next slot after N102", "timestamp": 1790744287}
{"id": "N259-N103", "type": "node", "parent": "N259-next", "run": 293, "idea": "N103", "metric": 1.0, "status": "discarded", "strategy": "N103 FACC-EDM adjudicated-not-executed (51st G3-retired re-derivation; SE(3) energy-deformed manifold grad-warp = energy-gated/manifold/flow-bridge class; FACC closed r232/r233); frozen-champion confirmation B 1.00 Welch p=5.26e-06 keep=true; 120/120 identical r292", "timestamp": 1790744440}
{"type": "edge", "from": "N259-N103", "to": "N260-next", "kind": "derived", "run": 293, "idea": "N103", "label": "next frontier: Tier-2 registration beyond 0.01,2 (I9); force-compliance floor (I11); path family closed"}
{"id": "N260-next", "type": "node", "parent": "N259-N103", "run": 293, "idea": "N104", "metric": 1.0, "status": "frontier", "strategy": "next slot after N103", "timestamp": 1790744440}
{"id": "N260-N104", "type": "node", "parent": "N260-next", "run": 294, "idea": "N104", "metric": 1.0, "status": "discarded", "strategy": "N104 AEIA adjudicated-not-executed (52nd G3-retired re-derivation; info-attention on SE(3) equivalence slice = energy-gated/manifold/flow-bridge class; FACC closed r232/r233); frozen-champion confirmation B 1.00 Welch p=5.26e-06 keep=true; 120/120 identical r293", "timestamp": 1790744618}
{"type": "edge", "from": "N260-N104", "to": "N261-next", "kind": "derived", "run": 294, "idea": "N104", "label": "next frontier: Tier-2 registration beyond 0.01,2 (I9); force-compliance floor (I11); path family closed"}
{"id": "N261-next", "type": "node", "parent": "N260-N104", "run": 294, "idea": "N105", "metric": 1.0, "status": "frontier", "strategy": "next slot after N104", "timestamp": 1790744618}
{"id": "N261-N105", "type": "node", "parent": "N261-next", "run": 295, "idea": "N105", "metric": 1.0, "status": "discarded", "strategy": "N105 DAFM adjudicated-not-executed (53rd G3-retired re-derivation; SE(3) contact-history flow deforming manifold pre-Pi0 = energy-gated/manifold/flow-bridge class; FACC closed r232/r233); frozen-champion confirmation B 1.00 Welch p=5.26e-06 keep=true; 120/120 identical r294", "timestamp": 1790744805}
{"type": "edge", "from": "N261-N105", "to": "N262-next", "kind": "derived", "run": 295, "idea": "N105", "label": "next frontier: Tier-2 registration beyond 0.01,2 (I9); force-compliance floor (I11); path family closed"}
{"id": "N262-next", "type": "node", "parent": "N261-N105", "run": 295, "idea": "N106", "metric": 1.0, "status": "frontier", "strategy": "next slot after N105", "timestamp": 1790744805}
{"id": "N262-N106", "type": "node", "parent": "N262-next", "run": 296, "idea": "N106", "metric": 1.0, "status": "discarded", "strategy": "N106 FACS adjudicated-not-executed (54th G3-retired re-derivation; discrete contact-mode switch + energy info-gain gate = manifold-switch/energy-gated class; FACC closed r232/r233); frozen-champion confirmation B 1.00 Welch p=5.26e-06 keep=true; 120/120 physics-identical r295", "timestamp": 1790745000}
{"type": "edge", "from": "N262-N106", "to": "N263-next", "kind": "derived", "run": 296, "idea": "N106", "label": "next frontier: Tier-2 registration beyond 0.01,2 (I9); force-compliance floor (I11); path family closed"}
{"id": "N263-next", "type": "node", "parent": "N262-N106", "run": 296, "idea": "N107", "metric": 1.0, "status": "frontier", "strategy": "next slot after N106", "timestamp": 1790745001}
{"id": "I20", "metric": 1.0, "parent": "N19", "status": "discarded", "strategy": "I20 (queued, run 297): proportional force-cap gate AEGIS_GATE_PROP=1/TRIG=1/THETA=0.15 \u2014 same scrub-phase+contact trigger as I19 (pre-falsified); continuous press_scale clip(1-max(0,j-0.7theta)/(0.3theta),0.3,1.0); paired trochoid 20 seeds; B success 1.00 vs 1.00 delta 0; no new trigger; discard; same 3-step GD calibration unchanged; frozen champion preserved", "timestamp": 1789815200, "type": "node"}
{"from": "N19", "kind": "derived", "to": "I20", "type": "edge", "note": "I20 proportional gate derived from I19 advisory gate (same trigger family, continuous response instead of slowdown); DISCARDED: no new trigger activates; pre-falsified by I19.2"}
{"id":"I20","metric":1.0,"parent":"I19","status":"discarded","strategy":"I20 proportional force-cap gate (new scrub-contact trigger GATE_TRIG=1): continuous press_scale = max(0.3, 1-(j-0.7θ)/(0.3θ)) applied to scrub-phase press; 20 seeds x 3 suites paired vs trochoid champion; prop_trig_scrub=0, prop_trig_contact=0 over 120 ep; trigger flat at floor; no improvement (B=1.00 vs 1.00, delta=0, Fisher p=1.0, Welch NaN); confirms I19.5 class-level finding: the scrub-phase jerk trigger carries no signal and any one-tick response collapses to its floor; gate-rethink family (I19, I20) closed","timestamp":1789816000,"type":"node","segment":15,"idea_id":"I20","evidence":"results/aegis_v2/I20_prop_gate.jsonl"}
{"from":"I19","kind":"derived","to":"I20","type":"edge","segment":15,"description":"I20 derived from I19 advisory-gate rethink: tests the only admissible remaining trigger (scrub-phase + in-contact) with a continuous response; result confirms no activation and no gain; family closed"}
{"id": "I12", "metric": 0.9999, "parent": "I9", "status": "kept", "strategy": "I12 200-seed robustness matrix of the final stack: trochoid + AEGIS_ROW_CENTRE=1 with the I9 32x32 depth-registration stage paired ON vs OFF on identical seeds; 4 pose-noise levels (0,0 / 0.01,2 / 0.02,4 / 0.03,6) x 3 suites x 200 seeds x 2 arms = 4800 physical episodes, 0 harness errors. AEGIS_REG promoted to a --compare-env knob (KNOB_STR_GLOBALS) so the registration axis is pairable in one process; default off verified bit-identical.", "timestamp": 1789820000, "type": "node", "segment": 15, "idea_id": "I12", "findings": "B success 0.600 -> 1.000 and covc 0.8867 -> 0.9999 at 0.03,6 (Welch p 2.43e-26, Fisher p 7.79e-29, rig keep=true); held-out R 0.560 -> 0.995 (Fisher p 1.51e-30). Rig keep=true at 0.01,2 and 0.02,4 too; false at 0,0 (nothing to fix). I5's '<0.005 m / 1 deg' Tier-2 floor is REFUTED. reg_err_xy is FLAT in sigma (median 3.5-4.2 mm, p90 13.3-14.6 mm, reg_ok 600/600) so the estimator's own resolution, not the pose noise, is the new floor. Isometric: path_len and force_compliance bit-identical between arms.", "evidence": "results/aegis_v2/I12_r299_n0.03_6.jsonl + I12_r299_n0_0/0.01_2/0.02_4 + I12_r299_table.json"}
{"from": "I9", "kind": "validated", "to": "I12", "type": "edge", "segment": 15, "description": "I12 executes the queued I12 matrix and is the first 200-seed physical validation of I9; it promotes the registration axis to a paired knob and overturns the I5 pose-noise requirement that closed the registration frontier at 0.01,2"}
{"id": "N190", "metric": 0.9999, "parent": "I12", "status": "queued", "strategy": "N190 registration-estimator dose: reg_err_xy p90 is flat at ~14 mm across a 6x sigma sweep, so the residual failure at 0.03,6 on fixture_A (198/200, covc 0.9889) is the ESTIMATOR's resolution, not the noise. Dose the 32x32 ray grid (AEGIS_REG_GRID 32 -> 64/96) and the yaw estimator (round fixture: PCA on a near-circular top face) to push p90 below 5 mm, then re-run the 0.03,6 and an extended 0.05,10 cell. Keep bar: B and R success >= 0.995 with coverage Welch p < 0.01 vs the 32x32 arm at 200 seeds.", "timestamp": 1789820001, "type": "node", "segment": 15, "idea_id": "N190", "evidence": "derived from results/aegis_v2/I12_r299_n0.03_6.jsonl (reg_err_xy_p90_mm 14.45, fixture_A 198/200)"}
{"from": "I12", "kind": "opened", "to": "N190", "type": "edge", "segment": 15, "description": "N190 opens from the I12 finding that the registration error is noise-independent: dose grid resolution / yaw estimation instead of asking the planner for more accuracy"}
{"id": "N107", "type": "node", "segment": 15, "parent": "N106", "status": "discard", "metric": 1.0, "timestamp": 1790751807, "strategy": "N107 FACC-E (director iter-45): scalar E(s,a,F_SE3), action a = -grad_a E, affordance manifold warped live by the contact force field, no discrete gate and no theta (explicitly to kill the run-297/298 I20 failure), bridge flow-matching -> affordance-equivalence via energy as a shared object. ADJUDICATED NOT EXECUTED: G3-retired family (manifold-switch / flow-bridge / energy-gated, 55th re-derivation; FACC closed r232/r233), G4-unpairable (no pi0 expert, no SE(3) energy-attention keypoint, no wrench-conditioned action head on the scrub rig; edits would be fabrication under G7), banned learned/soft-gate keep class. Math 6/6 checks fail; novelty = re-derivation. Frozen-champion confirmation physical and clean.", "evidence": "equations.md ROW N107; results/aegis_v2/R300_frozen_n00.jsonl (20 seeds x A/B/R x 2 arms, 0 harness errors, B 0.9453->1.0000 Welch p 5.26e-06, keep=true, both arms bit-identical to run 296)"}
{"from": "N106", "to": "N107", "type": "edge", "segment": 15, "kind": "retired", "description": "N107 continues the 55th re-derivation of the G3-retired manifold-switch / flow-bridge / energy-gated family; dropping the PROP/TRIG gate is architectural deletion, not a new mechanism, so the family stays closed at N107"}
{"from": "N107", "to": "N264-next", "type": "edge", "segment": 15, "kind": "next", "description": "N107 closes with two independent negative verdicts (math: div(-grad_a E) = -trace(Q) < 0 violates the flow-matching continuity equation, so the claimed bridge is broken at step 1; novelty: EnergyFlow 2605.00623, EDF 2206.08321, HI-FM 2410.11433, 2304.14391 and internal N49-N76 already contain every component). The live frontier is N190 registration-estimator dose"}
{"id": "N190", "type": "node", "segment": 15, "parent": "I12", "status": "keep", "metric": 0.9122, "timestamp": 1790752880, "strategy": "Registration-WINDOW truncation dose: the pose-noise floor is the ray grid's +-0.35 m half-extent clipping the top face, not its resolution. I12's O(1/n) prediction is refuted by measurement (fixture_B reg_err p90 14.62/18.40/15.78/14.97 mm at n=32/64/128/181). Fix = AEGIS_REG_HALF_M 0.35->0.6 (AEGIS_REG_EST extent is a registered but MEASURED-INERT second half). 100-seed paired vs the frozen I9 estimator: B transfer_success 37->82 of 100 at 0.28 m / 56 deg (Welch p 5.26e-12 covc, Fisher p 9.81e-11 succ, rig keep=true); held-out fixture_R 0.4801->0.7971; zero regression at 0,0 and 0.03,6."}
{"from": "I12", "to": "N190", "type": "edge", "segment": 15, "kind": "opened", "description": "I12 opened N190 on the observation that reg_err p90 ~14 mm is flat in sigma, and named the 32x32 grid resolution as the cause. N190 keeps the question and REFUTES the cause: the window half-extent, not the ray count, sets the floor, and I12's four swept sigma levels had all sat inside the unbiased regime."}
{"from": "N190", "to": "N191", "type": "edge", "segment": 15, "kind": "next", "description": "With the window >=9x wider the binding floor moves again. (a) yaw is still the frozen PCA with the prior resolving its pi-ambiguity, and a 56 deg prior error may already sit outside that branch - the yaw estimator is the next dose. (b) reg_ok falls to 292/300 at 0.28 m because truncation starves the fixed 30-point degeneracy test; it should be scale-free."}
{"id": "N191", "type": "node", "segment": 15, "parent": "N190", "status": "discard", "metric": 0.9153, "timestamp": 1790758800, "strategy": "Registration-estimator dose on the N190 window fix, run 302. Built the exact-under-truncation OPPOSITE-INTERIOR-SUPPORT midpoint (the ray window is axis-aligned and known, so a hit on its boundary bounds the WINDOW, not the face, and the extremes are true support points of the top face); it is unbiased and it LOSES (B 0.82 vs frozen-mean 0.84, Welch p 0.928, Fisher p 0.851, rig keep=false at 0.28 m/56 deg; strictly worse at 0.03 m/6 deg, Welch p 8.28e-05) because the mean of a symmetric grid is already unbiased when the window CONTAINS the face while 2 extremal samples each carry a full 38.7 mm ray pitch. Branch DELETED, not shipped. Both N191 hypotheses refuted: PCA yaw degeneracy fires 0/40 at every sigma (plan yaw error median 0.95 / p90 5.76 deg vs a 46.15 deg prior) and the fixed 30-point test fails 0/40,0/40,0/40,0/40,1/40. Real defect found: reg_err_yaw_deg has logged |correction - original error| since I9, i.e. the amount of yaw error REMOVED; added reg_yaw_plan_deg = |yaw_est - true_yaw| (B median 1.14 deg where the old field read 40.09)."}
{"from": "N190", "to": "N191", "type": "edge", "segment": 15, "kind": "opened", "description": "N190 opened N191 on two suspicions it could not test itself: (a) the yaw estimator's pi-branch 'may already sit outside' a 56 deg prior, (b) reg_ok 292/300 at 0.28 m because truncation starves the fixed 30-point test. N191 tests both and refutes both, and in testing (a) finds that the logged yaw metric was sign-inverted, which is why (a) looked plausible: run 301's medians 23.75/29.45/50.55 deg at 0.16/0.20/0.24 m were the error REMOVED, not the error remaining (true residual 1.14 deg median at 0.28 m)."}
{"from": "N191", "to": "N192", "type": "edge", "segment": 15, "kind": "next", "description": "The floor is now fully attributed and no estimator can move it: it is the ray window's CONTAINMENT threshold (H > rho + 3 sigma, equations N190.3), not the centroid rule (N190.6 extent inert, N191.2 support loses), not the ray count (N190.5 flat), not the yaw estimator (N191.1) and not the degeneracy test (N191.3). Once the window truncates, the missing crescent is a geometric loss of information that no centroid rule over P can recover. N192 must therefore change the SENSOR, not the estimator: a second off-centre / wider cast whose window is guaranteed to contain the footprint, or a fixture-footprint prior the camera brackets. Note the shipped H=0.6 window is a PLATEAU (H=0.9 is worse, N190.6), so 'just widen it' is already closed."}
{"from": "N191", "to": "N192", "type": "edge", "segment": 15, "kind": "opened", "description": "N191 refuted every estimator variable (PCA-yaw pi-branch, the fixed 30-point test, the exact support midpoint) and attributed the pose-noise floor to the ray window's CONTAINMENT of the top face. N192 changes the SENSOR as the edge prescribed: a k x k lattice of +-H windows whose union contains the plausible-centre set, keeping the one cast that best contains the face."}
{"id": "N192", "type": "node", "segment": 15, "parent": "N191", "status": "keep", "metric": 1.0, "timestamp": 1790802000, "strategy": "Cast-lattice sensor, run 303, KEEP. A k x k lattice of the SAME +-0.6 m window at pitch d = 1.5a (a = H - hypot(0.34,0.14) = 0.2323 m, the inf-norm containment slack), union covering 3 sigma; the containing cast is picked by its TOP-POINT COUNT (123 = the full-face grid count; ties to the prior-nearest cast, so k=1 is the frozen path bit-identically). A containing cast is UNTRUNCATED, so the frozen mean and the frozen PCA yaw are reused verbatim and the N190.3 bias term is identically zero. 100 seeds x {A,B,R} x 2 arms on the same seeds: fixture_B transfer_success 84->100 at 0.28 m/56 deg (covc 0.9153->0.9984, Welch p 2.51e-04, Fisher p 1.59e-05, rig keep=true), 91->100 at 0.24/48, 72->100 at 0.32/64 (Welch 6.36e-06); R 0.7893->0.8473; A 0.6521->0.7225; no coverage delta negative anywhere; the 0.03/6 and 0.20/40 levels are bit-identical (dose inert below the slack). What died is the TAIL: reg_err_xy p90 89.72->19.20 mm, max 241.82->23.32 mm, and the median is now flat in sigma (7.1-8.6 mm) = the signature of a contained estimator. All 13 frozen-arm B failures had reg_err_xy > 25 mm; all are removed. 0 harness errors in 3000 episodes; k=1 and default-OFF regressions 0 field diffs."}
{"from": "N191", "to": "N192", "type": "edge", "segment": 15, "kind": "answered", "description": "N192 answers the N191->N192 prescription exactly: the sensor changed, the estimator did not. It also corrects N190.3's own summary: the single-window budget is a = H - rho_inf = 0.2323 m (1.16 sigma at 0.2 m, 0.83 sigma at 0.28 m), NOT the 3-sigma rule H > rho + 3 sigma, which only holds for sigma < 0.078 - and the measured B curve (0.62 at 0.16, 0.84 at 0.28) is what that predicts."}
{"from": "N192", "to": "N193", "type": "edge", "segment": 15, "kind": "next", "description": "The registration floor is now closed: B is 100/100 at 0.32 m/64 deg with reg_err_xy flat in sigma at ~7 mm, i.e. ray-grid + z-band structure, not truncation. Two residual terms, and they are different problems. (a) fixture_A (round) is NOT rescued: 0.21 at 0.28 m with the BEST registration measured (median 2.09 mm, p90 4.30 mm, 0 of 79 failures above 25 mm); A's failure is monotone in the YAW term alone (98/29/25/21/15 successes at 6/40/48/56/64 deg) while yaw is genuinely unobservable on a rotationally symmetric face, so the residual sits in a PLAN-FRAME term. N193 must decide, with a discriminating rig run, whether that is a physical failure or a fixture-frame convention in the plan/coverage pairing - and if physical, what plan makes coverage yaw-invariant on a symmetric face. (b) the sigma <= a activation shortcut is a design claim, not a guarantee (unbounded Gaussian tail; 2 seeds at 170 mm at sigma 0.20), so the lattice should activate on k*sigma with a shorter covering radius d at fixed ray budget."}
