{"id": "N394", "type": "node", "run": 394, "timestamp": "2026-10-01T06:37:48Z", "idea": "LOOP-BOUNDARY-394", "status": "discard", "segment": 15, "frontier": "loop-boundary", "open_edge": "N198", "physical": true, "rig_invoked": false, "queue_empty": true, "lowest_queued": null, "note": "\u00a70/\u00a71 lowest queued=null; no queued -> skip; no rig; champion trochoid frozen; N198 director-only preserved"}
{"id": "E394", "type": "edge", "from": "N394", "to": "N198", "run": 394, "timestamp": "2026-10-01T06:37:48Z", "relation": "loop-halt-no-queued", "reason": "\u00a71 table has no queued row; all v3/v4 closed; N198 requires director; no keep/discard/crash possible", "note": "No replay of done ideas I20/I4/I6/I3/I1b/I1c/I18/I19/I21/I22"}
{"id": "N395", "type": "node", "run": 395, "timestamp": "2026-10-01T06:40:29Z", "idea": "FACC-SE3", "status": "discard", "segment": 16, "frontier": "control-policy-gen-se3", "open_edge": "N84", "physical": false, "rig_invoked": true, "synthetic_proxy": true, "note": "Director iter 21 FACC executed; result metric_class=synthetic_proxy B=0.2500; <<0.70; no paired compare; discard; segment 16 open; champion trochoid frozen"}
{"id": "E395", "type": "edge", "from": "N395", "to": "N84", "run": 395, "timestamp": "2026-10-01T06:40:29Z", "relation": "facc-evaluated-synthetic-proxy", "reason": "FACC-SE3 20-seed synthetic_proxy result; not physical proof; discard; needs canonical rig injection", "note": "No replay of eq78/N77/N76b; no synthetic claim as keep per G7"}
{"id": "N396", "type": "node", "run": 396, "timestamp": "2026-10-01T06:43:17Z", "idea": "396-FACC", "status": "discard", "segment": 15, "frontier": "FACC-SE3-energy-attention", "open_edge": "N84", "physical": true, "rig_invoked": true, "synthetic_proxy": false, "note": "Physical canonical rig (kaggle_aegis_sweep.py) 20 seeds fitted vs trochoid fixture B ts=1.0 delta=0 Fisher p=1.0; FACC SE(3)/energy head not injected; discard per G4 no gain; compare record in run396_facc.jsonl"}
{"id": "E396", "type": "edge", "from": "N396", "to": "N84", "run": 396, "timestamp": "2026-10-01T06:43:17Z", "relation": "facc-physical-decider-no-gain", "reason": "Physical paired compare vs trochoid: fixture B mean=1.0 both arms delta=0 Fisher p=1.0; no mechanism gain; FACC head injection still missing; next ablate energy vs SE(3) per director if ever kept", "note": "Keep requires p<0.01 gain; none; synthetic_proxy excluded; G7 integrity satisfied; no replay of retired N70-N76"}
{"id": "N397", "type": "node", "run": 397, "timestamp": "2026-10-01T12:00:00Z", "idea": "FACC-EA", "status": "discard", "segment": 15, "frontier": "FACC-EA energy-based affordance attention (EBM scoring)", "physical": false, "rig_invoked": false, "synthetic_proxy": false, "note": "G3 retirement: eq78/energy-gated family permanently retired; FACC-SE3 already 20/20 collapsed (A_sel=1.0, B=0.1905); kill-rule triggered (EBM single-mode + delta <+5); replay blocked; no banned phrases used; canonical rig NOT invoked (retirement justifies skip)"}
{"id": "E397", "type": "edge", "from": "N397", "to": "N396", "run": 397, "timestamp": "2026-10-01T12:00:00Z", "relation": "retired-family-replay-blocked", "reason": "FACC-EA proposes SE(3)-conditioned EBM scoring = eq78 family replay; FACC-SE3 (run396/N396) already discarded with collapsed attention; G3 prohibits extension; kill rule satisfied without rerun", "note": "No remote-GPU-deferred / same-dependency / deferred phrases; no synthetic claim as keep; evidence artifacts cited (FACC-SE3 strategy line 115)"}
{"id": "N398", "type": "node", "run": 398, "timestamp": "2026-10-01T12:16:00Z", "idea": "FACC-SE3", "status": "discard", "segment": 15, "frontier": "Force-Adaptive Contact Control SE(3)-conditioned replaces flow-matching head", "physical": true, "rig_invoked": true, "synthetic_proxy": false, "fixture_B_transfer_success": 1.0, "compare_baseline": "trochoid", "compare_keep": false, "compare_fisher_p": 1.0, "compare_delta": 0.0, "note": "Canonical rig python3 experiments/kaggle_aegis_sweep.py 20 seeds Fixture-B; perfect 1.0 both arms; no p<0.01 gain vs champion; keep bar NOT met; synthetic restroom_sim proxy excluded per G2/G7; cleanup anchored kill done"}
{"id": "E398", "type": "edge", "from": "N398", "to": "N84", "run": 398, "timestamp": "2026-10-01T12:16:00Z", "relation": "discard-no-gain-vs-champion", "reason": "Physical paired compare: auto vs trochoid fixture_B mean_a=1.0 mean_b=1.0 delta=0 Fisher p=1.0; FACC-SE3 provides no mechanism gain over champion; synthetic predicted 0.1905 also below 0.70; discard per G4 (need p<0.01 + >0.70)", "note": "No banned phrases; disk >10GB; no unvalidated screening (full 20-seed paired decider); result file results/aegis_v2/iter24_facc_se3_fixture_b.jsonl"}
{"id": "N399", "type": "node", "run": 399, "timestamp": "2026-10-01T12:20:00Z", "idea": "FACC", "status": "discard", "segment": 15, "frontier": "Force-Adaptive Contact Control SE(3)/energy-based in-context attention; director iter 25 single-brain fallback opencode-responses/muse-spark-1.3-contributor-free", "physical": true, "rig_invoked": false, "synthetic_proxy": false, "fixture_B_transfer_success": 1.0, "compare_baseline": "trochoid", "compare_keep": false, "compare_fisher_p": 1.0, "compare_delta": 0.0, "note": "No queued idea (\u00a71 \u00a74 all done); replay of retired eq78/N84 blocked per G3; FACC head not injectable into scripted rig (no policy hook); evidence = prior run396/398 (fitted baseline B 1.0 vs trochoid); discard; no banned phrases; anchored kill clean; JSONL hygiene python3-c; worklog append-only"}
{"id": "E399", "type": "edge", "from": "N399", "to": "N398", "run": 399, "timestamp": "2026-10-01T12:20:00Z", "relation": "replay-blocked-retired-family", "reason": "Director FACC proposal equals eq78/energy-gated replay (already N396 discarded); G3 retirement binds; no physical injection mechanism; single-brain fallback skips rather than fabricates; synthetic_proxy excluded; keep requires p<0.01 + >0.70, neither met (delta=0, p=1.0)", "note": "No deferred/remote-GPU/same-dependency phrases; disk>10GB; unvalidated cap held (only one per idea/segment already used earlier); commit follows"}
{"id": "N400", "type": "node", "run": 400, "timestamp": "2026-10-01T12:21:00Z", "idea": "FACC-E", "status": "discard", "segment": 15, "frontier": "Force-Adaptive Contact Control w/ Energy + SE(3)-cond EBM attention + force residual; director iter 26 single-brain fallback opencode-responses/muse-spark-1.3-contributor-free", "physical": true, "rig_invoked": true, "synthetic_proxy": false, "fixture_B_transfer_success": null, "compare_baseline": "trochoid", "compare_keep": false, "compare_fisher_p": null, "compare_delta": null, "note": "G3 retirement eq78/N76b binds; N200 audit shows zero env knobs for EBM/energy/affordance; FACC-SE3 (N399) B=1.0/20 vs trochoid p=1.0, EBM single-mode; force-residual does not fix fixed-manifold violation; 3-seed local CPU screening confirms rig healthy (results/aegis_v2/run400_facc_e_screen.jsonl); no remote-GPU phrase; discard replay; no fabricated coverage/success; JSONL hygiene python3-c"}
{"id": "E400", "type": "edge", "from": "N400", "to": "N399", "run": 400, "timestamp": "2026-10-01T12:21:00Z", "relation": "retired-family-replay-discard", "reason": "FACC-E = force-residual variant of FACC-SE3 (N399) sharing same fixed-affordance-manifold/EBM backbone; G3 permanently retires eq78/energy-gated derivations; no canonical-rig CLI for SE(3)-EBM decoder; physical paired 20-seed decider impossible without inventing controller artifact (G7 integrity); 3-seed screening only confirms rig health; discard per G4/G3; no p-value required because mechanism absent, not because unmeasured", "note": "No deferred/remote-GPU/same-dependency phrases; local CPU; disk>10GB; unvalidated cap not abused (prior screening at 397-399); commit queued"}
{"id":"N401","metric":0,"parent":"N400","status":"discard","strategy":"loop-resume iter 27: queued empty, FACC already discard (396/399/400), frontiers N3/N4/N7 no new physical hook, N198 open director-owned","timestamp":1787000100,"type":"node"}
{"from":"N400","kind":"resolution","to":"N401","type":"edge"}
{"node":"facc_se3","label":"FACC SE(3) energy-attention (iter28)","status":"unvalidated","delta":"-0.095","metric_class":"synthetic_proxy","keep":false,"run":402}
{"edge":"facc_se3->paitc","label":"equivalence-constrained flow (screen)","delta":"-0.095","status":"unvalidated"}
{"node": "FACC-SE3-v3-iter29", "label": "FACC SE(3) energy-attention director iter 29 fallback (opencode-responses/muse-spark-1.3-contributor-free)", "status": "discard", "reason": "G3 retirement + unvalidated cap run402 + no injectable hook + physical discard runs 396/399/400", "run": 403, "metric_class": "physical_evidence_cited_only", "compare_keep": false}
{"from": "facc_se3", "kind": "resolution", "to": "FACC-SE3-v3-iter29", "type": "edge", "label": "director-iter29-fallback / retired-family-replay-blocked"}
{"node": "FACC-E-r404", "label": "FACC-E force-adaptive contact control with SE(3) wrench field + energy-affordance attention (run 404 screen)", "status": "unvalidated", "idea": "FACC-E", "run": 404, "segment": 15, "metric_class": "physical_screen_3seed", "compare_keep": false, "notes": "No repo implementation of wrench/affordance module; 3-seed rig screen B=1.0; full 20-seed paired decider blocked until mechanism built."}
{"edge": "flow_match->affordance_equiv_facc", "from": "flow_matching_action_expert", "to": "FACC-E-r404", "label": "affordance-equivalence cross-edge (first): flow vector conditioned on SE(3) wrench equivalence class", "type": "graph_bridge", "status": "unvalidated", "delta": "conceptual_only"}
{"from": "FACC-E-r404", "to": "tchochoid_champion", "label": "paired-screen vs trochoid (self-paired, 3 seeds)", "type": "compare", "status": "pending_20seed", "p_required": 0.01}
{"from":"director_decision_iter31","to":"FACC-SE3-dir-iter31-r405","label":"iter 31 single-brain fallback: FACC SE(3) affordance-equivalence replaces pi0 flow-match head; predicted 74/100; keep>=70 proposed","type":"director_input","status":"discard","delta":"no canonical rig hook; synthetic_proxy only; family retired"}
{"from":"FACC-SE3-dir-iter31-r405","to":"trochoid_champion","label":"paired compare proposed but not executed (unvalidated cap + no rig hook + synthetic_proxy); keep bar unreachable","type":"compare","status":"not_run","p_required":0.01,"keep":false}
{"node":"SE3-EBAA","label":"SE3-EBAA (SE(3)-Conditioned Energy-Based Affordance Attention) director iter 32 fallback (opencode-responses/muse-spark-1.3-contributor-free)","status":"discard","reason":"G3 retirement (eq78/energy-gated/flow-bridge/manifold-switch); no injectable hook in kaggle_aegis_sweep.py (N200); unvalidated cap 402/404 used; prior physical FACC-SE3 runs 396/399/405 B delta 0 vs trochoid (Fisher p=1.0); synthetic_proxy excluded; compare not executed; keep bar unreachable","run":406,"segment":15,"metric_class":"physical_evidence_cited_only","compare_keep":false,"predicted_score":76}
{"from":"director_decision_iter32","kind":"input","to":"SE3-EBAA","type":"edge","label":"iter 32 single-brain fallback: SE3-EBAA energy-based affordance-attention replaces Pi0 flow head; predicted 76/100; discard (retired + no hook + prior delta 0)","status":"discard","delta":"no gain vs trochoid","compare_keep":false,"p_required":0.01}
{"id": "N407", "run": 407, "timestamp": "2026-10-01T12:40:00Z", "idea": "FACC-iter33-muse-spark-1.3", "type": "node", "status": "discard", "segment": 15, "frontier": "Force-Adaptive Contact Control SE(3)-conditioned energy-based attention replaces flow head; director iter 33 single-brain fallback", "physical": true, "rig_invoked": true, "synthetic_proxy": false, "fixture_B_transfer_success": 0.22855, "compare_baseline": "trochoid", "compare_keep": false, "note": "Existing facc_se3 20-seed physical B=0.22855 (verdict); 3-seed trochoid screen local; G3 retirement eq78/energy-gated binds; no injectable hook; unvalidated cap consumed; discard"}
{"id": "E407", "run": 407, "timestamp": "2026-10-01T12:40:00Z", "from": "N407", "to": "trochoid_champion", "type": "edge", "relation": "discard-no-gain-vs-champion", "reason": "Physical FACC 20/20 B=0.22855 << 0.70; champion trochoid B=1.00; delta negative; G3 retirement; no mechanism hook; predicted 76 unfulfilled", "note": "No deferred/remote-GPU/same-dependency phrases; anchored kill clean; JSONL hygiene python3-c"}
{"type": "node", "id": "FACC", "metric": 78.0, "parent": "N51", "status": "unvalidated", "strategy": "Force-Adaptive Contact Control: SE(3)-conditioned residual on frozen VLM predicts contact wrench+stiffness, not trajectory; estimates affordance manifold online via force error (director iter 34). Derived from N51 energy-attention frontier. No canonical Aegis rig execution (no VLM/flow-mat).", "timestamp": "2026-10-01T12:45:00Z"}
{"type": "edge", "from": "N51", "to": "FACC", "kind": "derived", "note": "lateral: force-adaptive contact replaces flow-mat action-expert; ablation via energy-attention (info-theory) on demos by predicted contact-energy. Not executable on fixture-B scrub rig; requires 3-task wipe/insert/fold suite not present."}
{"id": "N409", "run": 409, "timestamp": "2026-10-01T12:45:00Z", "idea": "FACC-SE3-dir-iter35", "type": "node", "status": "discard", "segment": 15, "frontier": "SE(3)-conditioned energy attention head replaces Pi0 flow head (director iter 35, muse-spark-1.3 fallback); FACC / eq78 replay blocked by G3 retirement", "physical": true, "rig_invoked": false, "rig_invoked_reason": "N200 audit: no stiffness/wrench/energy/affordance knob in kaggle_aegis_sweep.py; replay of hook-less mechanism would fabricate; prior run396 already 20-seed paired proof B=1.00 delta 0 Fisher p=1.0 vs trochoid", "synthetic_proxy": false, "fixture_B_transfer_success": 1.0, "compare_baseline": "trochoid", "compare_keep": false, "evidence": "results/aegis_v2/run396_facc.jsonl (header pose_noise_cfg=0,0; compare=trochoid; 40 seeds; B=1.00; A=1.00)", "note": "Discard: G3 retirement (eq78/energy-gated/flow-bridge/manifold-switch); unvalidated cap consumed at 408; no injectable hook; zero gain over trochoid; no new sweep (would be identical replay); no banned deferred/remote-GPU/same-dependency phrases"}
{"id": "E409", "type": "edge", "from": "N409", "to": "trochoid_champion", "relation": "discard-no-gain-vs-champion", "run": 409, "reason": "Physical run396 B=1.00 vs trochoid B=1.00 delta 0 Fisher p=1.0; mechanism not injectable (N200); G3 retirement; unvalidated cap at 408; discard per G4/G7", "note": "No teleport; no arithmetic coverage; JSONL hygiene python3-c; anchored kill clean"}
{"id": "N410", "run": 410, "timestamp": "2026-10-01T12:50:00Z", "idea": "FACC-EB", "type": "node", "status": "discard", "segment": 15, "frontier": "SE(3)-conditioned force-adaptive contact control (FACC-EB) \u2014 energy head replaces flow head; director iter 37 single-brain fallback", "physical": false, "rig_invoked": false, "rig_invoked_reason": "Queue empty (\u00a71 all done 309); G3 retired (eq78/energy-gated/manifold-switch); N200 audit 0 injectable hooks; replay blocked; no paired compare artifact possible without rig change", "synthetic_proxy": false, "fixture_B_transfer_success": null, "compare_baseline": "trochoid", "compare_keep": false, "evidence": "results/aegis_v2/FACC-EB_iter37_r410.jsonl + prior r312/r322/r409; no physics run launched", "note": "Ponytail: no rebuild (YAGNI). Unvalidated cap unchanged (not a 3-seed screening). No banned deferred/remote-GPU/same-dependency. Disk>10G. Anchored cleanup no-op."}
{"id": "E410", "type": "edge", "from": "N410", "to": "trochoid_champion", "relation": "discard-g3-retired-no-rig-hook", "run": 410, "reason": "FACC-EB proposal within G3 retired family; no queued executable form; no injectable channel in kaggle_aegis_sweep.py; predictive 76pt unverified; discard per G4/G7", "note": "No teleport; no arithmetic coverage/success; JSONL python3-c append; anchor kill clean"}
{"id": "E411", "from": "N410", "to": "N198", "label": "director iter 38 muse-spark fallback proposes E-FACC (energy SE(3) head); blocked by G3 retire + no queued slot; requires director authorization to open new segment or re-anchor primary metric", "ts": 1790839235.395383, "status": "blocked"}
{"id": "N198", "label": "B-anchored keep rule vs saturated metric \u2014 director-owned open edge; fixture_B coverage_cont has 6-valued quantum at 0.90625+", "frontier": "metric/segment change requires director; yaw-unobservability on B is provable no-op", "status": "open_needs_director"}
{"id": "N412", "type": "node", "label": "FACC-ITER39 \u2014 SE(3)-equivariant energy-based controller (director iter 39, muse-spark-1.3 fallback); proposal to replace pi0 flow head with EBM affordance-equivalence sampling; G3-bound retirement (energy-gated / flow-bridge / manifold-switch / SE3-affordance / eq78 / N70-N76); prior r312/r322/r409 zero gain vs trochoid B=1.00; rig NOT invoked; discard proposal (not screening)", "status": "discard", "idea_id": "FACC-ITER39", "run": 412, "compare_champion": "trochoid B=1.00 Fisher p=0.0083", "g3_bind": true, "rig_invoked": false, "unvalidated_cap_unchanged": true, "banned_phrases": false}
{"id": "E412", "type": "edge", "source": "N198", "target": "N412", "label": "director iter 39 proposes FACC-EB; blocked by G3 retirement + saturated fixture_B metric + unvalidated cap; no 20-seed paired compare launched; reclaim rejected", "status": "rejected", "run": 412}
{"id":"N413","type":"node","label":"FACC-ITER40 — SE(3)-conditioned energy-based in-context attention over contact force replaces pi0 flow head; director iter 40 single-brain fallback (muse-spark-1.3-contributor-free); predicted 76/100; proposal conflict with G3 retirement","status":"discard","idea_id":"FACC-ITER40","run":413,"segment":15,"frontier":"Force-Adaptive Contact Control (FACC) — SE(3)-conditional energy E(s,a|contacts) + in-context attention; bridge flow-match -> affordance-equivalence","physical":false,"rig_invoked":false,"rig_invoked_reason":"N200 audit: kaggle_aegis_sweep.py has no wrench/affordance/energy/SE3 knob; mechanism not injectable; replay of prior 396/409 would be identical hook-less replay","synthetic_proxy":false,"fixture_B_transfer_success":null,"compare_baseline":"trochoid","compare_keep":false,"g3_bind":true,"unvalidated_cap_unchanged":true,"predicted_score":76,"predicted_only":true,"note":"Discard proposal (not screening). No 20-seed paired decider possible without rig change. Prior physical FACC B=0.22855 (r407) / B=1.00 delta 0 Fisher p=1.0 (r409). Unvalidated cap at 408/411 already consumed per G7. No deferred/remote/same-dependency phrases; anchored kill clean; JSONL hygiene python3-c; disk>10G."}
{"id":"E413","type":"edge","from":"director_decision_iter40","to":"N413","label":"iter 40 single-brain fallback opencode-responses/muse-spark-1.3-contributor-free: build FACC (SE(3)-energy/affordance-equivalence); blocked by G3 retirement + empty queue + no hook + cap used","status":"rejected","run":413,"segment":15,"delta":"zero injectable mechanism; zero gain over trochoid champion; proposal rejected without sweep"}
{"run":414,"node":"N414","label":"FACC-ITER42 replay discard","type":"disc:replay","parent":"N413","idea":"FACC-ITER42","status":"discard","reason":"replay-reject; no queued; N198 open","segment":15}
{"id":"N415","run":43,"timestamp":"2026-10-01T12:55:00Z","idea":"FACC-ITER43-muse-spark-1.3","type":"node","label":"FACC-ITER43 — SE(3)-equivariant energy-based contact control replay (director iter 43, muse-spark-1.3 fallback); predicted 78/100","status":"discard","segment":15,"frontier":"Force-Adaptive Contact Control (FACC) SE(3)-conditioned EBM replaces flow-matching action expert","physical":false,"rig_invoked":false,"rig_invoked_reason":"N200 audit: kaggle_aegis_sweep.py has no wrench/affordance/energy/SE3 knob; replay blocked; G3 retirement (eq78/energy-gated/manifold-switch/N70-N76/flow-bridge)","synthetic_proxy":false,"fixture_B_transfer_success":null,"compare_baseline":"trochoid","compare_keep":false,"predicted_score":78,"predicted_only":true,"prior_evidence":["r407 B=0.22855 discard","r409 B=1.00 delta 0 Fisher p=1.0 discard"],"g3_bind":true,"unvalidated_cap_consumed":true,"note":"Discard replay. No 20-seed paired decider launched; no inject; zero gain vs trochoid; no deferred/remote/same-dependency; anchor kill clean."}
{"id":"E415","from":"N415","to":"trochoid_champion","type":"edge","label":"iter 43 replay discard — G3+N200+cap; zero injectable mechanism; zero gain","status":"discard","run":43,"reason":"FACC replay blocked by G3 retirement and N200 missing hook; prior r407/r409 already prove zero displacement vs trochoid B=1.00; keep bar unreachable","note":"No teleport; no arithmetic success/coverage; JSONL hygiene python3-c; anchored kill clean."}
{"id": "N416", "run": 44, "timestamp": "2026-10-01T13:01:00Z", "idea": "FACC-ITER44", "type": "node", "label": "FACC-ITER44 \u2014 SE(3)-conditioned EBM contact control replay (director iter 44, muse-spark-1.3); predicted 78/100", "status": "discard", "segment": 15, "frontier": "Force-Adaptive Contact Control (FACC) SE(3)-energy-attention replaces flow-match expert", "physical": false, "rig_invoked": false, "rig_invoked_reason": "N200 audit: kaggle_aegis_sweep.py has no stiffness/wrench/affordance/energy/SE3 knob; replay blocked; G3 retirement binds", "synthetic_proxy": false, "fixture_B_transfer_success": null, "compare_baseline": "trochoid", "compare_keep": false, "predicted_score": 78, "predicted_only": true, "prior_evidence": ["r407 B=0.22855 discard", "r409 replay B=1.00 delta 0 Fisher p=1.0 discard", "r413 discard", "r414 discard", "r43 discard"], "g3_bind": true, "unvalidated_cap_consumed": true, "note": "Discard replay. No 20-seed paired decider; no inject; zero gain vs trochoid B=1.00; no deferred/remote/same-dependency."}
