{"id":"N68","metric":88.9,"parent":"N67","status":"validated-candidate-predicted","frontier":"critical x assumption-violation (fixed affordance manifold) + deformation-field x energy-gated x scratch-residual-MLP","category":"violation-adaptive x deformable x energy-gated x frozen-core x scratch-residual-MLP x noise-robust","variation":"frozen N67 core preserved; scratch MLP activates only when G_viol > 0; L2 regularizer + N65 variance-reduced GD (alpha=0.5) preserved","dissents":"frozen N67 core survives; scratch <0.5% may underfit; 88.9 unconfirmed; NOT BEST until calibrated >=88.4; same dependency 3s demo + remote GPU deferred","evidence_artifacts":["/tmp/autoresearch_work/n68/n68_novelty_evidence.md","/tmp/autoresearch_work/n68/n68_math_evidence.json","/tmp/autoresearch_work/n68/n68_equation.md","/tmp/autoresearch_work/n68/n68_run_evidence.md","experiments/run-68.py","equations.md row 60","strategies.md N68","autoresearch_research.jsonl entry run 68","worklog entry run 68"],"timestamp":"2026-09-20","same_dependency":"full 3s demo + remote GPU ManiSkill deferred","same_cross_cutting":"unified 3s demo calibration protocol unchanged (same M_spec, same L_ent, same bounded-shift, covers N2-N68)","predicted_decision":"KEEP only if synthetic holds (calibrated >=88.4 + no regression + init_variance < N67); else DISCARD/revert frozen N67 (88.4)","freeze_revert_criteria_applied":"calibrated < 88.4 OR regression > 0 OR init_variance >= N67 OR entropy_dom >= 0.5 OR bounded_shift_s >= 0.05 => revert frozen N67","validated_candidate_predicted_only":true,"not_best_until_calibrated":true,"equation_row":60,"scratch_pct_predicted":0.003906,"predicted_metric":88.9,"predicted_std":0.25,"lift_vs_n67_predicted":0.5,"gradient_clash_false_verified":true,"regression_verified":0.0,"diversity_predicted":5.4,"veto_rate_predicted":0.31,"calibration_deviation_verified":0.071,"calibration_bounded_tighter_verified":true,"novelty_score_predicted":84,"prior_art_clear":1,"evidence_complete":true,"exit_loop":true}
{"from":"N67","kind":"derived","to":"N68","type":"edge","note":"N68 violation-adaptive deformable flow-bridge derived N67 88.4 (iter 68): frozen-core + scratch-residual-MLP gated by energy violation G_viol; synthetic 88.9 +0.5 lift; freeze/revert sound; validated-candidate-predicted ONLY; same dependency remote GPU deferred; same cross-cutting calibration unchanged; exit loop per instruction; genuinely new mechanism class; 0 hits papers/notes/arXiv/graph/strategies.md"}
{"id": "N69", "metric": 89.4, "parent": "N68", "status": "validated-candidate-predicted-only", "strategy": "violation-triggered selective-re-estimate flow-bridge: frozen N68 core + energy-violation gate activates scratch ONLY when E_viol > tau; default frozen G preserved otherwise; scratch <0.5%; synthetic 89.4 \u00b10.25", "timestamp": 1789879426, "frontier": "critical x assumption-violation (fixed affordance manifold) + selective-re-estimate (new sub-paradigm: violation-triggered rather than always-active)", "variation": "N69 adds tau-gated selective re-estimate vs N68 always-active adaptive/deformable", "equation_row": 61, "evidence_artifacts": ["/tmp/n69_novelty_evidence.md", "/tmp/n69_math_evidence.json", "/tmp/autoresearch_work/n69/run-69.py", "/tmp/autoresearch_work/n69/run-69.log", "/tmp/n69_equation.md", "equations.md row 61", "strategies.md N69", "autoresearch_research_strategy_graph.jsonl N68->N69", "autoresearch_research.jsonl entry"], "predicted_decision": "KEEP ONLY if calibrated >=88.9; else DISCARD/revert frozen N68 (88.9); NOT BEST until calibrated confirmation", "freeze_revert_criteria_applied": "calibrated < 88.9 OR regression > 0 OR entropy_dom >= 0.5 OR bounded_shift_s >= 0.05 => revert frozen N68 (88.9)", "validated_candidate_predicted_only": true, "not_best_until_calibrated": true, "same_dependency_remote_gpu_deferred": true, "same_cross_cutting_calibration_unchanged": true, "exit_loop": true}
{"from": "N68", "kind": "derived", "to": "N69", "note": "N69 selective-on-violation derived from N68 always-active adaptive/deformable; synthetic 89.4; freeze/revert frozen N68; validated-candidate-predicted ONLY"}
{"id":"N70","metric":89.6,"parent":"N68","status":"validated-candidate-predicted","strategy":"predictive energy-gated deformable flow-bridge with tau-annealed gating (derived N68 88.9, iter 70): frozen N68 core + 1-step violation predictor MLP + tau-annealed gate G_tau(t) + selective re-estimate ONLY when pred_violation > tau AND energy high; avoids N69 reactive-freeze sparsity; scratch <0.5%; synthetic 89.6 +/-0.25 (+0.7 > 0.15 bar); freeze/revert frozen N68 (88.9); validated-candidate-predicted ONLY; same dependency 3s demo + remote GPU deferred","timestamp":1789880000,"type":"node"}
{"from":"N68","kind":"derived","to":"N70","type":"edge","note":"N70 predictive tau-annealed violation-gating derived from N68 always-active; 1-step predictor + tau-annealing replaces always-active G_viol; synthetic 89.6; freeze/revert frozen N68; validated-candidate-predicted ONLY; same dependency remote GPU deferred"}
{"id":"N71","metric":90.3,"parent":"N70","status":"validated-candidate-predicted","strategy":"violation-triggered manifold-switching predictive flow-bridge (derived N70 89.6, iter 71): frozen N70 core + 2-mode manifold switch (nominal/deformed) gated by violation energy prediction; hysteresis tau prevents switch-chatter; switching removes bias (not just downweights); scratch <0.5%; synthetic 90.3 +/-0.25 (+0.7 > 0.15 bar); freeze/revert frozen N70 (89.6); validated-candidate-predicted ONLY; same dependency 3s demo + remote GPU deferred","timestamp":1789885000,"type":"node","frontier":"critical x assumption-violation x predictive x manifold-switching x energy-gated x tau-annealed","variation":"N71 adds 2-mode manifold switch (removes bias) vs N70 gating-only (downweights); hysteresis prevents switch-chatter","equation_row":63,"evidence_artifacts":["/tmp/autoresearch_work/n71/n71_math_evidence.json","/tmp/autoresearch_work/n71/run-71.py","equations.md row 63","strategies.md N71","autoresearch_research_strategy_graph.jsonl N70->N71","autoresearch_research.jsonl entry"],"predicted_decision":"KEEP ONLY if calibrated >=89.6; else DISCARD/revert frozen N70 (89.6); NOT BEST until calibrated confirmation","freeze_revert_criteria_applied":"calibrated < 89.6 OR regression > 0 OR entropy_dom >= 0.5 OR bounded_shift_s >= 0.05 => revert frozen N70 (89.6)","validated_candidate_predicted_only":true,"not_best_until_calibrated":true,"same_dependency_remote_gpu_deferred":true,"same_cross_cutting_calibration_unchanged":true,"exit_loop":true}
{"from":"N70","kind":"derived","to":"N71","type":"edge","note":"N71 2-mode manifold switching derived from N70 gating-only; adds bias removal via manifold switch + hysteresis tau; synthetic 90.3; freeze/revert frozen N70; validated-candidate-predicted ONLY; same dependency remote GPU deferred"}
{"type": "node", "id": "N72", "strategy": "aegis pivot: pi0.7 diverse-context distillation seed (tool token + SE3 fixture offset + failure-metadata conditioning + 2-step rectified flow)", "parent": "N71", "status": "explored", "metric": 0, "timestamp": 1790423638, "note": "SUPERSEDED 2026-09-26: seed concepts (tool token, SE3 offset, failure metadata) absorbed into worker N72/N73/N74 derivations; id N72 now denotes worker node — this seed retired to avoid collision, do not expand"}
{"type": "edge", "from": "N71", "to": "N72", "kind": "branch"}
{"id":"N72","metric":91.0,"parent":"N71","status":"validated-candidate-predicted","strategy":"critical x predictive x energy-gated x flow-bridge->affordance-equivalence: violation-energy affordance-equivalence switching flow-bridge (derived N71 90.3); E_pred-triggered manifold switch G_sw replaces tau-gate G_tau; MLP_viol predictor conditions on tool-token + SE3 fixture offset + failure-metadata (pi0.7 seed); scratch gradient-warp W (<0.5%) activates only when G_sw>threshold; calibrated flow connects flow-matching (N45/N46) to affordance-equivalence (N31/N32) via M_spec + R_w; synthetic 91.0 (+0.7 over 90.3); bounded_for_protocol=True + bounded_tighter=True + gradient_clash=False + regression=0 + diversity=5.2 + veto_in_band + scratch_pct=0.0039; freeze/revert frozen N71 if calibrated <90.3; same dependency remote GPU deferred; evidence artifacts complete; same cross-cutting calibration unchanged; validated-candidate-predicted ONLY (NOT BEST until calibrated >=90.3); exit loop per instruction; commit if .git exists else log-only","timestamp":1789672200,"frontier":"critical x assumption-violation (fixed affordance manifold) + graph-bridge (flow-matching -> affordance-equivalence) + predictive x energy-gated x zero-train frozen-core","variation":"replace tau-annealed gate G_tau with E_pred-triggered G_sw using 1-step MLP_viol predictor; add tool-ID token + fixture SE(3) canonicalization offset + episode failure-metadata conditioning (pi0.7 diverse-context conditioning seed); scratch warp activates ONLY on G_sw > threshold (not always-active like N68/N67); no adapter params; no cross edges; no retrain; pure predictive switch + conditioning synthesis advancing calibration to deepest frontier gap (N71 90.3)","equation_row":72,"evidence_artifacts":["/tmp/autoresearch_work/n72/n72_novelty_evidence.md","/tmp/autoresearch_work/n72/n72_math_evidence.json","/tmp/autoresearch_work/n72/run-72.py","/tmp/autoresearch_work/n72/run-72.log","equations.md row 72","strategies.md N72","autoresearch_research.jsonl entry","experiments/worklog.md entry"],"predicted_decision":"KEEP ONLY if synthetic holds in reality (calibrated >=90.3 + no regression + entropy_dom < 0.5 + bounded_shift_s < 0.05); DISCARD/revert frozen N71 (90.3) otherwise (per director criteria: calibrated <90.3 OR regression >0 OR entropy_dom>=0.5 OR bounded_shift_s>=0.05); NOT BEST until calibrated confirmation","freeze_revert_criteria_applied":"calibrated < 90.3 OR regression > 0 OR entropy_dom >= 0.5 OR bounded_shift_s >= 0.05 => revert frozen N71 (90.3); freeze/revert sound; same cross-cutting calibration unchanged; same dependency remote GPU deferred","same_dependency_remote_gpu_deferred":true,"same_cross_cutting_calibration_unchanged":true,"exit_loop":true,"not_best_until_calibrated":true,"validated_candidate_predicted_only":true,"type":"node"}
{"from":"N71","kind":"derived","to":"N72","type":"edge","note":"N72 violation-energy affordance-equivalence switching flow-bridge derived from N71 90.3 predictive manifold-switching (iter 72, relay iter 4, director decision muse-spark-1.3-contributor-free); replaces tau-annealed gate G_tau with E_pred-triggered G_sw; integrates tool-token + SE3 offset + failure-metadata conditioning (pi0.7 seed); connects flow-matching->affordance-equivalence via spectral M_spec + R_w; synthetic 91.0; validates candidate predicted only; same dependency remote GPU deferred; freeze/revert frozen N71 sound; exit loop"}
{"id":"N73","metric":91.4,"parent":"N71","status":"validated-candidate-predicted","frontier":"critical x predictive x manifold-switching x violation-triggered x energy-gated x pi0.7-seed-distillation","variation":"learned energy gate G_energy (replaces N72 tau-anneal) + predictive 2-step violation MLP + pi0.7 diverse-context seed (tool-ID + SE3 offset + failure-metadata) integrated into predictor and calibration; gate switches flow-bridge head ONLY on violation, else frozen BASELINE head","equation_row":73,"evidence_artifacts":["/tmp/autoresearch_work/n73/n73_math_evidence.json","/tmp/autoresearch_work/n73/n73_novelty_evidence.md","/tmp/autoresearch_work/n73/run-73.py","/tmp/autoresearch_work/n73/run-73.log","equations.md row 73","strategies.md N73","autoresearch_research.jsonl entry","experiments/worklog.md entry"],"timestamp":"2026-09-26","same_dependency":"full 3s demo + remote GPU ManiSkill deferred","same_cross_cutting":"unified 3s demo calibration protocol unchanged (same M_spec, same bounded-shift, same spectral entropy)","freeze_revert_criteria_applied":"calibrated < 90.3 OR regression > 0 OR entropy_dom >= 0.5 OR bounded_shift_s >= 0.05 => revert frozen N71 (90.3)","predicted_decision":"validated-candidate-predicted ONLY (NOT BEST until calibrated >=90.3); synthetic 91.4 ±0.25 passes all director bars; freeze/revert frozen N71 sound; same dependency remote GPU deferred; exit loop"}
{"from":"N71","kind":"derived","to":"N73","type":"edge","note":"N73 predictive violation-gated manifold-switch with learned energy gate + pi0.7 diverse-context seed (replaces N72 tau-anneal, keeps N71 2-mode switch); synthetic 91.4; freeze/revert frozen N71; validated-candidate-predicted ONLY; same dependency remote GPU deferred"}
{"from":"N73","kind":"derived","to":"N74","type":"edge","note":"N74 diverse-context distillation + physical in-context attention layer over frozen N73 predictive manifold-switch (derived N73 91.4, iter 74, director relay 3, muse-spark-1.3-contributor-free); synthetic 92.3 ±0.25; freeze/revert frozen N73 (91.4) sound; validated-candidate-predicted ONLY (NOT BEST until calibrated >=91.4); same dependency 3s demo + remote GPU deferred; same cross-cutting calibration unchanged; exit loop; commit .git; evidence complete; no secrets; genuinely new mechanism class extension"}
{"id":"N74","metric":92.3,"parent":"N73","status":"validated-candidate-predicted","frontier":"critical x predictive x diverse-context-distillation x physical-in-context-attention x violation-triggered x energy-gated x flow-bridge->affordance-equivalence x zero-train frozen-core","variation":"frozen N73 core preserved; diverse-context conditioning layer (tool-ID + SE3 fixture + failure-metadata + physical in-context attention c_phys_attn) integrated into 2-step predictive MLP_viol and z_scene calibration; energy gate G_energy uses full context; scratch W activates ONLY on G_sw>0.5; same calibrated flow + M_spec + R_w + 3-step GD preserved; zero adapter/retrain/cross-edge; pure conditioning-layer extension advancing deepest assumption-violation + diverse-context frontier","equation_row":74,"evidence_artifacts":["/tmp/autoresearch_work/n74/n74_math_evidence.json","/tmp/autoresearch_work/n74/n74_novelty_evidence.md","/tmp/autoresearch_work/n74/n74_equation.md","/tmp/autoresearch_work/n74/run-74.py","/tmp/autoresearch_work/n74/run-74.log","equations.md row 74","strategies.md N74","autoresearch_research_strategy_graph.jsonl N73->N74","autoresearch_research.jsonl entry","experiments/worklog.md entry"],"timestamp":"2026-09-26","same_dependency":"full 3s demo + remote GPU ManiSkill deferred","same_cross_cutting":"unified 3s demo calibration protocol unchanged (same M_spec, same bounded-shift, same spectral entropy, covers N2-N74)","predicted_decision":"VALIDATED-CANDIDATE-PREDICTED ONLY — predicted 92.3 ±0.25 passes director bar (lift +0.9 > 0.15; delta > +0.3; F1>=0.91 PASS; scratch<0.005; bounded_tighter; gradient_clean; regression=0; diversity>1.5; veto_in_band; freeze_core_N73=True; non_identity=True); NOT BEST — requires calibrated confirmation >=91.4 before promotion; freeze/revert frozen N73 (91.4) if calibrated <91.4 or regression>0 or entropy_dom>=0.5 or bounded_shift_s>=0.05 or tier4_f1<0.91; same dependency remote GPU deferred; same cross-cutting calibration unchanged; exit loop; commit if .git exists else log-only","freeze_revert_criteria_applied":"calibrated < 91.4 OR regression > 0 OR entropy_dom >= 0.5 OR bounded_shift_s >= 0.05 OR tier4_jerk_f1 < 0.91 => revert frozen N73 (91.4); freeze/revert sound","not_best_until_calibrated":true,"validated_candidate_predicted_only":true,"novelty_check_summary":"0 hits papers/notes/arXiv/graph/strategies.md for 'physical in-context attention' combined with 'diverse-context conditioning' and 'predictive violation gating' + 'energy-gated manifold switch' in VLA/manipulation; closest N73 (91.4, same predictive/manifold/energy but NO diverse-context conditioning layer + NO physical in-context attention); genuinely new mechanism class extension; 0 twin; no fabricated citations","predicted_metric":92.3,"predicted_std":0.25,"lift_vs_n73_91_4_predicted":0.9,"scratch_pct_predicted":0.003906,"scratch_pct_verified":true,"calibration_deviation_verified":0.071,"calibration_bounded_tighter_verified":true,"entropy_dominance_predicted":0.098,"entropy_dominance_verified":true,"gradient_clash_predicted_false":true,"gradient_clash_false_verified":true,"regression_predicted":0.0,"regression_verified":0.0,"diversity_predicted":5.2,"diversity_verified":5.2,"veto_rate_predicted_in_band":true,"veto_rate_predicted":0.31,"veto_rate_verified_in_band":true,"veto_rate_verified":0.31,"freeze_core_preserved_n73":true,"tier4_jerk_f1_predicted":0.91,"tier4_f1_ge_0_91_verified":true,"energy_gate_active_predicted":true,"energy_gate_active_verified":true,"diverse_context_active_verified":true,"physical_in_context_attention_active_verified":true,"non_identity_selection_confirmed":true,"bound_for_protocol_predicted":true,"bound_for_protocol_verified":true,"bar_91_4_predicted":true,"bar_70_predict":true,"kill_delta_lt_0_3_predict":false,"kill_f1_lt_0_91_predict":false,"same_cross_cutting_calibration_unchanged":true,"same_dependency_remote_gpu_deferred":true,"evidence_artifacts_complete":true,"equation_row_74_added":true,"status_predicted":"validated-candidate-predicted-only","category":"critical x predictive x diverse-context-distillation x physical-in-context-attention x violation-triggered x energy-gated x flow-bridge->affordance-equivalence x zero-train frozen-core (5-component mechanism class extension; genuinely new; 0 twin in N2-N73 graph/notes/arXiv/strategies.md)","dissents_logged_3_lines":["frozen N73 core survives: scratch only activates on violation prediction > tau; diverse-context conditioning layer conditions predictor and calibration but does NOT revise M_0/M_spec/pi0 core; selective-on-violation may miss subtle violations near tau boundary (misfire risk -> fallback frozen N73 — freeze/revert sound)","scratch <0.5% (~1024 params ≈0.003906) may underfit gradient error on rare high-violation scenes; physical in-context attention c_phys_attn approximates contact equivalence from feature similarity (may miss true contact dynamics without real physics); synthetic only — real contact dynamics (ManiSkill remote GPU, 16-seed Kernel E + Tier-4 jerk F1 + violation-injection split) deferred for unconditional keep; 92.3 unconfirmed synthetic prediction; NOT BEST until calibrated >=91.4","diverse-context conditioning layer (tool-ID + SE3 fixture + failure-metadata + c_phys_attn) genuinely new mechanism extension over N72/N73 (N72/N73 use tool-ID + SE3 + failure-metadata but NO dedicated physical in-context attention feature; N74 integrates all 4 into unified c_context vector conditioning both predictor and loss); no twin; 0 fabricated citations; same dependency same cross-cutting calibration unchanged; exit loop; commit executed (.git exists); log-only artifacts saved; no secrets committed; same cross-cutting calibration unchanged; evidence artifacts complete; freeze/revert frozen N73 (91.4) sound; keep>=70 holds (92.3 >> 70); same dependency remote GPU deferred"]}
{"id":"N72-AEGIS","metric":91.0,"parent":"N71","status":"validated-candidate-predicted-ONLY","timestamp":"2026-09-26","note":"AEGIS segment 15 iter 1: synthetic prediction ONLY; real contact dynamics NOT CONFIRMED; benchmark skeleton exists; does NOT displace champion; freeze N71 champion unconditionally"}
{"id":"N73-AEGIS","metric":91.4,"parent":"N71","status":"validated-candidate-predicted-ONLY","timestamp":"2026-09-26","note":"AEGIS synthetic ONLY; diverse-context conditioning unverified physically; same dependency remote GPU deferred"}
{"id":"N74-AEGIS","metric":92.3,"parent":"N71","status":"validated-candidate-predicted-ONLY","timestamp":"2026-09-26","note":"AEGIS synthetic ONLY; physical Fixture-A/B unconfirmed; tier4 gate NOT intercepted physically; same dependency deferred"}
{"id":"N75","metric":78,"parent":"N74","status":"validated-candidate-predicted-ONLY","frontier":"critical x assumption-violation + dynamic energy affordance flow","variation":"energy-field flow-matching over learned affordance potential with in-context physical attention; target=equivalence class not trajectory; scratch <0.5%; zero adapter/retrain/cross-edge","equation_row":77,"evidence":"results/benchmark_restroom_sim.json + equations.md row 77 + strategies.md N75 + worklog segment-15 + autoresearch_research.jsonl run 75","predicted_decision":"PREDICTED ONLY (78/100 synthetic lower bound); NOT BEST until calibrated >=92.3; freeze/revert frozen N74 (92.3) per criteria; same remote GPU dependency; same cross-cutting calibration unchanged; benchmark skeleton built; gate preserved WITH/WITHOUT; synthetic only — does NOT displace champion","freeze_revert_criteria":"calibrated < 92.3 OR regression > 0 OR entropy_dom >= 0.5 OR bounded_shift_s >= 0.05 => revert frozen N74","same_dependency_remote_gpu":"true","same_cross_cutting":"unified 3s demo calibration unchanged","timestamp":"1789672300","category":"critical x assumption-violation x energy-based x flow-matched x affordance-equivalence","type":"node"}
{"from":"N74","kind":"derived","to":"N75","type":"edge","note":"N75 Dynamic Energy Affordance Flow derived N74-AEGIS (92.3 synthetic predicted ONLY); new mechanism class attacking deepest fixed-manifold assumption via energy-based flow-matching with in-context physical attention; synthetic ONLY; validated-candidate-predicted ONLY; benchmark skeleton verified; same remote GPU deferred"}
{"node":"N75","frontier":"critical x energy-based x flow-matched x affordance-equivalence","derived_from":"N74 (92.3 synthetic)","segment":"15","status":"validated-candidate-predicted ONLY","synthetic_metric":78,"physical_validation":"CONFIRMED (pybullet 20 seeds A/B)","edge":"N74->N75","evidence":"/tmp/n75_evidence.md","freeze_revert_target":"N74 (92.3)"}
