{"run": 444, "idea": "FACC-E-DIRECTOR-ITER26 (Force-Adaptive Contact Control Expert, SE(3)-conditioned EBM contact-energy head replaces Pi0 flow head, energy-based physical in-context attention, single-brain muse-spark-1.3-contributor-free)", "segment": 15, "status": "discard", "timestamp": "2026-10-01T10:56:00Z", "metric": 0.0, "metric_name": "fixture_B transfer_success (coverage_cont >= 0.90 per episode), canonical rig, 20 paired seeds x 3 suites, pose_noise_cfg 0,0", "metric_class": "physical", "metric_class_note": "physical only; synthetic_proxy excluded per G2/G7; health-check only (frozen champion re-cert) since G3 replay + G4 unpairable prevent paired candidate measurement", "director_decision": {"iteration": 26, "idea": "FACC-E: Force-Adaptive Contact Control Expert (replaces Pi0 flow-matching head with SE(3)-conditioned EBM contact-energy head; predicts contact-wrench + stiffness; adapts online; info-theoretic attention via info-bottleneck; predicted 76/100 keep>=70, kill if contact-success delta <+15% or inference >1.3x)", "predicted_score": 76, "executed": false, "exclusion_reasons": ["G3 permanent retirement (2026-09-28): eq78 / N70-N76 / manifold-switch / flow-bridge / energy-gated / SE3-affordance / EBM / DAEF / FACC-SE3 / FACC-EA / EAM-EIC / DEAM-E / EAMA-SE3 family permanently retired; FACC-E is replay of same energy-based affordance-mechanism family (new label does not change mechanism class)", "G4 unpairable: PATH_MODES (experiments/kaggle_aegis_sweep.py) carries 0 injectable SE3/energy/EBM/contact-head/stiffness/manifold/controller hook (worklog/N200 audit); no mechanism exists to inject FACC controller into paired 20-seed Fixture-B comparison", "ideas.md sections 1+4: queue EMPTY since run 309 (all v3/v4 done; I20/I4/I6 at 241/244/245); no queued row to open; N198 open_needs_director (director-owned, not executable by worker)", "G7 integrity: predicted-only score 76/100 invalid for keep (unverified predictions may not set status); no synthetic_proxy promotion; synthetic N74 92.3 frozen unconditionally; no arithmetic promotion permitted", "G2 metric freeze: user-cited validation suite (pi0-FAST libero-contact + push-slide + peg-insert + compliant wipe; 50 trials; 3 seeds; varying stiffness/friction; contact-force variance) does NOT match canonical Fixture-B bar (fixture_B only, >=20 paired seeds, same friction/tool/noise/customer, 3 suites A/B/R, coverage_cont >=0.90, physical rig only); non-canonical suite excluded", "Falsifier (contact-success delta <+15%) irrelevant: no injectable mechanism = no measurement possible; previous family evidence sufficient (fixture_B 0.0857-0.2381 << 0.70 across all energy-gated variants; synthetic proxy 0.1905; replay B=1.00 delta 0 Fisher p=1.0 vs champion)", "No deferred/proxy/same-dependency phrase permitted (G5/G7); no synthetic/proxy promotion permitted"], "kill_criterion": "discard if contact-success delta <+15% OR inference >1.3x pi0; mechanism family already collapsed physically (fixture_B <0.70) so kill not required", "falsifier_notes": "No injectable mechanism exists to evaluate delta; health-check confirms frozen champion trochoid at ceiling (fixture_A/B/R 1.00 at 0,0); zero dynamic range confirms G4 bar; replay family evidence sufficient for discard without new execution"}, "physical_action_taken": "frozen-champion health re-cert only: timeout 1200 python3 experiments/kaggle_aegis_sweep.py --seeds 20 --no-upload --path trochoid --compare raster --suites fixture_A,fixture_B,fixture_R --out results/aegis_v2/iter26_facc_health.jsonl (exit 0, ~8.9s, 120 episodes, 0 harness errors, pose_noise_cfg 0,0, rig v2, path_mode trochoid, gate_mode post-hoc, 0 rig bytes changed, no teleport/resetBasePositionAndOrientation); evidence header matches claim; no synthetic_proxy run executed; no arithmetic promotion", "rig": "canonical rig experiments/kaggle_aegis_sweep.py (PyBullet DIRECT, system python3, rig_version 2, friction U[0.05,0.80], gate_mode post-hoc, pose_noise_cfg 0,0)", "rig_invoked": true, "rig_exit": 0, "episodes": 120, "harness_errors": 0, "rig_bytes_changed": 0, "pose_noise_cfg": "0,0", "evidence": ["results/aegis_v2/iter26_facc_health.jsonl (canonical rig header: pose_noise_cfg 0,0, rig_version 2, compare=raster, path_mode trochoid, gate_mode post-hoc; evidence header matches claim; 120 episodes; A/B/R 1.0000)", "autoresearch_research.jsonl (this line, python3-c hygiene append)", "autoresearch_research_strategy_graph.jsonl (replay edge N444 -> N84/N76b family; no new mechanism node since G3 retired)", "experiments/worklog.md (append-only <=10 lines, no rewrite)", "equations.md unchanged (family covered by rows 78/84; no new derivation)"], "metrics": {"idea": "FACC-E-DIRECTOR-ITER26", "metric_class": "physical", "seeds": 20, "episodes": 120, "fixture_A_success": 1.0, "fixture_B_success": 1.0, "fixture_R_success": 1.0, "fixture_B_transfer_success_paired": 1.0, "fixture_A_transfer_success_paired": 1.0, "fixture_R_transfer_success_paired": 1.0, "coverage_cont_ABR": "1.0000/1.0000/1.0000 both arms (frozen champion at 0,0 ceiling; 33rd independent 0,0 ceiling tie confirming G4 bar zero dynamic range)", "delta_vs_champion": 0.0, "welch_p_coverage_cont_vs_champion": "NaN (zero variance at ceiling; paired delta 0; champion trochoid frozen)", "fisher_p_success_vs_champion": 1.0, "compare_baseline": "raster (compare record: keep=false at 0,0 ceiling tie)", "compare_keep": false, "synthetic_proxy": null, "candidate_b_success": null, "champion_b_success": 1.0, "kept_bar_met": false, "compare_record_exists_in_results_file": true, "compare_record_keep_false": true, "evidence_file_header_pose_noise_cfg_matches_claim": true, "evidence_file_has_compare_raster_episodes": true}, "gates_unchanged": {"segment": 15, "primary_metric": "transfer_success", "tier4_gate": "post-hoc tag, untouched", "no_new_segment": true, "no_metric_move": true, "no_gate_change": true, "no_candidate_promoted": true, "no_new_unvalidated_row_added": true}, "verdict": "DISCARD (G3 retired mechanism-family replay + G4 unpairable + G7 predicted-only invalid + G2 metric-freeze/non-canonical-suite violation + queue empty + N198 director-only preserved). FACC-E (iter 26) describes the same energy-based adaptive-manifold + SE(3)-conditioned mechanism family (EBM contact-energy head, info-theoretic attention, flow-head replacement) that physically collapsed across all variants (fixture_B 0.0857-0.2381 << 0.70; synthetic proxy 0.1905; replay B=1.00 delta 0 Fisher p=1.0). No injectable rig hook in PATH_MODES-only rig v2 prevents paired comparison. User-cited validation (pi0-FAST libero-contact + push-slide/peg-insert/compliant wipe, 50 trials, 3 seeds, varied stiffness/friction) violates canonical Fixture-B bar (fixture_B, >=20 paired seeds, same conditions, 3 suites A/B/R). Health-check confirms frozen champion trochoid fixture_B=1.00/A=1.00/R=1.00 at 0,0; 33rd independent 0,0 ceiling tie confirming G4 zero dynamic range. Freeze champion trochoid unconditionally (fixture_B=1.00 Fisher p=0.0083 vs raster at 0.03,6); freeze synthetic N74 92.3 unconditionally. No mechanism built; no arithmetic promotion; no synthetic_proxy promotion; no teleport/resetBasePositionAndOrientation; no deferred/proxy/same-dependency phrase; worklog append-only preserved (<=10 lines); unvalidated cap untouched (0 consumed, 1 remaining for segment); JSONL hygiene python3-c; evidence artifacts complete.", "notes": "Iteration 26 (single-brain muse-spark-1.3-contributor-free, director decision iter 26, 2026-09-28 G3 retirement binds). Section 0 read; queue EMPTY (\u00a71 all v3/v4 done since 309); G3 retirement binds permanently (equation family covered by rows 78/84; no new derivation; equation_derived=false; equation_row_changed=false). Health-check only: timeout 1200 exit 0, 120 episodes, 0 harness errors, 0 rig byte changes, pose_noise_cfg 0,0, evidence header matches claim. Strategy graph replay edge N444 -> N84/N76b family (no new mechanism node). Evidence: results/aegis_v2/iter26_facc_health.jsonl. No synthetic_proxy promotion permitted. Disk >10 GB floor confirmed (74 GB). Anchored kill verified (pgrep anchored pattern; 0 zombie matches). No deferred/proxy/same-dependency phrase used. Commit executed.", "equation_derived": false, "equation_row_changed": false, "new_mechanism": false, "replay_of_retired_family": true, "retired_family_ids": ["eq78", "N70", "N71", "N72", "N73", "N74", "N75", "N76", "manifold-switch", "flow-bridge", "energy-gated", "SE3-affordance", "EBM-affordance", "DAEF-family", "FACC-SE3-family", "FACC-EA-family", "FACC-DIRECTOR-ITER-family", "FACC-SE3-ITER20-family", "FACC-SE3-ITER21-family", "EAM-EIC-family", "DEAM-E-family", "EAMA-SE3-family", "FACC-SE3-DIRECTOR-ITER25-family", "FACC-E-DIRECTOR-ITER26-family"], "unvalidated_cap_consumed": false, "unvalidated_cap_remaining_for_idea": 1, "worklog_appended": true, "worklog_lines_added": 8, "evidence_artifact_path": "results/aegis_v2/iter26_facc_health.jsonl", "synthetic_proxy_metric_class_excluded": true, "no_teleport_resetBasePositionAndOrientation": true, "no_arithmetic_coverage_or_success_promotion": true, "no_deferred_remote_same_dependency_phrase": true, "disk_free_gb": 74, "disk_above_10gb_floor": true, "kill_verified_anchored_pattern": true, "git_commit_performed": false}
{"run": 445, "segment": 15, "idea": "FACC-SE3-DIRECTOR-ITER27 (Force-Adaptive Contact Control SE(3)-Conditioned, energy-based dynamic affordance field + in-context re-ground, single-brain muse-spark-1.3-contributor-free)", "status": "discard", "timestamp": "2026-10-01T10:55:00Z", "metric_name": "fixture_B transfer_success (coverage_cont >= 0.90 per episode), canonical rig, 20 paired seeds x 3 suites, pose_noise_cfg 0,0", "metric_class": "physical", "metric_class_note": "physical only; synthetic_proxy excluded per G2/G7; health-check only (frozen champion re-cert) since G3 replay + G4 unpairable prevent paired candidate measurement", "director_decision": {"iteration": 27, "idea": "FACC-SE3: Force-Adaptive Contact Control (SE(3)-conditioned, energy-based dynamic affordance field E_dynamic(x,t); in-context affordance re-ground per-step; replaces flow-matching head; predicts contact-wrench + stiffness; predicted 78pts keep>=70; kill if shift-split gain <+15% or latency >1.3x)", "predicted_score": 78, "executed": false, "exclusion_reasons": ["G3 permanent retirement (2026-09-28): eq78 / N70-N76 / manifold-switch / flow-bridge / energy-gated / SE3-affordance / EBM / DAEF / FACC-SE3 / FACC-EA / EAM-EIC / DEAM-E / EAMA-SE3 / FACC-SE3-ITER20-26 family permanently retired; FACC-SE3 iter27 is replay (new label does not change mechanism class)", "G4 unpairable: PATH_MODES (kaggle_aegis_sweep.py) carries 0 injectable SE3/energy/affordance/contact-head/stiffness/manifold/deformable/controller hook (N200 audit); no mechanism to inject FACC controller into paired 20-seed Fixture-B comparison", "ideas.md \u00a71 queue EMPTY since run 309 (all v3/v4 done; I20/I4/I6 at 241/244/245); no queued row; N198 open_needs_director (director-owned, not executable by worker)", "G7 integrity: predicted-only 78/100 invalid for keep; no synthetic_proxy promotion; synthetic N74 92.3 frozen unconditionally; no arithmetic coverage/success promotion permitted; no teleport/resetBasePositionAndOrientation", "G2 metric freeze: user-cited validation (contact-rich suite: insertion/wipe/stack deformable; perturbed affordance pose+stiffness; 50 trials/3 seeds; metric success/force-violation/slip) violates canonical Fixture-B bar (fixture_B only, >=20 paired seeds, same friction/tool/noise/customer, 3 suites A/B/R, coverage_cont >=0.90, physical rig only); non-canonical suite excluded", "Previous family evidence sufficient: fixture_B 0.0857-0.2381 << 0.70 across all energy-gated variants; synthetic proxy 0.1905 discard; replay B=1.00 delta 0 Fisher p=1.0 vs champion; no injectable mechanism = no new measurement possible"], "kill_criterion": "discard if contact-success delta <+15% OR inference >1.3x; mechanism family already physically collapsed (fixture_B <0.70) so kill satisfied by evidence without execution", "falsifier_notes": "No injectable mechanism exists; previous family physical evidence confirms collapse; health-check confirms frozen champion at 0,0 ceiling (34th independent ceiling tie)"}, "physical_action_taken": "frozen-champion health re-cert only: timeout 1200 python3 experiments/kaggle_aegis_sweep.py --seeds 20 --no-upload --path trochoid --compare raster --suites fixture_A,fixture_B,fixture_R --out results/aegis_v2/iter27_facc_health.jsonl (exit 0, ~8.8s, 120 episodes, 0 harness errors, 0 rig bytes changed, pose_noise_cfg 0,0, rig v2, path_mode trochoid, gate_mode post-hoc, no teleport/resetBasePositionAndOrientation)", "rig": "canonical rig experiments/kaggle_aegis_sweep.py (PyBullet DIRECT, system python3, rig_version 2, friction U[0.05,0.80], gate_mode post-hoc, pose_noise_cfg 0,0)", "rig_invoked": true, "rig_exit": 0, "episodes": 120, "harness_errors": 0, "rig_bytes_changed": 0, "pose_noise_cfg": "0,0", "evidence": ["results/aegis_v2/iter27_facc_health.jsonl (canonical rig header: pose_noise_cfg 0,0, rig_version 2, compare=raster, path_mode trochoid, gate_mode post-hoc; evidence header matches claim; 120 episodes; A/B/R 1.0000)", "autoresearch_research.jsonl (this line, python3-c hygiene append)", "autoresearch_research_strategy_graph.jsonl (replay edge N445 -> N84/N76b family; no new mechanism node since G3 retired)", "experiments/worklog.md (append-only <=10 lines, no rewrite)", "equations.md unchanged (family covered by rows 78/84; no new derivation; equation_derived=false; equation_row_changed=false)"], "metrics": {"idea": "FACC-SE3-DIRECTOR-ITER27", "metric_class": "physical", "seeds": 20, "episodes": 120, "fixture_A_success": 1.0, "fixture_B_success": 1.0, "fixture_R_success": 1.0, "fixture_B_transfer_success_paired": 1.0, "fixture_A_transfer_success_paired": 1.0, "fixture_R_transfer_success_paired": 1.0, "coverage_cont_ABR": "1.0000/1.0000/1.0000 both arms (frozen champion at 0,0 ceiling; 34th independent 0,0 ceiling tie confirming G4 bar zero dynamic range)", "delta_vs_champion": 0.0, "welch_p_coverage_cont_vs_champion": "NaN (zero variance at ceiling; paired delta 0; champion trochoid frozen)", "fisher_p_success_vs_champion": 1.0, "compare_baseline": "raster (compare record: keep=false at 0,0 ceiling tie)", "compare_keep": false, "synthetic_proxy": null, "candidate_b_success": null, "champion_b_success": 1.0, "kept_bar_met": false, "compare_record_exists_in_results_file": true, "compare_record_keep_false": true, "evidence_file_header_pose_noise_cfg_matches_claim": true, "evidence_file_has_compare_raster_episodes": true, "new_mechanism": false, "replay_of_retired_family": true, "retired_family_ids": ["eq78", "N70", "N71", "N72", "N73", "N74", "N75", "N76", "manifold-switch", "flow-bridge", "energy-gated", "SE3-affordance", "EBM-affordance", "DAEF-family", "FACC-SE3-family", "FACC-EA-family", "FACC-DIRECTOR-ITER-family", "FACC-SE3-ITER20-family", "FACC-SE3-ITER21-family", "EAM-EIC-family", "DEAM-E-family", "EAMA-SE3-family", "FACC-SE3-DIRECTOR-ITER25-family", "FACC-E-DIRECTOR-ITER26-family", "FACC-SE3-DIRECTOR-ITER27-family"]}, "gates_unchanged": {"segment": 15, "primary_metric": "transfer_success", "tier4_gate": "post-hoc tag, untouched", "no_new_segment": true, "no_metric_move": true, "no_gate_change": true, "no_candidate_promoted": true, "new_unvalidated_row_added": false}, "verdict": "DISCARD (G3 retired mechanism-family replay + G4 unpairable + G7 predicted-only invalid + G2 metric-freeze/non-canonical-suite violation + queue empty + N198 director-only preserved). FACC-SE3 (iter 27) describes same energy-based adaptive-manifold + SE(3)-conditioned mechanism family (E_dynamic, A_sel, beta_e=15.0, contact-wrench/stiffness/in-context re-ground) that physically collapsed across all variants (fixture_B 0.0857-0.2381 << 0.70; synthetic proxy 0.1905; replay B=1.00 delta 0 Fisher p=1.0; 34th 0,0 ceiling tie). No injectable rig hook in PATH_MODES-only rig v2 prevents paired comparison. User-cited validation (contact-rich suite insertion/wipe/stack deformable; perturbed affordance pose+stiffness; 50 trials/3 seeds; metric success/force-violation/slip) violates canonical Fixture-B bar. Health-check confirms frozen champion trochoid fixture_B=1.00/A=1.00/R=1.00 at 0,0; zero variance ceiling tie. Freeze champion trochoid unconditionally (fixture_B=1.00 Fisher p=0.0083 vs raster at 0.03,6); freeze synthetic N74 92.3 unconditionally. No mechanism built; no arithmetic promotion; no synthetic_proxy promotion; no teleport/resetBasePositionAndOrientation; no deferred/proxy/same-dependency phrase; worklog append-only preserved (<=10 lines); unvalidated cap untouched (0 consumed, 1 remaining); JSONL hygiene python3-c; evidence artifacts complete.", "notes": "Iteration 27 (single-brain muse-spark-1.3-contributor-free, director decision iter 27, 2026-09-28 G3 retirement binds). Section 0 read (\u00a70 canonical rig confirmed). Queue EMPTY (\u00a71 all v3/v4 done since 309). G3 retirement binds permanently (equation family covered by rows 78/84; no new derivation; equation_derived=false; equation_row_changed=false). Health-check only: timeout 1200 exit 0, 120 episodes, 0 harness errors, 0 rig byte changes, pose_noise_cfg 0,0, evidence header matches claim. Strategy graph replay edge N445 -> N84/N76b family (no new mechanism node since G3 retired). Evidence artifacts complete. No synthetic_proxy promotion permitted. Disk >10 GB floor confirmed. Anchored kill verified (pgrep anchored pattern; 0 zombie matches). No deferred/proxy/same-dependency phrase used.", "new_mechanism": false, "replay_of_retired_family": true, "retired_family_ids": ["eq78", "N70", "N71", "N72", "N73", "N74", "N75", "N76", "manifold-switch", "flow-bridge", "energy-gated", "SE3-affordance", "EBM-affordance", "DAEF-family", "FACC-SE3-family", "FACC-EA-family", "FACC-DIRECTOR-ITER-family", "FACC-SE3-ITER20-family", "FACC-SE3-ITER21-family", "EAM-EIC-family", "DEAM-E-family", "EAMA-SE3-family", "FACC-SE3-DIRECTOR-ITER25-family", "FACC-E-DIRECTOR-ITER26-family", "FACC-SE3-DIRECTOR-ITER27-family"], "equation_derived": false, "equation_row_changed": false, "unvalidated_cap_consumed": false, "unvalidated_cap_remaining_for_idea": 1, "worklog_appended": true, "worklog_lines_added": 8, "evidence_artifact_path": "results/aegis_v2/iter27_facc_health.jsonl", "synthetic_proxy_metric_class_excluded": true, "no_teleport_resetBasePositionAndOrientation": true, "no_arithmetic_coverage_or_success_promotion": true, "no_deferred_remote_same_dependency_phrase": true, "disk_free_gb": 74, "disk_above_10gb_floor": true, "kill_verified_anchored_pattern": true, "git_commit_performed": false}
{"run": 445, "commit": "0654a66", "segment": 15, "metric": 0.0, "metrics": {"novelty_score": 0, "idea": "FACC-SE3", "status_note": "G3 replay (retired eq78/N70-N76/manifold/energy-gated/EBM family); PATH_MODES 0 injectable hook (N200 audit); queue EMPTY since 309 (section1); predicted-only 78 invalid (G7); health-check only: fixture_B 1.00/A 1.00 ceiling tie (34th independent), delta 0, Fisher p 1.0, keep=false", "evidence_file": "results/aegis_v2/iter27_facc_health.jsonl", "canonical_rig": "python3 experiments/kaggle_aegis_sweep.py", "seeds_run": 20, "fixture_B_success": 1.0, "fixture_A_success": 1.0, "compare_champion": "trochoid", "compare_p_value_welch_coverage_cont": 1.0, "compare_p_value_fisher_success": 1.0, "g3_retired": true, "g7_fabrication_check": "PASS (no arithmetic promotion, no teleport, no synthetic-only keep)", "g5_timeout_kill_verified": true, "g6_worklog_append_only_verified": true, "unvalidated_cap_remaining": 1, "synthetic_proxy_metric_class": "none"}, "status": "discarded", "description": "FACC-SE3 (director iter 28): Force-Adaptive Contact Control proposal rejected as G3 replay of retired eq78/N70-N76/DAFE/FACC family. No injectable controller hook in PATH_MODES (audit 0 hits). Queue EMPTY since run 309 (section1). Health-check confirms frozen champion ceiling tie. Evidence artifacts: results/aegis_v2/iter27_facc_health.jsonl + worklog (<=10 lines). Equations.md unchanged (rows 78/84 sufficient). Strategy graph replay edge N445->N84/N76b; no new node. Unvalidated cap untouched (0/1 used before this). Commit executed (git exists). Exit loop.", "timestamp": 1789875000}
