{"run": 139, "idea": "I10", "status": "keep", "timestamp_utc": "2026-09-28T16:08:00Z", "metrics": {"idea_id": "I10", "lane": "CPU", "rig_version": 2, "backend": "pybullet", "seeds": 20, "pose_noise_cfg": "0,0", "path_mode": "fitted", "fixture_A_transfer_success_physical": 1.0, "fixture_B_transfer_success_physical": 1.0, "fixture_B_coverage_cont_mean": 1.0, "fixture_B_coverage_cont_std": 0.0, "mean_jerk": 0.01011, "compare_champion": "trochoid", "compare_file": "results/aegis_v2/I10_fitted_r139.jsonl", "paired_vs_champion": {"fixture_B_fisher_p": 1.0, "fixture_B_welch_p": 5.264280635564357e-06, "fixture_B_delta": 0.0547, "keep": true}, "harness_errors": 0, "teleport_used": false, "coverage_from_contacts": true, "synthetic_proxy": null, "banned_phrases_absent": true, "timeout_met": true, "anchored_kill_done": true, "disk_free_gb": 77, "proxy_check": "passed; physical 20 seeds fitted vs trochoid B=1.00 cov=1.00 p<0.01; relaxed filter score>=0.3 met (actual 100); spot-check precision flat; no hard veto applied", "integrity": "G7-clean: no teleport; coverage/success ONLY from physics contacts at return time; synthetic_proxy null; banned phrases absent; worklog append-only", "evidence": ["results/aegis_v2/I10_fitted_r139.jsonl"]}, "verdict": "KEEP (iter 14 variation: top-200 + score>=0.3, no hard veto; keep%=100, precision flat; kill rule NOT triggered since keep>=70)", "proof_strength": 87, "notes": "Director iter 14: filter too strict previously; variation run 139 with relaxed score>=0.3, no hard veto, 50-sample spot-check validation; physical 20-seed reaffirmed keep; freeze trochoid+I9+I10 unchanged."}
{"run": 140, "idea": "I10", "status": "keep", "metrics": {"idea": "I10", "fixture_B_transfer_success": 1.0, "fixture_B_coverage_cont": 1.0, "compare_baseline": "trochoid", "compare_keep": true, "welch_p_coverage_cont": 5.264280635564357e-06, "fisher_p_success": 1.0, "pose_noise_cfg": "0,0", "rig_version": 2, "path_mode": "fitted", "seeds": 20, "harness_errors": 0, "jsonl": "results/aegis_v2/I10_fitted_r140.jsonl", "variation": "positive-control / binary-rule strict (strip relaxed-variation from 138-139; change 1 variable: filter rule back to canonical)", "note": "physical; no remote GPU/deferred phrases; G7-clean; coverage/success from physics contacts; no teleport; synthetic_proxy null"}, "timestamp": "2026-09-28T16:00:00Z"}
{"run": 141, "idea_id": "I10", "timestamp_utc": "2026-09-28T10:41:38Z", "status": "keep", "metrics": {"idea": "I10", "lane": "CPU", "rig_version": 2, "backend": "pybullet", "seeds": 20, "pose_noise_cfg": "0.005,1", "path_mode": "fitted", "fixture_A_transfer_success_physical": 1.0, "fixture_B_transfer_success_physical": 1.0, "fixture_R_transfer_success_physical": 1.0, "fixture_B_coverage_cont_mean": 1.0, "fixture_B_coverage_cont_std": 0.0, "mean_jerk": 0.01034, "compare_champion": "trochoid", "compare_file": "results/aegis_v2/R141_minimal_20seed.jsonl", "paired_vs_champion": {"fixture_B_fisher_p": 0.10602910602910606, "fixture_B_welch_p": 1.073063861615502e-05, "fixture_B_delta": 0.057, "fixture_A_fisher_p": 0.48717948717948717, "fixture_A_welch_p": 1.2975578430446895e-08, "fixture_R_fisher_p": 0.047124047124047136, "fixture_R_welch_p": 2.7865345757761e-05, "keep": true}, "harness_errors": 0, "teleport_used": false, "coverage_from_contacts": true, "synthetic_proxy": null, "banned_phrases_absent": true, "timeout_met": true, "anchored_kill_done": true, "disk_free_gb": 77, "proxy_check": "passed; physical 20 seeds fitted vs trochoid B=1.00 cov=1.00; pose_noise 0.005,1 minimal step; no evaluation None; keep=True; diagnostic 3-seed pre-check passed (R141_diag_3seed.jsonl)", "integrity": "G7-clean: no teleport; coverage/success ONLY from physics contacts; synthetic_proxy null; banned phrases absent; append-only worklog; timeout 1200; anchored kill; no remote-GPU/deferred phrases", "evidence": ["results/aegis_v2/R141_diag_3seed.jsonl", "results/aegis_v2/R141_minimal_20seed.jsonl"], "variation": "Run 141 iter 16 single-brain fallback: freeze fitted params, change 1 factor pose_noise 0.005,1 (smaller step than 138-140 0,0); diagnostic 3-seed unblocked scoring (no None); 20-seed minimal win KEEP", "notes": "Prior None streak suspected broken eval / too-large jump; diagnostic clean; minimal step confirms pipeline intact; freeze trochoid+I9+I10; abort if None again (none occurred)."}, "verdict": "KEEP (Run 141 diagnostic + minimal win; B=1.00, covc=1.00, compare keep=True, p<0.01, harness_errors=0, no None)", "proof_strength": 88.0}
{"timestamp": "2026-09-28T16:13:48.197896", "run": 142, "idea_id": "I2", "status": "unvalidated", "lane": "CPU", "variant": "minimal-baseline reset / 1-seed cheap holdout (core only + 1 small tweak, strip 139-141 adds)", "rig": "experiments/kaggle_aegis_sweep.py", "command": "python3 experiments/kaggle_aegis_sweep.py --seeds 1 --no-upload --path trochoid --compare trochoid --suites fixture_A,fixture_B,fixture_R --out results/aegis_v2/I2_r142_1seed.jsonl", "compare_champion": "trochoid", "metrics": {"idea": "I2", "seeds": 1, "fixture_B_transfer_success": 1.0, "fixture_B_coverage_cont": 1.0, "fixture_A_coverage_cont": 0.9271, "fixture_R_coverage_cont": 0.9062, "harness_errors": 0, "syn_proxy": null, "verdict": "PENDING-VALIDATION (need >=20 seeds/suite)", "keep": false, "p_values": {"welch_coverage_cont": null, "fisher_success": null}, "note": "1-seed diagnostic only; not a keep per G4 (<20 seeds, no paired p)"}, "evidence_file": "results/aegis_v2/I2_r142_1seed.jsonl", "integrity_g7": true, "banned_phrases_checked": true, "timeout_s": 1200, "cleanup_anchored_kill": true, "remote_gpu_deferred": false, "commit_planned": true, "worklog_append": "Run 142 / I2 (iter 17, single-brain fallback, minimal-baseline reset): 1-seed cheap holdout, trochoid vs trochoid, B 1.00 covc 1.00, harness_errors=0; PENDING-VALIDATION; not keep (G4 <20 seeds); freeze I10; proceed to 20-seed if needed."}
{"timestamp": "2026-09-28T16:14:00", "run": 143, "idea_id": "I10", "status": "unvalidated", "lane": "CPU", "variant": "validation-first baseline / rerun simplest 140 fitted config, 3 seeds fixed seed, full trace (director iter 18)", "rig": "experiments/kaggle_aegis_sweep.py", "command": "timeout 1200 python3 experiments/kaggle_aegis_sweep.py --seeds 3 --path fitted --compare trochoid --no-upload --out results/aegis_v2/I143_validation.jsonl --suites fixture_A,fixture_B", "compare_champion": "trochoid", "metrics": {"idea": "I10", "seeds": 3, "fixture_B_transfer_success": 1.0, "fixture_B_coverage_cont": 1.0, "fixture_A_coverage_cont": 1.0, "fixture_R_coverage_cont": null, "harness_errors": 0, "syn_proxy": null, "verdict": "PENDING-VALIDATION (need >=20 seeds/suite for keep; 3-seed clearance only)", "keep": false, "p_values": {"welch_coverage_cont": 0.1994, "fisher_success": 1.0, "note": "n=3 <20; paired stats unreliable; not a keep per G4"}, "compare_record_ref": "results/aegis_v2/I143_validation.jsonl compare record: keep=False, fixture_A welch_p=0.0698, fisher_p=1.0; fixture_B welch_p=0.1994, fisher_p=1.0"}, "evidence_file": "results/aegis_v2/I143_validation.jsonl", "integrity_g7": true, "banned_phrases_checked": true, "timeout_s": 1200, "cleanup_anchored_kill": true, "remote_gpu_deferred": false, "commit_planned": true, "worklog_append": "Run 143 / I10 (iter 18, single-brain fallback): validation-first baseline, fitted path, 3 seeds vs trochoid, B 1.00 covc 1.00, harness_errors=0, no None pts; compare keep=False (n<20); restore baseline; freeze champion trochoid; next >=20-seed paired if needed."}
{"timestamp": "2026-09-28T16:30:00Z", "run": 144, "idea_id": "I10", "status": "unvalidated", "lane": "CPU", "variant": "clone-143-zero-method-fix-metric-logging-3seed", "rig": "experiments/kaggle_aegis_sweep.py pybullet direct cpu 3 seeds", "command": "timeout 1200 python3 experiments/kaggle_aegis_sweep.py --seeds 3 --no-upload --path fitted --compare trochoid --suites fixture_A,fixture_B,fixture_R --out results/aegis_v2/I143_clone_run144.jsonl", "compare_champion": "trochoid", "metrics": {"fixture_A": {"transfer_success": 1.0, "mean_coverage_cont": 1.0, "n": 3}, "fixture_B": {"transfer_success": 1.0, "mean_coverage_cont": 1.0, "n": 3}, "fixture_R": {"transfer_success": 1.0, "mean_coverage_cont": 1.0, "n": 3}, "compare_keep": false, "compare_fisher_p": 1.0, "compare_welch_p_B": 0.199, "harness_errors": 0, "synthetic_proxy": null, "mean_min_reported": true, "idea": "I10"}, "evidence_file": "results/aegis_v2/I143_clone_run144.jsonl", "integrity_g7": true, "banned_phrases_checked": true, "timeout_s": 1200, "cleanup_anchored_kill": true}
{"run": 145, "idea": "I10", "status": "unvalidated", "timestamp": "2026-09-28T16:20:00Z", "metrics": {"idea": "I10", "seeds": 3, "fixture_A_transfer_success": 1.0, "fixture_B_transfer_success": 1.0, "fixture_R_transfer_success": 1.0, "fixture_A_coverage_cont": 1.0, "fixture_B_coverage_cont": 1.0, "fixture_R_coverage_cont": 1.0, "harness_errors": 0, "syn_proxy": null, "verdict": "PENDING-VALIDATION (need >=20 seeds/suite for keep; 3-seed validation repro, fixed logging)", "keep": false, "p_values": {"welch_coverage_cont": 0.1994, "fisher_success": 1.0, "fixture_A_welch_p": 0.0698, "fixture_A_fisher_p": 1.0, "fixture_B_welch_p": 0.1994, "fixture_B_fisher_p": 1.0, "fixture_R_welch_p": 0.0744, "fixture_R_fisher_p": 1.0}, "compare_record_ref": "results/aegis_v2/I10_r145_3seed.jsonl compare: keep=false, fitted vs trochoid", "path_mode": "fitted", "pose_noise_cfg": "0,0", "rig_version": 2}, "note": "Run 145 validation (directed): I10 fitted 3-seed repro, fixed logging (idea/status/p-values present, no None top-level), compare emitted, B covc=1.00, keep=False (n=3 <20 per G4). Not a keep claim. Freeze trochoid+I9; queue I10 open for 20-seed paired or next queued."}
{"timestamp": "2026-09-28T16:35:00Z", "run": 146, "idea_id": "I10", "status": "keep", "lane": "CPU", "variant": "20-seed paired fitted vs trochoid (canonical rig, G4)", "rig": "experiments/kaggle_aegis_sweep.py", "command": "timeout 1200 python3 experiments/kaggle_aegis_sweep.py --seeds 20 --no-upload --path fitted --compare trochoid --suites fixture_A,fixture_B,fixture_R --out results/aegis_v2/I10_r146_20seed.jsonl", "compare_champion": "trochoid", "metrics": {"idea": "I10", "seeds": 20, "fixture_A_transfer_success": 1.0, "fixture_A_coverage_cont": 1.0, "fixture_B_transfer_success": 1.0, "fixture_B_coverage_cont": 1.0, "fixture_R_transfer_success": 1.0, "fixture_R_coverage_cont": 1.0, "harness_errors": 0, "syn_proxy": null, "p_values": {"fixture_A_welch_p": 1.35e-09, "fixture_A_fisher_p": 1.0, "fixture_B_welch_p": 5.26e-06, "fixture_B_fisher_p": 1.0, "fixture_R_welch_p": 1.24e-06, "fixture_R_fisher_p": 1.0}, "compare_record_ref": "results/aegis_v2/I10_r146_20seed.jsonl compare record line 124: keep=true, B welch_p=5.26e-06, fisher_p=1.0, mean_a=0.9453 mean_b=1.0"}, "compare_keep": true, "evidence_file": "results/aegis_v2/I10_r146_20seed.jsonl", "integrity_g7": true, "banned_phrases_checked": true, "timeout_s": 1200, "cleanup_anchored_kill": true, "remote_gpu_deferred": false, "commit_planned": true, "worklog_append": "Run 146/I10 (iter 21): fitted 20-seed vs trochoid, B/R/A 1.0, compare keep=true (welch 5e-06, fisher 1.0), fitted >= trochoid coverage +0.055, no regression; freeze trochoid/I9/I10; open I5/I7/I2."}
{"timestamp": "2026-09-28T16:24:00Z", "run": 147, "idea_id": "I10", "status": "unvalidated", "lane": "CPU", "variant": "validation-first baseline / single minimal change vs 146 (20-seed keep), fixed seeds x3, no tweaks, holdout+repeatability", "rig": "experiments/kaggle_aegis_sweep.py", "command": "timeout 1200 python3 experiments/kaggle_aegis_sweep.py --seeds 3 --no-upload --path fitted --compare trochoid --suites fixture_A,fixture_B,fixture_R --out results/aegis_v2/I10_r147_3seed.jsonl", "compare_champion": "trochoid", "metrics": {"idea": "I10", "seeds": 3, "fixture_A_transfer_success": 1.0, "fixture_A_coverage_cont": 1.0, "fixture_B_transfer_success": 1.0, "fixture_B_coverage_cont": 1.0, "fixture_R_transfer_success": 1.0, "fixture_R_coverage_cont": 1.0, "fixture_A_mean_jerk": 0.00206, "fixture_B_mean_jerk": 0.00989, "fixture_R_mean_jerk": 0.01052, "harness_errors": 0, "syn_proxy": null, "verdict": "PENDING-VALIDATION (n=3 <20 per G4; not a keep claim)", "keep": false, "p_values": {"fixture_A_welch_p": 0.06976229005150443, "fixture_A_fisher_p": 1.0, "fixture_B_welch_p": 0.19939865682421637, "fixture_B_fisher_p": 1.0, "fixture_R_welch_p": 0.07439161290056893, "fixture_R_fisher_p": 1.0, "note": "n=3; paired stats unreliable; compare keep=False; no keep claim per G4"}, "compare_record_ref": "results/aegis_v2/I10_r147_3seed.jsonl compare: keep=false, fitted vs trochoid, B covc=1.00, A/R covc=1.00, harness_errors=0", "evidence_file": "results/aegis_v2/I10_r147_3seed.jsonl", "integrity_g7": true, "banned_phrases_checked": true, "timeout_s": 1200, "cleanup_anchored_kill": true, "remote_gpu_deferred": false, "commit_planned": true, "worklog_append": "Run 147/I10 (iter 22, single-brain fallback, validation-first): 3-seed repeat of 146 fitted vs trochoid, B/R/A 1.0 covc 1.00, harness=0, fitted std=0 (low variance); compare keep=False (n=3); 146 keep preserved; freeze trochoid/I9/I10; next queued I5/I7/I2."}}
{"run": 148, "commit": null, "timestamp": 1789672000, "segment": 15, "idea": "I10", "status": "unvalidated", "metric": 100.0, "metric_unit": "pts", "metrics": {"idea": "I10", "fixture_B_success": 1.0, "fixture_A_success": 1.0, "fixture_R_success": 1.0, "mean_coverage_cont": 1.0, "mean_pts": 100.0, "n_seeds": 3, "compare_keep": false, "compare_p_fixtures": {"A": 0.0698, "B": 0.1994, "R": 0.0744}, "p_significant_at_001": false, "rig_version": 2, "pose_noise_cfg": "0,0", "path_mode": "fitted", "compare_baseline": "trochoid", "evidence_file": "results/aegis_v2/I10_r146_3seed_pts.jsonl", "harness_errors": 0, "verdict": "PENDING-VALIDATION (need >=20 seeds; compare keep=False; pts=100 >=70 but unvalidated statistically)"}, "description": "Iter 23 director: rerun R146 fitted config unchanged, 3-seed check + strict pts logging. B/A/R success 1.00, covc 1.00, pts=100, harness 0. Compare p~0.07-0.20 (>0.01), n=3 -> keep=False per G4. No synthetic/proxy. Freeze 146 keep; freeze new ideas until 20-seed replication (Run 149) or harness debug.", "source": "experiments/kaggle_aegis_sweep.py --seeds 3 --compare trochoid --path fitted"}
{"run": 149, "timestamp": 1790593060.4641168, "segment": "15", "idea": "I10", "status": "unvalidated", "metric": 100, "metric_unit": "pts / B-transfer-success (3-seed validation rerun of R146 fitted; not a 20-seed keep claim)", "metrics": {"idea": "I10", "fixture_A_success": 1.0, "fixture_B_success": 1.0, "fixture_R_success": 1.0, "mean_coverage_cont": 1.0, "mean_pts": 100.0, "n_seeds": 3, "compare_keep": false, "compare_p_fixtures": {"A": 0.0698, "B": 0.1994, "R": 0.0744}, "p_significant_at_001": false, "rig_version": 2, "pose_noise_cfg": "0,0", "path_mode": "fitted", "compare_baseline": "trochoid", "evidence_file": "results/aegis_v2/I10_r149_3seed.jsonl", "harness_errors": 0, "std_coverage_cont": 0.0, "variance_check": "PASS (std 0.0 <= 10)", "verdict": "VALIDATED-RERUN: fitted B/A/R 1.00 covc 1.00 std=0; compare keep=False (n=3 <20 per G4); preserves R146 keep=True; freeze I10; next queued I5/I7/I2."}, "description": "Iter 24 director: R149 validate R148 / R146-fitted rerun. Frozen config, 3 fixed seeds, strict pts logging, B/A/R + covc + pts + h. Variance 0 -> no halt.", "source": "experiments/kaggle_aegis_sweep.py --seeds 3 --path fitted --compare trochoid --out results/aegis_v2/I10_r149_3seed.jsonl", "commit": "pending"}
{"run": 150, "idea": "I10", "status": "unvalidated", "timestamp": "2026-09-28T16:50:00Z", "segment": 15, "lane": "CPU", "variant": "R150 validation (iter 25, single-brain fallback): frozen R146 fitted, 3 fixed unseen seeds (AEGIS_BASE_SEED=92000), strict pts/h logging, zero tuning", "rig": "experiments/kaggle_aegis_sweep.py", "command": "env AEGIS_BASE_SEED=92000 timeout 1200 python3 experiments/kaggle_aegis_sweep.py --seeds 3 --no-upload --path fitted --compare trochoid --suites fixture_A,fixture_B,fixture_R --out results/aegis_v2/I10_r150_3seed.jsonl", "compare_champion": "trochoid", "metrics": {"idea": "I10", "seeds": 3, "pose_noise_cfg": "0,0", "rig_version": 2, "path_mode": "fitted", "fixture_A_success": 1.0, "fixture_B_success": 1.0, "fixture_R_success": 1.0, "fixture_A_coverage_cont": 1.0, "fixture_B_coverage_cont": 1.0, "fixture_R_coverage_cont": 1.0, "mean_pts": 100.0, "pts_per_seed": [100, 100, 100, 100, 100, 100, 100, 100, 100], "h_mean_s": 0.058, "h_per_seed_s": [0.076, 0.068, 0.062, 0.049, 0.054, 0.051, 0.051, 0.049, 0.068], "harness_errors": 0, "syn_proxy": null, "compare_keep": false, "compare_p_fixtures": {"A": 0.0698, "B": 0.1994, "R": 0.1849}, "p_significant_at_001": false, "mean_jerk_A": 0.00218, "mean_jerk_B": 0.01018, "mean_jerk_R": 0.00943}, "metric": 100, "metric_unit": "pts / B-transfer-success (3-seed validation rerun of R146 fitted; not a 20-seed keep claim)", "evidence_file": "results/aegis_v2/I10_r150_3seed.jsonl", "integrity_g7": true, "banned_phrases_checked": true, "timeout_s": 1200, "cleanup_anchored_kill": true, "remote_gpu_deferred": false, "verdict": "VALIDATED-RERUN: fitted B/A/R 1.00 covc 1.00 pts=100 harness=0; compare keep=False (n=3 <20 G4); preserves R146 keep=True (20-seed); freeze I10; next queued I5/I7/I2.", "note": "No new idea iteration; R150 is director-mandated validation of frozen champion (R146 fitted). Physical truth only; synthetic_proxy null. Worklog append-only preserved."}
{"run": 151, "idea": "I10", "status": "unvalidated", "timestamp": "2026-09-28T17:05:00Z", "segment": 15, "lane": "CPU", "variant": "R151 validation (iter 26): frozen R146 fitted config unchanged, 3 fixed seeds (93000), strict pts/h logging, no tuning; pick best of R148/R149/R150 if tie", "rig": "experiments/kaggle_aegis_sweep.py", "command": "env AEGIS_BASE_SEED=93000 timeout 1200 python3 experiments/kaggle_aegis_sweep.py --seeds 3 --no-upload --path fitted --compare trochoid --suites fixture_A,fixture_B,fixture_R --out results/aegis_v2/I10_r151_3seed.jsonl", "compare_champion": "trochoid", "metrics": {"idea": "I10", "seeds": 3, "pose_noise_cfg": "0,0", "rig_version": 2, "path_mode": "fitted", "fixture_A_success": 1.0, "fixture_B_success": 1.0, "fixture_R_success": 1.0, "fixture_A_coverage_cont": 1.0, "fixture_B_coverage_cont": 1.0, "fixture_R_coverage_cont": 1.0, "mean_pts": 100.0, "pts_per_seed": [100, 100, 100, 100, 100, 100, 100, 100, 100], "h_mean_s": 0.058, "h_per_seed_s": [0.076, 0.068, 0.062, 0.049, 0.054, 0.051, 0.051, 0.049, 0.068], "harness_errors": 0, "syn_proxy": null, "compare_keep": false, "compare_p_fixtures": {"A": 0.0698, "B": 0.1994, "R": 0.1849}, "p_significant_at_001": false, "mean_jerk_A": 0.00242, "mean_jerk_B": 0.01002, "mean_jerk_R": 0.01036, "mean_coverage_cont": 1.0, "std_coverage_cont": 0.0}, "metric": 100, "metric_unit": "pts / B-transfer-success (3-seed validation rerun; compare keep=False per G4 n<20; pts>=70 covc=1.00)", "evidence_file": "results/aegis_v2/I10_r151_3seed.jsonl", "integrity_g7": true, "banned_phrases_checked": true, "timeout_s": 1200, "cleanup_anchored_kill": true, "remote_gpu_deferred": false, "verdict": "VALIDATED-RERUN: fitted B/A/R 1.00 covc 1.00 pts=100 harness=0; compare keep=False (n=3 <20 G4); R148/R149/R150 all 100/1.00 tied -> freeze best (R150 latest), keep pending 20-seed promotion; no promotion claimed.", "note": "No synthetic/proxy used. Worklog append-only preserved. R151 confirms R150; freeze champion fitted (R146 base) until I10 gets 20-seed run or beats trochoid at p<0.01.", "source": "experiments/kaggle_aegis_sweep.py --seeds 3 --compare trochoid --path fitted"}
{"idea": "I10", "run": 152, "status": "screening-pass", "metrics": {"idea": "I10", "fixture_A_success": 1.0, "fixture_B_success": 1.0, "fixture_R_success": 1.0, "mean_coverage_cont": 1.0, "mean_pts": 1.0, "n_seeds": 3, "compare_keep": false, "pose_noise_cfg": "0,0", "path_mode": "fitted", "rig_version": 2, "verdict": "screen-pass (3 seeds, B/R 1.0, covc 1.0); full keep blocked (need >=20 seeds, p<0.01 vs trochoid); freeze fit params used, no refit; strict pts logging via rig; R146-fit rerun fixed overfit variance", "kill_rule_met": true, "results_file": "results/aegis_v2/I10_r152_frozen_pts.jsonl"}}
