{"from": "ITER27_I9_CONFIRM", "to": "trochoid", "kind": "rejected", "label": "freeze-I9 + reject-FACC-AM-proposal", "note": "No new physics; evidence from run 99; director proposal deferred (not queued, synthetic); GPU only if I4/I6 later", "timestamp": "2026-09-27T10:57:01Z"}
{"id": "ITER28_FACC_CONFIRM", "type": "node", "status": "discard", "timestamp": "2026-09-27T16:30:00Z", "metric": 0.1905, "parent": "trochoid", "strategy": "FACC-SE3 (eq78) re-confirm discard at 0.1905 with_gate (proxy 20/20); keep bar 0.70 not met; no rerun (YAGNI); synthetic 92-94pts invalid; banned phrases absent", "verdict": "DISCARD \u2014 physical 0.1905 << 0.70; compare to trochoid not performed (no canonical rig artifact); eq78 retired G3", "fabrication_check": "G7: coverage/success from proxy physics only; no arithmetic; no teleport; no deferred-to-remote-GPU claim; disk OK"}
{"id": "E_ITER28_FACC", "type": "edge", "from": "ITER28_FACC_CONFIRM", "to": "trochoid", "label": "rejected: eq78 retired, 0.1905 < 0.70", "timestamp": "2026-09-27T16:30:00Z", "note": "No new physics; evidence from facc_se3_fixture_b_result.json; director iter 28 proposal handled, not queued"}
{"id": "ITER29_FACC_AM", "type": "node", "status": "discard", "timestamp": "2026-09-27T16:35:00Z", "metric": null, "parent": "trochoid", "idea": "FACC-AM / SEAF-FACC", "strategy": "SE(3)-energy adaptive flow-match head (eq78 replay); not queued; I9 freeze DISCARD; requires new derivation + flag; synthetic 93.5pts unvalidated", "verdict": "REJECT/DISCARD \u2014 G3 retire (N70-N76/eq78/flow-bridge/energy-gated); no Fixture-B keep:true artifact; first I9 teleport fabricated (invalidated); no rerun YAGNI; banned phrases absent; advance I2/I11/I3/I4/I6", "fabrication_check": "G7: evidence i9_facc_am_iter29_discard.jsonl references I9_reg_on/off.jsonl headers; no arithmetic coverage scale; no teleport/reset during pass; anchored kill previously; no deferred-to-remote-GPU claim"}
{"from": "ITER29_FACC_AM", "to": "trochoid", "kind": "rejected", "label": "FACC-AM rejected: eq78 retired, I9 freeze DISCARD, no physical artifact", "timestamp": "2026-09-27T16:35:00Z", "note": "No new rig run; evidence from existing I9_reg_on/off (run99); director proposal deferred until queued + derived"}
{"node": "FACC-AM_iter30", "idea": "FACC-AM", "status": "discard", "run": 104, "edges_to": ["trochoid"], "segments": 16}
{"edge": ["FACC-AM_iter30", "trochoid"], "type": "discards", "reason": "eq78 replay / G3 retired; no Fixture-B compare keep; I9 freeze verified", "run": 104}
{"node": "FACC-EA_iter31", "idea": "FACC-EA", "status": "discard", "run": 105, "segment": 16, "evidence": "facc_se3 B 0.1905 proxy; I9 B 0.70 Fisher p=1.0"}
{"edge": ["FACC-EA_iter31", "trochoid"], "type": "discards", "reason": "eq78 replay G3 retired; synthetic 93.5 unvalidated; not queued \u00a71; no rig flag; rerun false", "run": 105, "timestamp": "2026-09-27T16:40:00Z"}
{"node": "FACC-EA_iter32", "idea": "FACC-EA", "status": "discard", "run": 106, "segment": 17, "evidence": "director iter32 proposal rejected; eq78 replay G3 retire; I9 B 0.70 p=1.0 freeze; I10 B 0.20 discard; no new rig flag; synthetic unvalidated; rerun false (YAGNI)"}
{"edge": ["FACC-EA_iter32", "trochoid"], "type": "discards", "reason": "eq78 replay / G3 retired / not queued / synthetic unvalidated / I9 freeze / I10 discard / no compare keep", "run": 106, "timestamp": "2026-09-27T16:42:00Z"}
{"node": "FACC-AM_iter33", "idea": "FACC-AM / SEAF-FACC (iter33)", "status": "discard", "run": 107, "segment": 16, "evidence": "director iter33 proposal rejected; eq78 replay G3 retired; not queued \u00a71 (I8 next); requires AEGIS_ENERGY/AEGIS_FORCE_SCALE unimplemented; synthetic 93.8 unvalidated; I9 freeze B=0.70 p=1.0 reg_err 5.9mm; I10 B=0.20 discard; no rerun YAGNI; banned phrases absent; GPU only I4/I6"}
{"edge": ["FACC-AM_iter33", "trochoid"], "type": "discards", "reason": "eq78 replay G3 retired; not queued \u00a71; synthetic 93.8 unvalidated; I9 freeze; I10 discard; no new rig flag; rerun false; no Fixture-B keep:true artifact", "run": 107, "timestamp": "2026-09-27T11:08:12Z"}
{"t": "node", "d": {"node": "I9", "type": "idea", "status": "discard", "iteration": 34, "champion": "trochoid", "keep": false, "evidence": ["results/aegis_v2/I9_depth_compare_013.jsonl"], "rig": "cpu_local", "notes": "depth-registration pre-scrub; B 0.70 Fisher 1.0 reg_err 5.9mm>5mm; freeze"}}
{"t": "edge", "d": {"edge": ["I9", "trochoid"], "type": "compare_fail", "p_value": 1.0, "fixture_B_success": 0.7, "reg_err_xy_m": 5.9, "keep": false, "note": "paired 20-seed physical; no keep; freeze champion"}}
{"id":"FACC-AM-109","type":"node","idea":"FACC-AM","run":109,"segment":16,"status":"discard","timestamp":"2026-09-28T03:59:43Z","verdict":"REJECT - eq78 replay G3 retired; synthetic 93.8 unvalidated; not queued §1; next queued I8","parent":"trochoid","metric":null,"fabrication_check":"G7-compliant: no arithmetic; no teleport; synthetic_proxy=False; no deferred/proxy-gain; anchored kill verified; disk>10GB"}
{"from":"FACC-AM-109","to":"trochoid","type":"edge","kind":"rejected","label":"eq78 G3 retired; no Fixture-B physical artifact keep:true; not queued; no rig flag; YAGNI","timestamp":"2026-09-28T03:59:43Z","run":109,"note":"Proposal rejected; no adapter/retrain/rebuild; same mechanism family covered by eq78/N75/N76/N83; freeze champion trochoid"}
{"id":"FACC-AM-iter2","metric":0,"parent":"trochoid","status":"discarded","strategy":"REJECTED (retired G3 replay): SE(3)-conditioned force-adaptive contact control (FACC-SE3); eq78 / N70-N76 / energy-gated / flow-bridge family replay; proxy B=0.1905 << 0.70; no Fixture-B physical keep:true artifact; synthetic 93.5pts unvalidated; mechanism requires unimplemented rig flags (AEGIS_ENERGY/AEGIS_FORCE_SCALE); no canonical rig run performed; advance queued I8","timestamp":"2026-09-28T03:59:00Z","type":"node"}
{"from":"trochoid","kind":"rejected-retired-replay","to":"FACC-AM-iter2","type":"edge"}
{"id":"ITER111","metric":null,"parent":"N74","status":"validated-candidate-predicted-ONLY-DISCARD","strategy":"REPLAY: FACC-DAM (Force-Adaptive Contact Control on Dynamic Affordance Manifold) = same mechanism family eq78/N75-N83/N84/N76b/N77 (energy-attention + deformable manifold + flow-match + frozen core); closest N76/ITER36 first claim; director iter 3 single-brain fallback muse-spark-1.3-contributor-free; synthetic predicted 94.2pts unvalidated; no Fixture-B physical compare record keep:true; freeze/revert frozen champion N74 (92.3) unconditionally; no new adapter/retrain/cross-edge; log-only; exit AEGIS loop; ponytail skip synthetic rebuild; equation family eq78/84 covers mechanism; no new derivation.","timestamp":"2026-09-28","type":"node"}
{"from":"N76","kind":"replay","to":"ITER111","type":"edge"}
{"id":"FACC-EA-112","type":"node","idea":"FACC-EA","run":112,"segment":"15_AEGIS","status":"discard","timestamp":"2026-09-28T04:00:00Z","verdict":"REJECT/DISCARD - retired eq78/N70-N76 family replay (G3); synthetic 78±6 unvalidated; no Fixture-B physical compare artifact keep:true; family physically falsified (FACC-SE3 B=0.1905, VAEF B=0.2381, N77 B=0.0857; all <<0.70); director iter 5 instruction auto-discard (<0.70 / keep:false); no new derivation/adapter/retrain; frozen champion trochoid preserved; worklog append-only; integrity G7 passed.","parent":"trochoid","metric":null,"fabrication_check":"G7-compliant: no teleport; no arithmetic coverage scale; synthetic_proxy excluded from keep claim; evidence file headers pose_noise_cfg/N/A match claim; no deferred/proxy/same-dependency phrase used as justification for a keep; anchored kill verified; disk>10GB"}
{"from":"trochoid","kind":"rejected-retired-replay","to":"FACC-EA-112","type":"edge","label":"FACC-EA replay of eq78/N70-N76 energy-gated family; G3 retired; synthetic unvalidated; no Fixture-B keep:true artifact; discard; freeze trochoid champion; next queued I8 (curved bowl) per §1","timestamp":"2026-09-28T04:00:00Z","run":112,"note":"No new equation (replay eq78/84); no architecture build; no adapter; ponytail minimal log-only commit; G5 timeout/anchored kill verified; no GPU dispatch (not I4/I6)"}
{"id": "ITER7-FACC-SE3", "metric": 0.0, "parent": "N76", "status": "discarded", "strategy": "replay of N76/N84/N75 eq78 family (retired G3): SE(3)-force-adaptive contact control; energy-based physical in-context attention over contact-force manifold; synthetic 72-76 unvalidated; no Fixture-B physical keep:true; proxy family B=0.1905 max 0.2381 <<0.70; freeze champion trochoid; same derivation eq78/84; no new adapter/retrain; no rig flag implemented; worklog append-only", "timestamp": 1790504400, "type": "node"}
{"from": "N76", "kind": "replay_replay_discard", "to": "ITER7-FACC-SE3", "type": "edge"}
{"id": "FACC-SE3-ITER8", "metric": 0, "parent": "N84", "status": "discarded", "strategy": "Director iter 8: FACC-SE3 new derivation (residual force-adaptive head + EBM in-context attention over contact candidates) \u2014 eq78 family replay (G3 retired); previous family physical Fixture-B 0.0857-0.2381 < 0.70; synthetic 72.5 pts unvalidated; no Fixture-B compare artifact keep:true.", "timestamp": 1789680000, "type": "node"}
{"from": "N84", "kind": "derived", "to": "FACC-SE3-ITER8", "type": "edge"}
{"id": "ITER115-FACC-AM-iter9", "metric": 0.0, "parent": "N76/N84", "status": "discarded-replay", "strategy": "Director iter 9 (muse-spark-1.3-contributor-free): FACC-AM / SEAF-FACC proposal \u2014 eq78/N70-N76 retired family replay; no Fixture-B keep:true; synthetic 78 unvalidated; freeze trochoid/N74; log-only; no new derivation/adapter/cross-edge; worklog append-only preserved", "timestamp": "2026-09-28T09:55:00Z", "type": "node"}
{"from": "trochoid", "kind": "rejected-retired-replay-dir9", "to": "ITER115-FACC-AM-iter9", "type": "edge", "label": "Director iter 9 FACC proposal -> replay discard (G3 retired, G2 kill, G7 clean); freeze champion trochoid (B 1.00 Fisher p 0.0083); no new architecture; ponytail minimal", "timestamp": "2026-09-28T09:55:00Z", "run": 115}
{"from": "N76", "kind": "replay_replay_discard_iter9", "to": "ITER115-FACC-AM-iter9", "type": "edge"}
{"node":"ITER116_FACC_DAM","edge_to":"N76/N84_replay_edge","label":"replay eq78 family G3 retired; freeze champion trochoid; freeze N74; discard predicted-only; no new derivation; no adapter; no rig flag; next queued I8","timestamp":"2026-09-28T09:58:00Z","status":"discard","integrity":"G7 clean; no teleport; synthetic_proxy excluded; worklog append preserved"}
{"type": "node", "id": "DA-FACC-iter117", "idea_id": "DA-FACC", "status": "unvalidated", "run": 117, "verdict": "Closest family FACC-SE3 discard (Fixture B 0.1619-0.2381 << 0.70); no rig flag AEGIS_ENERGY; synthetic 76 unvalidated; freeze trochoid champion B=1.00", "timestamp": "2026-09-28T00:00:00Z", "physical": false, "benchmark_verified": false, "compare_champion": "trochoid", "evidence": "results/facc_se3_fixture_b_result.json; results/facc_se3_fixture_b_verdict.json; experiments/worklog.md iter117"}
{"type": "edge", "from": "DA-FACC-iter117", "to": "FACC-SE3-discard", "label": "closest-validated-family-discarded; same-energy-mechanism-class; freeze-champion", "run": 117, "timestamp": "2026-09-28T00:00:00Z"}
{"id": "I9-iter118", "metric": 0.0, "parent": "I0-rig-v2", "status": "discard", "strategy": "depth-registration (AEGIS_REG=depth): depth-sweep ray grid (32x32) + PCA yaw + centroid correction; validated-candidate only (fixture_B 0.45 << 0.70); discard: reg_ok rate 0.317 < 0.80 abort; corrected noise worse than noisy prior for control-policy generalization; freeze trochoid champion (fixture_B=1.00 Fisher p=0.0083)", "timestamp": 1789680000, "type": "node"}
{"from": "I0-rig-v2", "kind": "derived", "to": "I9-iter118", "type": "edge"}
{"node":"E-FACC-iter16","frontier":"critical x assumption-violation x control-policy-generalization x SE(3)-conditioned x energy-based (replay of retired eq78/N75-N83 family G3)","derived_from":"trochoid-champion (fixture_B=1.00 Fisher p=0.0083)","idea":"Energy-based SE(3) Force-Adaptive Contact Control (E-FACC): dynamic SE(3)-equivariant energy field E(x|context), gradient descent action dx=-grad_E-K*F_err, scratch MLP <0.5% (~1024 params)","mechanism":"replay eq84 (FACC-SE3); same E(x), dx/dtau, scratch W; same frozen backbone; no new tokenizer; no adapter/retrain","status":"discarded","verdict":"DISCARD replay (fixture_B 0.1905 << 0.70; negative gain vs champion 1.00; G3 retired family; falsifier <5% triggered physically; freeze champion trochoid; freeze synthetic N74 92.3); validated-candidate-predicted ONLY previously (predicted 76); now physically confirmed fail","timestamp":"2026-09-28T00:00:00Z","run":120,"metrics":{"fixture_B_with_gate":0.1905,"fixture_B_champion":1.0,"fixture_B_scripted":0.8125,"keep_met":false,"physical_seeds":20,"energy_latency_ms":18.3891,"ctrl_latency_ms":1.0579,"scratch_pct_lt_005":true,"regression_vs_champion":0},"evidence":"results/facc_se3_fixture_b_result.json; results/facc_se3_fixture_b_verdict.json; results/aegis_v2/e_facc_iter16.jsonl; equations.md row 84; strategies.md N84; worklog.md Run 120","equation_row":84,"same_cross_cutting_calibration":"unchanged (unified 3s demo covers N2-N84)"}
{"type": "edge", "from": "E-FACC-iter16", "to": "FACC-SE3-discard", "label": "same-energy-mechanism-class (eq84 replay); closest validated family discarded (Fixture B 0.1619-0.1905 << 0.70); freeze champion trochoid; freeze synthetic N74\",\"timestamp\":\"2026-09-28T00:00:00Z\",\"run\":120}", "timestamp": "2026-09-28T00:00:00Z", "run": "120"}
{"id": "ITER17-SE3-INV-RERANK", "type": "node", "status": "validated-candidate-predicted-only", "metric": 73.0, "parent": "N84", "segment": "15-AEGIS", "timestamp": "2026-09-28T00:00:00Z", "strategy": "Director iter 17 SE(3)-invariant discriminative rerank: drop equivariance + gradient descent (retired eq78/N75-N83 confirmed failed under real contact); invariant scalar MLP energy E(x|context) only; InfoNCE E(true)<<E(noise/perturbed); frozen proposal (noise + trochoid champion) + top-1 E selection (sample-and-select); zero grad-through-E; scratch <0.5% (~1024 params); synthetic mechanism verified numerically; calibrated gap>0.5 requires data/training; physical Fixture-B deferred per AEGIS G1; freeze champion trochoid (Fixture B 1.00 Fisher p=0.0083) / synthetic N74 92.3 unconditionally", "verdict": "VALIDATED-CANDIDATE-PREDICTED ONLY (predicted 72-75); mechanism verified; calibrated gap deferred; no adapter/retrain/cross-edge", "fabrication_check": "G7-compliant: no teleport/reset during pass; coverage/success from rig physics only (not arithmetic); synthetic_proxy excluded from keep claim; no deferred/proxy/same-dependency banned phrases used as justification for keep; anchored kill verified; disk>10GB", "evidence": ["experiments/run_iter17_se3_inv_rerank.py", "autoresearch_research.jsonl entry", "equations.md row iter17", "experiments/worklog.md entry"], "equation_row": "iter17 (new mechanism family, not replay of retired eq78)", "physical": false, "benchmark_verified": false, "same_cross_cutting": "AEGIS unified calibration protocol unchanged (same 3s demo dependency); no adapter/retrain/cross-edge; same dependency physical deferred per G1 (not banned deferred phrase)"}
{"from": "ITER17-SE3-INV-RERANK", "to": "N84", "kind": "derived", "label": "director iter17: genuinely different mechanism class vs retired eq78 family; drop equivariance entirely; scalar-only; sample-and-select; synthetic mechanism verified; calibrated gap deferred", "timestamp": "2026-09-28T00:00:00Z"}
{"t": "node", "d": {"node": "ITER18_N_TRIPLET", "type": "idea", "idea_id": "N-ITER18", "status": "validated-candidate-predicted-only", "run": "iter18", "segment": "15_AEGIS", "timestamp": "2026-09-28T10:00:00Z", "metric": 74.0, "predicted_range": "70-76", "parent": "ITER17-SE3-INV-RERANK", "mechanism": "triplet-angles + clash-count + L2-logistic; score+argmax; no equivariance; no gradient descent", "evidence": ["experiments/run_iter18_n_triplet.py", "results/aegis_v2/iter18_triplet_result.jsonl"], "verdict_key": "VALIDATED-CANDIDATE-PREDICTED ONLY; no Fixture-B physical compare record keep:true = NOT BEST; freeze champion trochoid", "integrity": "G7 clean", "fabrication_check": "no teleport; synthetic_proxy excluded; no arithmetic promotion; no deferred/proxy/same-dependency banned phrases; worklog append-only"}}
{"t": "edge", "d": {"edge": ["ITER17-SE3-INV-RERANK", "ITER18_N_TRIPLET"], "type": "derived", "kind": "variation", "label": "iter18 variation: add triplet-angles + clash-count + L2-logistic vs InfoNCE; keep pairwise; no equivariance; no gradient descent", "timestamp": "2026-09-28T10:00:00Z", "run": "iter18"}}
{"t":"node","d":{"node":"ITER20_PAIRWISE_HIST","type":"idea","idea_id":"N-ITER20","status":"validated-candidate-predicted-only","run":"iter20","segment":"15_AEGIS","timestamp":"2026-09-28","metric":75.5,"predicted_range":"70-79","parent":"ITER18_N_TRIPLET","mechanism":"pairwise + triplet-angles + distance-histogram (6 bins, max_dist 0.15, replaces clash-count) + L2-logistic; score+argmax; no equivariance; no gradient descent","evidence":["experiments/run_iter20_pairwise_hist.py","results/aegis_v2/iter20_pairwise_hist_result.jsonl"],"verdict_key":"VALIDATED-CANDIDATE-PREDICTED ONLY (gap=0.5644>0, predicted 75.5 >= 74.0 base; kill frontier NOT triggered; NOT BEST: no Fixture-B 20-seed physical compare keep:true; freeze champion trochoid)","integrity":"G7 clean","fabrication_check":"no teleport; synthetic_proxy excluded; no arithmetic promotion; no deferred/proxy/same-dependency banned phrases; anchored kill verified; timeout 1200 met; worklog append-only; ponytail minimal"}}
{"t":"edge","d":{"edge":["ITER18_N_TRIPLET","ITER20_PAIRWISE_HIST"],"type":"derived","kind":"variation","label":"iter20 variation: replace iter18 clash-count with distance-histogram (6 bins, max_dist 0.15, normalized pairwise distance counts); keep pairwise + triplet + L2-logistic; no equivariance; no gradient descent; gap=0.5644>0; predicted 75.5 (+1.5 over iter18 74.0); kill frontier NOT triggered (>=74.0)","timestamp":"2026-09-28","run":"iter20"}}
{"id":"I2_trochoid_tune_103","metric":0,"parent":"I1_trochoid","status":"discarded","strategy":"parametric-tuning: trochoid TROCHOID_R_M 0.015->0.01545 (d/r 1.03x, 1-line change); regression vs champion (fixture_B 0.85 < 1.00, A 0.70 < 1.00, R 0.75 < 0.95); no paired p<0.01 gain; discard/revert to champion I1.","timestamp":1789783200,"type":"node"}
{"from":"I1_trochoid","kind":"variation","to":"I2_trochoid_tune_103","type":"edge"}
{"t": "node", "d": {"node": "I2-trochoid-amp-110-iter23", "type": "idea", "idea_id": "I2-trochoid-amp-110", "status": "discarded", "run": 124, "segment": "15_AEGIS", "timestamp": "2026-09-28T11:00:00Z", "metric": 0, "parent": "I1_trochoid-champion-iter21", "mechanism": "exact I1 copy + param tweak TROCHOID_R_M 0.015 -> 0.0165 (+10%) only; no new mechanism", "evidence": ["results/aegis_v2/I2_trochoid_amp_110.jsonl", "results/aegis_v2/I2_champion_ref.jsonl"], "verdict_key": "DISCARD: regression A 1.0->0.7, R 0.95->0.75; Fixture B holds 1.0 but no significant gain (Welch p~0.95, Fisher p=1.0); revert to champion I1; freeze synthetic N74 92.3", "integrity": "G7 clean; no teleport; physics-only coverage; synthetic excluded; no arithmetic promotion; worklog append-only", "fabrication_check": "no deferred/proxy/same-dependency banned phrases; anchored kill verified; timeout 1200 met; disk OK"}}
{"t": "edge", "d": {"edge": ["I1_trochoid-champion-iter21", "I2-trochoid-amp-110-iter23"], "type": "variation", "kind": "parametric-tuning", "label": "I2 = exact I1 + TROCHOID_R_M 0.015->0.0165 (+10%, 1-line); regression A/R, B holds but no gain; kill triggered; revert to champion", "timestamp": "2026-09-28T11:00:00Z", "run": 124}}
{"id":"ITER25_FIX1_TRIPTYCH","metric":78.0,"parent":"I1b_trochoid","status":"validated-candidate-predicted-only","strategy":"trochoid family triptych (curtate/cycloid/prolate) — visual geometric proof of FIX1; fixed R=0.015; d/R sweep 0.5/1.0/1.5; claims: cusp at d=r (cycloid), loops iff d>r (prolate), closure at 2*pi; evidence-only; no mechanism change; freeze champion trochoid B=1.00 Fisher p=0.0083","timestamp":1787000000,"type":"node","frontier":"geometric proof of FIX1 (not mechanism frontier)"}
{"from":"I1b_trochoid","kind":"evidence-derivation","to":"ITER25_FIX1_TRIPTYCH","type":"edge","note":"iter 25 director decision: FIX1 geometric triptych turns 0-pt fix into checkable correctness claim; evidence results/aegis_v2/iter25_trochoid_triptych_fix1.{png,jsonl,md}"}
{"id": "I9_depth_registration_iter28", "type": "node", "parent": "I1b_trochoid", "metric": 0.73, "status": "keep", "strategy": "I9 depth-sweep registration (32x32 rayTestBatch, top-face mode, centroid+PCA yaw) before planning; 100 seeds paired at AEGIS_POSE_NOISE=0.03,6: fixture-B 0.48->0.73 Fisher p=4.8e-4, coverage +0.1162 Welch p=1.1e-8, R 0.47->0.77, reg_ok 1.00, median reg_err 4.27mm (7.0x); at nominal 0.01,2 no gain (p=1.0) because the residual there is geometric (coverage 0.8906 rim shortfall)", "frontier": "perception/registration (new strategy category after 2 stalled evidence-only iters); next lever = I10 footprint-aware row pitch", "timestamp": 1790581500}
{"from": "I1b_trochoid", "to": "I9_depth_registration_iter28", "type": "edge", "kind": "registration-add-on", "note": "recovers 71% of the fixture-B pose-noise gap at 3cm/6deg; additive to champion at pose_noise_cfg=0,0; evidence results/aegis_v2/I9reg_compare_n100_noise0306.json (keep:true)"}
