{"run": 242, "segment": 15, "status": "discard", "idea": "I3", "timestamp": "2026-09-29T13:35:00Z", "rig": "canonical rig experiments/kaggle_aegis_sweep.py (PyBullet DIRECT, system python3, 20 seeds x 3 suites x 2 paired arms, rig_version 2, run at pose_noise 0,0 AND 0.01,2); pts_source=physics_contact; coverage_cont/success recomputed from physics contacts at return time (cov_kernel_gap 0.0 in every arm); ZERO rig edits this iteration -- the residual is injected through the rig's own documented RESIDUAL_HOOK_FN by experiments/i3_deploy.py, so every other idea's episode is still the frozen rig; regression: the INERT control arm (hook present, policy output ignored) is bit-identical to the paired champion at both noise conditions, delta 0.0000, keep=false", "command": "AEGIS_POSE_NOISE=0.01,2 AEGIS_RESIDUAL_ACTIVE=1 timeout 1200 python3 experiments/i3_deploy.py --i3-mode npz --npz results/aegis_v2/I3_r242_ppo_net.npz --seeds 20 --no-upload --path trochoid --compare trochoid --compare-env AEGIS_RESIDUAL_ACTIVE=0.0 --suites fixture_A,fixture_B,fixture_R --out results/aegis_v2/I3_r242_ppo_n012.jsonl (and the same at 0,0 -> I3_r242_ppo_n00.jsonl); controls: --i3-mode const --i3-const 0.0,{0.010,0.020,0.025,-0.025,0.0-0.020} and --i3-mode const --i3-const {0.020,-0.015,0.020,0.020} and --i3-mode jitter; training: AEGIS_POSE_NOISE=0.01,2 AEGIS_RESIDUAL_ACTIVE=1 timeout 900 python3 experiments/run_i3_ppo.py (200408 scrub ticks, the spec's cap); mechanism: timeout 300 python3 results/aegis_v2/I3_r242_mechanism.py (no physics, rig's own kernel)", "compare_champion": "in-rig --compare trochoid --compare-env AEGIS_RESIDUAL_ACTIVE=0.0 on the SAME 20 seeds -> same friction / tool / customer draw / pose noise; the baseline arm reproduced the frozen champion exactly (0,0: B coverage_cont 0.9453, 20/20, path_len 0.9098 m; 0.01,2: 0.9398, 15/20) and the INERT arm matches it field for field", "metric": 1.0, "metric_unit": "fixture_B transfer_success (coverage_cont>=0.90 per episode) of the I3 residual-PPO arm: 20/20 at pose_noise 0,0 AND 20/20 at 0.01,2; rig compare record keep=true on the coverage channel (Welch p 5.26e-06 at 0,0, 1.04e-04 at 0.01,2) but the learned policy is DISCARDED -- see falsification", "metrics": {"idea": "I3", "lane": "CPU canonical rig", "screens": 0, "unvalidated_rows": 0, "variant": "I3 residual PPO: a = a_trochoid + clip(pi(o), +-0.02 m) in the fixture frame, 6405-param net (64-64-2 MLP), 31-d obs = (pose error, velocity, fn, prog, binary 5x5 coverage patch), reward = d coverage_cont - 0.01|fn-f*|, trained on fixture_A+B with training seeds 300000+ at 1cm/2deg noise, fixture_R held out", "trainer": "200408 scrub ticks (the spec's abort cap), 328 episodes, wall 74.4 s, params 6405, deployed latency 0.00796 ms/tick, 0 VRAM. A DIVERGING GAE BUG in the first trainer (A_t = (r_t-V_t)+(GAMMA+LAM)A_{t+1} -> multiplier 1.94 > 1 -> advantage inf -> NaN weights -> np.clip(NaN) deployed as a CONSTANT +0.02 m in BOTH axes) was found by the previous worker, fixed to the textbook GAE(delta_t = r_t+GAMMA V_{t+1}-V_t, A_t = delta_t+GAMMA LAM A_{t+1}) with a post-step finiteness assertion, and the pre-fix artefacts are preserved as results/aegis_v2/I3_r241_BUG_gae_nan_*. The numbers below are all POST-FIX", "ppo_arm_0_01_2": {"fixture_A": {"covc": 0.9896, "success": 20, "welch_p": 3.83e-05, "paired_p": 1.74e-07, "fisher_p": 0.047124}, "fixture_B": {"covc": 0.9961, "success": 20, "base_covc": 0.9398, "delta": 0.0563, "welch_p": 0.000104, "paired_p": 4.29e-05, "fisher_p": 0.047124}, "fixture_R": {"covc": 0.9815, "success": 19, "base_success": 13, "welch_p": 0.000949, "fisher_p": 0.043596, "zero_shot": true}, "jerk_B": 0.0267, "residual_rms_m": 0.0159, "rig_keep": true}, "ppo_arm_0_0": {"fixture_A": 1.0, "fixture_B": {"covc": 1.0, "success": 20, "welch_p": 5.26e-06}, "fixture_R": {"covc": 1.0, "success": 20, "base_success": 19}, "jerk_B": 0.0268, "rig_keep": true}, "policy_collapse": "On 2e4 physically-plausible observations the trained net emits mean (du,dv) = (-0.0115, +0.0192), sd (0.0052, 0.0017), ||E a||/E||a|| = 0.976 -> the action is 97.6% its own mean. E dv = +0.0192 = 0.77 * CELL_M/2 (the closed-form centring law); E du = -0.0115 ~ -A, the loop operator's own u-drift (I18). The policy re-derived two constants of the plan it was given.", "controls": {"INERT_hook_ignored": {"0_0": "delta 0.0000 on A/B/R, Welch p 1.0, Fisher p 1.0, keep=false; identical to the champion field for field -> the wrapper and the hook plumbing are inert, so every delta below is caused by the residual itself"}, "jitter_zero_mean_rms_7mm": {"B_covc": 0.9563, "B_success": 19, "jerk": 0.369, "note": "same clip, same magnitude, ZERO mean: buys +0.0165 of coverage at 27x the jerk -> the gain is NOT 'extra swept area'"}, "const_u+0.020": {"B_covc": 0.9344, "B_success": 17, "keep": false}, "const_u-0.015": {"B_covc": 0.932, "B_success": 14, "keep": false}, "const_v-0.025_MIRROR": {"B_covc": 0.768, "B_success": 3, "welch_p": 1.29e-07, "fisher_p": 0.000328, "keep": false, "note": "the sign test: a directed -v bias is catastrophic, so +v is a physical centring, not a scoring artefact"}, "const_v+0.010": {"B_covc": 0.9844, "B_success": 20, "R_success": 16, "keep": true}, "const_v+0.020": {"0_01_2": {"B_covc": 1.0, "B_success": 20, "welch_p": 7.84e-06, "A_covc": 0.9979, "R_covc": 0.9974, "R_success": 20}, "0_0": {"A_covc": 1.0, "B_covc": 1.0, "B_welch_p": 5.26e-06, "R_covc": 1.0, "R_success": 20}}, "const_v+0.025_CELL_M_over_2": {"0_01_2": {"A_covc": 0.9917, "B_covc": 0.9992, "B_success": 20, "B_welch_p": 5.63e-05, "B_paired_p": 3.83e-05, "R_covc": 0.9826, "R_success": 20, "R_fisher_p": 0.008316, "jerk_B": 0.0135, "keep": true}, "0_0": {"A_covc": 1.0, "B_covc": 1.0, "B_welch_p": 5.26e-06, "R_covc": 1.0, "R_success": 20, "keep": true}}}, "domination": "The zero-parameter constant (0, +0.025) BEATS the 6405-parameter learned net on all three suites at both noise conditions (0,0 B 1.0000 = 1.0000, R 20/20 = 20/20; 0.01,2 A 0.9917 vs 0.9896, B 0.9992 vs 0.9961, R 0.9826 vs 0.9815 with 20/20 vs 19/20 and Fisher p 0.008316 vs 0.043596) at 0 params, 0 VRAM, 0 ms/tick vs 6405 params and 0.00796 ms/tick. Same precedence I18 used to score keep=true mechanically as DISCARD", "mechanism_I3.1_row_anchor": "scrub_uv builds rows = [v0 + r*CELL_M], v0 = -side/2, nv = int(side/CELL_M): the band is ANCHORED AT THE -v EDGE and truncated. scrub_grid is anchored the same way, so plan_centre = patch_centre - CELL_M/2 exactly, for every side and nv. fixture_B: nv=2, rows [-0.060,-0.010], plan v span [-0.0750,+0.0049], fine cell v centres [-0.0475,-0.0225,+0.0025,+0.0275]; analytic ceiling 0.9219/0.9531/1.0000 for r_eff 0.035/0.04/0.05 with 100% of the misses on the TOP v row (iu 5,6,13,14,15 / 6,13,14) -- the same rim signature I21 named, from a different cause", "mechanism_I3.2_centring_law": "dv* = CELL_M/2 = +0.025 m, closed form, independent of side, nv, r_eff, tool, friction, seed and pose noise. Priced on the rig's OWN kernel (PyBulletScrub._coverage_cont bound off a 1-field shim, not re-implemented) the ceiling is 1.0000 over a PLATEAU: fixture_B r_eff 0.035 on [+0.015,+0.035], 0.04 on [+0.010,+0.040]; fixture_A 0.035 on [+0.020,+0.035], 0.04 on [+0.015,+0.040], 0.05 on [+0.005,+0.035]. Physics lands on the predicted plateau at both noise conditions", "falsification": "I3 IS FALSIFIED AS LEARNING, NOT MERELY UNVALIDATED. Three independent measurements say the same thing. (1) The deployed action is a constant: 97.6% of its own mean over 2e4 plausible observations, with E dv = 0.77 of a quantity the planner can compute in closed form. (2) A zero-parameter constant at that closed-form value beats the net on every suite at both noise conditions, so no part of the net's performance needs the net. (3) The I3 spec's own pre-registered bar is not met: 'R success under noise >= 0.95, Fisher p < 0.01' gives R 0.95 (19/20) at Fisher p = 0.043596, and 6 discordant fail->success pairs cannot reach p < 0.01 at 20 seeds (5 give 0.047124, 7 give 0.008316) -- the constant cleared 7 and reached 0.008316. Independently, the 2026-09-28 SEGMENT+METRIC FREEZE bans any learned/adaptive variant from a keep, so I3 could not have been scored keep even had the net won.", "class_level": "Two closures. (a) A residual policy on a force-driven plan can only return the plan's own constants; a planner defect that is expressible in closed form must be fixed in the planner, because a policy that has to rediscover it pays 6405 parameters, a training run and a stochastic decider to land 77% of the way to a number the geometry already determines. (b) The champion's row-anchor defect is a general PLANNER class, not a fixture-B quirk: any path built as [v0 + r*CELL_M] from v0 = -side/2 is off-centre by exactly CELL_M/2 in v for every patch size, so the fix is one term in the row list.", "secondary_metrics": "mean_jerk rises on every residual arm (B 0.0104 -> 0.0135 at the constant, -> 0.0267 at the net, -> 0.3690 at the jitter probe) because the offset is applied to the COMMAND at the first scrub tick; all values are far below the 0.618 Tier-4 threshold except the jitter probe, which is 60% of it. force_compliance is 1.000 on fixture_B in every arm. slip_m is bit-identical (0.0106) across the champion and every constant arm, so the gain is purely footprint.", "g7_clean": true, "teleport_used": false, "g7_note": "the residual is added to the servo TARGET (tgt), never to the body state; the only resetBasePositionAndOrientation in the rig is the rig's own initial placement at line 1003, before the tick loop, present in every arm including the champion. coverage_cont/success come from physics contacts at return time and cov_kernel_gap = 0.0 in all 15 arms", "edge_budget": "net 6405 params (budget 500M), 0 VRAM (budget 1.5 GB), 0.00796 ms/tick deployed as 3 numpy matmuls (budget 25 ms/chunk) -- comfortably inside; the DISCARD is not a budget failure", "harness_errors": 0, "pts_source": "physics_contact", "synthetic_proxy": null, "novelty_score": null, "director_build_adjudicated": "Director iter-1 'FACC-E -- Force-Adaptive Contact Control with Energy-based In-Context Attention, SE(3)-conditioned' (predicted 76.5) ADJUDICATED, NOT EXECUTED, on the run 234/235/236/237/239/240/241 precedent, five grounds: (1) G4 requires a paired --compare record from the canonical rig, whose tool is a FORCE-DRIVEN foam head with no learned action head, no pi0 and no demo keypoints, so no such record is constructible for the proposal; (2) the directive needs a pi0 policy and checkpoints may never be downloaded locally; (3) G3 permanently retires manifold-switch / flow-bridge / energy-gated re-derivations, and swapping a flow-matching head for an SE(3) contact-energy scorer with a Langevin argmin is exactly that retired family; (4) the FACC line is already closed twice on physical data (T225 run 232 degenerate all-reject, T226 run 233 78/78 infeasible); (5) the 2026-09-28 freeze bans learned/adaptive variants from keeps, which the proposal is. The lowest-numbered queued idea executable in the canonical rig, I3, was run instead", "next": "I22 (pre-registered, NOT claimed): centre the champion's row plan by dv* = CELL_M/2 = +0.025 m at PLAN time (a path-mode term, no policy, no command step at the scrub entry so it should also cut the jerk the residual arms pay). Pre-registered prediction from the arms already on disk: fixture_B coverage_cont 1.0000 at pose_noise 0,0 (Welch p ~ 5e-06 vs the paired champion) and ~0.999 at 0.01,2 with 20/20 success on all three suites, R Fisher p ~ 0.008; the plan-time arm should match or beat const_v025 and its mean_jerk should fall from 0.0135 toward the champion's 0.0104. Kill it if the plan-time version does not reach coverage_cont >= 0.99 on B at 0.01,2, or if the jerk does not fall.", "evidence": ["results/aegis_v2/I3_r242_ppo_n00.jsonl", "results/aegis_v2/I3_r242_ppo_n012.jsonl", "results/aegis_v2/I3_r242_const_v025_n00.jsonl", "results/aegis_v2/I3_r242_const_v025_n012.jsonl", "results/aegis_v2/I3_r242_const_v020.jsonl", "results/aegis_v2/I3_r242_const_v020_n00.jsonl", "results/aegis_v2/I3_r242_const_v010_n012.jsonl", "results/aegis_v2/I3_r242_const_vn025_n012.jsonl", "results/aegis_v2/I3_r242_const_uv020.jsonl", "results/aegis_v2/I3_r242_const_u020.jsonl", "results/aegis_v2/I3_r242_const_um015.jsonl", "results/aegis_v2/I3_r242_INERT_hookignored_n00.jsonl", "results/aegis_v2/I3_r242_INERT_hookignored_n012.jsonl", "results/aegis_v2/I3_r241_probe_jitter.jsonl", "results/aegis_v2/I3_r241_probe_const.jsonl", "results/aegis_v2/I3_r242_ppo_curve.json", "results/aegis_v2/I3_r242_ppo_net.npz", "results/aegis_v2/I3_r242_mechanism.py", "results/aegis_v2/I3_r242_mechanism.json"], "equations": "ROW I3 ((I3.1)-(I3.5))", "graph": "N204-next->N205-I3->N206-next", "remote_gpu": "not used; I3 is the CPU-lane queued idea and the whole iteration ran locally in the canonical rig", "disk_free_gb": 12, "notes": "G7-clean, segment 15, primary metric transfer_success, statuses legal (discard). I3 closes the residual-PPO family: the plan's centring defect is a closed-form planner bug, so the learned head has nothing left to learn. The physical effect is REAL and is handed to I22 as a plan-time fix."}}
