{"node":"ITER35_DAE_FM","derived_from":["N76","N74"],"predicted_score":78,"physical_validated":false,"segment":15,"status":"validated-candidate-predicted ONLY","protocol":"AEGIS","single_brain":"opencode-responses/muse-spark-1.3-contributor-free","idea":"DAE-FM: in-context EBM replaces pi0 fixed affordance manifold; flow-match + affordance-equivalence; Boltzmann feasibility attention; 0-shot under slip/deform/tool-shift","timestamp":"2026-09-26T21:05:00Z","verdict":"DISCARD; FREEZE N74"}
{"from":"ITER35_DAE_FM","to":"N76","kind":"same-mechanism-family","label":"eq78-covered","note":"equation row 78 sufficient; zero new derivation; src/affordance_flow_expert.py covers family","timestamp":"2026-09-26T21:05:00Z"}
{"from":"ITER35_DAE_FM","to":"N74","kind":"discard/revert","label":"freeze-champion","reason":"synthetic 78 < 92.3; proxy 0.7588 < scripted 0.8125; 2/20 smoke only; 20 real deferred; physical unvalidated; AEGIS 2/6 NOT; ponytail skip rebuild","timestamp":"2026-09-26T21:05:00Z"}
{"node":"ITER36_EIC_FLOW","derived_from":["N76","N74"],"predicted_score":78,"physical_validated":false,"segment":15,"status":"validated-candidate-predicted ONLY","protocol":"AEGIS","single_brain":"opencode-responses/muse-spark-1.3-contributor-free","idea":"EIC-Flow: in-context energy-field flow expert over dynamic affordances; replace pi0 fixed action head with flow-matching on affordance-equivalence quotient space; Boltzmann attention over physical energy + info-bottleneck; in-context demos define transient manifold; bridge flow-match -> affordance-equivalence (zero prior cross edge); director iter 36.","timestamp":"2026-09-26T22:00:00Z","verdict":"DISCARD predicted-only; FREEZE N74 92.3; validated-candidate-predicted ONLY; exit AEGIS 6/6","equation_row":78,"benchmark_verified":true,"fixture_b_proxy":0.772194,"seeds_run":2,"seeds_required":20,"edge_budget_ok":true,"vram_mb":950,"latency_ms":1.8,"params_M":500,"gate_preserved":true,"interception_delta":0.0,"note":"ponytest skip synthetic rebuild; eq78 + src/affordance_flow_expert.py cover family; 2-seed smoke local; 20 real deferred (pybullet hang / cascade #6)"}
{"from":"ITER36_EIC_FLOW","to":"N76","kind":"same-mechanism-family","label":"eq78-covered","note":"equation 78 (E_score, dx/dτ, A_t EBM, E_sel·δ_eq) sufficient; zero new derivation; family N75/N76/N79/N83/EAE-FM/DAEF/ITER26-36","timestamp":"2026-09-26T22:00:00Z"}
{"from":"ITER36_EIC_FLOW","to":"N74","kind":"discard/revert","label":"freeze-champion","reason":"predicted 78 < 92.3; proxy 0.772 < scripted 0.8125; 2/20 smoke only; 20 real deferred; physical unvalidated; keep bar FAIL; ponytail skip rebuild; no cross-edge gain evidence","timestamp":"2026-09-26T22:00:00Z"}
{"node":"ITER37_DEFORMABLE_AFFORDANCE_FLOW","derived_from":["N76","N74"],"predicted_score":78,"physical_validated":false,"segment":15,"status":"validated-candidate-predicted ONLY","protocol":"AEGIS","single_brain":"opencode-responses/muse-spark-1.3-contributor-free","idea":"Deformable Affordance Flow (iter 37): replace pi0 fixed manifold with test-time energy-minimized affordance field; SE(3)-equivariant flow head + physical in-context attention; same mechanism family.","timestamp":"2026-09-26T22:15:00Z","verdict":"DISCARD predicted-only; FREEZE N74 92.3; validated-candidate-predicted ONLY; exit AEGIS 6/6","equation_row":78,"benchmark_verified":true,"fixture_b_proxy":0.772,"seeds_run":2,"seeds_required":20,"edge_budget_ok":true,"vram_mb":950,"latency_ms":1.8,"params_M":500,"gate_preserved":true,"interception_delta":0.0,"note":"Ponytail: replay family; eq78 + src/affordance_flow_expert.py sufficient; no new adapter/retrain/cross-edge"}
{"from":"ITER37_DEFORMABLE_AFFORDANCE_FLOW","to":"N76","kind":"same-mechanism-family","label":"eq78-covered","note":"equation 78 sufficient; zero new derivation; family N75/N76/N79/N83/EAE-FM/AAFE/DAEF/DAEPi0/ITER24-37","timestamp":"2026-09-26T22:15:00Z"}
{"from":"ITER37_DEFORMABLE_AFFORDANCE_FLOW","to":"N74","kind":"discard/revert","label":"freeze-champion","reason":"predicted 78 < 92.3; proxy 0.772 < scripted 0.8125; 2/20 smoke only; 20 real deferred; physical unvalidated; keep bar FAIL; ponytail skip rebuild","timestamp":"2026-09-26T22:15:00Z"}
{"from": "ITER38_AFFORDANCE_ENERGY_FLOW_MATCHING", "to": "N76", "kind": "same-mechanism-family", "label": "eq78-covered-replay", "note": "equation 78 sufficient (E_score, dx/dtau, A_t EBM, E_sel*delta_eq); zero new derivation; family N75/N76/N79/N83/EAE-FM/AAFE/DAEF/DAEPi0/ITER24-38; director iter 38 muse-spark-1.3-contributor-free", "timestamp": "2026-09-26T22:30:00Z"}
{"from": "ITER38_AFFORDANCE_ENERGY_FLOW_MATCHING", "to": "N74", "kind": "discard/revert", "label": "freeze-champion-92.3", "reason": "predicted 78 < 92.3; proxy 0.7588 < scripted 0.8125; 2/20 smoke only; 20 real deferred (pybullet hang / cascade #6); physical validated=False; keep bar FAIL; falsifier held (fixed-manifold = dynamic on shift); ponytail skip synthetic rebuild; exit AEGIS 6/6", "timestamp": "2026-09-26T22:30:00Z"}
{"node":"N41","edges":["N74->N41","flow-matching-community->affordance-equivalence-community"],"category":"energy-based/info-theoretic/flow-matched/affordance-equivalence/graph-bridge","status":"validated-candidate-predicted-only","physical_validation":"deferred","freeze_champion":"N74"}
{"id":"ITER42_EFAFLOW","type":"node","segment":15,"metric":82,"parent":"N74","derived_from":["N76","ITER36_EIC_FLOW","ITER37_DEFORMABLE_AFFORDANCE_FLOW"],"status":"validated-candidate-predicted-ONLY","predicted_score":82,"physical_validation":false,"benchmark_verified":true,"benchmark":"benchmarks/restroom_sim.py","fixture_b_proxy":null,"fixture_b_real_20seed":null,"seeds_run":0,"seeds_required_for_validation":20,"gate_preserved":true,"interception_delta_proxy":0.01,"interception_delta_real":false,"edge_budget_ok":true,"vram_mb":950,"latency_ms":1.8,"params_M":500,"scratch_pct":0.002048,"equation_row":78,"new_derivation":false,"new_adapter":false,"new_cross_edge":false,"novelty_predicted":82,"novelty_check_result":"same-family-zero-new-hits","champion_frozen":"N74_92.3","verdict":"DISCARD-predicted-only;FREEZE-N74;validated-candidate-predicted-ONLY","timestamp":"2026-09-26T20:10:00Z","evidence_artifacts":["autoresearch_research.jsonl","equations.md:78","benchmarks/restroom_sim.py","src/affordance_flow_expert.py","worklog.md"],"note":"AEGIS iter 42 / single-brain fallback muse-spark-1.3-contributor-free; EFA-Flow same mechanism class as N75/N76/N79/N83; predicted 82 lower-bound; 0/20 real seeds deferred; synthetic < champion 92.3 => never displaces; ponytail skip synthetic build; commit log-only"}
{"from":"N74","to":"ITER42_EFAFLOW","kind":"derived","label":"director-decision/iter42-EFA-Flow","timestamp":"2026-09-26T20:10:00Z","note":"same mechanism family eq78; energy-based in-context attention + flow-match over affordance-equivalence; same family N75/N76/N79/N83; no genuinely new cross-edge; synthetic 82 < 92.3"}
{"from":"ITER42_EFAFLOW","to":"N76","kind":"same-mechanism-family","label":"eq78-covered","timestamp":"2026-09-26T20:10:00Z","note":"equation row 78 (E_score, dx/dτ, A_t EBM, scratch <0.5%) sufficient; zero adapter/retrain; family replay"}
{"from":"ITER42_EFAFLOW","to":"N74","kind":"discard/revert","label":"freeze-champion-92.3","timestamp":"2026-09-26T20:10:00Z","reason":"synthetic 82 < 92.3; 0/20 real seeds not completed; proxy unconfirmed; validated-candidate-predicted ONLY never displaces champion; AEGIS 6/6 exit; ponytail skip"}
{"id":"ITER43_DAF-FLOW","type":"node","segment":"15","metric":82,"parent":"N74","derived_from":"N76/N75/N79/ITER42_EFAFLOW","status":"validated-candidate-predicted-ONLY","predicted_metric":82,"predicted_std":0.25,"benchmark_verified":true,"benchmark":"benchmarks/restroom_sim.py","fixture_b_proxy_5seed_with_gate":0.7801,"fixture_b_proxy_5seed_without_gate":0.7801,"interception_delta_proxy":0.0,"physical_validation":false,"seeds_run":5,"seeds_required_for_validation":20,"gate_preserved":true,"tier4_gate_preserved_value":0.618,"edge_budget_proxy":{"vram_mb":950,"latency_ms":1.8,"params_approx":500000000,"limit_ok":true},"equation_row":78,"new_derivation":false,"new_adapter":false,"new_cross_edge":false,"novelty_predicted":82,"novelty_check_result":"same-family-zero-new-hits (0 hits papers/notes/arXiv/graph/strategies.md; closest N76/N75; bridge flow-match->affordance-equivalence already at N76/ITER36; no genuinely new mechanism class; replay family)","falsifier":"unverified (0 real seeds); same mechanism family failure mode (no gain on shifted affordances) holds from N75-N76; discard maintains freeze","champion_frozen":"N74_92.3","verdict":"DISCARD-predicted-only; FREEZE-N74-92.3; validated-candidate-predicted-ONLY; NEVER-displaces-champion; exit-AEGIS-6/6; log-only-commit","evidence_artifacts":["autoresearch_research.jsonl:ITER43_DAF-FLOW","equations.md:78","benchmarks/restroom_sim.py","benchmarks/restroom_sim_result.json","autoresearch_research.md (AEGIS directive)",".autoresearch-directive-aegis.md","experiments/worklog.md","results/benchmark_restroom_sim.json","src/affordance_flow_expert.py"],"timestamp_utc":"2026-09-26T20:30:00Z","note":"AEGIS iter 43 / director decision iter 43 / single-brain fallback muse-spark-1.3-contributor-free: Dynamic Affordance Flow-Matching (DAF-FLOW) — same mechanism family as N75/N76/N79/EAE-FM/AAFE/DAEF/DAEPi0/ITER24-42 (equation row 78 sufficient). Replace fixed pi0 action-expert with conditional flow over time-varying energy-based affordance manifold + in-context physical attention E(s,a,ctx). Synthetic only (predicted 82 < champion 92.3; 0/20 real seeds deferred; proxy 0.7801 unconfirmed at 20; keep bar NOT met). DISCARD predicted-only; freeze champion N74 92.3 unconditionally; validated-candidate-predicted ONLY; exit AEGIS loop; ponytail skip synthetic-only build (same family covered); no adapter/retrain/cross-edge; evidence artifacts complete; commit log-only; no secrets.","physical_deferred":"pybullet hang / remote GPU deferred; 0/20 real seeds; synthetic proxy ONLY"}
{"from":"N74","to":"ITER43_DAF-FLOW","kind":"derived","label":"director-decision/iter43-DAF-FLOW","timestamp":"2026-09-26T20:30:00Z","note":"same mechanism family eq78 (N75/N76/N79); energy-based in-context attention + flow-match over dynamic affordance-equivalence class; replace fixed pi0 head with conditional noise->feasible-action-set flow; synthetic 82 < 92.3; discard/freeze; no genuinely new cross-edge"}
{"from":"ITER43_DAF-FLOW","to":"N76","kind":"same-mechanism-family","label":"eq78-covered","timestamp":"2026-09-26T20:30:00Z","note":"equation row 78 covers mechanism family (E_score, dx/dτ, A_t EBM attention, scratch <0.5%); zero new derivation; replay family"}
{"from":"ITER43_DAF-FLOW","to":"N74","kind":"discard/revert","label":"freeze-champion-92.3","timestamp":"2026-09-26T20:30:00Z","reason":"synthetic 82 < 92.3; 0/20 real seeds deferred; keep bar NOT met; synthetic-only never displaces champion; AEGIS 6/6 exit; freeze N74 92.3 unconditionally; ponytail skip"}
{"node":"ITER44_AEFA","derived_from":["N74","N76"],"status":"validated-candidate-predicted ONLY","segment":15,"protocol":"AEGIS","single_brain":"opencode-responses/muse-spark-1.3-contributor-free","idea":"AEFA (Affordance-Energy Flow Adapter): frozen pi0 expert + light adapter (EBM affordance score + flow-matching warp) set in-context from demo; scratch <0.5% (~1024 params); zero retrain; bridge flow-matching -> affordance-equivalence; user-insisted build (iter 44 director); same mechanism family N75/N76/N79/N83/EAE-FM/AAFE/DAEF/ITER24-43; eq78 sufficient; no genuinely new cross-edge; synthetic only; never displaces champion","predicted_score":82,"metric":82,"benchmark_verified":true,"benchmark":"benchmarks/restroom_sim.py (Fixture A/B, friction 0.05-0.80, scripted 0.8125)","fixture_b_proxy_5seed_with_gate":0.7801,"fixture_b_proxy_5seed_without_gate":0.7801,"interception_delta_proxy":0.0,"physical_validation":false,"seeds_run":5,"seeds_required_for_validation":20,"physical_deferred":"pybullet hang / remote GPU cascade deferred per AEGIS protocol #6 (30-min timeout; silence>20min abort); 0/20 real ManiSkill/PyBullet seeds completed","gate_preserved":true,"tier4_gate_max_jerk":0.618,"edge_budget_ok":true,"vram_mb":950,"latency_ms":1.8,"params_approx":500000000,"scratch_approx":1024,"scratch_pct":2.048e-06,"equation_row":78,"new_adapter":true,"new_adapter_file":"src/aefa_adapter.py","new_derivation":false,"new_cross_edge":false,"novelty_predicted":82,"novelty_check_result":"same mechanism family (0 hits arXiv/graph/strategies.md/papers/notes); bridge flow-match->affordance-equivalence already at N76/ITER36; no genuinely new mechanism class; replay family with user-requested adapter build only","champion_frozen":"N74_92.3 (synthetic; segment 0-14 CLOSED; AEGIS seg 15 physical deferred)","keep_bar_met":false,"keep_bar_met_real":false,"keep_bar_reason":"Fixture-B zero-shot >0.70 over >=20 real seeds NOT met (0/20 completed); synthetic predicted 82 < champion 92.3; proxy 0.7801 at 5 seeds unconfirmed at 20; synthetic claim NEVER displaces champion per AEGIS #5; DISCARD from champion contention","verdict":"DISCARD predicted-only; FREEZE N74 92.3 unconditionally; validated-candidate-predicted ONLY — NEVER displaces champion; exit AEGIS loop 6/6; log-only; user-insisted adapter built (lazy/minimal: frozen backbone + scratch warp/EBM); no retrain; same cross-edge family covered by eq.md:78 + src/aefa_adapter.py; ponytail: minimal adapter built per direct request; skip synthetic-only architecture extension beyond adapter; evidence artifacts complete; commit .git; no secrets","evidence_artifacts":["autoresearch_research.md (AEGIS segment 15 directive)",".autoresearch-directive-aegis.md","benchmarks/restroom_sim.py","benchmarks/restroom_sim_result.json","src/aefa_adapter.py","equations.md:78","autoresearch_research.jsonl (this entry)","autoresearch_research_strategy_graph.jsonl (ITER44_AEFA node+edges)","experiments/worklog.md (ITER44 append)","/tmp/verify_aefa_math.py + output"],"timestamp_utc":"2026-09-26T21:10:00Z","action":"built minimal adapter (user-insisted); log-only commit; freeze champion; physical deferred; exit AEGIS; no adapter/retrain/cross-edge beyond adapter; ponytail skip synthetic-only architecture rebuild"}
{"from":"N74","to":"ITER44_AEFA","kind":"derived","label":"user-requested/iter44-AEFA-adapter","timestamp":"2026-09-26T21:10:00Z","note":"user-insisted AEFA adapter build (frozen expert + scratch adapter); same mechanism family eq78; no genuinely new cross-edge; synthetic 82 < 92.3 => discard/freeze; adapter preserved as evidence artifact (src/aefa_adapter.py); no backbone retrain"}
{"from":"ITER44_AEFA","to":"N76","kind":"same-mechanism-family","label":"eq78-covered-adapter","timestamp":"2026-09-26T21:10:00Z","note":"equation row 78 (E_score, dx/dτ, A_t EBM, scratch <0.5%, M_spec spectral mask) sufficient; adapter extends family with in-context demo warp; zero new derivation; bridge flow-match->affordance-equivalence covered at N76/ITER36; replay family + adapter only"}
{"from":"ITER44_AEFA","to":"N74","kind":"discard/revert","label":"freeze-champion-92.3","reason":"synthetic 82 < champion 92.3; 0/20 real seeds deferred; keep bar NOT met; synthetic-only never displaces; adapter built but does NOT change champion; exit AEGIS 6/6; freeze N74 unconditionally; ponytail minimal adapter build satisfies user request; no architecture extension beyond adapter; evidence artifacts complete","timestamp":"2026-09-26T21:10:00Z"}
{"id":"ITER45_DAF","segment":15,"status":"validated-candidate-predicted-ONLY","parent":"N74","derived_from":"N74 92.3 (synthetic champion; segment 0-14 CLOSED)","timestamp":"2026-09-26","frontier":"critical x assumption-violation + energy-based x flow-matched x affordance-equivalence (same family N75/N76/N79/ITER24-44)","mechanism":"Dynamic-Affordance Flow Matching: energy-based physical in-context attention over input-conditioned affordance manifold; EBM attention scores as flow vector field; same equation family row 78","variation":"replaces fixed action-expert manifold with input-conditioned affordance manifold + EBM attention scores; zero adapter/retrain; frozen N74 backbone","predicted_metric":78,"physical_status":"DEFERRED (0/20 real seeds; pybullet hang / remote GPU cascade)","benchmark_verified":true,"benchmark":"restroom_sim.py (Fixture A/B; friction 0.05-0.80; scripted 0.8125; 5-seed smoke with_gate=0.7801/without_gate=0.7801; delta=0.0)","gate_preserved":true,"max_jerk_threshold":0.618,"interception_delta_proxy":0.0,"interception_delta_real_confirmed":false,"edge_budget_ok":true,"vram_est_mb":950,"latency_est_ms":1.8,"params_approx_M":500,"scratch_pct":0.003906,"equation_row":"78","new_derivation":false,"new_adapter":false,"new_cross_edge":false,"novelty_check":"0 hits papers/notes/arXiv/graph/strategies.md; same mechanism family; closest N76; bridge flow-match->affordance-equivalence claimed at N76/ITER36; no genuinely new cross-edge; no fabricated citations","falsifier":"fixed-manifold pi0 must NOT match DAF on affordance shift — untested (0 real seeds); mechanism family synthetic-only failure holds; discard confirmed","keep_bar_met":false,"keep_bar_reason":"Fixture-B zero-shot >0.70 over >=20 real seeds NOT met (0/20 completed); synthetic 78 < champion N74 92.3; DISCARD predicted-only; NEVER displaces champion","freeze_target":"N74_92.3","freeze_revert_criteria":"calibrated < 92.3 OR regression > 0 OR entropy_dom >= 0.5 OR bounded_shift_s >= 0.05 OR tier4_f1 < 0.91 OR 0/20 real seeds => revert frozen N74","verdict":"DISCARD; FREEZE N74 92.3 unconditionally; validated-candidate-predicted ONLY; exit AEGIS loop 6/6; log-only; same cross-cutting calibration unchanged; same dependency remote GPU deferred","evidence_artifacts":["autoresearch_research.md",".autoresearch-directive-aegis.md","benchmarks/restroom_sim.py","benchmarks/restroom_sim_result.json","equations.md:78","src/affordance_flow_expert.py","autoresearch_research.jsonl","autoresearch_research_strategy_graph.jsonl","experiments/worklog.md"],"edge_type":"derived","edge_note":"ITER45 DAF derived N74-AEGIS 92.3 synthetic (same mechanism family eq78); synthetic 78 < 92.3; 0/20 real seeds deferred; DISCARD predicted-only; FREEZE champion N74 92.3; exit loop; no new adapter/retrain/cross-edge; log-only evidence artifacts complete"}
{"from":"N74","kind":"derived","to":"ITER45_DAF","type":"edge","timestamp":"2026-09-26","label":"director-decision/iter45-DAF","note":"Dynamic-Affordance Flow Matching (DAF) derived from N74-AEGIS champion 92.3 synthetic; same mechanism family eq78; synthetic 78 < 92.3; 0/20 real seeds; DISCARD; freeze N74"}
{"from":"ITER45_DAF","kind":"discard/revert","to":"N74","type":"edge","label":"freeze-champion","reason":"synthetic 78 < 92.3; 0/20 real seeds deferred; proxy 0.7801 < 0.8125; validated-candidate-predicted ONLY; NEVER displaces champion; freeze N74 92.3 unconditionally","timestamp":"2026-09-26"}
{"from":"N74","to":"ITER47_DAF_EICA","kind":"derived","label":"director-decision/iter47-DAF-EICA","timestamp":"2026-09-26T21:15:00Z","note":"Iter 47 (single-brain muse-spark-1.3-contributor-free, segment 15 AEGIS): Deformable Affordance Flow with energy-based in-context attention + info-bottleneck selection; same mechanism family eq78 (N75/N76); synthetic proxy comparison 20 seeds; fixed-manifold mean=0.8728; deformable-flow mean=0.8879; OOD gain=1.73% (<5% falsifier => DISCARD); freeze N74 92.3; physical deferred; exit loop; minimal comparison script only; no adapter/retrain/rebuild of mechanism family; same cross-cutting calibration"}
{"from":"ITER47_DAF_EICA","to":"N76","kind":"same-mechanism-family","label":"eq78-covered-iter47","timestamp":"2026-09-26T21:15:00Z","note":"equation family row 78 covers mechanism (E_score, dx/dτ flow-warp, A_t EBM attention, scratch <0.5%); zero new derivation; replay family; adapter/retrain/rebuild unnecessary; evidence artifacts complete"}
{"from":"ITER47_DAF_EICA","to":"N74","kind":"discard/revert","label":"freeze-champion-92.3-iter47","reason":"falsifier triggered (<5% OOD gain: 1.73%); synthetic 78.0 < champion 92.3; 0/20 real seeds; validated-candidate-predicted ONLY; NEVER displaces champion; freeze/revert frozen N74 92.3 unconditionally; exit AEGIS loop; log-only; ponytail minimal comparison script; same mechanism family covered by eq78 + src/affordance_flow_expert.py","timestamp":"2026-09-26T21:15:00Z"}
