{"run": 307, "segment": 15, "status": "discard", "idea": "N196", "timestamp": "2026-09-30T21:40:00Z", "commit": "HEAD", "metric": 0.9844, "metric_name": "fixture_B transfer_success (coverage_cont >= 0.90 per episode), canonical rig, 20 seeds x 3 suites x 2 arms, pose_noise 0.64,128", "metric_unit": "fixture_B transfer_success of the AEGIS_REG_N=64 / AEGIS_REG_N=128 arm on top of the shipped N192/N195 lattice (REG_CASTS=0, REG_HALF_M=0.6, REG_DFACT=1.5, REG_CN=16), i.e. the fine-cast resolution of the depth-registration ray grid", "rig": "experiments/kaggle_aegis_sweep.py (PyBullet DIRECT, system python3, rig_version 2, friction U[0.05,0.80], gate_mode=post-hoc); pts_source=physics_contact; every coverage_cont/success recomputed from physics contacts at return time; no teleport, no arithmetic coverage", "command": "AEGIS_POSE_NOISE=0.64,128 AEGIS_REG=depth AEGIS_REG_HALF_M=0.6 AEGIS_REG_CASTS=0 AEGIS_REG_CN=16 AEGIS_REG_N=<64|128> timeout 1200 python3 experiments/kaggle_aegis_sweep.py --seeds 20 --no-upload --path trochoid --compare trochoid --compare-env AEGIS_REG_N=32 --suites fixture_A,fixture_B,fixture_R --out results/aegis_v2/N196_r30{8,9}_*.jsonl (r307 is the CN=0 arm, AEGIS_REG_N=64, N196_r307_n64_s20_0.64,128.jsonl)", "compare_champion": "in-rig --compare trochoid --compare-env AEGIS_REG_N=32 on the SAME 20 seeds -> identical friction / tool / customer draw / pose noise / ray grid; the baseline arm IS the shipped N192/N195 champion (n=32 fine cast, k=ceil(6 sigma/d)+1 lattice, border-margin argmax). The two CN=16 baselines (r308, r309) are BIT-IDENTICAL to each other: 122 reg_cast_points, fixture_B coverage_cont 0.9883, 20/20, on all 20 seeds.", "metrics": {"idea": "N196", "director_iteration": 54, "director_directive_adjudication": {"spec": "FACC: SE(3)-conditioned Force-Adaptive Contact Control -- replace the flow-matching expert with a contact-energy field; dynamic (not fixed) affordance manifold; energy-based in-context attention; cross-embodiment contact transfer; ablate SE(3)-conditioning vs a vanilla pi0 expert with contact-force RMSE + slip rate; OOD affordance-deformation test that a fixed-manifold baseline must fail; predicted score 76/100 keep", "executed": false, "exclusion_reasons": ["G3 retired family: 61st re-derivation of manifold-switch / flow-bridge / energy-gated. FACC was closed on PHYSICAL data at r232/r233 (all-reject degeneracy, worst-band recall ceiling 0.5714 < 0.65); FACC-E was not executed at r300; the identical spec was not executed at r301, r302, r303, r304, r305 or r306.", "G4 unpairable: the canonical scrub rig has no pi0 expert, no SE(3) energy-attention keypoint, no wrench-conditioned action head, no stiffness axis and no contact-force-RMSE or force-excess metric. Contact force in the rig is a logged diagnostic (fn_mean, fn_p95, force_compliance) at a scaled ~0.5 N foam-pad level, not a 10-25 N spec, and there is no stiffness sweep to ablate against. Building the apparatus to pair would be fabrication under G7.", "Banned: a predicted-only keep ('score 76/100'), and any soft/adaptive/learned gate variant.", "Directed instead to the live frontier node N196, exactly as the N194->N196 edge prescribed (open since run 305)."], "note": "The director's own framing ('pi0 fixed affordance manifold assumption-violation', 'replaces flow-mat with contact-energy field') is the retired family restated; the one honest reading of it that IS executable here -- a force-adaptive, energy-based contact controller -- was already falsified on physical data by I11/I15 (r235: PI saturates at the 0 rail, fn 5.2x setpoint, 93% of contact on the liner)."}, "verdict": "DISCARD (measured NULL) with a positive structural result: the parity term 2H/(n-1) is a real, exactly-1/n estimator error and it is INVISIBLE to the G2 metric, so the registration family is CLOSED. The dose (raise the fine-cast resolution n) is measurably worthless and more expensive; the shipped n=32 is correct.", "decider_A_n64_CN0_r307": {"file": "results/aegis_v2/N196_r307_n64_s20_0.64,128.jsonl", "episodes": 120, "harness_errors": 0, "fixture_B": {"coverage_cont_base_n32": 0.9891, "coverage_cont_cand_n64": 0.9859, "delta": -0.0031, "success_base": "20/20", "success_cand": "20/20", "welch_p": 0.6771645267509372, "fisher_p": 1.0}, "fixture_A": {"coverage_cont_base": 0.6958, "coverage_cont_cand": 0.6964, "delta": 0.0005, "success_base": "2/20", "success_cand": "2/20", "welch_p": 0.9923842304652737}, "fixture_R": {"coverage_cont_base": 0.8221, "coverage_cont_cand": 0.8214, "delta": -0.0008, "success_base": "12/20", "success_cand": "12/20", "welch_p": 0.9918979261598324}, "reg_err_xy_mm": {"cand_median": 3.44, "cand_p90": 13.54, "base_median": 4.69, "base_p90": 11.64, "reg_ok": "60/60 both arms"}, "wall_s_per_ep": {"base": 0.213, "cand": 1.593, "ratio": 7.48}, "rig_compare_keep": false}, "decider_B_n64_CN16_r309": {"file": "results/aegis_v2/N196_r309_n64cn16_s20_0.64,128.jsonl", "episodes": 120, "harness_errors": 0, "fixture_B": {"coverage_cont_base_n32": 0.9883, "coverage_cont_cand_n64": 0.9844, "delta": -0.0039, "success_base": "20/20", "success_cand": "20/20", "welch_p": 0.6389049055056764, "fisher_p": 1.0}, "fixture_A": {"coverage_cont_base": 0.6974, "coverage_cont_cand": 0.6958, "delta": -0.0016, "success": "2/20 both arms", "welch_p": 0.9773172110283107}, "fixture_R": {"coverage_cont_base": 0.8221, "coverage_cont_cand": 0.8229, "delta": 0.0008, "success": "12/20 both arms", "welch_p": 0.991708761216362}, "reg_err_xy_mm_fixture_B": {"base_median": 8.68, "base_p90": 16.64, "base_max": 18.07, "cand_median": 6.71, "cand_p90": 15.14, "cand_max": 18.45, "cand_cast_points": 501, "base_cast_points": 122}, "wall_s_per_ep": {"base": 0.105, "cand": 0.117, "ratio": 1.11}, "rig_compare_keep": false}, "decider_C_n128_CN16_r308": {"file": "results/aegis_v2/N196_r308_n128_s20_0.64,128.jsonl", "episodes": 120, "harness_errors": 0, "fixture_B": {"coverage_cont_base_n32": 0.9883, "coverage_cont_cand_n128": 0.9844, "delta": -0.0039, "success_base": "20/20", "success_cand": "20/20", "welch_p": 0.6389049055056764, "fisher_p": 1.0}, "fixture_A": {"coverage_cont_base": 0.6974, "coverage_cont_cand": 0.6974, "delta": 0.0, "success": "2/20 both arms", "welch_p": 0.9998540255818831}, "fixture_R": {"coverage_cont_base": 0.8221, "coverage_cont_cand": 0.8229, "delta": 0.0008, "success": "12/20 both arms", "welch_p": 0.9917100020414502}, "reg_err_xy_mm_fixture_B": {"cand_median": 5.5, "cand_p90": 15.82, "cand_max": 16.46, "cand_cast_points": 2039}, "wall_s_per_ep": {"base": 0.106, "cand": 0.194, "ratio": 1.83}, "rig_compare_keep": false, "paired_control": "the n=32 baseline block is bit-identical to r309's on all 20 seeds (122 reg_cast_points, coverage_cont 0.9883, 20/20) -- the two runs differ only in AEGIS_REG_N"}, "analytic_probe": {"file": "results/aegis_v2/N196_probe.json", "script": "experiments/N196_probe.py", "kind": "pure geometry, NO physics, NO coverage, NO success -- cannot set or move a metric", "draws": 4000, "seed": 20260930, "H_m": 0.6, "d_pitch_m": 0.34845, "face_half_m": [0.34, 0.14], "rows": [{"n": 16, "ray_pitch_mm": 80.0, "parity_amp_mm": 40.0, "err_med_mm": 22.84, "err_p90_mm": 36.02, "p90_over_amp": 0.9, "reg_ok_rate": 0.981}, {"n": 32, "ray_pitch_mm": 38.71, "parity_amp_mm": 19.35, "err_med_mm": 10.32, "err_p90_mm": 17.28, "p90_over_amp": 0.89, "reg_ok_rate": 1.0}, {"n": 64, "ray_pitch_mm": 19.05, "parity_amp_mm": 9.52, "err_med_mm": 4.64, "err_p90_mm": 7.91, "p90_over_amp": 0.83, "reg_ok_rate": 1.0}, {"n": 128, "ray_pitch_mm": 9.45, "parity_amp_mm": 4.72, "err_med_mm": 2.4, "err_p90_mm": 4.01, "p90_over_amp": 0.85, "reg_ok_rate": 1.0}], "finding": "err_p90/parity_amp is flat at 0.83-0.90 over a 16x change in n and flat in sigma (0.28/0.64/3.20 m agree to 3 s.f.), i.e. the residual IS the parity term 2H/(n-1) and nothing else; the law is exactly 1/n"}, "why_the_metric_cannot_see_it": {"pooled_fixture_B_plans": 60, "residual_range_mm": [2.6, 18.45], "d_coverage_cont_d_reg_mm": 0.00202, "pearson_r": 0.354, "value_of_the_whole_parity_range_in_coverage_cont": 0.026, "twenty_seed_paired_standard_error": 0.0083, "coverage_cont_sd": 0.0263, "verdict": "the effect is ~3x BELOW the decider's noise floor and the measured deltas are the wrong sign, so this is a null, not a masked win", "margin_fact": "fixture_B is 60/60 successful across the whole sweep and its MINIMUM coverage_cont is 0.9219 > 0.90 at the worst residual measured -- the G2 bar is already cleared everywhere the parity term can act", "operating_range_fact": "the single cast's residual runs 17.7 -> 71.0 mm as sigma grows (N194.1), the only regime where 0.002/mm would be worth 0.14 of coverage; the run-303 lattice forces d_cut=0 and caps the residual at the parity bound, so the sensitivity that would make the term visible was deleted by the mechanism that won the metric", "n_independent_floor": "physically the 1/n law holds only to a ~5 mm floor: n=32 -> 128 moves the fixture_B median 8.68 -> 5.50 mm while p90 stalls at 15-16 mm; fit e = sqrt(parity(n)^2 + c^2) on the medians gives c ~= 5 mm. reg_err_xy is measured against the FIXTURE SPEC centre and the physical top face is bevelled, so part of the residual is a fixed bias no estimator can remove at any n"}, "cost": {"n64_CN0_wall_ratio": 7.48, "n64_CN16_wall_ratio": 1.11, "n128_CN16_wall_ratio": 1.83, "rays_per_episode": {"n32_CN0": 173056, "n64_CN0": 692224, "n64_CN16": 45056, "n128_CN16": 59712}, "recommendation": "KEEP n=32 (the shipped value). It is the cheapest and every larger n is measurably worthless. With CN=0 the selection stage also runs at n, so raising n costs 7.5x for the same null.", "consistency": "same reason N191's unbiased-but-noisier extremal estimator lost (0.001/mm of usable signal vs 13.7 mm of added noise): the metric never had the resolution to adjudicate an estimator choice, and it still does not"}, "rig_edits": {"scored_knobs_added": 0, "force_solver_scoring_fixture_terms_changed": 0, "teleports": 0, "learned_params": 0, "note": "AEGIS_REG_N already existed as an env knob, so the dose needed NO rig change. The single edit is the N196.6 harness fix below; the default arm is unaffected."}, "harness_defect_fixed": {"symptom": "TypeError: 'float' object cannot be interpreted as an integer on 60/60 BASELINE episodes of the first pairing attempt (the candidate arm was unaffected)", "cause": "apply_knobs writes every --compare-env knob as a FLOAT; REG_N is an int global and np.linspace(..., num) has rejected a float since numpy 1.20", "fix": "one `nn = int(nn)` at the _cast() use site in experiments/kaggle_aegis_sweep.py; REG_N itself unchanged", "regression": "20 seeds x {A,B,R} x --path raster on git HEAD's rig vs the patched rig: 60/60 episodes each, 0 field diffs outside ts/wall_s, 0 harness errors", "regression_files": ["results/aegis_v2/N196_regression_HEAD.jsonl", "results/aegis_v2/N196_regression_POST.jsonl"], "failed_attempt_kept_as": "results/aegis_v2/N196_r307_HARNESSERROR_n64armonly.jsonl (sets no metric)"}, "family_closure": {"estimator_side_accounted": {"k and d": "N195 (closed)", "window H": "N190.6 (closed)", "estimator choice mean/extent/extremal": "N191 (closed, measured loss)", "fine-cast resolution n": "N196 (closed here)"}, "primary_metric_state": "fixture_B 20/20 at every level tested up to 3.2 m / 640 deg while its paired frozen champion is 0/20 -- no further fixture_B gain is measurable", "remaining_real_defect": "fixture_A (2/20, coverage_cont 0.697) and fixture_R (12/20, 0.822) fail on the UNOBSERVABLE YAW of rotationally symmetric faces, not on the centroid residual (pooled r = +0.079 on A, +0.289 on R). N193 already fixed it (auto/orbit: A 0.21 -> 0.99, R 0.61 -> 1.00) but it is a PROVABLE NO-OP on fixture_B (face inradius 0.14 m < patch circumradius 0.2088 m, and B's yaw is PCA-corrected anyway), so it cannot be a G4 keep.", "protocol_fact_for_director": "the last real defect in the programme is structurally unclaimable under a keep bar anchored on fixture_B. No gate change was made here; this is filed as node N198 for the director, not executed."}, "synthetic_proxy": null, "reproduce": ["python3 experiments/N196_probe.py", "AEGIS_POSE_NOISE=0.64,128 AEGIS_REG=depth AEGIS_REG_HALF_M=0.6 AEGIS_REG_CASTS=0 AEGIS_REG_CN=16 AEGIS_REG_N=128 timeout 1200 python3 experiments/kaggle_aegis_sweep.py --seeds 20 --no-upload --path trochoid --compare trochoid --compare-env AEGIS_REG_N=32 --suites fixture_A,fixture_B,fixture_R --out 'results/aegis_v2/N196_r308_n128_s20_0.64,128.jsonl'", "timeout 300 python3 experiments/N196_readout.py 'results/aegis_v2/N196_r308_n128_s20_0.64,128.jsonl'"], "evidence_files": ["results/aegis_v2/N196_r307_n64_s20_0.64,128.jsonl", "results/aegis_v2/N196_r308_n128_s20_0.64,128.jsonl", "results/aegis_v2/N196_r309_n64cn16_s20_0.64,128.jsonl", "results/aegis_v2/N196_regression_HEAD.jsonl", "results/aegis_v2/N196_regression_POST.jsonl", "results/aegis_v2/N196_r307_HARNESSERROR_n64armonly.jsonl", "results/aegis_v2/N196_probe.json"], "equations_row": "equations.md ROW N196 (N196.1-N196.6)", "graph": "N195->N196->{N197,N198}"}}
