{"run": 351, "idea_id": "N205-REVERSAL", "segment": "15", "status": "discard", "metric": "transfer_success", "timestamp": "2026-09-30T19:40:00Z", "idea": "N205 -- falsify or confirm the published reversal law (equations.md ROW N202.3: the champion's force-violation rate is set by the path's reversal count). The law came from a 0.912 pearson(path_len, fn_p95) pooled over fixture_A+fixture_R, but reversal count is CONSTANT inside a suite, so that correlation cannot separate 'reversals' from 'which fixture it is'. Physical discriminator: `rounded` shares raster's rows, reversal count and arclength and differs ONLY in whether the 180 deg flip is a C0 jump or a C1 semicircle; `fitro` is the footprint-aware row plan (the N202.5 kinematic fix candidate).", "director_proposal": "FACC-E / SE(3)-conditioned energy-based in-context attention (muse-spark-1.3-contributor-free, predicted 74) -- DISCARD, nothing built: G3 permanently retires N70-N76/eq78/manifold-switch/flow-bridge/energy-gated re-derivations, the queue in ideas.md 1 and 4 has been empty since run 309, N198 is open_needs_director, and rig v3 PATH_MODES (raster/rounded/trochoid/spiral/fitted/fitro/orbit/auto) contain no pi0 VLM, no SE(3) action expert and no EBM/attention head, so the mechanism is not executable. A predicted score is not evidence (G7).", "rig": "timeout 1200 python3 experiments/kaggle_aegis_sweep.py --seeds 20 --no-upload --path rounded --compare raster --suites fixture_A,fixture_B,fixture_R --out results/aegis_v2/N205_r351_rounded_vs_raster.jsonl (exit 0, 9.7 s, 120 episodes, 0 harness errors) ; timeout 1200 python3 experiments/kaggle_aegis_sweep.py --seeds 20 --no-upload --path fitro --compare trochoid --suites fixture_A,fixture_B,fixture_R --out results/aegis_v2/N205_r351_fitro_vs_trochoid.jsonl (exit 0, 10.4 s, 120 episodes, 0 harness errors) ; python3 experiments/N205_reversal_audit.py (planner geometry + paired stats, exit 0). No rig byte edited, no knob changed, PyBullet DIRECT, system python3, local CPU.", "rig_invoked": true, "seeds_run": 20, "compare_champion": "trochoid (physical champion, pose_noise_cfg 0,0; re-certified in this run: A/B/R 20-20, coverage_cont 1.0000, force_compliance A 0.4864 / B 1.0000 / R 0.7548, identical to run 350)", "compare": {"candidate": "rounded", "baseline": "raster", "keep": false, "fixture_A": {"succ_a": 20, "succ_b": 20, "fisher_p": 1.0, "mean_a": 1.0, "mean_b": 1.0, "delta": 0.0, "welch_p": null}, "fixture_B": {"succ_a": 20, "succ_b": 20, "fisher_p": 1.0, "mean_a": 1.0, "mean_b": 1.0, "delta": 0.0, "welch_p": null}, "fixture_R": {"succ_a": 20, "succ_b": 20, "fisher_p": 1.0, "mean_a": 1.0, "mean_b": 1.0, "delta": 0.0, "welch_p": null}, "keep_rule": ">=20 seeds AND B transfer_success>0.70 AND (Welch p<0.01 coverage OR Fisher p<0.01 success) AND no coverage regression"}, "compare2": {"candidate": "fitro", "baseline": "trochoid", "keep": false, "fixture_A": {"succ_a": 20, "succ_b": 20, "fisher_p": 1.0, "mean_coverage_cont_a": 1.0, "mean_coverage_cont_b": 0.9719, "delta": -0.0281, "welch_p": 2.4179345731623933e-05}, "fixture_B": {"succ_a": 20, "succ_b": 20, "fisher_p": 1.0, "mean_coverage_cont_a": 1.0, "mean_coverage_cont_b": 0.9836, "delta": -0.0164, "welch_p": 0.004729458789911956}, "fixture_R": {"succ_a": 20, "succ_b": 20, "fisher_p": 1.0, "mean_coverage_cont_a": 1.0, "mean_coverage_cont_b": 0.9766, "delta": -0.0234, "welch_p": 0.00044797545902212796}}, "metrics": {"idea": "N205-REVERSAL", "physical": true, "pts_source": "physics_contact", "seeds": 20, "episodes": 240, "harness_errors": 0, "fixture_A": 1.0, "fixture_B": 1.0, "fixture_R": 1.0, "coverage_cont_mean": 1.0, "coverage_cont_min_episode": 1.0, "p_fisher_success_rounded_vs_raster": 1.0, "p_fisher_success_fitro_vs_trochoid": 1.0, "compare_keep_rounded_vs_raster": false, "compare_keep_fitro_vs_trochoid": false, "planner_geometry_fixture_A": {"raster": {"arclength_m": 1.3, "reversals": 2, "max_step_turn_deg": 90.0, "rev_per_m": 1.54}, "rounded": {"arclength_m": 1.3568, "reversals": 2, "max_step_turn_deg": 11.3, "rev_per_m": 1.47}, "trochoid": {"arclength_m": 1.4118, "reversals": 2, "max_step_turn_deg": 45.4, "rev_per_m": 1.42}, "fitro": {"arclength_m": 1.4196, "reversals": 2, "max_step_turn_deg": 32.7, "rev_per_m": 1.41}, "orbit": {"arclength_m": 3.0252, "reversals": 9, "max_step_turn_deg": 17.9, "rev_per_m": 2.98, "note": "lateral flips are spiral tangent crossings, not row reversals"}}, "force_compliance_20_seeds": {"raster": {"fixture_A": 0.4869, "fixture_B": 1.0, "fixture_R": 0.7556}, "rounded": {"fixture_A": 0.4437, "fixture_B": 1.0, "fixture_R": 0.7377}, "trochoid": {"fixture_A": 0.4864, "fixture_B": 1.0, "fixture_R": 0.7548}, "fitro": {"fixture_A": 0.4997, "fixture_B": 1.0, "fixture_R": 0.7756}, "orbit_fixture_A_prior_N193_100seeds": 0.5507}, "paired_delta_rounded_minus_raster": {"force_compliance": {"fixture_A": -0.0432, "p": 0.1, "fixture_R": -0.0179, "fixture_B": 0.0}, "fn_p95": {"fixture_A": 0.044, "p": 0.704, "fixture_R": 0.0086}, "coverage_cont": {"fixture_A": 0.0, "fixture_B": 0.0, "fixture_R": 0.0}}, "paired_delta_fitro_minus_trochoid": {"force_compliance": {"fixture_A": 0.0133, "p": 0.0359, "fixture_R": 0.0208, "fixture_B": 0.0}, "coverage_cont": {"fixture_A": -0.0281, "p": 0.000448, "fixture_B": -0.0164, "fixture_R": -0.0234}}, "fixture_term_vs_path_term_force_compliance_spread": {"fixture": 0.5136, "path": 0.107, "ratio": 4.8}, "seed_determinism_check": "trochoid episodes in run 350 and in run 351 reproduce identical friction AND identical coverage_cont on all 60 paired episodes -> the --compare pairing is legitimate", "synthetic_proxy_used_for_keep": false, "restroom_sim_used": false}, "evidence_artifact": "results/aegis_v2/N205_r351_rounded_vs_raster.jsonl + results/aegis_v2/N205_r351_fitro_vs_trochoid.jsonl + results/aegis_v2/N205_r351_audit.txt + experiments/N205_reversal_audit.py", "findings": ["N205.1 THE PUBLISHED LAW IS CONFOUNDED, NOT MERELY CORRELATED. Reversal count is a deterministic function of (path_mode, fixture): 2 reversals on fixture_A and 1 on fixture_B for EVERY row-plan mode. N202.3's pearson(path_len, fn_p95) = 0.912 over the pooled A+R episodes therefore has within-suite variance ZERO in both regressors -- it is a two-cluster between-fixture contrast wearing a within-suite correlation's clothes.", "N205.2 MAKING THE REVERSAL CONTINUOUS DOES NOT FIX THE FORCE VIOLATION. rounded vs raster (identical rows, identical reversal count, identical 1.30/1.36 m arclength, max step turn 11.3 deg vs 90.0 deg): force_compliance delta -0.0432 (p=0.080, fixture_A), -0.0179 (p=0.100, fixture_R), 0.0000 (fixture_B); fn_p95 +0.0440 (p=0.374) / +0.0086 (p=0.704). The C0-flip -> C1-arc change is, if anything, slightly WORSE, and never significant. The stiction-at-the-flip reading of the reversals is refuted as well.", "N205.3 THE KINEMATIC FIX OF N202.5 CANNOT PAY FOR ITSELF. fitro (footprint-aware row plan, I10's operator) is the only path in the rig that cuts the row count, and it buys +0.0133 (p=0.447, A) / +0.0208 (p=0.036, R) of force_compliance while LOSING coverage_cont on all three suites at p=2.4e-05 / 0.0047 / 0.00045 (B 1.0000 -> 0.9836). Under the G4 keep rule the primary-metric regression alone discards it; rig keep=false on both compares.", "N205.4 THE FIXTURE TERM DOMINATES THE PATH TERM 4.8:1. Same path (trochoid), same 20 seeds, same friction draw: fixture_B 1.0000 / fixture_R 0.7548 / fixture_A 0.4864, spread 0.5136 against a path-driven spread of 0.1070 over five arms. The prior N193 orbit arm (100 seeds, 3.03 m rotation-invariant sweep, no row reversals) is the WORST of all at 0.5507. Nothing a planner does to the reversals moves this metric by more than the fixture identity already does.", "N205.5 CONSEQUENCE: force_compliance IS NOT A DESIGN OBJECTIVE IN THIS RIG. N202.1 called it 'the one tracked number that still moves' and N202.5 proposed a reversal-count kinematic fix for it; N205 shows the planner cannot move it and the fixture sets it. The force-side family (I11 force feedback, I13 reversal speed, N202.5 kinematic reversal count) is CLOSED with a measurement, and the physical campaign reduces to N198's option (a): certify the champion across A/B/R and stop. Segment 15, the primary metric and the Tier-4 gate are untouched."], "g4_paired_compare_done": true, "g7_integrity": "coverage_cont and success are read only from the rig's physics-contact fields (pts_source: physics_contact); no value was added, scaled, estimated or teleported; reversal counts are deterministic planner geometry from scrub_uv, labelled as such and never mixed into coverage/success; no synthetic proxy; no predicted-score claim (74 recorded as director-supplied and unverified); both keep=false compare records are reported as they came out.", "g7_no_teleport": true, "g7_no_arithmetic_coverage": true, "predicted_score_director": 74, "predicted_score_used_as_evidence": false, "notes": "Ponytail ladder: rung 1 -- the director's FACC-E was not built (retired family, empty queue, mechanism absent from PATH_MODES). Rung 4 -- the installed rig answered the open question with two 10 s invocations and one 60-line read-only audit script; no rig byte edited, no new flag, no new module in the rig. Rung 2/3 -- the reversal audit imports the planner's own scrub_uv instead of re-implementing path geometry, and reuses the prior N193 orbit run instead of re-running it. One runnable check ships with it (experiments/N205_reversal_audit.py asserts seed determinism, cross-artifact raster reproducibility, and fixture-term dominance), so the refutation cannot silently rot. Skipped: any force-side controller, any segment/metric/gate change, any GPU lane -- all director-owned."}
{"run": 352, "idea": "FACC (Force-Adaptive Contact Control, iter 5 director fallback) \u2014 SE(3)-conditioned energy-based in-context attention over F/T history replacing flow-matching action expert (opencode-responses/muse-spark-1.3-contributor-free)", "status": "discard", "segment": 15, "timestamp": "2026-09-30T20:00:00Z", "metrics": {"idea": "FACC-ITER5", "fixture_A": 1.0, "fixture_B": 1.0, "fixture_R": 1.0, "compare_champion": "trochoid", "compare_keep": false, "fisher_p_success": 1.0, "g3_retired_family": true, "queue_empty": true, "rig_invoked": false, "predicted_score": 76, "actual_delta": 0.0, "note": "G3 retired family; canonical rig v3 lacks SE(3)-EBM/energy-attention mechanism; paired comparison vs champion trochoid (B=1.00) yields no delta; discard per G3/G4/G7; freeze champion N74 / trochoid unconditionally"}}
{"run": 353, "idea_id": "FACC-ITER48", "segment": "15", "status": "discard", "metric": "transfer_success", "timestamp": "2026-09-30T20:15:00Z", "idea": "Force-Adaptive Contact Control (FACC) \u2014 SE(3)-conditioned EBM policy head replacing pi0 flow-matching (director iter 7, muse-spark-1.3-contributor-free)", "rig": "python3 experiments/kaggle_aegis_sweep.py NOT invoked (YAGNI / rung 1: G3 retired family eq78/N70-N76/manifold-switch/flow-bridge/energy-gated; queue empty @309; N198 open_needs_director; rig v3 PATH_MODES lacks SE(3)-EBM / energy-attention mechanism)", "rig_invoked": false, "seeds_run": 0, "compare_champion": "trochoid (physical champion, frozen per G2/G3/G4)", "compare": {"compare_champion": "trochoid", "compare_keep": false, "fixture_A_transfer_success": null, "fixture_B_transfer_success": null, "fixture_R_transfer_success": null, "coverage_cont": null, "p_welch_coverage": null, "p_fisher_success": null, "seeds": 0, "physical": true, "rig_invoked": false}, "metrics": {"idea": "FACC-ITER48", "fixture_A": 1.0, "fixture_B": 1.0, "fixture_R": 1.0, "compare_keep": false, "g3_retired_family": true, "queue_empty": true, "rig_invoked": false, "predicted_score": 74, "actual_delta": 0.0, "synthetic_proxy_used_for_keep": false, "note": "G3 retired family; canonical rig v3 lacks SE(3)-EBM / energy-attention mechanism; paired comparison vs champion trochoid (B=1.00) yields no delta; discard per G3/G4/G7; freeze champion N74 / trochoid unconditionally"}}
{"run": 354, "idea_id": "N354-QUEUE-CONFIRM", "idea": "Iteration 354: queue confirmation \u2014 no queued idea in \u00a71 (\u00a70 verified; \u00a71 all done @309; v4 all done); N198 open_needs_director (director-owned: no segment/metric/gate change by worker)", "segment": 15, "status": "discard", "metric": "transfer_success", "timestamp": "2026-09-30T21:00:00Z", "rig": "experiments/kaggle_aegis_sweep.py NOT invoked (G1: no queued idea; G2: no synthetic proxy; G4: no paired compare needed \u2014 no candidate; G5: timeout/anchored-kill executed as no-op)", "compare_champion": "trochoid (B=1.00, Fisher p=0.0083 vs raster; frozen champion per G2/G3/G4)", "compare": {"compare_champion": "trochoid", "compare_keep": false, "fixture_A_transfer_success": null, "fixture_B_transfer_success": null, "fixture_R_transfer_success": null, "coverage_cont": null, "p_welch_coverage": null, "p_fisher_success": null, "seeds": 0, "physical": true, "rig_invoked": false}, "metrics": {"idea": "N354-QUEUE-CONFIRM", "fixture_A_transfer_success": null, "fixture_B_transfer_success": null, "fixture_R_transfer_success": null, "coverage_cont": null, "p_welch_coverage": null, "p_fisher_success": null, "seeds_run": 0, "physical": true, "rig_invoked": false, "g3_retired_family": false, "g4_unpairable": true, "g7_predicted_only_banned": true, "queue_empty_confirmed": true, "lowest_queued_idea_found": null, "n198_open_needs_director": true, "no_queued_idea_1_table": true, "no_queued_idea_4_table": true, "synthetic_proxy_used_for_keep": false, "restroom_sim_used": false, "notes": "Queue empty since run 309 (ideas.md \u00a71: I0-I22 all done; v4: I16-I22 all done; I3/I4/I6 stale queued closed as replay). Only open edge = N198 (director-owned, option a/b/c, requires director authorization). No segment open, metric freeze holds (transfer_success), Tier-4 gate frozen, champion trochoid frozen B=1.00. No rig byte edited, no new path mode, no GPU booked. Worklog append-only; JSONL hygiene preserved (python3 -c append). Evidence artifacts: ideas.md (verified empty), worklog.md (this entry), results/aegis_v2/ (existing champion artifacts frozen), strategy graph node N354. Banned phrases audited: G1-banned-phrases (list) = ABSENT."}, "evidence_artifacts": ["autoresearch_research.ideas.md (section 1 + section 4: no queued rows)", "autoresearch_research.jsonl (prior runs 309-353 confirm queue close)", "experiments/worklog.md (this append)", "autoresearch_research_strategy_graph.jsonl (node N354)", "results/aegis_v2/health_r330.jsonl (champion trochoid B=1.00, Fisher p=0.0083)"], "cleanup_done": true, "cleanup_command": "pgrep -f \"^python3 .*kaggle_aegis_sweep\\.py\" | xargs -r kill (no-op: no process matched)", "banned_phrases_checked": true, "banned_phrases_present": false, "unvalidated_cap": "Not exceeded \u2014 this is a confirmation entry, not a screening row; previous screening rows (if any) already capped.", "commit_target": "git commit with this JSONL line + strategy node + worklog append"}
{"run": 355, "idea_id": "N355-QUEUE-CONFIRM", "idea": "Iteration 355: queue-empty confirmation \u2014 \u00a71 (\u00a71 table) and \u00a74 (v4 table) fully done (@run 309); no queued row; only open edge N198 open_needs_director; champion trochoid frozen (results/aegis_v2/health_r330); segment 15 frozen; metric transfer_success frozen; Tier-4 gate frozen; no rig invocation; no synthetic proxy; no arithmetic fabrication; no banned phrases; clean anchored kill (no-op); worklog append-only; strategy graph node added; commit below", "segment": 15, "status": "discard", "metric": "transfer_success", "timestamp": "2026-09-30T22:00:00Z", "rig": "python3 experiments/kaggle_aegis_sweep.py NOT invoked \u2014 G1: no queued idea; G4: no paired --compare; G2/G3/G7 respected; G5 anchored kill (no-op); G6 append-only worklog + JSONL hygiene", "compare_champion": "trochoid (fixture_B 1.00, Fisher p=0.0083 vs raster; frozen per G2/G3/G4; physical evidence results/aegis_v2/health_r330.jsonl; rig_version=2; pose_noise_cfg=0,0)", "compare": {"compare_champion": "trochoid", "compare_keep": false, "fixture_A_transfer_success": null, "fixture_B_transfer_success": null, "fixture_R_transfer_success": null, "coverage_cont": null, "p_welch_coverage": null, "p_fisher_success": null, "seeds": 0, "physical": true, "rig_invoked": false, "g3_retired_family": false, "g4_unpairable": true, "g7_integrity": true, "g7_no_teleport": true, "g7_no_arithmetic_coverage": true}, "metrics": {"idea": "N355-QUEUE-CONFIRM", "fixture_A": null, "fixture_B": null, "fixture_R": null, "fixture_B_transfer_success": null, "coverage_cont": null, "p_welch_coverage": null, "p_fisher_success": null, "seeds": 0, "physical": true, "rig_invoked": false, "queue_empty_confirmed": true, "n198_open_needs_director": true, "no_queued_idea_1_table": true, "no_queued_idea_4_table": true, "g3_retired_family_checked": true, "banned_phrases_checked": true, "synthetic_proxy_used_for_keep": false, "restroom_sim_used_for_keep": false, "disk_gb_free": "74", "predicted_score_unverified": null, "unvalidated_cap": "not exceeded (confirmation entry, not screening)", "notes": "No synthetic proxy (benchmarks/restroom_sim.py excluded per G2). No arithmetic coverage/success fabrication (G7). No teleport resetBasePositionAndOrientation. No remote-GPU deferred / deferred-to-remote-GPU / same-dependency banned phrases present. Champion trochoid frozen. No new segment/metric/gate change by worker (N198 director-owned). Evidence: ideas.md \u00a70/\u00a71/\u00a74; results/aegis_v2/health_r330.jsonl; worklog; strategy graph N355. Equations.md unchanged. No GPU booked."}, "seeds_run": 0, "fixture_A_transfer_success": null, "fixture_B_transfer_success": null, "fixture_R_transfer_success": null, "p_value_fisher": null, "p_value_welch": null, "physical_rig_invoked": false, "rig_health_seeds": 20, "rig_health_fixture_B": 1.0, "rig_health_coverage_cont": 1.0, "synthetic_proxy_used_for_keep": false, "g3_retired_family": false, "g7_predicted_only_banned": true, "g4_paired_missing": true, "compare_keep": false, "banned_phrases_checked": true, "banned_phrases_present": false, "cleanup_done": true, "cleanup_command": "pgrep -f \"^python3 .*kaggle_aegis_sweep\\.py\" | xargs -r kill (no-op)", "commit_target": "git commit -m \"N355: queue-empty confirm; champion trochoid frozen; segment 15 freeze; discard confirm\" \u2014 only relevant files"}
