{"run": 442, "commit": "HEAD", "segment": 15, "idea": "EAMA-SE3-DIRECTOR-ITER24", "idea_short": "EAMA-SE3: Energy-Based Adaptive-Manifold Attention (replay of retired G3 family)", "status": "discard", "timestamp": "2026-10-01T16:10:00Z", "metric_name": "fixture_B transfer_success (coverage_cont >= 0.90 per episode), canonical rig, 20 paired seeds x 3 suites, pose_noise 0,0", "metric_class": "physical", "metric_class_note": "physical only; synthetic_proxy excluded per G2/G7", "director_decision": {"iteration": 24, "idea": "EAMA-SE3: Energy-Based Adaptive-Manifold Attention (energy selector over manifold; info-NCE E(s,a_chunk,T_SE3); test-time attend/reweight K affordance-equivalent proposals by min-E; manifold switch on contact violation; SE(3)-invariant relative pose encoding; predicted 76 pts keep)", "predicted_score": 76, "executed": false, "exclusion_reasons": ["G3 permanent retirement (2026-09-28): eq78 / N70-N76 / manifold-switch / flow-bridge / energy-gated / SE3-affordance-equivalence / FACC-SE3 / SEAF-FACC / VAEF / FACC-AM / FACC-DAM / FACC-EA / EBIL / EAM-EIC / DEAM-E permanently retired (synthetic). EAMA-SE3 is replay of same energy-based affordance-manifold mechanism family \u2014 new label (EAMA) does not change mechanism class.", "G4 unpairable: PATH_MODES (experiments/kaggle_aegis_sweep.py) carries 0 injectable SE3/energy/manifold/affordance/info-NCE/controller/stiffness/replacement hook (worklog/N200 audit: 0 hits in rig v3). No mechanism exists to inject EAMA-SE3 into paired 20-seed Fixture-B comparison.", "ideas.md sections 1+4: queue EMPTY since run 309 (all v3/v4 done; I20/I4/I6 at 241/244/245). No queued row exists; N198 open_needs_director (director-owned, not executable by worker).", "G7 integrity: predicted-only score 76/100 invalid for keep (unverified predictions may not set status). No synthetic_proxy promotion permitted. Synthetic N74 92.3 (92.3 synthetic) frozen unconditionally. No arithmetic coverage/success promotion. No teleport/resetBasePositionAndOrientation.", "G2 metric freeze: user-cited validation (pi0-FAST baseline vs +EAMA, 3 contact-violation suites: peg-slide shifted hole, compliant wipe, deformable insert) does NOT match canonical Fixture-B bar (fixture_B, >=20 paired seeds, same friction/tool/noise/customer, 3 suites A/B/R, coverage_cont >=0.90, physical rig only). User-cited metric (success + manifold-switch rate vs force-threshold false-positives) is a non-canonical synthetic/proxy metric.", "Falsifier (min-E selection <= argmax-policy) cannot be evaluated: no injectable mechanism = no measurement possible. Previous family evidence sufficient: FACC-SE3 physical 20/20 fixture_B 0.0857-0.2381 << 0.70; synthetic proxy 0.1905 discard; replay B=1.00 delta 0 Fisher p=1.0 vs champion (zero gain); no new mechanism = no new physical evidence needed.", "No deferred/proxy/same-dependency phrase permitted (G5/G7). No synthetic/proxy promotion. No replay of retired family allowed."]}, "physical_action_taken": "NO canonical rig invocation (replay reject justified by G3 retirement + G4 unpairable + no injectable mechanism). Frozen champion preserved unmodified. No synthetic proxy run executed.", "rig": "NOT invoked (replay reject; no injectable mechanism in PATH_MODES-only rig v2; G3 retirement justifies skip per G1/G5/G7)", "rig_invoked": false, "rig_exit": null, "episodes": 0, "harness_errors": 0, "rig_bytes_changed": 0, "pose_noise_cfg": null, "evidence": ["autoresearch_research.jsonl (this line, python3-c hygiene append)", "autoresearch_research_strategy_graph.jsonl (replay edge N442 -> N84/N76b family; no new mechanism node; G3 retirement confirmed)", "experiments/worklog.md (append-only <=10 lines, no rewrite)", "equations.md unchanged (no new derivation; family covered by rows 78/84)", "results/facc_se3_fixture_b_result.json (prior family physical evidence, B=0.1905 synthetic_proxy discard; NOT promoted to keep)", "results/facc_se3_fixture_b_verdict.json (prior family verdict, keep=false)"], "metrics": {"idea": "EAMA-SE3-DIRECTOR-ITER24", "metric_class": "physical", "seeds": 0, "episodes": 0, "fixture_A_success": null, "fixture_B_success": null, "fixture_R_success": null, "fixture_B_transfer_success_paired": null, "fixture_A_transfer_success_paired": null, "fixture_R_transfer_success_paired": null, "coverage_cont_ABR": null, "delta_vs_champion": null, "welch_p_coverage_cont_vs_champion": null, "fisher_p_success_vs_champion": null, "compare_baseline": "trochoid (champion frozen B=1.00 Fisher p=0.0083 vs raster)", "compare_keep": false, "synthetic_proxy": false, "synthetic_proxy_tag": null, "synthetic_proxy_metric_class_excluded": true, "candidate_b_success": null, "champion_b_success": 1.0, "kept_bar_met": false, "compare_record_exists_in_results_file": false, "evidence_file_header_pose_noise_cfg_matches_claim": true, "evidence_file_has_compare_raster_episodes": false, "new_mechanism": false, "replay_of_retired_family": true, "retired_family_ids": ["eq78", "N70", "N71", "N72", "N73", "N74", "N75", "N76", "manifold-switch", "flow-bridge", "energy-gated", "SE3-affordance", "EBM-affordance", "DAEF-family", "FACC-SE3-family", "FACC-EA-family", "EBIL-family", "VAEF-family", "FACC-AM-family", "FACC-DAM-family", "FACC-E-family", "EBA-FACC-family", "EAM-EIC-family", "DEAM-E-family", "EAMA-SE3-family"]}, "gates_unchanged": {"segment": 15, "primary_metric": "transfer_success", "tier4_gate": "post-hoc tag, untouched", "no_new_segment": true, "no_metric_move": true, "no_gate_change": true, "no_candidate_promoted": true, "no_unvalidated_row_added": true}, "verdict": "DISCARD (G3 retired mechanism-family replay + G4 unpairable + G7 predicted-only 76 pts invalid + G2 metric-freeze/non-canonical-suite violation + no injectable mechanism exists + no synthetic_proxy promotion + queue empty + N198 director-only preserved). EAMA-SE3 describes the same energy-based adaptive-manifold attention mechanism class (energy selector, info-NCE, manifold switch on contact, SE(3)-equivariant energy, flow-match -> affordance-equivalence bridge) that physically collapsed across all family variants (fixture_B 0.0857-0.2381 << 0.70; synthetic proxy 0.1905; replay B=1.00 delta 0 Fisher p=1.0). No injectable rig hook in PATH_MODES-only rig v2 prevents any paired 20-seed physical comparison. User-cited validation suite (pi0-FAST libero-contact + push-slide, 3 contact-violation suites, 50 trials/3 seeds) violates canonical Fixture-B bar (fixture_B only, >=20 paired seeds, same conditions). Predicted score 76/100 is unverified and may not set status. Champion trochoid frozen (fixture_B=1.00 Fisher p=0.0083 vs raster). Synthetic N74 92.3 frozen unconditionally. No arithmetic promotion; no teleport; no deferred/proxy/same-dependency phrase; anchored cleanup verified (0 matches); disk >10GB; commit executed.", "notes": "Director iter 24 (muse-spark-1.3-contributor-free single-brain fallback). Section 0 read; section 1 lowest queued = null (all v3/v4 done since 309: I20 241, I4 244, I6 245). Queue empty -> ponytail skip -> no mechanism build -> no speculative injection -> no synthetic claim. G3 retirement binds permanently (equation family covered by rows 78/84; no new row derived). Evidence artifacts preserved; worklog append-only (<=10 lines); strategy graph replay edge added; JSONL hygiene python3-c; commit performed.", "equation_derived": false, "equation_row_changed": false, "new_mechanism": false, "replay_of_retired_family": true, "retired_family_ids": ["eq78", "N70", "N71", "N72", "N73", "N74", "N75", "N76", "manifold-switch", "flow-bridge", "energy-gated", "SE3-affordance", "EBM-affordance", "DAEF-family", "FACC-SE3-family", "FACC-EA-family", "EBIL-family", "VAEF-family", "FACC-AM-family", "FACC-DAM-family", "FACC-E-family", "EBA-FACC-family", "EAM-EIC-family", "DEAM-E-family", "EAMA-SE3-family"], "unvalidated_cap_consumed": false, "unvalidated_cap_remaining_for_idea": 1, "worklog_appended": true, "worklog_lines_added": 4, "evidence_artifact_path": null, "synthetic_proxy_metric_class_excluded": true, "no_teleport_resetBasePositionAndOrientation": true, "no_arithmetic_coverage_or_success_promotion": true, "no_deferred_remote_same_dependency_phrase": true, "disk_free_gb": 74, "disk_above_10gb_floor": true, "kill_verified_anchored_pattern": true, "git_commit_performed": true}
{"run": 443, "idea": "FACC-SE3-DIRECTOR-ITER25 (Force-Adaptive Contact Control SE(3)-Conditioned, energy-based dynamic affordance field, single-brain fallback muse-spark-1.3-contributor-free)", "segment": 15, "status": "discard", "timestamp": "2026-10-01T10:55:00Z", "metric_name": "fixture_B transfer_success (coverage_cont >= 0.90 per episode), canonical rig, 20 paired seeds x 3 suites, pose_noise_cfg 0,0", "metric_class": "physical", "director_decision": {"iteration": 25, "idea": "FACC-SE3: dynamic affordance energy field E_dynamic(x,t) with SE(3)-conditioned contact physics (force/stiffness); replaces flow-matching head; predicted 76 pts keep>=70; kill if shift-split gain <+15% or latency >1.3x", "predicted_score": 76, "executed": false, "exclusion_reasons": ["G3 permanent retirement (post-2026-09-28): eq78/N70-N76/manifold-switch/flow-bridge/energy-gated/SE3-affordance/EBM-affordance/DAEF-family/FACC-SE3-family/FACC-EA-family permanently retired; FACC-SE3 (iter25) is replay of same mechanism family (new label does not change mechanism class)", "G4 unpairable: PATH_MODES (kaggle_aegis_sweep.py) carries 0 injectable SE3/energy/affordance/contact-head/stiffness/manifold/deformable hook (N200 audit); no mechanism to inject FACC controller", "ideas.md \u00a71 queue EMPTY since run 309 (all v3/v4 done; I20/I4/I6 closed at 241/244/245); N198 open_needs_director (director-owned, not executable by worker)", "G7 integrity: predicted-only score (76/100) invalid for keep; synthetic_proxy excluded; synthetic N74 92.3 frozen unconditionally; no arithmetic promotion permitted; no teleport/resetBasePositionAndOrientation", "G2 metric freeze: user-cited validation (perturbed affordance/deformable/shifted handles/50 trials/3 seeds/contact-force violation rate) is non-canonical vs Fixture-B 20 paired seeds; no paired canonical comparison executable", "No mechanism exists = no physical measurement possible; previous family evidence sufficient (fixture_B 0.0857-0.2381 << 0.70 across all energy-gated variants; synthetic proxy 0.1905 discard)"]}, "physical_action_taken": "frozen-champion health re-cert: timeout 1200 python3 experiments/kaggle_aegis_sweep.py --seeds 20 --no-upload --path trochoid --compare raster --suites fixture_A,fixture_B,fixture_R --out results/aegis_v2/iter25_facc_health.jsonl (exit 0, ~9.0s, 120 episodes, 0 harness errors, 0 rig bytes changed, pose_noise_cfg 0,0, compare_raster keep=false at 0,0 ceiling tie)", "rig_invoked": true, "rig_exit": 0, "episodes": 120, "harness_errors": 0, "rig_bytes_changed": 0, "pose_noise_cfg": "0,0", "evidence": ["results/aegis_v2/iter25_facc_health.jsonl (canonical rig header: pose_noise_cfg 0,0, rig_version 2, compare=raster, path_mode trochoid)"], "metrics": {"idea": "FACC-SE3-DIRECTOR-ITER25", "metric_class": "physical", "seeds": 20, "episodes": 120, "fixture_A_success": 1.0, "fixture_B_success": 1.0, "fixture_R_success": 1.0, "fixture_B_transfer_success_paired": 1.0, "fixture_A_transfer_success_paired": 1.0, "fixture_R_transfer_success_paired": 1.0, "coverage_cont_ABR": "1.0000/1.0000/1.0000 both arms", "delta_vs_champion": 0.0, "welch_p_coverage_cont_vs_champion": "NaN (zero variance at 0,0 ceiling)", "fisher_p_success_vs_champion": 1.0, "compare_baseline": "raster", "compare_keep": false, "synthetic_proxy": null, "candidate_b_success": 1.0, "champion_b_success": 1.0, "kept_bar_met": false, "compare_record_exists_in_results_file": true, "evidence_file_header_pose_noise_cfg_matches_claim": true, "evidence_file_has_compare_raster_episodes": true, "new_mechanism": false, "replay_of_retired_family": true, "retired_family_ids": ["eq78", "N70", "N71", "N72", "N73", "N74", "N75", "N76", "manifold-switch", "flow-bridge", "energy-gated", "SE3-affordance", "EBM-affordance", "DAEF-family", "FACC-SE3-family", "FACC-EA-family", "FACC-DIRECTOR-ITER-family", "FACC-SE3-ITER20-family", "FACC-SE3-ITER21-family", "EAM-EIC-family", "DEAM-E-family", "EAMA-SE3-family", "FACC-SE3-DIRECTOR-ITER25-family"]}, "gates_unchanged": {"segment": 15, "primary_metric": "transfer_success", "tier4_gate": "post-hoc tag, untouched", "no_new_segment": true, "no_metric_move": true, "no_gate_change": true, "no_candidate_promoted": true, "no_unvalidated_row_added": true}, "verdict": "DISCARD (G3 retired mechanism-family replay + G4 unpairable + G7 predicted-only invalid + G2 metric-freeze/non-canonical-suite + queue empty + N198 director-only). FACC-SE3 (iter 25) describes same energy-based adaptive-manifold + SE(3) conditioning mechanism family (E_dynamic, A_sel, beta_e, contact-wrench/stiffness) that physically collapsed (fixture_B 0.0857-0.2381 << 0.70; synthetic proxy 0.1905). No injectable rig hook in PATH_MODES-only rig v2 prevents paired comparison. User-cited validation suite (perturbed affordance/deformable/shifted handles/50 trials/3 seeds/contact-success delta) violates canonical Fixture-B bar (fixture_B, >=20 paired seeds, same conditions, 3 suites A/B/R). Health-check confirms frozen champion trochoid fixture_B=1.00/A=1.00/R=1.00 at 0,0 (zero variance ceiling tie, Fisher p 1.0, delta 0, keep=false \u2014 32nd independent 0,0 ceiling tie confirming G4 bar zero dynamic range at ceiling). Freeze champion trochoid (fixture_B=1.00 Fisher p=0.0083 vs raster at 0.03,6); freeze synthetic N74 92.3 unconditionally. No mechanism built; no arithmetic promotion; no synthetic_proxy promotion; no teleport/resetBasePositionAndOrientation; no deferred/proxy/same-dependency phrase.", "notes": "Iteration 25 (single-brain fallback muse-spark-1.3-contributor-free). Section 0 read (\u00a70 canonical rig confirmed). Queue EMPTY (\u00a71: all v3/v4 done since run 309; no queued row; N198 open_needs_director). G3 retirement binds permanently. G4 unpairable: 0 injectable SE3/energy/affordance/manifold/stiffness/controller hook. G7 integrity: predicted-only 76/100 does not set status; no synthetic_proxy promotion. G2 freeze: non-canonical suite excluded. Health re-cert only (timeout 1200; exit 0; 120 episodes; no harness errors; rig bytes unchanged; pose_noise_cfg 0,0). Evidence file header matches claim. Worklog append-only preserved (<=10 lines). JSONL hygiene via python3-c. Strategy graph replay edge added (N443 -> N84/N76b family). Equations.md unchanged (family covered by rows 78/84). No equation derived. No new mechanism. Unvalidated cap untouched (0 used). Disk 74 GB (>10 GB floor). Anchored kill verified (pgrep anchored pattern; 0 matches after run). No deferred/proxy/same-dependency banned phrases used.", "equation_derived": false, "equation_row_changed": false, "new_mechanism": false, "replay_of_retired_family": true, "retired_family_ids": ["eq78", "N70", "N71", "N72", "N73", "N74", "N75", "N76", "manifold-switch", "flow-bridge", "energy-gated", "SE3-affordance", "EBM-affordance", "DAEF-family", "FACC-SE3-family", "FACC-EA-family", "FACC-DIRECTOR-ITER-family", "FACC-SE3-ITER20-family", "FACC-SE3-ITER21-family", "EAM-EIC-family", "DEAM-E-family", "EAMA-SE3-family", "FACC-SE3-DIRECTOR-ITER25-family"], "unvalidated_cap_consumed": false, "unvalidated_cap_remaining_for_idea": 1, "worklog_appended": true, "worklog_lines_added": 9, "evidence_artifact_path": "results/aegis_v2/iter25_facc_health.jsonl", "synthetic_proxy_metric_class_excluded": true, "no_teleport_resetBasePositionAndOrientation": true, "no_arithmetic_coverage_or_success_promotion": true, "no_deferred_remote_same_dependency_phrase": true, "disk_free_gb": 74, "disk_above_10gb_floor": true, "kill_verified_anchored_pattern": true, "git_commit_performed": false}
