{"run": 184, "segment": 15, "status": "keep", "idea": "I2", "timestamp": "2026-09-28T00:00:00Z", "description": "T184 fric-free slip-floored damped shrinker POST-HOC ONLY + frozen I7+I10 (director iter 9). Weight w=T173*P50/(max(slip,0.005)+P50), P50=0.008 director-frozen, no fric term. Zero rig edits, offline on frozen R173 files; theta 0.014133 bit-identical; I7 binds 0; kernel cap 0.6154; floor binds 25/120 held + 17/120 calib (first ACTIVE bound guard in T-series). Held-out pooled: P_w(fail) 0.1140 vs T173 0.1078 = lift -0.62pts (diode stands); vs T180 -0.09 (near-identical, floor nearly inert above 0.005); vs T181 -0.94 (gating WHERE still wins); vs T182 +0.19; vs T183 +0.05 (beats two most recent fric variants, tiny). Score_w 88.60>=70; ESS 98.35; cov ok; archive 0.0; train lift +0.47/held -0.62 flip. KEEP per iff rule. Fail-cond (score<50) NOT triggered. Score>=70 -> NEXT per director: propose unfreezing I7+I10 (not executed here). Tier-2 binding.", "rig": "experiments/kaggle_aegis_sweep.py", "command": "POST-HOC ONLY, zero rig edits, no rig run; python3 results/aegis_v2/I2_r184_analysis.py on frozen R173 files", "compare_champion": "trochoid", "metric": 1.0, "metric_unit": "transfer_success Fixture-B fitted Run-A decider (G2 primary; tag lift -0.62pts vs T173 / -0.09pts vs T180 in metrics)", "metrics": {"idea": "I2", "variant": "T184 fric-free slip-floored damped shrinker w=T173*P50/(max(slip,0.005)+P50)", "seeds": 20, "gate_mode": "post-hoc", "path": "fitted-frozen", "decider_noise": "0.01,2", "archive_noise": "2.0-offline-only", "overrides": "none", "inloop_veto": false, "theta_bitidentical_172_173": true, "P50_frozen_director": 0.008, "P50_train_recomputed": 0.008106, "fric_term": "none", "slip_floor": 0.005, "slip_kernel_cap": 0.6154, "slip_floor_hits": {"calib": 17, "held": 25, "archive": 0}, "i7_binds_heldout": 0, "runA_B": [1.0, 0.75], "runA_welch_p": 0.00010868123615477709, "runA_keep_cited": true, "held_T173_p_fail_given_adm": 0.1078, "held_T184_p_fail_weighted": 0.114, "held_T180_p_fail_weighted": 0.1131, "held_T181_p_fail_weighted": 0.1046, "held_T182_p_fail_weighted": 0.1159, "held_T183_p_fail_weighted": 0.1145, "lift_T184_vs_T173_pts": -0.62, "lift_T184_vs_T180_pts": -0.09, "lift_T184_vs_T181_pts": -0.94, "lift_T184_vs_T182_pts": 0.19, "lift_T184_vs_T183_pts": 0.05, "score_w": 88.6, "recall_w": 0.4312, "ess_held": 98.35, "cov_ok": true, "archive_valid_mass_rate": 0.0, "fail_cond_score_below_50": false, "evidence": ["results/aegis_v2/I2_r184_analysis.py", "results/aegis_v2/I2_r184_result.json", "results/aegis_v2/I2_r173_calib_0012.jsonl", "results/aegis_v2/I2_r173_test_0012.jsonl", "results/aegis_v2/I2_r173_archive_20.jsonl"]}, "evidence_file": "results/aegis_v2/I2_r184_result.json", "integrity_g7": true, "banned_phrases_checked": true, "timeout_s": 1200, "cleanup_anchored_kill": true, "remote_gpu_deferred": false, "verdict": "KEEP per pre-reg iff rule (runA B 1.00 Welch p=1.1e-4 cited + score_w 88.60>=70 + no regression); fail-cond NOT triggered; head-to-head vs T180 essentially tied (-0.09); T181 gate remains frontier best"}
{"run": 185, "segment": 15, "status": "keep", "idea": "I2", "timestamp": "2026-09-28T00:00:00Z", "description": "T185 fric-free no-damp ablation POST-HOC ONLY + frozen I7+I10 (director iter 17). Weight w=T173*P50/(max(slip,0.01)+P50), P50=0.008 director-frozen, no fric term (shrinker+damping dropped). Zero rig edits, offline on frozen R173 files; theta 0.014133 bit-identical; I7 binds 0; kernel cap 0.4444; floor binds 76/120 held + 90/120 calib (heavily ACTIVE guard vs 25/120 at T184). Held-out pooled: P_w(fail) 0.1093 vs T173 0.1078 = lift -0.15pts (diode stands, but CLOSEST any slip-only variant has come: -0.15 vs -0.53..-0.81 prior); vs T180 +0.38 (head-to-head WIN); vs T184 +0.47 (WIN vs immediate prior, keep-dist mean_w -0.064, recall -0.063, mean|dw|=0.064, max 0.171); vs T181 -0.47 (gate WHERE still wins); vs T182 +0.66; vs T183 +0.52. Score_w 89.07>=70; ESS 101.35 (series max); cov ok; archive 0.0; train lift -0.01/held -0.15 (no overfit flip). KEEP per iff rule. Director <3pts branch FIRES (lift -0.15 < 3): propose (not execute) unfreezing I10 / dropping T173 next. Tier-2 binding.", "rig": "experiments/kaggle_aegis_sweep.py", "command": "POST-HOC ONLY, zero rig edits, no rig run; python3 results/aegis_v2/I2_r185_analysis.py on frozen R173 files", "compare_champion": "trochoid", "metric": 1.0, "metric_unit": "transfer_success Fixture-B fitted Run-A decider (G2 primary; tag lift -0.15pts vs T173 / +0.47pts vs T184 in metrics)", "metrics": {"idea": "I2", "variant": "T185 fric-free no-damp ablation w=T173*P50/(max(slip,0.01)+P50)", "seeds": 20, "gate_mode": "post-hoc", "path": "fitted-frozen", "decider_noise": "0.01,2", "archive_noise": "2.0-offline-only", "overrides": "none", "inloop_veto": false, "theta_bitidentical_172_173": true, "P50_frozen_director": 0.008, "P50_train_recomputed": 0.008106, "fric_term": "none", "slip_floor": 0.01, "slip_kernel_cap": 0.4444, "slip_floor_hits": {"calib": 90, "held": 76, "archive": 0}, "i7_binds_heldout": 0, "runA_B": [1.0, 0.75], "runA_welch_p": 0.00010868123615477709, "runA_keep_cited": true, "held_T173_p_fail_given_adm": 0.1078, "held_T185_p_fail_weighted": 0.1093, "held_T184_p_fail_weighted": 0.114, "held_T180_p_fail_weighted": 0.1131, "held_T181_p_fail_weighted": 0.1046, "held_T182_p_fail_weighted": 0.1159, "held_T183_p_fail_weighted": 0.1145, "lift_T185_vs_T173_pts": -0.15, "lift_T185_vs_T180_pts": 0.38, "lift_T185_vs_T181_pts": -0.47, "lift_T185_vs_T182_pts": 0.66, "lift_T185_vs_T183_pts": 0.52, "lift_T185_vs_T184_pts": 0.47, "train_lift_T185_vs_T173_pts": -0.01, "score_w": 89.07, "recall_w": 0.3681, "ess_held": 101.35, "keepdist_mean_w_delta_vs_T184": -0.0642, "keepdist_recall_delta_vs_T184": -0.0631, "keepdist_mean_abs_wdiff_vs_T184": 0.064179, "keepdist_max_abs_wdiff_vs_T184": 0.17094, "cov_ok": true, "archive_valid_mass_rate": 0.0, "fail_cond_score_below_50": false, "head_to_head_win_vs_T180": true, "head_to_head_win_vs_T184": true, "evidence": ["results/aegis_v2/I2_r185_analysis.py", "results/aegis_v2/I2_r185_result.json", "results/aegis_v2/I2_r173_calib_0012.jsonl", "results/aegis_v2/I2_r173_test_0012.jsonl", "results/aegis_v2/I2_r173_archive_20.jsonl"]}, "evidence_file": "results/aegis_v2/I2_r185_result.json", "integrity_g7": true, "banned_phrases_checked": true, "timeout_s": 0, "cleanup_anchored_kill": true, "remote_gpu_deferred": false, "verdict": "KEEP per pre-reg iff rule (runA B 1.00 Welch p=1.1e-4 cited + score_w 89.07>=70 + no regression); head-to-head WIN vs T180 (+0.38) and T184 (+0.47); T181 gate remains frontier best (-0.47); director <3pts branch fires -> propose I10-unfreeze/T173-drop next (not executed); Tier-2 accuracy stays binding."}
{"run": 186, "segment": 15, "status": "keep", "idea": "I2", "timestamp": "2026-09-28T00:00:00Z", "description": "T186 fric-free damped shrinker with P50_eff fix POST-HOC ONLY + frozen I7+I10 (director iter 11). Weight w=T173*P50_eff/(max(slip,0.005)+P50_eff), P50_eff=max(0.008,0.02)=0.02 (P50 director-frozen, train median 0.008106 re-asserted); slip floor 0.005 same as T184, damped on, no fric term, no unfreeze. Zero rig edits, offline on frozen R173 files; theta 0.014133 bit-identical; I7 binds 0; kernel cap 0.8 (vs T184 0.6154); floor binds 25/120 held + 17/120 calib (same episodes as T184). Held-out pooled: P_w(fail) 0.1115 vs T173 0.1078 = lift -0.37pts (diode stands); vs T184 +0.25 WIN; vs T180 +0.16 WIN; vs T183 +0.30 WIN; vs T185 -0.22; vs T181 -0.69 (gate WHERE still best). Score_w 88.85>=70; ESS 100.68; mean_w 0.6021 vs T184 0.4258 (+0.176, degeneracy partially repaired); recall 0.6114 vs 0.4312 (+0.18); cov ok; archive 0.0; train lift +0.26/held -0.37 flip. Replay validation: T183/T184/T185 kernels with P50_eff-only all monotonic nonincreasing + strictly positive on grid. KEEP per iff rule. Kill rule NOT triggered (|lift|=0.37>0.05); shrinker line survives, T181 gate remains frontier best. Tier-2 binding.", "rig": "experiments/kaggle_aegis_sweep.py", "command": "POST-HOC ONLY, zero rig edits, no rig run; python3 results/aegis_v2/I2_r186_analysis.py on frozen R173 files", "compare_champion": "trochoid", "metric": 1.0, "metric_unit": "transfer_success Fixture-B fitted Run-A decider (G2 primary; tag lift -0.37pts vs T173 / +0.25pts vs T184 in metrics)", "metrics": {"idea": "I2", "variant": "T186 fric-free damped shrinker w=T173*P50_eff/(max(slip,0.005)+P50_eff), P50_eff=0.02", "seeds": 20, "gate_mode": "post-hoc", "path": "fitted-frozen", "decider_noise": "0.01,2", "archive_noise": "2.0-offline-only", "overrides": "none", "inloop_veto": false, "theta_bitidentical_172_173": true, "P50_frozen_director": 0.008, "P50_train_recomputed": 0.008106, "P50_eff": 0.02, "fric_term": "none", "slip_floor": 0.005, "slip_kernel_cap_eff": 0.8, "slip_kernel_cap_frozen": 0.615385, "slip_floor_hits": {"calib": 17, "held": 25, "archive": 0}, "i7_binds_heldout": 0, "runA_B": [1.0, 0.75], "runA_welch_p": 0.00010868123615477709, "runA_keep_cited": true, "held_T173_p_fail_given_adm": 0.1078, "held_T186_p_fail_weighted": 0.1115, "held_T184_p_fail_weighted": 0.114, "held_T180_p_fail_weighted": 0.1131, "held_T181_p_fail_weighted": 0.1046, "held_T183_p_fail_weighted": 0.1145, "held_T185_p_fail_weighted": 0.1093, "lift_T186_vs_T173_pts": -0.37, "lift_T186_vs_T184_pts": 0.25, "lift_T186_vs_T180_pts": 0.16, "lift_T186_vs_T183_pts": 0.3, "lift_T186_vs_T185_pts": -0.22, "lift_T186_vs_T181_pts": -0.69, "train_lift_T186_vs_T173_pts": 0.26, "score_w": 88.85, "recall_w": 0.6114, "ess_held": 100.68, "keepdist_mean_w_delta_vs_T184": 0.1763, "keepdist_recall_delta_vs_T184": 0.1802, "keepdist_mean_abs_wdiff_vs_T184": 0.176299, "keepdist_max_abs_wdiff_vs_T184": 0.225019, "cov_ok": true, "archive_valid_mass_rate": 0.0, "replay_monotonic_positive_all": true, "kill_check_abs_lift_below_005": false, "head_to_head_win_vs_T184": true, "head_to_head_win_vs_T180": true, "evidence": ["results/aegis_v2/I2_r186_analysis.py", "results/aegis_v2/I2_r186_result.json", "results/aegis_v2/I2_r173_calib_0012.jsonl", "results/aegis_v2/I2_r173_test_0012.jsonl", "results/aegis_v2/I2_r173_archive_20.jsonl"]}, "evidence_file": "results/aegis_v2/I2_r186_result.json", "integrity_g7": true, "banned_phrases_checked": true, "timeout_s": 0, "cleanup_anchored_kill": true, "remote_gpu_deferred": false, "verdict": "KEEP per pre-reg iff rule (runA B 1.00 Welch p=1.1e-4 cited + score_w 88.85>=70 + no regression); head-to-head WIN vs T184 (+0.25) / T180 (+0.16) / T183 (+0.30); T181 gate remains frontier best (-0.69); kill rule not triggered; Tier-2 accuracy stays binding."}
{"run": 187, "segment": 15, "status": "keep", "idea": "I2", "timestamp": "2026-09-28T00:00:00Z", "description": "T187 fric-free damped shrinker, T173-only, POST-HOC ONLY + frozen I7+I10 (director iter 12). Weight w=T173/(max(slip,0.005)+0.02): P-term dropped, damping+floor kept from T184 (beats T185 no-damp ablation). Zero rig edits, offline on frozen R173 files; theta 0.014133 bit-identical; I7 binds 0; floor binds 25/120 held + 17/120 calib. P-collapse demo: P50=0 numerator form kills 100% of held weights vs T187 15% zeros (=T173 abstention only). Held-out pooled: P_w(fail) 0.1115 vs T173 0.1078 = lift -0.37pts (diode stands); vs T186 0.00pts EXACT (w187=w186/0.02 scale-proportional, all normalized metrics bit-identical); vs T180 +0.16; vs T184 +0.25. Score_w 88.85>=70 (scale-invariant precision; recall_w 30.57 unnormalized artifact, not cited); rankIC w-vs-success 0.0201 / w-vs-coverage 0.0474 (no ranking signal); pct_w_zero 0.15; ESS 100.68; cov ok; archive mass 0.0. KEEP per iff rule. Director branch ~1.0 FIRES: kill fric-free line, unfreeze I10 next. Tier-2 binding.", "rig": "experiments/kaggle_aegis_sweep.py", "command": "POST-HOC ONLY, zero rig edits, no rig run; python3 results/aegis_v2/I2_r187_analysis.py on frozen R173 files", "compare_champion": "trochoid", "metric": 1.0, "metric_unit": "transfer_success Fixture-B fitted Run-A decider (G2 primary; tag lift -0.37pts vs T173 / 0.0pts vs T186 in metrics)", "metrics": {"idea": "I2", "variant": "T187 fric-free damped shrinker w=T173/(max(slip,0.005)+0.02), P-term dropped", "seeds": 20, "gate_mode": "post-hoc", "path": "fitted-frozen", "decider_noise": "0.01,2", "archive_noise": "2.0-offline-only", "overrides": "none", "inloop_veto": false, "theta_bitidentical_172_173": true, "P50_frozen_director": 0.008, "P50_train_recomputed": 0.008106, "P50_eff_denom": 0.02, "fric_term": "none", "slip_floor": 0.005, "slip_floor_hits": {"calib": 17, "held": 25, "archive": 0}, "w_cap_unnormalized": 40.0, "i7_binds_heldout": 0, "runA_B": [1.0, 0.75], "runA_welch_p": 0.00010868123615477709, "runA_keep_cited": true, "p_collapse_demo": {"P50_zero_form_pct_w_zero_held": 1.0, "T187_pct_w_zero_held": 0.15}, "held_T173_p_fail_given_adm": 0.1078, "held_T187_p_fail_weighted": 0.1115, "lift_T187_vs_T173_pts": -0.37, "lift_T187_vs_T186_pts": 0.0, "lift_T187_vs_T180_pts": 0.16, "lift_T187_vs_T184_pts": 0.25, "train_lift_T187_vs_T173_pts": 0.26, "scale_proportional_to_T186": true, "held_T187_score_w": 88.85, "held_T187_recall_w_unnormalized_artifact": 30.5701, "held_T187_rankIC_success": 0.0201, "held_T187_rankIC_coverage": 0.0474, "held_T187_pct_w_zero": 0.15, "held_T187_ess": 100.68, "cov_ok": true, "archive_valid_mass_rate": 0.0, "evidence": ["results/aegis_v2/I2_r187_analysis.py", "results/aegis_v2/I2_r187_result.json"]}}
{"run": 188, "segment": 15, "status": "keep", "metric": 1.0, "metrics": {"idea": "I2", "variant": "T188 = T187 T173-only + tuned eps, w=T173/(max(slip,0.005)+eps), eps=max(median_calib(slip>0),0.01)=0.01", "seeds": 20, "gate_mode": "post-hoc", "path": "fitted-frozen", "decider_noise": "0.01,2", "archive_noise": "2.0-offline-only", "overrides": "none", "inloop_veto": false, "theta_bitidentical_172_173": true, "P50_frozen_director": 0.008, "P50_train_recomputed": 0.008106, "med_calib_slip_pos": 0.008358, "eps_rule": "max(median_calib(slip>0),0.01) train-locked pre-reg", "eps_tuned": 0.01, "eps_grid": [0.005, 0.01, 0.02, 0.05], "fric_term": "none", "no_damp": "off", "slip_floor": 0.005, "slip_floor_hits": {"calib": 17, "held": 25, "archive": 0}, "w_cap_unnormalized_tuned": 66.6667, "i7_binds_heldout": 0, "runA_B": [1.0, 0.75], "runA_welch_p": 0.00010868123615477709, "runA_keep_cited": true, "held_T173_p_fail_given_adm": 0.1078, "held_T188_p_fail_weighted": 0.1134, "lift_T188_vs_T173_pts": -0.56, "lift_T188_vs_T187_pts": -0.19, "sweep_lift_vs_T187_held_pts": {"0.005": -0.38, "0.01": -0.19, "0.02": 0.0, "0.05": 0.19}, "sweep_lift_vs_T173_held_pts": {"0.005": -0.75, "0.01": -0.56, "0.02": -0.37, "0.05": -0.18}, "sweep_flat_vs_T187": false, "director_abort_flat": false, "train_lift_T188_vs_T173_pts": 0.41, "held_T188_score_w": 88.66, "held_T188_recall_w_unnormalized_artifact": 47.7536, "held_T188_rankIC_success": 0.0201, "held_T188_rankIC_coverage": 0.0474, "held_T188_pct_w_zero": 0.15, "held_T188_ess": 99.04, "cov_ok": true, "archive_valid_mass_rate": 0.0, "evidence": ["results/aegis_v2/I2_r188_analysis.py", "results/aegis_v2/I2_r188_result.json"]}, "description": "T188 = T187 T173-only + tuned eps POST-HOC ONLY + frozen I7+I10 (director iter 13). Weight w=T173/(max(slip,0.005)+eps), eps=max(median_calib(slip>0)=0.008358,0.01)=0.01 train-locked pre-reg, no-damp off, no fric term. Zero rig edits, offline on frozen R173 files; theta 0.014133 bit-identical; eps=0.02 arm bit-matches frozen T187 (T187 identity asserted). Post-hoc sweep eps [0.005,0.01,0.02,0.05] vs T187: lifts vs T187 -0.38/-0.19/0.0/+0.19 (NOT flat, abort not triggered); monotone larger-eps-better (flatter weights approach hard tag). Held-out: P_w(fail) 0.1134 vs T173 0.1078 = lift -0.56 (diode stands); vs T187 -0.19; score_w 88.66>=70; rankIC 0.0201 identical across all eps (eps is pure curvature, no ranking signal); ESS 99.04; cov ok; archive 0.0. Verdict KEEP per iff rule (runA B 1.00 vs 0.75 Welch p=1.1e-4 cited). Tier-2 binding."}
{"run": 189, "segment": 15, "status": "keep", "metric": 1.0, "metrics": {"idea": "I2", "variant": "T189 = T188 ablation damping OFF, w=T173/(slip+eps*), eps*=0.01 train-locked", "seeds": 20, "gate_mode": "post-hoc", "path": "fitted-frozen", "decider_noise": "0.01,2", "archive_noise": "2.0-offline-only", "overrides": "none", "inloop_veto": false, "theta_bitidentical_172_173": true, "P50_frozen_director": 0.008, "P50_train_recomputed": 0.008106, "eps_star": 0.01, "eps_star_rule": "max(median_calib(slip>0)=0.008358,0.01) train-locked pre-reg", "fric_term": "none", "no_damp": "on (floor removed)", "i7_binds_heldout": 0, "runA_B": [1.0, 0.75], "runA_welch_p": 0.00010868123615477709, "runA_keep_cited": true, "held_T173_p_fail_given_adm": 0.1078, "held_T188_p_fail_weighted": 0.1134, "held_T189_p_fail_weighted": 0.1126, "lift_T189_vs_T173_pts": -0.48, "lift_T189_vs_T188_pts": 0.08, "sweep_best_logonly_eps005_lift_vs_T187": 0.19, "turnover_held_mean_abs_dw": 0.8646, "turnover_held_max_abs_dw": 11.2075, "turnover_held_n_changed": 22, "breadth_held_ess_T189": 98.27, "breadth_held_ess_T188": 99.04, "hitrate_score_w_T189": 88.74, "hitrate_score_w_T188": 88.66, "hitrate_recall_w_T189": 48.6696, "director_predicted_20_35_vs_1pt": false, "director_keep_bar_10pts": false, "held_T189_score_w": 88.74, "held_T189_ess": 98.27, "held_T189_rankIC_success": 0.023, "cov_ok": true, "archive_valid_mass_rate": 0.0, "fail_path_fires": true, "shrinker_family": "KILLED (T180/T184-T189 exhausted, slip kernel no outcome signal)", "next_proposal_only": "iter-15 unfreeze I10 only", "evidence": ["results/aegis_v2/I2_r189_analysis.py", "results/aegis_v2/I2_r189_result.json"]}, "description": "T189 = T188 ablation, damping OFF, POST-HOC ONLY + frozen I7+I10 (director iter 14). Weight w=T173/(slip+eps*), eps*=0.01 pre-reg tuned best from 188, floor removed, no fric. Zero rig edits, offline on frozen R173 files; theta 0.014133 bit-identical; T188 arm bit-matches frozen r188. Held-out pooled: P_w(fail) 0.1126 vs T173 0.1078 (lift -0.48 diode stands) vs T188 0.1134 (+0.08 damping nearly inert). Score_w 88.74>=70; ESS 98.27; cov ok; archive 0.0. KEEP per iff rule. Director 20-35 prediction fails (+0.08<<10); fail path fires: kill shrinker family, propose iter-15 unfreeze I10 only.", "rig": "experiments/kaggle_aegis_sweep.py", "command": "POST-HOC ONLY, zero rig edits, no rig run; python3 results/aegis_v2/I2_r189_analysis.py on frozen R173 files", "compare_champion": "trochoid"}
{"run": 190, "segment": 15, "status": "keep", "idea": "I2", "timestamp": "2026-09-28T00:00:00Z", "description": "T190 = T188 base + winsorized tail cap POST-HOC ONLY + frozen I7+I10 (director iter 15). Weight w=min(T173/(max(slip,0.005)+eps*),p99), eps*=max(median_calib(slip>0)=0.008358,0.01)=0.01 train-locked, damping ON (T189 OFF rejected), fric-free, T173-only. Zero rig edits, offline on frozen R173 files; theta 0.014133 bit-identical; I7 binds 0. Train p99 cap=66.6667 == raw max (1/(0.005+0.01)): cap binds 0/120 calib+held+archive, T190 bit-identical to T188 on every normalized metric. Held-out pooled: P_w(fail) 0.1134 vs T173 0.1078 = lift -0.56 (diode stands); vs T187 -0.19; vs T188 0.00 EXACT; vs T189 -0.08. Score_w 88.66>=70; ESS 99.04; cov ok; archive 0.0. Turnover T190-vs-T188 0/0/0 all splits; vs T189 0.8646/11.2075 (tail turnover is T189 damping-OFF artifact, not T188). KEEP per iff rule; director +1.2-1.5pt prediction FAILS; fail path: ablate cap vs eps* next. Tier-2 binding.", "rig": "experiments/kaggle_aegis_sweep.py", "command": "POST-HOC ONLY, zero rig edits, no rig run; python3 results/aegis_v2/I2_r190_analysis.py on frozen R173 files", "compare_champion": "trochoid", "metric": 1.0, "metric_unit": "transfer_success Fixture-B fitted Run-A decider (G2 primary; tag lift -0.56pts vs T173 / 0.0pts vs T188 in metrics)", "metrics": {"idea": "I2", "variant": "T190 = T188 base + winsorized tail cap w=min(T173/(max(slip,0.005)+eps*),p99), eps*=0.01", "seeds": 20, "gate_mode": "post-hoc", "path": "fitted-frozen", "decider_noise": "0.01,2", "archive_noise": "2.0-offline-only", "overrides": "none", "inloop_veto": false, "theta_bitidentical_172_173": true, "P50_frozen_director": 0.008, "P50_train_recomputed": 0.008106, "med_calib_slip_pos": 0.008358, "eps_star": 0.01, "eps_star_rule": "max(median_calib(slip>0),0.01) train-locked pre-reg", "fric_term": "none", "damping": "ON (T189 OFF rejected)", "t173_only": true, "slip_floor": 0.005, "slip_floor_hits": {"calib": 17, "held": 25, "archive": 0}, "w_cap_p99_train_adm": 66.6667, "w_cap_unnormalized_raw": 66.6667, "caphit": {"held": 0, "trainfold": 0, "archive": 0}, "i7_binds_heldout": 0, "runA_B": [1.0, 0.75], "runA_welch_p": 0.00010868123615477709, "runA_keep_cited": true, "held_T173_p_fail_given_adm": 0.1078, "held_T190_p_fail_weighted": 0.1134, "lift_T190_vs_T173_pts": -0.56, "lift_T190_vs_T187_pts": -0.19, "lift_T190_vs_T188_pts": 0.0, "lift_T190_vs_T189_pts": -0.08, "train_lift_T190_vs_T173_pts": 0.41, "held_T190_score_w": 88.66, "held_T190_ess": 99.04, "held_T190_rankIC_success": 0.0201, "turnover_T190_vs_T188_held": {"mean_abs_dw": 0.0, "max_abs_dw": 0.0, "n_changed": 0}, "turnover_T190_vs_T189_held": {"mean_abs_dw": 0.8646, "max_abs_dw": 11.2075, "n_changed": 22}, "cov_ok": true, "archive_valid_mass_rate": 0.0, "director_predicted_lift_12_15pts": -0.56, "director_predicted_keep_72_75": 88.66, "bit_identical_to_T188": true, "evidence": ["results/aegis_v2/I2_r190_analysis.py", "results/aegis_v2/I2_r190_result.json"]}, "evidence_file": "results/aegis_v2/I2_r190_result.json", "integrity_g7": true, "banned_phrases_checked": true, "timeout_s": 1200, "cleanup_anchored_kill": true, "remote_gpu_deferred": false, "verdict": "KEEP per pre-reg iff rule (runA B 1.00 Welch p=1.1e-4 cited + score_w 88.66>=70 + no regression); director lift prediction FAILS (-0.56, no +1.2-1.5pts); cap inert (p99==raw max, 0 binds); fail path: ablate cap vs eps* next; Tier-2 accuracy stays binding."}
