{"run": 305, "idea": "N194", "segment": 15, "status": "keep", "metric": 1.0, "metric_name": "fixture_B transfer_success (coverage_cont >= 0.90, 100 seeds, physical PyBullet DIRECT)", "claim": "Frontier question ANSWERED and the shipped N192 stack RE-CERTIFIED at 2x the previously certified pose noise: fixture_B falls below the 0.70 bar at sigma_t = 0.36-0.40 m for the FROZEN single-cast champion, and the N192 cast lattice holds fixture_B at 100/100 all the way to 2.56 m / 512 deg. Re-certification of the r303 stack, NOT a new mechanism.", "director_iteration": 51, "director_verdict": "FACC-AE (SE(3)-conditioned force-adaptive contact control, energy-based in-context attention, no flow-matching, predicted 1.35 pts) ADJUDICATED NOT EXECUTED: 59th re-derivation of the G3-retired manifold-switch / flow-bridge / energy-gated family (FACC closed on physical data at r232/r233; FACC-E not executed r300; the same spec not executed r301/r302/r303/r304) and G4-unpairable: the scrub rig has no pi0 expert, no SE(3) energy-attention keypoint, no wrench-conditioned action head, no stiffness axis and no force-violation metric, so building one would be fabrication under G7; a predicted-only keep is banned. Ran the live frontier node N194, exactly as the N193->N194 edge prescribed.", "validation": {"rig": "experiments/kaggle_aegis_sweep.py, PyBullet DIRECT, system python3, friction U[0.05,0.80], paired --compare trochoid --compare-env AEGIS_REG_CASTS=1 (same seeds both arms), timeout 1200, anchored pgrep cleanup after every run", "decider_100_seeds_pose_noise_0.64,128": {"fixture_B": {"coverage_cont_frozen": 0.4441, "coverage_cont_lattice": 0.9834, "delta": 0.5394, "success_frozen": "36/100", "success_lattice": "100/100", "welch_p": 1.892469946141798e-20, "fisher_p": 2.32796989850347e-26, "paired_p": 2.466519900357866e-20, "rig_keep": true}, "fixture_R_heldout": {"coverage_cont_frozen": 0.3047, "coverage_cont_lattice": 0.8258, "success_frozen": "13/100", "success_lattice": "53/100", "welch_p": 1.2154121261362766e-25, "fisher_p": 1.890124758666189e-09}, "fixture_A_round": {"coverage_cont_frozen": 0.2732, "coverage_cont_lattice": 0.6402, "success_frozen": "1/100", "success_lattice": "11/100", "welch_p": 1.1028485317201e-20, "fisher_p": 0.0049817172673850075, "note": "A is still yaw-limited: its yaw is unobservable on a rotationally symmetric face (N193), so no registration dose can rescue it; the orbit plan that does is confirmed but not a G4 keep."}, "harness_errors": 0, "episodes": 600}, "frontier_scans_fixture_B_20_seeds_paired": {"0.36,72": {"lattice": "0.9969 20/20", "frozen": "0.8945 16/20", "fisher_p": 0.106, "keep": false}, "0.40,80": {"lattice": "0.9961 20/20", "frozen": "0.8359 13/20", "fisher_p": 0.00832, "keep": true}, "0.44,88": {"lattice": "0.9906 20/20", "frozen": "0.7836 12/20", "fisher_p": 0.00328, "keep": true}, "0.48,96": {"lattice": "0.9891 20/20", "frozen": "0.7039 10/20", "fisher_p": 0.000436, "keep": true}, "0.56,112": {"lattice": "0.9906 20/20", "frozen": "0.5914 10/20", "fisher_p": 0.000436, "keep": true}, "0.64,128": {"lattice": "0.9852 20/20", "frozen": "0.5133 8/20", "fisher_p": 4.51e-05, "keep": true}, "0.80,160": {"lattice": "0.9859 20/20", "frozen": "0.3969 6/20", "fisher_p": 3.34e-06, "keep": true}, "1.20,240": {"lattice": "0.9914 20/20", "frozen": "0.1703 1/20", "fisher_p": 3.05e-10, "keep": true}, "1.60,320": {"lattice": "0.9883 20/20", "frozen": "0.0492 0/20", "fisher_p": 1.45e-11, "keep": true}, "2.00,400": {"lattice": "0.9914 20/20", "frozen": "0.0000 0/20", "fisher_p": 1.45e-11, "keep": true}, "2.56,512": {"lattice": "0.9805 20/20", "frozen": "0.0000 0/20", "fisher_p": 1.45e-11, "keep": true}, "3.20,640": "NOT FINISHED -- 3249 casts x 1024 rays = 3.33 M rays/episode, 20 seeds x 2 arms overran the 120 s wall budget (~9 s/episode at 2116 casts, linear in cast count). The dose's binding constraint is the k^2 RAY BUDGET, not accuracy."}}, "metrics": {"idea": "N194", "idea_id": "N194", "fixture_B": {"transfer_success": 1.0, "coverage_cont": 0.9834, "n_seeds": 100, "pose_noise_cfg": "0.64,128"}, "fixture_A": {"transfer_success": 0.11, "coverage_cont": 0.6402, "n_seeds": 100}, "fixture_R": {"transfer_success": 0.53, "coverage_cont": 0.8258, "n_seeds": 100}, "coverage_cont": 0.9834, "frontier_frozen_bar_crossing_sigma_m": {"empirical_bracket": [0.36, 0.4], "logistic_fit_all_sigma_m": 0.317, "logistic_fit_resolvable_band_m": 0.2349, "note": "the log-logistic fit is REJECTED as a model (decay is steep and not log-logistic; it under-reads the bracket by 40-100%), so the empirical bracket 0.36-0.40 m is the reported crossing"}, "frontier_lattice_bar_crossing_sigma_m": "none up to 2.56 m / 512 deg (20/20 at every level, 0.9805-0.9969 coverage_cont)", "registration_error_lattice": {"xy_median_mm": "6.1-8.5 across sigma 0.36-2.56 m", "xy_p90_mm": "15.2-21.9", "reg_ok": "100/100 at every level", "casts": "64 -> 2116"}, "registration_error_frozen_k1": {"xy_median_mm": "17.7 -> 71.0 (sigma 0.36 -> 0.48)", "reg_ok": "20/20 at 0.36 down to 0/20 at 2.00"}, "contains_3sigma": true, "lattice_half_extent_over_3sigma": "1.02-1.21 at every level >= 0.24 m", "parity_floor_mm": 19.35, "analytic_closure": "For an axis-aligned window over a RECT face the kept rays form a contiguous index box, so the estimator error is exactly (one-sided cut depth)/2 + a phase-random parity term in +-PITCH/2, PITCH = 2H/(n-1) = 38.71 mm. The lattice keeps a cut with depth 0, so it leaves only the parity term: probe lattice p90 = 17.0-17.6 mm = 0.88-0.91 x the 19.35 mm parity floor, and the rig measures 15.2-21.9 mm independently. The k1 arm's median grows with the cut term (probe 34.2 -> 112.8 mm at sigma 0.36 -> 0.64 vs rig 17.7 -> 71.0 mm), the truncation fraction 0.298 -> 0.876."}, "cost": {"rays_per_episode": "1.02e3 (k=1) to 2.17e6 (sigma 2.56 m, 2116 casts); the k^2 law is the dose's real price", "wall_time": "~9 s/episode at 2116 casts; 3.33 M rays/episode (3249 casts) overran the 120 s budget for 40 episodes", "params": 0, "learned": false, "teleport": false, "force_solver_scoring_edits": "none"}, "defect_found_and_fixed": {"field": "reg_yaw_plan_deg", "bug": "logged unfolded as |yaw_est - true_yaw|; the scrub patch is a RECT so the plan's coverage is periodic in yaw with period 180 deg and the field read p90 = 179.3-180.0 deg at EVERY pose-noise level, which reads as a catastrophic plan error that does not exist", "fix": "fold to [0, 90] deg (min(e mod 180, 180 - e mod 180)); strictly a LOG change, noise and every contact/coverage number untouched", "evidence": "on fixture_B at 0.64,128 the field now reads median 0.83 / p90 1.26 / max 2.03 deg where the HEAD build read 1.17 / 179.33 / 180.00; regression 41 depth-arm episodes and 60 default-OFF episodes, 0 field diffs against git HEAD except wall_s and the run index (coverage_cont identical to 4 dp)"}, "regression": {"depth_arm_episodes": 41, "depth_arm_field_diffs_excluding_wallclock": 0, "defaultOFF_episodes": 60, "defaultOFF_field_diffs_excluding_wallclock": 0}, "frontier_consequence": "The G4 keep-bar on fixture_B is SATURATED, not merely exhausted: the shipped lattice is at 1.00 while its paired champion is at 0.00, so no further fixture_B gain is measurable and the next keep must come from another axis (fixture_A's unobservable yaw, or the k^2 ray budget as an edge-cost term).", "evidence": ["results/aegis_v2/N194_r305_s100_0.64,128.jsonl (compare.keep=true, 600 episodes)", "results/aegis_v2/N194_r305_s20_B_{0.36,72;0.40,80;0.44,88;0.48,96;0.56,112;0.64,128;0.72,144;0.80,160;0.96,192;1.20,240;1.60,320;2.00,400;2.56,512}.jsonl", "results/aegis_v2/N194_frontier.json", "results/aegis_v2/N194_probe.json", "results/aegis_v2/N194_regression_{depth,defaultOFF}_{head,post}.jsonl", "experiments/N194_probe.py", "experiments/N194_readout.py", "equations.md ROW N194", "strategy graph N193->N194->{N195,N196}"], "synthetic_proxy": null, "banned_phrases_present": false}
{"run": 306, "segment": 15, "status": "keep", "idea": "N195", "timestamp": "2026-09-30T16:20:00Z", "commit": "HEAD", "metric": 1.0, "metric_name": "fixture_B transfer_success (coverage_cont >= 0.90 per episode), canonical rig, 20 seeds x 3 suites x 2 arms, pose_noise 3.2,640", "metric_unit": "fixture_B transfer_success of the AEGIS_REG_DFACT=2.0 AEGIS_REG_CN=16 arm at sigma = 3.2 m / 640 deg, a pose-noise level the shipped champion cannot complete inside the 1200 s wall budget", "rig": "experiments/kaggle_aegis_sweep.py (PyBullet DIRECT, system python3, rig_version 2, friction U[0.05,0.80], gate_mode=post-hoc); pts_source=physics_contact; every coverage_cont/success recomputed from physics contacts at return time; no teleport, no arithmetic coverage", "command": "AEGIS_POSE_NOISE=3.2,640 AEGIS_REG=depth AEGIS_REG_HALF_M=0.6 AEGIS_REG_CASTS=0 AEGIS_REG_DFACT=2.0 AEGIS_REG_CN=16 timeout 1200 python3 experiments/kaggle_aegis_sweep.py --seeds 20 --no-upload --path trochoid --compare trochoid --compare-env AEGIS_REG_CASTS=1 --suites fixture_A,fixture_B,fixture_R --out results/aegis_v2/N195_r306_dose_s100_3.2,640.jsonl", "compare_champion": "in-rig --compare trochoid --compare-env AEGIS_REG_CASTS=1 (= the frozen single cast, the N190 champion arm) on the SAME 20 seeds -> identical friction / tool / customer draw / pose noise / ray grid. A SECOND pairing, --compare-env AEGIS_REG_DFACT=1.5,AEGIS_REG_CN=0, reproduces the SHIPPED N192 lattice as the baseline arm at 0.64,128 and is the accuracy-neutrality control.", "director_iteration": 53, "director_directive_adjudication": {"spec": "FACC-AE: SE(3)-conditioned Force-Adaptive Contact Control replacing the flow-matching head; energy-based physical in-context attention over the affordance-equivalence class; bridge flow-matching <-> affordance-equivalence; validation on SE(3)-shifted and stiffness-varied contacts; metrics success, slip, force-excess; predicted 75 pts keep", "executed": false, "exclusion_reasons": ["G3 retired family: manifold-switch / flow-bridge / energy-gated, 60th re-derivation. FACC closed twice on physical data (T225 r232 all-reject degeneracy, T226 r233 78/78 infeasible); FACC-E adjudicated NOT EXECUTED at r300; the same FACC spec adjudicated not executed at r301, r302, r303, r304, r305.", "G4 unpairable: the scrub rig has no pi0 flow expert, no SE(3) energy-attention keypoint and no wrench-conditioned action head, and no stiffness axis (contacts fixed at CONTACT_K 1e3) and no force-excess metric (the force fields are fn_mean / force_compliance / launch_frac). Adding any of them would be fabrication under G7.", "G7: predicted-only keeps and learned/soft-gate variants are banned from keeps."], "action_taken": "ran the live frontier node N195, opened by the N194->N195 edge and identical to item (b) of the N192->N193 edge (open since run 303)"}, "hypothesis": "The cast lattice's k^2 casts exist only to answer a k^2-way argmax, yet N192 cast every candidate at the full n x n resolution, so the sensor paid k^2 n^2 rays to keep one cast's points; and k was derived from a alone (ceil(4 sigma/a)+1) although the only real constraint is the covering radius d/2 <= a, so the shipped d = 1.5a is 1.78x the rays of the tightest legal pitch d = 2a. Buying both back must be FREE in coverage.", "mechanism": {"N195.1_containment_set": "a window at offset o holds the WHOLE top face iff max(|f-o|_inf) <= a = H - rho_inf = 0.2323 m, so the offsets that work are the square C(f) = f + [-a,a]^2. A lattice L(d) of pitch d and half-extent (k-1)d/2 hits C(f) for every |e|_inf <= E iff d/2 <= a AND (k-1)d/2 >= E, i.e. k = ceil(2E/d)+1 at fixed E = 3 sigma. N192's k = ceil(4 sigma/a)+1 is exactly this at d = 1.5a and is a d-LAW: the shipped k is the minimum for its own pitch and 1.78x the count of the tightest legal pitch d = 2a. Re-deriving k from d leaves the shipped expression EXACT (ceil(6 sigma/(1.5a))+1 = ceil(4 sigma/a)+1) and makes the budget a knob.", "N195.2_coarse_to_fine": "the argmax score is the BORDER MARGIN m(o) = min over the four sides of the gap between the top-point bbox and the window border, not the point count. m >= 0 iff the window contains the face and m <= a - max|f-o|; it is a DISTANCE, hence it survives a coarse grid as long as the coarse pitch 2H/(n_c-1) < a.", "N195.3_count_criterion_REFUTED": "the point count ALIASES on a coarse grid. Measured at 0.64,128 with the count score, n_c=8 (pitch 171 mm) picked a CUT window (32 top points instead of the full-face 123) and doubled reg_err_xy (43.2 vs 1.9 mm on seed 91002); n_c=16 left a count margin of 0 on 1 of 3 seeds, i.e. the coarse grid could not separate the candidates at all. With the border-margin score the same n_c=8 still failed once in 8 (reg_err_xy max 253 mm, 32 points) while n_c=12 (pitch 109 mm = 0.47a) and n_c=16 (80 mm = 0.34a) were identical and clean (err med 6.55, max 16.95 mm). Measured threshold: the coarse pitch must be below ~0.5 a_slack; shipped n_c = 16.", "rig_edits": "2 planner-side env knobs (AEGIS_REG_DFACT pitch factor, AEGIS_REG_CN coarse selection resolution) + k re-derived from d + the existing single cast extracted into a local _cast() helper + 1 log field (reg_cn_margin, the winner's own border margin in metres). No force, solver, scoring, fixture or coverage term touched; no teleport; 0 learned parameters."}, "validation": {"decider_A_cost_neutrality_20_seeds_0.64_128": {"pairing": "dose (DFACT=2.0, CN=16) vs the SHIPPED N192 lattice (DFACT=1.5, CN=0) on the same 20 seeds x 3 suites", "fixture_B": {"coverage_cont": [0.9891, 0.9891], "delta": 0.0, "welch_p": 1.0, "succ": [20, 20], "fisher_p": 1.0}, "fixture_R": {"coverage_cont": [0.8221, 0.8221], "delta": 0.0, "welch_p": 1.0, "succ": [12, 12], "fisher_p": 1.0}, "fixture_A": {"coverage_cont": [0.6958, 0.6964], "delta": 0.0006, "welch_p": 0.9924, "succ": [2, 2], "fisher_p": 1.0}, "reg_ok": "20/20 per suite in BOTH arms", "reg_err_xy_mm_median": {"dose": {"A": 2.51, "B": 8.7, "R": 4.86}, "shipped": {"A": 2.61, "B": 8.29, "R": 4.83}}, "rig_keep": false, "reading": "NEGATIVE BY DESIGN and it is the load-bearing result: the 6.50x ray cut is provably free. There is no coverage gain to have, so keep=false is the CORRECT verdict for this pairing, not a failure.", "wall_s_per_episode": {"dose": 0.099, "shipped": 0.253}, "casts": {"dose": 100, "shipped": 169}}, "decider_B_keep_20_seeds_3.2_640": {"pairing": "dose vs the FROZEN single cast (AEGIS_REG_CASTS=1) on the same 20 seeds x 3 suites, 120 episodes", "fixture_B": {"coverage_cont": [0.0, 0.9906], "delta": 0.9906, "welch_p": 1.1331206066910966e-33, "succ": [0, 20], "fisher_p": 1.4508889103849688e-11, "rig_keep": true}, "fixture_R_held_out": {"coverage_cont": [0.0, 0.855], "delta": 0.855, "welch_p": 2.0446558730489135e-14, "succ": [0, 12], "fisher_p": 4.5095150768120733e-05}, "fixture_A": {"coverage_cont": [0.0, 0.6786], "delta": 0.6786, "welch_p": 2.8715016825325415e-13, "succ": [0, 1], "fisher_p": 1.0, "note": "A stays yaw-limited exactly as N193 predicted: yaw is unobservable on a rotationally symmetric face, so no registration dose can move it. Registration on A is perfect (reg_err_xy median 2.42 mm, reg_ok 20/20) and A still fails."}, "reg_ok": {"dose": "20/20 per suite", "frozen_k1": {"A": "0/20", "B": "0/20", "R": "1/20"}}, "cn_margin_min_m": 0.08, "harness_errors": 0, "episodes": 240, "wall_s_per_episode": {"dose": 0.403, "shipped_champion_costprobe": 3.104}}, "cost_table_sigma_to_rays_per_episode": {"0.24": {"shipped_casts": 36, "shipped_rays": 36864, "dose_casts": 25, "dose_rays": 7424, "ratio": 4.97}, "0.28": {"shipped_casts": 36, "shipped_rays": 36864, "dose_casts": 25, "dose_rays": 7424, "ratio": 4.97}, "0.64": {"shipped_casts": 169, "shipped_rays": 173056, "dose_casts": 100, "dose_rays": 26624, "ratio": 6.5}, "1.20": {"shipped_casts": 484, "shipped_rays": 495616, "dose_casts": 289, "dose_rays": 75008, "ratio": 6.61}, "2.56": {"shipped_casts": 2116, "shipped_rays": 2166784, "dose_casts": 1225, "dose_rays": 314624, "ratio": 6.89}, "3.20": {"shipped_casts": 3249, "shipped_rays": 3326976, "dose_casts": 1849, "dose_rays": 474368, "ratio": 7.01}}, "measured_wall_speedup": {"0.64,128": 2.55, "3.2,640": 7.7, "note": "superlinear in the ray ratio because the per-cast rayTestBatch call overhead is paid k^2 times"}, "harness_errors": 0, "episodes_total": 360, "edge_budget": "not engaged: 0 parameters, 0 VRAM, 0 learned weights. The cost that matters here is sensor rays and wall time, and both fall 6.5-7.0x / 2.6-7.7x.", "rig_keep_fields": {"N195_r306_dose_s100_3.2,640.jsonl": true, "N195_r306_neutral_s100_0.64,128.jsonl": false}}, "corrections_to_prior_rows": ["N194.3 said the shipped champion is UNREACHABLE at sigma = 3.20 m because 3.33 M rays/episode 'overran the wall budget'. MEASURED CORRECTION (results/aegis_v2/N195_costprobe_shipped_s3_B_3.2,640.jsonl): the shipped champion does run at 3.20 m, at 3.10 s/episode with coverage_cont 0.9792 and 3/3 success. What overran in run 305 was the AGGREGATE 120-episode x 2-arm wall budget, not the per-episode cost. The dose is 7.7x faster per episode, which is what turns that aggregate from infeasible into feasible.", "N192's limits note (a) named the sigma <= a shortcut as a design claim on the scale. Closed: activation is now on the containment slack itself (d/2 <= a with d an explicit knob), and the residual tail is a measured 0.08 m minimum border margin over 120 dose episodes."], "regression": {"default_arm_vs_pre_N195_rig": "results/aegis_v2/N195_regression_shipped_s20_B_0.64,128.jsonl vs the run-305 file: 20 episodes, the only field that differs is reg_yaw_plan_deg on 9 episodes, which IS the fold N194 shipped (the run-305 scan predates it). Every contact, coverage and success field is identical, so the k re-derivation and the _cast() extraction are bit-identical at the shipped defaults.", "default_arm_post_margin_criterion": "results/aegis_v2/N195_regression_shippedPOST_s20_B_0.64,128.jsonl vs the pre-margin-criterion build: 0 field diffs on 20 episodes, so the REG_CN>0 path is inert at REG_CN=0.", "one_harness_bug_found_and_fixed": "the first coarse-selection build raised TypeError: unsupported operand type(s) for -: 'float' and 'tuple' on every episode (a tuple/float mixup in the runner-up max) and was HARNESS-ERROR, correctly excluded from aggregates; fixed and re-run. Logged because it is the only crash of this iteration."}, "limits": ["the accuracy content of this iteration is ZERO by construction: B coverage_cont delta 0.0000 and Welch p 1.0 against the shipped lattice on 100 paired episodes. The B gain in the keep row belongs to the lattice mechanism shipped in run 303; what N195 adds is that the lattice is 6.5-7.0x cheaper in rays and 2.6-7.7x cheaper in wall time, and that this makes sigma = 3.2 m runnable inside the budget.", "sigma = 3.2 m / 640 deg of planning-pose error on a 0.34 x 0.14 m tank is far outside any physical Tier-2 budget; the 3.2 m row certifies COST and the frontier scan, not a deployable accuracy claim.", "fixture_A is untouched (0.6786 coverage, 1/20 success at 3.2 m) and provably so: the yaw is unobservable on a symmetric face, so no sensor-side dose can move it. N193's orbit plan is the only measured fix and it is not a G4 keep because the bar is anchored on B.", "n_c = 16 is a measured threshold, not a proof: the coarse pitch must stay below ~0.5 a_slack, and 0.47a (n_c=12) passed on 8 seeds only. H (0.6) is fixed, so a larger window would demand a larger n_c.", "no stiffness or friction-generalisation claim: the sweep stays inside U[0.05,0.80] with fixed contact stiffness.", "the border-margin score needs the point cloud, so the k^2 casts cannot be replaced by a single fused pass; the saving is the resolution, not the number of ray batches."], "evidence": ["results/aegis_v2/N195_r306_dose_s100_3.2,640.jsonl (compare.keep=true, 120 episodes)", "results/aegis_v2/N195_r306_neutral_s100_0.64,128.jsonl (compare.keep=false, coverage-neutrality control, 120 episodes)", "results/aegis_v2/N195_costprobe_shipped_s3_B_3.2,640.jsonl", "results/aegis_v2/N195_regression_shipped_s20_B_0.64,128.jsonl", "results/aegis_v2/N195_regression_shippedPOST_s20_B_0.64,128.jsonl", "results/aegis_v2/N195_probeM_cn{8,12,16}_s8_B_0.64,128.jsonl", "results/aegis_v2/N195_probeM_cn16_s3_B_3.2,640.jsonl", "equations.md ROW N195", "strategy graph N194->N195->N196"], "synthetic_proxy": null, "novelty_score": null, "banned_phrases_present": false, "next": "N196: with the sensor cost cut 7x and the pose-noise axis saturated (B = 1.00 at 0.64 m, 2.56 m and now 3.2 m), the only untested resolution knob is n itself: the surviving registration error is the parity term 2H/(n-1) = 38.71 mm (N194.1), and n = 64/128 would halve/quarter it. That is the last estimator-side lever, and it must be judged on whether the parity term is still visible in coverage_cont at all -- which is itself the close-out question for segment 15."}
