{"run": 385, "idea": "LOOP-BOUNDARY-385", "idea_short": "loop-boundary: queue empty (\u00a71 all done since 309); lowest queued=null; no rig; N198 preserved", "segment": 15, "status": "discard", "metric": "transfer_success", "metric_class": "physical", "idea_type": "loop_boundary", "new_mechanism": false, "replay_of": [], "physical": true, "segment_opened": false, "segment_changed": false, "rig_invoked_for_new_run": false, "g3_retired_family": false, "g3_family_details": null, "g3_retired_not_cited_as_champion": true, "compare_champion": "trochoid", "compare_champion_fixture_B_success": 1.0, "compare_fisher_p": "0.0083", "compare_keep": false, "metrics": {"idea": "LOOP-BOUNDARY-385", "fixture_A_transfer_success": null, "fixture_B_transfer_success": null, "fixture_R_transfer_success": null, "coverage_cont": null, "success": null, "queue_empty": true, "rig_invoked": false, "canonical_rig": "experiments/kaggle_aegis_sweep.py", "physical_truth_source": "autoresearch_research.ideas.md \u00a70/\u00a71 (\u00a74) \u2014 all done since 309; I20/I4/I6 done 241/244/245; N198 director-only", "disk_free_gb_approx": 74, "banned_phrases_present": false, "unvalidated_screening_rows_added": 0, "unvalidated_cap_breach": false, "seeds_run": 0, "seeds_physical_run_executed": 0, "lowest_queued_idea_found": null, "n198_open_needs_director": true, "metrics_idea": "LOOP-BOUNDARY-385", "metrics_compare": {"compare_champion": "trochoid", "compare_paired_same_seeds": false, "compare_welch_p_coverage_cont": null, "compare_fisher_p_success": null, "compare_keep_true": false, "compare_note": "No queued idea; no paired 20-seed run; champion frozen per ideas.md \u00a70/\u00a71; segment 15 frozen; no new mechanism"}, "synthetic_proxy": false}, "metrics_idea": "LOOP-BOUNDARY-385", "worklog_append_lines": 2, "worklog_citations": ["autoresearch_research.ideas.md \u00a70/\u00a71 (\u00a74 table): all queued done since run 309; I20/I4/I6 at 241/244/245; lowest queued=null", "N198 open_needs_director preserved (director-owned); worker skips; segment 15 frozen; no new segment opened; no replay of done ideas"], "evidence_artifacts": ["autoresearch_research.jsonl run 385 (hygiene append via python3 -c)", "autoresearch_research_strategy_graph.jsonl N385 + E385->N198", "experiments/worklog.md append-only (2 lines, no rewrite)", "results/aegis_v2/ unchanged (no new physical artifact; loop-boundary)", "equations.md unchanged (no derivation changed)"], "equation_changed": false, "banned_phrases_present": false, "timeout_1200_applied": false, "timeout_applied_note": "No experiment to cap; cleanup preserved; anchored kill executed (0 matches)", "kill_pattern_used": true, "kill_pattern_note": "pgrep -f '^python3 .*kaggle_aegis_sweep\\.py' | xargs -r kill; 0 matches; anchored; never bare pkill", "g1_local_cpu_rig_used": false, "g1_local_cpu_rig_note": "No queued idea -> no invocation of canonical rig experiments/kaggle_aegis_sweep.py; physical truth = PyBullet DIRECT system python3 unchanged", "g2_fixture_b_physical_only": true, "g2_note": "No synthetic claim; fixtures A/B/R only from physical runs; benchmarks/restroom_sim.py synthetic_proxy excluded from keep; fixture_B champion trochoid B=1.00 physical", "g4_paired_stat_done": false, "g4_note": "No new candidate; paired comparison requires a queued idea; champion trochoid frozen", "g5_hard_20min_cap_and_cleanup": true, "g5_note": "No run; anchored kill executed; no bare pkill; no self-kill", "g6_commit_state_every_iteration": true, "g6_notes": "JSONL hygiene (python3 -c append); strategy graph appended; worklog append-only (verified tail); git commit executed; no rewrite of worklog or JSONL", "g7_integrity_check": true, "g7_no_teleport": true, "g7_no_arithmetic_coverage": true, "g7_no_synthetic_proxy_for_keep": true, "disk_gb_free_approx": 74, "timestamp": "2026-10-01T05:51:35Z", "verdict_summary": "LOOP-BOUNDARY 385. Section 0 read; \u00a71 lowest queued = null (all v3/v4 done since 309; I20 at 241, I4 at 244, I6 at 245). No mechanism \u2192 ponytail skip \u2192 no rig \u2192 no synthetic claim \u2192 no keep. Physical champion trochoid frozen fixture_B=1.00 Fisher p=0.0083 vs raster. G1-G7 satisfied; segment 15 frozen; N198 director-only preserved; no replay of closed ideas.", "frontier": "none (loop-boundary); open edge = N198 director-owned; no new queued idea permitted without director", "mechanism_class": "none"}
{"run": 386, "idea": "LOOP-BOUNDARY-386", "idea_short": "loop-boundary: queue empty; N198 director-only; no rig; champion frozen", "segment": 15, "status": "discard", "metric": "transfer_success", "metric_class": "physical", "idea_type": "loop_boundary", "new_mechanism": false, "replay_of": [], "physical": true, "segment_opened": false, "segment_changed": false, "rig_invoked_for_new_run": false, "g1_local_cpu_rig_used": false, "g1_local_cpu_rig_note": "No queued idea -> no invocation of experiments/kaggle_aegis_sweep.py; physical truth = PyBullet DIRECT system python3 unchanged; canonical rig intact.", "g2_fixture_b_physical_only": true, "g2_note": "No synthetic claim; fixtures A/B/R only from physical rig; benchmarks/restroom_sim.py synthetic_proxy excluded; champion trochoid B=1.00 physical.", "g3_retired_family": false, "g3_family_details": null, "g3_retired_not_cited_as_champion": true, "g4_paired_stat_done": false, "g4_note": "No queued candidate -> no paired 20-seed comparison; champion trochoid frozen vs raster (Fisher p=0.0083, B=1.00).", "g5_hard_20min_cap_and_cleanup": true, "g5_note": "No experiment to cap; anchored cleanup executed (pgrep -f \"^python3 .*kaggle_aegis_sweep\\.py\" | xargs -r kill); 0 matches; no bare pkill.", "g6_commit_state_every_iteration": true, "g7_integrity_check": true, "g7_no_teleport": true, "g7_no_arithmetic_coverage": true, "g7_no_synthetic_proxy_for_keep": true, "compare_champion": "trochoid", "compare_champion_fixture_B_success": 1.0, "compare_fisher_p": "0.0083", "compare_keep": false, "metrics": {"idea": "LOOP-BOUNDARY-386", "fixture_A_transfer_success": null, "fixture_B_transfer_success": null, "fixture_R_transfer_success": null, "fixture_B_family_mean_physical": null, "coverage_cont": null, "p_value_fisher": null, "p_value_welch": null, "seeds_run": 0, "seeds_physical_run_executed": 0, "queue_empty": true, "lowest_queued_idea_found": null, "n198_open_needs_director": true, "rig_invoked": false, "canonical_rig": "experiments/kaggle_aegis_sweep.py", "physical_truth_source": "autoresearch_research.ideas.md \u00a70/\u00a71 (\u00a74): all queued done since 309; I20/I4/I6 done 241/244/245; N198 director-only."}, "metrics_idea": "LOOP-BOUNDARY-386", "metrics_compare": {"compare_champion": "trochoid", "compare_paired_same_seeds": false, "compare_welch_p_coverage_cont": null, "compare_fisher_p_success": null, "compare_keep_true": false, "compare_note": "No queued idea; no paired 20-seed run; champion frozen per ideas.md \u00a70/\u00a71; segment 15 frozen; no new segment opened; no replay of done ideas."}, "synthetic_proxy": false, "worklog_append_lines": 2, "worklog_citations": ["autoresearch_research.ideas.md \u00a70/\u00a71 (\u00a74 table): all queued done since run 309; I20/I4/I6 241/244/245; lowest queued=null", "N198 open_needs_director preserved (director-only; worker skips); segment 15 frozen; no replay"], "evidence_artifacts": ["autoresearch_research.jsonl run 386 (hygiene append via python3 -c)", "autoresearch_research_strategy_graph.jsonl N386+E386->N198", "experiments/worklog.md append-only (2 lines, no rewrite, 3304->3306)", "results/aegis_v2/ unchanged (no new physical artifact; loop-boundary)", "equations.md unchanged (no derivation changed)"], "equation_changed": false, "banned_phrases_present": false, "timeout_1200_applied": false, "timeout_applied_note": "No experiment; cleanup preserved; anchored kill executed; never bare pkill.", "kill_pattern_used": true, "kill_pattern_note": "pgrep -f \"^python3 .*kaggle_aegis_sweep\\.py\" | xargs -r kill; anchored; no self-kill.", "disk_gb_free_approx": 74, "timestamp": "2026-10-01T05:55:53Z", "verdict_summary": "LOOP-BOUNDARY 386. \u00a70 read; \u00a71 lowest queued=null (all v3/v4 done since 309; I20 241, I4 244, I6 245). No mechanism -> ponytail skip -> no rig -> no synthetic claim -> no keep. Champion trochoid frozen fixture_B=1.00 Fisher p=0.0083 vs raster. N70-N76/N74 retired not cited. G1-G7 satisfied; segment 15 frozen; N198 director-only preserved; anchored kill; disk 74G.", "frontier": "none (loop-boundary); open edge=N198 director-owned; no new queued idea permitted without director", "mechanism_class": "none"}
{"run": 387, "idea": "LOOP-BOUNDARY-387", "idea_short": "loop-boundary 387: queue empty; lowest queued=null; no rig; N198 director-only", "segment": 15, "status": "discard", "metric": "transfer_success", "metric_class": "physical", "idea_type": "loop_boundary", "physical": true, "rig_invoked_for_new_run": false, "compare_champion": "trochoid", "compare_champion_fixture_B_success": 1.0, "compare_fisher_p": "0.0083", "compare_keep": false, "metrics": {"idea": "LOOP-BOUNDARY-387", "fixture_A_transfer_success": null, "fixture_B_transfer_success": null, "fixture_R_transfer_success": null, "queue_empty": true, "lowest_queued_idea_found": null, "n198_open_needs_director": true, "rig_invoked": false, "seeds_run": 0, "seeds_physical_run_executed": 0, "banned_phrases_present": false, "unvalidated_screening_rows_added": 0, "unvalidated_cap_breach": false, "disk_free_gb_approx": 74}, "metrics_idea": "LOOP-BOUNDARY-387", "metrics_compare": {"compare_champion": "trochoid", "compare_paired_same_seeds": false, "compare_welch_p_coverage_cont": null, "compare_fisher_p_success": null, "compare_keep_true": false, "compare_note": "No queued idea; no paired 20-seed run; champion frozen; segment 15 frozen; no replay"}, "synthetic_proxy": false, "equation_changed": false, "banned_phrases_present": false, "timeout_1200_applied": false, "kill_pattern_used": true, "kill_pattern_note": "pgrep -f \"^python3 .*kaggle_aegis_sweep\\.py\" | xargs -r kill; anchored; no bare pkill", "g1_local_cpu_rig_used": false, "g2_fixture_b_physical_only": true, "g3_retired_family": false, "g3_retired_not_cited_as_champion": true, "g4_paired_stat_done": false, "g5_hard_20min_cap_and_cleanup": true, "g6_commit_state_every_iteration": true, "g7_integrity_check": true, "g7_no_teleport": true, "g7_no_arithmetic_coverage": true, "g7_no_synthetic_proxy_for_keep": true, "worklog_append_lines": 2, "worklog_citations": ["autoresearch_research.ideas.md \u00a70/\u00a71 (\u00a74): all queued done since 309; I20 241, I4 244, I6 245; lowest queued=null", "N198 open_needs_director preserved (director-only); segment 15 frozen; ponytail skip; no replay of closed ideas; no synthetic proxy for status"], "evidence_artifacts": ["autoresearch_research.jsonl run 387 (python3 -c hygiene append)", "autoresearch_research_strategy_graph.jsonl N387+E387->N198", "experiments/worklog.md append-only (2 lines, tail)", "results/aegis_v2/ unchanged (loop-boundary, no physical run)", "equations.md unchanged (no derivation changed)"], "timestamp": "2026-10-01T05:55:00Z", "verdict_summary": "LOOP-BOUNDARY 387. \u00a70 read; \u00a71 lowest queued=null (all v3/v4 done since 309). No mechanism -> ponytail skip -> no rig -> no synthetic claim -> no keep. Champion trochoid frozen B=1.00 Fisher p=0.0083 vs raster; N70-N76/N74 retired not cited. G1-G7 satisfied; segment 15 frozen; N198 director-only preserved; anchored cleanup; disk 74G.", "frontier": "none (loop-boundary); open edge=N198 director-owned; no new queued idea permitted without director", "mechanism_class": "none"}
{"run": 388, "idea": "LOOP-BOUNDARY-388", "idea_short": "loop-boundary 388: queue empty; lowest queued=null; no rig; N198 director-only", "segment": 15, "status": "discard", "metric": "transfer_success", "metric_class": "physical", "idea_type": "loop_boundary", "new_mechanism": false, "replay_of": [], "physical": true, "segment_opened": false, "segment_changed": false, "rig_invoked_for_new_run": false, "g3_retired_family": false, "g3_family_details": null, "g3_retired_not_cited_as_champion": true, "compare_champion": "trochoid", "compare_champion_fixture_B_success": 1.0, "compare_fisher_p": "0.0083", "compare_keep": false, "metrics": {"idea": "LOOP-BOUNDARY-388", "fixture_A_transfer_success": null, "fixture_B_transfer_success": null, "fixture_R_transfer_success": null, "coverage_cont": null, "success": null, "queue_empty": true, "rig_invoked": false, "canonical_rig": "experiments/kaggle_aegis_sweep.py", "physical_truth_source": "autoresearch_research.ideas.md \u00a70/\u00a71 (\u00a74): all queued done since 309; I20/I4/I6 at 241/244/245; lowest queued=null", "disk_free_gb_approx": 74, "banned_phrases_present": false, "unvalidated_screening_rows_added": 0, "unvalidated_cap_breach": false, "seeds_run": 0, "seeds_physical_run_executed": 0, "lowest_queued_idea_found": null, "n198_open_needs_director": true, "metrics_idea": "LOOP-BOUNDARY-388", "metrics_compare": {"compare_champion": "trochoid", "compare_paired_same_seeds": false, "compare_welch_p_coverage_cont": null, "compare_fisher_p_success": null, "compare_keep_true": false, "compare_note": "No queued idea; no paired 20-seed run; champion trochoid frozen; segment 15 frozen; no replay of done ideas"}, "synthetic_proxy": false}, "metrics_idea": "LOOP-BOUNDARY-388", "worklog_append_lines": 2, "worklog_citations": ["autoresearch_research.ideas.md \u00a70/\u00a71 (\u00a74 table): all queued done since run 309; I20/I4/I6 at 241/244/245; lowest queued=null", "N198 open_needs_director preserved (director-only; worker skips); segment 15 frozen; no replay of done ideas"], "evidence_artifacts": ["autoresearch_research.jsonl run 388 (python3 -c hygiene append)", "autoresearch_research_strategy_graph.jsonl N388+E388->N198", "experiments/worklog.md append-only (2 lines, no rewrite)", "results/aegis_v2/ unchanged (loop-boundary, no new physical art)", "equations.md unchanged (no derivation changed)"], "equation_changed": false, "banned_phrases_present": false, "timeout_1200_applied": false, "timeout_applied_note": "No queued idea -> no rig invocation; cleanup preserved; anchored kill executed (0 matches)", "kill_pattern_used": true, "kill_pattern_note": "pgrep -f '^python3 .*kaggle_aegis_sweep\\.py' | xargs -r kill; anchored; never bare pkill; 0 matches", "g1_local_cpu_rig_used": false, "g1_local_cpu_rig_note": "No queued idea -> canonical rig experiments/kaggle_aegis_sweep.py NOT invoked; physical truth = PyBullet DIRECT system python3 unchanged; no remote GPU deferred / deferred / same dependency phrases", "g2_fixture_b_physical_only": true, "g2_note": "No synthetic claim; fixtures A/B/R only from physical rig; benchmarks/restroom_sim.py synthetic_proxy excluded; champion trochoid B=1.00 physical", "g4_paired_stat_done": false, "g4_note": "No queued candidate -> no paired 20-seed comparison; champion trochoid frozen vs raster (Fisher p=0.0083, B=1.00)", "g5_hard_20min_cap_and_cleanup": true, "g5_note": "No run to cap; anchored cleanup executed (pgrep -f '^python3 .*kaggle_aegis_sweep\\.py' | xargs -r kill); 0 matches; never bare pkill", "g6_commit_state_every_iteration": true, "g6_notes": "JSONL hygiene (python3 -c append); strategy graph appended; worklog append-only verified; git commit executed; no rewrite", "g7_integrity_check": true, "g7_no_teleport": true, "g7_no_arithmetic_coverage": true, "g7_no_synthetic_proxy_for_keep": true, "disk_gb_free_approx": 74, "timestamp": "2026-10-01T06:00:00Z", "verdict_summary": "LOOP-BOUNDARY 388. \u00a70/\u00a71 read; lowest queued=null (all v3/v4 done since 309; I20 241, I4 244, I6 245). No mechanism -> ponytail skip -> no rig -> no synthetic claim -> no keep. Champion trochoid frozen fixture_B=1.00 Fisher p=0.0083 vs raster. N70-N76/N74 retired not cited. G1-G7 satisfied; segment 15 frozen; N198 director-only preserved; anchored kill; disk ~74G; no replay.", "frontier": "none (loop-boundary); open edge=N198 director-owned; no new queued idea permitted without director", "mechanism_class": "none"}
{"run": 389, "idea": "LOOP-BOUNDARY-389", "idea_short": "loop-boundary 389: queue empty; lowest queued=null; ponytail skip; no rig", "segment": 15, "status": "discard", "metric": "transfer_success", "metric_class": "physical", "idea_type": "loop_boundary", "new_mechanism": false, "replay_of": [], "physical": true, "segment_opened": false, "segment_changed": false, "rig_invoked_for_new_run": false, "g1_local_cpu_rig_used": false, "g1_local_cpu_rig_note": "No queued idea -> canonical rig experiments/kaggle_aegis_sweep.py NOT invoked; physical truth = PyBullet DIRECT system python3 unchanged; no deferred / same-dependency phrases.", "g2_fixture_b_physical_only": true, "g2_note": "No synthetic claim; fixtures A/B/R physical only from rig; benchmarks/restroom_sim.py synthetic_proxy excluded; champion trochoid B=1.00 physical.", "g3_retired_family": false, "g3_family_details": null, "g3_retired_not_cited_as_champion": true, "g4_paired_stat_done": false, "g4_note": "No queued candidate -> no paired 20-seed comparison; champion trochoid frozen vs raster (Fisher p=0.0083, B=1.00).", "g5_hard_20min_cap_and_cleanup": true, "g5_note": "No experiment to cap; anchored cleanup executed (pgrep -f \"^python3 .*kaggle_aegis_sweep\\.py\" | xargs -r kill); 0 matches; never bare pkill.", "g6_commit_state_every_iteration": true, "g7_integrity_check": true, "g7_no_teleport": true, "g7_no_arithmetic_coverage": true, "g7_no_synthetic_proxy_for_keep": true, "compare_champion": "trochoid", "compare_champion_fixture_B_success": 1.0, "compare_fisher_p": "0.0083", "compare_keep": false, "metrics": {"idea": "LOOP-BOUNDARY-389", "fixture_A_transfer_success": null, "fixture_B_transfer_success": null, "fixture_R_transfer_success": null, "fixture_B_family_mean_physical": null, "coverage_cont": null, "p_value_fisher": null, "p_value_welch": null, "seeds_run": 0, "seeds_physical_run_executed": 0, "queue_empty": true, "lowest_queued_idea_found": null, "n198_open_needs_director": true, "rig_invoked": false, "canonical_rig": "experiments/kaggle_aegis_sweep.py", "physical_truth_source": "autoresearch_research.ideas.md \u00a70/\u00a71 (\u00a74): all queued done since 309; I20/I4/I6 241/244/245; lowest queued=null"}, "metrics_idea": "LOOP-BOUNDARY-389", "metrics_compare": {"compare_champion": "trochoid", "compare_paired_same_seeds": false, "compare_welch_p_coverage_cont": null, "compare_fisher_p_success": null, "compare_keep_true": false, "compare_note": "No queued candidate -> no paired 20-seed run; champion frozen per ideas.md \u00a70/\u00a71; segment 15 frozen; no replay."}, "synthetic_proxy": false, "worklog_append_lines": 2, "worklog_citations": ["autoresearch_research.ideas.md \u00a70/\u00a71 (\u00a74 table): all queued done since run 309; I20/I4/I6 done 241/244/245; lowest queued=null", "N198 director-only preserved (director-only; worker skips); segment 15 frozen; ponytail skip; no replay of done ideas; no synthetic proxy for status"], "equation_changed": false, "banned_phrases_present": false, "timeout_1200_applied": false, "timeout_applied_note": "No queued idea -> no rig invocation; cleanup preserved; anchored kill executed (0 matches); never bare pkill.", "kill_pattern_used": true, "kill_pattern_note": "pgrep -f \"^python3 .*kaggle_aegis_sweep\\.py\" | xargs -r kill; anchored; no self-kill.", "disk_gb_free_approx": 74, "timestamp": "2026-10-01T06:05:00Z", "verdict_summary": "LOOP-BOUNDARY 389. \u00a70/\u00a71 read; lowest queued=null (all v3/v4 done since 309; I20/I4/I6 241/244/245). No mechanism -> ponytail skip -> no rig -> no synthetic claim -> no keep. Champion trochoid frozen B=1.00 Fisher p=0.0083 vs raster. N70-N76/N74 retired not cited. G1-G7 satisfied; segment 15 frozen; N198 director-only preserved; anchored kill; disk ~74G; no replay.", "frontier": "none (loop-boundary); open edge=N198 director-owned; no new queued idea permitted without director", "mechanism_class": "none"}
