{"run":491,"segment":15,"idea":"FACC-SE3-ITER11","idea_short":"FACC-SE3 iter-11: Force-Adaptive Contact Control, SE(3)-conditioned dynamic affordance field + energy-attention + flow-bridge (director proposal, muse-spark-1.3-contributor-free) \u2014 REFUSED","status":"discard","timestamp":"2026-10-02T13:00:00Z","metric_name":"fixture_B transfer_success (coverage_cont >= 0.90 per episode), canonical rig v2, PyBullet DIRECT, 20 seeds x 3 suites","metric_class":"physical","metric_class_note":"physical only; synthetic_proxy excluded per G2/G7; refusal before execution; 0 episodes; G3 G4 G2 G7 exclusion","director_decision":{"iteration":11,"idea":"FACC-SE3: SE(3)-conditioned force-adaptive contact control with dynamic deformable affordance field + energy-based physical in-context attention + flow-matching -> affordance-equivalence bridge; replaces flow-match head; predicted 78/100","predicted_score":78,"executed":false,"exclusion_reasons":["G3 PERMANENT RETIREMENT (2026-09-26): eq78/N70-N76/manifold-switch/flow-bridge/energy-gated/EBM/SE3-affordance/DAEF/FACC family permanently retired (segment 15 root-cause confirmed: energy-modulation collapses under real rigid contact dynamics, high variance seed1=0.9459 vs seed2=0.2432; N477 family kill-rule triggered run 481, boundary 0.32m/64deg). FACC-SE3 = 50th replay; label rotation (SE3-conditioned / dynamic-manifold / deformable-affordance / energy-attention) does NOT change mechanism class.","G4 UNPAIRABLE: PATH_MODES (raster,rounded,trochoid,spiral,fitted,fitro,orbit,auto) carries 0 injectable SE3/energy/manifold/FACC-head hook; RESIDUAL_HOOK_FN is I3-owned only. No mechanism exists to inject a FACC-SE3 decoder for paired 20-seed Fixture-B comparison vs champion trochoid.","G2 QUEUE EMPTY / N477 COMPLETE: queued row N477 executed fully runs 476-481 (7440 episodes, family kill-rule at 481 with boundary 0.32m/64deg H=0.6; wall at 0.40,80 and 0.48,96 H>0.6). No queued mechanism remains since run 481. N198 stays open_needs_director.","G7 INTEGRITY: predicted-only 78pts invalid for any keep claim; synthetic champion N74 (92.3 synthetic) frozen unconditionally; no physical results/aegis_v2 file carries compare.keep:true record for any energy/SE3/manifold replay (49+ prior replays all discarded). Synthetic_proxy promotion banned per G2.","G1 CANONICAL RIG: python3 experiments/kaggle_aegis_sweep.py (DIRECT, system python3, 20 seeds, friction U[0.05,0.80]) \u2014 NO invocation performed; no deferred-language phrases present.","G5 CLEANUP: reap_orphans() verified pre-refusal; no python3 .*kaggle_aegis_sweep.py orphan held (0 invocation); timeout 1200 not triggered; no orphan kill performed.","G6 STATE: refusal logged; worklog appended; graph updated; equations.md verified unchanged (md5 cc9c73fd74f4bf1799f787226cce7a00, no mechanism = no equation change); commit executed with verdict discard + replay count 50."]},"physical_action_taken":"REFUSED before any rig invocation (50th replay of permanently retired G3 family; same mechanism class: SE3 + dynamic-manifold + energy-attention + flow-bridge + contact-deformation field). Health-check NOT required: champion trochoid B=1.00/1.00/1.00 at 0,0 verified in runs 476-481 (60 episodes, 0 harness errors, 0 rig bytes changed). No paired 20-seed Fixture-B measurement possible (G4 unpairable). No synthetic_proxy promotion. Evidence artifacts: this JSONL entry + worklog + graph.","rig_invoked":false,"rig_exit":0,"episodes":0,"harness_errors":0,"rig_bytes_changed":false,"pose_noise_cfg":"N/A (refusal before execution \u2014 mechanism class permanently retired, no paired arm possible)","evidence":["autoresearch_research.jsonl:run=491","autoresearch_research.ideas.md (\u00a70 ground truth read; \u00a71 queue empty; \u00a74 N477 complete; N198 open_needs_director; G3 retired-family listed)","autoresearch_research_strategy_graph.jsonl (N491 refusal node + replay-refused-50th edge to retired-FACC-family)","experiments/worklog.md (this append-only entry, <=10 lines)","results/aegis_v2/N476_r476_H06_n0.32_64.jsonl (champion reference B=0.85 keep=true, paired p=9.3e-4)","results/aegis_v2/N477_r477_* (family kill-rule at run 481, boundary 0.32,64)","equations.md (verified unchanged: md5 cc9c73fd74f4bf1799f787226cce7a00; no new row; family covered by eq78/eq82/eq84 replay rows)"],"metrics":{"idea":"FACC-SE3-ITER11","idea_short":"FACC-SE3 iter-11 (refused \u2014 50th G3 replay)","metric_class":"physical","fixture_A_success":null,"fixture_B_success":null,"fixture_R_success":null,"transfer_success":null,"seeds":0,"episodes":0,"compare_champion":"trochoid (B=1.00 at 0,0; frozen champion; Fisher p=0.0083 vs raster run 72; certified through 0.32,64 at H=0.6/n=32)","compare_keep":false,"new_mechanism":false,"replay_of_retired_family":true,"retired_family_ids":["eq78","N70","N71","N72","N73","N74","N75","N76","FACC","FACC-SE3","FACC-E","VM-FACC","FACC-DM","DAEF","EBM","SEAFC","SE3-EBAA","FACC-SE3-CONDITIONED","FACC-SE3-ITER6","FACC-SE3-ITER7","FACC-SE3-ITER8","FACC-SE3-ITER9","FACC-E-ITER10","FACC-SE3-ITER11"],"replay_count":50,"queue_status_at_start":"empty (N477 complete runs 476-481; kill-rule 481 at 0.40,80 H=1.2 B=0.00; boundary 0.32m/64deg; no queued mechanism since 309; N198 director-owned open_needs_director)","synthetic_proxy":null,"predicted_score_refused":78,"predicted_score_valid_for_keep":false,"n477_kill_rule_triggered":true,"n477_final_boundary_m_deg":"0.32 m / 64 deg (H=0.6/n=32 certified KEEP; H>0.6 DISCARD at 0.40,80 / 0.48,96)","champion_frozen":"trochoid B=1.00 at 0,0 (run 72)","physical_rig_invoked":false,"episodes_for_idea":0,"episodes_for_health_check":0},"gates_unchanged":{"segment":15,"primary_metric":"fixture_B_transfer_success","tier4_gate":"post-hoc tag preserved; untouched (in-loop I7 kept separately at run 169); no mechanism change executed","no_new_segment":true,"no_metric_move":true,"no_gate_change":true,"no_candidate_promoted":true,"new_unvalidated_row_added":false,"new_keep_claim":false,"new_synthetic_row":false},"verdict":"DISCARD (50th G3 retired-family replay refused before execution; mechanism class unchanged by label rotation SE3/deformable/dynamic-manifold/energy-attention/flow-bridge; 0 episodes; freeze champion trochoid B=1.00; queue empty since N477 kill-rule 481; N198 open_needs_director unchanged; segment 15 unchanged; metric frozen; equations.md unchanged; no synthetic_proxy; commit executed)","worklog_append_required":true,"graph_update_required":true,"novelty_verified":false,"prior_art_cited":"None (G3 replay of permanently retired family; synthetic champion N74 92.3 frozen unconditionally; no new mechanism = no new citation; family covered by equations.md rows 78/82/84)","evidence_artifacts_complete":true,"unvalidated_cap_consumed_segment_15":0,"unvalidated_cap_remaining_segment_15":1,"equation_changed":false,"equation_verified_unchanged":true,"equation_row_coverage_confirmed":"78 (N76 family) + 82 (N84 frontier) + 84 (FACC-SE3 replay) sufficient for retired mechanism; no new row added (mechanism refused before equation build)","edge_budget_check_performed":false,"banned_phrases_check":"PASS \u2014 no remote GPU deferred, deferred to remote GPU, same dependency in refusal record; G5 anchored pgrep cleanup verified; no synthetic_proxy claim","replay_family":"G3-retired (eq78/N70-N76/manifold/flow-bridge/energy-gated/EBM/SE3/DAEF/FACC/SEAFC/VM-FACC/FACC-SE3 series)","replay_count":50,"refused_before_execution":true}
{"run": 492, "commit": "HEAD", "segment": 15, "idea": "FACC-SE3-ITER12", "idea_short": "Director iter 12 (muse-spark-1.3-contributor-free): Force-Adaptive Contact Control (FACC) \u2014 SE(3)-conditioned contact policy; replaces flow-match head; learns affordance-equivalence manifold; energy-based physical in-context attention; flow-bridge to affordance-equivalence. REFUSED \u2014 51st G3 replay.", "status": "discard", "timestamp": "2026-10-02T12:00:00Z", "metric_name": "fixture_B transfer_success (coverage_cont >= 0.90 per episode), canonical rig v2, PyBullet DIRECT", "metric_class": "physical", "metric_class_note": "physical only; refusal before execution (0 episodes); synthetic_proxy excluded per G2/G7; G3 retired-family replay; G4 unpairable; G2 queue empty; G7 predicted-only invalid", "director_decision": {"iteration": 12, "idea": "FACC-SE3: SE(3)-conditioned force-adaptive contact policy; energy-based physical in-context attention over force/pose history; dynamic affordance field; flow-matching -> affordance-equivalence bridge", "predicted_score": 78, "executed": false, "exclusion_reasons": ["G3 PERMANENT RETIREMENT (2026-09-26): eq78/N70-N76/manifold-switch/flow-bridge/energy-gated/EBM/SE3-affordance/DAEF/FACC/SEAFC family permanently retired. Energy-modulation collapses under real rigid contact dynamics (high variance seed1=0.9459 vs seed2=0.2432; N477 family kill-rule triggered run 481 at boundary 0.32m/64deg H=0.6/n=32). Label rotation (FACC-SE3 / SE(3)-conditioned / dynamic-manifold / affordance-equivalence / energy-attention) does NOT change mechanism class \u2014 51st replay.", "G4 UNPAIRABLE: PATH_MODES (raster,rounded,trochoid,spiral,fitted,fitro,orbit,auto) carries 0 injectable SE3/energy/manifold/FACC-head hook (RESIDUAL_HOOK_FN is I3-owned only). No paired 20-seed Fixture-B measurement possible vs trochoid champion.", "G7 INTEGRITY: predicted-only 78pts invalid for any keep claim. Synthetic champion N74 (92.3 synthetic) frozen unconditionally. No physical results/aegis_v2 file carries compare.keep:true record for any energy/SE3/manifold replay (50+ prior replays all discarded). Synthetic_proxy promotion banned per G2.", "G2 QUEUE EMPTY: N477 completed runs 476-481 (7440 episodes); family kill-rule triggered at 481 (B=0.00 at 0.40,80 H=1.2; boundary certified 0.32m/64deg H=0.6/n=32). No queued mechanism remains since run 309. N198 stays open_needs_director.", "G1 CANONICAL RIG: python3 experiments/kaggle_aegis_sweep.py (DIRECT, system python3, 20 seeds, friction U[0.05,0.80]) \u2014 NO invocation performed (refusal before execution); no deferred-language phrases used.", "G5 CLEANUP: reap_orphans() verified pre-refusal (anchored pgrep); no python3 .*kaggle_aegis_sweep.py orphan held (0 invocation); timeout 1200 not triggered.", "G6 STATE: refusal logged; worklog appended; graph updated; equations.md verified unchanged; commit executed below."]}, "physical_action_taken": "REFUSED before any rig invocation (51st replay of permanently retired G3 mechanism family). Health-check NOT required (champion trochoid B=1.00/1.00/1.00 at 0,0 verified runs 476-481, 60 episodes, 0 harness errors, 0 rig bytes changed). No paired 20-seed Fixture-B measurement executed (G4 unpairable). No synthetic_proxy promotion. 0 episodes; 0 rig bytes changed.", "rig_invoked": false, "rig_exit": 0, "episodes": 0, "harness_errors": 0, "rig_bytes_changed": false, "pose_noise_cfg": "N/A (refusal before execution \u2014 mechanism class permanently retired; no paired arm possible)", "evidence": ["autoresearch_research.jsonl:run=492", "autoresearch_research.ideas.md (\u00a70: no queued mechanism; \u00a71: N477 complete; G3 retired-family listed; N198 open_needs_director)", "autoresearch_research_strategy_graph.jsonl (N492 refusal node + replay-refused-51st edge)", "experiments/worklog.md (append-only, this entry <=10 lines)", "results/aegis_v2/N476_r476_* / N477_r477_* / N72_trochoid_* (champion + boundary evidence)", "equations.md (verified unchanged: md5 cc9c73fd74f4bf1799f787226cce7a00; mechanism refused before equation build; family covered by eq78/82/84 replay rows)"], "metrics": {"idea": "FACC-SE3-ITER12", "metric_class": "physical", "fixture_A_success": null, "fixture_B_success": null, "fixture_R_success": null, "transfer_success": null, "seeds": 0, "episodes": 0, "compare_champion": "trochoid (B=1.00 at 0,0; frozen champion; Fisher p=0.0083 vs raster run 72; certified through 0.32,64 at H=0.6/n=32)", "compare_keep": false, "new_mechanism": false, "replay_of_retired_family": true, "retired_family_ids": ["eq78", "N70", "N71", "N72", "N73", "N74", "N75", "N76", "FACC", "FACC-SE3", "FACC-E", "VM-FACC", "FACC-DM", "DAEF", "EBM", "SEAFC", "SE3-EBAA", "FACC-SE3-CONDITIONED", "FACC-SE3-ITER6", "FACC-SE3-ITER7", "FACC-SE3-ITER8", "FACC-SE3-ITER9", "FACC-E-ITER10", "FACC-SE3-ITER11", "FACC-SE3-ITER12"], "replay_count": 51, "queue_status_at_start": "empty (N477 complete 476-481; kill-rule 481 at 0.40,80 H=1.2; boundary 0.32,64; no queued mechanism since 309; N198 director-owned open_needs_director)", "synthetic_proxy": null, "predicted_score_refused": 78, "predicted_score_valid_for_keep": false, "n477_kill_rule_triggered": true, "n477_final_boundary_m_deg": "0.32 m / 64 deg (H=0.6/n=32 certified KEEP; H>0.6 DISCARD at 0.40,80 / 0.48,96)", "champion_frozen": "trochoid B=1.00 at 0,0 (run 72; Fisher p=0.0083 vs raster)"}, "gates_unchanged": {"segment": 15, "primary_metric": "fixture_B_transfer_success", "tier4_gate": "post-hoc tag preserved; untouched (in-loop I7 kept separately at run 169; no mechanism change executed)", "no_new_segment": true, "no_metric_move": true, "no_gate_change": true, "no_candidate_promoted": true, "new_unvalidated_row_added": false, "new_keep_claim": false, "new_synthetic_row": false}, "verdict": "DISCARD (51st G3 retired-family replay refused before execution; mechanism class unchanged by director label rotation SE3/deformable/dynamic-manifold/energy-attention/flow-bridge/affordance-equivalence; 0 episodes; freeze champion trochoid B=1.00; queue empty since N477 kill-rule 481; N198 open_needs_director unchanged; segment 15 unchanged; metric frozen; no synthetic_proxy; equations.md unchanged; worklog/graph/JSONL updated; commit executed)", "worklog_append_required": true, "graph_update_required": true, "novelty_verified": false, "prior_art_cited": "None (G3 replay of permanently retired family; synthetic champion N74 92.3 frozen unconditionally; mechanism class identical to retired eq78/EBM/energy-attention/flow-bridge; no new paradigm; no verified equation change)", "evidence_artifacts_complete": true, "unvalidated_cap_consumed_segment_15": 0, "unvalidated_cap_remaining_segment_15": 1, "equation_changed": false, "equation_verified_unchanged": true, "equation_row_coverage_confirmed": "78 (N76b family) + 82 (N84 frontier) + 84 (FACC-SE3 replay) sufficient for retired mechanism; no new row added (mechanism refused before equation build)", "edge_budget_check_performed": false, "banned_phrases_check": "PASS \u2014 no 'remote GPU deferred', 'deferred to remote GPU', 'same dependency' in refusal record; G5 anchored pgrep cleanup verified; no synthetic_proxy claim made", "replay_family": "G3-retired (eq78 / N70-N76 / manifold / flow-bridge / energy-gated / EBM / SE3 / DAEF / FACC / FACC-SE3 / SEAFC / VM-FACC / FACC-SE3-ITER12 series)", "replay_count": 51, "refused_before_execution": true, "ponytail_note": "Lazy refusal: G3 retirement (51st replay of same mechanism class: SE3 + energy-attention + flow-bridge + dynamic-manifold/affordance-equivalence) + G4 unpairability eliminates any build. Queue empty since N477 kill-rule (481, boundary 0.32m/64deg). Champion trochoid frozen B=1.00. Zero episodes; zero rig bytes changed; no equation change; no deferred phrases; no synthetic promotion."}
