{"run": 556, "segment": 15, "idea": "FACC-Afford-director-iter24-refusal", "status": "invalid", "metric_name": "fixture_B transfer_success (canonical rig v2, PyBullet DIRECT) -- paired vs frozen champion trochoid on the same 3 seeds", "metric_class": "physical (3-seed hygiene smoke only, PyBullet DIRECT, system python3 CPU; synthetic_proxy EXCLUDED per G2/G7)", "metrics": {"idea": "FACC-Afford", "seeds": 3, "rig_invocations": 1, "episodes": 3, "harness_errors": 0, "pose_noise_cfg": "0,0", "compare_champion": "trochoid (B=1.00, coverage_cont 1.0000, Fisher p=0.0083 vs raster)", "fixture_B_transfer_success": 1.0, "coverage_cont": 1.0, "welch_p": null, "fisher_p": null, "compare_keep": false, "g3_replay_count": 79, "episodes_spent_on_proposal": 0}, "evidence": ["results/aegis_v2/N556_refusal_health.jsonl"], "hygiene_smoke": "results/aegis_v2/N556_refusal_health.jsonl: fixture_B 3/3 SUCCESS covc 1.0/1.0/1.0, 0 harness errors", "g3_refusal_this_iteration": {"director_proposal": "FACC-Afford iter24 SE(3)-Equivariant Force-Adaptive Contact Control replacing Pi0 flow-matching head with energy-based affordance field + impedance controller, predicted 78 keep", "refusal_reason": "G3-retired eq78/flow-bridge/energy-gated/manifold-switch/FACC family permanently retired; rig has no SE3/EBM/impedance/contact-energy hook (scripted controller + registration only); force channel falsified N479; predicted-score claims banned from keeps by segment+metric freeze (G7); queue empty (N198/N478d director-owned); 0 episodes spent on proposal"}, "verdict": "INVALID (79th G3 replay refusal + hygiene; no live axis; N198/N478d director-owned)", "notes": "Queue empty in ideas.md s1/s4. Tier-4 gate unchanged (post-hoc tag); equations.md unchanged; worklog append-only.", "timestamp": "2026-10-04T20:30:00Z", "source": "director iter-24 FACC-Afford proposal + canonical rig hygiene"}
{"run": 557, "segment": 15, "idea": "SE3-FACC-director-iter25-refusal", "status": "invalid", "metric_name": "fixture_B transfer_success (canonical rig v2, PyBullet DIRECT) -- paired vs frozen champion trochoid on the same 3 seeds", "metric_class": "physical (3-seed hygiene smoke only, PyBullet DIRECT, system python3 CPU; synthetic_proxy EXCLUDED per G2/G7)", "metrics": {"idea": "SE3-FACC", "seeds": 3, "rig_invocations": 1, "episodes": 3, "harness_errors": 0, "pose_noise_cfg": "0,0", "compare_champion": "trochoid (B=1.00, coverage_cont 1.0000, Fisher p=0.0083 vs raster)", "fixture_B_transfer_success": 1.0, "coverage_cont": 1.0, "welch_p": null, "fisher_p": null, "compare_keep": false, "g3_replay_count": 80, "episodes_spent_on_proposal": 0}, "evidence": ["results/aegis_v2/N557_refusal_health.jsonl"], "hygiene_smoke": "results/aegis_v2/N557_refusal_health.jsonl: fixture_B 3/3 SUCCESS covc 1.0/1.0/1.0, 0 harness errors", "g3_refusal_this_iteration": {"director_proposal": "SE3-FACC iter25 SE(3)-Equivariant Force-Adaptive Contact Policy replacing Pi0 flow-mat head, energy-based physical in-context attention over contact, predicted 78 keep", "refusal_reason": "G3-retired eq78/flow-bridge/energy-gated/manifold-switch/FACC family permanently retired; rig has no SE3/EBM/stiffness/contact-energy hook (scripted controller + registration only); force channel falsified N479; predicted-score/novelty claims banned from keeps by segment+metric freeze (G7); queue empty (N198/N478d director-owned); 0 episodes spent on proposal"}, "verdict": "INVALID (80th G3 replay refusal + hygiene; no live axis; N198/N478d director-owned)", "notes": "Queue empty in ideas.md s1/s4. Tier-4 gate unchanged (post-hoc tag); equations.md unchanged; worklog append-only.", "timestamp": "2026-10-04T21:00:00Z", "source": "director iter-25 SE3-FACC proposal + canonical rig hygiene"}
{"run": 558, "segment": 15, "idea": "SE3-FACC-director-iter26-refusal", "status": "invalid", "metric_name": "fixture_B transfer_success (canonical rig v2, PyBullet DIRECT) -- paired vs frozen champion trochoid on the same 3 seeds", "metric_class": "physical (3-seed hygiene smoke only, PyBullet DIRECT, system python3 CPU; synthetic_proxy EXCLUDED per G2/G7)", "metrics": {"idea": "SE3-FACC-iter26", "seeds": 3, "rig_invocations": 1, "episodes": 3, "harness_errors": 0, "pose_noise_cfg": "0,0", "compare_champion": "trochoid (B=1.00, coverage_cont 1.0000, Fisher p=0.0083 vs raster)", "fixture_B_transfer_success": 1.0, "coverage_cont": 1.0, "welch_p": null, "fisher_p": null, "compare_keep": false, "g3_replay_count": 81, "episodes_spent_on_proposal": 0}, "evidence": ["results/aegis_v2/N558_refusal_health.jsonl"], "hygiene_smoke": "results/aegis_v2/N558_refusal_health.jsonl: fixture_B 3/3 SUCCESS covc 1.0/1.0/1.0, 0 harness errors", "g3_refusal_this_iteration": {"director_proposal": "SE3-FACC iter26 control-policy x generalization x SE(3)-conditioned FACC replacing flow-matching action-expert with force-adaptive contact field, energy-based physical in-context attention E=contact+info-gain, predicted 78 keep", "refusal_reason": "G3-retired eq78/flow-bridge/energy-gated/manifold-switch/FACC family permanently retired; rig has no SE3/EBM/stiffness/friction/contact-energy hook (scripted controller + registration only); force channel falsified N479; predicted-score claims banned from keeps by segment+metric freeze (G7); queue empty (grep queued table rows = 0; N198/N478d director-owned); 0 episodes spent on proposal"}, "verdict": "INVALID (81st G3 replay refusal + hygiene; no live axis; N198/N478d director-owned)", "notes": "Queue empty in ideas.md s1/s4. Tier-4 gate unchanged (post-hoc tag); equations.md unchanged; worklog append-only.", "timestamp": "2026-10-04T21:30:00Z", "source": "director iter-26 SE3-FACC proposal + canonical rig hygiene"}
{"run": 559, "segment": 15, "idea": "FACC-iter27", "status": "invalid", "metric": 1.0, "metrics": {"idea": "FACC-iter27", "fixture_B_transfer_success": 1.0, "coverage_cont": 1.0, "seeds": 3, "episodes": 3, "harness_errors": 0, "compare_champion": "trochoid (B=1.00, coverage_cont 1.0000, Fisher p=0.0083 vs raster)", "compare_keep": false, "synthetic_proxy": false, "g3_refusal": true, "refusal_count": 82, "queue_empty": true}, "description": "director FACC iter27 (muse-spark-1.3-contributor-free) refused as 82nd G3 replay: SE(3)-conditioned EBM contact-energy replacing flow-mat head + force-adaptive in-context attention + test-time manifold warp; retired eq78/energy-gated/flow-bridge/manifold-switch/FACC family; rig has no SE3/EBM/contact-energy hook; force channel falsified N479; predicted-score claims banned from keeps; 0 episodes on proposal; hygiene fixture_B 3/3 covc 1.0", "timestamp": "2026-10-04T22:00:00Z", "evidence": ["results/aegis_v2/N559_refusal_health.jsonl"]}
{"run": 560, "segment": 15, "idea": "MW-CEBM-director-iter28-refusal", "status": "invalid", "metric": 1.0, "metrics": {"idea": "MW-CEBM-iter28", "fixture_B_transfer_success": 1.0, "coverage_cont": 1.0, "seeds": 3, "episodes": 3, "harness_errors": 0, "pose_noise_cfg": "0,0", "compare_champion": "trochoid (B=1.00, coverage_cont 1.0000, Fisher p=0.0083 vs raster)", "compare_keep": false, "synthetic_proxy": false, "g3_refusal": true, "refusal_count": 83, "queue_empty": true}, "description": "director MW-CEBM iter28 (muse-spark-1.3-contributor-free) refused as 83rd G3 replay: residual SE(3) energy corrector over frozen pi0 + Langevin on wrench/tactile + affordance-equivalence/I-slip gating; retired eq78/energy-gated/flow-bridge/manifold-switch/FACC family; rig has no pi0/EBM/wrench/tactile hook and no stiffness axis; force channel falsified N479; predicted-score claims banned from keeps; 0 episodes on proposal; hygiene fixture_B 3/3 covc 1.0", "timestamp": "2026-10-04T22:30:00Z", "evidence": ["results/aegis_v2/N560_refusal_health.jsonl"]}
{"run": 561, "segment": 15, "idea": "N537-force-ceiling-fclamp", "status": "discard", "metric_name": "fixture_B transfer_success (canonical rig v2, PyBullet DIRECT) -- paired vs frozen champion trochoid on the same 20 seeds", "metric_class": "physical (960 episodes, 8 rig invocations, PyBullet DIRECT, system python3 CPU, 20 seeds x {A,B,R} x 2 arms x 2 cells; synthetic_proxy EXCLUDED per G2/G7)", "metrics": {"idea": "N537", "axis": "force ceiling F_CLAMP_N as a SINGLE factor (first isolation; N210 swept it only coupled inside a 3x3 grid at SIM_HZ=1920)", "knob": "AEGIS_F_CLAMP_N", "seeds": 20, "rig_invocations": 8, "episodes": 960, "harness_errors": 0, "pose_noise_cfg": "0,0 (4 doses) + 0.32,64 (4 doses)", "compare_champion": "trochoid (B=1.00, coverage_cont 1.0000, Fisher p=0.0083 vs raster)", "doses_n": [1.0, 3.0, 6.0, 12.0, 25.0], "fixture_A_transfer_success": 0.0, "fixture_B_transfer_success": 0.0, "fixture_R_transfer_success": 0.0, "coverage_cont": 0.0258, "cell0_0_all_doses_B": "20/20 covc 1.0000 in EVERY dose, paired delta EXACTLY +0.0000 (frozen 3.0 N and every dose), Fisher p=1.0", "cell0_0_binding_ticks_B": {"1.0": 56.85, "3.0": 1.0, "6.0": 0.0, "12.0": 0.0, "25.0": 0.0}, "cell03264_B": {"1.0": {"success": "0/20", "covc": 0.0414, "delta": 0.018, "welch_p": 0.4791, "escaped": 20, "clamp_ticks": 26.7, "escaped_base": 15}, "3.0": {"success": "0/20", "covc": 0.0234, "delta": 0.0, "welch_p": null, "escaped": 15, "clamp_ticks": 23.55}, "6.0": {"success": "0/20", "covc": 0.0258, "delta": 0.0024, "welch_p": 0.8948, "escaped": 14, "clamp_ticks": 6.3, "escaped_base": 15}, "12.0": {"success": "0/20", "covc": 0.0258, "delta": 0.0024, "welch_p": 0.8948, "escaped": 14, "clamp_ticks": 0.95, "escaped_base": 15}, "25.0": {"success": "0/20", "covc": 0.0258, "delta": 0.0024, "welch_p": 0.8948, "escaped": 13, "clamp_ticks": 0.3, "escaped_base": 15}}, "binding_fraction_law": "f_clamp_ticks on B at 0.32,64 falls 26.70 -> 23.55 -> 6.30 -> 0.95 -> 0.30 across 1.0/3.0/6.0/12.0/25.0 N, i.e. monotone and reaching ~0 above p100(f_cmd_max)=39.3 N; on A 71.25 -> 25.30 -> 33.65 -> 1.10 -> 0.30 (non-monotone at 6.0 N)", "max_unclipped_f_cmd_n": {"at_25N_B": 75.36, "at_25N_A": 49.77, "at_3N_B_frozen": 39.16}, "spec_band_gap": "the AEGIS 10-25 N band is reachable in the COMMAND at 25 N (p100 f_cmd_max 75.4 N on B) but buys 0.0024 coverage_cont (Welch p 0.8948) and 0/20 success", "predictions": {"N537.1_NULL_AT_CEILING": "CONFIRMED: at 0,0 every dose 1.0-25.0 N reads exactly 20/20 covc 1.0000, paired delta +0.0000, Fisher p=1.0; the metric is saturated and the rail is not the binder on the certified stack", "N537.2_BINDING_FRACTION": "CONFIRMED: f_clamp_ticks is monotone non-increasing on B over the whole 25x dose range and reaches 0.30 ticks at 25 N, below the 400-tick budget; one non-monotone step on fixture_A at 6.0 N (33.65 vs 25.30) is recorded, not smoothed", "N537.3_RAIL_IS_NOT_THE_FRONTIER": "CONFIRMED: at 0.32,64 predicted coverage_cont(25.0) <= coverage_cont(3.0); measured +0.0024, Welch p 0.8948, Fisher p 1.0, escapes 15 -> 13. The frontier escapes are not force-starved", "N537.4_NO_FREE_LUNCH_DOWNWARD": "PARTLY ANSWERED: 1.0 N costs A (-0.0448, Welch p 0.3434) but is INERT on B (+0.0180, p 0.4791) where the frozen champion is already 0/20 with 15-20 of 20 escapes -- the axis is doubly void on the primary suite"}, "certificate": "on the certified champion stack the 3.0 N rail binds 1.0 tick per 400 on B (0.25% of the budget) and 23.55 (5.9%) at 0.32,64; unclipping it to 25 N removes 100% of the binding and moves coverage by 0.0024. The AEGIS 10-25 N force band is therefore NOT the binding constraint on transfer_success -- the constraint is the pose-noise escape channel (N479)", "n533_4_scope_correction": "N533.4 concluded 'the N214 escape floor is a force-rail floor'. Isolating F_CLAMP_N shows the rail is NOT the escape floor at the frontier: at 25 N (rail fully unbound, 0.30 clamp ticks) fixture_B still reads 0/20 success with 13 of 20 escapes. N533.4 is SCOPE-CORRECTED, not retracted: the rail explains the KD=0 escape ONSET in that arm (f_cmd_max 10.56 N vs 3.0 N ceiling) but not the frontier ceiling", "welch_p": 0.8948, "fisher_p": 1.0, "compare_keep": false, "keep_unreachable_reason": "at 0,0 the primary metric is saturated at 1.0000 so no dose can raise it; at 0.32,64 every dose reads B transfer_success 0/20 (< 0.70) with Welch p >= 0.34 and Fisher p = 1.0 on every cell; the candidate never separates from its own paired baseline", "synthetic_proxy": false, "remote_gpu_used": false, "banned_phrases": [], "rig_scored_quantities_touched": false, "gate_changed": false, "metric_changed": false, "segment_changed": false, "no_teleport": true, "no_arithmetic_coverage": true, "g3_refusal_this_iteration": {"director_proposal": "none queued this iteration (all table rows done; N198/N478d remain director-owned open_needs_director)", "refused_replay_family": "eq78/energy-gated/flow-bridge/manifold-switch/FACC/SEAF (G3), refused 84x cumulatively; 0 episodes spent on it", "episodes_spent_on_proposal": 0}, "queue_state": "EMPTY (grep queued on both tables = 0 rows; N198 and N478d are open_needs_director, NOT queued)", "harness_error_note": "a first 8-invocation batch was discarded unread because AEGIS_F_CLAMP_N was set on neither arm (--compare-env applies to the BASELINE arm only); those files were deleted before any number was read", "pre_registered_in_source": "autoresearch_research.ideas.md N537 section (written before the first dose was run)", "evidence_files": ["results/aegis_v2/N537_clamp1.0_cell0_0.jsonl", "results/aegis_v2/N537_clamp6.0_cell0_0.jsonl", "results/aegis_v2/N537_clamp12.0_cell0_0.jsonl", "results/aegis_v2/N537_clamp25.0_cell0_0.jsonl", "results/aegis_v2/N537_clamp1.0_cell0.32_64.jsonl", "results/aegis_v2/N537_clamp6.0_cell0.32_64.jsonl", "results/aegis_v2/N537_clamp12.0_cell0.32_64.jsonl", "results/aegis_v2/N537_clamp25.0_cell0.32_64.jsonl"]}, "compare": {"champion": "trochoid", "candidate": "N537 arms (AEGIS_F_CLAMP_N 1.0/6.0/12.0/25.0 vs paired 3.0)", "compare_run": true, "keep": false, "welch_p_coverage_cont": 0.8948, "fisher_p_success": 1.0, "seeds": 20}, "description": "N537 force ceiling F_CLAMP_N isolated as a single factor for the first time (N210 swept it only coupled at 1920 Hz). 960 physical episodes, 8 paired rig invocations, 20 seeds x {A,B,R} x 2 arms x 2 pose-noise cells. DISCARD the lever: the 3.0 N rail binds 1.0/400 ticks on the certified B stack and 23.55/400 at the frontier; unclipping to 25 N removes 100% of the binding and moves B coverage_cont by +0.0024 (Welch p 0.8948) with Fisher p 1.0 and B success 0/20 in every arm. The AEGIS 10-25 N force band is not the binding constraint on transfer_success; the pose-noise escape channel (N479) is. N533.4 scope-corrected.", "timestamp": "2026-10-05T03:20:00Z", "evidence": ["results/aegis_v2/N537_clamp25.0_cell0.32_64.jsonl", "equations.md#N537", "autoresearch_research_strategy_graph.jsonl#N537_force_ceiling"], "source": "worker"}
{"run": 562, "segment": 15, "idea": "N562-elongated-face-residual-attribution", "status": "keep", "metric_name": "fixture_B transfer_success (canonical rig v2, PyBullet DIRECT) -- paired vs the frozen single-cast default on the same 20 seeds", "metric_class": "physical (2160 episodes, 9 paired rig invocations + 1 default-off regression, PyBullet DIRECT, system python3 CPU, 20 seeds x {A,B,R} x 2 arms; synthetic_proxy EXCLUDED per G2/G7)", "metrics": {"idea": "N562", "run": 562, "axis": "attribution of the elongated-face registration residual (N478d cells) + first probe ABOVE the certified 1.60,320 pose-noise wall", "seeds": 20, "rig_invocations": 9, "episodes": 2160, "harness_errors": 0, "candidate_stack": "AEGIS_REG=depth AEGIS_REG_HALF_M=0.6 AEGIS_REG_N=32 AEGIS_ROW_CENTRE=1 AEGIS_REG_CASTS=0 AEGIS_REG_CN=12 AEGIS_REG_DFACT=2.0 --path trochoid (certified N478 stack verbatim)", "paired_baseline": "--compare trochoid --compare-env AEGIS_REG_CASTS=1.0,AEGIS_REG_CN=0.0,AEGIS_REG_DFACT=1.5,AEGIS_REG_N=32.0 (frozen single-cast default)", "compare_champion": "trochoid (B=1.00, coverage_cont 1.0000, Fisher p=0.0083 vs raster)", "certified_cell": {"pose_noise_cfg": "3.20,640", "fixture_B_transfer_success": 1.0, "fixture_B_success_count": "20/20", "coverage_cont": 0.9906, "baseline_B_success_count": "0/20", "baseline_coverage_cont": 0.0, "welch_p": 1.13e-33, "fisher_p": 1.45e-11, "rig_keep": true, "reg_ok_candidate": "20/20", "reg_err_xy_p50_mm": 6.16, "reg_err_xy_p90_mm": 15.15}, "certified_frontier_extension": "0.32,64 -> 3.20,640 = 10.0x the original wall, 2.0x the N478c 1.60,320 wall; coverage_cont flat in sigma_t (0.9797/0.9844/0.9867/0.9813/0.9906 at 0.96,192/1.60,320/2.00,400/2.40,480/3.20,640)", "phaseB_table": {"0.32,64": {"B_cand": 1.0, "B_base": 0.85, "welch_p": 0.129, "fisher_p": 0.231, "keep": false}, "0.96,192": {"B_cand": 1.0, "B_base": 0.15, "welch_p": 2.04e-07, "fisher_p": 2.57e-08, "keep": true}, "1.60,320": {"B_cand": 1.0, "B_base": 0.1, "welch_p": 1.01e-10, "fisher_p": 3.35e-09, "keep": true}, "2.00,400": {"B_cand": 1.0, "B_base": 0.05, "welch_p": 2.55e-13, "fisher_p": 3.05e-10, "keep": true}, "2.40,480": {"B_cand": 1.0, "B_base": 0.0, "welch_p": 7.01e-25, "fisher_p": 1.45e-11, "keep": true}, "3.20,640": {"B_cand": 1.0, "B_base": 0.0, "welch_p": 1.13e-33, "fisher_p": 1.45e-11, "keep": true}}, "phaseB_regok_baseline": {"0.32,64": "20/20", "0.96,192": "9/20", "1.60,320": "3/20", "2.00,400": "2/20", "2.40,480": "1/20", "3.20,640": "0/20"}, "D1_top_face_band_cell": {"verdict": "FALSIFIED", "probe": "experiments/N562_probe_band.py -- 123/123 hits accepted, 0 rejected, 1 rigid body, 2 z values 2.3 mm apart", "oriented_bbox_u_m": 0.67499, "oriented_bbox_v_m": 0.27844, "frozen_face_u_m": 0.68, "frozen_face_v_m": 0.28, "delta_u_m": -0.00501, "delta_v_m": -0.00156, "ray_pitch_m": 0.03871, "delta_in_pitch": [0.13, 0.04]}, "D2_pca_pi_branch_cell": {"verdict": "FALSIFIED", "branch_margin_deg_range": [40.89, 89.85], "flip_line_deg": 10}, "D3_estimator_ray_pitch_cell": {"verdict": "REFUTED", "B_p50_mm": {"n32": 8.12, "n128": 5.61, "ratio": 1.45, "bar": 2.0}, "A_p50_mm": {"n32": 2.46, "n128": 0.32, "ratio": 7.7}, "B_p90_mm": {"n32": 13.63, "n128": 16.26}}, "D4_placement_cell": {"verdict": "REFUTED", "pose_noise_cfg_used": "0,192 (XY exactly 0, yaw sigma 192)", "B_p50_mm": 7.75, "B_p50_at_0_0_mm": 7.75, "B_p90_mm": 13.2, "bar_mm": 2.0}, "D5_no_lever_from_attribution": {"verdict": "HELD", "evidence": "candidate == paired baseline at 0,0 (Welch p 1.0) and 0.32,64 (Welch p 0.129), keep=false on both"}, "attribution_result": "the elongated-face residual is the frozen `mean` centroid, NOT any N478d cell: at zero pose noise with the grid centred, the oriented-bbox midpoint error is exactly 0.0 mm while the centroid error is 7.71 mm, with 118/123 accepted points mirror-symmetric about the face centre", "D6_cost_of_residual": {"verdict": "CONFIRMED", "statement": "fixture_B 20/20 at 3.20,640 (10x the certified wall, yaw sigma doubled again) with reg_err_xy p50 still 6.16 mm -- the 5-16 mm estimator residual costs nothing on transfer_success; the estimator axis closes as a certificate"}, "D7_predicted_failure_order": {"verdict": "REFUTED", "prediction": "1.60,320 20/20 then 2.00,400 and above NOT 20/20 (escape channel binds before the estimator)", "measured": "all four Phase B cells 20/20, candidate escaped_frac ~0, candidate reg_ok 20/20 everywhere", "actual_binder": "cast-lattice CONTAINMENT of the noisy centre -- the baseline arm's reg_ok falls 20->9->3->2->1->0 of 20 over the same range"}, "rig_defect_found": {"what": "N561 diagnostic computes _q = _P @ _R.T with _R = [[c,-s],[s,c]], so (P R^T)_0 = P.(c,-s) and (P R^T)_1 = P.(s,c) -- the MIRRORED frame, not (major, minor)", "evidence": "mirrored axes read 0.668 x 0.444 m vs a 0.68 x 0.28 m face; the correct projection `P @ R` reads 0.675 x 0.278 m", "invalid_fields": ["reg_bbox_du_m", "reg_bbox_dv_m", "reg_est_du_mm", "reg_est_dv_mm", "reg_err_du_mm", "reg_err_dv_mm", "reg_off_u_mm", "reg_off_v_mm"], "valid_fields": ["reg_pitch_m", "reg_band_z_span", "reg_band_nbody", "reg_border_frac", "reg_pca_ratio", "reg_branch_margin_deg", "reg_branch_flips", "reg_est_gap_mm"], "action": "inline DO-NOT-QUOTE warning added at the dict; experiments/N562_probe_band.py is the ground truth; nothing scored reads the dict"}, "also_fixed": "_pct empty-sample guard (at sigma_t >= 2.40 every fixture_B episode returns reg_err_xy = NaN, which indexed off an empty list and killed the summary AFTER all episodes were written); pure reporting path", "default_off_regression": {"episodes": 60, "field_diffs": 0, "vs": "results/aegis_v2/N562_A1_000.jsonl candidate arm"}, "mis_specified_arm_logged": "N562_A5_MISSPCEEDED_noop.jsonl -- AEGIS_POSE_FIX_U/V=0 IS the frozen default (additive on the sampled draw) so that D4 arm was a no-op; replaced by AEGIS_POSE_NOISE=0,192", "next_node": "N563 = AEGIS_REG_EST=extent paired decider on the truncation-free lattice stack (N190/N191 dosed the extent midpoint only in the TRUNCATING H=0.35 window, where the mean's O(sigma) bias dominates; the probe shows the extent midpoint is exact at reg_border_frac 0.0000)", "champion_unchanged": "trochoid (B 1.00, coverage_cont 1.0000, Fisher p 0.0083 vs raster)"}, "evidence": ["results/aegis_v2/N562_A1_000.jsonl", "results/aegis_v2/N562_A2_03264.jsonl", "results/aegis_v2/N562_A3_096_n32.jsonl", "results/aegis_v2/N562_A4_096_n128.jsonl", "results/aegis_v2/N562_A5_096_fix0.jsonl", "results/aegis_v2/N562_B1_160320.jsonl", "results/aegis_v2/N562_B2_200400.jsonl", "results/aegis_v2/N562_B3_240480.jsonl", "results/aegis_v2/N562_B4_320640.jsonl", "results/aegis_v2/N562_regression_defaultOFF.jsonl", "results/aegis_v2/N562_A5_MISSPCEEDED_noop.jsonl", "experiments/N562_probe_band.py", "experiments/N562_drive.sh", "experiments/N562_analyze.py", "equations.md#N562", "experiments/worklog.md#run562"], "timestamp": "2026-10-05T04:10:00Z"}
