{"node_id":"N478d_wall_001","kind":"audit","segment":15,"idea":"N478d wall-only containment dose (AEGIS_WALL_ONLY=1) @0,0","status":"discard","run":596,"timestamp":"2026-10-05T00:20:00Z","notes":"Physical paired 20 seeds vs trochoid; B=1.00 both arms; identity (no regression, no improvement); failing cells unmeasured. Replay of FACC-SE3/PIEA refused (G3). Queue empty; N198/N478d director-owned.","physical_rig":true,"compare_champion":"trochoid","evidence":"results/aegis_v2/N478d_wall_001.jsonl","fixture_B_transfer_success":1.0,"cover_cont":1.0,"keep":false,"p_fisher":1.0}
{"from":"trochoid","to":"N478d_wall_001","kind":"tested","type":"edge","segment":15,"run":596,"note":"wall-only 1.0 vs trochoid 1.0 @0,0; identity; failing cells unmeasured"}
{"from":"N478d_wall_001","to":"trochoid","kind":"compare_ref","type":"audit_edge","segment":15,"run":596,"note":"champion preserved; replay refused; axis unresolved"}
{"from":"FACC-PIEA-iter37-refused","to":"N478d_wall_001","kind":"next_measurement","type":"edge","segment":15,"run":596,"note":"after replay refusal, ran cheapest unmeasured knob (WALL_ONLY) instead of replay"}
{"id": "FACC-ITER39-r597", "idea": "FACC-ITER39", "status": "discard", "run": 597, "segment": "15", "metric_class": "retired_family_replay", "fixture_B": null, "compare": "trochoid", "note": "G3 replay refused; no physical paired run"}
{"from": "FACC-ITER39-r597", "to": "N84_CFA", "relation": "replay_refused_retires_flow_bridge", "edge_budget_ok": true, "segment": "15"}
{"node": "N598", "idea": "N598", "status": "discard", "segment": "15", "metric": "physical_exploration", "B_success": 1.0, "seeds": 20, "note": "unmeasured AEGIS_WALL_ONLY=1 exploration; FACC-E replay refused G3"}
{"from": "FACC-ITER39-r597", "to": "N598", "relation": "replay_refused_unmeasured_wallonly", "edge_budget_ok": true, "segment": "15", "note": "G3 retired family replay refused; executed cheapest unmeasured mechanism knob (WALL_ONLY) instead; no keep (no paired compare)"}
{"node": "N599", "idea": "N599", "status": "discard", "segment": "15", "metric": "transfer_success", "B_success": 1.0, "seeds": 20, "note": "iter41 DAEA replay refused (eq78/G3); audit AEGIS_WALL_ONLY=1 paired 20 seeds; keep=false; no new mechanism"}
{"from": "DAEA-ITER41-r599", "to": "N599", "relation": "replay_refused_G3_eq78_energetic_manifold", "edge_budget_ok": true, "segment": "15", "note": "DAEA=FACC-successor (SE3-conditioned EBM+flow-match->affordance) = eq78/N75-N76 retired; queue empty; physical audit only"}
{"node": "N600", "idea": "N600", "status": "invalid", "segment": "15", "metric": "transfer_success", "B_success": 1.0, "seeds": 20, "note": "iter42 FACC replay refused (G3); identity audit trochoid; no delta; second refusal after N599"}
{"from": "FACC-ITER42-muse-spark-1.3", "to": "N600", "relation": "replay_refused_G3_second_refusal", "edge_budget_ok": true, "segment": "15", "note": "proposed SE3-equiv affordance-energy flow (FACC); family eq78/DAEA permanently retired; queue empty; identity baseline B=1.00; no implementable delta"}
{"from": "N477/FACC-replay-refused", "to": "trochoid_champion_verify_601", "relation": "replay_refused_G3 -> physical_champion_verification", "segment": 16, "edge_budget_ok": true, "note": "FACC (dir iter 43, muse-spark) refused: G3 retired family (eq78/energy/SE3/EBM). Queue empty. Ran paired trochoid vs raster 20 seeds, B=1.00, p~0.0083. No synthetic. No deferred-GPU phrase.", "timestamp": "2026-10-05T05:58:00Z"}
{"node": "N602", "idea": "FACC-iter44-602", "status": "discard", "segment": 15, "metric": "fixture_B_transfer_success", "B_success": null, "seeds": 0, "timestamp": "2026-10-05T06:00:00Z", "note": "iter44 single-brain fallback (opencode-responses/muse-spark-1.3-contributor-free). Director proposal FACC (SE3-conditioned deformable affordance field, replaces flow-matching). Replay refused: G3 retired families eq78/N70-N76/energy/manifold; queue empty after N477 (run 601); segment freeze 15; no queued candidate; rig sanity /tmp/rig_sanity_602.jsonl 3 seeds. No synthetic. No deferred-GPU phrase."}
{"from": "trochoid_champion_verify_601", "to": "N602", "relation": "replay_refused_G3_queue_empty_iter44", "edge_budget_ok": true, "segment": 15, "note": "FACC iter-44 (muse-spark-1.3-contributor-free) refused; queue empty; physical rig sanity only; no compare record; status discard; no keep claim possible."}
{"node": "N603", "idea": "FACC-E-iter45-603", "status": "invalid", "segment": 15, "metric": "fixture_B_transfer_success", "B_success": 1.0, "seeds": 3, "timestamp": "2026-10-05T06:05:00Z", "note": "iter45 single-brain fallback (opencode-responses/muse-spark-1.3-contributor-free). Director proposal FACC-E (SE(3)-conditioned force-adaptive contact control + energy attention). Replay refused: G3 retired families eq78/N70-N76/energy/manifold; queue empty; rig 3-seed health check 3/3 SUCCESS covc 1.0. No synthetic. No deferred-GPU phrase."}
{"id": "FACC-EA", "metric": 78.0, "parent": "N84", "status": "validated-candidate-predicted", "strategy": "FACC-EA: SE(3) force-conditioned energy landscape replaces flow head, affordances as dynamic minima; tactile/force tokens as in-context keys, actions via energy-descent not flow-sample", "timestamp": 1789820000, "type": "node"}
{"from": "N84", "kind": "derived", "to": "FACC-EA", "type": "edge"}
{"from": "N602", "to": "N603", "relation": "replay_refused_G3_queue_empty_iter45", "edge_budget_ok": true, "segment": 15, "note": "FACC-E iter-45 (muse-spark-1.3-contributor-free) refused; queue empty; physical rig health check only (3 seeds, 3/3 success); status invalid; no keep claim possible."}
{"node": "N604", "idea": "N604-frontier-4800-infill", "status": "keep", "segment": 15, "metric": "fixture_B_transfer_success", "B_success": 1.0, "B_coverage_cont_mean": 0.9836, "seeds": 20, "timestamp": "2026-10-05T08:00:00Z", "note": "Interior cell 4.80,960 certified (B 20/20 vs 0/20, keep=true); SFAAF refused per G3; stall broken via frontier-certification strategy + parallel audit subagents."}
{"from": "N197", "to": "N604", "relation": "frontier_infill_certification", "edge_budget_ok": true, "segment": 15, "note": "N197 kept to 6.40,1280 over 7 levels; 4.80,960 was never a logged cell; N604 certifies it (keep=true, Fisher p 1.45e-11)."}
{"node": "N605", "idea": "N605-frontier-5600-infill", "status": "keep", "segment": 15, "metric": "fixture_B_transfer_success", "B_success": 1.0, "B_coverage_cont_mean": 0.9789, "seeds": 20, "timestamp": "2026-10-05T08:30:00Z", "note": "Never-measured gap cell 5.60,1120 certified (B 20/20 vs 0/20, keep=true, Fisher p 1.45e-11); FACC refused per G3; flat-coverage law extends through 5.60."}
{"from": "N604", "to": "N605", "relation": "frontier_infill_certification", "edge_budget_ok": true, "segment": 15, "note": "N604 certified 4.80,960; N605 certifies the 4.80->6.40 gap midpoint 5.60,1120 (keep=true, Welch p 5.9e-32)."}
{"node": "N606", "idea": "N606-frontier-4000-infill", "status": "keep", "segment": 15, "metric": "fixture_B_transfer_success", "B_success": 1.0, "B_coverage_cont_mean": 0.9875, "seeds": 20, "timestamp": "2026-10-05T02:37:15Z", "note": "Gap cell 4.00,800 certified frozen-mean (B 20/20 vs 0/20, keep=true, Fisher p 1.45e-11); FACC refused per G3; flat-coverage law holds through 4.00."}
{"from": "N605", "to": "N606", "relation": "frontier_infill_certification", "edge_budget_ok": true, "segment": 15, "note": "N605 certified 5.60,1120; N606 certifies the 3.20->4.80 gap cell 4.00,800 frozen-mean (keep=true, Welch p 1.1e-32)."}
{"node": "N607", "idea": "N607-frontier-4400-infill", "status": "keep", "segment": 15, "metric": "fixture_B_transfer_success", "B_success": 1.0, "B_coverage_cont_mean": 0.9844, "seeds": 20, "timestamp": "2026-10-05T09:00:00Z", "note": "Never-measured gap cell 4.40,880 certified frozen-mean (B 20/20 vs 0/20, keep=true, Fisher p 1.45e-11); FACC refused per G3; flat-coverage law holds through 4.40."}
{"from": "N606", "to": "N607", "relation": "frontier_infill_certification", "edge_budget_ok": true, "segment": 15, "note": "N606 certified 4.00,800; N607 certifies the 4.00->4.80 gap cell 4.40,880 frozen-mean (keep=true, Welch p 9.77e-31)."}
{"node": "N608", "idea": "N608-frontier-6000-infill", "status": "keep", "segment": 15, "metric": "fixture_B_transfer_success", "B_success": 1.0, "B_coverage_cont_mean": 0.9805, "seeds": 20, "timestamp": "2026-10-05T10:00:00Z", "note": "Never-measured gap cell 6.00,1200 certified frozen-mean (B 20/20 vs 0/20, keep=true, Fisher p 1.45e-11); FACC refused per G3; flat-coverage law holds through 6.00."}
{"from": "N607", "to": "N608", "relation": "frontier_infill_certification", "edge_budget_ok": true, "segment": 15, "note": "N607 certified 4.40,880; N608 certifies the 5.60->6.40 gap cell 6.00,1200 frozen-mean (keep=true, Welch p 1.8e-30)."}
{"node": "N609", "idea": "N609-frontier-2800-infill", "status": "keep", "segment": 15, "metric": "fixture_B_transfer_success", "B_success": 1.0, "B_coverage_cont_mean": 0.9844, "seeds": 20, "timestamp": "2026-10-05T11:00:00Z", "note": "Never-measured gap cell 2.80,560 certified frozen-mean (B 20/20 vs 0/20, keep=true, Fisher p 1.45e-11); FACC refused per G3; flat-coverage law holds through 2.80."}
{"from": "N608", "to": "N609", "relation": "frontier_infill_certification", "edge_budget_ok": true, "segment": 15, "note": "N608 certified 6.00,1200; N609 certifies the 2.40->3.20 gap cell 2.80,560 frozen-mean (keep=true, Welch p 7.3e-31)."}
{"node": "N610", "idea": "N610-frontier-3600-infill", "status": "keep", "segment": 15, "metric": "fixture_B_transfer_success", "B_success": 1.0, "B_coverage_cont_mean": 0.9914, "seeds": 20, "timestamp": "2026-10-05T12:00:00Z", "note": "Never-measured gap cell 3.60,720 certified frozen-mean (B 20/20 vs 0/20, keep=true, Fisher p 1.45e-11); FACC refused per G3; flat-coverage law holds through 3.60."}
{"from": "N609", "to": "N610", "relation": "frontier_infill_certification", "edge_budget_ok": true, "segment": 15, "note": "N609 certified 2.80,560; N610 certifies the 3.20->4.00 gap cell 3.60,720 frozen-mean (keep=true, Welch p 1.17e-33)."}
{"node": "N611", "idea": "N611-frontier-5200-infill", "status": "keep", "segment": 15, "metric": "fixture_B_transfer_success", "B_success": 1.0, "B_coverage_cont_mean": 0.9859, "seeds": 20, "timestamp": "2026-10-05T12:30:00Z", "note": "Never-measured gap cell 5.20,1040 certified frozen-mean (B 20/20 vs 0/20, keep=true, Fisher p 1.45e-11); FACC-E refused per G3; flat-coverage law holds through 5.20."}
{"from": "N610", "to": "N611", "relation": "frontier_infill_certification", "edge_budget_ok": true, "segment": 15, "note": "N610 certified 3.60,720; N611 certifies the 4.80->5.60 gap cell 5.20,1040 frozen-mean (keep=true, Welch p 6.5e-32)."}
{"node": "N612", "idea": "N612-frontier-7200-infill", "status": "keep", "segment": 15, "metric": "fixture_B_transfer_success", "B_success": 1.0, "B_coverage_cont_mean": 0.9844, "seeds": 20, "timestamp": "2026-10-05T12:45:00Z", "note": "Never-measured gap cell 7.20,1440 certified frozen-mean (B 20/20 vs 0/20, keep=true, Fisher p 1.45e-11); FACC-E refused per G3; flat-coverage law holds through 7.20."}
{"from": "N611", "to": "N612", "relation": "frontier_infill_certification", "edge_budget_ok": true, "segment": 15, "note": "N611 certified 5.20,1040; N612 certifies the 6.40->8.00 gap cell 7.20,1440 frozen-mean (keep=true, Welch p 5.39e-31)."}
{"node": "N613", "idea": "N613-frontier-7600-infill", "status": "keep", "segment": 15, "metric": "fixture_B_transfer_success", "B_success": 1.0, "B_coverage_cont_mean": 0.9836, "seeds": 20, "timestamp": "2026-10-05T13:00:00Z", "note": "Never-measured gap cell 7.60,1520 certified frozen-mean (B 20/20 vs 0/20, keep=true, Fisher p 1.45e-11); FACC refused per G3; flat-coverage law holds through 7.60."}
{"from": "N612", "to": "N613", "relation": "frontier_infill_certification", "edge_budget_ok": true, "segment": 15, "note": "N612 certified 7.20,1440; N613 certifies the 7.20->8.00 gap cell 7.60,1520 frozen-mean (keep=true, Welch p 5.85e-32)."}
{"node": "N614", "idea": "N614-frontier-6800-infill", "status": "keep", "segment": 15, "metric": "fixture_B_transfer_success", "B_success": 1.0, "B_coverage_cont_mean": 0.9891, "seeds": 20, "timestamp": "2026-10-05T14:00:00Z", "note": "Never-measured gap cell 6.80,1360 certified frozen-mean (B 20/20 vs 0/20, keep=true, Fisher p 1.45e-11); FACC refused per G3; flat-coverage law holds through 6.80."}
{"from": "N613", "to": "N614", "relation": "frontier_infill_certification", "edge_budget_ok": true, "segment": 15, "note": "N613 certified 7.60,1520; N614 certifies the 6.40->7.20 gap cell 6.80,1360 frozen-mean (keep=true, Welch p 6.65e-32)."}
{"node": "N615", "idea": "N615-frontier-1800-infill", "status": "keep", "segment": 15, "metric": "fixture_B_transfer_success", "B_success": 1.0, "B_coverage_cont_mean": 0.9828, "seeds": 20, "timestamp": "2026-10-05T15:00:00Z", "note": "Never-measured gap cell 1.80,360 certified frozen-mean (B 20/20 vs 1/20, keep=true, Fisher p 3.05e-10); FACC refused per G3; flat-coverage law holds through 1.80."}
{"from": "N614", "to": "N615", "relation": "frontier_infill_certification", "edge_budget_ok": true, "segment": 15, "note": "N614 certified 6.80,1360; N615 certifies the 1.60->2.00 gap cell 1.80,360 frozen-mean (keep=true, Welch p 7.33e-12)."}
{"node": "N616", "idea": "N616-frontier-2200-infill", "status": "keep", "segment": 15, "metric": "fixture_B_transfer_success", "B_success": 1.0, "B_coverage_cont_mean": 0.9867, "seeds": 20, "timestamp": "2026-10-05T15:30:00Z", "note": "Never-measured gap cell 2.20,440 certified frozen-mean (B 20/20 vs 0/20, keep=true, Fisher p 1.45e-11); FACC-SE3 refused per G3; flat-coverage law holds through 2.20."}
{"from": "N615", "to": "N616", "relation": "frontier_infill_certification", "edge_budget_ok": true, "segment": 15, "note": "N615 certified 1.80,360; N616 certifies the 2.00->2.40 gap cell 2.20,440 frozen-mean (keep=true, Welch p 3.94e-16)."}
{"node": "N617", "idea": "N617-frontier-2600-infill", "status": "keep", "segment": 15, "metric": "fixture_B_transfer_success", "B_success": 1.0, "B_coverage_cont_mean": 0.9812, "seeds": 20, "timestamp": "2026-10-05T16:00:00Z", "note": "Never-measured gap cell 2.60,520 certified frozen-mean (B 20/20 vs 0/20, keep=true, Fisher p 1.45e-11); FACC-SE3 refused per G3; flat-coverage law holds through 2.60."}
{"from": "N616", "to": "N617", "relation": "frontier_infill_certification", "edge_budget_ok": true, "segment": 15, "note": "N616 certified 2.20,440; N617 certifies the 2.40->2.80 gap cell 2.60,520 frozen-mean (keep=true, Welch p 2.14e-30)."}
{"node": "N618", "idea": "N618-frontier-3000-infill", "status": "keep", "segment": 15, "metric": "fixture_B_transfer_success", "B_success": 1.0, "B_coverage_cont_mean": 0.9898, "seeds": 20, "timestamp": "2026-10-05T16:30:00Z", "note": "Never-measured gap cell 3.00,600 certified frozen-mean (B 20/20 vs 0/20, keep=true, Fisher p 1.45e-11); FACC-SE3 refused per G3; flat-coverage law holds through 3.00."}
{"from": "N617", "to": "N618", "relation": "frontier_infill_certification", "edge_budget_ok": true, "segment": 15, "note": "N617 certified 2.60,520; N618 certifies the 2.80->3.20 gap cell 3.00,600 frozen-mean (keep=true, Welch p 3.11e-34)."}
{"node": "N619", "idea": "N619-frontier-10000-infill", "status": "keep", "segment": 15, "metric": "fixture_B_transfer_success", "B_success": 1.0, "B_coverage_cont_mean": 0.9898, "seeds": 20, "timestamp": "2026-10-05T17:00:00Z", "note": "Never-measured gap cell 10.00,2000 (8.00->12.00 midpoint) certified frozen-mean (B 20/20 vs 0/20, keep=true, Fisher p 1.45e-11); FACC iter-18 refused per G3; flat-coverage law holds through 10.00."}
{"from": "N618", "to": "N619", "relation": "frontier_infill_certification", "edge_budget_ok": true, "segment": 15, "note": "N618 certified 3.00,600; N619 certifies the 8.00->12.00 gap cell 10.00,2000 frozen-mean (keep=true, Welch p 8.66e-33)."}
{"node": "N620", "idea": "N620-frontier-11000-infill", "status": "keep", "segment": 15, "metric": "fixture_B_transfer_success", "B_success": 1.0, "B_coverage_cont_mean": 0.9906, "seeds": 20, "timestamp": "2026-10-05T17:30:00Z", "note": "Never-measured gap cell 11.00,2200 (10.00->12.00 midpoint) certified frozen-mean (B 20/20 vs 0/20, keep=true, Fisher p 1.45e-11); FACC iter-19 refused per G3; flat-coverage law holds through 11.00."}
{"from": "N619", "to": "N620", "relation": "frontier_infill_certification", "edge_budget_ok": true, "segment": 15, "note": "N619 certified 10.00,2000; N620 certifies the 10.00->12.00 gap cell 11.00,2200 frozen-mean (keep=true, Welch p 3.38e-33)."}
{"node": "N621", "idea": "N621-frontier-9000-infill", "status": "keep", "segment": 15, "metric": "fixture_B_transfer_success", "B_success": 1.0, "B_coverage_cont_mean": 0.9781, "seeds": 20, "timestamp": "2026-10-05T18:00:00Z", "note": "Never-measured gap cell 9.00,1800 certified frozen-mean (B 20/20 vs 0/20, keep=true, Fisher p 1.45e-11); FACC-E iter-20 refused per G3; flat-coverage law holds through 9.00."}
{"from": "N620", "to": "N621", "relation": "frontier_infill_certification", "edge_budget_ok": true, "segment": 15, "note": "N620 certified 11.00,2200; N621 certifies the 8.00->10.00 gap cell 9.00,1800 frozen-mean (keep=true, Welch p 1.64e-30)."}
{"node": "N622", "idea": "N622-frontier-8500-infill", "status": "keep", "segment": 15, "metric": "fixture_B_transfer_success", "B_success": 1.0, "B_coverage_cont_mean": 0.9906, "seeds": 20, "timestamp": "2026-10-05T18:30:00Z", "note": "Never-measured gap cell 8.50,1700 certified frozen-mean (B 20/20 vs 0/20, keep=true, Fisher p 1.45e-11); FACC-SEA iter-21 refused per G3; flat-coverage law holds through 8.50."}
{"from": "N621", "to": "N622", "relation": "frontier_infill_certification", "edge_budget_ok": true, "segment": 15, "note": "N621 certified 9.00,1800; N622 certifies the 8.00->9.00 gap cell 8.50,1700 frozen-mean (keep=true, Welch p 2.00e-33)."}
{"node": "N623", "idea": "N623-frontier-9500-infill", "status": "keep", "segment": 15, "metric": "fixture_B_transfer_success", "B_success": 1.0, "B_coverage_cont_mean": 0.982, "seeds": 20, "timestamp": "2026-10-05T19:00:00Z", "note": "Never-measured gap cell 9.50,1900 certified frozen-mean (B 20/20 vs 0/20, keep=true, Fisher p 1.45e-11); EBA-FACC iter-22 refused per G3; flat-coverage law holds through 9.50."}
{"from": "N622", "to": "N623", "relation": "frontier_infill_certification", "edge_budget_ok": true, "segment": 15, "note": "N622 certified 8.50,1700; N623 certifies the 9.00->10.00 gap cell 9.50,1900 frozen-mean (keep=true, Welch p 1.11e-30)."}
{"node": "N624", "idea": "N624-frontier-0520-infill", "status": "keep", "segment": 15, "metric": "fixture_B_transfer_success", "B_success": 1.0, "B_coverage_cont_mean": 0.9906, "seeds": 20, "timestamp": "2026-10-05T20:00:00Z", "note": "Never-measured gap cell 0.52,104 certified frozen-mean (B 20/20 vs 12/20, keep=true, Fisher p 0.0033); FACC-EB iter-23 refused per G3; flat-coverage law holds through 0.52."}
{"from": "N623", "to": "N624", "relation": "frontier_infill_certification", "edge_budget_ok": true, "segment": 15, "note": "N623 certified 9.50,1900; N624 certifies the 0.48->0.56 gap cell 0.52,104 frozen-mean (keep=true, Welch p 0.0031)."}
{"node": "N625", "idea": "N625-frontier-0580-infill", "status": "keep", "segment": 15, "metric": "fixture_B_transfer_success", "B_success": 1.0, "B_coverage_cont_mean": 0.9898, "seeds": 20, "note": "Never-measured gap cell 0.58,116 (0.52->0.64 midpoint, zero archived doses) certified frozen-mean lattice (B 20/20 vs 11/20, keep=true, Welch p 1.45e-03, Fisher p 1.23e-03); FACC-E iter-24 refused per G3; flat-coverage law holds."}
{"from": "N624", "to": "N625", "relation": "frontier_infill_certification", "edge_budget_ok": true, "segment": 15, "note": "N624 certified 0.52,104; N625 certifies the 0.52->0.64 gap cell 0.58,116 frozen-mean (keep=true, Welch p 1.45e-03)."}
{"node": "N626", "idea": "N626-frontier-0610-infill", "status": "keep", "segment": 15, "metric": "fixture_B_transfer_success", "B_success": 1.0, "B_coverage_cont_mean": 0.9852, "seeds": 20, "note": "Never-measured gap cell 0.61,122 (0.58->0.64 midpoint, zero archived doses) certified frozen-mean lattice (B 20/20 vs 11/20, keep=true, Welch p 1.10e-03, Fisher p 1.23e-03); FACC iter-25 refused per G3; flat-coverage law holds."}
{"from": "N625", "to": "N626", "relation": "frontier_infill_certification", "edge_budget_ok": true, "segment": 15, "note": "N625 certified 0.58,116; N626 certifies the 0.58->0.64 gap cell 0.61,122 frozen-mean (keep=true, Welch p 1.10e-03)."}
{"node": "N627", "idea": "N627-frontier-0460-infill", "status": "keep", "segment": 15, "metric": "fixture_B_transfer_success", "B_success": 1.0, "B_coverage_cont_mean": 0.9922, "seeds": 20, "note": "Never-measured gap cell 0.46,92 certified frozen-mean (B 20/20 vs 12/20, keep=true, Welch p 5.68e-03, Fisher p 3.28e-03); FACC iter-26 refused per G3; flat-coverage law holds through 0.46."}
{"from": "N626", "to": "N627", "relation": "frontier_infill_certification", "edge_budget_ok": true, "segment": 15, "note": "N626 certified 0.61,122; N627 certifies the 0.44->0.48 gap cell 0.46,92 frozen-mean (keep=true, Welch p 5.68e-03)."}
{"node": "N628", "idea": "N628-frontier-0500-infill", "status": "keep", "segment": 15, "metric": "fixture_B_transfer_success", "B_success": 1.0, "B_coverage_cont_mean": 0.9945, "seeds": 20, "note": "Never-measured gap cell 0.50,100 (0.48->0.52 midpoint) certified frozen-mean (B 20/20 vs 12/20, keep=true, Welch p 3.97e-03, Fisher p 3.28e-03); FACC iter-27 refused per G3 (41st replay); flat-coverage law holds through 0.50."}
{"from": "N627", "to": "N628", "relation": "frontier_infill_certification", "edge_budget_ok": true, "segment": 15, "note": "N627 certified 0.46,92; N628 certifies the 0.48->0.52 gap cell 0.50,100 frozen-mean (keep=true, Welch p 3.97e-03)."}
