{"run": 207, "segment": 15, "status": "discard", "idea": "I2", "timestamp": "2026-09-28T00:00:00Z", "description": "T200 global-only linear soft score POST-HOC ONLY + frozen I7+I10 (director iter 25). Score s=w191-lam*jerk, admit iff s>=TAU_global (2 params, zero per-tool tables/buffer/shrinkage). Train-locked fit on calib (deviation: lam gridded on calib not held-out, held-fit would be test-peeking): Q70 over 17 calib fails -> lam*=250 (min calib P(fail|admit) 0.0984), TAU*=72.5843. Single held eval, frozen R173 files, zero rig edits. HeldB yield 0.40 (=T199, precision 1.0, cov ok). Pooled failure-recall 46.67=T199 EXACTLY (n_adm 57 vs 60, vetoes 3 extra successes); P(fail|admit) 0.1404 vs T199 0.1333 (precision drops); rescue_rate 0.0 (rescues nothing); lift -3.26 (worst diode in T-series); lam=0 Q70 arm bit-identical pooled (soft term reorders only inside reject region). Calib recall 0.6471 misses the 70 target (17-fail quantization). Director 71.0 KEEP missed by 24.3pts. DISCARD; w191-admission abandon stands (soft=hard=46.67 plateau); I2 CLOSED; next I8.", "metric": 46.67, "metric_unit": "transfer_success Fixture-B fitted Run-A decider (G2 primary; pooled failure-reject recall 46.67 in metrics)", "metrics": {"idea": "I2", "variant": "T200 linear soft score s=w191-lam*jerk", "seeds": 20, "gate_mode": "post-hoc", "path": "fitted-frozen", "LAM_STAR": 250, "TAU_STAR": 72.5843, "TAU70_grid": {"0": 74.3443, "250": 72.5843, "500": 71.3026, "1000": 68.0008, "2000": 62.7544, "4000": 58.6719}, "calib_recall_at_TAU70": 0.6471, "heldB_yield": 0.4, "heldB_keep_pct": 40.0, "pooled_failure_recall": 0.4667, "score_recall_pts": 46.67, "vs_T199_recall_pts": 0.0, "pooled_p_fail_adm": 0.1404, "T199_p_fail_adm": 0.1333, "selective_risk_lift_vs_T173_pts": -3.26, "rescue_rate": 0.0, "heldB_rescued": 0, "new_mistakes": 0, "precision_no_drop": false, "lam0_Q70_bitidentical_pooled": true, "archive_adm_frac": 0.0, "director_predicted_71": 46.67, "T205_note": "no T205 exists; read as T198 40.0 worst hard-gate recall", "evidence": ["results/aegis_v2/I2_r200_analysis.py", "results/aegis_v2/I2_r200_result.json"]}, "rig": "experiments/kaggle_aegis_sweep.py", "command": "POST-HOC ONLY, zero rig edits, no rig run; timeout 300 python3 results/aegis_v2/I2_r200_analysis.py on frozen R173 files", "compare_champion": "trochoid"}
{"run": 208, "segment": 15, "status": "discard", "idea": "I2", "timestamp": "2026-09-28T00:00:00Z", "description": "T201 global-only joint-tuned soft score (director iter 26). s=w191-lam*jerk, admit iff s>=TAU_global, lam+TAU co-tuned in-train via 5-fold CV on CALIB only (nested; single held eval); theta_marg refit per-fold (unfrozen); zero per-tool tables; zero rig edits, frozen R173 files. CV ridge FLAT in lam (all lam>0 tie at mean recall 0.8833 @q0.9); tie-break picks LAM_STAR=8000 (grid edge) while per-fold mode at q0.70 is 0 (4/5 folds) -> lam UNSTABLE to 0/inf, director discard FIRES. Held pooled recall 93.33 is a strictness artifact (n_adm 9/120; heldB yield 0.0, vetoes everything incl. all successes; rescue 0.0; cov regression 0.0 vs 0.9883). lam=0@same q already 86.67, jerk adds only +6.66. DISCARD (instability + zero utility); I2 stays CLOSED; next I8.", "metric": 93.33, "metric_unit": "transfer_success Fixture-B fitted Run-A decider (G2 primary; pooled failure-reject recall 93.33 strictness artifact in metrics)", "metrics": {"idea": "I2", "variant": "T201 joint-tuned soft score 5-fold CV", "seeds": 20, "gate_mode": "post-hoc", "path": "fitted-frozen", "LAM_STAR": 8000, "Q_STAR": 0.9, "TAU_STAR": 75.8, "cv_ridge_flat_lam": true, "fold_best_lam_at_q70": [0, 0, 0, 2000, 0], "lam_unstable_to_0_or_inf": true, "heldB_yield": 0.0, "heldB_n_adm": 0, "pooled_failure_recall": 0.9333, "score_recall_pts": 93.33, "pooled_n_adm": 9, "vs_T199_recall_pts": 46.66, "jerk_adds_vs_lam0_pts": 6.66, "lam0_same_q_recall": 86.67, "selective_risk_lift_vs_T173_pts": -0.33, "rescue_rate": 0.0, "cov_regression": true, "archive_adm_frac": 0.0, "director_predicted_70_73": 93.33, "evidence": ["results/aegis_v2/I2_r201_analysis.py", "results/aegis_v2/I2_r201_result.json"]}, "rig": "experiments/kaggle_aegis_sweep.py", "command": "POST-HOC ONLY, zero rig edits, no rig run; timeout 300 python3 results/aegis_v2/I2_r201_analysis.py on frozen R173 files", "compare_champion": "trochoid"}
{"run": 209, "segment": 15, "status": "discard", "idea": "I2", "timestamp": "2026-09-28T00:00:00Z", "description": "T202 global dual-cut (TAU+JMAX veto), pooled-1 (director iter 27). Admit iff w191>=TAU AND jerk<=JMAX, co-tuned in-train on CALIB (TAU=Qq fail-w x JMAX=Qq succ-jerk, 35 pairs, recall>=0.65 then min P(fail|admit), loosest tie-break); frozen I7+I10; zero rig edits; frozen R173 files. Locked TAU*=74.9317 (Q0.8) + JMAX*=0.020572 (Q1.0=max=VACUOUS, above theta_marg 0.014133): in-train selector itself rejects the veto (calib P(fail|admit) rises monotonically as JMAX tightens at every TAU). Held pooled recall 46.67=T199 EXACTLY (n_adm 57 vs 60, veto adds +0.0 vs TAU-only; JMAX-only=T173 26.67); precision drops 0.1404 vs 0.1333; rescue 0.0; lift -3.26 (ties T200 worst diode). Kill FIRES (46.67<=50). Director 71.5 MISSED by 24.8. DISCARD; veto direction wrong (not just inert); global-only exhausted linear+nonlinear; I2 stays CLOSED; next I8.", "rig": "experiments/kaggle_aegis_sweep.py", "command": "POST-HOC ONLY, zero rig edits, no rig run; timeout 300 python3 results/aegis_v2/I2_r202_analysis.py on frozen R173 files", "compare_champion": "trochoid", "metric": 46.67, "metric_unit": "transfer_success Fixture-B fitted Run-A decider (G2 primary; pooled failure-reject recall 46.67 in metrics)", "metrics": {"idea": "I2", "variant": "T202 global dual-cut w191>=TAU AND jerk<=JMAX", "seeds": 20, "gate_mode": "post-hoc", "path": "fitted-frozen", "TAU_STAR": 74.9317, "TAU_q": 0.8, "JMAX_STAR": 0.020572, "JMAX_q": 1.0, "JMAX_vacuous_above_theta_marg": true, "theta_marg": 0.014133, "feasible_n": 19, "star_at_grid_edge": true, "calib_star_recall": 0.7647, "calib_star_p_fail_adm": 0.0714, "heldB_yield": 0.4, "heldB_keep_pct": 40.0, "pooled_failure_recall": 0.4667, "score_recall_pts": 46.67, "vs_T199_recall_pts": 0.0, "veto_adds_vs_TAUonly_pts": 0.0, "JMAX_only_recall": 26.67, "pooled_p_fail_adm": 0.1404, "T199_p_fail_adm": 0.1333, "selective_risk_lift_vs_T173_pts": -3.26, "rescue_rate": 0.0, "winners_vetoed_by_JMAX": 0, "precision_no_drop": false, "kill_le_50": true, "per_tool_needed": false, "archive_adm_frac": 0.0, "director_predicted_71_5": 46.67, "evidence": ["results/aegis_v2/I2_r202_analysis.py", "results/aegis_v2/I2_r202_result.json"]}}
{"run": 210, "segment": 15, "status": "discard", "idea": "I2", "timestamp": "2026-09-28T00:00:00Z", "description": "T203 jerk-stratified dual-cut, pooled-1 (director iter 28). Admit iff w191>=TAU_b[jerk-bin], k=3 CALIB tertile bins (E1=0.003652,E2=0.009075, 40/40/40, fails 6/4/7); co-tuned 3xTAU in-train on CALIB pooled (global fail-w grid 5q, 35 isotonic combos, recall>=0.65 then min P(fail|admit), loosest tie-break); frozen I7+I10; zero rig edits; frozen R173 files. Locked TAU_B=[73.2251,74.9317,74.9317] isotonic, interior (no edge). HeldB keep 40.0 (=T199/T202; precision 1.0; cov ok); pooled recall 46.67=T199/T202 EXACTLY (n_adm 57; rescue 0.0; precision drops 0.1404 vs 0.1333; lift -3.26 ties worst diode); T201 abl 93.33 artifact (heldB 0.0). Bin>=50 check FAILED (40/bin caveat; no collapse, no fallback). Kill FIRES (keep<70 AND pts<70); director 78-85pts/71-75keep MISSED by ~32-38. DISCARD; KILL conditional line per fail-branch; next: per-sample conformal.", "rig": "experiments/kaggle_aegis_sweep.py", "command": "POST-HOC ONLY, zero rig edits, no rig run; timeout 300 python3 results/aegis_v2/I2_r203_analysis.py on frozen R173 files", "compare_champion": "trochoid", "metric": 46.67, "metric_unit": "transfer_success Fixture-B fitted Run-A decider (G2 primary; pooled failure-reject recall 46.67 in metrics)", "metrics": {"idea": "I2", "variant": "T203 jerk-stratified dual-cut w191>=TAU_b[jerk-bin]", "seeds": 20, "gate_mode": "post-hoc", "path": "fitted-frozen", "E1": 0.003652, "E2": 0.009075, "cal_bin_n": [40, 40, 40], "cal_bin_fails": [6, 4, 7], "bin_ge50_pass": false, "collapsed": false, "fallback": null, "TAU_B": [73.2251, 74.9317, 74.9317], "isotonic": true, "star_idx": [1, 3, 3], "feasible_ge65_n": 17, "calib_star_recall": 0.7647, "calib_star_p_fail_adm": 0.069, "star_at_grid_edge": false, "heldB_keep_pct": 40.0, "heldB_yield_vs_T199_pts": 0.0, "pooled_failure_recall": 0.4667, "score_recall_pts": 46.67, "recall_vs_T199_pts": 0.0, "recall_vs_T202_pts": 0.0, "recall_vs_T201_pts": -46.66, "selective_risk_lift_vs_T173_pts": -3.26, "rescue_rate": 0.0, "heldB_rescued": 0, "new_mistakes": 0, "precision_no_drop": false, "archive_adm_frac": 0.0, "abl_T201_recall": 93.33, "abl_T201_heldB_yield": 0.0, "director_predicted_pts_78_85": 46.67, "director_predicted_keep_71_75": 40.0, "kill_keep_and_pts_lt_70": true}, "evidence_file": "results/aegis_v2/I2_r203_result.json", "integrity_g7": true, "banned_phrases_checked": true, "timeout_s": 300, "cleanup_anchored_kill": true, "remote_gpu_deferred": false, "verdict": "DISCARD (HELD keep 40<70 AND pts 46.67<70; director conditional-keep rule fails); conditional admission line KILLED per fail-branch; next per-sample conformal."}
{"run": 211, "segment": 15, "status": "discard", "idea": "I2", "timestamp": "2026-09-28T00:00:00Z", "description": "T204 robust global soft-score with clipped jerk, pooled-1 (director iter 29). s=w191-lam*clip(jerk,0,J95), J95=0.015175 CALIB-pooled Q0.95; decoupled fit (lam sweep at fixed Q70-fail TAU rule, then TAU lock; no bins/CV); frozen I7+I10; zero rig edits; frozen R173 files. Locked LAM*=250 (interior, =T200) + TAU*=72.5843 (=T200 bit-identical: clip inert at lam 250). CALIB pooled: recall 0.6471/pf 0.0984 vs T201 0.9412/0.0833 -> NO GAIN, director discard FIRES. Held pooled recall 46.67=T199/T200/T202/T203 EXACTLY (n_adm 57; lam=0 ablation bit-identical, jerk adds +0.0; rescue 0.0/53; precision drops 0.1404 vs 0.1333; lift -3.26 ties worst diode); heldB keep 40.0 (=T199; precision 1.0; cov ok); archive 0.0. Director 100-110pts/keep>=70 MISSED by ~55-65. DISCARD; KILL soft-penalty frontier (raw/clipped, joint/decoupled, CV/pooled all converge 46.67 or artifacts); I2 stays CLOSED; next per-sample conformal.", "metric": 46.67, "metric_unit": "transfer_success Fixture-B fitted Run-A decider (G2 primary; pooled failure-reject recall 46.67 in metrics)", "metrics": {"idea": "I2", "variant": "T204 clipped soft-score s=w191-lam*clip(jerk,0,J95)", "seeds": 20, "gate_mode": "post-hoc", "path": "fitted-frozen", "J95": 0.015175, "LAM_STAR": 250, "TAU_STAR": 72.5843, "lam_at_grid_edge": false, "calib_recall_T204": 0.6471, "calib_pf_T204": 0.0984, "calib_recall_T201": 0.9412, "calib_pf_T201": 0.0833, "calib_gain_vs_T201": false, "heldB_yield": 0.4, "heldB_keep_pct": 40.0, "pooled_failure_recall": 0.4667, "score_recall_pts": 46.67, "vs_T199_recall_pts": 0.0, "vs_T201_recall_pts": -46.66, "jerk_adds_vs_lam0_pts": 0.0, "pooled_p_fail_adm": 0.1404, "T199_p_fail_adm": 0.1333, "selective_risk_lift_vs_T173_pts": -3.26, "rescue_rate": 0.0, "T204_eq_T200_held": true, "archive_adm_frac": 0.0, "director_predicted_pts_100_110": 46.67, "evidence": ["results/aegis_v2/I2_r204_analysis.py", "results/aegis_v2/I2_r204_result.json"]}, "rig": "experiments/kaggle_aegis_sweep.py", "command": "POST-HOC ONLY, zero rig edits, no rig run; timeout 300 python3 results/aegis_v2/I2_r204_analysis.py on frozen R173 files", "compare_champion": "trochoid"}
{"run": 212, "segment": 15, "status": "discard", "idea": "I2", "timestamp": "2026-09-28T00:00:00Z", "description": "T205 w191-only ablation, kill-test for jerk frontier (director iter 30). Admit iff w191>=TAU*, no jerk term, pooled-1 CALIB; TAU* via 5-fold stratified CV on CALIB only (Q grid 0.5..0.9, max mean-CV recall, loosest tie-break); frozen I7+I10; zero rig edits; frozen R173 files. Locked Q*=0.8/TAU*=74.9317 (interior; mean-CV recall 0.8167/pf 0.0533; ==T202 TAU). HeldB keep 40.0 (=T199/T202/T203/T204; precision 1.0; veto 0.60; cov ok); pooled recall 46.67=T202/T203/T204 EXACTLY (n_adm 57; veto 0.525; pf 0.1404 vs T199 0.1333; rescue 0.0; lift -3.26 ties worst diode); archive 0.0. Held admit-overlap vs T202/T203/T204 agreement 1.0/Jaccard 1.0 (bit-identical); vs T199 0.975/0.95. corr(w191,jerk) calib -0.6147/held -0.6192 all-eps, admitted-only -0.1766/+0.2477. Director 46.67pts HIT EXACTLY, keep>=70 P<5% confirmed. DISCARD; CLOSE F-jerk (tie proves jerk adds zero); T206 = new orthogonal signal target 65-75.", "metric": 46.67, "metric_unit": "transfer_success Fixture-B fitted Run-A decider (G2 primary; pooled failure-reject recall 46.67 in metrics)", "metrics": {"idea": "I2", "variant": "T205 w191-only ablation admit iff w191>=TAU*", "seeds": 20, "gate_mode": "post-hoc", "path": "fitted-frozen", "Q_STAR": 0.8, "TAU_STAR": 74.9317, "q_at_grid_edge": false, "mean_cv_recall": 0.8167, "mean_cv_pf": 0.0533, "heldB_keep_pct": 40.0, "heldB_veto_rate": 0.6, "pooled_failure_recall": 0.4667, "score_recall_pts": 46.67, "recall_vs_T199_pts": 0.0, "recall_vs_T202_pts": 0.0, "recall_vs_T203_pts": 0.0, "recall_vs_T204_pts": 0.0, "tie_vs_T202_T203_T204": true, "pooled_p_fail_adm": 0.1404, "selective_risk_lift_vs_T173_pts": -3.26, "held_overlap_vs_T202_agreement": 1.0, "held_overlap_vs_T202_jaccard": 1.0, "held_overlap_vs_T203_agreement": 1.0, "held_overlap_vs_T204_agreement": 1.0, "held_overlap_vs_T199_agreement": 0.975, "corr_w191_jerk_calib_all": -0.6147, "corr_w191_jerk_held_all": -0.6192, "corr_w191_jerk_calib_admitted": -0.1766, "corr_w191_jerk_held_admitted": 0.2477, "rescue_rate": 0.0, "archive_adm_frac": 0.0, "frontier_closed": "F-jerk", "next": "T206 new orthogonal signal target 65-75", "evidence": ["results/aegis_v2/I2_r205_analysis.py", "results/aegis_v2/I2_r205_result.json"]}}
{"run": 213, "segment": 15, "status": "discard", "idea": "I2", "timestamp": "2026-09-28T00:00:00Z", "description": "T206 band-gated stratified soft-score, pooled-1 (director iter 31). Auto-admit w191>=TAU_hi=100.0 (P90 all-cal w); auto-reject w191<TAU_lo=65.6704 (P30); in-band admit iff w191-lam*clip(jerk,0,J95)>=TAU_mid, J95=0.015175 reused; grid lam x TAU_mid on CALIB pooled (recall>=0.65 then min pf); frozen I7+I10; zero rig edits; frozen R173 files. Locked LAM*=250+TAU_MID*=74.6045 interior; CALIB recall 0.8235/pf 0.06 vs lam0 0.7059/0.0847 (in-band +0.2857 in-train); split-half UNSTABLE (h1 lam0/100.0 vs h2 lam0/73.2). HeldB keep 35.0 (<T205 40.0); pooled recall 46.67=T199/T205 EXACTLY (n_adm 55; rescue 0; pf 0.1455; lift -3.77); held in-band delta 0.0/7; band mass 39.2pct held. Kill FIRES (delta<=0). DISCARD; CLOSE F-jerk entirely; I2 CLOSED; next I8.", "rig": "experiments/kaggle_aegis_sweep.py", "command": "POST-HOC ONLY, zero rig edits, no rig run; timeout 300 python3 results/aegis_v2/I2_r206_analysis.py on frozen R173 files", "compare_champion": "trochoid", "metric": 46.67, "metric_unit": "transfer_success Fixture-B fitted Run-A decider (G2 primary; pooled failure-reject recall 46.67 in metrics)", "metrics": {"idea": "I2", "variant": "T206 band-gated stratified soft-score", "seeds": 20, "gate_mode": "post-hoc", "path": "fitted-frozen", "TAU_HI_P90": 100.0, "TAU_LO_P30": 65.6704, "J95": 0.015175, "LAM_STAR": 250, "TAU_MID_STAR": 74.6045, "calib_recall": 0.8235, "calib_pf": 0.06, "calib_inband_delta": 0.2857, "split_half_stable": false, "heldB_keep_pct": 35.0, "heldB_vs_T205_pts": -5.0, "pooled_failure_recall": 0.4667, "score_recall_pts": 46.67, "held_inband_delta": 0.0, "band_mass_held": 0.3917, "selective_risk_lift_vs_T173_pts": -3.77, "kill_inband_delta_le_0": true, "kill_jerk_frontier": true, "archive_adm_frac": 0.0, "director_predicted_pts_62_68": 46.67, "evidence": ["results/aegis_v2/I2_r206_analysis.py", "results/aegis_v2/I2_r206_result.json"]}}
{"run": 214, "segment": 15, "status": "discard", "idea": "I2", "timestamp": "2026-09-28T00:00:00Z", "description": "T207 band-local soft-score, pooled-0, no hard gates (director iter 32). s=(w191-mu_band)/sig_band - lam*clip(jerk,0,J95_band), CALIB jerk-tertile bands (E1=0.003652,E2=0.009075, 40/40/40, fails 6/4/7); J95_band=[0.003611,0.008967,0.019942], mu=[83.46,75.14,51.02], sig=[15.33,16.28,36.36]; lam sweep {0,0.25,0.5}, per-band ROC TAU*_band; LAM*=0.25 + TAU*=[1.0783,-0.0348,0.6390] (lam=0 infeasible band0); frozen I7+I10; zero rig edits; frozen R173 files. HeldB keep 40.0 (=T205, precision 1.0, cov ok); pooled recall 60.0 vs T199/T205 46.67 (+13.33, first break of plateau; local beats global abl +13.33; strict subset admits 43c57, Jaccard 0.75); band1 held recall 0.0 (loose TAU* out-of-sample); selective-risk lift -3.17 (diode stands); archive 0.0. Kill FIRES (keep 40<60). Director 55pm5 HIT (60.0 at top edge), keep>60 MISSED. DISCARD; NO T208 (keep leg failed); I2 stays CLOSED; next I8.", "rig": "experiments/kaggle_aegis_sweep.py", "command": "POST-HOC ONLY, zero rig edits, no rig run; timeout 300 python3 results/aegis_v2/I2_r207_analysis.py on frozen R173 files", "compare_champion": "trochoid", "metric": 60.0, "metric_unit": "transfer_success Fixture-B fitted Run-A decider (G2 primary; pooled failure-reject recall 60.0 in metrics)", "metrics": {"idea": "I2", "variant": "T207 band-local soft-score pooled-0", "seeds": 20, "gate_mode": "post-hoc", "path": "fitted-frozen", "E1": 0.003652, "E2": 0.009075, "J95_band": [0.003611, 0.008967, 0.019942], "mu_band": [83.4572, 75.1447, 51.0233], "sig_band": [15.3323, 16.282, 36.3569], "LAM_STAR": 0.25, "TAU_STAR_band": [1.0783, -0.0348, 0.639], "calib_recall": 0.8235, "calib_pf": 0.0714, "heldB_keep_pct": 40.0, "heldB_vs_T205_pts": 0.0, "pooled_failure_recall": 0.6, "score_recall_pts": 60.0, "vs_T199_recall_pts": 13.33, "local_vs_global_pts": 13.33, "band1_held_recall": 0.0, "selective_risk_lift_vs_T173_pts": -3.17, "admit_overlap_jaccard_vs_T205": 0.7544, "strict_subset_43c57": true, "kill_pts_le_48_67": false, "kill_keep_lt_60": true, "archive_adm_frac": 0.0, "evidence": ["results/aegis_v2/I2_r207_analysis.py", "results/aegis_v2/I2_r207_result.json"]}, "evidence_file": "results/aegis_v2/I2_r207_result.json", "integrity_g7": true, "banned_phrases_checked": true, "timeout_s": 300, "cleanup_anchored_kill": true, "remote_gpu_deferred": false, "verdict": "DISCARD (keep 40.0<60 kill fires; pooled 60.0 first plateau break but diode stands, band1 collapses held); NO T208; I2 CLOSED; next I8."}
{"run": 215, "segment": 15, "status": "discard", "idea": "I2", "timestamp": "2026-09-28T00:00:00Z", "description": "T208 shrunk band-local+global soft-score pooled-1 (director iter 33). s=z_shrunk+z_global-jerk_pen, mu_shrunk=(40*mu_b+20*mu_g)/60=[78.93,73.39,57.31], sig_pooled=28.07, jerk_pen=lam*clip(j,0,0.015175)/0.015175, no hard gates; train-locked CALIB pooled fit (lam x TAU, recall>=0.65 then min pf); frozen I7+I10; zero rig edits; frozen R173 files. Locked LAM*=1.0(grid edge)+TAU*=0.1258 (calib recall 0.7647/pf 0.0833). HeldB keep 40.0 (=T205; precision 1.0; cov ok); pooled recall 46.67=plateau (n_adm 54; -13.33 vs T207 60.0; pf 0.1481; lift -4.03 worst diode). Ablations: lam0 53.33 BEATS lam* by +6.66 (jerk hurts); shrunk==raw 46.67 (delta 0.0, director fail FIRES); pooled-0 60.0 beats pooled-1 by +13.33 (pooling destroys T207 localization). Director 71.7 KEEP MISSED by 25.0. DISCARD; CLOSE shrunk/pooled-1 line; I2 stays CLOSED; next I8.", "metric": 46.67, "metric_unit": "transfer_success Fixture-B fitted Run-A decider (G2 primary; pooled failure-reject recall 46.67 in metrics)", "metrics": {"idea": "I2", "variant": "T208 s=z_shrunk+z_global-jerk_pen pooled-1", "seeds": 20, "gate_mode": "post-hoc", "path": "fitted-frozen", "LAM_STAR": 1.0, "TAU_STAR": 0.1258, "lam_at_grid_edge": true, "mu_shrunk": [78.9298, 73.3881, 57.3072], "calib_recall": 0.7647, "calib_pf": 0.0833, "heldB_keep_pct": 40.0, "pooled_failure_recall": 0.4667, "score_recall_pts": 46.67, "vs_T207_pts": -13.33, "shrunk_vs_raw_pts": 0.0, "lam_vs_lam0_pts": -6.66, "pooled1_vs_pooled0_pts": -13.33, "selective_risk_lift_vs_T173_pts": -4.03, "archive_adm_frac": 0.0, "director_predicted_71_7": 46.67, "evidence": ["results/aegis_v2/I2_r208_analysis.py", "results/aegis_v2/I2_r208_result.json"]}, "rig": "experiments/kaggle_aegis_sweep.py", "command": "POST-HOC ONLY, zero rig edits, no rig run; timeout 300 python3 results/aegis_v2/I2_r208_analysis.py on frozen R173 files", "compare_champion": "trochoid"}
