{"run": 358, "segment": 15, "status": "keep", "idea": "N209-FRICTION-AXIS", "metric": 1.0, "metric_name": "fixture_B transfer_success (coverage_cont >= 0.90 per episode), canonical rig, 20 seeds, pose_noise 0,0", "metric_unit": "fixture_B transfer_success of the trochoid champion at mu_tool=1.0 (realized == commanded friction) over the paired mu_tool dose {0.3, 0.9, 1.0, 1.2, 1.6, 2.0, 3.0}, 20 seeds, suites A/B/R, every arm paired in-rig against the frozen mu_tool=0.9 rig on the SAME seeds", "rig": "experiments/kaggle_aegis_sweep.py (PyBullet DIRECT, system python3, declared friction U[0.05,0.80], gate_mode=post-hoc); pts_source=physics_contact; coverage_cont/success recomputed from physics contacts at return time; no teleport, no arithmetic coverage, no synthetic proxy", "command": "AEGIS_POSE_NOISE=0,0|0.03,6 AEGIS_TOOL_FRICTION=<mu> timeout 1200 python3 experiments/kaggle_aegis_sweep.py --seeds 20 --no-upload --path <trochoid|raster> --compare <trochoid|raster> --compare-env AEGIS_TOOL_FRICTION=0.9 --suites fixture_A,fixture_B,fixture_R --out results/aegis_v2/N209_r358*.jsonl  (7 runs + 1 identity control, all exit 0, 0 harness errors, 4.8-8.1 s each, anchored kill after each)", "compare_champion": "in-rig --compare-env AEGIS_TOOL_FRICTION=0.9 on the SAME 20 seeds -> identical friction draw, tool id, pose noise and customer draw; the baseline arm IS the frozen rig. Identity control: default arm reproduces results/aegis_v2/Run350_champion_health_r350.jsonl bit-for-bit on all 60 episodes (max |d coverage_cont| = 0.0), and three repeat processes give identical per-episode coverage_cont.", "description": "Third rig-validity audit (after N207 rate, N208 iterations), attacking the contact MODEL's own factor. Bullet combines the two bodies' lateralFriction multiplicatively, so the tool head's hardcoded 0.9 was a second factor on the swept axis that no run recorded. Measured the realized coefficient with a lateral force-ramp probe, corrected the band, and located the friction transition relative to the declared [0.05, 0.80]. The declared band turns out to contain NO transition point, so the paper's 'robust to wet soap .. dry porcelain' statement is not supported as written -- while the frozen champion is unaffected.", "metrics": {"idea": "N209-FRICTION-AXIS", "seeds": 20, "physical": true, "rig_invoked": true, "new_mechanism": false, "claim_type": "validity_audit", "fixture_A": 1.0, "fixture_B": 1.0, "fixture_R": 1.0, "question": "The declared experimental factor is friction U[0.05,0.80] (wet soap .. dry porcelain). Runs 1-357 logged the SAMPLED coefficient only and never the one the solver used. Is the swept axis what the rig says it is, and does the metric have any dynamic range inside it?", "knob": "AEGIS_TOOL_FRICTION (default 0.9 = the frozen literal, byte-identical arm; registered in KNOB_GLOBALS; read at CALL time per the N207d rule). Header/records now also carry friction_realized (logged, never scored). No force, scoring, geometry, phase-label or tick term touched.", "n209_1_combine_rule": {"claim": "Bullet multiplies the two bodies' lateralFriction: mu_realized = mu_tool*mu_fixture + 0.008", "discriminator": "6-point least-squares slope d(mu_realized)/d(mu_fixture) at fixed mu_tool=0.9", "slope_measured": 0.9006, "slope_product_rule": 0.9, "slope_min_or_max_rule": 1.0, "weak_test_rejected": "pointwise at (mu_fixture 0.8, mu_tool 0.1): measured 0.088 vs product 0.080 vs min 0.100 -- the +0.008 static offset sits between the candidates, so only the slope separates them", "static_offset": 0.008}, "n209_2_realized_band": {"declared": [0.05, 0.8], "realized_frozen_rig": [0.045, 0.72], "factor": 0.9, "asserted": "max(friction_realized)=0.7200=0.9*0.80 and min=0.0450=0.9*0.05 on the frozen arm", "consequence": "every friction-binned statement in runs 1-357 (including the monotone-decreasing-in-friction docstring claim and N202.2's non-monotone bins) is on mislabelled axes and must be re-read on friction_realized"}, "n209_3_declared_band_is_dead": {"probe": "raster @ pose noise 0.03m/6deg (NON-saturated, so coverage has range), 20 seeds, candidate vs frozen mu_tool=0.9 paired on the SAME seeds", "table": [{"mu_tool": 0.3, "band_top": 0.24, "d_covc_A": 0.001, "d_covc_B": 0.0031, "d_covc_R": 0.0, "d_succ": [0, 0, 0], "slip_ratio_B": 0.44, "stall_B": 0.0}, {"mu_tool": 1.0, "band_top": 0.8, "d_covc_A": -0.0005, "d_covc_B": -0.0008, "d_covc_R": 0.0, "d_succ": [0, 0, 0], "slip_ratio_B": 1.09, "stall_B": 0.0}, {"mu_tool": 1.2, "band_top": 0.96, "d_covc_A": -0.0005, "d_covc_B": -0.0008, "d_covc_R": -0.0005, "d_succ": [0, 0, 0], "slip_ratio_B": 1.28, "stall_B": 0.0}, {"mu_tool": 1.6, "band_top": 1.28, "d_covc_A": -0.0005, "d_covc_B": -0.0094, "d_covc_R": -0.0016, "d_succ": [0, 0, 0], "slip_ratio_B": 1.66, "stall_B": 0.0}, {"mu_tool": 2.0, "band_top": 1.6, "d_covc_A": -0.0005, "d_covc_B": -0.0484, "d_covc_R": -0.0026, "d_succ": [0, -1, 0], "slip_ratio_B": 4.7, "stall_B": 0.0458}, {"mu_tool": 3.0, "band_top": 2.4, "d_covc_A": -0.0755, "d_covc_B": -0.107, "d_covc_R": -0.0521, "d_succ": [-2, -4, -1], "slip_ratio_B": 8.24, "stall_B": 0.0911}], "inside_declared_band": "realized mu 0.015..0.96: max |d coverage_cont| = 0.0031 and d_success = 0 on A/B/R in EVERY arm -> no transition point inside the declared band", "transition_location": "realized mu ~ 1.0-1.3 (first measurable loss at band_top 1.28, i.e. 60% ABOVE the declared top)", "mechanism": "slip and stall, not tracking error: slip_m 0.0106 -> 0.0873 m on B and stall_frac 0.0000 -> 0.0911 at mu_tool 3.0, while fn_mean is unchanged (0.4955 -> 0.5035 N). A force-driven head reacts whatever the cone allows, so the crossing is mu_realized*fn versus the commanded lateral demand.", "low_end": "mu_tool 0.3 (realized 0.015-0.24, pure soap film) is not inert but marginally BETTER (+0.0031 on B, slip x0.44): the frozen point is already on the flat side of the transition"}, "n209_4_slip_dead_zone": "coverage_cont is invariant while slip_m varies x0.44..x1.7 and stall_frac is exactly 0.0000. The r_eff=0.035 m pad dilation on the 0.025 m coverage grid absorbs sub-centimetre slip, so slip_m and stall_frac are the ONLY slip-sensitive readouts of this rig and must be reported beside coverage_cont, never instead of it.", "n209_5_frozen_certification_survives": {"arm": "trochoid @ pose_noise 0,0, mu_tool 1.0 vs frozen 0.9, 20 seeds", "fixture_B_coverage_cont": [1.0, 1.0], "success": [20, 20], "fixture_A": [1.0, 1.0], "fixture_R": [1.0, 1.0], "rig_keep": false, "why_keep_false": "BY CONSTRUCTION: coverage_cont is saturated on both sides (delta 0.0, Fisher p 1.0, Welch p NaN). No keep is claimed on the primary metric; this is a validity audit, not a candidate.", "identity_control": "default arm bit-identical to results/aegis_v2/Run350_champion_health_r350.jsonl on all 60 episodes (max |d coverage_cont| 0.0); three repeat processes identical per episode"}, "n209_6_consequence": "The 'robust to friction 0.05-0.80' statement is unsupported as written: inside that band the metric cannot distinguish the arms. Either widen the sweep to the measured transition (mu_realized 0.05-2.4, i.e. mu_tool 0.9-3.0) or report the band as a no-op region with the transition location quoted alongside. Adopted reporting rule: every friction-binned number carries friction_realized AND the tool coefficient.", "n198_line": "third independent line for director option (b): N207 showed the G4 anchor has no dynamic range on force across the discretisation dose, N208 the same over rates x iterations, and N209 that the declared friction factor has no dynamic range at all. Raised without a segment, metric or gate change.", "synthetic_proxy": null, "artifacts": ["results/aegis_v2/N209_r358_0_identity_trochoid.jsonl", "results/aegis_v2/N209_r358_A_mutool1.0.jsonl", "results/aegis_v2/N209_r358_B_mutool1.0.jsonl", "results/aegis_v2/N209_r358_C_mutool0.3.jsonl", "results/aegis_v2/N209_r358_D_mutool3.0.jsonl", "results/aegis_v2/N209_r358_E_mutool1.2.jsonl", "results/aegis_v2/N209_r358_E_mutool1.6.jsonl", "results/aegis_v2/N209_r358_E_mutool2.0.jsonl", "experiments/N209_friction_combine_probe.py", "experiments/N209_friction_axis_audit.py", "equations.md#ROW-N209"]}, "equations_row": "N209", "artifacts": ["results/aegis_v2/N209_r358_0_identity_trochoid.jsonl", "results/aegis_v2/N209_r358_A_mutool1.0.jsonl", "results/aegis_v2/N209_r358_B_mutool1.0.jsonl"], "strategy_graph_nodes": ["N209", "N209a", "N209b"], "segment_15_frozen": true, "primary_metric_frozen": true, "tier4_gate_frozen": true, "n198_still_open_needs_director": true, "timestamp": "2026-09-30T22:40:00Z"}
{"run": 359, "idea": "N210-FORCE-AXIS", "status": "keep", "metric": "transfer_success", "metric_class": "physical", "novelty_score": null, "summary": "Validity audit (new_mechanism=false) of the rig's NORMAL-FORCE axis: the press was a bare literal (0.500 N) in every run 1-358, the axis is live and one-sided over 500x, and at the AEGIS 10-25 N spec band the frozen champion scores 0/20 on fixture_B. Mechanism slip = mu*Fn/KP. No keep is claimed on the primary metric: rig keep=false in every arm BY CONSTRUCTION.", "metrics": {"idea": "N210-FORCE-AXIS", "claim_type": "validity_audit", "new_mechanism": false, "physical": true, "rig_invoked": true, "backend": "pybullet", "sim_hz": 1920, "solver_iters": 80, "pose_noise_cfg": "0,0", "path_mode": "trochoid", "seeds": 20, "suites": ["fixture_A", "fixture_B", "fixture_R"], "episodes_total": 2880, "paired_baseline": "frozen 0.5 N press at the SAME 1920 Hz on the SAME seeds (--compare-env)", "rig_keep_any_arm": false, "keep_claimed_on_primary_metric": false, "fixture_A": {"0.05N": 1.0, "0.5N_frozen": 1.0, "1N": 1.0, "1.5N": 1.0, "2N": 0.9984, "10N": 0.725, "25N": 0.3818}, "fixture_B": {"0.05N": 1.0, "0.5N_frozen": 1.0, "1N": 0.9992, "1.5N": 0.9969, "2N": 0.9844, "10N": 0.5562, "25N": 0.1813}, "fixture_R": {"0.05N": 1.0, "0.5N_frozen": 1.0, "1N": 0.9995, "1.5N": 0.9977, "2N": 0.9899, "10N": 0.6677, "25N": 0.3162}, "success_counts_B": {"0.05N": 20, "0.5N_frozen": 20, "1N": 20, "1.5N": 20, "2N": 20, "10N": 0, "25N": 0}, "coverage_cont": {"10N": {"A": 0.725, "B": 0.5562, "R": 0.6677}, "25N": {"A": 0.3818, "B": 0.1813, "R": 0.3162}}, "p_welch_coverage": {"10N": {"A": 2.54e-05, "B": 5.29e-09, "R": 1.21e-05}, "25N": {"A": 2.88e-07, "B": 1.95e-17, "R": 3.03e-09}}, "p_fisher_success": {"10N": {"A": 3.34e-06, "B": 1.45e-11, "R": 3.34e-06}, "25N": {"A": 1.54e-07, "B": 1.45e-11, "R": 3.05e-10}}, "slip_law": {"form": "slip_m = mu_realized*Fn/KP + 0.0026 m floor", "mu_realized_rule": "0.9*mu_sampled (N209.1)", "meas_over_pred_per_cell": [0.724, 1.108], "per_episode_median": 1.02, "n_episodes": 180, "pearson_mu_slip_at_25N": 0.982, "kp_needed_n_per_m": {"10N": 288.0, "25N": 720.0}}, "rail": {"frozen_f_clamp_n": 3.0, "realized_fn_with_25N_press": 3.84, "f_cmd_max_n": 25.6, "clamp_bound_ticks": 311, "B_covc_frozen_rail": 0.1242, "B_covc_rail_lifted": 0.1813, "verdict": "ceiling, not the cause"}, "gain_axis": {"arms": [4, 8, 12, 16], "press_unchanged": 0.5, "A_covc": {"x4": 0.2094, "x8": 0.7, "x12": 0.8187, "x16": 0.6995}, "B_fn_mean_coupling": {"frozen": 0.4956, "x4": 1.549, "x8": 1.293, "x12": 2.048, "x16": 1.935}, "escapes_A_x4": "18/20", "z_excursion_A_x4_m": 0.1058, "monotone_in_gain": false}, "identity_check": {"artifact": "results/aegis_v2/Run350_champion_health_r350.jsonl", "episodes_matched": 120, "coverage_cont_bit_identical": true, "success_bit_identical": true, "fn_mean_max_abs_delta_N": 0.154}, "rig_change": {"knobs_added": ["AEGIS_PRESS_M", "AEGIS_CONTACT_K", "AEGIS_F_CLAMP_N", "AEGIS_KP_GAIN"], "logged_fields_added": ["f_cmd_max_n", "f_clamp_ticks", "f_clamp_n", "press_m", "contact_k", "kp_n_per_m", "kd", "kp_gain"], "physics_terms_touched": "none outside the three frozen-by-default literals", "default_arm": "byte-identical"}, "synthetic_proxy_used_for_keep": false, "restroom_sim_used": false, "g3_retired_family_touched": false, "teleport_used": false, "arithmetic_coverage_or_success": false, "unvalidated_rows": 0, "gpu_booked": false, "n198": "open_needs_director (fourth independent line for option b)", "artifacts": ["results/aegis_v2/N210_r359_0_identity_trochoid.jsonl", "results/aegis_v2/N210_r359_A_f0p05.jsonl", "results/aegis_v2/N210_r359_B_f0p5_identity.jsonl", "results/aegis_v2/N210_r359_G_f1.jsonl", "results/aegis_v2/N210_r359_H_f1p5.jsonl", "results/aegis_v2/N210_r359_C_f2.jsonl", "results/aegis_v2/N210_r359_D_f10.jsonl", "results/aegis_v2/N210_r359_E_f25.jsonl", "results/aegis_v2/N210_r359_F_f25_rail3.jsonl", "results/aegis_v2/N210_r359_K_gain4.jsonl", "results/aegis_v2/N210_r359_K_gain8.jsonl", "results/aegis_v2/N210_r359_K_gain12.jsonl", "results/aegis_v2/N210_r359_K_gain16.jsonl", "results/aegis_v2/N210_r359_audit.txt", "experiments/N210_force_axis_audit.py"], "audit_asserts_pass": true}}
{"run": 360, "idea": "N211-KERNEL-AXIS", "status": "keep", "metric": 1.0, "metric_class": "physical", "novelty_score": null, "summary": "Validity audit (new_mechanism=false) of the rig's SCORING KERNEL: three frozen literals inside _coverage_cont produced every coverage_cont/success in runs 1-359 (0.025 m grid pitch, an isotropic disc of radius r_eff=min(hu,hv) although every pad is a RECTANGLE, and a pts[::2] contact stride above 400 contacts). The certification is KERNEL-INDEPENDENT (fixture_B transfer_success 1.00, 20/20, identical under all 7 kernels at 0,0), two of the three literals are provably not live factors, and the third is a STRICT LOWER BOUND on physical footprint occupancy, so the reported pose-noise robustness is conservative (rect >= disc on 420/420 episodes; trochoid 0.03,6 fixture_B 0.9266 15/20 -> 0.9664 17/20). No keep is claimed on the primary metric: rig keep=false in every arm BY CONSTRUCTION.", "metrics": {"idea": "N211-KERNEL-AXIS", "claim_type": "validity_audit", "new_mechanism": false, "physical": true, "rig_invoked": true, "backend": "pybullet", "sim_hz": 240, "solver_iters": 80, "pose_noise_cfg": "0,0", "path_mode": "trochoid", "seeds": 20, "suites": ["fixture_A", "fixture_B", "fixture_R"], "steps": 400, "episodes_total": 840, "arms": ["trochoid 0,0", "trochoid 0.01,2", "trochoid 0.03,6", "raster 0.03,6", "raster 0,0 ROW_CENTRE=0", "trochoid 0.03,6 @1920 Hz", "raster 0,0 ROW_CENTRE=1"], "paired_baseline": "same arm with the kernel audit OFF (--compare-env AEGIS_COV_KERNEL=0), SAME 20 seeds -> scored metric identical by construction", "rig_keep_any_arm": false, "keep_claimed_on_primary_metric": false, "fixture_A": 1.0, "fixture_B": 1.0, "fixture_R": 1.0, "fixture_B_coverage_cont_frozen_kernel": {"0,0": 1.0, "0.01,2": 0.9961, "0.03,6": 0.9266, "raster 0.03,6": 0.9039, "raster 0,0 RC=0": 0.9109, "raster 0,0 RC=1": 1.0}, "fixture_B_success_counts_frozen_kernel": {"0,0": 20, "0.01,2": 20, "0.03,6": 15, "raster 0.03,6": 13, "raster 0,0 RC=0": 13, "raster 0,0 RC=1": 20}, "N211.1_certification_kernel_independent": {"claim": "the headline fixture_B transfer_success 1.00 (trochoid, 0,0, 20 seeds) is identical under all 7 scoring kernels, so the KEEP is not an artifact of the frozen kernel", "fixture_B_coverage_cont": {"frozen": 1.0, "allcontacts": 1.0, "rect": 1.0, "p2": 1.0, "p4": 1.0, "nodilat": 0.5985, "faithful": 1.0}, "fixture_B_success_of_20": {"frozen": 20, "allcontacts": 20, "rect": 20, "p2": 20, "p4": 20, "nodilat": 0, "faithful": 20}, "min_over_kernels_fixture_B_excluding_nodilat": 1.0}, "N211.2_frozen_kernel_is_a_strict_lower_bound": {"claim": "min(hu,hv) < hu,hv, so the inscribed disc is a SUBSET of the pad rectangle: the true-footprint kernel reports >= coverage on 420/420 episodes (geometric containment) and flips 7/60 verdicts FAIL->PASS at 0.03,6. Direction: the reported robustness is CONSERVATIVE.", "rect_ge_disc_episodes": "420/420", "mean_delta_all_arms": {"0,0": 0.0, "0.01,2": 0.0065, "0.03,6": 0.0392, "raster 0.03,6": 0.0203, "raster 0,0 RC=0": 0.0008, "raster 0,0 RC=1": 0.0}, "verdict_flips_rect_vs_frozen": {"0,0": 0, "0.01,2": 0, "0.03,6": 7, "raster 0.03,6": 5, "raster 0,0 RC=0": 0, "raster 0,0 RC=1": 0}, "fixture_B_at_0.03,6": {"frozen": {"cov": 0.9266, "succ": "15/20"}, "rect": {"cov": 0.9664, "succ": "17/20"}, "faithful": {"cov": 0.9547, "succ": "16/20"}}}, "N211.3_two_of_three_literals_are_dead": {"grid_pitch_converged": {"claim": "0.025 m and 0.0125 m agree to <=0.0045 mean |d| per arm", "mean_abs_p2_minus_p4_per_arm": {"0,0": 0.0012, "0.01,2": 0.0016, "0.03,6": 0.0035, "raster 0.03,6": 0.0038, "raster 0,0 RC=0": 0.0045, "raster 0,0 RC=1": 0.0, "0.03,6 @1920": 0.0035}}, "contact_stride_dead": {"claim": "contact_uv grows at most once per control tick and the sweep runs T_MAX=400 ticks, so `len(pts) > 400` cannot fire: the stride is dead code at the shipped step budget and 0/420 episodes exceeded it", "episodes_above_400_contacts": 0, "max_contacts_observed": 334}}, "N211.4_the_metric_measures_footprint_not_path": {"claim": "with the footprint dilation removed (cell rasterisation) coverage collapses to 0.43-0.62 and success to 0/60 in six of seven arms: 0.38-0.52 of every reported coverage_cont is the pad footprint, not where the path went. This is the mechanism behind N209.4's slip dead-zone.", "nodilat_coverage_range": [0.4271, 0.618], "nodilat_success_total_of_420": 4}, "N211.5_no_keep_conclusion_changes": {"claim": "the champion-vs-raster paired contrast on fixture_B at 0.03,6 is non-significant under EVERY kernel, so the kernel moves individual verdicts but no conclusion", "fixture_B_fisher_p_per_kernel": {"allcontacts": 0.731, "rect": 0.451, "p2": 0.731, "p4": 1.0, "faithful": 1.0}, "fixture_B_welch_p_per_kernel": {"allcontacts": 0.51, "rect": 0.15, "p2": 0.549, "p4": 0.574, "faithful": 0.269}, "note": "the historical champion KEEP (Fisher p=0.0083 vs raster) was measured on the PRE-I22 raster; the frozen raster default is now saturated at 1.0000/60, so that contrast is no longer reproducible and is not re-claimed here"}, "N211.6_kernel_sweep_is_solver_independent": {"claim": "240 Hz vs 1920 Hz on the SAME seeds: kernel means agree, max |d(cov_k)| = 0.0209", "max_abs_delta_any_kernel_any_episode": 0.0209, "extends": "N207.1 (coverage is solver-independent) from the physics to the metric"}, "integrity": {"scored_metric_untouched": "_coverage_cont is byte-identical; the audit adds only the cov_k/succ_k diagnostic fields", "identity_vs_run359_max_abs_delta": 0.0, "identity_checked_fields": ["seed", "suite", "tool_id", "friction", "friction_realized", "coverage_cont", "success", "slip_m", "stall_frac", "quality_tag", "coverage"], "no_teleport": true, "no_arithmetic_coverage": true, "synthetic_proxy_used": false}, "artifacts": ["results/aegis_v2/N211_r360_0_identity_trochoid.jsonl", "results/aegis_v2/N211_r360_1_trochoid_0p01_2.jsonl", "results/aegis_v2/N211_r360_2_trochoid_0p03_6.jsonl", "results/aegis_v2/N211_r360_3_raster_0p03_6.jsonl", "results/aegis_v2/N211_r360_4_raster_rowcentre0.jsonl", "results/aegis_v2/N211_r360_5_trochoid_0p03_6_hz1920.jsonl", "results/aegis_v2/N211_r360_6_raster_identity.jsonl", "results/aegis_v2/N211_r360_audit.txt", "experiments/N211_kernel_audit.py"], "rig_change": "1 diagnostic knob AEGIS_COV_KERNEL (default 0 = off, records byte-identical) + 1 logged pad_half + 6 header fields. No force, geometry, phase-label, tick or scoring term touched; frozen-kernel identity verified against run 359 (max |d| 0.0) and by an in-rig assert on every episode.", "correction": "run-360 row re-appended in the same iteration: fixture_B frozen-kernel numbers corrected to the per-suite values (an all-suite mean had been written for 0.01,2 and raster RC=0), max_contacts_observed 334 (not 398), p2-p4 for raster RC=1 = 0.0000."}}
