{"type": "node", "id": "N511_refusal", "label": "FACC-dir21 iter 21 refusal (G3 retired eq78/FACC/energy-gated; 21st replay refused)", "group": "retired", "run": 511, "status": "invalid", "segment": 16, "metrics": {"idea": "FACC-dir21", "compare_keep": false, "rig_executed": false, "seed_count": 0}, "timestamp": "2026-10-02T15:40:00Z", "note": "Director iter 21 proposes SE(3)-conditioned Force-Adaptive Contact Control = eq78 mechanism replay; queue not this (N477 queued, N198 open); no physical run; refusal per G3"}
{"type": "edge", "from": "N511_refusal", "to": "N510_refusal", "kind": "replay_refused", "label": "21st FACC/SE3-energy replay refused (iter 21); eq78 family permanently retired G3", "run": 511, "timestamp": "2026-10-02T15:40:00Z"}
{"type": "edge", "from": "N511_refusal", "to": "N477", "kind": "open_queued", "label": "lowest queued now N477 (dose AEGIS_REG_HALF_M / pose-noise cell); family replay refused, direct to queued mechanism", "run": 511, "timestamp": "2026-10-02T15:40:00Z"}
{"type": "edge", "from": "N511_refusal", "to": "N198", "kind": "open_needs_director", "label": "open:N198 (unattributed residual) / N478d after 21st replay refusal; director choose mechanism or segment close", "run": 511, "timestamp": "2026-10-02T15:40:00Z"}
{"id": "N512_refusal", "metric": null, "parent": "N477", "status": "invalid", "strategy": "FACC-E replay refusal (iter 22); G3 retired family; rig health 3-seed local tier only; no new mechanism axis; queue empty; open N198/N478d", "timestamp": 1790935882, "type": "node", "run": 512}
{"from": "N477", "kind": "rejected_replay", "to": "N512_refusal", "type": "edge", "label": "G3-retired FACC/SE3/energy replay refused; director proposed new axis needed", "run": 512, "timestamp": 1790935882}
{"id": "N513_refusal", "metric": null, "parent": "N512_refusal", "status": "invalid", "strategy": "FACC-E replay refusal (iter 23 / FACC-dir23); G3 retired family; dir single-brain fallback muse-spark-1.3-contributor-free; rig health local 3-seed; queue empty; open N198/N478d; 23rd refusal (498-512 prior)", "timestamp": 1790935988, "type": "node", "run": 513}
{"from": "N512_refusal", "kind": "rejected_replay", "to": "N513_refusal", "type": "edge", "label": "G3-retired FACC/SE3/energy replay refused; director 23rd proposal; no new axis; queue empty; open N198/N478d", "run": 513, "timestamp": 1790935988}
{"id": "N514_refusal", "metric": null, "parent": "N513_refusal", "status": "invalid", "strategy": "SAAF-R replay refusal (iter 24); G3 retired eq78/energy-gated/FACC/SE3 family; director proposed SE(3)-conditioned adaptive affordance residual + energy attention on frozen pi0; 24th refusal (498-513); queue empty; open N198/N478d; rig health local 3-seed; no new mechanism axis; no canonical rig invocation (YAGNI)", "timestamp": 1790936061, "type": "node", "run": 514}
{"from": "N513_refusal", "to": "N514_refusal", "kind": "rejected_replay", "type": "edge", "label": "G3-retired SAAF-R/eq78/FACC/energy replay refused; director iter 24 single-brain fallback; no new axis; queue empty; open N198/N478d", "run": 514, "timestamp": 1790936061}
{"id": "N515_refusal", "metric": null, "parent": "N514_refusal", "status": "invalid", "strategy": "SEGA-F replay refusal (iter 25); G3 retired eq78/energy-gated/FACC/SE3/flow-bridge/manifold-switch; director proposed SE(3)-Conditioned Energy-Gated Affordance Flow (per-step energy attention -> affordance manifold -> gating flow action); 25th refusal (498-514); queue empty; open N198/N478d; champion trochoid B 1.00 Fisher p=0.0083; no new axis; rig health local 3-seed /tmp/health_515.jsonl; no canonical rig (YAGNI)", "timestamp": 1790936197, "type": "node", "run": 515}
{"from": "N514_refusal", "to": "N515_refusal", "kind": "rejected_replay", "label": "G3-retired SEGA-F/eq78/energy/SE3 replay refused; director iter 25 single-brain fallback muse-spark-1.3-contributor-free; no new mechanism axis; open N198/N478d", "run": 515, "timestamp": 1790936197, "type": "edge"}
{"id": "FACC-S", "metric": 74, "parent": "FACC-SE3", "status": "unvalidated", "strategy": "FACC-S switching manifold: frozen pi0 + SE(3) contact-energy gate + force-adaptive residual switch; replaces flow-matching; 3-seed physical screen (rig kaggle_aegis_sweep.py, pybullet, fixture_B success 1.0/3 seeds) completed; mechanism not yet in canonical rig \u2014 synthetic proxies excluded; next = 20-seed paired decider vs trochoid after build", "timestamp": 1760000000, "type": "node"}
{"from": "FACC-SE3", "kind": "derived", "to": "FACC-S", "type": "edge"}
{"id": "FACC-SE3-decider-517", "metric": 0.25, "parent": "FACC-SE3", "status": "discard", "strategy": "FACC SE(3)-conditioned 20-seed physical decider vs trochoid; with_gate 0.25 << 0.70; A_sel=1.0 always; dynamic modulation ineffective; eq78 family collapsed; no p-value vs champion needed (fail is fail)", "timestamp": 1790916612, "type": "node"}
{"from": "FACC-SE3", "to": "FACC-SE3-decider-517", "relation": "physical_decider_20seed_discard", "metrics": {"fixture_B_gate": 0.25, "fixture_B_nogate": 0.2071, "scripted_baseline": 0.8125, "trochoid_champion_B": 1.0}, "timestamp": 1790916612, "type": "edge"}
{"node": "FACC-SE-dir28", "idea": "FACC-SE-dir28", "status": "invalid", "run": 518, "segment": 16, "timestamp": "2026-10-02T10:25:00Z", "type": "node", "verdict": "26th replay refusal; G3 eq78 retired; physical 517 discard B0.25"}
{"from": "FACC-SE-dir28", "to": "FACC-SE3-decider-517", "relation": "replay_refusal_26th", "metrics": {"fixture_B_517": 0.25, "trochoid_champion_B": 1.0, "predicted_invalidated": 76, "g3_family": "eq78/FACC/SE3"}, "timestamp": "2026-10-02T10:25:00Z", "type": "edge"}
{"id":"N519","metric":0.0,"parent":"N1","status":"invalid","strategy":"segment-15 queue-empty hygiene (run 519): all §1 ideas done; open N198/N478d director-owned; canonical rig 3-seed health passes; no queued idea to run; champion trochoid B=1.00 unchanged; G3 replay refusal not triggered (no proposal)","timestamp":1766672100,"type":"node"}
{"from":"N1","kind":"hygiene","to":"N519","type":"edge"}
{"id": "N497_queue_empty", "type": "node", "run": 497, "segment": 15, "status": "discard", "metric": null, "parent": "N479", "timestamp": 1790937005, "strategy": "Queue-empty hygiene (run 497): \u00a71 table all done (I0-I23); N477 DISCARD r478-481; N479 DISCARD r497 (force-channel invariant, F1-F5); N198 open_needs_director; N478d open_needs_director. No queued idea -> refused replay (not 42nd G3 replay; no proposal made). Canonical rig smoke 3 seeds (2.3s, 9/9 SUCCESS, 0 harness errors, /tmp/health_3.jsonl -> results/aegis_v2/health_check_queue_empty_run497.jsonl). No synthetic_proxy cited as keep; no deferred/remote-GPU phrase; no retired N70-N76 cited. No new equation; worklog append-only (+1 line)."}
{"from": "N479", "to": "N497_queue_empty", "type": "edge", "kind": "hygiene", "label": "run-497: queue empty, no replay permitted, rig health verified, no keep", "run": 497, "timestamp": 1790937005, "segment": 15}
{"id": "N520_queue_empty", "type": "node", "run": 520, "segment": 15, "status": "invalid", "metric": "fixture_B coverage_cont 1.000 (3 seeds, health smoke, not paired decider)", "parent": "N479", "timestamp": 1790937281.6061635, "strategy": "Queue-empty hygiene (run 520): \u00a71 all done; N198 open_needs_director; N478d open_needs_director. 3-seed physical smoke on champion trochoid (pybullet direct, 0 harness errors, force_pi false, press 0.5N, no teleport/arithmetic coverage). No queued idea -> no replay, no G3 FACC proposal. Synthetic_proxy excluded; no deferred/remote phrase; anchored kill done; worklog +1 line; equations unchanged."}
{"from": "N479", "to": "N520_queue_empty", "type": "edge", "kind": "hygiene", "label": "run-520: queue still empty after N479 DISCARD; hygiene smoke 3 seeds; no keep; segment 15 freeze holds", "run": 520, "timestamp": 1790937281.6061642, "segment": 15}
{"id": "N521_DA-FACC_refuse", "type": "node", "run": 521, "segment": 15, "status": "discard", "metric": "3-seed smoke 6 SUCCESS harness_errors=0; replay refused G3; no 20-seed paired decider; no p-value; no synthetic_proxy", "parent": "N479", "timestamp": 1790937830.2077634, "strategy": "Director iter 32 proposed DA-FACC (predicted 74 KEEP). G3 refusal: SEAF/eq78/flow-bridge/energy-gated family permanently retired (refused r497, same mechanism label rotation). PATH_MODES lacks injectable hook. Canonical rig smoke executed (CPU, ~2s, anchored kill). No arithmetic/teleport/deferred phrase. Worklog +1; equations unchanged."}
{"from": "N479", "to": "N521_DA-FACC_refuse", "type": "edge", "kind": "refusal", "label": "run-521: DA-FACC replay refused (G3 eq78/SEAF); 3-seed champion smoke; no keep; N198/N478d open", "run": 521, "timestamp": 1790937830.207764, "segment": 15}
{"id": "N522", "metric": 0.0, "parent": "N521", "status": "discard", "strategy": "G3 replay refusal (EEAF-FACC / SE(3)-Equivariant Energy Affordance Field + FACC); no 20-seed decider; 3-seed champion smoke B=1.00; refusal reason: permanently retired eq78/energy-gated family; no new mechanism axis", "timestamp": 1790937960, "type": "node"}
{"from": "N521", "kind": "refused_replay", "to": "N522", "type": "edge", "note": "G3 retired family; next frontier N198/N478d"}
{"id": "N523", "metric": 0.0, "parent": "N522", "status": "discard", "strategy": "G3 replay refusal (muse-spark-iter34 / SE(3)-energy-contact-controller / flow-bridge / FACC); queue empty; 3-seed champion smoke trochoid B=1.00; refusal reason: eq78/energy-gated permanently retired; no new mechanism axis; open_needs_director N198/N478d", "timestamp": 1790938054.1120772, "type": "node", "run": 523, "segment": 15, "idea": "N523-MUSE-34-REPLAY"}
{"from": "N522", "to": "N523", "type": "edge", "kind": "refusal", "label": "run-523: muse-spark-iter34 replay refused (G3 eq78/energy/SE3/FACC); queue empty; 3-seed smoke; no keep; open N198/N478d", "run": 523, "timestamp": 1790938054.1120777, "segment": 15}
{"id": "N524_FACC-EA-ITER35", "type": "node", "run": 524, "segment": 15, "status": "discard", "metric": "3-seed smoke 3 SUCCESS fixture_B covc=1.00 harness_errors=0; replay refused G3; no 20-seed paired decider; no p-value; synthetic_proxy=false", "parent": "N523", "timestamp": 1790938172.238527, "strategy": "Director iter 35 proposed FACC-EA (SE(3)-conditioned force-adaptive contact + energy attention, predicted 78 KEEP). G3 refusal: eq78/energy-gated/flow-bridge/FACC family permanently retired (refused 43rd replay since r497). Queue empty (\u00a71). Canonical 3-seed smoke trochoid --compare trochoid ~1.8s, anchored kill, no deferred/remote. No arithmetic/teleport/deferred phrase. Worklog +1; equations unchanged.", "idea": "FACC-EA-ITER35"}
{"from": "N523", "to": "N524_FACC-EA-ITER35", "type": "edge", "kind": "refusal", "label": "run-524: FACC-EA replay refused (G3 eq78/energy-gated/FACC/SEAF); 3-seed champion smoke; no keep; open N198/N478d", "run": 524, "timestamp": 1790938172.2385278, "segment": 15}
{"id": "N525", "type": "node", "run": 525, "segment": 15, "status": "discard", "idea": "FACC-EA-ITER35-REPLAY-REFUSAL", "metric": 0.0, "strategy": "G3 replay refusal (eq78/energy-gated/FACC/SE3); queue empty; 3-seed smoke trochoid B=3/3 covc=1.00; no 20-seed decider; refusal reason same as N479/N522/N523/N524", "timestamp": 1790939000, "parent": "N524_FACC-EA-ITER35"}
{"from": "N524_FACC-EA-ITER35", "to": "N525", "kind": "refused_replay", "label": "run-525: 43rd G3 rejection (FACC-EA / muse-spark iter34 / EEAF); smoke only; open N198/N478d", "run": 525, "segment": 15, "type": "edge"}
{"id": "N526", "type": "node", "run": 526, "segment": 15, "status": "discard", "idea": "I37-FACC-SE3-ENERGY-ITER37", "metric": 0.0, "strategy": "Director iter 37 FACC/SE3-force-error/energy-attention; mechanism not implemented in canonical rig (no FACC kernel; only trochoid path); 3-seed smoke identical to champion (B=1.00, p=1.0); G3 eq78/em/energy-gated family retired; replay refused; no 20-seed paired decider; next frontier N198/N478d", "timestamp": 1790938443.503643, "parent": "N525"}
{"from": "N525", "to": "N526", "type": "edge", "kind": "refused_replay", "label": "run-526: 44th G3 refusal (I37 FACC-SE3-ENERGY / muse-spark-1.3); smoke trochoid vs trochoid; no variance drop; keep=False; no remote/GPU deferred", "run": 526, "timestamp": 1790938443.503644, "segment": 15}
{"node":{"id":"N527_FACC-EA-ITER36","type":"node","run":527,"segment":15,"status":"discard","metric":"refused before execution (54th G3 replay; G3 retired eq78/EBM/SE3/FACC; G4 unpairable; queue empty); 0 episodes; 0 rig bytes; champion trochoid B=1.00 frozen","parent":"N526","timestamp":"1790938575","idea":"FACC-EA v36 (muse-spark-1.3-contributor-free; iter 38; N527)"},"edge":{"from":"N527_FACC-EA-ITER36","to":"retired_family_eq78_EBM_SE3_FACC","relation":"replay_refused_54th","reason":"G3 permanent retirement; mechanism class unchanged by label rotation; G4 unpairable; G2 empty; G7 predicted-only invalid"}}
{"id": "N528", "type": "node", "run": 528, "segment": 15, "status": "discard", "idea": "FACC-SE3 iter 39 (director muse-spark-1.3-contributor-free; pred 74 KEEP synthetic-only); G3 replay refusal (54th+); mechanism unchanged by label rotation", "metric": "none (replay refused; 3-seed hygiene only; B=1.00 covc=1.000 but n=3 < 20; compare keep=False; no p-value)", "timestamp": 1790938732.4264781, "parent": "N527_FACC-EA-ITER36"}
{"from": "N527_FACC-EA-ITER36", "to": "N528", "type": "edge", "kind": "replay_refused", "label": "iter 39 refusal: FACC-SE3 predicted 74 KEEP rejected; eq78/flow-bridge/energy-gated/FACC family G3 retired; no 20-seed decider; hygiene 3-seed trochoid vs trochoid B=1.00 keep=False; no deferred/proxy; champion trochoid B=1.00 unchanged", "run": 528, "timestamp": 1790938732.4264786, "segment": 15}
{"from": "N529", "to": "N74", "type": "edge", "kind": "discard", "label": "FACC-SE3 iter40 proposal-reject (G3 retired; unvalidated cap; rig uninvokable)", "run": 529, "timestamp": "2026-10-02T16:30:00Z", "segment": 15, "idea": "FACC-SE3"}
{"from": "N529", "kind": "node", "type": "node", "label": "FACC-SE3-dir-iter40 (director iter 40, single-brain fallback muse-spark-1.3-contributor-free); discard; queue empty; G3 bound", "run": 529, "timestamp": "2026-10-02T16:30:00Z", "segment": 15, "idea": "FACC-SE3", "status": "discard", "physical": false, "compare_champion": "trochoid"}
{"run":530,"node":"N530_refusal","from":"N529_refusal","to":"N530_refusal","label":"iter 41 FACC-dir41 replay refused G3 (55th eq78/FACC/SE3/energy/flow-bridge); mechanism unchanged"}
{"run":530,"node":"N530_refusal","to":"N198","label":"open director decision unchanged; replay refused; no keep"}
{"from": "N530_refusal", "to": "N531_hygiene", "type": "edge", "kind": "hygiene", "label": "queue-empty hygiene iteration run 531; open N198/N478d (open_needs_director); 3-seed champion trochoid B 3/3 covc=1.00 harness_errors=0; no queued idea", "run": 531, "timestamp": "2026-10-02T16:45:00Z", "segment": 15}
{"from": "N531_hygiene", "to": "N532_path_discretisation", "type": "edge", "kind": "axis-close", "label": "queue empty; director MAEF refused as 56th G3 replay (0 episodes); new axis from a 1000-header dose audit: path discretisation (TROCHOID_DS_M / BASE_DS_M) had only ever been swept FINER", "run": 532, "timestamp": "2026-10-02T17:20:00Z", "segment": 15}
{"run": 532, "node": "N532_path_discretisation", "kind": "result", "status": "discard", "segment": 15, "label": "BASE_DS_M inert over 6.3x [0.005,0.0314]: fixture_A/B/R coverage_cont exactly 1.0000 20-of-20 at every dose (delta +0.0000), flat at 0.03,6 (max |delta| 0.0032); raster control flat => champion-vs-raster Fisher p=0.0083 mesh-invariant; NEW CERTIFICATE: champion 1.0000 is MESH-CONVERGED (sagitta 0.05-2.06 mm = 0.15-5.9% of r_eff), mesh leaves every coverage law", "metrics": {"fixture_B_transfer_success": 1.0, "coverage_cont": 1.0, "seeds": 20, "episodes": 1000, "rig_invocations": 9, "harness_errors": 20, "compare_keep": false, "fisher_p": 1.0}, "evidence": ["results/aegis_v2/N532_baseds_003.jsonl", "results/aegis_v2/N532_trochds_0016.jsonl", "results/aegis_v2/N532_trochds_0008.jsonl", "equations.md#N532"]}
{"from": "N532_path_discretisation", "to": "N533_next_axis", "type": "edge", "kind": "frontier", "label": "D1 REFUTED: the resample step is not bookkeeping -- C1 assertion (60 deg) + kappa time-reparameterisation read the RESAMPLED polyline, so it owns a hard validity cliff at ds_t ~ 0.0098 m on fixture_A (frozen 0.004 = 2.45x inside, 45.4 of 60 deg); above it fixture_A dies to a generator AssertionError (20/20 harness errors) while fixture_B (3.4x looser) degrades physically (19/20, covc 0.95, stick 61x, escape 0.05). Predicted ds_base ceiling 0.0314 CONFIRMED. Mesh + resample axes now CLOSED as levers; N198/N478d remain director-owned", "run": 532, "timestamp": "2026-10-02T17:20:00Z", "segment": 15}
{"from": "N533_next_axis", "to": "N533_servo_damping_ratio", "type": "edge", "kind": "frontier", "label": "dose audit (1009 headers + AST sweep) leaves exactly ONE physics literal that is neither env-read, nor a registered knob, nor ever logged: KD = 1.9, the actuator derivative gain. KP_GAIN (N210, 6 doses) scales kp AND kd together, so zeta = KD/(2*sqrt(KP*m)) was frozen at 0.586-0.672 on all three pads for the whole segment. It is also the term N214's escape-floor law m >= K*(TICK_S/2pi)^2 omits (that law is written for an UNDAMPED loop).", "run": 533, "timestamp": "2026-10-04T21:45:00Z", "segment": 15}
{"run": 533, "node": "N533_servo_damping_ratio", "kind": "result", "status": "discard", "segment": 15, "label": "zeta axis is REAL and TWO-SIDED: plateau KD in [0.95, 2.83] (zeta 0.336-1.0, 3.0x) with paired |delta covc| <= 0.0013 (p > 0.95); lower wall KD=0 -> coverage_cont exactly 0.0000, 0/20 on A/B/R at both cells, slip 55x, stick 0.994, track_tol 0.000 (Fisher p 1.45e-11); upper wall KD=5.66 -> B -0.1031 (Welch p 6.74e-05, Fisher p 1.45e-04, 9/20) attributed to the WORKSPACE RAIL: f_cmd_max 3.86 -> 10.56 N vs F_CLAMP_N 3.0 and f_clamp_ticks 1.0 -> 395.6 (396x). N533.3 REFUTED (plateau, not monotone), N533.4 REFUTED (critical damping destroys the light-mass arm: B 1.00 -> 0.58, A 0.866 -> 0.051; the frozen light arm already demands 18.50 N / 332 clamp ticks, so the N214 escape floor is a FORCE-RAIL floor).", "metrics": {"fixture_B_transfer_success": 1.0, "coverage_cont": 1.0, "seeds": 20, "episodes": 1200, "rig_invocations": 10, "harness_errors": 0, "zeta_frozen": [0.6718, 0.5863, 0.6264], "plateau_kd": [0.95, 2.83], "lower_wall_B_covc": 0.0, "upper_wall_B_delta_covc": -0.1031, "upper_wall_welch_p": 6.742750047935116e-05, "upper_wall_fisher_p": 0.00014530659691950015, "upper_wall_f_clamp_ticks_x": 396.0, "compare_keep": false, "synthetic_proxy": false}, "timestamp": "2026-10-04T21:45:00Z"}
{"from": "N533_servo_damping_ratio", "to": "N534_next_axis", "type": "edge", "kind": "frontier", "label": "servo stability CLOSED as a lever (both walls are regressions, the interior is a plateau). Remaining never-dosed physics literals, with the audit verdict on each: WS_LIMIT_M = 0.60 (workspace stray rail -- the only one left that is physics and not certified inert), KP_PRESS = 1.0 (multiplier on an already-saturated press), CONTACT_C = 200.0 (CERTIFIED INERT: 6-decade probe, slip changes 0.4% at mu=0.8), LAUNCH_Z_M = 0.02 (launch COUNTER threshold, measurement only), RESIDUAL_CLIP_M = 0.02 (residual off in 798/815 arms). CELL_M = 0.05 is BARRED as an axis: FINE_M = CELL_M/2 IS the metric pitch, so touching it moves the metric.", "run": 533, "timestamp": "2026-10-04T21:45:00Z", "segment": 15}
{"run": 534, "node": "N534_workspace_limit", "kind": "result", "status": "discard", "segment": 15, "label": "WS_LIMIT_M non-binding over 6x [0.25,1.50]: covc delta +0.0000 at 0,0 and 0.03,6; containment bracket (0.20,0.25], frozen margin 2.59x, 4th head floor R>~0.29m; slip echo invalidates cross-dose slip; 5x rail at frontier leaves B bit-identical (0.0234) while excursion diverges to 2.998m", "metrics": {"fixture_B_transfer_success": 1.0, "coverage_cont": 1.0, "seeds": 20, "episodes": 3120, "rig_invocations": 26, "harness_errors": 0, "compare_keep": false}, "evidence": ["results/aegis_v2/N534_ws0.25_cell0.jsonl", "results/aegis_v2/N534_ws1.50_cell0306.jsonl", "results/aegis_v2/N534_ws3.00_cell3264.jsonl"], "timestamp": "2026-10-04T22:00:00Z"}
{"from": "N533_servo_damping_ratio", "to": "N534_workspace_limit", "type": "edge", "kind": "axis-close", "label": "run 534: WS_LIMIT_M closed as lever (non-binding envelope); only physics-path literal never varied is now TICK_S=0.05s; N198/N478d director-owned", "run": 534, "timestamp": "2026-10-04T22:00:00Z", "segment": 15}
{"run": 535, "node": "N535_control_tick", "kind": "result", "status": "discard", "segment": 15, "label": "TICK_S: 0.025 bit-identical to frozen on A/B/R (delta +0.0000, Fisher 1.0); 0.10 breaks all suites at 0,0 (B 11/20 covc 0.60, Welch p=0.0021, Fisher p=0.0012, esc 0.40) and 0.03,6 (B 7/20 vs 15/20, Welch p=0.0025); escapes lead, coverage follows via termination; N535.1+N535.2 CONFIRMED; control-period axis CLOSED", "metrics": {"fixture_B_transfer_success": 0.55, "coverage_cont": 0.6, "seeds": 20, "episodes": 360, "rig_invocations": 3, "harness_errors": 0, "compare_keep": false}, "evidence": ["results/aegis_v2/N535_tick0025_cell0.jsonl", "results/aegis_v2/N535_tick010_cell0.jsonl", "results/aegis_v2/N535_tick010_cell0306.jsonl"], "timestamp": "2026-10-04T22:30:00Z"}
{"from": "N534_workspace_limit", "to": "N535_control_tick", "type": "edge", "kind": "axis-close", "label": "run 535: director SFA2-EF refused as 59th G3 replay (0 episodes); TICK_S dosed instead (last unvaried physics literal): 40Hz identical, 10Hz breaks; remaining literals own nothing; N198/N478d director-owned", "run": 535, "timestamp": "2026-10-04T22:30:00Z", "segment": 15}
