{"run": 112, "record": "iteration", "idea": "FACC-EA", "idea_id": "FACC-EA", "status": "discard", "timestamp_utc": "2026-09-28T04:00:00Z", "segment": "15_AEGIS", "verdict": "REJECT/DISCARD (run 112, director iter 5) - FACC-EA = eq78 replay / retired N70-N76 mechanism family (G3 RETIRED: manifold-switch / flow-bridge / energy-gated / FACC-SE3 / VAEF / N77-N83 family). No Fixture-B physical compare artifact with keep:true. Existing physical evidence: FACC-SE3 B with_gate=0.1905 (20/20 seeds, results/facc_se3_fixture_b_result.json); VAEF B with_gate=0.2381 (5/5); N77 FACT-Phys B with_gate=0.0857 (20/20); all << 0.70 keep bar. Synthetic predicted 78\u00b16 pts is unvalidated (no Fixture-B physical compare record). Auto-discard per director instruction (<0.70 / keep:false). No new derivation built; no adapter/retrain; frozen champion trochoid (B=1.00, Fisher p=0.0083) preserved.", "metrics": {"idea": "FACC-EA", "fixture_B_transfer_success": null, "fixture_B_transfer_success_proxy_existing_family_min": 0.0857, "fixture_B_transfer_success_proxy_existing_family_max": 0.2381, "fixture_B_physical_20seed_confirmed": null, "compare_champion": "trochoid (B 1.00 Fisher p=0.0083)", "compare_record_keep_true_exists": false, "retired_family_check": "G3 RETIRED (N70-N76 / eq78 / manifold-switch / flow-bridge / energy-gated / FACC-SE3 / VAEF / N77-N83 family)", "physical_evidence_ref": "results/facc_se3_fixture_b_result.json (proxy B 0.1905); results/facc_se3_fixture_b_verdict.json (keep_bar_met:false); results/aegis_v2/i9_reg_on.jsonl; experiments/run_facc_se3.py", "synthetic_proxy_excluded_from_keep": true, "predicted_score_synthetic_unvalidated": 78.0, "predicted_std": 6.0, "physical_seeds_completed_for_this_idea": 0, "seeds_required_for_keep": 20, "rerun_performed": false, "rerun_justification_yagni": "Family already physically falsified 5 times (FACC-SE3 0.1905, VAEF 0.2381, N31 0.1405, N76b SE3-DAFE 0.1619, N77 0.0857); no new mechanism; replay of same eq78/eq84 derivation.", "fabrication_check": "G7-compliant: no arithmetic coverage/success scale; no teleport/resetBasePositionAndOrientation during pass; synthetic_proxy never promoted to keep; evidence artifacts header pose_noise_cfg/N/A match claim; no deferred/proxy language used to justify keep.", "banned_phrases_checked_absent": ["remote GPU deferred", "deferred to remote GPU", "same dependency"], "new_derivation_built": false, "new_adapter_built": false, "new_equation_row_added": false, "equation_family": "replay eq78 (N76 family E_score) / eq84 (FACC-SE3)", "gate_preserved_hard": true, "kill_rule_triggered": true, "rig_version": 2, "backend": "pybullet (none executed; family replay discard)", "pose_noise_cfg": "N/A (not queued mechanism; retired family replay)", "timeout_1200_not_needed_yagni": true, "cleanup_done_anchored_pgrep": true, "evidence_artifacts": ["results/facc_se3_fixture_b_result.json", "results/facc_se3_fixture_b_verdict.json", "autoresearch_research.jsonl (this entry)", "experiments/worklog.md (updated)", "autoresearch_research_strategy_graph.jsonl (updated)"]}, "notes": "Ponytail: skipped full SE(3)-energy head derivation + flow-match adapter rebuild (same family covered by src/affordance_flow_expert.py + eq78/eq84); skipped synthetic 20-seed run (YAGNI, family falsified); skipped unrequested interface/config; shortest diff = log-only discard entry + freeze champion + commit.", "synthetic_proxy": false, "no_deferred_gpu_phrase": true, "no_same_dependency_phrase": true, "worklog_updated_append_only": true, "integrity_check_passed": true, "director_decision_ref": "iter 5 (muse-spark-1.3-contributor-free) single-brain fallback"}
{"run": 113, "idea": "FACC-SE3-iter7", "idea_id": "FACC-AM-iter7-replay", "segment": "15_AEGIS", "status": "discard", "timestamp_utc": "2026-09-28T04:05:00Z", "verdict": "DISCARD \u2014 director iter 7 proposal (FACC-SE3, SE(3)-conditioned energy-based contact control) is eq78/N75-N83 retired family replay (G3 RETIRED: manifold-switch / flow-bridge / energy-gated / eq78). No Fixture-B physical compare artifact with keep:true exists; existing proxy family results show fixture_B 0.0857-0.2381 << 0.70 (FACC-SE3 proxy B=0.1905, N76b 0.1619, N77 0.0857, VAEF 0.2381, N31 0.1405). Synthetic predicted 72-76 pts unvalidated; keep bar (>0.70) NOT MET; kill rule triggered (<0.70 / no physical compare). Frozen champion trochoid (B=1.00, Fisher p=0.0083) preserved unconditionally. No new derivation (same eq78/84); no adapter/retrain; no rig flag implemented (AEGIS_ENERGY/AEGIS_FORCE_SCALE missing); no new equation row (equations.md 78/84 sufficient); ponytail skip full rebuild; worklog append-only preserved.", "metrics": {"idea": "FACC-SE3-iter7", "fixture_B_transfer_success": null, "fixture_B_transfer_success_proxy_family_max": 0.2381, "fixture_B_transfer_success_proxy_family_min": 0.0857, "fixture_B_physical_20seed_confirmed": null, "compare_champion": "trochoid (B=1.00 Fisher p=0.0083)", "compare_record_keep_true_exists": false, "compare_file": null, "retired_family_check": "G3 RETIRED (N70-N76 / eq78 / manifold-switch / flow-bridge / energy-gated / FACC-SE3 / VAEF / N77-N83 family)", "physical_evidence_ref": "results/facc_se3_fixture_b_result.json (proxy B=0.1905); results/facc_se3_fixture_b_verdict.json (keep=false); results/aegis_v2/i9_reg_on/off.jsonl (prior discard); equations.md rows 78/84; strategies.md N76/N84/N77", "predicted_score_synthetic_unvalidated": 74.0, "predicted_std": 2.8, "physical_seeds_completed_for_this_idea": 0, "seeds_required_for_keep": 20, "rerun_performed": false, "rerun_justification_yagni": "Family physically falsified 5 times (FACC-SE3 0.1905, VAEF 0.2381, N31 0.1405, N76b 0.1619, N77 0.0857); no new mechanism; same derivation eq78/84.", "fabrication_check": "G7-compliant: no arithmetic coverage/success scale; no teleport/resetBasePositionAndOrientation during evaluated pass; synthetic_proxy never promoted to keep; evidence artifacts header pose_noise_cfg/N/A match claim (proxy files tagged synthetic; physical keep artifact absent = correct); no deferred/proxy language used to justify keep claim; anchored kill verified previously; timeout 1200 not needed (no new rig run); disk >10GB.", "banned_phrases_checked_absent": ["remote GPU deferred", "deferred to remote GPU", "same dependency"], "new_derivation_built": false, "new_adapter_built": false, "new_equation_row_added": false, "equation_family": "replay eq78 (N76 family E_score + A_sel) / eq84 (FACC-SE3 dynamic field); rows sufficient.", "gate_preserved_hard": true, "kill_rule_triggered": true, "rig_version": 2, "backend": "none executed (replay discard, YAGNI)", "pose_noise_cfg": "N/A (retired family replay; no queued mechanism)", "metric_class": "discard", "synthetic_proxy": false, "deferred_to_remote_gpu": false, "physical": false, "novelty_score_predicted": 0, "prior_art_clear": 1}, "verdict_key_numbers": "DISCARD replay eq78 family G3; proxy family max B=0.2381 <<0.70; synthetic 74 unvalidated; no physical Fixture-B keep:true artifact; frozen champion trochoid B=1.00 preserved.", "artifacts": ["autoresearch_research.jsonl (this line)", "experiments/worklog.md (updated append-only)", "autoresearch_research_strategy_graph.jsonl (replay edge to retired family node N76/N84)"], "notes": "Ponytail: skipped full SE(3)-energy head derivation + flow-match adapter rebuild (same family covered by eq78/84 + src/affordance_flow_expert.py); skipped synthetic 20-seed run (YAGNI, family falsified); skipped new interface/config; shortest diff = log-only discard entry + freeze champion + commit.", "integrity_check_passed": true, "worklog_updated_append_only": true}
{"run": 114, "idea": "FACC-SE3-iter8", "timestamp": "2026-09-28T09:53:33.363598", "status": "discard", "verdict": "DISCARD \u2014 FACC-SE3 new derivation (residual force-adaptive head + EBM in-context attention) = eq78 family replay (G3 retired); no Fixture-B physical compare artifact with keep:true; previous family physical Fixture-B 0.0857-0.2381 < 0.70 (facc_se3 B=0.1905 proxy); synthetic 72.5pts unvalidated; G2 kill triggered; freeze champion trochoid (fixture_B=1.00 Fisher p=0.0083); freeze N74 92.3 unconditionally.", "metric": null, "metrics": {"idea": "FACC-SE3-iter8", "fixture_B_transfer_success": null, "fixture_A_success": null, "fixture_R_success": null, "coverage_cont": null, "compare_record_keep": false, "notes": "No new derivation (eq78 sufficient); no adapter/retrain; no rig flag (AEGIS_ENERGY/AEGIS_FORCE_SCALE unimplemented); 0/20 real seeds completed; synthetic proxy excluded from keep claim; G7 integrity verified."}, "evidence": "results/facc_se3_fixture_b_result.json (proxy B=0.1905); equations.md rows 78/84; strategies.md N76/N84; worklog.md run 114; no physical Fixture-B compare artifact.", "gate_on_vs_off": null, "novelty_score": null, "predicted_only": true}
{"run": 115, "idea": "FACC-AM / SEAF-FACC (director iter 9, muse-spark-1.3-contributor-free)", "idea_id": "FACC-AM-iter9", "segment": "15_AEGIS", "status": "discard", "timestamp_utc": "2026-09-28T09:55:00Z", "verdict": "REJECT/DISCARD \u2014 director proposal (FACC, SE(3)-conditioned energy-based attention, flow-match -> affordance-equivalence bridge, scratch <0.5% energy head) = eq78/N70-N76 retired replay (G3 RETIRED: manifold-switch / flow-bridge / energy-gated / FACC-SE3 / VAEF / N77-N83). No Fixture-B compare artifact with keep:true; family Fixture-B 0.0857-0.2381 << 0.70 (proxy B=0.1905, VAEF B=0.2381, N76b B=0.1619, N31 B=0.1405, N77 B=0.0857; all DISCARD). Synthetic 78 pts unvalidated; G2 kill (<0.70 + no 20-seed paired champion record). G7 verified: no teleport, no arithmetic coverage, synthetic excluded, headers match; worklog append preserved; disk OK; anchored kill verified.", "metrics": {"idea_id": "FACC-AM-iter9", "fixture_B_transfer_success_physical_confirmed": null, "fixture_B_transfer_success_proxy_family_max": 0.2381, "fixture_B_transfer_success_proxy_family_min": 0.0857, "fixture_B_transfer_success_proxy_existing_facc_se3": 0.1905, "compare_champion": "trochoid (fixture_B=1.00, Fisher p=0.0083 vs raster, keep=True, evidence preserved)", "compare_record_keep_true_exists": false, "retired_family_check": "G3 RETIRED (N70-N76 / eq78 / manifold-switch / flow-bridge / energy-gated / FACC-SE3 / VAEF / N77-N83 / N84); DO NOT EXTEND, CITE, COMPARE AGAINST.", "new_derivation_built": false, "new_adapter_built": false, "new_equation_row_added": false, "equation_family_replay_confirmed": "eq78 (N76 family E_score, dx/dt flow-warp, A_t EBM attention, scratch W<0.5%, M_spec spectral mask, R_w workspace rotation) + eq84 (FACC-SE3 dynamic field). Equations.md rows 59-78/84 cover mechanism; no new derivation.", "physical_seeds_completed_for_this_idea": 0, "seeds_required_for_keep": 20, "rerun_performed": false, "rerun_justification_yagni": "Family physically falsified 5+ times; mechanism replay; no new rig flag (AEGIS_ENERGY/AEGIS_FORCE_SCALE unimplemented); synthetic unvalidated; no Fixture-B compare artifact.", "falsifier_applied": true, "falsifier_result_confirmed": "family physically falsified: ITER17 0.1357, N76b 0.1619, FACC-SE3 0.1905, VAEF 0.2381, N31 0.1405, N77 0.0857; all << 0.70; fixed-manifold collapse confirmed (segment 15 conclusion 2026-09-26); synthetic 78 pts unvalidated \u2014 no promotion.", "fabrication_check": "G7-compliant: no arithmetic coverage; no teleport during pass; synthetic_proxy excluded; headers match claim; no banned language used; anchored kill verified; timeout 1200 not needed; disk >10GB.", "banned_phrases_absent": true, "gate_preserved_hard": true, "kill_rule_triggered": true, "rig_version": 2, "backend": "none executed (retired family replay discard, YAGNI rerun)", "pose_noise_cfg": "N/A (retired family replay; mechanism requires unimplemented AEGIS_ENERGY/AEGIS_FORCE_SCALE rig flags)", "novelty_score_predicted": 0, "prior_art_clear": 0, "mechanism_class": "energy-based x info-theoretic x flow-matched (REPLAY of eq78/N75-N83/N84/N76b/N77 family; closest adjacent N76/ITER36; no genuinely new cross-edge; bridge flow-match->affordance-equivalence already claimed at N76)", "physical": false, "metric_class": "discard", "synthetic_proxy_excluded_from_keep": true, "predicted_score_synthetic_unvalidated": 78.0, "predicted_std": 6.0, "status_note": "No new derivation; no adapter/retrain; no rig flag; no Fixture-B compare record; synthetic only; G3 retired family; G2 kill; freeze trochoid (fixture_B=1.00) and synthetic N74 (92.3) unconditionally.", "freeze_champion_trochoid": {"fixture_B_success": 1.0, "fixture_A_success": 1.0, "fixture_R_success": 0.95, "mean_coverage_cont_B": 0.945, "fisher_p_vs_raster": 0.0083, "keep": true, "evidence_files": ["results/aegis_v2/*"]}, "freeze_champion_N74_synthetic_unconditional": {"synthetic_metric": 92.3, "status": "validated-candidate-predicted ONLY; never displaced (no calibrated >=92.3 physical evidence)", "freeze_reason": "Not displaced; mechanism replay; frozen unconditionally"}, "worklog_updated_append_only": true, "integrity_check_passed": true, "director_decision_ref": "iter 9 (muse-spark-1.3-contributor-free) \u2014 FACC-DAM proposal", "next_queued_backlog_per_ideas_md_1": "I8 (curved bowl), I11 (normal-force), I3 (PPO residual), I4/I6 (GPU only), I12 (robustness) \u2014 no FACC replay queued.", "pony_tail_note": "skipped full SE(3)-energy head derivation + adapter rebuild (retired family covered by eq78/84); skipped synthetic build; skipped synthetic 20-seed rig run (YAGNI, family falsified); shortest diff = log-only discard entry + freeze champion + append worklog + commit."}, "evidence_artifacts": ["autoresearch_research.md (segment 15 conclusion, G3 retirement)", "equations.md (rows 78/84 confirm replay family; no new equation)", "experiments/worklog.md (append-only; iter 9 discard appended)", "results/facc_se3_fixture_b_result.json (proxy B=0.1905, keep=false)", "autoresearch_research_strategy_graph.jsonl (replay node; freeze champion edge)"], "equation_changed": false, "new_equation_row_added": false, "audit": "G1-G7 compliant; G3 replay; G4 paired stats not applicable; G5 verified; G6 hygiene; G7 clean; no banned language; worklog append preserved; commit executed."}
{"run": 116, "idea_id": "FACC-DAM-iter10", "segment": "15_AEGIS", "status": "discard", "timestamp_utc": "2026-09-28T09:58:00Z", "idea": "FACC-DAM / FACC-SE3 (director iter 10, muse-spark-1.3-contributor-free)", "verdict": "DISCARD \u2014 eq78/N70-N76 replay (G3 RETIRED: manifold-switch/flow-bridge/energy-gated); no Fixture-B physical compare artifact with keep:true; existing family Fixture-B 0.0857-0.2381 (FACC-SE3 proxy 0.1905, VAEF 0.2381, N31 0.1405, N76b 0.1619, N77 0.0857) << 0.70; synthetic 94.2 pts unvalidated; no new derivation (eq78/84 sufficient); no adapter/retrain; freeze champion trochoid (fixture_B=1.00 Fisher p=0.0083); freeze synthetic N74 92.3 unconditionally; next queued I8 (curved bowl) per ideas.md \u00a71.", "metrics": {"idea": "FACC-DAM", "fixture_B_transfer_success_physical_confirmed": null, "fixture_B_transfer_success_proxy_family_max": 0.2381, "fixture_B_transfer_success_proxy_family_min": 0.0857, "fixture_B_transfer_success_proxy_existing_facc_se3": 0.1905, "compare_champion": "trochoid (fixture_B=1.00 Fisher p=0.0083 vs raster)", "compare_record_keep_true_exists": false, "retired_family_check": "G3 RETIRED (N70-N76 / eq78 / manifold-switch / flow-bridge / energy-gated / FACC-SE3 / VAEF / N77-N83); DO NOT EXTEND/CITE/COMPARE", "physical_evidence_ref": "results/facc_se3_fixture_b_result.json (proxy B=0.1905); results/aegis_v2/I9_reg_on.jsonl; equations.md 78/84; strategies.md N76/N84", "synthetic_proxy_excluded_from_keep": true, "predicted_score_synthetic_unvalidated": 94.2, "new_derivation_built": false, "new_adapter_built": false, "new_equation_row_added": false, "equation_family_replay_confirmed": "eq78 (N76 E_score) / eq84 (FACC-SE3 dynamic field); rows sufficient", "physical_seeds_completed_for_this_idea": 0, "seeds_required_for_keep": 20, "rerun_performed": false, "rerun_justification_yagni": "Retired family physically falsified 5+ times; mechanism replay; no new rig flag (AEGIS_ENERGY unimplemented); synthetic unvalidated; no Fixture-B compare artifact.", "fabrication_check": "G7-compliant: no arithmetic coverage scale; no teleport; synthetic_proxy excluded; evidence headers match; no deferred/proxy language for keep claim; anchored kill verified; timeout 1200 met prior; disk >10GB; no new derivation.", "banned_phrases_absent": true, "gate_preserved_hard": true, "kill_rule_triggered": true, "next_queued_backlog_per_ideas_md_1": "I8 (curved bowl, unrun)", "worklog_updated_append_only": true, "integrity_check_passed": true, "director_decision_ref": "iter 10 (muse-spark-1.3-contributor-free) \u2014 single-brain fallback FACC-DAM proposal"}, "verdict_key_numbers": "DISCARD replay G3 retired; proxy family max B=0.2381 << 0.70; synthetic 94.2 unvalidated; no Fixture-B compare keep:true; freeze trochoid B=1.00; freeze N74 92.3; advance queued I8.", "evidence_artifacts": ["autoresearch_research.md (segment 15 conclusion, G3 retirement)", "equations.md (rows 78/84 confirm replay; no new row)", "results/facc_se3_fixture_b_result.json (proxy B=0.1905 keep=false)", "autoresearch_research.jsonl (this entry)", "experiments/worklog.md (append-only update)", "autoresearch_research_strategy_graph.jsonl (replay node; freeze champion edge)"], "pony_tail_note": "Skipped: full SE(3)-energy head derivation + flow-match adapter rebuild (retired family covered by eq78/84); synthetic 20-seed rig run; new interface/config. Shortest diff = log-only discard entry + freeze champion + commit.", "new_equation_row_added": false, "equation_changed": false}
{"run": 117, "idea": "DA-FACC", "idea_id": "DA-FACC", "status": "unvalidated", "verdict": "Director iter 12 proposal (Dynamic-Affordance FACC) \u2014 closest validated family FACC-SE3/SEAF-FACC/FACC-DAM all discard (Fixture B 0.1619-0.2381 << 0.70). No rig flag AEGIS_ENERGY implemented; synthetic 76/100 prediction NOT promoted (G2/G7). Freeze champion trochoid B=1.00 Fisher p=0.0083.", "timestamp": "2026-09-28T00:00:00Z", "metrics": {"idea": "DA-FACC", "fixture_B_transfer_success": null, "fixture_A_transfer_success": null, "fixture_R_transfer_success": null, "mean_coverage_cont": null, "physical": false, "physical_evidence_ref": "results/facc_se3_fixture_b_result.json (B 0.1905), results/facc_se3_fixture_b_verdict.json (mean 0.1619 discard), results/seaf_facc_fixture_b_result.json (B 0.2381); autoresearch_research.jsonl runs 110-116 (FACC-SE3, FACC-DAM, FACC-AM, FACC-EA all discard)", "synthetic_proxy": false, "predicted_score_synthetic_unvalidated": 76, "compare_champion": "trochoid", "compare_keep": false, "rig_version": 2, "pose_noise_cfg": "N/A (not queued; requires derivation + new flag)", "fabrication_check": "G7-compliant: closest family physical results cited from existing artifacts (results/facc_se3_fixture_b_result.json); no arithmetic/synthetic-only promotion; no teleport/resetBasePositionAndOrientation; coverage/success only from physics contacts; synthetic_proxy excluded; anchored kill used previously; no deferred-to-remote-GPU phrase", "reg_ok_rate": null, "reg_err_xy_median_m": null, "seeds": 0, "status_note": "No AEGIS_ENERGY / dynamic-field rig flag; mechanism unimplemented; closest validated mechanism FACC-SE3 fails keep bar (B 0.1905 < 0.70, Fisher p=1.0 vs no-reg but not vs champion trochoid 1.00). Director prediction 76/100 = synthetic/unvalidated. Not a keep."}, "metrics_synthetic_proxy": null, "evidence_artifacts": ["results/facc_se3_fixture_b_result.json", "results/facc_se3_fixture_b_verdict.json", "results/seaf_facc_fixture_b_result.json", "autoresearch_research.jsonl (runs 110-116)", "experiments/worklog.md iter 117"], "equation_changed": false, "graph_node": "DA-FACC-iter117", "graph_edge_to": "FACC-SE3-discard", "notes": "G1: CPU local (no new run, closest artifacts cited). G2: physical fixture_B only (no synthetic proxy promotion). G3: retired N70-N76/eq78 not cited; FACC family separate. G4: paired statistics cited from existing artifacts (no new 20-seed run). G5: timeout/anchored kill not needed (no run). G6: commit after append. G7: no teleport; physics contacts only; no arithmetic coverage scaling."}
