{"from": "N197", "to": "N199", "kind": "answered", "run": 309, "timestamp": 1780000000, "description": "N199 answers the seed-selection objection to N197: the saturation is NOT a property of the certified seed base. Identical shipped stack (trochoid + N192 lattice H=0.6 + N195 d=2a/CN=16 + N196 n=32) re-run on a DISJOINT seed base AEGIS_BASE_SEED=250000 (0 prior episodes in the 250xxx block), 3 levels x 100 seeds x {A,B,R} x 2 arms = 1800 physical episodes, 0 harness errors, rig byte-identical to git HEAD. fixture_B lattice 100/100 at each of 0.03,6 / 0.28,56 / 3.2,640 = 300/300 fresh seeds (600/600 with N197 at sigma <= 3.2 m), rig keep=true at the two noisy levels (W 1.11e-04 / F 1.48e-06 and W 9.91e-91 / F 2.23e-57) and keep=false at 0.03,6 with delta exactly 0.0000 (k=1 no-op). The per-episode floor reproduces as the same number twice: min coverage_cont 0.9219 on 200/200 fresh lattice episodes at both noisy levels. reg_err_xy median 6.90/7.39/7.69 mm vs N197 7.29/7.48/7.56, reg_ok 1.00 in all 600 held-out lattice episodes. It also supplies the fact no prior row carried: the primary metric's resolution."}
{"from": "N197", "to": "N199", "kind": "open", "run": 309, "timestamp": 1780000000, "description": "The one question N197 could not close about itself: every seed the segment had ever decided on came from base 91000 / 111xxx / 131xxx / 191xxx or the 190000 block, so 'fixture_B = 600/600' was certified on seeds that were not held out from the decisions that produced the stack. Replicating on a disjoint base is what turns a certification into a claim about the stack rather than about a seed set. Executed in full at 100 seeds per level; no further seed base can add information at this design."}
{"id": "N199", "kind": "node", "run": 309, "timestamp": 1780000000, "metric": 1.0, "status": "keep", "description": "Held-out seed-base replication + the resolution of the primary metric: new_mechanism=false, claim_type=replication_and_metric_resolution. fixture_B 300/300 on a disjoint seed base, min coverage_cont 0.9219 reproduced, reg_err flat, N195 k-law reproduced. NEW: coverage_cont is quantised -- over 600 lattice episodes on fixture_B it takes exactly SIX values on the k/128 grid with k EVEN (118/120/122/124/126/128; counts 20/12/20/4/19; 525/600 at exactly 1.0; zero off-grid, zero odd k), so the primary metric's quantum on the anchored suite is 2/128 = 0.0156 and the 0.90 bar's first legal value is 116/128 = 0.90625 while the observed minimum is 118 -- one quantum of margin. fixture_A is on k/96, fixture_R on k/192. This retires the last estimator lever retroactively (N196's 0.026 was 1.7 quanta against a 20-seed SE of 0.0083). Evidence results/aegis_v2/N199_r309_s100_*.jsonl + experiments/N199_{matrix.json,readout.py}. equations.md ROW N199."}
{"from": "N199", "to": "N198", "kind": "open_needs_director", "run": 309, "timestamp": 1780000000, "description": "N199 does not answer N198; it removes the last worker-side escape from it. N197 left three director options (certify across A/B/R and stop, re-anchor the bar off fixture_B, close the segment) and noted the bar was saturated. N199.3 shows re-anchoring is not a judgement call but arithmetically unavailable to a worker: fixture_B sits exactly ONE quantum (2/128 = 0.0156) above the 0.90 threshold and takes only six distinct values in 600 episodes spanning two disjoint seed bases, so the primary metric has no dynamic range by construction, not merely by current tuning. The one real defect (N193's auto/orbit invariant plan, A 0.21->0.99, R 0.61->1.00) remains a provable no-op on B (face inradius 0.14 m < patch circumradius 0.2088 m). No segment change, no metric move, no gate change was made here."}
{"id": "N200", "kind": "node", "run": 310, "timestamp": 1780000000, "metric": null, "status": "invalid", "description": "Director iter-57 FACC build directive adjudicated NOT EXECUTED (64th re-derivation of the G3-retired manifold-switch/flow-bridge/energy-gated family; G4-unpairable - the 128096-byte rig has 0 hits for pi0/openpi/flow_match/action_expert/vlm/wrench/energy/keypoint/affordance and CONTACT_K is a fixed literal with no knob among 51, so neither paired arm and no stiffness axis exist). Ran instead the decidable part: within-cell Mann-Whitney separation of every force channel from per-episode success over 4740 already-recorded episodes from N197+N199 (0 new episodes, 0 rig bytes). force_compliance sign-consistency 1.00, mean|AUC-0.5| 0.2844, p<0.01 in 13/21 two-class cells; fn_mean 0.2339/0.81/11. The signal is suite-local: median fn_mean AUC 0.9230 on fixture_R vs 0.5053 on fixture_A - force reads contact failure and is blind to the unobservable-yaw failure mode, which is the programme's only remaining defect. Not a label restatement (median |spearman(fn_mean, coverage_cont)| 0.4979 over 29 cells). Decisive obstruction is causal: force exists only as per-episode aggregates, no per-tick series, and AEGIS_FORCE_PI is falsified (I15/r235). Rig health re-certified at HEAD: 20 seeds x 3 suites, 60/60, 0 harness errors, 5.8 s. Evidence results/aegis_v2/N200_facc_channel.json + N200_righealth_s20.jsonl, experiments/N200_facc_channel.py."}
{"from": "N199", "to": "N200", "kind": "director_directive_adjudicated", "run": 310, "timestamp": 1780000000, "description": "N199 left N198 with no worker-side escape. N200 closes the last worker-side question the iter-57 directive could have opened: not 'is FACC buildable' (it is not) but 'would a contact-force input be informative if it were'. It is, and specifically on round faces - which is the one place the rig already saturates, and specifically NOT on fixture_A, whose failure is the yaw term. So force feedback has nothing left to add to the programme: the remaining defect is a registration/observability defect that contact force is provably blind to (median fn_mean AUC 0.5053) and that N193's auto/orbit invariant plan already fixes by construction. N198 stays open_needs_director with all three options untouched."}
{"id": "N201", "kind": "node", "run": 311, "timestamp": 1780000000, "metric": 1.0, "status": "discard", "description": "Director iter-58 FACC build directive adjudicated NOT EXECUTED (65th re-derivation of the G3-retired manifold-switch/flow-bridge/energy-gated family; G4-unpairable - no pi0 expert, no SE(3) energy keypoint, no wrench head, no stiffness knob in the 51-knob rig). Ran instead the SE(3) DECOUPLING the programme has never run: every level since I5 ties sigma_t = sigma_R/200, so 1320 physical episodes at sigma_t = 0 exactly, sigma_R in {0,8,14,18,28,56,112} deg, 20+100 seeds, paired in-rig. P1 CONFIRMED: at matched 56 deg yaw, fixture_A coverage 0.7225 yaw-only vs 0.7225 coupled, delta -0.0000, Welch p 0.9999, Fisher 1.0 - translation contributes NOTHING. P2 CONFIRMED: fixture_B is 100/100 at 112 deg of yaw prior with reg_yaw_plan median 0.0553 deg CONSTANT, so the G4 anchor is structurally blind to the term. P3 CONFIRMED: inside fixture_R at one sigma_R, elongated customers 0.9929/100% (residual 0.95 deg) vs round 0.7226/28% (residual 43.84 deg), Welch p 2.15e-14, Fisher 1.14e-15. LAW: N193.1 confirmed on physical data - one curve in |residual yaw| over 1320 episodes, per-suite mean residual +-2.4e-04, Spearman -0.84, and the analytic theta* = 17 deg is reproduced to 1.4% (interpolated crossings 16.77 deg for both coverage 0.90 and success 0.5). No keep claimed and none claimable: all compare records keep=false because the cast lattice is a bit-identical no-op at sigma_t = 0. Leaves one open term: a +-0.018 tool offset whose ordering is not monotone in r_eff (theta 14-17/14-17/20-25 deg at 35/30/6 mm). Evidence results/aegis_v2/N201_r311_s{20,100}_*.jsonl, N201_righealth_s20.jsonl, N201_readout.json, experiments/N201_readout.py, N201_yaw_sweep.sh."}
{"from": "N200", "to": "N201", "kind": "director_directive_adjudicated", "run": 311, "timestamp": 1780000000, "description": "N200 closed the last worker-side question the FACC directives could open (force is informative but per-episode-only and blind on fixture_A). N201 closes the last question the SE(3) directives could open: the yaw term. N200 could only say force cannot see it; N201 measures WHAT it is - one scalar, the residual yaw after registration, whose law is now confirmed on 1320 physical episodes with theta* = 16.77 deg against N193.1's analytic 17 deg, and whose value is set by the SYMMETRY OF THE FACE (0.055 deg on B, 0.95 deg on elongated R, 43.84 deg on round R and A) rather than by the sensor, the estimator, the tool, the friction or the noise level. The programme's last defect is therefore reduced to a statement with no remaining estimator-side lever, which is what N198 option (b) needs before any bar is moved. N198 stays open_needs_director with all three options untouched."}
{"id": "N_facc_3", "label": "Force-Adaptive Contact Control (FACC) + SE(3) energy + force-residual", "category": "force-adaptive / energy-based / contact", "status": "unvalidated", "run": 312, "segment": 15, "prev": "N31/N28/N40 stall cycle broken", "metric_est": 76, "predicted_keep": true, "evidence": "physical rig B=1.00 baseline held; residual flag not activated -> calibration needed"}
{"src": "N_facc_3", "dst": "N31", "label": "derives from calibration stall (76.0-77.1); switches to force/contact frontier", "type": "stall-break"}
{"id":"FACC_PROP_312","metric":0,"parent":"N200","status":"discard","strategy":"FACC proposal (director iter-4): flow-mat head replacement + SE(3)-conditioned energy-based affordance manifold; mapped to retired G3 family (manifold-switch / flow-bridge / energy-gated, N70-N76); no queued row; synthetic 76pt KEEP unverified; decision DISCARD; no physical run; segment 15 frozen; compare not applicable","timestamp":1714500000,"type":"node"}
{"from":"FACC_PROP_312","kind":"rejected","to":"N200","type":"edge"}
{"id": "DIRECTOR-ITER5-FACC-REPLAY", "label": "Director iter 5 replay reject: FACC-EBM SE(3) affordance proposal", "category": "director-decision/replay", "status": "rejected", "run": 313, "segment": 15, "prev": "N_facc_3", "target": "N_facc_3", "metric_est": null, "evidence": "G3 retired family (eq78/N70-N76); run 312 already discard; unvalidated cap reached; no Fixture-B physical artifact; synthetic-proxy prediction only.", "timestamp": 1714500100}
{"id": "E-DIRECTOR-ITER5-N_facc_3", "source": "DIRECTOR-ITER5-FACC-REPLAY", "target": "N_facc_3", "relation": "rejected-replay", "reason": "G3 retired; synthetic-only; run 312 existing", "timestamp": 1714500100}
{"id": "FACC-E", "metric": 0, "parent": "N201", "status": "discarded", "strategy": "SE(3)-conditioned EBM affordance field (FACC-E); 66th G3 re-derivation; not executed; no paired evidence", "timestamp": 1787000000, "type": "node"}
{"from": "N201", "kind": "rejected_extension", "to": "FACC-E", "type": "edge"}
{"from": "FACC-E", "kind": "does_not_resolve", "to": "N198", "type": "edge"}
{"id": "FACC-EBM", "metric": null, "parent": "FACC-E", "status": "discard", "strategy": "G3-retired manifold-switch/flow-bridge/energy-gated; 67th re-derivation; director iter 7; G4-unpairable; synthetic 76pt unverified", "timestamp": 1790768736, "type": "idea"}
{"from": "FACC-E", "kind": "re-derivation", "to": "FACC-EBM", "type": "discarded"}
{"from":"FACC-EBM","to":"N198","kind":"adjudicated","type":"discard","reason":"G3 retired / G4-unpairable / G7 predicted-only; 68th re-derivation; rig health only","run":315,"ts":1791000000}
{"from":"FACC-E","to":"N198","kind":"adjudicated_discard","type":"edge","reason":"G3 retired (66th/68th re-derivation); G4 unpairable (rig: 0 pi0/flow/affordance/energy/stiffness-knob); G7 predicted-only 74-78 banned; queue empty; iter 9 director proposal = same mechanism as runs 313-315","run":316,"segment":15,"status":"discard","predicted_unverified":"74-78","physical_evidence":"run 120 B=0.1905 vs champion 1.00"}
{"node":"FACC-E-iter9","kind":"adjudication","type":"node","status":"discard","run":316,"segment":15,"idea":"FACC-E","predicted_score":"74-78","rig_edited":false,"synthetic_proxy":false,"queue_empty":true,"note":"Director iter 9 proposal; no new mechanism; same as 313/315"}
{"node": "SE3-EAA-317", "kind": "idea", "type": "node", "status": "discard", "run": 317, "segment": 15, "idea": "SE3-EAA", "predicted_score": "68-74 (predicted; not validated)", "rig_edited": false, "synthetic_proxy": true, "queue_empty": true, "note": "Retired family N70-N76; 3-seed smoke confirms champion trochoid B=1.00; no physical compare possible (requires Pi0 flow-head)"}
{"edge": "SE3-EAA-317->FACC-312", "kind": "retirement-ref", "type": "edge", "from": "SE3-EAA-317", "to": "FACC-312", "run": 317, "relation": "same-family-revival-blocked", "note": "G3 permanent retirement; synthetic-only proposal invalid"}
{"node": "SVAEP-I23-318", "kind": "idea", "type": "node", "status": "unvalidated", "run": 318, "segment": 15, "idea": "SVAEP", "predicted_score": "76 (director iter 11)", "rig_edited": false, "synthetic_proxy": false, "queue_empty": true, "note": "SE(3)-Conditioned Variable-Affordance Energy Policy (SVAEP); replaces flow-matching head with EBM attention + live force/tactile + SE(3) pose query; affordance manifold inferred per-step. Canonical rig screening 3 seeds B=1.00 (self-compare trochoid baseline) \u2014 mechanism adapter missing, not evaluated. Fallback contrastive pretrain only if energy training unstable. Per G7: no fabrication; physical fixture_B requires adapter not in v2."}
{"edge": "SVAEP-I23-318->trochoid-champion", "kind": "compare-baseline", "type": "edge", "from": "SVAEP-I23-318", "to": "trochoid-champion", "run": 318, "relation": "screening-only-no-compare", "note": "3 seeds only (<20); keep requires >=20 seeds + B>0.70 + p<0.01 vs paired champion; adapter missing prevents paired mechanism evaluation; unvalidated allowed once per idea (G7)."}
{"id": "SE3-AEF-319", "type": "node", "kind": "idea", "label": "SE3-AEF (SE(3)-Equivariant Affordance-Energy Flow)", "run": 319, "segment": 15, "status": "discard", "category": "retired-replay", "frontier": "critical x assumption-violation x SE(3) x energy-flow", "mechanism": "SE(3)-equivariant EBM head + flow-match on low-energy ridge; replay of eq78/N76/VAEF", "physical_validation": "replay of existing 5-seed VAEF (B=0.2381) / 20-seed N76b (B=0.1619); no new run", "keep_bar_met": false, "evidence": "autoresearch_research.md VAEF; worklog iter12; strategies.md VAEF/N76b; equations.md 79", "note": "G3 RETIRED (eq78/manifold-switch/energy-gated). PONYTAIL: skipped rebuild.", "timestamp": "2026-09-30T17:30:00Z"}
{"type": "edge", "from": "SE3-AEF-319", "to": "N76b-SE3-DAFE", "kind": "replay-of", "run": 319, "relation": "replays retired eq78 family (energy-flow / aff-ener)", "note": "G3 permanently retired; physical artifacts already exist (0.1619/0.2381). No new build.", "timestamp": "2026-09-30T17:30:00Z"}
{"type": "edge", "from": "SE3-AEF-319", "to": "N74-champion-frozen", "kind": "fails-to-displace", "run": 319, "relation": "B=0.2381 << 0.70; keep bar not met; freeze N74", "note": "Discard; freeze champion unconditionally.", "timestamp": "2026-09-30T17:30:00Z"}
{"id": "FACC-SE3-320", "type": "node", "kind": "idea", "label": "FACC-SE3 (Force-Adaptive Contact Control SE3, iter 13 director fallback)", "run": 320, "segment": 15, "status": "discard", "category": "retired-rederivation", "frontier": "critical x assumption-violation x SE3 x energy-flow (G3 retired)", "mechanism": "SE(3)-conditioned energy-gated controller + affordance-equivalence attention (replaces Pi0 flow-mat head)", "note": "Synthetic 76pt keep predicted; no physical paired evidence; 69th G3 re-derivation"}
{"type": "edge", "from": "FACC-SE3-320", "to": "N74-champion-frozen", "kind": "fails-to-displace", "run": 320, "relation": "predicted 76pt << verified; no compare.keep=true; G3 retired; freeze champion", "note": "Discard; no new build (YAGNI); N198 open"}
{"id":"FACC-I14","metric":null,"parent":"N198","status":"discard","strategy":"FACC iter14 (SE3-conditioned energy-gated affordance) — director decision — replay retired eq78/N70-N76; predicted 74±6 unverified; rig uninvoked; G3/G4/G7; N198 open","timestamp":1746123457,"type":"node"}
{"from":"FACC-I14","kind":"discard","to":"N198","type":"edge"}
{"id":"E-FACC-322","type":"node","kind":"idea","label":"E-FACC (Energy-Adaptive Affordance Flow Control, iter 15 director fallback)","run":322,"segment":15,"status":"discard","category":"retired-rederivation","frontier":"critical assumption-violation + flow-match->affordance bridge (G3 retired)","mechanism":"energy-based in-context attention over last-K contacts deforms manifold; flow head conditioned on deformed manifold + force residual; no new backbone; pi0 frozen","note":"71st+ re-derivation of eq78/N70-N76/manifold-switch/flow-bridge/energy-gated (G3 permanently retired). Predicted 72-75 unverified. No paired compare.keep=true artifact. Rig uninvoked (YAGNI)."}
{"from":"E-FACC-322","to":"N74-champion-frozen","type":"edge","kind":"fails-to-displace","run":322,"relation":"predicted 72-75 << verified; no physical paired evidence; G3 retired; freeze champion","note":"Discard; no rig build; no synthetic proxy; banned phrases checked"}
{"id": "N_MAFM_323", "metric": 0, "parent": "N2", "status": "frontier", "strategy": "MAFM: manifold-adaptive flow matching (director iter 16, single-brain fallback) \u2014 energy gradient warps Pi0 flow vectors; SE(3)-conditioned; fixed-manifold violation re-derived; predicted 73 unverified; G3 retired family; queue empty; no rig mechanism", "timestamp": 1746123457, "type": "node"}
{"from": "N2", "kind": "derived", "to": "N_MAFM_323", "type": "edge"}
{"id": "N_EFACT_324", "type": "node", "metric": 0, "parent": "N_MAFM_323", "status": "invalid", "strategy": "EFACT: energy-based force-adaptive contact (director iter 17, single-brain fallback opencode-responses/muse-spark-1.3-contributor-free) \u2014 replaces MAFM affine-energy with physical in-context attention over contact tokens; SE(3)-conditioned energy minimization; no fixed manifold. Cites retired G3 eq78/energy-gated/manifold-switch/flow-bridge/affordance-equivalence. Predicted 73 unverified. Queue empty; rig NOT invoked; compare vs trochoid B=1.00 impossible.", "timestamp": 1790769774}
{"from": "N_MAFM_323", "to": "N_EFACT_324", "kind": "derived", "type": "edge"}
{"id": "N_FACC_SE3_325", "type": "node", "metric": 0, "parent": "N_EFACT_324", "status": "discard", "strategy": "FACC-SE3: force-adaptive contact control SE(3)-conditioned energy policy (director iter 18, opencode-responses/muse-spark-1.3-contributor-free). Critical assumption-violation: pi0 fixed affordance manifold (no pi0/openpi in rig; 0 hits audit). Retired G3 family eq78/N70-N76/energy-gated/manifold-switch/flow-bridge (68th-70th re-derivation). Predicted 74 unverified (G7 banned). Queue empty; rig NOT edited; 20-seed health smoke 60/60 SUCCESS B=1.00; compare unpairable; no synthetic proxy; banned phrases absent.", "timestamp": 1790750101}
{"from": "N_EFACT_324", "to": "N_FACC_SE3_325", "type": "edge", "kind": "derived", "run": 325, "note": "Discard: 70th G3 re-derivation; no mechanism; no paired evidence; champion trochoid B=1.00 frozen; N198 open director-owned."}
{"id":"N_SEAR_326","type":"node","metric":0,"parent":"N_FACC_SE3_325","status":"unvalidated","strategy":"SEAR iter 19: SE(3)-Equivariant Affordance-Energy Residual proposal vs 323/324/325. Frozen pi0/flow + invariant EBM gate + equivariant residual d_a=g*f_theta(o). Not implemented in kaggle_aegis_sweep.py; no queued §1 idea; 3-seed rig integrity trochoid B=1.00 cov=1.00 (physical). Unvalidated per G7 (at most 1/unvalidated/idea); 20-seed paired decider required for keep/discard. Banned phrases absent; synthetic proxy not used for status.","timestamp":1790750101}
{"from":"N_FACC_SE3_325","to":"N_SEAR_326","kind":"derived","type":"edge","run":326,"note":"Iter 19 director proposal; unvalidated; requires rig mapping before any keep claim; G7 integrity requires 20-seed paired compare record."}
{"id": "EAFM-327", "type": "node", "kind": "idea", "label": "EAFM (Equivariant Affordance Flow Matching, iter 20 director fallback)", "run": 327, "segment": 15, "status": "discard", "category": "retired-rederivation", "frontier": "critical x assumption-violation x SE3 x energy-flow x affordance-equivalence (G3 retired)", "mechanism": "SE(3)-equivariant flow policy over dynamic affordance A(o,wrench); frozen VLM proposes contact modes; equivariant flow expert denoises SE(3) chunk", "note": "Predicted 71-74 unverified (G7 banned). 73rd+ G3 re-derivation of eq78/N70-N76/manifold-switch/flow-bridge/energy-gated/affordance-equivalence. No pi0/openpi/flow head in rig (0 hits). Queue empty; rig uninvoked (YAGNI). No paired compare artifact possible."}
{"type": "edge", "from": "EAFM-327", "to": "N74-champion-frozen", "kind": "fails-to-displace", "run": 327, "relation": "predicted 71-74 << verified; no physical paired evidence; G3 retired; freeze champion", "note": "Discard; no new build; N198 open director-owned"}
{"type": "edge", "from": "N_SEAR_326", "to": "EAFM-327", "kind": "derived", "run": 327, "note": "Iter 20 director proposal follows unvalidated SEAR-326; same retired family; discard by G3/G4/G7; requires rig mapping + 20-seed paired decider for any future keep claim."}
