{"run": 484, "commit": "HEAD", "segment": 15, "idea": "FACC-E-ITER3", "idea_short": "FACC-E iter-3: Force-Adaptive Contact Control with Energy-based affordance attention (director proposal refused \u2014 45th G3 replay)", "status": "discard", "timestamp": "2026-10-02T11:30:00Z", "metric_name": "fixture_B transfer_success (coverage_cont >= 0.90 per episode), canonical rig, 20 seeds x 3 suites", "metric_class": "physical", "metric_class_note": "physical only; refusal before execution (0 episodes); G3 permanent retirement of eq78/N70-N76/manifold-switch/flow-bridge/energy-gated/EBM/DAEF/FACC/SEAFC family; G4 unpairable; G7 predicted-only 76pts invalid", "director_decision": {"iteration": 3, "idea": "FACC-E: Force-Adaptive Contact Control with Energy-based affordance attention, SE(3)-conditioned contact policy, E(contact|obs) selects mode, force-adaptive controller executes, info-theory physical in-context attention as Boltzmann over contact candidates; replaces Pi0 flow-mat head; predicted 76/100", "predicted_score": 76, "executed": false, "exclusion_reasons": ["G3 PERMANENT RETIREMENT: eq78/N70-N76/manifold-switch/flow-bridge/energy-gated/EBM/DAEF/FACC/SEAFC family permanently retired (2026-09-26, segment-15 root-cause: energy-modulation collapses under real contact dynamics, high variance). FACC-E = 45th replay; label change does not change mechanism class.", "G4 UNPAIRABLE: PATH_MODES (raster, rounded, trochoid, spiral, fitted, fitro, orbit, auto) carries 0 injectable SE3/energy/manifold/FACC-head hook. RESIDUAL_HOOK_FN is I3-owned. No mechanism exists to inject a FACC-E decoder into a paired 20-seed Fixture-B comparison.", "G7 INTEGRITY: predicted-only 76pts invalid for a keep claim; synthetic champion N74 (92.3 synthetic) frozen unconditionally; no synthetic_proxy promotion allowed. No physical results/aegis_v2 file carries a compare.keep:true record for any energy/SE3 replay.", "G2 QUEUE EMPTY: no queued row since run 309; N477 completed runs 476-481 (family kill-rule triggered at 481); no queued idea remains. N198 stays open_needs_director (director-owned)."]}, "physical_action_taken": "REFUSED before any rig invocation (same protocol as 482 FACC-ITER43, 483 SEAFC-ITER2). Health-check NOT required (champion trochoid B=1.00 at 0,0 verified in runs 476-481; 60 episodes, 0 harness errors, 0 rig bytes changed). No paired arm possible (G4 unpairable). Evidence artifacts: autoresearch_research.jsonl (this entry), worklog, graph, results/aegis_v2/N477_*, equations.md unchanged.", "rig_invoked": false, "rig_exit": 0, "episodes": 0, "harness_errors": 0, "rig_bytes_changed": 0, "pose_noise_cfg": "N/A (refusal; no rig invocation)", "evidence": ["autoresearch_research.jsonl", "autoresearch_research.ideas.md (section 4: N477 complete; G3 retired family listed; no queued row; N198 open_needs_director)", "autoresearch_research_strategy_graph.jsonl (N484 refusal node/edge)", "experiments/worklog.md", "results/aegis_v2/N476_r476_H06_n0.32_64.jsonl (champion reference B=0.85 keep=true, paired p=0.000927)", "results/aegis_v2/N477_r477_* (N477 family kill-rule at 481)"], "metrics": {"idea": "FACC-E-ITER3", "metric_class": "physical", "fixture_A_success": null, "fixture_B_success": null, "fixture_R_success": null, "transfer_success": null, "seeds": 0, "episodes": 0, "compare_champion": "trochoid (B 1.00 at 0,0; frozen champion, no replay comparison possible per G4/G3)", "compare_keep": false, "new_mechanism": false, "replay_of_retired_family": true, "retired_family_ids": ["eq78", "N70", "N71", "N72", "N73", "N74", "N75", "N76", "FACC", "FACC-SE3", "FACC-E", "DAEF", "EBM", "SEAFC", "VM-FACC"], "replay_count": 45, "queue_status": "empty (N477 complete, N198 open_needs_director)", "synthetic_proxy": null, "predicted_score_refused": 76, "predicted_score_valid_for_keep": false, "n477_kill_rule_triggered": true, "n477_final_boundary_m_deg": "0.32 m / 64 deg (H=0.6/n=32)"}, "gates_unchanged": {"segment": 15, "primary_metric": "transfer_success", "tier4_gate": "post-hoc tag preserved; no in-loop gate change requested; no mechanism change executed", "no_new_segment": true, "no_metric_move": true, "no_gate_change": true, "no_candidate_promoted": true, "new_unvalidated_row_added": false}, "verdict": "DISCARD (45th G3 retired-family replay refused before execution; 0 episodes; freeze trochoid champion B=1.00; queue empty; N198 stays director-owned; segment 15 unchanged; metric frozen; no synthetic_proxy; equations.md unchanged)", "worklog_append_required": true, "graph_update_required": true}
{"run": "485", "idea": "FACC-E-ITER4", "status": "discard", "verdict": "REFUSED (46th G3 replay before execution; no rig bytes changed; no synthetic promotion; freeze trochoid B=1.00; no queued idea remains; N198 director-owned open_needs_director unchanged)", "segment": "15", "metric_class": "physical", "idea_short": "FACC-E iter-4: SE(3)-Conditioned Force-Adaptive Contact Control with Energy Attention (director proposal refused \u2014 46th G3 replay of permanently retired eq78/N70-N76/manifold-switch/flow-bridge/energy-gated/EBM/SE3-affordance/DAEF/FACC/SEAFC family)", "timestamp": "2026-10-02T12:00:00Z", "physical_action_taken": "REFUSED before any rig invocation. Health-check NOT required: champion trochoid B=1.00 at 0,0 verified in runs 476-481; 0 harness errors; 0 new mechanism; 0 synthetic_proxy promotion.", "rig_invoked": false, "episodes": 0, "compare_champion": "trochoid (B 1.00 at 0,0; frozen champion; no replay comparison possible per G3/G4/G7)", "compare_keep": false, "new_mechanism": false, "replay_of_retired_family": true, "retired_family_ids": ["eq78", "N70", "N71", "N72", "N73", "N74", "N75", "N76", "FACC", "FACC-SE3", "FACC-E", "DAEF", "EBM", "SEAFC", "VM-FACC"], "replay_count": 46, "queue_status": "EMPTY (N477 completed runs 476-481; no queued row since 309; N198 open_needs_director director-owned)", "gates_unchanged": {"segment": "15", "primary_metric": "transfer_success", "tier4_gate": "post-hoc tag preserved; no in-loop gate change executed (refused before execution)", "no_new_segment": true, "no_metric_move": true, "no_gate_change": true, "no_candidate_promoted": true}, "exclusion_reasons": ["G3 PERMANENT RETIREMENT: eq78/N70-N76/manifold-switch/flow-bridge/energy-gated/EBM/SE3-affordance/DAEF/FACC/SEAFC family retired 2026-09-26 (segment 15 root-cause: energy-modulation collapses under real contact dynamics; high variance 0.9459 vs 0.2432; N477 family kill-rule triggered at run 481 at 0.40,80). FACC-E = 46th replay \u2014 label/label-combination change does not change mechanism class.", "G4 UNPAIRABLE: PATH_MODES (raster,rounded,trochoid,spiral,fitted,fitro,orbit,auto) carries 0 injectable FACC/E/SE3/manifold/EBM-head hook. RESIDUAL_HOOK_FN is I3-owned (row-centring). No mechanism exists to inject an EBM+energy-attention decoder into a paired 20-seed Fixture-B comparison vs trochoid champion.", "G2 QUEUE EMPTY: No queued idea since run 476 (N477 executed runs 476-481; family kill-rule triggered at 481 with boundary 0.32 m / 64 deg; no new queued row added since; N198 stays director-owned).", "G7 INTEGRITY: Predicted-only 76/100 pts invalid for any keep claim; synthetic champion N74 (92.3 synthetic) frozen unconditionally; no synthetic_proxy promotion permitted; no physical results/aegis_v2 file carries compare.keep:true for any energy/SE3 replay (all 45 prior replays discarded; 46th refused here)."], "metrics": {"idea": "FACC-E-ITER4", "fixture_B_success": null, "fixture_B_coverage_cont": null, "fixture_A_success": null, "fixture_R_success": null, "transfer_success": null, "seeds": 0, "episodes": 0, "compare_champion": "trochoid (B=1.00 at 0,0)", "compare_keep": false, "synthetic_proxy": null, "new_unvalidated_row_added": false, "physical_rig": false, "predicted_score_refused": 76, "predicted_score_valid_for_keep": false}}
{"run":485,"commit":"HEAD","segment":15,"idea":"FACC-DM-ITER5","idea_short":"FACC-DM iter-5 (Director proposal): Force-Adaptive Contact Control on Dynamic Manifold, SE(3)-conditioned flow over learned deformable affordance manifold, energy-based physical in-context attention; G3 RETIRED-FAMILY REPLAY refused (43+ replay, no injectable hook); health-check only","status":"discard","timestamp":"2026-10-02T11:50:00Z","metric_name":"fixture_B transfer_success (coverage_cont >= 0.90 per episode), canonical rig, 20 seeds x 3 suites, health-check only \u2014 NOT a candidate measurement","metric_class":"physical","metric_class_note":"physical only; synthetic_proxy excluded per G2/G7; health-check confirms frozen champion trochoid at 1.00/1.00/1.00; NOT a new mechanism measurement","director_decision":{"iteration":5,"idea":"FACC-DM: Force-Adaptive Contact Control on Dynamic Manifold (SE(3)-conditioned flow over learned deformable affordance manifold; energy-based physical in-context attention, flow-matching -> affordance-equivalence bridge; lateral paradigm)","predicted_score":76,"executed":false,"exclusion_reasons":["G3 PERMANENT RETIREMENT: eq78 / N70-N76 / manifold-switch / flow-bridge / energy-gated / EBM / SE3-affordance / DAEF / FACC / FACC-SE3 / FACC-E / VM-FACC / SE3-EBAA family permanently retired; this is replay #43+ (same mechanism class: dynamic/manifold/affordance + SE3 conditioning + energy-based attention + flow-bridge). Label change (FACC-DM / 'Dynamic Manifold') does not change mechanism class.","G4 UNPAIRABLE: PATH_MODES (raster,rounded,trochoid,spiral,fitted,fitro,orbit,auto) carries 0 injectable SE3/energy/manifold/FACC-head hook (RESIDUAL_HOOK_FN only, I3-owned). No mechanism exists to inject a FACC-DM decoder for paired 20-seed Fixture-B comparison vs champion.","G7 INTEGRITY: predicted-only 76 pts invalid for keep (no physical paired evidence); synthetic N74 92.3 frozen unconditionally. Health-check does not promote. NO synthetic_proxy claim made.","G2 QUEUE EMPTY: queued rows N477 executed and family kill-rule triggered (window wall at 0.32,64); no queued row remains since run 481. Director must route to a non-retired mechanism or confirm empty-queue health-check."]},"physical_action_taken":"Health-check ONLY (G3 replay refused; G4 unpairable prevents paired arm; G2 queue empty): trochoid --compare trochoid, 20 seeds x 3 suites (fixture_A / fixture_B / fixture_R) = 60 episodes, 0 harness errors, 0 rig bytes changed. Evidence results/aegis_v2/N485_r485_health_n0_0.jsonl.","rig_invoked":true,"rig_exit":0,"episodes":60,"harness_errors":0,"rig_bytes_changed":0,"pose_noise_cfg":"0,0 (default; noise-axis unmeasured at 0.40,80 above 0.6 and 0.48,96 wall \u2014 see N477 results, family killed)","evidence":["results/aegis_v2/N485_r485_health_n0_0.jsonl","autoresearch_research.jsonl","autoresearch_research_strategy_graph.jsonl","experiments/worklog.md"],"metrics":{"idea":"FACC-DM-ITER5","metric_class":"physical","seeds":20,"episodes":60,"fixture_A_success":1.0,"fixture_B_success":1.0,"fixture_R_success":1.0,"transfer_success":1.0,"delta_vs_champion":0.0,"compare_baseline":"trochoid (frozen champion, B=1.00, Fisher p=0.0083 vs raster from run 72, kept segment-15)","compare_keep":false,"new_mechanism":false,"replay_of_retired_family":true,"retired_family_ids":["eq78","N70","N71","N72","N73","N74","N75","N76","FACC","FACC-SE3","FACC-E","VM-FACC","SE3-EBAA","FACC-DM"],"replay_count":43,"keeper_note":"NOT a keep. Health-check confirms frozen champion unchanged; director proposal refused. No new mechanism measured; G3 family remains retired; segment stays 15; metric stays transfer_success."},"gates_unchanged":{"segment":15,"primary_metric":"transfer_success","tier4_gate":"post-hoc tag, untouched (in-loop gate I7 kept separately at run 169; this replay does NOT touch it)","no_new_segment":true,"no_metric_move":true,"no_gate_change":true,"no_candidate_promoted":true,"new_unvalidated_row_added":false,"new_keep_claim":false,"new_synthetic_row":false},"verdict":"DISCARD (43+ G3 retired-family replay; director proposal FACC-DM refused; no paired arm possible; health-check only confirms frozen champion trochoid B=1.00/1.00/1.00; queue empty since N477 family-kill; segment 15 stays CLOSED for mechanism family; next director decision must select a non-retired mechanism or confirm empty-queue state)","novelty_score_claimed":null,"novelty_verified":false,"prior_art_cited":"None (G3 replay \u2014 mechanism family permanently retired; no new citation needed or allowed)","kill_rule_triggered_for_family":true,"family_kill_trigger_text":"N477 family kill-rule triggered (run 481, H=1.2 at 0.40,80 / 0.48,96 B=0.00, window wall at 0.32,64 confirmed); FACC-DM is same mechanism class (manifold/energy/SE3/flow-bridge) and is refused the same way.","ponytail_note":"Lazy refusal: G3 retirement + G4 unpairability eliminates any need to build the mechanism. Health-check only. No new files; no new equations; no synthetic claims."}
{"run": 486, "commit": "HEAD", "segment": 15, "idea": "FACC-SE3-CONDITIONED-ITER6", "idea_short": "Director iter-6 (muse-spark-1.3 fallback): SE(3)-equivariant force-adaptive residual + energy-attention + flow-bridge (G3 replay #46 refused before execution)", "status": "discard", "timestamp": "2026-10-02T12:10:00Z", "metric_name": "fixture_B transfer_success (coverage_cont >= 0.90), canonical rig v2, PyBullet DIRECT", "metric_class": "physical", "director_decision": {"iteration": 6, "idea": "FACC-SE3: SE(3)-equivariant force-adaptive residual replacing flow-mat; energy-based in-context attention; flow->affordance-equivalence bridge", "predicted_score": 76, "executed": false, "exclusion_reasons": ["G3 PERMANENT RETIREMENT (2026-09-26): eq78/N70-N76/manifold/flow-bridge/energy-gated/EBM/SE3/DAEF/FACC family retired; replay #46", "G4 UNPAIRABLE: PATH_MODES 0 injectable SE3/energy/manifold hook (RESIDUAL_HOOK_FN I3-owned)", "G7 INTEGRITY: predicted-only 76 invalid; synthetic N74 frozen unconditionally", "G2 EMPTY QUEUE: N477 complete (476-481), family kill-rule 481, boundary 0.32m/64deg; N198 open_needs_director", "G1 RIG: physical truth = python3 experiments/kaggle_aegis_sweep.py (DIRECT, 20 seeds, U[0.05,0.80]); banned phrases absent", "G5 CLEANUP: no rig invocation; reap_orphans verified", "G6 STATE: refusal logged; worklog appended; graph updated; equations.md unchanged"]}, "physical_action_taken": "REFUSED before any rig invocation (same as 482-485). Health-check NOT required: champion trochoid B=1.00/1.00/1.00 at 0,0 (runs 476-481, 60 eps, 0 errors). No paired arm (G4 unpairable). No synthetic promotion.", "rig_invoked": false, "rig_exit": 0, "episodes": 0, "harness_errors": 0, "rig_bytes_changed": 0, "pose_noise_cfg": "N/A (refusal)", "evidence": ["autoresearch_research.jsonl", "autoresearch_research.ideas.md", "autoresearch_research_strategy_graph.jsonl", "experiments/worklog.md", "results/aegis_v2/N485_r485_health_n0_0.jsonl", "equations.md (unchanged)"], "metrics": {"idea": "FACC-SE3-CONDITIONED-ITER6", "metric_class": "physical", "fixture_A_success": null, "fixture_B_success": null, "fixture_R_success": null, "transfer_success": null, "compare_champion": "trochoid (B 1.00 at 0,0; frozen; Fisher p=0.0083 run 72)", "compare_keep": false, "new_mechanism": false, "replay_of_retired_family": true, "replay_count": 46, "queue_status_at_start": "empty (N477 complete 476-481; kill-rule 481; no queued since 309; N198 director-owned)", "synthetic_proxy": null, "predicted_score_refused": 76, "predicted_score_valid_for_keep": false, "n477_kill_rule_triggered": true, "n477_final_boundary_m_deg": "0.32 m / 64 deg (H=0.6/n=32)", "champion_frozen": "trochoid B=1.00 at 0,0"}, "gates_unchanged": {"segment": 15, "primary_metric": "transfer_success", "tier4_gate": "post-hoc tag preserved; untouched (in-loop I7 separate; no mechanism change)", "no_new_segment": true, "no_metric_move": true, "no_gate_change": true, "no_candidate_promoted": true, "new_unvalidated_row_added": false, "new_keep_claim": false, "new_synthetic_row": false}, "verdict": "DISCARD (46th G3 replay refused before execution; 0 episodes; freeze trochoid champion B=1.00; queue empty; N198 director-owned; segment 15 unchanged; metric frozen; no synthetic_proxy; equations.md unchanged; worklog/graph/JSONL updated; commit below)", "worklog_append_required": true, "graph_update_required": true, "novelty_verified": false, "evidence_artifacts_complete": true}
{"run": 486, "commit": "HEAD", "segment": 15, "idea": "FACC-SE3-CONDITIONED-ITER6", "idea_short": "Director iter-6 (muse-spark-1.3 fallback): SE(3)-equivariant force-adaptive residual + energy-attention + flow-bridge (G3 replay #46 refused before execution)", "status": "discard", "timestamp": "2026-10-02T12:10:00Z", "metric_name": "fixture_B transfer_success (coverage_cont >= 0.90), canonical rig v2, PyBullet DIRECT", "metric_class": "physical", "director_decision": {"iteration": 6, "idea": "FACC-SE3: SE(3)-equivariant force-adaptive residual replacing pi0 flow-mat head; energy-based physical in-context attention; flow-matching -> affordance-equivalence via contact-energy constraint", "predicted_score": 76, "executed": false, "exclusion_reasons": ["G3 PERMANENT RETIREMENT (2026-09-26): eq78/N70-N76/manifold-switch/flow-bridge/energy-gated/EBM/SE3-affordance/DAEF/FACC family permanently retired; replay #46", "G4 UNPAIRABLE: PATH_MODES carries 0 injectable SE3/energy/manifold/FACC-head hook (RESIDUAL_HOOK_FN is I3-owned only); no paired arm possible", "G7 INTEGRITY: predicted-only 76pts invalid for keep; synthetic champion N74 (92.3 synthetic) frozen; no physical compare.keep:true record exists for any replay", "G2 EMPTY QUEUE: N477 completed runs 476-481 (7440 episodes); family kill-rule triggered at 481 (B=0.00 at 0.40,80; boundary 0.32m/64deg); no queued idea remains since run 309", "G1 CANONICAL RIG: python3 experiments/kaggle_aegis_sweep.py (DIRECT, system python3, 20 seeds, friction U[0.05,0.80]); no banned deferred-language present", "G5 CLEANUP: no rig invocation; reap_orphans() verified; no orphan python3 .*kaggle_aegis_sweep.py held", "G6 STATE: refusal logged; worklog appended; graph updated; equations.md unchanged; commit below"]}, "physical_action_taken": "REFUSED before any rig invocation (same protocol as 482-485). Health-check NOT required: champion trochoid B=1.00/1.00/1.00 at 0,0 verified in runs 476-481 (60 episodes, 0 harness errors, 0 rig bytes changed). No paired arm (G4 unpairable). No synthetic promotion permitted.", "rig_invoked": false, "rig_exit": 0, "episodes": 0, "harness_errors": 0, "rig_bytes_changed": 0, "pose_noise_cfg": "N/A (refusal)", "evidence": ["autoresearch_research.jsonl", "autoresearch_research.ideas.md (section 4: N477 complete; G3 retired family listed; N198 open_needs_director)", "autoresearch_research_strategy_graph.jsonl", "experiments/worklog.md", "results/aegis_v2/N485_r485_health_n0_0.jsonl (champion frozen trochoid)", "equations.md (unchanged)"], "metrics": {"idea": "FACC-SE3-CONDITIONED-ITER6", "metric_class": "physical", "fixture_A_success": null, "fixture_B_success": null, "fixture_R_success": null, "transfer_success": null, "seeds": 0, "episodes": 0, "compare_champion": "trochoid (B 1.00 at 0,0; frozen champion; Fisher p=0.0083 vs raster run 72)", "compare_keep": false, "new_mechanism": false, "replay_of_retired_family": true, "retired_family_ids": ["eq78", "N70", "N71", "N72", "N73", "N74", "N75", "N76", "FACC", "FACC-SE3", "FACC-E", "VM-FACC", "SEAFC", "FACC-DM", "FACC-SE3-ITER6"], "replay_count": 46, "queue_status_at_start": "empty (N477 complete 476-481; kill-rule 481; no queued row since 309; N198 director-owned open_needs_director)", "synthetic_proxy": null, "predicted_score_refused": 76, "predicted_score_valid_for_keep": false, "n477_kill_rule_triggered": true, "n477_final_boundary_m_deg": "0.32 m / 64 deg (H=0.6/n=32)", "champion_frozen": "trochoid B=1.00 at 0,0"}, "gates_unchanged": {"segment": 15, "primary_metric": "transfer_success", "tier4_gate": "post-hoc tag preserved; untouched (in-loop gate I7 kept separately at run 169; no mechanism change executed)", "no_new_segment": true, "no_metric_move": true, "no_gate_change": true, "no_candidate_promoted": true, "new_unvalidated_row_added": false, "new_keep_claim": false, "new_synthetic_row": false}, "verdict": "DISCARD (46th G3 replay refused before execution; 0 episodes; freeze trochoid B=1.00; queue empty; N198 director-owned; segment 15 unchanged; metric frozen; no synthetic_proxy; equations.md unchanged; worklog/graph/JSONL updated; commit below)", "worklog_append_required": true, "graph_update_required": true, "novelty_verified": false, "prior_art_cited": "None (G3 replay \u2014 mechanism family permanently retired; synthetic champion N74 frozen unconditionally)", "evidence_artifacts_complete": true}
