{"run": 419, "segment": 15, "status": "keep", "idea": "N217-PLAN-SHAPE-AXIS", "metric": 1.0, "metric_class": "physical", "timestamp": "2026-10-01T15:40:00Z", "timestamp_utc": "2026-10-01T15:40:00Z", "ts": 1790843092, "metric_name": "fixture_B transfer_success (coverage_cont >= 0.90 per episode), canonical rig, 20 paired seeds x 3 suites, 16 (A,w) arms", "description": "Validity audit (new_mechanism=false) of the rig's PLAN-SHAPE axis: the (A, w) manifold of the champion's own trochoid loop, the last unvaried frozen family after N207 rate, N208 iterations, N209 friction, N210 force, N211 kernel, N212 dose, N213 pose-noise, N214 tool body, N215 fixture face and N216 patch.", "rig": "canonical rig experiments/kaggle_aegis_sweep.py (PyBullet DIRECT, system python3, rig_version 2, friction U[0.05,0.80], gate_mode post-hoc); coverage_cont/success computed from physics contacts at return time; ZERO rig bytes changed", "rig_invoked": true, "rig_bytes_changed": 0, "commands": ["experiments/N217b_plan_shape_ladder.sh  (17 arms: 11 orphaned N217 arms re-adjudicated + 6 fresh arms; each 20 paired seeds x 3 suites x 2 arms, timeout 1200)", "python3 experiments/N217_plan_shape_audit.py  (asserts + report)"], "evidence": ["results/aegis_v2/N217_r366_identity.jsonl", "results/aegis_v2/N217_r366_l020.jsonl", "results/aegis_v2/N217_r366_l030.jsonl", "results/aegis_v2/N217_r366_l040.jsonl", "results/aegis_v2/N217_r366_l060.jsonl", "results/aegis_v2/N217_r366_l080.jsonl", "results/aegis_v2/N217_r366_l090.jsonl", "results/aegis_v2/N217_r366_l100.jsonl", "results/aegis_v2/N217_r366_lA005.jsonl", "results/aegis_v2/N217_r366_lA030.jsonl", "results/aegis_v2/N217_r366_lA045.jsonl", "results/aegis_v2/N217b_r419_lam005.jsonl", "results/aegis_v2/N217b_r419_lam020.jsonl", "results/aegis_v2/N217b_r419_lam035.jsonl", "results/aegis_v2/N217b_r419_lam055.jsonl", "results/aegis_v2/N217b_r419_lam070.jsonl", "results/aegis_v2/N217b_r419_amp0225.jsonl", "experiments/N217_plan_shape_audit.py"], "arm_convention": "the rig writes the CANDIDATE block first then the paired BASELINE block, 60 episodes each; arm identity is taken from POSITION, not path_len_m (fixture_R straddles two faces and emits two arclengths, and at lambda >= 0.60 the baseline's round-face episodes carry no path_len_m at all)", "metric_value": 1.0, "metrics": {"idea": "N217-PLAN-SHAPE-AXIS", "metric_class": "physical", "lambda": {"identity": 1.0, "0.05": 1.0, "0.20": 1.0, "0.30": 1.0, "0.35": 1.0, "0.40": 0.9953, "0.55": 1.0}, "lambda_ladder_coverage_cont_valid": {"0.05": {"A": 1.0, "B": 1.0, "R": 0.99948}, "0.20": {"A": 1.0, "B": 1.0, "R": 1.0}, "0.30": {"A": 1.0, "B": 1.0, "R": 1.0}, "0.35": {"A": 1.0, "B": 1.0, "R": 1.0}, "0.40": {"A": 0.9964, "B": 1.0, "R": 0.9953}, "0.55": {"A": 1.0, "B": 1.0, "R": 1.0}}, "lambda_ladder_n_harness": {"0.05": 0, "0.20": 0, "0.30": 0, "0.35": 0, "0.40": 0, "0.55": 0, "0.60": {"A": 20, "B": 0, "R": 9}, "0.70": {"A": 20, "B": 0, "R": 9}, "0.80": {"A": 20, "B": 20, "R": 20}, "0.90": {"A": 20, "B": 20, "R": 20}, "1.00": {"A": 20, "B": 20, "R": 20}}, "geometry_max_turn_deg_round_face": {"0.05": 11.09, "0.50": 45.37, "0.55": 52.52, "0.60": 64.84, "0.70": 63.25, "0.80": 85.3, "0.90": 141.95, "1.00": 145.1}, "geometry_max_turn_deg_elongated_face": {"0.50": 17.63, "0.60": 27.4, "0.70": 53.84, "0.80": 85.3}, "A_ladder_at_lambda_0.5_coverage_cont": {"0.005": {"A": 1.0, "B": 1.0, "R": 1.0}, "0.015": {"A": 1.0, "B": 1.0, "R": 1.0}, "0.0225": {"A": 0.99688, "B": 0.98752, "R": 0.99188}, "0.030": {"A": 0.962, "B": 0.9625, "R": 0.9599}, "0.045": {"A": 0.8964, "B": 0.90938, "R": 0.9052}}, "A_ladder_success_of_20": {"0.030": {"A": 14, "B": 20, "R": 15}, "0.045": {"A": 7, "B": 8, "R": 8}}, "A_ladder_arclength_m_elongated": {"0.015": 0.9098, "0.0225": 0.8315, "0.030": 0.9604, "0.045": 0.9571}, "bar_quantum": {"elongated": 0.015625, "round": 0.0104167}, "seeds": 20, "episodes": 3840, "arms": 17, "compare_keep_any_arm": false, "identity_fields_bit_identical_to_run350": "360/360 across coverage_cont/success/escaped/coverage/stall_frac/z_exc_max_m", "physical_rig": "python3 experiments/kaggle_aegis_sweep.py (PyBullet DIRECT, system python3, rig_version 2)", "synthetic_proxy": null, "rig_edited": false, "unvalidated_cap": "unchanged (every arm is a >= 20-seed paired physical run)", "g7_integrity": "no teleport; no arithmetic on coverage_cont/success; no synthetic_proxy status; harness-error episodes EXCLUDED from every quoted coverage mean and n_valid quoted beside each cell"}, "predications": {"Y1_hard_cusp_floor_plateau_to_0.80": {"verdict": "REFUTED", "measured": "first coverage loss at lambda = 0.60 on the elongated anchor (B 0.9500, 19/20 success); at lambda >= 0.80 there is no physics at all -- every episode is a C1 assertion error, so the (0.80, 1.00] window is unscorable rather than lossy"}, "Y2_scale_free_in_A_at_fixed_lambda": {"verdict": "CONFIRMED", "measured": "A 0.005/0.015/0.0225 at lambda = 0.5 differ by at most 0.0125 coverage_cont, inside one bar quantum (0.015625 elongated / 0.010417 round) on all three suites over a 4.5x span in A"}, "Y3_u_excursion_breaks_round_faces_only": {"verdict": "REFUTED", "measured": "A = 0.030 loses on all three suites together (A 0.9620 / B 0.9625 / R 0.9599); the elongated anchor with N216's 1.52x face margin falls as hard as the round faces, so the term is the plan's excursion, not the face"}, "Y4_cycle_time_cost_of_scale_freedom": {"verdict": "REFUTED", "measured": "coverage moves monotonically down with A (1.0000 -> 0.9875 -> 0.9625 -> 0.9094 on B) and arclength is NON-monotone in A (0.9098 -> 0.8315 -> 0.9604 -> 0.9571 m) because _loops_offset samples the offset circle once per 0.01 m base point, so the realised angular step is 0.01*lambda/A and the realised loop shrinks at small A (N28's mesh artefact). The shortest certifying path is the first to lose coverage, so there is no cycle-time win: A = 0.015 is the shortest path that certifies."}}, "findings": ["The binder above lambda = 0.55 is the PLAN GENERATOR's C1 assertion (kaggle_aegis_sweep.py:1195, MAX_TURN_DEG = 60), not the contact. max_turn_deg(uv) reproduces the measured per-suite harness-error counts exactly in all 15 (arm, suite) cells that trip it, which is a pure-geometry check with no physics involved.", "New floor, tightest in the segment: lambda_C1 in (0.55, 0.60) on the round faces = champion margin 1.10-1.20x in lambda, 1.32x in turn angle. Tighter than N214 1.27x, N215 1.33x, N216 1.45x.", "New measurement-chain defect: a suite with ZERO valid episodes in the paired baseline reads coverage_cont = 0.0000 instead of 'no data', so the lambda >= 0.80 rows (60/60 harness errors) would be scored as a total physics loss. n_valid must be quoted beside every plan-shape cell."], "gates_unchanged": {"segment": 15, "primary_metric": "transfer_success", "tier4_gate": "post-hoc tag, untouched", "no_new_segment": true, "no_metric_move": true, "no_gate_change": true, "no_candidate_promoted": true}, "verdict": "KEEP as segment knowledge (validity audit, new_mechanism=false; N207-N216 precedent). Three of four pre-registered predictions refuted, and that is the value: the lambda axis is CLEAN to 0.55 and then UNSCORABLE, the C1 wall is located exactly by pure geometry as the tightest floor in the segment, and Y4's refutation comes with its mechanism (offset-circle mesh quantisation, realised angular step 0.01*lambda/A). No candidate promoted; in-rig compare.keep is false in all 17 arms because the champion sits at the 1.0000 ceiling everywhere its plan is legal.", "notes": "Run 419 continued the orphaned N217 plan-shape work: 11 arms already on disk from the interrupted N217 ladder (r366) plus 6 fresh arms (lambda 0.05/0.20/0.35/0.55/0.70 and A 0.0225) generated by experiments/N217b_plan_shape_ladder.sh, 20 paired seeds each. Queue remains empty (all ideas.md sections done since run 309), N198 remains open_needs_director, and the FACC family stays G3-retired and was not rebuilt. Director recommendation unchanged: option (b) still needs re-anchoring off fixture_B AND a paired read; this run adds the twelfth independent line and the first one that locates a bound on the PLAN rather than on the fixture."}
{"run": 420, "idea": "FACC-DIRECTOR-ITER2 + FROZEN-CHAMPION-HEALTH", "segment": 15, "status": "discard", "timestamp": "2026-10-01T16:00:00Z", "metric": 1.0, "metric_name": "fixture_B transfer_success (coverage_cont >= 0.90 per episode), canonical rig, 20 paired seeds x 3 suites, pose_noise 0,0", "metric_class": "physical", "director_decision": {"iteration": 2, "idea": "FACC SE(3)-conditioned energy-based attention replacing pi0 flow-matching head, predicted 78pts keep", "predicted_score": 78, "executed": false, "exclusion_reasons": ["G3 permanent retirement: eq78/N70-N76/manifold-switch/flow-bridge/energy-gated + SE(3)-affordance re-derivations; FACC closed at r407 B=0.22855 and replay-rejected r409/r413/r414/r415/r417/r418", "G4 unpairable: PATH_MODES carry no pi0/SE3/EBM/wrench/stiffness hook; N200 audit = 0 injectable knob", "ideas.md sections 1+4 have no queued row (all done since run 309); N198 open_needs_director, worker may not move metric/gate/segment", "G7 predicted-only score may not set status"]}, "physical_action_taken": "frozen-champion health re-cert: timeout 1200 python3 experiments/kaggle_aegis_sweep.py --seeds 20 --no-upload --path trochoid --compare raster --suites fixture_A,fixture_B,fixture_R --out results/aegis_v2/r420_frozen_champion_health.jsonl (exit 0, ~10s, 120 episodes, 0 harness errors, 0 rig bytes changed)", "rig": "canonical rig experiments/kaggle_aegis_sweep.py (PyBullet DIRECT, system python3, rig_version 2, friction U[0.05,0.80], gate_mode post-hoc)", "rig_invoked": true, "rig_exit": 0, "episodes": 120, "harness_errors": 0, "rig_bytes_changed": 0, "pose_noise_cfg": "0,0", "evidence": ["results/aegis_v2/r420_frozen_champion_health.jsonl"], "metrics": {"idea": "FACC-DIRECTOR-ITER2", "metric_class": "physical", "seeds": 20, "episodes": 120, "fixture_A_success": 1.0, "fixture_B_success": 1.0, "fixture_R_success": 1.0, "coverage_cont_ABR": "1.0000/1.0000/1.0000 both arms", "delta": 0.0, "welch_p": "NaN (zero variance)", "fisher_p": 1.0, "paired_p": "NaN (zero variance)", "compare_keep": false, "synthetic_proxy": null}, "gates_unchanged": {"segment": 15, "primary_metric": "transfer_success", "tier4_gate": "post-hoc tag, untouched", "no_new_segment": true, "no_metric_move": true, "no_gate_change": true, "no_candidate_promoted": true}, "verdict": "DISCARD (proposal-reject + health re-cert). Candidate trochoid and baseline raster both 20/20 on A/B/R, coverage_cont 1.0000, delta 0, Fisher p 1.0, keep=false. Second independent 0,0 tie after r417: G4 bar has zero dynamic range on fixture_B at 0,0 (r418 showed the paired read only separates at 0.03,6). No teleport, no arithmetic coverage/success, no synthetic_proxy status.", "notes": "Queue remains empty; N198 open_needs_director; FACC family stays G3-retired and was not rebuilt."}
{"run": 421, "idea": "FACC-DIRECTOR-ITER3 + FROZEN-CHAMPION-HEALTH", "segment": 15, "status": "discard", "timestamp": "2026-10-01T16:30:00Z", "metric": 1.0, "metric_name": "fixture_B transfer_success (coverage_cont >= 0.90 per episode), canonical rig, 20 paired seeds x 3 suites, pose_noise 0,0", "metric_class": "physical", "director_decision": {"iteration": 3, "idea": "FACC Force-Adaptive Contact Control replacing flow-matching head (SE(3) + force-feedback conditioned energy-based attention over dynamic affordance manifold, new_mechanism=true), predicted 76 keep", "predicted_score": 76, "executed": false, "exclusion_reasons": ["G3 permanent retirement: eq78/N70-N76/manifold-switch/flow-bridge/energy-gated + SE(3)-affordance re-derivations; FACC closed at r407 B=0.22855 and replay-rejected r409/r413/r414/r415/r417/r418/r420", "G4 unpairable: PATH_MODES carry no pi0/SE3/EBM/wrench/stiffness hook; N200 audit = 0 injectable knob", "ideas.md sections 1+4 have no queued row (all done since run 309); N198 open_needs_director, worker may not move metric/gate/segment", "G7 predicted-only score may not set status; Run 419 (A,w) PLAN-SHAPE sweep is a kept validity audit, replaying it is a closed-idea replay"]}, "physical_action_taken": "frozen-champion health re-cert: timeout 1200 python3 experiments/kaggle_aegis_sweep.py --seeds 20 --no-upload --path trochoid --compare raster --suites fixture_A,fixture_B,fixture_R --out results/aegis_v2/r421_frozen_champion_health.jsonl (exit 0, ~8.6s, 120 episodes, 0 harness errors, 0 rig bytes changed)", "rig_invoked": true, "rig_exit": 0, "episodes": 120, "harness_errors": 0, "rig_bytes_changed": 0, "pose_noise_cfg": "0,0", "evidence": ["results/aegis_v2/r421_frozen_champion_health.jsonl"], "metrics": {"idea": "FACC-DIRECTOR-ITER3", "metric_class": "physical", "seeds": 20, "episodes": 120, "fixture_A_success": 1.0, "fixture_B_success": 1.0, "fixture_R_success": 1.0, "coverage_cont_ABR": "1.0000/1.0000/1.0000 both arms", "delta": 0.0, "welch_p": "NaN (zero variance)", "fisher_p": 1.0, "paired_p": "NaN (zero variance)", "compare_keep": false, "synthetic_proxy": null}, "gates_unchanged": {"segment": 15, "primary_metric": "transfer_success", "tier4_gate": "post-hoc tag, untouched", "no_new_segment": true, "no_metric_move": true, "no_gate_change": true, "no_candidate_promoted": true}, "verdict": "DISCARD (proposal-reject + health re-cert). Candidate trochoid and baseline raster both 20/20 on A/B/R, coverage_cont 1.0000, delta 0, Fisher p 1.0, keep=false. Third independent 0,0 tie after r417/r420: G4 bar has zero dynamic range on fixture_B at 0,0.", "notes": "Queue remains empty; N198 open_needs_director; FACC family stays G3-retired and was not rebuilt."}
{"run": 422, "segment": 15, "metric": 1.0, "status": "discard", "metrics": {"idea": "FACC-DIRECTOR-ITER4", "metric_class": "physical", "seeds": 20, "episodes": 60, "fixture_A_success": 1.0, "fixture_B_success": 1.0, "fixture_R_success": 1.0, "coverage_cont_ABR": "1.0000/1.0000/1.0000", "harness_errors": 0, "pose_noise_cfg": "0,0", "rig": "experiments/kaggle_aegis_sweep.py --seeds 20 --no-upload --path trochoid --compare trochoid", "rig_file": "results/aegis_v2/FACC_iter4_r422.jsonl", "rig_bytes_changed": 0, "delta_vs_champion": 0.0, "welch_p": null, "fisher_p": null, "compare_keep": false, "synthetic_proxy": null}, "description": "Director iter-4 FACC (SE3-conditioned contact head + force residual, freeze planner swap expert, predicted 76) adjudicated-not-executed: G3-retired energy-gated/SE3-affordance family, 0 injectable rig hook, queue empty since 309, N198 director-owned, predicted-only validity metric barred by G7 freeze. Physical content: frozen-champion identical-arm health re-cert, 20 seeds x 3 suites = 60 episodes, A/B/R 20/20, coverage_cont 1.0000, 0 harness errors, 0 rig bytes changed. Proposal delta 0 by construction, no paired p-value, keep=false.", "timestamp": 1790843400}
{"run": 423, "idea": "FACC-DIRECTOR-ITER5-LITE + FROZEN-CHAMPION-HEALTH", "segment": 15, "status": "discard", "timestamp": "2026-10-01T17:00:00Z", "metric": 1.0, "metric_name": "fixture_B transfer_success (coverage_cont >= 0.90 per episode), canonical rig, 20 paired seeds x 3 suites, pose_noise 0,0", "metric_class": "physical", "director_decision": {"iteration": 5, "idea": "FACC-Lite SE(3)-conditioned contact head + force residual, FiLM-SE(3) adapter <5M, freeze planner, predicted 74.5 keep", "predicted_score": 74.5, "executed": false, "exclusion_reasons": ["G3 permanent retirement: eq78/N70-N76/manifold-switch/flow-bridge/energy-gated + SE(3)-affordance re-derivations; FACC closed at r407 B=0.22855 and replay-rejected r409/r413/r414/r415/r417/r418/r420/r421/r422", "G4 unpairable: PATH_MODES carry no pi0/SE3/FiLM/wrench/stiffness hook; FiLM adapter + force residual has 0 injectable rig knob", "ideas.md sections 1+4 have no queued row (all done since run 309); N198 open_needs_director, worker may not move metric/gate/segment", "G7 predicted-only score may not set status; contact-rich peg/wipe/slide suite is not the canonical Fixture-B transfer bar"]}, "physical_action_taken": "frozen-champion health re-cert: timeout 1200 python3 experiments/kaggle_aegis_sweep.py --seeds 20 --no-upload --path trochoid --compare raster --suites fixture_A,fixture_B,fixture_R --out results/aegis_v2/FACC_iter5_r423.jsonl (exit 0, ~9s, 120 episodes, 0 harness errors, 0 rig bytes changed)", "rig": "canonical rig experiments/kaggle_aegis_sweep.py (PyBullet DIRECT, system python3, rig_version 2, friction U[0.05,0.80], gate_mode post-hoc)", "rig_invoked": true, "rig_exit": 0, "episodes": 120, "harness_errors": 0, "rig_bytes_changed": 0, "pose_noise_cfg": "0,0", "evidence": ["results/aegis_v2/FACC_iter5_r423.jsonl"], "metrics": {"idea": "FACC-DIRECTOR-ITER5-LITE", "metric_class": "physical", "seeds": 20, "episodes": 120, "fixture_A_success": 1.0, "fixture_B_success": 1.0, "fixture_R_success": 1.0, "coverage_cont_ABR": "1.0000/1.0000/1.0000 both arms", "delta": 0.0, "welch_p": "NaN (zero variance)", "fisher_p": 1.0, "compare_keep": false, "synthetic_proxy": null}, "gates_unchanged": {"segment": 15, "primary_metric": "transfer_success", "tier4_gate": "post-hoc tag, untouched", "no_new_segment": true, "no_metric_move": true, "no_gate_change": true, "no_candidate_promoted": true}, "verdict": "DISCARD (proposal-reject + health re-cert). Candidate trochoid and baseline raster both 20/20 on A/B/R, coverage_cont 1.0000, delta 0, Fisher p 1.0, keep=false. Fourth independent 0,0 tie after r417/r420/r421: G4 bar has zero dynamic range on fixture_B at 0,0.", "notes": "Queue remains empty; N198 open_needs_director; FACC family stays G3-retired and was not rebuilt."}
{"run": 424, "idea": "FACC-DIRECTOR-ITER6-EXE + FROZEN-CHAMPION-HEALTH", "segment": 15, "status": "discard", "timestamp": "2026-10-01T17:30:00Z", "metric": 1.0, "metric_name": "fixture_B transfer_success (coverage_cont >= 0.90 per episode), canonical rig, 20 paired seeds x 3 suites, pose_noise 0,0", "metric_class": "physical", "director_decision": {"iteration": 6, "idea": "FACC-exe SE3-conditioned contact head + force-residual adapter, freeze planner+expert train 2-layer residual, predicted 78 keep", "predicted_score": 78, "executed": false, "exclusion_reasons": ["G3 permanent retirement: eq78/N70-N76/manifold-switch/flow-bridge/energy-gated + SE(3)-affordance re-derivations; FACC closed at r407 B=0.22855 and replay-rejected r409/r413/r414/r415/r417/r418/r420/r421/r422/r423", "G4 unpairable: PATH_MODES carry no pi0/SE3/contact-head/force-residual/FiLM/wrench/stiffness hook; 2-layer residual has 0 injectable rig knob", "ideas.md sections 1+4 have no queued row (all done since run 309); N198 open_needs_director, worker may not move metric/gate/segment", "G7 predicted-only score may not set status; wipe/insert/stack suite is not the canonical Fixture-B bar"]}, "physical_action_taken": "frozen-champion health re-cert: timeout 1200 python3 experiments/kaggle_aegis_sweep.py --seeds 20 --no-upload --path trochoid --compare raster --suites fixture_A,fixture_B,fixture_R --out results/aegis_v2/FACC_iter6_r424.jsonl (exit 0, ~9s, 120 episodes, 0 harness errors, 0 rig bytes changed)", "rig": "canonical rig experiments/kaggle_aegis_sweep.py (PyBullet DIRECT, system python3, rig_version 2, friction U[0.05,0.80], gate_mode post-hoc)", "rig_invoked": true, "rig_exit": 0, "episodes": 120, "harness_errors": 0, "rig_bytes_changed": 0, "pose_noise_cfg": "0,0", "evidence": ["results/aegis_v2/FACC_iter6_r424.jsonl"], "metrics": {"idea": "FACC-DIRECTOR-ITER6-EXE", "metric_class": "physical", "seeds": 20, "episodes": 120, "fixture_A_success": 1.0, "fixture_B_success": 1.0, "fixture_R_success": 1.0, "coverage_cont_ABR": "1.0000/1.0000/1.0000 both arms", "delta": 0.0, "welch_p": "NaN (zero variance)", "fisher_p": 1.0, "compare_keep": false, "synthetic_proxy": null}, "gates_unchanged": {"segment": 15, "primary_metric": "transfer_success", "tier4_gate": "post-hoc tag, untouched", "no_new_segment": true, "no_metric_move": true, "no_gate_change": true, "no_candidate_promoted": true}, "verdict": "DISCARD (proposal-reject + health re-cert). Candidate trochoid and baseline raster both 20/20 on A/B/R, coverage_cont 1.0000, delta 0, Fisher p 1.0, keep=false. Fifth independent 0,0 tie after r417/r420/r421/r423: G4 bar has zero dynamic range on fixture_B at 0,0.", "notes": "Queue remains empty; N198 open_needs_director; FACC family stays G3-retired and was not rebuilt."}
