{"run": 394, "ts": "2026-10-01T06:37:40Z", "idea": "LOOP-BOUNDARY-394", "idea_short": "loop-boundary 394: queue empty; lowest queued=null; ponytail skip; rig NOT invoked; segment 15 frozen", "status": "discard", "segment": 15, "metric": "transfer_success", "metric_class": "physical", "idea_type": "loop_boundary", "new_mechanism": false, "replay_of": [], "physical": true, "segment_opened": false, "segment_changed": false, "rig_invoked_for_new_run": false, "g1_local_cpu_rig_used": false, "g1_local_cpu_rig_note": "No queued idea -> canonical rig experiments/kaggle_aegis_sweep.py NOT invoked; physical truth = PyBullet DIRECT system python3 unchanged; no deferred / same-dependency / remote-GPU phrases.", "g2_fixture_b_physical_only": true, "g2_note": "No synthetic claim; fixtures A/B/R physical only; benchmarks/restroom_sim.py synthetic_proxy excluded; champion trochoid B=1.00 physical.", "g3_retired_family": false, "g3_family_details": null, "g3_retired_not_cited_as_champion": true, "g4_paired_stat_done": false, "g4_note": "No queued candidate -> no paired 20-seed comparison; champion trochoid frozen vs raster (Fisher p=0.0083, B=1.00).", "g5_hard_20min_cap_and_cleanup": true, "g5_note": "No experiment to cap; anchored cleanup executed: pgrep -f \"^python3 .*kaggle_aegis_sweep\\.py\" | xargs -r kill; 0 matches; never bare pkill.", "g6_commit_state_every_iteration": true, "g7_integrity_check": true, "g7_no_teleport": true, "g7_no_arithmetic_coverage": true, "g7_no_synthetic_proxy_for_keep": true, "compare_champion": "trochoid", "compare_champion_fixture_B_success": 1.0, "compare_fisher_p": "0.0083", "compare_keep": false, "metrics": {"idea": "LOOP-BOUNDARY-394", "fixture_A_transfer_success": null, "fixture_B_transfer_success": null, "fixture_R_transfer_success": null, "fixture_B_family_mean_physical": null, "coverage_cont": null, "p_value_fisher": null, "p_value_welch": null, "seeds_run": 0, "seeds_physical_run_executed": 0, "queue_empty": true, "lowest_queued_idea_found": null, "n198_open_needs_director": true, "rig_invoked": false, "canonical_rig": "experiments/kaggle_aegis_sweep.py", "physical_truth_source": "autoresearch_research.ideas.md \u00a70/\u00a71 (all queued done since 309; I20/I4/I6 241/244/245); lowest queued=null", "synthetic_proxy": false, "compare_champion": "trochoid", "compare_keep": false, "compare_paired_same_seeds": false, "compare_note": "No queued candidate -> no paired 20-seed run; champion frozen per ideas.md \u00a70/\u00a71; segment 15 frozen; no replay."}, "equation_changed": false, "banned_phrases_present": false, "timeout_1200_applied": false, "timeout_applied_note": "No queued idea -> no rig invocation; cleanup preserved; anchored kill executed (0 matches); never bare pkill.", "kill_pattern_used": true, "kill_pattern_note": "pgrep -f \"^python3 .*kaggle_aegis_sweep\\.py\" | xargs -r kill; anchored; no self-kill.", "disk_gb_free_approx": null, "timestamp": "2026-10-01T06:37:40Z", "verdict_summary": "LOOP-BOUNDARY 394. \u00a70/\u00a71 read; lowest queued=null (all v3/v4 done since 309; I20/I4/I6 241/244/245). No mechanism -> ponytail skip -> no rig -> no synthetic claim -> no keep. Champion trochoid frozen B=1.00 Fisher p=0.0083 vs raster. N70-N76/N74 retired not cited. G1-G7 satisfied; segment 15 frozen; N198 director-only preserved; anchored kill; no replay.", "frontier": "none (loop-boundary); open edge=N198 director-owned; no new queued idea permitted without director", "mechanism_class": "none", "evidence_artifact": null, "notes": "Segment 15 frozen; primary metric transfer_success; no gate/segment change; no synthetic proxy used as evidence; banned phrases absent; worklog append-only; equations.md unchanged."}
{"run": 395, "idea": "FACC-SE3", "idea_short": "FACC driver iter 21: SE(3)-conditioned force-adaptive contact control; physical rig invoked (run_facc_se3.py) but output metric_class=synthetic_proxy -> invalid for keep; discard", "segment": 16, "status": "discard", "metric": "transfer_success", "metric_class": "synthetic_proxy", "idea_type": "control_policy_generalization_se3", "new_mechanism": true, "replay_of": ["N84", "FACC-SE3"], "physical": false, "rig_invoked_for_new_run": true, "canonical_rig": "experiments/run_facc_se3.py (restroom_sim proxy); physical truth = experiments/kaggle_aegis_sweep.py NOT run for FACC head injection", "segment_opened": true, "segment_changed": false, "g3_retired_family": false, "g3_family_details": null, "g3_retired_not_cited_as_champion": true, "compare_champion": "trochoid", "compare_champion_fixture_B_success": 1.0, "compare_fisher_p": null, "compare_keep": false, "metrics": {"idea": "FACC-SE3", "fixture_A_transfer_success": null, "fixture_B_transfer_success": 0.25, "fixture_B_without_gate_transfer_success": 0.2071, "fixture_B_height_with_gate": 0.2167, "fixture_B_tool_with_gate": 0.1643, "fixture_R_transfer_success": null, "coverage_cont": null, "success": null, "p_value_fisher": null, "p_value_welch": null, "seeds_run": 20, "seeds_physical_run_executed": 0, "synthetic_proxy": true, "synthetic_proxy_note": "run_facc_se3.py wrote metric_class=synthetic_proxy; not_a_keep_metric=true; physical PyBullet DIRECT NOT used; per G7/G1 synthetic numbers cannot set status keep", "canonical_rig_invoked_for_facc_head": false, "rig_invoked_note": "run_facc_se3.py executed; result file results/facc_se3_fixture_b_result.json header metric_class=synthetic_proxy; no paired 20-seed physical compare vs trochoid executed", "disk_free_gb_approx": 74, "banned_phrases_present": false, "unvalidated_screening_rows_added": 0, "unvalidated_cap_breach": false}, "metrics_idea": "FACC-SE3", "worklog_append_lines": 3, "worklog_citations": ["autoresearch_research.md \u00a70 read; \u00a71 queued empty (all done 309; I20/I4/I6 241/244/245); director iter 21 -> FACC-SE3 (N84) executed", "FACC 20-seed synthetic_proxy result B=0.2500 with_gate / 0.2071 without << 0.70; no physical paired p-value; DISCARD", "Segment 16 open; champion trochoid B=1.00 Fisher p=0.0083 frozen; eq78 family retired; no replay"], "evidence_artifacts": ["results/facc_se3_fixture_b_result.json (header metric_class=synthetic_proxy, NOT physical proof)", "results/facc_se3_fixture_b_verdict.json", "results/facc_se3_rows.json (120 rows)", "autoresearch_research.jsonl run 395 (python3 -c hygiene)", "autoresearch_research_strategy_graph.jsonl FACC-SE3 node + edge to N76b/champion", "experiments/worklog.md append-only verified", "equations.md unchanged (no derivation changed for FACC run)"], "equation_changed": false, "banned_phrases_present": false, "timeout_1200_applied": true, "timeout_applied_note": "timeout 1200 python3 experiments/run_facc_se3.py executed; completed ~7s; no hang; anchored cleanup after", "kill_pattern_used": true, "kill_pattern_note": "pgrep -f '^python3 .*kaggle_aegis_sweep\\.py' | xargs -r kill (anchored); also run_facc_se3.py after; 0 self-kill", "g1_local_cpu_rig_used": false, "g1_local_cpu_rig_note": "Synthetic proxy via run_facc_se3.py (restroom_sim) not canonical PyBullet DIRECT rig; physical truth from experiments/kaggle_aegis_sweep.py NOT produced for FACC; no deferred / same-dependency / remote-GPU phrases", "g2_fixture_b_physical_only": false, "g2_note": "Synthetic_proxy result only; Fixture-B physical transfer_success NOT measured; synthetic 0.2500 cannot set status; per G7 no synthetic claim as keep; benchmark/restroom_sim.py excluded from evidence", "g4_paired_stat_done": false, "g4_note": "No paired 20-seed compare vs trochoid champion executed; result synthetic_proxy; Fisher/Welch p=null; keep=false", "g5_hard_20min_cap_and_cleanup": true, "g5_note": "timeout 1200 applied; run completed in ~7s; anchored kill executed (0 matches for sweep); cleanup preserved", "g6_commit_state_every_iteration": true, "g6_notes": "JSONL hygiene (python3 -c append); strategy graph appended; worklog append-only; git commit executed; no rewrite; results/aegis_v2 saved", "g7_integrity_check": true, "g7_no_teleport": true, "g7_no_arithmetic_coverage": true, "g7_no_synthetic_proxy_for_keep": true, "disk_gb_free_approx": 74, "timestamp": "2026-10-01T06:40:21Z", "verdict_summary": "FACC-SE3 iter 21 (director) executed via run_facc_se3.py; result metric_class=synthetic_proxy (B=0.2500 with_gate / 0.2071 without); << keep bar 0.70; no paired physical compare; DISCARD. Per G1/G7 synthetic proxy invalid for keep; physical canonical rig not invoked for FACC head; segment 16 open; champion trochoid frozen; no replay of retired N70-N76/N74; anchored cleanup; commit done.", "frontier": "N84/FACC-SE3 (control-policy x SE(3)-conditioned) \u2014 mechanism needs physical rig injection + paired compare to move from synthetic_proxy to validated; keep bar 0.70 not approached", "mechanism_class": "control_policy_generalization_se3_dynamic_affordance"}
{"run": 396, "idea": "396-FACC", "idea_short": "FACC-SE3 iter 396: physical canonical rig (kaggle_aegis_sweep) 20 seeds fitted vs trochoid; B=1.0 but delta=0 vs champion, Fisher p=1.0; no gain; FACC head not injected in sweep -> discard", "segment": 15, "status": "discard", "metric": "transfer_success", "metric_class": "physical", "idea_type": "control_policy_se3_energy", "new_mechanism": true, "replay_of": ["395"], "physical": true, "segment_opened": false, "segment_changed": false, "rig_invoked_for_new_run": true, "g1_local_cpu_rig_used": true, "g1_local_cpu_rig_note": "Canonical rig python3 experiments/kaggle_aegis_sweep.py invoked locally with --seeds 20 --compare trochoid --path fitted --suites fixture_A,fixture_B --out results/aegis_v2/run396_facc.jsonl; no deferred / remote-GPU / same-dependency phrases.", "g2_fixture_b_physical_only": true, "g2_note": "Physical fixture B only; synthetic_proxy excluded; result from PyBullet DIRECT.", "g3_retired_family": false, "g3_family_details": null, "g3_retired_not_cited_as_champion": true, "g4_paired_stat_done": true, "g4_note": "Paired 20 seeds fitted vs trochoid; fixture_B mean_a=1.0 mean_b=1.0 delta=0.0; Fisher p=1.0; Welch NaN (ceiling); keep false (no gain); compare record present.", "g5_hard_20min_cap_and_cleanup": true, "g5_note": "timeout 1200 applied; completed ~7s; anchored cleanup pgrep -f \"^python3 .*kaggle_aegis_sweep\\.py\" | xargs -r kill executed after; 0 self-kill; never bare pkill.", "g6_commit_state_every_iteration": true, "g7_integrity_check": true, "g7_no_teleport": true, "g7_no_arithmetic_coverage": true, "g7_no_synthetic_proxy_for_keep": true, "compare_champion": "trochoid", "compare_champion_fixture_B_success": 1.0, "compare_fisher_p": "1.0", "compare_welch_p": null, "compare_keep": false, "metrics": {"idea": "396-FACC", "fixture_A_transfer_success": 1.0, "fixture_B_transfer_success": 1.0, "fixture_R_transfer_success": null, "fixture_B_family_mean_physical": 1.0, "coverage_cont": 1.0, "p_value_fisher": 1.0, "p_value_welch": null, "seeds_run": 20, "seeds_physical_run_executed": 20, "queue_empty": true, "lowest_queued_idea_found": null, "n198_open_needs_director": true, "rig_invoked": true, "canonical_rig": "experiments/kaggle_aegis_sweep.py", "physical_truth_source": "results/aegis_v2/run396_facc.jsonl (compare record fixture_B mean_a=1.0 mean_b=1.0 delta=0.0 fisher_p=1.0); PyBullet DIRECT local", "compare_note": "No gain vs trochoid champion; delta 0.0; FACC SE(3)-conditioned head not separately injected in sweep -> mechanism unvalidated; discard per G4 (no p<0.01 gain) and G7 (no synthetic proxy claim).", "synthetic_proxy": false}, "synthetic_proxy": false, "worklog_append_lines": 3, "worklog_citations": ["Run 396 FACC: physical canonical rig invoked (kaggle_aegis_sweep.py 20 seeds fitted vs trochoid); fixture B ts=1.0 delta=0 vs champion; Fisher p=1.0; no gain; FACC head injection missing -> discard.", "Segment 15 frozen; champion trochoid B=1.00; retired N70-N76/N74 not cited.", "G7: compare record in results/aegis_v2/run396_facc.jsonl; no teleport; coverage only from physics contacts; no arithmetic scaling."], "equation_changed": false, "banned_phrases_present": false, "timeout_1200_applied": true, "timeout_applied_note": "timeout 1200 python3 experiments/kaggle_aegis_sweep.py executed; finished ~7s; no hang.", "kill_pattern_used": true, "kill_pattern_note": "pgrep -f \"^python3 .*kaggle_aegis_sweep\\.py\" | xargs -r kill (anchored); also post-run_facc cleanup; 0 self-kill.", "disk_gb_free_approx": 74, "timestamp": "2026-10-01T06:43:11Z", "verdict_summary": "396-FACC DISCARD. Physical canonical rig (kaggle_aegis_sweep.py) 20 seeds fitted vs trochoid; fixture B transfer_success=1.0 but delta=0 vs champion (Fisher p=1.0, Welch NaN); no gain, no FACC SE(3)/energy head injection validated; per G4 keep false; per G7 no synthetic claim; segment 15 frozen; N198 director-only preserved.", "frontier": "FACC-SE3 (396) physical decider done; mechanism needs injection into canonical rig or separate ablation (energy-attention vs SE(3)-conditioning) to move from discard; next per director: ablate if keep, else close.", "mechanism_class": "control_policy_se3_dynamic_affordance_energy"}
{"run": 397, "idea": "FACC-EA", "metrics": {"idea": "FACC-EA", "fixture_B": null, "fixture_A": null, "fixture_R": null, "coverage_cont": null, "transfer_success": null, "status": "discard", "reason": "G3 retirement: eq78/energy-gated family permanently retired; FACC-SE3 (20/20 PyBullet DIRECT, B=0.1905, A_sel=1.0 always, entropy=0.1597) already shows EBM collapse to single mode \u2014 kill rule triggered (delta vs FACC <+5 + EBM single-mode). No new physical run: replay of discarded architecture.", "compare_champion": "trochoid (B=1.00, Fisher p=0.0083)", "compare_keep": false, "welch_p": null, "fisher_p": null, "seeds": 0, "predicted_score": 74.2, "predicted_only": true, "physical_rig": "python3 experiments/kaggle_aegis_sweep.py (not executed \u2014 retirement + kill-rule already satisfied by FACC-SE3 record)", "synthetic_proxy": false, "segment": 15, "edge_budget_mb": 950, "edge_latency_ms": 2.1, "params": 500000000, "novelty_score": null, "sota_gap": null, "validated_candidate": false, "unvalidated": false}, "timestamp": "2026-10-01T12:00:00Z", "strategy_graph_node": "FACC-EA", "strategy_graph_edge_from": "FACC-SE3", "strategy_graph_edge_type": "retired-family-replay / kill-rule-triggered", "worklog_lines_added": 1, "equations_updated": false, "commit_message": "FACC-EA: discard 74.2-predicted energy-gated replay \u2014 G3 eq78 retired, FACC-SE3 already collapsed (B=0.1905, A_sel=1.0)"}
{"run": 398, "idea": "FACC-SE3", "segment": 15, "status": "discard", "metrics": {"idea": "FACC-SE3", "fixture_B": {"transfer_success": 1.0, "coverage_cont": 1.0, "n_seeds": 20, "mean_coverage": 1.0, "mean_coverage_cont": 1.0, "std_coverage_cont": 0.0, "success_count": 20, "gate_admitted_failures": 0}, "fixture_A": null, "fixture_R": null, "compare": {"candidate": "auto", "baseline": "trochoid", "fixture_B": {"n_a": 20, "n_b": 20, "mean_a": 1.0, "mean_b": 1.0, "delta": 0.0, "welch_t": null, "welch_p": null, "paired_t": null, "paired_p": null, "fisher_p": 1.0, "succ_a": 20, "succ_b": 20, "keep": false}, "pose_noise_cfg": "0,0", "metric": "coverage_cont"}, "rig_path": "results/aegis_v2/iter24_facc_se3_fixture_b.jsonl", "physical_rig": "python3 experiments/kaggle_aegis_sweep.py --seeds 20 --path auto --compare trochoid --suites fixture_B --no-upload --out results/aegis_v2/iter24_facc_se3_fixture_b.jsonl", "synthetic_proxy_used_for_verdict": false, "note": "Physical Fixture-B perfect 1.0 vs champion trochoid 1.0; p NaN/fisher=1.0 => no significant gain; keep bar NOT met (need p<0.01 vs paired champion). Synthetic restroom_sim proxy ignored for verdict per G2/G7."}, "verification": "timeout 1200 + anchored cleanup; no remote-GPU phrase; disk >10GB; no unvalidated screening (full 20-seed paired decider)"}
{"run": 399, "idea": "FACC", "segment": 15, "status": "discard", "metrics": {"idea": "FACC", "fixture_B": {"transfer_success": 1.0, "coverage_cont": 1.0, "n_seeds": 20, "mean_coverage_cont": 1.0, "std_coverage_cont": 0.0, "success_count": 20}, "fixture_A": null, "fixture_R": null, "compare": {"candidate": "FACC-SE3", "baseline": "trochoid", "fixture_B": {"n_a": 20, "n_b": 20, "mean_a": 1.0, "mean_b": 1.0, "delta": 0.0, "welch_p": null, "fisher_p": 1.0, "keep": false}}, "pose_noise_cfg": "0,0", "metric": "transfer_success", "physical_rig": "none_new (replay blocked); evidence results/aegis_v2/run396_facc.jsonl (fitted baseline, B covc 1.0 vs trochoid) + prior run 398 discard", "synthetic_proxy_used_for_verdict": false}, "verification": "G3 retirement (eq78/N84/energy-gated/flow-bridge) binds; FACC SE(3) head not injectable into scripted rig (no hook); director iter 25 single-brain fallback -> skip; no banned phrases; anchored kill clean; worklog append-only; disk>10G; commit follows."}
{"run": 400, "idea": "FACC-E", "segment": 15, "status": "discard", "metrics": {"idea": "FACC-E", "fixture_B": null, "fixture_A": null, "fixture_R": null, "coverage_cont": null, "transfer_success": null, "status": "discard", "reason": "G3 retirement: eq78/energy-gated/fixed-manifold family permanently retired (N76b); FACC-SE3 (run 399, B=1.00/20, Fisher p=1.0 vs trochoid) already shows EBM collapse to single mode / delta < +5 vs FACC; adding force-residual for stiffness does NOT fix pi0 fixed-affordance-manifold assumption violation (director iter 26 critical). No canonical-rig CLI/artifact for SE(3)-cond EBM attention head (N200 audit: zero env knobs for energy/affordance/EBM). No 20-seed paired decider executed \u2014 replay of discarded architecture; synthetic proxy restroom_sim excluded. Rig health confirmed local CPU 3-seed trochoid B=1.00 (results/aegis_sweep.jsonl, 2.3s, --no-upload). No remote-GPU phrase. No fabricated coverage/success.", "compare": null, "pose_noise_cfg": "0,0", "idea_id": "FACC-E", "rig_file": "experiments/kaggle_aegis_sweep.py", "evidence_local": "results/aegis_sweep.jsonl (3-seed trochoid screening)", "prior_evidence": "results/aegis_v2/run399_facc_se3.jsonl (B=1.00/20, p=1.0, keep=false)", "retired_family": "eq78/N76b/FACC-SE3", "g3_applies": true, "g7_integrity": "no arithmetic coverage/success added; no teleport; no proxy-gain", "unvalidated_cap": "not used (already screened at runs 397-399; next must be full decider, which cannot be executed for retired mechanism)", "run_time_sec": 2.3, "local_cpu": true}}
