{"node":"ITER47_DAF_EICA","derived_from":"N74","derived_from_note":"derived from N74-AEGIS champion 92.3 synthetic (segment 0-14 CLOSED); same mechanism family eq78 (N75/N76/N79/ITER24-45); replay + minimal comparison script; user-insisted mechanism: energy-based physical in-context attention + info-bottleneck selection over contact/stiffness/slip features; scratch MLP W <0.5% (~1024 params); zero adapter/retrain/rebuild of backbone; frozen backbone preserved","status":"DISCARD (falsifier triggered); validated-candidate-predicted ONLY; FREEZE N74 92.3 unconditionally","segment":"15_AEGIS","protocol":"AEGIS 6/6 exit","brain":"muse-spark-1.3-contributor-free","frontier":"bridge flow-matching -> affordance-equivalence + violate pi0 fixed-manifold (same family N76/ITER36 claim preserved)","mechanism":"energy-based physical in-context attention (contact/stiffness/slip cost -> energy; info-bottleneck selection via argmin_k E_k over affordance mappings); calibrated flow dx/dτ = v_field ⊙ A_sel + (1-A_sel)·M_spec·δ_cal + E_sel·δ_eq; scratch <0.5%; same mechanism family eq78","benchmark":"benchmarks/restroom_sim.py VERIFIED (Fixture A/B; friction 0.05-0.80; scripted 0.8125); 20 seeds WITH/without gate proxy; physical deferred; 0/20 real ManiSkill completed","benchmark_verified":true,"benchmark_result":"fixture_B_fixed_manifold_proxy=0.8728; fixture_B_deformable_flow_proxy=0.8879; scripted_baseline=0.8125; OOD_gain_pct=1.73 (<5% falsifier => kill); gate_interception_delta_proxy=0.01","physical_validation":false,"seeds_run_proxy":20,"seeds_required":20,"seeds_real_confirmed":0,"physical_engine":"pybullet DIRECT (local; full 20-seed deferred to remote GPU per AEGIS protocol #6: 30-min timeout / silence>20min abort / cascade local→kaggle-45h→colab-pro→colab-old)","fixture_A":"not run (same mechanism family; focus Fixture B OOD shift per director request)","fixture_B_fixed_manifold_mean":0.8728,"fixture_B_deformable_flow_mean":0.8879,"fixture_B_scripted_baseline":0.8125,"transfer_success_proxy_fixed":0.8728,"transfer_success_proxy_deformable":0.8879,"tier4_gate_preserved":true,"tier4_max_jerk":0.618,"interception_delta_proxy":0.01,"interception_delta_real_confirmed":false,"gate_with_without_reported":true,"edge_budget_ok":true,"vram_est_mb":950,"latency_est_ms":1.8,"params_approx":1024,"scratch_pct":0.003906,"edge_budget_passed":true,"equation_family":"equations.md row 78 sufficient (E_score, dx/dτ flow-warp, A_t EBM, scratch <0.5%, M_spec spectral mask, calibration protocol); zero new derivation; same family N75/N76/N79/N83/EAE-FM/AAFE/DAEF/ITER24-45","new_derivation":false,"new_adapter":false,"new_cross_edge":false,"novelty_check":"0 hits papers/notes/arXiv/graph/strategies.md; same mechanism family (closest N76/N75/N49/N48); bridge flow-match->affordance-equivalence claimed at N76/ITER36; replay family + minimal comparison script; no genuinely new mechanism class; no fabricated citations; no twin","novelty_predicted":76,"predicted_metric_synthetic_only":78.0,"predicted_score":76,"lift_vs_fixed_manifold_pct":1.73,"lift_vs_champion_pct":-15.1,"champion_frozen":"N74_92.3 (synthetic; segment 0-14 CLOSED; AEGIS segment 15 physical deferred; freeze unconditionally per AEGIS #5; same dependency remote GPU deferred; freeze/revert sound: revert frozen N74 if calibrated <92.3 or regression>0 or entropy_dom>=0.5 or bounded_shift_s>=0.05 or tier4_f1<0.91 or 0/20 real seeds; same cross-cutting calibration unchanged)","keep_bar_met":false,"keep_bar_real_met":false,"keep_bar_reason":"Fixture-B zero-shot transfer_success >0.70 over >=20 real seeds NOT met (0/20 real ManiSkill; synthetic proxy 0.8879 >0.70 but synthetic NEVER counts per AEGIS #1); synthetic predicted 78.0 < champion 92.3 => DISCARD from champion contention; falsifier triggered: 1.73% < 5% OOD gain => KILL mechanism claim; freeze/revert frozen N74 92.3 sound; no regression <70; validated-candidate-predicted ONLY; NOT BEST; exit loop 6/6","verdict":"DISCARD (falsifier triggered: 1.73% < 5% OOD gain over fixed-manifold pi0 baseline); FREEZE champion N74 92.3 unconditionally; validated-candidate-predicted ONLY (NOT BEST — 78.0 synthetic < 92.3 champion, 0/20 real seeds, synthetic never displaces champion); exit AEGIS loop 6/6; log-only commit; ponytail: minimal comparison script (run-47-iter.py) + falsifier + evidence artifacts; no adapter/retrain/rebuild of mechanism (same mechanism family covered by eq78 + src/affordance_flow_expert.py); same dependency remote GPU deferred; same cross-cutting calibration unchanged; no secrets; no synthetic promotion; no cross-edge claim; no unvalidated idea >1/segment","same_dependency":"full 3s demo calibration + remote GPU ManiSkill for final calibrated >=92.3 confirmation (same dependency deferred per AEGIS #6: 30-min timeout, silence>20min abort, cascade)","same_cross_cutting":"unified 3s demo calibration protocol covering N2-N74 (M_spec spectral mask + entropy-stability loss L_ent + bounded-shift s < 0.05 + calibration dependency; freeze/revert frozen N74)","falsifier_applied":true,"falsifier_ood_gain_pct":1.73,"falsifier_threshold_pct":5.0,"falsifier_result":"KILL mechanism claim (<5%); DISCARD from champion contention; FREEZE N74 92.3; replay family; same mechanism family covered; exit loop","action":"ran experiments/run-47-iter.py (20-seed proxy comparison); created results/iter47_falsifier.json; benchmark verified; equation family verified (eq78); falsifier triggered; verdict DISCARD + FREEZE N74; updated autoresearch_research.jsonl (this entry); updated autoresearch_research_strategy_graph.jsonl (node + 3 edges); updated strategies.md (append ITER47 note); updated experiments/worklog.md (ITER47 entry); updated equations.md (append verification); no secrets; no adapter/retrain/rebuild of mechanism family; exit AEGIS loop; minimal evidence artifacts complete","evidence_artifacts":["experiments/run-47-iter.py","results/iter47_falsifier.json","benchmarks/restroom_sim.py","benchmarks/restroom_sim_result.json","src/affordance_flow_expert.py","equations.md (family row 78 + ITER47 verification)","autoresearch_research.jsonl (this entry)","autoresearch_research_strategy_graph.jsonl (ITER47 node + 3 edges)","experiments/worklog.md (ITER47 entry)","strategies.md (ITER47 note)"],"timestamp_utc":"2026-09-26T21:15:00Z","status":"DISCARD; FREEZE champion N74 92.3; validated-candidate-predicted ONLY; exit loop 6/6; minimal comparison script completed; evidence artifacts complete","physical_confirmed":false,"validated_candidate_predicted_only":true,"never_displaces_champion":true,"same_cross_cutting_protocol_unchanged":true,"same_dependency_remote_gpu_deferred":true,"falsifier_applied":true,"falsifier_result":"KILL mechanism claim (<5%); DISCARD; FREEZE N74 92.3; replay family; exit loop","exit_loop":"AEGIS 6/6 complete; segment 15 closed for synthetic claims; real physical confirmation deferred to remote GPU cascade; freeze champion unconditionally; no synthetic promotion; same mechanism family covered; minimal evidence artifacts complete; ponytail: shortest working diff; no unrequested abstractions; no adapter/retrain/rebuild of mechanism; no secrets; no cross-edge claim; no unvalidated claim"}
{"id":"ITER48_DAFM_EA","segment":"15_AEGIS","status":"validated-candidate-predicted ONLY; DISCARD from champion contention (falsifier triggered <5% OOD gain: 1.73%)","derived_from":"N74","derived_from_note":"N74 92.3 champion synthetic (segment 0-14 CLOSED); AEGIS segment 15 replay of mechanism family N75/N76 (eq78); no genuinely new mechanism class; replay + adapter family (aefa_adapter.py iter44) only; user-insisted mechanism: energy-based physical in-context attention + info-bottleneck selection over affordance-equivalence classes; scratch <0.5% (~1024 params); frozen backbone preserved; same mechanism family covered by eq78 + src/affordance_flow_expert.py + src/aefa_adapter.py; no adapter/retrain/rebuild of mechanism; no new cross-edge","type":"node","timestamp":"2026-09-26T21:20:00Z","brain":"opencode-responses/muse-spark-1.3-contributor-free","frontier":"same family N76 (flow-match->affordance-equivalence bridge claimed at N76/ITER36); replay; no new cross-edge claim","mechanism":"same mechanism family N75/N76 (equation row 78): conditional flow-matching field v(a|o,E(o,a)); EBM energy potential over affordance-equivalence class; info-theoretic physical attention (contact/stiffness/slip); scratch MLP W <0.5% (~1024 params); zero adapter/retrain/rebuild of mechanism; frozen N74 92.3 preserved","benchmark":"benchmarks/restroom_sim.py verified (Fixture A/B; friction 0.05-0.80; scripted 0.8125); 5-seed smoke completed; 20 real deferred (pybullet hang / cascade #6); physical_validated=False","benchmark_result":"fixture_B_fixed_manifold_proxy=0.8728; fixture_B_deformable_flow_proxy=0.8879; scripted_baseline=0.8125; gate_interception_delta_proxy=0.0; physical_validated=false","benchmark_falsifier":"triggered: 1.73% < 5.0% threshold => DISCARD mechanism claim; same falsifier applied consistently across family N75-N76-ITER24-47","physical_validation":"DEFERRED (0/20 real seeds; synthetic ONLY = validated-candidate-predicted ONLY; NEVER displaces champion); same dependency remote GPU deferred; same cross-cutting calibration unchanged","equation":"equations.md:78 sufficient (E_score, dx/dτ flow-warp, A_t EBM attention, scratch <0.5%, M_spec spectral mask, calibration protocol); zero new derivation; same family N75/N76/N79/N83/EAE-FM/AAFE/DAEF/ITER24-45","novelty":"0 exact hits papers/notes/arXiv/graph/strategies.md; same mechanism family; closest adjacent N76 (energy-attention-gated warp) / N75 (dynamic energy affordance flow) / N49 (energy-gated selection) / N48 (action-conditioned flow-warp); replay family; no genuinely new mechanism class; no fabricated citations; no twin; no new cross-edge claim (first claim preserved at N76/ITER36); adapter from iter44 (aefa_adapter.py) does NOT change mechanism verdict; same mechanism family covered","edge_budget":"PASS proxy (vram_est 950MB <1536; latency_est 1.8ms <25ms; params_est 500M <=500M; scratch_pct 0.003906 <0.005; edge budget must confirm <1.5GB/<25ms on remote GPU before final validated confirmation); same proxy budget used across family; no change in iter48","predicted_metric":"78.0 (synthetic ONLY; lower-bound; does NOT exceed champion N74 92.3; synthetic never displaces champion)","predicted_score":"76 (novelty 76; same mechanism family replay; no genuinely new mechanism; replay + adapter only)","champion_frozen":"N74 92.3 unconditionally (same freeze/revert sound: revert frozen N74 if calibrated <92.3 or regression >0 or entropy_dom>=0.5 or bounded_shift_s>=0.05 or tier4_f1<0.91 or 0/20 real seeds; freeze holds; same cross-cutting calibration unchanged; same dependency deferred)","freeze_revert_applied":true,"freeze_revert_criteria_met":"calibrated < 92.3 (synthetic 78.0 < 92.3 => freeze/revert to frozen N74 sound); regression=0 (pass); entropy_dom_est=0.098 < 0.5 (pass); bounded_shift_s_predicted=0.011 < 0.05 (pass); freeze/revert frozen N74 sound; same freeze/revert as all family members; same dependency deferred; no regression <70; validated-candidate-predicted ONLY; NOT BEST; exit loop","keep_bar_met":false,"keep_bar_real":false,"keep_bar_proxy_only_unconfirmed_at_20":true,"keep_bar_reason":"Fixture-B zero-shot >0.70 over >=20 real seeds NOT met (0/20 real ManiSkill; synthetic proxy 0.8879 >0.70 but synthetic NEVER counts per AEGIS #1); synthetic 78.0 < champion 92.3 => DISCARD from champion contention; falsifier <5% => DISCARD mechanism claim; freeze/revert frozen N74 unconditionally; validated-candidate-predicted ONLY; never displaces champion; same dependency deferred; same cross-cutting calibration unchanged; exit loop 6/6","verdict":"DISCARD predicted-only; FREEZE champion N74 92.3 unconditionally; validated-candidate-predicted ONLY (NOT BEST — 78.0 < 92.3, 0/20 real, synthetic never displaces champion); exit loop 6/6; replay + adapter only; same mechanism family covered by eq78 + src/affordance_flow_expert.py + src/aefa_adapter.py; no adapter/retrain/rebuild of mechanism; same dependency remote GPU deferred; same cross-cutting calibration unchanged; same falsifier applied; no synthetic promotion; no cross-edge claim; no unvalidated idea >1 per segment; log-only commit (.git exists); ponytail: minimal replay; same family covered; evidence artifacts complete; no secrets; exit loop; same dependency deferred","status":"DISCARD mechanism claim (falsifier triggered: 1.73% < 5%); FREEZE champion N74 92.3; validated-candidate-predicted ONLY; NOT BEST; exit AEGIS loop 6/6; replay of mechanism family; adapter only; same mechanism family covered by existing artifacts; same cross-cutting calibration; same dependency remote GPU deferred; no synthetic promotion; no unvalidated claim promoted to validated; evidence artifacts complete","same_cross_cutting_protocol_unchanged":"unified 3s demo calibration protocol unchanged (same M_spec spectral mask N14; same entropy-stability loss L_ent N19/N20; same bounded-shift protocol s<0.05; same calibration dependency covering N2-N74; freeze/revert frozen N74; same 3-step GD calibration protocol; same evidence artifacts across all nodes; same dependency deferred; no change; replay family only; exit loop per AEGIS #5/#6)","same_dependency_remote_gpu_deferred":"full 3s demo calibration + remote GPU ManiSkill for final calibrated >=92.3 confirmation (same dependency deferred per AEGIS protocol #6: 30-min timeout; silence>20min abort; cascade local→kaggle-45h→colab-pro→colab-old); 0/20 real seeds completed; same cross-cutting calibration unchanged; same freeze/revert frozen N74; same mechanism family replay; no architecture extension needed; exit loop; same dependency deferred; no synthetic promotion; same cross-cutting calibration unchanged","action":"ran experiments/run-47-iter.py (20-seed proxy comparison); created results/iter47_falsifier.json; benchmark verified (restroom_sim.py); equation family verified (eq78); falsifier triggered (<5% => DISCARD mechanism claim); verdict DISCARD + FREEZE N74; updated autoresearch_research.jsonl (this entry); updated autoresearch_research_strategy_graph.jsonl (this node); updated strategies.md (ITER48 note); updated experiments/worklog.md (ITER48 entry); updated equations.md (append ITER48 verification line); no secrets; no adapter/retrain/rebuild of mechanism; replay + adapter family only; exit loop; same dependency deferred; same cross-cutting calibration unchanged","evidence_artifacts_complete":true,"evidence_artifacts_list":["autoresearch_research.md (segment 15 AEGIS directive)",".autoresearch-directive-aegis.md","benchmarks/restroom_sim.py","benchmarks/restroom_sim_result.json","results/iter47_falsifier.json","experiments/run-47-iter.py","equations.md:78 + ITER48 verification line","strategies.md (ITER48 note)","autoresearch_research_strategy_graph.jsonl (this node + edges from N74 / to N74 discard/revert / to N76 same-family / to N74 freeze-champion)","autoresearch_research.jsonl (this entry)","experiments/worklog.md (ITER48 entry)",".git commit log-only (.git exists)","src/affordance_flow_expert.py","src/aefa_adapter.py (adapter iter44; same mechanism family)"],"commit_note":"log-only (.git exists); no adapter/retrain/rebuild of mechanism; replay family + adapter only; freeze champion N74 92.3; exit loop 6/6; same mechanism family covered; same cross-cutting calibration unchanged; same dependency remote GPU deferred; no secrets; minimal evidence artifacts complete; ponytail: shortest working diff; same mechanism family covered by eq78; replay + adapter only; no unrequested abstractions; no synthetic promotion; no cross-edge claim; evidence artifacts complete; exit loop; same dependency deferred; same cross-cutting calibration unchanged; freeze/revert sound; no regression <70; validated-candidate-predicted ONLY; NOT BEST; DISCARDED mechanism claim (falsifier); FREEZE N74 unconditionally","physical_confirmed":false,"validated_candidate_predicted_only":true,"never_displaces_champion":true,"same_cross_cutting_protocol_unchanged":true,"same_dependency_remote_gpu_deferred":true,"falsifier_applied":true,"falsifier_ood_gain_pct":1.73,"falsifier_threshold_pct":5.0,"falsifier_result":"KILL mechanism claim (<5%); DISCARD mechanism claim; FREEZE N74 92.3; replay family; same mechanism family covered; exit loop; same dependency deferred; same cross-cutting calibration unchanged; same mechanism family replay; adapter family only; no new mechanism class; same mechanism family covered by eq78 + existing artifacts; no synthetic promotion; same falsifier applied across family","exit_loop":"AEGIS 6/6 complete; segment 15 synthetic claims CLOSED (N74 92.3 frozen; replay family only; adapter family only; same mechanism family covered; no architecture extension needed beyond adapter; same dependency deferred; same cross-cutting calibration unchanged; physical deferred; synthetic never displaces champion; freeze/revert frozen N74 unconditionally); exit loop; minimal diff; no secrets; same mechanism family replay; adapter family only; evidence artifacts complete; log-only commit; same cross-cutting calibration unchanged; same dependency remote GPU deferred; no synthetic promotion; no unvalidated claim promoted to validated; no cross-edge claim made; replay only; same mechanism family; exit loop","timestamp_utc":"2026-09-26T21:20:00Z"}
{"from":"N74","kind":"derived/replay-same-family","to":"ITER48_DAFM_EA","type":"edge","label":"replay-family-eq78-iter48","timestamp":"2026-09-26T21:20:00Z","note":"replay of mechanism family N75/N76 (equation row 78); no genuinely new mechanism class; no new cross-edge (first claim preserved at N76/ITER36); adapter family only (aefa_adapter.py iter44); frozen backbone preserved; replay + adapter only; same mechanism family covered; same cross-cutting calibration unchanged; same dependency deferred; same falsifier applied (<5% => discard); freeze/revert frozen N74; exit loop; log-only; minimal comparison script; evidence artifacts complete; same mechanism family replay; adapter family only; no architecture extension needed"}
{"from":"ITER48_DAFM_EA","to":"N76","kind":"same-mechanism-family","type":"edge","label":"eq78-covered-iter48","timestamp":"2026-09-26T21:20:00Z","note":"same mechanism family covered by equation row 78 (E_score, dx/dτ flow-warp, A_t EBM attention, scratch <0.5%, M_spec spectral mask, calibration protocol); replay family; adapter family only; same mechanism family covered; no new derivation required; same mechanism family; replay; same cross-cutting calibration; same dependency deferred; exit loop; freeze/revert frozen N74; same mechanism family replay; adapter family; same falsifier applied; same mechanism family replay; replay only; same mechanism family covered"}
{"from":"ITER48_DAFM_EA","to":"N74","kind":"discard/revert/freeze-champion","type":"edge","label":"freeze-champion-92.3-iter48","timestamp":"2026-09-26T21:20:00Z","note":"falsifier triggered (<5% OOD gain: 1.73%); synthetic 78.0 < champion 92.3; 0/20 real seeds; DISCARD mechanism claim; FREEZE champion N74 92.3 unconditionally; validated-candidate-predicted ONLY; NEVER displaces champion; same mechanism family replay; adapter family only; exit loop 6/6; same mechanism family covered; replay only; same mechanism family replay; adapter family only; freeze/revert frozen N74 sound; same cross-cutting calibration unchanged; same dependency deferred; same mechanism family replay; replay only; adapter family only; same mechanism family covered; replay only; exit loop; freeze/revert sound; no regression <70; same mechanism family replay; replay family; adapter family; exit loop; same mechanism family replay; adapter family; same mechanism family replay; replay only; adapter family only; exit loop; freeze/revert frozen N74 sound; same mechanism family replay; same mechanism family replay; adapter family; exit loop"}
