{"run": 250, "segment": 15, "idea": "N58", "status": "discard", "metric": 1.0, "metric_class": "physical_fixture_B_transfer_success", "timestamp_utc": "2026-09-29T12:30:00Z", "rig": "canonical rig experiments/kaggle_aegis_sweep.py (PyBullet DIRECT, system python3, 20 seeds x 3 suites x 2 paired arms, rig v2); coverage_cont/success from physics contacts at return time; ZERO rig edits", "command": "timeout 1200 python3 experiments/kaggle_aegis_sweep.py --seeds 20 --no-upload --path trochoid --compare trochoid --compare-env AEGIS_ROW_CENTRE=0.0 --suites fixture_A,fixture_B,fixture_R --out results/aegis_v2/R250_frozen_n00.jsonl", "compare_champion": "in-rig --compare trochoid --compare-env AEGIS_ROW_CENTRE=0.0 on SAME 20 seeds; candidate B 1.0000 vs frozen 0.9453, Welch p=5.26e-06, keep=true; 120/120 scored fields bit-identical to run 249 arm", "description": "N58 OA-EA-FACC (online-adaptive energy-attention FACC + 8-contact info-gain gating, live manifold refit) ADJUDICATED NOT EXECUTED; frozen-champion no-regression confirmation instead. DISCARD.", "metrics": {"idea": "N58", "lane": "CPU canonical rig", "metric_name": "transfer_success", "fixture_B_transfer_success": 1.0, "frozen": {"A": "1.0000 vs 0.9354 p=1.35e-09", "B": "1.0000 vs 0.9453 p=5.26e-06", "R": "1.0000 vs 0.9427 p=1.24e-06", "keep": true}, "adjudication": ["G3 retires energy-gated/manifold re-derivations; this is the 8th (runs 234-241,248,249 precedent)", "G4-unpairable: force-driven foam head, no policy/head/demo keypoints, no --compare record possible for attention-gated refit", "cites N56 win but run 247 is INVALID (evidence file missing, banned metric class) per run-248 audit", "predicts 97.5pts keep on banned novelty_score class; SEGMENT freeze bans novelty_score keeps", "FACC line closed 2x on physical data (r232 all-reject, r233 78/78 infeasible)", "queue exhausted: all S1/v4 ideas have paired deciders (I20 r241, I3 r242, I22 r243, I4 r244, I6 r245); run 248 already ran the 0.02,4/0.03,6 noise pair"], "harness_errors": 0, "g7_clean": true, "synthetic_proxy": null}, "director_build_adjudicated": "Director iter-5 N58 OA-EA-FACC ADJUDICATED NOT EXECUTED on the six grounds in metrics.adjudication. Lowest-numbered queued idea: none (queue exhausted); ran frozen-champion no-regression confirmation.", "evidence": ["results/aegis_v2/R250_frozen_n00.jsonl"], "equations": "none (retired family, no equation changed)", "graph": "N216-next->N217-N58->N218-next"}
{"run": 251, "segment": 15, "idea": "N59", "status": "discard", "metric": 1.0, "metric_class": "physical_fixture_B_transfer_success", "timestamp_utc": "2026-09-29T13:00:00Z", "rig": "canonical rig experiments/kaggle_aegis_sweep.py (PyBullet DIRECT, system python3, 20 seeds x 3 suites x 2 paired arms, rig v2); coverage_cont/success from physics contacts at return time; ZERO rig edits", "command": "timeout 1200 python3 experiments/kaggle_aegis_sweep.py --seeds 20 --no-upload --path trochoid --compare trochoid --compare-env AEGIS_ROW_CENTRE=0.0 --suites fixture_A,fixture_B,fixture_R --out results/aegis_v2/R251_frozen_n00.jsonl", "compare_champion": "in-rig --compare trochoid --compare-env AEGIS_ROW_CENTRE=0.0 on SAME 20 seeds; candidate B 1.0000 vs frozen 0.9453, Welch p=5.26e-06, keep=true; 120/120 scored fields identical to run 250 arm (header ts jitter only)", "description": "N59 EA-FACC-Lite (frozen pi0 + post-hoc single-contact energy-gated refit, no attention/trochoid) ADJUDICATED NOT EXECUTED; frozen-champion no-regression confirmation instead. DISCARD.", "metrics": {"idea": "N59", "lane": "CPU canonical rig", "metric_name": "transfer_success", "fixture_B_transfer_success": 1.0, "frozen": {"A": "1.0000 vs 0.9354 p=1.35e-09", "B": "1.0000 vs 0.9453 p=5.26e-06", "R": "1.0000 vs 0.9427 p=1.24e-06", "keep": true}, "adjudication": ["G3 retires energy-gated/manifold re-derivations; this is the 9th (runs 234-241,248,249,250 precedent); stripping 8 contacts to 1 does not un-retire the family", "G4-unpairable: rig grep confirms ZERO energy/refit/facc/attention/manifold code paths; no --compare record possible for a contact-energy gate without rig edits, and rig edits adding a synthetic gate = fabrication per G7", "requested 0.02,4/0.03,6 frozen-vs-lite pair already answered by run 248 (row-centred vs frozen, keep=false both); lite adds no executable delta, so the falsifier triggers trivially: B_delta undefined on this rig, gate fires 0% (no gate exists) < 10% -> fixed-manifold assumption holds per director falsifier -> FACC line stays killed", "cites R248 correctly but R248 kept nothing; predicts B 0.85 at 0.03,6 with no mechanism to produce it", "FACC line closed 2x on physical data (r232 all-reject, r233 78/78 infeasible)", "queue exhausted: all S1/v4 ideas have paired deciders (I20 r241, I3 r242, I22 r243, I4 r244, I6 r245)"], "harness_errors": 0, "g7_clean": true, "synthetic_proxy": null}, "director_build_adjudicated": "Director iter-6 N59 EA-FACC-Lite ADJUDICATED NOT EXECUTED on the six grounds in metrics.adjudication. Lowest-numbered queued idea: none (queue exhausted); ran frozen-champion no-regression confirmation.", "evidence": ["results/aegis_v2/R251_frozen_n00.jsonl"], "equations": "none (retired family, no equation changed)"}
{"run": 252, "commit": "pending", "segment": 15, "metric": 1.0, "metrics": {"idea": "N60", "fixture_A": 1.0, "fixture_B": 1.0, "fixture_R": 1.0, "coverage_cont_B": 1.0, "welch_p_B": 5.26e-06, "fisher_p_B": 1.0, "keep_record": true, "synthetic_proxy": null}, "status": "discard", "description": "N60 SAV-Probe (frozen pi0 SE(3) affordance-violation probe, no refit/attention) ADJUDICATED NOT EXECUTED; frozen-champion confirmation instead. G3-retired FACC gateway (10th re-derivation; FACC closed r232/r233); G4-unpairable (rig has no pi0/action-expert/residual; checkpoint downloads banned); metric correlation(r) != transfer_success (frozen). 20 seeds x 3 suites x 2 arms, 0 harness errors, 8.5s: B 0.9453->1.0000 Welch p 5.26e-06 keep=true; 120/120 fields identical to runs 249-251. Frontier unchanged: Tier-2 registration beyond 0.01,2 (I9); force-compliance floor (I11). Evidence: results/aegis_v2/R252_frozen_n00.jsonl."}
{"run": 253, "commit": "pending", "segment": 15, "metric": 1.0, "metrics": {"idea": "N61", "fixture_A": 1.0, "fixture_B": 1.0, "fixture_R": 1.0, "coverage_cont_B": 1.0, "welch_p_B": 5.26e-06, "fisher_p_B": 1.0, "keep_record": true, "synthetic_proxy": null}, "status": "discard", "description": "N61 FACC-1C (frozen pi0 + single-contact energy-gated trochoid override, no attention/live refit) ADJUDICATED NOT EXECUTED; frozen-champion confirmation instead. G3-retired energy-gated/manifold family (11th re-derivation; stripping N58 8-contact/attention/live-refit to 1-contact/open-loop does not un-retire it; FACC closed r232/r233); G4-unpairable (force-driven foam head, no pi0/action-head/contact-energy keypoints, no --compare record possible; rig edits adding a gate = fabrication per G7); N61 falsifier triggers trivially (override rate 0%, no gate exists; B_delta undefined). 20 seeds x 3 suites x 2 arms, 0 harness errors, 8.7s: B 0.9453->1.0000 Welch p 5.26e-06 keep=true; summary/compare stats identical to runs 249-252 (episode wall_s jitter only, scored metrics unaffected). Frontier unchanged: Tier-2 registration beyond 0.01,2 (I9); force-compliance floor (I11). Evidence: results/aegis_v2/R253_frozen_n00.jsonl."}
{"run": 254, "commit": "pending", "segment": 15, "metric": 1.0, "metrics": {"idea": "N63", "lane": "CPU", "metric_name": "transfer_success", "fixture_A": 1.0, "fixture_B": 1.0, "fixture_R": 1.0, "coverage_cont_B": 1.0, "welch_p_B": 5.26e-06, "fisher_p_B": 1.0, "keep_record": true, "frozen": true, "adjudication": "not-executed", "harness_errors": 0, "g7_clean": true, "synthetic_proxy": null}, "status": "discard", "description": "N63 FACC-LiveAttn (trainable energy attention + live refit, LoRA-r8 action-expert, frozen VLM, 1-head SE3 force-energy attention) ADJUDICATED NOT EXECUTED; frozen-champion confirmation instead. G3-retired energy-gated/manifold family (12th re-derivation; LoRA rank / 1-head / live-refit strip-down does not un-retire it; FACC closed r232/r233); G4-unpairable (force-driven rig has no pi0/action-expert/LoRA/attention/refit paths, no VLM weights; rig edits adding a gate = fabrication per G7); kill triggers trivially (no gate exists so override rate 0%, +10pts over frozen unmeasurable; violation split already run as I5ext run 248 DISCARD). 20 seeds x 3 suites x 2 arms, 0 harness errors, ~12s: B 0.9453->1.0000 Welch p 5.26e-06 keep=true; 120/120 scored fields bit-identical to run 253. Frontier unchanged: Tier-2 registration beyond 0.01,2 (I9); force-compliance floor (I11). Evidence: results/aegis_v2/R254_frozen_n00.jsonl."}
{"run": 255, "segment": 15, "idea": "N64", "status": "discard", "metric": 1.0, "metric_class": "physical_fixture_B_transfer_success", "timestamp_utc": "2026-09-29T17:35:00Z", "rig": "canonical rig experiments/kaggle_aegis_sweep.py (PyBullet DIRECT, system python3, 20 seeds x 3 suites x 2 paired arms, rig v2); coverage_cont/success from physics contacts at return time; ZERO rig edits", "command": "timeout 1200 python3 experiments/kaggle_aegis_sweep.py --seeds 20 --no-upload --path trochoid --compare trochoid --compare-env AEGIS_ROW_CENTRE=0.0 --suites fixture_A,fixture_B,fixture_R --out results/aegis_v2/R255_frozen_n00.jsonl", "compare_champion": "in-rig --compare trochoid --compare-env AEGIS_ROW_CENTRE=0.0 on SAME 20 seeds; candidate B 1.0000 vs frozen 0.9453, Welch p=5.26e-06, keep=true; 120/120 scored fields bit-identical to run 254 arm", "description": "N64 FACC-FrozenGate (frozen pi0 + analytic SE(3) energy veto, 0 trainable params) ADJUDICATED NOT EXECUTED; frozen-champion no-regression confirmation instead. DISCARD.", "metrics": {"idea": "N64", "lane": "CPU canonical rig", "metric_name": "transfer_success", "fixture_A": 1.0, "fixture_B": 1.0, "fixture_R": 1.0, "coverage_cont_B": 1.0, "welch_p_B": 5.26428e-06, "fisher_p_B": 1.0, "keep_record": true, "frozen": true, "adjudication": "not-executed", "harness_errors": 0, "g7_clean": true, "synthetic_proxy": null}, "evidence": ["results/aegis_v2/R255_frozen_n00.jsonl"]}
{"run": 256, "segment": 15, "idea": "N66", "status": "discard", "metric": 1.0, "metric_class": "physical_fixture_B_transfer_success", "timestamp_utc": "2026-09-29T18:00:00Z", "rig": "canonical rig experiments/kaggle_aegis_sweep.py (PyBullet DIRECT, system python3, 20 seeds x 3 suites x 2 paired arms, rig v2); coverage_cont/success from physics contacts at return time; ZERO rig edits", "command": "timeout 1200 python3 experiments/kaggle_aegis_sweep.py --seeds 20 --no-upload --path trochoid --compare trochoid --compare-env AEGIS_ROW_CENTRE=0.0 --suites fixture_A,fixture_B,fixture_R --out results/aegis_v2/R256_frozen_n00.jsonl", "compare_champion": "in-rig --compare trochoid --compare-env AEGIS_ROW_CENTRE=0.0 on SAME 20 seeds; candidate B 1.0000 vs frozen 0.9453, Welch p=5.26e-06, keep=true; 120/120 scored fields bit-identical to run 255 arm", "description": "N66 FACC-DeformGate (frozen pi0 + deformable affordance gate, 1-head SE3 force-energy gate ~50k trainable, k=3 contact trochoid basis, analytic prior + learned gate) ADJUDICATED NOT EXECUTED; frozen-champion no-regression confirmation instead. DISCARD.", "metrics": {"idea": "N66", "lane": "CPU canonical rig", "metric_name": "transfer_success", "fixture_A": 1.0, "fixture_B": 1.0, "fixture_R": 1.0, "coverage_cont_B": 1.0, "welch_p_B": 5.26428e-06, "fisher_p_B": 1.0, "keep_record": true, "frozen": true, "adjudication": "not-executed", "harness_errors": 0, "g7_clean": true, "synthetic_proxy": null}, "director_build_adjudicated": "Director iter-11 N66 FACC-DeformGate ADJUDICATED NOT EXECUTED: (1) G3-retired energy-gated/manifold/deformable family (14th re-derivation; dropping LoRA-r8/live-refit/single-contact/0-param veto does not un-retire it; FACC closed r232/r233); (2) G4-unpairable (force-driven foam head, no pi0/VLM/action-expert/contact-energy keypoints; checkpoint downloads banned; rig edits adding a gate = fabrication per G7); (3) predicts 74pts KEEP on banned novelty_score class; SEGMENT+METRIC FREEZE bans novelty_score keeps; soft/adaptive/learned gate variants banned from keeps; Tier-4 gate stays HARD; (4) requested stiffness/geometry-shift + gate on/off + 1-vs-3-contact ablation already answered by I5ext run 248 (row-centred vs frozen at 0.02,4/0.03,6, keep=false both) and I19 run 240 (0 scrub-phase vetoes in 120 eps); (5) queue exhausted: all S1/v4 ideas have paired deciders (I20 r241, I3 r242, I22 r243, I4 r244, I6 r245). Lowest-numbered queued idea: none (I12 blocked on I8 BLOCKED/unblock-exhausted).", "evidence": ["results/aegis_v2/R256_frozen_n00.jsonl"], "equations": "none (retired family, no equation changed)", "graph": "N223-next->N223-N66->N224-next"}
{"run": 257, "segment": 15, "idea": "N67", "status": "discard", "metric": 1.0, "metric_class": "physical_fixture_B_transfer_success", "timestamp_utc": "2026-09-29T18:30:00Z", "rig": "canonical rig experiments/kaggle_aegis_sweep.py (PyBullet DIRECT, system python3, 20 seeds x 3 suites x 2 paired arms, rig v2); coverage_cont/success from physics contacts at return time; ZERO rig edits", "command": "timeout 1200 python3 experiments/kaggle_aegis_sweep.py --seeds 20 --no-upload --path trochoid --compare trochoid --compare-env AEGIS_ROW_CENTRE=0.0 --suites fixture_A,fixture_B,fixture_R --out results/aegis_v2/R257_frozen_n00.jsonl", "compare_champion": "in-rig --compare trochoid --compare-env AEGIS_ROW_CENTRE=0.0 on SAME 20 seeds; candidate B 1.0000 vs frozen 0.9453, Welch p=5.26e-06, keep=true; 120/120 scored fields bit-identical to run 256 arm", "description": "N67 FACC-FreeManifold (frozen pi0 + deformable affordance manifold + info-theoretic SE3 free-energy attention, 55k trainable) ADJUDICATED NOT EXECUTED; frozen-champion no-regression confirmation instead. DISCARD.", "metrics": {"idea": "N67", "lane": "CPU canonical rig", "metric_name": "transfer_success", "fixture_A": 1.0, "fixture_B": 1.0, "fixture_R": 1.0, "coverage_cont_B": 1.0, "welch_p_B": 5.26428e-06, "fisher_p_B": 1.0, "keep_record": true, "frozen": true, "adjudication": "not-executed", "harness_errors": 0, "g7_clean": true, "synthetic_proxy": null}, "director_build_adjudicated": "Director iter-12 N67 FACC-FreeManifold ADJUDICATED NOT EXECUTED: (1) G3-retired energy-gated/manifold/deformable/free-energy family (15th re-derivation; force-history warp DeltaT(SE3)=f(F/T) + 55k 1-head SE3 gate does not un-retire it; FACC closed r232/r233); (2) G4-unpairable (force-driven foam head, no VLM/pi0/action-expert/contact-energy keypoints; checkpoint downloads banned; rig edits adding manifold/gate = fabrication per G7); (3) predicts 72.5pts KEEP on banned novelty_score class; SEGMENT+METRIC FREEZE bans novelty_score keeps; soft/adaptive/learned gate variants banned from keeps; Tier-4 gate stays HARD; (4) requested stiffness/SE3-shift insertion split already answered by I5ext run 248 (DISCARD, keep=false both noises) and I19 run 240 (0 scrub-phase vetoes in 120 eps); N66 static-gate kill-rule comparison already covered; (5) queue exhausted: all S1/v4 ideas have paired deciders (I20 r241, I3 r242, I22 r243, I4 r244, I6 r245). Lowest-numbered queued idea: none (I12 blocked on I8 BLOCKED/unblock-exhausted).", "evidence": ["results/aegis_v2/R257_frozen_n00.jsonl"], "equations": "none (retired family, no equation changed)", "graph": "N224-next->N224-N67->N225-next"}
{"run": 258, "segment": 15, "idea": "N68", "status": "discard", "metric": 1.0, "metric_class": "physical_fixture_B_transfer_success", "timestamp_utc": "2026-09-29T18:30:00Z", "rig": "canonical rig experiments/kaggle_aegis_sweep.py (PyBullet DIRECT, system python3, 20 seeds x 3 suites x 2 paired arms, rig v2); coverage_cont/success from physics contacts at return time; ZERO rig edits", "command": "timeout 1200 python3 experiments/kaggle_aegis_sweep.py --seeds 20 --no-upload --path trochoid --compare trochoid --compare-env AEGIS_ROW_CENTRE=0.0 --suites fixture_A,fixture_B,fixture_R --out results/aegis_v2/R258_frozen_n00.jsonl", "compare_champion": "in-rig --compare trochoid --compare-env AEGIS_ROW_CENTRE=0.0 on SAME 20 seeds; candidate B 1.0000 vs frozen 0.9453, Welch p=5.26e-06, keep=true; 120/120 scored fields bit-identical to run 257 arm", "description": "N68 FACC-FlowReuse (frozen pi0 + force-conditioned flow-velocity as affordance deformer, no external gate, ~35k trainable, predicted 74) ADJUDICATED NOT EXECUTED; frozen-champion no-regression confirmation instead. DISCARD.", "metrics": {"idea": "N68", "lane": "CPU canonical rig", "metric_name": "transfer_success", "fixture_A": 1.0, "fixture_B": 1.0, "fixture_R": 1.0, "coverage_cont_B": 1.0, "welch_p_B": 5.26428e-06, "fisher_p_B": 1.0, "keep_record": true, "frozen": true, "adjudication": "not-executed", "harness_errors": 0, "g7_clean": true, "synthetic_proxy": null}, "director_build_adjudicated": "Director iter-13 N68 FACC-FlowReuse ADJUDICATED NOT EXECUTED: (1) G3-retired flow-bridge/manifold/deformable family (16th re-derivation; reusing pi0 flow head instead of a new gate does not un-retire it; FACC closed r232/r233); (2) G4-unpairable (force-driven foam head, no pi0/flow head/velocity field; no --compare record possible; rig edits adding flow-velocity deformer = fabrication per G7); (3) predicts 74pts KEEP on banned novelty_score class; SEGMENT+METRIC FREEZE bans novelty_score keeps; (4) contact-slip/SE(3)-perturb/frozen-parity validation already answered by I22 r243 + I5ext r248 + I19 r240; (5) queue exhausted: all S1/v4 ideas have paired deciders", "evidence": ["results/aegis_v2/R258_frozen_n00.jsonl"]}
{"run": 259, "segment": 15, "idea": "N69", "status": "discard", "metric": 1.0, "metric_class": "physical_fixture_B_transfer_success", "timestamp_utc": "2026-09-29T19:00:00Z", "rig": "canonical rig experiments/kaggle_aegis_sweep.py (PyBullet DIRECT, system python3, 20 seeds x 3 suites x 2 paired arms, rig v2); coverage_cont/success from physics contacts at return time; ZERO rig edits", "command": "timeout 1200 python3 experiments/kaggle_aegis_sweep.py --seeds 20 --no-upload --path trochoid --compare trochoid --compare-env AEGIS_ROW_CENTRE=0.0 --suites fixture_A,fixture_B,fixture_R --out results/aegis_v2/R259_frozen_n00.jsonl", "compare_champion": "in-rig --compare trochoid --compare-env AEGIS_ROW_CENTRE=0.0 on SAME 20 seeds; candidate B 1.0000 vs frozen 0.9453, Welch p=5.26e-06, keep=true; 120/120 scored fields bit-identical to run 258 arm", "description": "N69 FACC-FixedBias (frozen pi0 + fixed affordance + SE3 force-energy attention bias, zero geometry warp, ~38k trainable, predicted 73) ADJUDICATED NOT EXECUTED; frozen-champion no-regression confirmation instead. DISCARD.", "metrics": {"idea": "N69", "lane": "CPU canonical rig", "metric_name": "transfer_success", "fixture_A": 1.0, "fixture_B": 1.0, "fixture_R": 1.0, "coverage_cont_B": 1.0, "welch_p_B": 5.26428e-06, "fisher_p_B": 1.0, "keep_record": true, "frozen": true, "adjudication": "not-executed", "harness_errors": 0, "g7_clean": true, "synthetic_proxy": null}, "director_build_adjudicated": "Director iter-14 N69 FACC-FixedBias ADJUDICATED NOT EXECUTED: (1) G3-retired energy-gated/manifold/flow-bridge family (17th re-derivation; attention-logit-bias-only strip-down does not un-retire it; FACC closed r232/r233); (2) G4-unpairable (force-driven foam head, no pi0/cross-attn/velocity field; rig edits adding bias = fabrication per G7); (3) predicts 73pts KEEP on banned novelty_score class; violation split already run 248 DISCARD; queue exhausted (I12 blocked on I8).", "evidence": "results/aegis_v2/R259_frozen_n00.jsonl"}
{"run": 260, "segment": 15, "idea": "N70", "status": "discard", "metric": 1.0, "metric_class": "physical_fixture_B_transfer_success", "timestamp_utc": "2026-09-29T19:30:00Z", "rig": "canonical rig experiments/kaggle_aegis_sweep.py (PyBullet DIRECT, system python3, 20 seeds x 3 suites x 2 paired arms, rig v2); coverage_cont/success from physics contacts at return time; ZERO rig edits", "command": "timeout 1200 python3 experiments/kaggle_aegis_sweep.py --seeds 20 --no-upload --path trochoid --compare trochoid --compare-env AEGIS_ROW_CENTRE=0.0 --suites fixture_A,fixture_B,fixture_R --out results/aegis_v2/R260_frozen_n00.jsonl", "compare_champion": "in-rig --compare trochoid --compare-env AEGIS_ROW_CENTRE=0.0 on SAME 20 seeds; candidate B 1.0000 vs frozen 0.9453, Welch p=5.26e-06, keep=true; 120/120 scored fields bit-identical to run 259 arm", "description": "N70 FACC-ResidualAct (frozen pi0 + SE(3) 6D wrench residual MLP ~42k trainable post-pi0, predicted 72) ADJUDICATED NOT EXECUTED; frozen-champion no-regression confirmation instead. DISCARD.", "metrics": {"idea": "N70", "lane": "CPU canonical rig", "metric_name": "transfer_success", "fixture_A": 1.0, "fixture_B": 1.0, "fixture_R": 1.0, "coverage_cont_B": 1.0, "welch_p_B": 5.26428e-06, "fisher_p_B": 1.0, "keep_record": true, "frozen": true, "adjudication": "not-executed", "harness_errors": 0, "g7_clean": true, "synthetic_proxy": null}, "director_build_adjudicated": "Director iter-15 N70 FACC-ResidualAct ADJUDICATED NOT EXECUTED: (1) G3-retired energy-gated/manifold/flow-bridge family (18th re-derivation; moving adaptation post-pi0 as SE(3) residual does not un-retire it; FACC closed r232/r233); (2) G4-unpairable (force-driven foam head, no pi0/action-head/wrench keypoints; rig edits adding residual = fabrication per G7); (3) predicts 72pts KEEP on banned novelty_score class; residual-norm risk-kill unmeasurable in rig; queue exhausted (I12 blocked on I8).", "evidence": "results/aegis_v2/R260_frozen_n00.jsonl"}
