{"run": 562, "node": "N562_residual_attribution", "kind": "result", "status": "keep", "segment": 15, "label": "N562: elongated-face registration residual ATTRIBUTED (all three N478d cells FALSIFIED -- top-face band admits exactly the flat face, pi-branch margin 40.9-89.9 deg, ray pitch owns only 1.45x of a 4x cut, XY-noise-0 p50 identical to 0,0; the residual is the frozen mean centroid: bbox-midpoint error exactly 0.0 mm vs centroid 7.71 mm) AND the certified pose-noise wall extended 1.60,320 -> 3.20,640 = 10.0x the original 0.32,64 wall with B=1.00, covc 0.9906, reg_ok 20/20, reg_err p50 flat. D6 CONFIRMED (residual costs nothing on the primary metric), D7 REFUTED (escape channel does not bind; cast-lattice containment does). Also found+annotated a mirrored-frame defect in the N561 diagnostic axis fields (measurement chain only).", "metrics": {"fixture_B_transfer_success": 1.0, "coverage_cont": 0.9906, "seeds": 20, "episodes": 2160, "rig_invocations": 9, "harness_errors": 0, "compare_keep": true, "welch_p": 1.13e-33, "fisher_p": 1.45e-11, "certified_frontier": "3.20,640", "frontier_extension_x": 10.0, "reg_err_xy_p50_mm_frontier": 6.16, "reg_ok_candidate_frontier": "20/20", "D1": "FALSIFIED", "D2": "FALSIFIED", "D3": "REFUTED", "D4": "REFUTED", "D5": "HELD", "D6": "CONFIRMED", "D7": "REFUTED"}, "evidence": ["results/aegis_v2/N562_B4_320640.jsonl", "results/aegis_v2/N562_A1_000.jsonl", "experiments/N562_probe_band.py", "equations.md#N562"], "timestamp": "2026-10-05T04:10:00Z"}
{"from": "N561_N537_force_ceiling", "to": "N562_residual_attribution", "type": "edge", "kind": "attribution", "label": "run 562: queue-empty -> N562 executes run 561 pre-registered-but-unrun N562 block; closes the estimator axis as a certificate (D6) and opens the pose-noise cost frontier above 1.60,320", "run": 562, "timestamp": "2026-10-05T04:10:00Z", "segment": 15}
{"from": "N562_residual_attribution", "to": "N563_reg_est_extent", "type": "edge", "kind": "next", "label": "run 562: the residual is NAMED as the mean-vs-extent-midpoint estimator choice in the TRUNCATION-FREE regime (probe: bbox midpoint exact 0.0 mm, mean off 7.71 mm). N190 and N191 both dosed AEGIS_REG_EST=extent only in the TRUNCATING H=0.35 window where the mean O(sigma) bias dominates; the lattice regime at reg_border_frac 0.0000 has never been dosed", "run": 562, "timestamp": "2026-10-05T04:10:00Z", "segment": 15}
{"node_id": "N198-r563", "parent": "N198", "status": "discard", "frontier": "none", "category": "containment/residual-clip dose", "run": 563, "evidence": "results/aegis_v2/N198_resid_clip_0.02.jsonl", "note": "Identity arm; knob not activated; no delta vs trochoid champion"}
{"from": "N198", "to": "N198-r563", "relation": "explored-dose", "run": 563, "verdict": "discard"}
{"id": "N563", "metric": 0.9875, "parent": "N562", "status": "discard", "strategy": "estimator extent on certified lattice (N478) at 3.20,640; lever dead, payload kept", "timestamp": 1765000000, "type": "node"}
{"from": "N562", "kind": "tested", "to": "N563", "type": "edge"}
{"type": "node", "node_id": "N563_4800", "label": "N563 estimator probe 4.00,800 (truncation-free lattice)", "segment": 15, "status": "discard", "physical_evidence": "results/aegis_v2/N563_4800.jsonl", "key_numbers": {"reg_err_p50_mm": 3.3609, "reg_est_gap_mm": 3.3609, "pose_noise_cfg": "4.00,800"}, "note": "Lever dead; P1 holds; B unchanged."}
{"type": "edge", "from": "N563", "to": "N563_4800", "relation": "probes_next_frontier_cell", "physical": true}
{"type": "node", "id": "N563_extent", "label": "N563 AEGIS_REG_EST=extent on truncation-free lattice (20 seeds, default noise 0,0)", "status": "discard", "idea": "N563", "run": 565, "segment": 15, "physical": true, "evidence": "results/aegis_v2/N563_extent.jsonl", "fixture_B_transfer_success": 1.0, "fixture_B_coverage_cont": 1.0, "compare_keep": false, "compare_fisher_p": 1.0, "compare_welch_p": null, "timestamp": "2026-10-05T04:00:00Z", "note": "Paired tie at 0,0 (mean 1.00 both arms, delta 0, Fisher p=1.0, keep=false). No frontier cell tested; lever dead at certified noise. No arithmetic coverage; no teleport; anchored cleanup performed; synthetic_proxy excluded."}
{"type": "edge", "from": "N562_attribution", "to": "N563_extent", "relation": "next-queued-idea", "label": "run 565: lowest queued N563 executed; physical 20-seed paired decider at 0,0; tie -> discard of lever; payload (lattice containment) kept; no replay; gate untouched; segment 15.", "run": 565, "segment": 15, "physical": true}
{"node": "N563_r566", "idea": "N563", "status": "discard", "run": 566, "evidence": "results/aegis_v2/N563_r566.jsonl", "note": "20-seed paired decider at 0,0; compare keep=False; cert kept (residual removed)", "timestamp": "2026-10-05"}
{"edge": "N563_r566->N563_cert", "from": "N563_r566", "to": "N563_cert", "relation": "certifies_estimator_removed", "run": 566}
{"node": "N563_close_iter567", "idea": "N563", "status": "discard", "run": 567, "segment": 15, "timestamp": "2026-10-05T04:30:00Z", "evidence": "results/aegis_v2/N563_r566.jsonl", "note": "Lowest queued N563 closed; ideas.md done; queue empty; no replay."}
{"from": "N563_r566", "to": "N563_close_iter567", "type": "edge", "relation": "closes_queued", "run": 567, "segment": 15}
{"type":"node","id":"N563_close_568","label":"N563 close confirmation (run 568)","idea":"N563","status":"discard","run":568,"segment":15,"physical":true,"evidence":"results/aegis_v2/N563_r566.jsonl","fixture_B_transfer_success":1.0,"compare_keep":false,"compare_fisher_p":1.0,"timestamp":"2026-10-05T05:00:00Z","note":"Lowest queued N563 fully closed after 566-567; queue empty (N198/N478d open_needs_director); no replay; physical; no banned phrases; no synthetic; anchored kill; timeout respected."}
{"type":"edge","from":"N563_close_iter567","to":"N563_close_568","relation":"confirms_closed","label":"run 568: lowest queued N563 confirmed closed; queue empty; no new queued; director must authorize new axis.","run":568,"segment":15,"physical":true}
{"type": "node", "id": "N478d_r569_screen", "label": "N478d 3-seed screening at 1.60,320 (unvalidated)", "idea": "N478d", "status": "unvalidated", "run": 569, "segment": 15, "physical": true, "evidence": "/tmp/n478d_screen.jsonl", "fixture_B_transfer_success": 0.0, "compare_keep": null, "timestamp": "2026-10-05T00:00:00Z", "note": "Single screening allowed; 20-seed paired decider required next (UNVALIDATED-CAP). No synthetic; no arithmetic coverage; pybullet direct; timeout 1200; anchored kill."}
{"type": "edge", "from": "N478d_r569_screen", "to": "N478d_r570_decider", "label": "next: 20-seed paired vs trochoid (G4)", "idea": "N478d", "segment": 15}
{"node":"N570-empty-queue","idea":"NONE-QUEUED","run":570,"segment":15,"status":"discard","verdict":"queue-empty no queued idea; N563/N477 done; N478d unvalidated (next 20-seed paired)","frontier":"estimator (N453b) certified at 3.20,640 by N562; remaining open = N198/N478d director-owned","edges":[{"from":"N562","to":"N570-empty-queue","label":"certified frontier -> queue empty"},{"from":"N563","to":"N570-empty-queue","label":"lever dead / cert preserved"},{"from":"N478d","to":"N570-empty-queue","label":"unvalidated screening used (run 569); next decider required"}]}
{"id": "AUDIT-571", "metric": 0, "parent": "N562", "status": "audit", "strategy": "queue-empty audit \u00a71/\u00a74: N563 done (discard/cert), N562 KEEP 3.20,640, N198/N478d director-owned, no replay, unvalidated-cap on r569 screening -> must decider next; segment 15 frozen; no physical run", "timestamp": 1791153927.5048783}
{"from": "N562", "kind": "audit", "to": "AUDIT-571", "type": "edge"}
{"kind": "node", "idea": "N478d", "segment": 15, "status": "discard", "run": 572, "predicted_score": 0.0, "benchmark_verified": "results/aegis_v2/N478d_r572_decider.jsonl", "physical_validation": true, "seeds_run": 20, "seeds_required": 20, "notes": "20-seed paired decider at 1.60,320; B=0/20; all OBSTACLE_STALL; reg_ok=false; discard; unvalidated-cap closed; no replay"}
{"from": "N478d_screen_r569", "kind": "edge", "to": "N478d_decider_r572", "type": "unvalidated_cap_decider", "status": "discard", "run": 572, "compare": "trochoid", "p_fisher": null, "metrics": "B_transfer_success=0.0"}
{"node": "N573-audit-empty", "type": "audit", "status": "discard", "idea": "NONE-QUEUED", "segment": 15, "evidence": ["results/aegis_v2/N478d_r572_decider.jsonl"], "timestamp": "2026-10-05T05:15:00Z"}
{"edge": ["N478d", "N573-audit-empty"], "relation": "decider-closed -> audit-empty", "segment": 15, "timestamp": "2026-10-05T05:15:00Z"}
{"node_id":"QUEUE_EMPTY_AUDIT_S2_r574","segment":15,"timestamp":"2026-10-05T05:20:00Z","idea":"QUEUE-EMPTY-AUDIT-S2","status":"discard","physical":false,"metric":"transfer_success","evidence":"autoresearch_research.ideas.md §1; autoresearch_research.jsonl r573-r574; results/aegis_v2/N478d_r572_decider.jsonl","notes":"No queued row; no rig run; champion trochoid B=1.00 p=0.0083; N198/N478d open_needs_director; unvalidated cap respected."}
{"edge":{"from":"N478d_decider_r572","to":"QUEUE_EMPTY_AUDIT_S2_r574"},"relation":"follows_decider","segment":15,"timestamp":"2026-10-05T05:20:00Z","notes":"Audit after N478d 20-seed paired discard; queue empty."}
{"node_id": "QUEUE_EMPTY_POST_R574_r575", "segment": 15, "timestamp": "2026-10-05T05:25:00Z", "idea": "QUEUE-EMPTY-POST-R574", "status": "discard", "physical": false, "metric": "transfer_success", "evidence": "autoresearch_research.ideas.md \u00a71; autoresearch_research.jsonl r575; results/aegis_v2/N478d_r572_decider.jsonl", "notes": "Audit after empty-queue; no queued idea; rig not invoked; champion trochoid B=1.00 p=0.0083; N198/N478d open_needs_director."}
{"edge": {"from": "QUEUE_EMPTY_AUDIT_S2_r574", "to": "QUEUE_EMPTY_POST_R574_r575"}, "relation": "audit_chain", "segment": 15, "timestamp": "2026-10-05T05:25:00Z", "notes": "Sequential audit; no queued idea; no replay; unvalidated cap satisfied."}
{"node_id": "QUEUE_EMPTY_POST_R575_r576", "segment": 15, "timestamp": "2026-10-05T05:30:00Z", "idea": "QUEUE-EMPTY-POST-R575", "status": "discard", "physical": false, "metric": "transfer_success", "evidence": ["autoresearch_research.ideas.md \u00a71", "autoresearch_research.jsonl r576", "results/aegis_v2/N478d_r572_decider.jsonl"], "notes": "Audit after empty-queue; no queued idea; rig not invoked; champion trochoid B=1.00 Fisher p=0.0083 vs raster; N198/N478d open_needs_director."}
{"edge": {"from": "QUEUE_EMPTY_POST_R574_r575", "to": "QUEUE_EMPTY_POST_R575_r576"}, "relation": "audit_chain", "segment": 15, "timestamp": "2026-10-05T05:30:00Z", "notes": "Sequential audit; no queued idea; no replay; unvalidated cap satisfied."}
{"node_id": "AUDIT_577_QUEUE_EMPTY", "timestamp": "2026-10-05T05:35:00Z", "idea": "QUEUE-EMPTY-AUDIT-577", "status": "discard", "segment": 15, "physical": false, "note": "No queued idea in \u00a71 after N563/N477/N478d resolved; N198 open_needs_director; canonical rig not invoked; no replay of G3/N70-N76/I0-I23."}
{"edge_id": "AUDIT_577->N198", "timestamp": "2026-10-05T05:35:00Z", "from": "AUDIT_577_QUEUE_EMPTY", "to": "N198_OPEN_DIRECTOR", "label": "next axis requires director; not queued; no replay", "segment": 15}
{"node_id": "AUDIT_578_QUEUE_EMPTY", "timestamp": "2026-10-05T05:40:00Z", "idea": "NONE-QUEUED", "status": "discard", "segment": 15, "physical": false, "metric": "transfer_success", "evidence": ["autoresearch_research.ideas.md \u00a71 \u00a74", "autoresearch_research.jsonl r578", "results/aegis_v2/N478d_r572_decider.jsonl", "results/aegis_v2/N478d_r569_screen.jsonl"], "notes": "No queued idea; rig not invoked; physical truth preserved; unvalidated cap satisfied (N478d r569+r572); no replay of retired G3/N70-N76/I0-I23; champion trochoid B=1.00 p=0.0083; N198/N478d open_needs_director."}
{"edge_id": "AUDIT_578->N198", "timestamp": "2026-10-05T05:40:00Z", "from": "AUDIT_578_QUEUE_EMPTY", "to": "N198_OPEN_DIRECTOR", "label": "no queued idea; director required for next axis; no reproduction of retired families", "segment": 15}
{"id": "AUDIT_579_QUEUE_EMPTY", "metric": 0, "parent": "N478d_r569_screen", "status": "audit", "strategy": "queue-empty audit; no queued idea; canonical rig NOT invoked; no replay retired; segment/pinned; director must open new axis (N198/N478d open_needs_director)"}
{"from": "AUDIT_579_QUEUE_EMPTY", "to": "N198_OPEN_DIRECTOR", "type": "needs_director"}
{"id": "AUDIT_580_SEG15_QUEUE_EMPTY", "type": "node", "status": "audit", "idea": "NONE-QUEUED", "label": "Seg15 audit: no queued idea; physical champion trochoid B=1.00; no fabrication; worklog append-only", "timestamp": "2026-10-04T23:25:33Z"}
{"from": "AUDIT_580_SEG15_QUEUE_EMPTY", "to": "N198_OPEN_DIRECTOR", "type": "needs_director"}
{"id": "AUDIT_581_QUEUE_EMPTY", "type": "node", "status": "audit", "idea": "NONE-QUEUED", "label": "Seg15 audit run 581: queue empty after N563 (done 564-566); rig verified 3 seeds local CPU harness_errors=0; champion trochoid B=1.00 p=0.0083 vs raster; no synthetic proxy; no banned phrases; N198/N478d remain open_needs_director", "timestamp": "2026-10-05T00:00:00Z"}
{"from": "AUDIT_581_QUEUE_EMPTY", "to": "N198_OPEN_DIRECTOR", "type": "needs_director"}
{"id": "N582-none-queued", "metric": 0, "parent": "N198-next", "status": "discard", "strategy": "Segment 15 loop: queue empty (no queued row in \u00a71/\u00a74 after I23/N534/N562/N563); frontier N198-next remains director-owned (open_needs_director). No rig invocation; no synthetic proxy claim; no keep fabricated. Canonical CPU rig untouched. Next iteration requires director to open a queued idea or authorize N198/N478d edge.", "timestamp": 1788000000, "type": "node"}
{"from": "N198-next", "to": "N582-none-queued", "kind": "discontinued", "type": "edge"}
{"id": "AUDIT_583_QUEUE_EMPTY", "type": "node", "status": "audit", "idea": "NONE-QUEUED", "label": "Seg15 audit run 583: queue empty (I0-I23/N476-N534/N562/N563 done; N198/N478d open_needs_director). Canonical CPU rig NOT invoked; trochoid B=1.00 p=0.0083; no fabrication; no synthetic proxy; unvalidated cap satisfied; no banned deferred phrases. Next requires director-authorised axis.", "timestamp": "2026-10-05T03:57:00Z"}
{"from": "AUDIT_583_QUEUE_EMPTY", "to": "N198_OPEN_DIRECTOR", "type": "needs_director", "kind": "needs_director"}
{"node": {"id": "N584", "label": "queue-empty audit r584", "status": "discard", "idea": "NONE-QUEUED", "segment": 15, "run": 584, "physical_rig": true, "seeds": 3, "fixture_B_success": 1.0, "mean_cov_cont": 1.0, "champion": "trochoid", "compare_keep": false, "note": "\u00a71 zero queued; 3-seed health-check; no keep; N198/N478d open_needs_director"}}
{"edge": {"from": "N584", "to": "N198", "label": "needs director-open before paired decider"}}
{"node": {"id": "N585", "label": "queue-empty audit r585", "status": "discard", "idea": "NONE-QUEUED", "segment": 15, "run": 585, "physical_rig": true, "seeds": 3, "fixture_B_success": 1.0, "mean_cov_cont": 1.0, "champion": "trochoid", "compare_keep": false, "note": "\u00a71 zero queued; 3-seed local CPU DIRECT only; no 20-seed paired decider; no keep; N198/N478d open_needs_director"}}
{"edge": {"from": "N585", "to": "N198", "label": "needs director-open before paired decider"}}
{"id": "N535", "metric": 1.0, "parent": "N534", "status": "discarded", "strategy": "TICK_S ladder 0.025 at 0,0 containment boundary: B 1.00/20 covc 1.00 vs champion 0.05 delta 0.00 p NaN; null law; axis not a lever; physical pybullet DIRECT 20 seeds; no arithmetic; no teleport; G3 retired not cited; champion trochoid B 1.00 Fisher 0.0083 vs raster", "timestamp": 1791157972.6707826, "type": "node"}
{"from": "N534", "kind": "derived", "to": "N535", "type": "edge"}
{"node_id": "N587_queue_empty_audit", "kind": "audit", "segment": 15, "idea": "NONE-QUEUED", "status": "discard", "run": 587, "timestamp": "2026-10-05T05:30:00Z", "notes": "queue-empty audit; no queued idea; rig not invoked; no synthetic keep", "physical_rig": false, "compare_champion": "trochoid"}
{"from": "N587_queue_empty_audit", "to": "trochoid", "kind": "compare_ref", "type": "audit_edge", "segment": 15, "run": 587, "note": "champion preserved; no paired decider possible"}
{"from": "QUEUE_SEG15", "to": "N587_queue_empty_audit", "kind": "audit_next", "type": "graph_edge", "segment": 15, "run": 587, "note": "queue confirmed empty after N486-N586"}
{"id": "N480", "metric": null, "parent": "trochoid", "status": "unvalidated", "strategy": "cheapest-unmeasured AEGIS_WALL_ONLY=1 (replay of G3-retired FACC refused)", "timestamp": 1762323060, "type": "node", "run": 588, "evidence": "results/aegis_v2/N480_wall1.jsonl"}
{"from": "trochoid", "kind": "tested", "to": "N480", "type": "edge", "note": "wall-only containment; B 1.00 no p emitted"}
{"node_id": "N589_residual_clip", "kind": "audit", "segment": 15, "idea": "N589-residual-clip (replay refused FACC)", "status": "unvalidated", "run": 589, "timestamp": "2026-10-05T05:33:00Z", "notes": "G3 replay refused; audit knob AEGIS_RESIDUAL_CLIP_M=0.5 vs troch. B=1.00 covc=1.00; no Welch/Fisher p => unvalidated. No synthetic. Champion trochoid p=0.0083.", "physical_rig": true, "compare_champion": "trochoid", "evidence": "results/aegis_v2/N589_residual_clip.jsonl"}
{"from": "trochoid", "to": "N589_residual_clip", "kind": "tested", "type": "edge", "segment": 15, "run": 589, "note": "residual_clip 0.5; B 1.00/20 covc 1.00; no compare p"}
{"from": "N589_residual_clip", "to": "trochoid", "kind": "compare_ref", "type": "audit_edge", "segment": 15, "run": 589, "note": "champion preserved; replay of G3-FACC refused; queue still empty"}
{"node": "ITER31_FACC_EA", "id": "ITER31", "idea": "FACC-EA", "type": "directive-replay-discard", "segment": "15", "frontier": "critical x assumption-violation x control-policy-generalization x SE(3)-conditioned", "status": "discard", "metric": null, "predicted_synthetic": 76, "std": 6, "physical_seeds": 0, "compare_champion": "trochoid", "compare_keep": false, "retired_family": "eq78/N75-N76/N84/FACC-SE3", "notes": "Replays eq78 family (retired G3). No Fixture-B 20-seed compare keep:true. Existing FACC-SE3 proxy B=0.1905; I9 B=0.70 Fisher p=1.0; freeze trochoid."}
{"edge": "ITER31_FACC_EA->N76", "from": "ITER31_FACC_EA", "to": "N76", "relation": "replay-of", " Evidence": "equations.md:78 / FACC-SE3 result B=0.1905 / G3 retirement", "status": "discard"}
{"node": "ITER32_FACC_E", "id": "ITER32", "idea": "FACC-E", "type": "directive-replay-discard", "segment": "15", "frontier": "critical x assumption-violation x SE(3)-energy-attention", "status": "discard", "metric": null, "predicted_synthetic": 78, "std": null, "physical_seeds": 0, "compare_champion": "trochoid", "compare_keep": false, "retired_family": "eq78/N75-N76/N84/FACC-SE3", "notes": "Iter 32 replay of iter 31/588/589. G3 retirement enforced. No queued idea; no 20-seed paired decider; rig not invoked."}
{"edge": "ITER32_FACC_E->ITER31_FACC_EA", "from": "ITER32_FACC_E", "to": "ITER31_FACC_EA", "relation": "replay-of", "Evidence": "ideas.md \u00a70 G3 retirement; same eq78 family; no Fixture-B paired keep", "status": "discard", "run": 590}
{"id": "ITER33-DAEF-refusal", "metric": 0, "parent": "N76", "status": "discard", "strategy": "replay-refused G3-retired DAEF (SE3-energy-flow); no queued idea; rig not invoked", "timestamp": 1791158944.9081948, "type": "node"}
{"from": "DIRECTOR-ITER33-DAEF", "kind": "rejected", "to": "ITER33-DAEF-refusal", "type": "edge"}
{"from": "ITER33-DAEF-refusal", "kind": "retired-family", "to": "N76", "type": "edge"}
{"id": "ITER35-SE3-FACC-E-refusal", "metric": 0, "parent": "N76", "status": "discard", "strategy": "G3 replay refused SE3-FACC-E (force-energy-affordance flow-match); queue empty; no 20-seed decider; physical rig not invoked", "timestamp": 1791159151.427307, "type": "node"}
{"from": "DIRECTOR-ITER35-SE3-FACC-E", "kind": "rejected", "to": "ITER35-SE3-FACC-E-refusal", "type": "edge"}
{"from": "ITER35-SE3-FACC-E-refusal", "kind": "retired-family", "to": "N76", "type": "edge"}
{"node": "FACC-SE3-iter36", "kind": "node", "idea": "FACC \u2014 Force-Adaptive Contact Control, SE(3)-conditioned", "segment": 15, "predicted_score": 78, "benchmark_verified": false, "physical_validation": false, "seeds_run": 0, "seeds_required": 20, "status": "crash", "crash_reason": "canonical_rig_integration_missing", "edge_from": "N76b", "director_iteration": 36, "single_brain_fallback": "muse-spark-1.3-contributor-free", "synthetic_proxy_excluded": true, "compare_champion": "trochoid", "equation_row": 84, "timestamp_utc": "2026-10-05T05:43:00Z"}
{"from": "N76b", "to": "FACC-SE3-iter36", "kind": "edge", "type": "mechanism-class"}
{"from": "FACC-SE3-iter36", "to": "trochoid", "kind": "edge", "type": "paired-decider-failed"}
{"from": "FACC-SE3-iter36", "to": "N84", "kind": "edge", "type": "flow-match->affordance-equivalence"}
{"node": "FACC-PIEA-iter37-refused", "kind": "node", "idea": "FACC-PIEA \u2014 SE(3)-Conditioned Force-Adaptive Contact Control (proposed iter 37)", "segment": 15, "status": "invalid", "physical_validation": false, "seeds_run": 0, "seeds_required": 20, "benchmark_verified": false, "predicted_score": 82, "synthetic_proxy_excluded": true, "compare_champion": "trochoid", "timestamp_utc": "2026-10-05T05:46:00Z", "director_iteration": 37, "single_brain_fallback": "muse-spark-1.3-contributor-free", "edge_from": "N76b / FACC-SE3-iter36"}
{"from": "FACC-SE3-iter36", "to": "FACC-PIEA-iter37-refused", "kind": "edge", "type": "replay-refused-retired-family"}
{"from": "FACC-PIEA-iter37-refused", "to": "trochoid", "kind": "edge", "type": "no-paired-decider-refused"}
