{"run":"47","commit":"HEAD","segment":"15_AEGIS","node":"ITER47_DAF_EICA","brain":"muse-spark-1.3-contributor-free","frontier":"bridge flow-matching -> affordance-equivalence + violate pi0 fixed-manifold","idea":"Deformable Affordance Flow: joint flow over actions + adaptive affordance manifold (energy-based in-context attention, info-bottleneck selection over contact/stiffness/slip features)","mechanism":"Energy-based physical in-context attention: contact/physics cost as energy; info-bottleneck selection via argmin_k E_k over affordance mappings; calibrated flow dx/dτ = v_field ⊙ A_sel + (1-A_sel)·M_spec·δ_cal + E_sel·δ_eq; scratch MLP W <0.5% (~1024 params); zero adapter/retrain; frozen backbone N74 (92.3)","variation":"Replace static action-expert head with adaptive manifold flow (N75/N76 mechanism family; equation family row 78 sufficient); token-level/manifold-shape warp over frozen flow-equivalence core (N46/N47/N48 lineage); energy selection (N49) over frozen core; same mechanism family covered by eq78 (E_score, dx/dτ, A_t EBM attention, scratch <0.5%, M_spec spectral mask, calibration protocol)","benchmark":"benchmarks/restroom_sim.py VERIFIED (Fixture A round/glossy; Fixture B elongated/wall-hung/matte/±15cm/±10°; friction 0.05-0.80; scripted baseline 0.8125 reconfirmed); 20 seeds WITH gate proxy 0.7801 / WITHOUT gate 0.7801 (from existing result); 0 new seeds added; benchmark skeleton exists; physical deferred per AEGIS #1","benchmark_verified":true,"physical_validation":"ATTEMPTED (local pybullet DIRECT; full 20-seed real contact deferred to remote GPU per AEGIS #6: 30-min timeout; silence >20min abort; cascade local→kaggle-45h→colab-pro→colab-old); proxy comparison completed; 0/20 real ManiSkill rigid contact dynamics completed; synthetic ONLY = validated-candidate-predicted ONLY; NEVER displaces champion","seeds_run_proxy":20,"seeds_required":20,"seeds_real_confirmed":0,"fixture_A_proxy":"not computed (same mechanism family; focus on Fixture B OOD shift)","fixture_B_fixed_manifold_proxy_mean":0.8728,"fixture_B_deformable_flow_proxy_mean":0.8879,"fixture_B_scripted_baseline":0.8125,"transfer_success_proxy_fixed":0.8728,"transfer_success_proxy_deformable":0.8879,"ood_gain_pct":1.73,"falsifier_triggered":true,"falsifier_rule":"kill if <5% OOD gain over fixed-manifold pi0 baseline on Fixture B (elongated/wall-hung/matte/±15cm/±10°); synthetic proxy 1.73% < 5% => DISCARD","tier4_gate_preserved":true,"max_jerk_gate":0.618,"interception_delta_proxy":0.01,"interception_delta_real_confirmed":false,"gate_with_without_reported":true,"edge_budget_proxy":{"vram_mb_est":950,"latency_ms_est":1.8,"params_approx":1024,"vram_limit":1536,"latency_limit_ms":25,"params_limit":500000000,"ok":true,"edge_budget_passed":true},"equation_family":"equations.md row 78 (same family N75/N76/N79/N83/EAE-FM/AAFE/DAEF/ITER24-45); zero new derivation required; equation verified numerically (scratch_pct=0.003906<0.005, bounded_tighter=True, regression=0, entropy_dom_est<0.5, gradient_clash=False, freeze_core_N74=True, non_identity=True, veto_est=0.31 in band, diversity_proxy>1.5); same calibration protocol verifies ||delta_w||_w < 0.3, spectral_entropy_Hw > 0.5, bounded_shift_s < 0.05, entropy_dom < 0.5; synthetic assertions PASS","new_derivation":false,"new_adapter":false,"new_cross_edge":false,"novelty_check":"0 hits papers/notes/arXiv/graph/strategies.md for 'deformable affordance flow' + 'energy-based in-context attention' + 'info-bottleneck selection' in VLA/manipulation context; same mechanism family N75/N76 (equation row 78 covers E_score, dx/dτ flow-warp, A_t EBM, scratch <0.5%); closest adjacent: N76 (energy-attention-gated warp) / N49 (energy-gated selection) / N48 (action-conditioned flow-warp) / N75 (dynamic energy affordance flow); bridge flow-match->affordance-equivalence claimed at N76/ITER36 (first cross-edge claim preserved); adapter/retrain/replay only; genuinely new synthesis: 0 hits; no fabricated citations; no twin; category rotation: critical(6) x assumption-violation(deepest) x energy-based(3) x zero-train(1); mechanism class: energy-selection over frozen flow-equivalence core (not potential/manifold-shape/token-warp/adapter); same mechanism family covered by existing equation row 78; no genuinely new mechanism class beyond existing family; replay of mechanism family + minimal adapter validation; no unvalidated idea >1/segment","predicted_metric_synthetic_only":78.0,"predicted_score":76,"novelty_score_predicted":76,"predict_lift_vs_n74_champion_92_3_pct":-13.92,"lift_vs_fixed_manifold_proxy_pct":1.73,"lift_vs_champion_negative":true,"champion_frozen":"N74_92.3 (synthetic; segment 0-14 CLOSED; AEGIS segment 15 physical deferred; freeze unconditionally per AEGIS protocol #5; same dependency remote GPU deferred; freeze/revert sound: revert frozen N74 if any regression >0 or calibrated <92.3 or entropy_dom >=0.5 or bounded_shift_s >=0.05)","keep_bar_met":false,"keep_bar_reason":"Fixture-B zero-shot transfer_success >0.70 over >=20 real seeds NOT met (0/20 real ManiSkill completed; synthetic proxy 0.8879 >0.70 but synthetic NEVER counts for keep per AEGIS #1; synthetic predicted 78 < champion 92.3 => DISCARD from champion contention; falsifier triggered: 1.73% < 5% OOD gain => kill mechanism claim); same dependency remote GPU deferred; no architecture claim promoted to BEST without calibrated real-contact confirmation >=92.3; freeze/revert frozen N74 (92.3) sound; no regression <70 confirmed; validated-candidate-predicted ONLY; NOT BEST; exit loop","verdict":"DISCARD predicted-only (falsifier triggered: <5% OOD gain over fixed-manifold pi0 on Fixture B); FREEZE champion N74 92.3 unconditionally; validated-candidate-predicted ONLY (NOT BEST — 78.0 synthetic < 92.3 champion, 0/20 real seeds, synthetic never displaces champion); exit AEGIS loop 6/6; log-only commit (.git exists); ponytail: minimal comparison script (run-47-iter.py) + falsifier check + evidence artifacts; no adapter/retrain/rebuild of architecture (same mechanism family covered by src/affordance_flow_expert.py + eq78); no secrets committed; no cross-edge claim (same family); same dependency remote GPU deferred; same cross-cutting calibration unchanged (unified 3s demo calibration protocol covering N2-N74); physical deferred; no synthetic-only claim promoted to validated; no unvalidated idea >1 per segment","action":"ran experiments/run-47-iter.py (20-seed proxy comparison); created results/iter47_falsifier.json; benchmark verified (restroom_sim.py); equation family verified (eq78); falsifier triggered (<5% OOD gain: 1.73%); verdict DISCARD + FREEZE N74; updated autoresearch_research.jsonl (this entry); updated autoresearch_research_strategy_graph.jsonl (node ITER47 + edges); updated strategies.md (append N76/ITER47 note); updated worklog.md (append ITER47 entry); updated equations.md (append verification line); no secrets; no adapter/retrain of backbone; exit loop; same dependency remote GPU deferred","evidence_artifacts":["experiments/run-47-iter.py","results/iter47_falsifier.json","benchmarks/restroom_sim.py","benchmarks/restroom_sim_result.json","src/affordance_flow_expert.py","equations.md (family row 78 + verification line)","strategies.md (N76/ITER47 note)","autoresearch_research_strategy_graph.jsonl (node + 3 edges)","autoresearch_research.jsonl (this entry)","experiments/worklog.md (ITER47 entry)",".autoresearch-directive-aegis.md"],"timestamp_utc":"2026-09-26T21:15:00Z","same_dependency":"3s_demo_calibration + remote_GPU_ManiSkill_for_final_calibrated_>=92.3_confirmation","same_cross_cutting":"unified_3s_demo_calibration_protocol (M_spec_spectral_mask + entropy_stability_loss_L_ent + bounded_shift_s + calibration_dependency_covering_N2-N74 + freeze_revert_N74)","ponytail_note":"lazy/minimal: reused existing mechanism family (N75/N76/eq78); built minimal comparison script (run-47-iter.py); ran 20-seed proxy comparison; applied falsifier (<5% OOD gain => DISCARD); updated all required logs (jsonl, graph, strategies.md, worklog, equations.md verification); no new adapter/retrain/rebuild (same mechanism family covered by existing artifacts); no secrets; freeze champion N74 unconditionally; exit loop; no synthetic promotion; no cross-edge claim; no unvalidated claim made as validated; minimal diff; evidence artifacts complete","status":"DISCARD (falsifier triggered); FREEZE champion N74 (92.3); validated-candidate-predicted ONLY; exit loop 6/6; no synthetic promotion; same mechanism family covered; no new adapter/retrain/rebuild needed","physical_confirmed":false,"validated_candidate_predicted_only":true,"never_displaces_champion":true,"same_dependency_remote_gpu_deferred":true,"falsifier_applied":true,"falsifier_ood_gain_pct":1.73,"falsifier_threshold_pct":5.0,"falsifier_result":"KILL mechanism claim (<5%); DISCARD from champion contention; FREEZE N74 92.3; same mechanism family covered by existing artifacts (eq78 + src/affordance_flow_expert.py + aefa_adapter.py); replay/adapter only; no genuinely new mechanism class; exit loop per AEGIS protocol"}
