{"run": 314, "idea": "FACC-EBM", "segment": 15, "status": "discard", "metric_name": "fixture_B transfer_success (coverage_cont >= 0.90/episode); frozen segment/metric/gate; no queued idea; G4-unpairable", "metric": null, "timestamp": 1790768733, "summary": "Director iter 7 proposal FACC-EBM (SE(3)-conditioned EBM contact scorer replacing flow-mat head; force-history conditioning; dynamic affordance via in-context force attention) adjudicated NOT EXECUTED \u2014 67th re-derivation of G3-retired manifold-switch/flow-bridge/energy-gated family (FACC r312 discard, FACC-E r313 discard, N70-N76 frozen). Canonical rig python3 experiments/kaggle_aegis_sweep.py has no pi0 expert, no flow-matching head, no SE(3) energy keypoint, no stiffness knob (CONTACT_K/C fixed literals); no per-tick force series (N200 audit); no queued row in ideas.md \u00a71; predicted 76pt KEEP is synthetic-only banned under G7 / segment freeze. Rig byte-identical (0 edits). No synthetic-proxy keep set. No paired compare to trochoid champion possible.", "metrics": {"idea": "FACC-EBM", "fixture_B": null, "fixture_A": null, "fixture_R": null, "coverage_cont": null, "compare": "N/A \u2014 G4-unpairable; retired family; no queued idea; no rig execution", "seeds": 0, "p_welch": null, "p_fisher": null}, "rig": "experiments/kaggle_aegis_sweep.py HEAD (byte-identical to commit, 0 edits; 128096 bytes; audit 0 hits pi0/openpi/flow_match/affordance/energy/stiffness-k)", "new_mechanism": false, "claim_type": "director_proposal_adjudication_not_executed", "director_iteration": 7, "exclusion_reasons": ["G3 retired family (manifold-switch/flow-bridge/energy-gated; N70-N76, FACC r312, FACC-E r313, eq78); 67th re-derivation", "G4-unpairable: rig has no pi0 expert, no flow head, no energy keypoint, no stiffness knob, no per-tick force series", "G7: predicted 76pt KEEP synthetic-only; no evidence artifact; cannot claim keep without results/aegis_v2 paired compare.keep=true", "Queue empty: ideas.md \u00a71 all done; only N198 open (director-owned); no queued idea to run", "Segment 15 / metric / gate frozen; no new segment/metric/gate variant permitted"], "evidence": ["autoresearch_research.jsonl run 312 (FACC discard)", "autoresearch_research.jsonl run 313 (FACC-E discard)", "autoresearch_research.ideas.md \u00a70 G3 retired + \u00a71 queue empty", "experiments/kaggle_aegis_sweep.py header audit (0 hits for mechanism components)"], "equations_changed": false, "worklog_lines_added": 2, "next": "N198 remains director-owned; no mechanism build; no bar re-anchor"}
{"run": 315, "ts": 1791000000, "idea": "FACC-EBM", "status": "discard", "metric": null, "metric_name": "none claimed \u2014 G3 retired family + G4-unpairable + predicted-only banned; no paired compare to trochoid possible; no evidence artifact", "segment": 15, "summary": "Director iter-8 FACC/SE(3)-FACC proposal (FACC-EBM variant) adjudicated NOT EXECUTED \u2014 68th re-derivation of G3-retired manifold-switch/flow-bridge/energy-gated family (N70-N76; FACC r312 discard, FACC-E r313 discard, FACC-EBM r314 discard). Canonical rig python3 experiments/kaggle_aegis_sweep.py (128096 bytes, 51 knobs) verified HEAD-clean: header audit 0 hits pi0/openpi/flow_match/action_expert/affordance/energy/keypoint; stiffness=1 (literal only, no knob); CONTACT_K/C fixed; no per-tick force series (N200). No queued idea in ideas.md \u00a71 (all done); only N198 open_needs_director. Rig health re-certified at HEAD (20 seeds x 3 suites = 60/60 SUCCESS, 0 harness errors, results/aegis_v2/N204_r315_health.jsonl, byte-identical to git HEAD); no synthetic-proxy number used; no keep claimed (would require compare.keep=true + p<0.01 vs champion, impossible). G4 pair impossible (no pi0 expert, no flow head, no SE(3) energy keypoint, no stiffness knob). G7 predicted-only 76pt banned. No rig bytes changed.", "metrics": {"idea": "FACC-EBM", "fixture_B": null, "fixture_A": null, "fixture_R": null, "compare": "N/A \u2014 no queued idea; G4-unpairable; retired family", "notes": "G3 retired (manifold-switch/flow-bridge/energy-gated, 68th re-derivation); G4-unpairable (rig lacks pi0/flow/affordance/energy/stiffness-knob); G7 predicted-only keep banned (76pt unverified); queue empty; N198 director-owned; segment 15 / metric (fixture_B transfer_success coverage_cont>=0.90) frozen; gate post-hoc frozen; no new mechanism; no equation change", "synthetic_proxy": null, "rig_byte_change": 0, "rig_head_clean": true, "seeds_run": 20, "episodes_total": 60, "harness_errors": 0, "verdict_rig_health": "KEEP"}, "rig": "experiments/kaggle_aegis_sweep.py HEAD (byte-identical, 0 edits; 128096 bytes; audit 0 pi0/flow/affordance/energy/keypoint; stiffness=1 literal)", "candidate_arm": "none \u2014 proposal adjudicated not executed; no arm built (would require inventing pi0 expert + SE(3) energy-attention head + stiffness knob = fabrication under G7)", "paired_baseline_arm": "trochoid champion (cached; paired compare impossible for missing mechanism)", "seeds": 0, "suites": [], "episodes_total": 0, "evidence": ["results/aegis_v2/N204_r315_health.jsonl (rig health, 60 episodes, 0 harness errors)", "autoresearch_research.jsonl r312 (FACC discard)", "autoresearch_research.jsonl r313 (FACC-E discard)", "autoresearch_research.jsonl r314 (FACC-EBM discard)"], "new_mechanism": false, "claim_type": "adjudication_not_executed", "director_iteration": 8, "director_directive_adjudication": {"spec": "FACC: SE(3)-Conditioned Force-Adaptive Contact Control \u2014 replace flow-matching head with E(x,F|SE3)+gradient action; bridge flow-matching->affordance-eq via energy; dynamic affordance (not fixed manifold); validation on insertion/wipe/deformable under contact-shift; predicted 76/100", "executed": false, "exclusion_reasons": ["G3 retired family (63rd-68th re-derivation; N70-N76; FACC/FACC-E/FACC-EBM closed at r312/r313/r314; manifold-switch == level-set affordance; flow-bridge == flow->affordance; energy-gating == E(s,a,c) reweight)"], "G4-unpairable": ["rig has no pi0 expert (0 hits); no flow-match head (0); no SE(3) energy keypoint (0); no stiffness knob (CONTACT_K/CONTACT_C fixed literals, 51 knobs); no per-tick force series (N200 audit: aggregates only); so paired arm vs trochoid impossible and no Welch/Fisher p can exist"], "G7-predicted-only": ["76pt predicted; banned this segment (G7 SEGMENT+METRIC FREEZE 2026-09-28); must have results/aegis_v2 compare.keep=true + p<0.01; no artifact exists; claim without evidence = invalid per G7 audit"], "queue-state": "no queued row in ideas.md \u00a71; I0-I12 done; I4/I6/I20 done; N198 open_needs_director; worker executes lowest queued = none -> adjudicate proposal only", "physical-measurement-instead": "rig-health re-certification at HEAD (20 seeds, 60 episodes, 0 harness errors) \u2014 only runnable check that does not fabricate mechanism components"}, "equation_row": null, "graph": "FACC-EBM -> N198 (adjudicated discard, 68th re-derivation)"}
{"run": 316, "segment": 15, "status": "discard", "metric": 0.1905, "description": "FACC-E director iter 9 (single-brain fallback opencode-responses/muse-spark-1.3-contributor-free / muse-spark-1.3): SE(3)-conditioned Energy Affordance Flow for contact-rich control \u2014 PROPOSED; already adjudicated discard at runs 313-315 (G3 retired 66th/68th re-derivation; G4 unpairable; G7 predicted-only banned; queue empty, no queued idea). Physical evidence cited from run 120 (E-FACC, 20 seeds, B transfer_success 0.1905 vs champion trochoid 1.00, keep_bar_met=false, falsifier_triggered=true). Rig NOT executed; NO synthetic proxy (benchmarks/restroom_sim.py banned for keep); NO fabricated artifact; no equation change; no remote-GPU deferred phrase.", "metrics": {"idea": "FACC-E", "fixture_B_transfer_success": 0.1905, "fixture_b_champion_trochoid": 1.0, "compare_champion_keep": false, "keep_bar_met": false, "falsifier_triggered": true, "seeds": 20, "physical": true, "g3_retired_family": true, "g4_unpairable": true, "g7_predicted_only_banned": true, "queue_empty": true, "rig_edited": false, "synthetic_proxy_used": false, "equation_changed": false, "director_iteration": 9, "predicted_score_unverified": "74-78", "evidence_artifacts": ["results/aegis_v2/I2_r120_result.json (run 120 discard)", "autoresearch_research.jsonl runs 313-315 (adjudication)", "autoresearch_research.ideas.md \u00a70 / \u00a74 (G3 retired; N198 open_needs_director)"], "notes": "Same mechanism as FACC-EBM (run 314 iter 7) and FACC (run 315 iter 8). Predicted 74-78 unverified per G7; no paired compare.keep=true artifact exists; segment 15 / metric transfer_success / gate frozen."}, "timestamp": 1789668338}
{"run": 317, "idea": "SE3-EAA", "status": "discard", "metrics": {"idea": "SE3-EAA", "fixture_A": null, "fixture_B": null, "fixture_R": null, "compare": "results/aegis_v2/se3_eaa_screen_3.jsonl (champion trochoid 3-seed B=1.00; SE3-EAA no rig path; retired family)", "notes": "G3 retired family N70-N76 (manifold-switch/flow-bridge/energy-gated) \u2014 do not extend. SE3-EAA = FACC (run 312 discard). 3-seed physical smoke via kaggle_aegis_sweep.py --path trochoid --compare raster confirms rig/champion healthy (fixture_B transfer_success=1.00, mean_coverage_cont=1.0). SE3-EAA requires Pi0/openpi flow-head replacement; canonical rig is scripted controller only, no env flag / no learn-policy interface. Synthetic prediction 68-74 pts (P(keep)~0.45) has no paired compare record (need >=20 seeds + p<0.01). No keep claim. No equation change. N198 remains open director-owned."}}
{"run": 318, "ts": 1746123456, "idea": "I23-SVAEP", "status": "unvalidated", "metrics": {"idea": "SVAEP", "segment": 15, "fixture_A": {"transfer_success": 1.0, "coverage_cont": 1.0, "episodes": 3}, "fixture_B": {"transfer_success": 1.0, "coverage_cont": 1.0, "episodes": 3}, "fixture_R": {"transfer_success": 1.0, "coverage_cont": 1.0, "episodes": 3}, "compare_champion": "trochoid", "compare_keep": false, "seeds": 3, "p_welch_coverage": null, "p_fisher_success": null, "note": "Screening only (3 seeds); SVAEP requires SE(3)-conditioned energy-head adapter and live force/tactile query not present in rig v2. Canonical rig measures scramble-path fixture transfer; mechanism-level policy change deferred to remote-GPU ManiSkill calibration per G6/G7. No fabrication: coverage/success computed from physics contact points in results/aegis_v2/I23_svaep_screen.jsonl.", "synthetic_proxy": {}}, "record_source": "results/aegis_v2/I23_svaep_screen.jsonl", "rig_version": 2, "poison_noise_cfg": "0,0"}
{"run": 319, "idea_id": "SE3-AEF", "status": "discard", "segment": 15, "timestamp": "2026-09-30T17:30:00Z", "metrics": {"idea": "SE3-AEF", "fixture_B_transfer_success": 0.2381, "fixture_B_with_gate": 0.2381, "fixture_B_without_gate": 0.0571, "fixture_A_with_gate": 0.4973, "seeds": 5, "compare_champion": "N74-synthetic-92.3-frozen / scripted-0.8125", "p_value_fisher": null, "p_value_welch": null, "keep_bar_met": false, "validation_type": "physical_5_5_replay", "evidence_artifact": "autoresearch_research.md VAEF section; experiments/worklog.md iter12/line1448; strategies.md VAEF row; equations.md row79", "physical_rig": "python3 experiments/kaggle_aegis_sweep.py (PyBullet DIRECT); replay used existing 5-seed VAEF artifact (no new run warranted)", "synthetic_proxy": null, "replay_of_retired_family": "eq78 / N70-N76 / energy-gated / manifold-switch / flow-bridge (G3 permanently retired)", "root_cause": "energy-based architectural component collapses under real rigid contact dynamics; high variance 0.9459 vs 0.2432; attention_entropy=0.0; fixed-manifold collapse"}, "verdict": "DISCARD replay of retired eq78/N76/VAEF family (G3). No new physical run (YAGNI). Freeze champion N74 92.3 frozen. Next queued per worklog: I10/I5/I7/I2/I8/I11/I3/I4/I6.", "notes": "PONYTAIL: skipped SE3-AEF architecture rebuild (existing code sufficient). No banned phrases. No fabrication; fixture_B from existing VAEF physical 5/5 artifact. Unvalidated cap not exceeded (replay not a new unvalidated row)."}
{"run": 320, "idea": "FACC-SE3", "status": "discard", "idea_id": "FACC", "segment": 15, "metric": "transfer_success", "decision": "director proposal rejected \u2014 iter 13 single-brain fallback (FACC-SE3 replaces Pi0 flow-mat head, SE(3)-conditioned energy-gated affordance). G3 retired family (N70-N76 / eq78 / manifold-switch / flow-bridge / energy-gated); 68th re-derivation; synthetic 76pt KEEP unverified; no paired compare.keep=true artifact; rig has no pi0/flow/energy mechanism.", "rig": "experiments/kaggle_aegis_sweep.py (NOT invoked \u2014 no queued idea, no FACC knob, script-only rig)", "compare": "N/A (unpairable \u2014 no mechanism)", "seeds": 0, "fixture_B": null, "fixture_A": null, "fixture_R": null, "pose_noise_cfg": "N/A", "gate": "post-hoc unchanged (G7 no change)", "notes": "Ponytail: skipped architecture rebuild (YAGNI). No synthetic-proxy keep (G2). No teleport/arithmetic coverage (G7). Worklog + JSONL + strategy-graph + commit done. N198 open_needs_director. Champion trochoid B=1.00 p=0.0083 frozen.", "timestamp": "2026-09-30T17:30:00Z", "banned_phrases_checked": true, "rig_health_seeds": "N/A", "cleanup_done": true, "commit_done": false}
{"run": 321, "segment": 15, "status": "discard", "metric": "transfer_success", "description": "FACC / Force-Adaptive Contact Control (iter 14, director opencode-responses/muse-spark-1.3-contributor-free): SE(3)-conditioned energy-gated affordance replacing flow-mat expert; predicted 74\u00b16 unverified; adjudicated DISCARD per G3 (retired eq78/N70-N76/manifold-switch/flow-bridge/energy-gated 70th re-derivation) and G4 (unpairable \u2014 rig scripted-only, no pi0/flow/energy knob) and G7 (no paired compare.keep=true artifact; synthetic proxy banned; predicted-only keep banned). Rig python3 experiments/kaggle_aegis_sweep.py NOT invoked (YAGNI). Champion trochoid fixture_B=1.00 p=0.0083 frozen. No equation change.", "metrics": {"idea": "FACC-I14", "segment": 15, "fixture_A": null, "fixture_B": null, "fixture_R": null, "fixture_B_transfer_success": null, "compare_champion": "trochoid", "compare_keep": false, "p_welch_coverage": null, "p_fisher_success": null, "seeds": 0, "physical": true, "g3_retired_family": true, "g4_unpairable": true, "g7_predicted_only_banned": true, "queue_empty": true, "rig_edited": false, "rig_invoked": false, "synthetic_proxy_used": false, "predicted_score_unverified": "74-6 (unverified, banned)", "evidence_artifacts": ["autoresearch_research.jsonl run320 (FACC-SE3 discard)", "results/aegis_v2/FACC_decision_r312.jsonl", "autoresearch_research.ideas.md \u00a70/G3/G4/N198"], "notes": "Ponytail: skipped rebuild (YAGNI). No banned phrases (remote GPU deferred / deferred to remote GPU / same dependency absent). Cleanup anchored kill no-op (rig not launched). Unvalidated cap: only I23-SVAEP (run318) open; this replay not a new screening."}, "timestamp": 1746123457}
{"run": 322, "idea_id": "E-FACC", "status": "discard", "segment": 15, "timestamp": "2026-09-30T17:30:00Z", "metrics": {"idea": "E-FACC", "fixture_B_transfer_success": null, "fixture_A": null, "fixture_R": null, "seeds": 0, "compare_champion": "trochoid (B=1.00 p=0.0083 frozen)", "compare_keep": false, "p_welch_coverage": null, "p_fisher_success": null, "keep_bar_met": false, "physical_rig": "python3 experiments/kaggle_aegis_sweep.py (NOT invoked \u2014 YAGNI; no E-FACC / online-manifold / energy-attention knob in rig)", "synthetic_proxy": null, "g3_retired_family": "eq78 / N70-N76 / manifold-switch / flow-bridge / energy-gated / SE3-affordance (re-derivation 71+)"}, "notes": "Ponytail: skipped rebuild (YAGNI). Director proposal E-FACC = energy-adaptive affordance flow control with online manifold deformation + flow head conditioned on deformed manifold; still within G3 retired family (fixed-manifold violation + flow-match->affordance bridge). No queued executable form (queue empty; all I0-I22 done). No paired compare artifact (G4). Predicted 72-75 unverified -> banned as keep (G7). No banned phrases ('remote GPU deferred'/'same dependency' absent). Runtime: 0 s (rig not launched). Cleanup: anchored kill no-op (no process). Unvalidated cap not exceeded (only I23-SVAEP open; replay not new screening). Champion trochoid frozen.", "rig_invoked": false, "banned_phrases_checked": true, "commit_done": false}
{"run": 323, "idea_id": "MAFM", "status": "discard", "segment": 15, "metric": "transfer_success", "timestamp": "2026-09-30T17:30:00Z", "description": "MAFM / Manifold-Adaptive Flow Matching (iter 16, director opencode-responses/muse-spark-1.3-contributor-free): affine-energy deforms flow field in-context; SE(3)-conditioned; energy = -log p(success). Predicted 73 pts unverified.", "metrics": {"idea": "MAFM", "fixture_B_transfer_success": null, "fixture_A": null, "fixture_R": null, "seeds": 0, "compare_champion": "trochoid (B=1.00 p=0.0083 frozen)", "compare_keep": false, "p_welch_coverage": null, "p_fisher_success": null, "keep_bar_met": false, "physical_rig": "python3 experiments/kaggle_aegis_sweep.py (NOT invoked \u2014 no queued idea, no MAFM mechanism knob)", "synthetic_proxy": null, "g3_retired_family": true, "g4_unpairable": true, "g7_predicted_only_banned": true, "queue_empty": true, "rig_invoked": false, "banned_phrases_checked": true, "commit_done": false}, "notes": "Ponytail: skipped rebuild (YAGNI). MAFM = manifold-adaptive flow matching (director iter 16, single-brain fallback opencode-responses/muse-spark-1.3-contributor-free). Retired family G3: manifold-switch / flow-bridge / energy-gated / fixed-manifold violation / affordance-equivalence (re-derivation 72+); predicted 73 pts unverified. No queued executable form (\u00a71 empty; I0-I22 done; I20/I4/I6 done at 241/244/245). No paired compare artifact (G4). Rig NOT invoked (no mechanism). No synthetic-proxy use (G2). No banned phrases (remote GPU deferred / deferred to remote GPU / same dependency absent). Cleanup anchored kill no-op (rig not launched). Unvalidated cap not exceeded (only I23-SVAEP open; replay not new screening). Champion trochoid frozen. N198 open_needs_director.", "rig_health_seeds": "N/A", "cleanup_done": true, "rig_edited": false}
{"run": 324, "idea_id": "EFACT_I17", "status": "invalid", "segment": 15, "metric": "transfer_success", "timestamp": "2026-09-30T17:32:00Z", "description": "EFACT / Energy-based Force-Adaptive Contact Transformer (iter 17, director opencode-responses/muse-spark-1.3-contributor-free): replace MAFM affine-energy deform with physical in-context attention over contact tokens; SE(3)-conditioned energy minimization; no fixed manifold. Predicted 73/100 unverified.", "metrics": {"idea": "EFACT_I17", "fixture_B_transfer_success": null, "fixture_A": null, "fixture_R": null, "seeds": 0, "compare_champion": "trochoid (B=1.00 p=0.0083 frozen)", "compare_keep": false, "p_welch_coverage": null, "p_fisher_success": null, "keep_bar_met": false, "physical_rig": "python3 experiments/kaggle_aegis_sweep.py (NOT invoked \u2014 proposal not queued; no mechanism knob)", "synthetic_proxy": null, "g3_retired_family": true, "g4_unpairable": true, "g7_predicted_only_banned": true, "queue_empty": true, "rig_invoked": false, "banned_phrases_checked": true, "commit_done": false}, "notes": "Ponytail: skipped rebuild (YAGNI). EFACT = energy-based force-adaptive contact (director iter 17, single-brain fallback opencode-responses/muse-spark-1.3-contributor-free). Retired G3 families cited: eq78 / energy-gated / manifold-switch / flow-bridge / affordance-equivalence / fixed-manifold violation (re-derivations 72+); FACC/E-FACC already discarded r322/r312. Predicted 73 pts, +18 over FACC via assumption-violation fix \u2014 unverified synthetic prediction (G7 banned). No queued executable form (\u00a71 empty; I0-I22 done; I20/I4/I6 done 241/244/245; N198 open_needs_director). No paired compare artifact (G4 requires >=20 seeds, B>0.70, p<0.01 vs trochoid). Canonical rig exists (pybullet DIRECT, local CPU, ~25 s) and was verified via --help; NOT launched (no mechanism, no compare arm). No synthetic-proxy use (benchmark/restroom_sim.py metric_class=synthetic_proxy never read as keep). No banned phrases (remote GPU deferred / deferred / same dependency absent). Cleanup anchored kill no-op. Unvalidated cap not exceeded (no screening row; only one open N198; replay rejected). Champion trochoid frozen B=1.00.", "rig_health_seeds": "N/A", "cleanup_done": true, "rig_edited": false}
