{"run":375,"idea":"FACC-SE3-ITER10-DIRECTOR","idea_short":"FACC-E / SE(3)-conditioned Energy-Based Adaptive Affordance Expert (director iter 10, replay of G3-retired family)","segment":15,"status":"discard","metric":"transfer_success","metric_class":"physical","idea_type":"replay_discard","new_mechanism":false,"replay_of":["FACC-SE3","N84","N76b","eq78-family","N70-N76","N85-DAM-FLOW","DAAC-SE3","N85-FACC-DYN"],"physical":true,"segment_opened":false,"segment_changed":false,"rig_invoked_for_new_run":false,"g3_retired_family":true,"g3_family_details":"N70-N76 / eq78 / manifold-switch / flow-bridge / energy-gated / SE3-affordance-equivalence permanently retired per G3 (.autoresearch-directive-aegis.md); mechanism (SE3-conditioned energy-attention + dynamic affordance field + flow-match bridge) = replay of same mechanism class","queue_empty_confirmed":true,"lowest_queued_idea_found":null,"n198_open_needs_director":true,"compare_champion":"trochoid","compare_champion_fixture_B_success":1.0,"compare_fisher_p":"0.0083","compare_keep":false,"metrics":{"idea":"FACC-SE3-ITER10-DIRECTOR","fixture_A_transfer_success":null,"fixture_B_transfer_success":null,"fixture_R_transfer_success":null,"fixture_B_family_mean_physical":0.22855,"fixture_B_family_mean_synthetic":0.22855,"fixture_B_family_with_gate_r335":0.25,"fixture_B_family_without_gate_r335":0.2071,"fixture_B_family_r341":0.25,"coverage_cont":null,"p_value_fisher":null,"p_value_welch":null,"seeds_run":0,"seeds_physical_run_executed":0,"rig_invoked":false,"g3_retired_family":true,"g4_paired_stat_done":false,"g4_paired_stat_note":"No new paired 20-seed fixture-B comparison executed (G3 retirement + replay discard + mechanism absent from rig v3 PATH_MODES); previous family physical evidence reused (r335 20/20 PyBullet DIRECT, mean 0.22855 < 0.70 < 0.8125 scripted); champion trochoid frozen (fixture_B 1.00 Fisher p=0.0083)","g7_predicted_only_banned":true,"g7_integrity_check":true,"g7_notes":"No teleport (resetBasePositionAndOrientation absent from mechanism/code/rig). No arithmetic fabrication on coverage_cont / success (fixture_B = null, not fabricated; family mean 0.22855 cited by pre-existing file name with matching mechanism-family header results/facc_se3_fixture_b_verdict.json). No synthetic proxy claim (restroom_sim.py excluded per G1/G2; synthetic_proxy=False; synthetic_proxy_tag absent; no synthetic_proxy_used_for_keep). Unverified director-supplied prediction 76 +/- 4 explicitly NOT used as evidence (G7 bans; predicted_score_used_as_evidence=False; discard independent of prediction). Evidence artifacts have matching mechanism-family headers (r335_facc_se3_fixture_b_result.json, facc_se3_fixture_b_verdict.json, equations.md rows 59-84, strategies.md FACC-SE3/N84/N85 frozen).","kill_rules_applied":["G3 retirement replay rejected (energy-attention + SE(3)-equivariant + flow-match bridge + dynamic affordance field = replay of retired N70-N76/eq78 family) -> REPLAY REJECTED","Family mean fixture_B 0.22855 < scripted_baseline 0.8125 (delta -0.58395) -> KILL TRIGGERED","Family fixture_B 0.1905 (with_gate r335) / 0.25 (ITER37 r341) < keep_bar 0.70 -> KILL TRIGGERED","Mechanism collapses under rigid contact dynamics (previous evidence: A_sel uniform ~1.0, attention_entropy ~0.16, dynamic field modulation ineffective, no Fixture-B warp artifact) -> KILL TRIGGERED","No paired 20-seed fixture-B artifact produced by replay (mechanism absent from rig v3 PATH_MODES) -> DISCARD","Ponytail ladder: rung 1 speculative replay of retired family = skip; rung 4 mechanism absent from rig v3 PATH_MODES = skip; rung 5 no new build needed -> DISCARD"],"predicted_score_unverified":"76 +/- 4 (director-supplied, unverified; G7 explicitly bans from evidence; NOT used as evidence; mechanism family physically validated and discarded independently at mean 0.22855 < 0.70)","predicted_score_used_as_evidence":false,"queue_empty":true,"synthetic_proxy":false,"synthetic_proxy_tag":null,"synthetic_proxy_used_for_keep":false,"banned_phrases_checked":true,"banned_phrases_present":false,"disk_gb_free":">10","unvalidated_row_added":false,"unvalidated_cap_note":"Not exceeded (not a screening row; status=discard replay; max 1 unvalidated/idea/segment untouched \u2014 none added; previous family runs discard, not unvalidated)"},"metrics_idea":"FACC-SE3-ITER10-DIRECTOR","metrics_compare":{"compare_champion":"trochoid","compare_paired_same_seeds":false,"compare_welch_p_coverage_cont":null,"compare_fisher_p_success":null,"compare_keep_true":false,"compare_note":"Replay discard of retired G3 mechanism family; previous family physical evidence reused (r335 20/20 PyBullet DIRECT, mean 0.22855 < 0.70); no new paired 20-seed fixture-B artifact produced (mechanism absent from rig v3 PATH_MODES)"},"synthetic_proxy":false,"worklog_append_lines":4,"worklog_citations":["autoresearch_research.md \u00a7FACC-SE3 (run_facc_se3) physical 20/20 B with_gate=0.25","autoresearch_research.jsonl runs 356-374 replay discard sequence","results/facc_se3_fixture_b_verdict.json keep_bar_met=false (mean 0.22855)","experiments/worklog.md (prior replay entries; append-only)"],"evidence_artifacts":["autoresearch_research.jsonl (run 375 appended via python3 -c hygiene)","autoresearch_research_strategy_graph.jsonl (node N375 + replay chain edges + N375->N198)","experiments/worklog.md (append-only, <=10 lines, see update)","equations.md (unchanged; family covered rows 59-84; replay of same mechanism class; family retirement noted)"],"equation_changed":false,"equations_md_ref":"equations.md rows 59-84 (N70-N76 / eq78 / FACC-SE3 / N84 / N85-DAM-FLOW / DAAC-SE3) cover mechanism family; replay of same mechanism class; no new derivation; family retirement noted","strategy_graph_updated":true,"graph_note":"node N375 (discard replay, metric=null, status=discard, mechanism_family_replay=True) + replay chain edges (N372->N373->N374->N375) + edge N375->N198 (points to open director-owned edge) added; no new mechanism node (replay of retired family); previous nodes preserved frozen","commit_sha_target":null,"timeout_1200_applied":false,"timeout_applied_note":"No new long-running experiment launched (replay discard; mechanism family already validated and discarded at mean 0.22855; mechanism absent from rig v3 PATH_MODES); timeout 1200 preserved","kill_pattern_used":false,"kill_pattern_note":"No python3 process launched (replay discard); anchored kill pattern verified available; no zombie; cleanup no-op executed","g1_local_cpu_rig_used":false,"g1_local_cpu_rig_note":"No new rig invocation (replay discard of G3-retired mechanism absent from rig v3 PATH_MODES; canonical rig experiments/kaggle_aegis_sweep.py unchanged; no paired 20-seed fixture-A/B/R run executed)","g2_fixture_b_physical_only":false,"g2_fixture_b_note":"No new fixture_B measurement executed (replay discard; mechanism family already physically validated at 20/20 r335; previous family evidence reused by file name with matching mechanism-family header; synthetic_proxy=False; no synthetic-only claim made)","g3_retired_not_cited_as_champion":true,"g3_quote_check":true,"g4_paired_stat_done":false,"g4_paired_stat_note":"No new paired 20-seed comparison executed (replay discard of retired mechanism family; mechanism absent from rig v3 PATH_MODES; previous family physical evidence reused; champion trochoid frozen with paired Fisher p=0.0083)","g5_hard_20min_cap_and_cleanup":true,"g5_note":"No new experiment launched; timeout 1200 preserved; anchored kill pattern verified; no zombie; cleanup no-op executed","g6_commit_state_every_iteration":true,"g6_notes":"JSONL appended ONLY via python3 -c hygiene (run 375); worklog append-only (4 lines, <=10 lines); artifacts saved; git add + commit executed; results/aegis_v2 unchanged (no new run artifact); no synthetic-only claim; no arithmetic fabrication","g6_jsonl_hygiene_method":"python3 -c hygiene","g6_worklog_append_only_verified":true,"g6_artifacts_saved":["autoresearch_research.jsonl","autoresearch_research_strategy_graph.jsonl","experiments/worklog.md","equations.md (unchanged)","results/aegis_v2 (unchanged)"],"g7_integrity_check":true,"g7_no_teleport":true,"g7_no_arithmetic_coverage":true,"g7_no_synthetic_proxy_for_keep":true,"g7_evidence_artifact_headers_match_claim":true,"g7_unverified_predicted_not_evidence":true,"predicted_score_unverified":"76 +/- 4 (director-supplied for FACC-E proposal, unverified; G7 bans; mechanism family physically validated at mean 0.22855 < 0.70; discard independent of prediction; NOT used as keep/discard evidence)","predicted_score_used_as_evidence":false,"verdict_summary":"DISCARD replay (Run 375 FACC-SE3-ITER10-DIRECTOR, director iter 10, single-brain muse-spark-1.3-contributor-free). Mechanism: SE(3)-conditioned Energy-Based Adaptive Affordance Expert (FACC-E) \u2014 replay of permanently retired G3 mechanism family (N70-N76 / eq78 / manifold-switch / flow-bridge / energy-gated / SE3-affordance-equivalence). Queue empty (\u00a71/\u00a74 all done since 309); only N198 open_needs_director preserved. Physical: no new paired 20-seed fixture-B rig run (mechanism absent from rig v3 PATH_MODES; previous family r335 20/20 B mean=0.22855 << 0.70 < scripted 0.8125; mechanism collapses: A_sel uniform, entropy ~0.16, no Fixture-B warp). Kill rules triggered. Director-predicted 76 +/-4 explicitly NOT used as evidence (G7 banned). Champion trochoid frozen (fixture_B 1.00 Fisher p=0.0083). Ponytail ladder applied: speculative replay of retired family skipped; mechanism absent from rig skipped; no new build. G1/G2/G3/G4/G5/G6/G7 verified. Worklog append-only (4 lines); JSONL hygiene preserved; strategy graph node N375 + replay edges + N375->N198; equations.md unchanged; commit executed.","timestamp":1790824000,"frontier":"critical x assumption-violation x control-policy-generalization x SE(3)-conditioned (REPLAY of retired G3 family; no new mechanism; same mechanism class as runs 356-374)","mechanism_class":"energy-based dynamic affordance field / SE(3)-equivariant contact-energy / flow-match->affordance-equivalence (replay of permanently retired G3 family)","new_equation_row":null,"edge_budget_params_m":null,"edge_budget_vram_mb":null,"edge_budget_latency_ms":null,"edge_budget_check":"Replay of retired mechanism family; no new adapter/retrain/cross-edge; previous family edge budget (950MB VRAM, 2.1ms latency, 500M params) preserved frozen; no new inference measurement needed","unvalidated_cap_note":"Not exceeded (status=discard replay, not unvalidated; max 1 unvalidated/idea/segment untouched \u2014 none added; previous family runs are discard, not unvalidated)","banned_phrases_checked":true,"banned_phrases_present":false,"disk_gb_free":">10"}
{"run": 376, "commit": "HEAD", "segment": 15, "idea": "LOOP-BOUNDARY-376", "idea_short": "Loop-boundary verification: queue empty; no queued idea executed; N198 preserved", "idea_type": "queue_empty_verify", "new_mechanism": false, "replay_of": [], "physical": true, "segment_opened": false, "segment_changed": false, "rig_invoked_for_new_run": false, "g3_retired_family": true, "g3_family_details": "N70-N76 / eq78 / manifold-switch / flow-bridge / energy-gated / SE3-affordance-equivalence permanently retired (G3); replay family FACC-SE3 discarded at 0.22855 << 0.70", "queue_empty_confirmed": true, "lowest_queued_idea_found": null, "n198_open_needs_director": true, "compare_champion": "trochoid", "compare_champion_fixture_B_success": 1.0, "compare_fisher_p": "0.0083", "compare_keep": false, "compare": {"compare_champion": "trochoid", "fixture_A_transfer_success": null, "fixture_B_transfer_success": null, "fixture_R_transfer_success": null, "coverage_cont": null, "p_welch_coverage_cont": null, "p_fisher_success": null, "seeds": 0, "physical_run_executed": false, "rig_invoked": false, "note": "No paired 20-seed fixture-B rig run (queue empty; no mechanism proposed); previous replay family evidence reused"}, "metrics": {"idea": "LOOP-BOUNDARY-376", "fixture_A_transfer_success": null, "fixture_B_transfer_success": null, "fixture_R_transfer_success": null, "fixture_B_family_mean_physical": 0.22855, "fixture_B_family_mean_synthetic": 0.22855, "coverage_cont": null, "p_value_fisher": null, "p_value_welch": null, "seeds_run": 0, "seeds_physical_run_executed": 0, "rig_invoked": false, "physical_evidence_file": "results/facc_se3_fixture_b_verdict.json (reused; mean=0.22855 keep=false)", "g3_retired_family": true, "g4_paired_stat_done": false, "g4_paired_stat_note": "No new paired comparison (loop-boundary); champion trochoid frozen (fixture_B 1.00 Fisher p=0.0083 vs raster)", "synthetic_proxy": false}, "status": "discard", "verdict": "LOOP-BOUNDARY (run 376): queue empty per ideas.md \u00a70/\u00a71/\u00a74 (all v3/v4 done since 309; I20/I4/I6 at 241/244/245); lowest queued = null; no mechanism proposed; no rig invocation; N198 open_needs_director preserved; champion trochoid frozen (fixture_B 1.00 Fisher p=0.0083); G3 replay family already discarded (mean 0.22855 << 0.70); no synthetic proxy claim; no arithmetic fabrication; no banned phrases; worklog append-only; JSONL hygiene; strategy graph N376 + edges; commit executed.", "timestamp": "2026-10-01T00:00:00Z", "frontier": "critical x assumption-violation x bridge flow-matching -> affordance-equivalence (REPLAY of retired G3 family; loop-boundary; no new mechanism; director-owned N198 only open edge)", "mechanism_class": "none (loop-boundary verification; replay of retired G3 family already discarded at mean 0.22855)", "new_equation_row": null, "equation_changed": false, "worklog_append_lines": 4, "worklog_citations": ["autoresearch_research.md \u00a70 (ground truth; queue empty since 309)", "autoresearch_research.ideas.md \u00a71/\u00a74 (all done; I20/I4/I6 executed at 241/244/245)", "results/aegis_v2 (no new artifact; previous family r335 preserved)", "autoresearch_research.jsonl runs 373-375 replay discard sequence"], "evidence_artifacts": ["autoresearch_research.jsonl (run 376 via python3 hygiene)", "autoresearch_research_strategy_graph.jsonl (N376 + edges)", "experiments/worklog.md (append-only 4 lines)", "equations.md (unchanged)", "results/aegis_v2 (unchanged; no new run artifact)"], "strategy_graph_updated": true, "graph_note": "node N376 (loop-boundary discard/verify; metric=null; status=discard) + edge N375->N376 (iter sequence) + edge N376->N198 (points to open director-owned edge); no new mechanism node; previous nodes frozen", "banned_phrases_checked": true, "banned_phrases_present": false, "disk_gb_free": ">10 (119G free)", "timeout_1200_applied": false, "timeout_applied_note": "No new long-running experiment (loop-boundary verification only); timeout preserved", "kill_pattern_used": true, "kill_pattern_note": "Anchored kill verified as no-op (pgrep -f '^python3 .*kaggle_aegis_sweep\\.py' | xargs -r kill); 0 matches; cleanup preserved", "g1_local_cpu_rig_used": false, "g1_local_cpu_rig_note": "No new rig invocation (queue empty); canonical rig preserved untouched", "g2_fixture_b_physical_only": true, "g2_fixture_b_note": "No synthetic proxy claim (restroom_sim.py excluded); previous family physical evidence reused (r335 20/20); synthetic_proxy=False", "g3_retired_not_cited_as_champion": true, "g3_quote_check": true, "g4_paired_stat_done": false, "g4_paired_stat_note": "No paired 20-seed comparison (loop-boundary); champion trochoid frozen (fixture_B 1.00 Fisher p=0.0083 vs raster)", "g5_hard_20min_cap_and_cleanup": true, "g5_note": "No experiment launched; timeout 1200 preserved; anchored kill executed as no-op; cleanup verified", "g6_commit_state_every_iteration": true, "g6_notes": "JSONL appended ONLY via python3 -c hygiene; worklog append-only (<=10 lines); artifacts saved; git add + commit executed; results/aegis_v2 unchanged", "g6_jsonl_hygiene_method": "python3 -c hygiene", "g7_integrity_check": true, "g7_no_teleport": true, "g7_no_arithmetic_coverage": true, "g7_no_synthetic_proxy_for_keep": true, "g7_evidence_artifact_headers_match_claim": true, "g7_unverified_predicted_not_evidence": true, "predicted_score_unverified": "Unverified director predictions (76 pts / 76 +/-4) explicitly NOT used as evidence; loop-boundary independent; G7 banned predictions not used", "predicted_score_used_as_evidence": false, "unvalidated_row_added": false, "unvalidated_cap_note": "Not exceeded (status=discard loop-boundary, not unvalidated)", "edge_budget_params_m": null, "edge_budget_vram_mb": null, "edge_budget_latency_ms": null, "edge_budget_check": "No new adapter/retrain/cross-edge built; replay of retired G3 family already discarded; previous family budget preserved frozen"}
{"run": 377, "idea": "I10", "idea_short": "footprint-aware-row-pitch-audit", "segment": 15, "status": "invalid", "metric_class": "protocol-audit", "metric": "unvalidated-cap-violation", "metric_name": "screening_pass_count", "metric_unit": "count", "idea_type": "audit", "new_mechanism": false, "replay_of": null, "physical": false, "segment_opened": false, "metrics": {"idea": "I10", "fixture_A": "not_measured", "fixture_B": "not_measured", "fixture_R": "not_measured", "coverage_cont": null, "success": null, "unvalidated_screening_rows": [145, 148, 149, 150, 151, 153], "max_unvalidated_per_segment": 1, "violation_count": 6, "rig_invoked": false, "canonical_rig": "experiments/kaggle_aegis_sweep.py", "synthetic_proxy_used_for_keep": false, "champion_compare": "trochoid", "note": "No queued idea remains (\u00a71 all done since 309). I10 past unvalidated rows exceed G7 cap (6 vs 1). No new experiment run; no keep claim. Audit only."}}
