{"type": "node", "id": "N188-T225", "run": 232, "segment": 15, "idea": "I2/T225", "status": "discard", "verdict": "DISCARD - FACC-Lite falsified on physical rig data; KILL FACC line (fail-branch, pts 100.0 > 70)", "parent": "N187", "frontier": "control-policy x generalization x SE(3)-conditioned (attacking pi0 fixed affordance manifold)", "metric": null, "strategy": "T225 FACC-Lite: freeze T224 band-local median+IQR soft-clip (thr_b=[107.7861,90.3420,80.2145] asserted bit-identical), replace s_base=max(0,wraw-thr_b) with s'=(1+alpha*E)*s_base where E is an energy-based in-context scalar head over SE(3)+contact residuals (d=10, 103 CALIB-success bank, log-partition free energy, sigmoid z-sigmoid, 2 params); pooled-2 Q{0.65,0.8}; frozen I7+I10; zero rig edits; frozen R173 files. All 3 bands infeasible for every alpha in {0,0.25,0.5,1,2,4} and every pooled-0/2 grid -> all-reject fallback -> degenerate 100.0 (n_adm 0/120, heldB keep 0.0, coverage regression).", "falsifications": {"P1_zero_support_collapse": "thr_0=107.7861 > wraw hard ceiling 100.0=1/(0.005+0.005) -> s_base=0 for EVERY band-0 episode (calib+held max 100.0) -> s'=0 for all alpha and all finite E; the energy head cannot act on a zero score", "P2_threshold_invariant": "global thr multiplier m infeasible at all 3 bands for every m in [0.05,1.00] (20-step sweep); first_feasible_m=None; recoverable=False", "P3_inversion_decisive": "auc_hi_is_fail = P(fail scores HIGHER than succ) = [0.500,0.361,0.379], mean 0.4133<0.5 -> failures are the LOW-s tail; s'=(1+alpha*E)*s_base is monotone non-decreasing in s_base so it can only promote already-successful episodes and can never catch a low-s failure; Spearman(s_base,s'_a1)=0.9992", "P4_energy_not_orthogonal": "auc_hi_is_fail on E alone = 0.4847 (chance level); E runs correctly (calib [0.0613,1.0], held [0.0842,0.9999], finite, var>0) but carries no usable separation"}, "metrics": {"idea": "T225", "variant": "FACC-Lite SE(3)-conditioned force-adaptive residual s'=(1+alpha*E)*s_base", "seeds": 20, "gate_mode": "post-hoc", "path": "fitted-frozen", "alpha_grid": [0, 0.25, 0.5, 1, 2, 4], "alpha_sweep_feasible": "0/6", "pooled0_x_alpha_feasible": "0/12", "E_permuted_feasible": "0/6", "lobo_feasible": "0/3", "zero_inf_nan": true, "E_off_bit_identical_to_T224": true, "s_base_frac_zero_calib": 0.85, "s_base_frac_zero_held": 0.775, "wraw_hard_ceiling": 100.0, "thr_band": [107.7861, 90.342, 80.2145], "mean_auc_hi_is_fail_T225": 0.4133, "mean_auc_hi_is_fail_E_alone": 0.4847, "spearman_s_base_vs_alpha1": 0.999187, "n_held_reordered_alpha1": 27, "viol_slice_n": 7, "viol_slice_n_fails": 4, "viol_slice_win": false, "tie_slice_n": 113, "tie_slice_n_fails": 11, "viol_win_leg_met": false, "first_feasible_m": null, "recoverable": false, "heldB_keep_pct": 0.0, "pooled_failure_recall_pts": 100.0, "degenerate_all_reject": true, "n_adm": 0, "cov_ok": false, "archive_adm_frac": 0.0, "discard_counter": 9, "director_predicted_keep_38_45": 0.0, "runA_keep_cited": true, "runA_fixture_B": {"succ_a": 15, "succ_b": 20, "welch_p": 0.00010868123615477709, "fisher_p": 0.047124047124047136}}, "fabrication_check": "G7-compliant: post-hoc scoring on frozen physical rig outputs, zero rig edits, no teleport, no arithmetic on coverage/success, all values emitted by the rig's physics-contact path; anchored kill executed; disk 13G free; no banned phrases; worklog append-only", "evidence": ["results/aegis_v2/I2_r225_analysis.py", "results/aegis_v2/I2_r225_result.json", "equations.md ROW T225", "experiments/worklog.md Run 232"], "timestamp": "2026-09-29T00:00:00Z"}
{"type": "edge", "from": "N187", "to": "N188-T225", "kind": "derived", "run": 232, "label": "T225 FACC-Lite falsified on physical data: P1 zero-support collapse (thr_0=107.79 > wraw ceiling 100.0), P2 threshold-invariant infeasibility (m in [0.05,1.00]), P3 inversion (mean AUC hi-is-fail 0.413 < 0.5; multiplicative form monotone non-decreasing so it can never catch a low-s failure), P4 energy head chance-level (0.485). Fail-branch FIRES -> KILL FACC line; freeze champion trochoid (B 1.00, Fisher p=0.0083); I2 stays CLOSED; next queued I8 (curved bowl).", "timestamp": "2026-09-29T00:00:00Z"}
{"type": "node", "id": "N189-T226", "run": 233, "segment": 15, "idea": "I2/T226", "status": "discard", "verdict": "DISCARD - adaptive-threshold FACC sub-line CLOSED by a class-level impossibility (78/78 cells infeasible, worst-band recall ceiling 0.5714 < 0.65)", "parent": "N188", "frontier": "control-policy x generalization x contact-conditioned adaptive gating (attacking pi0 fixed affordance manifold)", "metric": 0.0, "metric_unit": "fixture_B transfer_success of the gate-admitted set /20 HELD R173 episodes", "strategy": "T226 FACC-Full: UNFREEZE the band fence. thr_b(e)=clip(med_b + alpha*W(fn_p95) + beta*med_b*D_SE3, 5, 100) on contact-phase episodes, else med_b; s=max(0,wraw-thr_b); p=1-exp(-s/scale_b); admit <=> p<=tau_b per band (Q8 grid, recall_b>=0.65 then min pf). alpha{0,+-0.1,+-0.25,+-0.5,+-1,+-2,+-4} x beta{0,+-0.5} x 2 wrench norms = 78 cells; selection on CALIB only, HELD scored once; frozen I7+I10; zero rig edits; frozen R173.", "falsifications": {"P1_threshold_free_recall_ceiling": "s=max(0,wraw-theta) with admit<=>s<=tau, tau>=0 forces wraw=0 => s=0 => ADMIT for every tau, so recall_b <= #{fails_b: wraw>theta_b}/#{fails_b} independent of tau, alpha, beta and the grid. ceil(alpha=0)=[0.500,0.000,0.286] (fails [6,4,7], reachable [3,0,2]); best worst-band ceiling over all 78 cells = 0.5714 (alpha=-0.1,beta=-0.5,robust_z, ceil=[1.000,1.000,0.571]) < 0.65 criterion. => per-band fit infeasible everywhere; all-reject fallback; degenerate heldB keep 0.0, cov 0.0 vs 0.9883.", "P2_clamp_is_the_mechanism": "75% of episodes sit in an fn_p95 atom at 0.4968 N, so FP_MAD=8.90e-04 N vs a 0.973 N signal gap and the robust z reaches 1093; every non-zero alpha saturates thr at an endpoint (12/78 cells clamp-bind on >50% of episodes) so each cell collapses onto the alpha=0 fence or the all-reject corner. The min-max arm is inert (identical ceilings for all alpha).", "P3_score_inversion_survives": "fn_p95 alone has auc_hi_is_fail=0.582 (9/17 failures in the high-force spike); the T226 score at the ceiling-maximising cell has auc_hi_is_fail=[0.495,0.340,0.383], mean 0.406 < 0.5. T225-P3 inversion SURVIVES the adaptive threshold: the residual form inverts the only informative channel.", "P4_structural_blindness": "wraw := 0 on every t173-negative episode, so the gate inherits the trigger of the detector it vetoes. The t173-tripping failures are the OBSTACLE_STALL/escape ones (7/17 CALIB, 4/15 HELD, coverage_cont=0) - the physically dangerous ones. No transform of wraw can intercept them.", "P5_contact_shift_gap": "The requested contact-shift split is UNAVAILABLE and is reported as a gap, not a pass: CALIB/HELD (pose 0.01,2) are 120/120 contact-phase (restriction bit-inert); the ARCHIVE (pose 2.0,2) is 120/120 free-space/escaped (fn_mean=0), contributing no contact-phase episode."}, "evidence": "results/aegis_v2/I2_r226_analysis.py, results/aegis_v2/I2_r226_result.json", "integrity_g7": "no arithmetic on coverage_cont/success; no rig edits; frozen R173 physical files; the min-max arm was registered after observing arm-1 clamp saturation and is disclosed", "timestamp": "2026-09-29T03:44:11Z"}
{"type": "edge", "from": "N188", "to": "N189-T226", "kind": "falsified_by_impossibility", "run": 233, "label": "T226 adaptive-threshold FACC sub-line closed with a CLASS-LEVEL result, not a point falsification: for any fence theta_b(e) in the wraw-residual class with admit<=>s<=tau and tau>=0, the per-band failure-recall ceiling is #{fails_b: wraw>theta_b}/#{fails_b} = [0.500,0.000,0.286] at alpha=0 and at most 0.5714 in the worst band over all 78 cells, below the 0.65 criterion. Root cause is structural: the gate shares the t173 trigger of the detector it vetoes and is blind to the stall/escape failures that actually hurt. KILL T224/T225/T226; freeze the champion trochoid (B 1.00, Fisher p=0.0083); I2 stays CLOSED; next queued I8 (curved bowl). The only untried lever is a DIFFERENT trigger (stall/timeout/tracking-residual), which leaves the frozen I7+I10 score.", "timestamp": "2026-09-29T03:44:11Z"}
{"type": "node", "id": "N190-I13", "run": 234, "segment": 15, "idea": "I13", "status": "discard", "verdict": "DISCARD - pre-registered abort fired (escapes >50% at every alpha, B <= 0.05 vs bar 0.50); I8 stays BLOCKED after unblock 1 of 3", "parent": "N189", "metric": 0.05, "frontier": "realism: curved-bowl fixture (I8) - why the flat champion cannot scrub a paraboloid", "strategy": "I13 quasi-static speed scheduling on curvature: v(s)=v0/(1+alpha*kappa) as a tick->arclength time re-parameterisation (total tick budget unchanged, no force/solver/scoring change); paired 20-seed vs alpha=0 on the same bowl", "timestamp": 1790654177, "source": "director v4 queue I13 (I8 unblock 1)"}
{"type": "edge", "from": "N189", "to": "N190-I13", "kind": "falsified", "run": 234, "label": "I13 falsified on the rig: quasi-static re-timing HALVES the ballistic launch fraction (0.1115 -> 0.0378 at alpha=4) yet escapes RISE (0.50 -> 0.60) and coverage stays 0.28-0.32 vs the 0.90 bar, keep=false in both compare records (Welch p 0.61/0.89, Fisher p 1.0). Launching is not the binding failure - force-tracking is: p90 residual 0.35-0.53 m on the bowl vs 0.0106 m flat (33-50x, no overlap). Handoff: the blocker is servo/contact stability, so unblock 2/3 must touch the press gain (I15 AEGIS_FORCE_PI), not the clock. Also supplies the physically independent gate trigger the T226 handoff asked for: tracking residual (flat/bowl separated with zero overlap) where every wraw transform in T208-T226 collapsed to 46.67-100.0 pts.", "timestamp": 1790654177}
{"type": "node", "id": "N191-I8frontier", "segment": 15, "idea": "I8", "status": "frontier", "verdict": "OPEN - next unblock attempt is I15 (fn setpoint press regulation), then I14 (containment); I13 is closed", "parent": "N190-I13", "metric": null, "frontier": "curved bowl: flat champion (trochoid, B 1.00) collapses to B 0.00-0.05 the moment the top face is a paraboloid (k=0.01)", "strategy": "I15 AEGIS_FORCE_PI: replace the constant KP_PRESS term with a PI loop on measured fn to AEGIS_FN_SET - the only unblock attempt that touches the press gain, which the I13 diagnosis identifies as the cause. Note for the director: an fn setpoint loop is a controller, not an admission gate, so G7's ban on soft/adaptive/learned GATE variants does not bar it.", "timestamp": 1790654177, "source": "I13 handoff"}
{"type": "edge", "from": "N190-I13", "to": "N191-I8frontier", "kind": "derived", "run": 234, "label": "diagnosis-driven redirect: I13 ruled out the clock, so the I8 unblock sequence advances to the press-gain attempt (I15) before containment (I14)", "timestamp": 1790654177}
{"type": "node", "id": "N192-I15", "run": 235, "segment": 15, "idea": "I15", "status": "discard", "verdict": "DISCARD - both pre-registered bars missed (bowl B success 0/20 vs 0.90; force_compliance 0.185 vs 0.90), rig compare keep=false; I8 stays BLOCKED after unblock 2 of 3", "parent": "N191-I8frontier", "metric": 0.0}
{"type": "edge", "from": "N191-I8frontier", "to": "N192-I15", "kind": "falsified", "run": 235, "label": "I15 falsified on the cambered bowl (20 seeds x 3 suites, paired, AEGIS_FORCE_PI=1 vs 0.0, same bowl in both arms). A PI regulator on the MEASURED contact normal force cannot reach a 0.5 N setpoint: the measured force is 2.59 N on B (5.2x the setpoint) and 93% of it is carried by the heightfield liner, so the integral saturates at the 0 rail and the loop degenerates into a press-OFF controller (mean commanded press 0.500 -> 0.252 N). Halving the press removes only 21% of the force, so on a cambered surface the normal force is set by the KP tracking term levering the head against the slope, NOT by the press channel -- a class-level negative for the whole force-targeting family (I11/I15) and for the press channel of the T208-T226 gate line. Effect on the primary metric: B coverage_cont 0.3797 -> 0.4414 (+0.062, Welch p=0.41, paired p=0.10), R regresses -0.012, success 0/20 -> 0/20, Fisher p=1.0, escapes unmoved 10/20 both arms. Rig MEASUREMENT fix shipped with it: the bowl liner is now a counted contact body (the old base-only query under-counted the force ~40x on the bowl); flat champion proven bit-identical, 40/40 episodes on 11 fields. Handoff: after the clock (I13) and the press (I15) are ruled out, only containment (I14) remains untried on I8.", "timestamp": 1790654798}
{"type": "node", "id": "N193-I14", "run": 236, "segment": 15, "idea": "I14", "status": "discard", "parent": "N191-I8frontier", "metric": 0.0, "verdict": "DISCARD - pre-registered bowl-escape bar missed in BOTH arms (9/20 clamp+wall, 11/20 wall-only vs <5%); rig keep=false, B success 0/20. Containment is not the binding constraint: the escape is a vertical ballistic launch (z_exc_max up to 4.26 m) that a lateral force capped at 3.0 N cannot touch; the wall-only ablation is negative (A coverage 0.2984->0.1448 p=0.0002) because the wall fights the trochoid loops that generate coverage."}
{"type": "edge", "from": "N191-I8frontier", "to": "N193-I14", "kind": "falsified", "run": 236, "label": "I14 falsified on the cambered bowl (20 seeds x 3 suites, paired, AEGIS_INSET_M=0.020 clamp+wall and AEGIS_INSET_M=0.010 wall-only vs AEGIS_INSET_M=0.0, same bowl in both arms). B escapes 10/20->9/20 and 10/20->11/20 against the <5% bar; B success 0/20 both arms. The wall's max penetration is 0.35-0.53 m and the launch z-excursion reaches 3.6 m (candidate) / 4.3 m (baseline), so the failure mode is vertical and force-tracking, not lateral exit.", "timestamp": 1790655564.7660832}
{"type": "node", "id": "N194-I8frontier", "run": 236, "segment": 15, "idea": "I8", "status": "frontier", "parent": "N193-I14", "metric": null, "verdict": "OPEN but UNBLOCK-EXHAUSTED - all three named unblocks are now tried and failed (clock I13, press I15, containment I14). Measured blocker: the plane-tuned KP/KD/press servo diverges on the paraboloid (p90 residual 0.28-0.35 m vs 0.0106 m flat) and launches the head vertically off the camber. Next proposal (not claimed): re-tune the SERVO on curvature (curvature-aware KP/KD or a normal-frame decomposition), or add a vertical-axis compliance term - not another path/containment/press wrapper."}
{"type": "edge", "from": "N193-I14", "to": "N194-I8frontier", "kind": "derived", "run": 236, "label": "diagnosis-driven redirect: I14 ruled out lateral containment, so the unblock sequence is exhausted; the residual evidence (launch z-excursion, p90 tracking residual, bowl force share) points at the servo/contact-stability law itself.", "timestamp": 1790655564.7660832}
{"type": "node", "id": "N195-I17", "run": 237, "segment": 15, "idea": "I17", "status": "discard", "parent": "N194-I8frontier", "metric": 0.3, "verdict": "DISCARD, falsified not unvalidated. Alternating the trochoid loop winding per row makes the loop phase a TRIANGLE wave (row 0: 0->W, row 1: W->0, W = rate*row_length = 13.33 rad = 2.12 turns), so odd rows retrace even rows EXACTLY (max retrace error 0.0 m). The fresh-phase-per-row advance was the only mechanism by which the superimposed loops add footprint; on a 2-row patch (CELL_M 0.05 m over a 0.12 m side) that halves it. fixture_B coverage_cont 0.9453 -> 0.8844 (Welch p=4.8e-05), success 20/20 -> 6/20 (Fisher p=3.3e-06); R 19/20 -> 8/20; A coverage flat but success 20/20 -> 14/20. Slip bit-identical, no escapes: pure footprint loss. The premise also failed: the champion's per-row mean v-offset is -0.0022/+0.0017 m, already ~0, so there was no lateral drift to cancel."}
{"type": "edge", "from": "N194-I8frontier", "to": "N195-I17", "kind": "queued-executed", "run": 237, "label": "lowest-numbered queued idea executable on the canonical rig (I16 done run 201; I2 CLOSED, I3 needs I19 + a learned policy, I4/I6 GPU lane, I8 BLOCKED, I11 force-family falsified run 235, I12 depends on I8). Director iter-6 FACC build adjudicated, not run: no paired --compare record is possible for a learned action head in the canonical rig, the pi0 policy + demo keypoints are not constructible locally (checkpoints may never be downloaded), G3 permanently retires flow-bridge / energy-gated re-derivations, and the FACC line is already closed twice on physical data (T225 run 232, T226 run 233). Precedent: runs 234/235/236.", "timestamp": 1790656178.9847214}
{"type": "edge", "from": "N195-I17", "to": "N196-next", "kind": "derived", "run": 237, "label": "class-level closure of the phase re-schedule family: a C1 winding reversal REQUIRES a continuous phase, and a continuous phase is necessarily a retrace, so winding alternation cannot buy footprint on a loop-superimposed path. I16 already put the trochoid on a coverage plateau, so no phase schedule can buy coverage from a plateau. Remaining v4 queue: I21 (diagnose fitted pitch, gates I18) then I19/I20 gate rethinks. I8 stays BLOCKED; the standing proposal is curvature-aware servo re-tuning / normal-frame decomposition, not another path, containment or press wrapper.", "timestamp": 1790656178.9847214}
{"type": "node", "id": "N196-next", "run": 237, "segment": 15, "idea": "I21", "status": "frontier", "parent": "N195-I17", "metric": null, "verdict": "OPEN. Next executable queued idea is I21 (diagnose WHY fitted pitch scored B 0.20 vs trochoid 1.00) because it gates I18. I8 remains BLOCKED/unblock-exhausted; the only untried direction anyone has named is re-tuning the SERVO for curvature (curvature-aware KP/KD or normal-frame decomposition), since the measured blocker is a plane-tuned servo diverging on the paraboloid (p90 residual 0.28-0.35 m vs 0.0106 m flat)."}
{"type": "edge", "from": "N196-next", "to": "N197-I21", "kind": "queued-executed", "run": 238, "label": "lowest-numbered queued idea executable on the canonical rig (I16 done 201, I17 done 237, I2 CLOSED, I3 needs I19 + a learned policy, I4/I6 GPU lane, I8 BLOCKED/unblock-exhausted, I11 force family falsified 235, I12 depends on I8); I21 gates I18 so it goes first. Director iter-7 FACC-E build adjudicated, not run, on the runs 234-237 precedent: no paired --compare record is constructible for a learned action head in a force-driven-pad rig, the pi0 policy and demo keypoints cannot be built locally (checkpoints may never be downloaded), G3 permanently retires flow-bridge / energy-gated re-derivations, and the FACC line is already closed twice on physical data (T225 232, T226 233).", "timestamp": 1790656651.725053}
{"type": "node", "id": "N197-I21", "run": 238, "segment": 15, "idea": "I21", "status": "keep", "parent": "N196-next", "metric": 1.0, "verdict": "CLOSED WITH A CAUSE. The spec premise is stale: 'fitted B 0.20' describes the v1 path of commit ac8bc4b, not the shipped path. v1 is reconstructed verbatim and scored with the rig's own fine-cell kernel, which attributes the loss instead of asserting it: on fixture-B v1 emitted ONE row (v_start -0.025, v_end +0.025, pitch 0.056, the while-loop stops at +0.031), so the plan swept 0.070 m of a 0.120 m patch and 100.00% of the missed fine cells are RIM cells. Analytic ceiling v1 verbatim B 0.8021 / A 0.9306; removing only the u-inset recovers +0.0312 on B; the shipped v2 rule n=ceil(side/2r_eff) at band centres with no inset reaches 1.0000 (+0.1979). Hypotheses: (a) pitch math YES, (b) inset secondary, (c) phase bug REFUTED (no interior miss in any variant). Paired re-decider, 20 seeds x 3 suites, pose_noise 0,0, --compare trochoid: fixture_B 20/20 coverage_cont 1.0000 (min per-episode 1.0) vs champion 0.9453, Welch p=5.26e-06, paired p=5.26e-06, Fisher p=1.0 (both arms saturated at 20/20), rig keep=true; A +0.0646 p=1.35e-09, R 19/20->20/20 +0.0573 p=1.24e-06; harness_errors 0. Same kernel on the champion: trochoid ceiling 0.9219/0.9531/1.0000 on B, its misses also 100% rim -- the champion clears 0.90 only because pad 2's footprint is large enough. Caveats logged: both arms saturate on success at 0,0 so the success margin rests on the prior paired decider at 0.01,2 (fitted 0.875 vs trochoid 0.750, runs 165/170) and is cited, not re-claimed; path_len_m is logged with the default r_eff=0.035 not the pad's own, which overstates fixture-A pad 2 and inflates its step budget, but all three pads plan the identical 2-row path on fixture-B so the G2 metric is free of the confound -- left unedited, log-only field, editing the step budget would re-time every other idea's episode."}
{"type": "edge", "from": "N197-I21", "to": "N198-next", "kind": "derived", "run": 238, "label": "I18 is now unblocked and its outcome is PREDICTED, not guessed: trochoid and `fitted` surrender the SAME cells to the SAME cause (100% rim, zero interior on every suite x tool cell), and `fitted` alone already attains the coverage ceiling 1.0000, so the composition CANNOT win on coverage. I18 is therefore only worth a run against a strictly higher bar than 1.0000, and its only admissible justification is a non-coverage win (path length / cycle time: fitted is already 0.8939 m vs trochoid 0.9098 m on B and 1.3878 vs 1.4118 on A, i.e. the composition would have to beat that). Class-level close of the footprint-aware-pitch family: an inset-parameterised pitch plan is self-defeating because the scorer already inflates every contact by r_eff, so the plan must span the PATCH at pitch <= 2*r_eff with no inset -- nothing further is left to fix there. Remaining v4 queue after I18: I19 then I20 (gate rethinks). I8 stays BLOCKED/unblock-exhausted; the standing proposal remains curvature-aware servo re-tuning / normal-frame decomposition, not another path, containment or press wrapper.", "timestamp": 1790656651.725053}
