{"run": 233, "segment": 15, "idea": "T226", "status": "discard", "timestamp": "2026-09-29T03:43:36Z", "rig": "frozen R173 canonical-rig episodes (PyBullet DIRECT, 20 seeds x 3 suites x 2 path modes; pts_source=physics_contact; coverage_cont from physics contacts at return time)", "command": "timeout 1200 python3 results/aegis_v2/I2_r226_analysis.py", "compare_champion": "trochoid (physical champion, fixture_B transfer_success 1.00, Fisher p=0.0083 vs raster)", "metric": 0.0, "metric_unit": "fixture_B transfer_success (coverage_cont>=0.90) of the gate-admitted set, /20 HELD R173 episodes", "metrics": {"idea": "T226", "variant": "FACC-Full contact-conditioned adaptive threshold (director iter 51)", "rule": "thr(e)=clip(med_b + alpha*W(fn_p95) + beta*med_b*D_SE3, 5, 100); s=max(0,wraw-thr); p=1-exp(-s/scale_b); admit <=> p<=tau_b; non-contact episodes fall back to med_b", "norms": ["robust_z (primary)", "minmax (registered after arm-1 clamp saturation)"], "alpha_grid": [0.0, -0.1, 0.1, -0.25, 0.25, -0.5, 0.5, -1.0, 1.0, -2.0, 2.0, -4.0, 4.0], "beta_grid": [0.0, -0.5, 0.5], "tau_grid": [0.5, 0.6, 0.65, 0.7, 0.75, 0.8, 0.85, 0.9], "seeds": 20, "path": "fitted+trochoid", "gate_mode": "post-hoc (score only, never controls)", "grid_cells": 78, "grid_feasible": 0, "recall_criterion_per_band": 0.65, "heldB_keep_pct": 0.0, "heldB_discard_pct": 100.0, "heldB_n_adm": 0, "coverage_cont_champion_all20": 0.9883, "coverage_cont_admitted": 0.0, "degenerate_all_reject": true, "P1_threshold_free_recall_ceiling": {"alpha0_ceiling_band": [0.5, 0.0, 0.2857], "alpha0_n_fail_band": [6, 4, 7], "alpha0_fails_reachable_band": [3, 0, 2], "best_worst_band_ceiling_over_all_78_cells": 0.5714, "criterion": 0.65, "recoverable": false, "statement": "s == 0 implies p == 0 implies ADMIT for every tau >= 0, so failure-recall is upper-bounded by the fraction of failures with wraw > thr_b -- independent of the tau grid. That ceiling is below the 0.65 criterion in every band at alpha=0, so the per-band fit cannot be feasible in the alpha=0 limit."}, "P2_alpha_grid_is_a_no_op": {"cells_clamp_binding_over_half": 12, "distinct_recall_ceilings": 11, "statement": "The 5% lower clamp is not a safety rail on this data, it is the whole mechanism: for every non-zero alpha the term alpha*W saturates thr at one endpoint (W_max ~ 1.6e3 under the robust z, alpha*W_max >> 100), so each cell collapses onto either the alpha=0 fence or the thr == ceiling all-reject corner. The 78-cell surface is therefore flat."}, "P3_wrench_signal_real_but_scaling_degenerate": {"auc_hi_is_fail_fn_p95_alone": 0.582, "spike_failures": 9, "n_fail_calib": 17, "fp_mad": 0.00088956, "fp_gap_over_mad": 1093.35, "z_wrench_max": 1093.35, "spike_is_bimodal_atom": true}, "P4_score_still_inverted": {"auc_hi_is_fail_s_per_band_REF": {"0": 0.4951, "1": 0.3403, "2": 0.3831}, "auc_hi_is_fail_wrench_alone_per_band_REF": {"0": 0.5196, "1": 0.6111, "2": 0.6364}, "statement": "T225-P3 inversion survives the adaptive threshold: mean AUC(hi-is-fail) of the T226 score is 0.406 < 0.5 while the wrench channel ALONE is 0.589, so the residual score actively destroys the only real signal in the episode."}, "P5_structural_blindness": {"t173_false_failures_calib": 3, "t173_false_failures_held": 4, "wraw_zero_by_construction": true, "statement": "wraw := 0 for every episode failing the T173 trigger, so s = max(0, 0 - thr) = 0 and p = 0, which is ADMITTED by every tau >= 0. The 7/17 CALIB + 4/15 HELD failures that trip T173 (OBSTACLE_STALL / escape) are therefore structurally unreachable by ANY gate in the wraw-residual class -- the gate shares the trigger of the detector it is supposed to veto."}, "minmax_arm_inert": true, "clamp_off_best_ceiling_band": [1.0, 1.0, 0.8571], "contact_slices": [{"slice": "held_0.01,2", "n": 120, "n_contact": 120, "n_free_space": 0, "contact": {"n": 120, "n_adm": 0, "keep_pct": 0.0, "discard_pct": 100.0, "contact_success_pct": null, "cov_adm": 0.0}, "free_space": {"n": 0, "n_adm": 0, "keep_pct": null, "discard_pct": null, "contact_success_pct": null, "cov_adm": 0.0}}, {"slice": "archive_2.0,2_contact_shift", "n": 120, "n_contact": 0, "n_free_space": 120, "contact": {"n": 0, "n_adm": 0, "keep_pct": null, "discard_pct": null, "contact_success_pct": null, "cov_adm": 0.0}, "free_space": {"n": 120, "n_adm": 0, "keep_pct": 0.0, "discard_pct": 100.0, "contact_success_pct": null, "cov_adm": 0.0}}], "free_space_episodes_total": 120, "contact_restriction_active": true, "contact_shift_note": "CALIB/HELD (pose 0.01,2) are 100% contact-phase, so the contact-only restriction is bit-inert there; the ARCHIVE (pose 2.0,2) is 100% free-space/escaped (0 contact episodes), so it supplies no contact-phase data either. The contact-shift split the director asked for is NOT available in the frozen R173 set -- reported as a coverage gap, not as a pass.", "lobo": {"per_band": [{"held_out_band": 0, "recall": 0.8333, "feasible": true}, {"held_out_band": 1, "recall": null, "feasible": false}, {"held_out_band": 2, "recall": null, "feasible": false}], "recall_spread": 0.0, "pass": false, "feasible_bands": 1}, "zero_inf_nan": 0, "alpha0_s_finite": true, "keep": false, "verdict": "DISCARD", "g7_adaptive_gate_ban_applies": true, "director_prediction": "72-75 keep, first keep>=70, breaks 0/3 discard streak", "director_prediction_missed": true, "discard_counter": 10, "line_keep": 0, "kill": "adaptive-threshold FACC sub-line (T224/T225/T226): CLOSED for the third time. The class is impossible, not merely mis-tuned -- see P1/P5.", "next": "I8 (curved bowl, the next queued non-I2 idea); the gate family needs a DIFFERENT trigger (stall/timeout/tracking-residual), not another transform of wraw.", "evidence": "results/aegis_v2/I2_r226_analysis.py, results/aegis_v2/I2_r226_result.json"}, "evidence_file": "results/aegis_v2/I2_r226_result.json", "integrity_g7": "no arithmetic on coverage_cont or success; no rig edits; no teleport; frozen R173 physical files; b_a_minmax registered AFTER observing arm-1 clamp saturation and disclosed in metrics.norms", "banned_phrases_checked": true, "timeout_s": 1200, "cleanup_anchored_kill": true, "verdict": "DISCARD"}
{"run": 234, "segment": 15, "status": "discard", "idea": "I13", "timestamp": "2026-09-29T09:30:00Z", "rig": "canonical rig experiments/kaggle_aegis_sweep.py (PyBullet DIRECT, system python3, 20 seeds x 3 suites x 2 arms, trochoid path, pose_noise 0,0, rig_version 2); bowl liner AEGIS_SURFACE=bowl AEGIS_BOWL_K=0.01 in BOTH arms; pts_source=physics_contact; coverage_cont computed from physics contacts at return time", "command": "AEGIS_SURFACE=bowl AEGIS_BOWL_K=0.01 AEGIS_SPEED_ALPHA=8.0 timeout 1200 python3 experiments/kaggle_aegis_sweep.py --seeds 20 --no-upload --path trochoid --compare trochoid --compare-env AEGIS_SPEED_ALPHA=0.0 --suites fixture_A,fixture_B,fixture_R --out results/aegis_v2/I13_r234_a8.0_k001.jsonl  (alpha=4.0 arm: .../I13_r234_a4.0_k001.jsonl)", "compare_champion": "paired in-rig control: identical seeds / friction / tool / noise / bowl, AEGIS_SPEED_ALPHA=0.0 (the frozen uniform tick->arclength map). Flat-surface champion trochoid quoted as reference only (B 1.00, coverage_cont 0.9453, results/aegis_v2/v2_trochoid_0,0.jsonl).", "metric": 0.05, "metric_unit": "fixture_B transfer_success (coverage_cont>=0.90) of the alpha=8.0 arm, /20 seeds (G4 rig keep=false)", "metrics": {"idea": "I13", "lane": "CPU canonical rig", "variant": "I8 unblock attempt 1 of 3 - quasi-static speed scheduling on the bowl (v(s)=v0/(1+alpha*kappa))", "mechanism": "tick->arclength TIME re-parameterisation: t_i = sum_j ds_j (1 + alpha*kappa_j), kappa = |d theta|/ds of the horizontal heading; tick->waypoint index uniform in t. Total tick budget unchanged, no force gain / solver / scoring term touched.", "alpha_grid_20seed": [8.0, 4.0], "alpha_screen": [0, 0.25, 0.5, 1, 2, 4, 8], "bowl_k_m": 0.01, "prereg_bar": {"escapes_lt": 0.05, "fixture_B_success_ge": 0.5, "keep_B_gt": 0.7, "keep_p_lt": 0.01}, "fixture_B_alpha8": {"succ_base": "0/20", "succ_cand": "1/20", "coverage_cont_base": 0.2672, "coverage_cont_cand": 0.318, "coverage_cont_delta": 0.0508, "welch_p": 0.6087, "paired_p": 0.317, "fisher_p": 1.0, "keep": false, "escaped_base": 0.5, "escaped_cand": 0.55, "launch_frac_base": 0.1115, "launch_frac_cand": 0.0557, "slip_p90_base_m": 0.3458, "slip_p90_cand_m": 0.353}, "fixture_B_alpha4": {"succ_base": "0/20", "succ_cand": "1/20", "coverage_cont_base": 0.2672, "coverage_cont_cand": 0.2805, "coverage_cont_delta": 0.0133, "welch_p": 0.8864, "paired_p": 0.6311, "fisher_p": 1.0, "keep": false, "escaped_base": 0.5, "escaped_cand": 0.6, "launch_frac_base": 0.1115, "launch_frac_cand": 0.0378, "slip_p90_base_m": 0.3458, "slip_p90_cand_m": 0.4005}, "fixture_A_alpha8": {"succ_base": "0/20", "succ_cand": "0/20", "coverage_cont_base": 0.1771, "coverage_cont_cand": 0.1141, "welch_p": 0.2047, "fisher_p": 1.0}, "fixture_R_alpha8": {"succ_base": "1/20", "succ_cand": "2/20", "coverage_cont_base": 0.2896, "coverage_cont_cand": 0.3221, "welch_p": 0.7352, "fisher_p": 1.0}, "flat_champion_reference": {"file": "results/aegis_v2/v2_trochoid_0,0.jsonl", "fixture_B_success": 1.0, "fixture_B_coverage_cont": 0.9453, "fixture_B_slip_p90_m": 0.0106}, "frozen_rig_regression": {"episodes": 6, "bit_identical_at_alpha0": true, "additive_fields_only": ["launch_frac", "speed_alpha", "z_exc_max_m"]}, "rig_edits": ["AEGIS_SPEED_ALPHA knob (default 0.0 = OFF, frozen map preserved) + _warp_table/_warp_index", "header provenance surface/bowl_k_m/speed_alpha/launch_z_m (G7 header gap closed)", "diagnostics z_exc_max_m, launch_frac, escaped_frac, mean_z_exc_max_m in metrics/aggregate"], "abort_fired": "escapes > 50% at every alpha (bar < 5%) and B <= 0.05 (bar >= 0.50)", "falsification": "quasi-static premise HALF holds: launch fraction halves (0.1115 -> 0.0378 at alpha=4) but escapes RISE (0.50 -> 0.60) and coverage stays 0.28-0.32 vs the 0.90 bar. Launching is not the binding failure; force-tracking is: p90 residual 0.35-0.53 m on the bowl vs 0.0106 m flat (33-50x), i.e. KP/KD/press gains tuned for a plane diverge on a paraboloid. Re-timing ticks cannot restore tracking stability.", "frontier_handoff": "I8 stays BLOCKED (unblock 1 of 3 done). Blocker characterised as servo/contact stability, so the next unblock attempt must touch the press gain (I15 AEGIS_FORCE_PI fn-setpoint regulation), not the clock. For the post-T226 search: the TRACKING RESIDUAL separates flat from bowl with no overlap (0.0106 vs 0.35-0.53 m) where every wraw transform in T208-T226 collapsed to 46.67-100.0 pts - a physically independent candidate for the stall/timeout/tracking-residual trigger the T226 handoff asked for.", "evidence": ["results/aegis_v2/I13_r234_a8.0_k001.jsonl", "results/aegis_v2/I13_r234_a4.0_k001.jsonl", "results/aegis_v2/I13_r234_analysis.py", "results/aegis_v2/I13_r234_result.json", "results/aegis_v2/I13_r234_regression_alpha0_PRE-edit.jsonl", "results/aegis_v2/I13_r234_regression_alpha0_POST-edit.jsonl"], "equations_row": "ROW I13", "next_queued": "I8 unblock 2 (I14 containment) / unblock 3 (I15 fn-feedback press) - I15 attacks the measured cause"}, "director_directive_adjudication": {"proposal": "T226 AE-ICB (iter 3): frozen-pi0 attention bias from an SE(3)-invariant visual contact-energy head, vision-only, no force", "verdict": "REJECTED - not executed", "reasons": ["G-rules: 'Never download datasets/checkpoints locally' + no local pi0/openpi (import probe: openpi None) - the frozen backbone the proposal validates against does not exist in this workspace and may not be fetched", "GPU lane is I4/I6 only via connect_gpu/run_gpu.sh; T226 is in neither queue", "G7 segment/metric freeze: 'any soft/adaptive/learned gate variant are banned from keeps' - a trained linear energy head + attention bias is exactly that, so the predicted 74-80pt KEEP is impossible by rule, independent of the physics", "G2/G4: the proposal's validation plan (novel-affordance / cross-embodiment contact splits) produces no paired --compare-trochoid rig record, so no keep could ever be claimed from it", "T226 the id is already spent: run 233 (FACC-Full adaptive threshold) closed the adaptive-threshold FACC sub-line by a class-level impossibility; the I2/T2xx family stays CLOSED"]}, "novelty_score": null, "sota_gap_only": false, "notes": "No banned phrases (remote GPU deferred / deferred to remote GPU / same dependency). No teleport, no arithmetic coverage, no synthetic proxy used for any decision. Unvalidated-cap respected: one alpha screen (4 seeds, 7 configs) then full 20-seed paired deciders for both pre-registered alphas; no unvalidated row written. Worklog append-only."}
{"run": 235, "segment": 15, "status": "discard", "idea": "I15", "timestamp": "2026-09-29T11:05:00Z", "rig": "canonical rig experiments/kaggle_aegis_sweep.py (PyBullet DIRECT, system python3, 20 seeds x 3 suites x 2 arms, trochoid path, pose_noise 0,0, rig_version 2); cambered liner AEGIS_SURFACE=bowl AEGIS_BOWL_K=0.01 in BOTH arms; contact_bodies=fixture+bowl_liner; pts_source=physics_contact; coverage_cont recomputed from physics contacts at return time", "command": "AEGIS_SURFACE=bowl AEGIS_BOWL_K=0.01 AEGIS_FORCE_PI=1 AEGIS_FN_KP=0.3 AEGIS_FN_KI=1.5 AEGIS_FN_SET=0.5 timeout 1200 python3 experiments/kaggle_aegis_sweep.py --seeds 20 --no-upload --path trochoid --compare trochoid --compare-env AEGIS_FORCE_PI=0.0 --suites fixture_A,fixture_B,fixture_R --out results/aegis_v2/I15_r235_kp0.3_ki1.5_k001.jsonl", "compare_champion": "paired in-rig control: identical seeds / friction / tool / noise / bowl with AEGIS_FORCE_PI=0.0 (the frozen constant press KP_PRESS*kp*PRESS_M = 0.5 N). Flat-surface champion trochoid quoted as reference only (B 1.00, coverage_cont 0.9453, results/aegis_v2/v2_trochoid_0,0.jsonl) and re-verified bit-identical after the rig edit.", "metric": 0.0, "metric_unit": "fixture_B transfer_success (coverage_cont>=0.90) of the PI arm, /20 seeds (G4 rig keep=false)", "metrics": {"idea": "I15", "lane": "CPU canonical rig", "variant": "I8 unblock attempt 2 of 3 - fn setpoint PI press regulation on the cambered liner", "mechanism": "press(t) = clip(base + kp*(fn_set - fn(t-1)) + I, 0, 1.2 N), base = KP_PRESS*kp*PRESS_M = 0.5 N, I += ki*(fn_set - fn(t-1))*dt applied along the ANALYTIC surface normal; fn is the previous scrub tick's MEASURED tool contact normal force, so the loop is causal and never touches coverage/success scoring. A controller, not an admission gate.", "bowl_k_m": 0.01, "fn_set_n": 0.5, "fn_kp": 0.3, "fn_ki": 1.5, "press_max_n": 1.2, "prereg_bar": {"primary_i8_bowl_B_success_ge": 0.9, "secondary_force_compliance_ge": 0.9, "keep_B_gt": 0.7, "keep_p_lt": 0.01, "abort_fn_std_doubles": true, "abort_escapes_gt_50pct": true}, "screen_4seed_B": {"grid": ["off", "ki0.5", "ki1.5", "ki4.0", "ki1.5kp0.3"], "rule": "no crash; max force_compliance; max coverage_cont; abort if fn_std > 2x PI-off", "selected": "ki1.5kp0.3", "one_screen_only": true}, "fixture_B": {"succ_base": "0/20", "succ_cand": "0/20", "fisher_p": 1.0, "coverage_cont_base": 0.3797, "coverage_cont_cand": 0.4414, "coverage_cont_delta": 0.0617, "welch_p": 0.4079, "paired_p": 0.1021, "keep": false, "fn_mean_base": 3.2775, "fn_mean_cand": 2.5861, "fn_bowl_share_cand": 0.9324, "press_mean_base_n": 0.5, "press_mean_cand_n": 0.2523, "press_max_cand_n": 1.0844, "force_compliance_base": 0.1498, "force_compliance_cand": 0.1848, "fn_std_ratio_cand_over_base": 0.9032, "escaped_base": "10/20", "escaped_cand": "10/20", "slip_p90_base_m": 0.3458, "slip_p90_cand_m": 0.335, "launch_frac_base": 0.1115, "launch_frac_cand": 0.2601}, "fixture_A": {"succ_base": "0/20", "succ_cand": "0/20", "fisher_p": 1.0, "coverage_cont_base": 0.2984, "coverage_cont_cand": 0.3177, "coverage_cont_delta": 0.0193, "welch_p": 0.7028, "paired_p": 0.5855, "keep": false}, "fixture_R": {"succ_base": "1/20", "succ_cand": "1/20", "fisher_p": 1.0, "coverage_cont_base": 0.3672, "coverage_cont_cand": 0.3555, "coverage_cont_delta": -0.0117, "welch_p": 0.8821, "paired_p": 0.6636, "keep": false}, "flat_champion_reference": {"file": "results/aegis_v2/v2_trochoid_0,0.jsonl", "fixture_B_success": 1.0, "fixture_B_coverage_cont": 0.9453, "slip_p90_m": 0.0106}, "flat_bit_identity_after_edit": {"episodes": 40, "fields": 11, "diffs": 0, "file": "results/aegis_v2/I15_r235_regression_flat_POST-edit.jsonl"}, "verdict": "DISCARD. Both pre-registered bars missed (bowl B success 0/20 vs 0.90; force_compliance 0.185 vs 0.90) and the rig compare record carries keep=false, so no keep is claimable. Falsified: the setpoint is UNREACHABLE - the measured contact force is 2.59 N = 5.2x the 0.5 N setpoint and 93% of it is carried by the liner, so the integral runs rail-saturated at 0 and the loop is a press-OFF controller (mean press 0.500 -> 0.252 N) that buys +0.062 coverage_cont at Welch p=0.41 / paired p=0.10 while R regresses -0.012 and the launch fraction rises 0.11 -> 0.26. Halving the commanded press removes only 21% of the force, i.e. the normal force on a cambered surface is set by the KP tracking term levering the head against the slope, not by the press channel: any force-targeting controller (I11/I15 family, and the press channel of the T208-T226 gate line) is structurally blind there. Escapes are unmoved (10/20 both arms), so the escape mechanism remains the binding failure after the clock (I13) and the press (I15) have been ruled out.", "evidence_file": "results/aegis_v2/I15_r235_result.json", "director_directive_adjudication": "iter-4 T226 'Dynamic-Affordance FACC' REJECTED, not executed: T226 id already spent by run 233 (FACC-Full class-level impossibility) and T225 (run 232) falsified the multiplicative SE(3) force residual; G7 bans soft/adaptive/learned gate variants from keeps so the predicted 78pt KEEP is impossible by rule; the deformable/shifted-affordance violation-split has no paired --compare record in the canonical rig. Lowest-numbered queued idea executed instead: I15.", "novelty_score": null, "sota_gap_only": false}, "evidence_file": "results/aegis_v2/I15_r235_result.json", "integrity_g7": "physical only; coverage_cont/success from physics contacts at return time; no teleport; one declared rig MEASUREMENT fix (bowl liner counted as a contacted body) proven not to move the flat champion (40/40 episodes bit-identical); one screen then the full 20-seed paired decider, zero unvalidated rows; no arithmetic coverage/success adjustment", "banned_phrases_checked": true, "timeout_s": 1200, "cleanup_anchored_kill": true, "verdict": "DISCARD - I15 falsified; I8 stays BLOCKED after unblock 2 of 3 (clock I13, press I15); only containment (I14) untried"}
