{"run": 289, "commit": "HEAD", "segment": 15, "metric": 1.0, "metrics": {"idea": "N99", "transfer_B": 1.0, "baseline_B_covc": 0.9453, "welch_p_B": 5.26e-06, "keep_compare": true, "harness_errors": 0, "identical_r288": 120}, "status": "discard", "description": "N99 EIGA-FACC adjudicated-not-executed (47th G3-retired re-derivation; contact-energy/info-gain warped manifold + SE(3) energy gate switching FACC stiffness = energy-gated/manifold-switch/flow-bridge class retired N70-N76; dropping flow-warp+PI0-top-k vs N96-98 does not un-retire; FACC closed r232/r233; N68-N98 discarded r258-r288); G4-unpairable (foam head, no contact-energy/info-gain/SE(3)-gate/FACC-stiffness keypoints; edits=fabrication; contact-rich-split delta + gate-off ablation unmeasurable); banned learned-gate + predicted-only (72.3 novelty_score class, no paired p); frozen confirmation B 1.00 keep=true 120/120 identical r288; evidence results/aegis_v2/R289_frozen_n00.jsonl"}
{"run": 290, "commit": "HEAD", "segment": 15, "metric": 1.0, "metrics": {"idea": "N100", "transfer_B": 1.0, "baseline_B_covc": 0.9453, "welch_p_B": 5.26e-06, "keep_compare": true, "harness_errors": 0, "identical_r289": 120}, "status": "discard", "description": "N100 FACC-DAM adjudicated-not-executed (48th G3-retired re-derivation; SE(3) force-error energy-attention live-remap affordance-equivalence class = energy-gated/manifold-switch/flow-bridge class retired N70-N76; variation vs N93-N99 does not un-retire; FACC closed r232/r233; N68-N99 discarded r258-r289); G4-unpairable (foam head, no SE(3)-force/FT-energy/equivalence keypoints; edits=fabrication; contact-rich-split + SE(3)-perturbation tests unmeasurable); banned learned-gate + predicted-only (74pts, no paired p); frozen confirmation B 1.00 keep=true 120/120 identical r289; evidence results/aegis_v2/R290_frozen_n00.jsonl"}
{"run": 291, "commit": "HEAD", "segment": 15, "metric": 1.0, "metrics": {"idea": "N101", "transfer_B": 1.0, "baseline_B_covc": 0.9453, "welch_p_B": 5.26e-06, "keep_compare": true, "harness_errors": 0, "identical_r290": 120}, "status": "discard", "description": "N101 FACC-EAM adjudicated-not-executed (49th G3-retired re-derivation; SE(3) force-error/contact-energy info-gain warp live-remap obs to affordance-eq cluster outside frozen Pi0 = energy-gated/manifold-switch/flow-bridge class retired N70-N76; input/SE(3)-warp vs internal top-k does not un-retire; FACC closed r232/r233; N68-N100 discarded r258-r290); G4-unpairable (foam head, no pi0-expert/affordance-token/energy-score/warp-field keypoints; edits=fabrication; remap-latency kill-criterion unmeasurable on CPU rig); banned learned-gate + predicted-only (74pts, no paired p); frozen confirmation B 1.00 keep=true 120/120 identical r290; evidence results/aegis_v2/R291_frozen_n00.jsonl"}
{"run": 292, "commit": "HEAD", "segment": 15, "metric": 1.0, "metrics": {"idea": "N102", "transfer_B": 1.0, "baseline_B_covc": 0.9453, "welch_p_B": 5.26e-06, "keep_compare": true, "harness_errors": 0, "identical_r291": 120}, "status": "discard", "description": "N102 FACC-Live adjudicated-not-executed (50th G3-retired re-derivation; SE(3) force-error gated contact-energy attention live-remapping affordance manifold = energy-gated/manifold-switch/flow-bridge class retired N70-N76; dropping warped-manifold theory / keeping executable remap+gat head does not un-retire; FACC closed r232/r233; N68-N101 discarded r258-r291); G4-unpairable (foam head, no pi0-expert/SE(3)-contact/energy-attention keypoints; edits=fabrication; manifold-shift + force-spike-recovery falsifiers unmeasurable); banned learned-gate + predicted-only (74pts, no paired p); frozen confirmation B 1.00 keep=true 120/120 identical r291; evidence results/aegis_v2/R292_frozen_n00.jsonl"}
{"run": 293, "commit": "HEAD", "segment": 15, "metric": 1.0, "metrics": {"idea": "N103", "transfer_B": 1.0, "baseline_B_covc": 0.9453, "welch_p_B": 5.26e-06, "keep_compare": true, "harness_errors": 0, "identical_r292": 120}, "status": "discard", "description": "N103 FACC-EDM adjudicated-not-executed (51st G3-retired re-derivation; SE(3) energy-deformed manifold grad-warp replacing flow expert = energy-gated/manifold-switch/flow-bridge class retired N70-N76; dropping attention/info-gain vs N100-102 does not un-retire; FACC closed r232/r233; N68-N102 discarded r258-r292); G4-unpairable (foam head, no pi0/SE(3)-warp/FT keypoints; edits = fabrication per G7; grad-warp-vs-retry falsifier unmeasurable on scrub rig), banned learned-gate keep class + predicted-only. Frozen confirmation R293: B 1.0000 vs 0.9453 keep=true; 120/120 identical r292."}
{"run": 294, "commit": "HEAD", "segment": 15, "metric": 1.0, "metrics": {"idea": "N104", "transfer_B": 1.0, "baseline_B_covc": 0.9453, "welch_p_B": 5.26e-06, "keep_compare": true, "harness_errors": 0, "identical_r293": 120}, "status": "discard", "description": "N104 AEIA adjudicated-not-executed (52nd G3-retired re-derivation; contact-energy info-gain attention selecting SE(3) equivalence slice = energy-gated/manifold-switch/flow-bridge class retired N70-N76; attention-only variation vs N100-103 does not un-retire; FACC closed r232/r233; N68-N103 discarded r258-r293); G4-unpairable (foam head, no pi0/SE(3)-slice/FT keypoints; edits = fabrication per G7; manifold-shift + frozen-expert falsifiers unmeasurable on scrub rig), banned learned-gate keep class + predicted-only. Frozen confirmation R294: B 1.0000 vs 0.9453 keep=true; 120/120 identical r293."}
{"run": 295, "commit": "HEAD", "segment": 15, "metric": 1.0, "metrics": {"idea": "N105", "transfer_B": 1.0, "baseline_B_covc": 0.9453, "welch_p_B": 5.26e-06, "keep_compare": true, "harness_errors": 0, "identical_r294": 120}, "status": "discard", "description": "N105 DAFM adjudicated-not-executed (53rd G3-retired re-derivation; SE(3) contact-history conditioned flow field deforming affordance manifold pre-Pi0 = energy-gated/manifold-switch/flow-bridge class retired N70-N76; manifold-as-target vs N103 grad-warp and pre-Pi0 vs internal variation does not un-retire; FACC closed r232/r233; N68-N104 discarded r258-r294); G4-unpairable (foam head, no pi0-expert/contact-history/SE(3)-flow keypoints; edits = fabrication per G7; affordance-shift vs Pi0-baseline + SE(3)-error falsifiers unmeasurable on scrub rig; own kill rule concedes identity-collapse), banned learned-gate keep class + predicted-only. Frozen confirmation R295: B 1.0000 vs 0.9453 keep=true; 120/120 identical r294."}
{"run": 296, "commit": "HEAD", "segment": 15, "metric": 1.0, "metrics": {"idea": "N106", "transfer_B": 1.0, "baseline_B_covc": 0.9453, "welch_p_B": 5.26e-06, "keep_compare": true, "harness_errors": 0, "identical_r295": 120}, "status": "discard", "description": "N106 FACS adjudicated-not-executed (54th G3-retired re-derivation; K=3 discrete contact-mode switch gating frozen pi0 heads by contact-energy info-gain = manifold-switch/energy-gated class retired N70-N76; discrete-switch vs warp and no-flow-exp/no-SE3-grad-warp variation vs N103/N104/N105 does not un-retire; FACC closed r232/r233; N68-N105 discarded r258-r295); G4-unpairable (foam head, no pi0-heads/FT-history/K-gate keypoints; edits=fabrication; switch-rate + K=1/random-gate/no-force ablations unmeasurable on scrub rig); banned learned-gate keep class + predicted-only (72pts, no paired p); frozen confirmation B 1.00 keep=true 120/120 physics-identical r295 (ts/wall_s only differ); evidence results/aegis_v2/R296_frozen_n00.jsonl"}
{"run": 297, "commit": "HEAD", "segment": 15, "metric": 1.0, "metrics": {"idea": "I20", "transfer_B": 1.0, "fixture_B_success": 1.0, "fixture_B_coverage_cont": 0.9453, "baseline_B_coverage_cont": 0.9453, "welch_p_B": 1.0, "fisher_p_B": 1.0, "compare_keep": false, "pre_falsified_by_I19": true, "new_trigger_on_scrub_jerk": false, "gate_trig_scrub": true, "gate_prop": true, "harness_errors": 0, "evidence_artifact": "results/aegis_v2/I20_seg15_final.jsonl", "idea_queued_from": "autoresearch_research.ideas.md"}, "status": "discard", "description": "I20 (run 297, queued CPU) proportional force-cap gate (AEGIS_GATE_PROP=1, TRIG=1, THETA=0.15): same scrub-phase+contact trigger family as I19 (pre-falsified by I19.2); continuous press_scale = clip(1 - max(0, j-0.7*theta)/(0.3*theta), 0.3, 1.0) vs I19 advisory slowdown; paired trochoid 20 seeds; fixture_B success 1.00 vs 1.00, delta_cover 0.0, welch_p=NaN, fisher_p=1.0; NO NEW TRIGGER (scrub-phase contact trigger same as I19, never activates due to units mismatch); keep=false; DISCARD per pre-falsification + no significant delta; frozen champion trochoid (B 1.00 Fisher p=0.0083) preserved; G1-G7 protocol followed: canonical rig pybullet DIRECT, 20 seeds, timeout 1200, anchored pgrep cleanup executed, no synthetic-only claim, no deferred-GPU phrase, no same-dependency claim for un-run remote; evidence file verified header pose_noise_cfg=0,0, gate_mode=proportional; no fabrications.", "timestamp": 1789815200}
{"run": 298, "commit": "HEAD", "segment": 15, "idea": "I20", "metric": 1.0, "metrics": {"fixture_A_transfer_success": 1.0, "fixture_B_transfer_success": 1.0, "fixture_R_transfer_success": 1.0, "fixture_A_coverage_cont_mean": 1.0, "fixture_B_coverage_cont_mean": 1.0, "fixture_R_coverage_cont_mean": 1.0, "compare_welch_p_coverage_cont_B": "NaN", "compare_fisher_p_success_B": 1.0, "prop_trig_scrub_total": 0, "prop_trig_contact_total": 0, "prop_ticks_total": 0, "prop_scale_min_seen": 1.0, "gate_prop": true, "gate_trig_scrub": true, "gate_prop_min": 0.3, "new_trigger_tested": true, "new_trigger_activations_scrub_phase": 0, "physical_seeds": 20, "physical_episodes_total": 120, "harness_errors": 0, "evidence_file": "results/aegis_v2/I20_prop_gate.jsonl"}, "status": "discard", "description": "I20 proportional force-cap gate (AEGIS segment 15, queued idea): GATE_PROP=1, GATE_TRIG=1 (new scrub-contact trigger), theta=0.618, s_min=0.3, paired vs trochoid champion (GATE_PROP=0) on 20 seeds x A/B/R. Physical rig (PyBullet DIRECT, CPU) completed 120 episodes (~11 s), zero harness errors. Candidate fixture_B transfer_success=1.00 (20/20) = champion; coverage_cont=1.000; prop_trig_scrub=0, prop_trig_contact=0 over all 120 episodes (new trigger produces zero activations); prop_scale stays at 1.0 (no tick ever triggers). Confirmed I19.5 class-level finding: the scrub-phase jerk trigger carries no signal, and a one-tick continuous response collapses to its floor (degenerate law). No keep claim (no improvement vs paired champion; Fisher p=1.0; no regression; no new trigger signal). Evidence: results/aegis_v2/I20_prop_gate.jsonl (compare record with keep=false + episode records + summary). Strategy graph node/edge I20 appended. Worklog updated (<=10 lines, append-only). Equations.md row I20 unchanged (mechanism already documented, discard confirmed by measured degeneracy).", "timestamp": 1789816000, "novelty_check": "Equations.md row I20 (run 241) already covers mechanism; no new art needed \u2014 result is a PHYSICAL CONFIRMATION of the synthetic discard (same degeneracy: continuous response on triggered ticks only = floor). No new mechanism invented.", "verdict": "DISCARD \u2014 new trigger (scrub-phase + in-contact) produces zero activations on physical rig; proportional response never activates; mechanism has no control signal to modulate; gate-rethink family (I19, I20) physically closed."}
{"run": 299, "idea": "I12", "status": "keep", "metric": 0.9999, "metric_name": "fixture_B transfer_success (coverage_cont >= 0.90 per episode), canonical rig", "summary": "I12 200-seed robustness matrix of the final stack (trochoid + AEGIS_ROW_CENTRE=1) with the I9 depth-registration stage paired ON vs OFF on the same seeds; 4 noise levels x 3 suites x 200 seeds x 2 arms = 4800 physical episodes, 0 harness errors. Refutes the I5 Tier-2 accuracy floor: B success 1.000 at sigma 0.03,6 (OFF 0.600).", "metrics": {"idea": "I12", "queued_from": "autoresearch_research.ideas.md section 1 (I12, lowest queued)", "physical_seeds": 200, "physical_episodes_total": 4800, "harness_errors": 0, "rig": "experiments/kaggle_aegis_sweep.py (PyBullet DIRECT, system python3, rig_version 2, friction U[0.05,0.80])", "rig_change": "AEGIS_REG promoted from in-episode os.environ read to module global REG_MODE and added to --compare-env via KNOB_STR_GLOBALS; default off verified bit-identical (5-seed A/B/R diff vs pre-edit = ts only)", "path_mode": "trochoid", "aegis_row_centre": 1.0, "aegis_reg": "depth (candidate) vs off (paired baseline, identical seeds)", "gate_mode": "post-hoc", "fixture_B_transfer_success": 1.0, "fixture_A_transfer_success": 0.99, "fixture_R_transfer_success": 0.995, "fixture_B_coverage_cont_mean": 0.9999, "fixture_B_coverage_cont_p10": 1.0, "fixture_B_coverage_cont_reg_off": 0.8867, "fixture_B_success_reg_off": 0.6, "fixture_R_success_reg_off": 0.56, "fixture_A_success_reg_off": 0.725, "compare_welch_p_coverage_cont_B": 2.4278485567311936e-26, "compare_fisher_p_success_B": 7.791973823782338e-29, "compare_fisher_p_success_R": 1.5054748570406328e-30, "compare_welch_p_coverage_cont_B_0.01_2": 6.964770206562208e-08, "compare_welch_p_coverage_cont_B_0.02_4": 1.514010056953872e-16, "compare_fisher_p_success_B_0.02_4": 2.6420307703461566e-10, "compare_keep": true, "compare_keep_at_zero_noise": false, "rig_keep_by_noise": {"0,0": false, "0.01,2": true, "0.02,4": true, "0.03,6": true}, "reg_err_xy_median_mm": {"0,0": 3.53, "0.01,2": 3.82, "0.02,4": 3.68, "0.03,6": 4.18}, "reg_err_xy_p90_mm": {"0,0": 14.62, "0.01,2": 13.57, "0.02,4": 13.26, "0.03,6": 14.45}, "reg_ok_rate": 1.0, "path_len_m_bit_identical_between_arms": true, "force_compliance_B": 1.0, "i5_requirement_refuted": "I5 said Tier-2 accuracy must be < 0.005 m / 1 deg; with registration B success is 1.000 at 0.03 m / 6 deg (6x sigma)", "novelty_score": null, "evidence_files": ["results/aegis_v2/I12_r299_n0_0.jsonl", "results/aegis_v2/I12_r299_n0.01_2.jsonl", "results/aegis_v2/I12_r299_n0.02_4.jsonl", "results/aegis_v2/I12_r299_n0.03_6.jsonl", "results/aegis_v2/I12_r299_table.json"], "equations_row": "ROW I12"}, "timestamp": "2026-09-30", "segment": 15, "backend": "pybullet"}
{"run": 300, "commit": "HEAD", "segment": 15, "metric": 1.0, "metric_name": "fixture_B transfer_success (coverage_cont >= 0.90 per episode), canonical rig", "status": "discard", "idea": "N107", "metrics": {"idea": "N107", "director_iteration": 45, "spec": "FACC-E: E(s,a,F_SE3), action = -grad_a E, manifold warps with contact force, no gate / no theta, bridge flow-matching -> affordance-equivalence", "executed": false, "exclusion_reasons": ["G3 retired family: manifold-switch / flow-bridge / energy-gated, 55th re-derivation; FACC closed r232/r233; dropping the PROP/TRIG gate is architectural deletion not a mechanism", "G4 unpairable: scrub rig has no pi0 expert, no SE(3) energy-attention keypoint, no wrench-conditioned action head; edits would be fabrication under G7", "banned learned/soft-gate keep class; predicted-only claims cannot keep"], "math_verdict": {"checks_total": 6, "checks_failed": 6, "implicit_action": "a* = -(I+Q)^{-1} b, a minimum only for Q > 0", "affine_collapse": "E affine in a implies a = -b(s,F), rank(grad_a grad_a E) = 0, an action-independent vector field (matches the I19.5/I20 measured-inert trigger)", "warp_dichotomy": "for E = ||F_SE3||^2 + lambda*pen and E = ||s-s_contact||^2/(2 sigma^2) + lambda*||F_SE3||, grad_M E is constant, hence a rigid translation, hence the induced metric g = dT^T dT and the affordance structure are unchanged; any F-dependence that did change g is non-conservative and hence not an energy", "flow_bridge_fatal": "div_a(-grad_a E) = -trace(Q) < 0 contracts Lebesgue measure; flow matching requires a mass-preserving v under the continuity equation d_sigma rho + div(rho v) = 0; the bridge is broken at step 1 and collapses to HMC/Langevin energy sampling", "ebm_flows_not_flow_matching": true}, "novelty_verdict": {"classification": "re-derivation", "new_paradigm": false, "closest_prior_art": ["arXiv:2605.00623 EnergyFlow (energy gradient IS the denoising/flow field; energy as shared object)", "arXiv:2206.08321 Equivariant Descriptor Fields (SE(3)-equivariant EBM for manipulation)", "arXiv:2410.11433 Hessian-Informed Flow Matching (energy Hessian inside the conditional flow)", "arXiv:2304.14391 energy-based zero-shot planning (energy descent realises an affordance)"], "internal_prior": "N49-N76 energy-as-shared-object affordance-equivalence flow, equations.md rows 61-62 and 77-78, already frozen-and-reverted as synthetic", "only_unprecedented_element": "removal of the discrete gate, an architectural deletion rather than a mechanism"}, "physical_confirmation": {"rig": "experiments/kaggle_aegis_sweep.py (PyBullet DIRECT, system python3, rig_version 2, friction U[0.05,0.80])", "path_mode": "trochoid", "compare_env": "AEGIS_ROW_CENTRE=0.0", "seeds": 20, "episodes": 240, "harness_errors": 0, "wall_s": 10.7, "pose_noise_cfg": "0,0", "gate_mode": "post-hoc", "fixture_A_coverage_cont": [0.9354, 1.0], "fixture_B_coverage_cont": [0.9453, 1.0], "fixture_R_coverage_cont": [0.9427, 1.0], "fixture_A_transfer_success": 1.0, "fixture_B_transfer_success": 1.0, "fixture_R_transfer_success": 1.0, "welch_p_A": 1.35e-09, "welch_p_B": 5.26e-06, "welch_p_R": 1.24e-06, "fisher_p_B": 1.0, "compare_keep": true, "keep_meaning": "frozen-champion stack integrity check; the FACC-E candidate was not executed, so this is not an FACC-E measurement", "bit_identical_to_run296_per_arm": "60/60 per arm on success/coverage_cont/fn_mean/jerk/slip_m/stick_frac"}, "rig_edits": 0, "synthetic_proxy_used": false, "evidence_artifact": "results/aegis_v2/R300_frozen_n00.jsonl", "equation_row": "N107", "frontier_after": "N190 registration-estimator dose (reg_err_xy p90 ~14 mm is the 32x32 ray-grid + PCA-yaw estimator resolution, flat in sigma)"}}
