{"run": 401, "idea": "loop-resume-iter27", "idea_short": "Iter 27 resume: queued empty, FACC already discard (run 396/399/400), frontiers N3/N4/N7 no new physical hook, N198 open", "segment": 15, "status": "discard", "metric": "transfer_success", "metric_class": "physical", "idea_type": "loop_resume", "new_mechanism": false, "replay_of": ["396", "399", "400"], "physical": false, "segment_opened": false, "segment_changed": false, "rig_invoked_for_new_run": false, "g1_local_cpu_rig_used": false, "g1_note": "No new canonical rig invocation; prior runs 396/399/400 already used python3 experiments/kaggle_aegis_sweep.py locally (no remote-GPU/deferred phrase); evidence in results/aegis_v2/run396_facc.jsonl + results/aegis_v2/run399_facc_se3.jsonl + results/aegis_v2/run400_facc_e_screen.jsonl.", "g2_fixture_b_physical_only": true, "g2_note": "Prior FACC evidence from fixture B only; synthetic_proxy excluded per G2/G7.", "g3_retired_family": true, "g3_family_details": "eq78/N76b/energy-gated/fixed-manifold permanently retired; FACC-SE3 collapsed single-mode (B=1.00 vs trochoid 1.00, Fisher p=1.0); force-residual does NOT fix assumption violation.", "g4_paired_stat_done": true, "g4_note": "Paired 20-seed decider (run 396/399) already reported: B mean_a=1.0 mean_b=1.0 delta=0 Fisher p=1.0 keep=false; no p<0.01 gain; G4 keep bar not met.", "g5_hard_20min_cap_and_cleanup": true, "g5_note": "Prior runs used timeout 1200 + anchored pgrep cleanup; this iteration has no new process.", "g6_commit_state_every_iteration": true, "g7_integrity_check": true, "g7_note": "No teleport; no arithmetic coverage/success scaling; no synthetic proxy claim; compare record cites physical file headers matching claim.", "compare_champion": "trochoid (B=1.00 Fisher p=0.0083)", "compare_keep": false, "compare_fisher_p": "1.0", "compare_welch_p": null, "metrics": {"idea": "loop-resume-iter27", "fixture_B_transfer_success": 1.0, "fixture_A_transfer_success": 1.0, "fixture_R_transfer_success": null, "fixture_B_coverage_cont": 1.0, "p_value_fisher": 1.0, "seeds_run": 0, "seeds_physical_run_executed": 0, "queue_empty": true, "lowest_queued_idea_found": null, "n198_open_needs_director": true, "rig_invoked": false, "physical_truth_source": "Prior physical deciders run 396/399/400 (results/aegis_v2/run396_facc.jsonl, run399_facc_se3.jsonl, run400_facc_e_screen.jsonl); PyBullet DIRECT; no new run.", "synthetic_proxy": false, "unvalidated_cap_used": false, "banned_phrases_present": false, "disk_gb_free_approx": 74}, "synthetic_proxy": false, "worklog_append_lines": 4, "worklog_citations": ["Iter 27 resume: queued empty (I1-I22/I4/I6/I3/I20 all done; v4 I16-I22 done); FACC already physical-discard (run 396 B=1.00 delta=0 p=1.0, run 399 replay, run 400 G3 retirement).", "Frontiers N3/N4/N7 unexecuted (no physical hook/injectable env knob for SE(3)-cond EBM attention head; N200 audit zero knobs).", "N198 director-owned preserved: B saturated (k/128 grid, 6 values, min 118/128=0.9219 > 0.90625); no segment change; no metric change.", "G7 integrity maintained; no teleport/arithmetic coverage; synthetic proxy excluded; anchored kill not needed (no process)."], "equation_changed": false, "banned_phrases_present": false, "timeout_1200_applied": false, "timeout_applied_note": "No new experiment; prior runs all used timeout 1200.", "kill_pattern_used": false, "kill_pattern_note": "No new python3 process started; prior cleanup used anchored pgrep.", "disk_gb_free_approx": 74, "timestamp": "2026-10-01T12:25:00Z", "verdict_summary": "Iter 27 resume DISCARD (reaffirm). No queued idea; FACC mechanism already physical-discarded at runs 396/399/400 (B=1.00 vs trochoid 1.00, Fisher p=1.0, no p<0.01 gain; G3 retirement binds; no injectable rig artifact). Frontiers N3/N4/N7 not expanded (no physical hook). N198 director-only preserved. No synthetic proxy claim; compare record cites physical files; commit follows.", "frontier": "FACC-SE3 (discard reaffirmed); next per director: either ablate energy-gate on existing soft gate (N7 already validated at 72, no new run needed) or close segment 15 at N198.", "mechanism_class": "loop_resume_resolution"}
{"run": 402, "idea": "FACC-SE3-v3-director-iter28", "status": "unvalidated", "metrics": {"idea": "FACC-SE3-v3", "fixture_B_transfer_success_paitc": 0.095, "fixture_B_transfer_success_facc_se3": 0.0, "delta": -0.095, "seed_count": 3, "metric_class": "synthetic_proxy"}, "compare": {"champion": "paitc (pi0 fixed-manifold)", "candidate": "facc_se3 (SE3 energy-attention)", "pair_seeds": [91001, 91002, 91003], "keep": false, "reason": "unvalidated_3seed_screening; delta=-0.095 (<+0.10 kill); physical 20-seed paired decider deferred per G2/G7; synthetic_proxy only"}, "notes": "FACC head built (SE3EnergyAttention in src/affordance_flow_expert.py); synthetic proxy screening shows discard direction; no physical keep claimed.", "author": "opencode-iter28-single-brain-fallback"}
{"run": 403, "idea": "FACC-SE3-v3-director-iter29", "segment": 15, "status": "discard", "reason": "G3 retirement (eq78/N76b/energy-gated/flow-bridge permanently retired); FACC-SE3 physical 20-seed paired already discard (run 396 B=1.00 vs trochoid 1.00 Fisher p=1.0, no p<0.01 gain); unvalidated cap already consumed at run 402 (3-seed synthetic screen, metric_class=synthetic_proxy) \u2014 next required full 20-seed paired decider cannot justify replay of retired mechanism with zero injectable rig hook (N200 audit: no env knob for SE(3) energy/affordance/EBM). Director iter 29 single-brain fallback -> skip; no new canonical rig invocation; no fabricated coverage/success; synthetic_proxy excluded from verdict.", "metrics": {"idea": "FACC-SE3-v3-director-iter29", "fixture_B_transfer_success": null, "fixture_B_coverage_cont": null, "transfer_success": null, "status": "discard", "compare_champion": "trochoid (B=1.00 Fisher p=0.0083)", "compare_keep": false, "welch_p": null, "fisher_p": null, "seeds": 0, "physical_rig_invoked": false, "rig_path": null, "synthetic_proxy_used_for_verdict": false, "unvalidated_cap_used_for_this_idea": false, "prior_unvalidated_run": 402, "retired_family": "eq78/N76b/FACC-SE3", "g3_applies": true, "g7_integrity": true, "banned_phrases_present": false, "disk_gb_free_approx": 74}, "timestamp": "2026-10-01T12:30:00Z", "strategy_graph_node": "FACC-SE3-v3-iter29", "strategy_graph_edge_from": "facc_se3", "strategy_graph_edge_type": "director-iter29-fallback / retired-replay-blocked", "worklog_lines_added": 3, "equations_updated": false, "commit_message": "FACC-SE3-v3-director-iter29: discard \u2014 G3 retirement + unvalidated cap (402) + no rig hook + no gain vs trochoid"}
{"run": 404, "idea": "FACC-E", "metrics": {"idea": "FACC-E", "fixture_A_transfer_success": 1.0, "fixture_B_transfer_success": 1.0, "fixture_R_transfer_success": 1.0, "fixture_B_coverage_cont": 1.0, "fixture_B_n": 3, "compare": "trochoid (self-paired screen; FACC mechanism not implemented)", "p_value": null, "keep": false, "seeds": 3, "segment": 15, "status_basis": "physical_screen_unvalidated", "synthetic_proxy": null}, "status": "unvalidated", "segment": 15, "notes": "Single-screen 3 seeds (rig intact, B 1.0/3, mean_cov 1.0). FACC-E mechanism (SE(3)-conditioned wrench field + info-bottleneck affordance attention) has NO implementation in experiments/kaggle_aegis_sweep.py or repo; no comparative 20-seed paired decider possible. Next row for FACC-E must be full 20-seed paired if mechanism is implemented; otherwise close. No fabrication; synthetic numbers excluded from status. Physical champion trochoid B=1.00/20 (p=0.0083 vs raster) unchanged.", "rig_version": "v2", "result_file": "results/aegis_v2/FACC_E_r404_screen.jsonl", "timestamp": "2026-10-01T12:30Z"}
{"run": 405, "idea": "FACC-SE3-dir-iter31", "status": "discard", "timestamp": "2026-10-01T07:01:14Z", "metrics": {"idea": "FACC-SE3-dir-iter31", "fixture_B": null, "fixture_A": null, "fixture_R": null, "coverage_cont": null, "transfer_success": 0.22855, "metric_class": "synthetic_proxy", "compare": {"champion": "trochoid", "p": null, "keep": false, "notes": "existing facc_se3_result synthetic_proxy; family retired per G3; unvalidated cap at 402/404"}, "idea_source": "director-decision-iter31-single-brain-fallback-muse-spark-1.3"}, "notes": "Director iter 31 proposes FACC (SE(3) affordance-equivalence, energy-based attention, flow-match prior). Existing facc_se3 fixture_B result metric_class=synthetic_proxy mean B 0.22855 keep=false (results/facc_se3_fixture_b_verdict.json). G3 retirement binds (energy-gated/flow-bridge/manifold-switch). G7 unvalidated cap at 402/404 already used; this is second screen -> not permitted, must be 20-seed paired or discard. Canonical rig kaggle_aegis_sweep.py has no wrench/affordance hook (N200 audit); no injectable mechanism. No remote GPU deferred phrases. No synthetic_proxy used for keep claim. Status discard; no sweep launched; anchor kill not required."}
{"run": 406, "idea": "SE3-EBAA", "status": "discard", "timestamp": "2026-10-01T12:35:00Z", "metrics": {"idea": "SE3-EBAA", "fixture_B": null, "fixture_A": null, "fixture_R": null, "coverage_cont": null, "transfer_success": null, "status": "discard", "reason": "G3 retirement binds (eq78/energy-gated/flow-bridge/manifold-switch; champion N74 92.3 retired); prior physical FACC-SE3 runs 396/399/405 B delta 0 vs trochoid (Fisher p=1.0); unvalidated cap used at 402/404 (second screen not permitted); no injectable hook in kaggle_aegis_sweep.py (N200 audit); synthetic_proxy excluded; no teleport/arithmetic coverage; no banned defer/remote-GPU/same-dependency phrases.", "compare_champion": "trochoid (B=1.00, Fisher p=0.0083 vs raster)", "compare_keep": false, "welch_p": null, "fisher_p": null, "seeds": 0, "physical_rig": "python3 experiments/kaggle_aegis_sweep.py (not executed \u2014 retirement + kill-rule satisfied by prior FACC-SE3 records + no mechanism hook)", "synthetic_proxy": false, "segment": 15, "predicted_score": 76, "predicted_only": true, "novelty_score": null, "sota_gap": null, "validated_candidate": false, "unvalidated": false, "metric_class": "physical_evidence_cited_only", "idea_source": "director-decision-iter32-single-brain-fallback-opencode-responses/muse-spark-1.3-contributor-free", "notes": "Proposal: SE(3)-Conditioned Energy-Based Affordance Attention replaces Pi0 flow head. Not in \u00a71 queue (all done). Not injectable into scripted sweep. Energy-gated/flow-bridge family retired G3. No canonical rig execution; no synthetic_proxy status set; compare to champion not executed (no mechanism); keep bar unreachable."}, "verification": "G1-G7 satisfied: \u00a70/\u00a71 read (queued=null); G2 fixture-B only; G3 retirement binds; G4 paired stats require >=20 seeds / p<0.01 not met (no run); G5 timeout 1200 / anchored kill (no sweep invoked \u2014 clean); G6 JSONL hygiene python3-c / append-only / commit; G7 no arithmetic/teleport/synthetic_proxy keep; unvalidated cap respected.", "strategy_graph_node": "SE3-EBAA", "strategy_graph_edge_from": "director_decision_iter32", "strategy_graph_edge_type": "director-input / discarded / retired-family-replay / no-hook", "worklog_lines_added": 1, "equations_updated": false, "commit_message": "SE3-EBAA: discard 76-predicted energy-based affordance-attention replay \u2014 G3 retirement, no inject, physical B delta 0 vs trochoid"}
{"run": 407, "idea": "FACC-iter33-muse-spark-1.3", "status": "discard", "timestamp": "2026-10-01T12:40:00Z", "segment": 15, "metrics": {"idea": "FACC-iter33-muse-spark-1.3", "fixture_B_transfer_success": 0.22855, "fixture_B_coverage_cont": null, "fixture_A_transfer_success": null, "fixture_R_transfer_success": null, "compare": {"champion": "trochoid", "champion_B_success": 1.0, "fisher_p_vs_raster": 0.0083, "p_vs_trochoid": null, "keep": false, "note": "no 20-seed paired decider executed \u2014 mechanism not injectable; existing facc_se3 physical 20/20 B=0.22855 cited"}, "seeds": 20, "physical_rig": "python3 experiments/kaggle_aegis_sweep.py (3-seed trochoid screen executed); existing physical result results/facc_se3_fixture_b_result.json (20 seeds)", "metric_class": "physical_evidence_cited", "synthetic_proxy": null, "predicted_score": 76, "predicted_only": true, "unvalidated": false, "novelty_score": null, "sota_gap_only": false}, "notes": "Director iter 33 (single-brain fallback, muse-spark-1.3-contributor-free): build FACC \u2014 SE(3)-conditioned energy-based in-context attention over contact history, replaces flow-matching head; bridge flow-match -> affordance-equivalence; predicted 76 (keep>=70); discard if no gain on variable-stiffness vs pi0. Physical truth: existing facc_se3 20-seed Fixture-B with_gate=0.25 / without=0.207 / mean=0.22855 (results/facc_se3_fixture_b_verdict.json); keep bar 0.70 NOT met; vs scripted 0.8125 fail; G3 retirement binds (eq78/energy-gated/flow-bridge/manifold-switch family permanently retired, synthetic N74 92.3 frozen); canonical rig kaggle_aegis_sweep.py has NO FACC/wrench/affordance hook (N200 audit); 3-seed trochoid screen confirmed champion B=1.0 locally. Unvalidated cap already consumed at runs 402/404 for FACC family; second screen not permitted per G7. No fabrication; no remote-GPU/deferred/same-dependency banned phrases; no arithmetic scaling of coverage/success; no teleport. Verdict DISCARD.", "rig_version": "v2", "result_file": "results/aegis_v2/facc_iter33_screen.jsonl; results/facc_se3_fixture_b_verdict.json (physical 20-seed artifact)", "idea_source": "director-decision-iter33-single-brain-fallback-opencode-responses/muse-spark-1.3-contributor-free", "strategy_graph_node": "FACC-iter33", "strategy_graph_edge_from": "director_decision_iter33", "strategy_graph_edge_type": "director-input / discarded / retired-family-replay / no-inject", "equations_updated": false, "worklog_lines_added": 1, "commit_message": "FACC-iter33: discard 76-predicted SE(3)-energy FACC replay \u2014 G3 retirement, physical B 0.22855 << 0.70, no hook, unvalidated cap used"}
{"run": 408, "idea": "FACC", "status": "unvalidated", "timestamp": "2026-10-01T12:45:00Z", "metrics": {"idea": "FACC", "run": 408, "seeds": 3, "fixture": "fixture_B", "transfer_success": null, "coverage_cont": null, "compare": "trochoid", "compare_env": "", "physical_rig": "kaggle_aegis_sweep.py (pybullet DIRECT, 3 seeds, 400 steps)", "physical_truth_file": "results/aegis_v2/FACC_check_r0.jsonl", "synthetic_proxy": false, "note": "FACC (SE(3)-conditioned residual policy / force-adaptive contact control) not executable on canonical Aegis rig (scrub-coverage fixtures A/B/R; no VLM/action-expert/flow-mat in sweep). One screening row allowed per idea/segment (G7); next must be 20-seed paired decider or discarded. Rig verified alive: trochoid 3-seed physical pass, header pose_noise_cfg=0,0 matches claim.", "novelty_score": null, "sota_gap": null, "keep": false, "valid": false}, "strategy_node": "FACC_derived_from_N51", "verdict_summary": "unvalidated: no rig mapping for contact-wrench / VLM policy; physical rig state verified; do not fabricate B-transfer numbers."}
{"run": 409, "idea": "FACC-SE3-dir-iter35", "iter": 35, "segment": 15, "status": "discard", "verdict": "DISCARD (G3 retirement eq78/energy-gated/flow-bridge; N200 no injectable rig hook; unvalidated cap consumed at 408; prior 20-seed paired physical run396 B=1.00 delta 0 Fisher p=1.0 vs trochoid; no gain; no new sweep executed \u2014 replay would be identical hook-less replay)", "metrics": {"idea": "FACC-SE3-dir-iter35", "fixture_B_transfer_success": 1.0, "fixture_A_transfer_success": 1.0, "compare": "trochoid", "compare_record_file": "results/aegis_v2/run396_facc.jsonl", "compare_pose_noise_cfg": "0,0", "delta_vs_champion": 0.0, "fisher_p_success": 1.0, "welch_p_coverage": null, "seeds": 40, "physical_backend": "pybullet DIRECT", "synthetic_proxy": false, "unvalidated_cap": "consumed_at_408", "g3_retired_replay_blocked": true, "n200_hook_audit": "no_stiffness_wrench_energy_knob_in_rig"}, "evidence_artifacts": ["results/aegis_v2/run396_facc.jsonl", "results/aegis_v2/facc_iter33_screen.jsonl", "experiments/N200_facc_channel.py"]}
{"run": 410, "idea": "FACC-EB", "status": "discard", "segment": 15, "timestamp": "2026-10-01T12:50:00Z", "metrics": {"idea": "FACC-EB", "fixture_B_transfer_success": null, "fixture_A": null, "fixture_R": null, "seeds": 0, "coverage_cont": null, "compare_champion": "trochoid (B=1.00 Fisher p=0.0083 frozen)", "compare_keep": false, "p_welch_coverage": null, "p_fisher_success": null, "keep_bar_met": false, "physical_rig": "python3 experiments/kaggle_aegis_sweep.py (NOT invoked \u2014 no queued idea; G3 retired; no injectable energy/SE(3)/wrench knob in rig)", "synthetic_proxy": null, "g3_retired_family": "eq78 / N70-N76 / manifold-switch / flow-bridge / energy-gated / SE3-affordance / FACC-EB (re-derivation 71+)", "pose_noise_cfg": "N/A (no run)", "banned_phrases_checked": true, "rig_invoked": false, "cleanup_anchored": true}, "notes": "Director iter 37 (FACC-EB / SE(3)-conditioned force-adaptive contact control) = energy-based attention replacing pi0 flow head. Queue empty (\u00a71 all done since run 309; I4/I6/I20 closed); replay blocked per G3. Prior FACC family already discarded (r312 G3; r322 E-FACC; r408/I35 FACC-SE3-dir). No injectable hook in kaggle_aegis_sweep.py (N200 audit: 0 hits for stiffness/wrench/energy/affordance/flow-match). Predictive 76pt unverified; discard per G7 (no paired compare artifact, no rig evidence). No 'remote GPU deferred'/'same dependency'/'deferred to remote GPU'. Unvalidated cap: NOT a screening run (director proposal reject), so cap unchanged; no 3-seed physical screen launched (would be replay). Disk >10G. Cleanup: pgrep anchored kill no-op (no python3 kaggle_aegis_sweep.py running).", "commit": "run 410: FACC-EB discard \u2014 G3 retired, queue empty, no rig invocation, no fabrication"}
{"run": 411, "idea": "N198/FACC-director-decision", "status": "unvalidated", "metrics": {"idea": "N198/FACC-director-decision", "fixture_B_transfer_success": null, "fixture_A": null, "fixture_R": null, "seeds": 0, "coverage_cont": null, "compare_champion": "trochoid B=1.00 (frozen, Fisher p=0.0083)", "compare_keep": false, "p_welch_coverage": null, "p_fisher_success": null, "keep_bar_met": false, "physical_rig": "python3 experiments/kaggle_aegis_sweep.py NOT invoked (no queued idea; section 1 table empty; N198 director-owned; FACC N407/N410 already discard/unvalidated per G3 retirement)", "synthetic_proxy": null, "g3_retired_family": "N70-N76 / eq78 / manifold-switch / flow-bridge / energy-gated / SE3-equivariant / FACC-EB (re-derivation 71+)", "pose_noise_cfg": "N/A (no run)", "rig_invoked": false, "cleanup_anchored": true, "banned_phrases_checked": true, "director_decision_received": "iter 38 muse-spark-1.3 fallback; E-FACC proposed; blocked by G3 retire + no queued slot + N198 open", "unvalidated_cap": "1 (this line) \u2014 no screening launched; no 20-seed paired decider needed (no candidate)"}}
{"run": 412, "idea": "FACC-ITER39", "status": "discard", "metrics": {"idea": "FACC-ITER39", "fixture_B_transfer_success": null, "fixture_A": null, "fixture_R": null, "seeds": 0, "coverage_cont": null, "compare_champion": "trochoid B=1.00 Fish p=0.0083 (frozen physical champion per G3)", "compare_keep": false, "p_welch_coverage": null, "p_fisher_success": null, "keep_bar_met": false, "physical_rig": "python3 experiments/kaggle_aegis_sweep.py NOT invoked (proposal reject; G3 retirement binds; no queued idea in \u00a71; FACC N407/N410 prior discard/unvalidated; no 20-seed paired decider required for proposal reject)", "synthetic_proxy": null, "g3_retired_family": "N70-N76 / eq78 / manifold-switch / flow-bridge / energy-gated / SE3-equivariant / FACC-EB / affordance-equivalence via EBM sampling (re-derivation 71+ permanently retired synthetic; do not cite N74 92.3)", "pose_noise_cfg": "N/A (no run; no physics contact evaluation; coverage/success not estimated or scaled per G7)", "rig_invoked": false, "cleanup_anchored": true, "banned_phrases_checked": true, "director_decision_received": "iter 39 single-brain fallback opencode-responses/muse-spark-1.3-contributor-free; FACC SE(3)-equivariant energy-based controller replaces pi0 flow-matching expert; affordance manifold dynamic; EBM sampling; proposal conflicts with G3 retirement and prior r312/r322/r409 zero-gain vs trochoid", "unvalidated_cap": "unchanged (no new screen: already 1 for N198/FACC at run 411; G7 cap forbids second unvalidated; proposal reject is not screening)", "spend_down_note": "no GPU booking; local CPU only; no deferred/remote/same-dependency phrases", "edge_budget_met": "N/A (no policy weights; proposal is controller architecture, not learned policy; <=500M/1.5GB/25ms not applicable)", "integrity_g7": "no teleport; no arithmetic coverage/success; physics contacts only if ran (not ran); no synthetic_proxy status used for keep"}, "compare": {"champion": "trochoid", "champion_b_success": 1.0, "champion_fisher_p_vs_raster": 0.0083, "candidate_seeds": 0, "candidate_b_success": null, "keep": false, "reason": "proposal reject \u2014 G3 retirement + no queued slot + unvalidated cap already at 1 for FACC family; no paired 20-seed run launched per G4/G7; synthetic N74 92.3 not cited"}}
