{"type": "edge", "from": "N427", "to": "N427a", "kind": "replaces-with-health-check", "run": 426, "label": "replay rejected, health check executed instead; 0 rig bytes changed.", "timestamp": 1790844000}
{"type": "edge", "from": "N427a", "to": "N198", "kind": "supports-option-b", "run": 426, "label": "nineteenth line for option (b): ceiling tie reproduces; bar has zero dynamic range at 0,0.", "timestamp": 1790844000}
{"type": "node", "id": "N428", "run": 427, "segment": 15, "status": "discard", "label": "Director iter-9 FACC (SE3 energy head predicts wrench+stiffness not trajectory, predicted 76+-6) adjudicated-not-executed: G3-retired family, 0 injectable rig hook, queue empty, predicted-only barred by G7. Prior physical r407 B=0.22855, replays delta 0.", "timestamp": 1790847600}
{"type": "node", "id": "N428a", "run": 427, "segment": 15, "status": "characterized", "label": "Frozen-champion health re-cert r427: trochoid vs raster 20 paired seeds x 3 suites at 0,0, A/B/R 20/20 both arms, coverage_cont 1.0000, 0 harness errors, results/aegis_v2/FACC_iter9_r427.jsonl, 0 rig bytes changed. Compare keep=false.", "timestamp": 1790847600}
{"type": "edge", "from": "N428", "to": "N428a", "kind": "replaces-with-health-check", "run": 427, "label": "replay rejected, health check executed instead; 0 rig bytes changed.", "timestamp": 1790847600}
{"type": "edge", "from": "N428a", "to": "N198", "kind": "supports-option-b", "run": 427, "label": "twentieth line for option (b): ceiling tie reproduces; bar has zero dynamic range at 0,0.", "timestamp": 1790847600}
{"type": "node", "id": "N429", "run": 428, "segment": 15, "status": "discard", "label": "Director iter-10 FACC-E (SE3-conditioned force-adaptive contact control with energy manifold gating, predicted 78) adjudicated-not-executed: G3-retired family, 0 injectable rig hook, queue empty, predicted-only barred by G7. Prior physical r407 B=0.22855, replays delta 0.", "timestamp": 1790850000}
{"type": "node", "id": "N429a", "run": 428, "segment": 15, "status": "characterized", "label": "Frozen-champion health re-cert r428: trochoid vs raster 20 paired seeds x 3 suites at 0,0, A/B/R 20/20 both arms, coverage_cont 1.0000, 0 harness errors, results/aegis_v2/FACCE_iter10_r428.jsonl, 0 rig bytes changed. Compare keep=false.", "timestamp": 1790850000}
{"type": "edge", "from": "N429", "to": "N429a", "kind": "replaces-with-health-check", "run": 428, "label": "replay rejected, health check executed instead; 0 rig bytes changed.", "timestamp": 1790850000}
{"type": "edge", "from": "N429a", "to": "N198", "kind": "supports-option-b", "run": 428, "label": "twenty-first line for option (b): ceiling tie reproduces; bar has zero dynamic range at 0,0.", "timestamp": 1790850000}
{"type": "node", "id": "N430", "run": 429, "segment": 15, "status": "discard", "label": "Director iter-11 SE-EA-FACC (SE3 energy-attention contact policy as energy minima, predicted 74) adjudicated-not-executed: G3-retired family, 0 injectable rig hook, queue empty, predicted-only barred by G7. Prior physical r407 B=0.22855, replays delta 0.", "timestamp": 1790853600}
{"type": "node", "id": "N430a", "run": 429, "segment": 15, "status": "characterized", "label": "Frozen-champion health re-cert r429: trochoid vs raster 20 paired seeds x 3 suites at 0,0, A/B/R 20/20 both arms, coverage_cont 1.0000, 0 harness errors, results/aegis_v2/SEEA_FACC_iter11_r429.jsonl, 0 rig bytes changed. Compare keep=false.", "timestamp": 1790853600}
{"type": "edge", "from": "N430", "to": "N430a", "kind": "replaces-with-health-check", "run": 429, "label": "replay rejected, health check executed instead; 0 rig bytes changed.", "timestamp": 1790853600}
{"type": "edge", "from": "N430a", "to": "N198", "kind": "supports-option-b", "run": 429, "label": "twenty-second line for option (b): ceiling tie reproduces; bar has zero dynamic range at 0,0.", "timestamp": 1790853600}
{"type": "node", "id": "N431", "run": 430, "segment": 15, "status": "discard", "label": "FACC-SE3 (iter 12 / director single-brain fallback muse-spark-1.3): synthetic proxy B=0.25 << 0.70; mechanism G3-retired eq78/N70-N76; A_sel uniform 1.0; no paired canonical rig gain (delta=0 Fisher p=1.0); rig v3 no injectable hook; discard; freeze champion trochoid B=1.00 Fisher p=0.0083; synthetic N74 92.3 frozen.", "timestamp": 1790853600}
{"type": "edge", "from": "N84", "to": "N431", "kind": "discarded-replay-retired-family", "run": 430, "label": "FACC-SE3 replay of N84 family: synthetic proxy 0.25; G3 retirement binds; no injectable rig hook; paired physical compare delta=0 p=1.0 vs trochoid; no new derivation; freeze champion.", "timestamp": 1790853600}
{"type": "node", "id": "N431", "run": 431, "segment": 15, "status": "discard", "label": "Director iter-13 FACC-EAR (SE3-conditioned EBM over affordance manifold, flow frozen, predicted 74 keep) adjudicated NOT EXECUTED: G3-retired eq78 family replay; 0 injectable rig hook (PATH_MODES); G4 unpairable; G7 predicted-only barred; no queued row; replay-rejected; no new mechanism.", "timestamp": "2026-10-01T23:30:00Z"}
{"type": "node", "id": "N431a", "run": 431, "segment": 15, "status": "characterized", "label": "Frozen-champion health re-cert r431: timeout 1200 python3 experiments/kaggle_aegis_sweep.py --seeds 20 --no-upload --path trochoid --compare raster --suites A/B/R --out results/aegis_v2/FACC_EAR_iter13_r431.jsonl; exit 0, ~9s; 120 eps; 0 harness errors; A/B/R 20/20 coverage_cont 1.0000; delta 0; Fisher p 1.0; keep=false. 23rd independent 0,0 tie confirming G4 bar zero dynamic range at ceiling.", "timestamp": "2026-10-01T23:30:00Z"}
{"type": "edge", "from": "N431", "to": "N431a", "kind": "replaces-with-health-check", "run": 431, "label": "replay rejected; health check executed; 0 rig bytes changed; no synthetic promotion.", "timestamp": "2026-10-01T23:30:00Z"}
{"type": "edge", "from": "N431a", "to": "N198", "kind": "supports-option-b", "run": 431, "label": "23rd independent 0,0 ceiling tie: champion and baseline both sit at ceiling, so G4 bar has zero separating dynamic range on fixture_B at 0,0. FACC-EAR family stays retired; freeze champion trochoid (fixture_B=1.00 Fisher p=0.0083).", "timestamp": "2026-10-01T23:30:00Z"}
{"type":"node","id":"N432","run":432,"segment":15,"status":"discard","label":"Director iter-14 EBA-FACC (Energy-Based Affordance-Adaptive Contact Control, SE3-equivariant energy minimization + Langevin resample, FACC-SE3 + online affordance, predicted 74) adjudicated NOT EXECUTED: G3-retired eq78/N70-N76/manifold-switch/flow-bridge/energy-gated/SE3-affordance replay; 0 injectable rig hook (PATH_MODES); queue EMPTY since 309; G7 predicted-only barred; user-cited \"peg/hole shift + deformable wipe, 50 trials vs FACC-SE3\" not Fixture-B bar; freeze champion trochoid B=1.00 Fisher p=0.0083.","timestamp":"2026-10-01T23:45:00Z"}
{"type":"node","id":"N432a","run":432,"segment":15,"status":"characterized","label":"Frozen-champion health re-cert r432: timeout 1200 python3 ... trochoid --compare raster --suites A/B/R --out results/aegis_v2/EBA_FACC_iter14_r432.jsonl; exit 0 ~8.9s; 120 eps; 0 harness errors; A/B/R 20/20 coverage_cont 1.0000; delta 0; Fisher p 1.0; keep=false. 24th independent 0,0 ceiling tie confirming G4 bar zero dynamic range at ceiling.","timestamp":"2026-10-01T23:45:00Z"}
{"type":"edge","from":"N432","to":"N432a","kind":"replaces-with-health-check","run":432,"label":"replay rejected; health check executed instead; 0 rig bytes changed; no synthetic promotion; no arithmetic fabrication.","timestamp":"2026-10-01T23:45:00Z"}
{"type":"edge","from":"N432a","to":"N198","kind":"supports-option-b","run":432,"label":"24th independent 0,0 ceiling tie: champion and baseline both at ceiling; G4 bar has zero separating dynamic range on fixture_B at 0,0. EBA-FACC family stays G3-retired; freeze champion trochoid.","timestamp":"2026-10-01T23:45:00Z"}
{"type": "node", "id": "N433", "run": 433, "timestamp": "2026-10-01T23:55:00Z", "segment": 15, "idea": "DAEF-DIRECTOR-ITER15", "label": "DAEF (Dynamic Affordance-Energy Field) \u2014 Director iter-15 proposal ADJUDICATED NOT EXECUTED: G3-retired energy/SE3/affordance replay; 0 injectable rig hook; queue empty; predicted-only 68-74pts barred; health-check only; discard; freeze champion trochoid", "status": "discard", "frontier": "Dynamic Affordance-Energy Field (DAEF) \u2014 online SE(3) manifold from force+vision via energy-based in-context attention; flow-matching residual energy E(contact|SE3,F)", "physical": true, "rig_invoked": true, "rig_invoked_reason": "Only health-check executed (frozen-champion re-cert); proposal rejected before mechanism injection", "fixture_B_transfer_success": 1.0, "compare_baseline": "trochoid", "compare_keep": false, "predicted_score": "68-74", "predicted_only": true, "prior_evidence": ["r407 B=0.22855 discard (FACC-SE3 synthetic proxy)", "r409 replay delta 0 Fisher p=1.0 discard", "r430-r432 replay discard (0 injectable hook, G3 retirement binds)", "autoresearch_research.md segment 16: all AEGIS mechanisms discarded; N74 92.3 synthetic frozen unconditionally", "equations.md row 84 (FACC-SE3) / row 79 (N76b SE3-DAFE) \u2014 same family, all discard"], "g3_bind": true, "unvalidated_cap_consumed": false, "note": "Discard replay. No 20-seed paired decider launched for DAEF mechanism; no injectable mechanism exists; health-check confirms frozen champion at ceiling; no deferred/proxy/same-dependency; worklog append-only; commit performed."}
{"type": "edge", "id": "E433", "from": "N433", "to": "N198", "label": "iter 15 discard -> supports-option-b: G3-retired replay blocked (DAEF = energy/SE3/affordance family); 0 injectable hook; queue empty; health-check only; freeze champion trochoid; no synthetic promotion", "status": "discard", "run": 433, "segment": 15, "reason": "DAEF replay of G3-retired eq78/energy-gated/manifold-switch family; no injectable mechanism; predicted-only invalid for keep; no queued idea since 309; health-check confirms 25th independent 0,0 ceiling tie", "kind": "supports-option-b"}
{"type":"node","id":"N434","run":434,"segment":15,"idea":"FACC-SE3-DIRECTOR-ITER16","label":"FACC-SE3 (iter 16) — Director proposal ADJUDICATED NOT EXECUTED: replay of G3-retired energy/SE3/affordance family; 0 injectable rig hook; queue empty since 309; predicted-only 76pts barred by G7; health-check only; discard; freeze champion trochoid","status":"discard","frontier":"Force-Adaptive Contact Control SE(3)-conditioned (FACC-SE3) — energy-based physical in-context attention replacing flow-matching head","physical":true,"rig_invoked":true,"rig_invoked_reason":"Only health-check executed (frozen-champion re-cert r434); proposal rejected before mechanism injection","fixture_B_transfer_success":1.0,"compare_baseline":"raster","compare_keep":false,"predicted_score":"76","predicted_only":true,"prior_evidence":["r407 B=0.22855 discard (FACC-SE3 synthetic proxy)","r409-r430 replay delta 0 Fisher p=1.0 discard","r431-r433 replay discard (G3 retirement binds)","autoresearch_research.md segment 15-16: all AEGIS mechanisms discarded; N74 92.3 synthetic frozen unconditionally","equations.md row 84 (FACC-SE3) — same family, all discard"],"g3_bind":true,"unvalidated_cap_consumed":false,"note":"Discard replay. No injectable mechanism exists; health-check confirms 26th independent 0,0 ceiling tie; freeze champion trochoid fixture_B=1.00 Fisher p=0.0083; freeze synthetic N74 92.3 unconditionally; no deferred/proxy/same-dependency phrases used."}
{"type":"edge","id":"E434","from":"N434","to":"N198","label":"iter 16 discard -> supports-option-b: G3-retired replay blocked (FACC-SE3 = energy/SE3/affordance family); 0 injectable hook; queue empty since 309; health-check only; freeze champion trochoid; no synthetic promotion; no arithmetic fabrication; worklog append-only preserved","status":"discard","run":434,"segment":15,"reason":"FACC-SE3 replay of G3-retired eq78/energy-gated/manifold-switch/SE3-affordance family; no injectable mechanism; predicted-only 76pts invalid for keep; no queued idea since 309; health-check confirms 26th independent 0,0 ceiling tie (A/B/R 20/20 coverage_cont 1.0000 delta 0 Fisher p=1.0)","kind":"supports-option-b"}
{"type": "node", "id": "N436", "run": 436, "segment": 15, "idea": "FACC-SE3-DIRECTOR-ITER18 (Force-Adaptive Contact Control SE(3)-conditioned, energy-based attention, single-brain muse-spark-1.3-contributor-free)", "label": "FACC-SE3 (iter 18) \u2014 Director proposal ADJUDICATED NOT EXECUTED: replay of G3-retired energy/SE3/affordance/EBM/DAEF family (new label FACC-SE3 does not change mechanism class); 0 injectable rig hook (PATH_MODES only); predicted-only 74pts barred by G7; queue empty since 309; health-check only; discard; freeze champion trochoid", "status": "discard", "frontier": "Force-Adaptive Contact Control SE(3)-conditioned (FACC-SE3) \u2014 energy-based physical in-context attention replacing flow-matching head; E(contact,wrench,SE3-goal)", "physical": true, "rig_invoked": true, "rig_invoked_reason": "Only health-check executed (frozen-champion re-cert r436); proposal rejected before mechanism injection", "fixture_B_transfer_success": 1.0, "compare_baseline": "raster", "compare_keep": false, "predicted_score": "74", "predicted_only": true, "prior_evidence": ["r407 B=0.22855 discard (FACC-SE3 synthetic proxy)", "r409-r435 replay delta 0 Fisher p=1.0 discard (0 injectable hook, G3 retirement binds)", "autoresearch_research.md segment 15-16: all AEGIS mechanisms discarded; N74 92.3 synthetic frozen unconditionally", "equations.md row 78 / 84 (FACC-SE3 / N76b SE3-DAFE) \u2014 same family, all discard"], "g3_bind": true, "unvalidated_cap_consumed": false, "note": "Discard replay. No injectable mechanism exists; health-check confirms frozen champion at ceiling; no deferred/proxy/same-dependency phrases; worklog append-only preserved.", "timestamp": "2026-10-01T23:59:00Z"}
{"type": "edge", "id": "E436", "from": "N436", "to": "N198", "kind": "supports-option-b", "label": "iter 18 discard -> supports-option-b: G3-retired replay blocked (FACC-SE3 = energy/SE3/affordance/EBM/DAEF family replay); 0 injectable hook; queue empty since 309; health-check only; freeze champion trochoid; no synthetic promotion; no arithmetic fabrication", "status": "discard", "run": 436, "segment": 15, "reason": "FACC-SE3 replay of G3-retired eq78/N70-N76/manifold-switch/flow-bridge/energy-gated/SE3-affordance/EBM/DAEF-family; no injectable mechanism; predicted-only 74pts invalid; health-check confirms 27th independent 0,0 ceiling tie (A/B/R 20/20 coverage_cont 1.0 delta 0 Fisher p 1.0 keep=false)", "timestamp": "2026-10-01T23:59:00Z"}
{"type": "node", "id": "N437", "run": 437, "segment": 15, "idea": "FACC-SE3-DIRECTOR-ITER19 (Force-Adaptive Contact Control SE(3)-Conditioned, energy-based in-context attention, replaces pi0 flow head with force-adaptive contact field, director iter 19 single-brain muse-spark-1.3-contributor-free)", "label": "FACC-SE3 (iter 19) \u2014 Director proposal ADJUDICATED NOT EXECUTED: G3-retired replay of energy/SE3/affordance/manifold-switch/flow-bridge/EBM/DAEF/FACC family; 0 injectable rig hook (PATH_MODES); G7 predicted-only 76pts invalid; G2 user-cited non-Fixture-B variation excluded (pi0-FAST libero-contact + push-slide 50 trials); discard; freeze champion trochoid", "status": "discard", "frontier": "Force-Adaptive Contact Control SE(3)-Conditioned (FACC-SE3) \u2014 energy-based physical in-context attention replacing flow-matching head; dynamic affordance field E_dynamic(x,t); SE(3)-conditioned contact targets", "physical": true, "rig_invoked": true, "rig_invoked_reason": "Only frozen-champion health-check executed (r437); proposal rejected before mechanism injection", "fixture_B_transfer_success": 1.0, "compare_baseline": "raster", "compare_keep": false, "predicted_score": "76", "predicted_only": true, "prior_evidence": ["r407 B=0.22855 synthetic discard (FACC-SE3 synthetic proxy)", "r409-r430 replay delta 0 Fisher p=1.0 discard (no injectable hook, G3 retirement binds)", "autoresearch_research.md segment 15-16: all AEGIS mechanisms discarded; N74 92.3 synthetic frozen unconditionally", "equations.md row 82/84 (FACC-SE3 / DAEF / SE3-DAFE) \u2014 same family, all discard", "worklog iter 16-18: 26-27th independent 0,0 ceiling ties confirming G4 zero dynamic range"], "g3_bind": true, "unvalidated_cap_consumed": false, "note": "Discard replay. No injectable mechanism; health-check confirms frozen champion at ceiling; G2 metric freeze violated by user-cited non-canonical suite; no deferred/proxy/same-dependency phrases; worklog append-only preserved.", "timestamp": "2026-10-01T23:59:00Z"}
{"type": "edge", "id": "E437", "from": "N437", "to": "N198", "kind": "supports-option-b", "label": "iter 19 discard -> supports-option-b: G3-retired replay blocked (FACC-SE3 = energy/SE3/affordance/manifold-switch/flow-bridge family replay); 0 injectable hook; queue empty since 309; G2 user-cited non-canonical suite excluded; health-check only; freeze champion trochoid; no arithmetic fabrication; no synthetic promotion", "status": "discard", "run": 437, "segment": 15, "reason": "FACC-SE3 replay of G3-retired eq78/N70-N76/manifold-switch/flow-bridge/energy-gated/SE3-affordance/EBM/DAEF-family; no injectable mechanism; predicted-only 76pts invalid; G2 metric freeze violation (user-cited non-Fixture-B suite); health-check confirms 28th independent 0,0 ceiling tie (A/B/R 20/20 coverage_cont 1.0 delta 0 Fisher p 1.0 keep=false)", "timestamp": "2026-10-01T23:59:00Z"}
{"id":"N438","metric":0,"parent":"N198","status":"discarded","strategy":"FACC-SE3 ITER20 — Force-Adaptive Contact Control SE(3)-conditioned: energy-based physical in-context attention E(contact|SE3,force); predicts contact-wrench + SE(3) equivalence + stiffness; dynamic affordance field; replay of G3-retired eq78/energy-gated/manifold-switch/EBM/DAEF family (new label does not change mechanism class); 0 injectable rig hook (PATH_MODES only); user-cited non-canonical suite (perturbed affordance/deformable/varied friction/50 trials/3 seeds) violates G2 canonical Fixture-B bar; health-check only confirms frozen champion trochoid B=1.00/A=1.00/R=1.00 at 0,0 ceiling; paired delta 0 Fisher p 1.0 keep=false; discard per G3/G4/G7","timestamp":1789672000,"type":"node"}
{"from":"N198","kind":"replay_reject","to":"N438","type":"edge"}
{"id":"N440","metric":0,"parent":"N439","status":"replay-discard","strategy":"EAM-EIC replay (iter 22): energy-adaptive affordance manifold + in-context contact attention — G3 retired family replay; predicted 74 pts invalid; no injectable mechanism; discard at replay level; health-cert only","timestamp":"2026-10-01T16:00:00Z","type":"node"}
{"from":"N439","kind":"replay-rejected","to":"N440","type":"edge"}
{"id":"N441","metric":0,"parent":"N439","status":"replay-discard","strategy":"DEAM-E replay (iter 23): SE(3)-equivariant deformable energy-gated affordance manifold — G3 retired eq78/energy-gated/manifold-switch/EBM/DAEF/FACC-family replay; no injectable mechanism (PATH_MODES only); health-cert only confirms frozen champion trochoid fixture_B=1.00/A=1.00/R=1.00 at 0,0 ceiling; discard per G3/G4/G7; unvalidated cap untouched; worklog preserved","timestamp":"2026-10-01T16:05:00Z","type":"node"}
{"from":"N439","kind":"replay-rejected","to":"N441","type":"edge"}
{"id":"N442","parent":"N441","status":"replay-discard","strategy":"EAMA-SE3 replay of retired G3 energy-gated/manifold-switch/flow-bridge family (no injectable hook, queue empty, G3 retirement binds, predicted 76 pts invalid, champion frozen)","timestamp":1789743000,"type":"node"}
{"from":"N441","kind":"replay-discard","to":"N442","type":"edge"}
{"id": "N443", "parent": "N442", "status": "replay-discard", "strategy": "FACC-SE3-DIRECTOR-ITER25 replay of retired G3 energy-gated/manifold-switch/flow-bridge/EBM/DAEF/FACC-family (no injectable hook PATH_MODES, queue empty since 309, G3 binds, predicted 76 pts invalid G7, health-cert only frozen champion B=1.00 A=1.00 R=1.00 ceiling, discard)", "timestamp": "2026-10-01T10:55:00Z", "type": "node"}
{"from": "N442", "kind": "replay-discard", "to": "N443", "type": "edge"}
{"id": "N444", "parent": "N443", "status": "replay-discard", "strategy": "FACC-E (iter 26) replay of retired G3 energy-gated/manifold-switch/EBM/DAEF/FACC-family: SE(3)-conditioned EBM contact-energy head replaces Pi0 flow head; energy-based physical in-context attention; no injectable PATH_MODES hook; queue EMPTY since 309; G3 retirement binds; G4 unpairable; G7 predicted-only 76 pts invalid; G2 user-cited non-canonical suite (50 trials/3 seeds/varied friction/stiffness) excludes; health-cert only frozen champion trochoid B=1.00/A=1.00/R=1.00 at 0,0; discard per G3/G4/G7; unvalidated cap untouched (1 remaining); evidence results/aegis_v2/iter26_facc_health.jsonl", "timestamp": "2026-10-01T10:56:00Z", "type": "node", "metric": 0}
{"from": "N443", "kind": "replay-discard", "to": "N444", "type": "edge", "timestamp": "2026-10-01T10:56:00Z"}
{"from":"N447","kind":"replay_edge_to_retired_family","to":"N84","type":"edge","note":"G3 replay: TEF-EICA (energy-attention + SE(3)-equivariant + flow-match -> affordance-equivalence + variable-topology) matches retired eq78/N70-N76 family; no injectable mechanism; discard"}
{"node_id": "EDAA", "derived_from": ["N84", "N76b"], "category": "energy-based", "status": "DISCARD+REVERT", "metric": 1.0, "segment": 15, "evidence": "results/aegis_v2/edaa_iter32.jsonl"}
{"node_id": "EDAA", "derived_from": ["N84", "N76b"], "category": "energy-based", "status": "DISCARD+REVERT", "metric": 1.0, "segment": 15, "evidence": "results/aegis_v2/edaa_iter32.jsonl"}
{"node_id": "EDAA", "derived_from": ["N84", "N76b"], "category": "energy-based", "status": "DISCARD+REVERT", "metric": 1.0, "segment": 15, "evidence": "results/aegis_v2/edaa_iter32.jsonl"}
