{"run": 271, "segment": 15, "idea": "N81", "status": "discard", "metric": 1.0, "metric_class": "physical_fixture_B_transfer_success", "timestamp_utc": "2026-09-30T12:00:00Z", "rig": "canonical rig experiments/kaggle_aegis_sweep.py (PyBullet DIRECT, system python3, 20 seeds x 3 suites x 2 paired arms, rig v2); coverage_cont/success from physics contacts at return time; ZERO rig edits", "command": "timeout 1200 python3 experiments/kaggle_aegis_sweep.py --seeds 20 --no-upload --path trochoid --compare trochoid --compare-env AEGIS_ROW_CENTRE=0.0 --suites fixture_A,fixture_B,fixture_R --out results/aegis_v2/R271_frozen_n00.jsonl", "compare_champion": "in-rig --compare trochoid --compare-env AEGIS_ROW_CENTRE=0.0 on SAME 20 seeds; candidate B 1.0000 vs frozen 0.9453, Welch p=5.26e-06, keep=true; 120/120 scored fields bit-identical to run 270 arm", "description": "N81 FACC-ESCA (frozen pi0 percep only, discard action-expert, SE(3)-canonicalized energy-steered contact proposer + adaptive compliance, ~19k trainable, predicted 74) ADJUDICATED NOT EXECUTED; frozen-champion no-regression confirmation instead. DISCARD.", "metrics": {"idea": "N81", "lane": "CPU canonical rig", "metric_name": "transfer_success", "fixture_A": 1.0, "fixture_B": 1.0, "fixture_R": 1.0, "coverage_cont_B": 1.0, "welch_p_B": 5.26428e-06, "fisher_p_B": 1.0, "keep_record": true, "frozen": true, "adjudication": "not-executed", "harness_errors": 0, "g7_clean": true, "synthetic_proxy": null}, "director_build_adjudicated": "Director iter-11 N81 FACC-ESCA ADJUDICATED NOT EXECUTED: (1) G3-retired energy-gated/manifold/flow-bridge family (29th re-derivation; N79 canonicalizer + N80 energy-attention fusion keeps energy-gated class; FACC closed r232/r233; N68-N80 arms discarded r258-r270); (2) G4-unpairable (force-driven foam head, no pi0-percep/contact-frame/proposer/compliance keypoints; rig edits adding them = fabrication per G7; contact-geometry/stiffness-shift validations unmeasurable in rig); (3) energy in-context attention + adaptive compliance = learned/adaptive gate variant banned from keeps per G7; predicted-only 74 carries no paired p-value vs champion."}
{"run": 272, "segment": 15, "idea": "N82", "status": "discard", "metric": 1.0, "metric_class": "physical_fixture_B_transfer_success", "timestamp_utc": "2026-09-30T12:00:00Z", "rig": "canonical rig experiments/kaggle_aegis_sweep.py (PyBullet DIRECT, system python3, 20 seeds x 3 suites x 2 paired arms, rig v2); coverage_cont/success from physics contacts at return time; ZERO rig edits", "command": "timeout 1200 python3 experiments/kaggle_aegis_sweep.py --seeds 20 --no-upload --path trochoid --compare trochoid --compare-env AEGIS_ROW_CENTRE=0.0 --suites fixture_A,fixture_B,fixture_R --out results/aegis_v2/R272_frozen_n00.jsonl", "compare_champion": "in-rig --compare trochoid --compare-env AEGIS_ROW_CENTRE=0.0 on SAME 20 seeds; candidate B 1.0000 vs frozen 0.9453, Welch p=5.26e-06, keep=true; 120/120 scored fields bit-identical to run 271 arm", "description": "N82 FACC-ELFA (frozen pi0 percep only, discard action-expert, SE(3) energy-level-set flow affordance: tau adapted in-context from force history, attention logits -E/kT, ~19k trainable, predicted 73) ADJUDICATED NOT EXECUTED; frozen-champion no-regression confirmation instead. DISCARD.", "metrics": {"idea": "N82", "lane": "CPU canonical rig", "metric_name": "transfer_success", "fixture_A": 1.0, "fixture_B": 1.0, "fixture_R": 1.0, "coverage_cont_B": 1.0, "welch_p_B": 5.26428e-06, "fisher_p_B": 1.0, "keep_record": true, "frozen": true, "adjudication": "not-executed", "harness_errors": 0, "g7_clean": true, "synthetic_proxy": null}, "director_build_adjudicated": "Director iter-12 N82 FACC-ELFA ADJUDICATED NOT EXECUTED: (1) G3-retired energy-gated/manifold/flow-bridge family (30th re-derivation; tau-adaptive E-level-set + Boltzmann attention + flow-match proposer keeps energy-gated class; N79/N80/N81 arms discarded r269-r271; FACC closed r232/r233); (2) G4-unpairable (force-driven foam head, no pi0-percep/contact-frame/tau-adapter keypoints; rig edits adding them = fabrication per G7; stiffness-shift/novel-geometry validations unmeasurable in rig); (3) banned learned-gate keep class + predicted-only (no paired p-value); falsifier precondition (adaptive-tau vs fixed-tau delta) unmeasurable without the unbuilt head. Queue exhausted (I12 blocked on I8)."}
{"run": 273, "segment": 15, "idea": "N83", "status": "discard", "metric": 1.0, "metric_class": "physical_fixture_B_transfer_success", "timestamp_utc": "2026-09-30T12:00:00Z", "rig": "canonical rig experiments/kaggle_aegis_sweep.py (PyBullet DIRECT, system python3, 20 seeds x 3 suites x 2 paired arms, rig v2); coverage_cont/success from physics contacts at return time; ZERO rig edits", "command": "timeout 1200 python3 experiments/kaggle_aegis_sweep.py --seeds 20 --no-upload --path trochoid --compare trochoid --compare-env AEGIS_ROW_CENTRE=0.0 --suites fixture_A,fixture_B,fixture_R --out results/aegis_v2/R273_frozen_n00.jsonl", "compare_champion": "in-rig --compare trochoid --compare-env AEGIS_ROW_CENTRE=0.0 on SAME 20 seeds; candidate B 1.0000 vs frozen 0.9453, Welch p=5.26e-06, keep=true; 120/120 scored fields bit-identical to run 272 arm", "description": "N83 FACC-RCAR (frozen pi0 full + SE(3) contact residual, closed-loop force control replacing flow-propose, tau/compliance adapted in-context from force error, predicted 72-75) ADJUDICATED NOT EXECUTED; frozen-champion no-regression confirmation instead. DISCARD.", "metrics": {"idea": "N83", "lane": "CPU canonical rig", "metric_name": "transfer_success", "fixture_A": 1.0, "fixture_B": 1.0, "fixture_R": 1.0, "coverage_cont_B": 1.0, "welch_p_B": 5.26428e-06, "fisher_p_B": 1.0, "keep_record": true, "frozen": true, "adjudication": "not-executed", "harness_errors": 0, "g7_clean": true, "synthetic_proxy": null}, "director_build_adjudicated": "Director iter-13 N83 FACC-RCAR ADJUDICATED NOT EXECUTED: (1) G3-retired energy-gated/manifold/flow-bridge family (31st re-derivation; SE(3) contact-frame attention gating energy-level-set + in-context tau/compliance adaptation keeps learned energy-gated class; residual-on-force-error keeps residual-manifold class closed by I3 r242 constant-collapse; N68-N82 discarded r258-r272; FACC closed r232/r233); (2) G4-unpairable (force-driven foam head, no pi0/contact-residual/force-error keypoints; rig edits adding them = fabrication per G7; stiffness/pose-shift + force-violation validations unmeasurable in rig); (3) banned learned-gate keep class + predicted-only (no paired p-value); residual on/off A-B unmeasurable without the unbuilt head. Queue exhausted (I12 blocked on I8)."}
{"run": 274, "segment": 15, "idea": "N84", "status": "discard", "metric": 1.0, "metric_class": "physical_fixture_B_transfer_success", "timestamp_utc": "2026-09-30T13:00:00Z", "rig": "canonical rig experiments/kaggle_aegis_sweep.py (PyBullet DIRECT, system python3, 20 seeds x 3 suites x 2 paired arms, rig v2); coverage_cont/success from physics contacts at return time; ZERO rig edits", "command": "timeout 1200 python3 experiments/kaggle_aegis_sweep.py --seeds 20 --no-upload --path trochoid --compare trochoid --compare-env AEGIS_ROW_CENTRE=0.0 --suites fixture_A,fixture_B,fixture_R --out results/aegis_v2/R274_frozen_n00.jsonl", "compare_champion": "in-rig --compare trochoid --compare-env AEGIS_ROW_CENTRE=0.0 on SAME 20 seeds; candidate B 1.0000 vs frozen 0.9453, Welch p=5.26e-06, keep=true; 120/120 scored fields bit-identical to run 273 arm", "description": "N84 FACC-EICA (frozen pi0 percep only, discard action-expert, SE(3) energy proposer + IB in-context compliance attention + force residual closed-loop, predicted 74-78) ADJUDICATED NOT EXECUTED; frozen-champion no-regression confirmation instead. DISCARD.", "metrics": {"idea": "N84", "lane": "CPU canonical rig", "metric_name": "transfer_success", "fixture_A": 1.0, "fixture_B": 1.0, "fixture_R": 1.0, "coverage_cont_B": 1.0, "welch_p_B": 5.26428e-06, "fisher_p_B": 1.0, "keep_record": true, "frozen": true, "adjudication": "not-executed", "harness_errors": 0, "g7_clean": true, "synthetic_proxy": null}, "director_build_adjudicated": "Director iter-14 N84 FACC-EICA ADJUDICATED NOT EXECUTED: (1) G3-retired energy-gated/manifold/flow-bridge family (32nd re-derivation; N82 tau-adaptive E-level-set + N83 force-residual fusion keeps energy-gated/residual-manifold class; FACC closed r232/r233; N68-N83 arms discarded r258-r273); (2) G4-unpairable (force-driven foam head, no pi0-percep/energy-proposer/wrist-FT/IB-compliance keypoints; rig edits adding them = fabrication per G7; affordance-manifold split + attention-vs-fixed-tau + proposer-vs-residual ablations unmeasurable in rig); (3) IB in-context attention/compliance = learned/adaptive gate variant banned from keeps per G7; predicted-only 74-78 carries no paired p-value vs champion. Queue exhausted (I12 blocked on I8).", "evidence": ["results/aegis_v2/R274_frozen_n00.jsonl"], "equations": "none (retired family, no equation changed)", "graph": "N241-next->N241-N84->N242-next"}
{"run": 275, "commit": "HEAD", "segment": 15, "metric": 1.0, "metrics": {"idea": "N85", "transfer_B": 1.0, "baseline_B_covc": 0.9453, "welch_p_B": 5.26e-06, "keep_compare": true, "harness_errors": 0, "identical_r274": 120}, "status": "discard", "description": "N85 FACC-CMSA adjudicated-not-executed (33rd G3-retired re-derivation; SE(3) residual adapter on action tokens = residual-on-frozen-expert closed I3 r242 + energy-gated/manifold class retired N70-N76; FACC closed r232/r233; N68-N84 discarded r258-r274); G4-unpairable (foam head, no pi0/contact-mode/IB keypoints; edits=fabrication); banned learned-gate + predicted-only (74 novelty_score class, no paired p); frozen confirmation B 1.00 keep=true 120/120 identical r274; evidence results/aegis_v2/R275_frozen_n00.jsonl"}
{"run": 276, "commit": "HEAD", "segment": 15, "metric": 1.0, "metrics": {"idea": "N86", "transfer_B": 1.0, "baseline_B_covc": 0.9453, "welch_p_B": 5.26e-06, "keep_compare": true, "harness_errors": 0, "identical_r275": 120}, "status": "discard", "description": "N86 FACC-EADM adjudicated-not-executed (34th G3-retired re-derivation; EBM contact-energy + IB compliance-attention gate keeps energy-gated/manifold class retired N70-N76; dropping residual/flow-propose does not un-retire; FACC closed r232/r233; N68-N85 discarded r258-r275); G4-unpairable (foam head, no pi0-percep/FT/IB keypoints; edits=fabrication); banned learned-gate + predicted-only (72-76 novelty_score class, no paired p); frozen confirmation B 1.00 keep=true 120/120 identical r275; evidence results/aegis_v2/R276_frozen_n00.jsonl"}
{"run": 277, "commit": "HEAD", "segment": 15, "metric": 1.0, "metrics": {"idea": "N87", "transfer_B": 1.0, "baseline_B_covc": 0.9453, "welch_p_B": 5.26e-06, "keep_compare": true, "harness_errors": 0, "identical_r276": 120}, "status": "discard", "description": "N87 FACC-EDAF adjudicated-not-executed (35th G3-retired re-derivation; SE(3) energy proposer + IB compliance prompt + flow-matching bridge keeps energy-gated/manifold/flow-bridge class retired N70-N76; variation vs N84-86 does not un-retire; FACC closed r232/r233; N68-N86 discarded r258-r276); G4-unpairable (foam head, no pi0-percep/stiffness/IB keypoints; edits=fabrication; stiffness-shift falsifier unmeasurable); banned learned-gate + predicted-only (74.0 class, no paired p); frozen confirmation B 1.00 keep=true 120/120 identical r276; evidence results/aegis_v2/R277_frozen_n00.jsonl"}
{"run": 278, "commit": "HEAD", "segment": 15, "metric": 1.0, "metrics": {"idea": "N88", "transfer_B": 1.0, "baseline_B_covc": 0.9453, "welch_p_B": 5.26e-06, "keep_compare": true, "harness_errors": 0, "identical_r277": 120}, "status": "discard", "description": "N88 FACC-DAM adjudicated-not-executed (36th G3-retired re-derivation; FT-history in-context attention deforming SE(3) manifold + unfrozen diffusion expert = manifold/energy-gated/flow-bridge class retired N70-N76; FACC closed r232/r233; N68-N87 discarded r258-r277); G4-unpairable (foam head, no FT-history/SE(3)-manifold keypoints; edits=fabrication); banned learned-gate + predicted-only (76 class, no paired p); frozen confirmation B 1.00 keep=true 120/120 identical r277; evidence results/aegis_v2/R278_frozen_n00.jsonl"}
{"run": 279, "commit": "HEAD", "segment": 15, "metric": 1.0, "metrics": {"idea": "N89", "transfer_B": 1.0, "baseline_B_covc": 0.9453, "welch_p_B": 5.26e-06, "keep_compare": true, "harness_errors": 0, "identical_r278": 120}, "status": "discard", "description": "N89 AMD-PI0 adjudicated-not-executed (37th G3-retired re-derivation; learnable deformable affordance manifold adapter on frozen pi0 expert = manifold/energy-gated/flow-bridge class retired N70-N76; stops-37th-FACC variation does not un-retire; FACC closed r232/r233; N68-N88 discarded r258-r278); G4-unpairable (foam head, no pi0-expert/deformation-field/FT-history keypoints; edits=fabrication; manifold-violation-rate unmeasurable); banned learned-gate + predicted-only (74 novelty_score class, no paired p); frozen confirmation B 1.00 keep=true 120/120 identical r278; evidence results/aegis_v2/R279_frozen_n00.jsonl"}
{"run": 280, "commit": "HEAD", "segment": 15, "metric": 1.0, "metrics": {"idea": "N90", "transfer_B": 1.0, "baseline_B_covc": 0.9453, "welch_p_B": 5.26e-06, "keep_compare": true, "harness_errors": 0, "identical_r279": 120}, "status": "discard", "description": "N90 FACC-EIA adjudicated-not-executed (38th G3-retired re-derivation; EBM energy-scored FT-history + in-context stiffness/damping attention + analytic solver head = energy-gated/manifold class retired N70-N76; dropping learned warp does not un-retire; FACC closed r232/r233; N68-N89 discarded r258-r279); G4-unpairable (foam head, no pi0-expert/FT-history/stiffness keypoints; edits=fabrication; stiffness falsifier unmeasurable); banned learned-gate + predicted-only (74 novelty_score class, no paired p); frozen confirmation B 1.00 keep=true 120/120 identical r279; evidence results/aegis_v2/R280_frozen_n00.jsonl"}
{"run": 281, "commit": "HEAD", "segment": 15, "metric": 1.0, "metrics": {"idea": "N91", "transfer_B": 1.0, "baseline_B_covc": 0.9453, "welch_p_B": 5.26e-06, "keep_compare": true, "harness_errors": 0, "identical_r280": 120}, "status": "discard", "description": "N91 FACC-REP adjudicated-not-executed (39th G3-retired re-derivation; E-gated analytic stiffness/damping + SE(3)-equivariant head replacing pi0 flow head = energy-gated/manifold class retired N70-N76; surgical-head-replace vs adapter does not un-retire; FACC closed r232/r233; N68-N90 discarded r258-r280); G4-unpairable (foam head, no VLM/wrench/SE(3)/stiffness-shift keypoints; edits=fabrication; stiffness-shift falsifier unmeasurable); banned learned-gate + predicted-only (73 novelty_score class, no paired p); frozen confirmation B 1.00 keep=true 120/120 identical r280; evidence results/aegis_v2/R281_frozen_n00.jsonl"}
{"run": 282, "commit": "HEAD", "segment": 15, "metric": 1.0, "metrics": {"idea": "N92", "transfer_B": 1.0, "baseline_B_covc": 0.9453, "welch_p_B": 5.26e-06, "keep_compare": true, "harness_errors": 0, "identical_r281": 120}, "status": "discard", "description": "N92 WAE-FR adjudicated-not-executed (40th G3-retired re-derivation; SE(3)-equivariant warp on affordance-equivalence class + contact-energy attention = energy-gated/manifold/flow-bridge class retired N70-N76; freezing pi0+flow and warping inputs does not un-retire; FACC closed r232/r233; N68-N91 discarded r258-r281); G4-unpairable (foam head, no pi0-flow/SE(3)-warp/contact-energy keypoints; edits=fabrication; warp-identity + stiffness-ablation falsifiers unmeasurable); banned learned-gate + predicted-only (74.5 novelty_score class, no paired p); frozen confirmation B 1.00 keep=true 120/120 identical r281; evidence results/aegis_v2/R282_frozen_n00.jsonl"}
{"run": 283, "commit": "HEAD", "segment": 15, "metric": 1.0, "metrics": {"idea": "N93", "transfer_B": 1.0, "baseline_B_covc": 0.9453, "welch_p_B": 5.26e-06, "keep_compare": true, "harness_errors": 0, "identical_r282": 120}, "status": "discard", "description": "N93 FACC-MS adjudicated-not-executed (41st G3-retired re-derivation; FT-energy/info-gain contact-switched manifolds + per-manifold SE(3) FACC + flow-conditioned-on-manifold-ID = manifold-switch/flow-bridge/energy-gated class retired N70-N76; switching manifolds vs warping inside one does not un-retire; FACC closed r232/r233; N68-N92 discarded r258-r282); G4-unpairable (foam head, no FT-energy/manifold-ID/pi0-flow keypoints; edits=fabrication; switch-chatter falsifier unmeasurable); banned learned-gate + predicted-only (74 novelty_score class, no paired p); frozen confirmation B 1.00 keep=true 120/120 identical r282; evidence results/aegis_v2/R283_frozen_n00.jsonl"}
{"run": 284, "commit": "HEAD", "segment": 15, "metric": 1.0, "metrics": {"idea": "N94", "transfer_B": 1.0, "baseline_B_covc": 0.9453, "welch_p_B": 5.26e-06, "keep_compare": true, "harness_errors": 0, "identical_r283": 120}, "status": "discard", "description": "N94 EPIA-SE3 adjudicated-not-executed (42nd G3-retired re-derivation; freeze-pi0 + FT-energy/info-gain attention over action chunks with SE(3)-equivariant keys = energy-gated/manifold/flow-bridge class retired N70-N76; SE(3)-keyed attention vs warping does not un-retire; FACC closed r232/r233; N68-N93 discarded r258-r283); G4-unpairable (foam head, no pi0-expert/FT-energy/action-chunk keypoints; edits=fabrication; info-gain-separation falsifier unmeasurable); banned learned-gate + predicted-only (72 novelty_score class, no paired p); frozen confirmation B 1.00 keep=true 120/120 identical r283; evidence results/aegis_v2/R284_frozen_n00.jsonl"}
{"run": 285, "commit": "HEAD", "segment": 15, "metric": 1.0, "metrics": {"idea": "N95", "transfer_B": 1.0, "baseline_B_covc": 0.9453, "welch_p_B": 5.26e-06, "keep_compare": true, "harness_errors": 0, "identical_r284": 120}, "status": "discard", "description": "N95 EGAS-FACC adjudicated-not-executed (43rd G3-retired re-derivation; contact-energy gate + SE(3)-warp on equivalence class + flow-conditioned FACC = energy-gated/manifold-switch/flow-bridge class retired N70-N76; freezing pi0 and swapping flow head for gate+warp does not un-retire; FACC closed r232/r233; N68-N94 discarded r258-r284); G4-unpairable (foam head, no pi0-flow/contact-energy/SE(3)-warp keypoints; edits=fabrication; info-gain-switch + warp-equivariance falsifiers unmeasurable); banned learned-gate + predicted-only (72.5 novelty_score class, no paired p); frozen confirmation B 1.00 keep=true; evidence results/aegis_v2/R285_frozen_n00.jsonl"}
{"run": 286, "commit": "HEAD", "segment": 15, "metric": 1.0, "metrics": {"idea": "N96", "transfer_B": 1.0, "baseline_B_covc": 0.9453, "welch_p_B": 5.26e-06, "keep_compare": true, "harness_errors": 0, "identical_r285": 120}, "status": "discard", "description": "N96 EGMS-FACC adjudicated-not-executed (44th G3-retired re-derivation; FT-energy/info-gain manifold-switch + FACC executor + flow-head replace/VLM-only keeps energy-gated/manifold-switch/flow-bridge class retired N70-N76; head-swap vs N93/N94/N95 does not un-retire; FACC closed r232/r233; N68-N95 discarded r258-r285); G4-unpairable (foam head, no FT-energy/manifold-ID/pi0-flow keypoints; edits=fabrication; switch-latency + FT-noise falsifiers unmeasurable); banned learned-gate + predicted-only (73.5 novelty_score class, no paired p); frozen confirmation B 1.00 keep=true; evidence results/aegis_v2/R286_frozen_n00.jsonl"}
{"run": 287, "commit": "HEAD", "segment": 15, "metric": 1.0, "metrics": {"idea": "N97", "transfer_B": 1.0, "baseline_B_covc": 0.9453, "welch_p_B": 5.26e-06, "keep_compare": true, "harness_errors": 0, "identical_r286": 120}, "status": "discard", "description": "N97 EGWE-FACC adjudicated-not-executed (45th G3-retired re-derivation; flow-matching SE(3) affordance-warp field + info-gain attention + FACC executor keeps energy-gated/manifold/flow-bridge class retired N70-N76; dropping pi0 expert / keeping VLM backbone does not un-retire; FACC closed r232/r233; N68-N96 discarded r258-r286); G4-unpairable (foam head, no VLM/flow-warp/affordance keypoints; edits=fabrication; SE(3)-perturb + affordance-transfer validations unmeasurable); banned learned-gate + predicted-only (74 novelty_score class, no paired p); frozen confirmation B 1.00 keep=true 120/120 identical r286; evidence results/aegis_v2/R287_frozen_n00.jsonl"}
{"run": 288, "commit": "HEAD", "segment": 15, "metric": 1.0, "metrics": {"idea": "N98", "transfer_B": 1.0, "baseline_B_covc": 0.9453, "welch_p_B": 5.26e-06, "keep_compare": true, "harness_errors": 0, "identical_r287": 120}, "status": "discard", "description": "N98 EIAA-PI0 adjudicated-not-executed (46th G3-retired re-derivation; contact-energy + info-gain top-k attention reweight inside pi0 expert, flow-matching head kept, no FACC executor, no SE(3)-warp = energy-gated/manifold/flow-bridge class retired N70-N76; attention-only variation vs N95-N97 does not un-retire; FACC closed r232/r233; N68-N97 discarded r258-r287); G4-unpairable (foam head, no pi0-expert/affordance-token/energy-score keypoints; edits=fabrication; SE(3)-perturb + shuffle-energy falsifiers unmeasurable); banned learned-gate + predicted-only (73 novelty_score class, no paired p); frozen confirmation B 1.00 keep=true 120/120 identical r287; evidence results/aegis_v2/R288_frozen_n00.jsonl"}
