{"type": "edge", "from": "N171", "to": "N172", "kind": "frontier-expansion", "label": "robust band-local score (T207 hardening)", "note": "N172: TAU*=[0.5082,-0.399,0.0319]+TAU_G=-0.0397 interior feasible; tie-break 2/120 inert; heldB 40.0; pooled 60.0=T207 EXACT (+13.33 plateau; 43c57 subset of T205); lam0 infeasible-degenerate; MAD-vs-sig 0.0; J90-vs-J95 0.0 (all n_adm 43); band1 held recall 0.0; director 71-74 MISSED; DISCARD; KILL robust line; I2 CLOSED, next I8. Tier-2 binding."}
{"type": "node", "id": "N173", "parent": "N172", "status": "discarded", "metric": 100.0, "strategy": "T210 upper-tail multiplicative jerk gating (director iter 35): s=max(0,w191-med_b)/(1.4826*MAD_b+eps)*exp(-jerk/J90_b), pooled-0 CALIB fit, no lam/shrink/hard-gate/tie-break; frozen I7+I10; zero rig edits, offline on frozen R173 files", "frontier": "multiplicative gating interaction (additive-penalty replacement)", "variation": "T209 additive (w-med)/scale-0.5*clip(j/J90) -> T210 upper-tail max(0,.)*exp(-j/J90)", "timestamp": "2026-09-28T00:00:00Z", "evidence_artifacts": ["results/aegis_v2/I2_r210_analysis.py", "results/aegis_v2/I2_r210_result.json"]}
{"type": "edge", "from": "N172", "to": "N173", "kind": "frontier-expansion", "label": "multiplicative jerk gating (upper-tail)", "note": "N173: band1 INFEASIBLE (upper-tail clip+exp destroys in-band separation, 4 fails) -> all-reject fallback -> degenerate pooled 100.0 (n_adm 0/120, heldB 0.0, cov regression); additive refit feasible, 60.0=T207/T209; band2 gain +0.2857 degenerate; DISCARD; KILL multiplicative line; I2 CLOSED, next I8. Tier-2 binding."}
{"type": "node", "id": "N174", "parent": "N173", "status": "discarded", "metric": 100.0, "strategy": "T211 shrunk-scale upper-tail soft-score (director iter 36): s=max(0,w191-med_b)/(1.4826*max(MAD_b,0.2*MAD_global)+eps)*exp(-0.5*clip(jerk/J90_b,0,3)), pooled-0 CALIB fit, no lam/shrink-washout/hard-gate/tie-break; frozen I7+I10; zero rig edits, offline on frozen R173 files", "frontier": "shrunk-scale multiplicative dampening (MAD floor + clipped exp damp)", "variation": "T210 exp(-j/J90)/raw MAD -> T211 0.5-clipped exp + MAD global floor, pure-local location", "timestamp": "2026-09-28T00:00:00Z", "evidence_artifacts": ["results/aegis_v2/I2_r211_analysis.py", "results/aegis_v2/I2_r211_result.json"]}
{"type": "edge", "from": "N173", "to": "N174", "kind": "frontier-expansion", "label": "shrunk-scale multiplicative dampening", "note": "N174: band1 INFEASIBLE -> all-reject fallback -> degenerate pooled 100.0 (heldB 0.0, cov regression); MAD floor never binds (no collapse exists); F sweep bit-identical; raw ablation feasible 60.0=T207/T209 (max costs -40pts); band2 gain degenerate; DISCARD; KILL shrunk-scale multiplicative line; I2 CLOSED, next I8. Tier-2 binding."}
{"type": "node", "id": "N175", "parent": "N174", "status": "discarded", "metric": 60.0, "strategy": "T212 shrunk-denominator additive-jerk upper-tail soft-score (director iter 37): s=max(0,w191-med_b)/(1.4826*MAD*_b+eps)-0.25*clip(jerk/J90_b,0,1), MAD*_b=max(0.7*MAD_b+0.3*MAD_glob,0.3*MAD_glob), lam FIXED 0.25, pooled-0 CALIB fit, no hard-gate/tie-break; frozen I7+I10; zero rig edits, offline on frozen R173 files", "frontier": "shrunk-denominator additive soft-score (upper-tail + global shrinkage)", "variation": "T211 shrunk-scale multiplicative exp-damp -> T212 additive 0.25-penalty + shrunk denominator", "timestamp": "2026-09-28T00:00:00Z", "evidence_artifacts": ["results/aegis_v2/I2_r212_analysis.py", "results/aegis_v2/I2_r212_result.json"]}
{"type": "edge", "from": "N174", "to": "N175", "kind": "frontier-expansion", "label": "shrunk-denominator additive score", "note": "N175: TAU*=[0.6624,-0.1294,0.1952] all feasible (fixes T210/T211 infeasibility); floor 0/3, collapse 0/3 (no collapse, abort NOT fired); heldB 40.0; pooled 60.0=T207/T209 (+13.33 plateau); lam0 infeasible-degenerate (drop-jerk FAILS); archive 0.10; DISCARD; KILL sub-line; I2 CLOSED, next I8. Tier-2 binding."}
{"type": "node", "id": "N176", "parent": "N175", "status": "discarded", "metric": 53.33, "strategy": "T213 hierarchical global-anchored signed soft-score (director iter 38): s=(w191-[l*med_b+(1-l)*med_glob])/(1.4826*max(MAD_b,MAD_glob/sqrt(n_b),0.5*MAD_glob)), l=n_b/(n_b+10)=0.8, signed no-ReLU no-jerk, pooled-1 global TAU* + LOBO; frozen I7+I10; zero rig edits, offline on frozen R173 files", "frontier": "hierarchical global-anchored scoring (shrink center + floored scale, pooled-1)", "variation": "T212 shrunk-denominator additive-jerk upper-tail -> T213 shrunk CENTER + signed score + drop ReLU + drop jerk entirely", "timestamp": "2026-09-28T00:00:00Z", "evidence_artifacts": ["results/aegis_v2/I2_r213_analysis.py", "results/aegis_v2/I2_r213_result.json"]}
{"type": "edge", "from": "N175", "to": "N176", "kind": "frontier-expansion", "label": "hierarchical global-anchored score (pooled-1)", "note": "N176: TAU*=0.257 feasible (calib 0.7647/0.0889); heldB 40.0; pooled 53.33 (+6.66 plateau, -6.67 vs T207 60.0); LOBO mean 0.4381<0.65 FAIL, TAU range 0.88 unstable; floor 0/3 (no collapse); pooled-0 abl infeasible-degenerate; band1 held 0.0; director 74 MISSED; DISCARD; KILL hierarchical line; I2 CLOSED, next I8. Tier-2 binding."}
{"type": "node", "id": "N177", "parent": "N176", "status": "discarded", "metric": 100.0, "strategy": "T214 band-local upper-tail EB-shrunk-scale soft-score (director iter 39): s=max(0,w191-med_b)/(1.4826*max((n_b*MAD_b+10*MAD_glob)/(n_b+10),0.3*MAD_glob)), pooled-0 CALIB fit, no jerk/exp/hard-gate; frozen I7+I10; zero rig edits, offline on frozen R173 files", "frontier": "sample-size-aware scale shrinkage (EB + 0.3 floor)", "variation": "T211 fixed 0.2 floor -> EB n-weighted + 0.3 floor, keep local-med/upper-tail/pooled-0", "timestamp": "2026-09-28T00:00:00Z", "evidence_artifacts": ["results/aegis_v2/I2_r214_analysis.py", "results/aegis_v2/I2_r214_result.json"]}
{"type": "edge", "from": "N176", "to": "N177", "kind": "frontier-expansion", "label": "EB-shrunk-scale upper-tail score", "note": "N177: bands 0+1 INFEASIBLE -> all-reject fallback -> degenerate pooled 100.0 (heldB 0.0, cov regression); EB~MAD_b (n40>>10, floor 0/3, no collapse); raw-MAD abl bit-identical (EB adds 0.0); pooled-1 same-s 60.0=T207 (gap 40, no leak); director 105-110 MISSED; DISCARD; KILL EB line; I2 CLOSED, next I8. Tier-2 binding."}
{"type": "node", "id": "N178", "parent": "N177", "status": "discarded", "metric": 100.0, "strategy": "T215 band-local upper-tail EB-shrunk-scale + floored-denominator soft-score (director iter 40): s=max(0,w191-med_b)/(1.4826*max((n_b*MAD_b+10*MAD_glob)/(n_b+10),0.5*MAD_glob)), pooled-0 CALIB fit, no jerk/exp/hard-gate; frozen I7+I10; zero rig edits, offline on frozen R173 files", "frontier": "robust band-local upper-tail anomaly score (EB + 0.5 floor)", "variation": "T214 0.3 floor -> 0.5 floor (stop zero-MAD blowup), drop T212 additive-jerk hack", "timestamp": "2026-09-28T00:00:00Z", "evidence_artifacts": ["results/aegis_v2/I2_r215_analysis.py", "results/aegis_v2/I2_r215_result.json"]}
{"type": "edge", "from": "N177", "to": "N178", "kind": "frontier-expansion", "label": "EB + floored-denominator upper-tail score", "note": "N178: bands 0+1 INFEASIBLE -> all-reject degenerate pooled 100.0 (heldB 0.0, cov regression); floor 0/3, collapse 0/3 (no collapse, hypothesis FALSIFIED 5th); k{5,10,20}x floor on/off all degenerate (floor inert real, works synthetic MAD0 3.16/1.35/0.45); rank corr vs T214 1.0; signed delta 0.0; director 75-82 MISSED; DISCARD; KILL EB+floored line; I2 CLOSED, next I8. Tier-2 binding."}
{"type": "node", "id": "N179", "parent": "N178", "status": "discarded", "metric": 53.33, "strategy": "T216 hierarchical global-anchored signed EB-shrunk floored-denominator soft-score pooled-1 (director iter 41): s=(w191-[l*med_b+(1-l)*med_glob])/(1.4826*max((n_b*MAD_b+10*MAD_glob)/(n_b+10),0.2*MAD_glob)), l=0.8; signed, no jerk term; single global TAU* CALIB fit; frozen I7+I10; zero rig edits, offline on frozen R173 files", "frontier": "hierarchical global-anchored robust score (EB + floor + sign)", "variation": "T213 center-shrink + T214/T215 EB denominator + 0.2 floor, signed, pooled-1", "timestamp": "2026-09-28T00:00:00Z", "evidence_artifacts": ["results/aegis_v2/I2_r216_analysis.py", "results/aegis_v2/I2_r216_result.json"]}
{"type": "edge", "from": "N178", "to": "N179", "kind": "frontier-expansion", "label": "global-anchored EB-shrunk floored signed score", "note": "N179: pooled recall 53.33=T213 bit-identical (n_adm 45; heldB 40.0; band1 recall 0.0); EB~MAD_b (n40>>10, floor 0/3, no collapse FALSIFIED 6th); rank corr vs T213 0.9974; zero-MAD finite 2.26/10u; sign retained 55.8%; pooled-0 band0 infeasible->degenerate (validates pooled-1); director 65-72 MISSED; DISCARD; KILL hierarchical-EB line; I2 CLOSED, next I8. Tier-2 binding."}
{"type": "node", "id": "N180", "parent": "N179", "status": "discarded", "metric": 100.0, "strategy": "T217 band-local upper-tail EB-shrunk floored-denominator pooled-0 (director iter 42): s=max(0,w191-med_b)/(1.4826*max((n_b*MAD_b+10*MAD_glob)/(n_b+10),0.15*MAD_glob,eps)), local med, upper-tail, no median shrinkage; frozen I7+I10; zero rig edits, offline on frozen R173 files", "frontier": "scale-floor-only fix (global-scale floor, no median shrinkage)", "variation": "T215 0.5 floor -> 0.15*MAD_glob floor + eps, keep local-med/upper-tail/pooled-0", "timestamp": "2026-09-28T00:00:00Z", "evidence_artifacts": ["results/aegis_v2/I2_r217_analysis.py", "results/aegis_v2/I2_r217_result.json"]}
{"type": "edge", "from": "N179", "to": "N180", "kind": "frontier-expansion", "label": "scale-floor-only fix (0.15 global floor)", "note": "N180: bands 0+1 INFEASIBLE -> all-reject degenerate pooled 100.0 (heldB 0.0, cov regression); floor 0/3, collapse 0/3 (no collapse, 7th falsification); raw-MAD bit-identical; rank corr vs T215 1.0; zero inf/NaN PASS; DISCARD; KILL upper-tail-EB-floor sub-line; I2 CLOSED, next T218 winsorize per director. Tier-2 binding."}
{"type": "node", "id": "N181", "parent": "N180", "status": "discarded", "metric": 100.0, "strategy": "T218 band-local upper-tail dual-floored hard-score pooled-0 + 10pct global anchor (director iter 43): s=max(0,w191-[0.9*med_b+0.1*med_g])/(1.4826*max(MAD_b,0.1*MAD_glob,floor)+eps), floor=(10*eps+40*med_noise)/sqrt(n_b); raw MAD_b; frozen I7+I10; zero rig edits, offline on frozen R173 files", "frontier": "dual-floor + light global anchor fix for pooled-0/MAD_b instability", "variation": "T217 EB-scale -> raw MAD_b + dual floor; local med -> 10pct-anchored center", "timestamp": "2026-09-28T00:00:00Z", "evidence_artifacts": ["results/aegis_v2/I2_r218_analysis.py", "results/aegis_v2/I2_r218_result.json"]}
{"type": "edge", "from": "N180", "to": "N181", "kind": "frontier-expansion", "label": "dual-floor + 10pct anchor hard score", "note": "N181: bands 0+1 INFEASIBLE -> all-reject degenerate pooled 100.0 (heldB 0.0, cov regression); floor 0/3, collapse 0/3 (no collapse, 8th falsification); MAD0 finite 4.51/10u; zero inf/NaN PASS; rank corr vs T217 0.9817; LOBO var 20.0 FAILS <15; pooled-1 abl 53.33; DISCARD; KILL dual-floor+anchor line; I2 CLOSED, next I8. Tier-2 binding."}
{"type": "node", "id": "N182", "parent": "N181", "status": "discarded", "metric": 100.0, "strategy": "T219 band-local upper-tail asymmetric upper-MAD EB-lite single-floor soft-score pooled-0 + 20pct global anchor (director iter 44): med*=0.8*med_b+0.2*med_g; MADup*=w*MADup_b+(1-w)*MADup_g, w=n_b/(n_b+20); s=max(0,w191-med*)/(1.4826*max(MADup*,floor)); floor=max(5,0.5*MADup_g); p=1-exp(-s); per-band ROC TAU_p; frozen I7+I10; zero rig edits, offline on frozen R173 files", "frontier": "asymmetric scale (upper-tail MAD, first non-symmetric scale in T207-T219 line)", "variation": "T218 symmetric MAD_b + dual-floor + hard-score -> T219 upper-MAD + single floor + soft p + 20pct anchor", "timestamp": "2026-09-28T00:00:00Z", "evidence_artifacts": ["results/aegis_v2/I2_r219_analysis.py", "results/aegis_v2/I2_r219_result.json"]}
{"type": "edge", "from": "N181", "to": "N182", "kind": "frontier-expansion", "label": "asymmetric upper-MAD soft score (20pct anchor)", "note": "N182: bands 0+1 INFEASIBLE -> all-reject fallback -> degenerate pooled 100.0 (heldB 0.0, cov regression); skew [1.479,1.024,0.148] no consistent direction; floor 0/3, collapse 0/3 (9th falsification); MADup0 finite; anchor0/sym abls delta 0.0; soft-hard rank 1.0 inert; LOBO 13.34 PASS; pooled-1 60.0; DISCARD; KILL upper-tail asymmetric line; I2 CLOSED, next I8. Tier-2 binding."}
{"type": "node", "id": "N183", "parent": "N182", "status": "discarded", "metric": 100.0, "strategy": "T220 cross-band pooled two-tail IQR soft-score pooled-8 + 50pct global anchor (director iter 45): s=min(|w191-[0.5*med_b+0.5*med_g]|/(0.7413*max(IQR_pool,floor_g)),6); admit iff s<=TAU* (single global TAU, 8-pt success-quantile grid); frozen I7+I10; zero rig edits, offline on frozen R173 files", "frontier": "cross-band pooled scale (first pooled-IQR two-tail score; leaves band-local upper-tail MAD)", "variation": "T219 band-local upper-tail MADup + per-band ROC -> T220 pooled IQR + two-tail abs + single global TAU", "timestamp": "2026-09-28T00:00:00Z", "evidence_artifacts": ["results/aegis_v2/I2_r220_analysis.py", "results/aegis_v2/I2_r220_result.json"]}
{"type": "edge", "from": "N182", "to": "N183", "kind": "frontier-expansion", "label": "pooled two-tail IQR (50pct anchor)", "note": "N183: best-grid calib recall 0.4706<0.65 -> INFEASIBLE -> all-reject degenerate pooled 100.0 (heldB 0.0, cov regression); all 5 ablations infeasible-degenerate delta 0.0; LOBO all-infeasible; zero inf/NaN PASS; ABORT-IF FIRES (pts>=70): KILL robust-z family; next rank/quantile. I2 CLOSED. Tier-2 binding."}
{"type": "node", "id": "N184", "parent": "N183", "status": "discarded", "metric": 100.0, "strategy": "T221 band-local median-only symmetric IQR hard-score pooled-0 + 0pct global, zero floors, no EB/MAD (director iter 46): s=max(0,|w191-med_b|-1.5*IQR_b); admit iff s<=TAU*_b; frozen I7+I10; zero rig edits, offline on frozen R173 files", "frontier": "center-isolation (anchor/floor ablation; strips all anchoring/scaling machinery)", "variation": "T220 pooled IQR two-tail soft pooled-8 + 50pct anchor -> T221 band-local IQR hard fence exceedance pooled-0 + 0pct anchor, zero floors", "timestamp": "2026-09-28T00:00:00Z", "evidence_artifacts": ["results/aegis_v2/I2_r221_analysis.py", "results/aegis_v2/I2_r221_result.json"]}
{"type": "edge", "from": "N183", "to": "N184", "kind": "frontier-expansion", "label": "center-isolation IQR hard fence (0pct anchor)", "note": "N184: fence halfwidth [43.97,34.92,111.52] swallows ALL points -> s identically 0 (central frac 1.0, deciles 0.0), all 3 bands infeasible -> all-reject degenerate 100.0 (heldB 0.0, cov regression); 5 ablations delta 0.0; LOBO var 0.0; DISCARD; CENTER-COLLAPSED -> next T222 lower-tail-only. I2 CLOSED. Tier-2 binding."}
{"type": "node", "id": "N185", "parent": "N184", "status": "discarded", "metric": 100.0, "strategy": "T222 band-local median-only symmetric hard-keep control pooled-0 + 0pct global, single floor, zero extra (director iter 47): s=|wraw-med_b| raw (no C99 clip, no fence/scale/soft/EB/MAD); admit iff s<=TAU*_b; frozen I7+I10; zero rig edits, offline on frozen R173 files", "frontier": "discard-path bug test (raw deviation, not tail statistic)", "variation": "T221 IQR fence exceedance (s identically 0) -> T222 raw |w-med| (s var 317, separation test)", "timestamp": "2026-09-28T00:00:00Z", "evidence_artifacts": ["results/aegis_v2/I2_r222_analysis.py", "results/aegis_v2/I2_r222_result.json"]}
{"type": "edge", "from": "N184", "to": "N185", "kind": "frontier-expansion", "label": "raw-deviation hard-keep control (0pct anchor)", "note": "N185: band0 feasible (TAU*=15.77) but bands 1+2 infeasible -> all-reject degenerate 100.0 (heldB 0.0, cov regression); s var>0 (317.45) but succ/fail q50 15.02/15.96 near-identical (fails central, inverted separability); zero inf/NaN PASS; discard counter 6, streak NOT broken; 3 ablations delta 0.0; DISCARD; KILL raw-deviation line; I2 CLOSED. Tier-2 binding."}
{"type": "node", "id": "N186", "parent": "N185", "status": "discarded", "metric": 100.0, "strategy": "T223 band-local median asymmetric upper-only IQR soft-clip pooled-4 + 25pct global anchor (director iter 48): s=max(0,wraw-thr_b), thr_b=max(0.75*med_b+0.25*med_g+1.5*IQRup_b,med_b), p=1-exp(-s/max(IQRup_b,eps)), per-band 4-pt grid; frozen I7+I10; zero rig edits, offline on frozen R173 files", "frontier": "keep-first upper-only tail (remove lower-tail false positives)", "variation": "T222 raw symmetric |w-med| central-keep -> T223 upper-only exceedance + 1.5*IQRup fence + soft-clip + 25pct anchor + 4-pt grid", "timestamp": "2026-09-28T00:00:00Z", "evidence_artifacts": ["results/aegis_v2/I2_r223_analysis.py", "results/aegis_v2/I2_r223_result.json"]}
{"type": "edge", "from": "N185", "to": "N186", "kind": "frontier-expansion", "label": "upper-only IQR soft-clip (25pct anchor)", "note": "N186: thr 106.48/89.66/80.88 >> med; frac_zero 1.0/0.75/0.80; all 3 bands infeasible -> all-reject degenerate 100.0 (heldB 0.0, cov regression); 5 ablations delta 0.0; DISCARD; ABORT-IF FIRES: frontier exhausted, pivot winsorize-all T224. I2 CLOSED. Tier-2 binding."}
{"type": "node", "id": "N187", "parent": "N186", "status": "discarded", "metric": 100.0, "strategy": "T224 band-local median asymmetric upper-only IQR soft-clip pooled-2 + 10pct anchor + light EB k=2 (director iter 49): s=max(0,wraw-thr_b), thr_b=max(0.9*med_b+0.1*med_g+1.5*IQRup*_b,med_b), per-band 2-pt grid Q{0.65,0.8}; frozen I7+I10; zero rig edits, offline on frozen R173 files", "frontier": "keep-first interpolation (pooled-0 too strict, pooled-4+25pct over-shrinks)", "variation": "T223 pooled-4/25pct-anchor/no-EB -> T224 pooled-2/10pct-anchor/EB-k2", "timestamp": "2026-09-28T00:00:00Z", "evidence_artifacts": ["results/aegis_v2/I2_r224_analysis.py", "results/aegis_v2/I2_r224_result.json"]}
{"type": "edge", "from": "N186", "to": "N187", "kind": "frontier-expansion", "label": "upper-only IQR soft-clip interpolation (10pct anchor, EB k=2)", "note": "N187: interpolation FALSIFIED - thr 107.79/90.34/80.21 HIGHER than T223; frac_zero 1.0/0.75/0.80; all 3 bands infeasible -> all-reject degenerate 100.0 (heldB 0.0, cov regression); 9-cell ablation + 15pct bonus ALL infeasible (10/10); DISCARD; KILL upper-only max(0,.) line (11th); I2 CLOSED. Tier-2 binding."}
{"type": "node", "id": "I13", "strategy": "quasi-static speed scheduling on curves (I8 unblock 1): v=v0/(1+alpha*kappa)", "parent": "I8", "status": "frontier", "metric": 0, "timestamp": 1790651644, "source": "director v4 queue"}
{"type": "edge", "from": "I8", "to": "I13", "kind": "derived"}
{"type": "node", "id": "I14", "strategy": "patch-inset containment for bowl (I8 unblock 2): clamp scrub rect + soft wall", "parent": "I8", "status": "frontier", "metric": 0, "timestamp": 1790651644, "source": "director v4 queue"}
{"type": "edge", "from": "I8", "to": "I14", "kind": "derived"}
{"type": "node", "id": "I15", "strategy": "fn-feedback press regulation (I8 unblock 3, I11-lite): PI on measured fn", "parent": "I8", "status": "frontier", "metric": 0, "timestamp": 1790651644, "source": "director v4 queue"}
{"type": "edge", "from": "I8", "to": "I15", "kind": "derived"}
{"type": "node", "id": "I16", "strategy": "trochoid hyper-sweep amp x loop-rate (DONE run201: plateau, champion unbeaten)", "parent": "I1", "status": "explored", "metric": 0.95, "timestamp": 1790651644, "source": "director v4 queue"}
{"type": "node", "id": "I17", "strategy": "alternating-phase trochoid (drift cancel)", "parent": "I1", "status": "frontier", "metric": 0, "timestamp": 1790651644, "source": "director v4 queue"}
{"type": "edge", "from": "I1", "to": "I17", "kind": "derived"}
{"type": "node", "id": "I18", "strategy": "trochoid + fitted-pitch composition (needs I21 fix)", "parent": "I1", "status": "frontier", "metric": 0, "timestamp": 1790651644, "source": "director v4 queue"}
{"type": "edge", "from": "I1", "to": "I18", "kind": "derived"}
{"type": "node", "id": "I19", "strategy": "advisory slowdown gate, never retract (I7 rethink)", "parent": "I1", "status": "frontier", "metric": 0, "timestamp": 1790651644, "source": "director v4 queue"}
{"type": "edge", "from": "I1", "to": "I19", "kind": "derived"}
{"type": "node", "id": "I20", "strategy": "proportional force-cap gate, no binary veto (I7 rethink)", "parent": "I1", "status": "frontier", "metric": 0, "timestamp": 1790651644, "source": "director v4 queue"}
{"type": "edge", "from": "I1", "to": "I20", "kind": "derived"}
{"type": "node", "id": "I21", "strategy": "diagnose WHY fitted pitch failed (gates I18)", "parent": "I1", "status": "frontier", "metric": 0, "timestamp": 1790651644, "source": "director v4 queue"}
{"type": "edge", "from": "I1", "to": "I21", "kind": "derived"}
