{"run": 495, "segment": 15, "idea": "N478b-RAY-BUDGET", "timestamp": "2026-10-02T15:20:00Z", "idea_short": "Ray-budget dose on the N478 frontier: N195's two never-run budget knobs REG_CN (coarse selection, c>=12) and REG_DFACT (lattice pitch f=2.0) vs the paired certified N478 arm (REG_CN=0, REG_DFACT=1.5). 3.6x-6.5x fewer planner rays at fixture_B=1.00 with |delta covc|<=0.0023; frontier extends 0.80,160 -> 0.96,192. KEEP (cost result).", "status": "keep", "metric_name": "fixture_B transfer_success (coverage_cont >= 0.90 per episode), canonical rig v2, PyBullet DIRECT", "metric_class": "physical", "refused_proposal": {"idea": "FACC (SE(3)-conditioned Force-Adaptive Contact Control, energy-based in-context contact affordance attention, flow-matching -> affordance-equivalence bridge; director iter 17, predicted 76)", "status": "discard", "reason": "54th replay of the G3-permanently-retired family (eq78/N70-N76/manifold-switch/flow-bridge/energy-gated/EBM/SE3/DAEF/FACC). Fixed affordance manifold + flow-matching + energy scoring IS the retired manifold/flow-bridge class; 'FACC' relabels the same mechanism. G4 unpairable: PATH_MODES carries 0 injectable SE3/energy/manifold/FACC hook. G7: predicted-only 76 pts invalid for any keep. 0 episodes, 0 rig bytes changed."}, "director_progression": "Stall broken by measurement per the run-453/run-476/run-494 precedent: refuse the retired-family replay, then spend the iteration on the ONE queued row (N478b).", "physical_action_taken": "7 rig invocations x 20 seeds x 3 suites x 2 paired arms = 840 physical episodes, 0 harness errors, 0 rig bytes changed, no tool teleport, no coverage/success arithmetic (every coverage_cont and success comes from physics contacts at return time). Stack frozen: AEGIS_PATH=trochoid AEGIS_ROW_CENTRE=1 AEGIS_REG=depth AEGIS_REG_HALF_M=0.6 AEGIS_REG_N=32 AEGIS_REG_CASTS=0; paired baseline --compare trochoid --compare-env AEGIS_REG_CASTS=0.0,AEGIS_REG_CN=0.0,AEGIS_REG_DFACT=1.5 = the certified N478 arm. Only REG_CN and REG_DFACT dosed (both already in KNOB_GLOBALS, N195).", "rig_invoked": true, "rig_exit": 0, "rig_bytes_changed": false, "harness_errors": 0, "episodes": 840, "pose_noise_cfg_cells": ["0.32,64", "0.80,160", "0.96,192"], "knobs_dosed": {"AEGIS_REG_CN": [8, 12, 16], "AEGIS_REG_DFACT": [1.5, 2.0]}, "geometry": {"rho_inf_m": 0.3676, "a_slack_m": 0.2324, "H_m": 0.6, "n": 32, "k_law": "k = ceil(6 sigma_t / (f*a)) + 1", "ray_law": "full = k^2 n^2, coarse = k^2 c^2 + n^2, coarse pitch p_c = 2H/(c-1)"}, "cells": [{"cell": "0.32,64", "arm": "REG_CN=16,REG_DFACT=2.0", "k": 6, "rays_per_ep_base": 36864, "rays_per_ep_cand": 10240, "reduction_x": 3.6, "B_succ_base": 1.0, "B_succ_cand": 1.0, "mean_covc_base": 0.9977, "mean_covc_cand": 0.9977, "delta_covc_B": 0.0, "welch_p_B": 1.0, "fisher_p_B": 1.0, "rig_keep": false, "wall_s_per_ep_base": 0.129, "wall_s_per_ep_cand": 0.088, "harness_errors": 0}, {"cell": "0.32,64", "arm": "REG_CN=12,REG_DFACT=2.0", "k": 6, "rays_per_ep_base": 36864, "rays_per_ep_cand": 6208, "reduction_x": 5.94, "B_succ_base": 1.0, "B_succ_cand": 1.0, "delta_covc_B": 0.0, "welch_p_B": 1.0, "fisher_p_B": 1.0, "rig_keep": false, "wall_s_per_ep_base": 0.151, "wall_s_per_ep_cand": 0.084, "harness_errors": 0}, {"cell": "0.32,64", "arm": "REG_CN=8,REG_DFACT=2.0", "k": 6, "rays_per_ep_base": 36864, "rays_per_ep_cand": 3328, "reduction_x": 11.1, "B_succ_base": 1.0, "B_succ_cand": 0.9, "mean_covc_base": 0.9977, "mean_covc_cand": 0.8977, "delta_covc_B": -0.1, "welch_p_B": 0.162, "fisher_p_B": 0.487, "rig_keep": false, "harness_errors": 0, "note": "REFUTED: 2 of 20 fixture_B episodes collapse (coverage_cont 0.0000, reg_err_xy 0.2317/0.2466 m ~= a_slack 0.2324 = CUT window)"}, {"cell": "0.80,160", "arm": "REG_CN=16,REG_DFACT=2.0", "k": 12, "rays_per_ep_base": 230400, "rays_per_ep_cand": 37888, "reduction_x": 6.08, "B_succ_base": 1.0, "B_succ_cand": 1.0, "mean_covc_base": 0.9852, "mean_covc_cand": 0.9836, "delta_covc_B": -0.0016, "welch_p_B": 0.835, "fisher_p_B": 1.0, "rig_keep": false, "wall_s_per_ep_base": 0.25, "wall_s_per_ep_cand": 0.103, "harness_errors": 0}, {"cell": "0.80,160", "arm": "REG_CN=16,REG_DFACT=1.5", "k": 15, "rays_per_ep_base": 230400, "rays_per_ep_cand": 58624, "reduction_x": 3.93, "B_succ_base": 1.0, "B_succ_cand": 1.0, "delta_covc_B": -0.0016, "rig_keep": false, "harness_errors": 0}, {"cell": "0.80,160", "arm": "REG_CN=8,REG_DFACT=1.5", "k": 15, "rays_per_ep_base": 230400, "rays_per_ep_cand": 15424, "reduction_x": 14.94, "B_succ_base": 1.0, "B_succ_cand": 1.0, "delta_covc_B": -0.0016, "rig_keep": false, "harness_errors": 0}, {"cell": "0.80,160", "arm": "REG_DFACT=2.0 only", "k": 12, "rays_per_ep_base": 230400, "rays_per_ep_cand": 147456, "reduction_x": 1.56, "B_succ_base": 1.0, "B_succ_cand": 1.0, "delta_covc_B": -0.0016, "rig_keep": false, "harness_errors": 0, "note": "HB3 pre-registered arithmetic control: the pitch alone is BELOW the 2x bar"}, {"cell": "0.80,160", "arm": "REG_CN=8,REG_DFACT=2.0", "k": 12, "rays_per_ep_base": 230400, "rays_per_ep_cand": 10240, "reduction_x": 22.5, "B_succ_base": 1.0, "B_succ_cand": 1.0, "delta_covc_B": -0.0016, "rig_keep": false, "harness_errors": 0, "note": "unsafe grid, but inert at this cell; it fails at 0.32,64 and 0.96,192"}, {"cell": "0.96,192", "arm": "REG_CN=16,REG_DFACT=2.0", "k": 14, "rays_per_ep_base": 331776, "rays_per_ep_cand": 51200, "reduction_x": 6.48, "B_succ_base": 1.0, "B_succ_cand": 1.0, "mean_covc_base": 0.9781, "mean_covc_cand": 0.9805, "delta_covc_B": 0.0023, "welch_p_B": 0.792, "fisher_p_B": 1.0, "rig_keep": false, "wall_s_per_ep_base": 0.383, "wall_s_per_ep_cand": 0.119, "harness_errors": 0, "note": "frontier cell: B=1.00 (20/20) for BOTH arms on the same seeds; fixture_R 12/20 both arms (not the G2 metric)"}, {"cell": "0.96,192", "arm": "REG_CN=8,REG_DFACT=2.0", "k": 14, "rays_per_ep_base": 331776, "rays_per_ep_cand": 13568, "reduction_x": 24.5, "B_succ_base": 1.0, "B_succ_cand": 0.95, "mean_covc_base": 0.9781, "mean_covc_cand": 0.932, "delta_covc_B": -0.0461, "welch_p_B": 0.366, "fisher_p_B": 1.0, "rig_keep": false, "harness_errors": 0, "note": "REFUTED: seed 111009 collapses (coverage_cont 0.0000, reg_err_xy 0.2326 m ~= a_slack)"}], "pre_registered": {"HB1_confirmatory": "at 0.80,160 at least one dose holds B=1.00 with delta covc >= -0.005 while rays fall >= 2x -> CONFIRMED (best safe arm 6.08x at that cell)", "HB2_refuting": "every >=2x dose drops B below 0.90 -> REFUTED as stated; the REFUTED sub-case is the cn=8 grid (3 of 40 fixture_B episodes collapse)", "HB3_control": "DFACT=2.0 alone is 1.56x, below the 2x bar -> CONFIRMED as arithmetic"}, "result": {"budget_law": "rays/ep = k^2 c^2 + n^2 (coarse) or k^2 n^2 (full); k = ceil(6 sigma_t/(f a)) + 1", "selection_resolution_law": "coarse border margin is quantised to p_c = 2H/(c-1); sound selection requires p_c <= a/2, i.e. c >= ceil(4H/a)+1 = 12 at H=0.6, a=0.23240. N195.1's weaker p_c < a is necessary but NOT sufficient (cn=8 satisfies it and fails).", "confirmed_arm": "REG_CN>=12 with REG_DFACT=2.0 -> 3.6x-6.5x fewer rays at B=1.00, |delta covc| <= 0.0023, wall clock 0.383 -> 0.119 s/ep (3.2x) at 0.96,192", "frontier": "fixture_B = 1.00 (20/20) at 0.96 m / 192 deg for both arms = 3.0x the N477-frozen 0.32 m / 64 deg wall", "compare_keep_field": false, "compare_keep_note": "compare.keep=false in every cell BY CONSTRUCTION: the rig's keep rule demands a significant IMPROVEMENT over the paired baseline and this is a cost lever whose measured effect is no-regression. The rig's own summary field fixture_B_keep_bar_met=true (B=1.00, n=20) and verdict=KEEP in every cell."}, "artifacts": ["results/aegis_v2/N478b_r495_cn16_n0.80,160.jsonl", "results/aegis_v2/N478b_r495_cn8_n0.80,160.jsonl", "results/aegis_v2/N478b_r495_df2_n0.80,160.jsonl", "results/aegis_v2/N478b_r495_cn8df2_n0.80,160.jsonl", "results/aegis_v2/N478b_r495_cn16df2_n0.32,64.jsonl", "results/aegis_v2/N478b_r495_cn16df2_n0.80,160.jsonl", "results/aegis_v2/N478b_r495_cn16df2_n0.96,192.jsonl", "results/aegis_v2/N478b_r495_cn8df2_n0.32,64.jsonl", "results/aegis_v2/N478b_r495_cn8df2_n0.96,192.jsonl", "results/aegis_v2/N478b_r495_cn12df2_n0.32,64.jsonl"], "metrics": {"fixture_B": 1.0, "fixture_A": 0.05, "fixture_R": 0.6, "coverage_cont_mean_fixture_B": 0.9836, "seeds": 20, "synthetic_proxy": null, "novelty_score": null, "sota_gap_claim": null, "validated_candidate": null}, "notes": "G2: metric is fixture_B transfer_success from the canonical rig only. No synthetic proxy row. G3: no retired family touched. G4: every arm paired against the certified N478 arm on the same 20 seeds via --compare-env. G7: no coverage/success arithmetic, no teleport, header flags match every claim; the compare keep field is false and is reported as such.", "status_detail": "keep", "sota_gap": null, "novelty_score": null, "validated_candidate": null}
{"run": 496, "segment": 15, "idea": "N478c-RAY-PITCH-n-DOSE", "timestamp": "2026-10-02T16:40:00Z", "idea_short": "N478c: dose AEGIS_REG_N (the kept cast's ray pitch 2H/(n-1), named the surviving error by N194/N195) on the N478b cheap stack, then sweep pose noise to 1.60,320. RESULT: the parity attribution is REFUTED on fixture_B (p90 flat 13.6-16.3 mm from n=32 to n=128 while fixture_A falls 7.9x) and REFUTED again in the window slack (H=1.2 regresses B to 18/20); the certified fixture_B frontier extends 0.96,192 -> 1.60,320 = 5.0x the original 0.32,64 wall, with rig keep=true paired certificates (Fisher 2.57e-08 / 3.35e-09) vs the frozen single-cast default. KEEP (frontier + refutation).", "status": "keep", "metric_name": "fixture_B transfer_success (coverage_cont >= 0.90 per episode), canonical rig v2, PyBullet DIRECT", "metric_class": "physical", "refused_proposal": {"idea": "FACC (Force-Adaptive Contact Control, SE(3)-conditioned; energy-based contact field + adaptive compliance; flow-matching expert replaced; flow-matching -> affordance-equivalence bridge; director iter 18, predicted 78)", "status": "discard", "reason": "55th replay of the G3-permanently-retired family (eq78 / N70-N76 / manifold-switch / flow-bridge / energy-gated / EBM / SE3 / DAEF / FACC / SEAFC / VMEAF). A fixed-or-learned affordance manifold scored by an energy and bridged to a flow-matching expert IS the retired manifold/flow-bridge class; 'adaptive compliance' and 'SE(3)-conditioned' relabel the same mechanism. G4 unpairable: PATH_MODES carries 0 injectable SE3/energy/manifold/FACC hook (only RESIDUAL_HOOK_FN, I3-owned). G7: predicted-only 78 pts invalid for any keep. 0 episodes, 0 rig bytes changed."}, "director_progression": "Stall broken by measurement per the run-453/run-476/run-494/run-495 precedent: refuse the retired-family replay, then spend the iteration on the ONE queued row (N478c). The unmeasured cell was found by the N495 hand-off note: run 495 freed 3.6x-6.5x of rays without ever touching n.", "physical_action_taken": "13 rig invocations x 20 seeds x 3 suites x 2 paired arms = 1560 physical episodes. Stack frozen: AEGIS_PATH=trochoid AEGIS_ROW_CENTRE=1 AEGIS_REG=depth AEGIS_REG_HALF_M=0.6 AEGIS_REG_CASTS=0 AEGIS_REG_CN=12 AEGIS_REG_DFACT=2.0. Phase A dosed AEGIS_REG_N in {32,48,64,96,128} at 0.96,192; phase B probed the pose-noise axis at {1.12,224 / 1.28,256 / 1.60,320} plus the 0.32,64 no-regression cell; two cells paired against the frozen SINGLE-CAST default for the p-value; PRE-REG 2 dosed AEGIS_REG_HALF_M in {0.9,1.2}. No coverage/success arithmetic anywhere: every coverage_cont and success comes from physics contacts at return time; the tool is never teleported.", "rig_invoked": true, "rig_exit": 0, "rig_bytes_changed": false, "rig_md5": "ce401a0293b695b7b56c066024c1003f", "harness_errors": 0, "episodes": 1560, "unvalidated_rows_consumed": 0, "pose_noise_cfg_cells": ["0.32,64", "0.96,192", "1.12,224", "1.28,256", "1.60,320"], "phase_A_ray_pitch_ladder_0.96,192": {"note": "ONE selection rule (c=12, d=2a, k=14 identical on every rung); reg_err_xy in mm, candidate arm", "fixture_B": {"n32": {"p50": 8.12, "p90": 13.63}, "n48": {"p50": 6.12, "p90": 16.08}, "n64": {"p50": 6.21, "p90": 14.96}, "n96": {"p50": 6.26, "p90": 15.46}, "n128": {"p50": 5.61, "p90": 16.26}, "parity_mm": {"32": 38.71, "48": 25.53, "64": 19.05, "96": 12.63, "128": 9.45}}, "fixture_A_same_ladder_p90_mm": {"32": 4.35, "48": 2.37, "64": 1.98, "96": 0.62, "128": 0.55}, "fixture_R_same_ladder_p90_mm": {"32": 12.52, "48": 11.16, "64": 10.4, "96": 10.96, "128": 10.16}, "corr_err_vs_yaw_on_B": {"32": 0.139, "48": 0.768, "64": 0.935, "96": 0.918, "128": 0.987}, "fixture_B_success_all_rungs": "20/20", "fixture_B_covc_all_rungs": [0.9797, 0.9758, 0.975, 0.975, 0.975], "verdict": "Hc1 REFUTED (no monotone fall; p90(128)/p90(32) = 1.19 vs the pre-registered 0.6 bar). Hc2 CONFIRMED on fixture_B: n is inert above 32 there, while it is live on fixture_A. Hc3 SATISFIED."}, "phase_B_frontier": {"fixture_B": {"0.32,64": {"succ": "20/20", "covc": 0.9977, "reg_ok": "20/20", "yaw_p90_deg": 1.43}, "0.96,192": {"succ": "20/20", "covc": 0.9797, "reg_ok": "20/20", "yaw_p90_deg": 1.5}, "1.12,224": {"succ": "20/20", "covc": 0.9742, "reg_ok": "20/20", "yaw_p90_deg": 1.28}, "1.28,256": {"succ": "20/20", "covc": 0.9781, "reg_ok": "20/20", "yaw_p90_deg": 1.25}, "1.60,320": {"succ": "20/20", "covc": 0.9844, "reg_ok": "20/20", "yaw_p90_deg": 0.98}}, "note": "both paired arms 20/20 at every frontier cell, so arms-vs-champion Fisher p = 1.0 there and is reported as such, never as a win. coverage_cont does NOT decay with sigma_t (0.9797 -> 0.9844 from 0.96 to 1.60).", "verdict": "Hc4 CONFIRMED: the certified frontier extends 0.96,192 -> 1.60,320 = 5.0x the original 0.32,64 wall."}, "paired_certificate_vs_frozen_single_cast": [{"cell": "0.96,192", "file": "results/aegis_v2/N478c_r496_vs1cast_0.96,192.jsonl", "pose_noise_cfg": "0.96,192", "candidate_B_succ": 20, "single_cast_B_succ": 3, "candidate_covc": 0.9797, "single_cast_covc": 0.3023, "fisher_p_success": 2.5695242602917804e-08, "rig_keep": true}, {"cell": "1.60,320", "file": "results/aegis_v2/N478c_r496_vs1cast_1.60,320.jsonl", "pose_noise_cfg": "1.60,320", "candidate_B_succ": 20, "single_cast_B_succ": 2, "candidate_covc": 0.9844, "single_cast_covc": 0.1211, "fisher_p_success": 3.351553382989278e-09, "rig_keep": true}], "pre_reg_2_window_slack": {"AEGIS_REG_HALF_M": {"0.6": {"B_succ": "20/20", "B_covc": 0.9797, "B_err_p50_mm": 8.12, "B_err_p90_mm": 13.63, "k": 14}, "0.9": {"B_succ": "20/20", "B_covc": 0.968, "B_err_p50_mm": 8.03, "B_err_p90_mm": 16.57, "k": 7}, "1.2": {"B_succ": "18/20", "B_covc": 0.8781, "B_err_p50_mm": 7.25, "B_err_p90_mm": 15.34, "k": 5}}, "R_succ": {"0.6": "12/20", "0.9": "12/20", "1.2": "7/20"}, "verdict": "Hd1 REFUTED (flat in a_slack too) and Hd3 VIOLATED at H=1.2 -> that dose is DISCARDED by the pre-registered guard. Reproduces N190.6 (H=0.9 loses to H=0.6) with the lattice ON, and worse at 1.2. The elongated-face residual is left UNATTRIBUTED; no replacement law claimed."}, "key_numbers": {"certified_frontier_m_deg": "1.60 m / 320 deg (was 0.96,192; original wall 0.32,64)", "frontier_extension_vs_original_wall": "5.0x", "fixture_B_transfer_success_at_frontier": 1.0, "fixture_B_coverage_cont_at_frontier": 0.9844, "seeds_per_suite": 20, "fisher_p_vs_frozen_single_cast_at_1.60,320": 3.351553382989278e-09, "rig_keep_at_1.60,320": true, "harness_errors": 0}, "falsifiers": {"F1_refuted": "Hc1: reg_err_xy p90 does not fall with n on fixture_B (ratio 1.19 vs bar 0.6). The N194/N195 'surviving error = ray pitch 2H/(n-1)' attribution is refuted ON THE METRIC SUITE; it holds on fixture_A.", "F2_refuted": "Hd1/Hd3: the same residual is not window-slack truncation either, and H=1.2 actively regresses the metric (B 18/20, R 7/20). Left unattributed.", "F3_standing": "The run-495 cn=8 CUT-window failure (3/40 episodes, reg_err_xy ~ a_slack, coverage_cont 0.0000) did NOT reappear at cn=12 for any n or H: reg_ok = 20/20 on every episode of every file, min winner border margin >= 0 (quantised to the coarse pitch p_c)."}, "not_claimed": ["no novelty of the mechanism: the cast lattice, the coarse selection and the row_centre plan are the rig's own shipped code (N192/N195/N190), the contribution is the never-run dose and the refutation", "no learned component, no soft/adaptive gate variant, no change to the Tier-4 gate", "no segment change (still 15), no metric change (still fixture_B transfer_success), no gate change", "nothing read from benchmarks/restroom_sim.py (synthetic proxy) and nothing from a predicted score", "no replacement law for the unattributed elongated-face residual"], "compliance": {"G1": "canonical rig python3 experiments/kaggle_aegis_sweep.py, PyBullet DIRECT, system python3, 20 seeds, friction U[0.05,0.80]; no banned phrases", "G2": "metric = fixture_B transfer_success from the rig only; no synthetic_proxy key emitted", "G3": "retired families untouched: no citation of N70-N76/eq78/manifold/flow-bridge/energy-gated; N74 92.3 not cited; champion trochoid B=1.00 referenced only as the frozen pairing", "G4": "every cell paired with --compare trochoid; Welch/Fisher recomputed from the JSONL by experiments/n478c_analyze.py, never read off the rig's prose", "G5": "every invocation wrapped in timeout 1200; cleanup with the anchored pgrep pattern after each run; 0 orphans left", "G6": "JSONL appended via the hygiene one-liner; graph node+edges; worklog appended (append-only); equations.md row N478c; results under results/aegis_v2/N478c_r496_* (13 files)", "G7": "every coverage_cont/success comes from physics contacts at return time; no arithmetic on either; no teleport; keep=true artifacts cited by file for both certificates"}, "evidence": {"rig_files": ["results/aegis_v2/N478c_r496_n32_0.96,192.jsonl", "results/aegis_v2/N478c_r496_n48_0.96,192.jsonl", "results/aegis_v2/N478c_r496_n64_0.96,192.jsonl", "results/aegis_v2/N478c_r496_n96_0.96,192.jsonl", "results/aegis_v2/N478c_r496_n128_0.96,192.jsonl", "results/aegis_v2/N478c_r496_front_1.12,224.jsonl", "results/aegis_v2/N478c_r496_front_1.28,256.jsonl", "results/aegis_v2/N478c_r496_front_1.60,320.jsonl", "results/aegis_v2/N478c_r496_n32_0.32,64.jsonl", "results/aegis_v2/N478c_r496_vs1cast_0.96,192.jsonl", "results/aegis_v2/N478c_r496_vs1cast_1.60,320.jsonl", "results/aegis_v2/N478c_r496_H0.9_0.96,192.jsonl", "results/aegis_v2/N478c_r496_H1.2_0.96,192.jsonl"], "prereg": "experiments/n478c_prereg.md", "analysis": "experiments/n478c_analyze.py", "equations_row": "N478c", "worklog": "experiments/worklog.md"}, "next_frontier": {"node": "N478d", "question": "the elongated-face position residual (p50 5.6-8.1 mm, p90 13.6-16.3 mm on fixture_B) is invariant to the ray pitch AND to the window slack and is yaw-coherent (corr up to 0.99). Either it is the max-z top-face FILTER (1 cm band) admitting a rim/pedestal at large yaw, or the PCA pi-branch. Both are candidate CELLS, not claims.", "status": "open_needs_director"}, "queue_state": "N478c done (this run). No `queued` row remains; N198 stays open_needs_director; N478d opened for the director."}
