{"run": 310, "ts": 1780000000, "idea": "N200", "status": "invalid", "metric": null, "metric_name": "none claimed - no transfer_success row is produced; primary metric frozen, segment 15 unchanged, rig byte-identical to HEAD", "segment": 15, "summary": "Director iter-57 FACC build directive ADJUDICATED NOT EXECUTED (64th re-derivation of the G3-retired manifold-switch/flow-bridge/energy-gated family), plus the one physical measurement that was still missing before the ruling: does the rig's contact-force channel carry usable information at all? Zero new rig bytes, zero new simulated episodes - the readout re-uses 4740 already-recorded physical episodes from N197 (7 levels x 2 arms x 3 suites) and N199 (3 levels x 2 arms x 3 suites, disjoint seed base) and computes the WITHIN-CELL Mann-Whitney separation of every force channel from per-episode success. Pooling is confounded (failures concentrate at high pose noise and on round faces) and coverage_cont_pre is the label itself (pooled AUC 1.0, excluded as leakage), so the statistic is per-cell. RESULT: the force channel IS informative, but only where failure is a contact failure. force_compliance within-cell sign-consistency 1.00 over 21 two-class cells, mean|AUC-0.5| 0.2844, p<0.01 in 13/21; fn_mean 0.2339 / 0.81 / 11-21; but the signal is entirely suite-local: fixture_R fn_mean median AUC 0.9230 (0.786-0.979) and force_compliance 0.9044, fixture_B 0.5692 / 0.7500, and fixture_A 0.5053 / 0.6333 - i.e. BLIND on the one suite whose failure is the unobservable-yaw term, which is the only real defect left in the programme (N193). It is not a restatement of the label: median |spearman(fn_mean, coverage_cont)| = 0.4979 over 29 cells. THE DECISIVE OBSTRUCTION is causal, not statistical: every force statistic the rig records is a PER-EPISODE AGGREGATE (fn_mean/fn_p95/fn_std/force_compliance), there is no per-tick force series, so a within-pass in-context reweighting of an action expert has no input to consume, and the rig's only force-closure knob AEGIS_FORCE_PI is already falsified (I15/r235: PI saturates at the 0 rail, fn 5.2x setpoint, 93% of the press on the liner). Prerequisite audit of the 128096-byte rig: 0 hits for pi0/openpi/flow_match/action_expert/vlm/wrench/force_excess/energy/keypoint/affordance, so neither arm of the required pair (pi0+flow-mat vs pi0+FACC) exists and the 'unseen stiffness' axis has no realisation either - CONTACT_K is the fixed literal CONTACT_K, CONTACT_C = 1.0e3, 2.0e2 with no env or CLI knob among the rig's 51. Rig health re-certified at HEAD after the iteration: 20 seeds x 3 suites, 60/60 SUCCESS, 0 harness errors, verdict KEEP in 5.8 s (results/aegis_v2/N200_righealth_s20.jsonl). No keep, no p-value, no metric change, no gate change, no segment change.", "metrics": {"idea": "N200", "new_mechanism": false, "claim_type": "director_directive_adjudication_plus_channel_informativeness", "director_iteration": 57, "director_directive_adjudication": {"spec": "FACC: Force-Adaptive Contact Control - SE(3)-conditioned control policy replacing the flow-matching head; energy-based physical in-context attention reweights the action expert by contact force + SE(3) error; affordance manifold deformable via force feedback; validation on a contact-rich generalization suite (unseen stiffness/geometry, SE(3) perturbation, force-threshold success); baseline pi0 + flow-matching vs pi0 + FACC, same VLM backbone; predicted 74 keep", "executed": false, "exclusion_reasons": ["G3 retired family: 64th re-derivation of manifold-switch / flow-bridge / energy-gated. 'Affordance manifold deformable via force feedback' IS manifold-switch, 'energy-based physical in-context attention' IS energy gating, 'SE(3)-conditioned head replacing the flow-matching head' IS the flow bridge. FACC closed on physical data at r232/r233, FACC-E and the same SEAFP spec adjudicated not executed at r300-r309.", "G4-unpairable: the canonical rig has no pi0 expert, no VLM backbone, no flow-matching head and no SE(3) energy keypoint (0 hits each in 128096 bytes), so the mandated paired arms (pi0+flow-mat vs pi0+FACC) cannot be instantiated on the same seeds and no Welch/Fisher p-value can exist. The 'unseen stiffness' validation axis has no realisation: CONTACT_K is the fixed literal CONTACT_K, CONTACT_C = 1.0e3, 2.0e2 with no env or CLI knob among 51 knobs.", "G7 causal gap, measured this iteration: the rig records force only as per-episode aggregates; there is no per-tick force series, so within-pass in-context reweighting has no input, and the only force-closure knob (AEGIS_FORCE_PI) is falsified (I15/r235).", "Predicted-only keeps are banned this segment (G7 SEGMENT + METRIC FREEZE); the directive's 74 pts is a prediction with no experiment behind it."], "ran_instead": "the channel-informativeness measurement below, which is the only part of the directive that a CPU worker can physically decide, plus a rig-health re-certification at HEAD"}, "within_cell_force_channel": {"episodes_reused": 4740, "files": ["results/aegis_v2/N197_r310_s100_0,0.jsonl", "results/aegis_v2/N197_r310_s100_0.03,6.jsonl", "results/aegis_v2/N197_r310_s100_0.28,56.jsonl", "results/aegis_v2/N197_r310_s100_0.64,128.jsonl", "results/aegis_v2/N197_r310_s100_1.6,320.jsonl", "results/aegis_v2/N197_r310_s100_3.2,640.jsonl", "results/aegis_v2/N197_r310b_s20_6.4,1280.jsonl", "results/aegis_v2/N199_r309_s100_0.03_6.jsonl", "results/aegis_v2/N199_r309_s100_0.28_56.jsonl", "results/aegis_v2/N199_r309_s100_3.2_640.jsonl"], "cells_with_both_classes": 29, "force_compliance": {"cells": 21, "mean_abs_auc_dev": 0.2844, "max_abs_auc_dev": 0.4708, "sign_consistency": 1.0, "cells_p_lt_0.01": 13}, "fn_mean": {"cells": 21, "mean_abs_auc_dev": 0.2339, "max_abs_auc_dev": 0.4792, "sign_consistency": 0.8095, "cells_p_lt_0.01": 11}, "fn_p95": {"cells": 21, "mean_abs_auc_dev": 0.2124, "sign_consistency": 0.5714, "cells_p_lt_0.01": 10}, "fn_std": {"cells": 21, "mean_abs_auc_dev": 0.2143, "sign_consistency": 0.8095, "cells_p_lt_0.01": 11}, "jerk": {"cells": 21, "mean_abs_auc_dev": 0.1752, "sign_consistency": 0.7143, "cells_p_lt_0.01": 9}, "slip_m": {"cells": 21, "mean_abs_auc_dev": 0.1267, "sign_consistency": 0.6667, "cells_p_lt_0.01": 4}, "stick_frac": {"cells": 21, "mean_abs_auc_dev": 0.1372, "sign_consistency": 0.8095, "cells_p_lt_0.01": 4}, "stall_frac": {"cells": 21, "mean_abs_auc_dev": 0.0674, "sign_consistency": 1.0, "cells_p_lt_0.01": 5}, "median_fn_mean_auc_by_suite": {"fixture_A": 0.5053, "fixture_B": 0.5692, "fixture_R": 0.923}, "median_force_compliance_auc_by_suite": {"fixture_A": 0.6333, "fixture_B": 0.75, "fixture_R": 0.9044}, "median_abs_spearman_fn_mean_vs_coverage_cont": 0.4979, "reading": "the force channel reads CONTACT failure (fixture_R) and is blind to the YAW failure mode (fixture_A); the one defect left in the programme is exactly the one force cannot see", "leakage_excluded": ["coverage_cont_pre"], "causal_availability": "none - all force statistics are per-episode aggregates, no per-tick series exists in the rig"}, "rig_prerequisite_audit": {"rig_bytes": 128096, "env_knobs": 51, "term_hits": {"pi0": 0, "openpi": 0, "flow_match": 0, "action_expert": 0, "vlm": 0, "wrench": 0, "force_excess": 0, "energy": 0, "keypoint": 0, "affordance": 0, "stiffness": 4}, "contact_k": "CONTACT_K, CONTACT_C = 1.0e3, 2.0e2 (fixed literal, no knob)"}, "rig_health": {"file": "results/aegis_v2/N200_righealth_s20.jsonl", "seeds": 20, "suites": 3, "episodes": 60, "success": 60, "harness_errors": 0, "verdict": "KEEP", "wall_s": 5.8, "rig_bytes_changed": 0}, "synthetic_proxy": null, "evidence": ["results/aegis_v2/N200_facc_channel.json", "results/aegis_v2/N200_righealth_s20.jsonl", "experiments/N200_facc_channel.py"], "kept_from_this_iteration": "the by-suite reading of the force channel, offered to the director as input to N198 option (b) only; it changes no metric and no bar"}, "next": "N198 remains director-owned. Worker-side the frontier is closed: fixture_B is saturated to 3.2 m on two disjoint seed bases (N197/N199), every registration and cost axis is closed, and the only remaining defect (N193 auto/orbit, a provable no-op on B) is invisible to contact force (median fn_mean AUC 0.5053 on fixture_A) and already solved by construction. The director must pick one of N198's three options: (a) certify across A/B/R and stop, (b) re-anchor the keep bar off fixture_B, (c) close segment 15."}
