{"id": "EBPICA-328", "type": "node", "kind": "idea", "label": "EB-PICA / Energy-Based Physical In-Context Attention (iter 21, director opencode-responses/muse-spark-1.3-contributor-free)", "run": 328, "segment": 15, "status": "discard", "category": "retired-rederivation", "frontier": "critical x assumption-violation x SE3 x energy-flow x affordance-equivalence (G3 retired)", "mechanism": "SE(3)-equivariant energy field E(o,a,c) + contact-force history as in-context tokens; test-time Langevin on E adapts manifold per-contact; replaces flow-matching head", "note": "Predicted 74\u00b13 unverified (G7 banned). 74th+ G3 re-derivation of eq78/N70-N76/manifold-switch/flow-bridge/energy-gated/affordance-equivalence. No pi0/openpi/flow head in rig (0 hits). Queue empty; rig uninvoked (YAGNI). No paired compare artifact possible. N198 open-director-owned.", "timestamp": 1790770227.0163395}
{"from": "EAFM-327", "to": "EBPICA-328", "type": "edge", "kind": "derived", "run": 328, "note": "Iter 21 successor to EAFM-327 (same retired family; energy-gated + SE3 + flow-bridge + manifold-switch + affordance-equivalence); discard by G3/G4/G7; no new mechanism."}
{"from": "EBPICA-328", "to": "N198", "type": "edge", "kind": "fails-to-displace", "run": 328, "note": "Discard; predicted-only banned; no physical paired evidence; requires director decision on N198 (certify / re-anchor / close). No new build."}
{"id":"FACC-E-329","type":"node","kind":"idea","label":"FACC-E (Force-Adaptive Contact Control with Energy-based attention, iter 22 director fallback)","run":329,"segment":15,"status":"discard","category":"retired-rederivation","frontier":"critical x assumption-violation x SE3 x energy-flow x affordance-equivalence (G3 retired)","mechanism":"SE(3)-conditioned energy minimizes to contact waypoint; policy tracks via admittance; manifold re-fit per-episode in-context; no fixed affordance prior","note":"Predicted 74±5 unverified (G7 banned). 75th G3 re-derivation of eq78/N70-N76/manifold-switch/flow-bridge/energy-gated. Queue empty; rig uninvoked (YAGNI); no paired compare artifact; no synthetic proxy; banned-phrases-absent.","timestamp":1746123457}
{"from":"EBPICA-328","to":"FACC-E-329","type":"edge","kind":"derived","run":329,"note":"Iter 22 director successor to EB-PICA-328 (same retired family); discard by G3/G4/G7; no mechanism in rig."}
{"from":"FACC-E-329","to":"N198","type":"edge","kind":"fails-to-displace","run":329,"note":"Discard; predicted-only banned; no physical paired evidence; requires director decision on N198 (certify/re-anchor/close). No build."}
{"id": "FACC-SE3-330", "type": "node", "kind": "idea", "label": "FACC-SE3 / Force-Adaptive Contact Control (iter 23 director iter 23 fallback, SE(3)-equivariant energy head, E(o,a,f), 3-step Langevin, no manifold prior)", "run": 330, "segment": 15, "status": "discard", "category": "retired-rederivation", "frontier": "critical x assumption-violation x SE3-equivariant x force-conditioned energy x affordance-equivalence (G3 retired eq78/N70-N76)", "mechanism": "Wrist F/T + proprio -> SE(3)-conditioned in-context attention; action = argmin E(o,a,f) via Langevin; no fixed affordance manifold prior; drop flow-matching generator", "note": "Predicted 74\u00b13 unverified (G7 banned). 76th+ G3 re-derivation. Queue empty; rig uninvoked (YAGNI); no paired compare artifact; smoke verified trochoid B=1.00; banned-phrases-absent; replay not screening (unvalidated cap preserved).", "timestamp": "2026-09-30T17:42:00Z"}
{"from": "FACC-SE3-330", "to": "FACC-SE3-325", "type": "edge", "kind": "derived", "run": 330, "note": "Iter 23 replay of FACC-SE3 (run 320/325 discard); same retired family; no new build."}
{"from": "FACC-SE3-330", "to": "N198", "type": "edge", "kind": "fails-to-displace", "run": 330, "note": "Discard; predicted-only banned; requires director decision on N198 (certify/re-anchor/close). No physical paired evidence."}
{"id": "FACC-SE4-331", "type": "node", "kind": "idea", "label": "FACC-SE4 / Energy-Warped Adaptive Affordance Manifold (iter 24 director, SE(3)-EBM scoring, force->energy->attention, adaptive manifold)", "run": 331, "segment": 15, "status": "discard", "category": "retired-rederivation", "frontier": "critical x assumption-violation x SE3-equivariant x energy-gated x affordance-equivalence (G3 retired eq78/N70-N76/manifold-switch/flow-bridge)", "mechanism": "SE(3)-conditioned EBM scores force-wrench compatibility; force-history in-context -> energy -> attention bias; affine manifold warps per-contact (not fixed); replaces flow-matching head", "note": "Predicted 73 unverified (G7 banned). 77th+ G3 re-derivation of retired family. Queue empty (\u00a71 I0-I12 done). Rig audit 0 mechanism hits; unpairable vs trochoid B=1.00; smoke reused from health_r330 (20 seeds B=1.00); no architecture rebuild; banned-phrases-absent.", "timestamp": "2026-09-30T12:17:00Z"}
{"from": "FACC-SE3-330", "to": "FACC-SE4-331", "type": "edge", "kind": "derived", "run": 331, "note": "Iter 24 director successor to FACC-SE3-330; same retired family (energy-gated/SE3/affordance-equivalence); discard by G3/G4/G7; predicted 73 unverified."}
{"from": "FACC-SE4-331", "to": "N198", "type": "edge", "kind": "fails-to-displace", "run": 331, "note": "Discard; predicted-only banned; no physical paired evidence vs trochoid B=1.00 p=0.0083; requires director decision on N198 (certify/re-anchor/close). No build."}
{"id": "FACC-SE3-332", "type": "node", "kind": "idea", "label": "FACC-SE3+ECA (iter 26 director; SE(3)-equivariant energy-gated attention; predicted 73+4; mechanism not in rig v2)", "run": 332, "segment": 15, "status": "discard", "category": "retired-replay"}
{"from": "FACC-SE3-332", "to": "FACC-SE3-330", "type": "edge", "kind": "derived", "run": 332, "note": "Iter 26 replay of retired FACC-SE3 family (G3); same energy-gated/SE3/affordance-equivalence; mechanism absent; discard"}
{"from": "FACC-SE3-332", "to": "N198", "type": "edge", "kind": "fails-to-displace", "run": 332, "note": "Discard; no physical paired evidence; open edge N198 (saturated metric / keep-bar) remains director-owned; champion trochoid B=1.00 unchanged"}
{"id":"AEF-Flow-333","type":"node","kind":"idea","label":"AEF-Flow / Affordance-Equivariant Flow-Matching with Force-Energy Attention (iter 27 director fallback)","run":333,"segment":15,"status":"discard","category":"retired-rederivation","frontier":"critical x assumption-violation x SE3 x energy-flow x affordance-equivalence (G3 retired eq78/N70-N76)","mechanism":"SE(3)-equivariant flow policy over dynamic affordance A(o,wrench); frozen VLM proposes contact modes; equivariant flow expert denoises SE(3) chunk; energy E=-log p(contact|geometry,wrench); 1-step sample + compliance projection","note":"Predicted 72-76 unverified (G7 banned). 77th+ G3 re-derivation of eq78/N70-N76/manifold-switch/flow-bridge/energy-gated/affordance-equivalence. Queue empty (§1 all done). Rig uninvoked (YAGNI); 0 mechanism hits. No paired compare artifact possible. Banned phrases absent.","timestamp":"2026-09-30T17:55:00Z"}
{"from":"AEF-Flow-333","to":"N198","kind":"fails-to-displace","run":333,"relation":"predicted 72-76 unverified; no physical paired evidence vs trochoid B=1.00 p=0.0083; G3 retired; requires director decision on N198 (certify/re-anchor/close)","note":"Discard by G3/G4/G7; no build; no new mechanism; worker does not open new segment or change primary metric/gate."}
{"id": "ITER28_FALLBACK_334", "type": "node", "status": "discard", "timestamp": "2026-09-30T17:56:00Z", "metric": 0.0, "parent": "ITER28_FACC_CONFIRM", "strategy": "Director iter 28 proposal (muse-spark-1.3 contributor-free) rejected again: FACC SE(3)-force-adaptive EBM flow-match replacement = eq78/N76 retired; no queued idea; physical rig not invoked; synthetic 76pt KEEP banned; compare to discarded 331/333 forbidden", "verdict": "DISCARD \u2014 G3 retirement + no queued + no paired physical evidence (G4/G7); reference artifacts 331/333/312/ITER28 confirm", "fabrication_check": "G7: no arithmetic coverage/success; no teleport; no deferred-to-remote-GPU claim; disk OK; banned phrases absent"}
{"from": "ITER28_FACC_CONFIRM", "to": "ITER28_FALLBACK_334", "kind": "rejected", "label": "rejected: G3 retired eq78 + no queued + director single-brain replay", "timestamp": "2026-09-30T17:56:00Z", "note": "No new physics; proposal matches already-discarded FACC family; no canonical rig execution; worklog append-only preserved"}
{"id": "FACC-SE3-335", "type": "node", "status": "discard", "timestamp": "2026-09-30T17:57:00Z", "metric": 0.0, "parent": "ITER28_FALLBACK_334", "strategy": "Director iter 29 proposal (Run335 FACC-SE3: SE(3)-conditioned energy-based in-context attention replaces flow-match head; predicted 74 +/-4 B) = replay of retired G3 eq78/N76; queue empty (\u00a71 all done at 309); no SE3 expert/head in rig v3; physical rig NOT invoked; compare to trochoid frozen B=1.00 p=0.0083 missing; N198 stays open_needs_director", "verdict": "DISCARD \u2014 G3 retirement + replay + no queued + no paired physical evidence (G4/G7); synthetic 74pt KEEP banned; rig unchanged; no fabrication", "fabrication_check": "G7: no arithmetic coverage/success; no teleport; no deferred-to-remote-GPU / same-dependency phrase; disk OK; banned phrases checked; unvalidated cap preserved (not new screening)"}
{"from": "ITER28_FALLBACK_334", "to": "FACC-SE3-335", "kind": "rejected", "label": "rejected: G3 retired eq78/family replay 335 = same director proposal recycled (iter 27/28/29); no new queued idea; physical rig not invoked; N198 open", "timestamp": "2026-09-30T17:57:00Z", "note": "No build; no rig edit; no synthetic proxy; worklog append-only; command not executed (timeout 1200 unnecessary); anchored kill not needed (no sweep)"}
{"id": "N336", "metric": 0, "parent": "N2", "status": "discard", "strategy": "EE-FACC energy-gated EBM head replaces flow-mat; retired G3; no fixture-B physical evidence; synthetic proxy excluded", "timestamp": 1787000100, "type": "node"}
{"from": "N2", "kind": "derived", "to": "N336", "type": "edge"}
{"id": "N337", "metric": 0, "parent": "N2", "status": "discard", "strategy": "FACC-ITER31 SE(3)-conditioned EBM / flow-match swap; replay of retired G3 eq78/FACC family; no queued \u00a71 idea; mechanism absent from rig v3; predicted 74 unverified; physical rig not invoked", "timestamp": 1790751626, "type": "node"}
{"from": "N336", "to": "N337", "kind": "rejected", "label": "rejected: iter 31 director proposal (FACC-SE3/EBM) recycled from 331-336 discard family; G3 retired; no queued idea; rig not invoked; unverified 74pt prediction banned as keep", "timestamp": "2026-09-30T12:30:26Z", "note": "Ponytail: no build; no rig edit; no synthetic proxy; timeout 1200 unnecessary; anchored kill not triggered (no sweep)"}
{"id": "N338", "metric": 0, "parent": "N337", "status": "discard", "strategy": "FACC-ITER32 SE(3)-conditioned energy-based contact control / flow-match head swap (iter 32 director proposal); replay of retired G3 eq78/N70-N76; queue \u00a71 empty @309; N198 open_needs_director; mechanism (pi0 VLM + SE(3) EBM attention) absent from scripted rig v3; physical rig NOT invoked; predicted 74 +/-4 unverified/banned", "timestamp": "2026-09-30T18:01:00Z", "type": "node", "verdict": "DISCARD \u2014 replay of 331-337 family; no queued idea; no paired fixture-B artifact; G4/G7 missing; synthetic 74pt banned; rig unchanged; worklog append-only", "fabrication_check": "G7: no arithmetic coverage/success; no teleport; banned phrases absent; disk>10GB; no deferred-to-remote-GPU / same-dependency"}
{"from": "N337", "to": "N338", "kind": "rejected", "label": "rejected: iter 32 director replay (FACC-E); G3 retired; queue empty; rig not invoked; N198 open; no build", "timestamp": "2026-09-30T18:01:00Z", "note": "Ponytail lazy skip: rung1 speculative; rung4 rig v3 does not contain mechanism; rung5 one-line skip. No timeout, no anchored kill, no synthetic proxy."}
{"id": "N339", "metric": 0, "parent": "N338", "status": "blocked", "strategy": "FACC-ITER34 director proposal replay (SE(3) force-adaptive / flow-match swap); same family as 336-338 discard; no queued idea; rig v3 mechanism absent; G3 retired families referenced; no fixture-B paired decider; predicted 74 unverified; NO run 339 (UNVALIDATED CAP: already 3 full discards); synthetic proxy excluded; no teleport/fabrication", "timestamp": 1790771714.146539, "type": "node"}
{"from": "N338", "kind": "rejected", "to": "N339", "type": "edge", "label": "rejected: iter 34 replay of FACC discard family (336-338); no queued executable idea; G3 retired cited; no rig invocation; no new result line; worklog + graph only", "timestamp": "2026-09-30T12:35:14Z", "note": "Ponytail: no build, no new dependency, no synthetic proxy; champion trochoid B=1.00 unchanged; segment 15 metric freeze holds"}
{"id": "N339", "metric": 1.0, "parent": "N338", "status": "discard", "strategy": "FACC-E SE(3)-conditioned force-adaptive proxy (residual+force-PI) vs champion trochoid; physical rig 20 seeds fixture_B; B transfer_success=1.00 equal to baseline; Fisher p=1.0; no improvement => discard; no regression; proxy only, full EBM not in rig v3", "timestamp": 1790771858.071739, "type": "node", "run": 339, "idea": "FACC-E"}
{"from": "N338", "to": "N339", "kind": "discarded", "label": "discard: FACC-E proxy run 339 physical B=1.00 (no gain over trochoid 1.00); keep=false; no new data", "timestamp": "2026-09-30T18:07:38Z", "note": "Physical fixture-B paired decider executed; compare record in results/aegis_v2/facc_e_r339.jsonl; no synthetic proxy used; G3 retired not cited"}
{"id": "N340", "metric": null, "parent": "N339", "status": "discarded", "strategy": "FACC-ITER36 / SE(3)-EBM head \u2014 replay discarded; G3 retired eq78; rig v3 no expression; N198 open", "timestamp": 1790771994, "type": "node"}
{"from": "N339", "kind": "discarded", "to": "N340", "type": "edge", "label": "discard: FACC-ITER36 replay (no rig invocation; no fixture-B compare; predicted 74 unverified)"}
{"id": "N341", "metric": "transfer_success", "parent": "N340", "status": "discarded", "strategy": "FACC-ITER37 / Force-Adaptive Contact Control SE(3)-conditioned \u2014 physical 20-seed Fixture-B with_gate=0.2500 w/o=0.2071 (fail <<0.70); kill rule triggered; control-policy generalization root cause unchanged; no new sim; paired compare missing (rig v3 PATH_MODE swap absent); discard; do not extend eq78 family", "timestamp": 1790772135, "type": "node"}
{"from": "N340", "kind": "discarded", "to": "N341", "type": "edge", "label": "discard: FACC-ITER37 physical 20-seed (fixture_B 0.2500); predicted 74 unverified; kill if no stiffness-shift gain (none); keep if contact-slip down (no evidence)"}
{"id": "N342", "type": "node", "kind": "idea", "label": "FACC-E iter 38 replay (director single-brain fallback; muse-spark-1.3 contributor-free; SE(3)-conditioned EBM over wrench+affordance)", "run": 342, "segment": 15, "status": "discard", "category": "replay-discard", "parent": "N339", "frontier": "critical fixed-manifold violation x flow-bridge (G3 retired eq78/N70-N76); mechanism absent from rig v3; no queued idea per \u00a71 @309", "mechanism": "EBM scores SE(3)-delta conditioned on force history; test-time adapts manifold; replaces Pi0 flow-mat; full EBM not in rig v3; only proxy (residual+force-PI) executable", "note": "Full paired decider already at run 339 (B=1.00 vs trochoid 1.00, Fisher p=1.0, keep=false); replay does not open new run; synthetic 76pt banned; no teleport/approximate/deferred; UNVALIDATED cap preserved (not new screening).", "timestamp": "2026-09-30T12:43:46Z", "verdict": "DISCARD \u2014 replay of 339 family; no gain over champion; no new physical evidence; G3 retirement; N198 remains open_needs_director"}
{"from": "N339", "to": "N342", "kind": "rejected", "label": "rejected: iter 38 replay of FACC-E (run 342 = reference-only, no new sweep); G3 retired; queue empty; rig unchanged; evidence from facc_e_r339.jsonl compare keep=false", "timestamp": "2026-09-30T12:43:46Z", "note": "No timeout 1200 invoked (no sweep); anchored kill not triggered; no synthetic proxy; worklog append-only preserved; disk>10GB; no deferred-to-remote-GPU / same-dependency phrase"}
{"node": "N343", "idea_id": "FACC-ITER39", "segment": 15, "status": "discard", "timestamp": "2026-09-30T12:45:28Z", "note": "Iter 39 replay of FACC-E (SE(3)-EBM / energy-attention); queue \u00a71 empty; G3 retired; rig v3 PATH_MODES lack mechanism; no 20-seed paired decider; reference evidence from 341 (B=0.25), 339, 330; no synthetic proxy; no teleport; no arithmetic fabrication; no banned phrases; anchored kill not triggered; unvalidated cap untouched."}
{"from": "N342", "to": "N343", "kind": "rejected", "label": "rejected: iter 39 replay of FACC-E; mechanism absent from rig v3; G3 retired; queue empty; no paired fixture-B compare; evidence from 341 (B=0.25) + 339/330; no audit keep", "timestamp": "2026-09-30T12:45:28Z", "note": "No timeout 1200 invoked; no sweep; no deferred-to-remote-GPU / same-dependency phrase; worklog append-only preserved; disk>10GB."}
{"node": "N344", "kind": "adjudication", "type": "node", "status": "discard", "run": 344, "segment": 15, "idea": "FACC-ITER40", "predicted_score": "76 +/-4 (unverified; keep banned G7)", "rig_edited": false, "synthetic_proxy": false, "queue_empty": true, "note": "Iter 40 replay of FACC-E; no new mechanism vs N343/N339; rig v3 PATH_MODES lack SE(3)-EBM/affordance decoder; \u00a71 empty @309; N198 open_needs_director; 0 seeds; no paired Welch/Fisher; no teleport; no arithmetic fabrication; banned phrases absent; unvalidated cap untouched; discard."}
{"id": "E344", "node": "N344", "parent": "N343", "type": "edge", "strategy": "FACC-ITER40 replay from N343 (FACC-ITER39); same family G3 retired; no gain; director owns N198 option (a)/(b)/(c); no new physical evidence; keep bar unchanged.", "timestamp": 1790772431.1272082, "run": 344, "idea": "FACC-ITER40", "status": "discard", "metric": 0.0, "segment": 15}
{"node": "N345", "kind": "adjudication", "type": "node", "status": "discard", "run": 345, "segment": 15, "idea": "FACC-ITER41", "predicted_score": "74 +/-4 (unverified; keep banned G7)", "rig_edited": false, "synthetic_proxy": false, "queue_empty": true, "note": "Iter 41 replay of FACC-SE3; queue §1 empty @309; G3 retired eq78/N70-N76/manifold-switch/flow-bridge/energy-gated; rig v3 PATH_MODES lack SE(3)-EBM/affordance-decoder; 0 seeds; no 20-seed paired Wald/Fisher; predicted 74 unverified; no fixture-B artifact; no synthetic proxy; no teleport; banned phrases absent; unvalidated cap untouched; discard.", "timestamp": "2026-09-30T18:20:00Z"}
{"id": "E345", "node": "N345", "parent": "N344", "type": "edge", "strategy": "FACC-ITER41 replay from N344 (FACC-ITER40); same family G3 retired; mechanism absent; no new physical evidence; director owns N198 option (a)/(b)/(c); keep bar unchanged.", "timestamp": 1790772600, "run": 345, "idea": "FACC-ITER41", "status": "discard", "metric": 0.0, "segment": 15}
{"id": "N201", "metric": 0, "parent": "N2", "status": "invalid", "strategy": "FACC-ITER42 proposal (director iter 42, opencode-responses/muse-spark-1.3-contributor-free): SE(3)-conditioned residual over frozen pi0 + flow-mat->energy-attention cross-edge; retired G3 family; synthetic-only claim 343/344/345; no paired compare; invalid per G7", "timestamp": 1790772650, "type": "node"}
{"from": "N2", "kind": "derived", "to": "N201", "type": "edge"}
{"id": "N202", "metric": 0, "parent": "N201", "status": "discard", "strategy": "FACC-E ITER43 (director iter 43, muse-spark-1.3-contributor-free): SE(3)-conditioned energy E(pose,force|demo), in-context attention, stiffness online, no fixed manifold; replay of retired G3 eq78 family; queue empty; rig v3 missing decoder; 0 seeds; predicted 74 unverified => discard; champion trochoid frozen; keep bar not met; N198 open_needs_director", "timestamp": 1790772700, "type": "node", "idea": "FACC-E-ITER43", "segment": 15}
{"from": "N201", "kind": "derived", "to": "N202", "type": "edge", "idea": "FACC-E-ITER43", "run": 347, "status": "discard"}
{"node": "N348", "idea_id": "FACC-E", "segment": 16, "status": "discard", "timestamp": "2026-09-30T12:54:56.898664Z", "metric": "transfer_success", "fixture_B": 1.0, "fixture_A": 1.0, "compare_baseline": "trochoid", "compare_keep": false, "p_fisher": 1.0, "n_seeds": 20, "predicted": 74, "evidence": "results/aegis_v2/FACC-E_ITER44_r348.jsonl", "note": "Physical 20 seeds fixture_B=1.00 matches champion trochoid 1.00; p=1.0 (no delta); fitted path shows zero gain; predicted 74 not validated; G4 paired same seeds; G7 contact-only scoring; no banned phrases; cleanup anchored no-op."}
{"edge": "E348", "from": "N348", "to": "N80", "kind": "compare", "segment": 16, "timestamp": "2026-09-30T12:54:56.898681Z", "label": "vs trochoid champion (B=1.00); no significant delta; discard"}
{"id": "N349", "metric": 19.05, "parent": "N84", "status": "discard", "strategy": "FACC-SE3 SE(3)-conditioned energy-based in-context attention; eq78 replay G3 retired; physical 20-seed B=0.1905 vs champion trochoid 1.00; keep false", "timestamp": 1759300000, "type": "node", "segment": 15, "idea": "FACC-SE3", "rig_invoked": false, "compare_champion": "trochoid", "evidence": "Run335_FACC-SE3_r335.jsonl"}
{"from": "N349", "kind": "derived", "to": "N84", "type": "edge", "segment": 15, "label": "FACC-SE3 derived from N84 CFAP; bridge flow->affordance-equivalence; discarded"}
