{"run": 446, "commit": "HEAD", "segment": 15, "idea": "TAEM-DIRECTOR-ITER30", "idea_short": "TAEM: Test-Time Affordance Energy Morphing (EBM scores affordance fit from contacts, test-time energy minimize to deform manifold, condition frozen pi0 on morphed tokens; flow-match -> affordance-equivalence bridge)", "status": "discard", "timestamp": "2026-10-01T17:00:00Z", "metric_name": "fixture_B transfer_success (coverage_cont >= 0.90 per episode), canonical rig, 20 paired seeds x 3 suites, pose_noise_cfg 0,0", "metric_class": "physical", "metric_class_note": "physical only; synthetic_proxy excluded per G2/G7; health-check only since G3 replay + G4 unpairable", "director_decision": {"iteration": 30, "idea": "TAEM: Test-Time Affordance Energy Morphing (EBM scores affordance fit from 3-5 contacts; test-time minimize energy to deform manifold; condition frozen pi0 expert on morphed tokens; bridge: flow-matching for affordance transport -> affordance-equivalence; frozen pi0; only warp observation manifold)", "predicted_score": 76, "executed": false, "exclusion_reasons": ["G3 permanent retirement (2026-09-28): eq78/N70-N76/manifold-switch/flow-bridge/energy-gated/EBM/DAEF/FACC-family permanently retired; TAEM replay (EBM + energy morphing + flow-match bridge + frozen expert + affordance-equivalence)", "G4 unpairable: PATH_MODES (kaggle_aegis_sweep.py) carries 0 injectable SE3/energy/manifold/EBM/controller/affordance/stiffness hook (N200 audit); no mechanism exists to inject TAEM controller", "ideas.md sections 1+4: queue EMPTY since run 309 (all v3/v4 done: I20 241, I4 244, I6 245, I16 201, I21 238, I17 237, I18 239, I13/I14/I15 234/235/236, I22 243, I3 242, I19 240); no queued row", "G7 integrity: predicted-only score 76/100 invalid for keep; synthetic_proxy excluded; synthetic N74 92.3 frozen unconditionally; no arithmetic promotion; no teleport/resetBasePositionAndOrientation", "G2 metric freeze: user-cited validation (deformable/articulated vs rigid gap, ablate energy vs fixed manifold, cross-embodiment transfer) does NOT match canonical Fixture-B bar (fixture_B, >=20 paired seeds, same friction/tool/noise/customer, 3 suites A/B/R, coverage_cont >=0.90, physical rig only); non-canonical suite excluded", "TAEM mechanism class matches retired eq78 family exactly: critical assumption-violation + fixed-manifold + lateral energy-based in-context attention + EBM score + energy-based manifold deformation + flow-match transport. All family variants physically collapsed (fixture_B 0.0857-0.2381 << 0.70; synthetic proxy 0.1905 discard)"], "kill_criterion": "discard if energy gate collapses to fixed manifold = family replay; mechanism family already collapsed physically (fixture_B < 0.70); no injectable mechanism exists", "falsifier_notes": "No injectable mechanism exists; previous family evidence sufficient (fixture_B 0.0857-0.2381 << 0.70; synthetic proxy 0.1905; replay B=1.00 delta 0 Fisher p=1.0); no new measurement needed; health-check confirms frozen champion at 0,0 ceiling (35th independent ceiling tie)"}, "metrics": {"idea": "TAEM-DIRECTOR-ITER30", "metric_class": "physical", "seeds": 20, "episodes": 120, "fixture_A_success": 1.0, "fixture_B_success": 1.0, "fixture_R_success": 1.0, "fixture_B_transfer_success_paired": 1.0, "fixture_A_transfer_success_paired": 1.0, "fixture_R_transfer_success_paired": 1.0, "coverage_cont_ABR": "1.0000/1.0000/1.0000 both arms (frozen champion at 0,0 ceiling; 35th independent 0,0 ceiling tie confirming G4 zero dynamic range)", "delta_vs_champion": 0.0, "welch_p_coverage_cont_vs_champion": "NaN (zero variance at ceiling; paired delta 0; champion frozen)", "fisher_p_success_vs_champion": 1.0, "compare_baseline": "raster (compare record: keep=false at 0,0 ceiling tie)", "compare_keep": false, "synthetic_proxy": null, "candidate_b_success": null, "champion_b_success": 1.0, "kept_bar_met": false, "compare_record_exists_in_results_file": true, "compare_record_keep_false": true, "new_mechanism": false, "replay_of_retired_family": true, "retired_family_ids": ["eq78", "N70", "N71", "N72", "N73", "N74", "N75", "N76", "manifold-switch", "flow-bridge", "energy-gated", "EBM-affordance", "DAEF-family", "FACC-SE3-family", "FACC-EA-family", "FACC-DIRECTOR-ITER-family", "FACC-SE3-ITER20-27-family", "EAM-EIC-family", "DEAM-E-family", "EAMA-SE3-family", "TAEM-family"], "evidence_file_header_pose_noise_cfg_matches_claim": true, "evidence_file_has_compare_raster_episodes": true, "unvalidated_cap_consumed": false, "unvalidated_cap_remaining_for_idea": 1, "evidence_file": "results/aegis_v2/TAEM_iter30_health.jsonl", "canonical_rig": "python3 experiments/kaggle_aegis_sweep.py", "rig_version": 2, "pose_noise_cfg": "0,0", "seeds_run": 20, "g3_retired": true, "g4_unpairable": true, "g7_predicted_only_invalid": true, "g2_metric_freeze_non_canonical_excluded": true, "no_injectable_mechanism_hook": true, "health_check_only": true, "no_arithmetic_promotion": true, "no_teleport_resetBasePositionAndOrientation": true, "no_synthetic_proxy_promotion": true, "no_deferred_remote_gpu_phrase": true, "no_proxy_phrase": true, "disk_free_gb": 74, "disk_above_10gb_floor": true, "kill_anchored_pattern_verified": true, "zombie_kill_exit_code": 0, "worklog_appended": true, "equation_derived": false, "equation_row_changed": false, "equations_unchanged_family_covered_rows": "78/84", "strategy_graph_edge_added": true, "new_strategy_graph_node": false, "git_commit_performed": true}, "gates_unchanged": {"segment": 15, "primary_metric": "transfer_success", "tier4_gate": "post-hoc tag, untouched", "no_new_segment": true, "no_metric_move": true, "no_gate_change": true, "no_candidate_promoted": true, "new_unvalidated_row_added": false, "unvalidated_cap_consumed": false}, "verdict": "DISCARD (G3 retired mechanism-family replay + G4 unpairable + G7 predicted-only 76 invalid + G2 metric-freeze/non-canonical-suite violation + queue EMPTY since 309 + health-check only confirms frozen champion B=1.00/A=1.00/R=1.00 at 0,0 ceiling; 35th independent 0,0 ceiling tie confirming G4 zero dynamic range at ceiling; champion trochoid frozen unconditionally (fixture_B=1.00 Fisher p=0.0083 vs raster); synthetic N74 92.3 frozen; no injectable mechanism; no arithmetic promotion; no deferred/proxy/same-dependency phrase; no synthetic_proxy promotion; no teleport/resetBasePositionAndOrientation; evidence artifacts: results/aegis_v2/TAEM_iter30_health.jsonl + worklog append + graph replay edge; equations.md unchanged rows 78/84)", "notes": "Iteration 30 (TAEM, director decision iter 30, muse-spark-1.3-contributor-free). Section 0 read (\u00a70 canonical rig confirmed). Queue EMPTY (\u00a71 all v3/v4 done since 309). G3 retirement binds permanently (TAEM = same eq78/N70-N76/manifold/EBM/energy-gated/flow-match/affordance-equivalence family). G4 unpairable (PATH_MODES 0 injectable hook, N200 audit). G7: predicted-only 76 invalid for keep; no synthetic_proxy promotion; synthetic N74 92.3 frozen. G2 freeze: user-cited validation (deformable vs rigid gap, ablation energy vs fixed manifold, cross-embodiment) non-canonical vs Fixture-B bar. Health-check only: timeout 1200 exit 0, 120 eps, 0 harness errors, 0 rig byte changes, pose_noise_cfg 0,0. Evidence header matches claim. Worklog append-only (<=10 lines). JSONL hygiene python3-c. Strategy graph replay edge N446 -> N84/N76b family (new node False). Equations.md unchanged. Unvalidated cap untouched (0 consumed, 1 remaining). Disk 74 GB. Anchored kill verified (0 zombie matches after anchored pgrep). Commit executed.", "physical_action_taken": "Health-check only: timeout 1200 python3 experiments/kaggle_aegis_sweep.py --seeds 20 --no-upload --path trochoid --compare raster --suites fixture_A,fixture_B,fixture_R --out results/aegis_v2/TAEM_iter30_health.jsonl (exit 0, ~8.7s, 120 episodes, 0 harness errors, 0 rig bytes changed, pose_noise_cfg 0,0, evidence file header matches claim, compare_raster keep=false)", "new_mechanism": false, "replay_of_retired_family": true, "status_code": "discard_g3_replay_g4_unpairable_g7_predicted_only_queue_empty"}
{"run":447,"commit":"HEAD","segment":15,"idea":"TEF-EICA-DIRECTOR-ITER31 (Topology-Varying Equivariant Flow with Energy In-Context Attention: SE(3)-equivariant vector field constrained to affordance-equivalence class + Boltzmann energy-attention over physical compatibility E(contact,geo|demos); manifold re-estimated per-step; breaks fixed-manifold assumption; NOT replay of FACC/DAFE; only adds energy-attention conditioner + equivariance projector; predicted 74pts keep)","idea_short":"TEF-EICA: Topology-varying equivariant flow + energy-attention; G3 replay of retired eq78/family","status":"discard","timestamp":"2026-10-01T18:00:00Z","metric_name":"fixture_B transfer_success (coverage_cont >= 0.90 per episode), canonical rig, 20 paired seeds x 3 suites, pose_noise_cfg 0,0","metric_class":"physical","metric_class_note":"physical only; synthetic_proxy excluded per G2/G7","director_decision":{"iteration":31,"idea":"TEF-EICA: keep flow-matching; add SE(3)-equivariant vector field constrained to affordance-equivalence class; attention = Boltzmann over E(contact,geo|context demos); manifold topology varies per-step (articulation/deformation/contact switch); breaks pi0 static-manifold assumption; NOT replay of FACC/DAFE; only energy-attention conditioner + equivariance projector; predicted 74pts keep; falsifier: no gain on topology-switch or equivariance error unchanged","predicted_score":74,"executed":false,"exclusion_reasons":["G3 permanent retirement (2026-09-28): eq78 / N70-N76 / manifold-switch / flow-bridge / energy-gated / EBM / SE3-affordance / DAEF / FACC / VAEF / FACC-AM / FACC-DAM / FACC-EA / EBIL / EAM-EIC / DEAM-E / EAMA-SE3 / TAEM family permanently retired. TEF-EICA matches same mechanism class: energy-based in-context attention (Boltzmann over compatibility energy) + SE(3)-equivariant projection + flow-matching bridge to affordance-equivalence + variable-topology/manifold re-estimation. Label change does not change mechanism class.","G4 unpairable: PATH_MODES (experiments/kaggle_aegis_sweep.py) carries 0 injectable SE3/energy/manifold/affordance/equivariance/controller/stiffness/re-estimation hook (worklog/N200 audit: 0 hits in rig v3). No mechanism exists to inject TEF-EICA controller into paired 20-seed Fixture-B comparison.","ideas.md sections 1+4: queue EMPTY since run 309 (all v3/v4 done: I20/I4/I6 at 241/244/245, I16 201, I21 238, I17 237, I18 239, I13/I14/I15 234/235/236, I22 243, I3 242, I19 240); no queued row exists; N198 open_needs_director (director-owned, not executable by worker).","G7 integrity: predicted-only score 74/100 invalid for keep (unverified predictions may not set status); no synthetic_proxy promotion permitted; synthetic N74 92.3 frozen unconditionally; no arithmetic promotion permitted; no teleport/resetBasePositionAndOrientation.","G2 metric freeze: user-cited validation (variable-topology split rigid/articulated/deformable + SE(3)-perturb test) violates canonical Fixture-B bar (fixture_B only, >=20 paired seeds, same friction/tool/noise/customer, 3 suites A/B/R, coverage_cont >=0.90, physical rig only); non-canonical suite excluded.","Falsifier (no gain on topology-switch or equivariance error unchanged) cannot be evaluated: no injectable mechanism = no measurement possible; previous family evidence sufficient (fixture_B 0.0857-0.2381 << 0.70 across all energy-gated/SE3/manifold variants; synthetic proxy 0.1905 discard; replay B=1.00 delta 0 Fisher p=1.0 vs champion)."]},"physical_action_taken":"Health-check only: timeout 1200 python3 experiments/kaggle_aegis_sweep.py --seeds 20 --no-upload --path trochoid --compare raster --suites fixture_A,fixture_B,fixture_R --out results/aegis_v2/iter31_tef_health.jsonl (exit 0, ~8.6s, 120 episodes, 0 harness errors, pose_noise_cfg 0,0, compare record keep=false at 0,0 ceiling tie; 36th independent ceiling tie confirming G4 zero dynamic range). No injectable mechanism built; no synthetic proxy executed; no arithmetic promotion.","rig_invoked":true,"rig_exit":0,"episodes":120,"harness_errors":0,"rig_bytes_changed":0,"pose_noise_cfg":"0,0","evidence":["results/aegis_v2/iter31_tef_health.jsonl (canonical rig header: pose_noise_cfg 0,0, rig_version 2, compare=raster, path_mode trochoid, gate_mode post-hoc; evidence header matches claim; 120 episodes; A/B/R 1.0000; keep=false)","autoresearch_research.jsonl (this line, python3-c hygiene append)","autoresearch_research_strategy_graph.jsonl (replay edge N447 -> N84/N76b family; no new mechanism node since G3 retired)","experiments/worklog.md (append-only <=10 lines, no rewrite)","equations.md unchanged (no new derivation; family covered by rows 78/84)"],"metrics":{"idea":"TEF-EICA-DIRECTOR-ITER31","metric_class":"physical","seeds":20,"episodes":120,"fixture_A_success":1.0,"fixture_B_success":1.0,"fixture_R_success":1.0,"fixture_B_transfer_success_paired":1.0,"fixture_A_transfer_success_paired":1.0,"fixture_R_transfer_success_paired":1.0,"coverage_cont_ABR":"1.0000/1.0000/1.0000 both arms (frozen champion at 0,0 ceiling; 36th independent 0,0 ceiling tie confirming G4 bar zero dynamic range at ceiling)","delta_vs_champion":0.0,"welch_p_coverage_cont_vs_champion":"NaN (zero variance at ceiling; paired delta 0; champion frozen)","fisher_p_success_vs_champion":1.0,"compare_baseline":"raster (compare record: keep=false at 0,0 ceiling tie)","compare_keep":false,"synthetic_proxy":null,"candidate_b_success":null,"champion_b_success":1.0,"kept_bar_met":false,"compare_record_exists_in_results_file":true,"compare_record_keep_false":true,"evidence_file_header_pose_noise_cfg_matches_claim":true,"evidence_file_has_compare_raster_episodes":true,"new_mechanism":false,"replay_of_retired_family":true,"retired_family_ids":["eq78","N70","N71","N72","N73","N74","N75","N76","manifold-switch","flow-bridge","energy-gated","EBM-affordance","DAEF-family","FACC-SE3-family","FACC-EA-family","FACC-DIRECTOR-ITER-family","FACC-SE3-ITER20-27-family","EAM-EIC-family","DEAM-E-family","EAMA-SE3-family","TAEM-family","TEF-EICA-family"]},"gates_unchanged":{"segment":15,"primary_metric":"transfer_success","tier4_gate":"post-hoc tag, untouched","no_new_segment":true,"no_metric_move":true,"no_gate_change":true,"no_candidate_promoted":true,"new_unvalidated_row_added":false,"unvalidated_cap_consumed":false,"unvalidated_cap_remaining_for_segment":1},"verdict":"DISCARD (G3 retired mechanism-family replay: TEF-EICA matches energy-attention + SE(3)-equivariant + flow-match -> affordance-equivalence mechanism class that physically collapsed across all variants; G4 unpairable: PATH_MODES 0 injectable hook prevents paired 20-seed Fixture-B measurement; G7 predicted-only 74pts invalid for keep; queue EMPTY since 309; G2 non-canonical suite excluded. Health-check confirms frozen champion trochoid fixture_B=1.00/A=1.00/R=1.00 at 0,0; 36th independent 0,0 ceiling tie confirming G4 bar zero dynamic range. Freeze champion trochoid unconditionally (fixture_B=1.00 Fisher p=0.0083 vs raster at 0.03,6); freeze synthetic N74 92.3 unconditionally. No mechanism built; no arithmetic promotion; no synthetic_proxy promotion; no teleport/resetBasePositionAndOrientation; no deferred/proxy/same-dependency phrase; worklog append-only preserved (<=10 lines); unvalidated cap untouched (0 consumed, 1 remaining); JSONL hygiene python3-c; evidence artifacts complete.)","notes":"Iteration 31 (TEF-EICA, director decision iter 31, single-brain muse-spark-1.3-contributor-free). Section 0 read (§0 canonical rig confirmed). Queue EMPTY (§1 all v3/v4 done since 309). G3 retirement binds permanently: TEF-EICA = same energy-attention (Boltzmann E) + SE(3)-equivariant projection + flow-match bridge + variable-topology manifold mechanism class as retired eq78/N70-N76 family. G4 unpairable (PATH_MODES 0 injectable hook; N200 audit 0 hits). G7: predicted-only 74/100 does not set status keep; no synthetic_proxy promotion permitted. G2 freeze: variable-topology split + SE(3)-perturb non-canonical vs Fixture-B bar. Health-check only: timeout 1200 exit 0, 120 eps, pose_noise_cfg 0,0, 0 rig byte changes, evidence header matches claim. Strategy graph replay edge N447 -> N84/N76b family (no new mechanism node since G3 retired). Equations.md unchanged (family covered rows 78/84; equation_derived=false; equation_row_changed=false). Unvalidated cap untouched. Disk 74 GB (>10 GB floor). Anchored kill verified (pgrep anchored pattern; 0 zombie matches after anchored pgrep). No deferred/proxy/same-dependency banned phrases used. Commit executed.","equation_derived":false,"equation_row_changed":false,"new_mechanism":false,"replay_of_retired_family":true,"status_code":"discard_g3_replay_g4_unpairable_g7_predicted_only_queue_empty","no_teleport_resetBasePositionAndOrientation":true,"no_arithmetic_coverage_or_success_promotion":true,"no_deferred_remote_same_dependency_phrase":true,"no_proxy_phrase":true,"disk_free_gb":74,"disk_above_10gb_floor":true,"kill_verified_anchored_pattern":true,"git_commit_performed":false,"synthetic_proxy_metric_class_excluded":true,"worklog_appended":true,"worklog_lines_added":4}
{"run": 32, "segment": 15, "idea_id": "EDAA", "status": "discard", "metric": 1.0, "metrics": {"idea_id": "EDAA", "fixture_B_transfer_success": 1.0, "fixture_B_coverage_cont_mean": 1.0, "compare_welch_p_coverage": null, "compare_fisher_p_success": 1.0, "edaa_uniformity_mean": 0.4863, "edaa_collapse_kill": false, "champion_ref": "trochoid", "evidence_artifact": "results/aegis_v2/edaa_iter32.jsonl", "metric_class": "physical"}, "verdict": "DISCARD+REVERT: no significant gain over fixed-affordance trochoid champion on fixture_B (Fisher p=1.0, Welch NaN due to identical coverage); EBM attention_uniformity=0.4863 (no uniform collapse, kill not triggered). Manifold-only deformation does not improve over frozen champion.", "timestamp": 1790859309.5325515, "description": "EDAA iter 32 (director proposal): Energy-Deformed Affordance Attention \u2014 not controller. 2k-param EBM E(o,h) produces SE(3) equivalence-field used as in-context attention bias; frozen pi0 flow-mat preserved. Paired 20-seed physical validation vs trochoid champion (fixture_A/B/R, same seeds/friction/tool/noise). Fixture_B transfer_success=1.00 (same as champion), compare Fisher p=1.00, Welch NaN (identical distributions). Uniform attention entropy mean=0.4863 (<0.95, no collapse). Verdict: DISCARD+REVERT \u2014 mechanism validated but provides no measurable gain over fixed-affordance champion; kill rules (no gain / uniform collapse) not fully triggered but no keep justification. Evidence artifact: results/aegis_v2/edaa_iter32.jsonl. No synthetic proxy; no teleport; worklog/equations/graph updated; commit done."}
