{"run": 460, "commit": "HEAD", "segment": 15, "idea": "FACC-SE3-ITER9", "idea_short": "FACC-SE3 iter-9: Force-Adaptive Contact Control with SE(3)-conditioned energy affordance replacing flow-mat (G3 retired family replay, G4 unpairable, G7 predicted-only)", "status": "discard", "timestamp": "2026-10-01T00:00:00Z", "metric_name": "fixture_B transfer_success (coverage_cont >= 0.90 per episode), canonical rig, 20 seeds x 3 suites, health-check only", "metric_class": "physical", "metric_class_note": "physical only; synthetic_proxy excluded per G2/G7; health-check only since G3 replay + G4 unpairable prevent paired candidate measurement", "director_decision": {"iteration": 9, "idea": "FACC-SE3: Force-Adaptive Contact Control with SE(3)-conditioned energy affordance, replaces flow-mat with EBM potential + in-context attention over contact history", "predicted_score": 78.0, "executed": false, "exclusion_reasons": ["G3 PERMANENT RETIREMENT: eq78/N70-N76/manifold-switch/flow-bridge/energy-gated/EBM/SE3-affordance/DAEF/FACC family permanently retired; 26th replay (runs 450/451/454/455/458/459 + edges through iter-8 already refused 25). Label change (FACC-SE3) does not change mechanism class.", "G4 UNPAIRABLE: PATH_MODES=(raster,rounded,trochoid,spiral,fitted,fitro,orbit,auto) carries 0 injectable SE3/energy/manifold/FACC-head hook (RESIDUAL_HOOK_FN only, I3-owned). No mechanism exists to inject a FACC-SE3 decoder into a paired 20-seed Fixture-B comparison.", "G7 INTEGRITY: predicted-only 78pts invalid for keep; synthetic N74 92.3 frozen unconditionally. No synthetic_proxy promotion.", "G2 QUEUE EMPTY: no queued row since run 309; estimator lever N453b closed at every I23 level 0-0.24m (N455/N456/N457); N198 director-owned, unclaimable on the B bar."]}, "physical_action_taken": "Health-check ONLY (G3 replay, G4 unpairable): trochoid --compare trochoid, 20 seeds x 3 suites = 60 episodes, A/B/R 20/20 each (1.00/1.00/1.00), 0 harness errors, 0 rig bytes changed. Evidence results/aegis_v2/N460_r460_health_n0_0.jsonl.", "rig_invoked": true, "rig_exit": 0, "episodes": 60, "harness_errors": 0, "rig_bytes_changed": 0, "pose_noise_cfg": "0,0", "evidence": ["results/aegis_v2/N460_r460_health_n0_0.jsonl", "autoresearch_research.jsonl", "autoresearch_research_strategy_graph.jsonl", "experiments/worklog.md"], "metrics": {"idea": "FACC-SE3-ITER9", "metric_class": "physical", "seeds": 20, "episodes": 60, "fixture_A_success": 1.0, "fixture_B_success": 1.0, "fixture_R_success": 1.0, "delta_vs_champion": 0.0, "compare_baseline": "trochoid", "compare_keep": false, "new_mechanism": false, "replay_of_retired_family": true, "retired_family_ids": ["eq78", "N70", "N71", "N72", "N73", "N74", "N75", "N76", "FACC", "FACC-SE3", "FACC-E"]}, "gates_unchanged": {"segment": 15, "primary_metric": "transfer_success", "tier4_gate": "post-hoc tag, untouched", "no_new_segment": true, "no_metric_move": true, "no_gate_change": true, "no_candidate_promoted": true, "new_unvalidated_row_added": false}, "verdict": "DISCARD (26th G3 retired-family replay; health-check confirms frozen champion trochoid B=1.00; queue empty, estimator closed, N198 director-owned)"}
{"run": 461, "commit": "HEAD", "segment": 15, "idea": "FACC-ITER10", "idea_short": "FACC iter-10: Force-Adaptive Contact Control SE(3)-conditioned replacing flow-matching head (G3 retired family replay, G4 unpairable, G7 predicted-only)", "status": "discard", "timestamp": "2026-10-01T00:00:00Z", "metric_name": "fixture_B transfer_success (coverage_cont >= 0.90 per episode), canonical rig, 20 seeds x 3 suites, health-check only", "metric_class": "physical", "metric_class_note": "physical only; synthetic_proxy excluded per G2/G7; health-check only since G3 replay + G4 unpairable prevent paired candidate measurement", "director_decision": {"iteration": 10, "idea": "FACC: Force-Adaptive Contact Control, SE(3)-conditioned contact policy replacing flow-matching head; Pi0 action-expert + FACC residual", "predicted_score": 73, "executed": false, "exclusion_reasons": ["G3 PERMANENT RETIREMENT: eq78/N70-N76/manifold-switch/flow-bridge/energy-gated/EBM/SE3-affordance/DAEF/FACC family permanently retired; 27th replay (runs 450/451/454/455/458/459/460 + edges through iter-9 already refused 26). Label change (FACC) does not change mechanism class.", "G4 UNPAIRABLE: PATH_MODES=(raster,rounded,trochoid,spiral,fitted,fitro,orbit,auto) carries 0 injectable SE3/energy/manifold/FACC-head hook (RESIDUAL_HOOK_FN only, I3-owned). No mechanism exists to inject a FACC decoder into a paired 20-seed Fixture-B comparison.", "G7 INTEGRITY: predicted-only 73pts invalid for keep; synthetic N74 92.3 frozen unconditionally. No synthetic_proxy promotion.", "G2 QUEUE EMPTY: no queued row since run 309; estimator lever N453b closed at every I23 level 0-0.24m (N455/N456/N457); N198 director-owned, unclaimable on the B bar."]}, "physical_action_taken": "Health-check ONLY (G3 replay, G4 unpairable): trochoid --compare trochoid, 20 seeds x 3 suites = 60 episodes, A/B/R 20/20 each (1.00/1.00/1.00), 0 harness errors, 0 rig bytes changed. Evidence results/aegis_v2/N461_r461_health_n0_0.jsonl.", "rig_invoked": true, "rig_exit": 0, "episodes": 60, "harness_errors": 0, "rig_bytes_changed": 0, "pose_noise_cfg": "0,0", "evidence": ["results/aegis_v2/N461_r461_health_n0_0.jsonl", "autoresearch_research.jsonl", "autoresearch_research_strategy_graph.jsonl", "experiments/worklog.md"], "metrics": {"idea": "FACC-ITER10", "metric_class": "physical", "seeds": 20, "episodes": 60, "fixture_A_success": 1.0, "fixture_B_success": 1.0, "fixture_R_success": 1.0, "delta_vs_champion": 0.0, "compare_baseline": "trochoid", "compare_keep": false, "new_mechanism": false, "replay_of_retired_family": true, "retired_family_ids": ["eq78", "N70", "N71", "N72", "N73", "N74", "N75", "N76", "FACC", "FACC-SE3", "FACC-E"]}, "gates_unchanged": {"segment": 15, "primary_metric": "transfer_success", "tier4_gate": "post-hoc tag, untouched", "no_new_segment": true, "no_metric_move": true, "no_gate_change": true, "no_candidate_promoted": true, "new_unvalidated_row_added": false}, "verdict": "DISCARD (27th G3 retired-family replay; health-check confirms frozen champion trochoid B=1.00 at 0,0)"}
{"run": 462, "commit": "HEAD", "segment": 15, "idea": "SE3-EBAA-ITER11", "idea_short": "SE3-EBAA iter-11: SE(3)-Equivariant Energy-Based Affordance Attention replacing flow-matching head (G3 retired family replay, G4 unpairable, G7 predicted-only)", "status": "discard", "timestamp": "2026-10-01T00:00:00Z", "metric_name": "fixture_B transfer_success (coverage_cont >= 0.90 per episode), canonical rig, 20 seeds x 3 suites, health-check only", "metric_class": "physical", "metric_class_note": "physical only; synthetic_proxy excluded per G2/G7; health-check only since G3 replay + G4 unpairable prevent paired candidate measurement", "director_decision": {"iteration": 11, "idea": "SE3-EBAA: SE(3)-Equivariant Energy-Based Affordance Attention replacing flow-matching head; E(o,a|SE3) + 5-step Langevin over affordance-equivalence classes", "predicted_score": 74, "executed": false, "exclusion_reasons": ["G3 PERMANENT RETIREMENT: eq78/N70-N76/manifold-switch/flow-bridge/energy-gated/EBM/SE3-affordance/DAEF/FACC family permanently retired; 28th replay. Label change (SE3-EBAA) does not change mechanism class.", "G4 UNPAIRABLE: PATH_MODES carries 0 injectable SE3/energy/manifold/EBM-head hook (RESIDUAL_HOOK_FN only, I3-owned). No mechanism exists to inject an EBM+Langevin decoder into a paired 20-seed Fixture-B comparison.", "G7 INTEGRITY: predicted-only 74pts invalid for keep; synthetic N74 92.3 frozen unconditionally. No synthetic_proxy promotion.", "G2 QUEUE EMPTY: no queued row since run 309; estimator lever N453b closed at every I23 level 0-0.24m (N455/N456/N457); N198 director-owned, unclaimable on the B bar."]}, "physical_action_taken": "Health-check ONLY (G3 replay, G4 unpairable): trochoid --compare trochoid, 20 seeds x 3 suites = 60 episodes, A/B/R 20/20 each (1.00/1.00/1.00), 0 harness errors, 0 rig bytes changed. Evidence results/aegis_v2/N462_r462_health_n0_0.jsonl.", "rig_invoked": true, "rig_exit": 0, "episodes": 60, "harness_errors": 0, "rig_bytes_changed": 0, "pose_noise_cfg": "0,0", "evidence": ["results/aegis_v2/N462_r462_health_n0_0.jsonl", "autoresearch_research.jsonl", "autoresearch_research_strategy_graph.jsonl", "experiments/worklog.md"], "metrics": {"idea": "SE3-EBAA-ITER11", "metric_class": "physical", "seeds": 20, "episodes": 60, "fixture_A_success": 1.0, "fixture_B_success": 1.0, "fixture_R_success": 1.0, "delta_vs_champion": 0.0, "compare_baseline": "trochoid", "compare_keep": false, "new_mechanism": false, "replay_of_retired_family": true, "retired_family_ids": ["eq78", "N70", "N71", "N72", "N73", "N74", "N75", "N76", "FACC", "FACC-SE3", "SE3-EBAA", "EBM", "DAEF"], "replay_count": 28}, "gates_unchanged": true, "verdict": "DISCARD (28th G3 replay, NOT EXECUTED); health-check A/B/R 1.00/1.00/1.00, 60 eps, 0 errors, 0 rig bytes. Queue empty since 309; estimator closed; N198 director-owned."}
{"run": 463, "commit": "HEAD", "segment": 15, "idea": "FACC-E-ITER12", "idea_short": "FACC-E iter-12: SE(3)-conditioned Force-Adaptive Contact Control with energy-based affordance attention (G3 retired family replay, G4 unpairable, G7 predicted-only)", "status": "discard", "timestamp": "2026-10-01T00:00:00Z", "metric_name": "fixture_B transfer_success (coverage_cont >= 0.90 per episode), canonical rig, 20 seeds x 3 suites, health-check only", "metric_class": "physical", "metric_class_note": "physical only; synthetic_proxy excluded per G2/G7; health-check only since G3 replay + G4 unpairable prevent paired candidate measurement", "director_decision": {"iteration": 12, "idea": "FACC-E: SE(3)-conditioned Force-Adaptive Contact Control with energy-based affordance attention; flow-matching -> affordance-equivalence; Boltzmann over affordance tokens", "predicted_score": 78, "executed": false, "exclusion_reasons": ["G3 PERMANENT RETIREMENT: eq78/N70-N76/manifold-switch/flow-bridge/energy-gated/EBM/SE3-affordance/DAEF/FACC family permanently retired; 29th replay. Label change (FACC-E) does not change mechanism class.", "G4 UNPAIRABLE: PATH_MODES carries 0 injectable SE3/energy/manifold/FACC-head hook (RESIDUAL_HOOK_FN only, I3-owned). No mechanism exists to inject a FACC-E decoder into a paired 20-seed Fixture-B comparison.", "G7 INTEGRITY: predicted-only 78pts invalid for keep; synthetic N74 92.3 frozen unconditionally. No synthetic_proxy promotion.", "G2 QUEUE EMPTY: no queued row since run 309; estimator lever N453b closed at every I23 level 0-0.24m (N455/N456/N457); N198 director-owned, unclaimable on the B bar."]}, "physical_action_taken": "Health-check ONLY (G3 replay, G4 unpairable): trochoid --compare trochoid, 20 seeds x 3 suites = 60 episodes, A/B/R 20/20 each (1.00/1.00/1.00), 0 harness errors, 0 rig bytes changed. Evidence results/aegis_v2/N463_r463_health_n0_0.jsonl.", "rig_invoked": true, "rig_exit": 0, "episodes": 60, "harness_errors": 0, "rig_bytes_changed": 0, "pose_noise_cfg": "0,0", "evidence": ["results/aegis_v2/N463_r463_health_n0_0.jsonl", "autoresearch_research.jsonl", "autoresearch_research_strategy_graph.jsonl", "experiments/worklog.md"], "metrics": {"idea": "FACC-E-ITER12", "metric_class": "physical", "seeds": 20, "episodes": 60, "fixture_A_success": 1.0, "fixture_B_success": 1.0, "fixture_R_success": 1.0, "delta_vs_champion": 0.0, "compare_baseline": "trochoid", "keep": false}}
{"run": 464, "commit": "HEAD", "segment": 15, "idea": "FACC-E-ITER13", "idea_short": "FACC-E iter-13: SE(3)-conditioned Force-Adaptive Contact Control replacing fixed-manifold flow head (G3 retired family replay, G4 unpairable, G7 predicted-only)", "status": "discard", "timestamp": "2026-10-01T00:00:00Z", "metric_name": "fixture_B transfer_success (coverage_cont >= 0.90 per episode), canonical rig, 20 seeds x 3 suites, health-check only", "metric_class": "physical", "metric_class_note": "physical only; synthetic_proxy excluded per G2/G7; health-check only since G3 replay + G4 unpairable prevent paired candidate measurement", "director_decision": {"iteration": 13, "idea": "FACC-E: SE(3)-conditioned Force-Adaptive Contact Control; bridge flow-matching -> affordance-equivalence; EBM energy head + adaptive stiffness, argmin-E + Langevin refine", "predicted_score": 76, "executed": false, "exclusion_reasons": ["G3 PERMANENT RETIREMENT: eq78/N70-N76/manifold-switch/flow-bridge/energy-gated/EBM/SE3-affordance/DAEF/FACC family permanently retired; 30th replay. Label change (FACC-E) does not change mechanism class.", "G4 UNPAIRABLE: PATH_MODES carries 0 injectable SE3/energy/manifold/FACC-head hook (RESIDUAL_HOOK_FN only, I3-owned). No mechanism exists to inject a FACC-E decoder into a paired 20-seed Fixture-B comparison.", "G7 INTEGRITY: predicted-only 76pts invalid for keep; synthetic N74 92.3 frozen unconditionally. No synthetic_proxy promotion.", "G2 QUEUE EMPTY: no queued row since run 309; estimator lever N453b closed at every I23 level 0-0.24m (N455/N456/N457); N198 director-owned, unclaimable on the B bar."]}, "physical_action_taken": "Health-check ONLY (G3 replay, G4 unpairable): trochoid --compare trochoid, 20 seeds x 3 suites = 60 episodes, A/B/R 20/20 each (1.00/1.00/1.00), 0 harness errors, 0 rig bytes changed. Evidence results/aegis_v2/N464_r464_health_n0_0.jsonl.", "rig_invoked": true, "rig_exit": 0, "episodes": 60, "harness_errors": 0, "rig_bytes_changed": 0, "pose_noise_cfg": "0,0", "evidence": ["results/aegis_v2/N464_r464_health_n0_0.jsonl", "autoresearch_research.jsonl", "autoresearch_research_strategy_graph.jsonl", "experiments/worklog.md"], "metrics": {"idea": "FACC-E-ITER13", "metric_class": "physical", "seeds": 20, "episodes": 60, "fixture_A_success": 1.0, "fixture_B_success": 1.0, "fixture_R_success": 1.0, "delta_vs_champion": 0.0, "compare_baseline": "trochoid", "keep": false}}
{"run": 465, "commit": "HEAD", "segment": 15, "idea": "FACC-ITER14", "idea_short": "FACC iter-14: Force-Adaptive Contact Control SE(3)-conditioned replacing flow-matching head (G3 retired family replay, G4 unpairable, G7 predicted-only)", "status": "discard", "timestamp": "2026-10-01T00:00:00Z", "metric_name": "fixture_B transfer_success (coverage_cont >= 0.90 per episode), canonical rig, 20 seeds x 3 suites, health-check only", "metric_class": "physical", "metric_class_note": "physical only; synthetic_proxy excluded per G2/G7; health-check only since G3 replay + G4 unpairable prevent paired candidate measurement", "director_decision": {"iteration": 14, "idea": "FACC: SE(3)-conditioned Force-Adaptive Contact Control replacing flow-matching; contact wrench + SE(3) stiffness ellipsoid per chunk; energy-based in-context attention", "predicted_score": 78, "executed": false, "exclusion_reasons": ["G3 PERMANENT RETIREMENT: eq78/N70-N76/manifold-switch/flow-bridge/energy-gated/EBM/SE3-affordance/DAEF/FACC family permanently retired; 31st replay. Label change (FACC) does not change mechanism class.", "G4 UNPAIRABLE: PATH_MODES carries 0 injectable SE3/energy/manifold/FACC-head hook (RESIDUAL_HOOK_FN only, I3-owned). No mechanism exists to inject a FACC decoder into a paired 20-seed Fixture-B comparison.", "G7 INTEGRITY: predicted-only 78pts invalid for keep; synthetic N74 92.3 frozen unconditionally. No synthetic_proxy promotion.", "G2 QUEUE EMPTY: no queued row since run 309; estimator lever N453b closed at every I23 level 0-0.24m (N455/N456/N457); N198 director-owned, unclaimable on the B bar."]}, "physical_action_taken": "Health-check ONLY (G3 replay, G4 unpairable): trochoid --compare trochoid, 20 seeds x 3 suites = 60 episodes, A/B/R 20/20 each (1.00/1.00/1.00), 0 harness errors, 0 rig bytes changed. Evidence results/aegis_v2/N465_r465_health_n0_0.jsonl.", "rig_invoked": true, "rig_exit": 0, "episodes": 60, "harness_errors": 0, "rig_bytes_changed": 0, "pose_noise_cfg": "0,0", "evidence": ["results/aegis_v2/N465_r465_health_n0_0.jsonl", "autoresearch_research.jsonl", "autoresearch_research_strategy_graph.jsonl", "experiments/worklog.md"], "metrics": {"idea": "FACC-ITER14", "metric_class": "physical", "seeds": 20, "episodes": 60, "fixture_A_success": 1.0, "fixture_B_success": 1.0, "fixture_R_success": 1.0, "delta_vs_champion": 0.0, "compare_baseline": "trochoid", "keep": false, "verdict": "discard-31st-G3-replay-not-executed-health-check-only"}}
{"run": 466, "commit": "HEAD", "segment": 15, "idea": "FACC-ITER15", "idea_short": "FACC iter-15: Force-Adaptive Contact Control SE(3)-conditioned replacing flow head (G3 retired family replay, G4 unpairable, G7 predicted-only)", "status": "discard", "timestamp": "2026-10-01T00:00:00Z", "metric_name": "fixture_B transfer_success (coverage_cont >= 0.90 per episode), canonical rig, 20 seeds x 3 suites, health-check only", "metric_class": "physical", "metric_class_note": "physical only; synthetic_proxy excluded per G2/G7; health-check only since G3 replay + G4 unpairable prevent paired candidate measurement", "director_decision": {"iteration": 15, "idea": "FACC: SE(3)-conditioned Force-Adaptive Contact Control replacing flow-matching head; energy-based contact gate selects stiffness/damping", "predicted_score": 76, "executed": false, "exclusion_reasons": ["G3 PERMANENT RETIREMENT: eq78/N70-N76/manifold-switch/flow-bridge/energy-gated/EBM/SE3-affordance/DAEF/FACC family permanently retired; 32nd replay. Label change (FACC) does not change mechanism class.", "G4 UNPAIRABLE: PATH_MODES carries 0 injectable SE3/energy/manifold/FACC-head hook (RESIDUAL_HOOK_FN only, I3-owned). No mechanism exists to inject a FACC decoder into a paired 20-seed Fixture-B comparison.", "G7 INTEGRITY: predicted-only 76pts invalid for keep; synthetic N74 92.3 frozen unconditionally. No synthetic_proxy promotion.", "G2 QUEUE EMPTY: no queued row since run 309; estimator lever N453b closed at every I23 level 0-0.24m (N455/N456/N457); N198 director-owned, unclaimable on the B bar."]}, "physical_action_taken": "Health-check ONLY (G3 replay, G4 unpairable): trochoid --compare trochoid, 20 seeds x 3 suites = 60 episodes, A/B/R 20/20 each (1.00/1.00/1.00), 0 harness errors, 0 rig bytes changed. Evidence results/aegis_v2/N466_r466_health_n0_0.jsonl.", "rig_invoked": true, "rig_exit": 0, "episodes": 60, "harness_errors": 0, "rig_bytes_changed": 0, "pose_noise_cfg": "0,0", "evidence": ["results/aegis_v2/N466_r466_health_n0_0.jsonl", "autoresearch_research.jsonl", "autoresearch_research_strategy_graph.jsonl", "experiments/worklog.md"], "metrics": {"idea": "FACC-ITER15", "metric_class": "physical", "seeds": 20, "episodes": 60, "fixture_A_success": 1.0, "fixture_B_success": 1.0, "fixture_R_success": 1.0, "delta_vs_champion": 0.0, "compare_baseline": "trochoid", "keep": false, "verdict": "discard-32nd-G3-replay-not-executed-health-check-only"}}
{"run": 467, "commit": "HEAD", "segment": 15, "idea": "FACC-ITER16", "idea_short": "FACC-EA iter-16: SE(3)-conditioned force-adaptive contact control with energy attention (G3 retired family replay, G4 unpairable, G7 predicted-only)", "status": "discard", "timestamp": "2026-10-01T00:00:00Z", "metric_name": "fixture_B transfer_success (coverage_cont >= 0.90 per episode), canonical rig, 20 seeds x 3 suites, health-check only", "metric_class": "physical", "metric_class_note": "physical only; synthetic_proxy excluded per G2/G7; health-check only since G3 replay + G4 unpairable prevent paired candidate measurement", "director_decision": {"iteration": 16, "idea": "FACC-EA: SE(3)-Conditioned Force-Adaptive Contact Control with Energy Attention replacing flow-matching action-expert; SE(3) contact wrench as query, in-context demos as energy keys", "predicted_score": 78, "executed": false, "exclusion_reasons": ["G3 PERMANENT RETIREMENT: eq78/N70-N76/manifold-switch/flow-bridge/energy-gated/EBM/SE3-affordance/DAEF/FACC family permanently retired; 33rd replay. Label change (FACC-EA) does not change mechanism class.", "G4 UNPAIRABLE: PATH_MODES carries 0 injectable SE3/energy/manifold/FACC-head hook (RESIDUAL_HOOK_FN only, I3-owned). No mechanism exists to inject a FACC-EA decoder into a paired 20-seed Fixture-B comparison.", "G7 INTEGRITY: predicted-only 78pts invalid for keep; synthetic N74 92.3 frozen unconditionally. No synthetic_proxy promotion.", "G2 QUEUE EMPTY: no queued row since run 309; estimator lever N453b closed at every I23 level 0-0.24m (N455/N456/N457); N198 director-owned, unclaimable on the B bar."]}, "physical_action_taken": "Health-check ONLY (G3 replay, G4 unpairable): trochoid --compare trochoid, 20 seeds x 3 suites = 60 episodes, A/B/R 20/20 each (1.00/1.00/1.00), 0 harness errors, 0 rig bytes changed. Evidence results/aegis_v2/N467_r467_health_n0_0.jsonl.", "rig_invoked": true, "rig_exit": 0, "episodes": 60, "harness_errors": 0, "rig_bytes_changed": 0, "pose_noise_cfg": "0,0", "evidence": ["results/aegis_v2/N467_r467_health_n0_0.jsonl", "autoresearch_research.jsonl", "autoresearch_research_strategy_graph.jsonl", "experiments/worklog.md"], "metrics": {"idea": "FACC-ITER16", "metric_class": "physical", "seeds": 20, "episodes": 60, "fixture_A_success": 1.0, "fixture_B_success": 1.0, "fixture_R_success": 1.0, "delta_vs_champion": 0.0, "compare_baseline": "trochoid", "keep": false, "verdict": "discard-33rd-G3-replay-not-executed-health-check-only"}}
