{"type": "node", "id": "N193", "run": 304, "segment": 15, "idea": "N193", "parent": "N192", "status": "discard", "metric": 1.0, "timestamp": 1790757000, "verdict": "CONFIRMED, NOT A G4 KEEP. fixture_A's yaw-monotone failure is a PLAN/SCORE FRAME PAIRING artefact, not physics: coverage_cont(theta) = |P \u2229 (R_theta P (+) D_r_eff)|/|P| is purely geometric and the rig's own kernel predicts the measured number per episode to 0.2% (mean resid -0.0019, r 0.9978 at 0.28,56; -0.0018, r 0.9969 at 0.32,64; exactly 0.0000 for the dose arm). The yaw is UNOBSERVABLE on a rotationally symmetric face (likelihood invariant in theta => posterior = prior; the rig keeps the full prior by construction, reg_yaw_plan median 39.74 deg == prior), so it is a FLOOR, not a noise level, and no estimator or sensor can remove it. Dose: the minimal rotation-invariant plan (Archimedean spiral on the disc of radius = patch circumradius), taken iff the registration cannot observe the yaw. 100 paired seeds x {A,B,R} x 2 arms, 0 harness errors in 1800 episodes: A 0.21->0.99 and 0.15->1.00 (Welch 5.02e-29 / 5.16e-32, Fisher 2.49e-34 / 5.29e-41), held-out R 0.61->1.00 and 0.59->1.00 (Welch 1.54e-11 / 6.73e-12, Fisher 3.54e-14 / 5.03e-15), R round customers 15/54 -> 54/54 with the elongated half untouched, B BIT-IDENTICAL 100/100, 0,0 no cost and no gain. rig compare.keep = false at every level: G4's bar is anchored on fixture_B, where the dose is a PROVABLE no-op (inradius 0.14 m < patch circumradius 0.2088 m, so no invariant plan fits, and the yaw there is PCA-corrected to 0.57 deg). Cost stated: 2.10x swept area, 3.025 m vs 1.412 m arclength, 931 vs 434 ticks at the same commanded speed, slip/jerk/stick all equal-or-better. Do not re-derive, re-litigate or re-bench this family."}
{"from": "N192", "to": "N193", "type": "edge", "segment": 15, "kind": "opened", "run": 304, "timestamp": 1790757000, "description": "N192 left fixture_A unrescued (0.21 at 0.28 m) with the best registration ever measured (reg_err_xy median 2.09 mm, 0 of 79 failures above 25 mm) and named the residual a PLAN-FRAME term, because the estimator correctly declares the yaw unobservable on a symmetric face. N193 decides physical-vs-convention with a discriminating run and answers: convention, and removable by the plan alone."}
{"from": "N193", "to": "N192", "type": "edge", "segment": 15, "kind": "answered", "run": 304, "timestamp": 1790757000, "description": "N193 answers N192's question exactly and closes item (a) of the N192->N193 edge. It also confirms N192's own reading of A: A's registration was never the problem (identical in both arms), and it adds the single scalar that predicts everything -- reg_yaw_plan_deg, which is 39.74 deg on A (uncorrected), 0.57 on B and 1.05 on R's elongated customers (PCA-corrected). Item (b) of that edge (activate the lattice on k*sigma at fixed ray budget) is untouched and becomes N195."}
{"from": "N193", "to": "N194", "type": "edge", "segment": 15, "kind": "next", "run": 304, "timestamp": 1790757000, "description": "The G4 keep-bar is EXHAUSTED, not merely hard: fixture_B is 100/100 up to 0.32 m/64 deg and no planner can improve a metric already at ceiling, and N193 just proved the one remaining A-side lever cannot touch B. Any future KEEP must come from the pose-noise range where B ITSELF degrades below the bar. N194 must first find that range (dose sigma with the shipped N192 lattice vs the frozen k=1 arm, 100 paired seeds, and locate the sigma where the champion's B crosses 0.70) and only then dose inside it."}
{"from": "N193", "to": "N195", "type": "edge", "segment": 15, "kind": "open", "run": 304, "timestamp": 1790757000, "description": "Item (b) of the N192->N193 edge, still open: the cast lattice activates on sigma > a = H - rho_inf = 0.2323 m, which is a design claim on the scale (unbounded Gaussian tail; 2 seeds reach 170 mm at sigma 0.20). Activate on k*sigma and shrink the covering radius d at fixed ray budget -- the only estimator-side lever left, and the only candidate that can move fixture_B again."}
{"type": "node", "id": "N194", "run": 305, "segment": 15, "idea": "N194", "parent": "N193", "status": "keep", "metric": 1.0, "timestamp": 1798750000, "verdict": "Frontier question ANSWERED and the shipped N192 stack RE-CERTIFIED at 2x the previously certified pose noise, but the G4 keep-bar on fixture_B is now SATURATED rather than merely exhausted. Paired 100-seed decider at 0.64 m/128 deg: fixture_B coverage_cont 0.4441 -> 0.9834, success 36/100 -> 100/100, Welch p 1.89e-20, Fisher p 2.33e-26, rig compare.keep=true (results/aegis_v2/N194_r305_s100_0.64,128.jsonl). Held-out fixture_R 0.3047 -> 0.8258 (13/100 -> 53/100, Fisher p 1.89e-09). The FROZEN single-cast champion crosses the 0.70 bar between sigma 0.36 and 0.40 m (empirical bracket; the log-logistic fit is REJECTED as a model, it under-reads the bracket by 40-100%), and the N192 lattice holds 20/20 at every level up to 2.56 m / 512 deg. Analytic closure: for an axis-aligned window over a RECT face the kept rays form a contiguous index box, so the estimator error is exactly (one-sided cut depth)/2 + a parity term of amplitude 2H/(n-1) = 38.71 mm; the lattice forces the cut depth to 0 and leaves only the parity term, which is why reg_err_xy p90 saturates at 15.2-21.9 mm and is FLAT in sigma. Defect found and fixed: reg_yaw_plan_deg was logged unfolded, so a rect plan's legitimately 180-deg-aliased PCA branch read as a catastrophic 179-180 deg plan error at every noise level; folded to [0,90] deg, strictly a log change (41 + 60 regression episodes, 0 field diffs). The dose's binding constraint is the k^2 RAY BUDGET, not accuracy: 3.33 M rays/episode at 3.20 m overran the wall budget, so the shipped champion is UNRUNNABLE past sigma ~2.6 m."}
{"from": "N193", "to": "N194", "type": "edge", "segment": 15, "kind": "opened", "run": 305, "timestamp": 1798750000, "description": "Per the N193->N194 edge: locate the sigma at which fixture_B ITSELF crosses the 0.70 keep-bar before dosing anything, since no planner can improve a metric already at ceiling. Answer: 0.36-0.40 m for the frozen single-cast champion, and nowhere (up to 2.56 m) for the shipped lattice. G3/G4 adjudication of the director's iter-51 FACC spec: NOT EXECUTED, 59th re-derivation of the retired manifold-switch / flow-bridge / energy-gated family and unpairable in the scrub rig."}
{"from": "N194", "to": "N195", "type": "edge", "segment": 15, "kind": "next", "run": 305, "timestamp": 1798750000, "description": "N194 leaves exactly one executable lever and names it: the k^2 RAY BUDGET. The selection stage of the cast lattice is a k^2-way argmax over the top-point count, but every candidate is cast at the full n x n resolution, so the sensor pays k^2 n^2 rays to keep one cast; and k was derived from a (k = ceil(4 sigma/a)+1) while the only real constraint is the covering radius d/2 <= a, so the shipped d = 1.5a is 1.78x the rays of the tightest legal pitch d = 2a at equal 3-sigma coverage. N195 must buy both back -- coarse-to-fine selection (n_c for the argmax, full n once for the winner) and d as an explicit knob with k re-derived from d -- and must show the saved rays are FREE (paired vs the shipped champion, coverage delta ~ 0) while extending the runnable envelope past sigma = 2.6 m where the shipped champion times out. This is item (b) of the N192->N193 edge, still open."}
{"from": "N194", "to": "N196", "type": "edge", "segment": 15, "kind": "open", "run": 305, "timestamp": 1798750000, "description": "The other live axis, and the only one that can move a SUITE other than the saturated B: fixture_A stays yaw-limited (0.11 at 0.64 m) because yaw is unobservable on a rotationally symmetric face, and N193 already proved the orbit plan fixes it (A 0.21->0.99) but is not a G4 keep because the bar is anchored on B. N196 must decide whether that anchoring is the right protocol or whether the honest close-out of segment 15 is to certify the stack across A/B/R and stop claiming new keeps on a metric pinned at 1.00. Also open: the parity floor 2H/(n-1) is now the ONLY surviving registration error, so n is the untested resolution knob (n=64 halves it to 19.05 mm, n=128 to 9.5 mm) with no measured coverage consequence yet."}
{"type": "node", "id": "N195", "run": 306, "segment": 15, "idea": "N195", "parent": "N194", "status": "keep", "metric": 1.0, "timestamp": 1798760400, "verdict": "The cast lattice's k^2 is a d-LAW, not a constant: the offsets that hold the whole top face are the containment square C(f)=f+[-a,a]^2 with a=H-rho_inf=0.2323 m, so a lattice of pitch d covers the +-3 sigma plausible-centre set iff d/2 <= a and (k-1)d/2 >= 3 sigma, i.e. k = ceil(6 sigma/d)+1. N192's k = ceil(4 sigma/a)+1 is that law evaluated at d=1.5a, so the shipped k was the minimum for its OWN pitch and 1.78x the count of the tightest legal d=2a. Re-deriving k from d leaves the shipped expression exact. Second, the k^2-way argmax must be scored by the BORDER MARGIN (a distance) and not the point count (an area proxy that ALIASES on a coarse grid): measured, the count score at n_c=8 selected a cut window and doubled reg_err_xy, and at n_c=16 it tied 1 of 3 seeds; the margin score at n_c=12/16 (coarse pitch 0.47a/0.34a) is identical and clean, n_c=8 (0.74a) still fails. Result: 6.50x fewer rays at 0.64 m and 7.01x at 3.2 m, and the accuracy cost is EXACTLY ZERO -- 100 paired episodes at 0.64,128 give fixture_B coverage_cont 0.9891 -> 0.9891 (delta 0.0000, Welch p 1.0), fixture_R 0.8221 -> 0.8221, fixture_A 0.6958 -> 0.6964, reg_ok 20/20 both arms, wall 0.253 -> 0.099 s/episode; rig keep=false is the CORRECT verdict for a cost-only pairing. The keep row is the newly reachable regime: at 3.2 m / 640 deg, dose vs the frozen single cast, 240 episodes, 0 harness errors, fixture_B 0.0000 -> 0.9906 and 0/20 -> 20/20 (Welch 1.13e-33, Fisher 1.45e-11, rig keep=true), held-out fixture_R 0.0000 -> 0.8550 (12/20). CORRECTION to N194.3: the shipped champion is NOT unreachable at 3.2 m (cost probe 3.10 s/episode, coverage 0.9792, 3/3); what overran in run 305 was the aggregate 120-episode two-arm wall budget, and the 7.7x per-episode cut is what makes that budget feasible. Honest accounting: the accuracy content of N195 is zero by construction -- the fixture_B gain belongs to the run-303 lattice -- and fixture_A is untouched (1/20) because the yaw is unobservable on a symmetric face."}
{"from": "N194", "to": "N195", "type": "edge", "segment": 15, "kind": "opened", "run": 305, "timestamp": 1798760400, "description": "The only executor-verified cost defect left on the champion: k = ceil(4 sigma/a)+1 with every one of the k^2 candidates cast at the full n x n resolution, i.e. k^2 n^2 rays to keep one cast's points, and k derived from a rather than from the pitch although the binding constraint is d/2 <= a. N195 must buy both back and prove the saving is free in coverage."}
{"from": "N195", "to": "N194", "type": "edge", "segment": 15, "kind": "answered", "run": 306, "timestamp": 1798760400, "description": "N195 answers N194's k^2-ray-budget question and CORRECTS its reachability claim. The budget law is closed (k = ceil(2E/d)+1 at fixed E, d explicit, default arm bit-identical), and sigma = 3.20 m is not unreachable per-episode (3.10 s/episode measured) -- the run-305 overrun was aggregate wall budget, which the 7.7x per-episode cut makes feasible. N194's N194.1 parity floor is now the ONLY surviving registration error term."}
{"from": "N195", "to": "N196", "type": "edge", "segment": 15, "kind": "next", "run": 306, "timestamp": 1798760400, "description": "After N195 the only untested estimator-side lever is n itself: the surviving error is the parity term 2H/(n-1) = 38.71 mm (N194.1), so n = 64 halves it and n = 128 quarters it, at 4x/16x the (now cheap) fine cast. The close-out question is sharper than the dose: pose noise is saturated (fixture_B = 1.00 at 0.64, 2.56 and 3.2 m), fixture_A is provably sensor-unreachable (yaw unobservable, N193), and the k^2 budget is closed (N195) -- so N196 must decide whether the parity term is still VISIBLE in coverage_cont at all, and if not, say so and stop claiming registration keeps. Also open: the N193 orbit plan is confirmed but never a G4 keep because the bar is anchored on fixture_B, where it is a provable no-op (face inradius 0.14 m < patch circumradius 0.2088 m)."}
{"type": "node", "id": "N196", "run": 307, "segment": 15, "idea": "N196", "parent": "N195", "status": "discard", "metric": 0.9844, "timestamp": 1798770000, "verdict": "The parity term 2H/(n-1) is a REAL and EXACTLY-1/n estimator error, and it is INVISIBLE to the G2 metric, so the registration family is CLOSED. A pure-geometry probe of the rig's own cast algebra (no physics, no coverage, no success) sweeps n in {16,32,64,128}: centroid-error p90 36.02/17.28/7.91/4.01 mm with the ratio to the parity amplitude flat at 0.90/0.89/0.83/0.85 and flat in sigma (0.28/0.64/3.20 m agree to 3 s.f.) -- the residual IS the parity term and nothing else. Physically the law holds only to an n-INDEPENDENT ~5 mm floor: fixture_B reg_err_xy median 8.68 -> 5.50 mm from n=32 to n=128 while p90 stalls at 15-16 mm (fit e = sqrt(parity^2 + c^2), c ~= 5 mm; reg_err is against the SPEC centre and the physical top face is bevelled). The decider is a clean NULL, 20 seeds x {A,B,R} x 2 arms at 0.64,128, three paired runs, keep=false in all: n=64/CN=0 (r307) B 0.9891 -> 0.9859 (Welch 0.677); n=64/CN=16 (r309) and n=128/CN=16 (r308) B 0.9883 -> 0.9844 (Welch 0.639, and the two n=32 baselines are BIT-IDENTICAL, 122 cast points, 20/20). B is 20/20 in EVERY arm. The mechanism of the null is measured, not assumed: over the 60 pooled B plans the residual spans 2.60-18.45 mm at d(coverage_cont)/d(reg) = +0.00202 /mm, so the WHOLE parity range is worth 0.026 of coverage_cont against a 20-seed paired SE of 0.0083 -- 3x below the decider's noise floor, with the deltas the wrong sign. Two structural facts close it: (1) B's MINIMUM coverage_cont is 0.9219 > 0.90 across the entire sweep, so the bar is already cleared everywhere the parity term can act; (2) the single cast's 17.7 -> 71.0 mm residual (N194.1) was the only regime where 0.002/mm would be worth 0.14 of coverage, and the run-303 lattice forces d_cut=0 and caps the residual at the parity bound -- the sensitivity that would expose the term was DELETED by the mechanism that won the metric. Cost is negative too: with N195's CN=16, n=128 costs 1.83x wall/episode and n=64 1.11x; with CN=0 (selection at n as well) n=64 costs 7.48x. RECOMMENDATION: keep the shipped n=32. This is also why N191's unbiased extremal estimator lost -- the metric never had the resolution to adjudicate an estimator and still does not. Consequence: the estimator side is fully accounted (k/d N195, H N190.6, estimator N191, n here) and the primary metric is exhausted (B 20/20 to 3.2 m/640 deg vs a 0/20 paired champion). The suites that still fail -- A 2/20 covc 0.697, R 12/20 covc 0.822 -- are NOT centroid-limited (pooled r = +0.079 on A, +0.289 on R); they are limited by the UNOBSERVABLE YAW of rotationally symmetric faces, which N193 already fixed (A 0.21 -> 0.99) with a plan that is a PROVABLE NO-OP on fixture_B (face inradius 0.14 m < patch circumradius 0.2088 m). No scored knob was added: AEGIS_REG_N already existed, so the dose needed no rig change; one harness fix (apply_knobs writes floats and numpy>=1.20 rejects a float linspace num, killing 60/60 baseline episodes) was made at the _cast use site and regressed to 0 field diffs against git HEAD over 60 episodes."}
{"from": "N195", "to": "N196", "kind": "answered", "run": 307, "timestamp": 1798770000, "description": "N196 answers the N195->N196 edge: the parity term is a real 1/n law and it is NOT visible in coverage_cont. n=64 and n=128 both give fixture_B coverage_cont 0.9844 against the n=32 baseline's 0.9883 (Welch p 0.639) at 1.11x and 1.83x the wall. N194.1's parity floor 2H/(n-1) = 38.71 mm is therefore the last registration term and it is dead: not small, but with no operating range, because the lattice that won the metric also deleted the large-residual regime in which the metric's 0.002/mm sensitivity could act. n=32 is confirmed as the correct shipped value. Do not re-derive, re-bench or re-dose the resolution."}
{"from": "N196", "to": "N197", "kind": "next", "run": 307, "timestamp": 1798770000, "description": "The only honest artifact the segment can still produce: a CLOSE-OUT CERTIFICATION MATRIX of the final shipped stack (trochoid + N192 lattice H=0.6 + N195 d-law CN=16, n=32) at 100 seeds x {A,B,R} x 5 pose-noise levels {0,0; 0.03,6; 0.28,56; 0.64,128; 3.2,640}, paired against the frozen single cast, with per-suite transfer_success, coverage_cont, reg_err_xy, reg_ok, rays and wall_s, plus the certified operating envelope (the sigma at which each suite crosses 0.70). It sets no new keep and claims none: every mechanism it could certify was already decided (I9, I10, I12, N192, N195 kept; I11/I15, I3, I4, I6, N191, N193, N196 discarded). Its value is falsifiable coverage of the CLAIMED envelope and a clean statement of where the stack fails (A and R, on unobservable yaw, not on registration)."}
{"from": "N196", "to": "N198", "kind": "open_needs_director", "run": 307, "timestamp": 1798770000, "description": "A PROTOCOL question, not a mechanism, and NOT executable by a worker: the last real defect in the whole programme is the unobservable yaw of rotationally symmetric faces (fixture_A 2/20, fixture_R 12/20 at 0.64,128; N193's auto/orbit plan fixes A 0.21 -> 0.99 and R 0.61 -> 1.00), and it is structurally UNCLAIMABLE because G4 anchors the keep bar on fixture_B, where the fix is a provable no-op (face inradius 0.14 m < patch circumradius 0.2088 m, and B's yaw is PCA-corrected anyway). N196 supplies the quantitative half of the case: fixture_B is 60/60 with min coverage_cont 0.9219 across the whole residual range and 20/20 at every level to 3.2 m/640 deg, so the B bar can no longer discriminate ANY estimator or planner change. The director owns the choice -- certify across A/B/R, or re-anchor the bar, or close the segment -- and per the freeze rules no worker may open a new segment or move the primary metric. Nothing was changed here; this edge exists to put the decision on the record."}
{"from": "N196", "to": "N197", "kind": "answered", "run": 308, "timestamp": 1780000000, "description": "N197 answers the N196->N197 edge: the close-out certification matrix. Shipped stack (trochoid + N192 lattice H=0.6 + N195 d=2a/CN=16 + N196 n=32) vs the paired frozen single cast, 100 seeds x {A,B,R} x 7 pose-noise levels 0,0 -> 6.4 m/1280 deg, 3720 physical episodes, 0 harness errors, rig clean vs HEAD. fixture_B 100/100 at every level to 3.2 m/640 deg and 20/20 at 6.4 m/1280 deg (coverage_cont 0.9827-0.9977, min per-episode 0.9219 = the 118/128 grid floor), rig keep=true at 5 of 7 levels; keep=false at 0,0 and 0.03,6 where the dose is a measured bit-identical no-op. Held-out R 0.52-0.61 and A 0.06-0.20, and BOTH ARE FLAT in sigma from 0.28 to 6.4 m while reg_err_xy median stays 2.3-7.6 mm and reg_ok 0.99-1.00: 23x more pose noise buys A and R nothing. That is N196.5 confirmed with a dose-response curve, and it closes the registration axis on every suite. Candidate B at 0.28,56 on the first 20 seeds reproduces run 303 bit-identically (0.9984, 20/20)."}
{"from": "N197", "to": "N198", "kind": "open_needs_director", "run": 308, "timestamp": 1780000000, "description": "The certification makes N198 sharper rather than answering it. fixture_B is now 600/600 at sigma <= 3.2 m plus 20/20 at 6.4 m with min coverage_cont 0.9219 > 0.90, and the whole A/B/R separation is a single step between 0.03,6 and 0.28,56 that is entirely the yaw term (B is PCA-corrected and immune; A and R are round and take the full prior). So the primary metric has no dynamic range left at any noise level the rig can present, while the one real defect (N193's auto/orbit invariant plan: A 0.21->0.99, R 0.61->1.00) remains a PROVABLE no-op on B (face inradius 0.14 m < patch circumradius 0.2088 m). Three options, all director-owned: (a) certify across A/B/R and stop, (b) re-anchor the keep bar off fixture_B, (c) close the segment. No worker may open a segment or move the primary metric; nothing was changed here."}
{"id": "N197", "kind": "node", "run": 308, "timestamp": 1780000000, "metric": 1.0, "status": "keep", "description": "Close-out certification of the shipped stack: new_mechanism=false, claim_type=certification_only. fixture_B 1.00 at all 7 levels to 6.4 m/1280 deg, reg_err flat in sigma, A/R flat in sigma (yaw-bound, not registration-bound), k-law confirmed exactly (casts 1/1/25/100/484/1849/7056), cost 1,280 -> 1,807,360 rays and 0.072 -> 1.22 s/ep. Evidence results/aegis_v2/N197_r310*.jsonl + N197_matrix.json, experiments/N197_readout.py. equations.md ROW N197."}
