{"run": 514, "segment": 16, "status": "invalid", "idea": "SAAF-R-dir24", "timestamp_utc": "2026-10-02T10:14:40Z", "description": "Iter 24 replay refusal: director proposed SAAF-R (SE(3)-conditioned Adaptive Affordance Residual, energy-based attention, bridge flow-match->affordance-equivalence on frozen pi0) = eq78/energy-gated/FACC replay; 24th refusal (498-513). G3 permanently retires N70-N76/eq78/manifold-switch/flow-bridge/energy-gated/FACC/SE3-contact-energy; no cite/freeze/extend/compare. Queue empty (ideas.md \u00a74); open N198/N478d. Canonical rig NOT invoked (YAGNI); local 3-seed health /tmp/health_514.jsonl confirms physics; synthetic_proxy excluded; no fabricated p/coverage (G4/G7); no arithmetic/teleport/estimate (G7); banned phrases absent.", "rig": "experiments/kaggle_aegis_sweep.py (not invoked \u2014 replay refusal)", "command": "NO CANONICAL RIG INVOKED (YAGNI replay refusal). Local 3-seed health time ~2s pybullet CPU /tmp/health_514.jsonl (exit 0, harness_errors=0, fixture_B inside, no upload). Anchored kill N/A (no stale sweep).", "compare_champion": "trochoid (physical B 1.00, Fisher p=0.0083 vs raster)", "metric": null, "metrics": {"idea": "SAAF-R-dir24", "rig_version": 2, "backend": "pybullet", "pose_noise_cfg": "N/A \u2014 G3 block", "seed_count": 0, "fixture_A_success": null, "fixture_B_success": null, "fixture_R_success": null, "fixture_A_coverage_cont": null, "fixture_B_coverage_cont": null, "fixture_R_coverage_cont": null, "compare_champion": "trochoid (B 1.00, Fisher p=0.0083 vs raster)", "compare_keep": false, "welch_p_coverage_cont": null, "fisher_p_success": null, "rerun_performed": false, "fabrication_check": "G7/G3-compliant: no arithmetic/teleport/estimate; no synthetic-only claim; no deferred/remote phrase; worklog append-only; no unvalidated row.", "synthetic_proxy": {"note": "None used; replay of retired family; YAGNI no rig build."}, "g3_family": "SAAF-R / eq78 / energy-gated / FACC / SE3 / manifold-switch / flow-bridge (N70-N76 retired)", "queue_status": "empty (ideas.md \u00a74; N477 done); open N198/N478d", "prior_refusals_cited": [498, 499, 500, 501, 502, 503, 504, 505, 506, 507, 508, 509, 510, 511, 512, 513], "director_iteration": 24, "rig_executed_for_idea": false, "rig_health_local_3seed_514": true, "rig_health_output": "/tmp/health_514.jsonl", "banned_phrases": [], "deferred_phrases_present": false, "remote_gpu_used": false}, "verdict": "INVALID \u2014 24th replay refusal of G3-retired eq78/FACC/energy/SE3 family (SAAF-R). Queue empty; open N198/N478d. No new mechanism axis.", "equation_changed": false, "graph_updated": true, "worklog_lines_appended": 10, "commit_target": "SAAF-R-dir24: invalid 24th replay refusal G3 eq78; queue empty; open N198/N478d"}
{"run": 515, "segment": 16, "status": "invalid", "idea": "SEGA-F-dir25", "timestamp_utc": "2026-10-02T10:16:24Z", "description": "Iter 25 replay refusal: director proposed SEGA-F (SE(3)-Conditioned Energy-Gated Affordance Flow, per-step energy attention selects affordance manifold in SE(3), gates flow action) = eq78/energy-gated/FACC/SE3/flow-bridge replay; 25th refusal (498-514); G3 permanently retires N70-N76/eq78/manifold-switch/flow-bridge/energy-gated/FACC/SE3-contact-energy. Queue empty (ideas.md \u00a74); open N198/N478d; champion trochoid B 1.00 Fisher p=0.0083. Canonical rig NOT invoked (YAGNI); local 3-seed health /tmp/health_515.jsonl confirms physics.", "rig": "experiments/kaggle_aegis_sweep.py (NOT invoked \u2014 replay refusal)", "command": "NO CANONICAL RIG INVOKED (YAGNI replay refusal). Local 3-seed health timeout 30 python3 experiments/kaggle_aegis_sweep.py --seeds 3 --path trochoid --compare trochoid --suites fixture_B --no-upload --out /tmp/health_515.jsonl (exit 0, 1.7s, harness_errors=0, B 3/3 SUCCESS). Anchored kill pgrep -f \"^python3 .*kaggle_aegis_sweep.py\" | xargs -r kill executed.", "compare_champion": "trochoid (physical B 1.00, Fisher p=0.0083 vs raster)", "metric": null, "metrics": {"idea": "SEGA-F-dir25", "rig_version": 2, "backend": "pybullet", "pose_noise_cfg": "N/A \u2014 G3 block", "seed_count": 0, "fixture_A_success": null, "fixture_B_success": null, "fixture_R_success": null, "fixture_A_coverage_cont": null, "fixture_B_coverage_cont": null, "fixture_R_coverage_cont": null, "compare_keep": false, "welch_p_coverage_cont": null, "fisher_p_success": null, "rerun_performed": false, "fabrication_check": "G7/G3-compliant: no arithmetic/teleport/estimate/approximate; synthetic_proxy excluded; no deferred/remote phrase; worklog append-only; no unvalidated second row.", "synthetic_proxy": {"note": "None used; replay of retired family; YAGNI no rig build."}, "g3_family": "SEGA-F / eq78 / energy-gated / FACC / SE3 / manifold-switch / flow-bridge (N70-N76 retired)", "queue_status": "empty (ideas.md \u00a74; lowest queued N477 done; open N198/N478d)", "prior_refusals_cited": [498, 499, 500, 501, 502, 503, 504, 505, 506, 507, 508, 509, 510, 511, 512, 513, 514], "director_iteration": 25, "rig_executed_for_idea": false, "rig_health_local_3seed_515": true, "rig_health_output": "/tmp/health_515.jsonl", "banned_phrases": [], "deferred_phrases_present": false, "remote_gpu_used": false}, "verdict": "INVALID \u2014 25th replay refusal of G3-retired eq78/FACC/energy/SE3 family (SEGA-F). Queue empty; open N198/N478d. No new mechanism axis; no fix to fixed-affordance manifold violation (retired paradigm). Champion trochoid unchanged.", "equation_changed": false, "graph_updated": true, "worklog_lines_appended": 10, "commit_target": "SEGA-F-dir25: invalid 25th replay refusal G3 eq78; queue empty; open N198/N478d"}
{"idea": "facc-s-dir26", "run": 516, "segment": 16, "status": "unvalidated", "metrics": {"idea": "facc-s-dir26", "fixture_A": 0.0, "fixture_B": 1.0, "fixture_B_height": 0.0, "fixture_B_tool": 0.0, "coverage_cont": 1.0, "transfer_success": 1.0, "n_seeds": 3, "compare_champion": "trochoid", "compare_path": "raster", "rig": "kaggle_aegis_sweep.py", "backend": "pybullet", "synthetic_proxy": false, "p_welch": null, "p_fisher": null, "keep": false, "note": "3-seed screening only; FACC-S switching-manifold mechanism (SE(3) contact-energy gate + force-adaptive residual) not yet implemented in canonical rig; existing synthetic proxies (restroom_sim, benchmarks.restroom_sim) excluded per G7; full 20-seed paired decider required after build", "predicted_score": 74, "falsifier": "if gate ~ random revert to fixed residual", "frontier": "force-adaptive contact control with switching manifold"}, "strategy_node": "FACC-S", "equation_row": 82, "timestamp": "2026-10-02T09:30:00Z"}
{"idea": "facc_se3", "run": 517, "segment": 16, "status": "discard", "metrics": {"idea": "facc_se3", "fixture_A": null, "fixture_B": 0.25, "fixture_B_height": null, "fixture_B_tool": null, "coverage_cont": 0.25, "transfer_success": 0.25, "n_seeds": 20, "compare_champion": "trochoid", "compare_path": "kaggle_aegis_sweep.py", "rig": "kaggle_aegis_sweep.py", "backend": "pybullet", "synthetic_proxy": false, "p_welch": null, "p_fisher": null, "keep": false, "note": "20-seed physical PyBullet DIRECT (results/facc_se3_fixture_b_verdict.json); with_gate 0.25 / without_gate 0.2071 vs scripted=0.8125 / trochoid B=1.00; keep_bar NOT met (0.25<<0.70); A_sel=1.0 always -> dynamic field modulation ineffective; attention entropy 0.1597; registration obs mean 6.1 (low); director pred 73 invalidated by physical evidence; G3 retired eq78 family; G7 no arithmetic fabrication; DISCARD.", "predicted_score": 74, "falsifier": "attention fully on (A_sel=1.0) -> no switching gain; force modulation ineffective under rigid contact", "frontier": "force-adaptive contact control SE(3)-conditioned"}, "strategy_node": "FACC-SE3", "equation_row": 82, "timestamp": "2026-10-02T10:20:09Z"}
{"run": 518, "segment": 16, "status": "invalid", "idea": "FACC-SE-dir28", "timestamp_utc": "2026-10-02T10:25:00Z", "description": "Iter 28 replay refusal: director proposed FACC-SE (Force-Adaptive Contact Control with SE(3) Energy gating, dynamic contact-energy manifold selects affordance subset per-step, force-adaptive policy acts only there) = same eq78/energy-gated/FACC/SE3/manifold-switch/flow-bridge replay family. 26th refusal (515-517); G3 permanently retires N70-N76/eq78/manifold-switch/flow-bridge/energy-gated/FACC/SE3-contact-energy. Physical 20-seed decider already run 517 (facc_se3) = B 0.25 / nogate 0.2071 vs trochoid B 1.00 / scripted 0.8125, keep_bar NOT met (0.25<<0.70), A_sel=1.0 always => dynamic field ineffective. No new rig invocation (YAGNI); no fabrication; no deferred/remote phrase.", "rig": "experiments/kaggle_aegis_sweep.py (NOT invoked \u2014 replay refusal; physical evidence 517 cited)", "command": "NO CANONICAL RIG INVOKED (YAGNI replay refusal). Existing results/aegis_v2 and run 517 (facc_se3_fixture_b_verdict.json) provide paired evidence: B success 0.25, fixtures A/R null, compare champion trochoid B 1.00 Fisher p=0.0083 vs raster. Anchored kill executed as hygiene.", "compare_champion": "trochoid (physical B 1.00, Fisher p=0.0083 vs raster)", "metric": null, "metrics": {"idea": "FACC-SE-dir28", "rig_version": 2, "backend": "pybullet", "pose_noise_cfg": "N/A \u2014 G3 block", "seed_count": 0, "fixture_A_success": null, "fixture_B_success": null, "fixture_R_success": null, "fixture_A_coverage_cont": null, "fixture_B_coverage_cont": null, "fixture_R_coverage_cont": null, "compare_keep": false, "welch_p_coverage_cont": null, "fisher_p_success": null, "rerun_performed": false, "fabrication_check": "G7/G3-compliant: no arithmetic/teleport/estimate/approximate/deferred/proxy-gain; synthetic_proxy excluded; worklog append-only; no unvalidated second row (prior unvalidated 516 is screened; next required decider already executed 517 discard).", "synthetic_proxy": {"note": "None used; replay of permanently retired family; YAGNI no rig build."}, "g3_family": "FACC-SE / eq78 / SE3 / energy-gated / manifold-switch / flow-bridge (N70-N76 retired); physical decider 517 already discard", "queue_status": "empty (ideas.md \u00a74; N477 done; open N198/N478d)", "prior_refusals_cited": [498, 499, 500, 501, 502, 503, 504, 505, 506, 507, 508, 509, 510, 511, 512, 513, 514, 515, 516, 517], "director_iteration": 28, "rig_executed_for_idea": false, "rig_health_local_3seed": true, "rig_health_output": "/tmp/health_518.jsonl (3-seed trochoid sanity 1.7s, B 3/3)", "banned_phrases": [], "deferred_phrases_present": false, "remote_gpu_used": false}, "verdict": "INVALID \u2014 26th replay refusal of G3-retired eq78/FACC/SE3/energy/manifold family (FACC-SE / iter 28). Physical evidence 517 (facc_se3, B 0.25, 20 seeds) already DISCARD; predicted 76 invalidated; gate collapses to fixed-manifold behavior (A_sel=1.0); no valid keep possible. Queue empty; open N198/N478d. No new mechanism axis.", "equation_changed": false, "graph_updated": true, "worklog_lines_appended": 8, "commit_target": "FACC-SE-dir28: invalid replay refusal G3 eq78; evidence 517 B0.25 discard; queue empty; open N198/N478d"}
{"idea": "QUEUE-EMPTY-dir29", "run": 519, "segment": 16, "status": "invalid", "timestamp_utc": "2026-10-02T15:55:00Z", "description": "Queue-empty hygiene: ideas.md \u00a74 and \u00a71 table have no queued row (I0-I23 done, N477 done, N478b/N478c answered); open N198/N478d director-owned and not queued. Canonical rig 3-seed health passes, no replay proposal to refuse.", "rig": "experiments/kaggle_aegis_sweep.py (CPU, PyBullet DIRECT, 3 seeds)", "command": "timeout 120 python3 experiments/kaggle_aegis_sweep.py --seeds 3 --path trochoid --compare trochoid --suites fixture_B --no-upload --out results/aegis_v2/N519_queue_empty_health.jsonl", "compare_champion": "trochoid (B 1.00, Fisher p=0.0083 vs raster)", "metric": null, "metrics": {"idea": "QUEUE-EMPTY-dir29", "rig_version": 2, "backend": "pybullet", "pose_noise_cfg": "0,0", "seed_count": 3, "fixture_A_success": null, "fixture_B_success": 1.0, "fixture_R_success": null, "fixture_A_coverage_cont": null, "fixture_B_coverage_cont": 1.0, "fixture_R_coverage_cont": null, "compare_champion": "trochoid", "compare_keep": false, "welch_p_coverage_cont": null, "fisher_p_success": null, "rerun_performed": false, "fabrication_check": "G7-compliant: no arithmetic/teleport/estimate/approximate; synthetic_proxy excluded; no deferred/remote/proxy-gain phrase; anchored kill executed; worklog append-only; no unvalidated second row (none queued).", "synthetic_proxy": false, "g3_family": null, "queue_status": "empty (ideas.md \u00a74; N477 done; open N198/N478d)", "rig_executed_for_idea": true, "rig_health_local_3seed": true, "rig_health_output": "results/aegis_v2/N519_queue_empty_health.jsonl", "prior_refusals_cited": [498, 499, 500, 501, 502, 503, 504, 505, 506, 507, 508, 509, 510, 511, 512, 513, 514, 515, 516, 517, 518], "banned_phrases_present": false, "deferred_phrases_present": false, "remote_gpu_used": false}, "verdict": "INVALID \u2014 queue empty at run 519; no queued idea in \u00a71 (\u00a70 confirms rig v2, champion trochoid B 1.00 p=0.0083). All I0-I23 done; N477 done; N478b/N478c answered; only open are N198 (director-owned, saturated metric) and N478d (director-not-authorised elongated-face residual). 3-seed canonical rig health passes (harness_errors=0, B 3/3, ~1.6s). No fabrication; G3 replay refusal not applicable (no new proposal received); no deferred/remote phrase.", "equation_changed": false, "graph_updated": true, "worklog_lines_appended": 8, "commit_target": "QUEUE-EMPTY-dir29: invalid queue-empty hygiene; open N198/N478d; champion trochoid unchanged"}
{"idea": "NONE_queue_empty_hygiene", "run": 497, "status": "discard", "metrics": {"idea": "NONE_queue_empty_hygiene", "fixture_B_success": 1.0, "fixture_A_success": 1.0, "fixture_R_success": 1.0, "coverage_cont": 1.0, "seeds": 3, "compare": "trochoid", "keep": false, "p_welch": null, "p_fisher": null, "harness_errors": 0, "note": "queue-empty hygiene; canonical rig smoke only (3 seeds); NOT a queued idea; NOT a replay; no synthetic_proxy; no deferred/gpu phrase; no retired family cited; N198/N478d open_needs_director; physical results from results/aegis_v2/health_check_queue_empty_run497.jsonl", "synthetic_proxy": null, "rig_file": "results/aegis_v2/health_check_queue_empty_run497.jsonl"}, "timestamp": 1766672100}
{"idea": "QUEUE-EMPTY-dir30", "run": 520, "status": "invalid", "metrics": {"idea": "QUEUE-EMPTY-dir30", "run": 520, "fixture_B_transfer_success": 1.0, "fixture_B_coverage_cont": 1.0, "fixture_A_coverage_cont": 1.0, "seeds": 3, "harness_errors": 0, "backend": "pybullet", "force_pi": false, "mean_press_n": 0.5, "pose_noise_cfg": "0,0", "compare": null, "welch_p_coverage": null, "fisher_p_success": null, "status": "invalid", "note": "queue-empty hygiene: no queued idea (\u00a71 all done; N198/N478d open_needs_director). 3-seed physical smoke on champion trochoid (not paired decider). No arithmetic/teleport/estimate; coverage from physics contacts only; synthetic_proxy excluded; no deferred/remote phrase; anchored kill executed; G3 replay refused (no proposal); segment 15 freeze unchanged; champion trochoid B 1.00 Fisher p=0.0083 vs raster unchanged."}}
{"run": 521, "segment": 15, "idea": "N479-DA-FACC", "idea_short": "N479 replay (DA-FACC / SEAF / deformable affordance flow): G3-retired eq78/flow-bridge/energy-gated family refusal; no new mechanism axis", "timestamp_utc": "2026-10-02T16:13:00Z", "status": "discard", "metric": null, "metric_name": "fixture_B transfer_success (canonical rig); replay refused \u2014 no 20-seed paired decider", "metric_class": "physical (3-seed champion smoke only); synthetic_proxy explicitly NOT used for status", "refused_proposal": {"label": "DA-FACC (Deformable-Affordance FACC)", "mechanism": "SE(3)-conditioned energy E(force,SE3) deforms affordance manifold; flow-matching replaced by equivariant energy sample; pi0 action-expert on deformed manifold", "predicted_score": 74, "refusal_reason": "G3 permanently retired (N70-N76 / eq78 / manifold-switch / flow-bridge / energy-gated / EBM / SE3 / DAEF / FACC / SEAFC / SEAF / VMEAF). DA-FACC is label rotation of SEAF (refused r497). PATH_MODES has no injectable SE3/energy/affordance hook (only RESIDUAL_HOOK_FN I3-owned). No evidence artifact = no keep per G7."}, "compare": {"champion": "trochoid", "candidate": "N479-DA-FACC", "compare_run": false, "keep": false, "reason": "Replay refused (G3); no 20-seed paired decider executed; no p-value claimed; physical smoke only", "welch_p_coverage_cont": null, "fisher_p_success": null}, "rig_invoked": true, "rig_exit": 0, "rig_bytes_changed": false, "rig_md5": "ce401a0293b695b7b56c066024c1003f", "harness_errors": 0, "episodes": 6, "unvalidated_rows_consumed": 0, "physical_action_taken": "3-seed smoke on champion trochoid (experiments/kaggle_aegis_sweep.py --seeds 3 --path trochoid --compare trochoid --no-upload) ~2.0s CPU; 6 SUCCESS; harness_errors=0; anchored kill executed; no deferred/remote phrase.", "g3_refusal": true, "g7_integrity": "No arithmetic on coverage/success; no teleport; no synthetic proxy cited as evidence; worklog append-only.", "segment_freeze": 15, "champion_status": "trochoid B=1.00 Fisher p=0.0083 vs raster (unchanged)", "queue_state": {"queued": [], "open_needs_director": ["N198", "N478d"], "refused_replay": "N479-DA-FACC = SEAF retired family"}, "evidence_artifacts": ["results/aegis_v2/N521_queue_refuse_N479_DA-FACC_smoke.jsonl", "autoresearch_research.ideas.md \u00a71 (empty queue)", "autoresearch_research.jsonl run 497 (N479 SEAF refusal reference)"], "next_frontier": "N198 / N478d remain open_needs_director; champion saturated at B=1.00; segment 15 freeze holds; no new queued idea.", "compliance": {"segment": 15, "primary_metric": "fixture_B transfer_success", "statuses_used": ["discard"], "synthetic_proxy_used": false, "banned_phrases_used": false, "gate_changed": false, "segment_opened": false, "metric_moved": false, "edge_budget": "no learned policy; CPU only; no GPU/deferred", "disk_free_gb_approx": 74}}
{"run": 522, "segment": 15, "idea": "EEAF-FACC", "idea_short": "EEAF-FACC / SE(3)-Equivariant Energy Affordance Field + FACC replay refusal (G3-retired eq78/energy-gated/SE3/family)", "timestamp_utc": "2026-10-02T16:15:00Z", "status": "discard", "metric_name": "fixture_B transfer_success (canonical rig); replay refused \u2014 no 20-seed paired decider", "metric_class": "physical (3-seed champion smoke only); synthetic_proxy explicitly NOT used for status", "refused_proposal": {"label": "EEAF-FACC (SE(3)-Equivariant Energy Affordance Field + FACC)", "mechanism": "SE(3)-conditioned energy E(force,SE3) deforms affordance manifold; flow-matching replaced by equivariant energy sample; pi0 action-expert on deformed manifold; same family as DA-FACC / SEAF / FACC", "predicted_score": 76, "refusal_reason": "G3 permanently retired (N70-N76 / eq78 / manifold-switch / flow-bridge / energy-gated / EBM / SE3 / DAEF / FACC / SEAFC / SEAF / VMEAF / EEAF-FACC). No new mechanism axis in PATH_MODES / KNOB_GLOBALS. Previous refusal at run 521 (N479 DA-FACC) identical family. No evidence artifact -> no keep per G7."}, "compare": {"champion": "trochoid", "candidate": "EEAF-FACC", "compare_run": false, "keep": false, "reason": "Replay refused (G3); no 20-seed paired decider executed; no p-value claimed; physical smoke only on champion", "welch_p_coverage_cont": null, "fisher_p_success": null}, "rig_invoked": true, "rig_exit": 0, "rig_bytes_changed": false, "rig_md5": "ce401a0293b695b7b56c066024c1003f", "harness_errors": 0, "episodes": 6, "unvalidated_rows_consumed": 0, "physical_action_taken": "3-seed smoke on champion trochoid (experiments/kaggle_aegis_sweep.py --seeds 3 --path trochoid --compare trochoid --no-upload --out results/aegis_v2/N522_queue_refuse_EEAF-FACC_smoke.jsonl) ~2.3s CPU; 6 SUCCESS; fixture_B mean_coverage_cont=1.0; harness_errors=0; anchored kill executed; no deferred/remote phrase; no synthetic_proxy cited.", "g3_refusal": true, "g7_integrity": "No arithmetic on coverage/success; no teleport; no synthetic proxy cited as evidence; worklog append-only.", "segment_freeze": 15, "champion_status": "trochoid B=1.00 Fisher p=0.0083 vs raster (unchanged)", "queue_state": {"queued": [], "open_needs_director": ["N198", "N478d"], "refused_replay": "EEAF-FACC = G3 retired family (same as N479 DA-FACC / SEAF)"}, "evidence_artifacts": ["results/aegis_v2/N522_queue_refuse_EEAF-FACC_smoke.jsonl", "autoresearch_research.ideas.md \u00a71 (empty queue)", "autoresearch_research.jsonl run 521 (N479 SEAF refusal reference)"], "next_frontier": "N198 / N478d remain open_needs_director; champion saturated at B=1.00; segment 15 freeze holds; no new queued idea; next iteration must be a NEW mechanism axis or director-authorised open_needs_director.", "compliance": {"segment": 15, "primary_metric": "fixture_B transfer_success", "statuses_used": ["discard"], "synthetic_proxy_used": false, "banned_phrases_used": false, "gate_changed": false, "segment_opened": false, "metric_moved": false, "edge_budget": "no learned policy; CPU only; no GPU/deferred; <500M params / <1.5GB / <25ms irrelevant (no policy)", "disk_free_gb_approx": 74}}
