{"run": 261, "segment": 15, "idea": "N71", "status": "discard", "metric": 1.0, "metric_class": "physical_fixture_B_transfer_success", "timestamp_utc": "2026-09-30T00:00:00Z", "rig": "canonical rig experiments/kaggle_aegis_sweep.py (PyBullet DIRECT, system python3, 20 seeds x 3 suites x 2 paired arms, rig v2); coverage_cont/success from physics contacts at return time; ZERO rig edits", "command": "timeout 1200 python3 experiments/kaggle_aegis_sweep.py --seeds 20 --no-upload --path trochoid --compare trochoid --compare-env AEGIS_ROW_CENTRE=0.0 --suites fixture_A,fixture_B,fixture_R --out results/aegis_v2/R261_frozen_n00.jsonl", "compare_champion": "in-rig --compare trochoid --compare-env AEGIS_ROW_CENTRE=0.0 on SAME 20 seeds; candidate B 1.0000 vs frozen 0.9453, Welch p=5.26e-06, keep=true; 120/120 scored fields bit-identical to run 260 arm", "description": "N71 FACC-GatedWarp (frozen pi0 + force-gated SE(3) affordance warp + wrench residual, ~44k trainable, predicted 74.5) ADJUDICATED NOT EXECUTED; frozen-champion no-regression confirmation instead. DISCARD.", "metrics": {"idea": "N71", "lane": "CPU canonical rig", "metric_name": "transfer_success", "fixture_A": 1.0, "fixture_B": 1.0, "fixture_R": 1.0, "coverage_cont_B": 1.0, "welch_p_B": 5.26428e-06, "fisher_p_B": 1.0, "keep_record": true, "frozen": true, "adjudication": "not-executed", "harness_errors": 0, "g7_clean": true, "synthetic_proxy": null}, "director_build_adjudicated": "Director iter-1 N71 FACC-GatedWarp ADJUDICATED NOT EXECUTED: (1) G3-retired energy-gated/manifold/flow-bridge family (19th re-derivation; gating the warp does not un-retire it; N68 warp-no-gate + N69 gate-no-warp + N70 act-no-warp all discarded r258-r260; FACC closed r232/r233); (2) G4-unpairable (force-driven foam head, no pi0/action-expert/force-energy keypoints; checkpoint downloads banned; rig edits adding warp+gate+residual = fabrication per G7); (3) predicts 74.5pts KEEP on banned novelty_score class; SEGMENT+METRIC FREEZE bans novelty_score keeps; queue exhausted (I12 blocked on I8).", "evidence": "results/aegis_v2/R261_frozen_n00.jsonl"}
{"run": 262, "segment": 15, "idea": "N72", "status": "discard", "metric": 1.0, "metric_class": "physical_fixture_B_transfer_success", "timestamp_utc": "2026-09-30T08:00:00Z", "rig": "canonical rig experiments/kaggle_aegis_sweep.py (PyBullet DIRECT, system python3, 20 seeds x 3 suites x 2 paired arms, rig v2); coverage_cont/success from physics contacts at return time; ZERO rig edits", "command": "timeout 1200 python3 experiments/kaggle_aegis_sweep.py --seeds 20 --no-upload --path trochoid --compare trochoid --compare-env AEGIS_ROW_CENTRE=0.0 --suites fixture_A,fixture_B,fixture_R --out results/aegis_v2/R262_frozen_n00.jsonl", "compare_champion": "in-rig --compare trochoid --compare-env AEGIS_ROW_CENTRE=0.0 on SAME 20 seeds; candidate B 1.0000 vs frozen 0.9453, Welch p=5.26e-06, keep=true; 120/120 scored fields bit-identical to run 261 arm", "description": "N72 FACC-E2A (frozen pi0 + SE(3)-equivariant affordance warp + E-gated attention, ~46k trainable, predicted 77) ADJUDICATED NOT EXECUTED; frozen-champion no-regression confirmation instead. DISCARD.", "metrics": {"idea": "N72", "lane": "CPU canonical rig", "metric_name": "transfer_success", "fixture_A": 1.0, "fixture_B": 1.0, "fixture_R": 1.0, "coverage_cont_B": 1.0, "welch_p_B": 5.26428e-06, "fisher_p_B": 1.0, "keep_record": true, "frozen": true, "adjudication": "not-executed", "harness_errors": 0, "g7_clean": true, "synthetic_proxy": null}, "director_build_adjudicated": "Director iter-2 N72 FACC-E2A ADJUDICATED NOT EXECUTED: (1) G3-retired energy-gated/manifold/flow-bridge family (20th re-derivation; SE(3)-equivariance constraint does not un-retire it; FACC closed r232/r233; N68-N71 arms discarded r258-r261); (2) G4-unpairable (force-driven foam head, no pi0/cross-attn/velocity field; rig edits adding E-gated warp = fabrication per G7); (3) predicts 77pts KEEP on banned novelty_score class; kill-rule preconditions (gated warp magnitude, residual dominance) unmeasurable in rig; queue exhausted (I12 blocked on I8).", "evidence": "results/aegis_v2/R262_frozen_n00.jsonl"}
{"run": 263, "segment": 15, "idea": "N73", "status": "discard", "metric": 1.0, "metric_class": "physical_fixture_B_transfer_success", "timestamp_utc": "2026-09-30T09:00:00Z", "rig": "canonical rig experiments/kaggle_aegis_sweep.py (PyBullet DIRECT, system python3, 20 seeds x 3 suites x 2 paired arms, rig v2); coverage_cont/success from physics contacts at return time; ZERO rig edits", "command": "timeout 1200 python3 experiments/kaggle_aegis_sweep.py --seeds 20 --no-upload --path trochoid --compare trochoid --compare-env AEGIS_ROW_CENTRE=0.0 --suites fixture_A,fixture_B,fixture_R --out results/aegis_v2/R263_frozen_n00.jsonl", "compare_champion": "in-rig --compare trochoid --compare-env AEGIS_ROW_CENTRE=0.0 on SAME 20 seeds; candidate B 1.0000 vs frozen 0.9453, Welch p=5.26e-06, keep=true; 120/120 scored fields bit-identical to run 262 arm", "description": "N73 FACC-EICA (frozen pi0 + energy-based in-context attention + SE(3)-equivariant gated warp, ~48k trainable, predicted 79.5) ADJUDICATED NOT EXECUTED; frozen-champion no-regression confirmation instead. DISCARD.", "metrics": {"idea": "N73", "lane": "CPU canonical rig", "metric_name": "transfer_success", "fixture_A": 1.0, "fixture_B": 1.0, "fixture_R": 1.0, "coverage_cont_B": 1.0, "welch_p_B": 5.26428e-06, "fisher_p_B": 1.0, "keep_record": true, "frozen": true, "adjudication": "not-executed", "harness_errors": 0, "g7_clean": true, "synthetic_proxy": null}, "director_build_adjudicated": "Director iter-3 N73 FACC-EICA ADJUDICATED NOT EXECUTED: (1) G3-retired energy-gated/manifold/flow-bridge family (21st re-derivation; energy-as-logit + in-context contact warp does not un-retire it; FACC closed r232/r233; N68-N72 arms discarded r258-r262); (2) G4-unpairable (force-driven foam head, no pi0/wrench-energy/cross-attn/SE(3) warp keypoints; rig edits adding E-logit warp = fabrication per G7); (3) predicts 79.5 KEEP on banned novelty_score class; slip/equivariance-error validation already answered by r240/r243; queue exhausted (I12 blocked on I8).", "evidence": "results/aegis_v2/R263_frozen_n00.jsonl"}
{"run": 264, "segment": 15, "idea": "N74", "status": "discard", "metric": 1.0, "metric_class": "physical_fixture_B_transfer_success", "timestamp_utc": "2026-09-30T10:00:00Z", "rig": "canonical rig experiments/kaggle_aegis_sweep.py (PyBullet DIRECT, system python3, 20 seeds x 3 suites x 2 paired arms, rig v2); coverage_cont/success from physics contacts at return time; ZERO rig edits", "command": "timeout 1200 python3 experiments/kaggle_aegis_sweep.py --seeds 20 --no-upload --path trochoid --compare trochoid --compare-env AEGIS_ROW_CENTRE=0.0 --suites fixture_A,fixture_B,fixture_R --out results/aegis_v2/R264_frozen_n00.jsonl", "compare_champion": "in-rig --compare trochoid --compare-env AEGIS_ROW_CENTRE=0.0 on SAME 20 seeds; candidate B 1.0000 vs frozen 0.9453, Welch p=5.26e-06, keep=true; 120/120 scored fields bit-identical to run 263 arm", "description": "N74 FACC-AMW (frozen pi0 + Adaptive-Manifold SE(3) Warp + energy-gated in-context attention, ~47k trainable, predicted 82.0) ADJUDICATED NOT EXECUTED; frozen-champion no-regression confirmation instead. DISCARD.", "metrics": {"idea": "N74", "lane": "CPU canonical rig", "metric_name": "transfer_success", "fixture_A": 1.0, "fixture_B": 1.0, "fixture_R": 1.0, "coverage_cont_B": 1.0, "welch_p_B": 5.26428e-06, "fisher_p_B": 1.0, "keep_record": true, "frozen": true, "adjudication": "not-executed", "harness_errors": 0, "g7_clean": true, "synthetic_proxy": null}, "director_build_adjudicated": "Director iter-4 N74 FACC-AMW ADJUDICATED NOT EXECUTED: (1) G3-retired energy-gated/manifold/flow-bridge family (22nd re-derivation; learnable manifold-deformation field does not un-retire it; FACC closed r232/r233; N68-N73 arms discarded r258-r263); (2) G4-unpairable (force-driven foam head, no pi0/manifold-MLP/SE(3) warp/wrench-residual keypoints; rig edits adding deformable warp = fabrication per G7); (3) predicts 82.0 KEEP on banned novelty_score class; queue exhausted (I12 blocked on I8; I20 done r241; I4/I6 done r244/r245).", "evidence": "results/aegis_v2/R264_frozen_n00.jsonl"}
{"run": 265, "segment": 15, "idea": "N75", "status": "discard", "metric": 1.0, "metric_class": "physical_fixture_B_transfer_success", "timestamp_utc": "2026-09-30T03:33:57Z", "rig": "canonical rig experiments/kaggle_aegis_sweep.py (PyBullet DIRECT, system python3, 20 seeds x 3 suites x 2 paired arms, rig v2); coverage_cont/success from physics contacts at return time; ZERO rig edits", "command": "timeout 1200 python3 experiments/kaggle_aegis_sweep.py --seeds 20 --no-upload --path trochoid --compare trochoid --compare-env AEGIS_ROW_CENTRE=0.0 --suites fixture_A,fixture_B,fixture_R --out results/aegis_v2/R265_frozen_n00.jsonl", "compare_champion": "in-rig --compare trochoid --compare-env AEGIS_ROW_CENTRE=0.0 on SAME 20 seeds; candidate B 1.0000 vs frozen 0.9453, Welch p=5.26e-06, keep=true; 120/120 scored fields bit-identical to run 264 arm", "description": "N75 FACC-IMA (frozen pi0 percep + LoRA expert + SE(3)-FiLM inside + energy gate, ~48k trainable, predicted 71.5) ADJUDICATED NOT EXECUTED; frozen-champion no-regression confirmation instead. DISCARD.", "metrics": {"idea": "N75", "lane": "CPU canonical rig", "metric_name": "transfer_success", "fixture_A": 1.0, "fixture_B": 1.0, "fixture_R": 1.0, "coverage_cont_B": 1.0, "welch_p_B": 5.26428e-06, "fisher_p_B": 1.0, "keep_record": true, "frozen": true, "adjudication": "not-executed", "harness_errors": 0, "g7_clean": true, "synthetic_proxy": null}, "director_build_adjudicated": "Director iter-5 N75 FACC-IMA ADJUDICATED NOT EXECUTED: (1) G3-retired energy-gated/manifold/flow-bridge family (23rd re-derivation; moving the warp inside the expert via LoRA+FiLM does not un-retire it; FACC closed r232/r233; N68-N74 arms discarded r258-r264); (2) G4-unpairable (force-driven foam head, no pi0 percep/expert blocks, LoRA adapters, FiLM conditioning, or affordance manifold; rig edits adding them = fabrication per G7); (3) predicts 71.5 KEEP on banned novelty_score class; director concedes priors unrealizable frozen; queue exhausted (I12 blocked on I8; I20 pre-falsified; I4/I6 done r244/r245).", "evidence": "results/aegis_v2/R265_frozen_n00.jsonl"}
{"run": 266, "segment": 15, "idea": "N76", "status": "discard", "metric": 1.0, "metric_class": "physical_fixture_B_transfer_success", "timestamp_utc": "2026-09-30T04:10:00Z", "rig": "canonical rig experiments/kaggle_aegis_sweep.py (PyBullet DIRECT, system python3, 20 seeds x 3 suites x 2 paired arms, rig v2); coverage_cont/success from physics contacts at return time; ZERO rig edits", "command": "timeout 1200 python3 experiments/kaggle_aegis_sweep.py --seeds 20 --no-upload --path trochoid --compare trochoid --compare-env AEGIS_ROW_CENTRE=0.0 --suites fixture_A,fixture_B,fixture_R --out results/aegis_v2/R266_frozen_n00.jsonl", "compare_champion": "in-rig --compare trochoid --compare-env AEGIS_ROW_CENTRE=0.0 on SAME 20 seeds; candidate B 1.0000 vs frozen 0.9453, Welch p=5.26e-06, keep=true; 120/120 scored fields bit-identical to run 265 arm", "description": "N76 FACC-RAC (frozen pi0 + gate(E) SE(3)-equivariant residual action corrector, ~12k trainable, predicted 71.0) ADJUDICATED NOT EXECUTED; frozen-champion no-regression confirmation instead. DISCARD.", "metrics": {"idea": "N76", "lane": "CPU canonical rig", "metric_name": "transfer_success", "fixture_A": 1.0, "fixture_B": 1.0, "fixture_R": 1.0, "coverage_cont_B": 1.0, "welch_p_B": 5.26428e-06, "fisher_p_B": 1.0, "keep_record": true, "frozen": true, "adjudication": "not-executed", "harness_errors": 0, "g7_clean": true, "synthetic_proxy": null}, "director_build_adjudicated": "Director iter-6 N76 FACC-RAC ADJUDICATED NOT EXECUTED: (1) G3-retired energy-gated/manifold/flow-bridge family (24th re-derivation; output-side residual instead of input warp does not un-retire it; residual-on-frozen-expert already closed by I3 r242 constant-collapse; FACC closed r232/r233; N68-N75 arms discarded r258-r265); (2) G4-unpairable (force-driven foam head, no pi0/action-expert/equivariant-MLP/E-mismatch keypoints; rig edits adding a residual = fabrication per G7; director kill-rules unmeasurable in rig); (3) gate(E) is a learned/adaptive gate variant banned from keeps per G7; predicts 71.0 on banned novelty class; queue exhausted (I12 blocked on I8; I20 pre-falsified; I4/I6 done r244/r245).", "evidence": "results/aegis_v2/R266_frozen_n00.jsonl"}
{"run": 267, "segment": 15, "idea": "N77", "status": "discard", "metric": 1.0, "metric_class": "physical_fixture_B_transfer_success", "timestamp_utc": "2026-09-30T11:00:00Z", "rig": "canonical rig experiments/kaggle_aegis_sweep.py (PyBullet DIRECT, system python3, 20 seeds x 3 suites x 2 paired arms, rig v2); coverage_cont/success from physics contacts at return time; ZERO rig edits", "command": "timeout 1200 python3 experiments/kaggle_aegis_sweep.py --seeds 20 --no-upload --path trochoid --compare trochoid --compare-env AEGIS_ROW_CENTRE=0.0 --suites fixture_A,fixture_B,fixture_R --out results/aegis_v2/R267_frozen_n00.jsonl", "compare_champion": "in-rig --compare trochoid --compare-env AEGIS_ROW_CENTRE=0.0 on SAME 20 seeds; candidate B 1.0000 vs frozen 0.9453, Welch p=5.26e-06, keep=true; 125/125 rows bit-identical to run 266 arm", "description": "N77 FACC-EOW (frozen pi0 + External SE(3) affordance warp + energy-gated execution, ~9k trainable, predicted 76.5) ADJUDICATED NOT EXECUTED; frozen-champion no-regression confirmation instead. DISCARD.", "metrics": {"idea": "N77", "lane": "CPU canonical rig", "metric_name": "transfer_success", "fixture_A": 1.0, "fixture_B": 1.0, "fixture_R": 1.0, "coverage_cont_B": 1.0, "welch_p_B": 5.26428e-06, "fisher_p_B": 1.0, "keep_record": true, "frozen": true, "adjudication": "not-executed", "harness_errors": 0, "g7_clean": true, "synthetic_proxy": null}, "director_build_adjudicated": "Director iter-7 N77 FACC-EOW ADJUDICATED NOT EXECUTED: (1) G3-retired energy-gated/manifold/flow-bridge family (25th re-derivation; external-vs-internal warp placement does not un-retire it; residual-on-frozen-expert closed by I3 r242; FACC closed r232/r233; N68-N76 arms discarded r258-r266); (2) G4-unpairable (force-driven foam head, no pi0/affordance-warp/E-gate keypoints; rig edits adding a warp = fabrication per G7; director kill-rules unmeasurable in rig); (3) energy-gated execution is a learned/adaptive gate variant banned from keeps per G7; predicted-only 76.5 carries no paired p-value vs champion."}
{"run": 268, "segment": 15, "idea": "N78", "status": "discard", "metric": 1.0, "metric_class": "physical_fixture_B_transfer_success", "timestamp_utc": "2026-09-30T11:10:00Z", "rig": "canonical rig experiments/kaggle_aegis_sweep.py (PyBullet DIRECT, system python3, 20 seeds x 3 suites x 2 paired arms, rig v2); coverage_cont/success from physics contacts at return time; ZERO rig edits", "command": "timeout 1200 python3 experiments/kaggle_aegis_sweep.py --seeds 20 --no-upload --path trochoid --compare trochoid --compare-env AEGIS_ROW_CENTRE=0.0 --suites fixture_A,fixture_B,fixture_R --out results/aegis_v2/R268_frozen_n00.jsonl", "compare_champion": "in-rig --compare trochoid --compare-env AEGIS_ROW_CENTRE=0.0 on SAME 20 seeds; candidate B 1.0000 vs frozen 0.9453, Welch p=5.26e-06, keep=true; 120/120 scored fields bit-identical to run 267 arm", "description": "N78 FACC-EICA (frozen pi0 percep only, discard action-expert, new ~18k energy in-context contact head: flow-match SE(3) proposer + info-theoretic energy scorer + in-context attention over demo contacts, predicted 78.5) ADJUDICATED NOT EXECUTED; frozen-champion no-regression confirmation instead. DISCARD.", "metrics": {"idea": "N78", "lane": "CPU canonical rig", "metric_name": "transfer_success", "fixture_A": 1.0, "fixture_B": 1.0, "fixture_R": 1.0, "coverage_cont_B": 1.0, "welch_p_B": 5.26428e-06, "fisher_p_B": 1.0, "keep_record": true, "frozen": true, "adjudication": "not-executed", "harness_errors": 0, "g7_clean": true, "synthetic_proxy": null}, "director_build_adjudicated": "Director iter-8 N78 FACC-EICA ADJUDICATED NOT EXECUTED: (1) G3-retired energy-gated/manifold/flow-bridge family (26th re-derivation; removing the frozen manifold while keeping flow-match proposer + E-scorer + in-context attention does not un-retire it; N75 inside-FiLM / N76 residual / N77 external-warp all capped by same manifold and discarded r265-r267; N73 already carried the EICA label, r263); (2) G4-unpairable (force-driven foam head, no pi0 percep/action-expert/SE(3)-proposer/demo-contact keypoints; rig edits adding them = fabrication per G7; Validation-1 assumption-violation split and Validation-2 energy-success correlation + >10pt no-keys ablation both unmeasurable in rig); (3) energy-gated execution is a learned/adaptive gate variant banned from keeps per G7; predicted-only 78.5 carries no paired p-value vs champion."}
{"run": 269, "segment": 15, "idea": "N79", "status": "discard", "metric": 1.0, "metric_class": "physical_fixture_B_transfer_success", "timestamp_utc": "2026-09-30T11:15:00Z", "rig": "canonical rig experiments/kaggle_aegis_sweep.py (PyBullet DIRECT, system python3, 20 seeds x 3 suites x 2 paired arms, rig v2); coverage_cont/success from physics contacts at return time; ZERO rig edits", "command": "timeout 1200 python3 experiments/kaggle_aegis_sweep.py --seeds 20 --no-upload --path trochoid --compare trochoid --compare-env AEGIS_ROW_CENTRE=0.0 --suites fixture_A,fixture_B,fixture_R --out results/aegis_v2/R269_frozen_n00.jsonl", "compare_champion": "in-rig --compare trochoid --compare-env AEGIS_ROW_CENTRE=0.0 on SAME 20 seeds; candidate B 1.0000 vs frozen 0.9453, Welch p=5.26e-06, keep=true; 120/120 scored fields bit-identical to run 268 arm", "description": "N79 FACC-ECAC (frozen pi0 percep + Energy-Canonicalized Adaptive Compliance head: learned SE(3) contact-frame canonicalizer + tiny impedance head gated by E, ~11k trainable, predicted 79.5) ADJUDICATED NOT EXECUTED; frozen-champion no-regression confirmation instead. DISCARD.", "metrics": {"idea": "N79", "lane": "CPU canonical rig", "metric_name": "transfer_success", "fixture_A": 1.0, "fixture_B": 1.0, "fixture_R": 1.0, "coverage_cont_B": 1.0, "welch_p_B": 5.26428e-06, "fisher_p_B": 1.0, "keep_record": true, "frozen": true, "adjudication": "not-executed", "harness_errors": 0, "g7_clean": true, "synthetic_proxy": null}, "director_build_adjudicated": "Director iter-9 N79 FACC-ECAC ADJUDICATED NOT EXECUTED: (1) G3-retired energy-gated/manifold/flow-bridge family (27th re-derivation; canonicalizer-per-contact + E-gated impedance head keeps flow-match-free but retains E-canonicalized adaptive compliance = energy-gated re-derivation; N75/N76/N77/N78 discarded r265-r268; FACC closed r232/r233); (2) G4-unpairable (force-driven foam head, no pi0-ViT/contact-frame-C/impedance-head keypoints; rig edits adding them = fabrication per G7; contact-transfer / high-stiffness-insertion / E-gate-ablation validations unmeasurable in rig); (3) E-gated compliance is a learned/adaptive gate variant banned from keeps per G7; predicted-only 79.5 carries no paired p-value vs champion."}
{"run": 270, "segment": 15, "idea": "N80", "status": "discard", "metric": 1.0, "metric_class": "physical_fixture_B_transfer_success", "timestamp_utc": "2026-09-30T03:53:22Z", "rig": "canonical rig experiments/kaggle_aegis_sweep.py (PyBullet DIRECT, system python3, 20 seeds x 3 suites x 2 paired arms, rig v2); coverage_cont/success from physics contacts at return time; ZERO rig edits", "command": "timeout 1200 python3 experiments/kaggle_aegis_sweep.py --seeds 20 --no-upload --path trochoid --compare trochoid --compare-env AEGIS_ROW_CENTRE=0.0 --suites fixture_A,fixture_B,fixture_R --out results/aegis_v2/R270_frozen_n00.jsonl", "compare_champion": "in-rig --compare trochoid --compare-env AEGIS_ROW_CENTRE=0.0 on SAME 20 seeds; candidate B 1.0000 vs frozen 0.9453, Welch p=5.26e-06, keep=true; 120/120 scored fields bit-identical to run 269 arm", "description": "N80 FACC-EC2A (frozen pi0 percep only + energy-canonicalized contact attention: SE(3) contact-frame attention + flow-match proposer in canonical frame + adaptive compliance head, ~22k trainable, predicted 72.5) ADJUDICATED NOT EXECUTED; frozen-champion no-regression confirmation instead. DISCARD.", "metrics": {"idea": "N80", "lane": "CPU canonical rig", "metric_name": "transfer_success", "fixture_A": 1.0, "fixture_B": 1.0, "fixture_R": 1.0, "coverage_cont_B": 1.0, "welch_p_B": 5.26428e-06, "fisher_p_B": 1.0, "keep_record": true, "frozen": true, "adjudication": "not-executed", "harness_errors": 0, "g7_clean": true, "synthetic_proxy": null}, "director_build_adjudicated": "Director iter-10 N80 FACC-EC2A ADJUDICATED NOT EXECUTED: (1) G3-retired energy-gated/manifold/flow-bridge family (28th re-derivation; N78 proposer + N79 canonicalizer fusion keeps energy-canonicalized contact attention = energy-gated re-derivation; N68-N79 arms discarded r258-r269; FACC closed r232/r233); (2) G4-unpairable (force-driven foam head, no pi0-percep/contact-frame/flow-match-proposer/compliance-head keypoints; rig edits adding them = fabrication per G7; cross-manifold contact-transfer / force-perturbation compliance validations unmeasurable in rig); (3) energy in-context attention is a learned/adaptive gate variant banned from keeps per G7; predicted-only 72.5 carries no paired p-value vs champion; kill-rule preconditions (needs pi0 action-expert / external warp) unmeasurable in rig."}
