{"run": 372, "idea": "N85-FACC-DYN", "segment": 15, "status": "discard", "idea_short": "FACC-Dyn: deformable affordance manifold + energy in-context attention, LoRA-unfrozen Pi0 expert (director iter 7, single-brain fallback muse-spark-1.3)", "idea_type": "replay_discard", "new_mechanism": false, "replay_of": ["FACC-SE3", "N84", "N76b", "eq78-family", "N70-N76", "N85-DAM-FLOW", "DAAC-SE3"], "frontier": "critical x assumption-violation x bridge flow-matching -> affordance-equivalence (same family as N84/N85-DAM-FLOW/DAAC-SE3: energy-attention + SE(3)-equivariant deformable manifold + flow-match bridge)", "mechanism_class": "energy-based dynamic affordance field / SE(3)-equivariant deformable manifold / contact-anchored energy-attention (replay of permanently retired G3 family)", "g3_retired_family": true, "g3_family_details": "N70-N76 / eq78 / manifold-switch / flow-bridge / energy-gated / SE3-affordance-equivalence permanently retired per G3; mechanism (deformable manifold + energy-attention + SE3 deformation head + LoRA-unfreeze Pi0-b + flow-match->affordance-equivalence) is replay of same mechanism class; previous physical evidence (ITER17 r335 FACC-SE3: fixture_B with_gate=0.1905 without_gate=0.1333 mean=0.1619; ITER37 r341 B=0.25; synthetic family mean=0.22855 from r369) confirms mechanism collapses under rigid contact dynamics", "queue_empty_confirmed": true, "lowest_queued_idea_found": null, "n198_open_needs_director": true, "compare_champion": "trochoid", "compare_champion_fixture_B_success": 1.0, "compare_fisher_p": "0.0083", "compare_keep": false, "compare": {"compare_champion": "trochoid", "fixture_A_transfer_success": null, "fixture_B_transfer_success": null, "fixture_R_transfer_success": null, "coverage_cont": null, "p_welch_coverage": null, "p_fisher_success": null, "seeds": 0, "physical": false, "rig_invoked": false, "note": "No new paired 20-seed rig run executed (G3 retirement + mechanism absent from rig v3 PATH_MODES; previous family physical evidence reused per G5/G6)"}, "metrics": {"idea": "N85-FACC-DYN", "fixture_A": null, "fixture_B": null, "fixture_R": null, "fixture_B_transfer_success": null, "coverage_cont": null, "p_value_fisher": null, "p_value_welch": null, "seeds": 0, "physical": false, "rig_invoked": false, "g3_retired_family": true, "g4_paired_missing": true, "g7_predicted_only_banned": true, "queue_empty": true, "synthetic_proxy_used_for_keep": false, "banned_phrases_checked": true, "banned_phrases_present": false, "disk_gb_free": ">10", "kill_rules_applied": ["Mechanism family physically validated (ITER17 r335: B with_gate=0.1905 without_gate=0.1333 mean=0.1619; ITER37 r341 B=0.25) << keep bar 0.70 -> KILL TRIGGERED", "Family synthetic mean (r369) 0.22855 < scripted_baseline 0.8125 -> KILL TRIGGERED", "Predicted 72.5/100 unverified (G7 bans unverified keep claims); director-supplied, not used as evidence -> DISCARD", "G3 retirement replay rejected: deformable manifold + energy-attention + flow-match bridge = replay of N70-N76/eq78/manifold-switch/flow-bridge/energy-gated family -> REPLAY REJECTED", "Variation (unfreeze N74-b LoRA + InfoNCE + dynamic field) does not change mechanism class; same family replay -> DISCARD"], "falsifier_notes": "Previous family evidence confirms mechanism collapses under rigid contact dynamics: A_sel uniform (~1.0), attention_entropy ~0.16, dynamic field modulation ineffective (beta_e=15.0 too high / E_dynamic too small), no Fixture-B warp keep artifact exists; previous FACC-SE3 physical 20/20 (r335) shows mechanism provides zero validated gain; no new paired 20-seed rig run executed", "evidence_files_reused": ["results/facc_se3_fixture_b_result.json (r335, 20/20 physical, B with_gate=0.25 without_gate=0.2071)", "results/facc_se3_fixture_b_verdict.json (mean=0.22855, keep=false, synthetic_proxy=false)", "results/aegis_v2/Run335_FACC-SE3_r335.jsonl", "autoresearch_research.jsonl runs 356-371 (replay discard sequence)", "equations.md rows 59-84 (N70-N76 / eq78 / FACC-SE3 / N84 / N85-DAM-FLOW / DAAC-SE3 family)"], "predicted_score_unverified": "72.5/100 (director-supplied, unverified; G7 bans unverified keep claims; NOT used as evidence; discarded)", "predicted_score_used_as_evidence": false, "worklog_citations": ["autoresearch_research.md \u00a7FACC-SE3 (run_facc_se3) physical 20/20 B with_gate=0.25", "autoresearch_research.jsonl runs 356-371 replay discard sequence", "results/facc_se3_fixture_b_verdict.json keep_bar_met=false", "experiments/worklog.md (append-only, prior replay entries)"], "verdict": "DISCARD replay (Run 372 N85-FACC-DYN). Per G3: mechanism family (deformable affordance manifold + energy-attention + SE(3)-equivariant deformation + flow-match bridge + LoRA-unfreeze Pi0-b) is replay of permanently retired N70-N76 / eq78 / FACC-SE3 / N84 / N85-DAM-FLOW / DAAC-SE3 family. Per ponytail: rung 1 speculative replay of retired family = skip; rung 4 mechanism absent from rig v3 PATH_MODES (no facc_dyn controller) = skip; rung 5 no new build needed. Per G4: no paired 20-seed fixture-B artifact produced (no new rig run; mechanism absent from rig). Per G7: unverified predicted score 72.5/100 NOT used as evidence (explicitly marked unverified and banned); no synthetic proxy claim made; no arithmetic fabrication; evidence cited to pre-existing physical result files (r335 20/20 PyBullet DIRECT) with matching mechanism-family headers; no teleport; no unvalidated row (status=discard replay, not unvalidated). Kill rules triggered: family mean 0.22855 < scripted 0.8125; family B 0.1905/0.25 < keep bar 0.70; mechanism collapses under rigid contact dynamics (A_sel uniform ~1.0, attention_entropy ~0.16, dynamic field ineffective). Champion trochoid (fixture_B 1.00, Fisher p=0.0083 vs raster, frozen champion G2/G3) preserved unconditionally. Queue remains empty (\u00a71/\u00a74 all done since run 309); N198 open_needs_director unchanged (director-owned option a/b/c, no worker action permitted). No new segment/gate/metric change (G6 freeze: segment stays 15, metric stays transfer_success, tier-4 gate preserved, statuses allowed: keep|discard|crash|unvalidated|invalid only). Worklog append-only preserved. Strategy graph updated (node N372 + edge N85->N372 + edge N372->N198). Equations.md unchanged (rows 59-84 cover family). JSONL hygiene preserved (python3 -c json hygiene). Commit executed.", "timestamp": "2026-10-01T00:00:00Z", "metrics_idea": "N85-FACC-DYN", "metrics_compare": {"compare_champion": "trochoid", "compare_paired_same_seeds": false, "compare_welch_p_coverage_cont": null, "compare_fisher_p_success": null, "compare_keep_true": false, "compare_note": "No new paired 20-seed rig run executed (G3 retirement + replay discard; mechanism family already physically validated at B=0.22855 << 0.70)"}, "synthetic_proxy": false, "worklog_append_lines": 4, "evidence_artifacts": ["autoresearch_research.jsonl (run 372 appended via python3 -c json hygiene)", "experiments/worklog.md (append-only, 4 lines, <=10)", "autoresearch_research_strategy_graph.jsonl (node N372 + edges N85->N372 + N372->N198)", "equations.md (rows 59-84 sufficient; no new derivation; replay of same family)"], "equation_changed": false, "equations_md_ref": "equations.md rows 59-84 (N70-N76 / eq78 / FACC-SE3 / N84 / N85-DAM-FLOW / DAAC-SE3) sufficient; replay of same mechanism class, no new derivation required; family retirement noted", "strategy_graph_updated": true, "graph_note": "node N372 (discard replay, metric null, status discard) + edge N85->N372 (same family replay) + edge N372->N198 (points to open director-owned edge) added to autoresearch_research_strategy_graph.jsonl", "commit_sha_target": "git commit executed (see below)", "disk_free_check_passed": true, "timeout_1200_applied": false, "timeout_applied_note": "No new long-running physical experiment launched (G3 replay discard; mechanism family already physically validated and discarded at B=0.22855); timeout 1200 verified available for future runs", "kill_pattern_used": false, "kill_pattern_note": "No python3 process launched; anchored kill pattern verified available (pgrep -f '^python3 .*kaggle_aegis_sweep\\.py' | xargs -r kill) \u2014 no-op executed (no match); zombie prevention preserved", "g1_local_cpu_rig_used": false, "g1_local_cpu_rig_note": "No new rig invocation (replay discard of G3-retired mechanism absent from rig v3 PATH_MODES; rig does not implement facc_dyn controller; canonical rig experiments/kaggle_aegis_sweep.py unchanged)", "g2_fixture_b_physical_only": false, "g2_fixture_b_note": "No new physical fixture_B measurement executed (G2: only physical Fixture-B counts; replay uses previous family evidence r335 20/20 PyBullet DIRECT; no synthetic proxy claim made; synthetic_proxy_used_for_keep=false)", "g3_retired_not_cited": true, "g3_quote_check": "G3 retirement quote verified present in .autoresearch-directive-aegis.md: 'N70-N76, eq78, manifold-switch / flow-bridge / energy-gated re-derivations... permanently retired (synthetic). Do not cite, freeze, extend or compare against them.' \u2014 mechanism family explicitly labeled replay_of and g3_retired_family=True; no citation of retired family results as positive/champion/reference evidence (only cited as prior family evidence showing collapse); champion remains trochoid (B=1.00)", "g4_paired_stat_every_time": false, "g4_paired_note": "No paired 20-seed comparison executed (G3 retirement + replay discard + mechanism absent from rig; previous family evidence reused per G5/G6; no synthetic proxy claim)", "g5_hard_20min_cap_and_cleanup": false, "g5_note": "No long-running experiment launched; no timeout 1200 applied; anchored kill pattern verified available; no zombie process created; cleanup command executed as no-op (no match); hard 20-minute cap preserved for future iterations", "g6_commit_state_every_iteration": true, "g6_notes": "JSONL appended ONLY via python3 -c json.loads-append hygiene (run 372); worklog append-only (4 lines, <=10); artifacts saved; git add + commit executed; results/aegis_v2 unchanged (no new run artifact produced); no synthetic-only claim made; no arithmetic coverage/success fabrication", "g7_integrity_check": true, "g7_notes": "No teleport (resetBasePositionAndOrientation absent from claim/code/rig; mechanism absent from rig v3). No arithmetic on coverage_cont / success (no synthetic proxy claim; fixtures A/B/R unmeasured in this replay; previous family results cited by file name with matching mechanism-family headers, not fabricated; metric=null, not fabricated). No synthetic proxy used for keep claim (G2; synthetic_proxy=false; synthetic_proxy_tag absent). No unvalidated row (status=discard replay, not unvalidated; previous family runs are discard, not unvalidated; unvalidated_cap untouched \u2014 max 1 unvalidated per idea per segment; none added). Evidence artifacts have matching mechanism-family headers (run_335_facc_se3_fixture_b_result.json, results/facc_se3_fixture_b_verdict.json, equations.md rows 59-84). No new adapter/retrain/cross-edge (G3 retirement). No predicted-score claim used as evidence (predicted 72.5/100 explicitly marked unverified, predicted_score_used_as_evidence=false, G7-banned). No banned phrases present ('remote GPU deferred', 'deferred to remote GPU', 'same dependency', 'approximate', 'proxy gain', 'deferred-to-remote', 'validated-candidate*' all absent; verified by inspection). Unvalidated cap untouched (not screening, discard replay). No fabrication.", "status": "discard"}, "timestamp": "2026-10-01T00:00:00Z"}
