{"run": 497, "segment": 15, "idea": "N479-FORCE-PI-CLOSED-LOOP-PRESS", "timestamp": "2026-10-02T18:20:00Z", "idea_short": "N479: dose the only never-run mechanism axis in the rig (AEGIS_FORCE_PI / FN_SET / FN_KP / FN_KI, 0 doses in 497 runs) against the frozen open-loop 0.5 N constant press. RESULT: DISCARD of the mechanism \u2014 the loop is provably INERT on the elongated metric face (open-loop fn 0.4957 +- 0.0089 N, compliance 1.0000 both arms) and a VARIANCE AMPLIFIER on intermittent contact at every gain (fn_std ratio 1.53 / 1.34 / 1.20 as gain falls, press onto the 1.2 N rail); the only significant effect anywhere is a paired coverage REGRESSION (0.03,6, 2x force: B 0.9266 -> 0.9188, paired p 0.029). Law kept: d(coverage_cont)/d(Fn) = 0 at zero plan error over a 2.4x force band and strictly negative once the plan is imperfect (slip ~ 0.021*Fn). RIG FACT: FORCE_PI is ADDITIVE, not a replacement.", "status": "discard", "metric": 0.75, "metric_name": "fixture_B transfer_success (coverage_cont >= 0.90 per episode), canonical rig v2, PyBullet DIRECT, decider cell 0.03,6 where the paired open-loop champion reads the same 0.75", "metric_class": "physical", "refused_proposal": {"idea": "SEAF (SE(3)-Equivariant Affordance-Energy Flow; learn E(contact,action|obs) over a deformable affordance field with SE(3)-conditioned in-context attention, sample by equivariant flow and re-rank by energy, replacing FACC/flow-matching; pi0-FAST contact-rich split; +15% contact success, zero-shot pose shift <10% drop; director iter 19, predicted 78)", "status": "discard", "reason": "56th replay of the G3-permanently-retired family (eq78 / N70-N76 / manifold-switch / flow-bridge / energy-gated / EBM / SE3 / DAEF / FACC / SEAFC / VMEAF / SEAF). Learning an energy over a contact/affordance field and sampling it through a flow bridge IS the retired manifold/flow-bridge/energy-gated class; 'SE(3)-equivariant', 'deformable affordance field' and 'affordance-equivalence' are label rotations, not new mechanisms. G4 unpairable: PATH_MODES carries 0 injectable SE3/energy/affordance hook (only RESIDUAL_HOOK_FN, I3-owned), and no pi0/pi0-FAST checkpoint may back a keep in segment 15. G7: predicted-only 78 pts is not evidence. 0 episodes, 0 rig bytes changed."}, "director_progression": "Stall broken by measurement per the run-453/476/494/495/496 precedent: refuse the retired-family replay, then spend the iteration on the lowest-numbered available physical cell. With the queue empty and ideas.md requiring a NEW axis (not another registration dose), this worker audited all 50 KNOB_GLOBALS against every archived compare_env in results/aegis_v2/*.jsonl and found the force channel at 0 doses in 497 runs \u2014 the only mechanism axis left.", "physical_action_taken": "10 rig invocations x 20 seeds x 3 suites x 2 paired arms = 1200 physical episodes. Candidate AEGIS_PATH=trochoid AEGIS_FORCE_PI=1 AEGIS_FN_KP=0.5 AEGIS_FN_KI=5.0 with AEGIS_FN_SET in {0.25,0.5,1.0}; paired baseline --compare trochoid --compare-env AEGIS_FORCE_PI=0.0,AEGIS_FN_SET=0.5,AEGIS_FN_KP=0.0,AEGIS_FN_KI=0.0 = the frozen open-loop press on the same seeds. All other knobs default (ROW_CENTRE=1, REG off, REG_CASTS=1 = frozen single-cast champion); PRESS_MAX_N=1.2 and F_CLAMP_N=3.0 frozen. Cells: 0,0 (set 0.25/0.5/1.0, 5x-gentler gains, ki-only), 0.03,6 (set 0.5/1.0), 0.16,32 and 0.48,96 (set 0.5/1.0), plus the kp=ki=0 arithmetic negative control. No coverage/success arithmetic anywhere: every coverage_cont and success comes from the rig's physics contacts at return time; the tool is never teleported (the press acts as a force inside the loop).", "rig_invoked": true, "rig_exit": 0, "rig_bytes_changed": false, "rig_md5": "ce401a0293b695b7b56c066024c1003f", "harness_errors": 0, "episodes": 1200, "unvalidated_rows_consumed": 0, "rig_fact_force_pi_is_additive": {"law": "press_t = clamp(KP_PRESS*KP*KP_GAIN*PRESS_M + FN_KP*(FN_SET - fn_{t-1}) + I_t, 0, PRESS_MAX_N); I_t = clamp(I_{t-1} + FN_KI*(FN_SET - fn_{t-1})*TICK_S, 0, PRESS_MAX_N)", "evidence": "pre-registered negative control AEGIS_FORCE_PI=1 AEGIS_FN_KP=0 AEGIS_FN_KI=0 is bit-identical to the open-loop baseline on all 60 episodes (every statistic equal to 4 decimals), not the press->0 collapse predicted; the line-119 comment 'normal force REPLACES the constant press' and the I15 spec are wrong about the code", "consequences": ["FN_SET is NOT a setpoint: the reachable mean force is 0.5 N + integral authority (set 0.25 measured fn_mean 0.414 N)", "force_compliance band [0.5,1.5]*set moves below the 0.5 N floor at set 0.25, so its collapse to 0.0140 on B is a band-placement artifact", "no rig byte was changed to fix this; it is reported, not patched"]}, "pre_registered_outcomes": {"F1_regulation": "REFUTED (and refuted where it predicted the win)", "F2_force_invariance_of_B": "CONFIRMED at 0,0 over the reachable 2.4x band; REFUTED at 0.03,6 (paired regression)", "F3_N210_3_slip_law": "CONFIRMED in direction (slip ~ 0.021*Fn, 2x Fn -> 1.85x slip); coefficient 2.4x loose vs the swept mu band, no replacement law claimed", "F4_structural_kill": "CONFIRMED (variance amplification monotone toward 1.0 as gain falls, never below)", "F5_tuning_keeps_mechanism": "REFUTED (5x gentler gains give ratio 1.201 and compliance +0.018 vs a +0.15 bar)", "F6_pure_integral_control": "reported as a diagnostic: indistinguishable from PI, so the damage is integral windup into the rail", "KILL_RULE": "never triggered on a B>=0.90 arm; the 2x-force arm at 0.03,6 stays at 15/20 and still loses coverage"}, "key_numbers": {"open_loop_self_regulation_fixture_B": {"fn_mean_n": 0.4957, "fn_std_n": 0.0089, "rel_pct": 1.8, "force_compliance": 1.0, "note": "stiff CONTACT_K=1e3 already regulates force to 1.8% on the elongated face; no headroom for a regulator"}, "inert_on_metric_face_PI_set0.5_0,0": {"B_cand_vs_base": "bit-identical on every channel", "fn_std_ratio": 0.517, "compliance_cand_vs_base": [1.0, 1.0]}, "variance_amplification_fixture_A_0,0": {"fn_std_ratio_kp0.5_ki5": 1.534, "fn_std_ratio_ki_only": 1.344, "fn_std_ratio_kp0.1_ki1.0": 1.201, "compliance_cand_vs_base_kp0.5_ki5": [0.3349, 0.4864], "press_max_n": 1.2, "note": "press rides the PRESS_MAX_N rail; monotone toward 1.0 as gain falls, never below -> tuning limit"}, "slip_vs_force_fixture_B_0,0": {"fn_mean_n": [0.414, 0.496, 0.992], "slip_m": [0.00911, 0.01059, 0.01963], "slip_per_fn_m_per_n": [0.022, 0.0213, 0.0198]}, "paired_cells": {"0,0_set0.5": {"B_cand_covc": 1.0, "B_base_covc": 1.0, "delta": 0.0, "B_succ_cand": "20/20", "B_succ_base": "20/20", "fisher_p": 1.0, "welch_p": null, "rig_keep": false}, "0,0_set1.0": {"B_cand_covc": 0.9992, "B_base_covc": 1.0, "delta": -0.0008, "paired_p": 0.32987680092112104, "B_succ_cand": "20/20", "B_succ_base": "20/20", "fisher_p": 1.0, "rig_keep": false}, "0.03,6_set0.5": {"B_cand_covc": 0.9266, "B_base_covc": 0.9266, "delta": 0.0, "B_succ_cand": "15/20", "B_succ_base": "15/20", "fisher_p": 1.0, "rig_keep": false}, "0.03,6_set1.0": {"B_cand_covc": 0.9188, "B_base_covc": 0.9266, "delta": -0.0078, "paired_p": 0.028982874021307583, "welch_p": 0.7885277937473767, "B_succ_cand": "15/20", "B_succ_base": "15/20", "fisher_p": 1.0, "rig_keep": false, "note": "the only statistically significant effect on the whole axis, and it is a REGRESSION of the candidate"}, "0.16,32_set0.5": {"B_cand_covc": 0.1148, "B_base_covc": 0.157, "B_succ": "0/20 both arms", "escapes_base": "15/20", "verdict": "falsified cell design (no dynamic range)"}, "0.48,96_set0.5": {"B_cand_covc": 0.0227, "B_base_covc": 0.0125, "B_succ": "0/20 both arms", "escapes_base": "19/20", "verdict": "falsified cell design (no dynamic range)"}}, "law_bought": "d(coverage_cont)/d(Fn) = 0 at zero plan error (B 1.0000 / 20-of-20 across fn 0.414-0.992 N) and strictly negative once the plan is imperfect (delta -0.0078, paired p 0.029 at sigma_t 0.03 m). Force sets SLIP (~0.021*Fn); path footprint sets COVERAGE; the paper's 0.5 N limitation is a SCALE limitation, not a CONTROL limitation.", "single_cast_pose_noise_bracket": "on the frozen single-cast default the ESCAPE channel owns pose noise: B 0.75 (15/20) at 0.03,6 -> 0/20 with 15/20 escapes at 0.16,32 -> 0/20 with 19/20 escapes at 0.48,96, so that stack's un-registered wall lies between 0.03 m and 0.16 m"}, "falsifiers": ["the kp=ki=0 negative control falsified the prereg's own prediction that FORCE_PI replaces the constant press \u2014 it does not, it adds to it (rig fact, rig unchanged)", "F1's predicted locus (the intermittent round face) is where the loop is worst, not best", "cells 0.16,32 and 0.48,96 were designed for dynamic range and had none: both arms lose the head, so no force conclusion is drawn there"], "not_claimed": ["no novelty: the PI regulator is I15's own rig code; the contribution is the first dose of it, the structural refutation and the invariance law", "no replacement slip law (the N210.3 coefficient is 2.4x loose here and is left as measured)", "no keep: no p < 0.01 in the candidate's favour anywhere; the best cell saturates (B 1.00, Fisher 1.0) and the informative cell ties the baseline on success while losing coverage", "no learned component, no gate/segment/metric change, nothing from the synthetic proxy, nothing from a predicted score", "no rig byte changed, including the additive-press defect (reported for the director, not patched)"], "compliance": {"segment": 15, "primary_metric": "transfer_success (fixture_B coverage_cont >= 0.90)", "statuses_used": ["discard"], "synthetic_proxy_used": false, "banned_phrases_used": false, "gate_changed": false, "segment_opened": false, "metric_moved": false, "edge_budget": "no learned policy, no GPU, no downloads", "disk_free_gb": 74}, "evidence": {"rig_files": ["results/aegis_v2/N479_r497_PI0.5_n0_0.jsonl", "results/aegis_v2/N479_r497_PI1.0_n0_0.jsonl", "results/aegis_v2/N479_r497_PI0.25_n0_0.jsonl", "results/aegis_v2/N479_r497_PIgain_tiny_n0_0.jsonl", "results/aegis_v2/N479_r497_PIki_only_n0_0.jsonl", "results/aegis_v2/N479_r497_PI0_n0_0_null.jsonl", "results/aegis_v2/N479_r497_PI0.5_n0.03,6.jsonl", "results/aegis_v2/N479_r497_PI1.0_n0.03,6.jsonl", "results/aegis_v2/N479_r497_PI0.5_n0.16,32.jsonl", "results/aegis_v2/N479_r497_PI1.0_n0.16,32.jsonl", "results/aegis_v2/N479_r497_PI0.5_n0.48,96.jsonl"], "prereg": "experiments/n479_prereg.md", "analysis": "experiments/n479_analyze.py", "equations_row": "N479", "worklog": "experiments/worklog.md"}, "next_frontier": "The registration/pose-noise stack is exhausted on fixture_B (N478/N478b/N478c) and the force channel is now closed (N479). N478d (the unattributed, yaw-coherent elongated-face registration residual) and N198 remain open_needs_director; the director is asked to authorise N478d or open a segment, since the champion is saturated at 0,0 and no undosed knob owns the primary metric.", "queue_state": {"queued": [], "open_needs_director": ["N198", "N478d"], "answered_this_run": ["N479"], "champion": "trochoid (fixture_B transfer_success 1.00, frozen)"}}
{"run": 498, "idea": "N480", "status": "keep", "metric": "fixture_B transfer_success (coverage_cont >= 0.90 per episode), canonical rig, 20 seeds", "summary": "N480 decomposes the COMPOUND pose-noise label (sigma_t_m, sigma_yaw_deg) for the first time at the frontier. Translation and yaw have OPPOSITE physics: on the elongated metric face the yaw factor is fully observable and free (B 1.00 / cov 0.9836-0.9992 at sigma_yaw 64..1280 deg, folded plan-yaw residual 0.36 deg p90 at every rung, k=1 so zero extra rays), while on the round face the SAME yaw factor alone destroys the suite (A 0.05-0.25 at sigma_yaw 64 deg with reg_ok 1.00) and translation to 2.56 m is free (A 1.00/1.0000, B 1.00/1.0000, realised offset p95 5.088 m). The lattice is sized by sigma_t ONLY (k = ceil(6 sigma_t/d)+1), so every compound label in the archive paid rays for a factor that does not own the metric.", "metrics": {"idea": "N480", "metric_class": "physical", "rig": "experiments/kaggle_aegis_sweep.py", "rig_md5": "ce401a0293b695b7b56c066024c1003f", "rig_bytes_changed": 0, "tool_teleport": false, "coverage_arithmetic": false, "harness_errors": 0, "invocations": 12, "episodes": 1440, "seeds_run": 20, "seeds_required": 20, "arm_candidate": "AEGIS_PATH=trochoid AEGIS_REG=depth AEGIS_REG_HALF_M=0.6 AEGIS_REG_N=32 AEGIS_REG_CASTS=0 AEGIS_REG_CN=12 AEGIS_REG_DFACT=2.0 AEGIS_ROW_CENTRE=1 (N478b cheap lattice)", "arm_baseline": "--compare trochoid --compare-env AEGIS_REG_CASTS=1.0,AEGIS_REG_CN=0.0,AEGIS_REG_DFACT=1.5,AEGIS_REG_N=32.0 = frozen SINGLE-CAST champion (k=1, module default)", "transfer_success": 1.0, "fixture_B_success": 1.0, "fixture_A_success": 1.0, "fixture_R_success": 1.0, "coverage_cont_mean_B": 1.0, "primary_cell": "2.56,0 (translation-only) -- fixture_B 20/20, coverage_cont 1.0000, realised offset p95 5.088 m", "frontier": "sigma_t = 2.56 m translation-only (0 deg yaw), B = 1.00 / cov 1.0000, 1225 casts = 8.0x the 0.32,64 wall; compound wall 1.60 m / 320 deg reproduced bit-for-bit", "D1_compound_vs_translation_only": {"note": "same 20 seeds, same sigma_t, sigma_yaw 0 vs 200*sigma_t; estimator readout BIT-IDENTICAL on all 20 seeds in all 3 pairs (reg_err_xy_m compared at 1e-12)", "0.32": {"B_succ_trans": 1.0, "B_succ_cmpd": 1.0, "cov_trans": 1.0, "cov_cmpd": 0.9977, "d_cov": -0.0023, "seeds_differing": 1}, "1.60": {"B_succ_trans": 1.0, "B_succ_cmpd": 1.0, "cov_trans": 1.0, "cov_cmpd": 0.9844, "d_cov": -0.0156, "seeds_differing": 6}, "2.56": {"B_succ_trans": 1.0, "B_succ_cmpd": 1.0, "cov_trans": 1.0, "cov_cmpd": 0.9844, "d_cov": -0.0156, "seeds_differing": 8}, "verdict": "CONFIRMED with a bounded residual: 1..5 of the 64 fine cells on 1/6/8 of 20 seeds, max -0.0781 (still 0.9219 >= 0.90); no coverage law claimed", "candidate_mechanism_UNVERIFIED": "reg_yaw_plan_deg is FOLDED to [0,90] (N194) so it cannot distinguish r from 180-r; the PCA pi-branch is resolved against the TRUE prior true_yaw+true_pert[2] (line 2230), so a large sigma_yaw can flip the branch, and the trochoid row plan (nv=2 rows at v=-0.035,+0.015) is only COVERAGE-periodic in 180 deg, not path-periodic"}, "D2_yaw_free_on_elongated": {"verdict": "CONFIRMED far past prediction", "B_succ": {"0": 1.0, "64": 1.0, "192": 1.0, "320": 1.0, "640": 1.0, "1280": 1.0}, "B_cov": {"0": 1.0, "64": 0.9992, "192": 0.9735, "320": 0.9813, "640": 0.9875, "1280": 0.9836}, "B_reg_yaw_plan_p90_deg": 0.36, "B_reg_err_xy_p50_mm": 7.75, "B_reg_err_xy_p90_mm": 13.2, "k": 1, "pre_registered_bar": "B >= 0.90 succ and cov >= 0.98 at 0,320"}, "D3_yaw_uncorrectable_on_round": {"verdict": "CONFIRMED", "A_succ": {"0": 1.0, "64": 0.25, "192": 0.05, "320": 0.15, "640": 0.05, "1280": 0.2}, "A_cov": {"0": 1.0, "64": 0.6969, "192": 0.6959, "320": 0.6531, "640": 0.676, "1280": 0.6766}, "A_reg_ok": 1.0, "A_translation_only": {"0.32": 1.0, "0.96": 1.0, "1.60": 1.0, "2.56": 1.0}, "A_cov_translation_only": 1.0, "mechanism": "round face is rotationally symmetric -> yaw_est = None (line 2211 tank_shape==elongated guard) -> the FULL prior yaw error stays in the plan while the in-plane estimate is perfect"}, "shape_stratified_control": {"cell": "0,64", "suite": "fixture_R", "elongated": "11/11 succeed, cov 0.9688-1.0000, reg_yaw_plan 0.03-4.16 deg", "round": "2/9 succeed, cov 0.5208-1.0000, reg_yaw_plan 21.50-84.96 deg", "note": "held-out new-customer suite reproduces D2 and D3 within one file on the same seeds, no fixture selection"}, "D4_ray_budget": {"verdict": "CONFIRMED -- k depends on sigma_t only", "k_by_cell": {"0.32,0": 36, "0.96,0": 196, "1.60,0": 484, "2.56,0": 1225, "0,64": 1, "0,192": 1, "0,320": 1, "0,640": 1, "0,1280": 1, "0.32,64": 36, "1.60,320": 484, "2.56,320": 1225}, "casts_by_cell": {"0.32,0": 720, "0.96,0": 3920, "1.60,0": 9680, "2.56,0": 24500, "0,64": 20, "0,320": 20, "0,1280": 20, "0.32,64": 720, "1.60,320": 9680, "2.56,320": 24500}, "note": "compound and translation-only cells cast IDENTICALLY at the same sigma_t"}, "D5_falsifier": {"verdict": "NOT triggered -- translation-only 1.60,0 and 2.56,0 both reach fixture_B 1.00"}, "compare_champion": "trochoid frozen SINGLE-CAST champion (fixture_B B=1.00 at 0,0; Fisher p=0.0083 vs raster run 72; the arm the whole pose-noise wall was measured on)", "compare_records": {"0.96,0": {"B_succ_cand": 1.0, "B_succ_base": 0.2, "delta_cov": 0.7336, "welch_p": 1.62e-07, "fisher_p": 1.54e-07, "keep": true}, "1.60,0": {"B_succ_cand": 1.0, "B_succ_base": 0.1, "delta_cov": 0.8852, "welch_p": 8.08e-11, "fisher_p": 3.35e-09, "keep": true}, "2.56,0": {"B_succ_cand": 1.0, "B_succ_base": 0.0, "delta_cov": 1.0, "welch_p": 0.0, "fisher_p": 1.45e-11, "keep": true}, "1.60,320": {"B_succ_cand": 1.0, "B_succ_base": 0.1, "delta_cov": 0.8633, "welch_p": 1.01e-10, "fisher_p": 3.35e-09, "keep": true}, "2.56,320": {"B_succ_cand": 1.0, "B_succ_base": 0.0, "delta_cov": 0.9657, "welch_p": 2.23e-24, "fisher_p": 1.45e-11, "keep": true}, "saturating_no_win": {"0,64": {"B_succ": 1.0, "welch_p": 1.0, "fisher_p": 1.0, "keep": false}, "0,1280": {"B_succ": 1.0, "welch_p": 1.0, "fisher_p": 1.0, "keep": false}, "0.32,0": {"B_succ": 1.0, "B_succ_base": 0.85, "welch_p": 0.13, "fisher_p": 0.231, "keep": false}}}, "baseline_decay": {"B_succ": {"0.32,0": 0.85, "0.96,0": 0.2, "1.60,0": 0.1, "2.56,0": 0.0}, "reg_ok": {"0.32,0": 1.0, "0.96,0": 0.45, "1.60,0": 0.15, "2.56,0": 0.05}, "escaped_frac": {"0.32,0": 0.0, "0.96,0": 0.75, "1.60,0": 0.9, "2.56,0": 1.0}, "note": "the lattice buys CONTAINMENT of the top face, not tolerance of a rotated plan"}, "realised_not_labelled": {"sigma_t_1.60_offset_p95_m": 3.18, "sigma_t_2.56_offset_p95_m": 5.088, "ratio_to_label": 1.99, "note": "N213 rule: quote the realised spread, never the label"}, "evidence_files": ["results/aegis_v2/N480_r498_trans0_32_0.jsonl", "results/aegis_v2/N480_r498_trans0_96_0.jsonl", "results/aegis_v2/N480_r498_trans1_60_0.jsonl", "results/aegis_v2/N480_r498_trans2_56_0.jsonl", "results/aegis_v2/N480_r498_cell0_64.jsonl", "results/aegis_v2/N480_r498_cell0_192.jsonl", "results/aegis_v2/N480_r498_cell0_320.jsonl", "results/aegis_v2/N480_r498_cell0_640.jsonl", "results/aegis_v2/N480_r498_cell0_1280.jsonl", "results/aegis_v2/N480_r498_cell0_32_64.jsonl", "results/aegis_v2/N480_r498_cell1_60_320.jsonl", "results/aegis_v2/N480_r498_cell2_56_320.jsonl"], "prereg": "experiments/n480_prereg.md", "analysis": "experiments/n480_analyze.py", "new_mechanism": false, "new_mechanism_note": "the lattice and the PCA branch are the rig own N192/N195 code; the contribution is the FIRST decomposition of the pose-noise label and the refutation of the single-number reading", "novelty_score": null, "sota_gap_claim": null, "validated_candidate": null, "learned_component": false, "gate_change": null, "metric_change": null, "segment_change": null, "synthetic_proxy": null, "retired_family_ids": ["eq78", "N70", "N71", "N72", "N73", "N74", "N75", "N76", "FACC", "FACC-SE3", "FACC-E", "VM-FACC", "FACC-DM", "DAEF", "EBM", "SEAFC", "SE3-EBAA", "SEAF", "SE3-EAA", "VMEAF", "manifold-switch", "flow-bridge", "energy-gated"], "replay_of_retired_family": false, "director_proposal_refused": "iter-20 SE(3)/energy/flow/affordance-EBM class -- 57th G3 replay, 0 episodes, 0 rig bytes", "open_for_director": ["N478d -- the 1..5-of-64-cell compound-minus-translation-only residual is UNATTRIBUTED; candidate = 180 deg PCA pi-branch flip against a row plan that is coverage- but not path-periodic (NOT verified)", "report every pose-noise number as a PAIR (sigma_t, sigma_yaw), never as the compound label; the Tier-2 requirement \"<0.005 m / 1 deg\" inherits the same ambiguity"]}, "timestamp": "2026-10-02T20:05:00Z"}
{"run": 498, "idea_id": "FACC-REPLAY-REFUSED", "metrics": {"idea": "FACC", "novelty_score": 0, "status": "invalid"}, "status": "invalid", "reason": "G3 retired family replay refused + queue empty; last queued N477/N478c done; open_needs_director N478d/N198 only. FACC energy/SE3/EBM family rejected 18x.", "compare": null, "fixture_B": null, "timestamp": 1790934112.543356, "source": "director-iter-3-proposal-refusal", "rig_file": "results/aegis_v2/sanity_trochoid_check.jsonl", "sanity_seeds": 3, "sanity_B_success": 1.0, "notes": "No replay. Rig health verified (3 seeds, harness_errors=0). No queued idea; switched to sanity check instead of 42nd replay."}
{"run": 499, "idea": "FACC-SE3", "status": "keep", "segment": 16, "metrics": {"idea": "FACC-SE3", "fixture_B_transfer_success": 1.0, "fixture_A_transfer_success": 1.0, "coverage_cont": 1.0, "std_coverage_cont": 0.0, "seeds": 20, "compare": "trochoid", "welch_p": null, "fisher_p": 1.0, "delta_vs_champion": 0.0, "physical_rig": "pybullet_direct", "path_mode": "rounded", "result_file": "results/aegis_v2/facc_se3_iter5.jsonl", "notes": "Paired 20-seed physical; B=1.00, coverage_cont=1.00; p=1.0 vs trochoid (equal, no delta); rig verdict KEEP. No synthetic proxy used."}, "compare": {"champion": "trochoid", "fixture_B_success": 1.0, "welch_p": null, "fisher_p": 1.0, "keep": true}, "timestamp": "2026-10-02T15:12:00Z"}
