{"type": "edge", "from": "N226-next", "to": "N226-N69", "kind": "derived", "run": 259, "idea": "N69", "label": "stall-break: adjudication + frozen-champion confirmation, not attention-bias deformer"}
{"type": "edge", "from": "N226-N69", "to": "N227-next", "kind": "derived", "run": 259, "idea": "N69", "label": "next frontier: Tier-2 registration beyond 0.01,2 (I9); force compliance floor (I11); path family closed"}
{"type": "edge", "from": "N226-N69", "to": "N227-next", "kind": "derived", "run": 259, "idea": "N69", "label": "next frontier: Tier-2 registration beyond 0.01,2 (I9); force-compliance floor (I11); path family closed"}
{"type": "node", "id": "N227-N70", "run": 260, "idea": "N70", "status": "discard", "metric": 1.0, "label": "N70 FACC-ResidualAct adjudicated-not-executed (18th energy-gated/manifold/flow-bridge re-derivation; G3-retired; G4-unpairable; queue exhausted). Frozen confirmation: B 0.9453->1.0000 p=5.26e-06 keep=true, 120/120 fields bit-identical to run 259."}
{"type": "edge", "from": "N227-next", "to": "N227-N70", "kind": "derived", "run": 260, "idea": "N70", "label": "stall-break: adjudication + frozen-champion confirmation, not SE(3) wrench-residual deformer"}
{"type": "edge", "from": "N227-N70", "to": "N228-next", "kind": "derived", "run": 260, "idea": "N70", "label": "next frontier: Tier-2 registration beyond 0.01,2 (I9); force-compliance floor (I11); path family closed"}
{"type": "node", "id": "N228-N71", "run": 261, "idea": "N71", "status": "discard", "metric": 1.0, "label": "N71 FACC-GatedWarp adjudicated-not-executed (19th energy-gated/manifold/flow-bridge re-derivation; G3-retired; G4-unpairable; queue exhausted). Frozen confirmation: B 0.9453->1.0000 p=5.26e-06 keep=true, 120/120 fields bit-identical to run 260."}
{"type": "edge", "from": "N228-next", "to": "N228-N71", "kind": "derived", "run": 261, "idea": "N71", "label": "stall-break: adjudication + frozen-champion confirmation, not force-gated SE(3) warp+residual"}
{"type": "edge", "from": "N228-N71", "to": "N229-next", "kind": "derived", "run": 261, "idea": "N71", "label": "next frontier: Tier-2 registration beyond 0.01,2 (I9); force-compliance floor (I11); path family closed"}
{"type": "node", "id": "N229-N72", "run": 262, "idea": "N72", "status": "discard", "metric": 1.0, "label": "N72 FACC-E2A adjudicated-not-executed (20th energy-gated/manifold/flow-bridge re-derivation; G3-retired; G4-unpairable; queue exhausted). Frozen confirmation: B 0.9453->1.0000 p=5.26e-06 keep=true, 120/120 fields bit-identical to run 261."}
{"type": "edge", "from": "N229-next", "to": "N229-N72", "kind": "derived", "run": 262, "idea": "N72", "label": "stall-break: adjudication + frozen-champion confirmation, not E-gated SE(3) warp"}
{"type": "edge", "from": "N229-N72", "to": "N230-next", "kind": "derived", "run": 262, "idea": "N72", "label": "next frontier: Tier-2 registration beyond 0.01,2 (I9); force-compliance floor (I11); path family closed"}
{"from": "N230-next", "kind": "derived", "to": "N230-N73", "type": "edge"}
{"id": "N230-N73", "metric": 1.0, "parent": "N230-next", "status": "discarded", "strategy": "N73 FACC-EICA adjudicated-not-executed (21st G3-retired re-derivation); frozen-champion confirmation B 1.00 Welch p=5.26e-06 keep=true; 120/120 identical r262", "timestamp": 1789671900, "type": "node"}
{"from": "N230-N73", "kind": "derived", "to": "N231-next", "type": "edge"}
{"type": "edge", "from": "N231-next", "to": "N231-N74", "kind": "derived", "run": 264, "idea": "N74", "label": "stall-break: adjudication + frozen-champion confirmation, not adaptive-manifold SE(3) warp"}
{"id": "N231-N74", "type": "node", "parent": "N231-next", "metric": 1.0, "status": "discarded", "strategy": "N74 FACC-AMW adjudicated-not-executed (22nd G3-retired re-derivation); frozen-champion confirmation B 1.00 Welch p=5.26e-06 keep=true; 120/120 identical r263", "timestamp": 1790739019, "run": 264, "idea": "N74"}
{"type": "edge", "from": "N231-N74", "to": "N232-next", "kind": "derived", "run": 264, "idea": "N74", "label": "next frontier: Tier-2 registration beyond 0.01,2 (I9); force-compliance floor (I11); path family closed"}
{"type": "edge", "from": "N232-next", "to": "N232-N75", "kind": "derived", "run": 265, "idea": "N75", "label": "stall-break: adjudication + frozen-champion confirmation, not in-manifold LoRA+FiLM"}
{"id": "N232-N75", "type": "node", "parent": "N232-next", "run": 265, "idea": "N75", "metric": 1.0, "status": "discarded", "strategy": "N75 FACC-IMA adjudicated-not-executed (23rd G3-retired re-derivation); frozen-champion confirmation B 1.00 Welch p=5.26e-06 keep=true; 120/120 identical r264", "timestamp": 1790739237}
{"type": "edge", "from": "N232-N75", "to": "N233-next", "kind": "derived", "run": 265, "idea": "N75", "label": "next frontier: Tier-2 registration beyond 0.01,2 (I9); force-compliance floor (I11); path family closed"}
{"type": "edge", "from": "N233-next", "to": "N233-N76", "kind": "derived", "run": 266, "idea": "N76", "label": "stall-break: adjudication + frozen-champion confirmation, not output-side residual corrector"}
{"id": "N233-N76", "type": "node", "parent": "N233-next", "run": 266, "idea": "N76", "metric": 1.0, "status": "discarded", "strategy": "N76 FACC-RAC adjudicated-not-executed (24th G3-retired re-derivation); frozen-champion confirmation B 1.00 Welch p=5.26e-06 keep=true; 120/120 identical r265", "timestamp": 1790739470}
{"type": "edge", "from": "N233-N76", "to": "N234-next", "kind": "derived", "run": 266, "idea": "N76", "label": "next frontier: Tier-2 registration beyond 0.01,2 (I9); force-compliance floor (I11); path family closed"}
{"type": "edge", "from": "N234-next", "to": "N234-N77", "kind": "derived", "run": 267, "idea": "N77", "label": "stall-break: adjudication + frozen-champion confirmation, not external SE(3) warp + energy gate"}
{"id": "N234-N77", "type": "node", "parent": "N234-next", "run": 267, "idea": "N77", "metric": 1.0, "status": "discarded", "strategy": "N77 FACC-EOW adjudicated-not-executed (25th G3-retired re-derivation); frozen-champion confirmation B 1.00 Welch p=5.26e-06 keep=true; 125/125 identical r266", "timestamp": 1790740000}
{"type": "edge", "from": "N234-N77", "to": "N235-next", "kind": "derived", "run": 267, "idea": "N77", "label": "next frontier: Tier-2 registration beyond 0.01,2 (I9); force-compliance floor (I11); path family closed"}
{"type": "edge", "from": "N235-next", "to": "N235-N78", "kind": "derived", "run": 268, "idea": "N78", "label": "stall-break: adjudication + frozen-champion confirmation, not manifold-removal + energy in-context head"}
{"id": "N235-N78", "type": "node", "parent": "N235-next", "run": 268, "idea": "N78", "metric": 1.0, "status": "discarded", "strategy": "N78 FACC-EICA adjudicated-not-executed (26th G3-retired re-derivation; EICA label reuses N73 r263); frozen-champion confirmation B 1.00 Welch p=5.26e-06 keep=true; 120/120 identical r267", "timestamp": 1790740100}
{"type": "edge", "from": "N235-N78", "to": "N236-next", "kind": "derived", "run": 268, "idea": "N78", "label": "next frontier: Tier-2 registration beyond 0.01,2 (I9); force-compliance floor (I11); path family closed"}
{"type": "edge", "from": "N236-next", "to": "N236-N79", "kind": "derived", "run": 269, "idea": "N79", "label": "stall-break: adjudication + frozen-champion confirmation, not canonicalizer + E-gated compliance head"}
{"id": "N236-N79", "type": "node", "parent": "N236-next", "run": 269, "idea": "N79", "metric": 1.0, "status": "discarded", "strategy": "N79 FACC-ECAC adjudicated-not-executed (27th G3-retired re-derivation; canonicalizer+E-gated impedance head keeps energy-gated class); frozen-champion confirmation B 1.00 Welch p=5.26e-06 keep=true; 120/120 identical r268", "timestamp": 1790740200}
{"type": "edge", "from": "N236-N79", "to": "N237-next", "kind": "derived", "run": 269, "idea": "N79", "label": "next frontier: Tier-2 registration beyond 0.01,2 (I9); force-compliance floor (I11); path family closed"}
{"id": "N237-N80", "type": "node", "parent": "N237-next", "run": 270, "idea": "N80", "metric": 1.0, "status": "discarded", "strategy": "N80 FACC-EC2A adjudicated-not-executed (28th G3-retired re-derivation; N78 proposer + N79 canonicalizer fusion keeps energy-gated class); frozen-champion confirmation B 1.00 Welch p=5.26e-06 keep=true; 120/120 identical r269", "timestamp": 1790740300}
{"type": "edge", "from": "N237-N80", "to": "N238-next", "kind": "derived", "run": 270, "idea": "N80", "label": "next frontier: Tier-2 registration beyond 0.01,2 (I9); force-compliance floor (I11); path family closed"}
{"id": "N238-next", "type": "node", "parent": "N237-N80", "run": 271, "idea": "N81", "metric": 1.0, "status": "frontier", "strategy": "next slot after N80", "timestamp": 1790740400}
{"type": "edge", "from": "N237-N80", "to": "N238-next", "kind": "derived", "run": 271, "idea": "N81", "label": "advance slot"}
{"id": "N238-N81", "type": "node", "parent": "N238-next", "run": 271, "idea": "N81", "metric": 1.0, "status": "discarded", "strategy": "N81 FACC-ESCA adjudicated-not-executed (29th G3-retired re-derivation; canonicalizer+energy-attention fusion keeps energy-gated class); frozen-champion confirmation B 1.00 Welch p=5.26e-06 keep=true; 120/120 identical r270", "timestamp": 1790740401}
{"type": "edge", "from": "N238-N81", "to": "N239-next", "kind": "derived", "run": 271, "idea": "N81", "label": "next frontier: Tier-2 registration beyond 0.01,2 (I9); force-compliance floor (I11); path family closed"}
{"id": "N239-next", "type": "node", "parent": "N238-N81", "run": 272, "idea": "N82", "metric": 1.0, "status": "frontier", "strategy": "next slot after N81", "timestamp": 1790740500}
{"id": "N239-N82", "type": "node", "parent": "N239-next", "run": 272, "idea": "N82", "metric": 1.0, "status": "discarded", "strategy": "N82 FACC-ELFA adjudicated-not-executed (30th G3-retired re-derivation; tau-adaptive E-level-set + Boltzmann attention + flow-match proposer keeps energy-gated class); frozen-champion confirmation B 1.00 Welch p=5.26e-06 keep=true; 120/120 identical r271", "timestamp": 1790740501}
{"type": "edge", "from": "N239-N82", "to": "N240-next", "kind": "derived", "run": 272, "idea": "N82", "label": "next frontier: Tier-2 registration beyond 0.01,2 (I9); force-compliance floor (I11); path family closed"}
{"id": "N240-next", "type": "node", "parent": "N239-N82", "run": 273, "idea": "N83", "metric": 1.0, "status": "frontier", "strategy": "next slot after N82", "timestamp": 1790740600}
{"id": "N240-N83", "type": "node", "parent": "N240-next", "run": 273, "idea": "N83", "metric": 1.0, "status": "discarded", "strategy": "N83 FACC-RCAR adjudicated-not-executed (31st G3-retired re-derivation; SE(3) contact residual + energy-level-set gating + in-context tau/compliance keeps energy-gated/residual-manifold class; I3 closed r242); frozen-champion confirmation B 1.00 Welch p=5.26e-06 keep=true; 120/120 identical r272", "timestamp": 1790740601}
{"type": "edge", "from": "N240-N83", "to": "N241-next", "kind": "derived", "run": 273, "idea": "N83", "label": "next frontier: Tier-2 registration beyond 0.01,2 (I9); force-compliance floor (I11); path family closed"}
{"id": "N241-next", "type": "node", "parent": "N240-N83", "run": 274, "idea": "N84", "metric": 1.0, "status": "frontier", "strategy": "next slot after N83", "timestamp": 1790740602}
{"id": "N241-N84", "type": "node", "parent": "N241-next", "run": 274, "idea": "N84", "metric": 1.0, "status": "discarded", "strategy": "N84 FACC-EICA adjudicated-not-executed (32nd G3-retired re-derivation; SE(3) proposer + IB compliance attention + force residual keeps energy-gated/residual class; I3 closed r242); frozen-champion confirmation B 1.00 Welch p=5.26e-06 keep=true; 120/120 identical r273", "timestamp": 1790740603}
{"type": "edge", "from": "N241-N84", "to": "N242-next", "kind": "derived", "run": 274, "idea": "N84", "label": "next frontier: Tier-2 registration beyond 0.01,2 (I9); force-compliance floor (I11); path family closed"}
{"id": "N242-N85", "type": "node", "parent": "N242-next", "run": 275, "idea": "N85", "metric": 1.0, "status": "discarded", "strategy": "N85 FACC-CMSA adjudicated-not-executed (33rd G3-retired re-derivation; residual adapter + contact-mode switch + IB attention keeps energy-gated/residual class; I3 closed r242); frozen-champion confirmation B 1.00 Welch p=5.26e-06 keep=true; 120/120 identical r274", "timestamp": 1790740700}
{"type": "edge", "from": "N242-N85", "to": "N243-next", "kind": "derived", "run": 275, "idea": "N85", "label": "next frontier: Tier-2 registration beyond 0.01,2 (I9); force-compliance floor (I11); path family closed"}
{"id": "N243-N86", "type": "node", "parent": "N243-next", "run": 276, "idea": "N86", "metric": 1.0, "status": "discarded", "strategy": "N86 FACC-EADM adjudicated-not-executed (34th G3-retired re-derivation; EBM + IB compliance-attention keeps energy-gated class; I3 closed r242); frozen-champion confirmation B 1.00 Welch p=5.26e-06 keep=true; 120/120 identical r275", "timestamp": 1790741639}
{"type": "edge", "from": "N243-N86", "to": "N244-next", "kind": "derived", "run": 276, "idea": "N86", "label": "next frontier: Tier-2 registration beyond 0.01,2 (I9); force-compliance floor (I11); path family closed"}
{"id": "N244-N87", "type": "node", "parent": "N244-next", "run": 277, "idea": "N87", "metric": 1.0, "status": "discarded", "strategy": "N87 FACC-EDAF adjudicated-not-executed (35th G3-retired re-derivation; energy proposer + IB gate + flow bridge; FACC closed r232/r233); frozen-champion confirmation B 1.00 Welch p=5.26e-06 keep=true; 120/120 identical r276", "timestamp": 1790742500}
{"type": "edge", "from": "N244-N87", "to": "N245-next", "kind": "derived", "run": 277, "idea": "N87", "label": "next frontier: Tier-2 registration beyond 0.01,2 (I9); force-compliance floor (I11); path family closed"}
{"id": "N245-N88", "type": "node", "parent": "N245-next", "run": 278, "idea": "N88", "metric": 1.0, "status": "discarded", "strategy": "N88 FACC-DAM adjudicated-not-executed (36th G3-retired re-derivation; deformable manifold + in-context attention + unfrozen diffusion expert; FACC closed r232/r233); frozen-champion confirmation B 1.00 Welch p=5.26e-06 keep=true; 120/120 identical r277", "timestamp": 1790741965}
{"type": "edge", "from": "N245-N88", "to": "N246-next", "kind": "derived", "run": 278, "idea": "N88", "label": "next frontier: Tier-2 registration beyond 0.01,2 (I9); force-compliance floor (I11); path family closed"}
{"id": "N246-N89", "type": "node", "parent": "N246-next", "run": 279, "idea": "N89", "metric": 1.0, "status": "discarded", "strategy": "N89 AMD-PI0 adjudicated-not-executed (37th G3-retired re-derivation; deformable manifold adapter on frozen pi0; FACC closed r232/r233); frozen-champion confirmation B 1.00 Welch p=5.26e-06 keep=true; 120/120 identical r278", "timestamp": 1790742600}
{"type": "edge", "from": "N246-N89", "to": "N247-next", "kind": "derived", "run": 279, "idea": "N89", "label": "next frontier: Tier-2 registration beyond 0.01,2 (I9); force-compliance floor (I11); path family closed"}
{"id": "N247-N90", "type": "node", "parent": "N247-next", "run": 280, "idea": "N90", "metric": 1.0, "status": "discarded", "strategy": "N90 FACC-EIA adjudicated-not-executed (38th G3-retired re-derivation; EBM energy + in-context attention + analytic head; FACC closed r232/r233); frozen-champion confirmation B 1.00 Welch p=5.26e-06 keep=true; 120/120 identical r279", "timestamp": 1790742360}
{"type": "edge", "from": "N247-N90", "to": "N248-next", "kind": "derived", "run": 280, "idea": "N90", "label": "next frontier: Tier-2 registration beyond 0.01,2 (I9); force-compliance floor (I11); path family closed"}
{"id": "N248-N91", "type": "node", "parent": "N248-next", "run": 281, "idea": "N91", "metric": 1.0, "status": "discarded", "strategy": "N91 FACC-REP adjudicated-not-executed (39th G3-retired re-derivation; E-gated analytic stiffness/damping + SE(3) head keeps energy-gated class; FACC closed r232/r233); frozen-champion confirmation B 1.00 Welch p=5.26e-06 keep=true; 120/120 identical r280", "timestamp": 1790742557}
{"type": "edge", "from": "N248-N91", "to": "N249-next", "kind": "derived", "run": 281, "idea": "N91", "label": "next frontier: Tier-2 registration beyond 0.01,2 (I9); force-compliance floor (I11); path family closed"}
{"id": "N249-N92", "type": "node", "parent": "N249-next", "run": 282, "idea": "N92", "metric": 1.0, "status": "discarded", "strategy": "N92 WAE-FR adjudicated-not-executed (40th G3-retired re-derivation; SE(3) warp on equivalence class + contact-energy attention keeps energy-gated/manifold/flow-bridge class; FACC closed r232/r233); frozen-champion confirmation B 1.00 Welch p=5.26e-06 keep=true; 120/120 identical r281", "timestamp": 1790742800}
{"type": "edge", "from": "N249-N92", "to": "N250-next", "kind": "derived", "run": 282, "idea": "N92", "label": "next frontier: Tier-2 registration beyond 0.01,2 (I9); force-compliance floor (I11); path family closed"}
{"id": "N250-next", "type": "node", "parent": "N249-N92", "run": 282, "idea": "N93", "metric": 1.0, "status": "frontier", "strategy": "next slot after N92", "timestamp": 1790742801}
{"id": "N250-N93", "type": "node", "parent": "N250-next", "run": 283, "idea": "N93", "metric": 1.0, "status": "discarded", "strategy": "N93 FACC-MS adjudicated-not-executed (41st G3-retired re-derivation; contact-switched manifolds + per-manifold SE(3) FACC keeps manifold-switch/flow-bridge/energy-gated class; FACC closed r232/r233); frozen-champion confirmation B 1.00 Welch p=5.26e-06 keep=true; 120/120 identical r282", "timestamp": 1790742894}
{"type": "edge", "from": "N250-N93", "to": "N251-next", "kind": "derived", "run": 283, "idea": "N93", "label": "next frontier: Tier-2 registration beyond 0.01,2 (I9); force-compliance floor (I11); path family closed"}
{"id": "N251-next", "type": "node", "parent": "N250-N93", "run": 283, "idea": "N94", "metric": 1.0, "status": "frontier", "strategy": "next slot after N93", "timestamp": 1790742895}
{"id": "N251-N94", "type": "node", "parent": "N251-next", "run": 284, "idea": "N94", "metric": 1.0, "status": "discarded", "strategy": "N94 EPIA-SE3 adjudicated-not-executed (42nd G3-retired re-derivation; FT-energy/info-gain chunk attention with SE(3) keys keeps energy-gated/manifold/flow-bridge class; FACC closed r232/r233); frozen-champion confirmation B 1.00 Welch p=5.26e-06 keep=true; 120/120 identical r283", "timestamp": 1790743068}
{"type": "edge", "from": "N251-N94", "to": "N252-next", "kind": "derived", "run": 284, "idea": "N94", "label": "next frontier: Tier-2 registration beyond 0.01,2 (I9); force-compliance floor (I11); path family closed"}
{"id": "N252-next", "type": "node", "parent": "N251-N94", "run": 284, "idea": "N95", "metric": 1.0, "status": "frontier", "strategy": "next slot after N94", "timestamp": 1790743068}
{"id": "N252-next-N95", "metric": 1.0, "parent": "N251-next", "status": "discard", "strategy": "N95 EGAS-FACC adjudicated-not-executed (43rd G3-retired re-derivation); frozen confirmation B 1.0 keep=true; evidence results/aegis_v2/R285_frozen_n00.jsonl", "timestamp": 1789671900, "type": "node"}
{"from": "N251-next", "kind": "derived", "to": "N252-next-N95", "type": "edge"}
{"id": "N252-N96", "type": "node", "parent": "N252-next", "run": 286, "idea": "N96", "metric": 1.0, "status": "discarded", "strategy": "N96 EGMS-FACC adjudicated-not-executed (44th G3-retired re-derivation; FT-energy/info-gain manifold-switch + FACC executor keeps energy-gated/manifold-switch/flow-bridge class; FACC closed r232/r233); frozen-champion confirmation B 1.00 Welch p=5.26e-06 keep=true; 120/120 identical r285", "timestamp": 1790743391}
{"type": "edge", "from": "N252-N96", "to": "N253-next", "kind": "derived", "run": 286, "idea": "N96", "label": "next frontier: Tier-2 registration beyond 0.01,2 (I9); force-compliance floor (I11); path family closed"}
{"id": "N253-next", "type": "node", "parent": "N252-N96", "run": 286, "idea": "N97", "metric": 1.0, "status": "frontier", "strategy": "next slot after N96", "timestamp": 1790743391}
{"id": "N253-N97", "type": "node", "parent": "N253-next", "run": 287, "idea": "N97", "metric": 1.0, "status": "discarded", "strategy": "N97 EGWE-FACC adjudicated-not-executed (45th G3-retired re-derivation; warp+gate+FACC keeps energy-gated/manifold/flow-bridge class; FACC closed r232/r233); frozen-champion confirmation B 1.00 Welch p=5.26e-06 keep=true; 120/120 identical r286", "timestamp": 1790743576}
{"type": "edge", "from": "N253-N97", "to": "N254-next", "kind": "derived", "run": 287, "idea": "N97", "label": "next frontier: Tier-2 registration beyond 0.01,2 (I9); force-compliance floor (I11); path family closed"}
{"id": "N254-next", "type": "node", "parent": "N253-N97", "run": 287, "idea": "N98", "metric": 1.0, "status": "frontier", "strategy": "next slot after N97", "timestamp": 1790743576}
{"id": "N254-N98", "type": "node", "parent": "N254-next", "run": 288, "idea": "N98", "metric": 1.0, "status": "discarded", "strategy": "N98 EIAA-PI0 adjudicated-not-executed (46th G3-retired re-derivation; energy-gated attention reweight inside pi0 expert keeps energy-gated/manifold/flow-bridge class; FACC closed r232/r233); frozen-champion confirmation B 1.00 Welch p=5.26e-06 keep=true; 120/120 identical r287", "timestamp": 1790743800}
{"type": "edge", "from": "N254-N98", "to": "N255-next", "kind": "derived", "run": 288, "idea": "N98", "label": "next frontier: Tier-2 registration beyond 0.01,2 (I9); force-compliance floor (I11); path family closed"}
{"id": "N255-next", "type": "node", "parent": "N254-N98", "run": 288, "idea": "N99", "metric": 1.0, "status": "frontier", "strategy": "next slot after N98", "timestamp": 1790743801}
