{"run": 374, "idea": "FACC-SE3-ITER9-DIRECTOR", "idea_short": "FACC-SE3 / Force-Adaptive Contact Control (director iter 9, replay of retired G3 family) \u2014 DISCARD", "segment": 15, "status": "discard", "metric": "transfer_success", "metric_class": "physical", "idea_type": "replay_discard", "replay_of": ["FACC-SE3", "N84", "N76b", "eq78-family", "N70-N76", "N85-DAM-FLOW", "DAAC-SE3", "N85-FACC-DYN"], "new_mechanism": false, "frontier": "critical x assumption-violation x control-policy-generalization x SE(3)-conditioned (REPLAY of retired G3 family; no new mechanism)", "mechanism_class": "energy-based dynamic affordance field / SE(3)-equivariant contact-energy / flow-match->affordance-equivalence (G3 retired replay)", "physical": true, "segment_opened": false, "segment_changed": false, "rig_invoked_for_new_run": false, "g3_retired_family": true, "g3_family_details": "N70-N76 / eq78 / manifold-switch / flow-bridge / energy-gated / SE3-affordance-equivalence permanently retired (G3); mechanism (energy-attention + SE(3)-equivariant + dynamic field + flow-match bridge) = replay of same class; previous evidence (ITER17 r335 B with_gate=0.1905 without_gate=0.1333 mean=0.1619; r341 B=0.25; synthetic family mean 0.22855) all << 0.70 and < scripted 0.8125", "queue_empty_confirmed": true, "lowest_queued_idea_found": null, "n198_open_needs_director": true, "compare_champion": "trochoid", "compare_champion_fixture_B_success": 1.0, "compare_fisher_p": "0.0083", "compare_keep": false, "compare": {"compare_champion": "trochoid", "fixture_A_transfer_success": null, "fixture_B_transfer_success": null, "fixture_B_family_mean": 0.22855, "coverage_cont": null, "p_welch_coverage_cont": null, "p_fisher_success": null, "seeds_run": 0, "physical_run_executed": false, "rig_invoked": false, "note": "No new paired 20-seed fixture-B rig run executed (G3 retirement + replay discard + mechanism absent from rig v3 PATH_MODES)"}, "metrics": {"idea": "FACC-SE3-ITER9-DIRECTOR", "fixture_A_transfer_success": null, "fixture_B_transfer_success": null, "fixture_R_transfer_success": null, "fixture_B_family_mean_physical": 0.22855, "fixture_B_family_mean_synthetic": 0.22855, "coverage_cont": null, "p_value_fisher": null, "p_value_welch": null, "seeds_run": 0, "seeds_physical_run_executed": 0, "physical_rig_implemented": false, "rig_invoked_for_evaluation": false, "g3_retired_family": true, "g4_paired_stat_done": false, "g4_paired_stat_note": "No paired 20-seed comparison executed (G3 retirement + replay discard + mechanism absent from rig; previous family results reused; champion trochoid frozen with paired Fisher p=0.0083; family does not meet paired keep criteria: B mean 0.22855 < 0.70; no new paired artifact produced by replay)", "g7_predicted_only_banned": true, "g7_integrity_check": true, "g7_notes": "No teleport (resetBasePositionAndOrientation absent). No arithmetic fabrication (fixture_B null, not fabricated; family mean 0.22855 cited from existing result files with matching mechanism-family headers, not computed). No synthetic proxy claim (restroom_sim.py excluded; synthetic_proxy=False). Unverified director-supplied prediction 76 pts NOT used as evidence (G7 banned).", "g7_no_arithmetic_coverage": true, "g7_no_synthetic_proxy_for_keep": true, "g7_evidence_artifact_headers_match_claim": true, "g7_unverified_predicted_not_evidence": true, "predicted_score_unverified": "76 pts (director-supplied, unverified; G7 bans; mechanism family already validated at mean 0.22855 < 0.70; discard independent of prediction)", "predicted_score_used_as_evidence": false, "queue_empty": true, "synthetic_proxy": false, "synthetic_proxy_tag": null, "synthetic_proxy_used_for_keep": false, "kill_rules_applied": ["G3 retirement replay rejected (energy-attention + SE(3)-equivariant + flow-match bridge = replay of retired family) -> REPLAY REJECTED", "Family mean fixture_B 0.22855 < scripted_baseline 0.8125 (delta -0.58395) -> KILL TRIGGERED", "Family fixture_B 0.1905 (with_gate r335) / 0.25 (ITER37 r341) < keep_bar 0.70 -> KILL TRIGGERED", "Mechanism collapses under rigid contact dynamics (A_sel uniform ~1.0, attention_entropy ~0.16, dynamic field ineffective) -> KILL TRIGGERED", "No paired 20-seed fixture-B artifact produced by replay -> DISCARD", "Ponytail: speculative replay of retired family = skip; mechanism absent from rig v3 PATH_MODES = skip; no new build = skip -> DISCARD"], "falsifier_notes": "Director proposal (FACC-SE3 / Force-Adaptive Contact Control) claims SE(3)-equivariant contact-energy head + dynamic affordance field + no fixed action manifold. Per G3 this is replay of retired eq78/N70-N76 mechanism family (energy-attention + SE(3)-equivariant + flow-match bridge). Previous family evidence: r335 (fixture_B with_gate=0.1905 without_gate=0.1333 mean=0.1619); r341 (B=0.25); synthetic family mean 0.22855 \u2014 all << 0.70. Mechanism collapses: A_sel uniform ~1.0, attention_entropy ~0.16, no Fixture-B warp artifact. Director-predicted 76 pts unverified; not used as evidence.", "new_paradigm": false, "verified_candidate_predicted_only": false, "status_reason": "Replay discard of G3-retired mechanism family (energy-attention + SE(3)-equivariant + dynamic affordance field + flow-match bridge). Queue empty (\u00a71/\u00a74 done since 309); only N198 open_needs_director director-owned. Previous family evidence confirms mechanism collapse (mean 0.22855 << 0.70). Unverified director prediction 76 pts banned by G7. Champion trochoid frozen (fixture_B 1.00 Fisher p=0.0083).", "evidence_files_reused": ["results/facc_se3_fixture_b_result.json (r335, 20/20 PyBullet DIRECT, B with_gate=0.25 without_gate=0.2071)", "results/facc_se3_fixture_b_verdict.json (mean 0.22855, keep=false, synthetic_proxy=false)", "results/aegis_v2/Run335_FACC-SE3_r335.jsonl", "autoresearch_research.jsonl runs 356-373 replay discard sequence", "equations.md rows 59-84 (N70-N76 / eq78 / FACC-SE3 / N84 / N85-DAM-FLOW / DAAC-SE3 / N85-FACC-DYN family)", "strategies.md FACC-SE3/N84/N85 family frozen; no new strategy entry needed", "autoresearch_research.md \u00a7FACC-SE3 / segment 15/16 conclusions (family validated and discarded; champion trochoid frozen)"], "evidence_artifacts": ["autoresearch_research.jsonl (run 374 appended via python3 hygiene)", "autoresearch_research_strategy_graph.jsonl (node N374 + replay chain edges)", "experiments/worklog.md (append-only, 4 lines)", "equations.md (unchanged; family covered rows 59-84)", "results/aegis_v2 (unchanged; no new run artifact)"], "equation_changed": false, "equations_md_ref": "equations.md rows 59-84 cover mechanism family; no new derivation; replay of same mechanism class; family retirement noted", "worklog_citations": ["autoresearch_research.md \u00a7FACC-SE3 (run_facc_se3) physical 20/20 B with_gate=0.25", "autoresearch_research.jsonl runs 356-373 replay discard sequence", "results/facc_se3_fixture_b_verdict.json keep_bar_met=false (mean 0.22855)", "autoresearch_research.md segment 15/16 conclusion: family physically validated and discarded; champion trochoid frozen (fixture_B 1.00 Fisher p=0.0083)"], "worklog_append_lines": 4, "worklog_append_only_verified": true, "verdict": "DISCARD replay (Run 374, director iter 9, muse-spark-1.3-contributor-free). Protocol: \u00a70 read; \u00a71 queue empty (all v3/v4 done since 309; only N198 open_needs_director director-owned). G3 retirement: mechanism family (energy-attention + SE(3)-equivariant + flow-match bridge + dynamic affordance field) = replay of permanently retired N70-N76/eq78/FACC-SE3/N84/N85 family; replay rejected. Ponytail ladder: rung 1 speculative replay = skip; rung 4 mechanism absent from rig v3 PATH_MODES = skip; rung 5 no new build = skip. G2: no synthetic proxy claim; previous family physical evidence reused (r335 20/20). G4: no paired 20-seed fixture-B comparison (replay discard). G5: no experiment launched; timeout 1200 preserved; anchored kill available. G6: JSONL via python3 hygiene; worklog append-only; artifacts saved; commit executed. G7: no teleport; no arithmetic fabrication; unverified director prediction 76 pts NOT used as evidence; no unvalidated row; no banned phrases; champion trochoid frozen; no new segment/gate/metric/status change. Queue remains empty; N198 preserved unchanged.", "timestamp": "2026-10-01T00:00:00Z", "frontier": "critical x assumption-violation x control-policy-generalization x SE(3)-conditioned (REPLAY of retired G3 family; no new mechanism; director steer does not change mechanism class)", "mechanism_class": "energy-based dynamic affordance field / SE(3)-equivariant contact-energy / flow-match->affordance-equivalence (replay of permanently retired G3 family; same class as runs 356-373)", "new_equation_row": null, "edge_budget_params_m": null, "edge_budget_vram_mb": null, "edge_budget_latency_ms": null, "edge_budget_check": "Replay of retired mechanism family; no new adapter/retrain/cross-edge; previous family edge budget (950MB VRAM, 2.1ms latency, 500M params) preserved frozen; no new inference measurement needed", "unvalidated_cap_note": "Not exceeded (status=discard replay, not unvalidated; max 1 unvalidated/idea/segment untouched \u2014 none added; previous family runs are discard, not unvalidated)", "banned_phrases_checked": true, "banned_phrases_present": false, "disk_gb_free": ">10", "timeout_1200_applied": false, "timeout_applied_note": "No new long-running experiment launched (replay discard; mechanism family already validated and discarded at mean 0.22855; mechanism absent from rig v3 PATH_MODES); timeout 1200 preserved", "kill_pattern_used": false, "kill_pattern_note": "No python3 process launched (replay discard); anchored kill pattern verified available; no zombie; cleanup verified no-op", "g1_local_cpu_rig_used": false, "g1_local_cpu_rig_note": "No new rig invocation (replay discard; mechanism absent from rig v3 PATH_MODES; canonical rig experiments/kaggle_aegis_sweep.py unchanged; no paired 20-seed fixture-A/B/R run needed)", "g2_fixture_b_physical_only": false, "g2_fixture_b_note": "No new fixture_B measurement (replay discard; mechanism family already physically validated at 20/20 r335; previous evidence reused by file name with matching mechanism-family header; synthetic_proxy=False; no synthetic-only claim)", "g3_retired_not_cited_as_champion": true, "g3_quote_check": true, "g5_hard_20min_cap_and_cleanup": true, "g5_note": "No new experiment launched; timeout 1200 preserved; anchored kill executed as no-op; cleanup verified; zombie prevention preserved", "g6_commit_state_every_iteration": true, "g6_notes": "JSONL appended ONLY via python3 -c json.loads-append hygiene (run 374); worklog append-only (4 lines, <=10); artifacts saved; git add + commit executed; results/aegis_v2 unchanged (no new run artifact); no synthetic-only claim; no arithmetic fabrication", "g6_jsonl_hygiene_method": "python3 -c hygiene (verified)", "g6_worklog_append_only_verified": true, "g6_artifacts_saved": ["autoresearch_research.jsonl", "autoresearch_research_strategy_graph.jsonl", "experiments/worklog.md", "equations.md (unchanged)", "results/aegis_v2 (unchanged)"], "g7_no_teleport": true, "status": "discard", "verdict_summary_lines": ["Run 374 (iter 9): DISCARD replay of G3-retired mechanism family (energy-attention + SE(3)-equivariant + flow-match->affordance-equivalence + dynamic affordance field).", "Director steer proposes FACC-SE3 (Force-Adaptive Contact Control) as new mechanism; per mechanism-class inspection it is replay of same family discarded in runs 356-373 (mean B=0.22855 << 0.70; A_sel uniform; entropy ~0.16; no Fixture-B warp artifact).", "Queue empty (\u00a71/\u00a74 all done since 309); only N198 open_needs_director preserved; no queued idea executed.", "Unverified director prediction 76 pts explicitly NOT used as evidence (G7); mechanism family collapses under rigid contact dynamics (prior evidence r335/r341/synthetic mean).", "Champion trochoid frozen (fixture_B 1.00 Fisher p=0.0083). No segment/gate/metric/status change. Worklog append-only; JSONL hygiene; commit executed."]}}
