{"type": "node", "id": "N102", "parent": "N101", "status": "kept", "metric": 88.66, "strategy": "T190 = T188 base + winsorized tail cap (director iter 15): w=min(T173/(max(slip,0.005)+eps*),p99), eps*=max(median_calib(slip>0),0.01)=0.01 train-locked, damping ON, fric-free, T173-only; post-hoc only, frozen I7+I10; zero rig edits, offline on frozen R173 files", "frontier": "slip-penalized sizing (tail-turnover kill via winsorization)", "variation": "T188 base + train-p99 hard cap on raw weights", "timestamp": "2026-09-28T00:00:00Z", "evidence_artifacts": ["results/aegis_v2/I2_r190_analysis.py", "results/aegis_v2/I2_r190_result.json"]}
{"type": "edge", "from": "N101", "to": "N102", "kind": "frontier-expansion", "label": "winsorized tail cap (p99 + max|w|)", "note": "N102: train p99=66.6667==raw max -> cap binds 0/120 all splits; T190 bit-identical to T188 (lift vs T188 0.00, score_w 88.66, ESS 99.04); lift vs T173 -0.56 (diode stands); vs T189 -0.08; turnover vs T188 zero, vs T189 0.86/11.21 (T189 tail is damping-OFF artifact); KEEP iff-rule; director +1.2-1.5pt prediction FAILS; fail path: ablate cap vs eps* next. Tier-2 binding."}
{"type": "node", "id": "N103", "parent": "N102", "status": "kept", "metric": 88.47, "strategy": "T191 = T188 base + joint eps*+cap (director iter 16): w=min(T173/(max(slip,0.005)+0.005),C99), C99=100.0 train-p99 == raw max, damping ON, fric-free, T173-only; post-hoc only, frozen I7+I10; zero rig edits, offline on frozen R173 files", "frontier": "tail-controlled T173 weighting (joint eps+cap tune)", "variation": "eps 0.005 decider + per-eps train-quantile caps; grid eps x C log-only; dampOFF+capped ablation", "timestamp": "2026-09-28T00:00:00Z", "evidence_artifacts": ["results/aegis_v2/I2_r191_analysis.py", "results/aegis_v2/I2_r191_result.json"]}
{"type": "edge", "from": "N102", "to": "N103", "kind": "frontier-expansion", "label": "joint eps*+cap tune (eps 0.005, p99)", "note": "N103: cap DEGENERATE (all quantiles == raw max at every eps, binds 0/120); lift vs T173 -0.75 (diode stands), vs T188 -0.19; score_w 88.47>=70; grid monotone larger-eps-better; dampOFF+capped bit-identical (cap-masked); KEEP iff-rule; director +2.0pt FAILS; shrinker+winsor EXHAUSTED. Tier-2 binding."}
{"type": "node", "id": "N104", "parent": "N103", "status": "kept", "metric": 40.0, "strategy": "T192 = T191 joint weight IN-SELECTION (director iter 17): w=min(T173/(max(slip,0.005)+0.005),C99) applied pre-keep as episode admission (Admit iff w>=TAU50=68.0452, median over calib fitted-B admitted n=16, train-locked); frozen I7+I10; zero rig edits, offline admission on frozen R173 files", "frontier": "in-loop-W selection (post-hoc-only CLOSED)", "variation": "same eps*/floor/C99, timing-only delta vs 189-191; decider median-split + log-only TAU p25/p75 grid", "timestamp": "2026-09-28T00:00:00Z", "evidence_artifacts": ["results/aegis_v2/I2_r192_analysis.py", "results/aegis_v2/I2_r192_result.json"]}
{"type": "edge", "from": "N103", "to": "N104", "kind": "frontier-expansion", "label": "in-selection timing (admission pre-keep)", "note": "N104: gated yield 0.40 vs raw 0.95 (-55pts sensitivity, first break of flat 1.0); precision_adm 1.0 (vetoes successes only); rank-shift mass 0.40; P(w=C99)=0; TAU grid 0.55/0.40/0.35 monotone; director 0.68-0.75 magnitude MISSED; KEEP iff-rule (score_sel 100); family EXHAUSTED as improvement, pivot to selection/threshold frontier. Tier-2 binding."}
{"type": "node", "id": "N105", "parent": "N104", "status": "kept", "metric": 55.0, "strategy": "T193 = T191 joint weight IN-SELECTION, TAU30 decider (director iter 18): w=min(T173/(max(slip,0.005)+0.005),C99) applied as episode admission (Admit iff w>=TAU30=55.9211, 30th pct over calib fitted-B admitted n=16, train-locked; TAU25=52.3987 buffer); frozen I7+I10; zero rig edits, offline admission on frozen R173 files", "frontier": "keep-constrained selection (threshold must allow keep>=70)", "variation": "TAU50->TAU30 relaxation only (same eps*/floor/C99); TAU25 buffer log-only", "timestamp": "2026-09-28T00:00:00Z", "evidence_artifacts": ["results/aegis_v2/I2_r193_analysis.py", "results/aegis_v2/I2_r193_result.json"]}
{"type": "edge", "from": "N104", "to": "N105", "kind": "frontier-expansion", "label": "TAU30 relaxation (keep-constrained selection)", "note": "N105: gated yield 0.55 vs raw 0.95 (-40pts); +15pts vs T192 TAU50 0.40; TAU25 buffer bit-identical (no held mass in gap); precision 1.0 at every TAU (vetoes successes only, zero outcome signal); score_sel 100>=70; rank-shift mass 0.25; caphit 0; archive 0.0; KEEP iff-rule; director keep-70-73/score-68.5-69.5 MISSED on both; pivot to non-slip selector. Tier-2 binding."}
{"type": "node", "id": "N106", "parent": "N105", "status": "discarded", "metric": 33.33, "strategy": "T194 per-tool conformal admission (director iter 19): Admit iff T173 AND jerk<=THETA[tool] (90pct calib-SUCCESS jerk per tool, all n>=20); frozen I7+I10; zero rig edits, offline on frozen R173 files", "frontier": "non-slip failure-predictive selector", "variation": "friction/slip bins -> tool bins (stall degenerate all-zero, excluded)", "timestamp": "2026-09-28T00:00:00Z", "evidence_artifacts": ["results/aegis_v2/I2_r194_analysis.py", "results/aegis_v2/I2_r194_result.json"]}
{"type": "edge", "from": "N105", "to": "N106", "kind": "frontier-expansion", "label": "non-slip selector (tool-conformal jerk)", "note": "N106: held P(fail|admit) 0.1042 vs T173 0.1078 (lift +0.37<1.0 bar); recall 0.333<70; score 33.3<70; cov no regression; archive 0.0; I7/stall bind 0; DISCARD; I2 EXHAUSTED (slip/fric/jerk/stall/tool all mapped, diode stands everywhere); next I8. Tier-2 binding."}
{"type": "node", "id": "N158", "parent": "N106", "status": "discarded", "metric": 33.33, "strategy": "T195 conditional-buffer admission (director iter 20): admit iff w191>=TAU50 OR (w191>=TAU30 AND jerk<=THETA[tool]); frozen I7+I10; zero rig edits, offline on frozen R173 files", "frontier": "conditional-buffer admission (hybridize 193+194)", "variation": "keep TAU50 hard-admit, reuse 194 THETA[tool] only in buffer zone, not as post-hoc gate", "timestamp": "2026-09-28T00:00:00Z", "evidence_artifacts": ["results/aegis_v2/I2_r195_analysis.py", "results/aegis_v2/I2_r195_result.json"]}
{"type": "edge", "from": "N106", "to": "N158", "kind": "frontier-expansion", "label": "conditional buffer (weight hard-admit + tool-jerk buffer)", "note": "N158: heldB yield 0.50 (+10pts vs T192, precision 1.0); pooled P(fail|admit) 0.1190 vs T173 0.1078 (lift -1.12, diode stands); recall 0.333=T194 (director 71.2 MISSED); tool-1 kill FIRES (0.20>0.1471); DISCARD; I2 stays CLOSED, next I8. Tier-2 binding."}
{"type": "node", "id": "N159", "parent": "N158", "status": "discarded", "metric": 40.0, "strategy": "T196 per-tool conformal admission (director iter 21): admit iff w191>=TAU_tool[t] OR (w191>=TAU30_tool[t] AND jerk<=THETA[t]), TAU_tool=Q10 calib-success w per tool (90pct recall), TAU30_tool=Q30 calib-admitted w per tool, THETA bit-identical; frozen I7+I10; zero rig edits, offline on frozen R173 files", "frontier": "per-tool conformal admission (relaxed hybrid 194+202)", "variation": "global TAU50/TAU30 -> per-tool conformal quantiles (fixes cross-tool scale variance)", "timestamp": "2026-09-28T00:00:00Z", "evidence_artifacts": ["results/aegis_v2/I2_r196_analysis.py", "results/aegis_v2/I2_r196_result.json"]}
{"type": "edge", "from": "N158", "to": "N159", "kind": "frontier-expansion", "label": "per-tool conformal TAUs (global->per-tool relaxation)", "note": "N159: heldB yield 0.60 (+10pts vs T195, precision 1.0); pooled failure-recall 0.40 vs T194 0.333 (+6.7pts, director 68-73 MISSED); selective-risk lift +0.31 first positive since T181; abort FIRES (40<50) + tool-1 kill FIRES (0.1667>0.1471); DISCARD; I2 stays CLOSED, next I8. Tier-2 binding."}
{"type": "node", "id": "N160", "parent": "N159", "status": "discarded", "metric": 46.67, "strategy": "T197 buffered per-tool conformal admission (director iter 22): admit iff w191>=TAU50_tool[t] OR (w191>=TAU30_tool[t] AND jerk<=THETA[t]), TAU50_tool=median calib-admitted w per tool, TAU30_tool bit-ident T196, THETA bit-ident T194; frozen I7+I10; zero rig edits, offline on frozen R173 files", "frontier": "buffered per-tool conformal admission (union 202x203)", "variation": "global TAU50/TAU30 -> per-tool median/Q30 (strict hard + rescue buffer)", "timestamp": "2026-09-28T00:00:00Z", "evidence_artifacts": ["results/aegis_v2/I2_r197_analysis.py", "results/aegis_v2/I2_r197_result.json"]}
{"type": "edge", "from": "N159", "to": "N160", "kind": "frontier-expansion", "label": "buffered per-tool TAUs (strict median hard + Q30 rescue)", "note": "N160: heldB yield 0.40 (buffer zone EMPTY 0 eps, +0.0pts; per-tool -10pts vs global ablation); pooled recall 0.4667 vs T194 0.333 (+13.3pts by strictness n_adm 61 vs 96) but selective-risk lift -2.33 (p_fail 0.1311, worst T-series, diode stands); no-buffer ablation identical 46.67 (buffer inert); per-tool medians within 1pct (WHY falsified: no cross-tool scale variance); abort FIRES (46.67<50) + tool-1 kill 3rd consecutive (0.25>0.1471); director 52-58 MISSED, freeze<45 narrowly missed; DISCARD; I2 CLOSED, next I8. Tier-2 binding."}
{"type": "node", "id": "N161", "parent": "N160", "status": "discarded", "metric": 40.0, "strategy": "T198 shrunk-buffered per-tool union (director iter 23): admit iff w191>=TAU50*_tool[t] OR (w191>=TAU30*_tool[t] AND jerk<=THETA[t]), TAU*=lam*global+(1-lam)*per-tool lam=20/(n+20); frozen I7+I10; zero rig edits, offline on frozen R173 files", "frontier": "shrunk-buffered per-tool conformal admission", "variation": "raw per-tool quantiles -> James-Stein-style shrinkage toward global (fixes small-n overfit)", "timestamp": "2026-09-28T00:00:00Z", "evidence_artifacts": ["results/aegis_v2/I2_r198_analysis.py", "results/aegis_v2/I2_r198_result.json"]}
{"type": "edge", "from": "N160", "to": "N161", "kind": "frontier-expansion", "label": "shrinkage toward global (small-n stabilisation)", "note": "N161: heldB yield 0.50 (+10pts vs T197, buffer ACTIVE 2/2 +10pts vs no-buffer); pooled recall 40.0 vs 46.67 (-6.7pts, admits more fails n_adm 71 vs 61); lift -1.90 diode stands; per-tool FPR 0.22/0.21/0.0; kill FIRES (<=46.67); director 53-55/60-68 MISSED; DISCARD; I2 CLOSED, next I8. Tier-2 binding."}
{"type": "node", "id": "N162", "parent": "N161", "status": "discarded", "metric": 46.67, "strategy": "T199 global-only ablation (director iter 24): admit iff w191>=TAU50_global=68.0452, zero per-tool tables, zero jerk gate; frozen I7+I10; zero rig edits, offline on frozen R173 files", "frontier": "w191-admission overfit test (global vs per-tool)", "variation": "remove TAU_tool/TAU30_tool/THETA[t]; single global median (tests overfit, not 4th tuning)", "timestamp": "2026-09-28T00:00:00Z", "evidence_artifacts": ["results/aegis_v2/I2_r199_analysis.py", "results/aegis_v2/I2_r199_result.json"]}
{"type": "edge", "from": "N161", "to": "N162", "kind": "frontier-expansion", "label": "global-only ablation (overfit test)", "note": "N162: heldB yield 0.40 (=T197); pooled recall 46.67=T197 exactly (n_adm 60 vs 61), +6.67 vs T198; lift -2.55 diode stands; FP var 0.011285 drops vs T197 (-7.4%) not vs T198; win>48 FAILS; DISCARD; ABANDON w191-admission frontier (global=per-tool, signal plateaus 46.67); move to new feature. Tier-2 binding."}
{"type": "node", "id": "N163", "parent": "N162", "status": "discarded", "metric": 46.67, "strategy": "T200 global-only linear soft score (director iter 25): s=w191-lam*jerk, admit iff s>=TAU_global, 2 params, zero per-tool tables/buffer/shrinkage; train-locked calib fit lam*=250 TAU*=72.5843 (Q70 over 17 calib fails); frozen I7+I10; zero rig edits, offline on frozen R173 files", "frontier": "soft-vs-hard admission (linear jerk tradeoff, global-only)", "variation": "OR/AND union -> linear score; TAU to 70pct fail-recall target not conformal 30/50", "timestamp": "2026-09-28T00:00:00Z", "evidence_artifacts": ["results/aegis_v2/I2_r200_analysis.py", "results/aegis_v2/I2_r200_result.json"]}
{"type": "edge", "from": "N162", "to": "N163", "kind": "frontier-expansion", "label": "linear soft score (2-param global tradeoff)", "note": "N163: heldB yield 0.40 (=T199); pooled recall 46.67=T199 EXACTLY (n_adm 57 vs 60); P(fail|admit) 0.1404 vs 0.1333 (precision drops); rescue_rate 0.0; lift -3.26 worst diode; lam=0 bit-identical pooled (soft term inert); calib recall 0.6471 misses 70 target; director 71 MISSED by 24.3; DISCARD; w191-admission abandon stands; I2 CLOSED, next I8. Tier-2 binding."}
{"type": "node", "id": "N164", "parent": "N163", "status": "discarded", "metric": 93.33, "strategy": "T201 global-only joint-tuned soft score (director iter 26): s=w191-lam*jerk, admit iff s>=TAU_global, lam+TAU co-tuned via 5-fold CV in-train; theta_marg refit per-fold; zero per-tool tables; zero rig edits, offline on frozen R173 files", "frontier": "joint lam+TAU in-train tuning (CV, not post-hoc)", "variation": "fixed Q70 + calib-grid lam -> 5-fold CV over lam x q; nested single held eval; lam=0 ablation", "timestamp": "2026-09-28T00:00:00Z", "evidence_artifacts": ["results/aegis_v2/I2_r201_analysis.py", "results/aegis_v2/I2_r201_result.json"]}
{"type": "edge", "from": "N163", "to": "N164", "kind": "frontier-expansion", "label": "joint CV tuning (lam+TAU co-tune)", "note": "N164: CV ridge flat in lam (all lam>0 tie 0.8833@q0.9); tie-break picks grid-edge 8000 vs fold-mode 0 -> lam UNSTABLE, director discard FIRES; held recall 93.33 = strictness artifact (n_adm 9, heldB yield 0.0, rescue 0, cov regression); jerk adds +6.66 over lam=0@same q; DISCARD; I2 CLOSED, next I8. Tier-2 binding."}
{"type": "node", "id": "N165", "parent": "N164", "status": "discarded", "metric": 46.67, "strategy": "T202 global dual-cut (director iter 27): admit iff w191>=TAU AND jerk<=JMAX, co-tuned in-train (TAU=Qq fail-w x JMAX=Qq succ-jerk); frozen I7+I10; zero rig edits, offline on frozen R173 files", "frontier": "global-only nonlinear admission (AND-veto, no lam)", "variation": "linear soft score s=w-lam*j -> dual-cut veto (keep high-w/mid-jerk winners, kill tail jerks)", "timestamp": "2026-09-28T00:00:00Z", "evidence_artifacts": ["results/aegis_v2/I2_r202_analysis.py", "results/aegis_v2/I2_r202_result.json"]}
{"type": "edge", "from": "N164", "to": "N165", "kind": "frontier-expansion", "label": "dual-cut veto (minimal nonlinear step)", "note": "N165: locked TAU*=74.93+JMAX*=0.0206=VACUOUS (selector rejects veto; calib pf rises as JMAX tightens); held recall 46.67=T199 exact, veto +0.0 vs TAU-only; precision drops; kill FIRES (<=50); director 71.5 MISSED by 24.8; DISCARD; veto direction wrong; I2 CLOSED, next I8. Tier-2 binding."}
{"type": "node", "id": "N166", "parent": "N165", "status": "discarded", "metric": 46.67, "strategy": "T203 jerk-stratified dual-cut (director iter 28): admit iff w191>=TAU_b[jerk-bin], k=3 CALIB tertiles, isotonic co-tune on CALIB pooled; frozen I7+I10; zero rig edits, offline on frozen R173 files", "frontier": "conditional admission (jerk-stratified thresholds, no lam penalty)", "variation": "global TAU / soft lam / AND-veto -> per-jerk-bin TAU_b (loose low-jerk, strict high-jerk)", "timestamp": "2026-09-28T00:00:00Z", "evidence_artifacts": ["results/aegis_v2/I2_r203_analysis.py", "results/aegis_v2/I2_r203_result.json"]}
{"type": "edge", "from": "N165", "to": "N166", "kind": "frontier-expansion", "label": "jerk-stratified TAU_b (conditional admission)", "note": "N166: locked TAU_B=[73.23,74.93,74.93] isotonic interior; heldB keep 40.0 (=T199/T202); pooled recall 46.67=T199/T202 exact (rescue 0, precision drops, lift -3.26); bin>=50 check FAILED (40/bin, no collapse); director 78-85/71-75 MISSED by ~32-38; DISCARD; conditional line KILLED, next per-sample conformal. Tier-2 binding."}
{"type": "node", "id": "N167", "parent": "N166", "status": "discarded", "metric": 46.67, "strategy": "T204 robust global soft-score (director iter 29): s=w191-lam*clip(jerk,0,J95) J95=0.015175 CALIB-pooled, decoupled lam sweep + Q70-fail TAU lock, zero bins; frozen I7+I10; zero rig edits, offline on frozen R173 files", "frontier": "robust soft-penalty scoring (clipped T201 line)", "variation": "raw jerk -> CALIB-J95-clipped jerk; joint CV -> decoupled sweep+lock", "timestamp": "2026-09-28T00:00:00Z", "evidence_artifacts": ["results/aegis_v2/I2_r204_analysis.py", "results/aegis_v2/I2_r204_result.json"]}
{"type": "edge", "from": "N166", "to": "N167", "kind": "frontier-expansion", "label": "clipped soft score (robust T201)", "note": "N167: LAM*=250 interior (=T200, clip inert at small lam); CALIB pooled recall 0.6471/pf 0.0984 vs T201 0.9412/0.0833 -> NO GAIN, director discard FIRES; held recall 46.67=T199/T200/T202/T203 exact (lam=0 bit-identical, jerk +0.0, rescue 0, precision drops, lift -3.26); heldB 40.0; director 100-110 MISSED; DISCARD; KILL soft-penalty frontier; I2 CLOSED, next per-sample conformal. Tier-2 binding."}
{"type": "node", "id": "N168", "parent": "N167", "status": "discarded", "metric": 46.67, "strategy": "T205 w191-only ablation (director iter 30): admit iff w191>=TAU*, no jerk term, pooled-1 CALIB, 5-fold CV-tuned Q*=0.8/TAU*=74.9317; frozen I7+I10; zero rig edits, offline on frozen R173 files", "frontier": "jerk-frontier kill-test (w191-only ablation)", "variation": "remove all jerk terms; CV (not in-train co-tune); veto-rate/overlap/corr reports", "timestamp": "2026-09-28T00:00:00Z", "evidence_artifacts": ["results/aegis_v2/I2_r205_analysis.py", "results/aegis_v2/I2_r205_result.json"]}
{"type": "edge", "from": "N167", "to": "N168", "kind": "frontier-expansion", "label": "w191-only kill-test (CV-tuned, no jerk)", "note": "N168: TAU* 74.9317==T202 TAU; held recall 46.67=T202/T203/T204 EXACT (Jaccard 1.0 bit-identical); corr(w191,jerk) -0.61 all-eps, ~0 admitted-only; veto 0.525; rescue 0; lift -3.26; DISCARD; CLOSE F-jerk (jerk adds zero); T206 = new orthogonal signal target 65-75. Tier-2 binding."}
{"type": "node", "id": "N169", "parent": "N168", "status": "discarded", "metric": 46.67, "strategy": "T206 band-gated stratified soft-score (director iter 31): auto-admit w>=TAU_hi=100.0 / auto-reject w<TAU_lo=65.6704 / in-band s=w-lam*clip(jerk,0,J95)>=TAU_mid, grid lam x TAU_mid on CALIB pooled; frozen I7+I10; zero rig edits, offline on frozen R173 files", "frontier": "conditional jerk value (band-gated, jerk only in uncertainty band)", "variation": "T203 cuts everywhere / T204 penalizes everywhere / T205 ignores jerk -> T206 gates jerk to band only", "timestamp": "2026-09-28T00:00:00Z", "evidence_artifacts": ["results/aegis_v2/I2_r206_analysis.py", "results/aegis_v2/I2_r206_result.json"]}
{"type": "edge", "from": "N168", "to": "N169", "kind": "frontier-expansion", "label": "band-gated soft score (conditional jerk)", "note": "N169: LAM*=250+TAU_MID*=74.6045 interior; CALIB in-band +0.2857 but split-half UNSTABLE (lam0 both halves); held recall 46.67=T199/T205 exact, in-band delta 0.0/7, heldB 35.0<T205; kill FIRES; DISCARD; CLOSE F-jerk entirely; I2 CLOSED, next I8. Tier-2 binding."}
{"type": "node", "id": "N170", "parent": "N169", "status": "discarded", "metric": 60.0, "strategy": "T207 band-local soft-score (director iter 32): s=(w191-mu_band)/sig_band - lam*clip(jerk,0,J95_band), CALIB jerk-tertile bands, lam sweep {0,0.25,0.5} + per-band ROC TAU*_band, no TAU_hi/lo hard gates; frozen I7+I10; zero rig edits, offline on frozen R173 files", "frontier": "localization/calibration (band-local standardization, not new feature)", "variation": "global J95=0.015175/TAU_hi=100 -> per-band J95_band, mu/sig_band + per-band TAU*", "timestamp": "2026-09-28T00:00:00Z", "evidence_artifacts": ["results/aegis_v2/I2_r207_analysis.py", "results/aegis_v2/I2_r207_result.json"]}
{"type": "edge", "from": "N169", "to": "N170", "kind": "frontier-expansion", "label": "band-local soft score (pooled-0 vs pooled-1)", "note": "N170: LAM*=0.25+TAU*=[1.0783,-0.0348,0.6390]; heldB keep 40.0 (=T205); pooled recall 60.0 vs 46.67 plateau (+13.33 first break; local beats global +13.33; strict subset 43c57); band1 held recall 0.0; lift -3.17 diode stands; kill FIRES (keep<60); director 55pm5 HIT at 60.0, keep>60 MISSED; DISCARD; NO T208; I2 CLOSED, next I8. Tier-2 binding."}
{"type": "node", "id": "N171", "parent": "N170", "status": "discarded", "metric": 46.67, "strategy": "T208 shrunk band-local+global soft-score (director iter 33): s=z_shrunk+z_global-jerk_pen, mu_shrunk=(40*mu_b+20*mu_g)/60, sig_pooled global, jerk_pen global J95, pooled-1 CALIB fit, no hard gates; frozen I7+I10; zero rig edits, offline on frozen R173 files", "frontier": "shrinkage/pooling (global pooling vs band-local calibration)", "variation": "T207 band-local only -> T208 shrunk+global sum with global jerk penalty", "timestamp": "2026-09-28T00:00:00Z", "evidence_artifacts": ["results/aegis_v2/I2_r208_analysis.py", "results/aegis_v2/I2_r208_result.json"]}
{"type": "edge", "from": "N170", "to": "N171", "kind": "frontier-expansion", "label": "shrunk+global pooled-1 score", "note": "N171: LAM*=1.0(edge)+TAU*=0.1258; heldB 40.0; pooled 46.67=plateau (-13.33 vs T207); lam0 53.33 beats lam* (+6.66 jerk hurts); shrunk==raw (fail FIRES); pooled-0 60.0 beats pooled-1 (pooling destroys localization); DISCARD; CLOSE shrunk line; I2 CLOSED, next I8. Tier-2 binding."}
{"type": "node", "id": "N172", "parent": "N171", "status": "discarded", "metric": 60.0, "strategy": "T209 robust band-local soft-score (director iter 34): s=(w191-med_b)/(1.4826*MAD_b+eps)-0.5*clip(jerk/J90_b,0,1), lam FIXED 0.5, zero hard gates, global tie-break |s-TAU|<0.05; pooled-0 CALIB fit; frozen I7+I10; zero rig edits, offline on frozen R173 files", "frontier": "robust localization (median/MAD + J90 vs mean/sig + J95)", "variation": "T207 mean/sig/J95/lam-sweep -> T209 med/MAD/J90/lam-fixed-0.5 + global tie-break", "timestamp": "2026-09-28T00:00:00Z", "evidence_artifacts": ["results/aegis_v2/I2_r209_analysis.py", "results/aegis_v2/I2_r209_result.json"]}
