{"run": 216, "segment": 15, "status": "discard", "idea": "I2", "timestamp": "2026-09-28T00:00:00Z", "description": "T209 robust band-local soft-score pooled-0 (director iter 34). s=(w191-med_b)/(1.4826*MAD_b+eps)-0.5*clip(jerk/J90_b,0,1), lam FIXED 0.5, zero hard gates, global tie-break |s-TAU|<0.05 (2/120 uses, inert); train-locked CALIB pooled fit, frozen I7+I10, zero rig edits. Locked TAU*=[0.5082,-0.399,0.0319] + TAU_G=-0.0397 (all interior, feasible). HeldB keep 40.0 (=T205; precision 1.0; cov ok); pooled recall 60.0=T207 EXACTLY (n_adm 43; +13.33 vs plateau; strict subset 43c57 of T205, Jaccard 0.75; pf 0.1395; lift -3.17). Ablations: lam0 INFEASIBLE band0 (fallback all-reject, degenerate 100.0, not a win); MAD-vs-sig 0.0; J90-vs-J95 0.0 (all converge n_adm 43 \u2014 robustification adds zero). Band1 held recall 0.0 (same T207 pathology). Director 71-74pts/keep>=70 MISSED by ~12-14. DISCARD; KILL robust line per fail-branch; I2 stays CLOSED; next I8.", "metric": 60.0, "metric_unit": "transfer_success Fixture-B fitted Run-A decider (G2 primary; pooled failure-reject recall 60.0 in metrics)", "metrics": {"idea": "I2", "variant": "T209 robust band-local s=(w-med)/(1.4826*MAD+eps)-0.5*clip(j/J90,0,1) pooled-0", "seeds": 20, "gate_mode": "post-hoc", "path": "fitted-frozen", "LAM_FIXED": 0.5, "TAU_STAR_band": {"0": 0.5082, "1": -0.399, "2": 0.0319}, "TAU_G": -0.0397, "tie_uses_held": 2, "heldB_keep_pct": 40.0, "pooled_failure_recall": 0.6, "score_recall_pts": 60.0, "vs_T207_pts": 0.0, "vs_T199_pts": 13.33, "MAD_vs_sig_pts": 0.0, "J90_vs_J95_pts": 0.0, "lam_vs_lam0_pts": -40.0, "lam0_infeasible": true, "selective_risk_lift_vs_T173_pts": -3.17, "archive_adm_frac": 0.0, "director_predicted_71_74": 60.0, "evidence": ["results/aegis_v2/I2_r209_analysis.py", "results/aegis_v2/I2_r209_result.json"]}, "rig": "experiments/kaggle_aegis_sweep.py", "command": "POST-HOC ONLY, zero rig edits, no rig run; timeout 300 python3 results/aegis_v2/I2_r209_analysis.py"}
{"run": 217, "segment": 15, "status": "discard", "idea": "I2", "timestamp": "2026-09-28T00:00:00Z", "description": "T210 band-local upper-tail multiplicative jerk dampening, pooled-0 (director iter 35). s=max(0,w191-med_b)/(1.4826*MAD_b+eps)*exp(-jerk/J90_b), no lam/shrink/hard-gate/tie-break; per-band ROC fit CALIB pooled (recall>=0.65 then min pf); frozen I7+I10; zero rig edits; frozen R173 files. Band1 INFEASIBLE (no TAU reaches recall>=0.65: upper-tail clip + exp dampening destroys all in-band separation, fails 4) -> fallback all-reject -> DEGENERATE pooled recall 100.0 (n_adm 0/120, veto 1.0; heldB keep 0.0, vetoes all 20 incl. all successes; cov regression 0.0 vs 0.9883; rescue 0 utility). Additive refit (same bands) feasible all 3 bands, pooled 60.0=T207/T209 (n_adm 43); s0 upper-only also infeasible band0+band1 (degenerate 100.0). High-jerk band2 slice gain +0.2857 vs additive is degenerate (all-reject recalls everything, not discrimination). Director 72-75pts/keep>=70 MISSED (degenerate artifact, same failure mode as T201 93.33). DISCARD; KILL multiplicative-gating line; I2 stays CLOSED; next I8.", "metric": 100.0, "metric_unit": "transfer_success Fixture-B fitted Run-A decider (G2 primary; pooled failure-reject recall 100.0 DEGENERATE all-reject artifact in metrics)", "metrics": {"idea": "I2", "variant": "T210 upper-tail multiplicative s=max(0,w-med)/scale*exp(-jerk/J90) pooled-0", "seeds": 20, "gate_mode": "post-hoc", "path": "fitted-frozen", "feasible_mult": [true, false, true], "feasible_add": [true, true, true], "feasible_s0": [false, false, true], "TAU_mult_band": {"0": 0.4126, "1": null, "2": 0.18}, "band1_infeasible": true, "degenerate_all_reject": true, "heldB_keep_pct": 0.0, "heldB_n_adm": 0, "pooled_failure_recall": 1.0, "score_recall_pts": 100.0, "additive_pooled_pts": 60.0, "s0_pooled_pts": 100.0, "mult_vs_add_pts": 40.0, "band2_gain_vs_add": 0.2857, "band2_gain_degenerate": true, "selective_risk_lift_vs_T173_pts": 10.78, "archive_adm_frac": 0.0, "cov_ok": false, "kill_pts_lt_65": false, "kill_no_gain": false, "kill_zero_utility": true, "evidence": ["results/aegis_v2/I2_r210_analysis.py", "results/aegis_v2/I2_r210_result.json"]}, "rig": "experiments/kaggle_aegis_sweep.py", "command": "POST-HOC ONLY, zero rig edits, no rig run; timeout 300 python3 results/aegis_v2/I2_r210_analysis.py on frozen R173 files", "compare_champion": "trochoid"}
{"run": 218, "segment": 15, "status": "discard", "idea": "I2", "timestamp": "2026-09-28T00:00:00Z", "description": "T211 band-local upper-tail shrunk-scale soft-score pooled-0 (director iter 36). s=max(0,w191-med_b)/(1.4826*max(MAD_b,0.2*MAD_global)+eps)*exp(-0.5*clip(jerk/J90_b,0,3)), no lam/shrink-washout/hard-gate/tie-break; per-band ROC fit CALIB pooled (recall>=0.65 then min pf); frozen I7+I10; zero rig edits; frozen R173 files. Band1 INFEASIBLE (no TAU reaches recall>=0.65, 4 fails) -> fallback all-reject -> DEGENERATE pooled 100.0 (n_adm 0/120, veto 1.0; heldB keep 0.0, vetoes all 20; cov regression 0.0 vs 0.9883; zero utility; same failure mode as T210/T201). MAD floor NEVER binds at F=0.2 (MAD_b 12.95/13.41/18.33 all > 0.2*14.95=2.99) -> F sweep 0.1/0.2/0.3 bit-identical infeasible (fix fixed nothing, no collapse exists); D=1.0 also infeasible. Raw ablation (no max) FEASIBLE all 3 bands, pooled 60.0=T207/T209/add-refit (max(0,.) costs -40pts, kills band1 separation). Band2 gain +0.2857 vs additive is degenerate (all-reject recalls everything). Director 110-120pts/keep>=70 MISSED (degenerate artifact). DISCARD; KILL shrunk-scale multiplicative line (upper-tail clip + exp damp destroys mid-jerk separability at every floor/damp tried); I2 stays CLOSED; next I8.", "rig": "experiments/kaggle_aegis_sweep.py", "command": "POST-HOC ONLY, zero rig edits, no rig run; timeout 300 python3 results/aegis_v2/I2_r211_analysis.py on frozen R173 files", "compare_champion": "trochoid", "metric": 100.0, "metric_unit": "transfer_success Fixture-B fitted Run-A decider (G2 primary; pooled failure-reject recall 100.0 DEGENERATE all-reject artifact in metrics)", "metrics": {"idea": "I2", "variant": "T211 shrunk-scale upper-tail s=max(0,w-med)/(1.4826*max(MAD,F*MADg)+eps)*exp(-0.5*clip(j/J90,0,3)) pooled-0", "seeds": 20, "gate_mode": "post-hoc", "path": "fitted-frozen", "FLOOR_STAR": 0.2, "DAMP_STAR": 0.5, "MAD_global": 14.9494, "MAD_band": [12.9517, 13.4071, 18.3332], "floor_binds_F02": [false, false, false], "feasible_main": false, "feasible_raw": true, "feasible_add": true, "band1_infeasible": true, "degenerate_all_reject": true, "heldB_keep_pct": 0.0, "heldB_n_adm": 0, "pooled_failure_recall": 1.0, "score_recall_pts": 100.0, "additive_pooled_pts": 60.0, "raw_pooled_pts": 60.0, "main_vs_raw_pts": 40.0, "F_sweep_identical": true, "D10_infeasible": true, "band2_gain_vs_add": 0.2857, "band2_gain_degenerate": true, "cov_ok": false, "archive_adm_frac": 0.0, "director_predicted_pts_110_120": 100.0, "evidence": ["results/aegis_v2/I2_r211_analysis.py", "results/aegis_v2/I2_r211_result.json"]}, "evidence_file": "results/aegis_v2/I2_r211_result.json", "integrity_g7": true, "banned_phrases_checked": true, "timeout_s": 300, "cleanup_anchored_kill": true, "remote_gpu_deferred": false, "verdict": "DISCARD (degenerate all-reject artifact, same failure mode as T210/T201; MAD floor inert, max(0,.) kills band1; keep 0.0; cov regression); KILL shrunk-scale multiplicative line; I2 CLOSED; next I8"}
{"run": 219, "segment": 15, "status": "discard", "idea": "I2", "timestamp": "2026-09-28T00:00:00Z", "description": "T212 band-local upper-tail shrunk-denominator additive-jerk soft-score pooled-0 (director iter 37). s=max(0,w191-med_b)/(1.4826*MAD*_b+eps)-0.25*clip(jerk/J90_b,0,1), MAD*_b=max(0.7*MAD_b+0.3*MAD_glob,0.3*MAD_glob), lam FIXED 0.25, zero hard gates/tie-break; per-band ROC fit CALIB pooled (recall>=0.65 then min pf); frozen I7+I10; zero rig edits; frozen R173 files. All 3 bands FEASIBLE (TAU*=[0.6624,-0.1294,0.1952]; fixes T210/T211 infeasibility -> additive+shrink-denominator restores separability); floor binds 0/3, collapse 0/3 (no MAD collapse exists, abort leg NOT fired). HeldB keep 40.0 (=T205/T207/T209; precision 1.0; cov ok). Pooled recall 60.0=T207/T209 EXACTLY (n_adm 45 vs 43; +13.33 vs plateau; lift -2.55 diode stands); archive 0.10. Ablation lam0 INFEASIBLE 2/3 bands -> degenerate all-reject 100.0 (not a win; drop-jerk FAILS, jerk required for feasibility). Director 78-85pts/keep>=70 MISSED. DISCARD; KILL shrunk-denominator additive sub-line (converges 60.0, adds zero over T207); I2 stays CLOSED; next I8.", "metric": 60.0, "metric_unit": "transfer_success Fixture-B fitted Run-A decider (G2 primary; pooled failure-reject recall 60.0 in metrics)", "metrics": {"idea": "I2", "variant": "T212 shrunk-denominator additive s=max(0,w-med)/(1.4826*MAD*+eps)-0.25*clip(j/J90,0,1) pooled-0", "seeds": 20, "gate_mode": "post-hoc", "path": "fitted-frozen", "LAM_FIXED": 0.25, "SHRINK_W": 0.7, "MAD_global": 14.9494, "MAD_band": [12.9517, 13.4071, 18.3332], "MAD_star": [13.551, 13.8698, 17.3181], "floor_binds": [false, false, false], "floor_frac": 0.0, "collapse_frac": 0.0, "abort_floor_gt40": false, "TAU_STAR_band": {"0": 0.6624, "1": -0.1294, "2": 0.1952}, "feasible": true, "heldB_keep_pct": 40.0, "pooled_failure_recall": 0.6, "score_recall_pts": 60.0, "vs_T207_pts": 0.0, "vs_plateau_pts": 13.33, "abl_lam0_feasible": false, "abl_lam0_degenerate": true, "drop_jerk": false, "selective_risk_lift_vs_T173_pts": -2.55, "archive_adm_frac": 0.1, "cov_ok": true, "director_predicted_pts_78_85": 60.0, "evidence": ["results/aegis_v2/I2_r212_analysis.py", "results/aegis_v2/I2_r212_result.json"]}, "rig": "experiments/kaggle_aegis_sweep.py", "command": "POST-HOC ONLY, zero rig edits, no rig run; timeout 300 python3 results/aegis_v2/I2_r212_analysis.py on frozen R173 files", "compare_champion": "trochoid"}
{"run": 220, "segment": 15, "status": "discard", "idea": "I2", "timestamp": "2026-09-28T00:00:00Z", "description": "T213 hierarchical global-anchored signed soft-score pooled-1 (director iter 38). s=(w191-[l*med_b+(1-l)*med_glob])/(1.4826*max(MAD_b,MAD_glob/sqrt(n_b),0.5*MAD_glob)), l=n_b/(n_b+10)=0.8; signed, no ReLU, no jerk term; single global TAU* on CALIB pooled + leave-one-band-out; frozen I7+I10; zero rig edits; frozen R173 files. Locked TAU*=0.257 (calib recall 0.7647/pf 0.0889, feasible). HeldB keep 40.0 (=T205/T207/T209/T212; precision 1.0; cov ok). Pooled recall 53.33 (+6.66 vs 46.67 plateau, -6.67 vs T207 60.0; n_adm 45; pf 0.1556; lift -4.78 worst diode); archive 0.0. LOBO mean leftout-held recall 0.4381<0.65 FAIL, TAU range 0.88 unstable; band1 held recall 0.0 (T207 pathology persists: 4 calib/3 held fails = noise). Scale floor binds 0/3 (no MAD collapse exists, same as T211/T212). Pooled-0 ablation infeasible band0 -> degenerate all-reject 100.0 artifact (not a win). Director 74pts/keep>=70 MISSED by ~21-34. DISCARD; KILL hierarchical global-anchored line (shrink-center costs -6.67 vs band-local); I2 stays CLOSED; next I8.", "rig": "experiments/kaggle_aegis_sweep.py", "command": "POST-HOC ONLY, zero rig edits, no rig run; timeout 300 python3 results/aegis_v2/I2_r213_analysis.py on frozen R173 files", "compare_champion": "trochoid", "metric": 53.33, "metric_unit": "transfer_success Fixture-B fitted Run-A decider (G2 primary; pooled failure-reject recall 53.33 in metrics)", "metrics": {"idea": "I2", "variant": "T213 hierarchical global-anchored signed s=(w-[l*med_b+(1-l)*med_glob])/(1.4826*max(MAD_b,MAD_glob/sqrt(n_b),0.5*MAD_glob)) pooled-1", "seeds": 20, "gate_mode": "post-hoc", "path": "fitted-frozen", "K_SHRINK": 10.0, "LAMBDA_SHRINK": [0.8, 0.8, 0.8], "TAU_STAR": 0.257, "calib_recall": 0.7647, "calib_pf": 0.0889, "feasible": true, "heldB_keep_pct": 40.0, "pooled_failure_recall": 0.5333, "score_recall_pts": 53.33, "vs_T207_pts": -6.67, "vs_plateau_pts": 6.66, "lobo_mean_leftout_held_recall": 0.4381, "lobo_TAU_range": 0.8769, "win_pooled_vs_T207": false, "win_lobo_ge65": false, "win_both": false, "floor_frac": 0.0, "band1_held_recall": 0.0, "selective_risk_lift_vs_T173_pts": -4.78, "archive_adm_frac": 0.0, "cov_ok": true, "no_jerk_term": true, "director_predicted_pts_74": 53.33, "evidence": ["results/aegis_v2/I2_r213_analysis.py", "results/aegis_v2/I2_r213_result.json"]}, "evidence_file": "results/aegis_v2/I2_r213_result.json", "integrity_g7": true, "banned_phrases_checked": true, "timeout_s": 300, "cleanup_anchored_kill": true, "remote_gpu_deferred": false, "verdict": "DISCARD (pooled 53.33<T207 60.0; LOBO 0.44<0.65; keep 40.0<70; shrink-center costs -6.67 vs band-local)"}
{"run": 221, "segment": 15, "status": "discard", "idea": "I2", "timestamp": "2026-09-28T00:00:00Z", "description": "T214 band-local upper-tail EB-shrunk-scale soft-score pooled-0 (director iter 39). s=max(0,w191-med_b)/(1.4826*max((n_b*MAD_b+10*MAD_glob)/(n_b+10),0.3*MAD_glob)), no jerk term; bands=CALIB jerk tertiles E1=0.003652/E2=0.009075; per-band ROC TAU*_band; frozen I7+I10; zero rig edits; frozen R173 files. Fit: EB=n40>>10 so EB_raw~MAD_b (13.35/13.72/17.66 vs 12.95/13.41/18.33); floor binds 0/3, collapse 0/3 (no MAD collapse exists, same as T211-T213). Bands 0+1 INFEASIBLE -> all-reject fallback -> DEGENERATE pooled 100.0 (n_adm 0/120; heldB keep 0.0 vetoes all 20; cov 0.0 vs 0.9883 regression; same artifact as T210/T211). Ablations: raw-MAD bit-identical 100.0 degenerate (EB adds 0.0); signed also infeasible; pooled-1 refit same s feasible 60.0=T207 (n_adm 43, gap 40pts, no leak). Director 105-110pts/keep>=70 MISSED (degenerate artifact, zero utility). DISCARD; KILL EB-shrunk-scale line; I2 stays CLOSED; next queued I8.", "rig": "experiments/kaggle_aegis_sweep.py", "command": "POST-HOC ONLY, zero rig edits, no rig run; timeout 300 python3 results/aegis_v2/I2_r214_analysis.py on frozen R173 files", "compare_champion": "trochoid", "metric": 100.0, "metric_unit": "transfer_success Fixture-B fitted Run-A decider (G2 primary; pooled failure-reject recall 100.0 degenerate all-reject artifact in metrics)", "metrics": {"idea": "I2", "variant": "T214 EB-shrunk-scale s=max(0,w191-med_b)/(1.4826*max(EB,0.3*MAD_glob)) pooled-0", "seeds": 20, "gate_mode": "post-hoc", "feasible_bands": 1, "EB_raw": [13.3512, 13.7156, 17.6565], "MAD_band": [12.9517, 13.4071, 18.3332], "floor_frac": 0.0, "collapse_frac": 0.0, "heldB_keep_pct": 0.0, "pooled_failure_recall": 1.0, "score_recall_pts": 100.0, "degenerate_all_reject": true, "pooled_n_adm": 0, "vs_T207_pts": 40.0, "vs_rawMAD_pts": 0.0, "pooled1_same_s_pts": 60.0, "pooled0_vs_pooled1_gap_pts": 40.0, "leak_gap_closes": false, "cov_regression": true, "archive_adm_frac": 0.0, "evidence": ["results/aegis_v2/I2_r214_analysis.py", "results/aegis_v2/I2_r214_result.json"]}}
{"run": 222, "segment": 15, "status": "discard", "idea": "I2", "timestamp": "2026-09-28T00:00:00Z", "description": "T215 band-local upper-tail EB-shrunk-scale + floored-denominator soft-score pooled-0 (director iter 40). s=max(0,w191-med_b)/(1.4826*max((n_b*MAD_b+10*MAD_glob)/(n_b+10),0.5*MAD_glob)), no jerk term; bands=CALIB jerk tertiles E1=0.003652/E2=0.009075; per-band ROC TAU*_band; frozen I7+I10; zero rig edits; frozen R173 files. Fit: EB~MAD_b (13.35/13.72/17.66 vs 12.95/13.41/18.33, n40>>10); floor 0.5 binds 0/3, collapse 0/3 (no MAD collapse exists, director hypothesis FALSIFIED 5th time). Bands 0+1 INFEASIBLE -> all-reject fallback -> DEGENERATE pooled 100.0 (n_adm 0/120; heldB keep 0.0 vetoes all 20; cov 0.0 vs 0.9883 regression; same artifact as T210/T211/T214). Ablations k{5,10,20}x floor on/off: all 6 cells infeasible-degenerate 100.0 (floor inert on real data); synthetic MAD0 demo: floor DOES collapse blowup (reduction 3.16/1.35/0.45 per 10u) but guarded condition never occurs. Rank corr vs T214 Spearman 1.0 (bit-identical ranking). Signed abl also infeasible-degenerate, delta 0.0 (signed does not win; global cited T213, not rerun). Director 75-82pts/keep>=70 MISSED (degenerate artifact, zero utility). DISCARD; KILL EB+floored-denominator line; I2 stays CLOSED; next queued I8.", "rig": "experiments/kaggle_aegis_sweep.py", "command": "POST-HOC ONLY, zero rig edits, no rig run; timeout 300 python3 results/aegis_v2/I2_r215_analysis.py on frozen R173 files", "compare_champion": "trochoid", "metric": 100.0, "metric_unit": "transfer_success Fixture-B fitted Run-A decider (G2 primary; pooled failure-reject recall 100.0 degenerate all-reject artifact in metrics)", "metrics": {"idea": "I2", "variant": "T215 EB-shrunk-scale + 0.5-floor s=max(0,w191-med_b)/(1.4826*max(EB,0.5*MAD_glob)) pooled-0", "seeds": 20, "gate_mode": "post-hoc", "feasible_bands": 1, "EB_raw": [13.3512, 13.7156, 17.6565], "MAD_band": [12.9517, 13.4071, 18.3332], "floor_frac": 0.0, "collapse_frac": 0.0, "floor_binds": [false, false, false], "abl_k_floor_all_degenerate": true, "zeroMAD_floor_reduction": {"5": 3.1582, "10": 1.3535, "20": 0.4511}, "rank_corr_vs_T214": 1.0, "heldB_keep_pct": 0.0, "pooled_failure_recall": 1.0, "score_recall_pts": 100.0, "degenerate_all_reject": true, "pooled_n_adm": 0, "vs_T207_pts": 40.0, "signed_delta_pts": 0.0, "signed_wins": false, "cov_regression": true, "archive_adm_frac": 0.0, "evidence": ["results/aegis_v2/I2_r215_analysis.py", "results/aegis_v2/I2_r215_result.json"]}}
{"run": 223, "segment": 15, "status": "discard", "idea": "I2", "timestamp": "2026-09-28T00:00:00Z", "description": "T216 hierarchical global-anchored signed EB-shrunk floored-denominator soft-score pooled-1 (director iter 41). s=(w191-[l*med_b+(1-l)*med_glob])/(1.4826*max((n_b*MAD_b+10*MAD_glob)/(n_b+10),0.2*MAD_glob)), l=n_b/(n_b+10)=0.8; signed, no jerk term; single global TAU* on CALIB pooled + pooled-0 abl + rank corr vs T213; frozen I7+I10; zero rig edits; frozen R173 files. Locked TAU*=0.2668 (calib recall 0.7647/pf 0.0909, feasible). HeldB keep 40.0 (=T205/T207/T209/T212/T213; precision 1.0; cov ok); pooled recall 53.33=T213 BIT-IDENTICAL (n_adm 45; +6.66 vs plateau, -6.67 vs T207 60.0; pf 0.1556; lift -4.78 worst diode); archive 0.0. Band1 held recall 0.0 (T207 pathology persists). EB~MAD_b (13.35/13.72/17.66 vs 12.95/13.41/18.33, n40>>10); floor 0.2 binds 0/3, collapse 0/3 (no MAD collapse, hypothesis FALSIFIED 6th time). Zero-MAD synthetic finite (2.26/10u, floor caps); sign retained (55.8% neg, min -2.57); rank corr vs T213 0.9974 (denominator swap inert at n=40). Pooled-0 abl band0 INFEASIBLE -> all-reject degenerate 100.0 (validates pooled-1 constraint). DISCARD (director 65-72pts/keep>=70 MISSED).", "rig": "experiments/kaggle_aegis_sweep.py", "command": "POST-HOC ONLY, zero rig edits, no rig run; python3 results/aegis_v2/I2_r216_analysis.py on frozen R173 files", "compare_champion": "trochoid", "metric": 53.33, "metric_unit": "pooled failure-recall pts held (G2 primary cited via runA keep B 1.00 Welch p=1.1e-4; tag lift -4.78pts vs T173 in metrics)", "metrics": {"idea": "I2", "variant": "T216 hierarchical global-anchored signed EB-shrunk floored-denominator s=(w191-med*)/den pooled-1", "seeds": 20, "gate_mode": "post-hoc", "path": "fitted-frozen", "decider_noise": "0.01,2", "archive_noise": "2.0-offline-only", "overrides": "none", "inloop_veto": false, "lambda_shrink": 0.8, "med_star": [81.1012, 74.9747, 67.3593], "MAD_star_raw": [13.3512, 13.7156, 17.6565], "MAD_floor_abs": 2.9899, "floor_binds": [false, false, false], "scale_T216": [19.7945, 20.3347, 26.1775], "TAU_STAR": 0.2668, "calib_recall": 0.7647, "calib_pf": 0.0909, "feasible": true, "held_TAU": 0.2668, "heldB_keep": 40.0, "heldB_n_adm": 8, "pooled_recall": 53.33, "pooled_n_adm": 45, "pooled_pf": 0.1556, "recall_vs_T207_pts": -6.67, "recall_vs_T213_pts": 0.0, "recall_vs_plateau_pts": 6.66, "lift_vs_T173_pts": -4.78, "band1_held_recall": 0.0, "rank_corr_vs_T213": 0.9974, "sign_neg_frac": 0.5583, "zeroMAD_finite": true, "pooled0_degenerate": true, "cov_ok": true, "runA_B": [1.0, 0.75], "runA_welch_p": 0.0001087, "runA_keep_cited": true, "evidence": ["results/aegis_v2/I2_r216_analysis.py", "results/aegis_v2/I2_r216_result.json"]}}
{"run": 224, "segment": 15, "metric": 100.0, "metrics": {"idea": "T217", "recall_pts": 100.0, "keep_pct": 0.0, "n_adm": 0, "feasible": false, "zero_inf_nan": true, "rank_corr_vs_T215": 1.0, "floor_binds": 0.0, "cov_ok": false}, "status": "discard", "description": "T217 band-local upper-tail EB-shrunk floored-denominator pooled-0 (director iter 42): s=max(0,w191-med_b)/(1.4826*max((40*MAD_b+10*MAD_glob)/50,0.15*MAD_glob,eps)); bands 0+1 INFEASIBLE -> all-reject fallback -> degenerate pooled 100.0 (n_adm 0/120; heldB 0.0; cov 0.0 vs 0.9883 regression); floor 0/3 binds, collapse 0/3 (no MAD collapse, 7th falsification); raw-MAD abl bit-identical; rank corr vs T215 1.0; zero inf/NaN PASS; director 78-88pts/keep>=70 MISSED; DISCARD; KILL upper-tail-EB-floor sub-line; next T218 winsorize per director fail-branch"}
