{"run": 238, "segment": 15, "status": "keep", "idea": "I21", "timestamp": "2026-09-29T10:40:00Z", "rig": "canonical rig experiments/kaggle_aegis_sweep.py (PyBullet DIRECT, system python3, 20 seeds x 3 suites x 2 paired arms, rig_version 2, pose_noise 0,0); pts_source=physics_contact; coverage_cont/success recomputed from physics contacts at return time; ZERO rig edits this iteration (analysis-only, the diagnosis is made in closed form against the rig's own scoring kernel)", "command": "timeout 1200 python3 experiments/kaggle_aegis_sweep.py --seeds 20 --no-upload --path fitted --compare trochoid --suites fixture_A,fixture_B,fixture_R --out results/aegis_v2/I21_r238_fitted_vs_trochoid_n00.jsonl   (diagnostics, no physics: timeout 300 python3 results/aegis_v2/I21_r238_analytic.py ; timeout 300 python3 results/aegis_v2/I21_r238_v1_attribution.py)", "compare_champion": "in-rig --compare trochoid on the SAME 20 seeds -> same friction / tool / customer draw / pose noise. Baseline arm reproduced the frozen champion exactly (fixture_B coverage_cont 0.9453, success 20/20, path_len 0.9098 m = the documented v2_trochoid_0,0 values).", "metric": 1.0, "metric_unit": "fixture_B transfer_success (coverage_cont>=0.90) of the `fitted` arm, 20/20 seeds; rig compare record keep=true (G4: >=20 seeds AND B>0.70 AND Welch p<0.01)", "metrics": {"idea": "I21", "lane": "CPU canonical rig", "screens": 0, "variant": "I21 diagnosis: root cause of the historical `fitted` B 0.20, then paired re-decider of the shipped `fitted` pitch vs the frozen champion trochoid", "root_cause": "The I21 spec premise ('fitted got B 0.20 vs trochoid 1.00') is STALE: it describes the v1 `fitted` of commit ac8bc4b, not the path the rig ships. v1 is reconstructed verbatim in closed form and scored with the rig's own fine-cell kernel (_coverage_cont: fine pitch 0.025 m, cell covered iff a contact lies within r_eff of the centre), so the loss is ATTRIBUTED, not asserted. On fixture-B, v1 emitted ONE row: v_start = -side/2 + r_eff = -0.025, v_end = +side/2 - r_eff = +0.025, pitch p = 2*r_eff*0.8 = 0.056, so the while-loop places v=-0.025 and then stops at v=+0.031 > v_end. One row dilated by r_eff=0.035 spans 0.070 m of the 0.120 m patch, and the u-axis inset (-half+r_eff .. +half-r_eff) additionally shaves the two u end columns. Analytic ceiling of v1 verbatim: fixture_B 0.8021, fixture_A 0.9306 -- and 100.00% of the missed fine cells are RIM cells on every suite x tool cell (rim/interior miss split = 1.00/0.00), which is the signature of a band that does not SPAN, not of an interior pitch stripe and not of a phase bug. Marginal recovery of each single change, fixture-B ceiling: remove the u-inset only -> 0.8333 (+0.0312); make the row walk span the inset sub-rect only -> 0.8125 (+0.0104); both -> 0.8333; the shipped v2 rule n = ceil(side/(2*r_eff)) rows placed at the band centres with NO inset -> 1.0000 (+0.1979, 2 rows, pitch 0.060 m). Verdict on the spec's three hypotheses: (a) pitch math -- YES, the row plan never spanned the patch; (b) inset -- secondary, +0.0312 on B and only because it double-counts a footprint the scoring kernel already applies; (c) phase bug -- REFUTED, no interior miss exists in any variant.", "class_level": "The defect is a class, not an instance: any footprint-aware pitch plan parameterised by an INSET sub-rect inherits it, because the scorer already inflates every contact by r_eff, so the plan must span the PATCH at pitch <= 2*r_eff with no inset. That is exactly the v2 rule and it is what ships. Nothing further is left to fix in the pitch, so I10 closes WITH a cause rather than open-ended.", "champion_ceiling": "The same kernel run on the champion: trochoid's analytic ceiling is 0.9219 / 0.9531 / 1.0000 on fixture-B for the three pads (mean 0.9583) and 100% of ITS misses are also rim cells. The champion clears the 0.90 gate only because pad 2's footprint is large enough to cover the rim; pads 0 and 1 cannot reach 1.0 on geometry alone. `fitted` reaches 1.0000 on all six suite x tool cells, so the physics run confirms the head realises the ceiling exactly rather than adding any recovery.", "fixture_B": {"n": 20, "success": 1.0, "success_count": 20, "mean_coverage_cont": 1.0, "min_coverage_cont": 1.0, "std_coverage_cont": 0.0, "path_len_m": 0.8939}, "fixture_A": {"n": 20, "success": 1.0, "mean_coverage_cont": 1.0}, "fixture_R": {"n": 20, "success": 1.0, "mean_coverage_cont": 1.0}, "paired_vs_champion_trochoid": {"fixture_B": {"coverage_cont_a": 0.9453, "coverage_cont_b": 1.0, "delta": 0.0547, "welch_p": 5.26e-06, "paired_p": 5.26e-06, "fisher_p_success": 1.0, "succ_a": 20, "succ_b": 20}, "fixture_A": {"coverage_cont_a": 0.9354, "coverage_cont_b": 1.0, "delta": 0.0646, "welch_p": 1.35e-09, "fisher_p_success": 1.0}, "fixture_R": {"coverage_cont_a": 0.9427, "coverage_cont_b": 1.0, "delta": 0.0573, "welch_p": 1.24e-06, "succ_a": 19, "succ_b": 20, "fisher_p_success": 1.0}, "rig_keep": true}, "success_caveat": "At pose_noise 0,0 BOTH arms are already saturated at 20/20, so the Fisher p on success is 1.0 and the whole signal is coverage_cont. The success-margin claim for `fitted` therefore rests on the earlier 20-seed paired decider at the rig's nominal planning error (run 165 / run 170, AEGIS_POSE_NOISE=0.01,2: fitted B 0.875 vs trochoid B 0.750), which is cited here as prior evidence, NOT re-claimed from this run.", "honest_caveats": "(1) `path_len_m` is logged from scrub_uv(spec, mode) with the DEFAULT r_eff=0.035, not the pad's own r_eff, so on fixture-A pad 2 the logged length (1.3878 m) overstates the commanded path (0.9409 m) and the step budget therefore gives that one arm ~2.2x the intended speed. On fixture-B all three pads plan the identical 2-row path (0.8939 m), so the G2 metric carries no such confound. Left unedited: path_len_m is a log-only field, it touches no scored quantity, and changing the step budget would silently re-time every other idea's episodes. (2) fixture-A pad 2 is the only cell where the two are not identical, and it is 1.0000 there anyway. (3) The rig's documented limits stand: force-driven pad with no arm, flat top faces, normal force ~0.5 N in rig units, Tier-4 gate is a post-hoc tag.", "director_iter7_facc_adjudication": "The iter-7 director build (FACC-E: SE(3)-conditioned energy-guided flow replacing the pi0 action expert) is ADJUDICATED, NOT EXECUTED, on the same grounds recorded for runs 234-237: G4 requires a paired --compare record from the canonical rig and the canonical rig is a force-driven pad with no learned action head, so no such record is constructible; the pi0 policy and its demo keypoints cannot be built locally because checkpoints may never be downloaded; G3 permanently retires flow-bridge / energy-gated re-derivations; and the FACC line is already closed twice on physical data (T225 run 232, T226 run 233).", "evidence": ["results/aegis_v2/I21_r238_fitted_vs_trochoid_n00.jsonl (compare record, keep=true, pose_noise_cfg 0,0)", "results/aegis_v2/I21_r238_analytic.py + I21_r238_analytic.json (ceiling of raster/trochoid/fitted on all 6 suite x tool cells)", "results/aegis_v2/I21_r238_v1_attribution.py + I21_r238_v1_attribution.json (verbatim v1 from ac8bc4b, one-defect-at-a-time attribution)"], "next_executable": "I18 (trochoid loops x the fixed fitted pitch). It is now unblocked and its outcome is PREDICTED by the ceiling table, not guessed: trochoid and `fitted` lose the SAME cells to the SAME cause (100% rim), so the composition is predicted to hit ceiling 1.0, which `fitted` alone already attains -- I18 can only be justified by a non-coverage win (path length / cycle time), not by coverage. If the director wants a strictly higher frontier bar, run I18 against the coverage ceiling 1.0000 and treat a tie as a discard."}, "notes": "I10 closes WITH a cause. `fitted` is the physical coverage champion on the flat rig (B 1.00, coverage_cont 1.0000 on every one of 20 seeds, Welch p=5.26e-06 vs the paired champion) but the campaign champion for the keep metric stays trochoid until the composition I18 is run."}
{"run": 239, "segment": 15, "status": "discard", "idea": "I18", "timestamp": "2026-09-29T11:05:00Z", "rig": "canonical rig experiments/kaggle_aegis_sweep.py (PyBullet DIRECT, system python3, 20 seeds x 3 suites x 2 paired arms, rig_version 2, pose_noise 0,0); pts_source=physics_contact; coverage_cont/success recomputed from physics contacts at return time; ONE rig edit this iteration: the champion loop operator extracted verbatim into _loops_offset() and reused by a new path mode `fitro` = fitted rows x trochoid loops (regression: champion arm bit-identical, 2280 compared fields x 60 episodes, 0 differences outside the wall_s clock field)", "command": "timeout 1200 python3 experiments/kaggle_aegis_sweep.py --seeds 20 --no-upload --path fitro --compare trochoid --suites fixture_A,fixture_B,fixture_R --out results/aegis_v2/I18_r239_fitro_vs_trochoid_n00.jsonl   (pre-count, no physics: timeout 300 python3 results/aegis_v2/I18_r239_analytic.py ; read-out: timeout 300 python3 results/aegis_v2/I18_r239_analyse.py <jsonl> ; regression: --path trochoid -> results/aegis_v2/I18_r239_regression_flat_POST-edit.jsonl)", "compare_champion": "in-rig --compare trochoid on the SAME 20 seeds -> same friction / tool / customer draw / pose noise. Baseline arm reproduced the frozen champion exactly (fixture_B coverage_cont 0.9453, success 20/20, path_len 0.9098 m; fixture_A 0.9354, fixture_R 0.9427 / 19-20), verified field-by-field against run 238's baseline arm.", "metric": 1.0, "metric_unit": "fixture_B transfer_success (coverage_cont>=0.90 per episode) of the `fitro` arm, 20/20 seeds; rig compare record keep=true (G4 mechanical: >=20 seeds AND B>0.70 AND Welch p<0.01)", "metrics": {"idea": "I18", "lane": "CPU canonical rig", "screens": 0, "variant": "I18: composition of the two best-understood path pieces -- `fitted`'s footprint-aware row plan x the champion trochoid scrub loops, as one new path mode `fitro` (only the row plan differs; the loop operator is shared verbatim, not re-derived)", "director_directive_adjudication": "Director iter-9 FACC build (swap the pi0 flow-matching head for an SE(3)-conditioned contact-energy scorer + Langevin argmin, predicted 78) ADJUDICATED, NOT EXECUTED, on the run 234/235/236/237 precedent: no paired --compare record is possible for a learned action head in the canonical rig (G4); no local pi0 and checkpoints may never be downloaded; G3 permanently retires energy-gated / flow-bridge re-derivations (a wrench-history-conditioned energy scorer IS that family); and the FACC line is already closed twice on physical data (T225 r232 degenerate all-reject, T226 r233 78/78 infeasible). Its own text also scores itself 4.5 pts, 'not BEST (<70)'. The lowest-numbered queued idea executable in the canonical rig was run instead, per the segment protocol.", "pre_count_no_physics": "Priced in closed form with the rig's own fine-cell kernel BEFORE the run (0.5 s, no physics): ceiling(fitted)=1.0000 on all six suite x tool cells; ceiling(fitro)=0.9688/0.9896/0.9479 (A) and 0.9531/0.9844/1.0000 (B); L(fitro)/L(fitted)=1.0132 (A) / 1.0139 (B); C1 preserved (max turn 32.70 / 15.46 deg vs the 60 deg bar). Prediction registered: the composition is dominated by its own part -> DISCARD.", "result_vs_champion": "fitro DOES beat the paired champion on coverage_cont on all three suites: A 0.9354->0.9719 (+0.0365, Welch p 3.92e-05), B 0.9453->0.9836 (+0.0383, Welch p 6.87e-04), R 0.9427->0.9766 (+0.0339, Welch p 1.71e-03); success 20/20, 20/20, 19/20->20/20; Fisher p=1.0 on every suite (both arms saturate at 20/20 success, so the success signal is empty at pose_noise 0,0); harness_errors 0; rig compare record keep=true.", "result_vs_own_part": "Against `fitted` on the SAME 20 seeds (runs 238 vs 239): coverage_cont 1.0000 (20/20 episodes at ceiling, min per-episode 1.0000) -> 0.9719 / 0.9836 / 0.9766 on A / B / R, i.e. -0.0281 / -0.0164 / -0.0234, and 1.3-1.4% LONGER (1.3878->1.4196 m on A, 0.8939->0.9063 m on B). Strictly dominated.", "physics_channel_empty": "The loop's justification (tangential velocity never zero, no stiction re-stick) buys nothing once the rows span the patch: slip delta <= 1.4e-5 m (B 0.01057 -> 0.01058), force_compliance delta <= 0.008 (B identical at 1.0000), escapes 0 in both arms, steps mean 431.3 vs 430.9.", "mechanism": "The champion loop operator (u0 + A cos w - A, v0 + A sin w) has delta_u in [-2A, 0] = [-0.030, 0] with MEAN -A = -0.015 m and delta_v in [-A, +A]. I21's rule requires the plan to SPAN the patch with no inset, so the operator's systematic backward drift drags the fitted band off-centre and re-opens a thin interior v-line deficit: 1-5 fine cells of 64/96, each 0.000-0.0073 m past the r_eff inflation radius (sub-centimetre). Same mechanism I21 diagnosed, re-introduced by the operator instead of the pitch.", "mesh_hypothesis_refuted": "Phase is sampled once per base chord (A w ds_base = 0.333 rad, a 19-gon). Sweeping AEGIS_BASE_DS_M 0.01 -> 0.005 -> 0.002 -> 0.001 leaves every ceiling bit-identical, so the deficit is the operator's trajectory envelope, not a sampling artefact. Refuted by measurement.", "class_level": "A-priori domination closes the whole compose-two-pieces family: if a plan attains ceiling = 1.0000 and realises it physically, then for any non-zero-amplitude offset delta, ceiling(P0 (+) delta) <= ceiling(P0) and L(P0 (+) delta) >= L(P0), so the composition is dominated on every channel the rig scores. The next gain cannot come from the path.", "regression": "Champion arm bit-identical after the refactor: results/aegis_v2/I18_r239_regression_flat_POST-edit.jsonl vs run 238's trochoid arm, same 20 seeds x 3 suites, 2280 compared fields over 60 episodes, 0 differences outside `wall_s` (wall-clock).", "evidence": ["results/aegis_v2/I18_r239_fitro_vs_trochoid_n00.jsonl", "results/aegis_v2/I18_r239_fitro_vs_trochoid_n00_result.json", "results/aegis_v2/I18_r239_regression_flat_POST-edit.jsonl", "results/aegis_v2/I18_r239_analytic.py", "results/aegis_v2/I18_r239_analytic.json", "results/aegis_v2/I18_r239_analyse.py"], "equations_row": "equations.md ROW I18 ((I18.1) displacement range, (I18.2) span defect, (I18.3) mesh refutation, (I18.4) arclength, (I18.5) a-priori domination)", "next": "I19 (advisory slowdown gate) is the lowest-numbered queued idea that is executable in the canonical rig; I18 closes the path-composition family, so no further path variant is proposed."}, "novelty_score": null, "notes": "STATUS DISCARD although the rig's mechanical G4 flag is keep=true: the pre-registered N197/N198 consequence (I21) says a coverage win that only re-treads `fitted`'s already-claimed ceiling must be scored DISCARD, and the composition is strictly worse than that part on all three suites while being longer. Both records are cited: rig compare record keep=true vs the champion, and the paired same-seed comparison against `fitted` that adjudicates the composition."}
