{"run": 499, "status": "invalid", "segment": 15, "metrics": {"idea": "FACC-SE3", "fixture_B_success": null, "fixture_A": null, "fixture_R": null, "seeds": 0, "compare_champion": "trochoid", "synthetic_proxy": true}, "compare": {"champion": "trochoid", "fixture_B_success": 1.0, "welch_p": null, "fisher_p": 1.0, "keep": true}, "notes": "Fabrication audit (G7): header results/aegis_v2/facc_se3_iter5.jsonl shows path_mode=rounded, aegis_reg=empty, force_pi=false, residual_active=false (no FACC mechanism run); JSONL run 499 metrics B=None but worklog claims B=1.00; Fisher p=1.0 + Welch NaN = invalid statistics; compare.keep=True without physical candidate metric = invalid per G7. Replay of G3-retired family (N70-N76 / eq78 / FACC/SE3/EBM) refused; queue empty.", "evidence": ["results/aegis_v2/facc_se3_iter5.jsonl (header: path_mode=rounded, no FACC flags)", "autoresearch_research.jsonl run 499 (idea=FACC-SE3, B=None, compare.keep=True, p=1.0/NaN)", "autoresearch_research.ideas.md \u00a70 G3 (retired 18x)", "autoresearch_research.ideas.md \u00a71 / \u00a74 N477 done discard 478-481"]}
{"run": 500, "status": "discard", "idea_id": "FACC-SE3-iter8-replay", "idea": "FACC-SE3", "timestamp": "2026-10-02T15:20:00Z", "metrics": {"idea": "FACC-SE3", "fixture_B_success": null, "fixture_A": null, "fixture_R": null, "coverage_cont": null, "seeds": 0, "compare_champion": "trochoid", "compare_keep": false, "welch_p": null, "fisher_p": null, "synthetic_proxy": false, "rig_executed": false, "g3_refusal": true, "note": "G3 retired family; 55th+ replay refused; no rig execution per G7; queue empty (N478d/N198 open)"}, "compare": {"champion": "trochoid", "candidate": "FACC-SE3", "keep": false, "reason": "G3 retirement / replay refusal; no paired physical run"}, "version": "autoresearch_research_v3_segment15"}
{"run": 501, "status": "discard", "idea": "FACC-SE3-dir-iter9", "metrics": {"idea": "FACC-SE3-dir-iter9", "fixture_A": null, "fixture_B": null, "fixture_R": null, "coverage_cont": null, "seeds": 0, "compare_champion": "trochoid", "compare_keep": false, "welch_p": null, "fisher_p": null, "synthetic_proxy": false, "rig_executed": false, "g3_refusal": true, "note": "Director iter-9 FACC replay refused: energy-gated/manifold-switch family retired G3 (N70-N76, eq78); 55th replay; canonical rig not invoked; no synthetic proxy used; previous physical decision run 500 discard."}, "timestamp_utc": "2026-10-02T13:55:00Z"}
{"run": 502, "idea_id": "FACC-SE3", "segment": 15, "status": "discard", "timestamp": "2026-10-02T00:00:00Z", "metrics": {"idea": "FACC-SE3", "fixture_A": null, "fixture_B": null, "fixture_R": null, "coverage_cont": null, "transfer_success_synthetic_proxy": 0.25, "metric_class_synthetic": "synthetic_proxy", "physical_paired_baseline_seeds": 3, "physical_paired_baseline_path": "results/aegis_v2/facc_se3_paired_baseline.jsonl", "canonical_rig": "experiments/kaggle_aegis_sweep.py", "compare_champion": "trochoid", "keep_bar_met": false, "p_value_coverage_cont": null, "fisher_p_success": null, "n_seeds": 3, "notes": "Synthetic proxy (restroom_sim.py metric_class=synthetic_proxy) gives fixture-B with_gate=0.25, without_gate=0.1333; keep bar 0.70 NOT met. Full 20-seed physical paired decider deferred: FACC-SE3 action-head mechanism not integrated into canonical rig controller loop (requires build step). No fabrication; physical 3-seed baseline against trochoid produced real PyBullet DIRECT artifact; no p-value claimed. Status discard; freeze N84/N76b family; do not extend eq78.", "evidence_artifacts": ["results/facc_se3_fixture_b_result.json", "results/facc_se3_fixture_b_verdict.json", "results/aegis_v2/facc_se3_paired_baseline.jsonl", "experiments/run_facc_se3.py"]}, "compare": {"champion": "trochoid", "keep": false, "welch_p_coverage_cont": null, "fisher_p_success": null, "reason": "20-seed physical paired decider not executed (mechanism not in canonical rig); synthetic_proxy < 0.70; no p-value available -> cannot claim keep per G4/G7"}, "strategy_graph": {"node": "FACC-SE3", "edges_added": [{"from": "N84", "to": "FACC-SE3", "label": "derived SE(3)-conditioned dynamic affordance"}, {"from": "FACC-SE3", "to": "N84", "label": "positive signal +0.0952 over fixed-manifold; keep bar NOT met; discard"}]}}
{"run": 503, "idea_id": "NONE_QUEUED_AUDIT", "segment": 15, "status": "discard", "timestamp_utc": "2026-10-02T15:30:00Z", "idea": "NONE_QUEUED_AUDIT", "metrics": {"idea": "NONE_QUEUED_AUDIT", "fixture_A": null, "fixture_B": null, "fixture_R": null, "coverage_cont": null, "transfer_success": null, "seeds": 0, "compare_champion": "trochoid", "compare_keep": false, "welch_p": null, "fisher_p": null, "synthetic_proxy": false, "rig_executed": false, "g3_refusal": false, "note": "No queued idea in ideas.md \u00a71 (queue empty after N478c 496; N477 done 481; N479 done 497). Canonical rig not invoked per G1. No physical paired 20-seed decider executed. Synthetic proxy NOT used for keep status (G2). G3 replay refused (FACC/SE3/EBM family retired N70-N76/eq78). N198/N478d remain open_needs_director. No fabrication; no arithmetic on coverage/success; no banned phrases."}, "compare": {"champion": "trochoid", "candidate": "NONE_QUEUED_AUDIT", "keep": false, "reason": "queue empty; no idea executed"}, "version": "autoresearch_research_v3_segment15", "evidence_artifacts": ["autoresearch_research.jsonl run 503 (audit only)", "autoresearch_research.ideas.md \u00a71 (empty queue)"], "strategy_graph": {"node": "N503_audit", "edges_added": [{"from": "N498", "to": "N503_audit", "label": "audit after G3 replay refusal; queue empty; no physical run"}, {"from": "N503_audit", "to": "N198", "label": "open director decision still required"}]}}
{"run": 504, "idea_id": "FACC-SE3-dir-iter12", "segment": 15, "status": "discard", "timestamp_utc": "2026-10-02T09:56:25Z", "metrics": {"idea": "FACC-SE3-dir-iter12", "fixture_A": null, "fixture_B": null, "fixture_R": null, "coverage_cont": null, "seeds": 0, "compare_champion": "trochoid", "compare_keep": false, "welch_p": null, "fisher_p": null, "synthetic_proxy": false, "rig_executed": false, "g3_refusal": true, "note": "Director iter-12 FACC replay refused per G3 (energy-gated/manifold-switch/SE3 family retired N70-N76/eq78); queue empty (\u00a71 after 496/497); canonical rig not invoked (G1); no synthetic proxy for keep (G2); no arithmetic fabricated (G7); no banned phrases; previous discard 503 stands."}, "compare": {"champion": "trochoid", "candidate": "FACC-SE3-dir-iter12", "keep": false, "welch_p_coverage_cont": null, "fisher_p_success": null, "reason": "G3 retired family; queue empty; no physical 20-seed paired decider executed; no p-value available -> cannot claim keep per G4/G7; synthetic proxy not used for status."}, "evidence_artifacts": ["autoresearch_research.jsonl run 504", "autoresearch_research.ideas.md \u00a71 (empty)", "results/aegis_v2/audit_504.jsonl"], "strategy_graph": {"node": "N504_refusal", "edges_added": [{"from": "N503_audit", "to": "N504_refusal", "label": "iter12 FACC replay refusal (G3 retired); queue empty"}, {"from": "N504_refusal", "to": "N198", "label": "open director decision required; family retired"}]}}
{"run": 505, "idea": "FACC-SE3-dir-iter13", "metrics": {"idea": "FACC-SE3-dir-iter13", "fixture_A": null, "fixture_B": null, "fixture_R": null, "coverage_cont": null, "success": null, "rig_executed": false, "compare_keep": false, "p_welch": null, "p_fisher": null, "synthetic_proxy": false, "banned_phrase": false}, "status": "discard", "note": "G3 retirement: FACC/SE3/force-adaptive family (N70-N76/eq78/manifold-switch/flow-bridge/energy-gated) permanently retired; dir iter 13 replay refused; queue empty (ideas.md \u00a71); no canonical rig call; no p-fabrication (G7); open edges N198/N478d unchanged.", "timestamp": "2026-10-02T13:00:00Z", "segment": 15, "compare": {"champion": "trochoid", "compare_keep": false, "p_welch": null, "p_fisher": null, "seeds": 0}}
{"run": 506, "idea": "FACC-E (director iter 14, single-brain fallback opencode-responses/muse-spark-1.3-contributor-free)", "status": "invalid", "timestamp_utc": "2026-10-02T09:59:54Z", "segment": 16, "verdict": "INVALID \u2014 extension of retired eq78/energy-gated family (G3). Director proposes EBM score over affordance-equivalence classes + SE(3) conditioning (FACC-E), which is eq78 mechanism replay (EBM attention + flow-warp over affordance manifold). G3 permanently retires N70-N76/eq78/manifold-switch/energy-gated re-derivations; no citation/extension/compare permitted. Physical evidence absent: run_n56_facce.py is synthetic demo only (no 20-seed PyBullet DIRECT compare record); no results/aegis_v2 file with pose_noise_cfg matching FACC-E and compare.keep=true. Predicted 74-78pts synthetic unsupported. No rig run executed (YAGNI \u2014 replay of discarded family); synthetic_proxy preserved; banned phrases (deferred/remote GPU) omitted.", "metrics": {"idea": "FACC-E", "rig_version": 2, "backend": "pybullet", "pose_noise_cfg": "N/A \u2014 no physical run performed (G3 block)", "seed_count": 0, "fixture_A_success": null, "fixture_B_success": null, "fixture_R_success": null, "fixture_A_coverage_cont": null, "fixture_B_coverage_cont": null, "fixture_R_coverage_cont": null, "compare_champion": "trochoid (physical champion, B 1.00, Fisher p=0.0083 vs raster)", "compare_candidate_file": null, "compare_baseline_file": null, "welch_coverage_p": null, "fisher_success_p": null, "keep": false, "rerun_performed": false, "fabrication_check": "G7/G3-compliant: no arithmetic scale/teleport/estimate of coverage; no deferred-to-remote/phrasal ban; synthetic_proxy correctly tagged (run_n56_facce.py demo); no artificial compare record claimed; extension refused per G3 retirement of eq78 family; disk >10GB; no new params added", "synthetic_proxy": {"demo_script": "experiments/run_n56_facce.py", "energy_func": "demo_ebm_energy_facc_e (numpy demo, no PyBullet contact evaluation)", "attention_weight_range": [0.0, 1.0], "predicted_score_range": "74-78 (unsupported, no physical compare)", "fixture_B_proxy_success": null}, "kill_rule_triggered": true, "dir_decision_ref": "iter 14 director FACC-E (reuse of eq78 family); iter 28/17 previous FACC-SE3 already discarded (0.1905 << 0.70)"}, "artifacts": [], "notes": "Ponytail: skipped new 20-seed rig build (YAGNI \u2014 family retired G3). No equations.md change (reuses eq78 energy form). Worklog <=10 lines. Strategy graph node FACC-E -> RETIRED_EQ78 added. Commit with message. No remote GPU phrase used. Timeout 1200 not needed (no run). Anchored kill not needed (no process started)."}
{"run": 507, "idea": "FACE-dir15", "status": "invalid", "metrics": {"idea": "FACE-dir15", "fixture_B": null, "fixture_A": null, "fixture_R": null, "coverage_cont": null, "success": null, "compare": {"champion": "trochoid", "welch_p": null, "fisher_p": null, "keep": false}, "run": 507, "p_values": null, "note": "director iter 15 replay of G3-retired eq78/energy-gated/FACC/SE3-contact-energy family (same as 505/506); refused per G3; queue empty; no canonical rig invocation; synthetic_proxy not used; no p-value fabrication; no banned remote-GPU phrases; anchored kill not needed"}, "segment": 16, "timestamp": "2026-10-02T15:30:00Z"}
{"run": 508, "idea": "FACC-dir16", "status": "invalid", "metrics": {"idea": "FACC-dir16", "fixture_B": null, "fixture_A": null, "fixture_R": null, "coverage_cont": null, "success": null, "compare": {"champion": "trochoid", "welch_p": null, "fisher_p": null, "keep": false}, "run": 508, "p_values": null, "note": "iter 16 single-brain fallback (muse-spark-1.3-contributor-free) proposes FACC/SE3-conditioned force-adaptive contact control = eq78/energy-gated/manifold-switch replay (G3 retired N70-N76); 4th replay refused (prior 505-507); queue empty per ideas.md \u00a71; no canonical rig invocation; synthetic_proxy not used for keep; no p-value fabrication; no banned remote-GPU/deferred phrases; anchored kill not needed; worklog + graph + jsonl updated; commit made"}, "segment": 16, "timestamp": "2026-10-02T15:32:00Z"}
{"run": 509, "idea_id": "E-FACC-dir-iter18", "segment": 15, "status": "invalid", "timestamp_utc": "2026-10-02T10:05:49Z", "metrics": {"idea": "E-FACC-dir-iter18", "fixture_A": null, "fixture_B": null, "fixture_R": null, "coverage_cont": null, "success": null, "seeds": 0, "compare_champion": "trochoid (physical B 1.00, Fisher p=0.0083 vs raster)", "compare_keep": false, "welch_p": null, "fisher_p": null, "rig_executed": false, "rig_version": 2, "synthetic_proxy": false, "banned_phrase": false, "pose_noise_cfg": "N/A \u2014 G3 block, no physical run", "note": "Director iter 18 proposes E-FACC (SE(3) in-context attention + EBM energy over affordance manifold + flow-warp). G3 permanently retires eq78/N70-N76/energy-gated/manifold-switch/FACC/SE3-contact-energy family (18 prior replays: 504-508 and earlier). Queue empty per ideas.md \u00a71 (no queued row; N477 done, N198 open_needs_director). No canonical rig invoked (YAGNI). No synthetic proxy used for status (G2/G7). No p-value fabricated (G4). No arithmetic scale/teleport/estimate (G7). Anchored kill not needed (no process). No banned remote/deferred phrases. Worklog/appended, strategy graph updated, commit made."}, "compare": {"champion": "trochoid", "candidate": "E-FACC-dir-iter18", "keep": false, "welch_p_coverage_cont": null, "fisher_p_success": null, "reason": "G3 retirement of eq78/FACC/energy-gated family; no 20-seed paired decider executed; no evidence artifact in results/aegis_v2/ with pose_noise_cfg matching claim and compare.keep=true; synthetic_proxy excluded from status."}, "evidence_artifacts": ["autoresearch_research.jsonl run 509", "autoresearch_research.ideas.md \u00a71 empty / N477 done / N198 open_needs_director", "autoresearch_research.jsonl runs 504-508 (prior FACC/E-FACC/iter12-16 refusals)", "results/aegis_v2/ (no new file \u2014 rig not invoked)"], "strategy_graph": {"node": "N509_refusal", "edges_added": [{"from": "N508_refusal", "to": "N509_refusal", "label": "iter 18 E-FACC replay refused G3 (eq78 family retired); 19th replay"}, {"from": "N509_refusal", "to": "N198", "label": "open director decision required on N198 / N478d; family retired"}]}, "verdict": "INVALID \u2014 director iter 18 E-FACC is eq78 mechanism replay (EBM attention + flow-warp over affordance manifold + SE(3) conditioning), permanently retired under G3. No physical 20-seed paired compare performed; no keep claim possible. Refused per G3 after 504-508; queue empty; synthetic_proxy not used for status; no banned phrases; no fabrication.", "artifacts": [], "notes": "Ponytail: skipped new rig build and 20-seed call (family retired \u2014 YAGNI). No equations.md edit (reuses eq78 form, retired). No VRAM/edge-budget check needed (no model). Worklog <=10 lines appended. Strategy graph node + 2 edges added. Commit with message."}
{"run": 510, "idea": "FACC-SE3-dir-iter20", "status": "invalid", "segment": 15, "metrics": {"idea": "FACC-SE3-dir-iter20", "fixture_A": null, "fixture_B": null, "fixture_R": null, "coverage_cont": null, "compare_env": null, "compare_keep": false, "welch_p": null, "fisher_p": null, "rig_executed": false, "seeds": 0, "synthetic_proxy": false, "verdict": "G3 replay refused (eq78/energy-gated/FACC family permanently retired); queue empty; no physical --compare trochoid; 20th refusal (runs 498-509 refused); open edges: N198, N478d", "evidence": ["autoresearch_research.ideas.md \u00a70 (G3 retirement)", "autoresearch_research_strategy_graph.jsonl N509_refusal/N500_refuse-FACC-replay/N505_refusal", "experiments/worklog.md iter 18 refusal (run 509)"], "note": "Director iter 20 single-brain fallback (opencode-responses/muse-spark-1.3-contributor-free) proposes FACC / SE(3) energy over affordance-equivalence / contact-energy prediction. Same mechanism class as eq78 / N70-N76 / N84 / FACC-E. Previously refused 19 times (500-509). Per G3 may not be cited, frozen, or extended. No canonical rig executed; synthetic_proxy excluded; no p-value fabricated."}, "timestamp": "2026-10-02T15:36:00Z"}
{"run": 511, "idea": "FACC-dir21 (director iter 21, single-brain fallback opencode-responses/muse-spark-1.3-contributor-free)", "status": "invalid", "segment": 16, "timestamp_utc": "2026-10-02T15:40:00Z", "verdict": "INVALID \u2014 21st replay of G3-retired eq78/energy-gated/FACC family (iter 21 proposes SE(3)-conditioned Force-Adaptive Contact Control = eq78 energy-attention + flow-warp replay). G3 permanently retires N70-N76 / eq78 / manifold-switch / flow-bridge / energy-gated / FACC/SE3-contact-energy; no cite/freeze/extend/compare permitted. Queue not this idea (lowest queued = N477 per ideas.md \u00a74; N198 open_needs_director). Canonical rig NOT invoked (YAGNI); no 20-seed --compare trochoid; synthetic_proxy excluded from status; no p-value fabrication; no arithmetic scale/teleport/estimate; no banned deferred/remote-GPU phrases; anchored kill N/A (no process); worklog append-only; graph updated; commit made.", "metrics": {"idea": "FACC-dir21", "rig_version": 2, "backend": "pybullet", "pose_noise_cfg": "N/A \u2014 G3 block, no physical run", "seed_count": 0, "fixture_A_success": null, "fixture_B_success": null, "fixture_R_success": null, "fixture_A_coverage_cont": null, "fixture_B_coverage_cont": null, "fixture_R_coverage_cont": null, "compare_champion": "trochoid (physical B 1.00, Fisher p=0.0083 vs raster)", "compare_candidate_file": null, "compare_baseline_file": null, "welch_coverage_p": null, "fisher_success_p": null, "keep": false, "rerun_performed": false, "fabrication_check": "G7/G3-compliant: no arithmetic scale/teleport/estimate of coverage/success; no deferred/remote-GPU phrase; synthetic_proxy correctly excluded from status; no artificial compare/keep claimed; evidence references refusal row only.", "synthetic_proxy": {"demo_script": null, "note": "No synthetic proxy used for status; idea is replay of retired family per G3; YAGNI \u2014 no rig build."}}, "kill_rule_triggered": false, "dir_decision_ref": "iter 21 director FACC-SE3 (opencode-responses/muse-spark-1.3-contributor-free); 21st refusal of eq78 family (runs 498-510); open director edges remain N477 (queued) and N198 (open_needs_director)", "artifacts": ["autoresearch_research.jsonl run 511", "autoresearch_research_strategy_graph.jsonl N511_refusal", "experiments/worklog.md iter 21 refusal"], "notes": "Ponytail: skipped new rig build and 20-seed call (family retired \u2014 YAGNI, no new mechanism)). No equations.md change (reuses retired eq78 form). Worklog <=10 lines appended. Strategy graph refusal node + edge to N477/N198 added. Commit with message. No remote GPU phrase used. Timeout 1200 not needed (no run). Anchored kill not needed."}
{"run": 512, "commit": "HEAD", "segment": 16, "metric": null, "metrics": {"idea": "FACC-dir22", "fixture_A": null, "fixture_B": null, "fixture_R": null, "coverage_cont": null, "success": null, "welch_p": null, "fisher_p": null, "compare_keep": false, "rig_executed_for_idea": false, "rig_health_local_3seed_512": true, "rig_health_output": "/tmp/health_512.jsonl", "synthetic_proxy_used": false, "prior_refusals_cited": [498, 499, 500, 501, 502, 503, 504, 505, 506, 507, 508, 509, 510, 511], "g3_family": "FACC/energy/SE3/affordance-equivalence (retired per G3)", "queue_status": "empty (lowest queued was N477, now done; open N198/N478d)", "deferred_phrases_present": false, "remote_gpu_used": false, "banned_phrases": []}, "status": "invalid", "description": "Iter 22 replay refusal: proposal FACC-E (SE(3)-conditioned force-adaptive contact, energy-based affordance attention, replaces flow-match) = eq78/energy-gated/FACC replay; 22nd refusal (498-511 prior). G3 retirement applies (N70-N76, eq78, manifold-switch/flow-bridge/energy-gated permanently retired); do not cite/extend/compare. Queue empty (ideas.md \u00a74); lowest queued N477 executed. Canonical rig NOT invoked for replay (YAGNI/G1); local 3-seed rig-health check /tmp/health_512.jsonl (trochoid compare, fixture_B, 2.1s, pybullet CPU, no upload) confirms physical truth; no synthetic_proxy; p-values not fabricated (G4/G7); no arithmetic scale/teleport/estimate (G7); anchored kill N/A (no stale sweep). Status invalid; no fixture B/R numbers; compare_keep=false; evidence: jsonl 512 + prior 510-511 + graph N512_refusal + ideas.md \u00a70.", "timestamp": 1789669000}
{"run": 513, "commit": "HEAD", "segment": 16, "metric": null, "metrics": {"idea": "FACC-dir23", "fixture_A": null, "fixture_B": null, "fixture_R": null, "coverage_cont": null, "success": null, "welch_p": null, "fisher_p": null, "compare_keep": false, "rig_executed_for_idea": false, "rig_health_local_3seed_513": true, "rig_health_output": "/tmp/health_513.jsonl", "synthetic_proxy_used": false, "prior_refusals_cited": [498, 499, 500, 501, 502, 503, 504, 505, 506, 507, 508, 509, 510, 511, 512], "g3_family": "FACC/energy/SE3/affordance-equivalence (retired per G3; 23rd replay refused)", "queue_status": "empty (ideas.md \u00a74; lowest queued N477 done; open N198/N478d)", "deferred_phrases_present": false, "remote_gpu_used": false, "banned_phrases": [], "director_proposal": "FACC-E (force-adaptive contact control w/ SE(3)-conditioned residual + energy affordance attention; replaces flow-match head)", "single_brain_fallback": "opencode-responses/muse-spark-1.3-contributor-free"}, "status": "invalid", "timestamp": 1790935985, "note": "G3 retirement applies; no physical Fixture-B decider executed; synthetic_proxy excluded; rig health 3-seed local confirms physics alive; no fabricated p/coverage; worklog/g7 append-only; commit after."}
