{"run": 301, "segment": 15, "status": "keep", "idea": "N190", "timestamp": "2026-09-30T13:40:00Z", "commit": "HEAD", "metric": 0.9122, "metric_name": "fixture_B transfer_success (coverage_cont >= 0.90 per episode), canonical rig, 100 seeds, pose_noise 0.28,56", "metric_unit": "fixture_B transfer_success of the AEGIS_REG_HALF_M=0.6 + AEGIS_REG_EST=extent arm", "rig": "experiments/kaggle_aegis_sweep.py (PyBullet DIRECT, system python3, rig_version 2, friction U[0.05,0.80], gate_mode=post-hoc); pts_source=physics_contact; every coverage_cont/success recomputed from physics contacts at return time", "command": "AEGIS_POSE_NOISE=<sigma> AEGIS_REG=depth AEGIS_REG_HALF_M=0.6 AEGIS_REG_EST=extent timeout 1200 python3 experiments/kaggle_aegis_sweep.py --seeds 100 --no-upload --path trochoid --compare trochoid --compare-env AEGIS_REG_HALF_M=0.35,AEGIS_REG_EST=0 --suites fixture_A,fixture_B,fixture_R --out results/aegis_v2/N190_r301_s100_<sigma>.jsonl", "compare_champion": "in-rig --compare trochoid + --compare-env AEGIS_REG_HALF_M=0.35,AEGIS_REG_EST=0 on the SAME 100 seeds -> identical friction / tool / customer draw / pose noise / ray grid; the baseline arm IS the frozen I9 registration estimator", "metrics": {"idea": "N190", "director_iteration": 46, "director_directive_adjudication": "Director iter-46 FACC (force-conditioned SE(3) flow, energy-based in-context contact attention, predicted 74 KEEP) ADJUDICATED NOT EXECUTED: 56th re-derivation of the G3-retired manifold-switch / flow-bridge / energy-gated family; FACC is already closed twice on physical data (T225 r232 all-reject degeneracy, T226 r233 78/78 infeasible) and FACC-E was adjudicated NOT EXECUTED at r300 for exactly this reason; G4-unpairable (the scrub rig has no pi0 flow expert, no SE(3) energy-attention keypoint, no dissipation-scored contact head - adding one would be fabrication under G7); predicted-only keeps and learned/soft-gate variants are banned. The lowest-numbered executable idea on the live frontier (N190, opened by I12) was run instead.", "frontier_node": "N190 (opened by I12: reg_err p90 ~14 mm is flat in sigma -> dose the registration estimator)", "hypothesis_refuted": "I12's stated CAUSE was wrong. It attributed the 14.6 mm reg_err p90 on fixture_B to 'the 32x32 ray-grid + PCA-yaw estimator resolution'. Resolution dose measured on 20 seeds (p90 mm): n=32 14.62, n=64 18.40, n=128 15.78, n=181 14.97. O(1/n) predicts 5.7 and 0.7 mm; measured 1.3x and 1.0x of the n=32 value. Resolution REFUTED as the binding variable.", "true_cause": "window TRUNCATION bias, closed form in equations.md N190.2-N190.3. The estimator averages the ray hits inside the +-H window, so it is the centroid of F INTERSECT W(e), not of the footprint F; E[||c_hat - c_true||] = O(sigma) once sigma > rho - H and 0 below it. The +-0.35 m window clips the 0.32 m round tank and the 0.34x0.14 m box, so reg_err explodes with sigma (fixture_B p90 34.7 / 72.2 / 118.8 mm at 6 / 10 / 16 cm) while all four sigma levels I12 swept sat in the unbiased regime and only measured ray pitch.", "fix": "two planner-side knobs, both defaulting to the frozen expression (rig byte-identical otherwise): AEGIS_REG_HALF_M (window half-extent H, default 0.35) and AEGIS_REG_EST (mean | extent = prior-yaw-frame extent midpoint, default mean). No force, solver or scoring edit; no teleport.", "ablation_H_alone": "H 0.35->0.60 with the mean estimator alone, 0.16,32, 20 seeds paired: reg_err med/p90 43.35/119.89 -> 4.40/24.45 mm; B covc 0.9016 -> 0.9961; B success 15 -> 20; Fisher p 0.0471. H carries essentially the whole effect.", "ablation_extent_alone": "extent midpoint alone at H=0.35, same seeds: reg_err 43.35/119.89 -> 36.57/116.01 mm; B covc 0.9016 -> 0.8945 (delta -0.0070, Welch p 0.923). INERT - the top-face point set is a ray GRID so max_q is still one pitch inside the true edge. Truncation, not the centroid rule, is the mechanism.", "dose_is_a_plateau": "H=0.9 vs H=0.6 at 0.20,40, 20 seeds paired: reg_err med 9.83 vs 4.49 mm (WORSE), B covc 0.9953 vs 0.9898, Welch p 0.613 - the wider window re-admits floor/lower-fixture points into the max-z mode band. Ship 0.6.", "paired_physical_100_seeds": {"0,0": {"B_covc": [1.0, 1.0], "B_succ": [100, 100], "welch_p": null, "fisher_p": 1.0, "keep": false, "note": "both arms at ceiling, nothing to fix"}, "0.03,6": {"B_covc": [1.0, 0.9991], "B_succ": [100, 100], "welch_p": 0.0834, "fisher_p": 1.0, "keep": false, "note": "both at ceiling; no regression (delta -0.0009)"}, "0.16,32": {"A_covc": [0.7034, 0.8257], "B_covc": [0.8727, 0.9942], "R_covc": [0.7868, 0.9072], "A_succ": [19, 40], "B_succ": [62, 99], "R_succ": [38, 68], "welch_p_B": 2.21e-07, "paired_p_B": 4.94e-08, "fisher_p_B": 2.26e-12, "welch_p_R": 4.92e-06, "fisher_p_R": 3.52e-05, "reg_ok": [299, 300], "reg_err_p90_mm_B": [null, 14.72], "keep": true}, "0.20,40": {"A_covc": [0.6199, 0.7784], "B_covc": [0.8055, 0.9847], "R_covc": [0.6892, 0.8724], "A_succ": [11, 30], "B_succ": [54, 96], "R_succ": [26, 60], "welch_p_B": 3.31e-09, "paired_p_B": 7.31e-11, "fisher_p_B": 1.33e-12, "welch_p_R": 1.12e-08, "fisher_p_R": 1.93e-06, "reg_ok": [295, 300], "reg_err_p90_mm_B": [null, 20.16], "keep": true}, "0.24,48": {"A_covc": [0.5121, 0.7254], "B_covc": [0.6989, 0.9459], "R_covc": [0.5836, 0.8406], "A_succ": [8, 20], "B_succ": [41, 89], "R_succ": [19, 56], "welch_p_B": 1.97e-09, "paired_p_B": 1.43e-13, "fisher_p_B": 6.1e-13, "reg_ok": [285, 298], "keep": true}, "0.28,56": {"A_covc": [0.4282, 0.6756], "B_covc": [0.5664, 0.9122], "R_covc": [0.4801, 0.7971], "A_succ": [5, 15], "B_succ": [37, 82], "R_succ": [13, 52], "welch_p_B": 5.26e-12, "paired_p_B": 1.19e-16, "fisher_p_B": 9.81e-11, "reg_ok": [273, 292], "keep": true}}, "headline": "fixture_B transfer_success 0.37 -> 0.82 (37 -> 82 of 100) at 0.28 m / 56 deg planning-pose error, Welch p 5.26e-12 on coverage_cont, Fisher p 9.81e-11 on success, rig compare.keep = true. Held-out fixture_R 0.4801 -> 0.7971. The dose arm still clears the 0.70 keep bar at 0.28 m, so the usable Tier-2 planning budget moves by >=9x over the frozen estimator with zero cost at 0,0 and 0.03,6.", "rig_edits": "2 planner-side knobs (AEGIS_REG_HALF_M, AEGIS_REG_EST) + a 1024-ray chunking loop in the existing rayTestBatch call (pybullet hard-caps one batch at 1024, which is why no n>32 grid was reachable before). No force, solver, scoring or teleport edit.", "regression": "default-off rig verified bit-identical to run 300: results/aegis_v2/N190_regression_defaultOFF.jsonl vs R300_frozen_n00.jsonl, 4800 compared fields over the shared 60 episodes, 0 differences outside the ts/wall_s clock fields.", "pairing_sanity": "a 0.6-vs-0.6 pairing run is bit-identical on all 60 episodes (results/aegis_v2/N190_r301_dose_0.6_vs_0.9_0.20_40.jsonl was mislabelled; the actual same-value control is the equal-arm delta 0.0000 / p 1.0 on all three suites), so the compare harness contributes nothing to the deltas.", "refutes": ["I12's stated cause (32x32 + PCA-yaw estimator resolution) - measured flat in n", "I5's 'Tier-2 accuracy must be < 0.005 m / 1 deg' - second refutation, and now for a different reason: the constraint was the sensor window, not the estimator or the planner"], "confirms": ["I9 (registration must precede planning)", "I12 (B transfer_success 1.000 at 6x the sigma I5 called fatal) and extends it: I12's 'reg_err flat in sigma' was an artefact of four sigma levels that all sat in the unbiased regime"], "falsifier_status": "NOT triggered. Pre-registered falsifier was 'no gain on unseen stiffness/geometry'; the held-out fixture_R new-customer draw separates at Fisher p 3.52e-05 (0.16 m) to 1.93e-06 (0.20 m).", "synthetic_proxy_used": false, "evidence_artifact": "results/aegis_v2/N190_r301_s100_0.16_32.jsonl", "evidence": ["results/aegis_v2/N190_r301_s100_0.16_32.jsonl", "results/aegis_v2/N190_r301_s100_0.20_40.jsonl", "results/aegis_v2/N190_r301_s100_0.24_48.jsonl", "results/aegis_v2/N190_r301_s100_0.28_56.jsonl", "results/aegis_v2/N190_r301_s100_0.03_6.jsonl", "results/aegis_v2/N190_r301_s100_0_0.jsonl", "results/aegis_v2/N190_r301_abl_halfonly_0.16_32.jsonl", "results/aegis_v2/N190_r301_abl_estonly_0.16_32.jsonl", "results/aegis_v2/N190_r301_dose_0.9_vs_0.6_0.20_40.jsonl", "results/aegis_v2/N190_regression_defaultOFF.jsonl", "results/aegis_v2/N190_probe.py", "results/aegis_v2/N190_probe.json", "results/aegis_v2/N190_readout.py"], "equation_row": "N190 (N190.1 setup, N190.2 intersection centroid, N190.3 truncation bias dichotomy, N190.4 refuted O(1/n) prediction, N190.5 the H dose, N190.6 the inert extent ablation + the H plateau, N190.7 refutes/confirms, N190.8 the 100-seed paired table)", "next": "the window is now >=9x wider than the frozen one, so the binding floor moves again. Two live sub-questions: (a) the yaw branch is still the frozen PCA with a prior for its pi-ambiguity - at 0.28 m/56 deg a 56 deg prior error may already be outside the branch, so the yaw estimator is the next dose; (b) reg_ok falls to 292/300 at 0.28 m because truncation starves the 30-point degeneracy test - the test should be scale-free. Node N191."}, "novelty_score": null, "notes": "STATUS KEEP. Rig compare.keep = true in FOUR independent 100-seed paired runs (0.16, 0.20, 0.24, 0.28 m), each with B success > 0.70 AND Welch p < 0.01 on coverage_cont AND Fisher p < 0.01 on success, zero harness errors, zero synthetic rows, and zero coverage regression at 0,0 and 0.03,6. novelty_score is null by segment rule: this is a measurement/estimator result on the canonical rig, not a sota-gap claim."}
{"run": 302, "segment": 15, "status": "discard", "idea": "N191", "timestamp": "2026-09-30T15:10:00Z", "commit": "HEAD", "metric": 0.9153, "metric_name": "fixture_B transfer_success (coverage_cont >= 0.90 per episode), canonical rig, 100 seeds, pose_noise 0.28,56", "metric_unit": "fixture_B transfer_success of the FROZEN AEGIS_REG=depth AEGIS_REG_HALF_M=0.6 AEGIS_REG_EST=mean arm (the dose was discarded and the estimator reverted)", "rig": "experiments/kaggle_aegis_sweep.py (PyBullet DIRECT, system python3, rig_version 2, friction U[0.05,0.80], gate_mode=post-hoc); pts_source=physics_contact; every coverage_cont/success recomputed from physics contacts at return time", "command": "AEGIS_POSE_NOISE=0.28,56 AEGIS_REG=depth AEGIS_REG_HALF_M=0.6 AEGIS_REG_EST=support timeout 1200 python3 experiments/kaggle_aegis_sweep.py --seeds 100 --no-upload --path trochoid --compare trochoid --compare-env AEGIS_REG_EST=1 --suites fixture_A,fixture_B,fixture_R --out results/aegis_v2/N191_r302_s100_0.28_56.jsonl", "compare_champion": "in-rig --compare trochoid with --compare-env AEGIS_REG_EST=1 (= the frozen AEGIS_REG_EST=mean) on the SAME 100 seeds -> identical friction / tool / customer draw / pose noise / ray grid; the baseline arm IS the shipped N190 champion configuration (H=0.6, mean), verified to reproduce run 301's arm row-for-row", "director_iteration": 47, "director_idea_adjudication": {"spec": "FACC: SE(3)-conditioned force-adaptive contact control replacing the flow-matching expert; dynamic affordance via energy-based physical in-context attention; bridge flow-matching -> affordance-equivalence; validation pi0 vs FACC under affordance shift; predicted 0.987 pts keep", "executed": false, "exclusion_reasons": ["G3 retired family: manifold-switch / flow-bridge / energy-gated, 56th re-derivation (FACC closed on physical data r232 all-reject degeneracy and r233 78/78 infeasible; FACC-E adjudicated NOT EXECUTED at r300)", "G4 unpairable: the scrub rig has no pi0 expert, no SE(3) energy-attention keypoint and no wrench-conditioned action head; adding one is fabrication under G7", "G7 banned keep class: predicted-only claims and learned/soft-gate variants cannot keep"]}, "metrics": {"idea": "N191", "seeds": 100, "episodes_total": 600, "harness_errors": 0, "physical_episodes_0.28_56": 600, "physical_episodes_0.03_6": 600, "rig_timeout_s": 1200, "rig_wall_s": {"0.28,56": 48.0, "0.03,6": 47.6}, "path_mode": "trochoid", "aegis_row_centre": 1.0, "aegis_reg": "depth, AEGIS_REG_HALF_M=0.6, AEGIS_REG_N=32", "gate_mode": "post-hoc", "dose": "REG_EST=support (opposite-interior-support midpoint, exact per world axis when untruncated, per-axis mean fallback) -- BUILT, MEASURED, DELETED", "fixture_B_transfer_success": {"support": 0.82, "mean_frozen": 0.84}, "fixture_B_coverage_cont": {"support": 0.9125, "mean_frozen": 0.9153, "welch_p": 0.9275, "delta": -0.0028, "fisher_p_success": 0.8509, "reg_compare_keep": false}, "fixture_B_coverage_cont_0.03_6": {"support": 0.9933, "mean_frozen": 1.0, "welch_p": 8.28e-05, "delta": -0.0067, "reg_err_xy_median_mm": {"support": 11.63, "mean_frozen": 7.13}, "reg_compare_keep": false}, "fixture_A_coverage_cont_0.28_56": {"support": 0.6493, "mean_frozen": 0.6521, "welch_p": 0.9396}, "fixture_R_coverage_cont_0.28_56": {"support": 0.786, "mean_frozen": 0.7893, "welch_p": 0.9275}, "hypothesis_a_yaw_estimator": {"claim": "a 56 deg prior error may sit outside the frozen PCA pi-branch, so the yaw estimator is the next dose", "verdict": "REFUTED", "pca_degeneracy_fire_rate": {"0,0": 0.0, "0.16,32": 0.0, "0.20,40": 0.0, "0.24,48": 0.0, "0.28,56": 0.0}, "branch_argument": "the snap is nearest-branch mod pi, valid for any prior error < 90 deg, so 56 deg cannot break it", "plan_yaw_error_deg_median_p90_0.28_56": [0.95, 5.76], "prior_yaw_error_deg_median": 46.15, "cause": "the elongated top face is 0.68 x 0.28 m, far larger than the +-0.6 m window, so the hit cloud is never near-circular"}, "hypothesis_b_scale_free_reg_ok": {"claim": "truncation starves the fixed 30-point degeneracy test; it should be scale-free", "verdict": "REFUTED as binding -- no knob shipped (YAGNI)", "n_pts_min_over_40_seeds": {"0,0": 119, "0.16,32": 98, "0.20,40": 83, "0.24,48": 54, "0.28,56": 10}, "count_test_fail_rate": {"0,0": 0.0, "0.16,32": 0.0, "0.20,40": 0.0, "0.24,48": 0.0, "0.28,56": 0.025}, "reg_ok_shipped_H0.6_arm": {"fixture_A": "96/100", "fixture_B": "97/100", "fixture_R": "99/100"}, "reg_ok_frozen_H0.35_baseline": {"fixture_A": "91/100", "fixture_B": "91/100", "fixture_R": "91/100"}}, "rejected_pre_rig": {"min_area_rectangle_yaw": "plan yaw error p90 90.0 deg vs PCA 5.76 deg on the same 40 seeds at 0.28 m -- the bounding-box area of a window-clipped rectangle is minimised by the WINDOW orientation, so it flips the pi-branch"}, "defect_found_and_fixed": {"field": "reg_err_yaw_deg", "logged_expression": "|degrees(dyaw_corr) - degrees(e_yaw)| = |correction - original error| = the AMOUNT OF YAW ERROR REMOVED, and 0.0 by construction when PCA declares the yaw unobservable", "new_field": "reg_yaw_plan_deg = |degrees(dyaw_corr)| = |yaw_est - true_yaw| = the plan's residual yaw error", "fixture_B_0.28_56_median_deg": {"old_field": 40.09, "new_field": 1.14}, "fixture_B_0.28_56_p90_deg_new_field": 11.54, "fixture_A_median_deg": {"old_field": 0.0, "new_field": 38.83}, "reg_err_xy_m_audit": "CORRECT -- the rebuilt plan sits at true_pos + (est - true_pos), so |est - true_pos| is exactly the residual translation error"}, "rig_edits": "1 log field (reg_yaw_plan_deg) + a comment recording the deleted dose; the estimator expression is byte-identical to frozen", "regression_default_OFF": {"episodes": 60, "field_diffs_vs_run300": 0}, "regression_frozen_mean_pre_vs_post_revert": {"episodes": 100, "field_diffs_excl_new_field": 0}, "champion_reproduced": {"fixture_B_transfer_success": 0.84, "fixture_B_coverage_cont": 0.9153}}, "synthetic_proxy": null, "equations_changed": "equations.md ROW N191 added (N191.1 hypothesis (a) refuted, N191.2 the dose + its bias/variance mechanism, N191.3 hypothesis (b) refuted, N191.4 the inverted metric and its correction, N191.5 net effect on the floor). No existing equation semantics changed.", "evidence": ["results/aegis_v2/N191_r302_s100_0.28_56.jsonl", "results/aegis_v2/N191_r302_s100_0.03_6.jsonl", "results/aegis_v2/N191_r302_frozen_champion_0.28_56.jsonl", "results/aegis_v2/N191_regression_defaultOFF.jsonl", "results/aegis_v2/N191_probe.json", "results/aegis_v2/N191_probe.py", "results/aegis_v2/N191_readout.py"], "verdict_reason": "The dose is a measured loss: B transfer_success 0.82 vs the frozen champion's 0.84 at 0.28 m/56 deg (Welch p 0.928, Fisher p 0.851, rig compare.keep=false) and strictly worse at 0.03 m/6 deg (Welch p 8.28e-05). All three N191 frontier hypotheses are refuted by measurement, and the branch was deleted rather than shipped. Only the sign-inverted reg_err_yaw_deg readout was corrected, which changes no episode.", "next": "N192 -- the floor is the window CONTAINMENT threshold (H > rho + 3 sigma), a sensor limit: a second off-centre cast or a bracketed footprint, not another centroid rule."}
