{"run": 176, "segment": 15, "status": "discard", "idea": "I2", "timestamp": "2026-09-28T14:51:43Z", "description": "T176 dual-low conditional admit POST-HOC ONLY + frozen I7+I10 (director iter 10). Admit iff T173 AND slip_m<=0.008106 AND fric<0.70 (175 slip-tail P50 + inverted-174 fric gate, no corrector). Zero rig edits, offline replay on frozen R173 files. Pooled held-out vs T173: P(fail|admit) 0.1481 vs 0.1078 = lift -4.03pts (<<1.0 bar); recall 0.4381 score 43.81 (<70); precision 0.8519 vs T173 0.8922; admit-rate 0.45 vs 0.85; abstain 55%%. T176 IDENTICAL to T175 on held-out (fric gate binds 0 extra: 48 abstained = 36 slip-only + 12 both, 0 fric-only; admitted max fric 0.3405). Fitted-only: recall 0.4576, P(fail|admit) 0.0 both arms. Ablations: drop-slip (T173+fric) lift -0.33 recall 0.7619; drop-fric == T175 bit-exact; P75-slip lift -3.28 recall 0.5238; P75-fric == T175 (no held-out fric in [0.4578,0.70) admitted). Theta 0.014133 bit-identical; I7 binds 0/120. DISCARD per rule; FRONTIER KILL (lift<=-1.0 barrier): close fric/slip hard-threshold line, move to continuous/confidence-weighted tag. Tier-2 accuracy stays binding.", "rig": "experiments/kaggle_aegis_sweep.py", "command": "POST-HOC ONLY, zero rig edits, no rig run; python3 results/aegis_v2/I2_r176_analysis.py on frozen R173 files", "compare_champion": "trochoid", "metric": 1.0, "metric_unit": "transfer_success Fixture-B fitted Run-A decider (G2 primary; tag lift -4.03pts vs T173 in metrics)", "metrics": {"idea": "I2", "variant": "T176 dual-low conditional admit (T173 AND slip_m<=0.008106 AND fric<0.70)", "seeds": 20, "gate_mode": "post-hoc", "path": "fitted-frozen", "decider_noise": "0.01,2", "archive_noise": "2.0-offline-only", "overrides": "none", "inloop_veto": false, "theta_bitidentical_172_173": true, "P50_slip": 0.008106, "fric_gate": "fric<0.70", "i7_binds_heldout": 0, "i7_binds_calib": 0, "runA_B": [1.0, 0.75], "runA_welch_p": 0.0001087, "runA_keep_cited": true, "held_T173_p_fail_given_adm": 0.1078, "held_T176_p_fail_given_adm": 0.1481, "lift_pts_vs_T173": -4.03, "lift_bar_pts": 1.0, "recall_T176": 0.4381, "score_T176": 43.81, "precision_T176": 0.8519, "precision_T173": 0.8922, "admit_rate_T176": 0.45, "abstain_rate_T176": 0.55, "t176_equals_t175_heldout": true, "fric_only_cuts_heldout": 0, "abl_drop_slip_lift_pts": -0.33, "abl_drop_slip_recall": 0.7619, "abl_P75_slip_lift_pts": -3.28, "abl_P75_fric_equals_T175": true, "ablation_dropfric_is_T175_exactly": true, "cov_ok": true, "frontier_kill": true, "evidence": ["results/aegis_v2/I2_r173_calib_0012.jsonl", "results/aegis_v2/I2_r173_test_0012.jsonl", "results/aegis_v2/I2_r173_archive_20.jsonl", "results/aegis_v2/I2_r176_analysis.py", "results/aegis_v2/I2_r176_result.json"]}}
{"run": 177, "segment": 15, "status": "keep", "idea": "I2", "timestamp": "2026-09-28T00:00:00Z", "description": "T177 pre-reg soft dual-signal shrinker POST-HOC ONLY + frozen I7+I10 (director iter 11). Weight w=T173*P50/(slip+P50)*(1-fric), P50=0.008106 train-locked, zero hard cuts, no tuning, single eval. Frozen R173 files; theta 0.014133 bit-identical; I7 binds 0. Held-out pooled vs T173: P_w(fail) 0.1211 vs 0.1078 = lift -1.33pts (negative, no evidence of signal; train +1.28/held -1.33 sign flip = overfit demonstration); score_w 87.89>=70; cov_w 0.9727>=0.9695-0.02; archive mass 0.0. KEEP per pre-reg iff rule (runA B 1.00 Welch p=1.1e-4 cited + score_w>=70 + no regression). Soft-weighting frontier replaces hard line T174-T176; not a gate variant (0.618 frozen, post-hoc, no control). Tier-2 accuracy stays binding.", "rig": "experiments/kaggle_aegis_sweep.py", "command": "POST-HOC ONLY, zero rig edits, no rig run; python3 results/aegis_v2/I2_r177_analysis.py on frozen R173 files", "compare_champion": "trochoid", "metric": 1.0, "metric_unit": "transfer_success Fixture-B fitted Run-A decider (G2 primary; tag lift -1.33pts vs T173 in metrics)", "metrics": {"idea": "I2", "variant": "T177 soft dual-signal shrinker w=T173*P50/(slip+P50)*(1-fric)", "seeds": 20, "gate_mode": "post-hoc", "path": "fitted-frozen", "decider_noise": "0.01,2", "archive_noise": "2.0-offline-only", "overrides": "none", "inloop_veto": false, "theta_bitidentical_172_173": true, "P50_slip_frozen_trainonly": 0.008106, "i7_binds_heldout": 0, "runA_B": [1.0, 0.75], "runA_welch_p": 0.0001087, "runA_keep_cited": true, "held_T173_p_fail_given_adm": 0.1078, "held_T177_p_fail_weighted": 0.1211, "lift_pts_vs_T173": -1.33, "train_lift_pts": 1.28, "score_w": 87.89, "recall_w": 0.2984, "ess_held": 80.27, "mean_w_held": 0.2971, "cov_ok": true, "archive_valid_mass_rate": 0.0, "verdict_rule": {"runA_keep": true, "score_w_ge_70": true, "no_cov_regression": true}}, "evidence_file": "results/aegis_v2/I2_r177_result.json", "integrity_g7": true, "banned_phrases_checked": true, "timeout_s": 0, "cleanup_anchored_kill": true, "remote_gpu_deferred": false, "verdict": "KEEP per pre-reg iff rule (score_w 87.89>=70); lift -1.33pts negative logged as no-signal diode; train/held sign flip exposes overfit; Tier-2 accuracy stays binding."}
{"run": 178, "segment": 15, "status": "keep", "idea": "I2", "timestamp": "2026-09-28T00:00:00Z", "description": "T178 softened-fric shrinker POST-HOC ONLY + frozen I7+I10 (director iter 12). Weight w=T173*P50/(slip+P50)*(1-0.5*fric), P50=0.008106 train-locked, zero hard cuts, no tuning, single eval. Frozen R173 files; theta 0.014133 bit-identical; I7 binds 0; slip-kernel identity asserted. Held-out pooled vs T177: P_w(fail) 0.1163 vs 0.1211 = lift +0.48pts (direction as predicted, below +1.2pt expectation); vs T173 -0.85pts (hard-tag diode stands). Score_w 88.37>=70; ESS 91.44 vs 80.27; cov_w 0.9728>=0.9695; archive mass 0.0. Mid-band mean_w 0.3257 vs 0.2278 (+43% mass restored), p_fail_w stable 0.0413 vs 0.0388. KEEP per pre-reg iff rule (runA B 1.00 Welch p=1.1e-4 cited + score_w>=70 + no regression). Not a gate variant (0.618 frozen, post-hoc, no control). If frontier continues: freeze slip kernel, next try exponent (1-fric)^0.5 only. Tier-2 accuracy stays binding.", "rig": "experiments/kaggle_aegis_sweep.py", "command": "POST-HOC ONLY, zero rig edits, no rig run; python3 results/aegis_v2/I2_r178_analysis.py on frozen R173 files", "compare_champion": "trochoid", "metric": 1.0, "metric_unit": "transfer_success Fixture-B fitted Run-A decider (G2 primary; tag lift +0.48pts vs T177 in metrics)", "metrics": {"idea": "I2", "variant": "T178 softened-fric shrinker w=T173*P50/(slip+P50)*(1-0.5*fric)", "seeds": 20, "gate_mode": "post-hoc", "path": "fitted-frozen", "decider_noise": "0.01,2", "archive_noise": "2.0-offline-only", "overrides": "none", "inloop_veto": false, "theta_bitidentical_172_173": true, "P50_slip_frozen_trainonly": 0.008106, "i7_binds_heldout": 0, "runA_B": [1.0, 0.75], "runA_welch_p": 0.0001087, "runA_keep_cited": true, "held_T173_p_fail_given_adm": 0.1078, "held_T177_p_fail_weighted": 0.1211, "held_T178_p_fail_weighted": 0.1163, "lift_T178_vs_T177_pts": 0.48, "lift_T178_vs_T173_pts": -0.85, "train_lift_T178_vs_T177_pts": -0.43, "score_w": 88.37, "recall_w": 0.3711, "ess_held": 91.44, "mean_w_held": 0.3674, "cov_ok": true, "midband_mean_w_T178_vs_T177": [0.3257, 0.2278], "midband_p_fail_w_T178_vs_T177": [0.0413, 0.0388], "archive_valid_mass_rate": 0.0, "verdict_rule": {"runA_keep": true, "score_w_ge_70": true, "no_cov_regression": true}}, "evidence_file": "results/aegis_v2/I2_r178_result.json", "integrity_g7": true, "banned_phrases_checked": true, "timeout_s": 0, "cleanup_anchored_kill": true, "remote_gpu_deferred": false, "verdict": "KEEP per pre-reg iff rule (score_w 88.37>=70); lift +0.48pts vs T177 direction-right magnitude-below-prediction; hard-tag diode stands (-0.85pts); Tier-2 accuracy stays binding."}
{"run": 179, "segment": 15, "status": "keep", "idea": "I2", "timestamp": "2026-09-28T00:00:00Z", "description": "T179 low-fric-tolerant shrinker POST-HOC ONLY + frozen I7+I10 (director iter 13). Weight w=T173*P50/(slip+P50)*(1-0.25*fric), P50=0.008106 train-locked, zero hard cuts, no tuning, single eval. Frozen R173 files; theta 0.014133 bit-identical; I7 binds 0; w179/w178 ratio == (1-0.25f)/(1-0.5f) asserted. Held-out pooled vs T173: P_w(fail) 0.1146 vs 0.1078 = lift -0.68pts (hard-tag diode stands); vs T177 +0.65pts; vs T178 +0.17pts. Score_w 88.54>=70; ESS 94.91; cov_w 0.9729>=0.9695; archive mass 0.0. Ablation alpha{0,0.25,0.5}xP50{0.008,median}: p_w 0.1131/0.1146/0.1163 monotone (+0.16pts per +0.25 alpha: fric penalty actively harmful throughout); slip-only alpha=0 still -0.53 vs T173 (slip kernel no signal either); P50 rounding delta 0.000 (lock inert). Train lift vs T178 -0.16 / held +0.17 sign flip (no-signal pattern). KEEP per pre-reg iff rule (runA B 1.00 Welch p=1.1e-4 cited + score_w>=70 + no regression). Not a gate variant (0.618 frozen, post-hoc, no control). Tier-2 accuracy stays binding.", "rig": "experiments/kaggle_aegis_sweep.py", "command": "POST-HOC ONLY, zero rig edits, no rig run; python3 results/aegis_v2/I2_r179_analysis.py on frozen R173 files", "compare_champion": "trochoid", "metric": 1.0, "metric_unit": "transfer_success Fixture-B fitted Run-A decider (G2 primary; tag lift -0.68pts vs T173 in metrics)", "metrics": {"idea": "I2", "variant": "T179 low-fric-tolerant shrinker w=T173*P50/(slip+P50)*(1-0.25*fric)", "seeds": 20, "gate_mode": "post-hoc", "path": "fitted-frozen", "decider_noise": "0.01,2", "archive_noise": "2.0-offline-only", "overrides": "none", "inloop_veto": false, "theta_bitidentical_172_173": true, "P50_slip_frozen_trainonly": 0.008106, "P50_train_recomputed": 0.008106, "alpha_179": 0.25, "i7_binds_heldout": 0, "runA_B": [1.0, 0.75], "runA_welch_p": 0.0001087, "runA_keep_cited": true, "held_T173_p_fail_given_adm": 0.1078, "held_T177_p_fail_weighted": 0.1211, "held_T178_p_fail_weighted": 0.1163, "held_T179_p_fail_weighted": 0.1146, "lift_T179_vs_T173_pts": -0.68, "lift_T179_vs_T177_pts": 0.65, "lift_T179_vs_T178_pts": 0.17, "train_lift_T179_vs_T178_pts": -0.16, "score_w": 88.54, "precision_w": 0.8854, "recall_w": 0.4074, "ess_held": 94.91, "ablation_p_w_alpha0": 0.1131, "ablation_p_w_alpha025": 0.1146, "ablation_p_w_alpha05": 0.1163, "ablation_alpha_slope_per025_pts": 0.16, "ablation_sliponly_lift_vs_T173_pts": -0.53, "ablation_P50rounding_delta_pts": 0.0, "cov_ok": true, "archive_valid_mass_rate": 0.0, "evidence": ["results/aegis_v2/I2_r173_calib_0012.jsonl", "results/aegis_v2/I2_r173_test_0012.jsonl", "results/aegis_v2/I2_r173_archive_20.jsonl", "results/aegis_v2/I2_r179_analysis.py", "results/aegis_v2/I2_r179_result.json"]}}
{"run": 180, "segment": 15, "status": "keep", "idea": "I2", "timestamp": "2026-09-28T00:00:00Z", "description": "T180 zero-fric control POST-HOC ONLY + frozen I7+I10 (director iter 14). Weight w=T173*P50/(slip+P50), P50=0.008 director-frozen, no fric term (k=1.0/0.5/0.25->0). Zero rig edits, offline on frozen R173 files; theta 0.014133 bit-identical; I7 binds 0. Held-out pooled vs T173: P_w(fail) 0.1131 vs 0.1078 = lift -0.53pts (hard-tag diode stands; slip kernel alone no signal); vs T177 +0.80, vs T178 +0.32, vs T179 +0.15 (monotone: fric penalty harmful throughout, magnitude shrinks to k=0). Score_w 88.69>=70; ESS 97.32; cov_w 0.9729>=0.9695; archive mass 0.0. Train lift +0.56/held -0.53 sign flip (no-signal pattern). KEEP per pre-reg iff rule (runA B 1.00 Welch p=1.1e-4 cited + score_w>=70 + no regression). FRIC-PENALTY LINE CLOSED: even k=0 cannot beat hard tag; pivot frontier next. Tier-2 accuracy stays binding.", "rig": "experiments/kaggle_aegis_sweep.py", "command": "POST-HOC ONLY, zero rig edits, no rig run; python3 results/aegis_v2/I2_r180_analysis.py on frozen R173 files", "compare_champion": "trochoid", "metric": 1.0, "metric_unit": "transfer_success Fixture-B fitted Run-A decider (G2 primary; tag lift -0.53pts vs T173 in metrics)", "metrics": {"idea": "I2", "variant": "T180 zero-fric control w=T173*P50/(slip+P50)", "seeds": 20, "gate_mode": "post-hoc", "path": "fitted-frozen", "decider_noise": "0.01,2", "archive_noise": "2.0-offline-only", "overrides": "none", "inloop_veto": false, "theta_bitidentical_172_173": true, "P50_frozen_director": 0.008, "P50_train_recomputed": 0.008106, "fric_factor": "none (k=0)", "i7_binds_heldout": 0, "runA_B": [1.0, 0.75], "runA_welch_p": 0.0001087, "runA_keep_cited": true, "held_T173_p_fail_given_adm": 0.1078, "held_T180_p_fail_weighted": 0.1131, "lift_T180_vs_T173_pts": -0.53, "lift_T180_vs_T177_pts": 0.8, "lift_T180_vs_T178_pts": 0.32, "lift_T180_vs_T179_pts": 0.15, "score_w": 88.69, "recall_w": 0.4411, "ess_held": 97.32, "cov_ok": true, "archive_valid_mass_rate": 0.0, "fric_line_kill": true, "evidence": ["results/aegis_v2/I2_r173_calib_0012.jsonl", "results/aegis_v2/I2_r173_test_0012.jsonl", "results/aegis_v2/I2_r173_archive_20.jsonl", "results/aegis_v2/I2_r180_analysis.py", "results/aegis_v2/I2_r180_result.json"]}}
{"run": 181, "segment": 15, "status": "keep", "idea": "I2", "timestamp": "2026-09-28T00:00:00Z", "description": "T181 slip-gated normalized-fric shrinker POST-HOC ONLY + frozen I7+I10 (director iter 15). Weight w=T173*P50/(slip+P50)*(1-0.5*fric_n*gate), P50=0.008 director-frozen, fric_n=clip(fric/med_fric,0,1) med_fric=0.3599 train-SUCCESS-locked, gate=1 iff slip<P50 else 0. Zero rig edits, offline on frozen R173 files; theta 0.014133 bit-identical; I7 binds 0. Held-out pooled: P_w(fail) 0.1046 vs T173 0.1078 = lift +0.32pts (FIRST positive vs hard tag since T173) and vs T180 0.1131 = +0.85pts head-to-head WIN. Score_w 89.54>=70; ESS 97.75; cov_w 0.9733>=0.9695; archive mass 0.0. Gate ablation: forced-gate-on 0.1177 (-0.46 vs T180, normalized fric alone still harmful); gate effect +1.31pts (gating carries the win). Train lift -0.69/held +0.32 flip noted. KEEP per pre-reg iff rule (runA B 1.00 Welch p=1.1e-4 cited + score_w>=70 + no regression). Fric line stays OPEN (kill not triggered); pivot none.", "rig": "experiments/kaggle_aegis_sweep.py", "command": "POST-HOC ONLY, zero rig edits, no rig run; python3 results/aegis_v2/I2_r181_analysis.py on frozen R173 files", "compare_champion": "trochoid", "metric": 1.0, "metric_unit": "transfer_success Fixture-B fitted Run-A decider (G2 primary; tag lift +0.32pts vs T173 / +0.85pts vs T180 in metrics)", "metrics": {"idea": "I2", "variant": "T181 slip-gated normalized-fric shrinker w=T173*P50/(slip+P50)*(1-0.5*fric_n*gate)", "seeds": 20, "gate_mode": "post-hoc", "path": "fitted-frozen", "decider_noise": "0.01,2", "archive_noise": "2.0-offline-only", "overrides": "none", "inloop_veto": false, "theta_bitidentical_172_173": true, "P50_frozen_director": 0.008, "P50_train_recomputed": 0.008106, "med_fric_train_success": 0.3599, "fric_coef": 0.5, "i7_binds_heldout": 0, "runA_B": [1.0, 0.75], "runA_welch_p": 0.0001087, "runA_keep_cited": true, "held_T173_p_fail_given_adm": 0.1078, "held_T180_p_fail_weighted": 0.1131, "held_T181_p_fail_weighted": 0.1046, "held_T181_gateon_p_fail_weighted": 0.1177, "lift_T181_vs_T173_pts": 0.32, "lift_T181_vs_T180_pts": 0.85, "lift_gateon_vs_T180_pts": -0.46, "lift_gate_effect_pts": 1.31, "train_lift_T181_vs_T173_pts": -0.69, "score_w": 89.54, "recall_w": 0.3792, "ess_held": 97.75, "gate_rate_held": 0.5196, "cov_ok": true, "archive_valid_mass_rate": 0.0, "head_to_head_win_vs_T180": true, "fric_line_kill": false, "evidence": ["results/aegis_v2/I2_r173_calib_0012.jsonl", "results/aegis_v2/I2_r173_test_0012.jsonl", "results/aegis_v2/I2_r173_archive_20.jsonl", "results/aegis_v2/I2_r181_analysis.py", "results/aegis_v2/I2_r181_result.json"]}, "evidence_file": "results/aegis_v2/I2_r181_result.json", "integrity_g7": true, "banned_phrases_checked": true, "timeout_s": 0, "cleanup_anchored_kill": true, "remote_gpu_deferred": false, "verdict": "KEEP per pre-reg iff rule (score_w 89.54>=70); head-to-head WIN vs T180 (+0.85pts); FIRST positive lift vs hard T173 (+0.32pts); gate ablation isolates the win to slip-gating (+1.31pts); fric line stays OPEN per director kill rule (keep>=70 AND >T180); Tier-2 accuracy stays binding."}
{"run": 182, "segment": 15, "status": "keep", "idea": "I2", "timestamp": "2026-09-28T00:00:00Z", "description": "T182 fric-capped slip-floored shrinker POST-HOC ONLY + frozen I7+I10 (director iter 16). Weight w=T173*P50/(slip+P50)*(1-0.35*fric_n), P50=0.008 director-frozen, fric_n=clip(fric/0.3599,0,1) train-SUCCESS-locked, w=0 if slip<1e-4 (slip floor). Zero rig edits, offline on frozen R173 files; theta 0.014133 bit-identical; I7 binds 0; slip floor binds 0/120 calib+held+archive (inert guard, correct). Held-out pooled: P_w(fail) 0.1159 vs T173 0.1078 = lift -0.81pts (diode stands); vs T179 -0.13, vs T180 -0.28, vs T181 -1.13. Score_w 88.41>=70; ESS 90.52; cov ok; archive 0.0. Slip-decile breakdown: failures concentrate decile 3 (5/12); T182 uniform capped penalty sheds success mass in high-slip deciles 6-9 where T181 gate spares it (deciles 6,8 zero fails, T182 cuts weights ~35% vs T181). KEEP per iff rule; head-to-head vs T180 FAILS -> director fail rule: freeze 0.35, sweep P50 next. Tier-2 binding.", "rig": "experiments/kaggle_aegis_sweep.py", "command": "POST-HOC ONLY, zero rig edits, no rig run; python3 results/aegis_v2/I2_r182_analysis.py on frozen R173 files", "compare_champion": "trochoid", "metric": 1.0, "metric_unit": "transfer_success Fixture-B fitted Run-A decider (G2 primary; tag lift -0.81pts vs T173 / -0.28pts vs T180 in metrics)", "metrics": {"idea": "I2", "variant": "T182 fric-capped slip-floored shrinker w=T173*P50/(slip+P50)*(1-0.35*fric_n), floor 1e-4", "seeds": 20, "gate_mode": "post-hoc", "path": "fitted-frozen", "decider_noise": "0.01,2", "archive_noise": "2.0-offline-only", "overrides": "none", "inloop_veto": false, "theta_bitidentical_172_173": true, "P50_frozen_director": 0.008, "P50_train_recomputed": 0.008106, "med_fric_train_success": 0.3599, "fric_coef": 0.35, "slip_floor": 0.0001, "slip_floor_hits": {"calib": 0, "held": 0, "archive": 0}, "i7_binds_heldout": 0, "runA_B": [1.0, 0.75], "runA_welch_p": 0.0001087, "runA_keep_cited": true, "held_T173_p_fail_given_adm": 0.1078, "held_T179_p_fail_weighted": 0.1146, "held_T180_p_fail_weighted": 0.1131, "held_T181_p_fail_weighted": 0.1046, "held_T182_p_fail_weighted": 0.1159, "held_T182_score_w": 88.41, "held_T182_ess": 90.52, "lift_T182_vs_T173_pts": -0.81, "lift_T182_vs_T179_pts": -0.13, "lift_T182_vs_T180_pts": -0.28, "lift_T182_vs_T181_pts": -1.13, "train_lift_T182_vs_T173_pts": 0.96, "cov_ok": true, "decile3_n_fail": 5, "archive_valid_mass_rate": 0.0}, "evidence_file": "results/aegis_v2/I2_r182_result.json", "integrity_g7": true, "banned_phrases_checked": true, "timeout_s": 0, "cleanup_anchored_kill": true, "remote_gpu_deferred": false, "verdict": "KEEP per pre-reg iff rule (score_w 88.41>=70); head-to-head vs T180 FAILS (-0.28pts) and vs T181 (-1.13pts); director fail rule fires: freeze 0.35, sweep P50 next; Tier-2 accuracy stays binding."}
{"run": 183, "segment": 15, "status": "keep", "idea": "I2", "timestamp": "2026-09-28T00:00:00Z", "description": "T183 fric-light damped shrinker POST-HOC ONLY + frozen I7+I10 (director iter 8). Weight w=T173*P50/(max(slip,0.002)+P50)*(1-0.2*min(fric_n,1.0)), P50=0.008 director-frozen, fric_n=fric/0.3599 train-SUCCESS-locked. Zero rig edits, offline on frozen R173 files; theta 0.014133 bit-identical; I7 binds 0; damp binds 0/120 calib+held+archive (inert guard, correct). Held-out pooled: P_w(fail) 0.1145 vs T173 0.1078 = lift -0.67pts (diode stands); vs T180 -0.14 (head-to-head FAIL, below +0.6-0.9pt prediction); vs T181 -0.99; vs T182 +0.14. Score_w 88.55>=70; ESS 94.24; cov ok; archive 0.0. Train lift +0.76/held -0.67 flip. KEEP per iff rule. Tier-2 binding.", "rig": "experiments/kaggle_aegis_sweep.py", "command": "POST-HOC ONLY, zero rig edits, no rig run; python3 results/aegis_v2/I2_r183_analysis.py on frozen R173 files", "compare_champion": "trochoid", "metric": 1.0, "metric_unit": "transfer_success Fixture-B fitted Run-A decider (G2 primary; tag lift -0.67pts vs T173 / -0.14pts vs T180 in metrics)", "metrics": {"idea": "I2", "variant": "T183 fric-light damped shrinker w=T173*P50/(max(slip,0.002)+P50)*(1-0.2*min(fric_n,1.0))", "seeds": 20, "gate_mode": "post-hoc", "path": "fitted-frozen", "decider_noise": "0.01,2", "archive_noise": "2.0-offline-only", "overrides": "none", "inloop_veto": false, "theta_bitidentical_172_173": true, "P50_frozen_director": 0.008, "P50_train_recomputed": 0.008106, "med_fric_train_success": 0.3599, "fric_coef": 0.2, "slip_damp": 0.002, "slip_kernel_cap": 0.8, "slip_damp_hits": {"calib": 0, "held": 0, "archive": 0}, "i7_binds_heldout": 0, "runA_B": [1.0, 0.75], "runA_welch_p": 0.0001087, "runA_keep_cited": true, "held_T173_p_fail_given_adm": 0.1078, "held_T180_p_fail_weighted": 0.1131, "held_T181_p_fail_weighted": 0.1046, "held_T182_p_fail_weighted": 0.1159, "held_T183_p_fail_weighted": 0.1145, "held_T183_score_w": 88.55, "held_T183_ess": 94.24, "lift_T183_vs_T173_pts": -0.67, "lift_T183_vs_T180_pts": -0.14, "lift_T183_vs_T181_pts": -0.99, "lift_T183_vs_T182_pts": 0.14, "train_lift_T183_vs_T173_pts": 0.76, "cov_ok": true, "archive_valid_mass_rate": 0.0, "head_to_head_win_vs_T180": false}, "evidence_file": "results/aegis_v2/I2_r183_result.json", "integrity_g7": true, "banned_phrases_checked": true, "timeout_s": 0, "cleanup_anchored_kill": true, "remote_gpu_deferred": false, "verdict": "KEEP per pre-reg iff rule (score_w 88.55>=70); head-to-head vs T180 FAILS (-0.14pts, below +0.6-0.9pt prediction); vs T181 -0.99 (gating WHERE still beats coefficient HOW-MUCH); Tier-2 accuracy stays binding."}
