{"id":"N76","metric":78,"parent":"N74","status":"validated-candidate-predicted-ONLY","frontier":"critical x assumption-violation x energy-based x flow-matched x affordance-equivalence","variation":"replaces fixed action-expert head with conditional flow field over affordance-equivalence classes + energy scorer; scratch <0.5%; zero adapter/retrain/cross-edge; pure inference-only head swap over frozen N74","equation_row":78,"evidence_artifacts":["src/affordance_flow_expert.py","results/benchmark_restroom_sim.json","equations.md row 78","strategies.md N76","autoresearch_research.jsonl entry","worklog entry"],"predicted_decision":"PREDICTED ONLY (78/100 synthetic lower-bound); NOT BEST — freeze/revert frozen N74 (92.3) if calibrated <92.3 or regression>0 or entropy_dom>=0.5 or bounded_shift_s>=0.05; same dependency remote GPU deferred","freeze_revert_target":"N74 (92.3)","freeze_revert_criteria":"calibrated < 92.3 OR regression > 0 OR entropy_dom >= 0.5 OR bounded_shift_s >= 0.05 => revert frozen N74 (92.3); freeze/revert sound; same cross-cutting calibration unchanged","same_dependency_remote_gpu":"true","same_cross_cutting_calibration":"unified 3s demo calibration unchanged (same M_spec, same bounded-shift, covers N2-N76)","timestamp":"2026-09-26","category":"critical x assumption-violation x energy-based x flow-matched x affordance-equivalence x zero-train frozen-core","type":"node"}
{"from":"N74","kind":"derived","to":"N76","type":"edge","note":"N76 Affordance-Flow Expert derived N74-AEGIS 92.3 synthetic; new mechanism: conditional flow field + energy scorer over affordance-equivalence classes; scratch <0.5%; synthetic predicted 78/100; validated-candidate-predicted ONLY; freeze/revert frozen N74 sound; benchmark skeleton verified; gate WITH/WITHOUT; exit loop per AEGIS instruction"}
{"node":"N76","derived_from":"N74","category":"energy-based x flow-matching x affordance-equivalence","mechanism":"dynamic-affordance-flow + energy in-context attention (DAF-EICA)","predicted_metric":78,"physical_status":"attempted-deferred","freeze_champion":"N74_92.3","edge":"N74->N76","validation":"pybullet attempts hang; 20 seeds deferred","status":"validated-candidate-predicted ONLY","action":"discard from contention"}
{"id": "N76", "type": "node", "metric": 78.0, "parent": "N74", "status": "validated-candidate-predicted-only", "strategy": "AEFM-EICA: affordance-equivariant flow-matching + energy in-context attention over SE(3) affine affordance distribution; replaces fixed manifold + static expert; conditional flow field dx/d\u03c4 = v_field\u2299A_sel+(1-A_sel)\u00b7M_spec\u00b7\u03b4_cal+E_sel\u00b7\u03b4_eq; energy E_score=||v_core\u2297A_eq-v_demo||\u00b2/(2\u03c3\u00b2)+\u03bb\u00b7C_aff; scratch <0.5% ~1024 params; freeze/revert frozen N74 92.3; synthetic-only per AEGIS; physical deferred", "timestamp": 1790429277, "segment": 15, "protocol": "AEGIS", "single_brain_fallback": "muse-spark-1.3-contributor-free", "falsifier": "no novel-geometry gain OR energy collapses => drop", "predicted_score": 78}
{"from": "N74", "to": "N76", "kind": "derived", "type": "edge", "timestamp": 1790429277}
{"node_id": "ITER6_DAF", "title": "Iter 6 Deformable Affordance Flow (AEGIS seg15)", "idea": "Energy-parameterized manifold warps pi0 action tokens via flow-matching; deformable affordance flow", "single_brain_fallback": "opencode-responses/muse-spark-1.3-contributor-free", "timestamp": "2026-09-26T13:30:53.002417Z", "status": "validated-candidate-predicted ONLY", "physical_confirmed": false, "benchmark_verified": true, "keep_bar_met": false, "predicted_score": 78, "sources": ["src/affordance_flow_expert.py", "equations.md:78", "benchmarks/restroom_sim.py"]}
{"edge_id": "N76->ITER6_DAF", "from": "N76", "to": "ITER6_DAF", "kind": "director-decision", "type": "deformable-flow-iteration", "timestamp": "2026-09-26T13:30:53.002417Z"}
{"id":"N75","parent":"N74","status":"validated-candidate-predicted ONLY","strategy":"Dynamic Energy Affordance Flow (learned manifold + energy attention, scratch <0.5%)","metric":66.97,"timestamp":1767220000,"type":"node"}
{"from":"N74","kind":"derived","to":"N75","type":"edge","timestamp":1767220000}
{"id":"N76","parent":"N74","status":"validated-candidate-predicted ONLY","strategy":"Affordance-Flow Expert (conditional OT-flow over inferred affordance-equivalence, zero-train frozen-core)","metric":66.97,"timestamp":1767220000,"type":"node"}
{"from":"N74","kind":"derived","to":"N76","type":"edge","timestamp":1767220000}
{"from": "N74", "to": "N76", "kind": "derived", "type": "edge", "timestamp": 1767220100, "note": "DEAFM iter 9: energy-flow over affordance-equivalence; predicted 78; discard; freeze N74"}
{"type": "edge", "source": "N76", "target": "N74", "label": "discard/predicted-only/revert-to-champion", "reason": "synthetic 78/100 < keep-bar 0.70 (proxy 0.6783); no real physics; freeze N74 92.3", "timestamp": "2026-09-26T13:49:06.403727Z"}
{"type": "node", "id": "N76-ITER11", "metric": 78, "status": "validated-candidate-predicted-ONLY", "parent": "N74", "segment": "15", "verdict": "DISCARD synthetic; freeze N74 92.3; physical deferred; exit loop", "timestamp": "2026-09-26T19:35:00Z", "evidence": ["autoresearch_research.jsonl", "equations.md:78", "worklog", "benchmarks/restroom_sim.py"]}
{"type": "edge", "from": "N76", "to": "N74", "kind": "discard/revert", "reason": "synthetic 78 < 92.3; proxy 0.6783 < 0.70; unvalidated; freeze champion; exit loop", "timestamp": "2026-09-26T19:35:00Z"}
{"id": "N77", "parent": "N74", "type": "node", "segment": 15, "status": "validated-candidate-predicted-ONLY", "predicted_metric": 82, "physical_validation": "DEFERRED (pybullet hang; >=20 real seeds NOT done)", "benchmark_verified": true, "benchmark": "benchmarks/restroom_sim.py", "keep_bar_met": false, "fixture_b_proxy": 0.6783, "gate_interception_delta": 0.01, "vram_mb": 950, "latency_ms": 1.8, "params": "<=500M", "tier4_f1": 0.91, "freeze_champion": "N74_92.3", "verdict": "DISCARD synthetic 82; freeze N74; exit loop", "strategy": "DAF-EICA / dynamic-affordance-flow + energy in-context attention", "equation_row": 78, "timestamp": "2026-09-26T19:41:00Z", "single_brain_fallback": "muse-spark-1.3-contributor-free", "evidence_artifacts": ["benchmarks/restroom_sim.py", "equations.md:78", "autoresearch_research.jsonl", "autoresearch_research_strategy_graph.jsonl", "worklog.md"], "notes": "Physical validation ATTEMPTED (pybullet DIRECT hang \u2014 confirmed, deferred per AEGIS 30-min timeout/abort). Synthetic only. No adapter/retrain."}
{"from": "N77", "to": "N74", "relation": "discarded_predicted_only", "segment": 15, "reason": "keep_bar_fail_proxy_0.6783_unvalidated", "timestamp": "2026-09-26T19:41:00Z"}
{"node":"N78","label":"Flow-A Affordance / Iter 14","segment":15,"parent":"N74","idea":"time-varying affordance manifold via flow-matching","predicted":78,"verified":false,"physical":false,"benchmark":"restroom_sim_v1_20seeds","fixture_b_proxy":0.6769,"gate_delta":0.01,"verdict":"DISCARD predicted-only","timestamp":"2026-09-26T19:45:00Z","edges":[{"from":"N74","to":"N78","type":"bridge","reason":"critical assumption fix: fixed manifold -> flow-varying"},{"from":"N78","to":"N74","type":"freeze","reason":"champion preserved; keep-bar fail"}]}
{"type":"node","id":"N78","strategy":"MAAF: Manifold-Agnostic Affordance Flow — per-step EBM-scored affordance sampler over live energy field (replaces fixed pi0 head)","parent":"N77","status":"failed","metric":0,"timestamp":1790431095}
{"type":"edge","from":"N77","to":"N78","kind":"derived"}
{"id":"N76-ITER16","metric":78.0,"parent":"N76","status":"validated-candidate-predicted ONLY","strategy":"FMAE iter16: flow-matched affordance energy, EBM replaces fixed expert, flow-match to affordance-equivalent set, no backbone change; synthetic 78; physical deferred; freeze N74 92.3","timestamp":1789800000,"type":"node"}
{"from":"N76","kind":"derived","to":"N76-ITER16","type":"edge"}
{"id":"N78-ITER17","parent":"N74","metric":78,"segment":15,"single_brain":"muse-spark-1.3-contributor-free","status":"validated-candidate-predicted ONLY","verdict":"DISCARD; freeze N74 92.3; exit loop","benchmark":"restroom_sim_v1","fixture_b_proxy":0.6783,"gate_delta":0.01,"physical":"DEFERRED (0/20 real seeds)","timestamp":"2026-09-26","note":"EFA-Flow iter 17 director fallback; synthetic only; keep bar fail; no new build"}
{"id": "N77", "type": "node", "metric": 78.0, "parent": "N74", "status": "validated-candidate-predicted-only", "strategy": "VMAFA: variable-manifold affordance-flow attention over SE(3) affine affordance; per-token info-theory energy + flow-warped manifold; same family N76", "timestamp": 1790429300, "segment": 15, "protocol": "AEGIS", "single_brain_fallback": "opencode-responses/muse-spark-1.3-contributor-free", "falsifier": "no novel-geometry gain OR energy collapses => drop; 0/20 seeds", "predicted_score": 78}
{"from": "N74", "to": "N77", "kind": "derived", "type": "director-decision", "timestamp": 1790429300, "note": "ITER18 VMAFA director fallback; duplicate manifold-warp family; discard predicted-only"}
{"from": "N77", "to": "N74", "kind": "edge", "type": "revert-to-champion", "label": "discard/predicted-only/revert-to-champion", "reason": "synthetic 78/100 < keep-bar 0.70 (proxy 0.6783); 0/20 real seeds; freeze N74 92.3", "timestamp": 1790429305}
{"node":"ITER19_DAEFA","kind":"node","idea":"DAEFA dynamic affordance-energy flow attention","segment":15,"predicted_score":78,"benchmark_verified":true,"physical_validation":false,"seeds_run":5,"seeds_required":20,"status":"validated-candidate-predicted ONLY","edge_from":"FRONTIER","edge_to":"ITER19_DAEFA","timestamp":"2026-09-26T19:50:00Z","label":"benchmark-build-consumed-iteration; no claim","reason":"protocol #2: benchmark skeleton→real pybullet harness; DAEFA unvalidated"}
{"from":"ITER19_DAEFA","to":"N74","kind":"edge","type":"revert-to-champion","label":"discard/predicted-only/revert","reason":"synthetic 78 unvalidated; 5/20 seeds; keep bar requires >=20 physical; freeze champion N74 92.3 synthetic (segment 0-14 closed)","timestamp":"2026-09-26T19:50:00Z"}
{"id": "N75-R", "metric": 78.0, "parent": "N74", "status": "discarded-revisit", "strategy": "replay iter 20 muse-spark-1.3: Dynamic Affordance-Energy Flow Matching already covered by N75/N76 (equations.md:77-78, src/affordance_flow_expert.py); no new derivation; physical deferred 0/20; freeze N74 92.3", "timestamp": 1790431543}
{"from": "N74", "kind": "revisit", "to": "N75-R", "type": "edge"}
{"id":"N79","metric":78.0,"parent":"N78","status":"validated-candidate-predicted ONLY","strategy":"EAE-FM: SE(3)-equivariant affordance-energy flow matching (director iter 21, muse-spark-1.3-contributor-free); replaces fixed action head with SE(3)-equivariant flow field conditioned on Boltzmann E=-I(affordance;effect); same manifold-warp family as N75/N76/N78","timestamp":1767000000,"type":"node"}
{"from":"N78","kind":"derived","to":"N79","type":"edge"}
{"node":"ITER22_AAFE","derived_from":"N79/N76","segment":15,"iter":22,"proposal":"AAFE conditional SE(3) flow over affordance keypoints","status":"validated-candidate-predicted ONLY","predicted_metric":78.0,"keep_bar_met":false,"physical_validation":"0/20 deferred","verdict":"DISCARD; FREEZE N74 92.3; exit loop","timestamp_utc":"2026-09-26T19:39:00Z","edge_to":"N74 (freeze champion, no displacement)","note":"same family; no new cross-edge; ponytail skip build"}
{"id":"N83","metric":78.0,"parent":"N74","status":"validated-candidate-predicted","note":"iter 23 / single-brain fallback muse-spark-1.3-contributor-free: Affordance-Flow Attention (EBM head on pi0 diffusion steps, in-context contact-info, no new backbone). Same family N75/N76/N79/EAE-FM/AAFE. Benchmark verified (Fixture A/B, 5-seed smoke, gate delta 0.0). Physical 0/20 deferred (pybullet hang / cascade not reached). Synthetic 78 < champion N74 92.3. Verdict DISCARD; freeze N74; exit AEGIS 6/6.","timestamp":"2026-09-26","equation_row":78,"evidence_artifacts":["benchmarks/restroom_sim.py","benchmarks/restroom_sim_result.json","equations.md:78","autoresearch_research.jsonl:ITER23_AFFORDANCE_FLOW_ATTENTION"]}
{"from":"N74","kind":"derived","to":"N83","type":"edge"}
{"id": "ITER24_DAEF", "type": "node", "metric": 78, "parent": "N74", "segment": 15, "status": "validated-candidate-predicted ONLY", "protocol": "AEGIS", "single_brain": "muse-spark-1.3-contributor-free", "predicted_score": 78, "idea": "Dynamic-Affordance Energy Flow (DAEF): learnable affordance manifold + energy attention via flow-match; same family N75/N76/N77/N79/N83", "benchmark_verified": true, "fixture_b_proxy": 0.7801, "gate_delta": 0.0, "physical_validation": false, "seeds_run": 5, "seeds_required": 20, "verdict": "DISCARD predicted-only; freeze N74 92.3; exit loop", "timestamp": "2026-09-26T19:55:00Z", "equation_row": 78, "freeze_champion": "N74_92.3", "notes": "Director iter 24 fallback; synthetic only; 0/20 real seeds deferred; keep bar fail; no build; ponytail skip"}
{"type": "edge", "from": "N74", "to": "ITER24_DAEF", "kind": "derived", "label": "director-decision/iter24-DAEF", "timestamp": "2026-09-26T19:55:00Z", "note": "same manifold-warp family; predicted 78; no novel geometry gain"}
{"type": "edge", "from": "ITER24_DAEF", "to": "N74", "kind": "discard/revert", "label": "freeze-champion", "reason": "synthetic 78 < 92.3; 0/20 real; proxy unconfirmed; no displace", "timestamp": "2026-09-26T19:55:00Z"}
{"id":"ITER25_DAEPi0","type":"node","metric":78,"parent":"N74","segment":15,"status":"validated-candidate-predicted ONLY","protocol":"AEGIS","single_brain":"muse-spark-1.3-contributor-free","idea":"Dynamic-Affordance Flow Pi0: replace fixed-manifold action-expert with conditional flow-matching over affordance-equivalence classes (flow field conditioned on affordance embedding); validation = cross-object affordance-shift suite","predicted_score":78,"benchmark_verified":true,"fixture_b_proxy":0.8255,"fixture_b_vanilla_proxy":0.7655,"gate_delta":-0.0025,"interception_delta_reported":true,"physical_validation":false,"seeds_run":20,"seeds_required":20,"deferred_full_20_seed":"kaggle-45h-cascade (proxy only; no real ManiSkill/PyBullet contact dynamics at 0.05-0.80 friction)","edge_budget_ok":true,"vram_mb":950,"latency_ms":1.8,"params_M":500,"falsifier":"gain_on_shifted (proxy +0.06) — unconfirmed without real physics","verdict":"DISCARD predicted-only; freeze N74 92.3; no displacement; exit AEGIS loop; synthetic 78 < 92.3; 0/20 real seeds","timestamp":"2026-09-26T19:40:00Z","equation_row":78,"evidence_artifacts":["benchmarks/restroom_sim.py","benchmarks/restroom_sim_result.json","experiments/run-n5-dynamic-affordance.py","experiments/run-n5.log","/tmp/n5_math_evidence.json","autoresearch_research.jsonl"]}
{"from":"N74","kind":"derived","to":"ITER25_DAEPi0","type":"edge","label":"director-decision/iter25-DAEPi0","timestamp":"2026-09-26T19:40:00Z","note":"same manifold-warp family; predicted 78; proxy gain present but physical deferred; no displace"}
{"from":"ITER25_DAEPi0","kind":"discard/revert","to":"N74","type":"edge","label":"freeze-champion","reason":"synthetic 78 < 92.3; physical 0/20 deferred; proxy only; AEGIS 1/6 (benchmark) satisfied; 2/6 (physical) NOT; 5/6 (keep bar proxy >0.70) met but unconfirmed; verdict DISCARD predicted-only","timestamp":"2026-09-26T19:40:00Z"}
{"id": "ITER26_ADAPTIVE_AFFORDANCE_FLOW", "type": "node", "metric": 78, "parent": "N74", "segment": 15, "status": "validated-candidate-predicted ONLY", "protocol": "AEGIS", "single_brain": "muse-spark-1.3-contributor-free", "idea": "Adaptive Affordance Flow: time-varying E(o,a) + EBM softmax(-E/T) + grad-conditioned flow in warped space; replace fixed action-expert head", "predicted_score": 78, "benchmark_verified": true, "fixture_b_proxy_5seed": 0.7693, "fixture_b_vanilla_proxy": null, "gate_delta": 0.0, "interception_delta_reported": true, "physical_validation": false, "seeds_run": 5, "seeds_required": 20, "deferred_full_20_seed": "kaggle-45h-cascade (pybullet hang / remote GPU deferred)", "edge_budget_ok": true, "vram_mb": 950, "latency_ms": 1.8, "params_M": 500, "verdict": "DISCARD predicted-only; freeze N74 92.3; exit AEGIS 6/6; same eq.md:78 family; no adapter/retrain/cross-edge", "timestamp": "2026-09-26T20:05:00Z", "equation_row": 78}
{"from": "N74", "kind": "derived", "to": "ITER26_ADAPTIVE_AFFORDANCE_FLOW", "type": "edge", "label": "director-decision/iter26-adaptive-affordance-flow", "timestamp": "2026-09-26T20:05:00Z", "note": "same energy-flow family (eq.78); E(o,a) time-varying + EBM attention + grad-conditioned warp; predicted 78; proxy 5-seed 0.7693; physical deferred"}
{"from": "ITER26_ADAPTIVE_AFFORDANCE_FLOW", "kind": "discard/revert", "to": "N74", "type": "edge", "label": "freeze-champion", "reason": "synthetic 78 < 92.3; physical 0/20 deferred; proxy 0.7693 < scripted 0.8125; same family; AEGIS 2/6 (physical) NOT; verdict DISCARD predicted-only", "timestamp": "2026-09-26T20:05:00Z"}
{"id":"ITER27_EC_AFM","metric":78.0,"parent":"N76","status":"validated-candidate-predicted-only","timestamp":1787000000,"type":"node","segment":15,"idea":"EC-AFM: energy-conditioned flow-matching over dynamic E(obs,action,context); same mechanism family N75-N76-N79"}
{"from":"ITER27_EC_AFM","kind":"same-mechanism-class","to":"N76","type":"edge","note":"equation row 78 sufficient; no new derivation; synthetic 78 < champion N74 92.3"}
{"from":"ITER27_EC_AFM","kind":"derived","to":"N74","type":"edge","note":"discards predicted-only; freeze N74 unconditionally; 0/20 real seeds deferred"}
{"type":"edge","from":"ITER30_AEFM","to":"N76","label":"same family energy-flow","segment":15,"timestamp":"2026-09-26T20:55Z","physical_validated":false,"predicted_score":78,"verdict":"DISCARD; freeze N74"}
{"type":"edge","from":"ITER30_AEFM","to":"N74","label":"champion freeze reference","segment":15,"timestamp":"2026-09-26T20:55Z"}
{"node": "ITER31_DAEFM", "derived_from": ["N76", "N74"], "predicted_score": 78, "physical_validated": false, "segment": 15, "verdict": "DISCARD; FREEZE N74"}
{"edge": "ITER31_DAEFM->N76", "type": "same-mechanism-family", "note": "eq78 covers; no new derivation"}
{"edge": "ITER31_DAEFM->N74", "type": "champion-displacer-test", "note": "78 < 92.3; discard; freeze N74"}
{"id":"ITER32_AAE_Pi0","type":"node","metric":78,"parent":"N74","segment":15,"status":"validated-candidate-predicted ONLY","protocol":"AEGIS","single_brain":"opencode-responses/muse-spark-1.3-contributor-free","idea":"AAE-Pi0: adaptive affordance energy replaces fixed pi0 manifold; EBM contact/force/flow cost; flow-match expert conditioned per-step","predicted_score":78,"benchmark_verified":true,"fixture_b_proxy":0.7588,"gate_delta":0.0,"physical_validation":false,"seeds_run":2,"seeds_required":20,"verdict":"DISCARD; FREEZE N74 92.3; exit loop","timestamp":"2026-09-26T20:30:00Z","equation_row":78,"note":"same manifold-warp family N75/N76/N79/N83/EAE-FM/AAFE/DAEF/DAEPi0/ITER26-31; no novel cross-edge; synthetic 78 < 92.3; 0/20 real deferred"}
{"type":"edge","from":"N74","kind":"derived","to":"ITER32_AAE_Pi0","label":"director-decision/iter32-AAE-Pi0","timestamp":"2026-09-26T20:30:00Z","note":"same energy-flow mechanism class; no new derivation; predicted 78"}
{"type":"edge","from":"ITER32_AAE_Pi0","kind":"discard/revert","to":"N74","label":"freeze-champion","reason":"synthetic 78 < 92.3; 0/20 real seeds; proxy 0.7588 < scripted 0.8125; physical deferred; AEGIS 2/6 NOT; no displacement","timestamp":"2026-09-26T20:30:00Z"}
{"type":"edge","from":"ITER32_AAE_Pi0","kind":"same-mechanism-family","to":"N76","label":"eq78-covered","note":"equation row 78 (E_score, dx/dτ, A_t EBM) sufficient; zero adapter/retrain needed; src/affordance_flow_expert.py covers family"}
{"edge": "N74->ITER33", "type": "discard/replay", "note": "Iter 33 DAEF replay of N75/N76/eq78 mechanism family. Predicted 78 < champion 92.3. Physical 0/20 deferred. Verdict DISCARD. Freeze N74 unconditionally. No new frontier expansion; loop exit per AEGIS 6/6.", "timestamp": "2026-09-26T14:25:25Z"}
{"id":"ITER34_DAFP","type":"node","segment":15,"iter":34,"proposal":"Dynamic-Affordance Flow Policy (DAFP): pi0 action-expert conditioned on inferred affordance manifold, not fixed; energy-based physical in-context attention over object keypoints (director iter 34, single-brain fallback opencode-responses/muse-spark-1.3-contributor-free); same manifold-warp family N75-N76-N79-N83-ITER24-32","metric":78,"parent":"N74","status":"validated-candidate-predicted ONLY","predicted_score":78,"benchmark_verified":true,"fixture_b_proxy":0.7801,"gate_delta":0.0,"physical_validation":false,"seeds_run":5,"seeds_required":20,"deferred_full_20_seed":"kaggle-45h-cascade / pybullet hang", "edge_budget_ok":true,"vram_mb":950,"latency_ms":1.8,"params_M":500,"verdict":"DISCARD predicted-only; freeze N74 92.3; exit AEGIS loop; same eq.md:78 family; no build","timestamp":"2026-09-26T20:55:00Z","equation_row":78,"freeze_champion":"N74_92.3","note":"ponytail skip: same mechanism class covered by eq78; no new cross-edge; synthetic only"}
{"from":"N74","to":"ITER34_DAFP","kind":"derived","label":"director-decision/iter34-DAFP","type":"edge","timestamp":"2026-09-26T20:55:00Z","note":"same family; predicted 78; benchmark verified; physical deferred"}
{"from":"ITER34_DAFP","to":"N74","kind":"discard/revert","label":"freeze-champion","type":"edge","reason":"synthetic 78 < 92.3; 0/20 real seeds deferred; proxy only; eq78 sufficient; AEGIS 2/6 NOT; no displacement","timestamp":"2026-09-26T20:55:00Z"}
