{"run": 236, "segment": 15, "status": "discard", "idea": "I14", "timestamp": "2026-09-29T04:19:08Z", "rig": "canonical rig experiments/kaggle_aegis_sweep.py (PyBullet DIRECT, system python3, 20 seeds x 3 suites x 2 arms, trochoid path, pose_noise 0,0, rig_version 2); cambered liner AEGIS_SURFACE=bowl AEGIS_BOWL_K=0.01 in BOTH arms; pts_source=physics_contact; coverage_cont/success recomputed from physics contacts at return time", "command": "AEGIS_SURFACE=bowl AEGIS_BOWL_K=0.01 AEGIS_INSET_M=0.020 timeout 1200 python3 experiments/kaggle_aegis_sweep.py --seeds 20 --no-upload --path trochoid --compare trochoid --compare-env AEGIS_INSET_M=0.0 --suites fixture_A,fixture_B,fixture_R --out results/aegis_v2/I14_r236_i0.020_k001.jsonl  (arm 2: same with AEGIS_INSET_M=0.010 AEGIS_WALL_ONLY=1 -> results/aegis_v2/I14_r236_wallonly0.010_k001.jsonl)", "compare_champion": "paired in-rig control: identical seeds / friction / tool / noise / bowl with AEGIS_INSET_M=0.0 (frozen rig: no clamp, wall inert). Flat champion trochoid quoted as reference only (B 1.00, coverage_cont 0.9453) and re-verified bit-identical after the rig edit.", "metric": 0.0, "metric_unit": "fixture_B transfer_success (coverage_cont>=0.90) of the containment arm, /20 seeds (G4 rig keep=false)", "metrics": {"idea": "I14", "lane": "CPU canonical rig", "variant": "I8 unblock attempt 3 of 3 - patch-inset containment on the cambered liner", "mechanism": "Planner: the trochoid row/turn/loop envelope is generated inside an inset rect (half -= INSET_M + 2R, side -= 2(INSET_M + R)), so the plan is C1 by construction. Controller: a WALL force is added when the head's TRUE fixture-frame (u,v) leaves the inset rect -- a PD pull toward the rect (WALL_KP * penetration along the fixture axes, rotated to world), never a teleport, capped by F_CLAMP_N like every other force. Default INSET_M=0.0 -> frozen rig, wall code never entered. This is containment, not an admission gate: it never decides coverage/success.", "bowl_k_m": 0.01, "inset_m": 0.02, "wall_only_ablation": {"inset_m": 0.01, "clamp": false}, "wall_kp": 25.0, "wall_force_cap_n": 3.0, "prereg_bar": {"primary_i8_bowl_escapes_lt_5pct": true, "abort_coverage_drop_gt_0.10": true, "keep_B_gt": 0.7, "keep_p_lt": 0.01}, "screen_4seed_B_k001": {"rule": "no harness crash; escapes <5% first; abort if coverage drops >0.10 vs off; one screen only", "cells": {"off": {"succ": 1, "covc": 0.4258, "escaped": 3, "wall_ticks": 0, "path_len_m": 0.9098}, "i0.010": {"succ": 0, "covc": 0.4961, "escaped": 4, "wall_ticks": 33, "path_len_m": 0.3213}, "i0.020": {"succ": 0, "covc": 0.4062, "escaped": 2, "wall_ticks": 14, "path_len_m": 0.2929}, "i0.035": {"succ": 0, "covc": 0.4883, "escaped": 3, "wall_ticks": 94, "path_len_m": 0.2586}, "wallonly0.010": {"succ": 0, "covc": 0.2812, "escaped": 2, "wall_ticks": 616, "path_len_m": 0.9098}, "wallonly0.020": {"succ": 0, "covc": 0.0508, "escaped": 3, "wall_ticks": 581, "path_len_m": 0.9098}, "wallonly0.020k100": {"succ": 0, "covc": 0.0, "escaped": 3, "wall_ticks": 484, "path_len_m": 0.9098}, "wallonly0.035": {"succ": 0, "covc": 0.0859, "escaped": 3, "wall_ticks": 559, "path_len_m": 0.9098}}, "selected": "i0.020 (only cell with escapes<=2/4 and no coverage abort) + wallonly0.010 as the mechanism-isolating ablation", "one_screen_only": true}, "arm1_clamp_wall_0.020": {"fixture_B": {"succ_base": "0/20", "succ_cand": "0/20", "fisher_p": 1.0, "coverage_cont_base": 0.3797, "coverage_cont_cand": 0.4555, "coverage_cont_delta": 0.0758, "welch_p": 0.21075, "paired_p": 0.14874, "keep": false, "escaped_base": "10/20", "escaped_cand": "9/20", "slip_p90_base_m": 0.3458, "slip_p90_cand_m": 0.28, "launch_frac_base": 0.1115, "launch_frac_cand": 0.0178, "z_exc_max_base_m": 4.2554, "z_exc_max_cand_m": 3.5664, "path_len_base_m": 0.9098, "path_len_cand_m": 0.2929, "wall_ticks_cand": 454, "wall_pen_max_cand_m": 0.3471}, "fixture_A": {"succ_base": "0/20", "succ_cand": "0/20", "fisher_p": 1.0, "coverage_cont_base": 0.2984, "coverage_cont_cand": 0.4292, "coverage_cont_delta": 0.1308, "welch_p": 0.002425, "paired_p": 0.000749, "keep": false, "escaped_base": "17/20", "escaped_cand": "10/20", "path_len_cand_m": 0.2929}, "fixture_R": {"succ_base": "1/20", "succ_cand": "0/20", "fisher_p": 1.0, "coverage_cont_base": 0.3672, "coverage_cont_cand": 0.3529, "coverage_cont_delta": -0.0143, "welch_p": 0.842936, "paired_p": 0.827967, "keep": false, "escaped_base": "12/20", "escaped_cand": "13/20"}}, "arm2_wall_only_0.010": {"fixture_B": {"succ_base": "0/20", "succ_cand": "0/20", "fisher_p": 1.0, "coverage_cont_base": 0.3797, "coverage_cont_cand": 0.3, "coverage_cont_delta": -0.0797, "welch_p": 0.18112, "paired_p": 0.166389, "keep": false, "escaped_base": "10/20", "escaped_cand": "11/20", "wall_ticks_cand": 3820, "wall_pen_max_cand_m": 0.5327}, "fixture_A": {"succ_base": "0/20", "succ_cand": "0/20", "fisher_p": 1.0, "coverage_cont_base": 0.2984, "coverage_cont_cand": 0.1448, "coverage_cont_delta": -0.1536, "welch_p": 0.000213, "paired_p": 0.000356, "keep": false, "escaped_cand": "17/20"}, "fixture_R": {"succ_base": "1/20", "succ_cand": "0/20", "fisher_p": 1.0, "coverage_cont_base": 0.3672, "coverage_cont_cand": 0.1672, "coverage_cont_delta": -0.2, "welch_p": 0.002539, "paired_p": 0.004374, "keep": false, "escaped_cand": "12/20"}}, "confound_declared": "the inset plan shortens the candidate path 3.1x (0.9098 -> 0.2929 m) while the tick budget stays 400 (self.steps uses max(1.0, cur/ref)), so the clamped arm commands ~3x lower arclength speed. The gain is therefore not a clean same-speed comparison; it is reported, not claimed. The wall-only arm is same-length and shows the wall alone is negative.", "flat_champion_reference": {"file": "results/aegis_v2/v2_trochoid_0,0.jsonl", "fixture_B_success": 1.0, "fixture_B_coverage_cont": 0.9453, "slip_p90_m": 0.0106}, "flat_bit_identity_after_edit": {"episodes": 40, "fields": 11, "diffs": 0, "file": "results/aegis_v2/I14_r236_regression_flat_POST-edit.jsonl"}, "harness_errors": "0/120 arm 1, 0/120 arm 2, 0/40 flat regression", "verdict": "DISCARD. The pre-registered primary bar is missed in BOTH arms: bowl escapes 9/20 (45%) for clamp+wall and 11/20 (55%) for wall-only, against <5%. The coverage abort does NOT fire for arm 1 (B delta +0.0758 is a gain, not a drop) but the rig compare record carries keep=false and B success is 0/20, so no keep is claimable. Falsified: containment is not the binding constraint. The escape is a VERTICAL ballistic launch (z_exc_max up to 4.26 m on the B baseline) and a lateral wall force capped at F_CLAMP_N=3.0 N cannot touch it; wall penetration reaches 0.35-0.53 m. The wall-only ablation is actively negative (A coverage 0.2984 -> 0.1448, Welch p=0.0002; R 0.3672 -> 0.1672, p=0.0025) because a wall rect at inset 0.01 is smaller than the champion trochoid's +-R loop envelope, so the wall fights the very loops that generate coverage.", "handoff": "I8 (curved bowl) stays BLOCKED and all three unblock attempts are now exhausted (clock I13, press I15, containment I14). The measured blocker is the force-tracking divergence of the plane-tuned KP/KD/press gains on a paraboloid, which manifests as a vertical launch (the K term levers the head off the camber) and a 0.28-0.35 m p90 residual; lateral containment and the press channel cannot address either. Next candidate, proposed not claimed: re-tune the SERVO itself on the curved surface (curvature-aware KP/KD or normal-frame decomposition), or a vertical-axis compliance term."}, "evidence_file": "results/aegis_v2/I14_r236_i0.020_k001.jsonl; results/aegis_v2/I14_r236_wallonly0.010_k001.jsonl; results/aegis_v2/I14_r236_screen_*.jsonl; results/aegis_v2/I14_r236_analysis.py; results/aegis_v2/I14_r236_result.json; results/aegis_v2/I14_r236_regression_flat_POST-edit.jsonl", "integrity_g7": "coverage_cont/success computed ONLY from physics contact points at return time; the wall is a FORCE (applyExternalForce), no resetBasePositionAndOrientation in the evaluated pass; no arithmetic coverage; flat champion bit-identical 40/40 episodes x 11 fields", "banned_phrases_checked": true, "timeout_s": 1200, "cleanup_anchored_kill": true, "director_directive_adjudication": {"proposal": "SAAEP - SE(3)-Adaptive Affordance-Energy Policy (Director iter 5): replace flow-matching with an energy(score)=contact-force + SE(3)-equivariance penalty, attend over affordance candidates, act=argmin energy; predicted 74 pts keep.", "ruling": "REJECTED, NOT EXECUTED - same precedent as runs 234/235. (1) It is an energy-gated re-derivation of the eq78 family, retired by G3 (manifold-switch/flow-bridge/energy-gated re-derivations). (2) It is a learned/adaptive GATE variant (act = argmin energy is a soft gate on action selection), banned from keeps by the 2026-09-28 freeze. (3) No local pi0/openpi and checkpoints may never be downloaded; the GPU lane is I4/I6 only. (4) It cannot produce a paired --compare-trochoid record in the canonical rig, which G4 requires for any keep. Ran the lowest-numbered executable queued idea instead (I14, the containment unblock both the run-233 and run-235 handoffs named).", "predicted_72_80pt_keep": "not claimable by rule (G3 + G7 gate ban), independent of any result"}}
{"run": 237, "segment": 15, "status": "discard", "idea": "I17", "timestamp": "2026-09-29T10:05:00Z", "rig": "canonical rig experiments/kaggle_aegis_sweep.py (PyBullet DIRECT, system python3, 20 seeds x 3 suites x 2 arms, trochoid path, pose_noise 0,0, rig_version 2); pts_source=physics_contact; coverage_cont/success recomputed from physics contacts at return time; one geometry knob added (AEGIS_TROCH_ALT), solver/force/scoring untouched", "command": "AEGIS_TROCH_ALT=1 timeout 1200 python3 experiments/kaggle_aegis_sweep.py --seeds 20 --no-upload --path trochoid --compare trochoid --compare-env AEGIS_TROCH_ALT=0.0 --suites fixture_A,fixture_B,fixture_R --out results/aegis_v2/I17_r237_alt1_k001.jsonl   (regression: timeout 1200 python3 experiments/kaggle_aegis_sweep.py --seeds 20 --no-upload --path trochoid --suites fixture_A,fixture_B,fixture_R --out results/aegis_v2/I17_r237_regression_flat_POST-edit.jsonl)", "compare_champion": "paired in-rig control: identical seeds / friction / tool / noise with AEGIS_TROCH_ALT=0.0, which IS the frozen champion trochoid path. Baseline arm reproduced it exactly (fixture_B coverage_cont 0.9453, success 20/20 = the documented champion), and a default-env rerun is BIT-IDENTICAL to run-236's post-edit rig on 40 episodes x 43 fields and to the frozen v2_trochoid_0,0.jsonl on 60 episodes x 25 scored fields.", "metric": 0.3, "metric_unit": "fixture_B transfer_success (coverage_cont>=0.90) of the AEGIS_TROCH_ALT=1 arm, /20 seeds (G4 rig keep=false)", "metrics": {"idea": "I17", "lane": "CPU canonical rig", "screens": 0, "variant": "alternating-phase trochoid (per-row loop winding reversal), ideas.md v4 queue", "director_directive_adjudication": "Iter-6 director build = FACC (Force-Adaptive Contact Control): swap the pi0 flow-matching action head for an SE(3)-conditioned contact-energy scorer E(s,a,F) with act = argmin-E by 3-step Langevin, predicted 78/100. NOT EXECUTED, on four independent grounds, following the runs 234/235/236 precedent (adjudicated, not run): (1) G4 requires a paired --compare record in the canonical rig, and the canonical rig is a force-driven pad with no learned action head, so no such record exists; (2) the directive needs a pi0 policy + demo keypoints and checkpoints may never be downloaded locally, so the candidate is not constructible here; (3) G3 permanently retires flow-bridge / energy-gated re-derivations, and swapping a flow-matching head for an energy scorer + Langevin argmin IS that retired family; (4) the FACC line is already closed twice on physical data - T225 (run 232, FACC-Lite degenerate all-reject, 100.0 pts, KILL FACC) and T226 (run 233, adaptive-threshold FACC, 78/78 infeasible, worst-band recall ceiling 0.5714 < 0.65). A third variant of a twice-falsified, G3-retired family is not an iteration. I17, the lowest-numbered queued idea executable on the canonical rig, was run instead.", "mechanism": "Planner only (no gate, no controller, no admission logic). The champion trochoid superimposes a circular scrub loop of amplitude amp=TROCHOID_R_M=0.015 m whose phase w = s*rate advances monotonically along the whole path (rate = DR/R = 33.33 rad/m). I17 negates the winding on odd rows. Implemented as a SIGNED ACCUMULATOR w += rate*ds*sign(row), NOT as a phase negation: literally negating w on odd rows would jump the tool offset by up to 2*amp = 0.03 m at every row turn, which is a teleport (G7), not a path. AEGIS_TROCH_ALT<=0 keeps the champion expression s*DR/R verbatim, so the default rig is bit-identical.", "knob": {"AEGIS_TROCH_ALT": 1.0}, "baseline_knob": {"AEGIS_TROCH_ALT": 0.0}, "prereg_bar": {"keep_B_gt": 0.7, "keep_p_lt": 0.01, "goal": "cancel the per-row lateral residual that a same-winding loop imposes"}, "path_geometry": {"cell_m": 0.05, "fixture_B_side_m": 0.12, "rows_fixture_B": 2, "rows_fixture_A": 3, "champion_points": 229, "alt_points": 230, "champion_len_m": 0.9098, "alt_len_m": 0.9148, "champion_max_turn_deg": 17.63, "alt_max_turn_deg": 36.37, "c1_bound_deg": 60.0, "champion_per_row_v_bias_m": {"-0.06": -0.00223, "-0.01": 0.00171}, "alt_per_row_v_bias_m": {"-0.06": -0.00223, "-0.01": -0.0034}}, "mechanism_proof": {"rate_rad_per_m": 33.3333, "amp_m": 0.015, "row_length_m": 0.4, "phase_span_rad": 13.3333, "turns_per_row": 2.1221, "max_retrace_err_m": 0.0, "statement": "w becomes a TRIANGLE wave (row 0: 0->W, row 1: W->0, W=rate*row_length=13.33 rad=2.12 turns). The offset locus is a function of w alone, so row 1's loop trace equals row 0's EXACTLY (max deviation 0.0 m) - it retraces instead of advancing to a fresh phase."}, "fixture_A": {"n": 20, "baseline_covc": 0.9354, "candidate_covc": 0.9339, "delta_covc": -0.0015, "welch_p": 0.87800248, "paired_p": 0.5266231042178653, "baseline_success": 20, "candidate_success": 14, "fisher_p": 0.02019602, "slip_m": 0.0073, "escaped": 0}, "fixture_B": {"n": 20, "baseline_covc": 0.9453, "candidate_covc": 0.8844, "delta_covc": -0.0609, "welch_p": 4.839e-05, "paired_p": 6.77377261022068e-18, "baseline_success": 20, "candidate_success": 6, "fisher_p": 3.34e-06, "slip_m": 0.0106, "escaped": 0, "baseline_path_len_m": 0.9098, "candidate_path_len_m": 0.9148}, "fixture_R": {"n": 20, "baseline_covc": 0.9427, "candidate_covc": 0.9102, "delta_covc": -0.0325, "welch_p": 0.0156058, "paired_p": 1.5089553191564788e-05, "baseline_success": 19, "candidate_success": 8, "fisher_p": 0.00043163, "slip_m": 0.0081, "escaped": 0}, "rig_keep": false, "unvalidated_rows": 0, "flat_regression": {"vs_run236_post_edit_rig": {"episodes_compared": 40, "fields_compared": 43, "differing_fields": "NONE"}, "vs_frozen_20260727_champion": {"episodes_compared": 60, "fields_compared": 25, "differing_fields": "NONE"}, "bit_identical": true}, "falsification": "No lateral drift existed to cancel: the champion's per-row mean v-offset is -0.0022 / +0.0017 m, already ~0 against a 0.015 m loop amplitude, so the hypothesis that same-winding loops bias the path laterally is FALSE as stated. Worse, the fix is strictly destructive. Making w a triangle wave removes the ONLY thing that makes the superimposed loops add footprint - a fresh phase per row - so on a 2-row patch half the rows re-walk an already-swept trace. Slip is bit-identical (0.0106 m both arms) and there are no escapes, so this is purely a footprint loss: fixture_B coverage_cont -0.0609 (Welch p=4.8e-05) and success 20/20 -> 6/20 (Fisher p=3.3e-06); fixture_R 19/20 -> 8/20 (Fisher p=4.3e-04); fixture_A coverage_cont flat (-0.0015, p=0.88) but success 20/20 -> 14/20 (Fisher p=0.020) because with 3 rows the third row repeats row 0 and pushes episodes across the 0.90 threshold. The winding reversal also doubles the per-segment heading excursion (17.63 -> 36.37 deg, still inside the 60 deg C1 bound) by adding a heading kink at every row turn.", "class_level": "Drift-cancelling winding is falsified for C1 loop-superimposed scrub paths: winding reversal is only C1 if the phase is made continuous, and a continuous phase is necessarily a retrace, which costs more footprint than the drift it removes. Closes I17; also retires the 'alternate the loops' half of the I1 path family (I16 already showed the trochoid sits on a plateau, so a phase re-schedule cannot buy coverage from a plateau either).", "next_queued": "I18 is gated on I21 (diagnose why fitted pitch failed, B 0.20). I8 stays BLOCKED with all three named unblocks (I13 clock, I15 press, I14 containment) exhausted; the next proposal (not claimed) remains curvature-aware servo re-tuning / normal-frame decomposition.", "evidence": ["results/aegis_v2/I17_r237_alt1_k001.jsonl", "results/aegis_v2/I17_r237_regression_flat_POST-edit.jsonl", "results/aegis_v2/I17_r237_analysis.py", "results/aegis_v2/I17_r237_result.json"]}, "verdict": "DISCARD - I17 falsified, not merely unvalidated: the signed accumulator makes the loop phase a triangle wave, so odd rows retrace even rows exactly (0.0 m error) and half the rows add no footprint. fixture_B coverage_cont 0.9453 -> 0.8844 (Welch p=4.8e-05) and success 20/20 -> 6/20 (Fisher p=3.3e-06); rig keep=false. Flat champion bit-identical (40 eps x 43 fields vs run-236, 60 eps x 25 scored fields vs the frozen file).", "notes": "G7-clean (no teleport, no arithmetic on coverage/success, all numbers recomputed from physics contact records by results/aegis_v2/I17_r237_analysis.py). Segment 15, metric transfer_success, statuses legal. Director iter-6 FACC build adjudicated, not run (see metrics.director_directive_adjudication). No GPU used, no data downloaded, disk 78 G free."}
