{"run": 591, "idea": "DAEF-muse-spark-iter33", "idea_id": "DAEF", "status": "discard", "verdict": "DISCARD replay (iter 33, director single-brain fallback opencode-responses/muse-spark-1.3-contributor-free, segment 15). Proposal = Deformable Affordance-Energy Flow (DAEF): SE(3)-conditioned FACC successor replacing flow-matching with energy-based physical in-context attention; bridge flow->affordance via equivalence-energy; predicted 78/100. Family RETIRED G3 (manifold-switch / flow-bridge / energy-gated / FACC-SE3 / VAEF; N70-N76, eq78, N77-N83; 18 prior rejections via runs 590/589/...). No queued idea (queue empty post-N477/N478d/N563; N198 open_needs_director). No Fixture-B paired decider executed; rig not invoked (YAGNI). Existing physical evidence: results/facc_se3_fixture_b_result.json proxy B 0.1905 << 0.70; I9_reg_on/off B 0.70 vs 0.75 Fisher p=1.0; N76b SE3-DAFE B 0.1619. No 20-seed paired compare vs trochoid (champion B 1.00, p=0.0083 vs raster); no Welch/Fisher emitted => cannot satisfy G4 keep. Banned phrases absent. No adapter/retrain; scratch <0.5% covered by src/affordance_flow_expert.py; frozen champion preserved. Edge budget not touched (no learned policy execution). Gate Tier-4 hard; no teleport; no arithmetic coverage; physical=true by protocol (canonical rig defined) but no episodes run (replay refused before start). Next: director must authorise new axis (N198/N478d open_needs_director) or open new mechanism axis (force channel dosed as DISCARD in N479; remaining knobs containment/gate/path sampling).", "metrics": {"idea": "DAEF", "fixture_B_transfer_success": null, "fixture_B_transfer_success_physical_confirmed": null, "fixture_A_transfer_success": null, "fixture_R_transfer_success": null, "predicted_metric_synthetic_only": 78, "predicted_std": null, "compare_champion": "trochoid", "compare_record_keep_true_exists": false, "physical_seeds_completed": 0, "seeds_required": 20, "physical": false, "rig_invoked": false, "backend": "none (replay refused before rig; G3 retirement)", "synthetic_proxy": false, "metric_class": "fixture_B_transfer_success", "welch_p_coverage_cont": null, "fisher_p_success": null, "keep": false, "evidence_artifacts": ["autoresearch_research.ideas.md \u00a70/G3/N70-N76/eq78 retirement", "autoresearch_research.jsonl run 590 (FACC-EA discard iter 31)", "autoresearch_research.jsonl run 589 (residual-clip audit replay refused)", "results/facc_se3_fixture_b_result.json (proxy B 0.1905, synthetic_proxy= true)", "results/aegis_v2/I9_reg_on.jsonl (B 0.70 vs 0.75, Fisher p=1.00)", "results/aegis_v2/N76b_se3_dafe.jsonl (B 0.1619)", "equations.md eq78 (N76 family; no new equation)", "strategies.md FACC-SE3 / N84 / N76b"], "retired_family_check": "G3 RETIRED (N70-N76 eq78 flow-bridge energy-gated FACC-SE3 VAEF N77-N83) \u2014 do not extend, freeze, compare, cite champion N74 92.3 (synthetic)", "falsifier_applied": true, "fabrication_check": "G7-compliant: no telemetry teleport/resetBasePositionAndOrientation; no arithmetic coverage/success; no synthetic promoted to keep; no deferred/GPU/banned phrases; anchor-kill from prior runs sufficient; worklog append-only; disk >10GB"}, "timestamp": "2026-10-05T05:45:00Z", "source": "autoresearch_research.ideas.md \u00a70 + G3 + director proposal DAEF (SE(3)-conditioned FACC/energy-flow); queue empty; no queued row; run 591 = max(590)+1", "notes": "Replay refused same family as iter 31/32; proposed 'distilled 1-step policy' touches learned-policy edge budget (<=500M/>1.5GB/>25ms Jetson) but not executed; no new AEGIS knob (AEGIS_ENERGY/AEGIS_FORCE_SCALE unimplemented); freeze trochoid champion (B 1.00, Fisher p=0.0083 vs raster) and I7 gate (B 1.00 at 0.03,6)."}
{"run": 592, "idea": "FACC-E-replay-iter34", "status": "discard", "timestamp": "2026-10-05T05:40:00Z", "metrics": {"idea": "FACC-E-replay-iter34", "fixture_B": null, "fixture_A": null, "fixture_R": null, "coverage_cont": null, "compare": {"keep": false, "welch_p": null, "fisher_p": null, "reason": "G3 replay refused: FACC/SE3/EBM family permanently retired (ideas.md \u00a71); no queued idea; director steer incorporated in next iteration"}, "synthetic_proxy": null, "run_time_s": 0}, "note": "Director iter-34 FACC proposal refused per G3; queue empty; proceeding to real axis N592-WALL_KP screening (3 seeds). No remote GPU deferred (banned phrase). Canonical rig local CPU (pybullet)."}
{"run": 593, "idea": "SE3-FACC-E-iter35", "status": "discard", "timestamp": "2026-10-05T00:12:27Z", "metrics": {"idea": "SE3-FACC-E-iter35", "fixture_B": null, "fixture_A": null, "fixture_R": null, "coverage_cont": null, "compare": {"keep": false, "welch_p": null, "fisher_p": null, "reason": "G3 replay refused: SE(3)-FACC-E / force-adaptive contact / energy-attention / flow-match->affordance belongs to permanently retired eq78/N75-N76 family (ideas.md \u00a70, G3); \u00a71 table zero queued (N477/N478d/N479 done, N198 open_needs_director); no 20-seed paired Fixture-B decider performed; synthetic_proxy null; no arithmetic coverage/success estimation; physical truth unchanged (trochoid B=1.00 Fisher p=0.0083 vs raster; I12 200-seed B=1.00)"}, "synthetic_proxy": null, "run_time_s": 0}, "note": "Director iter-35 proposal SE(3)-FACC-E refused per G3 + empty queue. Canonical rig experiments/kaggle_aegis_sweep.py syntax OK (pycompile, local CPU). No stale python3 sweep (pgrep clean). No banned deferred/remote-GPU/same-dependency phrase. No teleport/resetBasePositionAndOrientation during evaluation. Worklog <=10 lines appended; strategy graph node/edge appended; equations.md unchanged; results/aegis_v2 refusal note saved; git commit G6."}
{"run": 594, "idea": "FACC-SE3-iter36", "metrics": {"idea": "FACC-SE3-iter36", "segment": 15, "status": "crash", "crash_reason": "canonical_rig_integration_missing: kaggle_aegis_sweep.py is scripted-controller-only; FACC dynamic-affordance energy head not integrated. synthetic_proxy previous run (0.1905) excluded per G2/G7.", "fixture_B_transfer_success": null, "fixture_A_transfer_success": null, "compare_champion": "trochoid", "compare_seeds": 0, "seeds_required": 20, "synthetic_proxy": {"transfer_success_fixture_B_with_gate": 0.1905, "transfer_success_fixture_B_without_gate": 0.1333, "metric_class": "synthetic_proxy", "source_file": "results/facc_se3_fixture_b_result.json", "note": "NOT used for keep; G7/G2 forbidden"}, "physical_validation_rig": "experiments/kaggle_aegis_sweep.py", "physical_smoke_done": true, "smoke_seeds": 3, "smoke_fixture": "fixture_B", "smoke_compare": "trochoid", "p_value_coverage_cont": null, "p_value_fisher_success": null, "keep_bar_met": false, "predicted_score": 78, "novelty_score": null, "edge_budget_mparams": 6, "vram_mb_approx": 950, "latency_ms_approx": 2.1, "equation_row": 84, "worklog_lines_added": 1, "commit_message_preview": "FACC-SE3-iter36: crash integration-missing 0.1905 synthetic excluded"}, "timestamp_utc": "2026-10-05T05:43:00Z", "author": "opencode-responses/muse-spark-1.3-contributor-free", "protocol_version": "AEGIS-v3-seg15", "g1_physical_rig": "experiments/kaggle_aegis_sweep.py", "g2_only_physical_counts": true, "g3_champion": "trochoid", "g4_paired_stats": "missing (crash before compare)", "g5_timeout_1200": "not invoked (crash at integration stage)", "g6_commit_done": false, "g7_integrity": "synthetic_proxy excluded; no teleport; no arithmetic coverage estimation"}
{"run": 595, "idea": "FACC-PIEA-iter37-replay-refused", "status": "invalid", "timestamp_utc": "2026-10-05T05:46:00Z", "author": "opencode-responses/muse-spark-1.3-contributor-free", "protocol_version": "AEGIS-v3-seg15", "segment": 15, "single_brain_fallback": "muse-spark-1.3-contributor-free", "idea_title": "FACC-PIEA \u2014 SE(3)-Conditiond Force-Adaptive Contact Control with Physical In-Context Energy Attention", "g1_physical_rig": "experiments/kaggle_aegis_sweep.py (NOT invoked \u2014 replay refusal)", "g2_only_physical_counts": true, "g3_retired_family": "FACC/SE3/EBM/energy-gated/flow-match->affordance (eq78/N75-N76) permanently retired; do not extend, freeze, or compare", "g4_paired_stats": "not performed (no valid candidate; no 20-seed paired Fixture-B decider)", "g5_timeout_1200": "not invoked (refusal before experiment)", "g6_commit_done": false, "g7_integrity": "no arithmetic coverage/success estimation; no teleport/resetBasePositionAndOrientation; synthetic_proxy excluded; no banned deferred/remote-GPU phrases", "compare_champion": "trochoid (B=1.00 Fisher p=0.0083 vs raster; certified at 0,0)", "queue_state": "empty per audit AUDIT_580_SEG15_QUEUE_EMPTY (run 580); previous queued N477/N478c/N479 done; N198/N478d open_needs_director (not queued)", "previous_same_family_runs": [592, 593, 594, 36], "physical_validation_rig": false, "seeds_run": 0, "seeds_required": 20, "fixture_B_transfer_success": null, "fixture_A_transfer_success": null, "fixture_R_transfer_success": null, "metrics": {"idea": "FACC-PIEA-iter37-replay-refused", "coverage_cont": null, "fixture_B_transfer_success": null, "compare": {"keep": false, "welch_p": null, "fisher_p": null, "reason": "Replay of permanently retired FACC/SE3/EBM family (G3); queue empty (audit 580); no integrated rig candidate; no paired 20-seed Fixture-B decider; synthetic_proxy excluded per G2/G7; no arithmetic coverage estimation; physical truth unchanged (trochoid champion B=1.00)."}, "synthetic_proxy": null, "run_time_s": 0, "predicted_score": 82, "predicted_score_note": "Director proposal only; no validation; prediction not kept", "novelty_score": null, "edge_budget_mparams": null, "vram_mb_approx": null, "latency_ms_approx": null}, "equation_row_changed": false, "worklog_lines_added": 1, "note": "Director iter-37 (single-brain fallback muse-spark-1.3-contributor-free) proposed FACC-PIEA (SE(3)-conditioned EBM, deformable energy manifold). REFUSED per G3 (retired eq78/N75-N76 family, 18 prior rejections 592-594+36), G7 (no evidence artifacts, no paired compare, no keep claim permitted), and segment freeze (segment 15, primary metric transfer_success, statuses {keep,discard,crash,unvalidated,invalid} only). Queue empty; only open axes are N198/N478d (director-owned, NOT queued). Canonical rig experiments/kaggle_aegis_sweep.py NOT invoked. No remote-GPU/deferred/same-dependency banned phrase. No telemetry to benchmark proxy. Commit G6 to follow immediately after state save."}
{"run": 596, "idea": "N478d_wall_001", "status": "discard", "timestamp_utc": "2026-10-05T00:20:00Z", "author": "opencode-responses/muse-spark-1.3-contributor-free", "protocol_version": "AEGIS-v3-seg15", "segment": 15, "single_brain_fallback": "muse-spark-1.3-contributor-free", "idea_title": "Aegis wall-only containment dose (unmeasured axis N478d) at 0,0 \u2014 paired vs trochoid champion", "director_decision_refused": "FACC-SE3 / energy-EBM replay (G3 retired family, 18 prior rejections 592-594+36); queue empty; only director-owned N198/N478d open", "g1_physical_rig": "experiments/kaggle_aegis_sweep.py", "g2_only_physical_counts": true, "g3_champion": "trochoid (B=1.00 Fisher p=0.0083 vs raster; certified)", "g4_paired_stats": true, "g5_timeout_1200": true, "g6_commit_done": false, "g7_integrity": true, "compare_champion": "trochoid", "compare_seeds": 20, "fixture_A_transfer_success": 1.0, "fixture_B_transfer_success": 1.0, "fixture_R_transfer_success": 1.0, "metrics": {"idea": "N478d_wall_001", "segment": 15, "status": "discard", "fixture_A_transfer_success": 1.0, "fixture_B_transfer_success": 1.0, "fixture_R_transfer_success": 1.0, "compare_env": "AEGIS_WALL_ONLY=1", "compare_champion": "trochoid", "compare_seeds": 20, "pose_noise_cfg": "0,0", "coverage_cont_fixed_default": 1.0, "mean_coverage_cont_candidate": 1.0, "mean_coverage_cont_baseline": 1.0, "delta_coverage_cont": 0.0, "welch_p_coverage_cont": null, "fisher_p_success": 1.0, "keep_bar_met": false, "keep_reason": "Identity at 0,0 (both arms 1.00); no regression but no improvement; failing cells (>=0.03,6 / >=0.16,32) unmeasured \u2014 axis not resolved", "synthetic_proxy": null, "physical_validation_rig": true, "physical_smoke_done": true, "smoke_seeds": 20, "smoke_fixture": "fixture_B", "smoke_compare": "trochoid[AEGIS_WALL_ONLY=1]", "rig_result_file": "results/aegis_v2/N478d_wall_001.jsonl", "rig_result_bytes": 270935, "run_time_s": 9.6, "predicted_score": null, "novelty_score": null, "equation_row_changed": false, "worklog_lines_added": 1, "commit_message_preview": "N478d_wall_001: discard identity 1.00/1.00 wall-only @0,0; replay refused; N198/N478d open"}}
{"run": 597, "idea": "FACC-ITER39", "status": "discard", "metrics": {"idea": "FACC-ITER39", "fixture_B": null, "transfer_success": null, "metric_class": "retired_family_replay", "compare": "trochoid", "run": 597, "status_note": "G3 eq78/flow-bridge/energy-gated retired; replay refused; prior physical validated-candidate 0.1905 (iter17) << 0.70; synthetic_proxy 0.25 invalid for keep; no new 20-seed paired physical run", "p_value_fisher": null, "p_value_welch": null, "seeds": null, "champion": "trochoid (B=1.00, Fisher p=0.0083 vs raster)", "edge_budget_ok": true, "gate_preserved": true, "segment": "15 (frozen)"}, "compare": {"champion": "trochoid", "keep": false, "note": "no paired run; replay only"}, "note": "Director iter 39 single-brain fallback (muse-spark-1.3-contributor-free) proposes FACC with affordance-equivalence flow + force residual (flow-bridge cross edge). Matches retired eq78/N75-N76 family (G3). Prior FACC-SE3 physical 20/20 = 0.1905 validated-candidate-predicted NOT keep; synthetic_proxy result = 0.25 (not physical). No new canonical-rig invocation; replay refusal per G3/G7. No deferred/remote-GPU/deferred phrases."}
{"run": 598, "idea": "N598", "status": "discard", "metrics": {"idea": "N598", "fixture_B": 1.0, "fixture_A": 1.0, "fixture_R": 1.0, "transfer_success": 1.0, "coverage_cont": 1.0, "seeds": 20, "compare": "trochoid", "metric_class": "physical_exploration", "p_value_fisher": null, "p_value_welch": null, "under_compare_champion": "trochoid (B=1.00)", "status_note": "unmeasured mechanism cell AEGIS_WALL_ONLY=1 (20 seeds, all 1.00); no paired compare arm -> no p-value; not a keep per G4. Director FACC-E replay (iter 40 / muse-spark fallback) REFUSED per G3 (energy/SE3/EBM/FACC family permanently retired, 18 previous rejects). Queue empty; ran cheapest unmeasured knob instead."}, "compare": {"champion": "trochoid", "keep": false, "note": "no paired arm; exploratory only"}, "note": "Segment 15 frozen. G3 replay refusal: FACC-E / force-adaptive contact control / energy-based affordance flow is retired family (manifold-switch / flow-bridge / energy-gated). Physical rig = experiments/kaggle_aegis_sweep.py (PyBullet DIRECT, 20 seeds, 3 suites, ~5s). No synthetic_proxy used. Cleanup: anchored kill performed; no stale sweep. No GPU deferred phrase used.", "segment": "15 (frozen)", "edge_budget_ok": true, "gate_preserved": true}
{"run": 599, "ts": "2026-10-05T05:55:00Z", "idea": "N599", "status": "discard", "status_reason": "replay_refused: DAEA=FACC-successor=eq78/G3-retired (manifold-switch/flow-bridge/energy-gated/deformable-affordance). Queue empty; no queued idea. Physical audit 20 seeds paired trochoid vs trochoid[AEGIS_WALL_ONLY=1] fixture_B B=1.00 both, delta=0, fisher_p=1.0, welch_p=NaN; keep=false (no improvement, no new mechanism). No synthetic_proxy keep.", "metrics": {"idea": "N599", "fixture_B_transfer_success": 1.0, "fixture_B_coverage_cont_mean": 1.0, "fixture_B_n": 20, "compare_champion": "trochoid", "compare_arm": "trochoid[AEGIS_WALL_ONLY=1]", "keep": false, "fisher_p": 1.0, "welch_p": null, "harness_errors": 0, "seed_count": 20, "backend": "pybullet", "physical_truth": "kaggle_aegis_sweep.py DIRECT local CPU", "synthetic_proxy": null, "segment": 15, "metric": "transfer_success", "segment_closed": true, "g3_retired_family": "eq78/DAEA/FACC/SE3-energy/manifold-switch/flow-bridge", "director_proposal": "DAEA (iter 41) \u2014 deferred replay", "evidence_file": "results/aegis_v2/N599_iter41_daef_refuse.jsonl"}, "compare": {"candidate": "trochoid", "baseline": "trochoid[AEGIS_WALL_ONLY=1]", "fixture_B": {"n_a": 20, "n_b": 20, "mean_a": 1.0, "mean_b": 1.0, "delta": 0.0, "succ_a": 20, "succ_b": 20, "fisher_p": 1.0, "welch_p": null}, "keep": false, "metric": "coverage_cont"}, "notes": "Iter 41 director proposal DAEF (deformable-affordance energy attention, SE3-conditioned EBM + flow-match->affordance-equivalence) is replay of G3-retired eq78/N75-N83 family. No queued idea (\u00a71 empty). Executed cheapest audit arm AEGIS_WALL_ONLY=1 paired 20 seeds to preserve physical-loop continuity. No arithmetic coverage, no teleport, no synthetic keep, no deferred/GPU phrase, anchored kill clean, disk>10GB. Champion trochoid B=1.00 Fisher 0.0083 vs raster preserved."}
{"run": 600, "ts": "2026-10-05T05:57:00Z", "idea": "N600", "status": "invalid", "status_reason": "G3 replay refused (second, iter 42): FACC/SE3-equiv/energy/affordance-flow family permanently retired (N70-N76/eq78/manifold-switch/flow-bridge). Queue empty per ideas.md \u00a71; lowest queued = none. Director proposal = muse-spark-1.3-contributor-free / FACC. No implementable delta: evidence is identity-baseline trochoid (B=1.00, 60/60 SUCCESS, coverage_cont=1.000, harness_errors=0) with no policy change. Previous refusal N599 (run 599, same family) already logged discard + physical audit. No synthetic_proxy keep; claim invalid per G7.", "metrics": {"idea": "N600", "fixture_B_transfer_success": 1.0, "fixture_B_coverage_cont_mean": 1.0, "fixture_B_n": 20, "fixture_A_n": 20, "fixture_R_n": 20, "compare_champion": "trochoid", "compare_arm": "trochoid[proposal=FACC-iter42; family retired; no delta]", "keep": false, "fisher_p": 1.0, "welch_p": 1.0, "harness_errors": 0, "seed_count": 20, "backend": "pybullet", "physical_truth": "experiments/kaggle_aegis_sweep.py DIRECT local CPU (sys python3, 20 seeds)", "synthetic_proxy": null, "segment": 15, "metric": "transfer_success", "segment_closed": true, "g3_retired_family": "FACC/SE3-equiv/energy-gated/affordance-flow/manifold-switch/flow-bridge/eq78/DAEA", "director_proposal": "muse-spark-1.3-contributor-free (iter 42, single-brain fallback) \u2014 FACC / force-adaptive contact controller / SE(3)-equivariant flow / energy-based in-context attention / affine affordance manifold", "replay_of": "N599 (run 599, same family, discard + audit trochoid vs wall_only)", "evidence_file": "results/aegis_v2/N600_iter42_facc_replay_invalid.jsonl", "novelty_score_banned_from_keep": true, "status_gate": "G3-retired; queue-empty; second-refusal; invalid"}, "compare": {"candidate": "trochoid", "champion": "trochoid", "fixture_B_transfer_success_candidate": 1.0, "fixture_B_transfer_success_champion": 1.0, "delta_success": 0.0, "delta_coverage_cont": 0.0, "keep": false, "fisher_p": 1.0, "welch_p": 1.0, "paired_seeds": 20, "note": "identity comparison; proposal unimplemented (retired family); no delta; keep false per G3+G4"}}
{"run": 601, "idea": "N477/FACC-replay-refused", "status": "discard", "metrics": {"idea": "N477/FACC-replay-refused", "fixture_B_transfer_success": 1.0, "fixture_B_coverage_cont": 1.0, "seeds": 20, "backend": "pybullet", "compare": "trochoid_vs_raster", "compare_keep": true, "p_fisher": 0.0083, "verification_file": "results/aegis_v2/verify_champion_trochoid_r476.jsonl", "note": "Queue empty per ideas.md \u00a70 (N477 done runs 478-481 DISCARD). FACC/SE3/EBM/energy family permanently retired G3 (18 replays rejected). Dir iter 43 FACC proposal refused as replay. Ran canonical champion verification instead (physical paired, 20 seeds, B 1.00, p=0.0083 vs raster). No synthetic_proxy used; no remote-GPU deferred phrase.", "novelty_score": null}, "timestamp": "2026-10-05T05:58:00Z", "segment": 16, "physical": true}
{"run": 602, "ts": "2026-10-05T00:31:24.829750Z", "idea": "FACC-iter44-602", "status": "discard", "status_reason": "Queue empty after N477 (run 601); FACC (director iter-44 / muse-spark-1.3-contributor-free) is open_needs_director / replay-refused, not queued, not executable under AEGIS fixture-B rig (insertion/wiping SE(3)+stiffness vs control paths). AEGIS seg-15 freeze + G3 retired families (force/energy/gated) + G7 integrity: no fabricated B/A/R for FACC. Rig sanity alive: /tmp/rig_sanity_602.jsonl 3 seeds / 2.0 s.", "metrics": {"idea": "FACC-iter44-602", "fixture_B_transfer_success": null, "fixture_B_coverage_cont_mean": null, "fixture_B_n": 0, "fixture_A_n": 0, "fixture_R_n": 0, "compare_champion": "trochoid", "compare_arm": "NONE (queue empty)", "keep": false, "fisher_p": null, "welch_p": null, "harness_errors": 0, "seed_count": 3, "backend": "pybullet-local-cpu", "physical_truth": true, "synthetic_proxy": false, "segment": 15, "metric": "fixture_B_transfer_success", "segment_closed": true, "g3_retired_family": "force-adaptive / manifold-switch / energy-gated (N70-N76, eq78)", "director_proposal": "FACC / muse-spark-1.3-contributor-free (iter-44)", "replay_of": "N477 / FACC-replay-refused (run 601)", "evidence_file": "/tmp/rig_sanity_602.jsonl", "novelty_score_banned_from_keep": true, "status_gate": "hard(>=20 seeds + B>0.70 + p<0.01 vs paired champion) \u2014 not met; no candidate"}, "compare": {"keep": false, "reason": "No queued candidate; FACC replay refused; rig sanity only (3 seeds, not 20)."}}
