{"id":"ITER104-FACC-SE3-DIRECTOR-795","run":795,"idea_tag":"FACC-SE3 iter-66 (director iter 66, single-brain fallback: muse-spark-1.3-contributor-free): SE(3)-Conditioned Force-Adaptive Contact Control (FACC-SE3) — dynamic affordance manifold E(x,SE3,wrench) + energy-based physical in-context attention + flow-matching->affordance-equivalence bridge; predicted 81/100","status":"invalid","kind":"node","type":"director_decision_refused_replay_104","queue_empty_confirmed":true,"predicted_score":81,"physical_run":false,"compare_keep":false,"segment":15,"protocol_version":"v3","note":"104th replay refusal of G3-retired family (N70-N76/eq78/manifold-switch/flow-bridge/energy-gated/EBM/FACC-SE3/E-FACC/EB/DAFE/PAITC/VAEF/N84/N76b/SEAF-FACC; frozen 2026-09-28; champion N74 92.3 synthetic frozen; only validated champion = trochoid fixture_B=1.00 Fisher p=0.0083 20 seeds paired). Mechanism untestable in canonical rig (rigid flat-top friction U[0.05,0.80] only; NO stiffness/deformable/slip/contact-shift/SE3-perturbation/energy-attention/contact-energy/dynamic-field/stiffness-modulation/contact-wrench suite). Queue empty since run 497; N198/N478d/N478e open_needs_director NOT queued. Director steer (iter 66, muse-spark-1.3-contributor-free, predicted 81/100 synthetic unvalidated) documented. No synthetic/proxy claim (restroom_sim banned G2/G7). No arithmetic coverage/success estimation (G7). No teleport. Gate untouched (hard). Equations unchanged (eq78 frozen; row 84 preserved). Refusal prevents fabricated claim."}
{"id":"edge_793_795","from":"ITER103-FACC-SE3-DIRECTOR-793","to":"ITER104-FACC-SE3-DIRECTOR-795","kind":"edge","type":"refusal_then_refusal","run_from":793,"run_to":795,"note":"104th G3 replay refusal (run 795, iter 66 director single-brain fallback muse-spark-1.3-contributor-free); FACC-SE3 / SE(3)-Conditioned / dynamic affordance manifold E(x,SE3,wrench) / energy-based physical in-context attention / flow-matching->affordance-equivalence bridge / force-adaptive stiffness / contact-shift suite replay refused; mechanism untestable; director steer (predicted 81/100 synthetic unvalidated) documented; no synthetic/proxy claim; no arithmetic coverage/success; no teleport; gate untouched (hard); equations unchanged (eq78 frozen); champion frozen; worklog/appended; evidence saved; commit follows."}
{"id": "ITER105-FACC-E-DIRECTOR-796", "run": 796, "idea_tag": "FACC-E iter-67 (director decision muse-spark-1.3-contributor-free): Force-Adaptive Contact Control (FACC-E) \u2014 replace pi0 flow-matching head with EBM contact-energy; dynamic affordance manifold; SE(3)-conditioned; force-adaptive contact control; variable-stiffness + SE(3) perturb + novel geometry; metric success-rate under force-noise + cross-embodiment transfer; predicted 78/100", "status": "invalid", "kind": "node", "type": "director_decision_refused_replay_105", "segment": 15, "protocol_version": "v3", "queue_empty_confirmed": true, "predicted_score": 78, "physical_run": false, "compare_keep": false, "note": "105th replay refusal of G3-retired family (N70-N76/eq78/manifold-switch/flow-bridge/energy-gated/EBM/FACC-SE3/FACC-E; frozen 2026-09-28; champion N74 92.3 synthetic frozen; only validated champion = trochoid B=1.00 Fisher p=0.0083). Mechanism untestable in canonical rig (rigid flat-top friction U[0.05,0.80] only; NO variable-stiffness/deformable/slip/contact-shift/SE3-perturbation/energy-attention/contact-energy/dynamic-affordance-field/stiffness-modulation suite). Queue empty since run 497. Director-own open nodes N198/N478d/N478e NOT queued. No synthetic/proxy claim (restroom_sim banned G2/G7). No arithmetic coverage/success (G7). No teleport. Gate untouched (hard). Equations unchanged (eq78 frozen; row 84 preserved; no new row). Refusal prevents fabricated claim; next must be director-authorised non-G3 axis (N198/N478d/N478e) or segment-15 close."}
{"id": "edge_795_796", "from": "ITER104-FACC-SE3-DIRECTOR-795", "to": "ITER105-FACC-E-DIRECTOR-796", "kind": "edge", "type": "refusal_then_refusal", "run_from": 795, "run_to": 796, "note": "105th G3 replay refusal (run 796, iter 67 muse-spark-1.3-contributor-free); FACC-E / EBM contact-energy / dynamic affordance manifold / SE(3)-conditioned / force-adaptive / variable-stiffness + SE(3) perturb + novel geometry / force-noise / cross-embodiment replay refused; mechanism untestable; director steer (predicted 78/100 synthetic unvalidated) documented; no synthetic/proxy claim; no arithmetic coverage/success; no teleport; gate untouched (hard); equations unchanged (eq78 frozen; row 84 preserved); champion trochoid frozen B=1.00 Fisher p=0.0083; worklog appended; evidence file saved; commit follows; no further G3 replay proposals permitted."}
{"id": "N565-P1-archive-797", "run": 797, "idea_tag": "N565-P1 archive control (base 111000 at 4.00,800) + director FACC refusal (106th G3 replay)", "status": "keep", "kind": "node", "type": "law_test_certificate_keep", "predicted": "P1 sufficiency: in-window archive base holds fixture_B 20/20", "physical_run": true, "compare_keep": true, "segment": 15, "protocol_version": "v3", "pose_noise_cfg": "4.00,800", "fixture_B_transfer_success": 1.0, "coverage_cont": 0.9898, "note": "P1 SUFFICIENCY HOLDS at the archive seed base: candidate fixture_B 20/20 (coverage_cont 0.9898) vs paired single-cast default 0/20, Welch p 1.906e-33, Fisher p 1.451e-11, rig compare.keep=true; fixture_A 0.20, fixture_R 0.55; 120 episodes, 0 harness errors. k=53, reg_casts 2809 exact, W=12.0798 m, W/sigma_t=3.01996, realized max z_inf=2.1179 (margin +29.87%), reg_ok 20/20, 0 escapes, reg_err_xy p50 8.11 / p90 16.55 mm. Fresh run reproduces the previously unlogged archive control results/aegis_v2/N565_b111000_400.jsonl bit-identically (identical p-values). Closes the last open N565 pre-registration; N565 P1-P5 all answered. Director FACC (SE(3)-conditioned deformable affordance + EBM energy attention) refused as the 106th G3 replay: retired family, unexecutable in the rigid flat-top rig, predicted-only 78/100."}
{"id": "edge_796_797", "from": "ITER105-FACC-E-DIRECTOR-796", "to": "N565-P1-archive-797", "kind": "edge", "type": "refusal_then_physical_keep", "run_from": 796, "run_to": 797, "note": "106th G3 replay refusal (director iter 68 FACC / force-adaptive contact control with SE(3) deformable affordance field) followed by physical execution of the only open pre-registered cell in the backlog: N565 P1 archive control, fresh paired 20x3x2 canonical-rig run, rig keep=true."}
