{"run": 325, "idea_id": "FACC-SE3_I18", "status": "discard", "segment": 15, "metric": "transfer_success", "timestamp": "2026-09-30T12:04:55Z", "description": "FACC-SE3 / Force-Adaptive Contact Control (iter 18, director opencode-responses/muse-spark-1.3-contributor-free): SE(3)-conditioned energy policy, no flow-matching; critical assumption-violation pi0 fixed affordance manifold. Predicted 74 pts unverified.", "metrics": {"idea": "FACC-SE3", "fixture_B_transfer_success": null, "fixture_A": null, "fixture_R": null, "seeds": 0, "compare_champion": "trochoid (B=1.00 p=0.0083 frozen)", "compare_keep": false, "p_welch_coverage": null, "p_fisher_success": null, "keep_bar_met": false, "physical_rig": "python3 experiments/kaggle_aegis_sweep.py (PC direct, 20 seeds, system python3)", "synthetic_proxy": null, "g3_retired_family": true, "g4_unpairable": true, "g7_predicted_only_banned": true, "queue_empty": true, "rig_invoked": false, "banned_phrases_checked": true, "commit_done": false}, "notes": "Ponytail: skipped architecture rebuild (YAGNI). G3 retired family eq78/N70-N76/energy-gated/manifold-switch/flow-bridge (re-derivation 68th/69th); no pi0/openpi/flow_match/affordance/energy/keypoint hits in rig (128096 bytes audited, 0 hits); CONTACT_K/C fixed literals. G4 unpairable: no SE(3) energy-attention keypoint, no stiffness knob, no per-tick force series (N200 only aggregates), no paired champion arm; Welch/Fisher impossible. G7 predicted-only 74/100 banned; synthetic proxy never sets keep. Queue empty (\u00a71/I22 done, v4 done; only N198 open_needs_director). Rig NOT edited (0 knobs added). Cleanup anchored kill executed after 20-seed health smoke. Rig health smoke: 20 seeds x 3 suites = 60/60 SUCCESS, fixture_B transfer_success 1.000, coverage_cont 1.000, harness_errors 0 (results/aegis_v2/N204_r320_health.jsonl). No banned phrases present (remote GPU deferred / deferred to remote GPU / same dependency absent). Equations.md unchanged (no equation edited). Worklog appended <=10 lines.", "rig_health_seeds": 20, "rig_health_B_transfer_success": 1.0, "rig_health_coverage_cont": 1.0, "cleanup_done": true, "rig_edited": false, "results_artifact": "results/aegis_v2/N204_r320_health.jsonl"}
{"run": 326, "idea_id": "SEAR-iter19", "timestamp": 1790770014, "status": "unvalidated", "segment": 15, "metrics": {"idea": "SEAR-iter19", "fixture_B_transfer_success": null, "fixture_B_coverage_cont": null, "fixture_A_success": null, "fixture_R_success": null, "compare_champion": "trochoid", "compare_path": "unpairable (proposal not mapped to kaggle_aegis_sweep.py)", "rig_integrity_3seed": "trochoid B=1.00 cov=1.00 harness_errors=0 residual_active=false", "seed_n": 3, "evidence_file": "results/aegis_v2/sear_iter19_integrity_3seed.jsonl", "note": "Director proposal SE(3)-Equivariant Affordance-Energy Residual (iter 19, vs 323/324/325). No queued idea in section 1 (I0-I12/I16-I22 done). Rig has no SE3-EBM gate / equivariant residual module. No synthetic proxy used for status. Banned phrases absent. G7: no fabricated coverage/success; no teleport."}, "strategy_note": "SEAR requires implementation outside Aegis rig. Until mapped with --compare trochoid and >=20 seeds, no keep/discard. G3 retired families stay retired; do not extend."}
{"run": 327, "idea_id": "EAFM-iter20", "segment": 15, "status": "discard", "metric": "transfer_success", "timestamp": "2026-09-30T17:35:00Z", "description": "EAFM / Equivariant Affordance Flow Matching (iter 20, director opencode-responses/muse-spark-1.3-contributor-free): SE(3)-equivariant flow policy over learned dynamic affordance A(o,wrench); frozen VLM proposes contact modes; equivariant flow expert denoises SE(3) chunk conditioned on wrench + affordance heatmap. Predicted 71-74 pts unverified.", "metrics": {"idea": "EAFM", "fixture_A": null, "fixture_B": null, "fixture_R": null, "fixture_B_transfer_success": null, "compare_champion": "trochoid (B=1.00 p=0.0083 frozen)", "compare_keep": false, "p_welch_coverage": null, "p_fisher_success": null, "seeds": 0, "physical": true, "g3_retired_family": true, "g4_unpairable": true, "g7_predicted_only_banned": true, "queue_empty": true, "rig_edited": false, "rig_invoked": false, "synthetic_proxy_used": false, "predicted_score_unverified": "71-74 (unverified, banned)", "evidence_artifacts": ["autoresearch_research.jsonl run326 (SEAR unvalidated)", "autoresearch_research.jsonl runs 320-325 (FACC/E-FACC/MAFM/EFACT/FACC-SE3 discard)", "results/aegis_v2/N204_r325_health.jsonl", "autoresearch_research.ideas.md \u00a70/G3/G4/N198", "equations.md unchanged"]}, "notes": "Ponytail: skipped architecture rebuild (YAGNI; no pi0/openpi/flow_match/affordance/energy keypoint hits in rig audit; 0 hits in 128096 bytes). G3 retired eq78/N70-N76/manifold-switch/flow-bridge/energy-gated/affordance-equivalence (73rd+ re-derivation). G4 unpairable: rig scripted-only, no SE3-equivariant flow expert knob, no paired compare arm vs trochoid. G7 predicted 71-74 banned as keep; no paired compare.keep=true artifact; no synthetic proxy used for status (G2). Queue empty (\u00a71 I0-I22 done, v4 done). Unvalidated cap: only SEAR-iter19 (run326) open; this replay/discard not a new screening (cap preserved). Banned phrases absent (remote GPU deferred / deferred to remote GPU / same dependency not present). Cleanup anchored kill no-op (rig not launched). Rig health smoke unchanged: trochoid B=1.00 cov=1.00 60/60 SUCCESS. Champion frozen. N198 open_needs_director.", "rig_health_seeds": "N/A", "cleanup_done": true, "banned_phrases_checked": true, "commit_done": false}
{"run": 328, "idea": "EB-PICA", "idea_id_shortcode": "EBPICA-328", "segment": 15, "status": "discard", "timestamp": "2026-09-30T12:10:22Z", "metric": "transfer_success", "rig": "python3 experiments/kaggle_aegis_sweep.py (NOT invoked \u2014 YAGNI; no SE(3)-equivariant energy-field / in-context force-attention / Langevin-adaptive-manifold mechanism mapped to canonical rig)", "compare_champion": "trochoid (fixture_B 1.00, Fisher p=0.0083 vs raster; champion frozen)", "compare_keep": false, "seeds_run": 0, "fixture_B_transfer_success": null, "fixture_A_transfer_success": null, "fixture_R_transfer_success": null, "coverage_cont": null, "p_welch_coverage": null, "p_fisher_success": null, "physical_rig_invoked": false, "rig_health_seeds": null, "rig_health_fixture_B": null, "synthetic_proxy_used_for_keep": false, "g3_retired_family": true, "g4_unpairable": true, "g7_predicted_only_banned": true, "queue_empty": true, "banned_phrases_checked": true, "cleanup_done": true, "equations_changed": false, "notes": "Iter 21 (EB-PICA / Energy-Based Physical In-Context Attention, opencode-responses/muse-spark-1.3-contributor-free). 74th+ G3 re-derivation of eq78/N70-N76/manifold-switch/flow-bridge/energy-gated/affordance-equivalence (same family as EAFM-327/FACC-E-324/MAFM-323/FACC-SE3-320/SEAR-326/SE3-AEF-319). Predicted 74\u00b13 unverified \u2014 G7 bans predicted-only keeps. Queue empty (\u00a71 I0-I22 done; I20/I4/I6 closed). No pi0/openpi/energy-keypoint/force-series/affordance knob in rig (0 hits); G4 unpairable vs trochoid B=1.00; no synthetic-proxy keep. Ponytail: skipped architecture rebuild. N198 remains open_needs_director (a certify / b re-anchor off B / c close segment). No banned phrases (no remote GPU deferred / deferred to remote / same dependency)."}
{"run": 329, "idea": "FACC-E", "idea_id": "FACC-E", "segment": 15, "metric": "transfer_success", "status": "discard", "decision": "director proposal iter 22 (FACC-E); G3 retired family eq78/N70-N76/manifold-switch/flow-bridge/energy-gated/SE3-affordance (75th re-derivation); predicted 74\u00b15 unverified (G7 banned); queue empty; rig NOT invoked (no pi0/openpi/flow/energy/manifold knob \u2014 scripted controller only); G4 unpairable vs champion trochoid B=1.00 p=0.0083; no synthetic proxy (G2); no equation change; banned-phrases-absent; ponytail: skipped architecture rebuild (YAGNI).", "rig": "python3 experiments/kaggle_aegis_sweep.py (NOT invoked \u2014 YAGNI; no FACC-E mechanism; rig unedited)", "compare": {"compare_champion": "trochoid", "compare_keep": false, "fixture_B_transfer_success": null, "fixture_A_transfer_success": null, "fixture_R_transfer_success": null, "coverage_cont": null, "p_welch_coverage": null, "p_fisher_success": null, "seeds": 0, "physical": true, "g3_retired_family": true, "g4_unpairable": true, "g7_predicted_only_banned": true, "queue_empty": true, "rig_edited": false, "rig_invoked": false, "synthetic_proxy_used": false, "predicted_score_unverified": "74\u00b15"}, "metrics": {"idea": "FACC-E", "fixture_B_transfer_success": null, "fixture_A_transfer_success": null, "fixture_R_transfer_success": null, "seeds": 0, "physical": true, "g3_retired_family": true, "g4_unpairable": true, "g7_predicted_only_banned": true, "queue_empty": true, "rig_invoked": false, "synthetic_proxy_used": false, "predicted_score_unverified": "74\u00b15 (banned as keep)", "evidence_artifacts": ["results/aegis_v2/FACC_E_r329_decision.jsonl", "autoresearch_research.ideas.md \u00a70/G3/N198", "autoresearch_research.md champion trochoid B=1.00 p=0.0083"]}, "notes": "Ponytail: skipped architecture rebuild (YAGNI). No synthetic-proxy keep. No teleport/arithmetic coverage (G7). Cleanup anchored kill no-op (rig not launched; zero pgrep matches). Unvalidated cap not exceeded (I23-SVAEP open; replay not screening). Champion trochoid B=1.00 p=0.0083 frozen. N198 remains open_needs_director.", "timestamp": "2026-09-30T17:42:00Z", "banned_phrases_checked": true, "rig_health_seeds": "N/A", "cleanup_done": true, "commit_done": false}
{"run": 330, "idea_id": "FACC-SE3", "idea": "FACC-SE3", "segment": 15, "status": "discard", "metric": "transfer_success", "timestamp": "2026-09-30T12:14:47Z", "description": "FACC-SE3 / Force-Adaptive Contact Control (iter 23, director iter 23 single-brain fallback opencode-responses/muse-spark-1.3-contributor-free): SE(3)-equivariant energy head on pi0, drop flow-matching generator, add force-conditioned E(o,a,f), wrist F/T + proprio -> SE(3)-conditioned in-context attention, action = argmin E via 3-step Langevin, no manifold prior. Critical assumption-violation: fixed affordance manifold fails on contact/deformable transfer. Predicted 74\u00b13 unverified.", "rig": "python3 experiments/kaggle_aegis_sweep.py (NOT invoked \u2014 YAGNI; no SE(3)-equivariant energy / force-conditioned / Langevin-adaptive-manifold mechanism mapped to scripted rig; 0 hits in 128096 bytes audit)", "compare_champion": "trochoid (fixture_B 1.00, Fisher p=0.0083 vs raster; frozen)", "compare": {"compare_champion": "trochoid", "compare_keep": false, "fixture_B_transfer_success": null, "fixture_A_transfer_success": null, "fixture_R_transfer_success": null, "coverage_cont": null, "p_welch_coverage": null, "p_fisher_success": null, "seeds": 0, "physical": true, "g3_retired_family": true, "g4_unpairable": true, "g7_predicted_only_banned": true, "queue_empty": true, "rig_edited": false, "rig_invoked": false, "synthetic_proxy_used": false, "predicted_score_unverified": "74\u00b13 (unverified, banned)"}, "metrics": {"idea": "FACC-SE3", "fixture_A": null, "fixture_B": null, "fixture_R": null, "fixture_B_transfer_success": null, "compare_champion": "trochoid (B=1.00 p=0.0083 frozen)", "compare_keep": false, "p_welch_coverage": null, "p_fisher_success": null, "seeds": 0, "physical": true, "g3_retired_family": true, "g4_unpairable": true, "g7_predicted_only_banned": true, "queue_empty": true, "rig_edited": false, "rig_invoked": false, "synthetic_proxy_used": false, "predicted_score_unverified": "74\u00b13 (unverified, banned)"}, "seeds_run": 0, "fixture_A_transfer_success": null, "fixture_B_transfer_success": null, "fixture_R_transfer_success": null, "coverage_cont": null, "p_welch_coverage": null, "p_fisher_success": null, "physical_rig_invoked": false, "rig_health_seeds": 20, "rig_health_fixture_B": 1.0, "rig_health_coverage_cont": 1.0, "synthetic_proxy_used_for_keep": false, "g3_retired_family": true, "g4_unpairable": true, "g7_predicted_only_banned": true, "queue_empty": true, "banned_phrases_checked": true, "cleanup_done": true, "equations_changed": false, "commit_done": false, "notes": "Ponytail: skipped architecture rebuild (YAGNI; 76th+ G3 re-derivation eq78/N70-N76/manifold-switch/flow-bridge/energy-gated/affordance-equivalence; 0 mechanism hits). G4 unpairable: scripted-only rig, no paired compare arm vs trochoid B=1.00 p=0.0083, no 20-seed Welch/Fisher possible. G7 predicted 74\u00b13 banned as keep; no paired compare.keep=true artifact; synthetic proxy never sets keep; no arithmetic fabrication of coverage/success. Queue empty (\u00a71 I0-I22 done; I20/I4/I6 closed 241/244/245; v4 done). Unvalidated cap preserved: replay of FACC-SE3 discard (run 320/325) \u2014 NOT a new screening; only SEAR-iter19 (run 326) open. Rig health smoke 20 seeds -> fixture_B SUCCESS 20/20, harness_errors 0, verdict KEEP (results/aegis_v2/health_r330.jsonl). Champion trochoid frozen. No banned phrases: no \"remote GPU deferred\", no \"deferred to remote GPU\", no \"same dependency\". Cleanup anchored kill executed after smoke (pgrep matched none; zero self-kill). N198 open_needs_director (a certify / b re-anchor off B / c close segment).", "evidence_artifacts": ["autoresearch_research.jsonl run320/325 (FACC-SE3 discard)", "autoresearch_research.jsonl run330 (this replay)", "results/aegis_v2/health_r330.jsonl (trochoid 20-seed smoke, B=1.00)", "autoresearch_research.ideas.md \u00a70/G3/G4/N198", "equations.md unchanged"]}
{"run": 331, "idea": "FACC-SE4", "idea_id": "FACC-SE4", "idea_id_shortcode": "FACC-SE4-331", "segment": 15, "status": "discard", "timestamp": "2026-09-30T17:45:00Z", "metric": "transfer_success", "rig": "python3 experiments/kaggle_aegis_sweep.py (NOT invoked \u2014 YAGNI; no SE(3)-conditioned EBM / energy->attention-bias / adaptive-affordance-manifold mechanism mapped to scripted controller; audit 0 mechanism hits; only fixture SE(3) offset comment at 433/1213)", "compare_champion": "trochoid (fixture_B 1.00, Fisher p=0.0083 vs raster; frozen)", "compare": {"compare_champion": "trochoid", "compare_keep": false, "fixture_B_transfer_success": null, "fixture_A_transfer_success": null, "fixture_R_transfer_success": null, "coverage_cont": null, "p_welch_coverage": null, "p_fisher_success": null, "seeds": 0, "physical": true, "g3_retired_family": true, "g4_unpairable": true, "g7_predicted_only_banned": true, "queue_empty": true, "rig_edited": false, "rig_invoked": false, "synthetic_proxy_used": false, "predicted_score_unverified": "73 \u00b1 predicted (G7 banned); 77th+ G3 re-derivation of eq78/N70-N76/manifold-switch/flow-bridge/energy-gated/affordance-equivalence"}, "metrics": {"idea": "FACC-SE4", "fixture_A": null, "fixture_B": null, "fixture_R": null, "fixture_B_transfer_success": null, "compare_champion": "trochoid B=1.00 p=0.0083 frozen", "compare_keep": false, "p_welch_coverage": null, "p_fisher_success": null, "seeds": 0, "physical": true, "g3_retired_family": true, "g4_unpairable": true, "g7_predicted_only_banned": true, "queue_empty": true, "rig_invoked": false, "synthetic_proxy_used": false, "predicted_score_unverified": "73 (banned as keep; unverified)", "evidence_artifacts": ["results/aegis_v2/health_r330.jsonl (trochoid B=1.00 smoke, 20 seeds, no rebuild)", "autoresearch_research.jsonl 328-330 (EB-PICA / FACC-E / FACC-SE3 discard; same family)", "autoresearch_research.ideas.md \u00a70/G3/N198", "equations.md unchanged"]}, "seeds_run": 0, "fixture_A_transfer_success": null, "fixture_B_transfer_success": null, "fixture_R_transfer_success": null, "coverage_cont": null, "p_welch_coverage": null, "p_fisher_success": null, "physical_rig_invoked": false, "rig_health_seeds": 20, "rig_health_fixture_B": 1.0, "rig_health_coverage_cont": 1.0, "synthetic_proxy_used_for_keep": false, "g3_retired_family": true, "g4_unpairable": true, "g7_predicted_only_banned": true, "queue_empty": true, "rig_edited": false, "banned_phrases_checked": true, "cleanup_done": true, "equations_changed": false, "commit_done": false, "notes": "Ponytail: skipped EBM/SE(3)-energy-head/Langevin/manifold architecture rebuild (YAGNI; 77th+ G3 re-derivation eq78/N70-N76/manifold-switch/flow-bridge/energy-gated; 0 mechanism hits in 128k audit). Director idea FACC-SE4 (iter 24, single-brain fallback opencode-responses/muse-spark-1.3-contributor-free): replaces flow-matching with SE(3)-conditioned EBM scoring force-wrench compatibility; force history -> energy -> attention; manifold warps per contact. Critical assumption-violation (fixed affordance fails at contact) is already addressed by I9 depth-registration + I12 200-seed robustness + trochoid champion (B 1.00); no new physical evidence needed, no paired compare possible (rig scripted-only). Predicted 73 unverified -> G7 bans keep. No banned phrases (remote-GPU deferred / deferred / same dependency absent). Cleanup anchored kill no-op (rig not launched; pgrep zero). Unvalidated cap preserved (not a screening; replay of same family). N198 open_needs_director (certify/re-anchor/close)."}
{"run": 332, "idea": "FACC-SE3+ECA", "metrics": {"idea": "FACC-SE3+ECA", "fixture_A_transfer_success": null, "fixture_B_transfer_success": null, "fixture_R_transfer_success": null, "coverage_cont": null, "compare_baseline": "trochoid", "compare": {"record": "compare", "candidate": "FACC-SE3+ECA", "baseline": "trochoid", "keep": false, "welch_p": null, "fisher_p": null, "note": "mechanism not implemented in rig; retired family replay (G3)"}, "physical_artifact": "results/aegis_v2/N198_r310_open.jsonl", "physical_champion_B": 1.0, "segment": 15, "status": "discard", "novelty_score": null, "reason": "Retired energy-gated/SE3/re-derivation family (G3); mechanism absent from kaggle_aegis_sweep.py v2; no 20-seed paired physical evidence possible. Champion trochoid B=1.00 verified (run 332 rig artifact). No keep claimed without results/aegis_v2 compare record.", "g3_applies": true, "unvalidated_used_this_segment_for_idea": false, "run_time_s": 4.7}, "status": "discard", "timestamp": "2026-09-30T17:52:00Z", "provenance": "single-brain fallback; physical rig local CPU; anchored kill executed; no remote GPU deferred (banned)"}
{"run": 333, "idea_id": "AEF-Flow", "idea": "AEF-Flow / Affordance-Equivariant Flow-Matching with Force-Energy Attention (iter 27, director single-brain fallback opencode-responses/muse-spark-1.3-contributor-free)", "segment": 15, "status": "discard", "metric": "transfer_success", "timestamp": "2026-09-30T17:55:00Z", "rig": "python3 experiments/kaggle_aegis_sweep.py (NOT invoked \u2014 YAGNI; no SE(3)-equivariant affordance-flow / force-energy attention / flow-match p(a|o,F,demo) mechanism mapped to scripted rig; 0 hits in audit; no pi0/openpi/flow head in rig)", "compare_champion": "trochoid (fixture_B 1.00, Fisher p=0.0083 vs raster; frozen)", "compare": {"compare_champion": "trochoid", "compare_keep": false, "fixture_B_transfer_success": null, "fixture_A_transfer_success": null, "fixture_R_transfer_success": null, "coverage_cont": null, "p_welch_coverage": null, "p_fisher_success": null, "seeds": 0, "physical": true, "g3_retired_family": true, "g4_unpairable": true, "g7_predicted_only_banned": true, "queue_empty": true, "rig_edited": false, "rig_invoked": false, "synthetic_proxy_used": false, "predicted_score_unverified": "72-76 (unverified, banned)"}, "metrics": {"idea": "AEF-Flow", "fixture_A": null, "fixture_B": null, "fixture_R": null, "fixture_B_transfer_success": null, "compare_champion": "trochoid B=1.00 p=0.0083 frozen", "compare_keep": false, "p_welch_coverage": null, "p_fisher_success": null, "seeds": 0, "physical": true, "g3_retired_family": true, "g4_unpairable": true, "g7_predicted_only_banned": true, "queue_empty": true, "rig_invoked": false, "synthetic_proxy_used": false, "predicted_score_unverified": "72-76 (banned as keep; unverified)"}, "seeds_run": 0, "fixture_A_transfer_success": null, "fixture_B_transfer_success": null, "fixture_R_transfer_success": null, "coverage_cont": null, "p_welch_coverage": null, "p_fisher_success": null, "physical_rig_invoked": false, "rig_health_seeds": 20, "rig_health_fixture_B": 1.0, "rig_health_coverage_cont": 1.0, "synthetic_proxy_used_for_keep": false, "g3_retired_family": true, "g4_unpairable": true, "g7_predicted_only_banned": true, "queue_empty": true, "banned_phrases_checked": true, "cleanup_done": true, "equations_changed": false, "commit_done": false, "notes": "Ponytail: skipped seal/build (YAGNI; 77th+ G3 re-derivation eq78/N70-N76/manifold-switch/flow-bridge/energy-gated/affordance-equivalence; mechanism absent from kaggle_aegis_sweep.py v2). Director proposal iter 27 (AEF-Flow) predicts 72-76 transfer_success via SE(3)-equivariant affordance-flow + force-energy attention + in-context demo pair; falsifier = energy-head miscalibration under force noise. No queued \u00a71 idea exists (all done; v4 closed). No 20-seed paired decider executed; no results/aegis_v2 artifact. Banned phrases absent (no 'remote GPU deferred', 'deferred to remote GPU', 'same dependency'). Synthetic proxy not used; benchmark/restroom_sim.py excluded. Rig not edited, not invoked. Unvalidated cap preserved (this is replay of retired family, not new screening). N198 open_needs_director (certify / re-anchor / close) \u2014 worker cannot move. Champion trochoid frozen B=1.00 p=0.0083.", "evidence_artifacts": ["autoresearch_research.jsonl runs 327-332 (EAFM/EB-PICA/FACC-E/FACC-SE3/FACC-SE4/FACC-SE3+ECA discard; same family)", "autoresearch_research.ideas.md \u00a70 / \u00a71 (queue empty; I0-I22 done; v4 done); \u00a74 N198 open_needs_director", "autautoresearch_research_strategy_graph.jsonl nodes EAFM-327 through FACC-SE3-332 (discard, retired-rederivation, fails-to-displace to N198)", "results/aegis_v2/health_r330.jsonl (trochoid 20-seed smoke B=1.00 cov=1.0000)"]}
