{"run": 530, "idea": "FACC-dir41-muse-spark-iter41", "idea_id": "FACC-dir41", "segment": 15, "status": "discard", "timestamp_utc": "2026-10-02T16:40:00Z", "metric_name": "fixture_B transfer_success (canonical rig v2, PyBullet DIRECT); replay refused \u2014 no 20-seed paired decider", "metric_class": "physical (replay refusal; 0 episodes; synthetic_proxy EXCLUDED per G2/G7)", "metrics": {"idea": "FACC-dir41", "fixture_A": null, "fixture_B": null, "fixture_R": null, "coverage_cont": null, "transfer_success": null, "seeds": 0, "episodes": 0, "compare_champion": "trochoid (B=1.00 Fisher p=0.0083 vs raster)", "compare_keep": false, "welch_p": null, "fisher_p": null, "rig_executed_for_idea": false, "rig_version": 2, "backend": "pybullet", "pose_noise_cfg": "N/A \u2014 G3 block, replay refusal", "synthetic_proxy_used": false, "deferred_phrase_present": false, "remote_gpu_used": false, "banned_phrases": [], "g3_family": "eq78/N70-N76/manifold-switch/flow-bridge/energy-gated/EBM/SE3/FACC (retired)", "replay_of_retired_family": true, "replay_count": "55 (r497..530)", "queue_state": "empty (ideas.md \u00a71); open N198/N478d", "unvalidated_cap_consumed": true, "unvalidated_added": 0, "fabrication_check": "G7-compliant: no arithmetic/teleport/estimate; no synthetic-only claim; no p fabricated; worklog append-only", "director_proposal": "FACC-E / SE(3)-conditioned Force-Adaptive Contact via Energy-Based Affordance Field (replaces flow-mat head) \u2014 iter 41 single-brain fallback opencode-responses/muse-spark-1.3-contributor-free", "prior_refusals": [498, 499, 500, 501, 502, 503, 504, 505, 506, 507, 508, 509, 510, 511, 512, 513, 514, 515, 516, 517, 518, 519, 521, 522, 523, 527, 528, 529, 530], "physical_action_taken": "REFUSED before rig invocation (55th G3 replay; mechanism unchanged); 3-seed champion smoke NOT required \u2014 prior evidence 527-529 + 517 discard sufficient; anchored kill hygiene executed; timeout 1200 N/A", "rig_file": null, "rig_exit": 0, "harness_errors": 0, "bytes_changed": 0}, "compare": {"champion": "trochoid", "candidate": "FACC-dir41", "compare_run": false, "keep": false, "welch_p_coverage_cont": null, "fisher_p_success": null, "reason": "G3 permanently retired eq78/FACC/SE3/energy-gated family (55th replay since r497); queue empty; no injectable hook in PATH_MODES; no 20-seed paired decider; no evidence artifact with compare.keep=true"}, "verdict": "DISCARD / REFUSAL \u2014 director iter 41 FACC-E is eq78 replay (energy-attention + SE(3) conditioning + flow-bridge). G3 retirement binds (N70-N76/eq78/manifold-switch/flow-bridge/energy-gated/EBM/FACC). No new mechanism axis; no physical 20-seed --compare trochoid executed; synthetic_proxy excluded from status; no p-value fabricated; no deferred/remote-GPU phrase; anchored kill hygiene; worklog/graph/jsonl updated; commit made.", "gate_report": "Tier-4 gate stays HARD (no change); synthetic gate unmentioned; no soft/adaptive gate variant proposed.", "notes": "Ponytail: 55th replay refusal \u2014 mechanism class unchanged by director label rotation (FACC-E / SE(3)-conditioned / energy affordance / dynamic manifold). Prior physical discard at run 517 (facc_se3 B=0.25 vs trochoid 1.00) already invalidates family. No equations.md change (reuses eq78/82). Strategy graph refusal node + replay edge appended. No remote/deferred/proxy-gain/deferred-to-remote-gpu phrase present."}
{"run": 531, "segment": 15, "idea": "QUEUE-EMPTY-dir41", "status": "invalid", "timestamp_utc": "2026-10-02T16:45:00Z", "metrics": {"idea": "QUEUE-EMPTY-dir41", "fixture_B_transfer_success": 1.0, "seeds": 3, "coverage_cont": 1.0, "compare_champion": "trochoid", "synthetic_proxy": false, "rig_executed_for_idea": true, "rig_health_output": "results/aegis_v2/N531_queue_empty_health.jsonl"}, "verdict": "INVALID \u2014 queue empty; open N198/N478d; rig health 3-seed passes (B 3/3, harness_errors=0)"}
{"run": 532, "segment": 15, "idea": "N532-path-discretisation", "status": "discard", "metric_name": "fixture_B transfer_success (canonical rig v2, PyBullet DIRECT) -- paired vs frozen champion trochoid on the same 20 seeds", "metric_class": "physical (1000 episodes, PyBullet DIRECT, system python3 CPU; synthetic_proxy EXCLUDED per G2/G7)", "metrics": {"idea": "N532", "seeds": 20, "rig_invocations": 9, "episodes": 1000, "harness_errors": 20, "pose_noise_cfg": "0,0 (8 arms) + 0.03,6 (1 arm)", "compare_champion": "trochoid (B=1.00, coverage_cont 1.0000, Fisher p=0.0083 vs raster)", "fixture_A_transfer_success": 1.0, "fixture_B_transfer_success": 1.0, "fixture_R_transfer_success": 1.0, "coverage_cont": 1.0, "base_mesh_inert_band_m": [0.005, 0.0314], "base_mesh_sagitta_mm": [0.05, 2.06], "base_mesh_sagitta_frac_r_eff": [0.0015, 0.059], "base_mesh_delta_coverage_cont_max": 0.0032, "mesh_converged": true, "champion_fisher_vs_raster_mesh_invariant": true, "resample_C1_ceiling_ds_m_fixture_A": 0.0098, "resample_C1_ceiling_bracket_m": [0.008, 0.01], "resample_frozen_ds_m": 0.004, "resample_margin_x": 2.45, "resample_max_turn_deg": {"0.001": 25.8, "0.004": 45.4, "0.008": 56.5, "0.010": 60.3, "0.016": 84.3}, "resample_016_fixture_A": "C1 AssertionError, 20/20 harness errors, 0 episodes", "resample_016_fixture_B": {"success_count": 19, "n": 20, "coverage_cont": 0.95, "stick_frac": 0.0674, "slip_m": 0.0403, "escaped_frac": 0.05}, "welch_p": null, "fisher_p": 1.0, "compare_keep": false, "keep_unreachable_reason": "axis candidate == its own paired baseline on every cell (B saturates 20/20 both arms, Fisher p=1.0); the champion is already 1.00, so p<0.01 is arithmetically unreachable on this axis", "synthetic_proxy": false, "remote_gpu_used": false, "banned_phrases": [], "rig_scored_quantities_touched": false, "gate_changed": false, "metric_changed": false, "segment_changed": false, "no_teleport": true, "no_arithmetic_coverage": true, "g3_refusal_this_iteration": {"director_proposal": "MAEF -- Manifold-Adaptive Energy Flow: dynamic SE(3)-equivariant affordance field replaces the pi0 action-expert; contact-force+proprio as info-theoretic context for EBM in-context attention; predicted 78", "verdict": "REFUSED (56th since r497)", "reason": "label rotation of the retired eq78/energy-gated/FACC/DAFE/SEAF family; rig has no injectable stiffness/SE3/EBM hook; queue empty", "episodes_spent_on_proposal": 0}, "pre_registered_in_source": "experiments/kaggle_aegis_sweep.py (N532 PRE-REGISTRATION block, written before the first run)", "cells": [{"file": "results/aegis_v2/N532_trochds_0001.jsonl", "pose_noise_cfg": "0,0", "path": "trochoid", "candidate_knobs": {"TROCHOID_DS_M": 0.001, "BASE_DS_M": 0.01}, "baseline_knobs": {"TROCHOID_DS_M": 0.004, "BASE_DS_M": 0.01}, "harness_errors": 0, "episodes": 80, "fixture_B_candidate": {"transfer_success": 1.0, "success_count": 20, "n": 20, "coverage_cont": 1.0}, "fixture_B_compare": {"n_a": 20, "n_b": 20, "mean_a": 1.0, "mean_b": 1.0, "delta": 0.0, "welch_t": NaN, "welch_p": NaN, "paired_t": NaN, "paired_p": NaN, "p_method": "scipy", "succ_a": 20, "succ_b": 20, "fisher_p": 1.0}, "keep": false}, {"file": "results/aegis_v2/N532_trochds_0008.jsonl", "pose_noise_cfg": "0,0", "path": "trochoid", "candidate_knobs": {"TROCHOID_DS_M": 0.008, "BASE_DS_M": 0.01}, "baseline_knobs": {"TROCHOID_DS_M": 0.004, "BASE_DS_M": 0.01}, "harness_errors": 0, "episodes": 120, "fixture_B_candidate": {"transfer_success": 1.0, "success_count": 20, "n": 20, "coverage_cont": 1.0}, "fixture_B_compare": {"n_a": 20, "n_b": 20, "mean_a": 1.0, "mean_b": 1.0, "delta": 0.0, "welch_t": NaN, "welch_p": NaN, "paired_t": NaN, "paired_p": NaN, "p_method": "scipy", "succ_a": 20, "succ_b": 20, "fisher_p": 1.0}, "keep": false}, {"file": "results/aegis_v2/N532_trochds_0016.jsonl", "pose_noise_cfg": "0,0", "path": "trochoid", "candidate_knobs": {"TROCHOID_DS_M": 0.016, "BASE_DS_M": 0.01}, "baseline_knobs": {"TROCHOID_DS_M": 0.004, "BASE_DS_M": 0.01}, "harness_errors": 20, "episodes": 80, "fixture_B_candidate": {"transfer_success": 0.95, "success_count": 19, "n": 20, "coverage_cont": 0.95}, "fixture_B_compare": {"n_a": 20, "n_b": 20, "mean_a": 1.0, "mean_b": 0.95, "delta": -0.05, "welch_t": -1.0, "welch_p": 0.3298768009211246, "paired_t": -1.0, "paired_p": 0.3298768009211248, "p_method": "scipy", "succ_a": 20, "succ_b": 19, "fisher_p": 1.0}, "keep": false}, {"file": "results/aegis_v2/N532_baseds_0005.jsonl", "pose_noise_cfg": "0,0", "path": "trochoid", "candidate_knobs": {"TROCHOID_DS_M": 0.004, "BASE_DS_M": 0.005}, "baseline_knobs": {"TROCHOID_DS_M": 0.004, "BASE_DS_M": 0.01}, "harness_errors": 0, "episodes": 120, "fixture_B_candidate": {"transfer_success": 1.0, "success_count": 20, "n": 20, "coverage_cont": 1.0}, "fixture_B_compare": {"n_a": 20, "n_b": 20, "mean_a": 1.0, "mean_b": 1.0, "delta": 0.0, "welch_t": NaN, "welch_p": NaN, "paired_t": NaN, "paired_p": NaN, "p_method": "scipy", "succ_a": 20, "succ_b": 20, "fisher_p": 1.0}, "keep": false}, {"file": "results/aegis_v2/N532_baseds_002.jsonl", "pose_noise_cfg": "0,0", "path": "trochoid", "candidate_knobs": {"TROCHOID_DS_M": 0.004, "BASE_DS_M": 0.02}, "baseline_knobs": {"TROCHOID_DS_M": 0.004, "BASE_DS_M": 0.01}, "harness_errors": 0, "episodes": 120, "fixture_B_candidate": {"transfer_success": 1.0, "success_count": 20, "n": 20, "coverage_cont": 1.0}, "fixture_B_compare": {"n_a": 20, "n_b": 20, "mean_a": 1.0, "mean_b": 1.0, "delta": 0.0, "welch_t": NaN, "welch_p": NaN, "paired_t": NaN, "paired_p": NaN, "p_method": "scipy", "succ_a": 20, "succ_b": 20, "fisher_p": 1.0}, "keep": false}, {"file": "results/aegis_v2/N532_baseds_003.jsonl", "pose_noise_cfg": "0,0", "path": "trochoid", "candidate_knobs": {"TROCHOID_DS_M": 0.004, "BASE_DS_M": 0.03}, "baseline_knobs": {"TROCHOID_DS_M": 0.004, "BASE_DS_M": 0.01}, "harness_errors": 0, "episodes": 120, "fixture_B_candidate": {"transfer_success": 1.0, "success_count": 20, "n": 20, "coverage_cont": 1.0}, "fixture_B_compare": {"n_a": 20, "n_b": 20, "mean_a": 1.0, "mean_b": 1.0, "delta": 0.0, "welch_t": NaN, "welch_p": NaN, "paired_t": NaN, "paired_p": NaN, "p_method": "scipy", "succ_a": 20, "succ_b": 20, "fisher_p": 1.0}, "keep": false}, {"file": "results/aegis_v2/N532_baseds_00314.jsonl", "pose_noise_cfg": "0,0", "path": "trochoid", "candidate_knobs": {"TROCHOID_DS_M": 0.004, "BASE_DS_M": 0.0314}, "baseline_knobs": {"TROCHOID_DS_M": 0.004, "BASE_DS_M": 0.01}, "harness_errors": 0, "episodes": 120, "fixture_B_candidate": {"transfer_success": 1.0, "success_count": 20, "n": 20, "coverage_cont": 1.0}, "fixture_B_compare": {"n_a": 20, "n_b": 20, "mean_a": 1.0, "mean_b": 1.0, "delta": 0.0, "welch_t": NaN, "welch_p": NaN, "paired_t": NaN, "paired_p": NaN, "p_method": "scipy", "succ_a": 20, "succ_b": 20, "fisher_p": 1.0}, "keep": false}, {"file": "results/aegis_v2/N532_baseds_003_pn0306.jsonl", "pose_noise_cfg": "0.03,6", "path": "trochoid", "candidate_knobs": {"TROCHOID_DS_M": 0.004, "BASE_DS_M": 0.03}, "baseline_knobs": {"TROCHOID_DS_M": 0.004, "BASE_DS_M": 0.01}, "harness_errors": 0, "episodes": 120, "fixture_B_candidate": {"transfer_success": 0.75, "success_count": 15, "n": 20, "coverage_cont": 0.9234}, "fixture_B_compare": {"n_a": 20, "n_b": 20, "mean_a": 0.9266, "mean_b": 0.9234, "delta": -0.0031, "welch_t": -0.1057, "welch_p": 0.9164123933898826, "paired_t": -1.4555, "paired_p": 0.16184410057193294, "p_method": "scipy", "succ_a": 15, "succ_b": 15, "fisher_p": 1.0}, "keep": false}, {"file": "results/aegis_v2/N532_raster_baseds_003.jsonl", "pose_noise_cfg": "0,0", "path": "raster", "candidate_knobs": {"TROCHOID_DS_M": 0.004, "BASE_DS_M": 0.03}, "baseline_knobs": {"TROCHOID_DS_M": 0.004, "BASE_DS_M": 0.01}, "harness_errors": 0, "episodes": 120, "fixture_B_candidate": {"transfer_success": 1.0, "success_count": 20, "n": 20, "coverage_cont": 1.0}, "fixture_B_compare": {"n_a": 20, "n_b": 20, "mean_a": 1.0, "mean_b": 1.0, "delta": 0.0, "welch_t": NaN, "welch_p": NaN, "paired_t": NaN, "paired_p": NaN, "p_method": "scipy", "succ_a": 20, "succ_b": 20, "fisher_p": 1.0}, "keep": false}], "evidence_files": ["results/aegis_v2/N532_trochds_0001.jsonl", "results/aegis_v2/N532_trochds_0008.jsonl", "results/aegis_v2/N532_trochds_0016.jsonl", "results/aegis_v2/N532_baseds_0005.jsonl", "results/aegis_v2/N532_baseds_002.jsonl", "results/aegis_v2/N532_baseds_003.jsonl", "results/aegis_v2/N532_baseds_00314.jsonl", "results/aegis_v2/N532_baseds_003_pn0306.jsonl", "results/aegis_v2/N532_raster_baseds_003.jsonl"]}, "compare": {"champion": "trochoid", "candidate": "N532 arms", "compare_run": true, "keep": false, "welch_p_coverage_cont": null, "fisher_p_success": 1.0, "reason": "every paired cell saturates at fixture_B 20/20 on BOTH arms (delta 0.0000, Fisher p=1.0); the axis is INERT, not a win. Verdict is DISCARD of the lever with the mesh-convergence certificate and the resample C1 cliff KEPT as rig facts. See equations.md row N532 and results/aegis_v2/N532_*.jsonl compare records."}, "verdict": "DISCARD (lever) / KEEP (measurement payload). The base mesh BASE_DS_M is provably inert over 6.3x [0.005,0.0314] -- coverage_cont exactly 1.0000 / 20-of-20 on fixture_A/B/R at every dose, and flat at pose noise 0.03,6 (max |delta| 0.0032) -- so the champion's certified 1.0000 is MESH-CONVERGED (sagitta 0.05-2.06 mm = 0.15-5.9% of r_eff) and the mesh is deleted from every coverage law in the segment; the raster control is flat too, so the champion-vs-raster Fisher p=0.0083 is mesh-invariant and the test is fair. The resample step TROCHOID_DS_M is NOT bookkeeping (D1 REFUTED): the C1 assertion and the kappa time-reparameterisation read the resampled polyline, so it owns a hard validity cliff at ds_t ~ 0.0098 m on fixture_A (60.3 deg at 0.010; frozen 0.004 sits 2.45x inside at 45.4 of 60 deg) above which fixture_A dies to a generator AssertionError (20/20 harness errors, 0 episodes) while fixture_B, 3.4x looser, degrades physically (19/20, covc 0.9500, stick 61x, slip 3.8x, escape 0.05). Predicted ds_base C1 ceiling 0.0314 CONFIRMED. Director proposal MAEF refused as the 56th G3 replay (0 episodes).", "notes": "Section 0 of ideas.md claimed 'no unvaried frozen term left that anyone has named'; N532 names one and closes it. Next iteration must name a different axis: N198 and N478d remain director-owned, and the mesh/resample axis is now closed as a lever.", "timestamp": "2026-10-02T17:20:00Z", "source": "ideas.md section 0/4 (queue empty) + 1000-header dose audit of results/aegis_v2/", "commit": "532 discard N532-path-discretisation mesh-inert resample-C1-cliff"}
{"run": 533, "segment": 15, "idea": "N533-servo-damping-ratio", "status": "discard", "metric_name": "fixture_B transfer_success (canonical rig v2, PyBullet DIRECT) -- paired vs frozen champion trochoid on the same 20 seeds", "metric_class": "physical (1200 episodes, 10 rig invocations, PyBullet DIRECT, system python3 CPU; synthetic_proxy EXCLUDED per G2/G7)", "metrics": {"idea": "N533", "axis": "servo damping ratio zeta = KD/(2*sqrt(KP*m))", "knob": "AEGIS_KD", "seeds": 20, "rig_invocations": 10, "episodes": 1200, "harness_errors": 0, "pose_noise_cfg": "0,0 (6 arms) + 0.03,6 (4 arms)", "compare_champion": "trochoid (B=1.00, coverage_cont 1.0000, Fisher p=0.0083 vs raster)", "fixture_A_transfer_success": 1.0, "fixture_B_transfer_success": 1.0, "fixture_R_transfer_success": 1.0, "coverage_cont": 1.0, "zeta_frozen_by_pad": [0.6718, 0.5863, 0.6264], "servo_period_ticks": [7.1, 8.1, 7.6], "kd_ladder": [0.0, 0.95, 1.9, 2.83, 5.66], "plateau_kd": [0.95, 2.83], "plateau_zeta": [0.336, 1.0], "plateau_paired_delta_covc_max": 0.0013, "plateau_paired_p_min": 0.9564, "lower_wall_kd_bracket": [0.0, 0.95], "lower_wall_B_covc_0_0": 0.0, "lower_wall_B_success_0_0": "0/20", "lower_wall_B_slip_m": 0.5834, "lower_wall_B_slip_x_vs_frozen": 55.0, "lower_wall_B_stick_frac": 0.9942, "lower_wall_B_track_tol_frac": 0.0, "lower_wall_B_escaped_of_20": 13, "lower_wall_fisher_p_0_0": 1.4508889103849688e-11, "upper_wall_kd_bracket": [2.83, 5.66], "upper_wall_B_covc_0_0": 0.8969, "upper_wall_B_delta_covc_0_0": -0.1031, "upper_wall_B_welch_p_0_0": 6.742750047935116e-05, "upper_wall_B_fisher_p_0_0": 0.00014530659691950015, "upper_wall_B_success_0_0": "9/20", "upper_wall_B_f_cmd_max_n": 10.56, "upper_wall_f_cmd_max_x_vs_frozen": 2.74, "upper_wall_f_clamp_ticks": 395.6, "upper_wall_clamp_ticks_x_vs_frozen": 396.0, "upper_wall_F_CLAMP_N": 3.0, "upper_wall_B_track_tol_frac": 0.37, "mass045_test": {"pad_mass_kg": 0.045, "kd_frozen_B_covc": 1.0, "kd_critical_B_covc": 0.5797, "kd_critical_A_covc": 0.051, "kd_critical_A_welch_p": 5.008132592763051e-15, "kd_critical_B_escaped": 15, "frozen_B_f_cmd_max_n": 18.497, "frozen_B_f_clamp_ticks": 332.1, "verdict": "N533.4 REFUTED: the N214 escape floor is a force-rail floor, not a missing-damping floor"}, "pre_registered_in_source": "experiments/kaggle_aegis_sweep.py N533 block (written before the first rig run)", "predictions": {"N533.1": "REFUTED at both walls (KD=0 -> 0/20, KD=5.66 -> 9/20 at 0,0); CONFIRMED on the plateau", "N533.2": "REFUTED: coverage_cont is the FIRST quantity to move (exactly 0.0000 at KD=0), not the launch channel", "N533.3": "REFUTED: the response is a two-sided PLATEAU, not monotone", "N533.4": "REFUTED: critical damping destroys the light-mass arm instead of rescuing it", "N533.5": "holds trivially: every dose that moves anything moves it DOWN"}, "welch_p": 6.742750047935116e-05, "fisher_p": 0.00014530659691950015, "compare_keep": false, "keep_unreachable_reason": "on the plateau the candidate equals its own paired baseline (|delta covc| <= 0.0013, p > 0.95) and off it every significant effect is a REGRESSION; B saturates 20/20 on both arms inside the window", "synthetic_proxy": false, "remote_gpu_used": false, "banned_phrases": [], "rig_scored_quantities_touched": false, "gate_changed": false, "metric_changed": false, "segment_changed": false, "no_teleport": true, "no_arithmetic_coverage": true, "g3_refusal_this_iteration": {"director_proposal": "SEAC-Flow -- SE(3)-Equivariant Energy-Adaptive Contact Flow: affordance-energy scorer + force-adaptive SE(3) corrector replacing the pi0 flow-mat head; predicted 76", "verdict": "REFUSED (57th since r497)", "reason": "label rotation of the permanently retired eq78/energy-gated/FACC/DAFE/SEAF family (G3); the rig has no injectable stiffness/SE(3)/EBM/force-adaptation hook, and I11/N479 already falsified the force channel physically", "episodes_spent_on_proposal": 0}, "novelty_check": "not applicable: no novelty claim is made and the status is discard (measured control-physics axis, not a mechanism proposal)", "identity_check": "default arm (AEGIS_KD unset) reproduces the frozen champion exactly: B coverage_cont 1.0000 / 20-of-20 at 0,0 in every paired baseline arm", "evidence_files": ["results/aegis_v2/N533_kd0.0_cell0.jsonl", "results/aegis_v2/N533_kd0.95_cell0.jsonl", "results/aegis_v2/N533_kd2.83_cell0.jsonl", "results/aegis_v2/N533_kd5.66_cell0.jsonl", "results/aegis_v2/N533_kd0.0_cell0306.jsonl", "results/aegis_v2/N533_kd0.95_cell0306.jsonl", "results/aegis_v2/N533_kd2.83_cell0306.jsonl", "results/aegis_v2/N533_kd5.66_cell0306.jsonl", "results/aegis_v2/N533_mass045_kd2.83_cell0.jsonl", "results/aegis_v2/N533_mass045_kd5.66_cell0.jsonl"], "pre_probe": "experiments/iter44_contact_damping_probe.py (15-episode 1-body PyBullet caricature, dose-range selection only, NOT a metric source; it certified CONTACT_C as quasi-static inert over 6 decades -- slip changes 0.4% at mu=0.8)", "timestamp": "2026-10-04T21:40:00Z", "source": "autoresearch_research.ideas.md \u00a70 dose audit (1009 headers + AST sweep of every module-level float) -> last unpaired actuator term KD", "verdict": "DISCARD of the lever / KEEP of the stability-window certificate -- the servo damping ratio is now a registered, logged, paired axis; the frozen KD=1.9 sits inside a measured two-sided window KD in [0.95, 2.83] (zeta in [0.336, 1.0], 3.0x) whose lower wall is 55x slip with zero contact and whose upper wall is 396x workspace-rail clamping (f_cmd_max 10.56 N vs F_CLAMP_N 3.0). Third head floor for the paper: zeta >= 0.336.", "notes": "Queue empty in ideas.md \u00a71/\u00a74 (N198 + N478d remain director-owned). Next axis must be named elsewhere: the remaining never-dosed physics literals are WS_LIMIT_M (0.60 workspace stray rail), KP_PRESS (1.0), CONTACT_C (200.0, certified inert by the pre-probe), LAUNCH_Z_M (0.02, diagnostic counter only), RESIDUAL_CLIP_M (0.02, residual off by default); CELL_M is barred because FINE_M = CELL_M/2 IS the metric pitch. Tier-4 gate unchanged (post-hoc tag); equations.md ROW N533; worklog append-only."}}
