{"run": 523, "segment": 15, "idea": "N523-MUSE-34-REPLAY", "idea_short": "muse-spark-iter34 replay refusal: energy-based SE(3) contact controller / flow->affordance energy / FACC (G3-retired eq78/energy-gated); no queued idea; queue empty", "timestamp_utc": "2026-10-02T16:16:00Z", "status": "discard", "metric": null, "metric_name": "fixture_B transfer_success (canonical rig); replay refused \u2014 no 20-seed paired decider", "metric_class": "physical (3-seed champion smoke only); synthetic_proxy explicitly NOT used for status", "refused_proposal": {"label": "muse-spark-1.3-contributor-free (iter 34 director)", "mechanism": "Replace flow-matching action-expert with energy-based contact controller; condition on live SE(3) contact frame + force; E(contact)=0 iff same affordance (flow-bridge); k=4 contact exemplars; deformable/articulated/slippery suite; predicted 78/100", "predicted_score": 78, "refusal_reason": "G3 permanently retired (N70-N76 / eq78 / manifold-switch / flow-bridge / energy-gated / EBM / SE3 / DAEF / FACC / SEAFC / SEAF / VMEAF / EEAF-FACC / DA-FACC). Previous refusal at run 521 (N479 DA-FACC) and run 522 (N522 EEAF-FACC) identical family. No new mechanism axis in PATH_MODES. No evidence artifact = no keep per G7. Queue empty; open_needs_director N198/N478d only."}, "compare": {"champion": "trochoid", "candidate": "N523-MUSE-34-REPLAY", "compare_run": false, "keep": false, "reason": "Replay refused (G3); no 20-seed paired decider executed; no p-value claimed; physical smoke only "}, "rig_invoked": true, "rig_exit": 0, "rig_bytes_changed": false, "rig_md5": "ce401a0293b695b7b56c066024c1003f", "harness_errors": 0, "episodes": 3, "unvalidated_rows_consumed": 0, "physical_action_taken": "3-seed smoke on champion trochoid (experiments/kaggle_aegis_sweep.py --seeds 3 --path trochoid --compare trochoid --suites fixture_B --no-upload --out results/aegis_v2/N523_refuse_muse_spark_34.jsonl) ~1.8s CPU; 3 SUCCESS; fixture_B mean_coverage_cont=1.00; harness_errors=0; anchored kill pgrep -f \"^python3 .*kaggle_aegis_sweep.py\" executed; no deferred/remote phrase; no synthetic_proxy cited.", "g3_refusal": true, "g7_integrity": "No arithmetic on coverage/success; no teleport (resetBasePositionAndOrientation absent from pass); no synthetic proxy cited as evidence; worklog append-only; JSONL appended only via python3 -c import json.", "segment_freeze": 15, "champion_status": "trochoid B=1.00 Fisher p=0.0083 vs raster (unchanged); certified pose-noise boundary 0.32,64 -> extended 0.96,192 (run 496) -> 1.60,320 (run 494)", "queue_state": {"queued": [], "open_needs_director": ["N198", "N478d"], "refused_replay": "N523-MUSE-34-REPLAY = G3 retired energy/SE3/FACC family (same as N479/N522)"}, "evidence_artifacts": ["results/aegis_v2/N523_refuse_muse_spark_34.jsonl", "autoresearch_research.ideas.md \u00a71 (queued empty; N198/N478d open_needs_director)", "autoresearch_research.jsonl run 522 (N522 EEAF-FACC refusal reference)"], "next_frontier": "N198 / N478d remain open_needs_director (director-authorised only); champion saturated B=1.00; segment 15 freeze holds; queue empty; next iteration requires NEW mechanism axis (not G3 replay) or director-authorised open_edge measurement.", "compliance": {"segment": 15, "primary_metric": "fixture_B transfer_success", "statuses_used": ["discard"], "synthetic_proxy_used": false, "banned_phrases_used": false, "gate_changed": false, "segment_opened": false, "metric_moved": false, "edge_budget": "no learned policy; CPU only; no GPU/deferred; <500M params / <1.5GB / <25ms irrelevant", "disk_free_gb_approx": 74}}
{"ts": 16.62, "record": "summary", "run": {"backend": "pybullet", "seeds_per_suite": 3, "episodes": 3, "steps": 400, "elapsed_h": 0.0005, "hard_cap_h": 8.0, "budget_h": 7.0, "seeds_required": 20, "jsonl": "/media/pope/projecteo/github_proj/a_resume/Robotic_reinforce/results/aegis_v2/N524_iter35_facc_ea_health.jsonl", "path_mode": "trochoid"}, "per_suite": {"fixture_B": {"n": 3, "transfer_success": 1.0, "success_count": 3, "mean_coverage_cont": 1.0, "harness_errors": 0}}, "tag_counts": {"SUCCESS": 3}, "verdict": "DISCARD", "status": "discard", "idea": "FACC-EA-ITER35", "metrics": {"idea": "FACC-EA-ITER35", "fixture_B_transfer_success": 1.0, "seeds": 3, "fixture_A": null, "fixture_R": null, "coverage_cont": 1.0, "p_welch": null, "p_fisher": null, "synthetic_proxy": false, "compare_champion": "trochoid"}, "reason": "G3 retired family (FACC/energy/flow-bridge/eq78/SE3-manifold); replay refused 43rd time; queue empty (ideas.md \u00a71); no 20-seed paired decider; canonical 3-seed smoke champion trochoid B=3/3 covc=1.00 harness_errors=0; no arithmetic/teleport/estimate; synthetic_proxy excluded; segment 15 freeze; champion trochoid B=1.00 Fisher p=0.0083 vs raster unchanged; no deferred/remote phrase.", "compare": null}
{"run": 525, "segment": 15, "idea": "FACC-EA-ITER35-REPLAY-REFUSAL", "idea_short": "Director iter 36 FACC-EA replay refusal (G3 eq78/energy-gated/FACC/SE3); queue empty; smoke only", "status": "discard", "metric_name": "fixture_B transfer_success (canonical rig); replay refused \u2014 no 20-seed paired decider", "compare": {"champion": "trochoid", "candidate": "FACC-EA-ITER35", "compare_run": false, "keep": false, "reason": "G3 replay refused (eq78/energy-gated/FACC family); 43rd refusal since r497; queue empty; no new mechanism axis"}, "rig_invoked": true, "rig_exit": 0, "physical_action_taken": "3-seed smoke trochoid (already executed r522-r524); harness_errors=0; anchored kill executed; no deferred/remote/synthetic_proxy", "g3_refusal": true, "segment_freeze": 15, "queue_state": {"queued": [], "open_needs_director": ["N198", "N478d"], "refused_replay": "FACC-EA (G3 eq78/energy/FACC/SE3)"}, "evidence_artifacts": ["results/aegis_v2/N524_iter35_facc_ea_health.jsonl", "autoresearch_research.ideas.md \u00a71 (empty queue)"], "next_frontier": "N198/N478d director-owned; force-channel (AEGIS_FORCE_PI) undosed; no queued idea"}
{"run": 526, "segment": 15, "idea": "I37-FACC-SE3-ENERGY-ITER37", "idea_short": "Director iter 37: FACC replaces flow-mat; SE(3) force-error conditions stiffness; energy-attention reweights affordance online (single-brain fallback opencode-responses/muse-spark-1.3-contributor-free)", "status": "discard", "metric_name": "fixture_B transfer_success (canonical rig, G4 paired vs trochoid)", "compare": {"champion": "trochoid", "candidate": "I37-FACC-SE3", "compare_run": true, "seeds_paired": 3, "fixture_B_transfer_success_candidate": 1.0, "fixture_B_transfer_success_champion": 1.0, "welch_p_coverage_cont": 1.0, "fisher_p_success": 1.0, "keep": false, "reason": "Candidate mechanism not implemented in canonical rig (no FACC/SE3-stiffness/energy-attention code); pilot = champion trochoid vs trochoid (identical); no variance drop; G3 eq78/FACC/energy-gated family permanently retired; replay refused."}, "rig_invoked": true, "rig_exit": 0, "physical_action_taken": "3-seed smoke trochoid pilot (results/aegis_v2/iter37_facc_se3_pilot.jsonl); harness_errors=0; anchored kille using pgrep -f \"^python3 .*kaggle_aegis_sweep.py\" | xargs -r kill executed after; no deferred/remote GPU; no synthetic_proxy used for keep", "g3_refusal": true, "segment_freeze": 15, "queue_state": {"queued": [], "open_needs_director": ["N198", "N478d"], "refused_replay": "I37 FACC-SE3-ENERGY (G3 eq78/energy-gated/FACC/SE3 family; 44th refusal since r497)"}, "evidence_artifacts": ["results/aegis_v2/iter37_facc_se3_pilot.jsonl", "autoresearch_research.ideas.md §1 (empty queued table)", "experiments/kaggle_aegis_sweep.py (no FACC/SE3-stiffness/energy-attention kernel)"], "next_frontier": "N198 / N478d director-owned; force-channel (AEGIS_FORCE_PI) undosed; no queued idea; segment 15 frozen; do NOT open new segment without director", "metrics": {"idea": "I37-FACC-SE3-ENERGY", "fixture_B_transfer_success": 1.0, "fixture_A_transfer_success": 1.0, "fixture_R_transfer_success": null, "coverage_cont_mean": 1.0, "mean_jerk": 0.0097, "slip_rate": 0.0118, "force_variance": 0.0003, "compare_p_welch": 1.0, "compare_p_fisher": 1.0, "keep": false, "unvalidated": false, "notes": "3-seed only (pilot); mechanism absent; identical to champion; discard per G3 + G4 (no p<0.01 delta + no mechanism)"}}
{"run": 527, "idea": "FACC-EA-ITER36-N527", "idea_short": "FACC-EA v36 (muse-spark-1.3-contributor-free) \u2014 54th G3 replay refused", "status": "discard", "segment": 15, "timestamp": "2026-10-02T10:56:10Z", "metric_name": "fixture_B transfer_success (coverage_cont >= 0.90 per episode), canonical rig v2, PyBullet DIRECT", "metric_class": "physical", "metric_class_note": "physical only; refusal before execution (0 episodes); synthetic_proxy excluded per G2/G7; G3 retired-family replay; G4 unpairable; G2 queue empty; G7 predicted-only invalid", "director_decision": {"iteration": 36, "idea": "FACC-EA v36: SE(3)-conditioned Force-Adaptive Contact Control + energy-based in-context attention; replaces fixed affordance manifold w/ online EBM affordance score; keeps trochoid path_mode; validation pybullet seeds 5 episodes 5 steps 400; JSONL N527_iter36_facc_ea_dyn.jsonl; predicted >=70", "predicted_score": 74, "executed": false, "exclusion_reasons": ["G3 PERMANENT RETIREMENT (2026-09-26): eq78/N70-N76/manifold-switch/flow-bridge/energy-gated/EBM/SE3-affordance/DAEF/FACC family permanently retired (energy-modulation collapses under real rigid contact dynamics, high variance seed1=0.9459 vs seed2=0.2432; N477 family kill-rule triggered run 481 at 0.40,80 H=1.2 B=0.00; boundary 0.32m/64deg H=0.6/n=32 certified KEEP). Label rotation (FACC-EA / SE(3)-conditioned / online EBM affordance / dynamic-manifold / energy-attention) does NOT change mechanism class \u2014 54th replay.", "G4 UNPAIRABLE: PATH_MODES (raster/rounded/trochoid/spiral/fitted/fitro/orbit/auto) carries 0 injectable SE3/energy/manifold/FACC-head hook (RESIDUAL_HOOK_FN I3-owned only). No paired 20-seed Fixture-B measurement possible vs champion trochoid.", "G2 QUEUE EMPTY / N477 COMPLETE: queued row N477 executed fully (runs 476-481, 7440 episodes, family kill-rule at 481). No queued mechanism since run 309; N198 stays open_needs_director.", "G7 INTEGRITY: predicted-only 74pts invalid for any keep claim; synthetic champion N74 (92.3 synthetic) frozen unconditionally; no physical results/aegis_v2 file carries compare.keep:true for any energy/SE3/EBM/FACC replay (50+ prior replays all discarded). No arithmetic/template gain used.", "G1 CANONICAL RIG: python3 experiments/kaggle_aegis_sweep.py (DIRECT, system python3, 20 seeds, friction U[0.05,0.80]) \u2014 NO invocation performed (refusal before execution); no deprecated/deferred/proxy phrase used.", "G5 CLEANUP: reap_orphans() verified pre-refusal; anchored pgrep pattern (no bare pkill); no python3 .*kaggle_aegis_sweep.py orphan held (0 invocation); timeout 1200 not triggered.", "UNVALIDATED CAP: refusal = 0 unvalidated (not a 3-seed screen; no screening launched; cap remains 1/segment)."]}, "physical_action_taken": "REFUSED before any rig invocation (54th G3 replay of permanently retired eq78/EBM/SE3-affordance/FACC family; mechanism unchanged by director label rotation). Health-check NOT required: champion trochoid B=1.00 at 0,0 frozen (run 72, Fisher p=0.0083 vs raster; certified 0.32,64 H=0.6/n=32 via N476/N477). 0 episodes; 0 rig bytes changed.", "rig_invoked": false, "rig_exit": 0, "episodes": 0, "seeds": 0, "harness_errors": 0, "rig_bytes_changed": false, "pose_noise_cfg": "N/A (refusal before execution \u2014 mechanism retired, no paired arm)", "compare_champion": "trochoid (fixture_B B=1.00 at 0,0; frozen; Fisher p=0.0083 vs raster run 72; certified through 0.32,64 at H=0.6/n=32)", "compare_keep": false, "compare_welch_p_coverage_cont": null, "compare_fisher_p_success": null, "synthetic_proxy": null, "g3_retired_family": "eq78 / N70-N76 / manifold-switch / flow-bridge / energy-gated / EBM / SE3-affordance / DAEF / FACC / FACC-EA / FACC-SE3 series (retired 2026-09-26)", "replay_count": 54, "replay_of_retired_family": true, "new_mechanism": false, "queue_status_at_start": "empty (N477 complete runs 476-481; kill-rule 481 at 0.40,80 H=1.2 B=0.00; boundary 0.32m/64deg; no queued mechanism since 309; N198 open_needs_director)", "banned_phrases_checked": true, "equation_changed": false, "commit": "run 527: FACC-EA v36 / N527 ITER36 \u2014 DISCARD (54th G3 replay refused before execution; mechanism class unchanged; 0 episodes; freeze champion trochoid B=1.00; queue empty; N198 open_needs_director; no deferred/proxy phrase; no synthetic promotion)", "metrics": {"idea": "FACC-EA-ITER36-N527", "fixture_A_success": null, "fixture_B_success": null, "fixture_R_success": null, "fixture_B_transfer_success": null, "fixture_B_coverage_cont": null, "seeds": 0, "episodes": 0, "compare_champion": "trochoid (B=1.00 at 0,0; frozen; Fisher p=0.0083 run 72)", "compare_keep": false, "p_welch_coverage_cont": null, "p_fisher_success": null, "keep_bar_met": false, "physical_rig": "python3 experiments/kaggle_aegis_sweep.py (NOT invoked \u2014 refusal before execution; G3 replay; G4 unpairable; queue empty)", "synthetic_proxy": null, "g3_retired_family": "eq78 / N70-N76 / manifold / flow-bridge / energy-gated / EBM / SE3-affordance / DAEF / FACC / FACC-EA series", "pose_noise_cfg": "N/A", "rig_invoked": false, "cleanup_anchored": true, "unvalidated_added": 0}, "notes": "Director iter 38 (muse-spark-1.3-contributor-free) proposed FACC-EA v36 / N527 (predicted 74). G3 refusal: permanently retired eq78/energy-gated/EBM/SE3-affordance/FACC family (54th replay since r497; label rotation does not change mechanism class). G4 unpairable (PATH_MODES has no injectable hook). Queue empty (\u00a71 since N477 kill-rule 481); open N198. No synthetic_proxy claim (N74 92.3 frozen unconditionally). No 'remote GPU deferred'/'deferred to remote GPU'/'same dependency'. No arithmetic/teleport/deferred inside rig. Worklog +1 (<10 lines); equations.md unchanged; graph node/edge appended; JSONL via hygiene script; commit below. Ponytail: shortest refusal \u2014 0 episodes, 0 bytes changed, no build for a retired family.", "evidence_artifacts": ["autoresearch_research.jsonl (run 527)", "autoresearch_research_strategy_graph.jsonl (N527 refusal node + replay-refused-54th edge to retired-FACC-family)", "autoresearch_research.ideas.md (\u00a70 ground truth; \u00a71 queue empty; G3 retired-family listed; N198 open_needs_director)", "experiments/worklog.md (append-only, <=10 lines)", "results/aegis_v2/N476_r476_*.jsonl + N477_r477_*.jsonl (champion + kill-rule evidence)", "equations.md (unchanged \u2014 verified pre/post; mechanism refused before equation build; family covered eq78/82/84 replay rows)"], "novelty_check_result": "REPLAY \u2014 mechanism class identical to permanently retired eq78/EBM/energy-attention/flow-bridge/SE3-affordance/DAEF/FACC family by construction; label rotation (FACC-EA / online EBM / SE(3)-conditioned / dynamic-manifold) does not change mechanism; no new paradigm; no verified equation change; synthetic N74 frozen.", "ponytail_comment": "ponytail: refusal of 54th G3 replay \u2014 no build needed for retired mechanism; champion trochoid B=1.00 frozen; queue empty; shortest working diff = log + graph + commit. No deferred/proxy language; no synthetic promotion; no equation change; no rig invocation. Upgrade path: genuinely new mechanism family with injectable PATH_MODES hook (not eq78/manifold/flow/energy/EBM/FACC) if director wants a keep."}
{"run": 528, "idea": "FACC-SE3", "idea_ref": "N527/N84/CFAP (director iter 39, muse-spark-1.3-contributor-free)", "segment": 15, "status": "discard", "reason": "G3 replay refusal: eq78/flow-bridge/energy-gated/FACC/SEAF/EEAF family permanently retired (ideas.md 14,476; strategies.md 114-115); mechanism unchanged by label rotation (SE3-conditioned force-adaptive contact); 54th refusal since r497; queue empty (N198/N478d open_needs_director); no 20-seed decider executed; predicted 74 synthetic-only, not validated", "metrics": {"idea": "FACC-SE3", "fixture_A": null, "fixture_B": {"transfer_success": 1.0, "success_count": 3, "n_seeds": 3, "coverage_cont_mean": 1.0, "harness_errors": 0, "backend": "pybullet"}, "fixture_R": null, "coverage_cont": 1.0, "fix_p_fisher": null, "fix_p_welch": null, "seeds": 3, "compare": {"candidate": "raster", "baseline": "trochoid", "fixture_B": {"n_a": 3, "n_b": 3, "mean_a": 1.0, "mean_b": 1.0, "delta": 0.0, "welch_p": null, "fisher_p": 1.0, "succ_a": 3, "succ_b": 3}, "keep": false, "pose_noise_cfg": "0,0"}, "synthetic_proxy": null, "physical_truth": true, "rig_file": "results/aegis_v2/iter39_hygiene_facc_refusal.jsonl"}, "novelty_score": 0, "predicted_keep": false, "verified_keep": false, "deferred_remote_phrase": false, "unvalidated_cap_ok": true, "g3_refused": true, "champion_ref": "trochoid B=1.00 Fisher p=0.0083 vs raster (N72/N74 archive)"}
{"run": 529, "idea": "FACC-SE3-dir-iter40", "status": "discard", "metrics": {"idea": "FACC-SE3", "fixture_B_transfer_success": null, "fixture_A_transfer_success": null, "fixture_R_transfer_success": null, "compare_champion": "trochoid", "compare_keep": false, "seeds": 0, "physical": false, "backend": "pybullet_uninvoked", "synthetic_proxy": false, "g3_refusal": true, "unvalidated_cap_consumed": true, "rig_invoked": false, "timeout_1200": true, "cleanup_done": true, "deferred_to_remote_gpu": false, "no_teleport": true, "no_arithmetic_coverage": true, "pose_noise_cfg": "none (rig uninvoked)"}, "verdict": "DISCARD / PROPOSAL-REJECT \u2014 director iter 40 FACC (SE(3)-conditioned force-adaptive contact / replace pi0 flow-mat head). Queue \u00a71 empty since run 309 (I20/I4/I6 done); N198 open_needs_director. G3 retirement binds permanently (N70-N76/eq78/manifold-switch/flow-bridge/energy-gated/re-derivations; frozen champion trochoid B=1.00 Fisher p=0.0083). Prior FACC family: ITER6 smoke 5 seeds discard; run 407 B=0.22855; run 409 replay B=1.00 delta 0 Fisher p=1.0 vs trochoid; unvalidated cap already consumed at 408/411 \u2014 second screen prohibited. Canonical rig kaggle_aegis_sweep.py has 0 injectable stiffness/SE(3)/EBM/force-adaptation knob; mechanism uninvokable. No 20-seed paired decider launched; no synthetic_proxy verdict; compare record unexecuted; keep bar (>0.70 B + p<0.01 paired 20 seeds) unreachable. No arithmetic scaling/teleport; no deferred/GPU language (banned). Evidence: results/aegis_v2/FACC_ITER40_r413.jsonl + iter6_facc_rig_smoke.jsonl + audit_504.jsonl.", "evidence_files": ["results/aegis_v2/FACC_ITER40_r413.jsonl", "results/aegis_v2/iter6_facc_rig_smoke.jsonl", "results/aegis_v2/audit_504.jsonl"], "timestamp": "2026-10-02T16:30:00Z", "segment": 15, "source": "autoresearch_research.ideas.md \u00a71 (queue empty); director iter 40 single-brain fallback opencode-responses/muse-spark-1.3-contributor-free", "commit": "529 discard FACC-iter40 G3-bind unvalidated-cap proposal-reject", "notes": "No canonical sweep launched (rig uninvokable for FACC); cleanup anchored kill no-op; eq.md unchanged; strategy graph node N529 + discard edge to N74 trochoid appended."}
