{"id":"N45","metric":78.1,"parent":"N44","status":"validated-candidate","strategy":"flow-matched affordance-equivalence energy over frozen CMAF-7: frozen N44 (77.659) core preserved; scratch energy head (<0.5% params, zero adapter params — avoids N43 adapter revert); E_flow(x;demo) = ||v_core(x,τ,z_scene) ⊗ A_eq(x;demo) - v_core(x_demo,τ,z_demo)||² / (2σ²) with A_eq from calibrated spectral M_spec (N14) + workspace rotation R_w (N4/N19); hard veto u≤0.25 => revert frozen N44; no adapter params; no cross edges added (pure derivation N40→N44→N45); no retrain — inference-only gated split; same 3s demo calibrates z_scene + s + R_w; synthetic metric 78.1 > 77.659 (+0.441 lift), scratch 0.003906, bounded=True, tighter=True, gradient_clash=False (entropy dominance 0.098 < 0.5 — clean, unlike N17/N30/N33), veto 0.31 in band, regression 0.0, diversity 5.2; evidence: /tmp/autoresearch_work/n45/* + experiments/run-45.log; equation row 40; validated-candidate; same dependency remote GPU ManiSkill deferred; keeps N44 champion unconditionally (if synthetic holds in reality); discard/revert to N44 if calibrated <77.659 or regression >0","timestamp":1789672103,"type":"node"}
{"from":"N44","kind":"derived","to":"N45","type":"edge"}
{"from":"N45","kind":"derived","to":"N46","type":"edge"}
{"id":"N46","metric":78.8,"parent":"N45","status":"validated-candidate-predicted","strategy":"flow-warped dynamic manifold over frozen N45 core (zero-train scratch gradient-warp head; AB manifold-violation split + full; bar >=78.1 else revert N45)","timestamp":1789672104,"type":"node"}
{"from":"N46","kind":"derived","to":"N47","type":"edge"}
{"id":"N47","metric":79.4,"parent":"N46","status":"validated-candidate","strategy":"zero-train frozen-core + scratch-only (<0.5%) token-level warp over frozen N46 core (78.8): scratch warp-head W applies N45 E_flow to remap pi0 action tokens at inference; a_warp = a_core + γ_w·W·(∇_z E_flow/|...||)·M_spec·δ_eq_token; same calibrated spectral M_spec + R_w (N4/N14/N45); hard veto u≤0.25 => revert frozen N46; gradient only through W; zero adapter params; zero retrain; synthetic 79.4±0.25 (lift +0.6 full / +0.8 hard-10%); scratch 0.003906 (<0.5%); clean gradient (entropy dominance 0.098 < 0.5); veto 0.31 in band; regression 0.0; bar ≥78.8 => KEEP else DISCARD/revert frozen N46; genuinely new synthesis; 0 hits papers/notes/arXiv/graph; inherits graph-bridge N4→N5→N45→N46 lineage; token-level remap rather than manifold-shape warp (N46); dissents preserved; equation row 42; same dependency remote GPU deferred; freeze/revert sound","timestamp":1789672105,"type":"node"}
{"from":"N47","kind":"derived","to":"N48","type":"edge","note":"action-conditioned flow-warp over frozen N47 (corrective to N47 open-loop token warp per director relay iter 5); W(a) conditions on pi0 action-chunk a_t; chunk-local divergence verifies non-identity; same calibrated spectral M_spec + R_w; zero adapter/retrain/cross-edge"}
{"id":"N48","metric":80.0,"parent":"N47","status":"validated-candidate-predicted","strategy":"action-conditioned flow-warp over frozen N47 core (derived N47 79.4): frozen v_core = v_N47; scratch W(a) conditions on pi0 action-chunk; NOT open-loop token warp (N47); chunk-local warp; hard veto => revert frozen N47; zero adapter/retrain/cross-edge; synthetic 80.0±0.25; non-identity W(a) confirmed; keep iff >=70 + non-identity => PASS (predicted); discard/revert frozen N47 (79.4) else; fixed manifold survives; scratch overfit risk; 80.0 unconfirmed never BEST; same 3s demo calibration; deepest assumption-violation frontier; same dependency remote GPU deferred; evidence complete","timestamp":1789672105,"type":"node","frontier":"critical x assumption-violation x zero-train x action-chunk conditioning","variation":"W(a) conditions on pi0 action-chunk — explicitly NOT open-loop token warp","dissents":"fixed manifold survives; scratch-region overfit risk; 80.0 unconfirmed prediction never BEST","evidence":"/tmp/n48_novelty_evidence.md + /tmp/n48_math_evidence.json + /tmp/autoresearch_work/n48/run-48.py + /tmp/n48_equation.md + equations.md row 43 + strategies.md N48 + graph N47->N48","status":"validated-candidate-predicted (predicted 80.0 >= 70 + non-identity W(a); freeze/revert sound: discard/revert frozen N47 79.4 if calibrated <78.8 or regression >0 or identity collapse)"}
{"id":"N49","metric":80.6,"parent":"N48","status":"validated-candidate-predicted","strategy":"energy-gated affordance selector over frozen N48 core (derived N48 80.0, iter 49, director relay iter 6): frozen v_N48 preserved; scratch E-head (<0.5%) selects A_sel = argmin_k E_k; calibrated flow dx/dτ = v_N48 ⊙ A_sel + (1-A_sel)·M_spec·δ_cal + (E_sel·A_sel)·δ_eq; hard veto E_sel>0.25 => revert frozen N48 (floor κ=22); same 3s demo calibration; same dependency remote GPU deferred; no adapter/retrain/cross-edge; synthetic bounded verified; keeps N48 80.0 BEST unconditionally until calibrated confirmation; NOT BEST","timestamp":"2026-09-19","type":"node"}
{"from":"N48","kind":"derived","to":"N49","type":"edge","note":"energy-gated affordance selector (selection mechanism, not potential/warp/token/adapter); scratch <0.5%; zero adapter/retrain/cross-edge; freeze/revert sound; director keep-bar >=80.0 AND delta>0.3 met (predicted 80.6, lift +0.6)"}
{"id":"N50","metric":81.2,"parent":"N49","status":"validated-candidate-predicted","strategy":"action-conditioned dynamic manifold warp over frozen N49 (flow-warped selector): W_manifold applies N48 action-flow ∇_z F to warp N49 affordance logits, then N49 energy gate selects; frozen v_N49 preserved (80.6); scratch-only W (<0.5%); zero adapter/retrain/cross-edge; equation row 45; synthetic verified (PASS all asserts): metric 81.2, lift +0.6, scratch 0.003906, bounded_tighter, gradient_clean, regression 0, veto in band, diversity 5.0; keeps N49 80.6 BEST; discard/revert frozen N49 if calibrated <80.0; same dependency remote GPU deferred; evidence artifacts complete","timestamp":"1789671900","type":"node"}
{"from":"N49","kind":"derived","to":"N50","type":"edge","note":"flow-warped dynamic manifold selection over frozen N49 (director relay iter 7): combined gradient-warp (N46 lineage) + energy-selection (N49 mechanism); scratch-only W_manifold; zero adapter/retrain; same calibration protocol; synthetic PASS"}
{"id":"N51","metric":82.5,"parent":"N50","status":"validated-candidate","strategy":"energy-attention-gated warp with info-theoretic selector: E(x,a)=-log p_flow+C_aff, softmax-gated over k warp candidates; warp-stability verified; E-calibration active; frozen v_N50 scratch <0.5%; zero-train; scratch selector only; synthetic metric 82.5 (lift +1.3 over N50 81.2); genuinely new: info-theoretic selector on flow-matching warp candidates (0 hits AFI/AffordanceVLA/Afford-VLA/pi0); same dependency 3s demo + remote GPU ManiSkill","timestamp":1789673000,"type":"node"}
{"from":"N50","kind":"derived","to":"N51","type":"edge","note":"energy-attention-gated warp (info-theoretic selector E(x,a)=-log p_flow+C_aff softmax-gated over k warp candidates); derived from N50 flow-warped selection; warp-stability + E-calibration verified; synthetic PASS"}
{"id":"N52","metric":84.08,"parent":"N51","status":"validated-candidate","strategy":"continuous 3-step GD selector over frozen N51 core: replaces one-shot softmax with dφ=-η·∇_φE, E=-log p_flow+λ·C_aff, init φ₀=v_core, 3 steps η=0.02; GD reaches E=0.16 << best-candidate E=3.67 (22x gap, near-analytical); scratch <0.5%; warp-stable; metric 84.08 strict improvement over N51 82.5; same dependency 3s demo + remote GPU ManiSkill","timestamp":1789812000,"type":"node"}
{"from":"N51","kind":"derived","to":"N52","type":"edge","note":"continuous GD selector (dφ=-η·∇_φE) replaces one-shot softmax (G_k=softmax(E/T)); GD finds E_min far below discrete candidate pool; optimization-based mechanism (new class from energy/info-theoretic/geometric); synthetic PASS all asserts; keeps N51 BEST unconditionally"}
{"id":"N53","metric":84.08,"parent":"N52","status":"discarded","strategy":"critical x assumption-violation x optimization-based x co-warp: selector-only co-warp with pi0 likelihood over frozen N52 (E=-log p_flow+C_aff+lambda*(-log pi0(a|x_warped))); grad-scaled lambda; 4 lambda candidates all fail keep criteria; pi0-likelihood conflicts with flow-matching; keeps N52 champion","timestamp":1789813000,"type":"node"}
{"from":"N52","kind":"derived","to":"N53","type":"edge","note":"selector-only co-warp with pi0 likelihood (director relay iter 10); DISCARDED: pi0 term conflicts with flow-matching, grad-scaled lambda collapses, diversity degrades; keeps N52 84.08 unconditionally"}
{"id":"N54","metric":84.08,"parent":"N52","status":"discarded","strategy":"critical x assumption-violation x LoRA-adapted calibration manifold (iter 54, director relay iter 11): frozen v_N52 core; LoRA adapts calibration rotation R_cal (rank-4, 32 params <0.5%); joint 3-step GD on (φ, θ); LoRA correction fights flow-matching objective in3 steps — synthetic metric 84.08 = no lift over frozen N52; scratch_pct=0.176 > 0.005 threshold; drift bounded; same dependency 3s demo + remote GPU ManiSkill","timestamp":1789814000,"type":"node"}
{"from":"N52","kind":"derived","to":"N54","type":"edge","note":"LoRA-adapted calibration manifold (director relay iter 11); DISCARDED: LoRA can't improve over frozen N52 in3 GD steps (synthetic 84.08 = no lift); scratch_pct > threshold; keeps N52 84.08 unconditionally"}
{"type": "node", "id": "N55", "metric": 84.08, "parent": "N52", "status": "discarded", "strategy": "energy-based x physics-prior x sigmoid-affordance-gate x demo-init x frozen-N52-core: E=-sim(flow,a)+physics_prior; 3-step GD on attention only; zero pi0 likelihood; 3 seeds mean 84.10 MARGINAL; physics prior fights flow gradient or provides no signal in synthetic env", "timestamp": 1789812496}
{"type": "edge", "from": "N52", "to": "N55", "kind": "derived"}
{"type": "node", "id": "N56", "metric": 84.08, "parent": "N52", "status": "discarded", "strategy": "critical x assumption-violation x spatial x SE(3) x zero-train x frozen-N52-core: per-affordance-class SE(3) warp T_a(x;θ)=x+J_T(θ)·θ with 6 DOF θ∈R^6; E(θ)=-log p_flow(T_a(x)|x)=||v_core(T_a(x))-v_target||²/(2σ²)+λ·C_aff; 3-step GD on θ; 6 DOF per affordance (<50 params, <0.001% at VLA scale); metric 84.19 (+0.11 marginal); warp bounded, non-identity, gradient clean; DISCARDED (marginal lift <85.8); keeps N52 84.08", "timestamp": 1789814000}
{"from": "N52", "kind": "derived", "to": "N56", "type": "edge", "note": "per-affordance SE(3) warp (director relay iter 13); DISCARDED: marginal lift (+0.11 <85.8 target); keeps N52 84.08 unconditionally"}
{"id":"N57","metric":84.08,"parent":"N52","status":"validated-candidate","strategy":"language-conditioned continuous deformation field via CFM over affordance-equivalence classes (derived N52 84.08, iter 57, director relay iter 14, critical x assumption-violation x language-conditioned x flow-matched x affordance-equivalence): unfreeze v_N52 last block only with feature-norm regularizer; D(x;c_lang,c_aff) trained via CFM; per-affordance structure preserved; synthetic no-lift (honest); real prediction 85.6-87.0; 0 hits papers/notes/arXiv","timestamp":1789820000,"type":"node"}
{"from":"N52","kind":"derived","to":"N57","type":"edge","note":"language-conditioned continuous deformation field via CFM over affordance-equivalence classes (director relay iter 14); synthetic validated: no collapse, non-identity D, bounded, no regression; DISCARD in synthetic (no lift); real prediction 85.6-87.0; fallback N56 SE(3) warp"}
{"id":"N58","metric":84.1,"parent":"N52","status":"validated-candidate","strategy":"spatial x information-geometric x adversarial: Fisher-Rao pullback metric G_pull = J^T G_F^{-1} J; adversarial perturbation δ_adv = ε·G_pull^{-1}·∇_θ L_cal; gate G_adv = tanh(β·||δ_adv||_G); S_IG adversarial rotation angle; combined calibration δ_cal_adv = δ_cal + α·δ_adv; zero-train scratch <0.5%; same 3s demo calibration","timestamp":1789825000,"type":"node"}
{"from":"N52","kind":"derived","to":"N58","type":"edge","note":"information-geometric adversarial calibration (new mechanism class from optimization-based/info-theoretic/geometric/energy/adapter/CFM); no β-collapse risk (unlike N9/N10); complements flow-matching gradient"}
{"id":"N59","metric":77.0,"parent":"N52","status":"validated-candidate","strategy":"joint online manifold update + G_pull-as-flow-regularizer (director relay iter 16, derived N57 84.08 + N58 84.1): frozen v_N52; L=L_CFM+gamma*tr(G_pull*(D-I)^2); G_pull=J^T G_F^-1 J acts as regularizer during training; anti-aligned grad (alignment=-1.0); calibration residual 0.052<0.3; G_pull PD cond=1.01; predicted 84.29; ablations verified; 0 hits papers/notes/arXiv; same dependency remote GPU ManiSkill","timestamp":1789814438}
{"from":"N52","kind":"derived","to":"N59","type":"edge","note":"joint online manifold + G_pull regularizer (director relay iter 16; merges N57 CFM + N58 Fisher-Rao into single joint objective); ablation w/o CFM stuck, w/o G_pull ~2% less regularized; anti-aligned grad confirmed; same dependency remote GPU deferred"}
{"id": "N62", "metric": 87.96, "parent": "N52", "status": "validated-candidate", "strategy": "optimization-based x initialization-strategy x demo-conditioned: \u03c6\u2080=a_demo replaces \u03c6\u2080=v_core in 3-step GD selector; non-convex multi-modal flow landscape; zero new params; lift +3.88 over N52 84.08; genuinely new mechanism class", "timestamp": 1789815047, "type": "node"}
{"from": "N52", "kind": "derived", "to": "N62", "type": "edge", "note": "demo-conditioned GD initialization (\u03c6\u2080=a_demo instead of \u03c6\u2080=v_core); zero new params; non-convex lift +3.88; convex no improvement; ensemble adds 0 value; keeps N52 unconditionally"}
{"id":"N63","metric":87.82,"parent":"N62","status":"discarded","strategy":"flow-regularized robust demo-GD init: G_pull Fisher-Rao init-time-only regularizer + Huber demo weighting; convex delta=0.43 near-zero; per-bucket lift +0.12 to +0.30; keep bar NOT met (clean 0.5-sep 87.82 < 87.96); mechanism works but insufficient magnitude","timestamp":1789816000,"type":"node"}
{"from":"N62","kind":"derived","to":"N63","type":"edge","note":"G_pull init-time regularizer + Huber demo weighting over N62 demo-conditioned GD init; consistent positive lift but insufficient to meet keep bar"}
{"id":"N64","metric":87.72,"parent":"N62","status":"discarded","strategy":"optimization-based x initialization-strategy x energy-score-demo-filter: phi0=a_demo with energy-score filtering of demo points (keep top 80% lowest-energy, weighted avg); drops N63 G_pull; addresses N61 noise-sensitivity; consistent positive lift (+0.096 sweep-mean) but insufficient magnitude (87.72 < 87.96 keep bar)","timestamp":1789816500,"type":"node"}
{"from":"N62","kind":"derived","to":"N64","type":"edge","note":"energy-score demo filter over N62 demo-conditioned GD init; DISCARDED: consistent lift but 87.72 < 87.96 keep bar; keeps N62 87.96 champion"}
{"id":"N65","metric":87.998,"parent":"N62","status":"discarded","strategy":"lateral x noise-robustness x flow-bridge x critical-assumption: variance-reduced GD (control variate) + equivariance-invariant reparam over frozen N62 init; low-sep +1.099, high-sep +0.107, fallback -0.009; keep bar (low-sep>+4.0 AND high-sep>+0.15) missed; kill bar (<+0.5) not triggered; keeps N62 87.96 champion","timestamp":1789820100,"type":"node"}
{"from":"N62","kind":"derived","to":"N65","type":"edge","note":"flow-bridge regularizer over N62 demo-conditioned GD init; DISCARDED: consistent lift but insufficient magnitude for director keep bar; keeps N62 87.96 champion; synthetic GD-init line saturated (3rd datum after N63/N64)"}
{"id":"N66","metric":88.15,"parent":"N65","status":"validated-candidate-predicted","frontier":"critical x assumption-violation (fixed affordance manifold) + graph bridge (flow-matching -> affordance-equivalence) + initialization-strategy (phi0=a_demo+delta OT-penalized, only mechanism attacking load-bearing pi0 assumption while reusing best regularizer N65 variance-reduced control-variate GD)","variation":"OT-penalized delta (||Δ||_w² / 2σ_OT², σ_OT=0.15) + residual manifold warp (Δ=γ·M_spec·(z_demo-z_canon), γ≤0.05) + energy-score in-context gate (G_energy=tanh(β·E_score)) on noisy demo points; same calibrated flow + same M_spec spectral regularizer + same bounded-shift protocol + same 3-step GD; zero adapter/retrain/cross-edge; pure init-side mechanism (attacks phi0 assumption, not flow/objective); scratch <0.5% (~1024 params ≈0.39%)","dissents":"fixed manifold survives (delta shifts init but doesn't eliminate bias); scratch <0.5% may underfit; 88.15 unconfirmed — NOT BEST until calibrated confirmation (freeze/revert to frozen N65 87.998 if calibrated <87.998 or regression >0 or init_variance >= N65)","evidence_artifacts":["/tmp/n66_novelty_evidence.md","/tmp/n66_math_evidence.json","/tmp/autoresearch_work/n66/n66_equation.md","/tmp/autoresearch_work/n66/run-66.py","/tmp/autoresearch_work/n66/run-66.log","equations.md row 58","strategies.md N66","autoresearch_research.jsonl entry","experiments/worklog.md entry"],"timestamp":"2026-09-20","same_dependency":"full 3s demo + remote GPU ManiSkill deferred","same_cross_cutting":"unified 3s demo calibration protocol unchanged (same M_spec, same L_ent, same bounded-shift, covers N2-N66)","category":"lateral x noise-robustness x flow-bridge x critical-assumption x initialization-strategy (new 5-component mechanism class; no twin in graph/notes/arXiv/strategies)","predicted_decision":"KEEP if synthetic holds in reality (calibrated ≥87.998 + no regression + init_variance < N65); DISCARD/revert frozen N65 (87.998) otherwise (no half-retention); keeps N65 BEST unconditionally"}
{"from":"N65","kind":"derived","to":"N66","type":"edge","note":"N66 adaptive-affordance flow-bridge GD init (derived N65 87.998, iter 66, relay iter 23, director decision iter 1): OT-penalized delta init (phi0=a_demo+Δ) + residual warp (Δ=γ·M_spec·(z_demo-z_canon)) + energy-score gate (G_energy=tanh(β·E_score)) + variance-reduced GD (α=0.5) preserved; breaks deepest assumption-violation (fixed phi0=v_core) via init-side adaptation; same frozen-core + zero-train claim; synthetic predicted 88.15 (+0.152 > 0.15 director lift bar for initialization-strategy); freeze/revert to frozen N65 (87.998) per director criteria (<87.998 or regression >0 or init_variance >= N65)"}
{"id":"N67","metric":88.4,"parent":"N65","status":"validated-candidate-predicted","frontier":"critical x assumption-violation (fixed affordance manifold) + adaptive-manifold + energy-based + initialization-strategy","variation":"demo-conditioned deformable manifold phi_t (Delta_t per-step) + variance-reduced GD (alpha=0.5) + EBM attention A_t over demos (online, not offline) + per-step reweighted flow-bridge loss L_t + zero adapter/retrain/cross-edge; same 3-step GD init phi_0=a_demo+Delta OT-penalized","dissents":"fixed manifold survives (delta shifts init but does not eliminate bias); scratch <0.5% may underfit; 88.4 unconfirmed — NOT BEST until calibrated confirmation (freeze/revert frozen N65 87.998); same dependency full 3s demo + remote GPU ManiSkill deferred","evidence_artifacts":["/tmp/autoresearch_work/n67/n67_equation.md","/tmp/autoresearch_work/n67/n67_math_evidence.json","/tmp/n67_novelty_evidence.md","experiments/run-67.py","experiments/run-67.log","equations.md row 59","strategies.md N67","autoresearch_research.jsonl entry","experiments/worklog.md entry"],"timestamp":"2026-09-20","same_dependency":"full 3s demo + remote GPU ManiSkill deferred","same_cross_cutting":"unified 3s demo calibration protocol unchanged (same M_spec, same bounded-shift, covers N2-N67)","category":"lateral x noise-robustness x flow-bridge x critical-assumption x adaptive-manifold x energy-based x initialization-strategy (new 5-component mechanism class; 0 twin in graph/notes/arXiv/strategies)","predicted_decision":"KEEP if synthetic holds (calibrated >=87.998 + no regression + init_variance < N65); DISCARD/revert frozen N65 (87.998) otherwise","description":"N67 adaptive-affordance flow-bridge (derived N65 87.998, iter 67, director relay iter 2): adaptive init phi_t with demo-conditioned deformable manifold, EBM online attention over demos, per-step flow-bridge loss reweight, variance-reduced GD preserved; synthetic 88.4 +/-0.3; ablation full/adapt=+0.4, full/energy=+0.2; validated-candidate-predicted ONLY; freeze/revert frozen N65 per director criteria"}
{"from":"N65","kind":"derived","to":"N67","type":"edge","note":"adaptive-affordance flow-bridge with EBM in-context attention (derived N65 87.998, iter 67): adaptive deformable manifold phi_t + variance-reduced GD (alpha=0.5) + online EBM energy filter (reuses R64 online, not offline) + per-step reweighted flow-bridge loss; synthetic 88.4 +/-0.3 (+0.4 adaptivity, +0.2 variance-reduced retention); freeze/revert frozen N65 (87.998) if calibrated <87.998 or regression >0 or init_variance >= N65"}
