{"run": 363, "idea": "N214-PAD-FOOTPRINT-AXIS", "status": "keep", "metric": "transfer_success", "metric_class": "physical", "novelty_score": null, "title": "N214-PAD-FOOTPRINT-AXIS: validity audit of the TOOL BODY -- the head's footprint and mass are two unvaried floors, and the frozen certificate sits 1.27x and 1.45x above them", "segment": 15, "summary": "Validity audit (new_mechanism=false) of the rig's TOOL-BODY axis, the last unvaried term after N207 rate, N208 iterations, N209 friction, N210 force, N211 kernel, N212 dose and N213 pose-noise. In runs 1-362 the head changed only through tool_id = seed % 3, which moves the footprint (r_eff 0.035/0.040/0.050), the mass (0.080/0.105/0.092 kg) and the thickness (0.012/0.030/0.006 m) together and aliases them with the seed, so the head had never been a controlled dose -- while r_eff is the term every coverage law in the segment is written in (the N211 kernel dilation, the N212 frontier s <= 0.486*2 r_eff, the 'raster failures = tool 0 (r_eff 3.5 cm) only' claim). Three absolute diagnostic knobs (AEGIS_PAD_HU_M / AEGIS_PAD_HV_M / AEGIS_PAD_MASS, all default 0.0 = the frozen per-tool value; in-plane extents and body mass only, thickness/press/path/scoring kernel untouched) turn the head into a controlled dose: 35 arms, 2100 episodes, every arm paired in-rig on the SAME 20 seeds, identity arm bit-identical to Run350 (60/60 on coverage_cont/success, in-rig baseline included). TWO FLOORS found, on two different channels. COVERAGE floor: coverage_cont = 1.0000 and 20/20 for every r_eff >= 0.0275 m, 0.9062 (= 29/32 cells) at 0.025, 0.6414 / 0-of-20 at 0.0175, 0.3836 / 0-of-20 at 0.010, with ZERO escapes anywhere at r_eff >= 0.025. The naive 1-D strip binder 2*r_eff*L >= A_window predicts the cliff at 0.0110 m and is 2.3x too loose: area is not the binder, the last uncovered CELL is, and its distance to the contact polyline lies in (0.025, 0.0275] with the SAME value on fixture_A, fixture_B and fixture_R -- a property of the path and the scored window, not of the fixture. ESCAPE floor: the escape channel is non-empty for m <= 0.050 kg (2 residual escapes at 0.050, 20/11/15 of 20 at 0.045) and empty for m >= 0.055 kg, while coverage_cont is untouched (fixture_B 1.0000 at 0.045 kg) because success = (not escaped) and coverage_cont >= 0.90. The floor is set by the 20 Hz CONTROL TICK, not the integrator: N207's own criterion m >= K dt^2 = 0.0174 kg sits 2.9x below the last escaping mass and the servo-bandwidth form m >= K(TICK_S/2pi)^2 = 0.0633 kg sits 1.15x above the last clean one. An 8x rate (240 -> 1920 Hz) lifts the 0.030 kg arm only part of the way (fixture_B success 4/20 -> 10/20, coverage 0.6508 -> 0.6875, escapes 16 -> 8), so the floor is dynamics with a solver-dependent component. Q1 REFUTED (a square pad does NOT equate the rect and disc kernels -- rect - frozen = 0.0876/0.0938/0.0907 at r_eff 0.025, because the disc is inscribed and the gap is the pad's corner area, vanishing exactly at saturation 0.0000 for r_eff >= 0.0275). Q2 PARTLY CONFIRMED (every kernel saturates at 1.0000 at r_eff 0.035 for the square pad and for elongation along u or across v, max |delta| 0.0000) with the anisotropy REFUTED (elongation sign inconsistent: A +0.0104, B -0.0195, R +0.0144). Q3 REFUTED (N212's spacing law is not the binder here). Q5 CONFIRMED: the two modes fail through different channels -- every raster failure at a small pad is an ESCAPE, the trochoid loses coverage and stays escape-free. Q6 CONFIRMED: per-tool coverage_cont spread 0.0000, so decomposing the aliased tool axis costs nothing. rig keep=false in EVERY arm BY CONSTRUCTION and NO keep is claimed on the primary metric.", "metrics": {"idea": "N214-PAD-FOOTPRINT-AXIS", "claim_type": "validity_audit", "new_mechanism": false, "physical": true, "rig_invoked": "experiments/kaggle_aegis_sweep.py (PyBullet DIRECT, system python3, local CPU)", "backend": "pybullet", "sim_hz": 240.0, "solver_iters": 80.0, "path_mode": "trochoid (+ raster arms)", "steps": 400, "seeds": 20, "suites": ["fixture_A", "fixture_B", "fixture_R"], "pose_noise_cfg": ["0,0", "0.03,6"], "arm_files": 35, "episodes_total": 2100, "harness_errors": 0, "rig_keep_any_arm": false, "keep_claimed_on_primary_metric": false, "paired_baseline": "in-rig --compare-env AEGIS_PAD_HU_M=0,AEGIS_PAD_HV_M=0,AEGIS_PAD_MASS=0, the SAME 20 seeds -> same friction/tool/noise/customer in every arm (G4)", "A0_identity": {"bit_identical_to_run350": true, "arms_checked": ["00_identity", "fk", "k_fk"], "episodes_per_arm": 60, "max_delta_coverage_success": 0.0, "in_rig_baseline_also_identical": true, "cov_kernel_flag_non_perturbing": true, "note": "the scored pair is bit-reproducible across processes; every force-derived channel is not (N210.5's 0.154 N floor), so paired contrasts stay exact"}, "pad_footprint_cliff": {"verdict": "Q3 REFUTED; the binder is a local covering radius, not an area ratio", "coverage_cont_by_r_eff_m": {"0.07": 1.0, "0.05": 1.0, "0.0375": 1.0, "0.035": 1.0, "0.03": 1.0, "0.0325": 1.0, "0.0275": 1.0, "0.025": 0.9062, "0.0175": 0.6414, "0.01": 0.3836}, "coverage_identical_on_all_three_suites": true, "success_of_20": {"0.0275": 20, "0.025": 20, "0.0175": 0, "0.01": 0}, "escapes_ABC": {"0.0275": 0, "0.025": 0, "0.0175": 10, "0.01": 19}, "r_eff_certify_min_m": 0.0275, "r_eff_cliff_bracket_m": [0.025, 0.0275], "cells_uncovered_at_0p025": 3, "scored_window_cells": 32, "frozen_head_margin_x": 1.27, "frozen_head_over_smallest_frozen_pad": 0.786, "strip_bound_r_eff_m": 0.011, "strip_bound_ratio_to_measured": 2.3, "strip_bound_verdict": "REFUTED as the binder (2.3x too loose) -- area is not the constraint"}, "mass_floor": {"verdict": "Q4 REFUTED and INVERTED: mass carries an escape floor, not a coverage term", "escapes_ABC_by_kg": {"0.03": [20, 16, 17], "0.045": [20, 11, 15], "0.05": [2, 0, 0], "0.055": [0, 0, 0], "0.06": [0, 0, 0], "0.07": [0, 0, 0], "0.15": [0, 0, 0], "0.3": [0, 0, 0]}, "success_B_of_20": {"0.03": 4, "0.045": 9, "0.05": 20, "0.055": 20, "0.08": 20, "0.15": 20, "0.3": 20}, "coverage_B_at_0p045_kg": 1.0, "mean_slip_B_at_0p045_kg_m": 0.016, "last_escaping_mass_kg": 0.05, "last_clean_mass_kg": 0.055, "frozen_head_margin_x": 1.45, "integrator_limit_kg": 0.0174, "integrator_limit_ratio_below": 2.9, "servo_bandwidth_limit_kg": 0.0633, "servo_limit_ratio_above": 1.15, "verdict_mechanism": "the floor is set by the 20 Hz CONTROL TICK (TICK_S = 0.05 s), not by the integration rate"}, "mass_floor_mechanism_probe": {"verdict": "dynamics floor with a solver-dependent component, not a discretisation artefact", "arm": "0.030 kg at 1920 Hz (8x) vs 240 Hz", "fixture_B_success": [4, 10], "fixture_B_coverage_cont": [0.6508, 0.6875], "fixture_B_escapes": [16, 8], "coverage_stays_below_the_bar": true}, "Q1_square_pad_kernel_identity": {"verdict": "REFUTED", "rect_minus_frozen_at_r_eff_0p025": {"fixture_A": 0.0876, "fixture_B": 0.0938, "fixture_R": 0.0907}, "rect_minus_frozen_at_r_eff_0p035": {"fixture_A": 0.0, "fixture_B": 0.0, "fixture_R": 0.0}, "mechanism": "the disc is INSCRIBED in the pad rectangle, so the gap is the pad's corner area and exists for every pad including a square one; it vanishes exactly where coverage saturates (N211's lower-bound statement, sharpened)"}, "Q2_aspect": {"verdict": "PARTLY CONFIRMED; the anisotropy REFUTED", "max_abs_delta_at_r_eff_0p035_all_kernels": 0.0, "true_footprint_kernel_at_cliff_square": {"fixture_A": 0.9938, "fixture_B": 1.0, "fixture_R": 0.9969}, "true_footprint_kernel_at_cliff_either_elongation": 1.0, "frozen_kernel_shift_at_cliff": {"fixture_A": 0.0104, "fixture_B": -0.0195, "fixture_R": 0.0144}, "sign_consistent_across_suites": false, "claim_left": "a square pad is the WORST footprint; which axis is elongated is not a claim"}, "Q5_raster_vs_trochoid": {"verdict": "CONFIRMED in the predicted band; the modes fail through DIFFERENT channels", "raster_escapes": {"ras_sq025": {"A": 2, "B": 0, "R": 2}, "ras_sq0175": {"A": 8, "B": 1, "R": 4}}, "raster_failures_that_are_coverage": 0, "trochoid_at_0p0175": {"coverage_cont": 0.6414, "success_B": 0, "escapes_B": 1}, "raster_at_0p025_responsive_band_0p03_6": {"coverage_cont_B": 0.7617, "success_B": 5, "welch_p": 0.000141, "fisher_p": 0.00385}, "trochoid_at_0p0175_responsive_band_0p03_6": {"coverage_cont_B": 0.5227, "success_B": 0, "welch_p": 1.79e-11, "fisher_p": 7.71e-07}}, "Q6_tool_id_alias": {"verdict": "CONFIRMED", "per_tool_coverage_cont_at_0_0": {"tool_0": 1.0, "tool_1": 1.0, "tool_2": 1.0}, "spread": 0.0, "note": "decomposing the aliased tool axis into footprint + mass costs nothing at the frozen point"}, "rig_change": {"knobs_added": ["AEGIS_PAD_HU_M", "AEGIS_PAD_HV_M", "AEGIS_PAD_MASS"], "defaults": "0.0 = the frozen per-tool value, so every non-N214 arm is byte-identical", "touched": "the collision box's in-plane half-extents and the body mass only", "untouched": "pad thickness (hence lift and the approach height), the press law, scrub_grid, scrub_waypoints, _coverage_cont, the pose frame, the phase labels, the tick budget", "header_fields_added": ["pad_hu_m", "pad_hv_m", "pad_mass_kg", "tool_shapes_frozen", "pad_hu_realized", "pad_hv_realized", "pad_mass_realized", "pad_r_eff_realized"], "no_teleport": true, "no_arithmetic_on_scored_quantities": true}, "G4_table_fixture_B": {"sq_035_identity": {"covc": 1.0, "succ": 20, "welch_p": null, "fisher_p": 1.0, "keep": false}, "sq_0275": {"covc": 1.0, "succ": 20, "welch_p": null, "fisher_p": 1.0, "keep": false}, "sq_025": {"covc": 0.9062, "succ": 20, "welch_p": 2.33e-279, "fisher_p": 1.0, "keep": false}, "sq_0175": {"covc": 0.6414, "succ": 0, "welch_p": 2.28e-10, "fisher_p": 1.45e-11, "keep": false}, "sq_010": {"covc": 0.3836, "succ": 0, "welch_p": 8.27e-14, "fisher_p": 1.45e-11, "keep": false}, "m_045": {"covc": 1.0, "succ": 9, "welch_p": null, "fisher_p": 0.000145, "keep": false}, "m_050": {"covc": 1.0, "succ": 20, "welch_p": null, "fisher_p": 1.0, "keep": false}, "m_055": {"covc": 1.0, "succ": 20, "welch_p": null, "fisher_p": 1.0, "keep": false}, "m_015": {"covc": 1.0, "succ": 20, "welch_p": null, "fisher_p": 1.0, "keep": false}, "m_030kg_arm": {"covc": 0.6508, "succ": 4, "welch_p": 0.00431, "fisher_p": 1.54e-07, "keep": false}, "u_long_0p09x0p035": {"covc": 1.0, "succ": 20, "welch_p": null, "fisher_p": 1.0, "keep": false}, "v_long_0p035x0p09": {"covc": 1.0, "succ": 20, "welch_p": null, "fisher_p": 1.0, "keep": false}, "note": "every arm is a >=20-seed paired decider against the frozen champion on the same seeds; rig keep=false in ALL arms because every arm either ties the champion (delta 0.0000) or regresses"}, "G_rules": {"G1": "local CPU canonical rig, no GPU, nothing downloaded, disk 74 GB free", "G2": "physical fixture_B / fixture_A / fixture_R only, no synthetic proxy", "G3": "retired families untouched", "G4": "every arm paired in-rig on the SAME 20 seeds", "G5": "timeout 1200 on every arm + anchored pgrep kill only", "G6": "JSONL appended via the json.loads helper, worklog append-only, artifacts committed", "G7": "no teleport, no arithmetic on coverage/success, no predicted-score claim, no unvalidated row, no novelty_score"}, "artifacts": ["results/aegis_v2/N214_r363_*.jsonl (35 arms)", "results/aegis_v2/N214_r363_audit.txt", "experiments/N214_pad_footprint_audit.py (9 claim groups as asserts, all pass)", "experiments/N214_pad_footprint_axis.sh"], "reporting_rule_added": "quote the head's r_eff AND mass beside every coverage number, as N211 requires for the kernel, N212 for the tick budget and N208b for the force", "synthetic_proxy": null}}
