{"run": 413, "idea": "FACC-ITER40", "segment": 15, "status": "discard", "timestamp": "2026-10-01T13:00:00Z", "metrics": {"idea": "FACC-ITER40", "fixture_A_transfer_success": null, "fixture_B_transfer_success": null, "fixture_R_transfer_success": null, "fixture_B_coverage_cont": null, "transfer_success": null, "compare_champion": "trochoid (B=1.00, Fisher p=0.0083 vs raster)", "compare_keep": false, "welch_p": null, "fisher_p": null, "seeds": 0, "physical_rig_invoked": false, "rig_path": null, "synthetic_proxy_used_for_verdict": false, "metric_class": "physical_evidence_cited_only", "predicted_score": 76, "predicted_only": true, "unvalidated_cap_used_for_this_idea": false, "prior_unvalidated_runs": [408, 411], "retired_family": "eq78/N70-N76/manifold-switch/flow-bridge/energy-gated/SE3-affordance/FACC-EB (G3 permanent)", "g3_applies": true, "g7_integrity": true, "banned_phrases_present": false, "disk_gb_free_approx": 74, "spend_down_note": "CPU only; no GPU booking; no deferred/remote/same-dependency phrases"}, "notes": "Director iter 40 (single-brain fallback opencode-responses/muse-spark-1.3-contributor-free): build FACC \u2014 SE(3)-conditioned energy-based in-context attention over contact force replaces pi0 flow-matching expert; affordance as dynamic equivalence class; bridge flow-match -> affordance-equivalence. Queue \u00a71 empty since run 309 (I4/I6/I20 done); N198 open_needs_director. G3 retirement binds permanently (N70-N76/eq78/manifold-switch/flow-bridge/energy-gated/re-derivations/frozen champion N74 92.3). Prior FACC family physical 20-seed B=0.22855 (run 407) and replay B=1.00 delta 0 Fisher p=1.0 (run 409) \u2014 zero gain vs trochoid B=1.00. Unvalidated cap already consumed at runs 408/411 (FACC/N198) per G7 \u2014 second screen not permitted; this row is proposal-reject, not screening. Canonical rig kaggle_aegis_sweep.py (N200 audit) has 0 injectable stiffness/wrench/energy/affordance/SE3/EBM knob; no mechanism to evaluate FACC. No canonical sweep launched; no synthetic_proxy verdict; compare record not executed (no mechanism); keep bar unreachable. No arithmetic scaling/teleport of coverage or success; physics contacts evaluated only if run (not run). Cleanup: pgrep anchored kill no-op (no python3 kaggle_aegis_sweep.py running). Commit appended.", "compare": true, "compare_baseline": "trochoid", "compare_env": "", "strategy_graph_node": "FACC-ITER40", "strategy_graph_edge_from": "director_decision_iter40", "strategy_graph_edge_type": "director-input / discarded / G3-replay-blocked / no-hook", "equations_updated": false, "worklog_lines_added": 1, "commit_message": "FACC-ITER40: discard \u2014 G3 retirement + queue empty + no rig hook + unvalidated cap used + prior B delta 0 vs trochoid; no new sweep; no fabrication"}
{"run": 414, "idea_id": "FACC-ITER42", "segment": 15, "status": "discard", "metrics": {"idea": "FACC-ITER42", "fixture_B_transfer_success": null, "coverage_cont": null, "compare_keept": false, "compare_fisher_p": null, "compare_welch_p": null, "reason": "replay-reject: FACC family already discarded r413 (run 413, B=0.22855->replay 1.00 no gain); queue empty; N198 director-owned; canonical rig not invoked; G7 replay cap and G1 no-deferred rule prevent new screen", "canonical_rig": "experiments/kaggle_aegis_sweep.py NOT invoked", "seeds": 0, "synthetic_proxy": false}, "compare": null, "notes": "pony-tail: no new code, no rig launch, replay of director iter 42 proposal already handled at r413; no queued idea since 309; N198 open_needs_director"}
{"run": 43, "idea": "FACC-ITER43-muse-spark-1.3", "status": "discard", "segment": 15, "frontier": "Force-Adaptive Contact Control (FACC) \u2014 SE(3)-conditioned EBM policy replaces pi0 flow-match head", "physical": false, "rig_invoked": false, "rig_invoked_reason": "N200 audit: no stiffness/wrench/affordance/energy/SE3 knob in kaggle_aegis_sweep.py; replay blocked; G3 retirement binds (N70-N76/eq78/manifold-switch/energy-gated/flow-bridge)", "fixture_B_transfer_success": null, "compare_baseline": "trochoid (champion B=1.00 Fisher p=0.0083)", "compare_keep": false, "predicted_score": 78, "predicted_only": true, "evidence": "results/aegis_v2/run_iter43_facc_replay.jsonl; prior physical r407 B=0.22855 (discard), r409 B=1.00 delta0 Fisher p=1.0 vs trochoid (discard)", "g3_bind": true, "unvalidated_cap_consumed": true, "note": "Replay of retired family; no new 20-seed decider possible without rig change; discard per G3+G4+G7; no deprecated/deferred/remote-GPU/same-dependency language; anchored cleanup; disk>10G", "timestamp": "2026-10-01T12:55:00Z", "metrics": {"idea": "FACC-ITER43", "fixture_A_success": null, "fixture_B_success": null, "fixture_R_success": null, "coverage_cont": null, "compare_welch_p": null, "compare_fisher_p": null}, "strategy_graph_ref": "N413/N414/N198 -> iter43 replay discard"}
{"run": 44, "idea": "FACC-ITER44", "segment": 15, "status": "discard", "timestamp": "2026-10-01T13:01:00Z", "metrics": {"idea": "FACC-ITER44", "fixture_A_transfer_success": null, "fixture_B_transfer_success": null, "fixture_R_transfer_success": null, "fixture_B_coverage_cont": null, "transfer_success": null, "compare_champion": "trochoid (B=1.00 Fisher p=0.0083 vs raster)", "compare_keep": false, "welch_p": null, "fisher_p": null, "seeds": 0, "physical_rig_invoked": false, "rig_path": null, "synthetic_proxy_used_for_verdict": false, "metric_class": "physical_evidence_cited_only", "predicted_score": 78, "predicted_only": true, "unvalidated_cap_used_for_this_idea": true, "prior_unvalidated_runs": [43], "retired_family": "eq78/N70-N76/manifold-switch/flow-bridge/energy-gated/SE3-affordance/FACC-EB (G3 permanent)", "g3_applies": true, "g7_integrity": true, "banned_phrases_present": false, "disk_gb_free_approx": 74, "spend_down_note": "CPU only; no GPU booking; no deferred/remote/same-dependency phrases"}, "compare": true, "compare_baseline": "trochoid", "compare_env": "", "strategy_graph_node": "FACC-ITER44", "strategy_graph_edge_from": "director_decision_iter44", "strategy_graph_edge_type": "director-input / discarded / G3-replay-blocked / no-hook", "equations_updated": false, "worklog_lines_added": 1, "commit_message": "FACC-ITER44: discard \u2014 G3 retirement + queue empty + no rig hook + unvalidated cap used + prior B delta 0 vs trochoid; no new sweep; no fabrication"}
{"run": 415, "status": "discard", "metrics": {"idea": "FACC-N200-replay", "fixture_B": null, "fixture_A": null, "fixture_R": null, "coverage_cont": null, "compare": null, "synthetic_proxy": null, "note": "G3 retirement binds (eq78/energy-gated/N70-N76/manifold-flow-bridge); canonical rig kaggle_aegis_sweep.py has 0 injectable stiffness/wrench/affordance/SE3/EBM knob; unvalidated cap already consumed by prior screenings r43/r44; no 20-seed paired decider launched; N198 open_needs_director unchanged"}, "strategy_node": "N415", "strategy_edge": "E415->N198", "timestamp": "2026-10-01T13:03:00Z"}
{"run": 416, "idea": "FACE-P", "status": "discard", "timestamp": "2026-10-01T07:35:04Z", "metrics": {"idea": "FACE-P", "fixture_A": {"transfer_success": 1.0, "coverage_cont": 1.0, "seeds": 3}, "fixture_B": {"transfer_success": 1.0, "coverage_cont": 1.0, "seeds": 3, "friction_sample": [0.6455, 0.4224, 0.0749]}, "fixture_R": null, "compare": "", "p_welch_coverage_cont": null, "p_fisher_success": null, "phys_rig": "experiments/kaggle_aegis_sweep.py", "backend": "pybullet", "seeds": 3, "screening_only": true, "note": "FACE-P (SE(3) energy-attention / deformable affordance) not implemented in canonical rig; rigor requires stiffness sweep + manifold-shift + energy-vs-vanilla ablation (G7). No physical evidence for claimed >5% over pi0+FACC. Baseline fixture_B at 3 seeds = 1.0/1.0 but not generalizable without 20 seeds and paired champion (trochoid). Status discard per protocol."}, "novelty_score": null, "notes": "Director proposal (iter 46, muse-spark-1.3). Predicted 78/100 unverified. Fail condition (stiffness sweep <5% over pi0+FACC) inoperable without policy integration."}
{"run": 417, "idea": "FACC-SE3-DIRECTOR-ITER1 + FROZEN-CHAMPION-RECERT", "segment": 15, "status": "discard", "timestamp": "2026-10-01T13:20:00Z", "metric": null, "metric_name": "fixture_B transfer_success (coverage_cont >= 0.90 per episode), canonical rig, 20 seeds x 3 suites, paired arms, pose_noise 0,0", "metric_class": "physical", "director_decision": {"iteration": 1, "idea": "FACC-SE3 - SE(3)-conditioned Force-Adaptive Contact Control replacing the pi0 flow head", "predicted_score": 76, "executed": false, "exclusion_reasons": ["G3 permanent retirement: eq78/N70-N76/manifold-switch/flow-bridge/energy-gated + SE(3)-affordance re-derivations; FACC family physically closed (r407 B=0.22855, r409 replay B=1.00 delta 0 Fisher p=1.0) and adjudicated-not-executed at r312/r322/r335/r339/r410/r412/r413/r414/r415", "G4 unpairable: PATH_MODES = raster/rounded/trochoid/spiral/fitted/fitro/orbit/auto contain no pi0 VLM, no SE(3) action expert, no EBM/wrench head; N200 audit = 0 injectable stiffness/wrench/energy/affordance/SE3 knob", "ideas.md section 1 + section 4 have no queued row (all v3/v4 done since run 309); lowest queued = none", "N198 (B-anchored bar vs saturated metric) is open_needs_director; a worker may not move the primary metric or open a segment", "G7 predicted-only scores may not set status"]}, "physical_action_taken": "frozen-champion re-certification in the canonical rig (the only non-replay physical work available: no queued idea, no rig hook)", "rig": "python3 experiments/kaggle_aegis_sweep.py --seeds 20 --no-upload --path trochoid --compare raster --suites fixture_A,fixture_B,fixture_R --out results/aegis_v2/r417_frozen_champion_recert_trochoid_vs_raster.jsonl", "rig_invoked": true, "rig_exit": 0, "rig_seconds": 17.5, "episodes": 120, "harness_errors": 0, "pts_source": "physics_contact (coverage_cont/success recomputed from physics contacts at return time; no teleport, no arithmetic coverage)", "pose_noise_cfg": "0,0", "evidence": "results/aegis_v2/r417_frozen_champion_recert_trochoid_vs_raster.jsonl", "compare": {"champion": "trochoid", "baseline": "raster", "metric": "coverage_cont", "fixture_A": {"n_a": 20, "n_b": 20, "mean_a": 1.0, "mean_b": 1.0, "succ_a": 20, "succ_b": 20, "fisher_p": 1.0, "welch_p": null}, "fixture_B": {"n_a": 20, "n_b": 20, "mean_a": 1.0, "mean_b": 1.0, "succ_a": 20, "succ_b": 20, "fisher_p": 1.0, "welch_p": null}, "fixture_R": {"n_a": 20, "n_b": 20, "mean_a": 1.0, "mean_b": 1.0, "succ_a": 20, "succ_b": 20, "fisher_p": 1.0, "welch_p": null}, "keep": false, "keep_rule": ">=20 seeds AND B transfer_success > 0.70 AND (Welch p<0.01 coverage OR Fisher p<0.01 success) AND no coverage regression", "keep_reason": "bar MET on the candidate (B 20/20, coverage_cont 1.0000) but UNDISCRIMINATING: the paired baseline raster is also 20/20 at 0,0 under the shipped I22 row-centring default, so delta = 0 and no p-value can be < 0.01. Independent reproduction of run 350 (B/A/R 1.0/1.0, fisher 1.0, keep=false) and of N198's premise that the B-anchored bar has no dynamic range - now shown for BOTH arms, not only the candidate."}, "metrics": {"idea": "FACC-SE3-DIRECTOR-ITER1 + FROZEN-CHAMPION-RECERT", "fixture_B_transfer_success": 1.0, "fixture_A_transfer_success": 1.0, "fixture_R_transfer_success": 1.0, "coverage_cont": 1.0, "seeds": 20, "episodes": 120, "harness_errors": 0, "compare_keep": false, "fisher_p_B": 1.0, "welch_p_B": null, "physical_rig": "python3 experiments/kaggle_aegis_sweep.py (PyBullet DIRECT, system python3, rig_version 2, friction U[0.05,0.80], gate_mode=post-hoc)", "synthetic_proxy": null, "metric_class": "physical", "pose_noise_cfg": "0,0", "rig_invoked": true, "rig_edited": false, "rig_bytes_changed": 0, "banned_phrases_checked": true, "cleanup_anchored": true, "disk_gb_free": 8.7, "disk_note": "8.7 GB free is BELOW the 10 GB floor; purged pip cache + /tmp/cache_* (was no-op); largest local dirs are checkpoints/ 1.7 GB and connect_gpu/ 945 MB, both outside this iteration's scope", "g7_integrity": "no teleport; no arithmetic coverage/success; no synthetic_proxy status; predicted 76 never used as evidence", "unvalidated_cap": "unchanged (not a screening; no 3-seed screen launched)"}, "gates_unchanged": {"segment": 15, "primary_metric": "transfer_success", "tier4_gate": "post-hoc tag, untouched", "no_new_segment": true, "no_metric_move": true}, "verdict": "DISCARD - director proposal not executed (G3 retirement + no rig hook + queue empty + N198 director-owned + predicted-only banned). The iteration's physical content is a frozen-champion re-certification: B/A/R 20/20 at 0,0, 120 episodes, 0 harness errors, compare.keep=false because BOTH arms sit at the ceiling.", "notes": "Iteration boundary. Queue empty since run 309 (I4/I6/I20 closed 241/244/245). N198 remains open_needs_director with NINE prior supports-option-b lines (N207c/N208b/N209a/N210/N211a/N212a/N213d/N214b/N215); this run adds a TENTH and the only one measured on the PAIRED BASELINE arm: raster is 20/20 at 0,0, so the G4 rule has zero dynamic range on B from either side. Director recommendation unchanged: option (a) certify across A/B/R and stop, (b) re-anchor the bar off fixture_B onto the yaw term (N193/N201: the only real defect, provably a no-op on B), or (c) close the segment. No gate change (gate-on vs gate-off not compared: no candidate)."}
{"run": 418, "idea": "FACC-SE3-DIRECTOR-ITER2 + POSE-NOISE-PAIRED-LADDER", "segment": 15, "status": "discard", "timestamp": "2026-10-01T14:05:00Z", "metric": 1.0, "metric_name": "fixture_B transfer_success (coverage_cont >= 0.90 per episode), canonical rig, 100 seeds x 3 suites x 2 paired arms, pose_noise 0,0 (primary) + 0.01,2 + 0.03,6 ladder", "metric_class": "physical", "director_decision": {"iteration": 2, "idea": "FACC - SE(3)-conditioned energy-based controller replacing the flow-matching head", "predicted_score": 76, "executed": false, "exclusion_reasons": ["G3 permanent retirement: eq78/N70-N76/manifold-switch/flow-bridge/energy-gated + SE(3)-affordance; FACC adjudicated-not-executed at r312/r322/r409/r410/r412/r413/r414/r415/r417 and discarded at r407 (B=0.22855) and r416", "G4 unpairable: PATH_MODES (raster/rounded/trochoid/spiral/fitted/fitro/orbit/auto) carry no pi0/SE(3)/EBM/wrench/stiffness hook; N200 audit = 0 injectable knob", "ideas.md sections 1+4 have no queued row (all v3/v4 done since run 309)", "N198 open_needs_director; a worker may not move the primary metric, a gate or the segment", "G7 predicted-only score may not set status"]}, "physical_action_taken": "pose-noise PAIRED LADDER of the frozen champion against the scripted baseline at all three canonical noise levels, 100 seeds x 3 suites x 2 arms = 1800 episodes, to test section 0's pre-I22 champion claim ('trochoid B success 1.00, Fisher p=0.0083 vs raster') against the SHIPPED I22 row-centring default, which run 417 showed had lifted raster to ceiling", "rig": "AEGIS_POSE_NOISE={0,0|0.01,2|0.03,6} timeout 1200 python3 experiments/kaggle_aegis_sweep.py --seeds 100 --no-upload --path trochoid --compare raster --suites fixture_A,fixture_B,fixture_R --out results/aegis_v2/r418_*.jsonl", "rig_invoked": true, "rig_exit": 0, "rig_seconds": [40.7, 54.9, 44.0], "episodes": 1800, "harness_errors": 0, "rig_bytes_changed": 0, "pts_source": "physics_contact (coverage_cont/success exactly as the rig computed them from physics contacts at return time; paired p re-read from the rig's own compare record via the identical scipy ttest_rel; no teleport, no arithmetic coverage, no synthetic proxy)", "pose_noise_cfg": "0,0|0.01,2|0.03,6", "evidence": ["results/aegis_v2/r418_n100_noise000.jsonl", "results/aegis_v2/r418_n100_noise0102.jsonl", "results/aegis_v2/r418_champion_vs_raster_noise0306_n100.jsonl"], "arm_convention": "compare record: mean_a/succ_a = BASELINE (raster), mean_b/succ_b = CANDIDATE (trochoid), delta = b - a (kaggle_aegis_sweep.py:2686-2691). a/b are positional indices, NOT candidate/baseline.", "metrics": {"idea": "FACC-SE3-DIRECTOR-ITER2 + POSE-NOISE-PAIRED-LADDER", "fixture_B": {"transfer_success": 1.0, "coverage_cont": 1.0, "seeds": 100, "pose_noise_cfg": "0,0"}, "fixture_A": {"transfer_success": 1.0, "coverage_cont": 1.0, "seeds": 100, "pose_noise_cfg": "0,0"}, "fixture_R": {"transfer_success": 1.0, "coverage_cont": 1.0, "seeds": 100, "pose_noise_cfg": "0,0"}, "coverage_cont": 1.0, "ladder_100seed_candidate_trochoid_minus_baseline_raster": {"0,0": {"A": {"covc": [1.0, 1.0], "delta": 0.0, "W_T_L": [0, 100, 0], "succ": [100, 100], "welch_p": null, "fisher_p": 1.0, "paired_p": null}, "B": {"covc": [1.0, 1.0], "delta": 0.0, "W_T_L": [0, 100, 0], "succ": [100, 100], "welch_p": null, "fisher_p": 1.0, "paired_p": null}, "R": {"covc": [1.0, 1.0], "delta": 0.0, "W_T_L": [0, 100, 0], "succ": [100, 100], "welch_p": null, "fisher_p": 1.0, "paired_p": null}, "bit_identical_paired_episodes": "300/300 coverage AND success identical per seed"}, "0.01,2": {"A": {"covc": [0.9969, 0.9935], "delta": -0.0033, "W_T_L": [2, 79, 19], "succ": [99, 99], "welch_p": 0.1639, "paired_p": 0.001109}, "B": {"covc": [0.9973, 0.9958], "delta": -0.0016, "W_T_L": [3, 84, 13], "succ": [99, 100], "welch_p": 0.4388, "paired_p": 0.199}, "R": {"covc": [0.9964, 0.9931], "delta": -0.0033, "W_T_L": [4, 79, 17], "succ": [99, 99], "welch_p": 0.1649, "paired_p": 0.009527}}, "0.03,6": {"A": {"covc": [0.9232, 0.922], "delta": -0.0012, "W_T_L": [30, 24, 46], "succ": [71, 74], "welch_p": 0.9266, "paired_p": 0.6318}, "B": {"covc": [0.8783, 0.9025], "delta": 0.0242, "W_T_L": [61, 26, 13], "succ": [56, 64], "welch_p": 0.1606, "paired_p": 1.475e-09, "discordant_success_trochoid_only": 8, "raster_only": 0}, "R": {"covc": [0.8758, 0.8945], "delta": 0.0187, "W_T_L": [55, 25, 20], "succ": [53, 63], "welch_p": 0.3001, "paired_p": 1.748e-06, "discordant_success_trochoid_only": 11, "raster_only": 1}}}, "compare": "keep=false on all three levels and both arms (rig field). 20-seed deciders r418_champion_vs_raster_noise0306.jsonl / _noise0102.jsonl also keep=false.", "p_welch_coverage_cont_B": {"0,0": null, "0.01,2": 0.4388, "0.03,6": 0.1606}, "p_fisher_success_B": {"0,0": 1.0, "0.01,2": 1.0, "0.03,6": 0.3123}, "p_paired_coverage_cont_B": {"0,0": null, "0.01,2": 0.199, "0.03,6": 1.475e-09}, "unvalidated_cap": "not touched - no screening row; all four runs are >= 20-seed paired physical runs", "gate_on_vs_gate_off": "GATE-ON (shipped, reads welch_p OR fisher_p) = keep:false at all three levels. GATE-OFF counterfactual (reads the rig's own paired_p < 0.01 instead, delta >= -0.005) = keep:false as well, because B transfer_success at 0.03,6 is 0.64 <= the 0.70 floor. Reported for the director only; no gate, metric or segment byte was changed and no keep is claimed.", "synthetic_proxy": null, "note": "Three findings. (1) At pose noise 0,0 the champion and the raster baseline are not merely tied in aggregate: all 300 paired episodes are BIT-IDENTICAL in coverage_cont and success under the shipped I22 row-centring default, so the frozen primary axis carries ZERO paired signal and no statistic can separate the two paths there. This supersedes section 0's pre-I22 claim that trochoid beats raster on B at Fisher p=0.0083. (2) The champion's real, large advantage lives ONLY at 0.03,6 (+0.0242 coverage_cont and +8 success points on B, 8-0 discordant success pairs; +0.0187 / +10 on R, 11-1), where it is overwhelmingly significant PAIRED (p 1.5e-09 B, 1.7e-06 R) and invisible to the bar G4 defines (Welch p 0.16 / 0.30, Fisher p 0.31 / 0.20). (3) The pose-noise axis has a SIGN FLIP, not a monotone degradation: raster is significantly BETTER at 0.01,2 on A (paired p 0.0011) and R (paired p 0.0095). Consequence for the director: option (b) needs BOTH re-anchoring off fixture_B AND switching the read statistic from unpaired to paired, because the arms are paired by construction (identical seeds -> identical friction draw, tool_id and customer fixture) and between-seed variance from friction U[0.05,0.80] plus the tool alias swamps an arm effect of 0.024. Eleventh independent line for N198; recommendation only, no queue row opened (ideas.md is director-owned)."}, "verdict": "DISCARD (director proposal not executed: G3 + no rig hook + queue empty + N198 director-owned + predicted-score banned). Physical contribution = the pose-noise paired ladder above, which is a characterization, not a keep."}
