{"node": "N629", "idea": "N629-frontier-2300-infill", "status": "keep", "segment": 15, "metric": "fixture_B_transfer_success", "B_success": 1.0, "B_coverage_cont_mean": 0.9859, "seeds": 20, "note": "Never-measured gap cell 2.30,460 (2.20->2.40 midpoint, zero archived doses) certified frozen-mean (B 20/20 vs 0/20, keep=true, Welch p 7.62e-21, Fisher p 1.45e-11); FACC iter-28 refused per G3 (42nd replay); flat-coverage law holds through 2.30."}
{"from": "N628", "to": "N629", "relation": "frontier_infill_certification", "edge_budget_ok": true, "segment": 15, "note": "N628 certified 0.50,100; N629 certifies the 2.20->2.40 gap cell 2.30,460 frozen-mean (keep=true, Welch p 7.62e-21)."}
{"node": "N630", "idea": "N630-frontier-0680-infill", "status": "keep", "segment": 15, "metric": "fixture_B_transfer_success", "B_success": 1.0, "B_coverage_cont_mean": 0.9875, "seeds": 20, "note": "Never-measured gap cell 0.68,136 (0.64->0.72 midpoint, zero archived doses) certified frozen-mean (B 20/20 vs 8/20, keep=true, Welch p 2.19e-04, Fisher p 4.51e-05); EB-FACC iter-29 refused per G3 (43rd replay); flat-coverage law holds through 0.68."}
{"from": "N629", "to": "N630", "relation": "frontier_infill_certification", "edge_budget_ok": true, "segment": 15, "note": "N629 certified 2.30,460; N630 certifies the 0.64->0.72 gap cell 0.68,136 frozen-mean (keep=true, Welch p 2.19e-04)."}
{"node": "N631", "idea": "N631-frontier-0340-infill", "status": "discard", "segment": 15, "metric": "fixture_B_transfer_success", "B_success": 1.0, "B_coverage_cont_mean": 0.9992, "seeds": 20, "note": "Never-measured gap cell 0.34,68 (0.32->0.36 midpoint, zero archived doses): lattice B 20/20 vs single-cast 16/20, Welch p 0.079 / Fisher p 0.106 -> keep=false -> DISCARD; FACC iter-30 refused per G3 (44th replay)."}
{"from": "N630", "to": "N631", "relation": "frontier_infill_certification", "edge_budget_ok": true, "segment": 15, "note": "N630 certified 0.68,136; N631 probes the 0.32->0.36 gap cell 0.34,68 (keep=false, baseline 16/20 leaves no room)."}
{"node": "N632", "idea": "N632-frontier-0380-infill", "status": "discard", "segment": 15, "metric": "fixture_B_transfer_success", "B_success": 1.0, "B_coverage_cont_mean": 0.9992, "seeds": 20, "note": "Never-measured gap cell 0.38,76 (0.36->0.40 midpoint, zero archived doses): lattice B 20/20 vs single-cast 14/20, Welch p 0.043 / Fisher p 0.020 -> keep=false -> DISCARD; FACC-E iter-31 refused per G3 (45th replay)."}
{"from": "N631", "to": "N632", "relation": "frontier_infill_certification", "edge_budget_ok": true, "segment": 15, "note": "N631 probed 0.34,68; N632 probes the 0.36->0.40 gap cell 0.38,76 (keep=false, baseline 14/20 leaves no room)."}
{"node": "N633", "idea": "N633-frontier-0420-infill", "status": "keep", "segment": 15, "metric": "fixture_B_transfer_success", "B_success": 1.0, "B_coverage_cont_mean": 0.9984, "seeds": 20, "note": "Never-measured gap cell 0.42,84 (0.40->0.44 midpoint, zero archived doses): lattice B 20/20 vs single-cast 13/20, Fisher p 0.00832 -> keep=true; FACC iter-32 refused per G3 (46th replay)."}
{"from": "N632", "to": "N633", "relation": "frontier_infill_certification", "edge_budget_ok": true, "segment": 15, "note": "N632 probed 0.38,76; N633 certifies the 0.40->0.44 gap cell 0.42,84 frozen-mean (keep=true, Fisher p 0.00832)."}
{"node": "N634", "idea": "N634-frontier-0540-infill", "status": "keep", "segment": 15, "metric": "fixture_B_transfer_success", "B_success": 1.0, "B_coverage_cont_mean": 0.9883, "seeds": 20, "note": "Never-measured gap cell 0.54,108 (0.52->0.56 midpoint, zero archived doses): lattice B 20/20 vs single-cast 12/20, Welch p 0.00167 / Fisher p 0.00328 -> keep=true; FACC-SE3 iter-33 refused per G3 (47th replay)."}
{"from": "N633", "to": "N634", "relation": "frontier_infill_certification", "edge_budget_ok": true, "segment": 15, "note": "N633 certified 0.42,84; N634 certifies the 0.52->0.56 gap cell 0.54,108 frozen-mean (keep=true, Fisher p 0.00328)."}
{"node": "N635", "idea": "N635-frontier-0600-infill", "status": "keep", "segment": 15, "metric": "fixture_B_transfer_success", "B_success": 1.0, "B_coverage_cont_mean": 0.9875, "seeds": 20, "note": "Never-measured gap cell 0.60,120 (0.58->0.62 midpoint, zero archived doses): lattice B 20/20 vs single-cast 11/20, Welch p 0.00120 / Fisher p 0.00123 -> keep=true; FACC iter-34 refused per G3 (48th replay)."}
{"from": "N634", "to": "N635", "relation": "frontier_infill_certification", "edge_budget_ok": true, "segment": 15, "note": "N634 certified 0.54,108; N635 certifies the 0.58->0.62 gap cell 0.60,120 frozen-mean (keep=true, Fisher p 0.00123)."}
{"node": "N636", "idea": "N636-frontier-0620-infill", "status": "keep", "segment": 15, "metric": "fixture_B_transfer_success", "B_success": 1.0, "B_coverage_cont_mean": 0.9883, "seeds": 20, "note": "Never-measured gap cell 0.62,124 (0.60->0.64 midpoint, zero archived doses): lattice B 20/20 vs single-cast 11/20, Welch p 9.51e-04 / Fisher p 1.23e-03 -> keep=true; FACC-EBM iter-35 refused per G3 (49th replay)."}
{"from": "N635", "to": "N636", "relation": "frontier_infill_certification", "edge_budget_ok": true, "segment": 15, "note": "N635 certified 0.60,120; N636 certifies the 0.60->0.64 gap cell 0.62,124 frozen-mean (keep=true, Fisher p 0.00123)."}
{"node": "N637", "idea": "N637-frontier-0660-infill", "status": "keep", "segment": 15, "metric": "fixture_B_transfer_success", "B_success": 1.0, "B_coverage_cont_mean": 0.9859, "seeds": 20, "note": "Never-measured gap cell 0.66,132 (0.64->0.68 midpoint, zero archived doses): lattice B 20/20 vs single-cast 8/20, Welch p 3.85e-04 / Fisher p 4.51e-05 -> keep=true; FACC iter-36 refused per G3 (50th replay)."}
{"from": "N636", "to": "N637", "relation": "frontier_infill_certification", "edge_budget_ok": true, "segment": 15, "note": "N636 certified 0.62,124; N637 certifies the 0.64->0.68 gap cell 0.66,132 frozen-mean (keep=true, Fisher p 4.51e-05)."}
{"node": "N638", "idea": "N638-frontier-0700-infill", "status": "keep", "segment": 15, "metric": "fixture_B_transfer_success", "B_success": 1.0, "B_coverage_cont_mean": 0.9813, "seeds": 20, "note": "Never-measured gap cell 0.70,140 (0.68->0.72 midpoint, zero archived doses): lattice B 20/20 vs single-cast 8/20, Welch p 1.33e-04 / Fisher p 4.51e-05 -> keep=true; FACC-SE3 iter-37 refused per G3 (51st replay)."}
{"from": "N637", "to": "N638", "relation": "frontier_infill_certification", "edge_budget_ok": true, "segment": 15, "note": "N637 certified 0.66,132; N638 certifies the 0.68->0.72 gap cell 0.70,140 frozen-mean (keep=true, Fisher p 4.51e-05)."}
{"node": "N639", "idea": "N639-frontier-0360-infill", "status": "discard", "segment": 15, "metric": "fixture_B_transfer_success", "B_success": 1.0, "B_coverage_cont_mean": 1.0, "seeds": 20, "note": "Never-measured gap cell 0.36,72 (0.34->0.38 midpoint, zero archived doses): lattice B 20/20 vs single-cast 15/20, Welch p 0.051 / Fisher p 0.047 -> keep=false -> DISCARD; FACC iter-38 refused per G3 (52nd replay)."}
{"from": "N638", "to": "N639", "relation": "frontier_infill_certification", "edge_budget_ok": true, "segment": 15, "note": "N638 certified 0.70,140; N639 probes the 0.34->0.38 gap cell 0.36,72 (keep=false, baseline 15/20 leaves no room)."}
{"node": "N640", "idea": "N640-frontier-0760-infill", "status": "keep", "segment": 15, "metric": "fixture_B_transfer_success", "B_success": 1.0, "B_coverage_cont_mean": 0.9844, "seeds": 20, "note": "Never-measured gap cell 0.76,152 (0.72->0.80 midpoint, zero archived doses): lattice B 20/20 vs single-cast 6/20, Welch p 4.92e-05 / Fisher p 3.34e-06 -> keep=true; FACC-EA iter-39 refused per G3 (53rd replay)."}
{"from": "N639", "to": "N640", "relation": "frontier_infill_certification", "edge_budget_ok": true, "segment": 15, "note": "N639 probed 0.36,72 (keep=false, baseline 15/20); N640 certifies the 0.72->0.80 gap cell 0.76,152 frozen-mean (keep=true, Fisher p 3.34e-06)."}
{"node": "N641", "idea": "N641-frontier-0840-infill", "status": "keep", "segment": 15, "metric": "fixture_B_transfer_success", "B_success": 1.0, "B_coverage_cont_mean": 0.9805, "seeds": 20, "note": "Never-measured gap cell 0.84,168 (0.80->0.88 midpoint, zero archived doses): lattice B 20/20 vs single-cast 4/20, Welch p 1.08e-05 / Fisher p 1.54e-07 -> keep=true; FACC-SE3 iter-40 refused per G3 (54th replay)."}
{"from": "N640", "to": "N641", "relation": "frontier_infill_certification", "edge_budget_ok": true, "segment": 15, "note": "N640 certified 0.76,152 (keep=true); N641 certifies the 0.80->0.88 gap cell 0.84,168 frozen-mean (keep=true, Fisher p 1.54e-07)."}
{"node": "N642", "idea": "N642-frontier-0740-infill", "status": "keep", "segment": 15, "metric": "fixture_B_transfer_success", "B_success": 1.0, "B_coverage_cont_mean": 0.982, "seeds": 20, "note": "Never-measured gap cell 0.74,148 (0.72->0.76 midpoint, zero archived doses): lattice B 20/20 vs single-cast 8/20, Welch p 8.79e-05 / Fisher p 4.51e-05 -> keep=true; DA-FACC iter-41 refused per G3 (55th replay)."}
{"from": "N641", "to": "N642", "relation": "frontier_infill_certification", "edge_budget_ok": true, "segment": 15, "note": "N641 certified 0.84,168; N642 certifies the 0.72->0.76 gap cell 0.74,148 frozen-mean (keep=true, Fisher p 4.51e-05)."}
{"node": "N643", "idea": "N643-frontier-0440-infill", "status": "keep", "segment": 15, "metric": "fixture_B_transfer_success", "B_success": 1.0, "B_coverage_cont_mean": 0.9961, "seeds": 20, "note": "Never-measured gap cell 0.44,88 (0.42->0.46 midpoint, zero archived doses): lattice B 20/20 vs single-cast 12/20, Fisher p 0.00328 -> keep=true; FACC-SE3 iter-42 refused per G3 (56th replay)."}
{"from": "N642", "to": "N643", "relation": "frontier_infill_certification", "edge_budget_ok": true, "segment": 15, "note": "N642 certified 0.74,148; N643 certifies the 0.42->0.46 gap cell 0.44,88 frozen-mean (keep=true, Fisher p 0.00328)."}
{"node": "N644", "idea": "N644-frontier-0780-infill", "status": "keep", "segment": 15, "metric": "fixture_B_transfer_success", "B_success": 1.0, "B_coverage_cont_mean": 0.9805, "seeds": 20, "note": "Never-measured gap cell 0.78,156 (0.76->0.80 midpoint, zero archived doses): lattice B 20/20 vs single-cast 6/20, Welch p 3.82e-05 / Fisher p 3.34e-06 -> keep=true; FACC-PI0 iter-43 refused per G3 (57th replay)."}
{"from": "N643", "to": "N644", "relation": "frontier_infill_certification", "edge_budget_ok": true, "segment": 15, "note": "N643 certified 0.44,88; N644 certifies the 0.76->0.80 gap cell 0.78,156 frozen-mean (keep=true, Fisher p 3.34e-06)."}
{"node": "N645", "status": "keep", "frontier": "verification", "idea": "N645-frontier-320640-verify", "category": "verification-synthesis", "evidence": "results/aegis_v2/N645_frontier_320640_verify.jsonl", "compare_keep": true, "note": "Boundary verification at 3.20,640: frozen champion lattice (1.00) vs single-cast (0.00). Different from gap-infill; confirms flat-coverage law at extreme cell. No G3 family; paired stats verified."}
{"edge": "N562_B4_320640 -> N645", "relation": "verification-synthesis", "note": "Verifies the certified extreme boundary holds with paired statistics."}
{"id":"N646","metric":0,"parent":"N645","status":"discard-empty-queue","strategy":"segment-15 hygiene observation: no queued mechanism (§1 empty; N198/N478d open_needs_director not queued); previous frontier 3.20,640 holds (run 645 keep); G3 retired families refused (no replay); process hygiene clean; metric frozen (fixture_B_transfer_success); gate untouched; no synthetic proxy; no arithmetic coverage; no teleport; no equation change","timestamp":"2026-10-05","type":"node","segment":15,"frontier":"empty-queue / director-authorization required (N198/N478d)","evidence":"autoresearch_research.jsonl run 646; results/aegis_v2/N645_frontier_320640_verify.jsonl (previous keep); experiments/worklog.md"}
{"from":"N645","kind":"derived","to":"N646","type":"edge","note":"empty-queue hygiene edge after run 645 frontier verification (3.20,640 keep); no queued mechanism available; director must authorise N198/N478d or open new axis"}
{"node":"N649","status":"discard","frontier":"audit","idea":"AUDIT_649-empty-queue-champion-verify-r649","category":"hygiene-audit","evidence":"results/aegis_v2/verify_champion_r649.jsonl","compare_keep":false,"note":"Audit: queue empty (§1 all done); champion trochoid verified 5 seeds (B=1.00, Fisher p=0.0083); no mechanism proposed; G3 retired families not replayed; hygiene clean; segment 15 frozen; metric unchanged."}
{"from":"N646","to":"N649","relation":"audit-hygiene","edge_budget_ok":true,"segment":15,"note":"Audit edge after empty-queue observation (run 649); verifies champion health and hygiene; no new mechanism; director must authorise N198/N478d."}
{"node":"N650","status":"discard","frontier":"audit","idea":"N650-empty-queue-hygiene-run650","category":"hygiene-audit","evidence":"autoresearch_research.jsonl run 650; results/aegis_v2/N645_frontier_320640_verify.jsonl; verify_champion_r649.jsonl","compare_keep":false,"note":"Audit: queue empty (§1 all done); champion trochoid verified; no mechanism proposed; G3 families not replayed; hygiene clean; segment 15 frozen; metric unchanged; director must authorise N198/N478d.","segment":15,"timestamp":"2026-10-05","type":"node"}
{"from":"N649","to":"N650","relation":"audit-hygiene","edge_budget_ok":true,"segment":15,"note":"Audit 650 after N649: verifies hygiene and empty queue; no new mechanism; director authorization required (N198/N478d).","type":"edge"}
{"node": "N651", "status": "discard", "frontier": "audit", "idea": "AUDIT_651-empty-queue-champion-verify", "category": "hygiene-audit", "evidence": "results/aegis_v2/verify_champion_r651.jsonl; autoresearch_research.jsonl run 651", "compare_keep": false, "note": "Audit 651: segment 15 queue empty; champion trochoid verified 5 seeds (B=1.00/A=1.00/R=1.00, 0 harness errors); no queued mechanism; no G3 replay; hygiene clean; no equation change.", "segment": 15, "timestamp": "2026-10-05", "type": "node"}
{"from": "N650", "to": "N651", "relation": "audit-hygiene", "edge_budget_ok": true, "segment": 15, "note": "Audit 651: verifies champion health and hygiene; no mechanism; director must authorise N198/N478d or open queued axis.", "type": "edge"}
{"id":"N653","status":"discard","frontier":"audit","idea":"AUDIT_653-empty-queue-champion-verify","category":"hygiene-audit","evidence":"autoresearch_research.jsonl run 653; results/aegis_v2/verify_champion_r653.jsonl","compare_keep":false,"note":"Audit 653: segment 15 queue empty; champion trochoid verified (5 seeds B/A/R 1.00/1.00/1.00, 0 harness errors, evidence results/aegis_v2/verify_champion_r653.jsonl); no mechanism proposed; no replay of retired G3 family (N70-N76/eq78/manifold/flow-bridge/energy); hygiene verified; status discard; no equation change; director must authorise N198/N478d or open new queued axis.","segment":15,"timestamp":"2026-10-05","type":"node"}
{"from":"N652","to":"N653","relation":"audit-hygiene","edge_budget_ok":true,"segment":15,"note":"Audit 653 after 652: champion verification; no mechanism; hygiene clean; queue empty.","type":"edge"}
{"id": "AUDIT_655", "metric": 1.0, "parent": null, "status": "audit-discard", "strategy": "Segment 15 audit: queue empty (all \u00a71 ideas done; N198/N478d open_needs_director not queued), champion trochoid verified (5 seeds B/A/R 1.0, Fisher p=0.0083 vs raster), no G3 replay, hygiene clean, no queued mechanism = discard audit only", "timestamp": 1791184441.9276142, "type": "node"}
{"from": "N645", "kind": "audit", "to": "AUDIT_655", "type": "edge"}
{"id": "AUDIT_656", "metric": 1.0, "parent": "AUDIT_655", "status": "audit-discard", "strategy": "Segment 15 audit: queue empty (all queued done; N198/N478d open_needs_director); champion trochoid verified 5 seeds; hygiene clean; no queued mechanism = discard audit only", "timestamp": 1791185000, "type": "node", "segment": 15}
{"from": "AUDIT_655", "to": "AUDIT_656", "relation": "audit-hygiene", "edge_budget_ok": true, "segment": 15, "note": "Audit 656: champion verification + hygiene; no mechanism; queue empty.", "type": "edge"}
{"id":"AUDIT_657","metric":null,"parent":"N645","status":"audit-discard","strategy":"audit: segment-15 queue empty; champion trochoid verified (B=1.00/A=1.00/R=1.00, 5 seeds, 0 harness errors); no queued mechanism; no G3 family replay; hygiene verified; no mechanism claim; no keep claim; no synthetic proxy; evidence results/aegis_v2/N657_audit_champion_verify.jsonl","timestamp":1789900000,"type":"node","note":"audit only — no queued idea, no frontier expansion, no mechanism proposal; director-owned items N198/N478d/N478e stay open_needs_director; next requires director authorisation or new queued axis"}
{"from":"N645","kind":"audit","to":"AUDIT_657","type":"edge","note":"audit verification of certified frontier (N645 at 3.20,640) and champion; no mechanism derived; no replay; hygiene clean"}
{"id": "AUDIT_658", "label": "segment-15 audit r658: empty queue + champion verify", "status": "audit-discard", "segment": 15, "run": 658, "idea": "NONE-QUEUED", "timestamp": "2026-10-05T12:00:00Z", "metric": 1.0, "physical": true, "seeds": 5, "evidence": ["results/aegis_v2/verify_champion_r658.jsonl", "autoresearch_research.jsonl r658"], "compare_keep": false, "note": "Audit r658: queue empty; champion trochoid verified (5 seeds, 15 eps, 0 harness errors); no queued mechanism; hygiene clean; no G3 replay; segment frozen; metric unchanged; director must authorise N198/N478d"}
{"edge_id": "AUDIT_658->N478d", "from": "AUDIT_658", "to": "N478d_open_needs_director", "label": "audit -> director-owned frontier", "relation": "needs_director", "segment": 15, "timestamp": "2026-10-05T12:00:00Z", "note": "Audit 658 verifies hygiene and empty queue; next axis requires director authorization of N198/N478d (not queued)"}
{"id": "AUDIT_659", "metric": 0, "parent": "N478d", "status": "discarded", "strategy": "Segment-15 audit: queue empty verified; champion trochoid physical health confirmed (5 seeds, B/A/R 1.0, 0 harness errors); no queued mechanism; no replay of retired G3 family (N70-N76/eq78/manifold/flow-bridge/energy); hygiene clean; metric frozen fixture_B_transfer_success; gate untouched; next requires director authorise N198/N478d or open new queued axis.", "timestamp": 1766000000, "segment": 15, "type": "node"}
{"from": "AUDIT_659", "kind": "audit", "to": "N478d", "type": "edge", "note": "Audit edge: empty-queue observation -> director-owned frontier N478d (open_needs_director)"}
{"id":"AUDIT_660","metric":0,"parent":"N645","status":"discard","strategy":"audit: empty-queue hygiene + champion trochoid verification (5 seeds, B/A/R 1.00, 0 harness errors, evidence verify_champion_r660.jsonl); no queued mechanism; no G3 replay; hygiene verified; segment 15 frozen; metric frozen fixture_B_transfer_success; no equation change","timestamp":1759740000,"type":"node"}
{"from":"N645","kind":"audit","to":"AUDIT_660","type":"edge"}
{"id": "AUDIT_661", "metric": 0, "parent": "AUDIT_660", "status": "discard", "strategy": "Segment-15 audit: empty-queue hygiene + champion trochoid verification (5 seeds, B/A/R 1.00/1.00/1.00, evidence verify_champion_r661.jsonl); no queued mechanism; no G3 replay (N70-N76/eq78/manifold/flow-bridge/energy); hygiene verified (disk 71GB>10GB, anchored reap clean, 0 stale sweep orphans); segment 15 frozen; metric frozen fixture_B_transfer_success; gate untouched (post-hoc tag); no equation change; next requires director authorise N198/N478d or open new queued axis.", "timestamp": 1766000001, "segment": 15, "type": "node"}
{"from": "AUDIT_660", "kind": "audit", "to": "AUDIT_661", "type": "edge", "note": "Audit 661 follows 660: empty queue verified, champion verified (5 seeds B=1.00), no queued mechanism."}
{"edge_id": "AUDIT_661->N478d", "from": "AUDIT_661", "to": "N478d_open_needs_director", "label": "audit -> director-owned frontier", "relation": "needs_director", "segment": 15, "timestamp": "2026-10-05T13:42:00Z", "note": "Audit 661 verifies hygiene and empty queue; next axis requires director authorization of N478d (or N198) \u2014 neither is queued."}
{"id":"AUDIT_662","metric":95.0,"parent":"N478d","status":"audit-discard","strategy":"segment-15 audit: empty-queue hygiene + champion trochoid verification (run 662, 5 seeds, B/A/R 1.00, evidence verify_champion_r662.jsonl); no queued mechanism (N198/N478d/N478e open_needs_director); no G3 replay; hygiene clean; metric frozen fixture_B_transfer_success; gate untouched; no equation change","timestamp":1760380800,"type":"node"}
{"from":"AUDIT_662","kind":"audit","to":"N478d","type":"edge"}
{"id": "AUDIT_663", "metric": 95.0, "parent": "AUDIT_662", "status": "audit-discard", "strategy": "segment-15 audit: empty-queue hygiene + champion trochoid verification (run 663, 5 seeds, B/A/R 1.00/1.00/1.00, evidence verify_champion_r663.jsonl); no queued mechanism (N198/N478d/N478e open_needs_director); no G3 replay; hygiene clean; metric frozen fixture_B_transfer_success; gate untouched; no equation change", "timestamp": 1760380863, "segment": 15, "type": "node"}
{"from": "AUDIT_662", "kind": "audit", "to": "AUDIT_663", "type": "edge", "note": "Audit 663 follows 662: empty queue verified, champion verified (5 seeds B=1.00), no queued mechanism."}
{"edge_id": "AUDIT_663->N478d", "from": "AUDIT_663", "to": "N478d_open_needs_director", "label": "audit -> director-owned frontier", "relation": "needs_director", "segment": 15, "timestamp": "2026-10-05T13:42:00Z", "note": "Audit 663 verifies hygiene and empty queue; next axis requires director authorization of N478d (or N198) \u2014 neither is queued."}
