{"run": 311, "ts": 1780000000, "idea": "N201", "segment": 15, "status": "discard", "metric": 1.0, "metric_name": "fixture_B transfer_success (coverage_cont >= 0.90 per episode), canonical rig, 20+100 seeds x 3 suites x 2 paired arms, pose_noise 0,sigma_R (translation term set to EXACTLY zero), 1320 physical episodes, 0 harness errors", "metric_unit": "fixture_B transfer_success of the shipped stack (trochoid + N192 lattice H=0.6 + N195 d=2a/CN=16 + N196 n=32) under a YAW-ONLY planning-pose error up to 112 deg", "summary": "Director iter-58 FACC build directive ADJUDICATED NOT EXECUTED (65th re-derivation of the G3-retired manifold-switch/flow-bridge/energy-gated family; G4-unpairable - the rig has no pi0 expert, no SE(3) energy keypoint, no wrench head and no stiffness knob). Built nothing, changed no rig byte. Ran instead the one physical question the whole programme has never asked and that N198 option (b) needs answered before any bar can be moved: EVERY pose-noise level decided since I5 ties sigma_t = sigma_R/200, so the two SE(3) terms of the planning-pose error have never been separated. Env-only decoupling (AEGIS_POSE_NOISE='0,sigma_R'), 7 levels at 20 seeds and 3 at 100 seeds, paired in-rig on the same seeds. THREE PRE-REGISTERED PREDICTIONS, ALL CONFIRMED. (P1) TRANSLATION CONTRIBUTES EXACTLY NOTHING: at matched yaw, fixture_A coverage_cont 0.7225 yaw-only vs 0.7225 coupled, delta -0.0000, Welch p 0.9999, paired p 0.998, Fisher 1.0 (100 seeds, same seeds as N197's 0.28 m/56 deg file); fixture_R -0.0006 (p 0.982), fixture_B -0.0002 (p 0.925). The 0.28 m translation is fully absorbed by the depth registration (reg_err_xy median 3.9e-14 mm on A), so the programme's entire A/R deficit is the YAW term and nothing else. (P2) FIXTURE_B IS IMMUNE TO YAW: 100/100 success and coverage_cont 0.9975 at 56 deg and 0.9836 at 112 deg prior, 100/100 at every level, because its yaw is PCA-observable - reg_yaw_plan median is 0.0553 deg and CONSTANT from a 0 deg to a 112 deg prior. 112 deg of yaw prior costs the G4-anchored suite nothing, which is why no yaw-side mechanism can ever be adjudicated on it. (P3) FIXTURE_R SPLITS BY CUSTOMER SHAPE AT ONE AND THE SAME sigma_R: at 56 deg within the same 100 seeds, elongated customers coverage_cont 0.9929 / 100% success (yaw observed, residual 0.95 deg) vs round customers 0.7226 / 28% (yaw unobservable, residual 43.84 deg = the prior), delta -0.2703, Welch p 2.15e-14, Fisher 1.14e-15; at 112 deg -0.3010 (p 1.19e-16); at 18 deg -0.0808 (p 8.45e-08). The bimodality is the face's symmetry, not the customer's. LAW: N193.1's claim that coverage_cont is a function of the RESIDUAL yaw ALONE is now confirmed on physical data - one pooled curve over 1320 episodes / 3 suites / 10 levels, Spearman -0.84 (p<1e-100), and the per-suite mean residual against that single curve is -4.7e-05 (A) / +2.4e-04 (B) / -2.0e-04 (R), i.e. suite identity explains 0.02% of coverage once the residual yaw is known. Its analytic theta* = 17 deg is confirmed to 1.4%: the interpolated physical crossings are 16.77 deg for coverage_cont >= 0.90 and 16.77 deg for success 0.5. NO KEEP IS CLAIMED AND NONE IS CLAIMABLE: every compare record in every file has keep=false, because at sigma_t = 0 the registration lattice is a measured bit-identical no-op (k=1, so the two paired arms coincide) and because the G4-anchored suite is provably immune to the term under study. The deliverable is the law, not a mechanism: the programme's last defect is now a single scalar with a closed form, the observability of yaw, a property of the FACE.", "metrics": {"idea": "N201", "new_mechanism": false, "claim_type": "law validation on physical data (no candidate, no dose, no metric move)", "director_iteration": 58, "director_directive_adjudication": {"spec": "FACC: Force-Adaptive Contact Control - SE(3)-conditioned EBM scoring action-affordance pairs live, dropping the pi0 flow-matching action expert; energy-based physical in-context attention with F/T + 2 demos as keys and no finetune; contact-shift suite (stiffness change, slip, tool-use) vs 308/309; metric success + energy-contact calibration; falsifier 'kill if energy rank uncorrelated with contact success'; predicted 12-18 pts keep", "executed": false, "exclusion_reasons": ["G3 retired family, 65th re-derivation: 'energy-based physical in-context attention' IS energy gating, 'affordance-equivalence' bridge IS the flow bridge, 'SE(3)-conditioned head replacing the flow-matching head' IS manifold switching. FACC closed on physical data at r232/r233; FACC-E and SEAFP adjudicated not executed at r300-r310.", "G4-unpairable: the canonical rig has no pi0 expert, no VLM, no flow-matching head, no energy keypoint and no stiffness knob (CONTACT_K, CONTACT_C = 1.0e3, 2.0e2 is a fixed literal among 51 knobs), so neither arm of the mandated pair and neither axis of the contact-shift suite can be instantiated on the same seeds; no p-value could exist.", "G7: N200 measured last iteration that the rig's force channel is a per-EPISODE aggregate with no per-tick series, so 'F/T as keys' has no input, and it is blind on fixture_A (median fn_mean AUC 0.5053) which is the suite whose failure is the yaw term. A predicted-only keep is banned this segment."], "ran_instead": "the physical decoupling of the two SE(3) planning-pose terms, the last unmeasured quantity behind the programme's only remaining defect"}, "rig": "experiments/kaggle_aegis_sweep.py (PyBullet DIRECT, system python3, rig_version 2, friction U[0.05,0.80], gate_mode=post-hoc), aegis_reg=depth / REG_HALF_M=0.6 / REG_CASTS=0 / REG_DFACT=2.0 / REG_CN=16 / REG_N=32; pts_source=physics_contact; every coverage_cont and success recomputed from physics contacts at return time; no teleport, no arithmetic coverage, no rig byte changed (git status clean for the rig)", "commands": ["AEGIS_POSE_NOISE=0,<sr> AEGIS_REG=depth AEGIS_REG_HALF_M=0.6 AEGIS_REG_CASTS=0 AEGIS_REG_DFACT=2.0 AEGIS_REG_CN=16 AEGIS_REG_N=32 timeout 1200 python3 experiments/kaggle_aegis_sweep.py --seeds {20,100} --no-upload --path trochoid --compare trochoid --compare-env AEGIS_REG_CASTS=1 --suites fixture_A,fixture_B,fixture_R --out results/aegis_v2/N201_r311_s{20,100}_0_<sr>.jsonl   for sr in 0,8,14,18,28,56,112"], "levels_sigma_R_deg": [0, 8, 14, 18, 28, 56, 112], "seeds_per_level": {"20": [0, 8, 14, 18, 28, 56, 112], "100": [18, 56, 112]}, "episodes_total": 1320, "harness_errors": 0, "P1_translation_contributes_nothing": {"test": "yaw-only (0,56) vs the coupled (0.28,56) file on the IDENTICAL 100 seeds", "fixture_A": {"n": 100, "yawonly_covc": 0.722504, "coupled_covc": 0.7225060000000001, "delta": -2.0000000000575113e-06, "welch_p": 0.9999356170529781, "paired_p": 0.998003055977432, "yawonly_succ": 0.2, "coupled_succ": 0.2, "fisher_p": 1.0}, "fixture_B": {"n": 100, "yawonly_covc": 0.9975010000000001, "coupled_covc": 0.9976570000000001, "delta": -0.000156000000000045, "welch_p": 0.9253562330946623, "paired_p": 0.7652339703030114, "yawonly_succ": 1.0, "coupled_succ": 1.0, "fisher_p": 1.0}, "fixture_R": {"n": 100, "yawonly_covc": 0.84693, "coupled_covc": 0.8475539999999999, "delta": -0.0006239999999999579, "welch_p": 0.9820384962880468, "paired_p": 0.5500058240612455, "yawonly_succ": 0.61, "coupled_succ": 0.61, "fisher_p": 1.0}, "reg_err_xy_median_mm_yaw_only": 3.9e-14, "reading": "adding 0.28 m of translation error to a 56 deg yaw error changes fixture_A by -0.0000 coverage and 0 successes out of 100; the depth registration absorbs the translation completely, so the A/R deficit is the yaw term ALONE", "at_112deg": {"fixture_A": {"yaw_only": 0.651772, "coupled_56": 0.7225060000000001, "delta": -0.07073400000000007}, "fixture_B": {"yaw_only": 0.9836000000000001, "coupled_56": 0.9976570000000001, "delta": -0.014056999999999986}, "fixture_R": {"yaw_only": 0.8170840000000001, "coupled_56": 0.8475539999999999, "delta": -0.030469999999999775}}}, "P2_fixture_B_immune_to_yaw": {"covc_by_level_n20": {"0": 1.0, "8": 1.0, "14": 1.0, "18": 1.0, "28": 1.0, "56": 1.0, "112": 0.9867250000000001}, "covc_by_level_n100": {"18": 1.0, "56": 0.9975010000000001, "112": 0.9836000000000001}, "success_B_n100": {"18": 1.0, "56": 1.0, "112": 1.0}, "reg_yaw_plan_median_deg_n20": {"0": 0.05534051514195523, "8": 0.05534051514195523, "14": 0.05534051514195523, "18": 0.05534051514195523, "28": 0.05534051514195523, "56": 0.05534051514195523, "112": 0.05534051514197813}, "welch_B_0deg_vs_112deg_n20": [2.0947601252312156, 0.04982857564369659], "fisher_B_success_0deg_vs_112deg_n20": 1.0, "reading": "B's yaw is PCA-observable, so the estimator returns a residual of 0.0553 deg against a prior of 0 -> 112 deg; coverage_cont moves 1.0000 -> 0.9836 and success never moves off 100/100. The G4 anchor is therefore structurally unable to adjudicate any yaw-side mechanism."}, "P3_fixture_R_splits_by_face_symmetry": {"yaw56deg_n100": {"elongated": {"n": 46, "covc": 0.9928673913043479, "succ": 1.0, "reg_yaw_p50_deg": 0.9524781678401881, "reg_yaw_p90_deg": 2.5140912030842673}, "round": {"n": 54, "covc": 0.722612962962963, "succ": 0.2777777777777778, "reg_yaw_p50_deg": 43.83522942838337, "reg_yaw_p90_deg": 75.39100407019173}, "round_vs_elongated": {"delta_covc": -0.2702544283413849, "welch_p": 2.148711531851653e-14, "fisher_p": 1.1365779860029108e-15, "reg_yaw_gap_deg": 42.88275126054318}}, "yaw112deg_n100": {"elongated": {"n": 46, "covc": 0.9796217391304348, "succ": 0.9565217391304348, "reg_yaw_p50_deg": 0.9524781678401881, "reg_yaw_p90_deg": 2.5140912030842673}, "round": {"n": 54, "covc": 0.678625925925926, "succ": 0.16666666666666666, "reg_yaw_p50_deg": 50.36857412203014, "reg_yaw_p90_deg": 80.84768207668418}, "round_vs_elongated": {"delta_covc": -0.30099581320450886, "welch_p": 1.1860025246735814e-16, "fisher_p": 7.194351725080824e-17, "reg_yaw_gap_deg": 49.41609595418995}}, "yaw18deg_n100": {"elongated": {"n": 46, "covc": 1.0, "succ": 1.0, "reg_yaw_p50_deg": 0.9524781678401881, "reg_yaw_p90_deg": 2.5140912030842673}, "round": {"n": 54, "covc": 0.9191722222222223, "succ": 0.6666666666666666, "reg_yaw_p50_deg": 15.137343747052075, "reg_yaw_p90_deg": 26.65354977992069}, "round_vs_elongated": {"delta_covc": -0.08082777777777772, "welch_p": 8.451881795649061e-08, "fisher_p": 6.333994185517799e-06, "reg_yaw_gap_deg": 14.184865579211888}}, "reading": "same suite, same seeds, same sigma_R, one 46/54 split: elongated customers observe their yaw (residual 0.95 deg) and sit at ceiling; round customers cannot (residual 43.84 deg = the prior) and collapse to fixture_A's numbers. The defect is the symmetry of the FACE, not the customer, the friction, the tool or the noise."}, "law_N193_1_on_physical_data": {"statement": "coverage_cont = f(|residual yaw after registration|) alone; no friction, slip, force or translation term appears once the residual yaw is known", "episodes": 1320, "suites": 3, "levels": 10, "tools": 3, "spearman": -0.8400416121959294, "spearman_p": 0.0, "bins": [{"yaw_lo": 0, "yaw_hi": 2, "n": 661, "covc_mean": 0.9948564296520426, "covc_std": 0.01785807831007758, "succ": 0.9954614220877458}, {"yaw_lo": 2, "yaw_hi": 5, "n": 100, "covc_mean": 0.9941669999999999, "covc_std": 0.023524247299329264, "succ": 0.98}, {"yaw_lo": 5, "yaw_hi": 8, "n": 45, "covc_mean": 0.9861200000000001, "covc_std": 0.017974829314596815, "succ": 1.0}, {"yaw_lo": 8, "yaw_hi": 11, "n": 43, "covc_mean": 0.9692348837209303, "covc_std": 0.02280052920357822, "succ": 1.0}, {"yaw_lo": 11, "yaw_hi": 14, "n": 41, "covc_mean": 0.9443707317073171, "covc_std": 0.033071174124926224, "succ": 0.926829268292683}, {"yaw_lo": 14, "yaw_hi": 17, "n": 40, "covc_mean": 0.9283975, "covc_std": 0.038281852668725434, "succ": 0.9}, {"yaw_lo": 17, "yaw_hi": 20, "n": 45, "covc_mean": 0.8976822222222224, "covc_std": 0.03734485113336026, "succ": 0.4666666666666667}, {"yaw_lo": 20, "yaw_hi": 25, "n": 44, "covc_mean": 0.8617477272727275, "covc_std": 0.0348623298172864, "succ": 0.18181818181818182}, {"yaw_lo": 25, "yaw_hi": 30, "n": 31, "covc_mean": 0.819558064516129, "covc_std": 0.032239264521683235, "succ": 0.0}, {"yaw_lo": 30, "yaw_hi": 40, "n": 59, "covc_mean": 0.7485898305084746, "covc_std": 0.0464042652003545, "succ": 0.0}, {"yaw_lo": 40, "yaw_hi": 60, "n": 97, "covc_mean": 0.6238185567010309, "covc_std": 0.06480262233763703, "succ": 0.0}, {"yaw_lo": 60, "yaw_hi": 200, "n": 114, "covc_mean": 0.4907745614035087, "covc_std": 0.04131540176560368, "succ": 0.0}], "interpolated_theta_covc_0.90_deg": 16.77361971512549, "interpolated_theta_succ_0.50_deg": 16.76923076923077, "N193_1_predicted_theta_deg": 17.0, "agreement_pct": 1.3529411764705908, "per_suite_residual_vs_pooled_curve": {"fixture_A": {"n": 440, "mean_resid": -4.652196627977576e-05, "max_abs_resid": 0.13669750000000003, "p90_abs_resid": 0.06395737476459509}, "fixture_B": {"n": 440, "mean_resid": 0.0002449339843210668, "max_abs_resid": 0.07295642965204252, "p90_abs_resid": 0.01045642965204252}, "fixture_R": {"n": 440, "mean_resid": -0.00019841201804163394, "max_abs_resid": 0.14698144329896912, "p90_abs_resid": 0.05673594296520419}}, "reading": "the analytic theta* = 17 deg from N193.1's geometric kernel is reproduced by 1320 physical episodes to 1.4%, and the per-suite mean residual against one shared curve is +-2.4e-04"}, "open_term_this_iteration_leaves": {"statement": "tool identity offsets the shared curve by up to 0.018 and the ordering is NOT monotone in the pad's inscribed radius r_eff: theta_succ 14-17 deg at r_eff 35 mm, 14-17 deg at 30 mm, 20-25 deg at 6 mm", "per_tool": {"tool0": {"r_eff_mm": 35.0, "n": 440, "mean_resid_vs_pooled": -0.017681865049851583, "p90_abs_resid": 0.07295642965204252, "theta_succ_0.5_between_deg": [14, 17]}, "tool1": {"r_eff_mm": 30.0, "n": 440, "mean_resid_vs_pooled": -0.004552105202997933, "p90_abs_resid": 0.041756429652042626, "theta_succ_0.5_between_deg": [14, 17]}, "tool2": {"r_eff_mm": 6.0, "n": 440, "mean_resid_vs_pooled": 0.018417260553917698, "p90_abs_resid": 0.06132543859649131, "theta_succ_0.5_between_deg": [20, 25]}}, "why_it_is_not_resolved": "the geometric law assumes the coverage tolerance IS r_eff, but a 6 mm pad is covered in v by the 15 mm trochoid loop amplitude instead, so the effective dilation and the tracking/slip loss are both tool-dependent; separating them needs a slip-decomposition run, which this iteration did not do", "magnitude": "+-0.018 coverage = 1.2 quanta of fixture_B (2/128 = 0.0156)"}, "compare_records_all_keep_false": {"reason": "at sigma_t = 0 the N192 cast lattice is a measured bit-identical no-op (k=1 at sigma <= H - rho_inf), so the two paired arms coincide and no p-value can exist; this is the same measured no-op N197.4 reported at (0,0) and N199 at 0.03,6", "delta_at_0_56": {"fixture_A": -2.0000000000575113e-06, "fixture_B": -0.000156000000000045, "fixture_R": -0.0006239999999999579}, "keep": false}, "why_no_keep_is_possible_here": "G4 anchors the bar on fixture_B, and this iteration measures B at 100/100 with a residual yaw of 0.0553 deg under a 112 deg prior: any yaw-side dose is a provable no-op there, exactly as N193 already showed for the invariant plan. The G4-unpairability is a property of the anchor, not of the candidate.", "rig_health": {"file": "results/aegis_v2/N201_righealth_s20.jsonl", "seeds": 20, "suites": 3, "candidate_arm_success": 1.0, "harness_errors": 0, "rig_bytes_changed": 0}, "synthetic_proxy": null, "evidence": ["results/aegis_v2/N201_r311_s20_0_{0,8,14,18,28,56,112}.jsonl", "results/aegis_v2/N201_r311_s100_0_{18,56,112}.jsonl", "results/aegis_v2/N201_righealth_s20.jsonl", "results/aegis_v2/N201_readout.json", "experiments/N201_readout.py", "experiments/N201_yaw_sweep.sh", "experiments/N201_r311_s20_*.log", "experiments/N201_r311_s100_*.log"], "equations_row": "N201", "graph": "N200->N201->N198"}}
{"idea": "FACC", "run": 312, "status": "discard", "metrics": {"idea": "FACC", "fixture_B": null, "fixture_A": null, "fixture_R": null, "compare": "N/A \u2014 no queued idea; retired family G3", "notes": "Director proposal rejected: flow-mat/affordance-manifold/energy-attention = retired manifold-switch/flow-bridge/energy-gated family (N70-N76). Predicted 76pt KEEP synthetic; no results/aegis_v2 evidence. Queue empty; N198 only open. No rig run."}, "timestamp": 1714500000}
{"run": 313, "idea": "FACC-E", "status": "discard", "segment": 15, "metric_name": "none claimed; primary metric frozen (fixture_B transfer_success coverage_cont>=0.90/episode); G4-unpairable; no queued row; no evidence artifact", "metric": null, "summary": "Director iter-6 proposal FACC-E (SE(3)-conditioned Energy-Based Affordance Field, replace flow-mat head) adjudicated NOT EXECUTED \u2014 66th re-derivation of G3-retired manifold-switch/flow-bridge/energy-gated family (FACC=offset 312, N200/N201, N70-N76). Critical assumption-violation (pi0 fixed affordance manifold) is false on this rig: header audit 128096 bytes, 0 hits pi0/openpi/flow_match/affordance/energy/keypoint/stiffness-knob; CONTACT_K/CONTACT_C fixed literals. Bridge flow->affordance-eq = flow bridge already closed. Validation axes (stiffness, SE(3) pose perturbation, cross-object zero-shot, force-excess) have zero rig realization; no per-tick force series (N200 measured aggregates only), so in-context energy-attention has no input. Predicted 76/100 is a prediction-only claim banned under G7 / segment freeze / no paired compare. Queue empty: I0-I12 done, I4/I6/I20 done, N198 open_needs_director. No python3 experiments/kaggle_aegis_sweep.py executed (would fabricating paired evidence; G4 requires same-seed compare to trochoid champion, impossible). Rig byte-identical to HEAD; 0 edits; no synthetic-proxy keep; no results/aegis_v2 file for FACC-E.", "metrics": {"idea": "FACC-E", "fixture_B": null, "fixture_A": null, "fixture_R": null, "compare": "N/A \u2014 no queued idea; G4-unpairable; retired family", "notes": "Adjudicated only. Reference evidence: N312 (FACC discard, run 312), N311 (N201 yaw-decouple discard, 1320 eps), N310 (N200 invalid, force-channel audit), ideas.md \u00a70 G3 retired, worklog 2926.", "new_mechanism": false, "claim_type": "director_proposal_adjudication_not_executed", "director_iteration": 6, "exclusion_reasons": ["G3 retired family (manifold-switch / flow-bridge / energy-gated; N70-N76; FACC at 312, N200/N201 at 310/311); 66th re-derivation", "G4-unpairable: rig has no pi0 expert, no flow-matching head, no SE(3) energy keypoint, no stiffness knob (CONTACT_K/CONTACT_C fixed); no paired champion comparison possible", "G7 predicted-only keep banned: 76pt unverified; no results/aegis_v2 artifact; no p-value", "Queue empty (no queued idea); N198 open_needs_director; segment 15 / metric / gate frozen", "No per-tick force series (N200): in-context energy-reweighting has no input; AEGIS_FORCE_PI falsified (I15/r235)"], "rig": "experiments/kaggle_aegis_sweep.py HEAD (byte-identical, 0 edits); 128096 bytes; 51 env/CLI knobs; audit clean", "rig_health": {"seeds": 20, "episodes": 60, "success": 60, "harness_errors": 0, "rig_bytes_changed": 0}, "ran_instead": "adjudication only (no queued idea); canonical rig NOT run; no synthetic proxy used for keep; no fake evidence produced"}, "timestamp": 1787000000, "evidence": ["autoresearch_research.jsonl run 312 (FACC discard)", "autoresearch_research.jsonl run 311 (N201 discard, yaw-only decoupling, 1320 physical eps)", "autoresearch_research.jsonl run 310 (N200 invalid, force-channel audit, 0 new bytes)", "autoresearch_research.ideas.md \u00a70 G3 retired + \u00a71 queue empty", "experiments/kaggle_aegis_sweep.py header audit (0 hits pi0/openpi/flow_match/affordance/energy/keypoint)"], "next": "N198 remains director-owned (options a/b/c); no bar re-anchor; no new mechanism; no segment change"}
