{"from": "N80", "to": "N81", "kind": "noise-variant", "label": "+pose_noise 0.01,2 (I7 gate under planning uncertainty)", "note": "N80 I7 gate works at pose_noise=0,0 (B=1.00); N81 shows gate INCOMPATIBLE with pose_noise >= 0.01,2 (B=0.00). Compliant retraction destabilizes tool under planning uncertainty. Gate only valid at pose_noise < 0.005."}
{"type": "node", "id": "N82", "metric": 110.0, "parent": "N81", "status": "kept", "strategy": "physical x post-hoc-tag x revert (I7 Run 170): delete in-loop veto + soft threshold + contact override + conformal + hysteresis from rig; Tier-4 gate is post-hoc tag only, fixed threshold 0.618, score weight never control; I10 fitted pitch; sweep pose-noise 0.01/0.1/0.5/2.0", "timestamp": 1790502000, "frontier": "critical x assumption-violation x contact-preserving-physical-gating", "variation": "revert-to-post-hoc: control effect zero by construction"}
{"from": "N81", "to": "N82", "kind": "revert", "label": "delete in-loop control (killed 168, invalidated 169)", "note": "N82 post-hoc tag: decider B=1.00 vs 0.75 Welch p=1.1e-4 keep=True; fitted>=trochoid at all 4 sweep noises; tag-attributable contact drop 0%"}
{"type": "node", "id": "N83", "metric": 0.95, "parent": "N82", "status": "discarded", "strategy": "post-hoc x split-conformal-tag x frozen-pitch (I2 Run 171): per-friction-bin jerk quantile theta_b=ceil((n+1)(1-alpha))/n over SUCCESS episodes, alpha=0.1, hi-bin merged (n=11<20); POST-HOC scoring only, threshold never control; I10 fitted frozen; 0.01,2 control decider + 2.0 offline archive; held-out BASE_SEED=190000", "timestamp": 1790503000, "frontier": "decoupled-safety-tagging-from-control", "variation": "conformal admission tag, control effect zero by construction", "evidence_artifacts": ["results/aegis_v2/I2_r171_calib_0012.jsonl", "results/aegis_v2/I2_r171_test_0012.jsonl"]}
{"type": "edge", "from": "N82", "to": "N83", "kind": "frontier-expansion", "label": "conformal tag on post-hoc revert (killed as predictor, kept as calibrated tag)", "note": "N83: held-out false-tag 0.102<=0.15 PASS (calibrated); precision 0.22<0.9 + held-out keep=False (B p=0.605) -> DISCARD as keep. Jerk carries no failure signal under pose noise; Tier-2 accuracy remains binding."}
{"type": "node", "id": "N84", "metric": 86.67, "parent": "N83", "status": "kept", "strategy": "post-hoc x marginal-conformal-tag x frozen-pitch x noise-aware-ceiling (I2 Run 172): pooled jerk quantile theta=ceil((n+1)(1-alpha))/n over ALL Run-A SUCCESS episodes (n=103, alpha=0.1, NO per-bin split); admit iff jerk<=theta AND stall_frac<=0.05; theta clipped by frozen 0.618*f(I5) ceiling (0.927 @0.01,2, never binds); score weight only, never control; I10 fitted frozen; 0.01,2 decider + 190000 held-out + 2.0 offline archive", "timestamp": 1790504000, "frontier": "calibration-under-pose-noise-not-gating", "variation": "marginal admission tag, control effect zero by construction", "evidence_artifacts": ["results/aegis_v2/I2_r172_calib_0012.jsonl", "results/aegis_v2/I2_r172_test_0012.jsonl", "results/aegis_v2/I2_r172_archive_20.jsonl"]}
{"type": "edge", "from": "N83", "to": "N84", "kind": "frontier-expansion", "label": "drop per-bin split (sparsity), restore marginal + noise ceiling", "note": "N84: held-out recall 0.867 (score 86.67), admitted-failure 0.108<=0.15 calibrated (cf 171 0.102), miscoverage 0.133<=0.15, coverage no regression, archive valid rate 0.0 (correct abstention). KEEP: best calibrated Tier-4 tag; jerk still predicts no failures (171 stands)."}
{"type": "node", "id": "N85", "metric": 86.44, "parent": "N84", "status": "kept", "strategy": "unified post-hoc admission tag T173 (director iter 7): admit iff (jerk<=0.618 I7-170) AND (jerk<=theta_marginal 172) AND (stall<=0.05); theta=0.014133 pooled Run-A SUCCESS quantile (n=103, alpha=0.1), frozen 0.927 ceiling never binds; I10 fitted frozen; zero rig edits, offline scoring only", "timestamp": 1790505000, "frontier": "unified-post-hoc-admission-tag-zero-in-loop", "variation": "I7 AND marginal-conformal conjunction; drop 171 per-bin split", "evidence_artifacts": ["results/aegis_v2/I2_r173_calib_0012.jsonl", "results/aegis_v2/I2_r173_test_0012.jsonl", "results/aegis_v2/I2_r173_archive_20.jsonl"]}
{"type": "edge", "from": "N84", "to": "N85", "kind": "frontier-expansion", "label": "unify 170 tag + 172 marginal theta (I7 conjunct inert)", "note": "N85: Run-A B 1.00 vs 0.75 Welch p=1.1e-4 keep=True; held-out fitted admit 0.85, precision 1.0, recall 0.864 (86.44), pooled admitted-failure 0.108<=0.15; pitch frozen max resid 0.020 zero drift; archive 0.0 correct abstention. KEEP: best unified Tier-4 tag; Tier-2 binding."}
{"type": "node", "id": "N86", "metric": 87.62, "parent": "N85", "status": "discarded", "strategy": "F8 friction-binned pitch-residual corrector T174 (director iter 8): abstain iff fric>=0.70 AND slip_m>rim_margin (analytic frozen-I10 margins); I7 dropped (0 binds); I2-marginal theta log-only bit-identical 0.014133; zero rig edits, offline ON/OFF ablation + per-friction-bin split on frozen R173 files", "timestamp": 1790506000, "frontier": "bias-not-interval-residual-gating", "variation": "drop I7, demote I2-marginal to log-only", "evidence_artifacts": ["results/aegis_v2/I2_r174_analysis.py", "results/aegis_v2/I2_r174_result.json"]}
{"type": "edge", "from": "N85", "to": "N86", "kind": "frontier-expansion", "label": "residual-corrector instead of interval (bias hypothesis)", "note": "N86: pooled held-out lift 0.96pts<1.0 bar; top-bin 0.15->0.0 at cost of 13 successes; archive abstention broken (0.883); slip-matched fail/success pair near-identical -> DISCARD. Intervals (171-173) and residuals (174) both fail to fix bias; Tier-2 binding."}
{"type": "node", "id": "N87", "metric": 43.81, "parent": "N85", "status": "discarded", "strategy": "T175 slip-tail conditional admit (director iter 9): T173 AND slip_m<=P50 (P50=0.008106 pooled calib-success median, fit calib-only); not friction-gated (F8 failed); zero rig edits, offline replay on frozen R173 files", "timestamp": 1790506000, "frontier": "slip-tail-conditional-admit", "variation": "keep T173 unified tag, add slip_m<=p50(success) conjunct", "evidence_artifacts": ["results/aegis_v2/I2_r175_analysis.py", "results/aegis_v2/I2_r175_result.json"]}
{"type": "edge", "from": "N85", "to": "N87", "kind": "frontier-expansion", "label": "slip-tail instead of friction gate (F8 failed)", "note": "N87: pooled held-out lift -4.03pts vs T173 (P(fail|admit) 0.1481 vs 0.1078); recall 0.4381 score 43.81<70; abstain 55%; ablation exact; theta bit-identical; I7 0 binds -> DISCARD. Slip = friction drag, no outcome signal; Tier-2 binding."}
{"type": "node", "id": "N88", "metric": 43.81, "parent": "N87", "status": "discarded", "strategy": "T176 dual-low conditional admit (director iter 10): T173 AND slip_m<=0.008106 AND fric<0.70 (175 slip-tail + inverted-174 fric gate, no corrector); zero rig edits, offline replay on frozen R173 files", "timestamp": "2026-09-28T14:51:50Z", "frontier": "dual-low-hard-threshold-CLOSED", "variation": "add fric<0.70 conjunct to T175", "evidence_artifacts": ["results/aegis_v2/I2_r176_analysis.py", "results/aegis_v2/I2_r176_result.json"]}
{"type": "edge", "from": "N87", "to": "N88", "kind": "frontier-expansion", "label": "dual-low: add inverted-174 fric gate to T175", "note": "N88: pooled held-out lift -4.03pts vs T173 (0.1481 vs 0.1078); recall 0.4381 score 43.81<70; admit-rate 0.45; T176==T175 bit-identical on held-out (fric-only cuts 0/48; admitted max fric 0.3405); P75 ablations all negative lift -> DISCARD + FRONTIER KILL: close fric/slip hard-threshold line; Tier-2 binding."}
{"type": "node", "id": "N89", "metric": 87.89, "parent": "N88", "status": "kept", "strategy": "T177 pre-reg soft dual-signal shrinker (director iter 11): w=T173*P50/(slip+P50)*(1-fric), P50=0.008106 train-locked, zero hard cuts, post-hoc only, frozen I7+I10; zero rig edits, offline on frozen R173 files", "timestamp": "2026-09-28T00:00:00Z", "frontier": "soft-weighting (replaces hard admit/abstain line T174-T176)", "variation": "same signals slip_m+fric+T173, continuous confidence instead of cuts at P50/fric0.70", "evidence_artifacts": ["results/aegis_v2/I2_r177_analysis.py", "results/aegis_v2/I2_r177_result.json"]}
{"type": "edge", "from": "N88", "to": "N89", "kind": "frontier-expansion", "label": "soft shrinker instead of hard cuts (frontier-kill follow-up)", "note": "N89: held-out lift -1.33pts vs T173 (0.1211 vs 0.1078, negative); score_w 87.89>=70; cov ok; archive mass 0.0; train +1.28/held -1.33 sign flip = overfit demonstration -> KEEP per iff rule with no-signal diode. Slip/fric carry no generalizable outcome signal; Tier-2 binding."}
{"type": "node", "id": "N90", "metric": 88.37, "parent": "N89", "status": "kept", "strategy": "T178 softened-fric shrinker (director iter 12): w=T173*P50/(slip+P50)*(1-0.5*fric), P50=0.008106 train-locked, zero hard cuts, post-hoc only, frozen I7+I10; zero rig edits, offline on frozen R173 files", "timestamp": "2026-09-28T00:00:00Z", "frontier": "soft-weighting (halved fric penalty after T176 hard-gate kill)", "variation": "same slip kernel as T177, fric factor (1-fric)->(1-0.5*fric)", "evidence_artifacts": ["results/aegis_v2/I2_r178_analysis.py", "results/aegis_v2/I2_r178_result.json"]}
{"type": "edge", "from": "N89", "to": "N90", "kind": "frontier-expansion", "label": "halve fric penalty (mid-fric over-penalization fix)", "note": "N90: held-out lift +0.48pts vs T177 (0.1163 vs 0.1211, below +1.2pt expectation); score_w 88.37>=70; mid-band mass +43% restored, failure mass stable; archive 0.0; KEEP per iff rule. Slip/fric still carry no generalizable outcome signal vs hard tag (-0.85pts); Tier-2 binding."}
{"type": "node", "id": "N91", "parent": "N90", "status": "kept", "metric": 88.54, "strategy": "T179 low-fric-tolerant shrinker (director iter 13): w=T173*P50/(slip+P50)*(1-0.25*fric), P50=0.008106 train-locked, zero hard cuts, post-hoc only, frozen I7+I10; zero rig edits, offline on frozen R173 files", "frontier": "soft-weighting (quarter fric penalty after T178 half still -0.85pts)", "variation": "same slip kernel as T177/T178, fric factor (1-0.5*fric)->(1-0.25*fric) + alpha x P50 ablation", "timestamp": "2026-09-28T00:00:00Z", "evidence_artifacts": ["results/aegis_v2/I2_r179_analysis.py", "results/aegis_v2/I2_r179_result.json"]}
{"type": "edge", "from": "N90", "to": "N91", "kind": "frontier-expansion", "label": "quarter fric penalty + alpha-slope ablation", "note": "N91: held-out lift -0.68pts vs T173 (0.1146 vs 0.1078, diode stands); +0.65 vs T177, +0.17 vs T178; score_w 88.54>=70; ablation monotone +0.16pts per +0.25 alpha (fric penalty harmful throughout); slip-only -0.53 (no signal); P50 rounding 0.000; archive 0.0; KEEP per iff rule. Tier-2 binding."}
{"type": "node", "id": "N92", "parent": "N91", "status": "kept", "metric": 88.69, "strategy": "T180 zero-fric control (director iter 14): w=T173*P50/(slip+P50), P50=0.008 director-frozen, no fric term (k=0), post-hoc only, frozen I7+I10; zero rig edits, offline on frozen R173 files", "frontier": "soft-weighting kill-test (close fric-penalty line)", "variation": "drop fric factor entirely from T177/T178/T179 slip kernel", "timestamp": "2026-09-28T00:00:00Z", "evidence_artifacts": ["results/aegis_v2/I2_r180_analysis.py", "results/aegis_v2/I2_r180_result.json"]}
{"type": "edge", "from": "N91", "to": "N92", "kind": "frontier-expansion", "label": "zero-fric control (k->0 kill-test)", "note": "N92: held-out lift -0.53pts vs T173 (0.1131 vs 0.1078, diode stands); +0.80/+0.32/+0.15 vs T177/T178/T179 (monotone fric-harmful); score_w 88.69>=70; archive 0.0; KEEP per iff rule. FRIC LINE CLOSED: k=0 still negative -> fric not blocker, slip kernel no signal; pivot frontier next. Tier-2 binding."}
{"type": "node", "id": "N93", "parent": "N92", "status": "kept", "metric": 89.54, "strategy": "T181 slip-gated normalized-fric shrinker (director iter 15): w=T173*P50/(slip+P50)*(1-0.5*fric_n*gate), P50=0.008 director-frozen, fric_n=clip(fric/0.3599,0,1) train-locked, gate=1 iff slip<P50; post-hoc only, frozen I7+I10; zero rig edits, offline on frozen R173 files", "frontier": "fric-calibration (normalized+gated, not slope)", "variation": "normalize fric by train median + apply penalty only in low-slip regime", "timestamp": "2026-09-28T00:00:00Z", "evidence_artifacts": ["results/aegis_v2/I2_r181_analysis.py", "results/aegis_v2/I2_r181_result.json"]}
{"type": "edge", "from": "N92", "to": "N93", "kind": "frontier-expansion", "label": "slip-gated normalized fric (calibration not slope)", "note": "N93: held-out lift +0.32pts vs T173 (0.1046 vs 0.1078, FIRST positive vs hard tag) and +0.85pts vs T180 head-to-head WIN; score_w 89.54>=70; gate ablation +1.31pts (forced-on -0.46 vs T180); archive 0.0; KEEP per iff rule. Fric line OPEN; Tier-2 binding."}
{"type": "node", "id": "N94", "parent": "N93", "status": "kept", "metric": 88.41, "strategy": "T182 fric-capped slip-floored shrinker (director iter 16): w=T173*P50/(slip+P50)*(1-0.35*fric_n), P50=0.008 director-frozen, fric_n=clip(fric/0.3599,0,1) train-locked, w=0 if slip<1e-4; post-hoc only, frozen I7+I10; zero rig edits, offline on frozen R173 files", "frontier": "asymmetric-fric-tolerance (uniform capped penalty, no hard gate)", "variation": "0.35 coef between 179 raw-0.25 and 181 gated-0.5 + normalized fric + slip floor", "timestamp": "2026-09-28T00:00:00Z", "evidence_artifacts": ["results/aegis_v2/I2_r182_analysis.py", "results/aegis_v2/I2_r182_result.json"]}
{"type": "edge", "from": "N93", "to": "N94", "kind": "frontier-expansion", "label": "uniform capped penalty (drop hard gate, add slip floor)", "note": "N94: held-out lift -0.81pts vs T173 (0.1159 vs 0.1078, diode stands); -0.28 vs T180 head-to-head FAIL; -1.13 vs T181 (uniform penalty worse than slip-gating); score_w 88.41>=70; floor binds 0 (inert guard); archive 0.0; KEEP per iff rule. Fail rule: freeze 0.35, sweep P50 next. Tier-2 binding."}
{"type": "node", "id": "N95", "parent": "N94", "status": "kept", "metric": 88.55, "strategy": "T183 fric-light damped shrinker (director iter 8): w=T173*P50/(max(slip,0.002)+P50)*(1-0.2*min(fric_n,1.0)), P50=0.008 director-frozen, fric_n=fric/0.3599 train-locked, slip damp cap 0.8; post-hoc only, frozen I7+I10; zero rig edits, offline on frozen R173 files", "frontier": "keep-preserving friction control (light damped, not gated)", "variation": "k 0.35->0.2 + uniform capped penalty kept (no hard gate) + damp floor max(slip,0.002) instead of zero floor", "timestamp": "2026-09-28T00:00:00Z", "evidence_artifacts": ["results/aegis_v2/I2_r183_analysis.py", "results/aegis_v2/I2_r183_result.json"]}
{"type": "edge", "from": "N94", "to": "N95", "kind": "frontier-expansion", "label": "lighten fric penalty + damp slip kernel (keep-preserving control)", "note": "N95: held-out lift -0.67pts vs T173 (diode stands); -0.14 vs T180 head-to-head FAIL (below +0.6-0.9pt prediction); -0.99 vs T181; +0.14 vs T182; score_w 88.55>=70; damp binds 0 (inert guard); archive 0.0; KEEP per iff rule. Tier-2 binding."}
{"type": "node", "id": "N96", "parent": "N95", "status": "kept", "metric": 88.6, "strategy": "T184 fric-free slip-floored damped shrinker (director iter 9): w=T173*P50/(max(slip,0.005)+P50), P50=0.008 director-frozen, no fric term, kernel cap 0.6154; post-hoc only, frozen I7+I10; zero rig edits, offline on frozen R173 files", "frontier": "slip-only shrinker (drop fric term entirely)", "variation": "floor 0.002->0.005 + delete (1-k*fric) factor entirely", "timestamp": "2026-09-28T00:00:00Z", "evidence_artifacts": ["results/aegis_v2/I2_r184_analysis.py", "results/aegis_v2/I2_r184_result.json"]}
{"type": "edge", "from": "N95", "to": "N96", "kind": "frontier-expansion", "label": "drop fric term, strengthen slip floor (fric-free damped)", "note": "N96: held-out lift -0.62pts vs T173 (diode stands); -0.09 vs T180 (near-identical); -0.94 vs T181 (gate still best); +0.19 vs T182, +0.05 vs T183; score_w 88.60>=70; floor binds 25/120 held (first active guard); archive 0.0; KEEP per iff rule. Fail-cond NOT triggered; score>=70 -> propose unfreeze I7+I10. Tier-2 binding."}
{"type": "node", "id": "N97", "parent": "N96", "status": "kept", "metric": 89.07, "strategy": "T185 fric-free no-damp ablation (director iter 17): w=T173*P50/(max(slip,0.01)+P50), P50=0.008 director-frozen, no fric term, kernel cap 0.4444; post-hoc only, frozen I7+I10; zero rig edits, offline on frozen R173 files", "frontier": "slip-only ceiling (drop shrinker+damping, strongest floor)", "variation": "floor 0.005->0.01 + fric already deleted (no-damp ablation)", "timestamp": "2026-09-28T00:00:00Z", "evidence_artifacts": ["results/aegis_v2/I2_r185_analysis.py", "results/aegis_v2/I2_r185_result.json"]}
{"type": "edge", "from": "N96", "to": "N97", "kind": "frontier-expansion", "label": "raise slip floor to ceiling (no-damp ablation)", "note": "N97: held-out lift -0.15pts vs T173 (diode stands, closest slip-only yet); +0.38 vs T180 WIN; +0.47 vs T184 WIN (keep-dist mean_w -0.064, recall -0.063); -0.47 vs T181 (gate still best); +0.66 vs T182, +0.52 vs T183; score_w 89.07>=70; floor binds 76/120 held (heavily active); ESS 101.35 series max; archive 0.0; KEEP per iff rule. Director <3pts branch fires -> propose I10-unfreeze/T173-drop. Tier-2 binding."}
{"type": "node", "id": "N98", "parent": "N97", "status": "kept", "metric": 88.85, "strategy": "T186 fric-free damped shrinker with P50_eff fix (director iter 11): w=T173*P50_eff/(max(slip,0.005)+P50_eff), P50_eff=max(0.008,0.02)=0.02, floor 0.005 same as T184, damped on, no fric, frozen I7+I10; post-hoc only, zero rig edits, offline on frozen R173 files", "frontier": "zero-median weight degeneracy fix (P50_eff, not friction/damping)", "variation": "P50 0.008->P50_eff 0.02 only, T184-identical otherwise", "timestamp": "2026-09-28T00:00:00Z", "evidence_artifacts": ["results/aegis_v2/I2_r186_analysis.py", "results/aegis_v2/I2_r186_result.json"]}
{"type": "edge", "from": "N97", "to": "N98", "kind": "frontier-expansion", "label": "P50_eff weight fix (isolated single fix)", "note": "N98: held-out lift -0.37pts vs T173 (diode stands); +0.25 vs T184 WIN; +0.16 vs T180 WIN; +0.30 vs T183 WIN; -0.22 vs T185; -0.69 vs T181 (gate still best); score_w 88.85>=70; mean_w +0.176/recall +0.18 vs T184 (degeneracy partially repaired, cap 0.8); replay monotonic+positive pass; archive 0.0; KEEP per iff rule. Kill rule not triggered. Tier-2 binding."}
{"type": "node", "id": "N99", "parent": "N98", "status": "kept", "metric": 88.85, "strategy": "T187 fric-free damped shrinker (director iter 12): w=T173/(max(slip,0.005)+0.02), P-term dropped, damping+floor kept from T184, no fric, frozen I7+I10; post-hoc only, zero rig edits, offline on frozen R173 files", "frontier": "P-quantile collapse (P50=0 kills numerator-form weights)", "variation": "drop P numerator from T186, keep 0.02 denom offset + 0.005 floor", "timestamp": "2026-09-28T00:00:00Z", "evidence_artifacts": ["results/aegis_v2/I2_r187_analysis.py", "results/aegis_v2/I2_r187_result.json"]}
{"type": "edge", "from": "N98", "to": "N99", "kind": "frontier-expansion", "label": "drop P-term (P-collapse test)", "note": "N99: P50=0 kills 100% numerator-form weights vs T187 15% zeros; lift -0.37 vs T173, 0.00 vs T186 exact (w187=w186/0.02); score_w 88.85>=70; rankIC 0.0201 no signal; KEEP per iff rule. Director ~1.0 branch: kill fric-free line, unfreeze I10 next. Tier-2 binding."}
{"type": "node", "id": "N100", "parent": "N99", "status": "kept", "metric": 88.66, "strategy": "T188 = T187 T173-only + tuned eps (director iter 13): w=T173/(max(slip,0.005)+eps), eps=max(median_calib(slip>0)=0.008358,0.01)=0.01 train-locked pre-reg, no-damp off, no fric, frozen I7+I10; post-hoc only, zero rig edits, offline on frozen R173 files", "timestamp": "2026-09-28T00:00:00Z", "frontier": "none (stay on T187 fric-free damped shrinker line)", "variation": "tuned eps + post-hoc sweep [0.005,0.01,0.02,0.05] vs T187 fixed 0.02", "evidence_artifacts": ["results/aegis_v2/I2_r188_analysis.py", "results/aegis_v2/I2_r188_result.json"]}
{"type": "edge", "from": "N99", "to": "N100", "kind": "frontier-expansion", "label": "tuned eps (median-floored, not arbitrary 0.02)", "note": "N100: held-out lift -0.56pts vs T173 (diode stands); -0.19 vs T187; sweep -0.38/-0.19/0.0/+0.19 NOT flat (abort not triggered), monotone larger-eps-better; score_w 88.66>=70; rankIC 0.0201 identical all eps (curvature-only, no ranking signal); ESS 99.04; archive 0.0; KEEP per iff rule. Tier-2 binding."}
{"type": "node", "id": "N101", "parent": "N100", "status": "kept", "metric": 88.74, "strategy": "T189 = T188 ablation damping OFF (director iter 14): w=T173/(slip+eps*), eps*=0.01 train-locked, floor removed, no fric, frozen I7+I10; post-hoc only, zero rig edits, offline on frozen R173 files", "frontier": "damped-shrinker culprit test (not eps/slip floor)", "variation": "remove max(slip,0.005) floor, keep eps*=0.01; lambda 1.0->0 arm = pure T173", "timestamp": "2026-09-28T00:00:00Z", "evidence_artifacts": ["results/aegis_v2/I2_r189_analysis.py", "results/aegis_v2/I2_r189_result.json"]}
{"type": "edge", "from": "N100", "to": "N101", "kind": "frontier-expansion", "label": "damping-OFF ablation", "note": "N101: held-out lift -0.48 vs T173 (diode stands); +0.08 vs T188 (damping nearly inert, 22/120 changed, mean|dw| 0.86); score_w 88.74>=70; ESS 98.27; archive 0.0; KEEP iff-rule. Director 20-35 fails; fail path fires: KILL shrinker family, propose iter-15 unfreeze I10 only. Tier-2 binding."}
