{"id": "ITER96-E-FACC-DIRECTOR-785", "run": 785, "idea_tag": "E-FACC iter-56 (director decision): SE(3)-Equivariant Energy Adaptive Contact Field \u2014 EBM over dynamic affordance manifold + energy-based physical in-context attention + SE(3)-equiv E(o,a,F) + flow-matching->affordance-equivalence bridge; predicted 78/100", "status": "invalid", "kind": "node", "type": "director_decision_refused_replay_95", "queue_empty_confirmed": true, "predicted_score": 78, "physical_run": false, "compare_keep": false, "segment": 15, "protocol_version": "v3", "note": "95th replay refusal of G3-retired family (N70-N76/eq78/manifold-switch/flow-bridge/energy-gated/EBM/FACC-SE3/E-FACC). Mechanism untestable in canonical rig (rig rigid flat-top friction U[0.05,0.80] only; no stiffness/deformable/slip/contact-shift/SE3-perturbation suite; E_dynamic(x,t) and SE(3)-equivariant energy E(o,a,F) have no executable arm). Queue empty since run 497; N198/N478d open_needs_director NOT queued. No synthetic/proxy claim (restroom_sim banned G2). No arithmetic coverage/success estimation (G7). Champion trochoid B=1.00 Fisher p=0.0083 frozen. Refusal prevents fabricated G7-invalid claim; director must open non-G3 axis or confirm segment 15 close."}
{"id": "edge_784_785", "from": "ITER95-FACC-SE3-DIRECTOR-784", "to": "ITER96-E-FACC-DIRECTOR-785", "kind": "edge", "type": "refusal_then_refusal", "run_from": 784, "run_to": 785, "note": "95th G3 replay refusal (run 785); E-FACC / SE(3)-Equivariant Energy Adaptive Contact Field / EBM energy-attention / dynamic affordance manifold / flow-bridge / SE(3)-equivariant / force-adaptive family replay refused; mechanism untestable; director steer documented; no synthetic/proxy; no arithmetic; no teleport; gate preserved; equation unchanged; champion frozen; worklog appended; commit follows."}
{"id":"ITER97-FACC-DIRECTOR-786","run":786,"idea_tag":"FACC iter-57 director decision (opencode-responses/muse-spark-1.3-contributor-free): Force-Adaptive Contact Control (FACC) — SE(3)-conditioned flow-matching over learned affordance-equivalence; energy-based physical in-context attention (contact-energy logits + info-theory bottleneck); flow-matching -> affordance-equivalence bridge; contact-rich insertion/wipe/tool-use under novel pose + stiffness; baseline pi0 fixed-affordance vanilla flow-mat; falsify if no OOD gain; ablate energy-attn vs cross-attn then stiffness OOD; predicted 76/100","status":"invalid","kind":"node","type":"director_decision_refused_replay_96","queue_empty_confirmed":true,"predicted_score":76,"physical_run":false,"compare_keep":false,"segment":15,"protocol_version":"v3","note":"96th replay refusal of G3-retired family (N70-N76, eq78 frozen 2026-09-28; champion N74 92.3 synthetic frozen; FACC/SE3/EBM/energy-attention/manifold-switch/flow-bridge/energy-gated family). Director proposal (iter 57, muse-spark-1.3-contributor-free) combines SE(3)-conditioned flow-matching, energy-based physical in-context attention (contact-energy as logits + info-theory bottleneck), flow-bridge to affordance-equivalence, and force-adaptive contact control. Mechanism untestable in canonical rig (rig rigid flat-top friction U[0.05,0.80] only; NO stiffness/slip/deformable/contact-shift/SE3-perturbation/energy-attention/contact-energy-logits/info-bottleneck suite). Queue empty since run 497 (ideas.md s0: zero queued rows). No synthetic/proxy claim permitted (restroom_sim banned G2). No arithmetic coverage/success estimation (G7 integrity). No teleport used. Gate untouched (Tier-4 preserved HARD). Equations unchanged. Champion trochoid B=1.00 Fisher p=0.0083 frozen. Refusal prevents fabricated claim."}
{"id":"edge_785_786","from":"ITER96-E-FACC-DIRECTOR-785","to":"ITER97-FACC-DIRECTOR-786","kind":"edge","type":"refusal_then_refusal","run_from":785,"run_to":786,"note":"96th G3 replay refusal (run 786); FACC / SE(3)-conditioned flow-matching / energy-attention / info-bottleneck / flow-bridge / affordance-equivalence / force-adaptive / contact-rich suite replay refused; mechanism untestable; director steer documented (iter 57); no synthetic/proxy; no arithmetic; no teleport; gate preserved; equation unchanged; champion frozen; worklog append; commit follows."}
{"id":"ITER98-FACC-DIRECTOR-787","run":787,"idea_tag":"FACC iter-58 director decision (opencode-responses/muse-spark-1.3-contributor-free): Force-Adaptive Contact Control (FACC), SE(3)-conditioned — dynamic affordance manifold (contact-energy + stiffness-gated SE(3) delta), energy-based physical in-context attention over force/torque + SE(3) delta as energy keys, replaces flow-matching action-expert with energy-based affordance field; flow-matching community -> affordance-equivalence community bridge; validation: contact-shift suite (slip, deformable, tool-change); violated-manifold success + force-RMSE; predicted 81/100 KEEP","status":"invalid","kind":"node","type":"director_decision_refused_replay_97","queue_empty_confirmed":true,"predicted_score":81,"physical_run":false,"compare_keep":false,"segment":15,"protocol_version":"v3","note":"97th replay refusal of G3-retired family (N70-N76, eq78 frozen 2026-09-28; champion N74 92.3 synthetic frozen). Director proposal (iter 58, muse-spark-1.3-contributor-free) proposes FACC (SE(3)-conditioned Force-Adaptive Contact Control): dynamic affordance manifold E(x,t) with stiffness-gated SE(3) delta; energy-based physical in-context attention with force/torque + SE(3) delta as energy keys; replaces flow-matching expert with energy-based affordance field; flow-matching -> affordance-equivalence bridge; validation on contact-shift suite (slip, deformable, tool-change) with violated-manifold success + force-RMSE. Mechanism untestable in canonical rig (rig rigid flat-top friction U[0.05,0.80] only; NO stiffness/deformable/slip/contact-shift/SE3-perturbation/energy-attention/contact-energy/force-torque suite; E_dynamic(x,t) and SE(3)-conditioned energy keys have no executable arm; violated-manifold claim requires variable-stiffness/deformable objects not present in rig). Queue empty since run 497 (ideas.md s0: zero queued rows; N198/N478d open_needs_director NOT queued). No synthetic/proxy claim permitted (restroom_sim banned G2). No arithmetic coverage/success estimation performed (G7). No teleport used. Tier-4 gate untouched (hard gate preserved). Equations unchanged. Champion trochoid B=1.00 Fisher p=0.0083 frozen. Refusal prevents fabricated claim."}
{"id":"edge_786_787","from":"ITER97-FACC-DIRECTOR-786","to":"ITER98-FACC-DIRECTOR-787","kind":"edge","type":"refusal_then_refusal","run_from":786,"run_to":787,"note":"97th G3 replay refusal (run 787); FACC / SE(3)-conditioned / dynamic affordance manifold / energy-based in-context attention / force-torque + SE(3) energy keys / energy-based affordance field / flow-bridge / contact-shift suite / violated-manifold + force-RMSE replay refused; mechanism untestable in canonical rig; director steer documented (iter 58); no synthetic/proxy; no arithmetic; no teleport; gate preserved; equation unchanged; champion frozen; next must be director-authorised non-G3 axis (N198/N478d) or segment close."}
{"id": "ITER99-FACC-SE3-DIRECTOR-788", "run": 788, "idea_tag": "FACC-SE3 iter-59 (director decision, single-brain fallback: muse-spark-1.3-contributor-free): Force-Adaptive Contact Control (FACC-SE3) with energy-based physical in-context attention \u2014 SE(3)-conditioned EBM attention (contact-energy = -force+geometry), replaces flow-matching head with SE(3)-conditioned EBM affordance-equivalence; dynamic energy minimum; validation: contact-rich insertion/wiping under stiffness shift, zero-shot SE(3) perturbation + unseen compliance", "status": "invalid", "kind": "node", "type": "director_decision_refused_replay_98", "queue_empty_confirmed": true, "predicted_score": null, "physical_run": false, "compare_keep": false, "segment": 15, "protocol_version": "v3", "note": "98th replay refusal of G3-retired family (N70-N76, eq78 frozen 2026-09-28; champion N74 92.3 synthetic frozen). Director proposal (iter 59, single-brain fallback muse-spark-1.3-contributor-free) proposes SE(3)-conditioned EBM energy-based attention + dynamic energy minimum + flow-bridge + force-adaptive stiffness. Mechanism untestable in canonical rig (rig rigid flat-top, friction U[0.05,0.80] only; NO stiffness/slip/deformable/contact-shift/SE3-perturbation/energy-attention/contact-energy/force-adaptive suite). Queue empty since run 497. N198/N478d open_needs_director NOT queued. No synthetic/proxy claim permitted (restroom_sim banned G2). No arithmetic coverage/success (G7). No teleport. Gate untouched. Equations unchanged. Champion trochoid frozen B=1.00 Fisher p=0.0083. Verdict INVALID \u2014 replay refusal; mechanism untestable; no physical evidence; no equation change; director must open non-G3 axis (N198/N478d) or confirm segment 15 close."}
{"id": "edge_787_788", "from": "ITER98-FACC-DIRECTOR-787", "to": "ITER99-FACC-SE3-DIRECTOR-788", "kind": "edge", "type": "refusal_then_refusal", "run_from": 787, "run_to": 788, "note": "98th G3 replay refusal (run 788); FACC-SE3 / SE(3)-conditioned EBM / energy-attention / dynamic energy minimum / flow-bridge / force-adaptive / contact-rich insertion-wiping-stiffness-shift / zero-shot SE(3) perturbation + unseen compliance replay refused; mechanism untestable in canonical rig; director steer documented (iter 59); no synthetic/proxy claim; no arithmetic coverage; no teleport; gate preserved; equation unchanged; champion frozen; worklog appended; evidence file saved; commit follows."}
{"id":"ITER100-FACC-DIRECTOR-789","run":789,"idea_tag":"FACC iter-60 (director iter 60, single-brain fallback: opencode-responses/muse-spark-1.3-contributor-free): Force-Adaptive Contact Control (FACC) — SE(3)-conditioned force-adaptive contact controller; energy-based physical in-context attention; flow-matching -> affordance-equivalence via contact-energy; validation: 3 contact-rich tasks + stiffness + SE(3) pose shift; metric: success + force-limit violation; predicted 78/100 (synthetic, no paired artifact)","status":"invalid","kind":"node","type":"director_decision_refused_replay_99","queue_empty_confirmed":true,"predicted_score":78,"physical_run":false,"compare_keep":false,"segment":15,"protocol_version":"v3","note":"99th replay refusal of G3-retired family (N70-N76 frozen synthetic 2026-09-28; eq78 frozen; champion N74 92.3 synthetic frozen; only validated champion = trochoid fixture_B=1.00 Fisher p=0.0083). Mechanism untestable in canonical rig (rig rigid flat-top friction U[0.05,0.80] only; no stiffness/deformable/slip/contact-shift/SE3-perturbation/contact-rich/energy-attention/contact-energy/force-adaptive suite). Queue empty since run 497; N198/N478d open_needs_director NOT queued. No synthetic/proxy claim (restroom_sim banned G2/G7). No arithmetic coverage/success (G7). No teleport. Gate untouched (hard gate preserved). Equations unchanged (no new row; eq78 frozen). Refusal prevents fabricated G7-invalid claim; director must open non-G3 axis (N198/N478d) or confirm segment 15 close."}
{"id":"edge_788_789","from":"ITER99-FACC-SE3-DIRECTOR-788","to":"ITER100-FACC-DIRECTOR-789","kind":"edge","type":"refusal_then_refusal","run_from":788,"run_to":789,"note":"99th G3 replay refusal (run 789); FACC / SE(3)-conditioned / force-adaptive / energy-attention / flow-match->affordance-equivalence / contact-energy / stiffness-shift / SE3-perturbation / contact-rich suite replay refused; mechanism untestable in canonical rig; director steer (iter 60, muse-spark-1.3-contributor-free) documented; no synthetic/proxy claim; no arithmetic coverage/success estimation; no teleport; gate untouched; equation unchanged; champion trochoid frozen; worklog appended; evidence file saved; commit follows; next must be director-authorised non-G3 axis (N198/N478d) or segment close."}
{"id":"ITER101-SEAF-FACC-DIRECTOR-790","run":790,"idea_tag":"SEAF-FACC iter-61 (director iter 61, single-brain fallback: opencode-responses/muse-spark-1.3-contributor-free): SE(3) Energy-Adaptive Affordance Flow — SE(3)-conditioned energy-based in-context attention over contact-energy manifold, dynamic affordance field E_dynamic(x,t), FACC stiffness from energy score, flow-matching -> affordance-equivalence bridge; predicted 78/100","status":"invalid","kind":"node","type":"director_decision_refused_replay_100","queue_empty_confirmed":true,"predicted_score":78,"physical_run":false,"compare_keep":false,"segment":15,"protocol_version":"v3","note":"100th replay refusal of G3-retired family (N70-N76/eq78/manifold-switch/flow-bridge/energy-gated/EBM/FACC-SE3/E-FACC/EB/DAFE/PAITC/VAEF/N84/N76b; frozen 2026-09-28; champion N74 92.3 synthetic frozen; only validated physical champion = trochoid fixture_B=1.00 Fisher p=0.0083). Director proposal (iter 61, muse-spark-1.3-contributor-free): SEAF-FACC (SE(3) Energy-Adaptive Affordance Flow) — SE(3)-conditioned flow predicts dynamic affordance field; energy-based physical in-context attention; FACC stiffness modulation from energy score; replaces pi0 fixed expert; bridge flow-matching -> affordance-equivalence; validation SE(3) pose + stiffness perturbation suite. Mechanism untestable in canonical rig (rig rigid flat-top friction U[0.05,0.80]; no stiffness/deformable/slip/contact-shift/SE3-perturbation/energy-attention/contact-energy suite). Queue empty since run 497. N198/N478d open_needs_director NOT queued. No synthetic/proxy claim (restroom_sim banned G2/G7). No arithmetic coverage/success (G7). Gate untouched. Equations unchanged (eq78 frozen). Refusal completes 100 consecutive G3 replays (runs 691-790); director must open non-G3 axis (N198/N478d) or confirm segment 15 close."}
{"id":"edge_789_790","from":"ITER100-FACC-DIRECTOR-789","to":"ITER101-SEAF-FACC-DIRECTOR-790","kind":"edge","type":"refusal_then_refusal","run_from":789,"run_to":790,"note":"100th G3 replay refusal (run 790); SEAF-FACC / SE(3)-conditioned energy-adaptive affordance flow / dynamic affordance field / EBM attention / FACC stiffness / flow-bridge / affordance-equivalence family replay refused; mechanism absent; director steer documented (iter 61, muse-spark-1.3-contributor-free); no synthetic/proxy claim; no arithmetic coverage/success; no teleport; gate untouched; equation unchanged (eq78 frozen); champion trochoid frozen B=1.00 Fisher p=0.0083; worklog appended; evidence file saved; commit follows; 100 consecutive G3 replay refusals complete (691-790); next must be director-authorised non-G3 axis (N198/N478d) or segment-15 close."}
{"id": "ITER102-FACC-SE3-DIRECTOR-791", "run": 791, "idea_tag": "FACC-SE3 iter-62 (director single-brain fallback muse-spark-1.3-contributor-free): SE(3)-conditioned Force-Adaptive Contact Control \u2014 dynamic affordance manifold E_dynamic(x,t) + energy-based in-context attention + SE(3) conditioning + flow-matching->affordance-equivalence bridge; predicted 78/100", "status": "invalid", "kind": "node", "type": "director_decision_refused_replay_101", "queue_empty_confirmed": true, "predicted_score": 78, "physical_run": false, "compare_keep": false, "segment": 15, "protocol_version": "v3", "note": "101st replay refusal of G3-retired family (N70-N76/eq78/manifold-switch/flow-bridge/energy-gated/EBM/FACC-SE3/E-FACC; frozen 2026-09-28). Director proposal (iter 62, single-brain fallback muse-spark-1.3-contributor-free) proposes FACC-SE3 replacing flow-matching head with SE(3)-conditioned dynamic energy field. Mechanism untestable in canonical rig (rig rigid flat-top friction U[0.05,0.80] only; no stiffness/deformable/slip/contact-shift/SE3-perturbation/energy-attention/contact-energy/dynamic-affordance-field/stiffness-modulation suite). Queue empty since run 497. N198/N478d open_needs_director NOT queued. No synthetic/proxy claim (restroom_sim banned G2/G7). No arithmetic coverage/success (G7 integrity). No teleport. Gate untouched (hard gate preserved). Equations unchanged (no new equation row; eq78 frozen at row 84). Champion trochoid fixture_B transfer_success=1.00 Fisher p=0.0083 frozen. Refusal prevents fabricated claim; director must open non-G3 axis (N198/N478d) or confirm segment 15 close."}
{"id": "edge_790_791", "from": "ITER101-SEAF-FACC-DIRECTOR-790", "to": "ITER102-FACC-SE3-DIRECTOR-791", "kind": "edge", "type": "refusal_then_refusal", "run_from": 790, "run_to": 791, "note": "101st G3 replay refusal (run 791); FACC-SE3 / SE(3)-conditioned / dynamic affordance manifold / energy-attention / flow-bridge / force-adaptive / stiffness-modulation / contact-rich suite replay refused; mechanism untestable; director steer (iter 62) documented; queue empty; no synthetic/proxy; no arithmetic coverage; no teleport; gate preserved; equations unchanged; champion frozen; worklog appended; evidence file saved; commit follows; 101 consecutive G3 replay refusals (691-791) complete; next must be director-authorised non-G3 axis or segment close."}
{"id": "ITER103-FACC-SE3-DIRECTOR-792", "run": 792, "idea_tag": "FACC-SE3 iter-63 (director iter 63, single-brain fallback: muse-spark-1.3-contributor-free)", "status": "invalid", "kind": "node", "type": "director_decision_refused_replay_102", "segment": 15, "queue_empty_confirmed": true, "physical_run": false, "compare_keep": false, "predicted_score": 78, "protocol_version": "v3", "note": "102nd replay refusal of G3-retired family (N70-N76/eq78/manifold-switch/flow-bridge/energy-gated/EBM/FACC-SE3/E-FACC/EB/DAFE/PAITC/VAEF/N84/N76b/SEAF-FACC; frozen 2026-09-28). Director proposal (iter 63, single-brain fallback muse-spark-1.3-contributor-free) proposes SE(3)-conditioned Force-Adaptive Contact Control with dynamic affordance manifold + energy-based attention + flow-bridge. Mechanism untestable in canonical rig (rigid flat-top friction U[0.05,0.80] only; no stiffness/deformable/slip/contact-shift/SE3-perturbation/energy-attention/contact-energy/dynamic-affordance-field/stiffness-modulation suite). Queue empty since run 497 (ideas.md s0). N198/N478d open_needs_director NOT queued. No synthetic/proxy claim (restroom_sim banned G2/G7). No arithmetic coverage/success estimation (G7 integrity). No teleport. Gate untouched (hard gate preserved; no replacement by learned/energy/adaptive soft-gate). Equations unchanged (equations.md row 84 frozen; no new equation row). Champion trochoid fixture_B transfer_success=1.00 Fisher p=0.0083 frozen (physical 20 seeds paired, results/aegis_v2/*.jsonl certified). Refusal prevents fabricated claim; director must either open director-authorised non-G3 axis (N198/N478d) or confirm segment-15 close; NO further G3 replay proposals permitted."}
{"id": "edge_791_792", "from": "ITER102-FACC-SE3-DIRECTOR-791", "to": "ITER103-FACC-SE3-DIRECTOR-792", "kind": "edge", "type": "refusal_then_refusal", "run_from": 791, "run_to": 792, "note": "102nd G3 replay refusal (run 792); FACC-SE3 / SE(3)-conditioned / energy-attention / flow-bridge / affordance-equivalence / dynamic affordance manifold / force-adaptive stiffness replay refused; mechanism untestable; director steer (iter 63, muse-spark-1.3-contributor-free) documented; queue empty; champion trochoid frozen B=1.00 Fisher p=0.0083; worklog/appended; evidence saved; commit follows."}
{"id": "ITER103-FACC-SE3-DIRECTOR-793", "run": 793, "idea_tag": "FACC-SE3 iter-64 (director iter 64, single-brain fallback: muse-spark-1.3-contributor-free): SE(3)-conditioned Force-Adaptive Contact Control \u2014 dynamic affordance manifold E_dynamic(x,t) + energy-based physical in-context attention + flow-bridge; predicted 78/100", "status": "invalid", "kind": "node", "type": "director_decision_refused_replay_103", "queue_empty_confirmed": true, "predicted_score": 78, "physical_run": false, "compare_keep": false, "segment": 15, "protocol_version": "v3", "note": "103rd replay refusal of G3-retired family (N70-N76/eq78/manifold-switch/flow-bridge/energy-gated/EBM/FACC-SE3; frozen 2026-09-28; champion N74 92.3 synthetic frozen; only validated champion = trochoid B=1.00 Fisher p=0.0083). Mechanism untestable in canonical rig (rigid flat-top friction U[0.05,0.80] only; no stiffness/deformable/slip/contact-shift/SE3-perturbation/energy-attention/contact-energy/dynamic-field/stiffness-modulation suite). Queue empty since run 497; N198/N478d open_needs_director NOT queued. Director must open non-G3 axis (N198/N478d) or confirm segment-15 close."}
{"id": "edge_792_793", "from": "ITER102-FACC-SE3-DIRECTOR-792", "to": "ITER103-FACC-SE3-DIRECTOR-793", "kind": "edge", "type": "refusal_then_refusal", "run_from": 792, "run_to": 793, "note": "103rd G3 replay refusal (run 793); FACC-SE3 / SE(3)-conditioned / dynamic affordance manifold / energy-based attention / flow-bridge / affordance-equivalence / force-adaptive / contact-rich family replay refused; mechanism untestable; director steer documented (iter 64); no synthetic/proxy claim; no arithmetic coverage/success; no teleport; gate untouched (hard); equations unchanged (eq78 frozen); champion frozen; worklog appended; evidence saved; next must be director-authorised non-G3 axis (N198/N478d) or segment-15 close."}
{"id": "N794", "metric": 0.0, "parent": "N84", "status": "discarded", "strategy": "Force-Adaptive Contact Control SE(3)-conditioned (FACC-SE3): energy-based physical in-context attention over wrench + pose, dynamic affordance field; synthetic proxy only; kill rule triggered (fixture_B < 0.70)", "timestamp": 1789816000, "type": "node"}
{"from": "N84", "kind": "derived", "to": "N794", "type": "edge", "timestamp": 1789816000, "label": "FACC-SE3: flow-matching -> affordance-equivalence bridge (discarded by kill rule)"}
