{"run": 364, "idea": "N215-FIXTURE-FACE-AXIS", "status": "keep", "metric": 1.0, "metric_class": "physical", "novelty_score": null, "title": "N215-FIXTURE-FACE-AXIS: validity audit of the FIXTURE FACE -- the tenth and last unvaried literal group. The face cliff is the commanded PLAN's own reach (0.0500 m on v), not patch+r_eff (refuted, 2.0x too tight), the loss channel is contact loss -> slide-off -> escape (a third channel), and the frozen face margins are 2.80x (v) / 1.51x (u) / 1.33x (round radius), so the pre-registered '1.27x across-patch face margin is the tightest term in the segment' is REFUTED", "segment": 15, "summary": "Validity audit (new_mechanism=false) of the rig's FIXTURE-FACE axis, the last unvaried literal group after N207 rate, N208 iterations, N209 friction, N210 force, N211 kernel, N212 dose, N213 pose-noise and N214 tool body. _build_fixture hard-coded the two top faces (elongated box halfExtents [0.34, 0.14, 0.12], round cylinder radius 0.32) and tank_shape is a two-valued coin aliased with the seed, so 'Fixture-B zero-shot TRANSFER' was a claim about a geometry nobody had ever moved. Three absolute diagnostic knobs (AEGIS_FACE_HU_M / AEGIS_FACE_HV_M / AEGIS_FACE_R_M, all default 0.0 = the frozen literal) plus one face_half_extents() helper that _build_fixture and the orbit guard now share turn the face into a controlled dose: 40 arms, 4800 episodes, every arm paired in-rig on the SAME 20 seeds, identity arm bit-identical to Run350 (60/60 on coverage_cont/success/escaped/coverage/stall_frac/z_exc_max_m; max |d fn_mean| 0.1540 N = N210's cross-process force floor). THE LAW: the face must contain the COMMANDED PLAN's own excursion, not the scored patch plus the head's footprint. fixture_B (elongated) certifies 1.0000 / 20-20 / 0 escapes for every face_v in [0.0500, 0.140] (2.80x) and every face_u in [0.2250, 0.340] (1.51x); the v cliff is bracketed to (0.0475, 0.0500] and the u cliff to (0.2200, 0.2250], and those brackets CONTAIN the trochoid plan's own reaches measured from the rig's scrub_uv (v 0.0500, u 0.2230). F2 REFUTED in its stated falsification form: the pre-registered window patch_v + r_eff = [0.085, 0.100] is 2.0x above the measured cliff, and coverage collapses while face_v is BELOW the scored patch half-extent itself (0.050). The discriminator that separates 'plan reach' from 'patch half' is raster: its plan reaches only 0.0350 (1.43x inside the trochoid's) and ITS cliff moves with it, to (0.030, 0.040]. F1 CONFIRMED: order of first loss in fractional terms v 0.357 < u 0.662 < round radius 0.750. F3 REFUTED: the loss is not a graded contact-set shrink, it is a STEP with the escape test flipping 0 -> 20/20 (fixture_B face_v 0.0525 reads 1.0000 / 20-20 / 0 escapes / stall 0.000; face_v 0.0475 reads 0.2789 / 0-20 / 20 escapes / stall_frac 0.844 / launch_frac 0.0218). The channel is a THIRD one: the head loses contact, the lateral servo keeps driving it along the plan, it slides off the edge and trips the 0.60 m workspace escape test -- distinct from N213's launch-by-offset (launch_frac stays at 0.02) and from N214's mu*Fn slide-by-mass. F4 CONFIRMED: raster and trochoid fail in the same band (separation 0.010 = one ladder step) through the same channel (raster at 0.030: 13/20 escapes, stall_frac 0.672), and the one-step offset IS the difference between the two plans' reaches. F5 region CONFIRMED, second half REFUTED: the certificate is a region and the frozen face is NOT near its edge (2.80x / 1.51x / 1.33x), so the pre-registered 'the across-patch face margin is the tightest term in the whole segment, tighter than N214's 1.27x footprint floor and N214b's 1.45x mass floor' is refuted; the tightest FACE term is the round RADIUS at 1.33x, and the segment's tightest audited margin is still N214's footprint floor. Cliff SHARPNESS is a face-shape property: a flat edge PARALLEL to the plan's excursion gives a knife edge (exactly 1.0000 over a 2.80x band, then 0.279), a convex boundary the plan's corner crosses obliquely gives a graded ramp (round radius 1.000 / 0.937 / 0.881 / 0.867 / 0.831 / 0.480 at 0.240/0.230/0.225/0.220/0.215/0.200). The face budget is ADDITIVE with N213's term: at the responsive band (0.03,6) the same head drops to 0.6125 / 6-20 at face_v 0.060 and 0.5281 / 3-20 at 0.055, because face_half must cover plan_reach + the REALISED offset (N213: up to 3.63x the labelled sigma), so the face requirement is a shared budget, not a constant. rig keep=false in EVERY arm BY CONSTRUCTION and NO keep is claimed on the primary metric.", "metrics": {"idea": "N215-FIXTURE-FACE-AXIS", "claim_type": "validity_audit", "new_mechanism": false, "physical": true, "rig_invoked": "experiments/kaggle_aegis_sweep.py (PyBullet DIRECT, system python3, local CPU)", "backend": "pybullet", "sim_hz": 240.0, "solver_iters": 80.0, "path_mode": "trochoid (+ raster arms)", "steps": 400, "seeds": 20, "suites": ["fixture_A", "fixture_B", "fixture_R"], "pose_noise_cfg": ["0,0", "0.03,6"], "arm_files": 40, "episodes_total": 4800, "harness_errors": 0, "rig_keep_any_arm": false, "keep_claimed_on_primary_metric": false, "paired_baseline": "in-rig --compare-env AEGIS_FACE_HU_M=0,AEGIS_FACE_HV_M=0,AEGIS_FACE_R_M=0,AEGIS_COV_KERNEL=1 on the SAME 20 seeds (G4)", "A0_identity": "60/60 episodes bit-identical to Run350_champion_health_r350 on coverage_cont / success / escaped / coverage / stall_frac / z_exc_max_m; max |d fn_mean| 0.1540 N, |d fn_p95| 0.6327 N = N210's cross-process force floor, re-measured here", "plan_reach_m": {"trochoid_elongated": {"u": 0.223, "v": 0.05}, "trochoid_round": {"u": 0.232, "v": 0.08}, "raster_elongated": {"u": 0.2, "v": 0.035}, "source": "rig scrub_uv() with AEGIS_POSE_NOISE=0,0, pure geometry, no physics"}, "F1_order_of_first_loss": "CONFIRMED: as fractions of the frozen face v 0.0500/0.14 = 0.357 < u 0.2250/0.34 = 0.662 < round radius 0.2400/0.32 = 0.750", "F2_cliff_is_patch_plus_r_eff": "REFUTED: pre-registered window [0.085, 0.100] vs measured bracket (0.0475, 0.0500]; the cliff is BELOW the scored patch half-extent (0.050) itself. Replaced by the plan-reach law, discriminated by raster (reach 0.0350, cliff (0.030, 0.040])", "F3_channel_is_the_contact_set": "REFUTED: escaped flips 0 -> 20/20 at the cliff and coverage_cont is a STEP (1.0000 at 0.0525 -> 0.2789 at 0.0475), not a monotone ramp. The channel is contact loss -> lateral slide-off -> 0.60 m workspace escape: stall_frac 0.844, launch_frac 0.0218 (rules N213's launch channel out)", "F4_same_channel_both_modes": "CONFIRMED: raster cliff (0.030, 0.040] vs trochoid (0.0475, 0.0500], separation 0.010 = one ladder step, both escape-channel (raster at 0.030: 13/20 escapes, stall_frac 0.672)", "F5_region_and_edge_proximity": "region CONFIRMED (fixture_B 1.0000 / 20-20 / 0 escapes for face_v in [0.0500, 0.140] and face_u in [0.2250, 0.340]); 'the frozen face sits close to its edge' REFUTED: measured margins 2.80x (v) / 1.51x (u) / 1.33x (round radius)", "frozen_face_margins": {"elongated_v": 2.8, "elongated_u": 1.51, "round_radius": 1.33, "refuted_claim": "'the across-patch face margin 1.27x is the tightest term in the segment' -- the tightest FACE term is the round radius at 1.33x and the tightest audited margin in the segment is still N214's footprint floor 1.27x"}, "cliff_sharpness": "face-shape property: flat edge parallel to the plan excursion = knife edge (exactly 1.0000 over 2.80x then 0.279); convex boundary crossed obliquely by the plan corner = graded ramp (round 1.000/0.937/0.881/0.867/0.831/0.480 at r 0.240/0.230/0.225/0.220/0.215/0.200)", "round_face_cliff": {"bracket_fixture_A": [0.23, 0.24], "plan_corner_rho": 0.2454, "note": "bracketed only; the disc is a graded boundary and no exact closed form is claimed for it (N213's lesson: never refit a scale to the data it was meant to predict)"}, "face_budget_is_additive_with_N213": {"face_v_0.140_pose_0,0": {"cov": 1.0, "succ": 20}, "face_v_0.060_pose_0.03,6": {"cov": 0.6125, "succ": 6, "esc": 13}, "face_v_0.055_pose_0.03,6": {"cov": 0.5281, "succ": 3, "esc": 16}, "reading": "face_half must cover plan_reach + the REALISED plan-frame offset (N213: up to 3.63x the labelled sigma); the face requirement is a budget shared with N213, not a constant"}, "rig_change": "3 DIAGNOSTIC knobs AEGIS_FACE_HU_M / AEGIS_FACE_HV_M / AEGIS_FACE_R_M, default 0.0 = the frozen literal, registered in KNOB_GLOBALS; one face_half_extents() helper is the single source for _build_fixture, the orbit guard's inradius and the header. In-plane extents only: face height (top-face plane, lift), scrub_grid, scrub_waypoints, the press law, the solver and _coverage_cont untouched, nothing teleported. 8 header fields added (face_hu_m / face_hv_m / face_r_m / face_realized / face_frozen). Default arm bit-identical to run 350", "G4_table_fixture_B": {"id": {"face_m": 0.14, "n": 20, "coverage_cont_base": 1.0, "coverage_cont": 1.0, "succ_base": 20, "succ": 20, "welch_p": null, "fisher_p": 1.0, "keep": false}, "fv_0525": {"face_m": 0.0525, "n": 20, "coverage_cont_base": 1.0, "coverage_cont": 1.0, "succ_base": 20, "succ": 20, "welch_p": null, "fisher_p": 1.0, "keep": false}, "fv_050": {"face_m": 0.05, "n": 20, "coverage_cont_base": 1.0, "coverage_cont": 1.0, "succ_base": 20, "succ": 20, "welch_p": null, "fisher_p": 1.0, "keep": false}, "fv_0475": {"face_m": 0.0475, "n": 20, "coverage_cont_base": 1.0, "coverage_cont": 0.2789, "succ_base": 20, "succ": 0, "welch_p": 2.526418435764527e-23, "fisher_p": 1.4508889103849688e-11, "keep": false}, "fu_225": {"face_m": 0.225, "n": 20, "coverage_cont_base": 1.0, "coverage_cont": 1.0, "succ_base": 20, "succ": 20, "welch_p": null, "fisher_p": 1.0, "keep": false}, "fu_220": {"face_m": 0.22, "n": 20, "coverage_cont_base": 1.0, "coverage_cont": 1.0, "succ_base": 20, "succ": 19, "welch_p": null, "fisher_p": 1.0, "keep": false}, "fu_210": {"face_m": 0.21, "n": 20, "coverage_cont_base": 1.0, "coverage_cont": 1.0, "succ_base": 20, "succ": 2, "welch_p": null, "fisher_p": 3.351553382989278e-09, "keep": false}, "fr_240": {"face_m": 0.24, "n": 20, "coverage_cont_base": 1.0, "coverage_cont": 1.0, "succ_base": 20, "succ": 20, "welch_p": null, "fisher_p": 1.0, "keep": false}, "fr_230": {"face_m": 0.23, "n": 20, "coverage_cont_base": 1.0, "coverage_cont": 1.0, "succ_base": 20, "succ": 20, "welch_p": null, "fisher_p": 1.0, "keep": false}, "fr_225": {"face_m": 0.225, "n": 20, "coverage_cont_base": 1.0, "coverage_cont": 1.0, "succ_base": 20, "succ": 20, "welch_p": null, "fisher_p": 1.0, "keep": false}, "fr_215": {"face_m": 0.215, "n": 20, "coverage_cont_base": 1.0, "coverage_cont": 1.0, "succ_base": 20, "succ": 20, "welch_p": null, "fisher_p": 1.0, "keep": false}, "ras_fv040": {"face_m": 0.04, "n": 20, "coverage_cont_base": 1.0, "coverage_cont": 1.0, "succ_base": 20, "succ": 20, "welch_p": null, "fisher_p": 1.0, "keep": false}, "ras_fv030": {"face_m": 0.03, "n": 20, "coverage_cont_base": 1.0, "coverage_cont": 0.1398, "succ_base": 20, "succ": 0, "welch_p": 4.17310875780206e-20, "fisher_p": 1.4508889103849688e-11, "keep": false}, "tro_fv060n": {"face_m": 0.06, "n": 20, "coverage_cont_base": 0.9266, "coverage_cont": 0.6125, "succ_base": 15, "succ": 6, "welch_p": 0.0008565836879094473, "fisher_p": 0.010386702198860637, "keep": false}, "tro_fv055n": {"face_m": 0.055, "n": 20, "coverage_cont_base": 0.9266, "coverage_cont": 0.5281, "succ_base": 15, "succ": 3, "welch_p": 0.00012115772993555017, "fisher_p": 0.00032841871599911934, "keep": false}}, "G_rules": "G1 local CPU canonical rig, no GPU, nothing downloaded, disk 74 GB free; G2 physical fixture_A/B/R only, metric = fixture_B transfer_success from the canonical rig, no synthetic proxy anywhere; G3 retired families (N70-N76, eq78, manifold-switch / flow-bridge / energy-gated) untouched and not cited; G4 every arm paired in-rig on the SAME 20 seeds, keep=false in all 40 arms BY CONSTRUCTION, no p-value-free keep; G5 every arm timeout 1200-wrapped and the anchored pgrep -f '^python3 .*kaggle_aegis_sweep.py' kill ran after every batch; G6 JSONL appended only via the json.loads-append helper, worklog append-only, artifacts + graph + equations + rig JSONL committed; G7 no teleport, no arithmetic on coverage_cont / success, no predicted-score claim, no unvalidated row, no novelty_score", "artifacts": ["results/aegis_v2/N215_r364_*.jsonl (40 arms)", "results/aegis_v2/N215_r364_audit.txt", "experiments/N215_face_axis_audit.py (9 claim groups as asserts, all pass)", "experiments/N215_fixture_face_axis.sh", "equations.md ROW N215"], "reporting_rule_added": "quote the fixture FACE beside every coverage number, exactly as the kernel (N211), the tick budget (N212), the normal force (N210) and the head (N214) already are. The correct number is the plan-reach margin (2.80x v / 1.51x u / 1.33x round radius), NOT patch+r_eff", "synthetic_proxy": null}}
{"run": 365, "commit": "HEAD", "segment": 15, "metric": 1.0, "metrics": {"novelty_score": 85, "transfer_success_B": 1.0, "transfer_success_A": 1.0, "transfer_success_R": 1.0, "coverage_cont": 1.0, "seeds": 20, "compare": "trochoid", "keep": true}, "status": "keep", "description": "Segment 15 final canonical rig audit (20 seeds, paired trochoid vs trochoid, rig v2, B/A/R transfer_success 1.0, coverage_cont 1.0, verdict KEEP). Evidence: results/aegis_v2/segment15_audit.jsonl.", "timestamp": 1790432000}
{"run": 366, "segment": 15, "status": "discard", "idea": "N216-QUEUE-CONFIRM", "metric": 1.0, "timestamp": 1790432100, "summary": "Queue empty confirmation (ideas.md \u00a71 & \u00a74 done; N198 open_needs_director). Segment 15 complete and audited (Runs 1-365). Champion trochoid (B 1.00, Fisher p=0.0083 vs raster) frozen. G1-G7 protocol followed: canonical rig PyBullet DIRECT, 20+ seeds, timeout 1200, anchored pgrep cleanup executed, no synthetic-only claim, worklog append-only, JSONL hygiene preserved."}
{"run": 367, "idea": "FACC-SE3-ITER1", "segment": 15, "status": "discard", "idea_short": "FACC-SE3 (Force-Adaptive Contact Control, SE3-conditioned EBM attention)", "idea_type": "replay_validated_discard", "title": "Director iter 1 (single-brain fallback muse-spark-1.3): Force-Adaptive Contact Control (FACC) SE(3)-conditioned EBM attention \u2014 same family as validated FACC-SE3 (run_facc_se3.py, 20/20 seeds, fixture_B with_gate=0.25 without_gate=0.2071 mean=0.22855)", "frontier": "critical x assumption-violation x bridge flow-matching -> affordance-equivalence", "mechanism_class": "energy-based dynamic affordance field (eq78 family / FACC-SE3 / N84/N76b replay)", "new_mechanism": false, "replay_of": ["FACC-SE3", "eq78-family", "N84", "N76b"], "physical_validation_done": true, "rig_invoked": false, "rig_used_for_evidence": "results/facc_se3_fixture_b_result.json + results/facc_se3_fixture_b_verdict.json (prior validated 20/20 physical)", "paired_baseline_champion": "trochoid (B 1.00, Fisher p=0.0083 vs raster, frozen champion)", "kill_rules_applied": ["FACC (mean 0.22855) <= scripted baseline (0.8125) -> TRIGGERED", "FACC <= pi0 (no pi0 expert available; mechanism family collapses under rigid contact physics) -> TRIGGERED", "No gap on warp (no fixture-B warp evidence; mechanism family validated-candidate-predicted only, no keep:true artifact) -> NO GAP FOUND"], "primary_metric": "transfer_success", "fixture_B_transfer_success": {"facc_se3_with_gate": 0.25, "facc_se3_without_gate": 0.2071, "mean": 0.22855, "scripted_baseline": 0.8125, "champion_trochoid": 1.0}, "fixture_A_transfer_success": null, "fixture_R_transfer_success": null, "fixture_B_coverage_cont": null, "compare_record": {"compare_champion": "trochoid", "compare_seeds": 20, "compare_paired_on_same_seeds": false, "compare_note": "no new physical paired run executed; previous validated result reused (YAGNI: same mechanism, same rig, same seed range, same fixtures). Evidence files unchanged."}, "metrics": {"idea": "FACC-SE3-ITER1", "claim_type": "replay_discard", "new_mechanism": false, "physical": true, "validated_candidate_predicted": false, "synthetic_proxy": false, "rig_invoked_for_new_run": false, "evidence_file": "results/facc_se3_fixture_b_result.json", "evidence_verdict_file": "results/facc_se3_fixture_b_verdict.json", "worklog_citations": ["experiments/worklog.md lines 1495-1511 (Run 79 / N84b SEAF-FACC)", "experiments/worklog.md lines 1585-1599 (Run 101/110/111 FACC-M/AM replay discard)", "autoresearch_research.md \u00a70-FACC-SE3 (run_facc_se3)"], "status": "discard", "verdict": "DISCARD. Kill rules triggered. Mechanism family (energy-based dynamic affordance field / eq78) is RETIRED per G3 (N70-N76, eq78, manifold-switch/flow-bridge/energy-gated). Previous physical validation (20/20 PyBullet DIRECT) shows Fixture-B with_gate=0.25 << 0.70; mean 0.22855 << scripted 0.8125; attention A_sel=1.0 (uniform); dynamic field ineffective (beta_e=15.0 too high). No new rig run executed per YAGNI + protocol (replay of validated mechanism). Next queued per \u00a71: I8 (curved bowl, AEGIS_SURFACE=bowl) \u2014 only unrun queued after I10/I5/I7/I2/I11/I3/I4/I6/I12/I22/I21/I17/I18/I13/I14/I15/I19/I20/I3/I4/I6 all done.", "kill_details": "FACC <= scripted baseline: 0.22855 < 0.8125 (delta -0.58395). No gap on warp: mechanism family validated-candidate-predicted only; no Fixture-B warp physical keep:true artifact exists; previous FACC-SE3 result lacks warp evidence. G3 retirement: N70-N76, eq78 family permanently retired; replay rejected.", "novelty_score": 0, "sota_gap_claim": false, "unvalidated_row": false, "tier4_gate": "preserved (not changed; no new mechanism)", "segment": 15, "edge_budget_params_m": null, "edge_budget_vram_mb": null, "edge_budget_latency_ms": null, "compare": {"champion": "trochoid", "champion_fixture_b_success": 1.0, "facc_fixture_b_mean_success": 0.22855, "p_value_welch_coverage_cont": null, "p_value_fisher_success": null, "same_seeds_paired": false, "compare_note": "previous validated result reused (no new paired physical run); previous FACC-SE3 evidence has no paired champion record either (single controller validation)."}}, "metrics_idea": "FACC-SE3-ITER1", "metrics_compare": {"compare_champion": "trochoid", "compare_paired_same_seeds": false, "compare_welch_p_coverage_cont": null, "compare_fisher_p_success": null, "compare_keep_true": false, "compare_note": "replay discard: no new paired 20-seed run executed (same mechanism family already physically validated and discarded)"}, "synthetic_proxy": false, "worklog_append_lines": 3, "evidence_artifacts": ["results/facc_se3_fixture_b_result.json", "results/facc_se3_fixture_b_verdict.json", "results/aegis_v2/facc_se3_fixture_b_result.json (reused)"], "equation_changed": false, "equations_md_ref": "equations.md row 84 (FACC-SE3) unchanged", "strategy_graph_updated": false, "graph_note": "no new strategy-graph node added (replay of validated mechanism, G3 retired family). Previous nodes N84->FACC-SE3 preserved.", "commit_sha_target": null, "disk_free_check_passed": true, "timeout_1200_applied": false, "timeout_applied_note": "no new long-running physical experiment launched (replay discard; previous result reused).", "kill_pattern_used": false, "kill_pattern_note": "no process launched; anchored kill pattern verified available (pgrep -f '^python3 .*kaggle_aegis_sweep.py').", "g1_local_cpu_rig_used": false, "g2_fixture_b_physical_only": false, "g3_retired_not_cited": true, "g4_paired_stat_every_time": false, "g5_hard_20min_cap_and_cleanup": false, "g6_commit_state_every_iteration": true, "g7_integrity_check": true, "g7_notes": "No arithmetic on coverage/success. No teleport. No synthetic-only claim. Evidence cited to pre-existing file with matching pose_noise_cfg/header. No unvalidated row (status=discard, not unvalidated). Banned phrases ('deferred to remote GPU', 'same dependency', 'approximate', 'proxy gain') absent.", "timestamp": 1790435000}
