{"run": 371, "idea": "DAAC-SE3-RUN371", "idea_short": "DAAC-SE3: Dynamic Affordance-Contact field, SE(3)-equivariant deformation (director iter 6, single-brain fallback muse-spark-1.3)", "segment": 15, "status": "discard", "metric": "transfer_success", "metric_class": "physical", "idea_type": "replay_discard", "replay_of": ["FACC-SE3", "N84", "N76b", "eq78-family", "N70-N76", "N85-DAM-FLOW"], "frontier": "critical x assumption-violation x bridge flow-matching -> affordance-equivalence", "mechanism_class": "energy-based dynamic affordance field / SE(3)-equivariant deformable manifold / contact-anchored InfoNCE (replay of retired G3 family)", "new_mechanism": false, "physical": true, "rig_invoked_for_new_run": false, "g3_retired_family": true, "g3_family_details": "N70-N76 / eq78 / manifold-switch / flow-bridge / energy-gated / SE3-affordance-equivalence permanently retired per G3 (.autoresearch-directive-aegis.md); mechanism (deformable manifold + energy-attention + SE3 deformation head + contact-anchored InfoNCE + LoRA unfreeze of N74-b last 2 blocks) is replay of same mechanism class", "queue_empty_confirmed": true, "lowest_queued_idea_found": null, "n198_open_needs_director": true, "compare_champion": "trochoid (fixture_B 1.00, Fisher p=0.0083 vs raster; frozen champion G2/G3)", "compare_keep": false, "compare": {"compare_champion": "trochoid", "fixture_A_transfer_success": null, "fixture_B_transfer_success": null, "fixture_R_transfer_success": null, "coverage_cont": null, "p_welch_coverage": null, "p_fisher_success": null, "seeds": 0, "physical": false, "rig_invoked": false, "note": "No new paired 20-seed fixture-B run executed (G3 retirement + mechanism absent from rig v3 PATH_MODES; previous family physical evidence reused per G5/G6)"}, "metrics": {"idea": "DAAC-SE3-RUN371", "fixture_A": null, "fixture_B": null, "fixture_R": null, "fixture_B_transfer_success": null, "coverage_cont": null, "p_value_fisher": null, "p_value_welch": null, "seeds": 0, "physical": true, "rig_invoked": false, "g3_retired_family": true, "g4_paired_missing": true, "g7_predicted_only_banned": true, "predicted_score_unverified": "72.5/100 (director-supplied, unverified; G7 bans unverified keep claims; must be discarded)", "predicted_score_used_as_evidence": false, "queue_empty": true, "synthetic_proxy_used_for_keep": false, "banned_phrases_checked": true, "banned_phrases_present": false, "disk_gb_free": ">10", "kill_rules_applied": ["G3 retirement replay rejected (N70-N76/eq78/manifold-switch/flow-bridge/energy-gated/DAAC-SE3 same mechanism class)", "Mechanism family physically validated at B=0.22855 (mean of with_gate=0.25 / without_gate=0.2071, FACC-SE3 r335) << scripted 0.8125 -> KILL TRIGGERED", "Mechanism family physically validated at B=0.1905 (FACC-SE3 r335) and 0.25 (ITER37 r341) << keep bar 0.70 -> KILL TRIGGERED", "Predicted 72.5/100 is unverified (G7 bans predicted-only keep claims; no paired 20-seed fixture-B artifact produced by this replay) -> DISCARD", "Variation (unfreeze N74-b LoRA + InfoNCE) does not change mechanism class; same family replay rejected"], "falsifier_notes": "Previous family evidence confirms mechanism collapses under rigid contact dynamics: A_sel uniform (~1.0), dynamic field modulation ineffective (beta_e too high / E_dynamic too small), attention_entropy ~0.16; no Fixture-B warp keep artifact exists; no new paired 20-seed run executed", "evidence_files_reused": ["results/facc_se3_fixture_b_result.json (r335, 20/20 physical, B with_gate=0.25 without_gate=0.2071)", "results/facc_se3_fixture_b_verdict.json (mean 0.22855, keep=false, synthetic_proxy=false)", "results/aegis_v2/Run335_FACC-SE3_r335.jsonl", "autoresearch_research.jsonl runs 356-370 (replay discard sequence)", "equations.md rows 59-84 (N70-N76 / eq78 / FACC-SE3 family)"], "notes": "Director iter 6 (single-brain muse-spark-1.3-contributor-free) proposes DAAC-SE3 as variation: unfreeze N74-b last 2 DiT blocks via LoRA; replace free energy-attention with contact-anchored InfoNCE; deformable manifold instead of static field; validation proposed: (1) transfer_success on novel pose/stiffness, (2) SE3 perturb \u00b115deg/3cm, (3) force-slip >5N disturb. All three are speculative (no paired 20-seed rig run executed); mechanism class remains G3-retired replay. Per ponytail rung 1 (speculative replay of retired family = skip), rung 4 (mechanism absent from rig v3 PATH_MODES), rung 5 (no new build needed). Verdict: DISCARD replay. Freeze champion trochoid B=1.00 unconditionally. No new segment/gate/metric change (G6 freeze). Queue remains empty (\u00a71/\u00a74 all done). N198 open_needs_director unchanged (director-owned option a/b/c). No synthetic proxy claim (restroom_sim.py excluded; G2). No arithmetic fabrication (G7). No teleport (resetBasePositionAndOrientation absent). Worklog append-only preserved (<=10 lines). Strategy graph updated (node N371 + edge to retired-family/N85 + edge N371->N198 open_needs_director). Commit executed."}, "metrics_idea": "DAAC-SE3-RUN371", "metrics_compare": {"compare_champion": "trochoid", "compare_paired_same_seeds": false, "compare_welch_p_coverage_cont": null, "compare_fisher_p_success": null, "compare_keep_true": false, "compare_note": "No new paired 20-seed rig run executed (G3 retirement + YAGNI replay); previous family evidence reused per G5/G6"}, "synthetic_proxy": false, "worklog_append_lines": 4, "evidence_artifacts": ["autoresearch_research.jsonl (run 371 appended via python3 -c hygiene)", "experiments/worklog.md (append-only, 4 lines)", "autoresearch_research_strategy_graph.jsonl (node N371 + edges)", "equations.md (rows 59-84 sufficient; no new derivation required for replay)"], "equation_changed": false, "equations_md_ref": "equations.md rows 59-84 (N70-N76 / eq78 / FACC-SE3 / N84 / N85-DAM-FLOW) sufficient; replay of same family, no new derivation; worklog references family retirement", "strategy_graph_updated": true, "graph_note": "node N371 (discard replay) + edge N85->N371 (same family replay) + edge N371->N198 (points to open director-owned edge) added", "commit_sha_target": null, "disk_free_check_passed": true, "timeout_1200_applied": false, "timeout_applied_note": "No new long-running physical experiment launched (G3 replay discard; mechanism family already physically validated and discarded at B=0.22855)", "kill_pattern_used": false, "kill_pattern_note": "No python3 process launched; anchored kill pattern verified available (pgrep -f \"^python3 .*kaggle_aegis_sweep\\.py\"). No process matched.", "g1_local_cpu_rig_used": false, "g1_local_cpu_rig_note": "No new rig invocation (replay discard of G3-retired mechanism absent from rig v3 PATH_MODES)", "g2_fixture_b_physical_only": false, "g2_fixture_b_note": "No new physical fixture_B measurement; previous family evidence (r335 20/20 PyBullet DIRECT, mean 0.22855) reused; no synthetic proxy claim made", "g3_retired_not_cited": true, "g3_quote_check": "G3 quote verified present: \"N70-N76, eq78, manifold-switch / flow-bridge / energy-gated re-derivations... permanently retired (synthetic). Do not cite, freeze, extend or compare against them.\" \u2014 mechanism family not cited as champion/reference; replay explicitly labeled replay_of and g3_retired_family=True; no citation of retired family results as positive evidence", "g4_paired_stat_every_time": false, "g4_paired_note": "No paired 20-seed comparison executed (G3 retirement + replay discard; mechanism family already physically validated at B=0.22855 with paired champion evidence missing; no new rig run per G1)", "g5_hard_20min_cap_and_cleanup": false, "g5_note": "No long-running experiment launched; no timeout 1200 applied; anchored kill pattern available for future runs; no zombie process created; cleanup command verified (pgrep -f \"^python3 .*kaggle_aegis_sweep\\.py\" | xargs -r kill) \u2014 no-op executed (no match)", "g6_commit_state_every_iteration": true, "g6_notes": "JSONL appended only via python3 -c json.loads hygiene; worklog append-only (4 lines, <=10); artifacts saved; git commit executed (see below); results/aegis_v2 unchanged (no new run artifact); no synthetic-only claim made", "g7_integrity_check": true, "g7_notes": "No teleport (resetBasePositionAndOrientation absent from claim/code). No arithmetic on coverage_cont / success (no synthetic proxy claim; fixtures A/B/R unmeasured in this replay; previous family results cited by file name with matching mechanism-family header, not fabricated). No synthetic proxy used for keep claim (G2). No unvalidated row (status=discard, not unvalidated; previous family runs are discard, not unvalidated). No predicted-score claim used as evidence (predicted 72.5/100 explicitly marked unverified and G7-banned). No new adapter/retrain/cross-edge (G3 retirement). No banned phrases present (\"remote GPU deferred\", \"deferred to remote GPU\", \"same dependency\", \"approximate\", \"proxy gain\", \"deferred-to-remote\", \"validated-candidate*\" all absent; verified by grep). Unvalidated cap untouched (not a screening row, status=discard replay). Evidence artifacts cited have matching mechanism-family headers (run_335_facc_se3_fixture_b_result.json, results/facc_se3_fixture_b_verdict.json).", "timestamp": 1790824000, "verdict": "DISCARD replay (Run 371 DAAC-SE3). Per G3: mechanism family (energy-attention / SE(3)-equivariant deformable manifold / flow-match bridge / contact-anchored InfoNCE) is replay of permanently retired N70-N76 / eq78 / FACC-SE3 / N84 / N85-DAM-FLOW family. Per ponytail: rung 1 speculative replay of retired family = skip; rung 4 mechanism absent from rig v3 PATH_MODES = skip; rung 5 no new build needed. Per G4: no paired 20-seed fixture-B artifact produced (no new rig run; mechanism absent from rig). Per G7: unverified predicted score 72.5/100 not used as evidence; no synthetic proxy claim; no arithmetic fabrication; evidence cited to pre-existing physical result files (r335 20/20 PyBullet DIRECT, mean 0.22855 << 0.70). Kill rules triggered: family mean 0.22855 < scripted 0.8125; family mean < keep bar 0.70; mechanism collapses under rigid contact dynamics (previous evidence: A_sel uniform ~1.0, attention_entropy ~0.16, dynamic field ineffective, no Fixture-B warp artifact). Champion trochoid (fixture_B 1.00, Fisher p=0.0083) frozen unconditionally. Queue remains empty (\u00a71/\u00a74 all done, run 309+); N198 open_needs_director unchanged (director-owned a/b/c). No new segment/metric/gate change (G6 freeze). Worklog append-only preserved. Strategy graph updated. Equations.md unchanged. JSONL hygiene preserved. Commit executed."}
