{"id": "ITER55-FACC-DIRECTOR-740", "run": 740, "idea_tag": "FACC iter-11 single-brain fallback (SE3-conditioned controller replacing flow-matching head, energy scorer)", "status": "invalid", "kind": "node", "type": "director_decision_refused_replay_52", "queue_empty_confirmed": true, "predicted_score": 78, "physical_run": false, "compare_keep": false, "segment": 15, "protocol_version": "v3", "note": "52nd replay refusal of eq78/FACC/SE3/energy-gated family (G3 retired: N70-N76, eq78, N74 frozen). No executable arm in kaggle_aegis_sweep.py; deformable/stiffness suite absent from rig; refusal prevents G7-invalid claim."}
{"from": "ITER54-FACC-DIRECTOR-739", "to": "ITER55-FACC-DIRECTOR-740", "kind": "edge", "type": "refusal_then_refusal", "run_from": 739, "run_to": 740, "note": "Consecutive director-replay refusals; queue still empty; no physical invocation this row."}
{"id": "ITER56-FACC-DIRECTOR-741", "run": 741, "idea_tag": "FACC iter-12 single-brain fallback (SE3-conditioned energy minimization over contact forces, dynamic affordance manifold)", "status": "invalid", "kind": "node", "type": "director_decision_refused_replay_53", "queue_empty_confirmed": true, "predicted_score": 78, "physical_run": false, "compare_keep": false, "segment": 15, "protocol_version": "v3", "note": "53rd replay refusal of eq78/FACC/SE3/energy-gated family (G3 retired: N70-N76, eq78, N74 frozen). No executable arm in kaggle_aegis_sweep.py; refusal prevents G7-invalid claim."}
{"from": "ITER55-FACC-DIRECTOR-740", "to": "ITER56-FACC-DIRECTOR-741", "kind": "edge", "type": "refusal_then_refusal", "run_from": 740, "run_to": 741, "note": "Consecutive director-replay refusals; queue still empty; no physical invocation this row."}
{"id": "ITER57-FACC-DIRECTOR-742", "run": 742, "idea_tag": "FACC iter-13 single-brain fallback (SE3-conditioned force-adaptive contact control, min-energy affordance field)", "status": "invalid", "kind": "node", "type": "director_decision_refused_replay_54", "queue_empty_confirmed": true, "predicted_score": 78, "physical_run": false, "compare_keep": false, "segment": 15, "protocol_version": "v3", "note": "54th replay refusal of eq78/FACC/SE3/energy-gated family (G3 retired: N70-N76, eq78, N74 frozen). No executable arm in kaggle_aegis_sweep.py; refusal prevents G7-invalid claim."}
{"from": "ITER56-FACC-DIRECTOR-741", "to": "ITER57-FACC-DIRECTOR-742", "kind": "edge", "type": "refusal_then_refusal", "run_from": 741, "run_to": 742, "note": "Consecutive director-replay refusals; queue still empty; no physical invocation this row."}
{"id": "ITER58-FACC-DIRECTOR-743", "run": 743, "idea_tag": "FACC iter-14 single-brain fallback (SE3 energy-based attention expert, dynamic contact manifold via free-energy)", "status": "invalid", "kind": "node", "type": "director_decision_refused_replay_55", "queue_empty_confirmed": true, "predicted_score": 78, "physical_run": false, "compare_keep": false, "segment": 15, "protocol_version": "v3", "note": "55th replay refusal of eq78/FACC/SE3/energy-gated family (G3 retired: N70-N76, eq78, N74 frozen). No executable arm in kaggle_aegis_sweep.py; refusal prevents G7-invalid claim."}
{"from": "ITER57-FACC-DIRECTOR-742", "to": "ITER58-FACC-DIRECTOR-743", "kind": "edge", "type": "refusal_then_refusal", "run_from": 742, "run_to": 743, "note": "Consecutive director-replay refusals; queue still empty; no physical invocation this row."}
{"id": "ITER59-FACC-DIRECTOR-744", "run": 744, "idea_tag": "FACC iter-15 single-brain fallback (SE3-conditioned contact policy, in-context force/pose attention, EBM + SE3 residual)", "status": "invalid", "kind": "node", "type": "director_decision_refused_replay_56", "queue_empty_confirmed": true, "predicted_score": 78, "physical_run": false, "compare_keep": false, "segment": 15, "protocol_version": "v3", "note": "56th replay refusal of eq78/FACC/SE3/energy-gated family (G3 retired: N70-N76, eq78, N74 frozen). No executable arm in kaggle_aegis_sweep.py; refusal prevents G7-invalid claim."}
{"from": "ITER58-FACC-DIRECTOR-743", "to": "ITER59-FACC-DIRECTOR-744", "kind": "edge", "type": "refusal_then_refusal", "run_from": 743, "run_to": 744, "note": "Consecutive director-replay refusals; queue still empty; no physical invocation this row."}
{"id": "ITER60-FACC-DIRECTOR-745", "run": 745, "idea_tag": "FACC iter-16 single-brain fallback (SE3 energy-attention + admittance policy replacing flow-match head)", "status": "invalid", "kind": "node", "type": "director_decision_refused_replay_57", "queue_empty_confirmed": true, "predicted_score": 76, "physical_run": false, "compare_keep": false, "segment": 15, "protocol_version": "v3", "note": "57th replay refusal of eq78/FACC/SE3/energy-gated family (G3 retired: N70-N76, eq78, N74 frozen). No executable arm in kaggle_aegis_sweep.py; peg/insert + deformable/stiffness suite absent from rig; refusal prevents G7-invalid claim."}
{"from": "ITER59-FACC-DIRECTOR-744", "to": "ITER60-FACC-DIRECTOR-745", "kind": "edge", "type": "refusal_then_refusal", "run_from": 744, "run_to": 745, "note": "Consecutive director-replay refusals; queue still empty; no physical invocation this row."}
{"id": "ITER61-FACC-DIRECTOR-746", "run": 746, "idea_tag": "FACC iter-17 single-brain fallback (SE3-conditioned energy head replacing flow-match, dynamic affordance manifold)", "status": "invalid", "kind": "node", "type": "director_decision_refused_replay_58", "queue_empty_confirmed": true, "predicted_score": 82, "physical_run": false, "compare_keep": false, "segment": 15, "protocol_version": "v3", "note": "58th replay refusal of eq78/FACC/SE3/energy-gated family (G3 retired: N70-N76, eq78, N74 frozen). No executable arm in kaggle_aegis_sweep.py; stiffness/geometry suite absent from rig; refusal prevents G7-invalid claim."}
{"from": "ITER60-FACC-DIRECTOR-745", "to": "ITER61-FACC-DIRECTOR-746", "kind": "edge", "type": "refusal_then_refusal", "run_from": 745, "run_to": 746, "note": "Consecutive director-replay refusals; queue still empty; no physical invocation this row."}
{"id": "ITER62-FACC-DIRECTOR-747", "run": 747, "idea_tag": "FACC iter-18 single-brain fallback (SE3-conditioned FACC replacing flow head, energy in-context attention)", "status": "invalid", "kind": "node", "type": "director_decision_refused_replay_59", "queue_empty_confirmed": true, "predicted_score": 78, "physical_run": false, "compare_keep": false, "segment": 15, "protocol_version": "v3", "note": "59th replay refusal of eq78/FACC/SE3/energy-gated family (G3 retired: N70-N76, eq78, N74 frozen). No executable arm in kaggle_aegis_sweep.py; stiffness/geometry suite absent from rig; refusal prevents G7-invalid claim."}
{"from": "ITER61-FACC-DIRECTOR-746", "to": "ITER62-FACC-DIRECTOR-747", "kind": "edge", "type": "refusal_then_refusal", "run_from": 746, "run_to": 747, "note": "Consecutive director-replay refusals; queue still empty; no physical invocation this row."}
{"id": "ITER63-FACC-DIRECTOR-748", "run": 748, "idea_tag": "FACC-E iter-19 single-brain fallback (energy in-context attention field, contact-force + SE3-delta energy)", "status": "invalid", "kind": "node", "type": "director_decision_refused_replay_60", "queue_empty_confirmed": true, "predicted_score": 78, "physical_run": false, "compare_keep": false, "segment": 15, "protocol_version": "v3", "note": "60th replay refusal of eq78/FACC/SE3/energy-gated family (G3 retired: N70-N76, eq78, N74 frozen). No executable arm in kaggle_aegis_sweep.py; push/slide/insert + stiffness suite absent from rig; refusal prevents G7-invalid claim."}
{"from": "ITER62-FACC-DIRECTOR-747", "to": "ITER63-FACC-DIRECTOR-748", "kind": "edge", "type": "refusal_then_refusal", "run_from": 747, "run_to": 748, "note": "Consecutive director-replay refusals; queue still empty; no physical invocation this row."}
{"id": "ITER64-FACC-DIRECTOR-749", "run": 749, "idea_tag": "FACC iter-20 single-brain fallback (SE3-conditioned energy field over affordance + force, flow-matching to affordance-equivalence bridge)", "status": "invalid", "kind": "node", "type": "director_decision_refused_replay_61", "queue_empty_confirmed": true, "predicted_score": 78, "physical_run": false, "compare_keep": false, "segment": 15, "protocol_version": "v3", "note": "61st replay refusal of eq78/FACC/SE3/energy-gated family (G3 retired: N70-N76, eq78, N74 frozen). No executable arm in kaggle_aegis_sweep.py; stiffness/geometry suite absent from rig; refusal prevents G7-invalid claim."}
{"from": "ITER63-FACC-DIRECTOR-748", "to": "ITER64-FACC-DIRECTOR-749", "kind": "edge", "type": "refusal_then_refusal", "run_from": 748, "run_to": 749, "note": "Consecutive director-replay refusals; queue still empty; no physical invocation this row."}
{"id": "ITER65-FACC-DIRECTOR-750", "run": 750, "idea_tag": "FACC iter-21 single-brain fallback (SE3-conditioned energy in-context attention, flow-matching to affordance-equivalence bridge)", "status": "invalid", "kind": "node", "type": "director_decision_refused_replay_62", "queue_empty_confirmed": true, "predicted_score": 78, "physical_run": false, "compare_keep": false, "segment": 15, "protocol_version": "v3", "note": "62nd replay refusal of eq78/FACC/SE3/energy-gated family (G3 retired). No executable arm in kaggle_aegis_sweep.py; deformable/slippage suite absent from rig; refusal prevents G7-invalid claim."}
{"from": "ITER64-FACC-DIRECTOR-749", "to": "ITER65-FACC-DIRECTOR-750", "kind": "edge", "type": "refusal_then_refusal", "run_from": 749, "run_to": 750, "note": "Consecutive director-replay refusals; queue still empty; no physical invocation this row."}
{"id": "ITER66-FACC-DIRECTOR-751", "run": 751, "idea_tag": "FACC-E iter-22 single-brain fallback (SE3-conditioned energy in-context attention, flow-matching to affordance-equivalence bridge)", "status": "invalid", "kind": "node", "type": "director_decision_refused_replay_63", "queue_empty_confirmed": true, "predicted_score": 78, "physical_run": false, "compare_keep": false, "segment": 15, "protocol_version": "v3", "note": "63rd replay refusal of eq78/FACC/SE3/energy-gated family (G3 retired). No executable arm in kaggle_aegis_sweep.py; stiffness/geometry suite absent from rig; refusal prevents fabrication."}
{"from": "ITER65-FACC-DIRECTOR-750", "to": "ITER66-FACC-DIRECTOR-751", "kind": "edge", "type": "refusal_then_refusal", "run_from": 750, "run_to": 751, "note": "Consecutive director-replay refusals; queue still empty; no physical invocation this row."}
{"id": "N565-P4-752", "run": 752, "idea_tag": "N565-P4 scale-invariance at 16.00,3200 (base 141600)", "status": "keep", "kind": "node", "type": "law_test_certificate_keep", "predicted": "failing seed set identical to 4.00,800 cell {161618}", "physical_run": true, "compare_keep": true, "segment": 15, "protocol_version": "v3", "note": "P4 CONFIRMED at 4x scale: B 19/20 vs 0/20 baseline, Welch p 9.07e-14, Fisher p 3.05e-10, keep=true. Failing seed 161618 identical (rig-logged z_inf 3.5234 both cells, sigma-scaled copy); out-of-window 56.37m > W 48.00m; reg_ok=False escaped=True. Fresh 278s run reproduces archived N565_b141600_1600."}
{"from": "ITER66-FACC-DIRECTOR-751", "to": "N565-P4-752", "kind": "edge", "type": "refusal_then_measurement", "run_from": 751, "run_to": 752, "note": "After refusing the 63rd FACC replay, executed the unlogged N565-P4 pre-registered arm fresh (16.00,3200 base 141600)."}
{"id": "N565-P4-753", "run": 753, "idea_tag": "N565-P4 in-window control at scale (base 111000 at 16.00,3200)", "status": "keep", "kind": "node", "type": "law_test_certificate_keep", "predicted": "in-window base holds 20/20", "physical_run": true, "compare_keep": true, "segment": 15, "protocol_version": "v3", "note": "P4 control CONFIRMED: B 20/20 vs 0/20 baseline, Welch p 2.45e-31, Fisher p 1.45e-11, keep=true. Realized max z_inf 2.1179 (29.4 pct margin under W/st 3.00); reg_err p50 6.52/p90 14.93mm in certified band. P5 quantum: per-20-seed-cell P(fail) ~10pct at W/st 3.00. Fresh 275s run reproduces archived N565_b111000_1600."}
{"from": "N565-P4-752", "to": "N565-P4-753", "kind": "edge", "type": "p4_then_control", "run_from": 752, "run_to": 753, "note": "Same P4 falsifier, second seed base: out-of-window base fails identically, in-window base holds at scale. N565 P1/P2/P3/P4 answered; P5 reporting rule stated; only P1-111000@4.00,800 archive control unlogged."}
{"id": "ITER67-FACC-DIRECTOR-754", "run": 754, "idea_tag": "FACC-E iter-23 single-brain fallback (SE3-conditioned energy-rewired manifold, EBM attention + force residual adapter)", "status": "invalid", "kind": "node", "type": "director_decision_refused_replay_64", "queue_empty_confirmed": true, "predicted_score": 78, "physical_run": false, "compare_keep": false, "segment": 15, "protocol_version": "v3", "note": "64th replay refusal of eq78/FACC/SE3/energy-gated family (G3 retired). No executable arm in kaggle_aegis_sweep.py; stiffness/slip suite absent from rig; refusal prevents fabrication."}
{"from": "ITER66-FACC-DIRECTOR-751", "to": "ITER67-FACC-DIRECTOR-754", "kind": "edge", "type": "refusal_then_refusal", "run_from": 751, "run_to": 754, "note": "Consecutive director-replay refusals (752/753 were N565-P4 measurements on other rows); queue still empty; no physical invocation this row."}
{"id": "ITER68-FACC-DIRECTOR-755", "run": 755, "idea_tag": "FACC-E iter-24 single-brain fallback (SE3-conditioned force-adaptive contact control via energy-based affordance field)", "status": "invalid", "kind": "node", "type": "director_decision_refused_replay_65", "queue_empty_confirmed": true, "predicted_score": 78, "physical_run": false, "compare_keep": false, "segment": 15, "protocol_version": "v3", "note": "65th replay refusal of eq78/FACC/SE3/energy-gated family (G3 retired). No executable arm in kaggle_aegis_sweep.py; stiffness/friction-shift/deformable suite absent from rig; refusal prevents fabrication."}
{"from": "ITER67-FACC-DIRECTOR-754", "to": "ITER68-FACC-DIRECTOR-755", "kind": "edge", "type": "refusal_then_refusal", "run_from": 754, "run_to": 755, "note": "Consecutive director-replay refusals; queue still empty; no physical invocation this row."}
{"id": "ITER69-SEAF-DIRECTOR-756", "run": 756, "idea_tag": "SEAF iter-25 single-brain fallback (SE(3)-equivariant energy-based affordance flow replacing flow-matching with contact-energy minimization)", "status": "invalid", "kind": "node", "type": "director_decision_refused_replay_66", "queue_empty_confirmed": true, "predicted_score": 76, "physical_run": false, "compare_keep": false, "segment": 15, "protocol_version": "v3", "note": "66th replay refusal of eq78/FACC/SEAF/SE3/energy-gated family (G3 retired). No executable arm in kaggle_aegis_sweep.py; variable-stiffness/deformable/LIBERO suite absent from rig; refusal prevents fabrication."}
{"id": "edge", "from": "ITER68-FACC-DIRECTOR-755", "to": "ITER69-SEAF-DIRECTOR-756", "kind": "edge", "type": "refusal_then_refusal", "run_from": 755, "run_to": 756, "note": "Consecutive director-replay refusals; queue still empty; no physical invocation this row."}
{"id": "ITER70-DEFORMFACC-DIRECTOR-757", "run": 757, "idea_tag": "Deformable-Affordance FACC iter-26 single-brain fallback (SE(3)-conditioned time-varying manifold M_t + energy in-context attention replacing pi0 flow head)", "status": "invalid", "kind": "node", "type": "director_decision_refused_replay_67", "queue_empty_confirmed": true, "predicted_score": 78, "physical_run": false, "compare_keep": false, "segment": 15, "protocol_version": "v3", "note": "67th replay refusal of eq78/FACC/SEAF/SE3/energy-gated/manifold-switch/flow-bridge family (G3 retired). No executable arm in kaggle_aegis_sweep.py; deformable/contact-force-slip suite absent from rig; refusal prevents fabrication."}
{"id": "edge", "from": "ITER69-SEAF-DIRECTOR-756", "to": "ITER70-DEFORMFACC-DIRECTOR-757", "kind": "edge", "type": "refusal_then_refusal", "run_from": 756, "run_to": 757, "note": "Consecutive director-replay refusals; queue still empty; no physical invocation this row."}
{"id": "ITER71-FACC-DIRECTOR-758", "run": 758, "idea_tag": "FACC iter-27 single-brain fallback (SE(3)-equivariant Force-Adaptive Contact Controller + energy in-context attention replacing pi0 flow head)", "status": "invalid", "kind": "node", "type": "director_decision_refused_replay_68", "queue_empty_confirmed": true, "predicted_score": 78, "physical_run": false, "compare_keep": false, "segment": 15, "protocol_version": "v3", "note": "68th replay refusal of eq78/FACC/SE3/energy-gated/manifold-switch/flow-bridge family (G3 retired). No executable arm in kaggle_aegis_sweep.py; variable-stiffness/deformable suite absent from rig; refusal prevents fabrication."}
{"id": "edge", "from": "ITER70-DEFORMFACC-DIRECTOR-757", "to": "ITER71-FACC-DIRECTOR-758", "kind": "edge", "type": "refusal_then_refusal", "run_from": 757, "run_to": 758, "note": "Consecutive director-replay refusals; queue still empty; no physical invocation this row."}
{"id": "ITER72-SAAF-DIRECTOR-759", "run": 759, "idea_tag": "SAAF iter-28 single-brain fallback (SE(3)-conditioned adaptive affordance-energy flow replacing flow-matching head)", "status": "invalid", "kind": "node", "type": "director_decision_refused_replay_69", "queue_empty_confirmed": true, "predicted_score": 78, "physical_run": false, "compare_keep": false, "segment": 15, "protocol_version": "v3", "note": "69th replay refusal of eq78/SAAF/FACC/SE3/energy-gated/manifold-switch/flow-bridge family (G3 retired). No executable arm in kaggle_aegis_sweep.py; deformable/articulated/stiffness suite absent from rig; refusal prevents fabrication."}
{"id": "edge", "from": "ITER71-FACC-DIRECTOR-758", "to": "ITER72-SAAF-DIRECTOR-759", "kind": "edge", "type": "refusal_then_refusal", "run_from": 758, "run_to": 759, "note": "Consecutive director-replay refusals; queue still empty; no physical invocation this row."}
{"id": "ITER73-FDAEF-DIRECTOR-760", "run": 760, "idea_tag": "FDAEF iter-29 single-brain fallback (Force-Deformable Affordance-Energy Flow, SE(3)-conditioned EBM flow over dynamic manifold)", "status": "invalid", "kind": "node", "type": "director_decision_refused_replay_70", "queue_empty_confirmed": true, "predicted_score": 78, "physical_run": false, "compare_keep": false, "segment": 15, "protocol_version": "v3", "note": "70th replay refusal of eq78/FDAEF/FACC/SE3/energy-gated/manifold-switch/flow-bridge family (G3 retired). No executable arm in kaggle_aegis_sweep.py; variable-stiffness/deformable/articulated suite absent from rig; refusal prevents fabrication."}
{"id": "edge", "from": "ITER72-SAAF-DIRECTOR-759", "to": "ITER73-FDAEF-DIRECTOR-760", "kind": "edge", "type": "refusal_then_refusal", "run_from": 759, "run_to": 760, "note": "Consecutive director-replay refusals; queue still empty; no physical invocation this row."}
{"id": "ITER74-DAFACC-DIRECTOR-761", "run": 761, "idea_tag": "DA-FACC iter-30 single-brain fallback (Dynamic-Affordance FACC, SE(3)-conditioned contact control, energy-based in-context attention over contact manifold)", "status": "invalid", "kind": "node", "type": "director_decision_refused_replay_71", "queue_empty_confirmed": true, "predicted_score": 82, "physical_run": false, "compare_keep": false, "segment": 15, "protocol_version": "v3", "note": "71st replay refusal of eq78/DA-FACC/FACC/SE3/energy-gated/manifold-switch/flow-bridge family (G3 retired). No executable arm in kaggle_aegis_sweep.py; variable-stiffness suite absent from rig; refusal prevents fabrication."}
{"id": "edge", "from": "ITER73-FDAEF-DIRECTOR-760", "to": "ITER74-DAFACC-DIRECTOR-761", "kind": "edge", "type": "refusal_then_refusal", "run_from": 760, "run_to": 761, "note": "Consecutive director-replay refusals; queue still empty; no physical invocation this row."}
{"id": "ITER75-FACC-DIRECTOR-762", "run": 762, "idea_tag": "FACC iter-31 single-brain fallback (SE(3)-conditioned Force-Adaptive Contact Control, energy-based in-context attention over wrench + SE(3)-error history)", "status": "invalid", "kind": "node", "type": "director_decision_refused_replay_72", "queue_empty_confirmed": true, "predicted_score": 78, "physical_run": false, "compare_keep": false, "segment": 15, "protocol_version": "v3", "note": "72nd replay refusal of eq78/FACC/SE3/energy-gated/manifold-switch/flow-bridge family (G3 retired). No executable arm in kaggle_aegis_sweep.py; variable-stiffness suite absent from rig; refusal prevents fabrication."}
{"id": "edge", "from": "ITER74-DAFACC-DIRECTOR-761", "to": "ITER75-FACC-DIRECTOR-762", "kind": "edge", "type": "refusal_then_refusal", "run_from": 761, "run_to": 762, "note": "Consecutive director-replay refusals; queue still empty; no physical invocation this row."}
{"id": "ITER76-FACC-DIRECTOR-763", "run": 763, "idea_tag": "FACC iter-32 single-brain fallback (Force-Adaptive Contact Control, SE(3)-conditioned energy-based physical in-context attention, info-theory contrastive affordance energy)", "status": "invalid", "kind": "node", "type": "director_decision_refused_replay_73", "queue_empty_confirmed": true, "predicted_score": 78, "physical_run": false, "compare_keep": false, "segment": 15, "protocol_version": "v3", "note": "73rd replay refusal of eq78/FACC/SE3/energy-gated/manifold-switch/flow-bridge family (G3 retired). No executable arm in kaggle_aegis_sweep.py; contact-rich/stiffness/unseen-geometry suite absent. Champion trochoid B=1.00 frozen."}
{"id": "edge", "from": "ITER75-FACC-DIRECTOR-762", "to": "ITER76-FACC-DIRECTOR-763", "kind": "edge", "type": "refusal_then_refusal", "run_from": 762, "run_to": 763, "note": "Consecutive director-replay refusals; queue still empty; no physical invocation this row."}
