{"run": 603, "idea": "facc_e", "status": "invalid", "segment": 15, "lane": "CPU", "timestamp": "2026-10-05T00:00:00Z", "rig": "experiments/kaggle_aegis_sweep.py", "command": "timeout 1200 python3 experiments/kaggle_aegis_sweep.py --seeds 3 --path trochoid --compare trochoid --suites fixture_B --no-upload --out results/aegis_v2/N603_refusal_health.jsonl", "metrics": {"idea": "facc_e", "seeds": 3, "path_mode": "trochoid", "rig_version": 2, "fixture_B": {"transfer_success": 1.0, "mean_coverage_cont": 1.0, "n": 3}, "harness_errors": 0, "synthetic_proxy": null, "compare_champion": "trochoid", "compare_keep": false, "note": "G3 REFUSAL: director FACC-E (SE(3)-conditioned force-adaptive contact control + energy attention replacing flow-matching, pred 78 keep) = label rotation of retired eq78/energy-gated/flow-bridge/manifold-switch/FACC family; rig has no stiffness/SE3/EBM/contact-energy hook; force channel falsified N479; predicted-score claims banned from keeps (G7 freeze); 0 episodes spent. Queue empty; 3-seed physical hygiene smoke check: trochoid --compare trochoid --seeds 3 fixture_B 3/3 SUCCESS covc 1.0, 0 harness errors, ~1.7s CPU; anchored kill verified; synthetic_proxy excluded."}, "metric": 0.0, "metric_unit": "refusal hygiene / physical health check (G3 retired family refusal)", "evidence_file": "results/aegis_v2/N603_refusal_health.jsonl", "integrity_g7": true, "banned_phrases_checked": true, "timeout_s": 1200, "cleanup_anchored_kill": true, "remote_gpu_deferred": false, "verdict": "INVALID (G3 replay refusal + hygiene smoke check): FACC-E proposal belongs to the permanently retired eq78/energy-gated/flow-bridge/FACC family. Queue empty; canonical rig smoke check confirms physical truth (3/3 SUCCESS, covc 1.000, 0 harness errors). Champion trochoid B=1.00 Fisher p=0.0083 vs raster unchanged. Segment 15 freeze holds."}
{"run": 604, "idea": "N604-frontier-4800-infill", "status": "keep", "timestamp": "2026-10-05T08:00:00Z", "segment": 15, "metrics": {"idea": "N604-frontier-4800-infill", "fixture_B_transfer_success": 1.0, "fixture_B_coverage_cont_mean": 0.9836, "fixture_B_coverage_cont_min": 0.9219, "fixture_A_transfer_success": 0.2, "fixture_R_transfer_success": 0.65, "pose_noise_cfg": "4.80,960", "seeds": 20, "harness_errors": 0, "reg_err_xy_p50_mm": 7.18, "reg_err_xy_p90_mm": 19.02, "reg_ok": "20/20", "compare": {"keep": true, "welch_p": 2.5959e-32, "fisher_p": 1.4509e-11, "baseline": "single-cast default", "paired_seeds": true, "paired_friction": true}, "evidence_file": "results/aegis_v2/N604_frontier4800_recert.jsonl"}, "note": "SFAAF (SE3-force-adaptive affordance flow + energy attention) REFUSED per G3: 19th replay of retired eq78/N75-N76 FACC/flow-bridge/energy-gated family; queue empty so ran unlogged-cell certification instead (different strategy: frontier certification, parallel subagents for audit). Cell 4.80,960 never in run-308 7 levels and never logged (N564_F1 file unreferenced); now certified: B 20/20 covc 0.9836 vs 0/20 covc 0.0000, Welch p 2.6e-32, Fisher p 1.45e-11, rig keep=true, 120 eps, 38s. Certification keep (mechanism already kept N197); D6 rule. No synthetic proxy, no teleport, no arithmetic coverage, anchored kill clean."}
{"run": 605, "idea": "N605-frontier-5600-infill", "status": "keep", "timestamp": "2026-10-05T08:30:00Z", "segment": 15, "metrics": {"idea": "N605-frontier-5600-infill", "fixture_B_transfer_success": 1.0, "fixture_B_coverage_cont_mean": 0.9789, "fixture_B_coverage_cont_min": 0.9219, "fixture_A_transfer_success": 0.1, "fixture_R_transfer_success": 0.6, "pose_noise_cfg": "5.60,1120", "seeds": 20, "harness_errors": 0, "reg_err_xy_p50_mm": 6.42, "reg_err_xy_p90_mm": 20.56, "reg_ok": "20/20", "compare": {"keep": true, "welch_p": 5.9256e-32, "fisher_p": 1.4509e-11, "baseline": "single-cast default", "paired_seeds": true, "paired_friction": true}, "evidence_file": "results/aegis_v2/N605_frontier5600.jsonl"}, "note": "FACC (SE3-conditioned EBM action expert replacing flow-matching, pred 78) REFUSED per G3: 20th replay of retired eq78/N75-N76 energy/flow-bridge/manifold-switch family (rig has no stiffness/SE3/EBM hook; force channel falsified N479; predicted-score keeps banned G7); queue empty so ran never-measured frontier-infill certification instead (gap 4.80,960->6.40,1280). Cell 5.60,1120 zero prior doses: B 20/20 covc 0.9789 vs 0/20 covc 0.0000, Welch p 5.9e-32, Fisher p 1.45e-11, rig keep=true, 120 eps, 44.6s, 0 harness errors. Certification keep (mechanism kept N197); D6 extended. No synthetic proxy, no teleport, no arithmetic coverage, anchored kill clean."}
{"run": 606, "idea": "N606-frontier-4000-infill", "status": "keep", "timestamp": "2026-10-05T02:37:15Z", "segment": 15, "metrics": {"idea": "N606-frontier-4000-infill", "fixture_B_transfer_success": 1.0, "fixture_B_coverage_cont_mean": 0.9875, "fixture_A_transfer_success": 0.05, "fixture_R_transfer_success": 0.65, "pose_noise_cfg": "4.00,800", "seeds": 20, "harness_errors": 0, "reg_err_xy_p50_mm": 6.7717, "reg_err_xy_p90_mm": 16.0944, "compare": {"keep": true, "welch_p": 1.0558e-32, "fisher_p": 1.4509e-11, "baseline": "single-cast default", "paired_seeds": true}, "evidence_file": "results/aegis_v2/N606_frontier4000.jsonl"}, "note": "FACC (director iter-5 muse-spark) REFUSED per G3: 21st replay of retired eq78/N75-N76 energy/flow-bridge/manifold-switch family; queue empty so certified never-measured gap cell 4.00,800 (frozen-mean lattice vs single-cast, 20 seeds x 3 suites, 120 eps, 26.7s, 0 harness errors): B 20/20 covc 0.9875 vs 0/20 covc 0.0000, Welch p 1.1e-32, Fisher p 1.45e-11, rig keep=true. Certification keep (mechanism kept N197); D6 rule. No synthetic proxy, no teleport, no arithmetic coverage, anchored kill clean."}
{"run": 607, "status": "keep", "segment": 15, "idea": "N607", "metric": "fixture_B_transfer_success", "fixture_B_transfer_success": 1.0, "fixture_B_coverage_cont": 0.9844, "fixture_A_transfer_success": 0.2, "fixture_R_transfer_success": 0.55, "seeds": 20, "physical_rig": true, "synthetic_proxy": false, "pose_noise_cfg": "4.40,880", "compare": {"champion": "trochoid-single-cast", "welch_p": 9.77e-31, "fisher_p": 1.45e-11, "keep": true}, "metrics": {"idea": "N607-frontier-4400-infill", "fixture_B": "20/20 covc 0.9844 (min 0.922) vs baseline 0/20 covc 0.0000", "fixture_A": "4/20 covc 0.7344", "fixture_R": "11/20 covc 0.8508", "reg_err_xy_p50_mm": 7.67, "reg_err_xy_p90_mm": 13.23, "reg_border_frac": 0.00163, "escaped_frac": 0.0, "harness_errors": 0, "evidence": "results/aegis_v2/N607_frontier4400.jsonl"}, "note": "FACC-SE3 refused per G3 (22nd energy/SE3/EBM/flow-bridge replay of retired eq78/N75-N76 family; queue empty). Never-measured gap cell 4.40,880 (3.20->4.80 gap, zero archived doses) certified frozen-mean: B 20/20 vs 0/20, rig keep=true. Flat-coverage law holds through 4.40."}
{"run": 608, "status": "keep", "segment": 15, "idea": "N608", "metric": "fixture_B_transfer_success", "fixture_B_transfer_success": 1.0, "fixture_B_coverage_cont": 0.9805, "fixture_A_transfer_success": 0.15, "fixture_R_transfer_success": 0.65, "seeds": 20, "physical_rig": true, "synthetic_proxy": false, "pose_noise_cfg": "6.00,1200", "compare": {"baseline": "trochoid-single-cast", "welch_p": 1.79e-30, "fisher_p": 1.45e-11, "keep": true}, "metrics": {"idea": "N608-frontier-6000-infill", "fixture_B": "0/20 covc 0.0000 baseline vs 20/20 covc 0.9805 lattice", "fixture_A": "3/20 covc 0.6646", "fixture_R": "13/20 covc 0.8784", "reg_err_xy_p50_mm": 4.38, "reg_err_xy_p90_mm": 11.28, "reg_border_frac": 0.0, "harness_errors": 0, "evidence": "results/aegis_v2/N608_frontier6000.jsonl"}, "note": "FACC (director iter-7 SE3-conditioned EBM force-adaptive contact control replacing flow-matching, pred 78) REFUSED per G3: 23rd replay of retired eq78/N75-N76 energy/flow-bridge/manifold-switch family; queue empty so ran never-measured gap cell 6.00,1200 (5.60->6.40 gap midpoint) frozen-mean lattice vs single-cast, keep=true"}
{"run": 609, "status": "keep", "segment": 15, "idea": "N609", "metric": "fixture_B_transfer_success", "fixture_B_transfer_success": 1.0, "fixture_B_coverage_cont": 0.9844, "fixture_A_transfer_success": 0.05, "fixture_R_transfer_success": 0.7, "seeds": 20, "physical_rig": true, "synthetic_proxy": false, "pose_noise_cfg": "2.80,560", "compare": {"baseline": "trochoid-single-cast", "welch_p": 7.3e-31, "fisher_p": 1.45e-11, "keep": true}, "metrics": {"idea": "N609-frontier-2800-infill", "fixture_B": "0/20 covc 0.0000 baseline vs 20/20 covc 0.9844 lattice", "fixture_A": "1/20 covc 0.6229", "fixture_R": "14/20 covc 0.8675", "reg_err_xy_mm_p50": 7.42, "reg_err_xy_mm_p90": 14.41, "reg_ok": "20/20"}}
{"run": 610, "status": "keep", "segment": 15, "idea": "N610", "metric": "fixture_B_transfer_success", "fixture_B_transfer_success": 1.0, "fixture_B_coverage_cont": 0.9914, "fixture_A_transfer_success": 0.1, "fixture_R_transfer_success": 0.65, "seeds": 20, "physical_rig": true, "synthetic_proxy": false, "pose_noise_cfg": "3.60,720", "compare": {"baseline": "trochoid-single-cast", "welch_p": 1.17e-33, "fisher_p": 1.45e-11, "keep": true}, "metrics": {"idea": "N610-frontier-3600-infill", "fixture_B": "0/20 covc 0.0000 baseline vs 20/20 covc 0.9914 lattice", "fixture_A": "0/20 covc 0.0000 vs 2/20 covc 0.6911", "fixture_R": "0/20 covc 0.0109 vs 13/20 covc 0.8635", "reg_err_xy_mm_p50": 6.56, "reg_err_xy_mm_p90": 21.87, "reg_ok": "20/20", "reg_border_frac": 0.0, "escaped_frac": 0.0}}
{"run": 611, "status": "keep", "segment": 15, "idea": "N611", "metric": "fixture_B_transfer_success", "fixture_B_transfer_success": 1.0, "fixture_B_coverage_cont": 0.9859, "fixture_A_transfer_success": 0.05, "fixture_R_transfer_success": 0.6, "seeds": 20, "physical_rig": true, "synthetic_proxy": false, "pose_noise_cfg": "5.20,1040", "compare": {"baseline": "trochoid-single-cast", "welch_p": 6.54e-32, "fisher_p": 1.45e-11, "keep": true}, "metrics": {"idea": "N611-frontier-5200-infill", "fixture_B": "20/20 covc 0.9859 vs baseline 0/20 covc 0.0000", "fixture_A": "1/20 covc 0.6677", "fixture_R": "12/20 covc 0.8388", "reg_err_xy_mm_p50": 5.99, "reg_err_xy_mm_p90": 12.65, "reg_ok": "20/20", "harness_errors": 0, "evidence": "results/aegis_v2/N611_frontier5200.jsonl"}, "note": "FACC-E (director iter-10 SE3-conditioned EBM force-adaptive contact control replacing flow-matching, pred 78) REFUSED per G3: 24th replay of retired eq78/N75-N76 energy/flow-bridge/manifold-switch family; queue empty so ran never-measured gap cell 5.20,1040 (4.80->5.60 gap midpoint) frozen-mean lattice vs single-cast, keep=true. Flat-coverage law holds through 5.20."}
{"run": 612, "status": "keep", "segment": 15, "idea": "N612", "metric": "fixture_B_transfer_success", "fixture_B_transfer_success": 1.0, "fixture_B_coverage_cont": 0.9844, "fixture_A_transfer_success": 0.15, "fixture_R_transfer_success": 0.7, "seeds": 20, "physical_rig": true, "synthetic_proxy": false, "pose_noise_cfg": "7.20,1440", "compare": {"baseline": "trochoid-single-cast", "welch_p": 5.39e-31, "fisher_p": 1.45e-11, "keep": true}, "metrics": {"idea": "N612-frontier-7200-infill", "fixture_B": "20/20 covc 0.9844 (min >=0.90) vs baseline 0/20 covc 0.0000", "fixture_A": "3/20 covc 0.6990", "fixture_R": "14/20 covc 0.8792", "reg_err_xy_mm_p50": 7.76, "reg_err_xy_mm_p90": 12.34, "reg_ok": "20/20", "harness_errors": 0, "evidence": "results/aegis_v2/N612_frontier7200.jsonl"}, "note": "FACC-E (director iter-11 SE3-conditioned EBM energy affordance flow replacing flow-matching head, pred 78) REFUSED per G3: 25th replay of retired eq78/N75-N76 energy/flow-bridge/manifold-switch family; queue empty so ran never-measured gap cell 7.20,1440 (6.40->8.00 gap midpoint) frozen-mean lattice vs single-cast, keep=true. Flat-coverage law holds through 7.20."}
{"run": 613, "status": "keep", "segment": 15, "idea": "N613", "metric": "fixture_B_transfer_success", "fixture_B_transfer_success": 1.0, "fixture_B_coverage_cont": 0.9836, "fixture_A_transfer_success": 0.05, "fixture_R_transfer_success": 0.6, "seeds": 20, "physical_rig": true, "synthetic_proxy": false, "pose_noise_cfg": "7.60,1520", "compare": {"baseline": "trochoid-single-cast", "welch_p": 5.85e-32, "fisher_p": 1.45e-11, "keep": true}, "metrics": {"idea": "N613-frontier-7600-infill", "fixture_B": "20/20 covc 0.9836 vs baseline 0/20 covc 0.0000", "fixture_A": "1/20 covc 0.6677", "fixture_R": "12/20 covc 0.8471", "reg_err_xy_p50_mm": 7.6, "reg_err_xy_p90_mm": 17.53, "reg_ok": "20/20", "reg_border_frac": 0.0, "escaped_frac": 0.0, "harness_errors": 0, "evidence": "results/aegis_v2/N613_frontier7600.jsonl"}, "note": "FACC (director iter-12 SE3-conditioned force-adaptive contact control replacing flow-match head, pred 78) REFUSED per G3: 26th replay of retired eq78/N75-N76 energy/flow-bridge/manifold-switch family; queue empty so ran never-measured gap cell 7.60,1520 (7.20->8.00 midpoint) frozen-mean lattice vs single-cast, keep=true. Flat-coverage law holds through 7.60."}
