{"run": 240, "segment": 15, "status": "discard", "idea": "I19", "timestamp": "2026-09-29T11:35:00Z", "rig": "canonical rig experiments/kaggle_aegis_sweep.py (PyBullet DIRECT, system python3, 20 seeds x 3 suites x 2 paired arms, rig_version 2, run TWICE: pose_noise 0,0 and 0.01,2); pts_source=physics_contact; coverage_cont/success recomputed from physics contacts at return time; ONE rig edit family this iteration: the run-167 per-tick jerk trigger re-exposed behind AEGIS_GATE_ADVISORY (default 0 = frozen rig) with the SLOWDOWN response (half commanded arclength speed, 8 ticks) plus veto_scrub/veto_scrub_contact/jerk_tick_max telemetry and a full knob snapshot in the compare record (regression: 60 eps x 64 fields vs run 239's champion arm, 0 diffs in any scored field, only new telemetry + clock)", "command": "AEGIS_GATE_ADVISORY=1 timeout 1200 python3 experiments/kaggle_aegis_sweep.py --seeds 20 --no-upload --path trochoid --compare trochoid --compare-env AEGIS_GATE_ADVISORY=0 --suites fixture_A,fixture_B,fixture_R --out results/aegis_v2/I19_r240_advisory_n00.jsonl ; AEGIS_POSE_NOISE=0.01,2 AEGIS_GATE_ADVISORY=1 timeout 1200 python3 experiments/kaggle_aegis_sweep.py --seeds 20 --no-upload --path trochoid --compare trochoid --compare-env AEGIS_GATE_ADVISORY=0 --suites fixture_A,fixture_B,fixture_R --out results/aegis_v2/I19_r240_advisory_n012.jsonl   (regression: --path trochoid default env -> results/aegis_v2/I19_r240_regression_flat_POST-edit.jsonl ; read-out: timeout 300 python3 results/aegis_v2/I19_r240_analyse.py <jsonl>)", "compare_champion": "in-rig --compare trochoid on the SAME 20 seeds -> same friction / tool / customer draw / pose noise, with the gate flag itself the only difference (candidate AEGIS_GATE_ADVISORY=1 vs paired baseline AEGIS_GATE_ADVISORY=0, same path mode). Both baseline arms reproduced the frozen champion exactly (0,0: fixture_B coverage_cont 0.9453, 20/20, path_len 0.9098 m; 0.01,2: 0.9398, 15/20) and the default-env regression rerun is field-identical to run 239's champion arm.", "metric": 1.0, "metric_unit": "fixture_B transfer_success (coverage_cont>=0.90) of the advisory-gate arm at pose_noise 0,0, 20/20 seeds; rig compare record keep=false (d coverage_cont = 0.0000 on all three suites, Welch p=1.0, Fisher p=1.0 -- the arm is scored, not unvalidated)", "metrics": {"idea": "I19", "lane": "CPU canonical rig", "screens": 0, "variant": "I19 advisory slowdown gate: run 167's per-tick jerk trigger (| |F_t| - 2|F_{t-1}| + |F_{t-2}| | > 0.618 N) kept verbatim, response replaced by halving the COMMANDED arclength speed (path_progress += 0.5) for 8 ticks. No retraction, no position jump, no teleport (G7). Run at BOTH pose-noise conditions because the 0,0 sweep alone cannot exercise the gate.", "director_directive_adjudication": "Director iter-10 'SE(3)-conditioned Force-Adaptive Contact Control (FACC)' build (adaptive affordance manifold + energy-based physical in-context attention, predicted 2.8pts/74) ADJUDICATED, NOT EXECUTED, on the run 234/235/236/237/239 precedent: (1) G4 requires a paired --compare record from the canonical rig, which is a force-driven pad with no learned action head and no SE(3) energy model, so no such record can exist for this proposal; (2) the directive needs a pi0 policy + demo keypoints and checkpoints may never be downloaded locally, so the candidate is not constructible here; (3) G3 permanently retires manifold-switch / flow-bridge / energy-gated re-derivations, and this is exactly that (a flow-matching head swapped for an energy scorer -- run 233/T226 already closed the adaptive-threshold FACC sub-line on physical data at 78/78 infeasible, run 232/T225 closed FACC-Lite); (4) the FACC line is closed for the third time and its own predicted score (2.8) is the lowest of any proposal this segment. The queued queue entry I19 was executed instead, and -- unlike every previous adjudication -- it produced a mechanism that transfers to the remaining gate idea.", "gate_trigger_fire_rate": {"pose_noise_0_0": {"vetoes_total": 92, "vetoes_in_scrub": 0, "vetoes_in_scrub_and_contact": 0, "per_episode_A_B_R": [0.3, 2.35, 1.95]}, "pose_noise_0.01_2": {"vetoes_total": 98, "vetoes_in_scrub": 0, "vetoes_in_scrub_and_contact": 0, "per_episode_A_B_R": [0.35, 2.5, 2.05]}}, "root_cause": "The trigger is a UNITS MISMATCH and is therefore inert exactly where the rig scores. GATE_MAX_JERK=0.618 is the Tier-4 threshold for the EPISODE statistic jerk_proxy = mean_t(||F_t - 2F_{t-1} + F_{t-2}||^2) -- a mean of SQUARED vector second differences, which the champion scores at 0.0028-0.0098 with a max of 0.0200 over all 120 episodes. The in-loop trigger instead tests a PER-TICK absolute second difference of the commanded force MAGNITUDE in newtons on a 3.0 N clamped command. Measured per-tick max 0.671-4.741 N, all of it from the pre-contact approach ramp (0 -> rail); inside the scrub the commanded force is ~30x below the threshold forever. Result: across 120 candidate episodes (2 noise x 3 suites x 20 seeds) and 190 vetoes, ZERO fired in the scrub phase and ZERO while the tool was in contact, so no response to this signal can touch the swept patch.", "scored_effect": "0.0000 coverage_cont delta on all three suites at BOTH conditions (Welch p=1.0, Fisher p=1.0, keep=false). Success 20/20->20/20 (A,B) and 19/20->19/20 (R) at 0,0; 15/15 and 13/13 at 0.01,2. 47-50 vetoes on B (187-195 slowed ticks = 4.7 lost tick-equivalents of a 0.9098 m path) cost nothing because _coverage_cont dilates every physics contact by r_eff=0.035 m and 1.8 cm of arclength is well inside the radius already credited.", "i19_own_bar": "NOT MET: R success not reduced (19/20 -> 19/20) but slip_m -3e-6 m (Wilcoxon p=0.281) and fn_p95 +0.0148 N at 0,0 (p=0.398, WORSE) / -0.0081 N at 0.01,2 (p=0.674). The only 'significant' field is fixture_B slip_m -1e-6 m (p=6.4e-3) = one micron in a 0.0106 m signal = numerical dust, and negative because the APPROACH ran slower, not because contact improved.", "pre_transfer_to_I20": "Any in-loop response keyed to this trigger (I20 proportional force-cap, dwell, retract) inherits the same measurement: 0 scrub-phase occurrences in 120 episodes. The gate-rethink family is closed unless the TRIGGER is redefined on the scrub-phase quantity (per-tick jerk of the force commanded while ph=='scrub' and in contact, thresholded at the scale the scrub exhibits). That is a new trigger, not a new response.", "rig_edits": "AEGIS_GATE_ADVISORY knob in KNOB_GLOBALS (+knob_snapshot gate_mode string) and the advisory block in PyBulletScrub.run(): per-tick trigger, 8-tick speed halving, vetoes/vetoed_ticks/veto_scrub/veto_scrub_contact/jerk_tick_max telemetry, and base_knobs carrying the full snapshot. Default 0.0 = frozen rig.", "regression": "60 episodes x 64 fields vs run 239's champion arm: 0 differences in any scored field (success, coverage_cont, coverage, jerk, slip_m, stall_frac, fn_*, path_len_m, steps, touch/cell counts); the only diffs are the 7 NEW telemetry fields, ts and wall_s.", "evidence": ["results/aegis_v2/I19_r240_advisory_n00.jsonl", "results/aegis_v2/I19_r240_advisory_n012.jsonl", "results/aegis_v2/I19_r240_regression_flat_POST-edit.jsonl", "results/aegis_v2/I19_r240_analyse.py"], "equations": "ROW I19 ((I19.1)-(I19.5))", "graph": "N200-next->N201-I19->N202-next", "gate_on_vs_gate_off": "always reported: the paired --compare arm IS gate-off (AEGIS_GATE_ADVISORY=0) on identical seeds", "harness_errors": 0, "pts_source": "physics_contact", "keep_rule": "G4: >=20 seeds AND B transfer_success > 0.70 AND (Welch p<0.01 coverage OR Fisher p<0.01 success) AND no coverage regression -> keep=false on both paired records", "synthetic_proxy": null, "g7_clean": true, "remote_gpu": "not used; idea is CPU-lane in the canonical rig"}, "novelty_score": null, "sota_gap": null, "next": "I20 (proportional force-cap gate) -- pre-falsified by I19.2: 0 scrub-phase trigger occurrences in 120 episodes. Run it for the record only; a keep is impossible unless the trigger is redefined on the scrub-phase jerk."}
{"run": 241, "segment": 15, "status": "discard", "idea": "I20", "timestamp": "2026-09-29T12:20:00Z", "rig": "canonical rig experiments/kaggle_aegis_sweep.py (PyBullet DIRECT, system python3, 20 seeds x 3 suites x 2 paired arms, rig_version 2, run at pose_noise 0,0 AND 0.01,2); pts_source=physics_contact; coverage_cont/success recomputed from physics contacts at return time; ONE rig edit family, all behind default-OFF knobs so every other arm is frozen: AEGIS_GATE_PROP (proportional press-scale response), AEGIS_GATE_TRIG (1 = NEW trigger restricted to scrub phase AND in contact), AEGIS_GATE_THETA, AEGIS_GATE_PROP_MIN, + j_sc_p50/p90/p99/max trigger telemetry logged UNCONDITIONALLY on a local list (no physics reads it) so theta is calibrated on the frozen champion arm itself. REGRESSION: default-env rerun BIT-IDENTICAL to run 240's champion arm, 60 episodes x all scored fields, 0 differences.", "command": "timeout 1200 python3 experiments/kaggle_aegis_sweep.py --seeds 20 --no-upload --path trochoid --compare trochoid --suites fixture_A,fixture_B,fixture_R --out results/aegis_v2/I20_r241_regression_flat_POST-edit.jsonl ; calibration from that file's j_sc_* fields (no extra run) ; dose AEGIS_GATE_PROP=1 ... --compare-env AEGIS_GATE_PROP=0 --out results/aegis_v2/I20_r241_{legacy,trig001,trig005,trig015,CTRLstatic003,floor06,floor015}_n00.jsonl ; repeat at AEGIS_POSE_NOISE=0.01,2 -> I20_r241_n012_*.jsonl ; read-out: timeout 300 python3 results/aegis_v2/I20_r241_analyse.py", "director_build_adjudicated": "Director iter-12 'FACC-EA - Force-Adaptive Contact Control with Energy-based Affordance Attention' (predicted 74) ADJUDICATED, NOT EXECUTED, on five grounds following the run 234/235/236/237/239/240 precedent: (1) G4 - a learned action head is unpairable in the canonical rig, whose tool is a FORCE-DRIVEN foam head with no policy, no pi0 and no demo keypoints, so no --compare record can be produced; (2) checkpoints may never be downloaded and pi0 has no open weights; (3) G3 permanently retires manifold-switch / flow-bridge / energy-gated re-derivations, and 'energy(contact wrench) attention score' IS that family, re-derived; (4) the FACC line is already closed twice on physical data (T225 run 232 degenerate all-reject, T226 run 233 78/78 infeasible); (5) its own text scores 4.5/10 'not BEST'. The lowest-numbered queued idea executable on the canonical rig was run instead: I20.", "metric": 0.9492, "metric_unit": "fixture_B transfer_success at the best arm (0.9492 is coverage_cont; B success is 20/20 = 1.0 in EVERY arm including the champion, so the success channel is saturated at pose_noise 0,0 and carries no signal)", "metric_class": "physical", "compare_champion": "in-rig --compare trochoid --compare-env AEGIS_GATE_PROP=0 on the SAME 20 seeds -> same friction / tool / customer draw / pose noise. Gate-off arm reproduced the frozen champion exactly (B coverage_cont 0.9453, 20/20, R 0.9427 19/20) and is bit-identical to run 240's arm.", "metrics": {"fixture_A": {"covc_base": 0.9354, "covc_cand_best": 0.9354, "welch_p": 1.0, "succ_base": 20, "succ_cand": 20, "fisher_p": 1.0}, "fixture_B": {"covc_base": 0.9453, "covc_cand_best": 0.9492, "welch_p": 0.754, "paired_p": null, "succ_base": 20, "succ_cand": 20, "fisher_p": 1.0, "note": "B success is 20/20 in BOTH arms on every suite x cell -> the success channel is saturated and cannot decide anything at 0,0; the +0.0039 coverage delta is inside the r_eff=0.035 m dilation of _coverage_cont"}, "fixture_R": {"covc_base": 0.9427, "covc_cand_best": 0.9471, "welch_p": 0.754, "succ_base": 19, "succ_cand": 20, "fisher_p": 1.0}, "pose_noise_0.01,2": {"fixture_B": {"covc_base": 0.9398, "covc_cand_best": 0.9437, "succ_base": 15, "succ_cand": 15}, "fixture_R": {"covc_base": 0.9068, "covc_cand_best": 0.9096, "succ_base": 13, "succ_cand": 14}}, "rig_keep_field": false, "harness_errors": 0, "slip_m": {"base": 0.01059, "best": 0.00549, "welch_p": 0.000149, "paired_p": 1.25e-07}, "force_compliance": {"base": 1.0, "floor_0.30": 0.213, "floor_0.15": 0.213, "static": 0.103, "note": "MOVES 5-10x THE WRONG WAY - the slip win is bought out of the contact-force budget"}, "press_mean_n": {"base": 0.5, "best": 0.1653}, "fn_mean_n": {"base": 0.4967, "best": 0.164}, "trigger_calibration": {"j_sc_global_max_over_60_eps": 0.6001, "gate_max_jerk": 0.618, "verdict": "legacy theta lies ABOVE the entire scrub-contact jerk distribution -> the I19 finding (the legacy trigger never fires where the rig scores) is confirmed on physics"}, "response_law_dose_response": {"theta_0.01_slip": 0.00664, "theta_0.05_slip": 0.0066, "theta_0.15_slip": 0.0066, "static_theta_1e-4_slip": 0.00641, "mean_press_scale_per_arm": [0.3, 0.3, 0.3, 0.3, 0.6, 0.15], "verdict": "every triggered tick lands exactly on GATE_PROP_MIN; a 15x threshold change moves nothing"}, "spearman_slip_vs_press": {"rho": 0.7714, "p": 0.0724}, "spearman_slip_vs_theta": {"rho": 0.1518, "p": 0.774}}, "falsifier": "I20's own pre-registered bar (R success not reduced AND (slip OR p95 force) reduced with p<0.01) is MET on the slip half - B slip 0.01059 -> 0.00549 m at Welch p=1.5e-04, R slip p=0.0084 - and MET on no keep half: rig keep=false on all 6 arms at 0,0 and all 3 at 0.01,2. The slip 'win' is a tautology of the reduced press (Spearman slip~press rho=+0.77 vs slip~theta rho=+0.15) and is paid for with force_compliance 1.000 -> 0.213, i.e. the AEGIS secondary metric moves 5-10x the wrong way.", "root_cause": "Two closures. (a) A memoryless response cannot be proportional: a one-tick trigger is only EVALUATED on ticks that exceed it, and on those ticks the law is already at its floor, so 'bang-bang vs proportional' - the axis I19 and I20 were both framed on - does not exist in this loop. (b) The scrub-contact trigger that I19.5 left as the one admissible redefinition is now MEASURED and is not a control signal: flat at the floor across a 15x dose range, and a jerk-FREE static arm (theta=1e-4) reproduces its entire effect. The gate-rethink family is closed on physical data; a further gate must key on a quantity both stateful and causally upstream of coverage_cont, which in this rig means the path plan, not the force loop.", "bug_found_and_fixed": "Self-inflicted, logged not hidden: the first implementation wrote clip as min(GATE_PROP_MIN, max(0, x)), making 0.3 a CEILING and driving the press to 0.0 (press 0.50 -> 0.157 N) - a far stronger intervention than the spec. The two affected files are preserved as results/aegis_v2/I20_r241_BUG_clipceiling_*.jsonl, the clip was corrected to max(lo, min(hi, x)), a standalone assertion checks monotonicity + floor + ceiling + inertness below 0.7*theta, and every quoted number comes from post-fix runs.", "evidence": ["results/aegis_v2/I20_r241_regression_flat_POST-edit.jsonl", "results/aegis_v2/I20_r241_legacy_n00.jsonl", "results/aegis_v2/I20_r241_trig001_n00.jsonl", "results/aegis_v2/I20_r241_trig005_n00.jsonl", "results/aegis_v2/I20_r241_trig015_n00.jsonl", "results/aegis_v2/I20_r241_CTRLstatic003_n00.jsonl", "results/aegis_v2/I20_r241_floor06_n00.jsonl", "results/aegis_v2/I20_r241_floor015_n00.jsonl", "results/aegis_v2/I20_r241_n012_trig001.jsonl", "results/aegis_v2/I20_r241_n012_trig_floor015.jsonl", "results/aegis_v2/I20_r241_n012_CTRLstatic003.jsonl", "results/aegis_v2/I20_r241_analyse.py", "results/aegis_v2/I20_r241_analysis.txt", "results/aegis_v2/I20_r241_BUG_clipceiling_trig001.jsonl", "results/aegis_v2/I20_r241_BUG_clipceiling_trig005.jsonl"], "equation_row": "ROW I20 ((I20.1)-(I20.7))", "params_added": 0, "edge_budget": "no learned policy, 0 new params, 0 VRAM, control-loop cost is 2 subtractions + a clip per tick", "graph_edge": "N202-next->N203-I20->N204-next", "metric_name": "transfer_success", "g7_clean": true, "teleport_used": false}
