{"run": 468, "commit": "HEAD", "segment": 15, "idea": "FACC-ITER17", "idea_short": "FACC iter-17: Force-Adaptive Contact Control SE(3)-conditioned contact policy (G3 retired family replay, G4 unpairable, G7 predicted-only)", "status": "discard", "timestamp": "2026-10-01T00:00:00Z", "metric_name": "fixture_B transfer_success (coverage_cont >= 0.90 per episode), canonical rig, 20 seeds x 3 suites, health-check only", "metric_class": "physical", "metric_class_note": "physical only; synthetic_proxy excluded per G2/G7; health-check only since G3 replay + G4 unpairable prevent paired candidate measurement", "director_decision": {"iteration": 17, "idea": "FACC: SE(3)-conditioned Force-Adaptive Contact Control replacing flow-matching head; energy-based in-context attention", "predicted_score": 76, "executed": false, "exclusion_reasons": ["G3 PERMANENT RETIREMENT: eq78/N70-N76/manifold-switch/flow-bridge/energy-gated/EBM/SE3-affordance/DAEF/FACC family permanently retired; 34th replay.", "G4 UNPAIRABLE: PATH_MODES carries 0 injectable SE3/energy/manifold/FACC-head hook (RESIDUAL_HOOK_FN only, I3-owned).", "G7 INTEGRITY: predicted-only 76pts invalid for keep; synthetic N74 92.3 frozen unconditionally.", "G2 QUEUE EMPTY: no queued row since run 309; estimator lever N453b closed at every I23 level 0-0.24m (N455/N456/N457); N198 director-owned, unclaimable on the B bar."]}, "physical_action_taken": "Health-check ONLY (G3 replay, G4 unpairable): trochoid --compare trochoid, 20 seeds x 3 suites = 60 episodes, A/B/R 20/20 each (1.00/1.00/1.00), 0 harness errors, 0 rig bytes changed. Evidence results/aegis_v2/N468_r468_health_n0_0.jsonl.", "rig_invoked": true, "rig_exit": 0, "episodes": 60, "harness_errors": 0, "rig_bytes_changed": 0, "pose_noise_cfg": "0,0", "evidence": ["results/aegis_v2/N468_r468_health_n0_0.jsonl", "autoresearch_research.jsonl", "autoresearch_research_strategy_graph.jsonl", "experiments/worklog.md"], "metrics": {"idea": "FACC-ITER17", "metric_class": "physical", "seeds": 20, "episodes": 60, "fixture_A_success": 1.0, "fixture_B_success": 1.0, "fixture_R_success": 1.0, "delta_vs_champion": 0.0, "compare_baseline": "trochoid", "keep": false, "verdict": "discard-34th-G3-replay-not-executed-health-check-only"}}
{"run": 469, "commit": "HEAD", "segment": 15, "idea": "FACC-ITER18", "idea_short": "FACC iter-18: Force-Adaptive Contact Control SE(3)-conditioned energy head replacing Pi0 flow-mat (G3 retired family replay, G4 unpairable, G7 predicted-only)", "status": "discard", "timestamp": "2026-10-01T00:00:00Z", "metric_name": "fixture_B transfer_success (coverage_cont >= 0.90 per episode), canonical rig, 20 seeds x 3 suites, health-check only", "metric_class": "physical", "metric_class_note": "physical only; synthetic_proxy excluded per G2/G7; health-check only since G3 replay + G4 unpairable prevent paired candidate measurement", "director_decision": {"iteration": 18, "idea": "FACC: SE(3)-conditioned Force-Adaptive Contact Control replacing Pi0 flow-mat; score contact-affordance manifold via EBM in-context attention", "predicted_score": 76, "executed": false, "exclusion_reasons": ["G3 PERMANENT RETIREMENT: eq78/N70-N76/manifold-switch/flow-bridge/energy-gated/EBM/SE3-affordance/DAEF/FACC family permanently retired; 35th replay.", "G4 UNPAIRABLE: PATH_MODES carries 0 injectable SE3/energy/manifold/FACC-head hook (RESIDUAL_HOOK_FN only, I3-owned).", "G7 INTEGRITY: predicted-only 76pts invalid for keep; synthetic N74 92.3 frozen unconditionally.", "G2 QUEUE EMPTY: no queued row since run 309; estimator lever N453b closed at every I23 level 0-0.24m (N455/N456/N457); N198 director-owned, unclaimable on the B bar."]}, "physical_action_taken": "Health-check ONLY (G3 replay, G4 unpairable): trochoid --compare trochoid, 20 seeds x 3 suites = 60 episodes, A/B/R 20/20 each (1.00/1.00/1.00), 0 harness errors, 0 rig bytes changed. Evidence results/aegis_v2/N469_r469_health_n0_0.jsonl.", "rig_invoked": true, "rig_exit": 0, "episodes": 60, "harness_errors": 0, "rig_bytes_changed": 0, "pose_noise_cfg": "0,0", "evidence": ["results/aegis_v2/N469_r469_health_n0_0.jsonl", "autoresearch_research.jsonl", "autoresearch_research_strategy_graph.jsonl", "experiments/worklog.md"], "metrics": {"idea": "FACC-ITER18", "metric_class": "physical", "seeds": 20, "episodes": 60, "fixture_A_success": 1.0, "fixture_B_success": 1.0, "fixture_R_success": 1.0, "delta_vs_champion": 0.0, "compare_baseline": "trochoid", "keep": false, "verdict": "discard-35th-G3-replay-not-executed-health-check-only"}}
{"run": 470, "commit": "HEAD", "segment": 15, "idea": "VM-FACC-ITER19", "idea_short": "VM-FACC iter-19: Variable-Manifold Force-Adaptive Contact Control SE(3)-conditioned flow on force-gated affordance manifold (G3 retired family replay, G4 unpairable, G7 predicted-only)", "status": "discard", "timestamp": "2026-10-01T00:00:00Z", "metric_name": "fixture_B transfer_success (coverage_cont >= 0.90 per episode), canonical rig, 20 seeds x 3 suites, health-check only", "metric_class": "physical", "metric_class_note": "physical only; synthetic_proxy excluded per G2/G7; health-check only since G3 replay + G4 unpairable prevent paired candidate measurement", "director_decision": {"iteration": 19, "idea": "VM-FACC: Variable-Manifold Force-Adaptive Contact Control replacing pi0 flow-mat with SE(3)-conditioned flow on force-gated affordance manifold; predicted 76", "predicted_score": 76, "executed": false, "exclusion_reasons": ["G3 PERMANENT RETIREMENT: eq78/N70-N76/manifold-switch/flow-bridge/energy-gated/EBM/SE3-affordance/DAEF/FACC/VM-FACC family permanently retired; 36th replay.", "G4 UNPAIRABLE: PATH_MODES carries 0 injectable SE3/energy/manifold/FACC-head hook (RESIDUAL_HOOK_FN only, I3-owned).", "G7 INTEGRITY: predicted-only 76pts invalid for keep; synthetic N74 92.3 frozen unconditionally.", "G2 QUEUE EMPTY: no queued row since run 309; estimator lever N453b closed at every I23 level 0-0.24m (N455/N456/N457); N198 director-owned, unclaimable on the B bar."]}, "physical_action_taken": "Health-check ONLY (G3 replay, G4 unpairable): trochoid --compare trochoid, 20 seeds x 3 suites = 60 episodes, A/B/R 20/20 each (1.00/1.00/1.00), 0 harness errors, 0 rig bytes changed. Evidence results/aegis_v2/N470_r470_health_n0_0.jsonl.", "rig_invoked": true, "rig_exit": 0, "episodes": 60, "harness_errors": 0, "rig_bytes_changed": 0, "pose_noise_cfg": "0,0", "evidence": ["results/aegis_v2/N470_r470_health_n0_0.jsonl", "autoresearch_research.jsonl", "autoresearch_research_strategy_graph.jsonl", "experiments/worklog.md"], "metrics": {"idea": "VM-FACC-ITER19", "metric_class": "physical", "fixture_A_success": 1.0, "fixture_B_success": 1.0, "fixture_R_success": 1.0, "transfer_success": 1.0, "note": "health-check only; not a candidate measurement; G3 replay refused"}}
{"run": 471, "commit": "HEAD", "segment": 15, "idea": "FACC-ITER20", "idea_short": "FACC iter-20: Force-Adaptive Contact Control replacing flow-mat with SE(3)-conditioned energy-based physical in-context attention (G3 retired family replay, G4 unpairable, G7 predicted-only)", "status": "discard", "timestamp": "2026-10-01T00:00:00Z", "metric_name": "fixture_B transfer_success (coverage_cont >= 0.90 per episode), canonical rig, 20 seeds x 3 suites, health-check only", "metric_class": "physical", "metric_class_note": "physical only; synthetic_proxy excluded per G2/G7; health-check only since G3 replay + G4 unpairable prevent paired candidate measurement", "director_decision": {"iteration": 20, "idea": "FACC: Force-Adaptive Contact Control replacing flow-mat with SE(3)-conditioned energy-based physical in-context attention, flow-matching -> affordance-equivalence bridge; predicted 74", "predicted_score": 74, "executed": false, "exclusion_reasons": ["G3 PERMANENT RETIREMENT: eq78/N70-N76/manifold-switch/flow-bridge/energy-gated/EBM/SE3-affordance/DAEF/FACC family permanently retired; 37th replay.", "G4 UNPAIRABLE: PATH_MODES carries 0 injectable SE3/energy/manifold/FACC-head hook (RESIDUAL_HOOK_FN only, I3-owned).", "G7 INTEGRITY: predicted-only 74pts invalid for keep; synthetic N74 92.3 frozen unconditionally.", "G2 QUEUE EMPTY: no queued row since run 309; estimator lever N453b closed at every I23 level 0-0.24m (N455/N456/N457); N198 director-owned, unclaimable on the B bar."]}, "physical_action_taken": "Health-check ONLY (G3 replay, G4 unpairable): trochoid --compare trochoid, 20 seeds x 3 suites = 60 episodes, A/B/R 20/20 each (1.00/1.00/1.00), 0 harness errors, 0 rig bytes changed. Evidence results/aegis_v2/N471_r471_health_n0_0.jsonl.", "rig_invoked": true, "rig_exit": 0, "episodes": 60, "harness_errors": 0, "rig_bytes_changed": 0, "pose_noise_cfg": "0,0", "evidence": ["results/aegis_v2/N471_r471_health_n0_0.jsonl", "autoresearch_research.jsonl", "autoresearch_research_strategy_graph.jsonl", "experiments/worklog.md"], "metrics": {"idea": "FACC-ITER20", "metric_class": "physical", "fixture_A_success": 1.0, "fixture_B_success": 1.0, "fixture_R_success": 1.0, "transfer_success": 1.0, "note": "health-check only; not a candidate measurement; G3 replay refused"}}
{"run": 472, "commit": "HEAD", "segment": 15, "idea": "FACC-EA-ITER21", "idea_short": "FACC-EA iter-21: Force-Adaptive Contact Control with Energy Attention, SE(3)-conditioned EBM replacing flow-mat (G3 retired family replay, G4 unpairable, G7 predicted-only)", "status": "discard", "timestamp": "2026-10-01T00:00:00Z", "metric_name": "fixture_B transfer_success (coverage_cont >= 0.90 per episode), canonical rig, 20 seeds x 3 suites, health-check only", "metric_class": "physical", "director_decision": {"iteration": 21, "idea": "FACC-EA: SE(3)-conditioned EBM scores replacing flow-mat head; energy minimization over contact exemplars", "predicted_score": 76, "executed": false, "exclusion_reasons": ["G3 PERMANENT RETIREMENT: eq78/N70-N76/manifold-switch/flow-bridge/energy-gated/EBM/SE3-affordance/DAEF/FACC family retired; 38th replay.", "G4 UNPAIRABLE: PATH_MODES carries 0 injectable SE3/energy/manifold/FACC-head hook (RESIDUAL_HOOK_FN only, I3-owned).", "G7 INTEGRITY: predicted-only 76pts invalid for keep; synthetic N74 92.3 frozen unconditionally.", "G2 QUEUE EMPTY: no queued row since run 309; estimator lever N453b closed (N455/N456/N457); N198 director-owned."]}, "physical_action_taken": "Health-check ONLY (G3 replay, G4 unpairable): trochoid --compare trochoid, 20 seeds x 3 suites = 60 eps, A/B/R 1.00/1.00/1.00, 0 errors, 0 rig bytes changed. Evidence results/aegis_v2/N472_r472_health_n0_0.jsonl.", "rig_invoked": true, "rig_exit": 0, "episodes": 60, "harness_errors": 0, "rig_bytes_changed": 0, "pose_noise_cfg": "0,0", "evidence": ["results/aegis_v2/N472_r472_health_n0_0.jsonl"], "metrics": {"idea": "FACC-EA-ITER21", "metric_class": "physical", "fixture_A_success": 1.0, "fixture_B_success": 1.0, "fixture_R_success": 1.0, "transfer_success": 1.0}}
{"run": 473, "commit": "HEAD", "segment": 15, "idea": "FACC-ITER22", "idea_short": "FACC iter-22: Force-Adaptive Contact Control replacing flow-matching head in pi0 (G3 retired family replay, G4 unpairable, G7 predicted-only)", "status": "discard", "timestamp": "2026-10-01T00:00:00Z", "metric_name": "fixture_B transfer_success (coverage_cont >= 0.90 per episode), canonical rig, 20 seeds x 3 suites, health-check only", "metric_class": "physical", "director_decision": {"iteration": 22, "idea": "FACC: SE(3)-conditioned force-adaptive contact control replacing flow-matching head; energy-based physical in-context attention", "predicted_score": 76, "executed": false, "exclusion_reasons": ["G3 PERMANENT RETIREMENT: eq78/N70-N76/manifold-switch/flow-bridge/energy-gated/EBM/SE3-affordance/DAEF/FACC family retired; 39th replay.", "G4 UNPAIRABLE: PATH_MODES carries 0 injectable SE3/energy/manifold/FACC-head hook (RESIDUAL_HOOK_FN only, I3-owned).", "G7 INTEGRITY: predicted-only 76pts invalid for keep; synthetic N74 92.3 frozen unconditionally.", "G2 QUEUE EMPTY: no queued row since run 309; estimator lever N453b closed (N455/N456/N457); N198 director-owned."]}, "physical_action_taken": "Health-check ONLY (G3 replay, G4 unpairable): trochoid --compare trochoid, 20 seeds x 3 suites = 60 eps, A/B/R 1.00/1.00/1.00, 0 errors, 0 rig bytes changed. Evidence results/aegis_v2/N473_r473_health_n0_0.jsonl.", "rig_invoked": true, "rig_exit": 0, "episodes": 60, "harness_errors": 0, "rig_bytes_changed": 0, "pose_noise_cfg": "0,0", "evidence": ["results/aegis_v2/N473_r473_health_n0_0.jsonl"], "metrics": {"idea": "FACC-ITER22", "metric_class": "physical", "fixture_A_success": 1.0, "fixture_B_success": 1.0, "fixture_R_success": 1.0, "transfer_success": 1.0}}
{"run": 474, "commit": "HEAD", "segment": 15, "idea": "FACC-ITER23", "idea_short": "FACC iter-23: SE(3)-conditioned energy-based in-context attention replacing flow-mat head (G3 retired family replay, G4 unpairable, G7 predicted-only)", "status": "discard", "timestamp": "2026-10-01T00:00:00Z", "metric_name": "fixture_B transfer_success (coverage_cont >= 0.90 per episode), canonical rig, 20 seeds x 3 suites, health-check only", "metric_class": "physical", "director_decision": {"iteration": 23, "idea": "FACC: SE(3)-conditioned energy-based in-context attention replacing flow-mat head; deformable affordance field attending pi0 tokens to min-energy manifold", "predicted_score": 76, "executed": false, "exclusion_reasons": ["G3 PERMANENT RETIREMENT: eq78/N70-N76/manifold-switch/flow-bridge/energy-gated/EBM/SE3-affordance/DAEF/FACC family retired; 40th replay.", "G4 UNPAIRABLE: PATH_MODES carries 0 injectable SE3/energy/manifold/FACC-head hook (RESIDUAL_HOOK_FN only, I3-owned).", "G7 INTEGRITY: predicted-only 76pts invalid for keep; synthetic N74 92.3 frozen unconditionally.", "G2 QUEUE EMPTY: no queued row since run 309; estimator lever N453b closed (N455/N456/N457); N198 director-owned."]}, "physical_action_taken": "Health-check ONLY (G3 replay, G4 unpairable): trochoid --compare trochoid, 20 seeds x 3 suites = 60 eps, A/B/R 1.00/1.00/1.00, 0 errors, 0 rig bytes changed. Evidence results/aegis_v2/N474_r474_health_n0_0.jsonl.", "rig_invoked": true, "rig_exit": 0, "episodes": 60, "harness_errors": 0, "rig_bytes_changed": 0, "pose_noise_cfg": "0,0", "evidence": ["results/aegis_v2/N474_r474_health_n0_0.jsonl"], "metrics": {"idea": "FACC-ITER23", "metric_class": "physical", "fixture_A_success": 1.0, "fixture_B_success": 1.0, "fixture_R_success": 1.0, "transfer_success": 1.0}}
{"run": 475, "commit": "HEAD", "segment": 15, "idea": "FACC-ITER24", "idea_short": "FACC iter-24: energy-based physical in-context attention over SE(3) candidates replacing flow-matching expert (G3 retired family replay, G4 unpairable, G7 predicted-only)", "status": "discard", "timestamp": "2026-10-01T00:00:00Z", "metric_name": "fixture_B transfer_success (coverage_cont >= 0.90 per episode), canonical rig, 20 seeds x 3 suites, health-check only", "metric_class": "physical", "director_decision": {"iteration": 24, "idea": "FACC: Force-Adaptive Contact Control, energy-based physical in-context attention over SE(3) candidates; EBM scoring + compliance policy replacing flow-matching expert", "predicted_score": 74, "executed": false, "exclusion_reasons": ["G3 PERMANENT RETIREMENT: eq78/N70-N76/manifold-switch/flow-bridge/energy-gated/EBM/SE3-affordance/DAEF/FACC family retired; 41st replay.", "G4 UNPAIRABLE: PATH_MODES carries 0 injectable SE3/energy/manifold/FACC-head hook (RESIDUAL_HOOK_FN only, I3-owned).", "G7 INTEGRITY: predicted-only 74pts invalid for keep; synthetic N74 92.3 frozen unconditionally.", "G2 QUEUE EMPTY: no queued row since run 309; estimator lever N453b closed (N455/N456/N457); N198 director-owned."]}, "physical_action_taken": "Health-check ONLY (G3 replay, G4 unpairable): trochoid --compare trochoid, 20 seeds x 3 suites = 60 eps, A/B/R 1.00/1.00/1.00, 0 errors, 0 rig bytes changed. Evidence results/aegis_v2/N475_r475_health_n0_0.jsonl.", "rig_invoked": true, "rig_exit": 0, "episodes": 60, "harness_errors": 0, "rig_bytes_changed": 0, "pose_noise_cfg": "0,0", "evidence": ["results/aegis_v2/N475_r475_health_n0_0.jsonl"], "metrics": {"idea": "FACC-ITER24", "metric_class": "physical", "fixture_A_success": 1.0, "fixture_B_success": 1.0, "fixture_R_success": 1.0, "transfer_success": 1.0}}
{"run": 476, "commit": "HEAD", "segment": 15, "idea": "N476", "idea_short": "registration-window DOSE (AEGIS_REG_HALF_M) as the estimator frontier: does H=0.6 extend the certified pose-noise boundary past 0.24 m / 48 deg?", "status": "keep", "timestamp": "2026-10-02T00:00:00Z", "metric_name": "fixture_B transfer_success (coverage_cont >= 0.90 per episode), canonical rig v2, PyBullet DIRECT, 20 seeds x 3 suites x 2 paired arms", "metric_class": "physical", "director_decision": {"iteration": 1, "idea": "FACC-SE3: Force-Adaptive Contact Control + energy-based physical in-context attention, dynamic SE(3) affordance field replacing the pi0 fixed affordance manifold (predicted 76-81)", "executed": false, "exclusion_reasons": ["G3 PERMANENT RETIREMENT: eq78/N70-N76/manifold-switch/flow-bridge/energy-gated/EBM/SE3-affordance/DAEF/FACC family permanently retired; 42nd replay.", "G4 UNPAIRABLE: PATH_MODES carries 0 injectable SE3/energy/manifold/FACC-head hook (RESIDUAL_HOOK_FN only, I3-owned).", "G7 INTEGRITY: predicted-only 76-81 invalid for a keep; synthetic N74 92.3 stays frozen unconditionally."]}, "physical_action_taken": "Director proposal refused as a G3 replay (42nd). Instead executed the cheapest unmeasured rig cell: the registration-window DOSE at the first unmeasured pose-noise cells past the certified boundary. 3 noise cells x 20 seeds x 3 suites x 2 paired arms = 360 episodes + 120 independent verification episodes, 0 harness errors, 0 rig bytes changed.", "rig_invoked": true, "rig_exit": 0, "episodes": 480, "harness_errors": 0, "rig_bytes_changed": 0, "pose_noise_cfg": "0.32,64 (keep cell); 0.40,80 and 0.48,96 (boundary placement)", "evidence": ["results/aegis_v2/N476_r476_H06_n0.32_64.jsonl", "results/aegis_v2/N476_r476_H06_n0.40,80.jsonl", "results/aegis_v2/N476_r476_H06_n0.48,96.jsonl", "results/aegis_v2/N476_r476_verify_cand_n0.32_64.jsonl", "results/aegis_v2/N476_r476_verify_base_n0.32_64.jsonl"], "metrics": {"idea": "N476", "metric_class": "physical", "fixture_B_success": 0.85, "fixture_A_success": 0.25, "fixture_R_success": 0.3, "transfer_success": 0.85, "paired_baseline": "AEGIS_REG_HALF_M=0.35 (frozen), REG=depth + ROW_CENTRE=1, same 20 seeds", "fixture_B_success_baseline": 0.4, "fixture_A_success_baseline": 0.1, "fixture_R_success_baseline": 0.05, "coverage_cont_B_baseline": 0.5969, "coverage_cont_B_candidate": 0.9125, "coverage_cont_delta_B": 0.3156, "welch_p_B": 0.006606, "paired_p_B": 0.000927, "fisher_p_B": 0.007912, "welch_p_A": 0.002534, "paired_p_A": 0.000861, "welch_p_R": 0.000775, "paired_p_R": 4.07e-05, "rig_keep": true, "seeds": 20, "boundary_table_B_success_H06_vs_H035": {"0.24,48": "0.95 vs 0.55 (run 456)", "0.32,64": "0.85 vs 0.40 (this run, keep=true)", "0.40,80": "0.70 vs 0.20 (keep=false: B not > 0.70)", "0.48,96": "0.60 vs 0.10 (keep=false)"}, "reg_err_median_mm_at_0.32_64": {"H0.6": {"A": 3.9, "B": 12.6, "R": 32.1}, "H0.35": {"A": 124.5, "B": 90.5, "R": 156.6}}, "tier2_requirement": "B >= 0.90 through 0.12 m / 24 deg; B >= 0.70 through 0.32 m / 64 deg (extended from 0.24 m / 48 deg)", "novelty": "PARTIAL: one fallback sub-agent asserts no prior art treats the registration window as a dose knob, but its citation list was NOT returned to the worker and is therefore logged UNVERIFIED; mechanism itself is not new (I9 registration, N453 depth registration, N456 H=0.6 dose). New = the measured dose-response band and the extended certified boundary.", "p_independently_reverified": "yes - separate single-arm processes re-run and scipy re-computed; deltas and p match the rig compare record exactly"}, "synthetic_proxy": null}
