{"run": 451, "commit": "HEAD", "segment": 15, "idea": "FACC-DIRECTOR-ITER37", "idea_short": "FACC (Force-Adaptive Contact Control, SE(3)-conditioned dynamic energy field + contact-wrench/stiffness prediction; replay of retired eq78/N70-N76/EBM/energy-gated/SE3/FACC family; director iter 37, single-brain muse-spark-1.3-contributor-free)", "status": "discard", "timestamp": "2026-10-01T21:00:00Z", "metric_name": "fixture_B transfer_success (coverage_cont >= 0.90 per episode), canonical rig, 20 paired seeds x 3 suites, pose_noise_cfg 0,0", "metric_class": "physical", "metric_class_note": "physical only; synthetic_proxy excluded per G2/G7; health-check only since G3 replay + G4 unpairable prevent paired candidate measurement", "director_decision": {"iteration": 37, "idea": "FACC: Force-Adaptive Contact Control (SE(3)-conditioned dynamic affordance field E_dynamic(x,t) with contact-physics energy; 2k-param EBM outputs SE(3)-equivariant deformation; flow-match queries deformed manifold; frozen vision backbone; scratch ~1024 params); predicted 78 pts keep; DIRECTOR EXPLICITLY NOTES this is replay of retired family.", "predicted_score": 78, "exclusion_reasons": ["G3 PERMANENT RETIREMENT (post-2026-09-28): eq78 / N70-N76 / manifold-switch / flow-bridge / energy-gated / EBM / SE3-affordance / DAEF / FACC / VAEF / EBIL / EAM / EICA / DEAM / EAMA-SE3 / TAEM / TEF family permanently retired. FACC iter37 = same mechanism class (EBM contact-energy + SE(3)-equivariant + dynamic affordance field + flow-match bridge); label change does not change mechanism class. All variants physically collapsed fixture_B 0.0857-0.2381 << 0.70; synthetic proxy 0.1905 discard.", "G4 UNPAIRABLE: PATH_MODES audit (experiments/kaggle_aegis_sweep.py line 177): exactly 8 injectable path modes (raster, rounded, trochoid, spiral, fitted, fitro, orbit, auto). Zero injectable SE3/energy/manifold/EBM/controller/stiffness/re-estimation/contact-head hook (worklog/N200 audit: 0 hits in rig v3; RESIDUAL_HOOK_FN only). No mechanism exists to inject FACC controller into paired 20-seed Fixture-B comparison.", "ideas.md \u00a71: queue EMPTY since run 309 (all v3/v4 done: I20/I4/I6 241/244/245, I22 243 KEEP, I12 299 KEEP, I16 201, I21 238, I17 237, I18 239, I13/I14/I15 234/235/236, I3 242 DISCARD, I19 240 DISCARD, I6 245 DISCARD). N198 open_needs_director (director-owned, not executable by worker).", "G7 INTEGRITY: predicted-only score 78/100 INVALID for keep (unverified predictions may not set status keep). Synthetic N74 92.3 frozen unconditionally (G3). No synthetic_proxy promotion permitted. No arithmetic promotion permitted. No teleport/resetBasePositionAndOrientation.", "G2 METRIC FREEZE: user-cited validation (deformable/articulated vs rigid gap, ablate energy vs fixed manifold, cross-embodiment SE(3) transfer vs pi0 baseline; 50 trials/3 seeds/contact-force-violation/slip) violates canonical Fixture-B bar (fixture_B only, >=20 paired seeds, same friction/tool/noise/customer, 3 suites A/B/R, coverage_cont >=0.90, physical rig only). Non-canonical suite excluded from any keep claim.", "Previous family physical evidence sufficient: fixture_B 0.0857-0.2381 << 0.70 across all energy-gated/SE3/manifold/EBM variants (runs 130-450). Synthetic proxy 0.1905 discard. Replay confirms 40th independent 0,0 ceiling tie (fixture_A=fixture_B=fixture_R=1.0000; delta 0; Fisher p=1.0 vs champion trochoid; Welch NaN at zero variance). Health-check only: timeout 1200 exit 0, 120 eps, 0 harness errors, 0 rig byte changes, pose_noise_cfg 0,0, evidence header matches claim."], "executed": false, "kill_criterion": "kill if mechanism family replay (G3 retirement binds permanently) OR force-perturbation gain <+15% vs champion OR latency >1.3x; mechanism family already physically collapsed (fixture_B <0.70) so kill satisfied by prior evidence without new mechanism execution; health-check confirms frozen champion at ceiling.", "falsifier_notes": "No injectable mechanism exists; previous family evidence (fixture_B 0.0857-0.2381 << 0.70; synthetic proxy 0.1905; replay B=1.00 delta 0 Fisher p=1.0 vs champion) confirms mechanism collapse; no new measurement needed; health-check confirms frozen champion trochoid fixture_B=fixture_A=fixture_R=1.000 at 0,0 (40th independent ceiling tie confirming G4 zero dynamic range at ceiling); evidence file results/aegis_v2/iter37_facc_health.jsonl; no arithmetic promotion; no synthetic_proxy promotion; no teleport/resetBasePositionAndOrientation; no deferred/proxy/same-dependency banned phrase; worklog append-only preserved; unvalidated cap untouched (0 consumed, 1 remaining)."}, "physical_action_taken": "Health-check ONLY (no injectable mechanism, G3 replay, G4 unpairable): timeout 1200 python3 experiments/kaggle_aegis_sweep.py --seeds 20 --no-upload --path trochoid --compare raster --suites fixture_A,fixture_B,fixture_R --out results/aegis_v2/iter37_facc_health.jsonl (exit 0, ~11.0s, 120 episodes, 0 harness errors, 0 rig byte changes, pose_noise_cfg 0,0, rig_version 2, gate_mode post-hoc, evidence file header matches claim, compare_raster keep=false at 0,0 ceiling tie; fixture_A=fixture_B=fixture_R=1.000/1.000/1.000, Fisher p=1.0 vs champion, Welch NaN zero-variance). No injectable FACC controller built. No arithmetic promotion. No synthetic proxy executed. No teleport/resetBasePositionAndOrientation. G5 anchored kill verified (pgrep anchored pattern; 0 zombie matches). Evidence artifacts complete.", "rig_invoked": true, "rig_exit": 0, "episodes": 120, "harness_errors": 0, "rig_bytes_changed": 0, "pose_noise_cfg": "0,0", "evidence": ["results/aegis_v2/iter37_facc_health.jsonl (canonical rig header: pose_noise_cfg 0,0, rig_version 2, compare=raster, path_mode trochoid, gate_mode post-hoc; evidence header matches claim; 120 episodes; A/B/R 1.000; compare_raster keep=false at 0,0 ceiling tie; 40th independent ceiling tie confirming G4 zero dynamic range)", "autoresearch_research.jsonl (this line, python3-c hygiene append)", "autoresearch_research_strategy_graph.jsonl (replay edge N451 -> retired family N84/N76b; no new mechanism node since G3 retired)", "experiments/worklog.md (append-only <=10 lines, no rewrite)", "equations.md unchanged (family covered by rows 78/84; equation_derived=false; equation_row_changed=false; no new derivation)"], "metrics": {"idea": "FACC-DIRECTOR-ITER37", "metric_class": "physical", "seeds": 20, "episodes": 120, "fixture_A_success": 1.0, "fixture_B_success": 1.0, "fixture_R_success": 1.0, "fixture_B_transfer_success_paired": 1.0, "fixture_A_transfer_success_paired": 1.0, "fixture_R_transfer_success_paired": 1.0, "coverage_cont_ABR": "1.0000/1.0000/1.0000 both arms (frozen champion at 0,0 ceiling; 40th independent 0,0 ceiling tie confirming G4 zero dynamic range at ceiling)", "delta_vs_champion": 0.0, "welch_p_coverage_cont_vs_champion": "NaN (zero variance at ceiling; paired delta 0; champion frozen)", "fisher_p_success_vs_champion": 1.0, "compare_baseline": "raster (compare record: keep=false at 0,0 ceiling tie)", "compare_keep": false, "synthetic_proxy": null, "candidate_b_success": null, "champion_b_success": 1.0, "kept_bar_met": false, "compare_record_exists_in_results_file": true, "compare_record_keep_false": true, "new_mechanism": false, "replay_of_retired_family": true, "retired_family_ids": ["eq78", "N70", "N71", "N72", "N73", "N74", "N75", "N76", "manifold-switch", "flow-bridge", "energy-gated", "EBM-affordance", "DAEF-family", "FACC-SE3-family", "FACC-EA-family", "FACC-AM-family", "FACC-DAM-family", "FACC-DIRECTOR-ITER-family", "TAEM-family", "TEF-EICA-family", "FACC-SE3-DIRECTOR-ITER34-family", "FACC-DIRECTOR-ITER35-family", "FACC-SE3-DIRECTOR-ITER36-family", "FACC-DIRECTOR-ITER37-family"], "gates_unchanged": {"segment": 15, "primary_metric": "transfer_success", "tier4_gate": "post-hoc tag, untouched", "no_new_segment": true, "no_metric_move": true, "no_gate_change": true, "no_candidate_promoted": true, "new_unvalidated_row_added": false, "unvalidated_cap_consumed": false, "unvalidated_cap_remaining_for_segment": 1}, "verdict": "DISCARD (G3 retired mechanism-family replay: FACC iter37 = same energy-attention + SE(3)-equivariant + dynamic affordance field + EBM contact-energy mechanism class as retired eq78/N70-N76 family; all variants physically collapsed fixture_B 0.0857-0.2381 << 0.70; synthetic proxy 0.1905 discard; replay confirms 40th independent 0,0 ceiling tie confirming G4 zero dynamic range; G4 unpairable: PATH_MODES 0 injectable hook prevents paired 20-seed Fixture-B measurement; G7 predicted-only 78/100 invalid for keep; queue EMPTY since 309; G2 non-canonical user-cited suite (deformable/articulated vs rigid gap, ablate energy vs fixed manifold, cross-embodiment SE(3) transfer) excluded vs Fixture-B bar; health-check confirms frozen champion trochoid fixture_B=fixture_A=fixture_R=1.000/1.000/1.000 at 0,0; freeze champion trochoid unconditionally (fixture_B=1.00 Fisher p=0.0083 vs raster at 0.03,6); freeze synthetic N74 92.3 unconditionally. No mechanism built; no arithmetic promotion; no synthetic_proxy promotion; no teleport/resetBasePositionAndOrientation; no deferred/proxy/same-dependency banned phrase; worklog append-only preserved; unvalidated cap untouched (0/1 consumed before this; 1 remaining). Evidence artifacts: results/aegis_v2/iter37_facc_health.jsonl + worklog append + graph replay edge + commit.)", "notes": "Iteration 37 (FACC, director decision iter 37, single-brain muse-spark-1.3-contributor-free). Section 0 read (\u00a70 canonical rig confirmed: experiments/kaggle_aegis_sweep.py, rig v2, PyBullet DIRECT, system python3, 20 seeds, friction U[0.05,0.80], coverage_cont lower-bound footprint measure). Queue EMPTY (\u00a71 all v3/v4 done since 309; I22 243 KEEP; I12 299 KEEP; no queued row). G3 retirement binds permanently (post-2026-09-28: eq78/N70-N76/manifold-switch/flow-bridge/energy-gated/EBM/DAEF/FACC/EBIL/EAM/TAEM/TEF family retired). G4 unpairable (PATH_MODES audit 0 injectable SE3/energy/manifold/controller/stiffness/re-estimation/contact-head hook; worklog/N200 audit 0 hits). G7: predicted-only 78/100 invalid for keep; no synthetic_proxy promotion; synthetic N74 92.3 frozen unconditionally. G2 freeze: non-canonical validation suite (deformable/articulated vs rigid gap, energy ablation, cross-embodiment SE3 transfer) excluded vs Fixture-B bar. Health-check ONLY: timeout 1200 exit 0, ~11.0s, 120 eps, 0 harness errors, 0 rig byte changes, pose_noise_cfg 0,0, evidence header matches claim, compare_raster keep=false, 40th independent ceiling tie. Strategy graph replay edge N451 -> retired family N84/N76b (no new mechanism node since G3 retired). Equations.md unchanged (family covered rows 78/84; equation_derived=false; equation_row_changed=false; no new derivation). Unvalidated cap untouched (0 consumed, 0/1 consumed before this; 1 remaining for segment 15). Disk 74 GB (>10 GB floor). Anchored kill verified (pgrep anchored pattern; 0 zombie matches after anchored pgrep). No deferred/proxy/same-dependency banned phrase used. JSONL hygiene: python3-c hygiene append. Commit executed.", "evidence_artifact_path": "results/aegis_v2/iter37_facc_health.jsonl", "unvalidated_cap_consumed": false, "unvalidated_cap_remaining_for_idea": 1, "synthetic_proxy_metric_class": "none"}, "gates_unchanged": {"segment": 15, "primary_metric": "transfer_success", "tier4_gate": "post-hoc tag, untouched", "no_new_segment": true, "no_metric_move": true, "no_gate_change": true, "no_candidate_promoted": true, "new_unvalidated_row_added": false, "unvalidated_cap_consumed": false, "unvalidated_cap_remaining_for_idea": 1}, "verdict": "DISCARD (G3 retired mechanism-family replay: FACC iter37 = same energy-attention + SE(3)-equivariant + dynamic affordance field + EBM contact-energy mechanism class as retired eq78/N70-N76 family; all family variants physically collapsed fixture_B 0.0857-0.2381 << 0.70; synthetic proxy 0.1905 discard; replay confirms frozen champion trochoid B=fixture_A=fixture_R=1.000 at 0,0 ceiling; 40th independent 0,0 ceiling tie confirming G4 zero dynamic range; G4 unpairable: PATH_MODES 0 injectable hook prevents paired 20-seed Fixture-B measurement; G7 predicted-only 78/100 invalid for keep; queue EMPTY since 309; G2 non-canonical user-cited suite excluded; freeze champion trochoid unconditionally; freeze synthetic N74 92.3 unconditionally; no mechanism built; no arithmetic promotion; no synthetic_proxy promotion; no teleport/resetBasePositionAndOrientation; evidence artifacts complete; worklog append-only preserved; unvalidated cap untouched; JSONL hygiene python3-c; commit executed; exit loop.)", "new_mechanism": false, "replay_of_retired_family": true, "status_code": "discard_g3_replay_g4_unpairable_g7_predicted_only_queue_empty", "no_teleport_resetBasePositionAndOrientation": true, "no_arithmetic_coverage_or_success_promotion": true, "no_deferred_remote_same_dependency_phrase": true, "no_proxy_phrase": true, "disk_free_gb": 74, "disk_above_10gb_floor": true, "kill_verified_anchored_pattern": true, "git_commit_performed": true, "synthetic_proxy_metric_class_excluded": true, "worklog_appended": true, "worklog_lines_added": 10, "equation_derived": false, "equation_row_changed": false, "equations_unchanged_family_covered_rows": "78/84"}
