{"type": "edge", "from": "N207-I22", "to": "N208-next", "kind": "derived", "run": 243, "idea": "next", "label": "Four closures, in the order they should not be re-derived. (1) A learned residual on a hand-written plan has nothing to learn that the plan does not already determine; when the action collapses to 97.6% of its mean (run 242) AND the closed-form constant beats it, the finding is that the PLAN is wrong. Reach for the plan list first. (2) The binding constraint on this rig was never the path MODE (raster/rounded/trochoid all reach ceiling 1.0000 once the rows are on the cell centres) but the SPAN+ANCHOR condition against the scoring grid: rows must cover the cells the scorer defines, at the cells' centres. Any new path mode must satisfy that by construction, and the cheapest way to check is the rig's own _coverage_cont on the planned polyline -- no physics, sub-second, and it predicted this run to 4 decimals. (3) Two measurement rules this iteration needed: an INERT/reverted control arm to prove the plumbing (here, AEGIS_ROW_CENTRE=0.0 reproducing the frozen champion field-for-field) before believing a delta, and a dose-response with a collapsing arm (ROW_CENTRE=2.0, keep=false) to separate a law from a tuned offset -- a single +0.025 arm could have been reported either way. (4) Where the frontier now is: coverage_cont is saturated at 1.0000/0.9961, so no further path idea can win on coverage and the compose-two-pieces family (I18) stays closed. The measurable residuals are force_compliance 0.4864 on fixture_A and 0.7548 on fixture_R under the same 0.5 N press, which is the I11 normal-force floor (run 235) and is a rig mass/stiffness question, not a gate (I19/I20 closed) and not a path; and Tier-2 registration error beyond 1cm/2deg (I9/I5)."}
{"type": "edge", "from": "N208-next", "to": "N209-I4", "kind": "tested", "run": 244, "idea": "I4", "label": "I4 asked whether the 285 ms SmolVLA chunk can be brought under the 25 ms Jetson budget by collapsing the 10-step flow-matching loop to one NFE (shortcut model, Frans arXiv:2410.12557, or MeanFlow arXiv:2505.13447). Executed as a LOCAL pre-check on the RTX 3050, with the real inference methods wrapped so the split is the production path: t_chunk(N) = t_prefix 54.87 + t_unattr 16.13 + N*t_expert 11.40 ms, closing to 0.01 ms against the 184.99 measured. The 1-NFE chunk is 82.09 ms, 3.28x the budget, and solving N* = (25 - 71.00)/11.40 = -4.04 shows the bar is unreachable for EVERY NFE count including zero, because the per-chunk fixed cost alone is 2.84x the budget at N=0. Dropping a camera halves the prefix (177 -> 113 tokens, 0.855 ms/token) and still leaves N* = -1.59. Verdict DISCARD on its own pre-registered bar, BEFORE any training. Step B (Colab A100) was deliberately not booked."}
{"type": "node", "id": "N209-I4", "run": 244, "idea": "I4", "status": "discard", "metric": 1.0, "label": "I4 is closed, and the reason is more useful than the number. Shortcut/one-step samplers are the standard answer to flow-matching latency and they are the WRONG lever whenever a fixed per-chunk cost dominates: of the 82.09 ms that survives 1-NFE, 71.00 ms (86.5%) is spent before the first action vector exists (16 VLM decoder layers over image+lang tokens, KV cache filled once) and 11.40 ms (13.9%) is the denoiser anyone proposing a shortcut model is trying to shorten. Deleting the loop entirely is worth a real 2.25x and still misses by 3.28x. Two further measurements, both worth keeping: the prefix is linear in conditioning tokens at 0.855 ms/token while the expert step is independent of camera count, so the budget is set by the CONTEXT the policy carries, not by the evaluations it runs; and resize_imgs_with_padding 512 -> 256 is INERT in this stack (177 tokens either way, the ckpt preprocessor owns the resize) and made latency WORSE (1-cam 235.30 vs 157.39 ms), so the free 4x that a config diff suggests is not available. Paired rig record confirms no regression: 20 seeds x 3 suites, keep=true, B 0.9453 -> 1.0000 (Welch p 5.26e-06), bit-identical to run 243. No GPU spent, no checkpoint downloaded. VRAM 975.8 MiB held; the binding resource was time, not memory."}
{"type": "edge", "from": "N209-I4", "to": "N210-next", "kind": "derived", "run": 244, "idea": "next", "label": "Four transfers from I4, ordered by how much they generalise. (1) MEASURE THE FIXED COST BEFORE OPTIMISING THE LOOP. A budget can be unreachable for reasons orthogonal to the optimisation variable; here the NFE count was never binding. The cheap pre-check (one local timing run, no training, no GPU booking) falsified a queued A100 idea in minutes and saved the spend-down budget. Make the pre-check the gate for every future latency idea, not the training run. (2) A DISCOUNTED-BUDGET CLAIM IS NOT A SPEEDUP CLAIM. The 2.25x from deleting the flow loop is real and must be cited together with the 82.09 ms it lands on; the pre-registered target of 25 ms was never met and no amount of sampler work will meet it. (3) THE CONTEXT IS THE COMPUTE. 0.855 ms per conditioning token, paid once per chunk, against 11.40 ms for all ten denoising evaluations together, means the edge frontier for a VLA is what it conditions on, not how many times it evaluates. That is the same shape of finding as I18/I22 in reverse: there a plan was limited by a representation rather than a policy, here a budget is limited by a representation rather than an evaluation count. (4) A CONFIG KNOB IS NOT AN INTERVENTION UNTIL IT IS MEASURED. resize 512 -> 256 changed no token count and raised latency, because the override did not reach the ckpt's preprocessor. The measurement, not the diff, is what settles whether a knob works."}
{"type": "node", "id": "N211-I6", "run": 245, "idea": "I6", "status": "discard", "metric": 1.0, "label": "I6 answers a question the 4-tier stack depends on and nobody had measured: is a quality tag READ at all by a 500M edge expert? Paired, same observation, same images, same explicit flow noise, 7 language arms x 32 observations on the local SmolVLA-500M FT checkpoint. The pre-registered abort (||a_S - a_F|| < 1e-3) is NOT triggered - d(SUCCESS, FAILURE_SLIP) = 2.9298, CI95 [2.566, 3.307], Wilcoxon p 2.33e-10, and 64.8% of the action spread between two different observations. By magnitude alone that is the strongest conditioning effect measured in this segment. It is not conditioning. Three semantically NULL edits reproduce 44% (SUCCESS->PASS), 90% (FAILURE_SLIP->SLIP) and 46% (the same tag moved from suffix to prefix) of the success-vs-failure distance, while discarding the entire instruction ('fold a shirt') produces only 64% - the edit that should dominate is the smallest. And the tag-induced delta has no direction: mean pairwise cosine across observations 0.3737 vs an independent-pair null of 0.3833 (p 0.585). So the tag perturbs the prefix KV cache with surface form and nothing else. The transferable rule: action-space distance between two prompts is not evidence that the prompts mean different things, and every conditioning claim in this stack needs a synonym control and a position control next to the success/failure contrast. Free half: the language prefix is padded to 48 tokens for every arm at real counts 4-15, chunk latency is flat at 207.9-213.3 ms (2.6%, uncorrelated with real token count), so metadata conditioning costs 0 ms and 0 tokens and the I4 frontier is entirely image tokens (0.855 ms/token)."}
{"type": "edge", "from": "N210-next", "to": "N211-I6", "kind": "planned", "run": 245, "idea": "I6", "label": "N210 handed over two frontiers: conditioning-token count per chunk (0.855 ms/image token, prefix paid once per chunk) and the untested diverse-context-conditioning premise the whole stack rests on. I6 attacks the second and partly settles the first. It is also the lowest-numbered remaining `queued` idea in ideas.md section 1 after I4 (I6, GPU Colab/Kaggle, quality-tag conditioning test on the FT expert; I12 stays blocked on I8, which is BLOCKED/unblock-exhausted)."}
{"type": "edge", "from": "N211-I6", "to": "N212-next", "kind": "derived", "run": 245, "idea": "next", "label": "Four transfers from I6. (1) THE NULL-CONTROL RULE IS NOW MANDATORY, NOT OPTIONAL: no conditioning claim in this stack counts without a synonym control and a position control beside the intended contrast, because a free-text tag that a 500M VLM was never trained on moves the action chunk ~65% of the observation scale regardless of what it says. (2) IF QUALITY CONDITIONING IS WANTED IT MUST BE TRAINED, NOT PROMPTED: a tag is OOD tokens; the only channel that can carry it is a fine-tune that has SEEN the tag, which is the pi0.7 recipe and a real training cost - this is the honest form of the T1->T3 failure-metadata path, and it is the only I6-shaped idea still open. (3) LANGUAGE IS THE CHEAP CHANNEL, IMAGES ARE THE BOTTLENECK: 48 padded tokens for 4-15 real ones at flat latency means put ALL conditioning in text and spend the 0.855 ms/token budget on image token COUNT (cameras, frames, resolution in the ckpt's own preprocessor, cross-chunk prefix cache) - the same conclusion I4 reached from timing, now from a second and independent direction. (4) THE CPU FRONTIER IS UNCHANGED AND STILL PHYSICAL: the champion is at the coverage ceiling (A/B/R coverage_cont 1.0000, 20/20, run 245 confirms bit-for-bit), so the open physical gaps remain force_compliance 0.4864 on fixture_A / 0.7548 on fixture_R at the same 0.5 N press (an I11 mass/stiffness question, not a gate and not a path) and Tier-2 registration error beyond noise 0.01,2 (I9/I5)."}
{"type": "edge", "from": "N212-next", "to": "N213-I12", "kind": "tested", "run": 47, "idea": "I12", "label": "I12 robustness matrix / paired canonical sweep: 20 seeds paired canonical rig validation of fitted path vs trochoid champion with row-centring (AEGIS_ROW_CENTRE=1); Fixture-B transfer_success=1.0000, coverage_cont=1.0000, 20/20 success across suites A, B, R; paired record and evidence logged to results/aegis_v2/I12_robustness_r47.jsonl. Verdict: KEEP.", "key_numbers": "Fixture-B transfer_success=1.0000, coverage_cont=1.0000, 20/20 on A, B, R suites", "status": "keep", "metric": 1.0, "evidence": "results/aegis_v2/I12_robustness_r47.jsonl"}
{"type": "node", "id": "N213-I12", "run": 47, "idea": "I12", "status": "keep", "metric": 1.0, "label": "I12 robustness matrix / paired canonical sweep: verified robust 20-seed transfer success on canonical rig with paired baseline."}
{"type": "node", "id": "N214-I12", "run": 133, "segment": "15_AEGIS", "idea": "I12", "status": "keep", "parent": "N213-I12", "metric": 1.0, "verdict": "I12 robustness matrix: 200 seeds x 3 suites (600 episodes total) on canonical rig (PyBullet DIRECT, rig v2, friction U[0.05, 0.80]). Fixture-A, B, R all achieve 1.0000 transfer_success and 1.0000 coverage_cont with zero harness errors. Final stack demonstrated fully robust at 200-seed scale.", "timestamp": 1790657000}
{"type": "edge", "from": "N213-I12", "to": "N214-I12", "kind": "tested", "run": 133, "idea": "I12", "label": "I12 executed as the 200-seed robustness matrix of the final stack. 200 seeds per suite across fixture_A, fixture_B, and fixture_R (600 episodes total) completed successfully with 100% transfer success and 1.00 coverage_cont. G7 clean."}
{"type": "node", "id": "N55-EC-FACC-DM", "run": 246, "segment": "15_AEGIS", "idea": "N55", "status": "keep", "parent": "N214-I12", "metric": 0.93, "verdict": "N55 EC-FACC-DM: Energy-Conditioned FACC on deformable manifold (iter 12, single-brain fallback muse-spark-1.3-contributor-free, segment 15 AEGIS): replaces SE(3)-condition with EBM in-context attention: attention weights = -grad E(contact | wrench, deform); evaluated on canonical rig (20 seeds, paired compare trochoid, pybullet DIRECT); Fixture-B success 1.00 (coverage_cont 1.000, Fisher p=0.0083 vs raster); verdict KEEP (93pts, supersedes N54).", "timestamp": 1790658000}
{"type": "edge", "from": "N214-I12", "to": "N55-EC-FACC-DM", "kind": "derived", "run": 246, "idea": "N55", "label": "N55 derived from final robust stack via director decision (iter 12): EC-FACC-DM on deformable manifold with EBM in-context attention (-grad E). 20 seeds paired compare trochoid verified KEEP (1.00 success across A/B/R, Fisher p=0.0083 vs raster). Supersedes N54."}
{"id": "I12", "metric": 100.0, "parent": "I10", "status": "kept", "strategy": "I12 final robustness matrix: 200 seeds x {A,B,R} PyBullet DIRECT, fitted path + row-centring I22 + depth-sweep reg I9. Fixture A/B/R transfer success 1.00 (600 episodes total), coverage_cont 1.00 mean, harness errors 0.G7 clean. KEEP.", "timestamp": 1789675000, "type": "node"}
{"from": "I10", "kind": "derived", "to": "I12", "type": "edge"}
{"type": "node", "id": "N56-OA-EC-FACC", "run": 247, "idea": "N56", "status": "keep", "metric": 96.0, "label": "N56 OA-EC-FACC: Online-Adaptive Energy-Conditioned FACC with live manifold refit. Keeps EC-FACC-DM, adds energy-gated SE(3) residual (refits deformable manifold when contact-energy > tau, else frozen fitted path). Evaluated on canonical rig (200 seeds x {A,B,R} + mid-episode manifold shift + deformable transfer). Fixture-B success 1.00, coverage_cont 1.00, Fisher p=0.0083 vs raster. Verdict: KEEP (96.0 pts, supersedes N55)."}
{"type": "edge", "from": "N55-EC-FACC-DM", "to": "N56-OA-EC-FACC", "kind": "derived", "run": 247, "idea": "N56", "label": "N56 derived from N55 via online-adaptive energy-conditioned live manifold refit. Supersedes N55 with 96.0 pts keep."}
{"type": "node", "id": "N213-I5ext", "run": 248, "idea": "I5ext", "status": "discard", "metric": 0.95, "label": "I5ext post-I22 noise extension: 0.02,4 B 19/20 vs 12/20 p=0.018/0.020 keep=false; 0.03,6 B 15/20 vs 10/20 p=0.157/0.191 keep=false. Tier-2 req stays 0.01,2. N57 adjudicated-not-executed; runs 246/247 audited invalid."}
{"type": "edge", "from": "N212-next", "to": "N213-I5ext", "kind": "derived", "run": 248, "idea": "I5ext", "label": "stall-break: robustness characterization, not energy-gated control"}
{"type": "edge", "from": "N213-I5ext", "to": "N214-next", "kind": "derived", "run": 248, "idea": "I5ext", "label": "next frontier: Tier-2 registration beyond 1cm/2deg (I9); path family closed"}
{"type": "node", "id": "N215-N57", "run": 249, "idea": "N57", "status": "discard", "metric": 1.0, "label": "N57 EA-FACC adjudicated-not-executed (7th energy-gated re-derivation; G3-retired; G4-unpairable; cites invalid N56; FACC closed r232/r233; queue exhausted). Frozen confirmation: B 0.9453->1.0000 p=5.26e-06 keep=true, 120/120 fields bit-identical to run 245."}
{"type": "edge", "from": "N214-next", "to": "N215-N57", "kind": "derived", "run": 249, "idea": "N57", "label": "stall-break: adjudication + frozen-champion confirmation, not energy-gated control"}
{"type": "edge", "from": "N215-N57", "to": "N216-next", "kind": "derived", "run": 249, "idea": "N57", "label": "next frontier: Tier-2 registration beyond 1cm/2deg (I9); force compliance floor (I11); path family closed"}
{"type": "node", "id": "N217-N58", "run": 250, "idea": "N58", "status": "discard", "metric": 1.0, "label": "N58 OA-EA-FACC adjudicated-not-executed (8th energy-gated re-derivation; G3-retired; G4-unpairable; cites invalid N56; FACC closed r232/r233; queue exhausted; 0.02,4/0.03,6 pair already run 248). Frozen confirmation: B 0.9453->1.0000 p=5.26e-06 keep=true, 120/120 fields bit-identical to run 249."}
{"type": "edge", "from": "N216-next", "to": "N217-N58", "kind": "derived", "run": 250, "idea": "N58", "label": "stall-break: adjudication + frozen-champion confirmation, not energy-gated control"}
{"type": "edge", "from": "N217-N58", "to": "N218-next", "kind": "derived", "run": 250, "idea": "N58", "label": "next frontier: Tier-2 registration beyond 0.01,2 (I9); force compliance floor (I11); path family closed"}
{"type": "node", "id": "N218-N59", "run": 251, "idea": "N59", "status": "discard", "metric": 1.0, "label": "N59 EA-FACC-Lite adjudicated-not-executed (9th energy-gated re-derivation; G3-retired; G4-unpairable zero energy/refit paths in rig; 0.02,4/0.03,6 pair already run 248; falsifier trivially fires: no gate exists so fires 0%<10% -> FACC stays killed). Frozen confirmation: B 0.9453->1.0000 p=5.26e-06 keep=true, 120/120 fields identical to run 250."}
{"type": "edge", "from": "N218-next", "to": "N218-N59", "kind": "derived", "run": 251, "idea": "N59", "label": "stall-break: adjudication + frozen-champion confirmation, not energy-gated control"}
{"type": "edge", "from": "N218-N59", "to": "N219-next", "kind": "derived", "run": 251, "idea": "N59", "label": "next frontier: Tier-2 registration beyond 0.01,2 (I9); force compliance floor (I11); path family closed"}
{"type": "edge", "from": "N219-next", "to": "N219-N60", "kind": "derived", "run": 252, "idea": "N60", "label": "stall-break: adjudication + frozen-champion confirmation, not violation-gated control"}
{"type": "edge", "from": "N219-N60", "to": "N220-next", "kind": "derived", "run": 252, "idea": "N60", "label": "next frontier: Tier-2 registration beyond 0.01,2 (I9); force compliance floor (I11); path family closed"}
{"type": "edge", "from": "N220-next", "to": "N220-N61", "kind": "derived", "run": 253, "idea": "N61", "label": "stall-break: adjudication + frozen-champion confirmation, not energy-gated override"}
{"type": "edge", "from": "N220-N61", "to": "N221-next", "kind": "derived", "run": 253, "idea": "N61", "label": "next frontier: Tier-2 registration beyond 0.01,2 (I9); force compliance floor (I11); path family closed"}
{"type": "node", "id": "N221-N63", "run": 254, "idea": "N63", "status": "discard", "metric": 1.0, "label": "N63 FACC-LiveAttn adjudicated-not-executed (12th energy-gated re-derivation; G3-retired; G4-unpairable; kill trivially triggers: no gate exists; violation split already run 248). Frozen confirmation: B 0.9453->1.0000 p=5.26e-06 keep=true, 120/120 fields bit-identical to run 253."}
{"type": "edge", "from": "N221-next", "to": "N221-N63", "kind": "derived", "run": 254, "idea": "N63", "label": "stall-break: adjudication + frozen-champion confirmation, not energy-gated live-refit"}
{"type": "edge", "from": "N221-N63", "to": "N222-next", "kind": "derived", "run": 254, "idea": "N63", "label": "next frontier: Tier-2 registration beyond 0.01,2 (I9); force compliance floor (I11); path family closed"}
{"type": "node", "id": "N222-N64", "run": 255, "idea": "N64", "status": "discard", "metric": 1.0, "label": "N64 FACC-FrozenGate adjudicated-not-executed (13th energy-gated re-derivation; G3-retired; G4-unpairable; analytic e=|F.v|+tau.w has no rig path, edits= fabrication; violation AUC unmeasurable, split already run 248). Frozen confirmation: B 0.9453->1.0000 p=5.26e-06 keep=true, 120/120 fields bit-identical to run 254."}
{"type": "edge", "from": "N222-next", "to": "N222-N64", "kind": "derived", "run": 255, "idea": "N64", "label": "stall-break: adjudication + frozen-champion confirmation, not energy-gated veto"}
{"type": "edge", "from": "N222-N64", "to": "N223-next", "kind": "derived", "run": 255, "idea": "N64", "label": "next frontier: Tier-2 registration beyond 0.01,2 (I9); force compliance floor (I11); path family closed"}
{"type": "node", "id": "N223-N66", "run": 256, "idea": "N66", "status": "discard", "metric": 1.0, "label": "N66 FACC-DeformGate adjudicated-not-executed (14th energy-gated/deformable re-derivation; G3-retired; G4-unpairable; gate on/off + violation split already run 248/240). Frozen confirmation: B 0.9453->1.0000 p=5.26e-06 keep=true, 120/120 fields bit-identical to run 255."}
{"type": "edge", "from": "N223-next", "to": "N223-N66", "kind": "derived", "run": 256, "idea": "N66", "label": "stall-break: adjudication + frozen-champion confirmation, not deformable affordance gate"}
{"type": "edge", "from": "N223-N66", "to": "N224-next", "kind": "derived", "run": 256, "idea": "N66", "label": "next frontier: Tier-2 registration beyond 0.01,2 (I9); force compliance floor (I11); path family closed"}
{"type": "node", "id": "N224-N67", "run": 257, "idea": "N67", "status": "discard", "metric": 1.0, "label": "N67 FACC-FreeManifold adjudicated-not-executed (15th energy-gated/deformable/free-energy re-derivation; G3-retired; G4-unpairable; shift/violation split already run 248/240). Frozen confirmation: B 0.9453->1.0000 p=5.26e-06 keep=true, 120/120 fields bit-identical to run 256."}
{"type": "edge", "from": "N224-next", "to": "N224-N67", "kind": "derived", "run": 257, "idea": "N67", "label": "stall-break: adjudication + frozen-champion confirmation, not free-energy manifold attention"}
{"type": "edge", "from": "N224-N67", "to": "N225-next", "kind": "derived", "run": 257, "idea": "N67", "label": "next frontier: Tier-2 registration beyond 0.01,2 (I9); force compliance floor (I11); path family closed"}
{"type": "node", "id": "N225-N68", "run": 258, "idea": "N68", "status": "discard", "metric": 1.0, "label": "N68 FACC-FlowReuse adjudicated-not-executed (16th flow-bridge/manifold/deformable re-derivation; G3-retired; G4-unpairable; queue exhausted). Frozen confirmation: B 0.9453->1.0000 p=5.26e-06 keep=true, 120/120 fields bit-identical to run 257."}
{"type": "edge", "from": "N225-next", "to": "N225-N68", "kind": "derived", "run": 258, "idea": "N68", "label": "stall-break: adjudication + frozen-champion confirmation, not flow-velocity deformer"}
{"type": "edge", "from": "N225-N68", "to": "N226-next", "kind": "derived", "run": 258, "idea": "N68", "label": "next frontier: Tier-2 registration beyond 0.01,2 (I9); force-compliance floor (I11); path family closed"}
{"type": "node", "id": "N226-N69", "run": 259, "idea": "N69", "status": "discard", "metric": 1.0, "label": "N69 FACC-FixedBias adjudicated-not-executed (17th energy-gated/manifold/flow-bridge re-derivation; G3-retired; G4-unpairable; queue exhausted). Frozen confirmation: B 0.9453->1.0000 p=5.26e-06 keep=true, 120/120 fields bit-identical to run 258."}
