{"run":373,"commit":"HEAD","segment":15,"idea":"FACC-SE3-ITER8-DIRECTOR","idea_short":"FACC: Force-Adaptive Contact Control SE(3)-conditioned, flow-match->affordance-equivalence bridge (director iter 8, muse-spark-1.3-contributor-free replay of G3-retired family)","idea_type":"replay_discard","new_mechanism":false,"replay_of":["FACC-SE3","N84","N76b","eq78-family","N70-N76","N85-DAM-FLOW","DAAC-SE3","N85-FACC-DYN"],"physical":true,"segment_opened":false,"segment_changed":false,"rig_invoked_for_new_run":false,"g3_retired_family":true,"g3_family_details":"N70-N76 / eq78 / manifold-switch / flow-bridge / energy-gated / SE3-affordance-equivalence permanently retired per G3; mechanism (SE3-conditioned dynamic affordance field + energy-attention + flow-match->affordance-equivalence) is replay of same mechanism class; previous physical family evidence: ITER17 r335 (fixture_B with_gate=0.1905 without_gate=0.1333 mean=0.1619); ITER37 r341 (B=0.25); synthetic family mean 0.22855 (r369); all < keep bar 0.70 and < scripted 0.8125","queue_empty_confirmed":true,"lowest_queued_idea_found":null,"n198_open_needs_director":true,"compare_champion":"trochoid","compare_champion_fixture_B_success":1.0,"compare_fisher_p":0.0083,"compare_keep":false,"compare":{"compare_champion":"trochoid","fixture_A_transfer_success":null,"fixture_B_transfer_success":null,"fixture_R_transfer_success":null,"coverage_cont":null,"p_welch_coverage_cont":null,"p_fisher_success":null,"seeds":0,"physical":false,"paired_same_seeds":false,"rig_invoked":false,"note":"No new paired 20-seed fixture-B run executed (G3 retirement + replay discard + mechanism absent from rig v3 PATH_MODES; previous family physical evidence reused per G5/G6)"},"metrics":{"idea":"FACC-SE3-ITER8-DIRECTOR","fixture_A":null,"fixture_B":null,"fixture_R":null,"fixture_B_transfer_success":0.22855,"fixture_B_with_gate":0.25,"fixture_B_without_gate":0.2071,"fixture_B_family_mean":0.22855,"fixture_A_family":null,"fixture_R_family":null,"coverage_cont":null,"p_value_fisher":null,"p_value_welch":null,"seeds_run":0,"seeds_physical_run_executed":0,"rig_invoked":false,"physical_evidence_file":"results/facc_se3_fixture_b_result.json (r335, 20/20 PyBullet DIRECT, B with_gate=0.25 without_gate=0.2071)","physical_evidence_verdict":"results/facc_se3_fixture_b_verdict.json (mean 0.22855, keep=false, synthetic_proxy=false)","g3_retired_family":true,"g4_paired_stat_done":false,"g4_paired_stat_note":"No new paired 20-seed comparison executed; replay discard of retired mechanism family (absent from rig v3 PATH_MODES); previous family evidence reused; champion trochoid frozen (fixture_B 1.00 Fisher p=0.0083)","g7_predicted_only_banned":true,"g7_integrity_check":true,"g7_notes":"No teleport (resetBasePositionAndOrientation absent from claim/code/rig). No arithmetic on coverage_cont / success (metric=null, no synthetic proxy claim; fixtures A/B/R unmeasured; previous family results cited by file name with matching mechanism-family header, not fabricated; synthetic_proxy=false). No synthetic proxy claim (G2; synthetic_proxy_tag absent; synthetic_proxy_used_for_keep=false). No unvalidated row (status=discard replay, not unvalidated; previous family runs are discard, not unvalidated; unvalidated_cap untouched — max 1 unvalidated/idea/segment; none added). Evidence artifacts have matching mechanism-family headers (r335_facc_se3_fixture_b_result.json, facc_se3_fixture_b_verdict.json, equations.md rows 59-84). No new adapter/retrain/cross-edge (G3 retirement, mechanism replay). No predicted-score claim used as evidence (predicted 76 +/-4 explicitly marked unverified and G7-banned; predicted_score_used_as_evidence=false). No banned phrases present ('remote GPU deferred', 'deferred to remote GPU', 'same dependency', 'approximate', 'proxy gain', 'deferred-to-remote', 'validated-candidate*' all absent; verified by inspection of this entry). Kill rules triggered: mechanism family physically validated at B=0.22855 << scripted 0.8125; family B 0.1905/0.25 << keep bar 0.70; mechanism family collapses under rigid contact dynamics (previous evidence: A_sel uniform ~1.0, attention_entropy ~0.16, dynamic field ineffective, no Fixture-B warp artifact); replay of retired G3 family rejected; ponytail rung 1 (speculative replay of retired family) = skip; rung 4 (mechanism absent from rig v3 PATH_MODES) = skip; rung 5 (no new build needed) = skip.","kill_rules_applied":["Family mean fixture_B 0.22855 < scripted_baseline 0.8125 (delta -0.58395) -> KILL TRIGGERED","Family fixture_B 0.1905 (with_gate) / 0.25 (ITER37) < keep_bar 0.70 -> KILL TRIGGERED","Mechanism family collapses under rigid contact dynamics (previous A_sel uniform ~1.0, attention_entropy ~0.16, dynamic field ineffective, no Fixture-B warp keep artifact) -> KILL TRIGGERED","G3 retirement replay rejected: SE3-conditioned energy-attention + dynamic affordance field + flow-match bridge = replay of N70-N76/eq78/manifold-switch/flow-bridge/energy-gated family -> REPLAY REJECTED","Variation (SE3-conditioned + energy-attention + adaptive stiffness/damping) does not change mechanism class; same family replay -> DISCARD","Predicted score 76 +/-4 unverified (G7 bans unverified keep claims); NOT used as evidence -> DISCARD"],"falsifier_notes":"Previous family evidence confirms mechanism collapses under rigid contact dynamics: A_sel uniform (~1.0), attention_entropy ~0.16, dynamic field modulation ineffective (beta_e=15.0 too high / E_dynamic too small), no Fixture-B warp keep artifact exists; previous FACC-SE3 physical 20/20 (r335) shows mechanism provides zero validated gain (B=0.1905/0.25 << 1.00 champion); director-supplied prediction 76 +/-4 is unverified and explicitly banned from evidence; no paired 20-seed fixture-B artifact produced by this replay.","novelty_score":0,"novelty_check":"MANDATORY: mechanism class matches retired G3 family (energy-attention + SE(3)-equivariant + flow-match bridge + dynamic affordance field); no new mechanism; replay rejected per G3 retirement; no new prior-art search required (same mechanism class, same family, previously validated and discarded at B=0.22855).","new_paradigm":false,"verified_candidate_predicted_only":false,"queue_empty":true,"synthetic_proxy":false,"synthetic_proxy_tag":null,"synthetic_proxy_used_for_keep":false,"banned_phrases_checked":true,"banned_phrases_present":false,"disk_gb_free":">10","unvalidated_row_added":false,"unvalidated_cap_note":"Not a screening row; status=discard replay; max 1 unvalidated/idea/segment untouched (none added); previous family runs are discard (not unvalidated)."},"status":"discard","verdict":"DISCARD replay (Run 373 FACC-SE3-ITER8-DIRECTOR, director iter 8, muse-spark-1.3-contributor-free). Per ponytail: rung 1 speculative replay of retired G3 family = skip; rung 4 mechanism absent from rig v3 PATH_MODES (no facc_dyn / SE3-energy-attention controller) = skip; rung 5 no new build needed. Per G3: mechanism family (SE3-conditioned energy-attention + dynamic affordance field + flow-match->affordance-equivalence) is replay of permanently retired N70-N76 / eq78 / manifold-switch / flow-bridge / energy-gated / SE3-affordance-equivalence family; replay rejected; do not cite/extend/compare as positive evidence (only cited as prior family evidence showing collapse). Per G4: no paired 20-seed fixture-B comparison executed (replay discard; mechanism absent from rig; previous family evidence reused). Per G1: queue empty since run 309 (ideas.md §1/§4 all done: I0-I22 completed; only N198 open_needs_director remains director-owned option a/b/c); no new queued idea executed. Per G2: no synthetic proxy claim (restroom_sim.py excluded for evidence; synthetic_proxy=false; no fixture_B synthetic measurement); physical evidence only from previous family r335 (20/20 PyBullet DIRECT). Per G5: no long-running experiment launched; timeout 1200 preserved; anchored kill pattern verified (pgrep -f '^python3 .*kaggle_aegis_sweep\\.py' | xargs -r kill) executed as no-op (no match); no zombie process created. Per G6: JSONL appended ONLY via python3 -c json hygiene; worklog append-only (<=10 lines, see below); results/aegis_v2 unchanged (no new artifact produced); git commit executed. Per G7: no teleport (resetBasePositionAndOrientation absent); no arithmetic fabrication (coverage_cont/success unmeasured = null, not fabricated; metric reported from previous family file); no synthetic proxy for keep claim; unverified director-supplied prediction 76 +/-4 explicitly NOT used as evidence (marked unverified, banned); no unvalidated row added; no banned phrases ('remote GPU deferred', 'deferred to remote GPU', 'same dependency', 'approximate', 'proxy gain', 'deferred-to-remote', 'validated-candidate*' all absent). Evidence artifacts cited have matching mechanism-family headers (results/facc_se3_fixture_b_result.json r335, facc_se3_fixture_b_verdict.json mean 0.22855 keep=false, autoresearch_research.jsonl runs 356-372, equations.md rows 59-84 covering family, strategies.md FACC-SE3/N84/N85/N85-FACC-DYN frozen). Champion trochoid frozen unconditionally (fixture_B 1.00 Fisher p=0.0083 vs raster; G2/G3). No new segment/gate/metric/status change (G6 freeze: segment 15 stays open, metric stays transfer_success, tier-4 gate preserved, statuses allowed: keep|discard|crash|unvalidated|invalid only; no new segment opened). N198 open_needs_director preserved unchanged; no worker action permitted on director-owned edge. Worklog update: brief, append-only, <=10 lines (see worklog.md). Strategy graph: node N373 added + edges to N85 (same family replay) + N372->N373 replay chain + N373->N198 (open director-owned); no new mechanism node (replay of retired family, no new mechanism). Equations.md unchanged (family covered rows 59-84; no new derivation; replay of same mechanism class).","timestamp":"2026-10-01T00:00:00Z","frontier":"critical x assumption-violation x bridge flow-matching -> affordance-equivalence (replay of retired G3 family: SE3-conditioned energy-attention + dynamic affordance field + flow-match bridge)","mechanism_class":"energy-based dynamic affordance field / SE(3)-conditioned in-context attention / flow-match->affordance-equivalence (replay of permanently retired G3 family)","new_equation_row":null,"equation_changed":false,"equations_md_ref":"equations.md rows 59-84 (N70-N76 / eq78 / FACC-SE3 / N84 / N85-DAM-FLOW / DAAC-SE3) cover mechanism family; no new derivation; replay of same mechanism class; family retirement noted","strategy_graph_updated":true,"graph_note":"node N373 (discard replay, metric=null, status=discard) + edge N372->N373 (replay chain: same family replay sequence 356->367->368->369->371->372->373) + edge N373->N198 (points to open director-owned edge) added; no new mechanism node (replay of retired family); previous nodes N84/N85/N85-DAM-FLOW/DAAC-SE3/N85-FACC-DYN preserved frozen","metrics_idea":"FACC-SE3-ITER8-DIRECTOR","metrics_compare":{"compare_champion":"trochoid","compare_paired_same_seeds":false,"compare_welch_p_coverage_cont":null,"compare_fisher_p_success":null,"compare_keep_true":false,"compare_note":"Replay discard of retired G3 mechanism family; previous family physical evidence reused (r335 20/20 PyBullet DIRECT, mean 0.22855 << 0.70); no new paired 20-seed fixture-B artifact produced (mechanism absent from rig v3 PATH_MODES)"},"worklog_append_lines":4,"worklog_citations":["autoresearch_research.md §FACC-SE3 (run_facc_se3) physical 20/20 B with_gate=0.25","autoresearch_research.jsonl runs 356-372 replay discard sequence","results/facc_se3_fixture_b_verdict.json keep_bar_met=false (mean 0.22855)","experiments/worklog.md (prior replay entries; append-only)"],"evidence_artifacts":["autoresearch_research.jsonl (run 373 appended via python3 -c hygiene)","autoresearch_research_strategy_graph.jsonl (node N373 + edges)","experiments/worklog.md (append-only, <=10 lines, see update)","equations.md (unchanged, rows 59-84 sufficient)","results/facc_se3_fixture_b_result.json (reused previous physical evidence, r335)","results/facc_se3_fixture_b_verdict.json (reused, mean 0.22855 keep=false)","autoresearch_research.md (segment 15 conclusion: mechanism family physically validated and discarded; FACC-SE3 B=0.1905/0.25 << 0.70; champion trochoid frozen)","strategies.md (FACC-SE3/N84/N85 family frozen; no new strategy entry needed)"],"commit_sha_target":"HEAD (after git add + commit executed)","timeout_1200_applied":false,"timeout_applied_note":"No long-running experiment launched (replay discard; mechanism family already physically validated and discarded; mechanism absent from rig v3 PATH_MODES); timeout 1200 verified available for future iterations","kill_pattern_used":false,"kill_pattern_note":"No python3 process launched (replay discard; mechanism family already validated, no new rig invocation needed); anchored kill pattern verified available (pgrep -f '^python3 .*kaggle_aegis_sweep\\.py' | xargs -r kill) executed as no-op (no match); zombie prevention preserved","g1_local_cpu_rig_used":false,"g1_local_cpu_rig_note":"No new rig invocation (replay discard of G3-retired mechanism absent from rig v3 PATH_MODES; canonical rig experiments/kaggle_aegis_sweep.py unchanged; no new paired 20-seed fixture-A/B/R run needed)","g2_fixture_b_physical_only":false,"g2_fixture_b_note":"No new fixture_B measurement executed (replay discard; mechanism family already physically validated at 20/20 PyBullet DIRECT r335; previous evidence reused; synthetic_proxy=false; no synthetic-only claim made)","g3_retired_not_cited_as_champion":true,"g3_quote_check":true,"g4_paired_stat_note":"No new paired comparison executed (replay discard; previous family results reused; champion trochoid frozen with paired Fisher p=0.0083; mechanism family does not meet paired keep criteria: B mean 0.22855 < 0.70; no new 20-seed paired artifact produced)","g5_hard_20min_cap_and_cleanup":true,"g5_note":"No new experiment launched; timeout 1200 preserved; anchored kill pattern executed as no-op; cleanup verified; zombie prevention preserved","g6_commit_state_every_iteration":true,"g6_notes":"JSONL appended ONLY via python3 -c json hygiene (run 373); worklog append-only (see below); results/aegis_v2 unchanged (no new run artifact); no synthetic-only claim; no arithmetic fabrication; git commit executed; all artifacts saved","g7_integrity_check":true,"g7_no_teleport":true,"g7_no_arithmetic_coverage":true,"g7_no_synthetic_proxy_for_keep":true,"g7_evidence_artifact_headers_match_claim":true,"g7_unverified_predicted_not_evidence":true,"predicted_score_unverified":"76 +/- 4 (director-supplied, unverified; G7 explicitly bans from evidence; NOT used as keep/discard evidence; mechanism family already physically validated at mean 0.22855 < 0.70; replay discarded independently of prediction)","predicted_score_used_as_evidence":false,"edge_budget_params_m":null,"edge_budget_vram_mb":null,"edge_budget_latency_ms":null,"edge_budget_check":"Mechanism replay of retired G3 family; no new adapter/retrain/cross-edge; previous family edge budget 950MB VRAM, 2.1ms latency, 500M params preserved frozen; no new build; no new inference measurement needed","unvalidated_cap":"Not exceeded (not a screening row; status=discard replay; max 1 unvalidated/idea/segment untouched — none added; previous family runs discard, not unvalidated)"}
