{"run": 487, "commit": "HEAD", "segment": 15, "idea": "FACC-SE3-ITER7", "idea_short": "Director iter-7 (muse-spark-1.3): SE(3)-equivariant force-adaptive residual + energy-attention replacing pi0 flow-mat; G3 replay #47 refused", "status": "discard", "timestamp": "2026-10-02T12:30:00Z", "metric_name": "fixture_B transfer_success (coverage_cont >= 0.90 per episode), canonical rig v2", "metric_class": "physical", "director_decision": {"iteration": 7, "idea": "FACC-SE3: SE(3)-equivariant force-adaptive residual replacing pi0 flow-matching head; dynamic affordance field with energy attention; flow -> affordance-equivalence bridge", "predicted_score": 76, "executed": false, "exclusion_reasons": ["G3 PERMANENT RETIREMENT (2026-09-26): eq78/N70-N76/manifold-switch/flow-bridge/energy-gated/EBM/SE3-affordance/DAEF/FACC family permanently retired; replay #47; mechanism class unchanged (SE3 + energy-attention + flow-bridge + contact-manifold inference)", "G4 UNPAIRABLE: PATH_MODES carries 0 injectable SE3/energy/manifold/FACC-head hook (RESIDUAL_HOOK_FN I3-owned only); no paired 20-seed Fixture-B arm possible vs trochoid champion", "G7 INTEGRITY: predicted-only 76pts invalid for keep; synthetic N74 92.3 frozen unconditionally; no physical results/aegis_v2 file carries compare.keep:true for this replay", "G2 QUEUE EMPTY: N477 executed runs 476-481 (7440 eps); family kill-rule triggered at 481 (B=0.00 at 0.40,80 H=1.2; boundary 0.32m/64deg H=0.6/n=32); no queued idea since run 309; N198 stays open_needs_director", "G1 CANONICAL RIG: python3 experiments/kaggle_aegis_sweep.py (DIRECT, system python3, 20 seeds, friction U[0.05,0.80]); no banned deferred-language present", "G5 CLEANUP: no rig invocation; reap_orphans verified (anchored pgrep); no orphan python3 .*kaggle_aegis_sweep.py", "G6 STATE: refusal logged; worklog appended; graph updated; equations.md unchanged; commit below"]}, "physical_action_taken": "REFUSED before any rig invocation (47th G3 replay; G4 unpairable prevents paired measurement; G2 queue empty; G7 predicted-only invalid). No health-check rig run needed: champion trochoid B=1.00 at 0,0 verified in runs 476-481 (60 eps, 0 errors, 0 rig bytes changed). No synthetic_proxy promotion permitted.", "rig_invoked": false, "rig_exit": 0, "episodes": 0, "harness_errors": 0, "rig_bytes_changed": 0, "pose_noise_cfg": "N/A (refusal; no measurement)", "evidence": ["autoresearch_research.jsonl (run 487)", "autoresearch_research.ideas.md (\u00a70: no queued row; N477 complete; G3 family listed)", "autoresearch_research_strategy_graph.jsonl (refusal node/edge)", "experiments/worklog.md (this append)", "results/aegis_v2/N476_r476_H06_n0.32_64.jsonl (champion B=0.85 keep=true, paired p=0.000927)", "results/aegis_v2/N477_r481_* (family kill-rule at 481)", "equations.md (unchanged)"], "metrics": {"idea": "FACC-SE3-ITER7", "metric_class": "physical", "fixture_A_success": null, "fixture_B_success": null, "fixture_R_success": null, "transfer_success": null, "compare_champion": "trochoid (B 1.00 at 0,0; frozen champion; Fisher p=0.0083 vs raster run 72)", "compare_keep": false, "new_mechanism": false, "replay_of_retired_family": true, "retired_family_ids": ["eq78", "N70", "N71", "N72", "N73", "N74", "N75", "N76", "FACC", "FACC-SE3", "FACC-E", "DAEF", "EBM", "SEAFC", "VM-FACC", "FACC-DM", "FACC-SE3-ITER6", "FACC-SE3-ITER7"], "replay_count": 47, "queue_status_at_start": "empty (N477 complete 476-481; family kill-rule triggered at 481; no queued row since 309; N198 open_needs_director)", "synthetic_proxy": null, "predicted_score_refused": 76, "predicted_score_valid_for_keep": false, "n477_kill_rule_triggered": true, "n477_final_boundary_m_deg": "0.32 m / 64 deg (H=0.6/n=32)", "champion_frozen": "trochoid B=1.00 at 0,0 (run 72; certified through 0.32,64 at H=0.6/n=32)"}, "gates_unchanged": {"segment": 15, "primary_metric": "transfer_success", "tier4_gate": "post-hoc tag preserved; untouched (in-loop I7 separate at run 169; no mechanism change executed)", "no_new_segment": true, "no_metric_move": true, "no_gate_change": true, "no_candidate_promoted": true, "new_unvalidated_row_added": false, "new_keep_claim": false, "new_synthetic_row": false}, "verdict": "DISCARD (47th G3 replay refused before execution; 0 episodes; freeze trochoid B=1.00; queue empty; N198 stays open_needs_director; segment 15 unchanged; metric frozen; no synthetic_proxy; equations.md unchanged; worklog/graph/JSONL updated; commit below)", "worklog_append_required": true, "graph_update_required": true, "novelty_verified": false, "prior_art_cited": "None (G3 replay \u2014 family permanently retired; synthetic champion N74 frozen unconditionally)", "kill_rule_triggered_for_family": true, "family_kill_trigger_text": "N477 family kill-rule triggered (run 481, H=1.2 at 0.40,80 / 0.48,96 B=0.00; window wall at 0.32,64; dose family collapses past certified boundary at high pose noise). FACC-SE3-ITER7 same mechanism class (manifold/energy/SE3/flow-bridge) and is refused identically.", "ponytail_note": "Lazy refusal: G3 retirement (47th replay of same mechanism class) + G4 unpairability eliminates any build. Queue empty since N477 kill-rule (481). No new files; no new equations; no synthetic claims."}
{"run": 488, "commit": "HEAD", "segment": 15, "idea": "FACC-SE3-CONDITIONED-ITER8", "idea_short": "FACC iter-8 (Director proposal refused \u2014 48th G3 replay): SE(3)-conditioned energy-attention + flow-bridge; label rotation does not change mechanism class", "status": "discard", "verdict": "REFUSED (48th G3 replay before execution; 0 episodes; no rig bytes changed; no synthetic promotion; freeze trochoid B=1.00; queue empty post-N477 kill-rule 481; N198 open_needs_director unchanged)", "timestamp": "2026-10-02T06:27:52Z", "metric_name": "fixture_B transfer_success (coverage_cont >= 0.90 per episode), canonical rig v2, PyBullet DIRECT, 20 seeds x 3 suites", "metric_class": "physical", "metric_class_note": "physical only; refusal before execution (0 episodes); G3 retired-family replay (eq78/N70-N76/manifold-switch/flow-bridge/energy-gated/EBM/SE3-affordance/DAEF/FACC); G4 unpairable (PATH_MODES 0 injectable SE3/energy/manifold hook); G2 queue empty (N477 complete, family kill-rule 481 at 0.40,80 H=1.2); G7 predicted-only 78pts invalid; no paired champion arm executed; champion trochoid B=1.00 frozen (run 72, Fisher p=0.0083 vs raster); segment 15 unchanged; primary metric frozen; tier-4 gate untouched", "metrics": {"idea": "FACC-SE3-CONDITIONED-ITER8", "fixture_B_transfer_success": null, "fixture_B_coverage_cont": null, "seeds": 0, "rig_version": 2, "pose_noise_cfg": "refused-before-execution", "dose_H": null, "compare_champion": "trochoid", "compare_env": "AEGIS_REG_HALF_M=0.35 (champion)", "candidate_env": null, "fixture_A_success": null, "fixture_B_success": null, "fixture_R_success": null, "fixture_A_coverage_cont": null, "fixture_R_coverage_cont": null, "compare_keep": null, "compare_welch_p_coverage_cont": null, "compare_fisher_p_success": null, "candidate_welch_p_coverage_cont": null, "candidate_fisher_p_success": null, "director_decision": {"iteration": 8, "idea": "FACC-SE3-CONDITIONED", "frontier_claim": "force-adaptive contact control with SE(3)-conditioned energy-attention + flow-bridge to affordance-equivalence; replaces flow-match head with EBM contact-energy; validation: zero-shot deformable contact under stiffness/pose shift; predicted 78 pts", "refused_reason": "G3 RETIRED-FAMILY REPLAY #48 (permanently retired 2026-09-26: eq78/N70-N76/manifold-switch/flow-bridge/energy-gated/EBM/SE3/DAEF/FACC family \u2014 root cause: violation-aware energy modulation collapses under real rigid contact dynamics; high variance seed1=0.9459 vs seed2=0.2432; fixed-manifold assumption-violation confirmed; segment 15 root-cause closed)", "g3_retired_evidence": "autoresearch_research.md \u00a716 (segment 15 root cause); equations.md rows 61-62, 77-78, 79 (VAEF discard), 82 (N84 frontier), 84 (FACC-SE3 validated-candidate-predicted); results/aegis_v2/N476/N477; strategies.md FACC-SE3; 46+ prior refusals (runs 402, 485-487)", "g4_unpairable": "PATH_MODES (raster/rounded/trochoid/spiral/fitted/fitro/orbit/auto) carries 0 injectable SE3/energy/manifold/FACC-head hook \u2014 only RESIDUAL_HOOK_FN (I3-owned); no paired 20-seed Fixture-B measurement possible; no --compare arm exists for mechanism without a path-mode hook", "g7_predicted_only_invalid": "predicted 78 pts has no physical paired compare record with keep:true; synthetic champion N74 (92.3 synthetic) frozen unconditionally per G3; any KEEP claim requires results/aegis_v2/*.jsonl with header pose_noise_cfg matching claim AND compare.keep:true \u2014 none exists for any energy/SE3/EBM/FACC replay; synthetic_proxy excluded per G2", "g2_queue_empty": "N477 executed fully (run 476 KEEP + runs 478-481 DISCARD, family kill-rule triggered at run 481: H=1.2 at 0.40,80 B=0.00; boundary 0.32 m / 64 deg certified at H=0.6, n=32); autoresearch_research.ideas.md \u00a71 shows NO queued mechanism since run 481; N198 stays open_needs_director (unclaimable on saturated B-bar 1.00 through 0.32,64)", "g1_canonical_rig_status": "python3 experiments/kaggle_aegis_sweep.py (PyBullet DIRECT, system python3, 20 seeds, friction U[0.05,0.80]) \u2014 NO invocation performed (refusal before execution); no deferred-language phrases used", "g5_cleanup": "reap_orphans() verified pre-start; no python3 .*kaggle_aegis_sweep.py process held (0 invocation); timeout 1200 not triggered; no orphan kill performed", "g6_commit_state": "JSONL line 488 appended (hygiene script); graph node/edge appended; worklog appended (this entry); equations.md unchanged (verified pre/post: no mechanism = no equation change); git commit executed with message including idea id, verdict, key numbers"}, "unvalidated_cap_compliance": "0 unvalidated rows added (cap <=1 per segment; refusal = 0 unvalidated); no screening (3 seeds) performed; next row for any screened idea must be full 20-seed decider \u2014 not applicable", "replay_family": "G3-retired (eq78/N70-N76/manifold-switch/flow-bridge/energy-gated/EBM/SE3/DAEF/FACC)", "replay_count": 48, "refused_before_execution": true, "episodes_run": 0, "rig_bytes_changed": false, "synthetic_proxy_promotion": false, "champion_frozen": "trochoid (run 72, fixture_B B=1.00, Fisher p=0.0083 vs raster; certified through 0.32,64 at H=0.6/n=32; N212/N213/N214/N476/N477 audits complete)", "segment_changed": false, "metric_moved": false, "tier4_gate_changed": false}, "evidence_artifacts": ["autoresearch_research.jsonl:run=488", "autoresearch_research_strategy_graph.jsonl (N488 + refusal edge from FACC-ITER43)", "autoresearch_research.ideas.md \u00a71 (queue empty; N477 complete; N198 open_needs_director)", "experiments/worklog.md (this entry, append-only, <=10 lines)", "equations.md (unchanged \u2014 verified pre/post; no mechanism built = no new equation; G3 replay refused before equation build)", "results/aegis_v2/N476_r476_* / N477_r477_* / N72_trochoid_* (champion + boundary evidence)"], "next_action_required": "Director (N198 open_needs_director): (a) propose a genuinely new mechanism family with a real injectable rig hook (not eq78/manifold/flow-bridge/energy-gated/EBM/SE3/DAEF/FACC) that supports paired 20-seed Fixture-B measurement vs trochoid; (b) confirm segment 15 closure (no queued mechanism, champion trochoid B=1.00 certified) and close loop; or (c) request director approval to open segment 16 with a non-retired mechanism (segment freeze G6; metric freeze G2). No worker may open a new segment or move the primary metric.", "novelty_check_result": "REPLAY (no new mechanism): mechanism class identical to permanently retired eq78/EBM/energy-attention/flow-bridge family by construction; label rotation (FACC-SE3 / SE(3)-equivariant / dynamic-manifold / energy-based physical attention) does not change mechanism class; prior art EnergyFlow (arXiv:2605.00623), FACT (arXiv:2608.01402), PhysVLA (arXiv:2606.13886), FAVLA (arXiv:2602.23648), ForceVLA (arXiv:2505.22159) already cover SE3-equivariant energy + contact flow; no new paradigm; no verified equation change", "novelty_score_assigned": null, "banned_phrases_check": "PASS \u2014 no 'remote GPU deferred', 'deferred to remote GPU', 'same dependency' in this refusal record"}
{"run": 489, "segment": 15, "timestamp_utc": "2026-10-02T00:00:00Z", "node": "ITER9-FACC-REFUSED", "idea": "FACC-SE3 (Force-Adaptive Contact Control, SE(3)-conditioned, director iter 9, muse-spark-1.3-contributor-free) \u2014 REPLAY of G3-retired eq78/N70-N76/manifold-switch/flow-bridge/energy-gated/EBM/DAEF/FACC family (#46+ replay)", "status": "discard", "verdict_summary": "REFUSED before execution per AEGIS G3 (retired family 2026-09-26: energy-modulation collapses under real rigid contact dynamics; variance 0.9459 vs 0.2432) + G4 (PATH_MODES 0 injectable SE3/energy/manifold/FACC hook; unpairable) + G7 (predicted-only 78pts invalid; no paired Fixture-B compare.keep:true artifact) + G2 (queue EMPTY since 309; metric frozen fixture_B transfer_success). No mechanism injected; no adapter/retrain/cross-edge built.", "physical_validation": "HEALTH-CHECK ONLY (refusal before rig invocation of mechanism). Canonical rig: timeout 1200 python3 experiments/kaggle_aegis_sweep.py --seeds 20 --path trochoid --compare trochoid --suites A,B,R --out results/aegis_v2/iter9_facc_refused_health.jsonl; exit 0; ~5.4s; 120 episodes (3 suites x 20 seeds x 2 arms); 0 harness errors; fixture_A/B/R 1.00/1.00/1.00 at 0,0 ceiling (compare trochoid keep=false, Fisher p=1.0); pose_noise_cfg=0,0; rig_version=2.", "compare_record": {"champion_id": "trochoid", "compare_path": "trochoid", "keep": false, "fixture_B_success": 1.0, "fixture_A_success": 1.0, "fixture_R_success": 1.0, "welch_p_coverage_cont": 1.0, "fisher_p_success": 1.0, "interception_delta_gate": 0.0, "gate_mode": "post-hoc"}, "metrics": {"transfer_success_fixture_B": 1.0, "transfer_success_fixture_A": 1.0, "transfer_success_fixture_R": 1.0, "coverage_cont_mean": 1.0, "seeds_run": 20, "seeds_required": 20, "harness_errors": 0, "episodes_total": 120, "physical_ep_count_for_idea": 0, "physical_ep_for_health_check": 120, "path_mode": "trochoid", "pose_noise_cfg": "0,0"}, "frontier": "REUSED \u2014 same mechanism family as N75/N76/N77/N79/N83/ITER24-48 (retired); no genuinely new mechanism; label rotation (FACC-SE3 / dynamic-manifold / SE3-equivariant / energy-attention) does NOT change mechanism class.", "g3_retired_family_replay_count": 46, "g4_pairable": false, "g7_predicted_only_pts": 78, "g7_predicted_valid_for_keep": false, "g2_queue_empty_since_run": 309, "n477_status": "COMPLETE_KILL_RULE_RUN481 (boundary 0.32m/64deg; H=0.6 KEEP, H>0.6 DISCARD at 0.40,80/0.48,96)", "n198_status": "OPEN_NEEDS_DIRECTOR (unclaimable on saturated fixture_B bar 1.00 through 0.32,64)", "verdict_code": "DISCARD_REFUSE", "champion_frozen": "trochoid_fixture_B_1.00_fisher_p_0.0083_vs_raster_run_72", "synthetic_champion_frozen": "N74_92.3_synthetic_segment_0_14", "metric_frozen": "fixture_B_transfer_success", "tier4_gate_preserved": true, "tier4_gate_intercepted_this_run": false, "unvalidated_cap_consumed_segment_15": 0, "unvalidated_cap_remaining_segment_15": 1, "equation_changed": false, "equation_verified_unchanged": true, "equation_row_coverage_confirmed": "78 (N76 family) + 84 (FACC-SE3 family replay) sufficient for retired mechanism; no new row added", "edge_budget_check_performed": false, "evidence_artifacts": ["results/aegis_v2/iter9_facc_refused_health.jsonl", "autoresearch_research.jsonl (run 489)", "autoresearch_research_strategy_graph.jsonl (N489 node+edge)", "experiments/worklog.md (this entry)", "equations.md (md5sum unchanged: cc9c73fd74f4bf1799f787226cce7a00)"], "no_deferred_phrase_used": true, "no_proxy_phrase_used": true, "no_synthetic_proxy_for_keep": true, "commit_executed": true, "worklog_append_only": true, "worklog_lines_added": 1}
{"run": 490, "commit": "HEAD", "segment": 15, "idea": "FACC-E-ITER10", "idea_short": "Director iter-10 (muse-spark-1.3): FACC-E \u2014 49th G3 replay refused before execution", "status": "discard", "timestamp": "2026-10-02T12:45:00Z", "metric_name": "fixture_B transfer_success (coverage_cont >= 0.90), canonical rig v2, PyBullet DIRECT", "metric_class": "physical", "director_decision": {"iteration": 10, "idea": "FACC-E: SE(3)-Conditioned Force-Adaptive Contact Control with Energy-Based In-Context Attention; drop flow-mat head; EBM scores SE(3) contact affordances; bridge flow-matching -> affordance-equivalence", "predicted_score": 78, "executed": false, "exclusion_reasons": ["G3 PERMANENT RETIREMENT (2026-09-26): eq78/N70-N76/manifold/flow-bridge/energy-gated/EBM/SE3-affordance/DAEF/FACC permanently retired; FACC-E = 49th replay; label rotation does not change mechanism class.", "G4 UNPAIRABLE: PATH_MODES carries 0 injectable SE3/energy/manifold/FACC-head hook (RESIDUAL_HOOK_FN I3-owned only).", "G7 INTEGRITY: predicted-only 78pts invalid; synthetic champion N74 (92.3 synthetic) frozen unconditionally; no physical results/aegis_v2 file with compare.keep:true exists.", "G2 QUEUE EMPTY: N477 complete (run 481 kill-rule at 0.40,80 H=1.2; boundary 0.32m/64deg); no queued idea since 309; N198 open_needs_director.", "G1 CANONICAL RIG: python3 experiments/kaggle_aegis_sweep.py (DIRECT, system python3, 20 seeds, friction U[0.05,0.80]) \u2014 NO invocation (refusal).", "G5 CLEANUP: reap_orphans verified; timeout 1200 not triggered.", "G6 STATE: refusal logged; worklog appended; graph updated; equations.md unchanged; commit executed.", "UNVALIDATED CAP: 0 unvalidated added (cap 1/segment)."]}, "physical_action_taken": "REFUSED before execution (49th G3 replay; G4 unpairable; G2 empty; G7 predicted-only 78pts invalid). Champion trochoid frozen B=1.00 at 0,0 (run 72, Fisher p=0.0083). 0 episodes; 0 rig bytes changed.", "rig_invoked": false, "rig_exit": 0, "episodes": 0, "harness_errors": 0, "rig_bytes_changed": false, "pose_noise_cfg": "N/A (refusal; no measurement)", "evidence": ["autoresearch_research.jsonl (run 490)", "autoresearch_research.ideas.md (\u00a71 queue empty; \u00a74 N477 complete; G3 family listed)", "autoresearch_research_strategy_graph.jsonl (N490 refusal node + edge)", "experiments/worklog.md (append-only, <=10 lines)", "results/aegis_v2/N476_r476_* / N477_r477_* (champion + boundary evidence)", "equations.md (unchanged; family covered by eq78 + eq84 replay)"], "metrics": {"idea": "FACC-E-ITER10", "metric_class": "physical", "fixture_A_success": null, "fixture_B_success": null, "fixture_R_success": null, "transfer_success": null, "compare_champion": "trochoid (B=1.00 at 0,0; frozen; Fisher p=0.0083 run 72)", "compare_keep": false, "new_mechanism": false, "replay_of_retired_family": true, "retired_family_ids": ["eq78", "N70", "N71", "N72", "N73", "N74", "N75", "N76", "FACC", "FACC-SE3", "FACC-E", "DAEF", "EBM", "SEAFC", "VM-FACC", "FACC-DM"], "replay_count": 49, "queue_status_at_start": "empty (N477 complete 476-481; kill-rule 481; no queued since 309; N198 open_needs_director)", "synthetic_proxy": null, "predicted_score_refused": 78, "predicted_score_valid_for_keep": false, "n477_kill_rule_triggered": true, "n477_final_boundary_m_deg": "0.32 m / 64 deg (H=0.6/n=32)", "champion_frozen": "trochoid B=1.00 at 0,0", "physical_rig_invoked": false, "episodes_for_idea": 0, "episodes_for_health_check": 0}, "gates_unchanged": {"segment": 15, "primary_metric": "fixture_B_transfer_success", "tier4_gate": "post-hoc tag preserved; untouched (in-loop I7 separate at run 169)", "no_new_segment": true, "no_metric_move": true, "no_gate_change": true, "no_candidate_promoted": true, "new_unvalidated_row_added": false, "new_keep_claim": false, "new_synthetic_row": false}, "verdict": "DISCARD (49th G3 replay refused before execution; 0 episodes; freeze champion trochoid B=1.00; queue empty; N198 open_needs_director; segment 15 unchanged; metric frozen; no synthetic_proxy; equations.md unchanged; worklog/graph/JSONL committed)", "worklog_append_required": true, "graph_update_required": true, "novelty_verified": false, "prior_art_cited": "None (G3 replay \u2014 family retired 2026-09-26; synthetic N74 92.3 frozen unconditionally)", "evidence_artifacts_complete": true, "unvalidated_cap_consumed_segment_15": 0, "unvalidated_cap_remaining_segment_15": 1, "equation_changed": false, "equation_verified_unchanged": true, "equation_row_coverage_confirmed": "78 (N76b family) + 84 (FACC-SE3 replay) sufficient for retired mechanism; no new equation row added", "edge_budget_check_performed": false, "banned_phrases_check": "PASS \u2014 no 'remote GPU deferred', 'deferred to remote GPU', 'same dependency'", "replay_family": "G3-retired (eq78/N70-N76/manifold/flow-bridge/energy-gated/EBM/SE3/DAEF/FACC/E-FACC)", "replay_count": 49, "refused_before_execution": true}
