{"run": 436, "idea": "FACC-SE3-DIRECTOR-ITER18 (Force-Adaptive Contact Control SE(3)-conditioned, energy-based attention, single-brain muse-spark-1.3-contributor-free)", "segment": 15, "status": "discard", "timestamp": "2026-10-01T23:59:00Z", "metric_name": "fixture_B transfer_success (coverage_cont >= 0.90 per episode), canonical rig, 20 paired seeds x 3 suites, pose_noise 0,0", "metric_class": "physical", "director_decision": {"iteration": 18, "idea": "FACC-SE3: SE(3)-conditioned energy-based contact controller replacing flow-matching head; E(contact,wrench,SE3-goal); predicted 74pts keep>=70; falsifier: <5% gain over pi0-flow on force-variance or SE(3) OOD", "predicted_score": 74, "executed": false, "exclusion_reasons": ["G3 permanent retirement: eq78/N70-N76/manifold-switch/flow-bridge/energy-gated/SE3-affordance/EBM-affordance/DAEF-family/FACC-family retired (replay with new label FACC-SE3 iter18)", "G4 unpairable: PATH_MODES carries 0 injectable SE3/energy/contact-head/wrench/stiffness hook (N200 audit); no mechanism exists to inject FACC controller into paired rig", "ideas.md sections 1+4: queue EMPTY since run 309 (all v3/v4 done); no queued row to open", "G7 integrity: predicted-only score (74/100) may not set status; synthetic_proxy excluded; no arithmetic promotion permitted", "N198 open_needs_director (not executable by worker); worker may not open new segment, change metric/gate, or move primary metric"]}, "physical_action_taken": "frozen-champion health re-cert: timeout 1200 python3 experiments/kaggle_aegis_sweep.py --seeds 20 --no-upload --path trochoid --compare raster --suites fixture_A,fixture_B,fixture_R --out results/aegis_v2/iter18_facc_health_r436.jsonl (exit 0, ~8.9s, 120 episodes, 0 harness errors, 0 rig bytes changed, pose_noise_cfg 0,0)", "rig": "canonical rig experiments/kaggle_aegis_sweep.py (PyBullet DIRECT, system python3, rig_version 2, friction U[0.05,0.80], gate_mode post-hoc, pose_noise_cfg 0,0)", "rig_invoked": true, "rig_exit": 0, "episodes": 120, "harness_errors": 0, "rig_bytes_changed": 0, "pose_noise_cfg": "0,0", "evidence": ["results/aegis_v2/iter18_facc_health_r436.jsonl"], "metrics": {"idea": "FACC-SE3-DIRECTOR-ITER18", "metric_class": "physical", "seeds": 20, "episodes": 120, "fixture_A_success": 1.0, "fixture_B_success": 1.0, "fixture_R_success": 1.0, "coverage_cont_ABR": "1.0000/1.0000/1.0000 both arms", "delta_vs_champion": 0.0, "welch_p": "NaN (zero variance at ceiling)", "fisher_p_success_vs_champion": 1.0, "compare_keep": false, "synthetic_proxy": null, "candidate_b_success": 1.0, "champion_b_success": 1.0, "kept_bar_met": false, "compare_record_exists_in_results_file": true, "evidence_file_header_pose_noise_cfg_matches_claim": true}, "gates_unchanged": {"segment": 15, "primary_metric": "transfer_success", "tier4_gate": "post-hoc tag, untouched", "no_new_segment": true, "no_metric_move": true, "no_gate_change": true, "no_candidate_promoted": true, "no_unvalidated_row_added": true}, "verdict": "DISCARD (proposal-reject + health-check). FACC-SE3 (iter 18) is replay of G3-retired eq78/N70-N76/manifold-switch/flow-bridge/energy-gated/SE3-affordance/EBM-affordance/DAEF-family (new label does not change mechanism class); 0 injectable rig hook (PATH_MODES only); predicted-only 74pts invalid per G7; queue EMPTY since 309; N198 director-owned; health-check confirms frozen champion trochoid B=1.00/A=1.00/R=1.00 at 0,0; paired delta 0; Fisher p 1.0; keep=false \u2014 27th independent 0,0 ceiling tie confirming G4 bar zero dynamic range at ceiling. Freeze champion trochoid (fixture_B=1.00 Fisher p=0.0083 vs raster at 0,03,6); freeze synthetic N74 92.3 unconditionally.", "notes": "Iteration 18 (single-brain fallback muse-spark-1.3-contributor-free). Queue EMPTY (\u00a71 all v3/v4 done since 309); G3 retirement binds permanently: eq78/N70-N76/manifold-switch/flow-bridge/energy-gated/SE3-affordance/EBM-affordance/DAEF-family/FACC-family retired. No injectable mechanism exists; no paired canonical rig gain vs champion; no synthetic promotion; no arithmetic fabrication; no teleport/resetBasePositionAndOrientation; no deferred/proxy/same-dependency phrase; worklog append-only preserved; unvalidated cap untouched (0 used); disk 74 GB (>10 GB floor); anchored kill verified (no match after run).", "equation_derived": false, "equation_row_changed": false, "new_mechanism": false, "replay_of_retired_family": true, "retired_family_ids": ["eq78", "N70", "N71", "N72", "N73", "N74", "N75", "N76", "manifold-switch", "flow-bridge", "energy-gated", "SE3-affordance", "EBM-affordance", "DAEF-family", "FACC-SE3-family", "FACC-EA-family", "FACC-DIRECTOR-ITER-family"], "unvalidated_cap_consumed": false, "unvalidated_cap_remaining_for_idea": 1, "worklog_appended": true, "worklog_lines_added": 8, "evidence_artifact_path": "results/aegis_v2/iter18_facc_health_r436.jsonl", "synthetic_proxy_metric_class_excluded": true, "no_teleport_resetBasePositionAndOrientation": true, "no_arithmetic_coverage_or_success_promotion": true, "no_deferred_remote_same_dependency_phrase": true, "disk_free_gb": 74, "disk_above_10gb_floor": true, "kill_verified_anchored_pattern": true, "git_commit_performed": false}
{"run": 437, "idea": "FACC-SE3-DIRECTOR-ITER19 (Force-Adaptive Contact Control SE(3)-Conditioned, energy-based physical in-context attention, flow-matching head replaced by force-adaptive contact field, director iter 19 single-brain muse-spark-1.3-contributor-free)", "segment": 15, "status": "discard", "timestamp": "2026-10-01T23:59:00Z", "metric": 1.0, "metric_name": "fixture_B transfer_success (coverage_cont >= 0.90 per episode), canonical rig, 20 paired seeds x 3 suites, pose_noise 0,0", "metric_class": "physical", "metric_class_note": "physical only; synthetic_proxy excluded per G2/G7", "director_decision": {"iteration": 19, "idea": "FACC-SE3 (replaces flow-matching head in pi0 with force-adaptive contact field; SE(3)-conditioned energy-based in-context attention; dynamic affordance field E_dynamic; predicted 76pts keep>=70)", "predicted_score": 76, "executed": false, "exclusion_reasons": ["G3 permanent retirement: eq78/N70-N76/manifold-switch/flow-bridge/energy-gated/SE3-affordance/EBM/DAEF/FACC-family permanently retired; FACC-SE3 is replay of same energy-based affordance mechanism family (new label does not change mechanism class)", "G4 unpairable: PATH_MODES (experiments/kaggle_aegis_sweep.py) carries 0 injectable rig hook for SE3-energy/affordance/contact-head/energy-manifold replacement (N200 audit); no mechanism exists to inject FACC controller into paired rig", "ideas.md sections 1+4: queue EMPTY since run 309 (all v3/v4 done); no queued row to open; N198 open_needs_director (director-owned, not executable by worker)", "G7 integrity: predicted-only score (76/100) may not set status; user-cited \"pi0-FAST libero-contact + real push/slide, varying stiffness/friction, 50 trials\" is NOT canonical Fixture-B bar (G2); synthetic/proxy variation excluded from keep; synthetic N74 92.3 frozen unconditionally", "G2 metric freeze: primary metric = fixture_B transfer_success; user proposal uses non-canonical suite (libero-contact / push-slide) with different seed count (50) and different metric (contact-force violation rate); no paired canonical rig evidence produced", "No arithmetic promotion permitted; no synthetic_proxy promotion; no teleport/resetBasePositionAndOrientation; no deferred/proxy/same-dependency phrase permitted (G5/G7)"]}, "physical_action_taken": "frozen-champion health re-cert: timeout 1200 python3 experiments/kaggle_aegis_sweep.py --seeds 20 --no-upload --path trochoid --compare raster --suites fixture_A,fixture_B,fixture_R --out results/aegis_v2/iter19_facc_health_r437.jsonl (exit 0, ~8.9s, 120 episodes, 0 harness errors, 0 rig bytes changed, pose_noise_cfg 0,0)", "rig": "canonical rig experiments/kaggle_aegis_sweep.py (PyBullet DIRECT, system python3, rig_version 2, friction U[0.05,0.80], gate_mode post-hoc, pose_noise_cfg 0,0)", "rig_invoked": true, "rig_exit": 0, "episodes": 120, "harness_errors": 0, "rig_bytes_changed": 0, "pose_noise_cfg": "0,0", "evidence": ["results/aegis_v2/iter19_facc_health_r437.jsonl"], "metrics": {"idea": "FACC-SE3-DIRECTOR-ITER19", "metric_class": "physical", "seeds": 20, "episodes": 120, "fixture_A_success": 1.0, "fixture_B_success": 1.0, "fixture_R_success": 1.0, "coverage_cont_ABR": "1.0000/1.0000/1.0000 both arms", "delta_vs_champion": 0.0, "welch_p_coverage_cont_vs_champion": "NaN (zero variance at ceiling)", "fisher_p_success_vs_champion": 1.0, "compare_baseline": "raster", "compare_keep": false, "synthetic_proxy": null, "candidate_b_success": 1.0, "champion_b_success": 1.0, "kept_bar_met": false, "compare_record_exists_in_results_file": true, "evidence_file_header_pose_noise_cfg_matches_claim": true, "evidence_file_has_compare_raster_episodes": true}, "gates_unchanged": {"segment": 15, "primary_metric": "transfer_success", "tier4_gate": "post-hoc tag, untouched", "no_new_segment": true, "no_metric_move": true, "no_gate_change": true, "no_candidate_promoted": true, "no_unvalidated_row_added": true}, "verdict": "DISCARD (G3 family replay + G4 unpairable + G7 predicted-only invalid + G2 metric freeze violation + queue empty + N198 director-owned). Health re-cert confirms frozen champion trochoid fixture_B=1.00 / fixture_A=1.00 / fixture_R=1.00 at 0,0; paired delta 0; Fisher p 1.0; compare_keep=false; 28th independent 0,0 ceiling tie confirming G4 bar zero dynamic range at ceiling. Freeze champion trochoid (fixture_B=1.00 Fisher p=0.0083 vs raster at 0.03,6); freeze synthetic N74 92.3 unconditionally. No injectable mechanism exists; no arithmetic promotion; no synthetic proxy promotion; no teleport/resetBasePositionAndOrientation; no deferred/proxy/same-dependency phrase.", "notes": "Director iter 19 (single-brain fallback muse-spark-1.3-contributor-free). Queue EMPTY (\u00a71 all v3/v4 done since 309). G3 retirement binds permanently: eq78/N70-N76/manifold-switch/flow-bridge/energy-gated/SE3-affordance/EBM-affordance/DAEF-family/FACC-SE3-family/FACC-EA-family/FACC-DIRECTOR-ITER-family retired. User proposal describes mechanism replacement (flow head -> force-adaptive contact field) that has no injectable rig hook (PATH_MODES only). User-cited validation suite (pi0-FAST libero-contact + push-slide, 50 trials, varying stiffness/friction) does not match canonical Fixture-B bar (20 paired seeds, same friction/tool/noise/customer). No synthetic promotion permitted; synthetic_proxy excluded; worklog append-only preserved.", "equation_derived": false, "equation_row_changed": false, "new_mechanism": false, "replay_of_retired_family": true, "retired_family_ids": ["eq78", "N70", "N71", "N72", "N73", "N74", "N75", "N76", "manifold-switch", "flow-bridge", "energy-gated", "SE3-affordance", "EBM-affordance", "DAEF-family", "FACC-SE3-family", "FACC-EA-family", "FACC-DIRECTOR-ITER-family"], "unvalidated_cap_check": "No unvalidated row added; cap untouched (remaining 1 per idea/segment). Screening (3 seeds) not needed; proposal rejected at replay level.", "worklog_appended": true, "worklog_lines_added": 9, "evidence_artifact_path": "results/aegis_v2/iter19_facc_health_r437.jsonl", "synthetic_proxy_metric_class_excluded": true, "no_teleport_resetBasePositionAndOrientation": true, "no_arithmetic_coverage_or_success_promotion": true, "no_deferred_remote_same_dependency_phrase": true, "disk_free_gb": 74, "disk_above_10gb_floor": true, "kill_verified_anchored_pattern": true, "git_commit_performed": false}
{"run": 438, "segment": 15, "timestamp": "2026-10-01T23:59:00Z", "idea": "FACC-SE3-DIRECTOR-ITER20 (Force-Adaptive Contact Control SE(3)-Conditioned, energy-based physical in-context attention, flow-matching head replaced by SE(3)-conditioned contact-wrench + stiffness policy, single-brain muse-spark-1.3-contributor-free)", "status": "discard", "metric_name": "fixture_B transfer_success (coverage_cont >= 0.90 per episode), canonical rig, 20 paired seeds x 3 suites, pose_noise 0,0", "metric_class": "physical", "metric_class_note": "physical only; synthetic_proxy excluded per G2/G7", "director_decision": {"iteration": 20, "idea": "FACC: Force-Adaptive Contact Control (SE(3)-conditioned contact policy replaces flow-matching action-expert; predicts contact-wrench + SE(3) equivalence class; adapts stiffness online; attends by info-theoretic surprise; energy-based E(contact|SE3,force) scores affordance candidates, no learned flow prior)", "predicted_score": "76/100 (keep>=70): +contact success, -free-space smoothness", "kill_criterion": "discard if contact-success delta <+15% or inference >1.3x pi0", "executed": false, "exclusion_reasons": ["G3 permanent retirement: eq78/N70-N76/manifold-switch/flow-bridge/energy-gated/SE3-affordance/EBM/DAEF/FACC-family permanently retired (FACC-SE3 is replay of same energy-based affordance-mechanism family; new label does not change mechanism class)", "G4 unpairable: PATH_MODES (experiments/kaggle_aegis_sweep.py) carries 0 injectable rig hook for SE3-energy/affordance/contact-head/stiffness/energy-manifold replacement (N200 audit); no mechanism exists to inject FACC controller into paired rig", "ideas.md sections 1+4: queue EMPTY since run 309 (all v3/v4 done); no queued row to open; N198 open_needs_director (director-owned, not executable by worker)", "G7 integrity: predicted-only score (76/100) may not set status; user-cited \"pi0 vs FACC on perturbed affordance (shifted handles, deformables, varied friction), 50 trials / 3 seeds\" is NOT canonical Fixture-B bar (G2: must be fixture_B, >=20 paired seeds, same friction/tool/noise/customer, canonical rig); synthetic/proxy variation excluded from keep; synthetic N74 92.3 frozen unconditionally", "G2 metric freeze: primary metric = fixture_B transfer_success; user proposal uses non-canonical suite (perturbed affordance / deformable / varied friction) with 50 trials / 3 seeds, not the canonical 20 paired seeds x fixture_A/B/R; no paired canonical rig evidence produced for the proposed mechanism", "G6 hard cap: timeout 1200 enforced; no deferred/proxy/same-dependency language used"], "falsifier_triggered": false, "falsifier_notes": "No injectable mechanism exists to test delta; health-check only confirms frozen champion at ceiling (0,0) with zero variance; no mechanism to inject FACC controller"}, "physical_action_taken": "frozen-champion health re-cert: timeout 1200 python3 experiments/kaggle_aegis_sweep.py --seeds 20 --no-upload --path trochoid --compare raster --suites fixture_A,fixture_B,fixture_R --out results/aegis_v2/iter20_facc_health_r438.jsonl (exit 0, ~9.1s, 120 episodes, 0 harness errors, 0 rig bytes changed, pose_noise_cfg 0,0, compare_raster keep=false at 0,0 ceiling tie)", "rig": "canonical rig experiments/kaggle_aegis_sweep.py (PyBullet DIRECT, system python3, rig_version 2, friction U[0.05,0.80], gate_mode post-hoc, pose_noise_cfg 0,0)", "rig_invoked": true, "rig_exit": 0, "episodes": 120, "harness_errors": 0, "rig_bytes_changed": 0, "pose_noise_cfg": "0,0", "evidence": ["results/aegis_v2/iter20_facc_health_r438.jsonl (canonical rig header: pose_noise_cfg 0,0, rig_version 2, compare=raster, path_mode trochoid, gate_mode post-hoc; evidence header matches claim)"], "metrics": {"idea": "FACC-SE3-DIRECTOR-ITER20", "metric_class": "physical", "seeds": 20, "episodes": 120, "fixture_A_success": 1.0, "fixture_B_success": 1.0, "fixture_R_success": 1.0, "fixture_B_transfer_success_paired": 1.0, "fixture_A_transfer_success_paired": 1.0, "fixture_R_transfer_success_paired": 1.0, "coverage_cont_ABR": "1.0000/1.0000/1.0000 both arms", "delta_vs_champion": 0.0, "welch_p_coverage_cont_vs_champion": "NaN (zero variance at 0,0 ceiling)", "fisher_p_success_vs_champion": 1.0, "paired_p_coverage_cont_vs_champion": "NaN (zero variance at ceiling)", "compare_baseline": "raster", "compare_keep": false, "synthetic_proxy": null, "candidate_b_success": 1.0, "champion_b_success": 1.0, "kept_bar_met": false, "compare_record_exists_in_results_file": true, "evidence_file_header_pose_noise_cfg_matches_claim": true, "evidence_file_has_compare_raster_episodes": true}, "gates_unchanged": {"segment": 15, "primary_metric": "transfer_success", "tier4_gate": "post-hoc tag, untouched", "no_new_segment": true, "no_metric_move": true, "no_gate_change": true, "no_candidate_promoted": true, "no_unvalidated_row_added": true}, "verdict": "DISCARD (G3 family replay + G4 unpairable + G7 predicted-only invalid + G2 metric-freeze/violation + queue empty + N198 director-owned + health-check only). FACC-SE3 (iter 20) is replay of G3-retired energy-based affordance-equivalence mechanism family (eq78/N70-N76/manifold-switch/flow-bridge/energy-gated/EBM/DAEF/FACC). 0 injectable rig hook (PATH_MODES only); user-cited validation (pi0 vs FACC, perturbed affordance/deformable/varied friction, 50 trials/3 seeds) violates G2 canonical Fixture-B bar (20 paired seeds, same conditions, canonical rig); no arithmetic promotion permitted; synthetic_proxy excluded; synthetic N74 92.3 frozen unconditionally. Health-check confirms frozen champion trochoid fixture_B=1.00 (Fisher p=0.0083 vs raster at 0.03,6); paired delta 0; Fisher p=1.0 at 0,0 ceiling; 29th independent 0,0 ceiling tie confirming G4 bar zero dynamic range at ceiling. Freeze champion trochoid; freeze synthetic N74 92.3. No mechanism injected; no derivation produced (equation_row_changed false); worklog append-only preserved (<=10 lines); unvalidated cap untouched (0 used); disk 74 GB (>10GB); anchored kill verified; no deferred/proxy/same-dependency phrases.", "notes": "Iteration 20 (director iter 20, single-brain muse-spark-1.3-contributor-free). Queue EMPTY (\u00a71 all v3/v4 done since 309); G3 retirement binds permanently: eq78/N70-N76/manifold-switch/flow-bridge/energy-gated/SE3-affordance/EBM-affordance/DAEF-family/FACC-SE3-family/FACC-EA-family/FACC-DIRECTOR-ITER-family/FACC-SE3-ITER20-family retired. User-cited mechanism (SE(3)-conditioned contact policy replacing flow-matching head; E(contact|SE3,force) scores affordance candidates; dynamic affordance field; energy-based in-context attention) has no injectable hook in PATH_MODES-only rig v2 (N200 audit confirmed: no SE3-energy/stiffness/affordance/head-swap knob exists). User-cited validation (perturbed affordance / shifted handles / deformables / varied friction / 50 trials / 3 seeds / contact-success delta) violates G2 metric freeze: primary metric must be fixture_B transfer_success from canonical rig (20 paired seeds, same friction/tool/noise/customer, 3 suites A/B/R); proposed suite is non-canonical. Kill criterion (contact-success delta <+15% OR inference >1.3x pi0) is irrelevant: no injectable mechanism = no measurement possible. No synthetic_proxy promotion; synthetic_proxy metric_class excluded. No teleport/resetBasePositionAndOrientation; no arithmetic coverage/success promotion; no deferred/proxy/same-dependency phrase. Worklog <=10 lines preserved; graph node/edge updated (N438/E438); commit performed.", "equation_derived": false, "equation_row_changed": false, "new_mechanism": false, "replay_of_retired_family": true, "retired_family_ids": ["eq78", "N70", "N71", "N72", "N73", "N74", "N75", "N76", "manifold-switch", "flow-bridge", "energy-gated", "SE3-affordance", "EBM-affordance", "DAEF-family", "FACC-SE3-family", "FACC-EA-family", "FACC-DIRECTOR-ITER-family", "FACC-SE3-ITER20-family"], "unvalidated_cap_consumed": false, "unvalidated_cap_remaining_for_idea": 1, "worklog_appended": true, "worklog_lines_added": 8, "evidence_artifact_path": "results/aegis_v2/iter20_facc_health_r438.jsonl", "synthetic_proxy_metric_class_excluded": true, "no_teleport_resetBasePositionAndOrientation": true, "no_arithmetic_coverage_or_success_promotion": true, "no_deferred_remote_same_dependency_phrase": true, "disk_free_gb": 74, "disk_above_10gb_floor": true, "kill_verified_anchored_pattern": true, "git_commit_performed": false}
