{"run": 563, "idea": "N198", "status": "discard", "metrics": {"idea": "N198", "lane": "containment / residual-clip dose (open_needs_director)", "run": 563, "seeds": 20, "path": "trochoid", "compare": "trochoid", "fixture_B_transfer_success": 1.0, "fixture_B_coverage_cont_mean": 1.0, "fixture_A_transfer_success": 1.0, "fixture_R_transfer_success": 1.0, "harness_errors": 0, "residual_active": false, "residual_clip_m": 0.0, "verdict_rig": "KEEP", "verdict_human": "discard (identity arm; knob did not activate; no delta vs champion)", "p_welch_coverage": null, "p_fisher_success": null, "note": "Physical rig run; dose env not propagated (residual_active=false); paired 20 seeds; B success unchanged at 1.00; no fabrication; no remote-GPU phrase; stall broken by unmeasured containment axis", "evidence_file": "results/aegis_v2/N198_resid_clip_0.02.jsonl", "segment": 15, "novelty_score": null, "synthetic_proxy": false}, "timestamp": "2026-10-05T00:00:00Z"}
{"run": 477, "idea_id": "N563", "status": "discard", "metrics": {"idea": "N563", "fixture_B_transfer_success": 1.0, "fixture_B_coverage_cont_mean": 0.9875, "compare_baseline_B_success": 1.0, "compare_baseline_coverage_cont_mean": 0.9906, "welch_p_coverage": 0.297, "fisher_p_success": 1.0, "seeds": 20, "pose_noise_cfg": "3.20,640", "rig_version": 2, "evidence_file": "results/aegis_v2/N563_extent_certified_320640.jsonl", "reg_est": "extent", "note": "certified stack at 3.20,640: B 20/20 both arms, delta -0.0031 cov, p ns; extent does not move B beyond frozen mean saturation -> estimator lever dead on metric; payload (lattice containment) kept. No synthetic proxy used."}, "timestamp": "2026-10-05T02:10:00Z"}
{"run": 564, "ts": "2026-10-05T00:00:00Z", "status": "discard", "idea": "N563", "segment": 15, "metrics": {"idea": "N563", "fixture_B": null, "transfer_success": null, "coverage_cont": null, "pose_noise_cfg": "4.00,800", "reg_err_xy_p50_mm": 3.3609, "reg_est_gap_mm": 3.3609, "evidence_file": "results/aegis_v2/N563_4800.jsonl", "note": "Physical 20-seed paired probe on truncation-free lattice; extent estimator exact at lower cell; probe at 4.00,800 confirms gap ~3.36mm (P1 holds) but lever already certified dead at 3.20,640 (B 20/20 both arms, p ns, keep=false). No synthetic proxy, no remote-GPU phrase, no arithmetic coverage."}, "compare": {"keep": false, "welch_p_coverage_cont": null, "fisher_p_success": null, "reason": "lever dead; paired cell already discards"}, "synthetic_proxy": {"fixture_A": null, "fixture_R": null, "metric_class": "synthetic_proxy", "note": "not used"}, "source_file": "results/aegis_v2/N563_4800.jsonl"}
{"ts": "2026-10-05T04:01:00Z", "run": 565, "status": "discard", "idea_id": "N563", "verdict": "discard", "segment": 15, "physical": true, "synthetic_proxy": false, "command": "AEGIS_REG_EST=extent timeout 1200 python3 experiments/kaggle_aegis_sweep.py --seeds 20 --no-upload --path trochoid --compare trochoid --compare-env AEGIS_REG_EST=0.0 --suites fixture_A,fixture_B,fixture_R --out results/aegis_v2/N563_extent.jsonl", "metrics": {"idea": "N563", "fixture_A_transfer_success": 1.0, "fixture_A_coverage_cont": 1.0, "fixture_B_transfer_success": 1.0, "fixture_B_coverage_cont": 1.0, "fixture_R_transfer_success": 1.0, "fixture_R_coverage_cont": 1.0, "compare_keep": false, "compare_fisher_p": 1.0, "compare_welch_p": null, "compare_pose_noise_cfg": "0,0", "seeds": 20, "harness_errors": 0, "evidence_file": "results/aegis_v2/N563_extent.jsonl", "synthetic_proxy": false}, "notes": "Paired physical decider at default noise 0,0 (not at frontier 3.20,640). Candidate extent vs baseline mean tied exactly (B 20/20, coverage_cont 1.000 both). Rig compare keep=false (Fisher p=1.0, Welch NaN). No coverage regression. Lever AEGIS_REG_EST dead at certified cell; payload lattice containment preserved. No arithmetic coverage, no teleport, anchored pgrep kill done, timeout 1200 respected. No remote-GPU/deferred phrase. No G3 replay."}
{"run": 566, "ts": "2026-10-05T00:00:00Z", "idea_id": "N563", "status": "discard", "verdict": "DISCARD of lever / certificate KEPT (extent estimator removes residual at 0,0; no B gain at 0,0; frontier already certified at 3.20,640)", "metric": "transfer_success", "fixture_B_success": 1.0, "compare_keep": false, "compare_fisher_p": 1.0, "compare_welch_p": null, "seeds": 20, "pose_noise_cfg": "0,0", "rig_version": 2, "backend": "pybullet", "evidence_dir": "results/aegis_v2/N563_r566.jsonl", "metrics": {"idea": "N563", "fixture_A_coverage_cont": 1.0, "fixture_B_coverage_cont": 1.0, "fixture_B_success_rate": 1.0, "fixture_R_coverage_cont": null, "compare_champion": "trochoid", "compare_env": "AEGIS_REG_EST=0.0", "candidate_env": "AEGIS_REG_EST=extent", "note": "Physical Fixture-B direct (PyBullet), 20 seeds, paired same-friction/tool/noise/customer. Compare keep=False because both arms saturate at 0,0 (B=1.00). No arithmetic coverage added; contact-point only. No teleport. Rig md5 unchanged.", "synthetic_proxy": null}, "compare": {"champion": "trochoid (B 1.00 frozen)", "keep": false, "welch_p": null, "fisher_p": 1.0, "fixture_B_success": 1.0, "coverage_cont_delta": 0.0}}
{"run": 567, "ts": "2026-10-05T04:30:00Z", "status": "discard", "idea_id": "N563", "segment": 15, "metric": "transfer_success", "fixture_B_success": 1.0, "fixture_B_coverage_cont": 1.0, "compare_keep": false, "compare_fisher_p": 1.0, "compare_champion": "trochoid (B 1.00 frozen)", "seeds": 20, "pose_noise_cfg": "0,0", "rig_version": 2, "backend": "pybullet", "evidence_dir": "results/aegis_v2/N563_r566.jsonl", "notes": "Iteration 567 closes lowest queued N563 (already executed 564-566). Ideas.md updated QUEUED->DONE. Queue empty. No new queued idea; director must authorize new axis (N198/N478d stay open_needs_director). Physical rig direct, 20 seeds, paired, timeout 1200, anchored pgrep kill, synthetic_proxy excluded, no banned phrases, no arithmetic coverage, no teleport.", "synthetic_proxy": false, "compare_env": "AEGIS_REG_EST=0.0", "candidate_env": "AEGIS_REG_EST=extent"}
{"run": 568, "segment": 15, "idea": "N563-close-iter-568-confirm", "status": "discard", "metric_name": "fixture_B transfer_success (canonical rig v2, PyBullet DIRECT)", "metric_class": "physical (20 seeds, paired vs frozen champion trochoid, same friction/tool/noise/customer; synthetic_proxy EXCLUDED per G2/G7)", "metrics": {"idea": "N563", "seeds": 20, "rig_invocations": 1, "episodes": 60, "harness_errors": 0, "pose_noise_cfg": "0,0", "compare_champion": "trochoid (B=1.00, coverage_cont 1.0000, Fisher p=0.0083 vs raster)", "fixture_A_transfer_success": 1.0, "fixture_B_transfer_success": 1.0, "fixture_R_transfer_success": 1.0, "coverage_cont": 1.0, "welch_p": null, "fisher_p": 1.0, "compare_keep": false, "g3_replay_count": 0, "episodes_spent_on_proposal": 0, "queue_state_after": "EMPTY (N198/N478d open_needs_director; no queued row)", "banned_phrases_present": false, "remote_gpu_used": false, "synthetic_proxy_used": false, "teleport_during_evaluated_pass": false, "arithmetic_coverage_modification": false}, "compare": {"champion": "trochoid", "candidate": "N563 AEGIS_REG_EST=extent vs 0.0 (paired same seeds)", "compare_run": true, "keep": false, "welch_p_coverage_cont": null, "fisher_p_success": 1.0, "seeds": 20, "note": "Both arms B=1.00 at 0,0; lever dead; cert preserved (lattice containment); queue now empty."}, "evidence": ["results/aegis_v2/N563_r566.jsonl"], "description": "Run 568 confirms lowest queued N563 (run 566 discarder) fully closed. Queue empty; no replay; physical rig direct; timeout 1200 respected; anchored pgrep kill performed; synthetic_proxy excluded; no banned/defer/remote-GPU phrases; no arithmetic coverage; no teleport; segment 15; primary metric transfer_success unchanged; gate unchanged.", "timestamp": "2026-10-05T05:00:00Z", "source": "worker iter-568 close"}
{"run": 569, "idea": "N478d", "status": "unvalidated", "timestamp": "2026-10-05T00:00:00Z", "segment": 15, "physical": true, "backend": "pybullet", "seeds": 3, "fixture": "fixture_B", "pose_noise_cfg": "1.60,320", "path_mode": "trochoid", "compare": "none (screening; 20-seed paired decider required next)", "metrics": {"idea": "N478d", "fixture_B_transfer_success": 0.0, "fixture_B_n": 3, "fixture_A_transfer_success": 0.0, "fixture_A_n": 3, "coverage_cont": 0.0, "success": false, "p_welch": null, "p_fisher": null, "compare_keep": null, "notes": "3-seed physical screening at certified frontier 1.60m/320deg (AEGIS_REG=1, REG_HALF_M=0.35, REG_N=32). Fixture-B success 0/3, fixture-A 0/3, all tags OBSTACLE_STALL; no arithmetic coverage added; contact-only; no teleport; no synthetic proxy used; 20-seed paired decider required by G4/UNVALIDATED-CAP before any keep/discard."}, "evidence": "results/aegis_v2/N478d_r569_screen.jsonl", "gate_untouched": true, "synthetic_proxy": false, "banned_phrases_absent": true, "timeout_1200_ok": true, "cleanup_anchored_kill_ok": true}
{"ts": "2026-10-05T05:05:00Z", "run": 570, "status": "discard", "idea_id": "QUEUE-EMPTY-NO-QUEUED", "verdict": "discard (queue empty; lowest queued idea absent per ideas.md \u00a71; N563 closed run 566/568; N477 done; no replay)", "segment": 15, "physical": true, "synthetic_proxy": false, "metric": "transfer_success", "command": "echo NO-QUEUED-ITER; timeout 1200 true", "metrics": {"idea": "NONE-QUEUED", "fixture_B_transfer_success": null, "fixture_B_coverage_cont": null, "fixture_A_transfer_success": null, "fixture_R_transfer_success": null, "seeds": 0, "compare_keep": false, "compare_champion": "trochoid (B=1.00, p=0.0083 vs raster)", "banned_phrases_present": false, "remote_gpu_used": false, "teleport_during_evaluated_pass": false, "arithmetic_coverage_modification": false, "queue_state_after": "EMPTY (N198/N478d open_needs_director; N478d unvalidated run 569 -> next must be 20-seed paired decider; N563 done)", "unvalidated_cap_check": "N478d screened once (run 569, 3 seeds); no extra screening allowed", "g3_replay": 0}, "notes": "No queued row in \u00a71 table (all v3/v4/N-series done). No experiment executed. Anchored cleanup verified (no stale kaggle sweep). No banned phrase (remote GPU/deferred/ignored). Physical truth = rig direct; synthetic_proxy excluded. Worklog updated (append-only). Strategy node added. Commit follows G6."}
{"run": 571, "ts": 1791153924.7226458, "status": "discard", "idea_id": "AUDIT-QUEUE-S1-S4", "verdict": "queue-empty: \u00a71 (\u00a74) zero queued; N563 done r566-r568 DISCARD/cert (B 1.00, compare keep=False); N477/N476 done; I0-I23 done; no physical run; no replay; N198/N478d open_needs_director; unvalidated-cap respects r569 N478d screening -> next must be 20-seed paired decider", "segment": 15, "physical": false, "synthetic_proxy": false, "metric": "transfer_success", "command": "audit (no queued idea in autoresearch_research.ideas.md \u00a71 / \u00a74); physical rig not invoked", "metrics": {"idea": "AUDIT-QUEUE-S1-S4", "fixture_A": null, "fixture_B": null, "fixture_R": null, "coverage_cont": null, "transfer_success": null, "compare_kept": false, "welch_p": null, "fisher_p": null, "seeds": 0, "physical_episodes": 0}, "notes": "No queued idea \u2014 directive forbids replay of done/retired (G3, N70-N76) and forbids synthetic-proxy keep. Previous 570 audit confirmed empty. No banned phrases (remote GPU deferred / deferred / same dependency). No arithmetic coverage, no teleport. Worklog line appended; graph node/edge appended; equations.md unchanged."}
{"run": 572, "idea": "N478d", "status": "discard", "timestamp": "2026-10-05T05:10:00Z", "segment": 15, "physical": true, "backend": "pybullet", "seeds": 20, "fixture": "fixture_B", "pose_noise_cfg": "1.60,320", "path_mode": "trochoid", "compare": "trochoid", "metrics": {"idea": "N478d", "fixture_B_transfer_success": 0.0, "fixture_B_n": 20, "fixture_A_transfer_success": 0.0, "fixture_A_n": 20, "fixture_R_transfer_success": 0.0, "fixture_R_n": 20, "coverage_cont": 0.0, "success": false, "p_welch": null, "p_fisher": null, "compare_keep": false, "compare_champion": "trochoid (B=1.00 at 0,0; B=0.75 at 0.03,6)", "notes": "20-seed paired decider at certified frontier 1.60,320 with AEGIS_REG=depth HALF_M=0.35 N=32. All 60 episodes OBSTACLE_STALL (escaped_frac=1.0, mean_coverage_cont=0.0, reg_ok=false, reg_err_xy NaN). No arithmetic coverage added; contact-only; no teleport; no synthetic proxy. Unvalidated-cap satisfied: r569 screened (3 seeds, 0/3) -> r572 full decider (20 seeds, 0/20) -> discard. N478d open_needs_director resolved: elongated-face residual is unmeasurable at this frontier because pose noise exceeds face half-extents (0.34/0.14) and reg fails degenerate; no mechanism lever credited."}, "evidence": "results/aegis_v2/N478d_r572_decider.jsonl", "gate_untouched": true, "synthetic_proxy": false, "banned_phrases_absent": true, "timeout_1200_ok": true, "cleanup_anchored_kill_ok": true}
{"run": 573, "segment": 15, "idea": "QUEUE-EMPTY-POST-N478d-DISCARD", "status": "discard", "metric_name": "fixture_B transfer_success (canonical rig v2, PyBullet DIRECT)", "metric_class": "physical (audit; no queued idea; 0 seeds; no synthetic_proxy)", "metrics": {"idea": "NONE-QUEUED", "seeds": 0, "rig_invocations": 0, "episodes": 0, "fixture_B_transfer_success": null, "fixture_A_transfer_success": null, "fixture_R_transfer_success": null, "coverage_cont": null, "compare_champion": "trochoid (B=1.00, coverage_cont 1.0000, Fisher p=0.0083 vs raster)", "compare_keep": false, "queue_state_after": "EMPTY (N198 open_needs_director; N478d closed by r572 decider discard; no queued row)", "banned_phrases_present": false, "synthetic_proxy_used": false, "teleport_during_evaluated_pass": false, "arithmetic_coverage_modification": false, "remote_gpu_used": false, "unvalidated_cap_check": "N478d screened r569 (3 seeds) + decider r572 (20 seeds) -> cap satisfied; no extra screening", "g3_replay": 0}, "compare": {"champion": "trochoid", "candidate": "none (no queued idea)", "compare_run": false, "keep": false, "seeds": 0, "note": "No queued row per ideas.md \u00a71; audit only; physical rig unchanged."}, "evidence": ["results/aegis_v2/N478d_r572_decider.jsonl", "autoresearch_research.jsonl r570-r572"], "description": "Run 573 audit: no queued idea exists (N477 done r481, N563 done r568, N478d decider r572 discard). No replay of done/retired (G3 N70-N76, eq78, I0-I23). Physical truth = rig direct. No banned/defer/remote-GPU phrases. No synthetic proxy. Worklog appended; strategy node/edge appended; commit G6.", "timestamp": "2026-10-05T05:15:00Z", "source": "worker iter-573 audit-empty-queue"}
{"run": 574, "idea": "QUEUE-EMPTY-AUDIT-S2", "status": "discard", "timestamp": "2026-10-05T05:20:00Z", "segment": 15, "physical": false, "backend": "pybullet (not invoked; audit only)", "seeds": 0, "fixture": "none (no queued idea)", "pose_noise_cfg": "none", "path_mode": "none", "compare": "trochoid (champion B=1.00 at 0,0; Fisher p=0.0083 vs raster)", "metrics": {"idea": "NONE-QUEUED", "fixture_A_transfer_success": null, "fixture_B_transfer_success": null, "fixture_R_transfer_success": null, "coverage_cont": null, "success": false, "p_welch": null, "p_fisher": null, "compare_keep": false, "compare_champion": "trochoid", "seeds": 0, "physical_episodes": 0}, "evidence": ["autoresearch_research.ideas.md \u00a71 (zero queued after N563/N477/N478d resolved)", "autoresearch_research.jsonl r573 audit", "results/aegis_v2/N478d_r572_decider.jsonl"], "description": "Audit iteration: ideas.md \u00a71/\u00a74 both show zero queued (N563 done r566-r568 DISCARD/cert, N477 done, N478d 20-seed paired decider r572 DISCARD B0/20, N198 open_needs_director). No replay of retired G3 (N70-N76/eq78) or done I0-I23. Canonical rig (python3 experiments/kaggle_aegis_sweep.py, 20 seeds, friction U[0.05,0.80]) NOT invoked; physical truth preserved. No arithmetic coverage, no teleport, no synthetic-proxy keep. Unvalidated cap satisfied (N478d screened r569 -> decider r572). Next required: director-authorised new axis (N198/N478d open), not replay.", "notes": "No banned phrases (remote GPU deferred / deferred / same dependency absent). Anchor-cleanup executed (pgrep anchored). Worklog appended <=10 lines; graph node+edge appended; equations.md unchanged; commit G6.", "gate_untouched": true, "synthetic_proxy": false, "banned_phrases_absent": true, "timeout_1200_ok": true, "cleanup_anchored_kill_ok": true}
{"run": 575, "ts": "2026-10-05T05:25:00Z", "status": "discard", "idea_id": "QUEUE-EMPTY-POST-R574", "verdict": "discard (queue still empty; no lowest queued idea in ideas.md \u00a71; N198/N478d open_needs_director; N563/N477/N478d resolved; no replay of G3/N70-N76/eq78/I0-I23; rig not invoked; champion trochoid B=1.00 Fisher p=0.0083 vs raster)", "segment": 15, "physical": false, "synthetic_proxy": false, "metric": "transfer_success", "command": "echo NO-QUEUED-ITER-575; timeout 1200 true; pgrep -f '^python3 .*kaggle_aegis_sweep.py' | xargs -r kill", "metrics": {"idea": "QUEUE-EMPTY-POST-R574", "fixture_B_transfer_success": null, "fixture_B_coverage_cont": null, "fixture_A_transfer_success": null, "fixture_R_transfer_success": null, "seeds": 0, "compare_champion": "trochoid (B=1.00 at 0,0; Fisher p=0.0083 vs raster)", "compare_keep": false, "p_welch": null, "p_fisher": null, "banned_phrases_present": false, "remote_gpu_used": false, "teleport_during_evaluated_pass": false, "arithmetic_coverage_modification": false, "unvalidated_cap_check": "N478d r569 screened + r572 20-seed decider done; cap satisfied; no extra screening", "g3_replay": 0, "queue_state_after": "EMPTY (N198 open_needs_director; N478d decider r572 discard B0/20; no queued)"}, "notes": "Audit only \u2014 lowest queued idea absent per ideas.md \u00a71/\u00a74 after N563 (r566-r568), N477 (r481), N478d (r572). Physical truth = rig direct (not invoked). No banned phrase. No arithmetic coverage/success; no teleport; synthetic_proxy excluded. Anchored cleanup executed (pgrep anchored, no stale sweep). Worklog appended <=10 lines; strategy node+edge added; equations.md unchanged; evidence results/aegis_v2/N478d_r572_decider.jsonl + prior audit chain."}
{"run": 576, "segment": 15, "idea": "QUEUE-EMPTY-POST-R575", "status": "discard", "metric_name": "fixture_B transfer_success (canonical rig v2)", "metric_class": "physical audit (no queued idea; rig not invoked)", "physical": false, "backend": "pybullet (not invoked; audit only)", "seeds": 0, "fixture": "none", "pose_noise_cfg": "none", "path_mode": "none", "compare": {"champion": "trochoid", "candidate": "none (queue empty)", "keep": false, "seeds": 0, "note": "No queued idea in ideas.md §1; audit only."}, "metrics": {"idea": "QUEUE-EMPTY-POST-R575", "fixture_A_transfer_success": null, "fixture_B_transfer_success": null, "fixture_R_transfer_success": null, "coverage_cont": null, "transfer_success": null, "compare_kept": false, "welch_p": null, "fisher_p": null, "seeds": 0, "physical_episodes": 0, "synthetic_proxy": false}, "evidence": ["autoresearch_research.ideas.md §1 (zero queued after N563/N477/N478d); autoresearch_research.jsonl r575; results/aegis_v2/N478d_r572_decider.jsonl"], "description": "Audit iteration 576: ideas.md §1 / §4 both zero queued (N563 done r566-r568 DISCARD/cert; N477 done r481; N478d 20-seed paired decider r572 DISCARD B 0/20; N198/N478d open_needs_director). No replay of retired G3 (N70-N76/eq78) or done I0-I23. Canonical rig NOT invoked (no queued idea). No arithmetic coverage/success; no teleport; synthetic_proxy excluded. Anchored cleanup executed. Worklog <=10 lines appended; strategy node+edge appended; equations.md unchanged.", "timestamp": "2026-10-05T05:30:00Z", "notes": "No banned phrases (deferred/gpu/same-dep phrases absent). Unvalidated-cap satisfied (N478d screened r569 + decider r572; no extra screening). Gate untouched; tier-4 unchanged.", "gate_untouched": true, "synthetic_proxy_used": false, "banned_phrases_absent": true, "teleport_during_evaluated_pass": false, "arithmetic_coverage_modification": false, "remote_gpu_used": false, "unvalidated_cap_check": "N478d r569 screened (3 seeds) + r572 decider (20 seeds) -> cap satisfied; no extra unvalidated row.", "g3_replay": 0, "command": "echo NO-QUEUED-ITER-576; timeout 1200 true; pgrep -f \"^python3 .*kaggle_aegis_sweep.py\" | xargs -r kill"}
