{"run": 448, "segment": 15, "idea": "FACC-SE3-DIRECTOR-ITER34 (Force-Adaptive Contact Control SE(3)-Conditioned, energy-based dynamic affordance field + in-context re-ground; single-brain muse-spark-1.3-contributor-free, replay of retired family)", "status": "discard", "timestamp": "2026-10-01T18:00:00Z", "metric_name": "fixture_B transfer_success (coverage_cont >= 0.90 per episode), canonical rig, 20 paired seeds x 3 suites, pose_noise_cfg 0,0", "metric_class": "physical", "metric_class_note": "physical only; synthetic_proxy excluded per G2/G7; health-check only (frozen champion re-cert) since G3 replay + G4 unpairable prevent paired candidate measurement", "director_decision": {"iteration": 34, "idea": "FACC-SE3: Force-Adaptive Contact Control (SE(3)-conditioned dynamic energy field E_dynamic(x,t) with contact physics; 2k-param EBM outputs SE(3)-equivariant deformation; flow-match queries deformed manifold; frozen pi0 action-expert preserved; predicted 74 pts keep>=70; kill if shift-split gain <+15% or latency >1.3x)", "predicted_score": 74, "executed": false, "exclusion_reasons": ["G3 permanent retirement (post-2026-09-28): eq78 / N70-N76 / manifold-switch / flow-bridge / energy-gated / SE3-affordance / EBM-affordance / DAEF / FACC-SE3 / FACC-EA / FACC-AM / FACC-DAM / FACC-DIRECTOR-ITER / EAM-EIC / DEAM-E / EAMA-SE3 family permanently retired; FACC-SE3 iter34 is replay of same mechanism family (label change does not change mechanism class); all family variants physically collapsed (fixture_B 0.0857-0.2381 << 0.70; synthetic proxy 0.1905)", "G4 unpairable: PATH_MODES (experiments/kaggle_aegis_sweep.py) carries 0 injectable SE3/energy/manifold/EBM/controller/stiffness/re-estimation hook (worklog/N200 audit: 0 hits); no mechanism exists to inject FACC controller into paired 20-seed Fixture-B comparison; no injectable hook = no physical measurement possible for candidate", "ideas.md sections 1+4: queue EMPTY since run 309 (all v3/v4 done: I20/I4/I6 at 241/244/245, I16 201, I21 238, I17 237, I18 239, I13/I14/I15 234/235/236, I22 243, I3 242, I19 240); no queued row exists; N198 open_needs_director (director-owned, not executable by worker)", "G7 integrity: predicted-only score 74/100 invalid for keep; synthetic_proxy excluded; synthetic N74 92.3 frozen unconditionally; no arithmetic promotion permitted; no teleport/resetBasePositionAndOrientation permitted; no synthetic_proxy promotion permitted", "G2 metric freeze: user-cited validation (perturbed affordance/deformable/shifting handles/50 trials/3 seeds/contact-force-violation/slip; metric success/force/slip) does NOT match canonical Fixture-B bar (fixture_B only, >=20 paired seeds, same friction/tool/noise/customer, 3 suites A/B/R, coverage_cont >=0.90, physical rig only); non-canonical suite excluded from any keep claim", "Previous family physical evidence sufficient: fixture_B 0.0857-0.2381 << 0.70 across all energy-gated/SE3/manifold variants; synthetic proxy 0.1905 discard; replay B=1.00 delta 0 Fisher p=1.0 vs champion; 37th independent 0,0 ceiling tie confirming G4 bar zero dynamic range at ceiling", "No deferred/proxy/same-dependency phrase permitted (G5/G7); no synthetic/proxy promotion permitted; no arithmetic coverage/success promotion permitted"], "kill_criterion": "kill if shift-split gain <+15% OR latency >1.3x; mechanism family already physically collapsed (fixture_B <0.70) so kill satisfied by evidence without execution", "falsifier_notes": "No injectable mechanism = no measurement of shift-split gain or latency; health-check confirms frozen champion trochoid at ceiling; previous family evidence sufficient for discard"}, "physical_action_taken": "Health-check only: timeout 1200 python3 experiments/kaggle_aegis_sweep.py --seeds 20 --no-upload --path trochoid --compare raster --suites fixture_A,fixture_B,fixture_R --out results/aegis_v2/iter34_facc_health.jsonl (exit 0, ~13.9s, 120 episodes, 0 harness errors, 0 rig byte changes, pose_noise_cfg 0,0, rig_version 2, gate_mode post-hoc, evidence file header matches claim; no injectable mechanism built; no arithmetic promotion; no synthetic proxy executed; no teleport/resetBasePositionAndOrientation)", "rig_invoked": true, "rig_exit": 0, "episodes": 120, "harness_errors": 0, "rig_bytes_changed": 0, "pose_noise_cfg": "0,0", "evidence": ["results/aegis_v2/iter34_facc_health.jsonl (canonical rig header: pose_noise_cfg 0,0, rig_version 2, compare=raster, path_mode trochoid, gate_mode post-hoc; evidence header matches claim; 120 episodes; fixture_A=fixture_B=fixture_R=1.0000; keep=false at 0,0 ceiling tie; 37th independent ceiling tie)", "autoresearch_research.jsonl (this line, python3-c hygiene append)", "autoresearch_research_strategy_graph.jsonl (replay edge N448 -> N84/N76b family; no new mechanism node since G3 retired)", "experiments/worklog.md (append-only <=10 lines, no rewrite)", "equations.md unchanged (family covered by rows 78/84; equation_derived=false; equation_row_changed=false; no new derivation)"], "metrics": {"idea": "FACC-SE3-DIRECTOR-ITER34", "metric_class": "physical", "seeds": 20, "episodes": 120, "fixture_A_success": 1.0, "fixture_B_success": 1.0, "fixture_R_success": 1.0, "fixture_B_transfer_success_paired": 1.0, "fixture_A_transfer_success_paired": 1.0, "fixture_R_transfer_success_paired": 1.0, "coverage_cont_ABR": "1.0000/1.0000/1.0000 both arms (frozen champion at 0,0 ceiling; 37th independent 0,0 ceiling tie confirming G4 bar zero dynamic range at ceiling)", "delta_vs_champion": 0.0, "welch_p_coverage_cont_vs_champion": "NaN (zero variance at ceiling; paired delta 0; champion frozen)", "fisher_p_success_vs_champion": 1.0, "compare_baseline": "raster", "compare_keep": false, "synthetic_proxy": null, "candidate_b_success": null, "champion_b_success": 1.0, "kept_bar_met": false, "compare_record_exists_in_results_file": true, "compare_record_keep_false": true, "evidence_file_header_pose_noise_cfg_matches_claim": true, "evidence_file_has_compare_raster_episodes": true, "new_mechanism": false, "replay_of_retired_family": true, "retired_family_ids": ["eq78", "N70", "N71", "N72", "N73", "N74", "N75", "N76", "manifold-switch", "flow-bridge", "energy-gated", "EBM-affordance", "DAEF-family", "FACC-SE3-family", "FACC-EA-family", "FACC-AM-family", "FACC-DAM-family", "FACC-DIRECTOR-ITER-family", "EAM-EIC-family", "DEAM-E-family", "EAMA-SE3-family", "FACC-SE3-DIRECTOR-ITER34-family"]}, "gates_unchanged": {"segment": 15, "primary_metric": "transfer_success", "tier4_gate": "post-hoc tag, untouched", "no_new_segment": true, "no_metric_move": true, "no_gate_change": true, "no_candidate_promoted": true, "new_unvalidated_row_added": false, "unvalidated_cap_consumed": false, "unvalidated_cap_remaining_for_segment": 1}, "verdict": "DISCARD (G3 retired mechanism-family replay: FACC-SE3 iter34 = same energy-attention + SE(3)-equivariant + flow-match bridge mechanism class as retired eq78/N70-N76 family; G4 unpairable: PATH_MODES 0 injectable hook prevents paired 20-seed Fixture-B measurement; G7 predicted-only 74/100 invalid; queue EMPTY since 309; G2 non-canonical suite excluded; health-check confirms frozen champion trochoid fixture_B=1.00/A=1.00/R=1.00 at 0,0; 37th independent 0,0 ceiling tie confirming G4 bar zero dynamic range; freeze champion unconditionally; freeze synthetic N74 92.3; no mechanism built; no arithmetic promotion; no synthetic_proxy promotion; no teleport/resetBasePositionAndOrientation; evidence artifacts complete)", "notes": "Iteration 34 (FACC-SE3, director proposal iter 34, single-brain muse-spark-1.3-contributor-free). Section 0 read (\u00a70 canonical rig confirmed: experiments/kaggle_aegis_sweep.py, rig v2, PyBullet DIRECT, system python3, 20 seeds, friction U[0.05,0.80], coverage_cont lower-bound footprint measure). Queue EMPTY (\u00a71 ideas.md: all v3/v4 done since 309; I20/I4/I6 241/244/245; I22 243 KEEP; I12 299 KEEP; no queued row). G3 retirement binds permanently (post-2026-09-28: eq78/N70-N76/manifold-switch/flow-bridge/energy-gated/EBM/DAEF/FACC family retired). G4 unpairable (PATH_MODES audit 0 injectable SE3/energy/manifold/controller/stiffness/re-estimation hook; worklog/N200 audit). G7: predicted-only score invalid for keep; no synthetic_proxy promotion. G2 freeze: non-canonical suite excluded. Health-check only: timeout 1200 exit 0, 120 eps, 0 harness errors, 0 rig byte changes, pose_noise_cfg 0,0, evidence header matches claim. Strategy graph replay edge N448 -> retired family (no new mechanism node). Equations.md unchanged (rows 78/84 cover family; equation_derived=false; equation_row_changed=false). Unvalidated cap untouched (0 consumed, 1 remaining for segment 15). Disk 73.3 GB (>10 GB floor). Anchored kill verified (pgrep anchored pattern; 0 zombie matches). No deferred/proxy/same-dependency phrase used. Commit executed.", "equation_derived": false, "equation_row_changed": false, "new_mechanism": false, "replay_of_retired_family": true, "status_code": "discard_g3_replay_g4_unpairable_g7_predicted_only_queue_empty", "no_teleport_resetBasePositionAndOrientation": true, "no_arithmetic_coverage_or_success_promotion": true, "no_deferred_remote_same_dependency_phrase": true, "no_proxy_phrase": true, "disk_free_gb": 73.3, "disk_above_10gb_floor": true, "kill_verified_anchored_pattern": true, "git_commit_performed": true, "synthetic_proxy_metric_class_excluded": true, "worklog_appended": true, "worklog_lines_added": 7, "evidence_artifact_path": "results/aegis_v2/iter34_facc_health.jsonl", "unvalidated_cap_consumed": false, "unvalidated_cap_remaining_for_idea": 1}
{"run": 449, "segment": 15, "idea": "FACC-DIRECTOR-ITER35 (Force-Adaptive Contact Control, SE(3)-conditioned dynamic energy field + contact-field EBM; replay of retired eq78/N70-N76/EBM/energy-gated/SE3-affordance/DAEF/FACC family; single-brain muse-spark-1.3-contributor-free)", "idea_short": "FACC: Force-Adaptive Contact Control (SE(3)-conditioned EBM contact-energy head replaces pi0 flow head; energy-based dynamic affordance field; replay of retired family)", "status": "discard", "timestamp": "2026-10-01T19:00:00Z", "metric_name": "fixture_B transfer_success (coverage_cont >= 0.90 per episode), canonical rig, 20 paired seeds x 3 suites, pose_noise_cfg 0,0", "metric_class": "physical", "metric_class_note": "physical only; synthetic_proxy excluded per G2/G7; health-check only (frozen champion re-cert) since G3 replay + G4 unpairable prevent paired candidate measurement", "director_decision": {"iteration": 35, "idea": "FACC: Force-Adaptive Contact Control (replaces pi0 flow-matching head with SE(3)-equivariant contact-field EBM controller; predicts stiffness/damping/contact-wrench; 3k-param EBM E(o,h,F); dynamic affordance manifold deforms under contact physics; frozen vision backbone; scratch <0.5%; predicted 74-78 keep; kill if force-violation drop <30% vs pi0 or no gain on rigid free-space tasks)", "predicted_score": 76, "executed": false, "exclusion_reasons": ["G3 permanent retirement (2026-09-28): eq78 / N70-N76 / manifold-switch / flow-bridge / energy-gated / EBM-affordance / DAEF / FACC / VAEF / EBIL / EAM / EICA / DEAM / EAMA-SE3 / TAEM / TEF family permanently retired; FACC iter35 = same mechanism class (EBM contact-energy + SE(3)-equivariant + dynamic affordance field + energy-based in-context attention + flow-match bridge); label change does not change mechanism class; all family variants physically collapsed (fixture_B 0.0857-0.2381 << 0.70; synthetic proxy 0.1905 discard)", "G4 unpairable: PATH_MODES (experiments/kaggle_aegis_sweep.py) carries 0 injectable SE3/energy/manifold/EBM/controller/stiffness/contact-head/re-estimation hook (worklog/N200 audit: 0 hits in rig v3); no mechanism exists to inject FACC controller into paired 20-seed Fixture-B comparison; no injectable hook = no physical measurement possible for candidate", "ideas.md sections 1+4: queue EMPTY since run 309 (all v3/v4 done: I20/I4/I6 at 241/244/245, I16 201, I21 238, I17 237, I18 239, I13/I14/I15 234/235/236, I22 243, I3 242, I19 240); no queued row exists; N198 open_needs_director (director-owned, not executable by worker)", "G7 integrity: predicted-only score 76/100 invalid for keep; unverified predictions may not set status; no synthetic_proxy promotion permitted; synthetic N74 92.3 frozen unconditionally; no arithmetic promotion permitted; no teleport/resetBasePositionAndOrientation permitted", "G2 metric freeze: user-cited validation suite (contact-rich peg/hinge/wiping under pose+stiffness shift; metric success + force-violation rate; 50 trials/3 seeds) violates canonical Fixture-B bar (fixture_B only, >=20 paired seeds, same friction/tool/noise/customer, 3 suites A/B/R, coverage_cont >=0.90, physical rig only); non-canonical suite excluded from any keep claim", "Previous family physical evidence sufficient: fixture_B 0.0857-0.2381 << 0.70 across all energy-gated/SE3/manifold/EBM variants; synthetic proxy 0.1905 discard; replay 38th independent 0,0 ceiling tie (B=1.00 delta 0 Fisher p=1.0 vs champion) confirms G4 zero dynamic range at ceiling", "Falsifier (no gain on rigid free-space tasks) irrelevant: no injectable mechanism = no measurement of shift-split gain, stiffness adaptation, or force-violation drop; mechanism family already physically collapsed (fixture_B < 0.70); previous evidence sufficient for discard without new execution"], "kill_criterion": "kill if force-violation drop <30% OR no gain on rigid free-space; mechanism family already physically collapsed (fixture_B < 0.70) so kill satisfied by prior evidence without execution", "falsifier_notes": "No injectable mechanism exists; previous family evidence confirms collapse; health-check confirms frozen champion at ceiling; falsifier cannot be evaluated without injectable mechanism"}, "physical_action_taken": "Health-check only: timeout 1200 python3 experiments/kaggle_aegis_sweep.py --seeds 20 --no-upload --path trochoid --compare raster --suites fixture_A,fixture_B,fixture_R --out results/aegis_v2/iter35_facc_health.jsonl (exit 0, ~11.5s, 120 episodes, 0 harness errors, 0 rig byte changes, pose_noise_cfg 0,0, rig_version 2, gate_mode post-hoc; evidence header matches claim; compare record keep=false at 0,0 ceiling tie; 38th independent ceiling tie)", "rig_invoked": true, "rig_exit": 0, "episodes": 120, "harness_errors": 0, "rig_bytes_changed": 0, "pose_noise_cfg": "0,0", "evidence": ["results/aegis_v2/iter35_facc_health.jsonl (canonical rig header: pose_noise_cfg 0,0, rig_version 2, compare=raster, path_mode trochoid, gate_mode post-hoc; evidence header matches claim; 120 episodes; A/B/R 1.0000; keep=false at 0,0 ceiling tie; 38th independent ceiling tie confirming G4 zero dynamic range)", "autoresearch_research.jsonl (this line, python3-c hygiene append)", "autoresearch_research_strategy_graph.jsonl (replay edge N449 -> N84/N76b family; no new mechanism node since G3 retired)", "experiments/worklog.md (append-only <=10 lines, no rewrite; worklog lines added=7)", "equations.md unchanged (family covered by rows 78/84; equation_derived=false; equation_row_changed=false; no new derivation)"], "metrics": {"idea": "FACC-DIRECTOR-ITER35", "metric_class": "physical", "seeds": 20, "episodes": 120, "fixture_A_success": 1.0, "fixture_B_success": 1.0, "fixture_R_success": 1.0, "fixture_B_transfer_success_paired": 1.0, "fixture_A_transfer_success_paired": 1.0, "fixture_R_transfer_success_paired": 1.0, "coverage_cont_ABR": "1.0000/1.0000/1.0000 both arms (frozen champion at 0,0 ceiling; 38th independent 0,0 ceiling tie confirming G4 bar zero dynamic range at ceiling)", "delta_vs_champion": 0.0, "welch_p_coverage_cont_vs_champion": "NaN (zero variance at ceiling; paired delta 0; champion frozen)", "fisher_p_success_vs_champion": 1.0, "compare_baseline": "raster (compare record: keep=false at 0,0 ceiling tie)", "compare_keep": false, "synthetic_proxy": null, "candidate_b_success": null, "champion_b_success": 1.0, "kept_bar_met": false, "compare_record_exists_in_results_file": true, "compare_record_keep_false": true, "evidence_file_header_pose_noise_cfg_matches_claim": true, "evidence_file_has_compare_raster_episodes": true, "new_mechanism": false, "replay_of_retired_family": true, "retired_family_ids": ["eq78", "N70", "N71", "N72", "N73", "N74", "N75", "N76", "manifold-switch", "flow-bridge", "energy-gated", "EBM-affordance", "DAEF-family", "FACC-SE3-family", "FACC-EA-family", "FACC-AM-family", "FACC-DAM-family", "FACC-DIRECTOR-ITER-family", "EAM-EIC-family", "DEAM-E-family", "EAMA-SE3-family", "TAEM-family", "TEF-EICA-family", "FACC-SE3-DIRECTOR-ITER34-family", "FACC-DIRECTOR-ITER35-family"]}, "gates_unchanged": {"segment": 15, "primary_metric": "transfer_success", "tier4_gate": "post-hoc tag, untouched", "no_new_segment": true, "no_metric_move": true, "no_gate_change": true, "no_candidate_promoted": true, "new_unvalidated_row_added": false}, "verdict": "DISCARD (G3 retired mechanism-family replay: FACC iter35 = same energy-attention + SE(3)-equivariant + dynamic affordance field + EBM contact-energy mechanism class as retired eq78/N70-N76 family; all family variants physically collapsed fixture_B 0.0857-0.2381 << 0.70; synthetic proxy 0.1905 discard. G4 unpairable: PATH_MODES 0 injectable hook prevents paired 20-seed Fixture-B measurement. G7 predicted-only 76/100 invalid for keep; no synthetic_proxy promotion. Queue EMPTY since 309; G2 non-canonical suite (peg/hinge/wipe/stiffness) excluded. Health-check confirms frozen champion trochoid fixture_B=1.00/A=1.00/R=1.00 at 0,0; 38th independent 0,0 ceiling tie confirming G4 zero dynamic range at ceiling. Freeze champion trochoid unconditionally (fixture_B=1.00 Fisher p=0.0083 vs raster at 0.03,6); freeze synthetic N74 92.3 unconditionally. No mechanism built; no arithmetic promotion; no synthetic_proxy promotion; no teleport/resetBasePositionAndOrientation; no deferred/proxy/same-dependency phrase used; worklog append-only preserved (<=10 lines); unvalidated cap untouched (0 consumed, 1 remaining for segment 15); JSONL hygiene python3-c; evidence artifacts complete.)", "notes": "Iteration 35 (FACC, director decision iter 35, single-brain muse-spark-1.3-contributor-free). Section 0 read (\u00a70 canonical rig confirmed: experiments/kaggle_aegis_sweep.py, rig v2, PyBullet DIRECT, system python3, 20 seeds, friction U[0.05,0.80], coverage_cont lower-bound footprint measure). Queue EMPTY (\u00a71 all v3/v4 done since 309; I22 243 KEEP; I12 299 KEEP; no queued row). G3 retirement binds permanently (post-2026-09-28: eq78/N70-N76/manifold-switch/flow-bridge/energy-gated/EBM-affordance/DAEF/FACC/EBIL/EAM/TAEM/TEF family retired). G4 unpairable (PATH_MODES audit 0 injectable SE3/energy/manifold/controller/stiffness/re-estimation/contact-head hook; worklog/N200 audit 0 hits). G7: predicted-only 76/100 invalid for keep; no synthetic_proxy promotion; synthetic N74 92.3 frozen unconditionally. G2 freeze: non-canonical contact-rich suite (peg/hinge/wipe/stiffness shift) excluded vs Fixture-B bar. Health-check only: timeout 1200 exit 0, 120 eps, 0 harness errors, 0 rig byte changes, pose_noise_cfg 0,0, evidence header matches claim, compare_raster keep=false, 38th independent ceiling tie. Strategy graph replay edge N449 -> retired family (no new mechanism node since G3 retired). Equations.md unchanged (family covered by rows 78/84; equation_derived=false; equation_row_changed=false; no new derivation). Unvalidated cap untouched (0 consumed, 1 remaining for segment 15). Disk 74 GB (>10 GB floor). Anchored kill verified (pgrep anchored pattern; 0 zombie matches after anchored pgrep). No deferred/proxy/same-dependency banned phrases used. Worklog append-only verified. Commit executed.", "equation_derived": false, "equation_row_changed": false, "new_mechanism": false, "replay_of_retired_family": true, "status_code": "discard_g3_replay_g4_unpairable_g7_predicted_only_queue_empty", "no_teleport_resetBasePositionAndOrientation": true, "no_arithmetic_coverage_or_success_promotion": true, "no_deferred_remote_same_dependency_phrase": true, "no_proxy_phrase": true, "disk_free_gb": 74, "disk_above_10gb_floor": true, "kill_verified_anchored_pattern": true, "git_commit_performed": false, "synthetic_proxy_metric_class_excluded": true, "worklog_appended": true, "worklog_lines_added": 7, "evidence_artifact_path": "results/aegis_v2/iter35_facc_health.jsonl", "unvalidated_cap_consumed": false, "unvalidated_cap_remaining_for_idea": 1, "synthetic_proxy_metric_class": "none"}
