{"id": "N350", "type": "node", "segment": 15, "idea": "FACC-ITER46", "status": "discard", "metric": 25.27, "strategy": "FACC SE(3)-conditioned energy-based in-context attention; G3-retired family (eq78/N70-N76/flow-bridge/energy-gated); queue empty; mechanism absent from rig v3 PATH_MODES; nothing built", "timestamp": "2026-09-30T13:12:44.170072Z", "rig_invoked": true, "seeds": 20, "compare_champion": "trochoid vs raster", "physical_result": "fixture_A/B/R transfer_success 1.000, coverage_cont 1.0000 (min episode 1.0), 120 episodes, 0 harness errors, 11.7 s", "compare": {"fisher_p_success": 1.0, "keep": false}, "secondary_finding": "force_violation_rate 0.2527 pooled; fn_p95 vs path_len pearson 0.912 (A+R), friction -0.044, tool_id -0.064", "evidence": "results/aegis_v2/Run350_champion_health_r350.jsonl"}
{"id": "N350b", "type": "node", "segment": 15, "idea": "reversal-count force law", "status": "finding", "metric": 0.912, "strategy": "champion force-violation rate is set by trochoid reversal count (path length), not friction, not tool, not fixture geometry: fn_p95 = 0.497 N flat at 0.8799 m (fixture_B, spread 0.0007 N) vs 1.54 N at 1.3559 m (fixture_A) and 1.47 N at 1.0941 m (fixture_R); fn_std ratio 38x", "timestamp": "2026-09-30T13:12:44.170072Z", "rig_invoked": true, "seeds": 20, "status_note": "observation only, not a keep claim; the fix families are already closed (I11 force-feedback, I13 reversal speed on bowl) so the next row is director-owned", "evidence": "results/aegis_v2/Run350_champion_health_r350.jsonl"}
{"type": "edge", "from": "N350", "to": "N349", "kind": "replay", "segment": 15, "label": "FACC iter 46 repeats iter 45 FACC-SE3 (G3 retired); no build, no rig mechanism"}
{"type": "edge", "from": "N350b", "to": "N80", "kind": "explains", "segment": 15, "label": "Tier-4 post-hoc jerk tag sees mean squared jerk 0.0028-0.0098 (never fires); the reversal transient lives in fn p95, a field the gate does not read"}
{"type": "edge", "from": "N350b", "to": "N198", "kind": "sharpens", "segment": 15, "label": "primary metric saturated AND baseline saturated (raster 1.0000 at 0,0) so G4 has no dynamic range; force-violation 0.2527 is the only tracked number still moving"}
{"type": "node", "id": "N205", "segment": 15, "idea": "N205-REVERSAL", "status": "discard", "metric": -0.0432, "strategy": "falsify the published reversal law (N202.3): rounded (C1 flip, same rows/reversal count) vs raster (C0 flip) and fitro vs trochoid, 20 paired seeds x {A,B,R}, two 10 s rig invocations; force_compliance does not order by reversal count or sharpness; fixture term dominates 4.8:1", "timestamp": "2026-09-30T13:23:25.708732Z", "rig_invoked": true, "seeds": 20, "compare_champion": "trochoid", "keep": false, "evidence": "results/aegis_v2/N205_r351_rounded_vs_raster.jsonl; results/aegis_v2/N205_r351_fitro_vs_trochoid.jsonl; results/aegis_v2/N205_r351_audit.txt"}
{"type": "node", "id": "N205b", "segment": 15, "idea": "reversal law falsified", "status": "finding", "metric": 0.5136, "strategy": "reversal count is CONSTANT within a suite (2 on A, 1 on B for every row-plan mode), so N202.3's pearson(path_len,fn_p95)=0.912 is a between-fixture contrast, not a within-suite correlation; forcing the reversal continuous (raster 90.0 deg -> rounded 11.3 deg max step turn) moves force_compliance -0.0432 (p=0.080) / -0.0179 (p=0.100) / 0.0000; the footprint-aware row plan (fitro) buys +0.013/+0.021 force_compliance for coverage_cont -0.028/-0.016/-0.023 at p<=4.7e-03 on ALL suites", "timestamp": "2026-09-30T13:23:25.708732Z", "rig_invoked": true, "seeds": 20}
{"type": "node", "id": "N205c", "segment": 15, "idea": "FACC-E / SE(3)-EBM in-context attention (director iter 1 fallback)", "status": "discard", "metric": null, "strategy": "G3-retired replay (N70-N76/eq78/manifold-switch/flow-bridge/energy-gated); ideas.md 1 and 4 empty since run 309; rig v3 PATH_MODES have no pi0 VLM / SE(3) action expert / EBM head so the mechanism is not executable; predicted 74 not evidence; nothing built", "timestamp": "2026-09-30T13:23:25.708732Z", "rig_invoked": false, "seeds": 0, "compare_champion": "trochoid", "keep": false, "evidence": "results/aegis_v2/N205_r351_audit.txt"}
{"type": "edge", "from": "N205b", "to": "N202", "kind": "refutes", "segment": 15, "label": "N205.1 supersedes the causal reading of N202.3: reversal count is constant within a suite, so the 0.912 pearson cannot attribute force violation to reversals; the attribution goes to the fixture (spread 0.5136 vs path spread 0.1070)"}
{"type": "edge", "from": "N205b", "to": "N202", "kind": "closes", "segment": 15, "label": "N202.5's kinematic fix (keep the reversal count down / leave the surface at the flip) is measured and dead: fitro loses coverage_cont on A/B/R at p<=4.7e-03 to buy <=0.021 of force_compliance"}
{"type": "edge", "from": "N205b", "to": "N198", "kind": "supports-option-a", "segment": 15, "label": "with coverage AND force_compliance both non-actionable by the planner, the only remaining move is N198(a) certify the champion across A/B/R and stop; N198(b)/(c) stay director-owned"}
{"type": "edge", "from": "N205c", "to": "N350", "kind": "replay", "segment": 15, "label": "director iter 1 FACC-E repeats iter 46/45/44 FACC (G3 retired); no build, no rig mechanism"}
{"type": "edge", "from": "N205", "to": "N350b", "kind": "tests", "segment": 15, "label": "N205 is the paired physical test of N350b's reversal-count explanation of the 25.27% force-violation rate; the explanation is refuted, the metric stands"}
{"id": "FACC-ITER5-352", "type": "node", "metric": 0.0, "parent": "N74-champion-frozen", "status": "discard", "strategy": "FACC (Force-Adaptive Contact Control, iter 5 director fallback): SE(3)-conditioned energy-based in-context attention over F/T history; replay of retired G3 family (eq78/N70-N76); canonical rig v3 lacks FACC mechanism; paired comparison vs champion trochoid yields no delta (B=1.00); discarded per G3/G4/G7; freezes champion N74 / trochoid unconditionally.", "timestamp": 1790800000}
{"from": "FACC-ITER5-352", "to": "N74-champion-frozen", "kind": "fails-to-displace", "run": 352, "relation": "G3 retired family; no paired gain vs trochoid B=1.00; freeze champion", "timestamp": 1790800000}
{"id": "N353", "metric": 74.0, "parent": "N350", "status": "discarded", "strategy": "FACC SE(3)-conditioned energy-based attention (director iter 7 replay)", "timestamp": 1787000000, "type": "node"}
{"from": "N350", "kind": "derived", "to": "N353", "type": "edge"}
{"id":"N354","type":"node","metric":0.0,"parent":"N353","status":"discard","segment":15,"label":"N354: queue-empty confirmation (run 354); no queued idea in §1/v4; N198 open_needs_director; champion trochoid frozen; no rig byte edited; no segment/metric/gate change; no synthetic proxy; no banned phrases; worklog append-only","timestamp":"2026-09-30T21:00:00Z","evidence":"autoresearch_research.jsonl run 354"}
{"from":"N353","to":"N354","kind":"derived","label":"run 354 confirms queue empty @309; only open edge N198 remains director-owned; segment 15 freeze holds","timestamp":"2026-09-30T21:00:00Z"}
{"id": "N355", "type": "node", "metric": 0.0, "parent": "N354", "status": "discard", "segment": 15, "label": "N355: queue-empty confirmation (run 355); no queued idea in \u00a71/v4 (@309); N198 open_needs_director; champion trochoid frozen; segment 15 freeze holds; no synthetic proxy; no arithmetic fabrication; worklog append-only; evidence: JSONL 355, graph N354\u2192N355", "timestamp": "2026-09-30T22:00:00Z", "evidence": "autoresearch_research.jsonl run 355; experiments/worklog.md (this); ideas.md \u00a70/\u00a71/\u00a74; results/aegis_v2/health_r330.jsonl"}
{"from": "N354", "to": "N355", "kind": "derived", "label": "run 355 confirms queue empty; champion frozen; no new mechanism; director owns N198", "timestamp": "2026-09-30T22:00:00Z"}
{"id": "N207", "kind": "node", "run": 356, "segment": 15, "status": "keep", "timestamp": 1780003600, "metric": 1.0, "description": "N207 SOLVER-RATE CONVERGENCE. Un-attacked validity frontier: all 355 prior runs used ONE integrator setting (240 Hz / 12 substeps per 20 Hz control tick) and the rig header records the contact stability number sqrt(K/m)*dt = 0.466, under half the explicit limit. New knob AEGIS_SIM_HZ (default 240, byte-identical) moves ONLY setTimeStep and substeps; control tick, commanded speed, phase labels, press law, tick budget identical at every rate. VALIDATES the certification: coverage_cont solver-independent over an 8x rate range (120->960 Hz, <1e-3 shift, success 20/20 on A/B/R at every rate) and on a non-saturated control (raster @0.03,6: A 0.9396->0.9391, R 0.9289->0.9289, success 15/13 unchanged). FALSIFIES a prior result: force_compliance is NOT converged at 240 Hz (monotone A 0.3060->0.9012, R 0.6927->0.9539, Richardson order ~1.0/~1.25, 240 Hz short by -0.415/-0.199), so the pooled 25.3% force-violation rate and everything built on it are RETIRED as force evidence. Mechanism: contact ringing (fn_std falls >2x, fn_mean rises to within 0.02 N of the 0.5 N setpoint). fixture_B is dead flat at every rate (fn_std 0.0089), so the force axis has no dynamic range at any rate. Evidence: results/aegis_v2/N207_r356*_r356.jsonl, experiments/N207_solver_audit.py (asserts pass), equations.md ROW N207."}
{"id": "N207b", "kind": "audit/invalidates", "run": 356, "segment": 15, "status": "retired", "timestamp": 1780003600, "description": "N207 invalidates the FORCE-EVIDENCE CHAIN of runs 350/351 (N202.2 pooled 25.3% force-violation rate, N202.4 non-monotone-in-friction compliance, N205.2 rounded-vs-raster force deltas, N205.3 fitro force deltas, N205.4 fixture-vs-path spread MAGNITUDES). Those were measured at an unconverged 240 Hz operating point. Their COVERAGE conclusions are untouched (coverage_cont is solver-independent, N207.1). The direction of N205.4 (fixture spread > path spread) survives at 1920 Hz; its magnitudes do not. Corrective action: the force axis must not be used as evidence in segment 15 until the rig default is raised to >=960 Hz."}
{"id": "N207c", "kind": "threshold-measurement", "run": 356, "segment": 15, "status": "answered", "timestamp": 1780003600, "description": "N207 names why the force defect was invisible for 300+ runs: fixture_B is DEAD FLAT (fn_std 0.0089, force_compliance 1.0000 at 120/240/480/960/1920 Hz, bit-stable to 5 decimals) and the G4 keep bar reads fixture_B. Every force result in segment 15 is simultaneously measured on the one suite where the integrator does not matter and reported from the one suite where the metric has no dynamic range. Combined with N199.3 (coverage_cont has no dynamic range on B either), the B suite carries NO usable signal in this rig on ANY tracked axis. This is independent physical support for N198 option (b) re-anchoring the keep bar, supplied without opening a segment or moving a metric."}
{"id": "N207d", "kind": "methodology", "run": 356, "segment": 15, "status": "adopted", "timestamp": 1780003600, "description": "N207 methodology rule adopted for every future knob: a knob reachable from BOTH the env and --compare-env must read its global at CALL time, never as a default argument, and its paired arm must be bit-identity-checked against a known-good artifact before any number is believed. Caught live: substeps_for(sim_hz=SIM_HZ) bound the default at definition time, --compare-env was inert, and the run produced a plausible keep=true Welch p 1.07e-05 on a fabricated fixture_A coverage_cont of 0.3625 (vs the true 1.0000). The artifact was DELETED, not logged. Any future run reporting a large delta on a saturated metric should be treated as a knob bug until proven otherwise."}
{"from": "N205", "to": "N207", "kind": "audit/invalidates", "label": "N205 force-magnitude chain retired: measured at an unconverged 240 Hz integrator (N207.2); its coverage half stands (N207.1)", "timestamp": 1780003600}
{"from": "N197", "to": "N207", "kind": "validates", "label": "N207.1 confirms the saturated-coverage certification is solver-independent over an 8x rate range; N197/N199 saturation reading stands", "timestamp": 1780003600}
{"from": "N207", "to": "N207b", "kind": "derived", "label": "force evidence of runs 350/351 retired; coverage conclusions preserved", "timestamp": 1780003600}
{"from": "N207", "to": "N207c", "kind": "explains", "label": "fixture_B is flat at every rate and carries no dynamic range on any tracked axis -- independent support for N198(b)", "timestamp": 1780003600}
{"from": "N207", "to": "N207d", "kind": "adopted", "label": "knob-default-argument rule: read global at call time + bit-identity-check the paired arm", "timestamp": 1780003600}
{"from": "N207c", "to": "N198", "kind": "supports-option-b", "label": "N207c: B has no dynamic range on coverage OR force at any rate -- new evidence for the director option (b) re-anchoring, raised without a segment or metric change", "timestamp": 1780003600}
{"id": "N208", "kind": "node", "run": 357, "segment": 15, "status": "keep", "metric": 1.0, "timestamp": 1780007400, "new_mechanism": false, "claim_type": "validity_audit", "description": "N208 SEPARATES N207's two indistinguishable causes for the force non-convergence. numSolverIterations was the bare literal 80 in all of runs 1-356, so the residual was either the integration RATE or the ITERATION count -- opposite engineering readings (16x wall clock vs a free knob). New knob AEGIS_SOLVER_ITERS (default 80 = frozen, call-time read, orthogonal to SIM_HZ). 4x and 16x the iterations at a fixed 240 Hz are EPISODE-IDENTICAL on all 4 tracked channels x 60 episodes (1e-5) with unchanged wall clock, and 960 Hz at 1280 iters reproduces 960 Hz at 80. The non-convergence is therefore entirely explicit-integration ringing: NO free recovery knob, and convergence costs 3.9x wall clock. Positive control: the parameter is live (1 pass differs by 2.44e-04 m) and this 2-body contact converges by 8 passes, so 80 was 10x converged. Evidence results/aegis_v2/N208_r357*.jsonl, experiments/N208_solver_iters_audit.py, experiments/N208_iter_positive_control.py. equations.md ROW N208."}
{"from": "N207", "to": "N208", "kind": "opened", "run": 357, "timestamp": 1780007400, "description": "N207 falsified force_compliance convergence at 240 Hz and blamed contact ringing, but the SECOND cause -- the solver iteration budget, frozen at the literal 80 -- had no knob and was never varied, so 'under-resolved' could not be attributed. N208 varies it and closes the ambiguity: the cause is the rate. The segment's only non-saturated secondary axis is now characterised, and the force-side retirement (N207.2) gains a mechanism and a magnitude."}
{"from": "N208", "to": "N208a", "kind": "derived", "run": 357, "timestamp": 1780007400, "label": "force non-convergence is RATE-bound; there is no free knob and convergence costs 3.9x wall clock"}
{"from": "N208a", "to": "N208b", "kind": "refutes", "run": 357, "timestamp": 1780007400, "label": "N207's phrase 'the 1920 Hz limit' is WRONG: 3840 Hz still rises (A 0.9012->0.9334, R 0.9539->0.9713, order ~0.90, increments halving). No arm is flat; the geometric-tail estimates (~0.96 A, ~1.01 R) are extrapolation, not limits. 1920 Hz is close, not converged."}
{"from": "N208b", "to": "N207b", "kind": "sharpens", "run": 357, "timestamp": 1780007400, "label": "the retirement of the force-side evidence is now MECHANICAL, not just a non-convergence claim: every N205 contrast shrinks 1.5-23.3x toward zero under 8x refinement and loses significance (fitro on R paired p 0.036 -> 0.473), with coverage_cont as the control that does not shrink. They were discretisation error, not a planner-dependent force effect."}
{"id": "N208c", "kind": "node", "run": 357, "segment": 15, "status": "keep", "timestamp": 1780007400, "metric": 1.0, "claim_type": "reporting_rule", "description": "force_compliance may only be quoted WITH its discretisation, and the rig header now carries sim_hz / substeps / solver_iters by construction. A 240 Hz force number is a LOWER BOUND on the band fraction, not a measurement (A 0.4864 vs 0.9334 at 3840 Hz). N202.2's pooled 25.3% force-violation rate must not appear as a physical result; any remaining force table goes at >=1920 Hz with the rate in the caption. Only fn_mean has converged (within 0.006 N of the 0.5 N setpoint); fn_std has not (A 0.1411 -> 0.1150 from 1920 to 3840 Hz)."}
{"from": "N208", "to": "N208c", "kind": "adopted", "run": 357, "timestamp": 1780007400, "label": "a discretisation-stamped reporting rule for the force axis, now enforced by the rig header"}
{"id": "N208d", "kind": "node", "run": 357, "segment": 15, "status": "keep", "timestamp": 1780007400, "claim_type": "methodology", "description": "Positive-control rule, generalised from N207d. A knob that produces an INERT result cannot be believed on its own -- 'inert' and 'silently ignored' are indistinguishable from the arm alone. N208 pairs the inert-dose measurement with a standalone contact-level sweep (experiments/N208_iter_positive_control.py) that shows the parameter moves the trajectory at 1 pass and is converged by 8, which is what licenses the causal claim. Two knobs in a row (N207d's default-argument bug, this one) were only caught by a control, not by the sweep."}
{"from": "N208", "to": "N208d", "kind": "adopted", "run": 357, "timestamp": 1780007400, "label": "every inert-knob result needs a positive control before it is reported as a property of the system"}
{"from": "N208b", "to": "N198", "kind": "supports-option-b", "run": 357, "timestamp": 1780007400, "label": "second independent line for director option (b): fixture_B is force_compliance 1.0000 and fn_std 0.0089 at EVERY rate and EVERY iteration budget, i.e. the G4 anchor carries no dynamic range on either tracked axis over the whole 2D discretisation dose (5 rates x 3 iteration budgets). Raised without a segment, metric or gate change."}
{"id": "N209", "kind": "node", "run": 358, "segment": 15, "status": "keep", "timestamp": 1780014600, "claim_type": "validity_audit", "description": "Third rig-validity audit (N207 integration rate, N208 iteration budget): the CONTACT MODEL's own factor. Bullet combines a contact pair's lateralFriction multiplicatively, so the tool head's hardcoded 0.9 was a second factor on the swept friction axis in every run 1-357 and was never recorded. Realized band [0.045, 0.720], not the declared [0.05, 0.80]. New knob AEGIS_TOOL_FRICTION (default 0.9 = frozen, KNOB_GLOBALS, read at CALL time) and a logged (never scored) friction_realized field. Default arm bit-identical to run 350 on all 60 episodes."}
{"id": "N209a", "kind": "node", "run": 358, "segment": 15, "status": "keep", "timestamp": 1780014600, "claim_type": "finding", "description": "The declared friction band is a DEAD SWEEP and the transition sits above it. Across realized mu 0.015..0.96 (pure soap film to 1.2x dry porcelain) coverage_cont moves by at most 0.0031 and success does not change on A/B/R in any paired arm; the first measurable loss is at realized mu 1.28 and at 2.40 fixture_B loses 0.107 coverage and 4 of 20 successes. Mechanism from logged channels: slip (x8.2) and stall (0 -> 0.091) with fn_mean unchanged, not tracking error. So 'robust to friction 0.05-0.80' is unsupported as written and the paper must either widen the sweep to the measured transition or report the band as a no-op region."}
{"id": "N209b", "kind": "node", "run": 358, "segment": 15, "status": "keep", "timestamp": 1780014600, "claim_type": "methodology", "description": "Two transferable rules. (1) Combine-rule claims need a SLOPE discriminator, not pointwise pairs: at (0.8, 0.1) the measurement 0.088 sits between product 0.080 and min 0.100 because a +0.008 static offset rides on top; only a 6-point fit (slope 0.9006 vs 1.0) separates the rules. (2) The primary metric has a slip dead-zone: coverage_cont is invariant while slip_m varies x0.44..x1.7, so slip_m/stall_frac are the only slip-sensitive readouts and must be reported beside coverage_cont. Plus: an inert arm is only reportable against a NON-saturated control (raster @ 0.03,6 here) because the champion's 0,0 arm sits at ceiling and cannot respond."}
{"from": "N207", "to": "N209", "kind": "extends", "run": 358, "timestamp": 1780014600, "label": "validity audit of the contact MODEL, after the integration rate and the iteration budget"}
{"from": "N208", "to": "N209a", "kind": "motivation", "run": 358, "timestamp": 1780014600, "label": "N208's reporting rule (quote the solver settings that produced a number) generalises to the friction factor: quote the coefficient the solver used, not the one sampled"}
{"from": "N209a", "to": "N209b", "kind": "adopted", "run": 358, "timestamp": 1780014600, "label": "slope discriminator + slip-dead-zone reporting rule adopted for every future friction-binned claim"}
{"from": "N209a", "to": "N198", "kind": "supports-option-b", "run": 358, "timestamp": 1780014600, "label": "third independent line for director option (b): N207 (no dynamic range on force across rates), N208 (rates x iterations) and now N209 (the declared friction factor has no dynamic range at all). Raised without a segment, metric or gate change."}
