{"run": 334, "idea_id": "FACC-ITER28-DIRECTOR", "idea": "FACC (SE(3)-conditioned Force-Adaptive Contact Control; EBM + SE(3) error condition; flow-match replacement)", "segment": 15, "status": "discard", "metric": "transfer_success", "timestamp": "2026-09-30T17:56:00Z", "rig": "experiments/kaggle_aegis_sweep.py (NOT invoked \u2014 idea not queued; G3 retired family eq78/N76; director proposal rejected; no CLI execution)", "compare_champion": "trochoid", "compare": null, "seeds_run": 0, "fixture_A_transfer_success": null, "fixture_B_transfer_success": null, "fixture_R_transfer_success": null, "coverage_cont": null, "p_value_fisher": null, "p_value_welch": null, "metrics": {"idea": "FACC-ITER28-DIRECTOR", "physical": false, "rig_invoked": false, "fixture_B_transfer_success": null, "fixture_A_transfer_success": null, "fixture_R_transfer_success": null, "coverage_cont": null, "seeds": 0, "g3_retired_family": true, "g7_predicted_only_banned": true, "g4_paired_missing": true, "compare_keep": false, "notes": "Proposal matches retired eq78/FACC family (N76, FACC-AM, SEAF-FACC, ITER28 confirm discard 0.1905). Runs 331 (FACC-SE4), 332 (FACC-SE3+ECA), 333 (AEF-Flow) all discard; no new queued idea per \u00a71 (all done at run 309). Synthetic 76pt KEEP unverified; physical rig not invoked; no arithmetic fabrication; banned phrases absent; disk >10GB; no remote-GPU claim.", "reference_artifacts": ["results/aegis_v2/FACC_decision_r312.jsonl", "results/aegis_v2/ITER28_FACC_CONFIRM.jsonl", "autoresearch_research.jsonl:331-333", "results/aegis_v2/AEF-Flow_333.jsonl"]}}
{"run": 335, "idea_id": "FACC-SE3", "idea": "FACC-SE3 \u2014 Force-Adaptive Contact Control / SE(3)-conditioned energy-based in-context attention (director iter 29, single-brain fallback: opencode-responses/muse-spark-1.3-contributor-free)", "segment": 15, "status": "discard", "metric": "transfer_success", "timestamp": "2026-09-30T17:57:00Z", "rig": "python3 experiments/kaggle_aegis_sweep.py (NOT invoked \u2014 replay of retired G3 eq78/FACC family; no queued \u00a71 idea exists (all done at run 309); no SE(3)-equivariant affordance-flow / force-energy attention / flow-match p(a|o,F,demo) mechanism mapped to scripted rig v3; same family runs 331/332/333/334 discard confirmed)", "compare_champion": "trochoid (fixture_B 1.00, Fisher p=0.0083 vs raster; frozen champion)", "compare": {"compare_champion": "trochoid", "compare_keep": false, "fixture_A_transfer_success": null, "fixture_B_transfer_success": null, "fixture_R_transfer_success": null, "coverage_cont": null, "p_welch_coverage": null, "p_fisher_success": null, "seeds": 0, "physical": true, "rig_invoked": false}, "metrics": {"idea": "FACC-SE3", "fixture_A": null, "fixture_B": null, "fixture_R": null, "fixture_B_transfer_success": null, "coverage_cont": null, "p_welch_coverage": null, "p_fisher_success": null, "seeds": 0, "physical": true, "rig_invoked": false, "g3_retired_family": true, "g7_predicted_only_banned": true, "g4_unpairable": true, "queue_empty": true, "rig_edited": false, "synthetic_proxy_used": false, "predicted_score_unverified": "74 +/-4 (unverified, banned as keep)", "banned_phrases_checked": true, "disk_gb_free": ">10"}, "seeds_run": 0, "fixture_A_transfer_success": null, "fixture_B_transfer_success": null, "fixture_R_transfer_success": null, "coverage_cont": null, "p_value_fisher": null, "p_value_welch": null, "physical_rig_invoked": false, "rig_health_seeds": 20, "rig_health_fixture_B": 1.0, "rig_health_coverage_cont": 1.0, "synthetic_proxy_used_for_keep": false, "g3_retired_family": true, "g7_predicted_only_banned": true, "g4_paired_missing": true, "compare_keep": false, "notes": "Ponytail / lazy: skipped build (YAGNI; rung 1 \u2014 speculative need; rung 2 \u2014 stdlib/rig does not contain SE3-conditioned EBM attention; rung 4 \u2014 already installed rig v3 does not solve; rung 5 \u2014 one line = skip replay). Director proposal iter 29 (Run335 FACC-SE3) predicts 74 +/-4 B; mechanism requires pi0 backbone swap + SE(3) energy expert \u2014 absent. Replay of runs 331-334 (FACC family discard); N198 open_needs_director (certify/re-anchor/close) \u2014 worker does not open new segment, change primary metric, or alter gate. No 'remote GPU deferred' / 'deferred to remote GPU' / 'same dependency' phrases. No synthetic proxy (benchmarks/restroom_sim.py excluded). No teleport (resetBasePositionAndOrientation absent). No arithmetic coverage/success fabrication. Timeout 1200 / anchored kill not needed (no sweep launched). Unvalidated cap untouched (not a screening; replay rejected). Evidence artifacts: results/aegis_v2/FACC_decision_r312.jsonl, ITER28_FACC_CONFIRM, 331-334 JSONLs, N198_r310_open.", "evidence_artifacts": ["autoresearch_research.jsonl runs 331-334 (FACC-SE3/FACC-SE4/AEF-Flow/ITER28 discard; same family); run 335 appended", "autoresearch_research.ideas.md \u00a70 \u00a71 \u00a74 (queue empty at 309; N198 open_needs_director; G3 retired eq78/N70-N76)", "autoresearch_research_strategy_graph.jsonl nodes/edges 331-334 + 335", "results/aegis_v2/Run335_FACC-SE3_r335.jsonl (this file)", "results/aegis_v2/health_r330.jsonl (trochoid B=1.00 cov=1.0000 champion frozen)"]}
{"run": 336, "idea": "EE-FACC \u2014 Energy-based SE(3)-conditioned Force-Adaptive Contact Control (iter 30, director single-brain fallback opencode-responses/muse-spark-1.3-contributor-free)", "status": "discard", "timestamp": 1787000100, "metrics": {"idea": "EE-FACC", "run": 336, "fixture_A_transfer_success": null, "fixture_B_transfer_success": null, "fixture_R_transfer_success": null, "coverage_cont": null, "compare_keep": false, "p_value_coverage": null, "p_value_fisher": null, "rig_invoked": false, "g3_retired": true, "synthetic_proxy_used": false, "evidence_file": "none \u2014 family retired (G3); no fixture-B paired artifact", "note": "Retired family: manifold-switch/flow-bridge/energy-gated (N70-N76, eq78). Runs 333-335 discard. No queued idea \u00a71 (309 close). No rig path for EBM head swap; synthetic proxy excluded (G2/G7)."}, "compare": {"champion": "trochoid", "keep": false, "welch_p_coverage": null, "fisher_p_success": null, "seeds": 0, "fixture_B_transfer_success": null}}
{"run": 337, "idea_id": "FACC-ITER31", "idea": "Force-Adaptive Contact Control \u2014 SE(3) contact-conditioned residual policy / EBM attention (iter 31 director proposal; opencode-responses/muse-spark-1.3-contributor-free fallback)", "segment": 15, "status": "discard", "metric": "transfer_success", "timestamp": "2026-09-30T12:30:22Z", "rig": "experiments/kaggle_aegis_sweep.py NOT invoked \u2014 no queued idea (\u00a71 all done @309); G3 retired eq78/N70-N76; mechanism (pi0 frozen backbone + SE(3) EBM head swap / flow-match replacement) absent from scripted rig v3; replay of 331-336 FACC-family discard; no CLI execution; timeout 1200 not triggered; anchored kill not needed", "compare_champion": "trochoid (fixture_B 1.00, Fisher p=0.0083 vs raster; frozen champion per G2/G4)", "compare": {"compare_champion": "trochoid", "compare_keep": false, "fixture_A_transfer_success": null, "fixture_B_transfer_success": null, "fixture_R_transfer_success": null, "coverage_cont": null, "p_welch_coverage": null, "p_fisher_success": null, "seeds": 0, "physical": true, "rig_invoked": false, "g3_retired_family": true, "g4_paired_missing": true, "g7_predicted_banned": true}, "seeds_run": 0, "fixture_A_transfer_success": null, "fixture_B_transfer_success": null, "fixture_R_transfer_success": null, "coverage_cont": null, "p_value_fisher": null, "p_value_welch": null, "metrics": {"idea": "FACC-ITER31", "physical": false, "rig_invoked": false, "fixture_B_transfer_success": null, "fixture_A_transfer_success": null, "fixture_R_transfer_success": null, "coverage_cont": null, "p_welch_coverage": null, "p_fisher_success": null, "seeds": 0, "g3_retired_family": true, "g7_predicted_only_banned": true, "g4_unpairable": true, "queue_empty": true, "rig_edited": false, "synthetic_proxy_used": false, "banned_phrases_checked": true, "disk_gb_free": ">10", "predicted_score_unverified": "74 +/-4 (unverified, banned as keep; no fixture-B artifact)", "notes": "Ponytail lazy: rung 1 (speculative need \u2014 no queued \u00a71 idea; mechanism requires pi0 VLM + SE(3) EBM not in rig); rung 4 (installed rig v3 does not solve); rung 5 (skip build \u2014 replay of discarded family). G3 retired family eq78/manifold-switch/flow-bridge/energy-gated (N70-N76, FACC-AM, SEAF-FACC) confirmed by runs 331 (FACC-SE4 discard), 332 (FACC-SE3+ECA discard), 333 (AEF-Flow discard), 334 (ITER28 discard), 335 (FACC-SE3 replay discard), 336 (EE-FACC discard). Director prediction 74pts not verified; no arithmetic fabrication of coverage/success; no teleport; no synthetic proxy (benchmarks/restroom_sim.py excluded). Worklog append-only. No remote-GPU deferred phrase. Clean exit.", "evidence_artifacts": ["autoresearch_research.jsonl runs 331-336 (FACC family all discard)", "autoresearch_research.ideas.md \u00a70 (no queued @309) \u00a71 (v4 queue all done) \u00a74 (I22 CLOSE)", "results/aegis_v2/FACC_decision_r312.jsonl", "results/aegis_v2/ITER28_FACC_CONFIRM.jsonl", "results/aegis_v2/Run335_FACC-SE3_r335.jsonl", "results/aegis_v2/Run336_EE-FACC_r336.jsonl", "results/aegis_v2/health_r330.jsonl (trochoid B=1.00, Fisher p=0.0083)"]}}
{"run": 338, "idea_id": "FACC-ITER32", "idea": "Force-Adaptive Contact Control / SE(3)-conditioned energy-based in-context attention (iter 32, single-brain fallback: opencode-responses/muse-spark-1.3-contributor-free)", "segment": 15, "status": "discard", "metric": "transfer_success", "timestamp": "2026-09-30T18:01:00Z", "rig": "experiments/kaggle_aegis_sweep.py NOT invoked \u2014 queue \u00a71 empty (@309); N198 open_needs_director; G3 retired eq78/N70-N76/family; mechanism (pi0 frozen backbone + SE(3) EBM head / flow-match swap) absent from scripted rig v3; replay of 331-337 FACC-family discard; no CLI; timeout 1200 not triggered", "compare_champion": "trochoid (fixture_B 1.00, Fisher p=0.0083 vs raster; champion frozen per G2/G4)", "compare": {"compare_champion": "trochoid", "compare_keep": false, "fixture_A_transfer_success": null, "fixture_B_transfer_success": null, "fixture_R_transfer_success": null, "coverage_cont": null, "p_welch_coverage": null, "p_fisher_success": null, "seeds": 0, "physical": true, "rig_invoked": false}, "metrics": {"idea": "FACC-ITER32", "fixture_A": null, "fixture_B": null, "fixture_R": null, "fixture_B_transfer_success": null, "coverage_cont": null, "p_welch_coverage": null, "p_fisher_success": null, "seeds": 0, "physical": true, "rig_invoked": false, "g3_retired_family": true, "g4_paired_missing": true, "queue_empty": true, "rig_edited": false, "synthetic_proxy_used": false, "banned_phrases_checked": true, "disk_gb_free": ">10", "predicted_score_unverified": "74 +/-4 (unverified, banned as keep)", "notes": "Ponytail lazy: rung 1 speculative (no queued idea; mechanism requires pi0 VLM + SE(3) EBM absent); rung 4 installed rig v3 does not solve; rung 5 skip build \u2014 replay rejected. No remote-GPU deferred / deferred-to-remote-GPU / same-dependency phrases. No synthetic proxy (benchmarks/restroom_sim.py excluded). No teleport (resetBasePositionAndOrientation absent). No arithmetic coverage/success fabrication. Anchored kill (^python3 .*kaggle_aegis_sweep\\.py) executed (none mounted). Unvalidated cap untouched (replay, not screening). Evidence artifacts: autoresearch_research.jsonl 331-337; strategies graph; results/aegis_v2/Run338; worklog append."}, "seeds_run": 0, "fixture_A_transfer_success": null, "fixture_B_transfer_success": null, "fixture_R_transfer_success": null, "coverage_cont": null, "p_value_fisher": null, "p_value_welch": null, "physical_rig_invoked": false, "rig_health_seeds": 20, "rig_health_fixture_B": 1.0, "rig_health_coverage_cont": 1.0, "synthetic_proxy_used_for_keep": false, "g3_retired_family": true, "g7_predicted_only_banned": true, "g4_paired_missing": true, "compare_keep": false, "notes": "Iter 32 (single-brain FACC-E): discard replay. Queue \u00a71 empty at 309; N198 open_needs_director (director must choose a/b/c). No new segment. No metric change. No gate change. Worklog append-only (10 lines max)."}
{"run": 339, "idea": "FACC-E", "status": "discard", "timestamp": "2026-09-30T18:07:00Z", "metrics": {"idea": "FACC-E", "fixture_B_transfer_success": 1.0, "fixture_B_coverage_cont_mean": 1.0, "fixture_B_n_seeds": 20, "fixture_B_succ_a": 20, "fixture_B_succ_b": 20, "compare_candidate": "trochoid", "compare_baseline": "trochoid[AEGIS_RESIDUAL_ACTIVE=0,AEGIS_FORCE_PI=0]", "compare_fisher_p": 1.0, "compare_welch_p": null, "compare_keep": false, "rig_file": "results/aegis_v2/facc_e_r339.jsonl", "physical": true, "synthetic_proxy": false}, "compare": {"candidate": "trochoid", "baseline": "trochoid[AEGIS_RESIDUAL_ACTIVE=0,AEGIS_FORCE_PI=0]", "fixture_B": {"n_a": 20, "n_b": 20, "mean_a": 1.0, "mean_b": 1.0, "delta": 0.0, "succ_a": 20, "succ_b": 20, "fisher_p": 1.0, "welch_p": null, "keep": false}}}
{"run": 340, "idea_id": "FACC-ITER36", "idea": "Force-Adaptive Contact Control \u2014 SE(3)-conditioned EBM policy head / affordance-equivalence score + force residual (director iter 36; single-brain fallback opencode-responses/muse-spark-1.3-contributor-free)", "segment": 15, "status": "discard", "metric": "transfer_success", "timestamp": 1790771983, "rig": "python3 experiments/kaggle_aegis_sweep.py NOT invoked \u2014 replay of retired G3 eq78/N70-N76/manifold-switch/flow-bridge/energy-gated family; queue \u00a71 empty (@309); no SE(3)-equivariant affordance-flow / force-energy attention / pi0 flow-match replacement mapped to scripted rig v3 PATH_MODES; mechanism requires backbone swap absent", "compare_champion": "trochoid (fixture_B 1.00, Fisher p=0.0083 vs raster; frozen champion per G2/G4)", "compare": {"compare_champion": "trochoid", "compare_keep": false, "fixture_A_transfer_success": null, "fixture_B_transfer_success": null, "fixture_R_transfer_success": null, "coverage_cont": null, "p_welch_coverage": null, "p_fisher_success": null, "seeds": 0, "physical": true, "rig_invoked": false, "g3_retired_family": true, "g4_unpairable": true, "g7_predicted_only_banned": true}, "metrics": {"idea": "FACC-ITER36", "fixture_A": null, "fixture_B": null, "fixture_R": null, "fixture_B_transfer_success": null, "coverage_cont": null, "p_welch_coverage": null, "p_fisher_success": null, "seeds": 0, "physical": true, "rig_invoked": false, "g3_retired_family": true, "g7_predicted_only_banned": true, "queue_empty": true, "rig_edited": false, "synthetic_proxy_used": false, "banned_phrases_checked": true, "disk_gb_free": ">10", "predicted_score_unverified": "74 +/-4 (unverified, banned as keep; no fixture-B paired artifact)"}, "seeds_run": 0, "fixture_A_transfer_success": null, "fixture_B_transfer_success": null, "fixture_R_transfer_success": null, "coverage_cont": null, "p_value_fisher": null, "p_value_welch": null, "physical_rig_invoked": false, "rig_health_seeds": 20, "rig_health_fixture_B": 1.0, "rig_health_coverage_cont": 1.0, "synthetic_proxy_used_for_keep": false, "g3_retired_family": true, "g7_predicted_only_banned": true, "g4_paired_missing": true, "compare_keep": false, "notes": "Ponytail / lazy: rung 1 speculative (no queued \u00a71 idea; mechanism absent from rig v3); rung 4 installed rig does not solve SE(3)-EBM; rung 5 skip build = replay rejected. Director iter 36 predicts 74; no fixture-B 20-seed paired comparison; no arithmetic coverage/success fabrication; no teleport; no synthetic proxy (benchmarks/restroom_sim excluded); banned phrases 'remote GPU deferred'/'deferred to remote GPU'/'same dependency' absent. Timeout 1200 / anchored kill (pgrep -f '^python3 .*kaggle_aegis_sweep\\.py' | xargs -r kill) not triggered \u2014 no sweep launched. Unvalidated cap untouched (replay, not screening). Evidence: results/aegis_v2/Run338_FACC-ITER32_r338.jsonl, health_r330 (trochoid B=1.00 cov=1.0000). N198 open_needs_director \u2014 worker does not change segment/metric/gate."}
{"run": 341, "idea_id": "FACC-ITER37", "idea": "Force-Adaptive Contact Control (FACC-SE3) \u2014 replace flow-matching head with energy-scored SE(3) diffusion + compliance gate; condition on live SE(3) contact frame + force residual (director iter 37; single-brain fallback opencode-responses/muse-spark-1.3-contributor-free)", "segment": 15, "status": "discard", "metric": "transfer_success", "timestamp": 1790772122, "rig": "timeout 1200 python3 experiments/run_facc_se3.py (PyBullet DIRECT, 20 seeds, friction U[0.05,0.80]); physical fixture-B rollouts; comparison to champion trochoid via fixture_B transfer_success (not paired same-seed --compare because rig v3 PATH_MODES do not expose FACC decoder swap; paired Welch/Fisher missing \u2014 noted, not fabricated)", "compare_champion": "trochoid (fixture_B 1.00, Fisher p=0.0083 vs raster; frozen champion per G2/G3; physical evidence results/aegis_v2/health_r330)", "compare": {"compare_champion": "trochoid", "compare_keep": false, "fixture_A_transfer_success": null, "fixture_B_transfer_success": 0.25, "fixture_R_transfer_success": null, "coverage_cont": null, "p_welch_coverage": null, "p_fisher_success": null, "seeds": 20, "physical": true, "rig_invoked": true, "g3_retired_family": false, "g4_unpairable": true, "g7_predicted_only_banned": false}, "metrics": {"idea": "FACC-ITER37", "fixture_A": null, "fixture_B": 0.25, "fixture_R": null, "fixture_B_transfer_success": 0.25, "fixture_B_without_gate": 0.2071, "fixture_B_height_with_gate": 0.2167, "fixture_B_height_without_gate": 0.1619, "fixture_B_tool_with_gate": 0.1643, "fixture_B_tool_without_gate": 0.1167, "coverage_cont": null, "p_welch_coverage": null, "p_fisher_success": null, "seeds": 20, "physical": true, "rig_invoked": true, "g3_retired_family": false, "g4_paired_missing": true, "g7_predicted_only_banned": false, "synthetic_proxy_used": false, "banned_phrases_checked": true, "disk_gb_free": ">10", "predicted_score_unverified": "74 +/-4 (director iter 37); physical 0.2500 << 0.70; kill rule triggered; no stiffness-shift gain"}, "seeds_run": 20, "fixture_A_transfer_success": null, "fixture_B_transfer_success": 0.25, "fixture_R_transfer_success": null, "p_value_fisher": null, "p_value_welch": null, "physical_rig_invoked": true, "rig_health_seeds": 20, "rig_health_fixture_B": 1.0, "rig_health_coverage_cont": 1.0, "synthetic_proxy_used_for_keep": false, "g3_retired_family": false, "g7_predicted_only_banned": false, "g4_paired_missing": true, "compare_keep": false, "notes": "Ponytail / lazy: rung 1 mechanism exists (FACC-SE3 script); rung 2 stdlib not applicable; rung 4 installed rig (restroom_sim) runs; rung 5 do not build new backbone \u2014 swap only decoder (energy-scored diffusion) but physical result collapses under rigid contact (fixture_B 0.2500 with gate, 0.2071 w/o); root cause same as eq78/N76b: control policy cannot generalize to OOD fixture geometry despite SE(3) calibration finding offset. Kill rule triggered (no gain vs scripted 0.8125). Tier-4 gate preserved (interceptions recorded). No synthetic proxy; no arithmetic coverage/success fabrication; no teleport (resetBasePositionAndOrientation absent in rollout log); no banned phrases ('remote GPU deferred'/'deferred to remote GPU'/'same dependency' absent). Unvalidated cap untouched (20-seed paired decider, not screening). Evidence: results/facc_se3_fixture_b_result.json (run 341 output), results/facc_se3_fixture_b_verdict.json, experiments/run_facc_se3.py, benchmarks/restroom_sim.py (physical contact points only). Next: close segment 15 / FACC family; do not open new segment without director; do not extend eq78 family."}
{"run": 342, "idea": "FACC-E", "status": "discard", "metrics": {"idea": "FACC-E", "fixture_B": 1.0, "fixture_A": 1.0, "fixture_R": 0.95, "coverage_cont": 1.0, "compare": "trochoid", "compare_env": "AEGIS_RESIDUAL_ACTIVE=0,AEGIS_FORCE_PI=0", "p_value_fisher": 1.0, "p_value_welch": null, "keep": false, "seed_count": 20, "evidence_rig_file": "results/aegis_v2/facc_e_r339.jsonl", "evidence_run": 339, "replay_note": "iter 38 director replay; G3 retired family; full paired decider already exists (run 339); no new physical invocation; synthetic proxy excluded; no teleport/fabrication", "synthetic_proxy": null}, "timestamp": "2026-09-30T12:43:35Z", "note": "Ponytail: no new build; mechanism absent from rig v3; champion trochoid B=1.00 unchanged; segment 15 freeze holds"}
