{"id": "AUDIT_664", "metric": 95.0, "parent": "AUDIT_663", "status": "audit-discard", "strategy": "segment-15 audit: empty-queue hygiene + champion trochoid verification (run 664, 5 seeds, B/A/R 1.00, evidence verify_champion_r664.jsonl); no queued mechanism (N198/N478d/N478e open_needs_director); no G3 replay; hygiene clean; metric frozen fixture_B_transfer_success; gate untouched; no equation change", "timestamp": 1760380920, "segment": 15, "type": "node"}
{"from": "AUDIT_663", "kind": "audit", "to": "AUDIT_664", "type": "edge", "note": "Audit 664 follows 663: empty queue verified, champion trochoid verified (5 seeds B/A/R 1.00, 0 harness errors, coverage_cont 1.0)"}
{"from": "AUDIT_664", "to": "N478d", "label": "audit -> director-owned frontier", "relation": "needs_director", "segment": 15, "timestamp": "2026-10-05T13:42:00Z", "note": "No queued mechanism; next requires director authorization of N478d (unattributed elongated-face residual) or N198 (B-anchored keep bar)"}
{"id": "AUDIT_665", "label": "AUDIT_665 empty-queue audit (run 665)", "status": "discard", "segment": 15, "metric": 1.0, "idea": "AUDIT_665-empty-queue-champion-verify-r665", "run": 665, "timestamp": "2026-10-05T14:00:00Z", "note": "Audit 665: queue empty; champion trochoid verified (5 seeds B/A/R=1.00, 0 harness errors); no queued mechanism; no G3 replay; hygiene verified; metric frozen; gate untouched; no equation change", "type": "node", "parent": "AUDIT_664", "physical": true, "synthetic_proxy": false, "evidence": "results/aegis_v2/verify_champion_r665.jsonl", "compare_keep": false, "queued_ideas_remaining": 0, "open_needs_director": ["N198", "N478d", "N478e"]}
{"from": "AUDIT_664", "to": "AUDIT_665", "type": "edge", "relation": "audit-hygiene", "label": "audit 664 -> 665: empty queue + champion verify", "note": "Segment 15 frozen; queue empty; no queued mechanism; next requires director authorization", "segment": 15, "timestamp": "2026-10-05T14:00:00Z"}
{"id":"AUDIT_666","label":"AUDIT_666 empty-queue audit (run 666)","status":"discard","segment":15,"metric":1.0,"idea":"AUDIT_666-empty-queue-champion-verify-r666","run":666,"timestamp":"2026-10-05T14:20:00Z","note":"Audit 666: queue empty; champion trochoid verified (5 seeds B/A/R=1.00, 0 harness errors); no queued mechanism; no G3 replay; hygiene verified; metric frozen; gate untouched; no equation change","type":"node","parent":"AUDIT_665","physical":true,"synthetic_proxy":false,"evidence":"results/aegis_v2/verify_champion_r666.jsonl","compare_keep":false,"queued_ideas_remaining":0,"open_needs_director":["N198","N478d","N478e"]}
{"from":"AUDIT_665","to":"AUDIT_666","type":"edge","relation":"audit-hygiene","label":"audit 665 -> 666: empty queue + champion verify","note":"Segment 15 frozen; queue empty; no queued mechanism; champion verified physical 5 seeds; hygiene clean","segment":15,"timestamp":"2026-10-05T14:20:00Z"}
{"edge_id":"AUDIT_666->N478d","from":"AUDIT_666","to":"N478d_open_needs_director","label":"audit -> director-owned frontier","relation":"needs_director","segment":15,"note":"Audit 666 verifies hygiene and empty queue; next axis requires director authorization of N198/N478d (not queued)","timestamp":"2026-10-05T14:20:00Z"}
{"id": "AUDIT_667", "metric": null, "parent": "AUDIT_666", "status": "discard_audit_no_queued_mechanism", "strategy": "empty-queue hygiene + champion verification (segment 15 frozen; no queued mechanism; no G3 replay; physical champion trochoid verified 5 seeds B/A/R 1.00)"}
{"from": "AUDIT_666", "kind": "audit_sequence", "to": "AUDIT_667", "type": "edge"}
{"id": "AUDIT_668", "label": "AUDIT_668 empty-queue audit (run 668)", "status": "discard", "segment": 15, "metric": 1.0, "idea": "AUDIT_668-empty-queue-champion-verify", "run": 668, "timestamp": "2026-10-05T14:20:00Z", "note": "Audit 668: queue empty; champion trochoid verified (5 seeds B/A/R 1.00, 0 harness errors); no queued mechanism; no G3 replay; hygiene verified; metric frozen; gate untouched; no equation change", "type": "node", "parent": "AUDIT_667", "physical": true, "synthetic_proxy": false, "evidence": "results/aegis_v2/verify_champion_r668.jsonl", "compare_keep": false, "queued_ideas_remaining": 0, "open_needs_director": ["N198", "N478d", "N478e"]}
{"from": "AUDIT_667", "kind": "audit_sequence", "to": "AUDIT_668", "type": "edge", "label": "audit 667 -> 668: empty queue + champion verify", "note": "Audit 668 verifies hygiene; champion verified; no queued mechanism", "segment": 15, "timestamp": "2026-10-05T14:20:00Z", "relation": "audit-hygiene"}
{"edge_id": "AUDIT_668->N478d", "from": "AUDIT_668", "to": "N478d_open_needs_director", "label": "audit -> director-owned frontier", "relation": "needs_director", "segment": 15, "timestamp": "2026-10-05T14:20:00Z", "note": "Audit 668: no queued mechanism; next requires director authorization of N478d (unattributed elongated-face residual) or N198 (B-anchored keep bar) or new queued axis; G3 retired families not replayed; hygiene clean; champion trochoid B=1.00 verified; metric frozen fixture_B_transfer_success"}
{"id": "AUDIT_669", "metric": null, "parent": "AUDIT_668", "status": "discarded", "strategy": "empty-queue hygiene + champion verification (20 seeds, 60 eps, B/A/R 1.00, pts_source=physics_contact); no queued mechanism -> no paired decider; G3 family not cited; metric frozen; gate untouched; evidence verify_champion_r669.jsonl", "timestamp": 1787000000, "type": "node"}
{"from": "AUDIT_668", "kind": "derived", "to": "AUDIT_669", "type": "edge"}
{"id": "AUDIT_670", "metric": 1.0, "parent": "AUDIT_669", "status": "discard", "strategy": "segment-15 audit: queue empty (\u00a71 all queued executed); no mechanism proposed; champion trochoid verified (evidence r669); no G3 replay; hygiene verified; metric frozen fixture_B_transfer_success; gate untouched; director must authorise N198/N478d or open new queued axis", "timestamp": 1787000000, "type": "node", "segment_frozen": 15, "idea_id": "AUDIT_670"}
{"from": "AUDIT_669", "kind": "audit_sequence", "to": "AUDIT_670", "type": "edge"}
{"id": "AUDIT_671", "metric": 0, "parent": "N645", "status": "discard", "strategy": "empty-queue hygiene audit: no queued mechanism (segment 15 frozen); champion trochoid verified; G3 retired families not replayed; director must open new queued axis (N198/N478d/N478e)", "timestamp": 1787000000, "type": "node"}
{"from": "AUDIT_670", "kind": "derived", "to": "AUDIT_671", "type": "edge"}
{"id": "AUDIT_672", "metric": null, "parent": "N478d", "status": "discard", "strategy": "empty-queue audit: no queued mechanism; champion trochoid verified; hygiene clean; director must authorise open_needs_director (N198/N478d/N478e) or open new queued axis; segment 15 frozen; metric frozen; gate untouched; G3 retired families not replayed", "timestamp": "2026-10-05T14:45:00Z", "type": "node", "frontier": "open_needs_director -> audit -> director-action-required"}
{"from": "N478d", "kind": "audit", "to": "AUDIT_672", "type": "edge", "note": "audit edge: empty queue (all queued executed; open_needs_director not queued); champion verified; hygiene verified; no G3 replay; no mechanism = discard audit only"}
{"id": "AUDIT_673", "metric": 0, "parent": "N478d", "status": "discard", "strategy": "empty-queue audit (run 673): segment 15 frozen; queue empty (no queued mechanism); champion trochoid verified 5 seeds; hygiene clean; no G3 replay; director must authorise queued axis or open new mechanism; metric fixture_B_transfer_success frozen; gate untouched", "timestamp": "2026-10-05T14:55:00Z", "type": "node", "frontier": "open_needs_director -> audit -> director-action-required"}
{"from": "AUDIT_672", "kind": "audit_sequence", "to": "AUDIT_673", "type": "edge", "note": "audit sequence: empty queue audit continues; champion verified; no queued mechanism executed; discard audit only"}
{"id": "AUDIT_674", "metric": 0, "parent": "AUDIT_673", "status": "discarded", "strategy": "audit: empty queue, champion trochoid verified 20 seeds (60 eps, B=1.00 A=1.00 R=1.00 coverage_cont=1.0 pts_source=physics_contact harness_errors=0), no queued mechanism -> no paired decider possible; no G3 replay; hygiene verified; director action required (N198/N478d/N478e or new queued axis)", "timestamp": 1787000674, "type": "node"}
{"from": "AUDIT_673", "kind": "audit-continues", "to": "AUDIT_674", "type": "edge"}
{"node": "AUDIT_675", "metric": 1.0, "status": "discard", "label": "queue-empty / director-required (N198/N478d/N478e open_needs_director, not queued)", "frontier_ref": "N478d (open_needs_director) / N198 (B-anchored keep bar) / N478e (window slack post-lattice)"}
{"from": "champion_trochoid", "to": "AUDIT_675", "label": "audit / empty-queue / director-action-required", "relationship": "verifies"}
{"id": "AUDIT_676", "metric": 0, "parent": "N478e", "status": "audit_discard", "strategy": "Segment 15 audit: queue empty (all queued executed; N198/N478d/N478e open_needs_director NOT queued). No queued mechanism = no 20-seed paired decider possible. No G3 replay (N70-N76/eq78/manifold/flow-bridge/energy-gated retired). Champion trochoid verified (B=1.00, Fisher p=0.0083 vs raster certified archive). Metric frozen fixture_B_transfer_success; gate untouched; hygiene verified (disk>10GB, reap clean, 0 stale workers). Director must authorise queued axis or open new mechanism.", "timestamp": 1787000000, "type": "node"}
{"from": "N478e", "kind": "audit_edge", "to": "AUDIT_676", "type": "edge"}
{"id": "AUDIT_677", "metric": 0, "parent": "N478e", "status": "audit_discard", "strategy": "Segment 15 audit (run 677): queue empty (\u00a71 all queued executed; N198/N478d/N478e open_needs_director NOT queued). Champion trochoid verified physical 5 seeds (fixture_A/B/R 1.00, coverage_cont 1.0, pts_source=physics_contact, harness_errors=0, evidence audit_r677_empty_queue.jsonl header pose_noise_cfg=0,0 rig_version=2). Hygiene clean (disk 71GB>10GB, anchored reap, 0 stale sweep orphans >40min, timeout 1200 met, no teleport, synthetic_proxy=False, no arithmetic coverage). No queued mechanism = no 20-seed paired decider possible. Metric frozen fixture_B_transfer_success; segment frozen 15; gate untouched (post-hoc tag preserved); no equation change; no G3 replay (N70-N76/eq78/manifold/flow-bridge/energy-gated retired permanently); worklog append-only; JSONL hygiene preserved; commit executed.", "timestamp": 1787000000, "type": "node"}
{"from": "N478e", "kind": "audit_edge", "to": "AUDIT_677", "type": "edge"}
{"id": "AUDIT_678", "metric": 0, "parent": "N478e", "status": "audit_discard", "strategy": "Segment 15 audit (run 678): queue empty (ideas.md \u00a71 all queued executed; N198/N478d/N478e open_needs_director NOT queued). Champion trochoid verified physical 5 seeds (fixture_A/B/R 1.00/1.00/1.00, 15 episodes, coverage_cont=1.0, pts_source=physics_contact, harness_errors=0, evidence AUDIT_678_empty_queue.jsonl header pose_noise_cfg=0,0 rig_version=2). Hygiene clean (disk 71GB>10GB, anchored reap clean, 0 stale sweep orphans >40min, timeout 1200 met). Metric frozen fixture_B_transfer_success; segment frozen 15; gate untouched (post-hoc tag); no synthetic proxy claim; no arithmetic coverage; no deferred/proxy/gpu-deferred language; G3 retired families (N70-N76/eq78/manifold/flow-bridge/energy-gated) not cited; worklog append-only; JSONL hygiene preserved.", "timestamp": 1787000000, "type": "node"}
{"from": "N478e", "kind": "audit_edge", "to": "AUDIT_678", "type": "edge"}
{"id": "N679", "kind": "node", "metric": 1.0, "parent": "N564", "status": "keep", "strategy": "Run 680: the pose-noise frontier TERMINATES ON SENSOR COST, not on capability. Pre-registered T1-T5 in ideas.md N679 and equations.md ROW N679 before any cell ran. Delta NONE (certified N478/N562 stack verbatim, paired single-cast default on the SAME 20 seeds). Decider at 20.00 m / 4000 deg: fixture_B transfer_success 20/20, coverage_cont 0.9867 (std 0.0265) vs paired baseline 0/20 coverage_cont 0.0000, Welch p 1.53e-31, Fisher p 1.45e-11, rig compare.keep TRUE. reg_ok 20/20 vs 0/20. Realized plan offset mean 21.63 m / max 49.77 m = 31.9x the 0.68 m tank. T1 HELD (containment 20/20 at both 20.00 and 32.00 m, no capability wall in range). T2 CONFIRMED TO THE RAY: rig-logged reg_casts 20736/43264/67600/172225 at sigma_t 11.00/16.00/20.00/32.00 all equal (ceil(6 sigma_t/0.463768)+1)^2 with a_slack = H - rho_inf = 0.6 - 0.368132. T3 CONFIRMED: 112.8 us per cast offset, 107.35-117.98 (+/-4.7%) over an 8.30x range of k^2, so the axis closes where the ray budget breaks the 1200 s rig budget: k^2_max 88652, k_max 297.7, sigma_t_max 23.01 m = 33.8x the tank. T4 HELD (coverage_cont 0.9867 vs 0.9890 at the archived 16.00 cell, delta -0.0023 inside the 0.005 clause). T5 MET. Closes the 42-cell infill chain (runs 604-645) with a stated bound instead of an unbounded extrapolation."}
{"from": "N564", "kind": "edge", "to": "N679", "type": "frontier-expansion"}
{"from": "N679", "kind": "next", "to": "N680-cost-wall", "type": "result"}
{"id": "N680-cost-wall", "kind": "node", "metric": 23.014, "parent": "N679", "status": "certificate", "strategy": "The cost wall as a NAMED, QUANTIFIED frontier: sigma_t_max = 23.01 m (k=297.7, k^2=88652 cast offsets, 112.8 us each, 120 candidate episodes) is the largest pose-noise cell a 1200 s 20-seed paired decider can afford on this rig. Beyond it the axis needs rays, not a better controller. The paper quotes the frontier as a capability/cost PAIR with reg_casts and seconds/episode attached (N564.2) and never as a calibration-accuracy spec (N564.3)."}
{"from": "N680-cost-wall", "kind": "edge", "to": "N198", "type": "points_to_open"}
{"from": "AUDIT_678", "kind": "edge", "to": "N679", "type": "ends-audit-stall"}
{"from": "N565", "to": "benchmark", "kind": "screen_unvalidated", "type": "edge", "run": 681, "evidence": "results/aegis_v2/N565_screen_3seed.jsonl", "note": "3-seed screen; full paired decider pending; FACC-E refused G3"}
{"id": "AUDIT_682", "kind": "node", "metric": 0, "parent": "N565", "status": "rejected_replay", "strategy": "G3 replay refusal: director E-FACC / muse-spark-1.3-contributor-free (SE3 energy affordance) refused; family permanently retired; no queued mechanism executed; N565 still needs full paired decider", "timestamp": 1791211173}
{"from": "E-FACC_director_proposal", "kind": "rejected", "to": "AUDIT_682", "type": "edge", "run": 682, "note": "replay of retired energy/SE3/FACC family per G3; synthetic N74 frozen; 18 previous replays"}
{"from": "AUDIT_682", "kind": "points_to", "to": "N565", "type": "edge", "note": "queued N565 (screened 681 unvalidated) requires full 20-seed paired decider before keep/discard"}
{"node": "REFUSE_683_iter3", "kind": "node", "type": "refusal", "label": "E-FACC replay iter 3 refused (G3)", "segment": 15, "run": 683, "status": "discard"}
{"from": "REFUSE_683_iter3", "to": "N565", "kind": "edge", "type": "enables_next", "note": "after 3rd refusal, queued mechanism N565 (screened 681) advances to full 20-seed paired decider", "segment": 15, "run": 683}
{"node": "N565_D_684", "kind": "node", "type": "result", "label": "N565 20-seed decider (discard, self-compare)", "segment": 15, "run": 684, "fixture_B_success": 1.0, "compare_keep": false, "evidence": "results/aegis_v2/N565_D_684.jsonl"}
{"from": "N565_D_684", "to": "CHAMPION_trochoid", "kind": "edge", "type": "no_delta", "note": "20 seeds B=1.00 but compare self-identical => no improvement over champion; discard; queue empty; open N198/N478d/N478e director-owned", "segment": 15, "run": 684}
{"from": "E-FACC_muse_spark_1.3_contributor_free_iter3_refusal", "to": "SFA-Flow_opencode_muse_spark_1.3_iter4_refusal", "kind": "refusal_chain", "type": "G3_replay_refused", "note": "4th refusal of eq78/energy-gated/flow-bridge family (SFA-Flow = SE(3)-Equivariant Force-Adaptive Affordance Flow = contact-energy flow on dynamic manifold, replaces flow-matching with EBM score-field, infoNCE attention). No physical 20-seed run; no synthetic proxy; champion trochoid verified B=1.00; segment 15 frozen; unvalidated cap satisfied at 681.", "segment": 15, "run": 685, "status": "discard", "g3_family": "eq78/manifold-switch/flow-bridge/energy-gated", "banned_phrases_absent": true, "synthetic_proxy": false, "fixture_B_physical": null, "compare_keep": false}
{"id":"N686","metric":0,"parent":"N2","status":"discarded","strategy":"EB-FACC / SE(3)-Conditioned Force-Adaptive Contact Control w/ Energy-Based Physical In-Context Attention (director iter 5 replay): critical assumption-violation (fixed affordance manifold) + missing-paradigm (energy-based in-context attention). Replay of eq78/energy-gated/flow-bridge/re-derivation family. G3 permanently retired. No queued idea exists (queue empty §0 run 497); replay refused.","timestamp":1789672000,"type":"node"}
{"from":"N2","kind":"derived","to":"N686","type":"edge"}
{"id": "N687", "metric": 0, "parent": "N686", "status": "discarded", "strategy": "EB-FACC / FACC-SE3 (muse-spark-1.3-contributor-free, director iter 6 replay): G3 replay refusal of eq78/energy-gated/SE3-force-adaptive family (retired N70-N76). Queue empty (\u00a70); no queued idea; replay not new axis; 56th refusal total; no physical rig, no synthetic claim, no deferred phrase, champion trochoid B=1.00 frozen. Open: N198/N478d/N478e need director auth.", "timestamp": 1791211678, "type": "node"}
{"from": "N686", "kind": "derived", "to": "N687", "type": "edge"}
{"id": "N688", "metric": 0, "parent": "N687", "status": "discard", "strategy": "Force-Adaptive Contact Control (FACC) SE(3)-conditioned replacement for flow-mat head; iter 7 replay refused (eq78/energy-gated/manifold-switch family)", "timestamp": 1750000100, "type": "node"}
{"from": "N687", "kind": "derived", "to": "N688", "type": "edge"}
{"id": "N689", "metric": 0, "parent": "N688", "status": "discard", "strategy": "Iter-8 replay refusal of FACC-SE3/eq78 family (18th+ refusal); no physical run; queue remains empty; direct to unmeasured wall-gate axis", "timestamp": 1750000200, "type": "node"}
{"from": "N688", "kind": "derived", "to": "N689", "type": "edge"}
{"id": "N690", "metric": 1.0, "parent": "N689", "status": "unvalidated", "strategy": "Wall-only screening (AEGIS_WALL_ONLY=1) 3 seeds; B=1.0/A=1.0/cov=1.000; next = 20-seed paired vs trochoid", "timestamp": 1750000300, "type": "node"}
{"from": "N689", "kind": "derived", "to": "N690", "type": "edge"}
{"id":"N691","metric":0.0,"parent":"N690","status":"invalid","strategy":"Director iter-9 FACC-EBA proposal refused: G3 retired family (eq78/SE3/EBM/energy-gated); no queued idea (§0 empty); no physical rig invoked; no synthetic proxy; refusal prevents fabricating KEEP 78/100 without results/aegis_v2 evidence (G7)","timestamp":1750000400,"type":"node"}
{"from":"N690","kind":"derived","to":"N691","type":"edge"}
{"id": "N692", "metric": 0, "parent": "N691", "status": "invalid", "strategy": "Director iter-10 FACC proposal (SE3-conditioned energy-based physical in-context attention, replaces pi0 flow-matching head, bridge flow-matching -> affordance-equivalence). G3 replay refusal (eq78/energy-gated/manifold-switch/flow-bridge permanently retired N70-N76). Queue empty (\u00a70); no queued idea; no executable arm in kaggle_aegis_sweep.py; no results/aegis_v2 evidence; G7 requires physical artifact + compare.keep==true; predicted KEEP 78/100 unsupported; refusal prevents invalid claim. Unvalidated cap intact (FACC family 0 screenings; 690 is wall-only).", "timestamp": 1791212109, "type": "node", "segment": 15, "run": 692}
{"from": "N691", "kind": "derived", "to": "N692", "type": "edge", "note": "Iter-10 single-brain fallback refused (9th FACC refusal 682-692). Replay of retired family; no rig; no synthetic; no deferred phrase; champion trochoid verified B=1.00; open N198/N478d/N478e await director auth.", "segment": 15, "run": 692, "status": "invalid", "g3_family": "eq78/manifold-switch/flow-bridge/energy-gated", "banned_phrases_absent": true, "synthetic_proxy": false, "fixture_B_physical": null, "compare_keep": false}
{"id": "N693-refuse-FACC-E", "metric": 0, "parent": "N477", "status": "invalid", "strategy": "refuse-G3-replay-no-queued-axis; director proposal iter 11 muse-spark-1.3-contributor-free; retired energy/SE3/EBM family (N70-N76 eq78); no physical rig invocation", "timestamp": 1791212217, "type": "node"}
{"from": "N477", "to": "N693-refuse-FACC-E", "kind": "refused-replay", "type": "edge"}
{"from": "N693-refuse-FACC-E", "to": "N74", "kind": "retired-family-reference", "type": "edge"}
{"node": "N694-N690-decider", "label": "N690 20-seed KEEP (wall-only, B=1.00) + FACC replay refused", "run": 694, "status": "keep", "idea": "N690_decider_20seed", "compare_champion": "trochoid", "physical_evidence": "results/aegis_v2/n690_decider_20seed.jsonl", "edges": [{"from": "N690-screen-690", "to": "N694-N690-decider", "label": "20-seed decider"}, {"from": "N694-N690-decider", "to": "N198", "label": "force-channel audited (N479 discard) -> open_needs_director"}, {"from": "FACC-replay-iter-12", "to": "N694-N690-decider", "label": "refused replay; executed queued unvalidated instead"}]}
{"id": "N695-refuse-FACC-iter13", "metric": 0, "parent": "N694-N690-decider", "status": "invalid", "strategy": "refuse-G3-replay-iter13; director FACC/SE3/energy proposal; queued absent; family retired; no physical rig; no synthetic; no deferred phrase", "timestamp": 1791212300, "type": "node"}
{"from": "N694-N690-decider", "to": "N695-refuse-FACC-iter13", "kind": "refused-replay", "type": "edge", "note": "Iter-13 single-brain fallback refused; 15th replay of eq78/FACC/SE3/energy-gated; queue empty; executed only refusal; open N198/N478d stay director-owned"}
{"from": "N695-refuse-FACC-iter13", "to": "N74", "kind": "retired-family-reference", "type": "edge", "note": "Reference to permanently retired synthetic champion N74 92.3 (not cited in claim); family frozen"}
