{"run": 243, "segment": 15, "status": "keep", "idea": "I22", "timestamp": "2026-09-29T14:05:00Z", "rig": "canonical rig experiments/kaggle_aegis_sweep.py (PyBullet DIRECT, system python3, 20 seeds x 3 suites x 2 paired arms x 2 noise conditions, rig_version 2); pts_source=physics_contact; coverage_cont/success recomputed from physics contacts at return time (cov_kernel_gap 0.0 in every arm); ONE rig edit family, all inside the PLAN LISTS: rows = v0 + (r + 0.5*ROW_CENTRE)*CELL_M with ROW_CENTRE default 1 (the fix) and AEGIS_ROW_CENTRE in KNOB_GLOBALS so --compare-env AEGIS_ROW_CENTRE=0.0 re-points the paired baseline to the frozen expression. No force, solver, control or scoring edit.", "command": "timeout 1200 python3 experiments/kaggle_aegis_sweep.py --seeds 20 --no-upload --path trochoid --compare trochoid --compare-env AEGIS_ROW_CENTRE=0.0 --suites fixture_A,fixture_B,fixture_R --out results/aegis_v2/I22_r243_rowcentre_n00.jsonl ; AEGIS_POSE_NOISE=0.01,2 (same) --out results/aegis_v2/I22_r243_rowcentre_n012.jsonl ; dose AEGIS_POSE_NOISE=0.01,2 AEGIS_ROW_CENTRE in {0.4,0.6,1.4,2.0} (same flags) --out results/aegis_v2/I22_r243_dose_rc{0.4,0.6,1.4,2.0}_n012.jsonl ; pre-count no physics: timeout 300 python3 results/aegis_v2/I22_r243_analytic.py ; read-out + regression: timeout 300 python3 results/aegis_v2/I22_r243_analyse.py", "director_build_adjudicated": "Director iter-2 'FACC-SE3 + Energy-Based In-Context Attention (EBICA)' (SE(3)-conditioned energy minimisation over the contact manifold replacing flow-matching; validation 1 = novel tool-geometry contact transfer zero-shot, validation 2 = stiffness perturbation + SE(3) pose shift; predicted 76.5 / KEEP) ADJUDICATED, NOT EXECUTED, on six grounds following the run 234/235/236/237/239/240/241/242 precedent: (1) G4 - a learned action head is unpairable in the canonical rig, whose tool is a FORCE-DRIVEN foam head with no policy, no pi0 and no demo keypoints, so no --compare record can be produced; (2) checkpoints may never be downloaded and pi0 has no open weights; (3) G3 permanently retires manifold-switch / flow-bridge / energy-gated re-derivations, and an SE(3) contact-energy scorer with a Langevin argmin IS that family, here re-derived for the third time; (4) the FACC line is already closed twice on physical data (T225 run 232 degenerate all-reject, T226 run 233 78/78 infeasible); (5) its own validation plan is unposeable here - the rig has ONE pad and ONE force-driven head, so 'novel tool-geometry contact transfer' has no second tool geometry to transfer to, and force adaptation is the I11 family that run 235 falsified (PI saturates at the 0 rail); (6) the 2026-09-28 freeze independently bans learned/adaptive variants from keeps. The pre-registered N206 node and the lowest-numbered queued idea executable in the rig was run instead: I22.", "metric": 1.0, "metric_unit": "fixture_B transfer_success (coverage_cont>=0.90 per episode) of the row-centred arm, 20/20 seeds at BOTH pose_noise 0,0 and 0.01,2; rig compare record keep=true at both (G4: >=20 seeds AND B>0.70 AND Welch p<0.01 on coverage_cont)", "metrics": {"idea": "I22", "lane": "CPU canonical rig", "screens": 0, "unvalidated_rows": 0, "variant": "I22 row-centring: put the scrub rows on the CENTRES of the coarse cells they are meant to sweep. rows = v0 + (r + 0.5)*CELL_M instead of v0 + r*CELL_M, i.e. dv* = CELL_M/2 = +0.025 m, one term, behind AEGIS_ROW_CENTRE (1 = fix, 0 = frozen). Pre-registered at the N205-I3 closure node.", "law": "scrub_grid places coarse cells at org_v = -side/2 with nv = int(side/CELL_M), so cell centres are org_v + (r+0.5)*CELL_M; rows = v0 + r*CELL_M sat on each cell's LOWER EDGE, putting the band exactly CELL_M/2 low in v for every side and nv (equations I3.1 -> I22.1).", "pre_count_no_physics": "Priced on the rig's OWN _coverage_cont (bound off a 1-field shim) before any run: champion analytic ceiling 0.9219 (B) / 0.9062 (A) at r_eff 0.035 -> 1.0000 on both, and 0.9531/0.9271/0.9688 -> 1.0000 for r_eff 0.04/0.05; path_len_ratio 1.000000 EXACTLY on both suites (the fix is an isometric translation of the row list) and max_turn_deg 17.63 (B) / 45.37 (A) unchanged under the 60 deg C1 bound. The same kernel also lifts raster and rounded from 0.7500/0.8333 to 1.0000, so it is a PLANNER class and not a trochoid quirk.", "paired_decider_0_0": {"fixture_A": {"covc_base": 0.9354, "covc": 1.0, "delta": 0.0646, "welch_p": 1.3475417150857079e-09, "succ_base": "20/20", "succ": "20/20", "fisher_p": 1.0}, "fixture_B": {"covc_base": 0.9453, "covc": 1.0, "delta": 0.0547, "welch_p": 5.264280635564357e-06, "succ_base": "20/20", "succ": "20/20", "fisher_p": 1.0}, "fixture_R": {"covc_base": 0.9427, "covc": 1.0, "delta": 0.0573, "welch_p": 1.2399374592265432e-06, "succ_base": "19/20", "succ": "20/20", "fisher_p": 1.0}, "std_coverage_cont": 0.0, "min_per_episode_coverage_cont": 1.0, "keep": true}, "paired_decider_0_01_2": {"fixture_A": {"covc_base": 0.9307, "covc": 0.9964, "delta": 0.0656, "welch_p": 7.137239365889551e-06, "succ_base": "15/20", "succ": "20/20", "fisher_p": 0.047124047124047136}, "fixture_B": {"covc_base": 0.9398, "covc": 0.9961, "delta": 0.0563, "welch_p": 0.00010638379292964072, "succ_base": "15/20", "succ": "20/20", "fisher_p": 0.047124047124047136}, "fixture_R": {"covc_base": 0.9068, "covc": 0.9859, "delta": 0.0792, "welch_p": 0.0004711733740047963, "succ_base": "13/20", "succ": "20/20", "fisher_p": 0.008316008316008316}, "keep": true}, "metric": "fixture_B transfer_success = 1.0 (20/20) at both pose-noise conditions", "coverage_cont": {"0,0": {"fixture_A": 1.0, "fixture_B": 1.0, "fixture_R": 1.0}, "0.01,2": {"fixture_A": 0.9964, "fixture_B": 0.9961, "fixture_R": 0.9859}}, "p_values": {"welch_coverage_cont": {"0,0": {"fixture_A": 1.35e-09, "fixture_B": 5.26e-06, "fixture_R": 1.24e-06}, "0.01,2": {"fixture_A": 7.14e-06, "fixture_B": 0.000106, "fixture_R": 0.000471}}, "fisher_success": {"0,0": {"fixture_A": 1.0, "fixture_B": 1.0, "fixture_R": 1.0}, "0.01,2": {"fixture_A": 0.047124, "fixture_B": 0.047124, "fixture_R": 0.008316}}}, "fisher_20_seed_discrete_note": "At 20 seeds a discordant-pair count of 5 gives Fisher p = 0.047124 and 7 gives 0.008316 (run 242's I3 note). fixture_R clears 7 pairs, so ONLY fixture_R reaches p<0.01 on the success channel at this noise; fixture_A and fixture_B clear 5. The coverage channel carries the G4 significance for all three suites at both noise conditions.", "regression": "The paired baseline (AEGIS_ROW_CENTRE=0.0) is the FROZEN champion and is proven so twice: bit-identical to run 242's champion compare arm (I3_r242_ppo_n00.jsonl, 60 episodes x ALL 81 fields, 0 differences) and bit-identical to results/aegis_v2/v2_trochoid_0,0.jsonl (60 episodes x 31 shared fields, 0 differences, failure_metadata leaf-flattened because run 170 added a key there). Every delta above is therefore attributable to the row list and to nothing else.", "scope": "spiral, fitted and fitro polylines are point-for-point IDENTICAL under the knob (their ceilings and lengths unchanged), so I21's ceiling 1.0000 and I18's discard are untouched. Only the row-list modes move.", "dose_response_0_01_2": {"ROW_CENTRE_0.4_dv_+0.010": {"fixture_A": [0.9729, "20/20"], "fixture_B": [0.9844, "20/20"], "fixture_R": [0.9581, "17/20"], "keep": true}, "ROW_CENTRE_0.6_dv_+0.015": {"fixture_A": [0.9828, "20/20"], "fixture_B": [0.9945, "20/20"], "fixture_R": [0.9747, "18/20"], "keep": true}, "ROW_CENTRE_1.0_dv_+0.025": {"fixture_A": [0.9964, "20/20"], "fixture_B": [0.9961, "20/20"], "fixture_R": [0.9859, "20/20"], "keep": true}, "ROW_CENTRE_1.4_dv_+0.035": {"fixture_A": [0.9927, "20/20"], "fixture_B": [0.9844, "20/20"], "fixture_R": [0.9854, "20/20"], "keep": true}, "ROW_CENTRE_2.0_dv_+0.050": {"fixture_A": [0.9583, "17/20"], "fixture_B": [0.9125, "13/20"], "fixture_R": [0.9453, "16/20"], "keep": false}, "verdict": "the peak is exactly at the closed-form dv = CELL_M/2 and the saturation band is ROW_CENTRE in [0.6, 1.4] = +-0.010 m on both suites, matching the analytic plateau; 2.0 collapses for the same reason the MIRROR arm of (I3.3) did. A centring law, not a tuned offset."}, "secondary_channels": {"path_len_m": {"fixture_A": [1.4118, 1.4118], "fixture_B": [0.9098, 0.9098], "fixture_R": [1.1357, 1.1357], "note": "identical by construction, the fix is an isometric translation"}, "mean_jerk": {"fixture_B_0_0": [0.00976, 0.00979], "fixture_B_0_01_2": [0.01034, 0.01038]}, "slip_m_fixture_B": [0.01059, 0.01059], "force_compliance_0_0": {"fixture_A": [0.4864, 0.4778], "fixture_B": [1.0, 1.0], "fixture_R": [0.7548, 0.7536]}, "escaped_frac": 0.0, "stick_frac_fixture_B": 0.0159}, "predictions_refuted": "I3 pre-registered that the plan-time form would cut mean_jerk 0.0135 -> ~0.0104 because there is no 2.5 cm command step at the scrub entry. Physics reaches the predicted absolute value (0.00976 at 0,0; 0.01034 at 0.01,2, i.e. 23% BELOW I3's residual arm's 0.0135) but does NOT fall relative to the champion (0.00979 / 0.01038), and an isometric translation of the plan cannot change commanded-force second differences. Jerk was never the plan's problem; the residual arm paid 0.0135 purely for stepping its target.", "honest_cost": "At equal ceiling the champion is now 1.8% LONGER than `fitted` on fixture_B (0.9098 vs 0.8939 m) and 1.7% on fixture_A (1.4118 vs 1.3878 m). I22 buys the last cell with cycle time - the same trade I18 measured and refused, now taken deliberately because the champion's C1 scrubbing is what the paper claims.", "class_level": "The binding constraint on this rig was never the path MODE (raster, rounded and trochoid all reach ceiling 1.0000 once the rows are on the cell centres) but the SPAN+ANCHOR condition against the scoring grid. This is the second independent planner defect after I21's row COUNT, from the opposite direction, and both land on the same ceiling - convergent evidence that the span/anchor condition, not the path mode, was binding. Cheapest possible check for any future path mode: run the rig's own _coverage_cont on the planned polyline, no physics, sub-second.", "frontier_after": "coverage_cont is saturated (1.0000 at 0,0, 0.9961 on B at 0.01,2), so no further path idea can win on coverage and the compose-two-pieces family (I18) stays closed. The measurable residuals are force_compliance 0.4864 on fixture_A and 0.7548 on fixture_R under the same 0.5 N press - the I11 normal-force floor from run 235, a rig mass/stiffness question, not a gate (I19/I20 closed) and not a path - and Tier-2 registration error beyond 1cm/2deg (I9/I5).", "gate_on_vs_off": "gate_mode = post-hoc in every arm; Tier-4 gate unchanged (GATE_MAX_JERK 0.618, no veto, no retraction). Reported per the hard-gate rule.", "inference": "local CPU only, PyBullet DIRECT, system python3, 9-10 s per 120-episode run. No GPU, no remote, no dataset or checkpoint download.", "evidence": "results/aegis_v2/I22_r243_rowcentre_n00.jsonl, I22_r243_rowcentre_n012.jsonl, I22_r243_dose_rc0.4_n012.jsonl, I22_r243_dose_rc0.6_n012.jsonl, I22_r243_dose_rc1.4_n012.jsonl, I22_r243_dose_rc2.0_n012.jsonl, I22_r243_analytic.py, I22_r243_analytic.json, I22_r243_analyse.py, I22_r243_analysis.txt"}}
{"run": 244, "segment": 15, "status": "discard", "idea": "I4", "timestamp": "2026-09-29T16:20:00Z", "rig": "canonical rig experiments/kaggle_aegis_sweep.py (PyBullet DIRECT, system python3, 20 seeds x 3 suites x 2 paired arms, rig_version 2); pts_source=physics_contact, cov_kernel_gap 0.0 in every arm, harness_errors 0; NO rig edit \u2014 I4 is an inference-latency idea and the rig run is the G4 no-regression confirmation. Latency numbers come from the local RTX 3050 fp16 measurement in experiments/I4_r244_stepA_split.py, which times the shipped inference path.", "command": "timeout 1200 python3 experiments/I4_r244_stepA_split.py ; timeout 1200 python3 experiments/I4_r244_stepA_prefix_scaling.py ; timeout 1200 python3 experiments/I4_r244_stepA_1cam_floor.py ; timeout 1200 python3 experiments/kaggle_aegis_sweep.py --seeds 20 --no-upload --path trochoid --compare trochoid --compare-env AEGIS_ROW_CENTRE=0.0 --suites fixture_A,fixture_B,fixture_R --out results/aegis_v2/I4_r244_paired_n00.jsonl", "metric": 1.0, "metric_unit": "fixture_B transfer_success (coverage_cont>=0.90 per episode), 20/20 seeds, canonical rig, UNCHANGED by I4 (the 1-NFE expert touches inference latency only, not the control plan). I4s own pre-registered success bar is a separate axis and it FAILED: 1-NFE chunk = 82.09 ms against a <=25 ms budget, and N* = -4.04 makes the target unreachable for every NFE count including zero.", "director_build_adjudicated": "Director iter-3 FACC-SE3 / Energy-Based In-Context Attention (contact-conditioned diffusion policy replacing the flow-matching head; SE(3)-equivariant force/torque conditioning; dynamic affordance manifold selected per step by E(contact, wrench, affordance); validation = peg-insert under perturbed stiffness/friction, in-hand pivot, door-open; predicted 74 pts keep) ADJUDICATED, NOT EXECUTED, on the same six grounds as runs 234-242/243: (1) G4 \u2014 a learned action head is unpairable in the canonical rig, whose tool is a FORCE-DRIVEN foam head with no policy, no pi0 and no demo keypoints, so no --compare record can be produced; (2) checkpoints may never be downloaded and pi0 has no open weights; (3) G3 permanently retires manifold-switch / flow-bridge / energy-gated re-derivations, and an SE(3) contact-energy scorer selecting a manifold per step IS that family, here re-derived a third time; (4) the FACC line is already closed twice on physical data (T225 run 232 all-reject degeneracy, T226 run 233 78/78 infeasible), and FACC-SE3 itself is recorded at fixture_B 0.1905 << 0.70; (5) its validation plan is unposeable here \u2014 the rig has ONE pad and ONE force-driven head, so in-hand pivot and door-open have no counterpart, and force adaptation is the I11 family that run 235 falsified (PI saturates at the 0 rail, fn 5.2x setpoint); (6) the 2026-09-28 freeze bans learned/adaptive variants from keeps, so the predicted 74-pt keep is impossible by rule. The lowest-numbered queued idea in \u00a71 that the rig can actually decide was run instead: I4.", "metrics": {"idea": "I4", "lane": "latency / edge budget (local RTX 3050 fp16, canonical CPU rig for the G4 paired record)", "screens": 0, "unvalidated_rows": 0, "variant": "I4 1-NFE shortcut action expert (Frans et al. arXiv:2410.12557 shortcut model, or MeanFlow arXiv:2505.13447) replacing the 10-step flow-matching loop, to bring the chunk from 285 ms to <=25 ms on a Jetson Orin Nano. Step A is the pre-registered local pre-check: split the chunk into VLM-prefix vs expert-step before booking any Colab time.", "law": "t_chunk(N) = t_prefix + t_unattr + N*t_expert, with t_prefix and t_unattr paid ONCE per chunk (KV cache filled once, action chunk produced once) and t_expert linear in the NFE count (equations I4.1). The admissible NFE count is N* = (25 - t_prefix - t_unattr)/t_expert (I4.2).", "measured_split_2cam_512": "t_prefix 54.87 ms + t_unattr 16.13 ms + N*11.40 ms. Decomposition closes to 0.01 ms: 54.87+16.13+10*11.40 = 185.0 vs 184.99 measured; amortised 10*114.0/10 = 11.40 vs directly measured 1-step 11.50. Timed by wrapping the two REAL methods (embed_prefix, denoise_step) inside the shipped sample_actions, not by a reconstruction.", "falsifier_triggered": "I4 pre-registered success bar = 1-NFE chunk <= 25 ms AND action MSE <= 1.2x the 10-step MSE. MEASURED 1-NFE = 82.09 ms (3.28x the budget). N* = (25-71.00)/11.40 = -4.04, NEGATIVE: the fixed cost alone is 2.84x the budget at N=0, so the bar is unreachable for EVERY NFE count including zero. Reachable at any N: false. Triggered BEFORE training, so the MSE half was never spent.", "prediction_where_1nfe_lands": "82.40 ms predicted by (I4.1) vs 82.09 ms measured \u2014 0.4% error. The measurement is self-consistent with the law, so the falsifier is arithmetic, not a measurement artefact.", "cause_not_the_sampler": "Of the 82.09 ms surviving 1-NFE, 71.00 ms (86.5%) is spent before the first action vector exists and 11.40 ms (13.9%) is the denoiser the shortcut model would shorten. Eliminating the loop ENTIRELY is worth 2.25x (184.99 -> 82.09 ms) and still misses by 3.28x. t_prefix is linear in image tokens at 0.855 ms/token (177 tok -> 54.87 ms; 113 tok -> 27.71 ms) while t_expert does not depend on camera count at all. The lever is the conditioning-token count, not the NFE count.", "one_camera_floor": "1-cam 512: t_prefix 27.71 + t_unattr 15.40 = 43.11 ms fixed, N* = -1.59, still 1.72x the budget at N=0. 1-NFE measured 59.40 ms. Dropping a camera halves the prefix (177 -> 113 tokens) and is the only intervention that moved it, but not far enough.", "negative_result_resolution_knob_inert": "resize_imgs_with_padding 512 -> 256 did NOT reduce the token count (177 in both arms; the ckpt preprocessor owns the resize and the model-side override does not reach it) and did NOT reduce latency: 2-cam 190.20 ms at 256 vs 185.29 at 512; 1-cam 235.30 at 256 vs 157.39 at 512. A free 4x on the prefix is NOT available from this config, and any future edge plan that assumes it must first move the resize into the graph.", "paired_decider_0_0": "Canonical rig, 20 seeds x 3 suites x 2 paired arms (--path trochoid --compare trochoid --compare-env AEGIS_ROW_CENTRE=0.0), pose_noise 0,0, 8.4 s, harness_errors 0, keep=true. coverage_cont A 0.9354 -> 1.0000 (Welch p 1.35e-09, paired p 1.35e-09, Fisher p 1.0, succ 20/20 -> 20/20); B 0.9453 -> 1.0000 (p 5.26e-06, 5.26e-06, 1.0, 20/20 -> 20/20); R 0.9427 -> 1.0000 (p 1.24e-06, 1.24e-06, 1.0, 19/20 -> 20/20). Success 20/20/19-of-20 -> 20/20/20-of-20.", "coverage_cont": {"fixture_A": 1.0, "fixture_B": 1.0, "fixture_R": 1.0}, "p_values": {"fixture_A_welch": 1.3475417150857079e-09, "fixture_B_welch": 5.264280635564357e-06, "fixture_R_welch": 1.2399374592265432e-06, "fixture_A_fisher": 1.0, "fixture_B_fisher": 1.0, "fixture_R_fisher": 1.0, "keep_field": true}, "gate_on_vs_off": "Not applicable and not claimed: I4 touches no gate. rig header gate_mode=post-hoc, gate_max_jerk=0.618, vetoes 0 \u2014 bit-identical to run 243. Tier-4 gate untouched (G-rule).", "edge_budget": {"budget_ms": 25.0, "one_nfe_chunk_ms": 82.09, "ten_step_chunk_ms": 184.99, "hits_25ms": false, "speedup_vs_10step": 2.25, "vram_mib": 975.8, "fits_1p5GB": true, "params_le_500M": true, "binding_resource": "time, not memory"}, "gpu_dispatch": "NONE. Step B (Colab A100 shortcut/MeanFlow training) deliberately NOT BOOKED: the local pre-check proves the <=25 ms bar is unreachable for every NFE count, so an A100 burst would burn the spend-down budget to measure a bar it cannot pass. No remote GPU, no checkpoint download, no HF push. Colab reserve untouched.", "class_level": "Latency budgets can be unreachable for reasons orthogonal to the optimisation variable. Here the NFE count was never binding: a fixed per-chunk cost (prefix + preprocessing, 71.00 ms) overshoots the 25 ms target on its own. Shortcut/one-step samplers are the standard answer to flow-matching latency, and they are the wrong lever whenever the fixed cost dominates. This is I18/I22 in reverse: there a plan was limited by a representation rather than a policy, here a budget is limited by a representation rather than a function-evaluation count.", "evidence": ["results/I4_r244_stepA_split.json", "results/I4_r244_stepA_prefix_scaling.json", "results/I4_r244_stepA_1cam_floor.json", "results/aegis_v2/I4_r244_paired_n00.jsonl", "experiments/I4_r244_stepA_split.py", "experiments/I4_r244_stepA_prefix_scaling.py", "experiments/I4_r244_stepA_1cam_floor.py", "equations.md ROW I4 ((I4.1)-(I4.5))"], "honest_cost": "The 2.25x from deleting the flow loop is real and bankable on its own terms, but it does not reach the product target; anyone citing I4 for latency must cite 82.09 ms, not 25 ms. The A2/A3 runs are noisier than A (1-cam 10-step spread 190-310 ms across 15 timed chunks) because the 1-camera batch rebuilds the policy per case; the prefix medians (27.71/27.88) are stable and are the numbers the conclusion rests on, the totals are not used for any claim.", "predictions_refuted": "I4 assumed the 285 ms figure was dominated by the 10-step loop, so 1-NFE would land near 29 ms. MEASURED 82.09 ms. The loop was 113.99/184.99 = 61.6% of the chunk, not the whole story: 29.7% is the prefix and 8.7% is per-chunk preprocessing that no sampler change touches.", "frontier_after": "I4 closes as a SAMPLER question. It re-opens as a PREFIX question: the latency frontier is conditioning-token count per chunk (0.855 ms/image token, paid once per chunk, 86.5% of the surviving 1-NFE time), not NFE count. Interventions that follow from the measurement, in order: (a) cache the prefix across chunks instead of recomputing it (the KV cache is already built, then thrown away 50 steps later); (b) fewer image tokens per camera / one camera; (c) a smaller VLM trunk. None of these is a queued idea and none is executable in the CPU rig, so no next run is claimed. I4 stays discarded; the champion trochoid+ROW_CENTRE=1 stays frozen at fixture_B 1.0."}}
