{"id": "ITER35-FACC-DIRECTOR-716", "run": 716, "idea_tag": "FACC-v1 iter-12 single-brain fallback (SE3-conditioned contact potential + equivariant residual replacing flow-matching head)", "status": "invalid", "kind": "node", "type": "director_decision_refused_replay_32", "queue_empty_confirmed": true, "predicted_score": 78, "physical_run": false, "compare_keep": false, "segment": 15, "protocol_version": "v3", "note": "32nd replay refusal of eq78/FACC/SE3/energy-gated family (G3 retired: N70-N76, eq78, N74 frozen). Queue empty; no physical invocation."}
{"from": "ITER34-FACC-DIRECTOR-715", "to": "ITER35-FACC-DIRECTOR-716", "kind": "edge", "type": "director_decision_sequence_refused_32nd", "run_from": 715, "run_to": 716, "note": "Iter-12 FACC-v1 proposal refused; same retired family; queue still empty; no physical invocation."}
{"id": "ITER36-SEAC-DIRECTOR-717", "run": 717, "idea_tag": "SEAC iter-13 single-brain fallback (SE3 energy-affordance adaptive contact replacing pi0 flow head)", "status": "invalid", "kind": "node", "type": "director_decision_refused_replay_33", "queue_empty_confirmed": true, "predicted_score": 78, "physical_run": false, "compare_keep": false, "segment": 15, "protocol_version": "v3", "note": "33rd replay refusal of eq78/FACC/SE3/energy-gated family (G3 retired: N70-N76, eq78, N74 frozen). Queue empty (s0 run 497; s1 no queued; N198/N478d director-owned). No rig invocation; no synthetic claim; no equation change."}
{"from": "ITER35-FACC-DIRECTOR-716", "to": "ITER36-SEAC-DIRECTOR-717", "kind": "edge", "type": "director_decision_sequence_refused_33rd", "run_from": 716, "run_to": 717, "note": "Iter-13 SEAC proposal refused; same retired family; queue still empty; no physical invocation."}
{"id": "ITER37-FACC-E-DIRECTOR-718", "run": 718, "idea_tag": "FACC-E iter-14 single-brain fallback (SE3-conditioned force-adaptive contact control w/ affordance-equivalence energy field)", "status": "invalid", "kind": "node", "type": "director_decision_refused_replay_34", "queue_empty_confirmed": true, "predicted_score": 78, "physical_run": false, "compare_keep": false, "segment": 15, "protocol_version": "v3", "note": "34th replay refusal of eq78/FACC/SE3/energy-gated family (G3 retired: N70-N76, eq78, N74 frozen). Queue empty (s0 run 497; s1 no queued; N198/N478d director-owned). No rig invocation; no synthetic claim; no equation change."}
{"from": "ITER36-SEAC-DIRECTOR-717", "to": "ITER37-FACC-E-DIRECTOR-718", "kind": "edge", "type": "director_decision_sequence_refused_34th", "run_from": 717, "run_to": 718, "note": "Iter-14 FACC-E proposal refused; same retired family; queue still empty; no physical invocation."}
{"id": "ITER38-FACC-DIRECTOR-719", "run": 719, "idea_tag": "FACC iter-15 single-brain fallback (SE3-conditioned force-adaptive contact control replacing pi0 flow expert)", "status": "invalid", "kind": "node", "type": "director_decision_refused_replay_35", "queue_empty_confirmed": true, "predicted_score": 78, "physical_run": false, "compare_keep": false, "segment": 15, "protocol_version": "v3", "note": "35th replay refusal of eq78/FACC/SE3/energy-gated family (G3 retired: N70-N76, eq78, N74 frozen). Queue empty (s0 run 497; s1 no queued; N198/N478d director-owned). No rig invocation; no synthetic claim; no equation change."}
{"from": "ITER37-FACC-E-DIRECTOR-718", "to": "ITER38-FACC-DIRECTOR-719", "kind": "edge", "type": "director_decision_sequence_refused_35th", "run_from": 718, "run_to": 719, "note": "Iter-15 FACC proposal refused; same retired family; queue still empty; no physical invocation."}
{"id": "ITER39-FACC-DIRECTOR-720", "run": 720, "idea_tag": "FACC iter-16 single-brain fallback (SE3-conditioned force-adaptive contact control replacing pi0 flow expert)", "status": "invalid", "kind": "node", "type": "director_decision_refused_replay_36", "queue_empty_confirmed": true, "predicted_score": 78, "physical_run": false, "compare_keep": false, "segment": 15, "protocol_version": "v3", "note": "36th replay refusal of eq78/FACC/SE3/energy-gated family (G3 retired: N70-N76, eq78, N74 frozen). Queue empty; N198/N478d director-owned. No rig invocation."}
{"from": "ITER38-FACC-DIRECTOR-719", "to": "ITER39-FACC-DIRECTOR-720", "kind": "edge", "type": "director_decision_sequence_refused_36th", "run_from": 719, "run_to": 720, "note": "Iter-16 FACC proposal refused; same retired family; queue still empty; no physical invocation."}
{"id": "N565-P2-721", "run": 721, "idea_tag": "N565-P2 containment-cliff necessity (base 141600 at 4.00,800)", "status": "keep", "kind": "node", "type": "law_test_certificate_keep", "queue_empty_confirmed": false, "predicted": "19/20 failing exactly seed k=18", "physical_run": true, "compare_keep": true, "segment": 15, "protocol_version": "v3", "note": "P2 NECESSITY CONFIRMED: B 19/20 vs 1/20 baseline, Welch p 3.78e-15, Fisher p 5.82e-09, keep=true. Failing seed k=18 identified by rig-logged pose_noise (z 3.5234). reg_casts 2809=53^2 exact."}
{"from": "ITER39-FACC-DIRECTOR-720", "to": "N565-P2-721", "kind": "edge", "type": "refusal_then_measurement", "run_from": 720, "run_to": 721, "note": "After refusing the 36th FACC replay, executed the unexecuted N565 pre-registered arm (run 684 mis-ran it at 0,0 self-identical)."}
{"id": "ITER40-FACC-DIRECTOR-722", "run": 722, "idea_tag": "FACC-E iter-17 single-brain fallback (SE3 affordance-energy policy replacing flow-matching head)", "status": "invalid", "kind": "node", "type": "director_decision_refused_replay_37", "queue_empty_confirmed": true, "predicted_score": 78, "physical_run": false, "compare_keep": false, "segment": 15, "protocol_version": "v3", "note": "37th replay refusal of eq78/FACC/SE3/energy-gated family (G3 retired: N70-N76, eq78, N74 frozen). No executable arm in kaggle_aegis_sweep.py; no paired decider; refusal prevents G7-invalid claim. Champion trochoid B=1.00 frozen."}
{"from": "N565-P2-721", "to": "ITER40-FACC-DIRECTOR-722", "kind": "edge", "type": "measurement_then_refusal", "run_from": 721, "run_to": 722, "note": "After N565-P2 KEEP, director iter-17 FACC-E proposal refused; same retired family; queue still empty; no physical invocation."}
{"id": "ITER41-FACC-DIRECTOR-723", "run": 723, "idea_tag": "FACC-SE3 iter-18 single-brain fallback (SE3 energy attention + compliance policy replacing flow-matching)", "status": "invalid", "kind": "node", "type": "director_decision_refused_replay_38", "queue_empty_confirmed": true, "predicted_score": 78, "physical_run": false, "compare_keep": false, "segment": 15, "protocol_version": "v3", "note": "38th replay refusal of eq78/FACC/SE3/energy-gated family (G3 retired: N70-N76, eq78, N74 frozen). No executable arm in kaggle_aegis_sweep.py; no paired decider; refusal prevents G7-invalid claim. Champion trochoid B=1.00 frozen."}
{"from": "ITER40-FACC-DIRECTOR-722", "to": "ITER41-FACC-DIRECTOR-723", "kind": "edge", "type": "refusal_then_refusal", "run_from": 722, "run_to": 723, "note": "Consecutive director-replay refusals; queue still empty; no physical invocation either iteration."}
{"id": "ITER42-FACC-DIRECTOR-724", "run": 724, "idea_tag": "FACC iter-19 single-brain fallback (SE3-conditioned controller replacing flow-match head, deformable affordance field)", "status": "invalid", "kind": "node", "type": "director_decision_refused_replay_39", "queue_empty_confirmed": true, "predicted_score": 78, "physical_run": false, "compare_keep": false, "segment": 15, "protocol_version": "v3", "note": "39th replay refusal of eq78/FACC/SE3/energy-gated family (G3 retired: N70-N76, eq78, N74 frozen). No executable arm in kaggle_aegis_sweep.py; no paired decider; refusal prevents G7-invalid claim. Champion trochoid B=1.00 frozen."}
{"from": "ITER41-FACC-DIRECTOR-723", "to": "ITER42-FACC-DIRECTOR-724", "kind": "edge", "type": "refusal_then_refusal", "run_from": 723, "run_to": 724, "note": "Consecutive director-replay refusals; queue still empty; no physical invocation either iteration."}
{"id": "ITER43-FACC-DIRECTOR-725", "run": 725, "idea_tag": "FACC-EBM iter-20 single-brain fallback (SE3-conditioned energy contact field replacing Pi0 flow expert, force as in-context attention bias)", "status": "invalid", "kind": "node", "type": "director_decision_refused_replay_40", "queue_empty_confirmed": true, "predicted_score": 78, "physical_run": false, "compare_keep": false, "segment": 15, "protocol_version": "v3", "note": "40th replay refusal of eq78/FACC/SE3/energy-gated family (G3 retired: N70-N76, eq78, N74 frozen). No executable arm in kaggle_aegis_sweep.py; no paired decider; refusal prevents G7-invalid claim. Champion trochoid B=1.00 frozen."}
{"from": "ITER42-FACC-DIRECTOR-724", "to": "ITER43-FACC-DIRECTOR-725", "kind": "edge", "type": "refusal_then_refusal", "run_from": 724, "run_to": 725, "note": "Consecutive director-replay refusals; queue still empty; no physical invocation either iteration."}
{"compare_keep": false, "id": "ITER44-FACC-DIRECTOR-726", "idea_tag": "FACC iter-21 single-brain fallback (SE3 wrench-conditioned policy replacing flow-match head, energy in-context attention via Langevin)", "kind": "node", "note": "41st replay refusal of eq78/FACC/SE3/energy-gated family (G3 retired: N70-N76, eq78, N74 frozen). No executable arm in kaggle_aegis_sweep.py; no paired decider; refusal prevents G7-invalid claim. Champion trochoid B=1.00 frozen.", "physical_run": false, "predicted_score": 78, "protocol_version": "v3", "queue_empty_confirmed": true, "run": 726, "segment": 15, "status": "invalid", "type": "director_decision_refused_replay_41"}
{"from": "ITER43-FACC-DIRECTOR-725", "kind": "edge", "note": "Consecutive director-replay refusals; queue still empty; no physical invocation this row (measurement continues on N565-P1 arm, run 727).", "run_from": 725, "run_to": 726, "to": "ITER44-FACC-DIRECTOR-726", "type": "refusal_then_refusal"}
{"compare_keep": true, "coverage_cont": 0.9836, "fixture_B_transfer_success": 1.0, "id": "N565-P1-727", "idea_tag": "N565-P1 containment-cliff sufficiency boundary (base 117280 at 4.00,800, z_inf 3.017 vs W/st 3.020)", "kind": "node", "note": "P1 SUFFICIENCY HOLDS at the boundary: B 20/20 vs 0/20, Welch p 1.33e-17, Fisher p 1.45e-11, keep=true. reg_casts 2809=53^2 exact. Pairs with run 721 P2 necessity; P4 scale-invariance still open.", "physical_run": true, "pose_noise_cfg": "4.00,800", "run": 727, "segment": 15, "status": "keep", "type": "law_test_certificate"}
{"from": "ITER44-FACC-DIRECTOR-726", "kind": "edge", "note": "Refusal row followed by live-axis measurement in same iteration (cf. commit ec2f7aa runs 720-721); FACC refused, N565-P1 executed.", "run_from": 726, "run_to": 727, "to": "N565-P1-727", "type": "refusal_then_measure"}
{"id": "ITER45-SAFEFLOW-DIRECTOR-728", "run": 728, "idea_tag": "SAFE-Flow iter-22 single-brain fallback (SE3-adaptive force-energy flow replacing Pi0 expert, EBM deformable affordance + force setpoint)", "status": "invalid", "kind": "node", "type": "director_decision_refused_replay_42", "queue_empty_confirmed": true, "predicted_score": 82, "physical_run": false, "compare_keep": false, "segment": 15, "protocol_version": "v3", "note": "42nd replay refusal of eq78/FACC/SE3/energy-gated family (G3 retired: N70-N76, eq78, N74 frozen). No executable arm in kaggle_aegis_sweep.py; no paired decider; refusal prevents G7-invalid claim. Champion trochoid B=1.00 frozen."}
{"from": "ITER44-FACC-DIRECTOR-726", "to": "ITER45-SAFEFLOW-DIRECTOR-728", "kind": "edge", "type": "refusal_then_refusal", "run_from": 726, "run_to": 728, "note": "N565-P1-727 KEEP sits between; consecutive director-replay refusals; queue still empty; no physical invocation this row."}
{"id": "ITER46-FACC-DIRECTOR-729", "run": 729, "idea_tag": "FACC iter-23 single-brain fallback (SE3-conditioned force-adaptive contact control replacing flow-match head, contact-energy attention)", "status": "invalid", "kind": "node", "type": "director_decision_refused_replay_43", "queue_empty_confirmed": true, "predicted_score": 78, "physical_run": false, "compare_keep": false, "segment": 15, "protocol_version": "v3", "note": "43rd replay refusal of eq78/FACC/SE3/energy-gated family (G3 retired); queue empty; N198/N478d open_needs_director; N565-P3/P4 still the only open live axis, not executed this row (one idea per iteration)."}
{"from": "ITER45-SAFEFLOW-DIRECTOR-728", "to": "ITER46-FACC-DIRECTOR-729", "kind": "edge", "type": "refusal_then_refusal", "run_from": 728, "run_to": 729, "note": "Consecutive director-replay refusals; queue still empty; no physical invocation this row."}
{"id": "ITER47-FACC-DIRECTOR-730", "run": 730, "idea_tag": "FACC iter-3 single-brain fallback (SE3-conditioned energy affordance attention replacing flow-match head, 3-demo in-context adapt)", "status": "invalid", "kind": "node", "type": "director_decision_refused_replay_44", "queue_empty_confirmed": true, "predicted_score": 78, "physical_run": false, "compare_keep": false, "segment": 15, "protocol_version": "v3", "note": "44th replay refusal of eq78/FACC/SE3/energy-gated family (G3 retired: N70-N76, eq78, N74 frozen). No executable arm in kaggle_aegis_sweep.py; no paired decider; refusal prevents G7-invalid claim. Champion trochoid B=1.00 frozen."}
{"from": "ITER46-FACC-DIRECTOR-729", "to": "ITER47-FACC-DIRECTOR-730", "kind": "edge", "type": "refusal_then_refusal", "run_from": 729, "run_to": 730, "note": "Consecutive director-replay refusals; queue still empty; no physical invocation this row."}
{"id": "N565-P2b-731", "run": 731, "idea_tag": "N565-P2 necessity replication (base 147800 at 4.00,800, realized max z_inf 3.542, 2 seeds out)", "status": "keep", "kind": "node", "type": "law_test_certificate", "queue_empty_confirmed": true, "predicted_score": null, "physical_run": true, "compare_keep": true, "coverage_cont": 0.8859, "fixture_B_transfer_success": 0.9, "pose_noise_cfg": "4.00,800", "segment": 15, "protocol_version": "v3", "note": "P2 NECESSITY REPLICATED 2nd base: B 18/20 vs 0/20, Welch p 6.23e-11, Fisher p 3.35e-09, keep=true. Failing seeds exactly the 2 rig-logged out-of-window draws (z 3.472/3.542 > W/st 3.01). Pairs with run 721 P2 (141600) + run 727 P1 (117280); P1-111000 / P2-100100 / P4-scale-invariance still open."}
{"from": "ITER47-FACC-DIRECTOR-730", "to": "N565-P2b-731", "kind": "edge", "type": "refusal_then_measure", "run_from": 730, "run_to": 731, "note": "Refusal row followed by live-axis measurement in same iteration (cf. commits ec2f7aa, bd1860e); FACC refused, N565-P2b executed."}
{"id": "ITER48-FACC-DIRECTOR-732", "run": 732, "idea_tag": "FACC iter-4 single-brain fallback (SE3-conditioned residual replacing flow-matching, contact-wrench in-context key)", "status": "invalid", "kind": "node", "type": "director_decision_refused_replay_45", "queue_empty_confirmed": true, "predicted_score": 78, "physical_run": false, "compare_keep": false, "segment": 15, "protocol_version": "v3", "note": "45th replay refusal of eq78/FACC/SE3/energy-gated family (G3 retired: N70-N76, eq78, N74 frozen). No executable arm in kaggle_aegis_sweep.py; no paired decider; refusal prevents G7-invalid claim. Champion trochoid B=1.00 frozen."}
{"from": "ITER47-FACC-DIRECTOR-730", "to": "ITER48-FACC-DIRECTOR-732", "kind": "edge", "type": "refusal_then_refusal", "run_from": 730, "run_to": 732, "note": "Consecutive director-replay refusals (731 was live N565-P2b KEEP between them); queue still empty; no physical invocation this row."}
{"id": "ITER49-FACC-DIRECTOR-733", "run": 733, "idea_tag": "FACC iter-5 single-brain fallback (SE3-conditioned energy affordance field replacing flow-matching)", "status": "invalid", "kind": "node", "type": "director_decision_refused_replay_46", "queue_empty_confirmed": true, "predicted_score": 78, "physical_run": false, "compare_keep": false, "segment": 15, "protocol_version": "v3", "note": "46th replay refusal of eq78/FACC/SE3/energy-gated family (G3 retired: N70-N76, eq78, N74 frozen). No executable arm in kaggle_aegis_sweep.py; no paired decider; refusal prevents G7-invalid claim. Champion trochoid B=1.00 frozen."}
{"from": "ITER48-FACC-DIRECTOR-732", "to": "ITER49-FACC-DIRECTOR-733", "kind": "edge", "type": "refusal_then_refusal", "run_from": 732, "run_to": 733, "note": "Consecutive director-replay refusals (731 was live N565-P2b KEEP between 730/732); queue still empty; no physical invocation this row."}
{"id": "ITER50-FACC-DIRECTOR-734", "run": 734, "idea_tag": "FACC-SE3 iter-6 single-brain fallback (force-adaptive contact control replacing flow-matching head)", "status": "invalid", "kind": "node", "type": "director_decision_refused_replay_47", "queue_empty_confirmed": true, "predicted_score": 78, "physical_run": false, "compare_keep": false, "segment": 15, "protocol_version": "v3", "note": "47th replay refusal of eq78/FACC/SE3/energy-gated family (G3 retired: N70-N76, eq78, N74 frozen). No executable arm in kaggle_aegis_sweep.py; no paired decider; refusal prevents G7-invalid claim. Champion trochoid B=1.00 frozen."}
{"from": "ITER49-FACC-DIRECTOR-733", "to": "ITER50-FACC-DIRECTOR-734", "kind": "edge", "type": "refusal_then_refusal", "run_from": 733, "run_to": 734, "note": "Consecutive director-replay refusals (731/735 are live N565-P2 KEEPs around them); queue still empty; no physical invocation this row."}
{"id": "N565-P2c-735", "run": 735, "idea_tag": "N565-P2 necessity 3rd replication (base 100100 at 4.00,800)", "status": "keep", "kind": "node", "type": "paired_decider_keep", "queue_empty_confirmed": true, "physical_run": true, "compare_keep": true, "segment": 15, "protocol_version": "v3", "note": "B 18/20 vs 0/20, Welch p 6.67e-11, Fisher p 3.35e-09, rig keep=true. Exactly the 2 out-of-window seeds fail; realized max z_inf 3.549 matches prediction."}
{"from": "ITER50-FACC-DIRECTOR-734", "to": "N565-P2c-735", "kind": "edge", "type": "refusal_then_measure", "run_from": 734, "run_to": 735, "note": "Refusal row followed by live-axis measurement in same iteration (cf. commits ec2f7aa, bd1860e, 10242f1); FACC-SE3 refused, N565-P2c executed."}
{"id": "ITER51-FACC-DIRECTOR-736", "run": 736, "idea_tag": "FACC-SE3 iter-7 single-brain fallback (SE3-conditioned residual force policy + energy in-context attention replacing flow-matching)", "status": "invalid", "kind": "node", "type": "director_decision_refused_replay_48", "queue_empty_confirmed": true, "predicted_score": 78, "physical_run": false, "compare_keep": false, "segment": 15, "protocol_version": "v3", "note": "48th replay refusal of eq78/FACC/SE3/energy-gated family (G3 retired: N70-N76, eq78, N74 frozen). No executable arm in kaggle_aegis_sweep.py; no paired decider; refusal prevents G7-invalid claim. Champion trochoid B=1.00 frozen."}
{"from": "N565-P2c-735", "to": "ITER51-FACC-DIRECTOR-736", "kind": "edge", "type": "measure_then_refusal", "run_from": 735, "run_to": 736, "note": "Live N565-P2c KEEP followed by director-replay refusal; queue still empty; no physical invocation this row."}
{"id": "ITER52-FACC-DIRECTOR-737", "run": 737, "idea_tag": "FACC iter-8 single-brain fallback (SE3-conditioned contact policy + energy in-context attention + force feedback replacing flow-matching)", "status": "invalid", "kind": "node", "type": "director_decision_refused_replay_49", "queue_empty_confirmed": true, "predicted_score": 78, "physical_run": false, "compare_keep": false, "segment": 15, "protocol_version": "v3", "note": "49th replay refusal of eq78/FACC/SE3/energy-gated family (G3 retired: N70-N76, eq78, N74 frozen). No executable arm in kaggle_aegis_sweep.py; no paired decider; refusal prevents G7-invalid claim. Champion trochoid B=1.00 frozen."}
{"from": "ITER51-FACC-DIRECTOR-736", "to": "ITER52-FACC-DIRECTOR-737", "kind": "edge", "type": "refusal_then_refusal", "run_from": 736, "run_to": 737, "note": "Consecutive director-replay refusals; queue still empty; no physical invocation this row."}
{"id": "ITER53-FACC-DIRECTOR-738", "run": 738, "idea_tag": "FACC iter-9 single-brain fallback (SE3-conditioned energy policy replacing pi0 flow-match expert)", "status": "invalid", "kind": "node", "type": "director_decision_refused_replay_50", "queue_empty_confirmed": true, "predicted_score": 78, "physical_run": false, "compare_keep": false, "segment": 15, "protocol_version": "v3", "note": "50th replay refusal of eq78/FACC/SE3/energy-gated family (G3 retired: N70-N76, eq78, N74 frozen). No executable arm in kaggle_aegis_sweep.py; no paired decider; refusal prevents G7-invalid claim."}
{"from": "ITER52-FACC-DIRECTOR-737", "to": "ITER53-FACC-DIRECTOR-738", "kind": "edge", "type": "refusal_then_refusal", "run_from": 737, "run_to": 738, "note": "Consecutive director-replay refusals; queue still empty; no physical invocation this row."}
{"id": "ITER54-FACC-DIRECTOR-739", "run": 739, "idea_tag": "FACC iter-10 single-brain fallback (SE3 wrench-conditioned energy policy + compliance residual)", "status": "invalid", "kind": "node", "type": "director_decision_refused_replay_51", "queue_empty_confirmed": true, "predicted_score": 78, "physical_run": false, "compare_keep": false, "segment": 15, "protocol_version": "v3", "note": "51st replay refusal of eq78/FACC/SE3/energy-gated family (G3 retired: N70-N76, eq78, N74 frozen). No executable arm in kaggle_aegis_sweep.py; deformable/stiffness suite absent from rig; refusal prevents G7-invalid claim."}
{"from": "ITER53-FACC-DIRECTOR-738", "to": "ITER54-FACC-DIRECTOR-739", "kind": "edge", "type": "refusal_then_refusal", "run_from": 738, "run_to": 739, "note": "Consecutive director-replay refusals; queue still empty; no physical invocation this row."}
