{"run": 308, "ts": 1780000000, "idea": "N197", "status": "keep", "metric": 1.0, "metric_name": "fixture_B transfer_success (canonical rig, coverage_cont >= 0.90 per episode)", "segment": 15, "summary": "CLOSE-OUT CERTIFICATION MATRIX of the shipped stack (trochoid + N192 lattice H=0.6 + N195 d-law d=2a, CN=16 + N196 n=32) at 100 seeds x {A,B,R} x 2 arms on the SAME seeds x 7 pose-noise levels to 6.4 m/1280 deg, 3720 physical episodes, 0 harness errors. No new mechanism and no new claim: every mechanism certified here was already decided (I9, I10, I12, N192, N195 kept; I11/I15, I3, I4, I6, N191, N193, N196 discarded). fixture_B holds 100/100 at EVERY level to 3.2 m/640 deg and 20/20 at 6.4 m/1280 deg (rig keep=true at 5 of 7 levels; keep=false at 0,0 and 0.03,6 where the dose is a measured bit-identical no-op, k=1). The paired frozen single cast crosses 0.70 between 0.28 and 0.64 m. fixture_A and fixture_R are FLAT in sigma from 0.28 to 6.4 m (A 0.20/0.11/0.06/0.11/0.20, R 0.61/0.53/0.56/0.52/0.60) while reg_err_xy median stays 2.3-7.6 mm and reg_ok 0.99-1.00, which CONFIRMS N196.5 quantitatively: the binding constraint on A and R is the unobservable yaw, not registration.", "metrics": {"idea": "N197", "new_mechanism": false, "claim_type": "certification_only", "director_iteration": 55, "director_directive_adjudication": {"spec": "FACC: SE(3)-conditioned Force-Adaptive Contact Control replacing the flow-matching expert; dynamic affordance-equivalence (not a fixed manifold); energy-based physical in-context attention from info-theory; bridge flow-matching -> affordance-equivalence (first cross edge); validation on contact-rich SE(3) perturbation + OOD geometry, force-tracking error; predicted score 1.05 pts, P(keep>=70)=0.72", "executed": false, "exclusion_reasons": ["G3 retired family: 62nd re-derivation of manifold-switch / flow-bridge / energy-gated. FACC closed on physical data at r232/r233; FACC-E adjudicated not executed at r300; the same spec adjudicated not executed at r301-r307.", "G4-unpairable: the scrub rig has no pi0 expert, no SE(3) energy-attention keypoint, no wrench-conditioned action head, no stiffness axis and no force-excess metric, so the proposed validation cannot be run; building one is fabrication under G7.", "predicted-only keeps are banned this segment."], "ran_instead": "N197, the live frontier node on the N196->N197 edge"}, "rig": "experiments/kaggle_aegis_sweep.py (PyBullet DIRECT, system python3, git-clean vs HEAD, 0 rig edits)", "candidate_arm": "path=trochoid AEGIS_REG=depth AEGIS_REG_HALF_M=0.6 AEGIS_REG_N=32 AEGIS_REG_CASTS=0 AEGIS_REG_DFACT=2.0 AEGIS_REG_CN=16", "paired_baseline_arm": "--compare trochoid --compare-env AEGIS_REG_CASTS=1 (frozen single cast, same seeds)", "seeds": 100, "suites": ["fixture_A", "fixture_B", "fixture_R"], "episodes_total": 3720, "harness_errors": 0, "rig_timeout_s": 1200, "levels": {"0,0": {"n_seeds": 100, "k_casts": 1, "B_dose_succ": 1.0, "B_dose_covc": 1.0, "B_frozen_succ": 1.0, "B_frozen_covc": 1.0, "A_dose_succ": 1.0, "R_dose_succ": 1.0, "A_frozen_succ": 1.0, "R_frozen_succ": 1.0, "B_reg_ok": 1.0, "B_reg_err_mm_med": 7.75, "B_reg_err_mm_p90": 13.2, "B_dose_wall_s_ep": 0.0719, "B_frozen_wall_s_ep": 0.0942, "rig_compare_keep_B": false, "welch_p_B": null, "fisher_p_B": 1.0, "rays_per_ep": 1280}, "0.03,6": {"n_seeds": 100, "k_casts": 1, "B_dose_succ": 1.0, "B_dose_covc": 1.0, "B_frozen_succ": 1.0, "B_frozen_covc": 1.0, "A_dose_succ": 0.98, "R_dose_succ": 1.0, "A_frozen_succ": 0.98, "R_frozen_succ": 1.0, "B_reg_ok": 1.0, "B_reg_err_mm_med": 7.13, "B_reg_err_mm_p90": 18.55, "B_dose_wall_s_ep": 0.0711, "B_frozen_wall_s_ep": 0.1132, "rig_compare_keep_B": false, "welch_p_B": 1.0, "fisher_p_B": 1.0, "rays_per_ep": 1280}, "0.28,56": {"n_seeds": 100, "k_casts": 5, "B_dose_succ": 1.0, "B_dose_covc": 0.9977, "B_frozen_succ": 0.84, "B_frozen_covc": 0.9153, "A_dose_succ": 0.2, "R_dose_succ": 0.61, "A_frozen_succ": 0.17, "R_frozen_succ": 0.51, "B_reg_ok": 1.0, "B_reg_err_mm_med": 7.45, "B_reg_err_mm_p90": 17.85, "B_dose_wall_s_ep": 0.0762, "B_frozen_wall_s_ep": 0.0708, "rig_compare_keep_B": true, "welch_p_B": 0.000286, "fisher_p_B": 1.59e-05, "rays_per_ep": 7424}, "0.64,128": {"n_seeds": 100, "k_casts": 10, "B_dose_succ": 1.0, "B_dose_covc": 0.9836, "B_frozen_succ": 0.36, "B_frozen_covc": 0.4441, "A_dose_succ": 0.11, "R_dose_succ": 0.53, "A_frozen_succ": 0.01, "R_frozen_succ": 0.13, "B_reg_ok": 1.0, "B_reg_err_mm_med": 6.74, "B_reg_err_mm_p90": 18.14, "B_dose_wall_s_ep": 0.0892, "B_frozen_wall_s_ep": 0.046, "rig_compare_keep_B": true, "welch_p_B": 1.86e-20, "fisher_p_B": 2.33e-26, "rays_per_ep": 26624}, "1.6,320": {"n_seeds": 100, "k_casts": 22, "B_dose_succ": 1.0, "B_dose_covc": 0.9878, "B_frozen_succ": 0.02, "B_frozen_covc": 0.0453, "A_dose_succ": 0.06, "R_dose_succ": 0.56, "A_frozen_succ": 0.0, "R_frozen_succ": 0.02, "B_reg_ok": 1.0, "B_reg_err_mm_med": 7.55, "B_reg_err_mm_p90": 19.18, "B_dose_wall_s_ep": 0.157, "B_frozen_wall_s_ep": 0.0185, "rig_compare_keep_B": true, "welch_p_B": 3.94e-75, "fisher_p_B": 1.14e-55, "rays_per_ep": 124928}, "3.2,640": {"n_seeds": 100, "k_casts": 43, "B_dose_succ": 1.0, "B_dose_covc": 0.9827, "B_frozen_succ": 0.0, "B_frozen_covc": 0.0, "A_dose_succ": 0.11, "R_dose_succ": 0.52, "A_frozen_succ": 0.0, "R_frozen_succ": 0.0, "B_reg_ok": 1.0, "B_reg_err_mm_med": 7.49, "B_reg_err_mm_p90": 17.91, "B_dose_wall_s_ep": 0.3718, "B_frozen_wall_s_ep": 0.0117, "rig_compare_keep_B": true, "welch_p_B": 8.79e-158, "fisher_p_B": 2.21e-59, "rays_per_ep": 474368}, "6.4,1280": {"n_seeds": 20, "k_casts": 84, "B_dose_succ": 1.0, "B_dose_covc": 0.9875, "B_frozen_succ": 0.0, "B_frozen_covc": 0.0, "A_dose_succ": 0.2, "R_dose_succ": 0.6, "A_frozen_succ": 0.0, "R_frozen_succ": 0.0, "B_reg_ok": 1.0, "B_reg_err_mm_med": 5.89, "B_reg_err_mm_p90": 17.49, "B_dose_wall_s_ep": 1.2209, "B_frozen_wall_s_ep": 0.0119, "rig_compare_keep_B": true, "welch_p_B": 1.69e-31, "fisher_p_B": 1.45e-11, "rays_per_ep": 1807360}}, "certified_envelope": {"fixture_B": "transfer_success 1.00 at all seven levels 0,0 -> 6.4 m/1280 deg (100 seeds to 3.2 m, 20 seeds at 6.4 m); min per-episode coverage_cont 0.9219 at every noisy level, i.e. the 118/128 fine-grid floor. The upper end is OPEN: no crossing measured up to 6.4 m.", "frozen_single_cast": "crosses 0.70 between 0.28,56 (0.84) and 0.64,128 (0.36); consistent with N194's 0.36-0.40 m bracket.", "fixture_A": "0.98 at 0.03,6 -> 0.20 at 0.28,56 and flat thereafter; crosses 0.70 between 0.03 and 0.28 m.", "fixture_R": "1.00 at 0.03,6 -> 0.61 at 0.28,56 and flat thereafter; crosses 0.70 between 0.03 and 0.28 m."}, "load_bearing_results": ["Registration residual is FLAT in sigma for the candidate: fixture_B reg_err_xy median 7.75/7.13/7.45/6.74/7.55/7.49 mm and p90 13.2-19.2 mm over sigma 0 -> 6.4 m, reg_ok 1.00 at every level. 23x more pose noise costs the estimator nothing.", "fixture_A and fixture_R success is likewise FLAT from 0.28 to 6.4 m while their registration stays at 2.3-5.5 mm median and reg_ok 0.99-1.00. The registration axis is therefore exhausted on those suites too: their residual is the yaw term N193 named, which no amount of ray budget can observe on a rotationally symmetric face.", "The whole A/R/B separation appears between 0.03,6 and 0.28,56 and never moves again: A 0.98->0.20, R 1.00->0.61, B 1.00->1.00. B is immune because its yaw is PCA-corrected, A and R are not because they are round.", "N195.1's k-law is confirmed exactly on 100 seeds: measured casts 1/1/25/100/484/1849/7056 = k^2 with k = 1/1/5/10/22/43/84 = ceil(6 sigma/d)+1 at d = 2a = 0.4646 m.", "Cost of the certified envelope, stated: rays/episode 1,280 -> 7,424 -> 26,624 -> 124,928 -> 474,368 -> 1,807,360 and wall 0.072 -> 0.372 -> 1.22 s/ep (candidate) against 0.012 s/ep for the frozen single cast, i.e. 31x at 3.2 m and 102x at 6.4 m. Accuracy above sigma 0.28 m is bought with a k^2 ray schedule; below it the dose is a free no-op."], "regression": {"rig_edits": 0, "rig_clean_vs_git_HEAD": true, "cross_run_reproduction": "candidate fixture_B at 0.28,56 on the first 20 seeds reproduces run 303's champion BIT-IDENTICALLY (coverage_cont 0.9984, 20/20); the 100-seed value is 0.9977, 100/100.", "dose_inert_below_slack": "at 0,0 and 0.03,6 the candidate is k=1 and coverage delta is exactly 0.0000 on all 600 episodes with rig keep=false, confirming N192's 'dose inert while sigma <= a'."}, "synthetic_proxy": null, "evidence": ["results/aegis_v2/N197_r310_s100_0,0.jsonl", "results/aegis_v2/N197_r310_s100_0.03,6.jsonl", "results/aegis_v2/N197_r310_s100_0.28,56.jsonl", "results/aegis_v2/N197_r310_s100_0.64,128.jsonl", "results/aegis_v2/N197_r310_s100_1.6,320.jsonl", "results/aegis_v2/N197_r310_s100_3.2,640.jsonl", "results/aegis_v2/N197_r310b_s20_6.4,1280.jsonl", "results/aegis_v2/N197_matrix.json", "experiments/N197_readout.py", "experiments/N197_r310_*.log"], "equation_row": "N197", "graph": "N196->N197->N198"}, "next": "N198 stays open and needs the director: the only real defect left (unobservable yaw on rotationally symmetric faces) is a provable no-op on fixture_B, where the G4 bar is anchored and now saturated at 1.00 for 600/600 B episodes. Nothing further on the registration axis can move the primary metric."}
{"run": 309, "ts": 1780000000, "idea": "N199", "status": "keep", "metric": 1.0, "metric_name": "fixture_B transfer_success (canonical rig, coverage_cont >= 0.90 per episode, held-out seed base)", "segment": 15, "summary": "HELD-OUT SEED-BASE REPLICATION of the N197 saturation + the resolution of the primary metric. Same shipped stack (trochoid + N192 lattice H=0.6 + N195 d=2a/CN=16 + N196 n=32), same --compare-env AEGIS_REG_CASTS=1 pairing, on a DISJOINT seed base AEGIS_BASE_SEED=250000 (0 prior episodes in the 250xxx block): 3 pose-noise levels x 100 seeds x {A,B,R} x 2 arms = 1800 physical episodes, 0 harness errors, rig byte-identical to git HEAD. fixture_B lattice 100/100 at each of 0.03,6 / 0.28,56 / 3.2,640 = 300/300 fresh seeds (600/600 with N197 at sigma <= 3.2 m); rig keep=true at 0.28,56 (B 0.9269->0.9973, Welch 1.11e-04, Fisher 1.48e-06) and 3.2,640 (0.0231->0.9856, W 9.91e-91, F 2.23e-57); keep=false at 0.03,6 with coverage delta exactly 0.0000 (k=1, the measured no-op). Per-episode floor is the same number twice: min coverage_cont 0.9219 on 200/200 fresh lattice episodes at both noisy levels, matching N197. reg_err_xy median on B 6.90/7.39/7.69 mm vs N197 7.29/7.48/7.56, reg_ok 1.00 in all 600 held-out lattice episodes; N195 k-law reproduces (k = 1/5/43). NEW FACT: coverage_cont is QUANTISED - over 600 lattice episodes on fixture_B it takes EXACTLY SIX values, all on the k/128 grid with k EVEN (k = 118/120/122/124/126/128, counts 20/12/20/4/19, 525/600 at exactly 1.0, zero off-grid, zero odd k). So the primary metric quantum on the suite the bar is anchored to is 2/128 = 0.0156; the 0.90 threshold is k >= 115.2 whose first legal value is 116 = 0.90625; the observed B minimum k = 118 sits EXACTLY ONE QUANTUM above the bar. fixture_A is on k/96 and fixture_R on k/192. This closes the loop on N196: the last estimator lever (2H/(n-1)) was worth 0.026 = 1.7 quanta against a 20-seed paired SE of 0.0083, i.e. already below the metric integer quantum. No new mechanism, no new envelope.", "metrics": {"idea": "N199", "new_mechanism": false, "claim_type": "replication_and_metric_resolution", "director_iteration": 56, "director_directive_adjudication": {"spec": "SEAFP: SE(3)-Equivariant Affordance-Energy Flow Policy. Learn E(s,a,c) over SE(3) contact frames; affordance = level set of E; action = energy-min flow; replace the flow-matching head with FACC + energy-based physical in-context attention; bridge flow-matching -> affordance-equivalence (pi0 fixed affordance manifold assumed, dynamic); validation on contact-rich suites (insertion, wiping, tool-use) under pose/stiffness shift; ablate w/o SE(3)-conditioning, w/o energy attention, w/o affordance-equivalence loss; predicted 1.0 pts, claims to supersede runs 306/308", "executed": false, "exclusion_reasons": ["G3 retired family: 63rd re-derivation of manifold-switch / flow-bridge / energy-gated, by construction (level-set affordance over SE(3) contact frames = manifold-switch; flow-matching -> affordance-equivalence = the flow bridge; E(s,a,c) with energy-min action = energy gating). FACC closed on physical data at r232/r233; FACC-E adjudicated not executed at r300; the same spec adjudicated not executed at r301-r308.", "G4-unpairable: the scrub rig has no pi0 expert (so no \"pi0 fixed affordance manifold\" to be violated), no SE(3) energy-attention keypoint, no wrench-conditioned action head, no stiffness axis, no insertion/wiping/tool-use suite, and no force-excess metric (so \"force-violation rate\" cannot be computed). Building any of them is fabrication under G7.", "Predicted-only keeps are banned this segment (G7 SEGMENT + METRIC FREEZE)."], "ran_instead": "N199, the one question still open to a worker inside segment 15 with the primary metric frozen: is N197 saturation seed-base-independent?"}, "rig": "experiments/kaggle_aegis_sweep.py (PyBullet DIRECT, system python3), rig byte-identical to git HEAD (0 edits); every non-provenance header field identical to the N197 file compared against", "fixture_B_transfer_success": {"0.03,6": 1.0, "0.28,56": 1.0, "3.2,640": 1.0, "seeds_per_level": 100, "held_out_base": 250000}, "fixture_B_coverage_cont": {"0.03,6": 1.0, "0.28,56": 0.9973, "3.2,640": 0.9856}, "fixture_B_coverage_cont_min": {"0.03,6": 1.0, "0.28,56": 0.9219, "3.2,640": 0.9219}, "fixture_B_reg_err_xy_median_m": {"0.03,6": 0.0069, "0.28,56": 0.00739, "3.2,640": 0.00769}, "fixture_B_reg_ok": 1.0, "fixture_A_transfer_success": {"0.03,6": 1.0, "0.28,56": 0.24, "3.2,640": 0.17}, "fixture_R_transfer_success": {"0.03,6": 1.0, "0.28,56": 0.67, "3.2,640": 0.56}, "paired_single_cast_baseline_B": {"0.03,6": {"covc": 1.0, "success": 1.0}, "0.28,56": {"covc": 0.9269, "success": 0.81}, "3.2,640": {"covc": 0.0231, "success": 0.01}}, "compare": {"0.03,6": {"keep": false, "reason": "coverage delta exactly 0.0000 on 200 paired episodes, k=1 lattice == frozen single cast (measured no-op, N197.4)"}, "0.28,56": {"keep": true, "welch_p_coverage_cont": 0.00011119619802243356, "fisher_p_success": 1.4845070643582561e-06, "delta": 0.0705}, "3.2,640": {"keep": true, "welch_p_coverage_cont": 9.912650806443553e-91, "fisher_p_success": 2.230848300131498e-57, "delta": 0.9625}}, "metric_resolution": {"episodes": 600, "suites": "fixture_B lattice arm only (3 levels x 2 disjoint 100-seed bases)", "distinct_coverage_cont_values": [0.921875, 0.9375, 0.953125, 0.96875, 0.984375, 1.0], "as_k_over_128": [118, 120, 122, 124, 126, 128], "counts": [20, 12, 20, 4, 19, 525], "off_grid": 0, "odd_k_occurrences": 0, "quantum_B": 0.015625, "threshold_0.90_means_k_ge": 115.2, "first_legal_even_k": 116, "first_legal_even_value": 0.90625, "observed_min_k": 118, "margin_above_bar_quanta": 1, "fixture_A_denominator": 96, "fixture_R_denominator": 192, "consequence": "N196 parity lever worth 0.026 coverage_cont = 1.7 quanta vs a 20-seed paired SE of 0.0083 -> below the metric quantum, unrecoverable by any seed count"}, "episodes_total": 1800, "harness_errors": 0, "seeds_per_level": 100, "levels": ["0.03,6", "0.28,56", "3.2,640"], "seed_bases": {"certified": "91000", "held_out": "250000"}, "k_law_casts": {"0.03,6": 1, "0.28,56": 25, "3.2,640": 1849}, "harness_notes": ["First attempt omitted the AEGIS_REG/REG_* env stack, so registration never ran (reg_err_xy_m absent on all 1800 episodes) and a keep verdict was still emitted on a no-op comparison, because AEGIS_REG defaults to \"\". Kept as results/aegis_v2/N199_HARNESSERROR_regoff_s100_*.jsonl, sets no metric; re-run with aegis_reg=\"depth\"."], "queue_hygiene": "ideas.md rows I20/I4/I6 were still marked queued although executed and closed as runs 241/244/245; re-marked done so no worker re-runs a closed idea. No rig edit, no metric.", "evidence": ["results/aegis_v2/N199_r309_s100_0.03_6.jsonl", "results/aegis_v2/N199_r309_s100_0.28_56.jsonl", "results/aegis_v2/N199_r309_s100_3.2_640.jsonl", "results/aegis_v2/N199_HARNESSERROR_regoff_s100_0.03_6.jsonl", "experiments/N199_matrix.json", "experiments/N199_readout.py", "equations.md ROW N199"]}, "next": "N198 stays OPEN and director-owned. N199.3 supplies the reason a worker cannot re-anchor the bar: fixture_B is one quantum above threshold and takes six values in 600 episodes, so the G4 anchor has no dynamic range by construction. Nothing else in segment 15 is executable."}
