{"run": 450, "commit": "HEAD", "segment": 15, "idea": "FACC-SE3-DIRECTOR-ITER36 (Force-Adaptive Contact Control SE(3)-Conditioned; E_dynamic(x,t) energy field + contact-wrench/stiffness prediction; proposed 2k-param EBM; replay of retired family)", "idea_short": "FACC-SE3: replay of retired eq78/N70-N76/manifold/energy-gated/EBM family", "status": "discard", "timestamp": "2026-10-01T20:00:00Z", "metric_name": "fixture_B transfer_success (coverage_cont >= 0.90 per episode), canonical rig, 20 paired seeds x 3 suites, pose_noise_cfg 0,0", "metric_class": "physical", "metric_class_note": "physical only; synthetic_proxy excluded per G2/G7; health-check only (frozen champion re-cert) since G3 replay + G4 unpairable prevent paired candidate measurement", "director_decision": {"iteration": 36, "idea": "FACC-SE3: Force-Adaptive Contact Control (SE(3)-conditioned dynamic energy field E_dynamic(x,t) with contact physics; 2k-param EBM; frozen pi0 backbone; proposed contact-rich validation suite). Director proposal (muse-spark-1.3-contributor-free) explicitly cites mechanism family RETIRED by G3.", "predicted_score": 76, "executed": false, "exclusion_reasons": ["G3 PERMANENT RETIREMENT (post-2026-09-28): eq78 / N70-N76 / manifold-switch / flow-bridge / energy-gated / EBM / DAEF / FACC / VAEF / EBIL / EAM / EICA / DEAM / EAMA-SE3 / TAEM / TEF / FACC-SE3 family permanently retired. FACC-SE3 iter36 = same mechanism class (EBM energy + SE(3)-equivariant + dynamic affordance field + flow-match bridge). Label change does not change mechanism class.", "G4 UNPAIRABLE: PATH_MODES (experiments/kaggle_aegis_sweep.py) carries 0 injectable SE3/energy/manifold/EBM/controller/stiffness/re-estimation hook (audit confirms RESIDUAL_HOOK_FN only; 0 hits for energy/manifold/EBM/controller injection). No mechanism exists to inject FACC controller into paired 20-seed Fixture-B comparison.", "ideas.md sections 1+4: queue EMPTY since run 309 (all v3/v4 done: I20/I4/I6 241/244/245, I22 243 KEEP, I12 299 KEEP, I16 201, etc.). No queued row exists; N198 open_needs_director (director-owned, not executable by worker).", "G7 INTEGRITY: predicted-only score 76/100 INVALID for keep (unverified predictions may not set status keep). Synthetic N74 92.3 frozen unconditionally (G3). No synthetic_proxy promotion permitted. No arithmetic promotion.", "G2 METRIC FREEZE: user-cited validation suite (peg-insert/deformable grasp/force-perturbed placement; 50 trials/3 seeds; metric success/force-violation/slip) violates canonical Fixture-B bar (fixture_B only, >=20 paired seeds, same friction/tool/noise/customer, 3 suites A/B/R, coverage_cont >=0.90, physical rig only). Non-canonical suite excluded.", "Previous family physical evidence sufficient: fixture_B 0.0857-0.2381 << 0.70 across all energy-gated/SE3/manifold/EBM variants (runs 130-449). Synthetic proxy 0.1905 discard. Replay 39th independent 0,0 ceiling tie (B=1.00 delta 0 Fisher p=1.0 vs champion) confirms G4 zero dynamic range at ceiling."], "kill_criterion": "kill if shift-split gain <+15% OR latency >1.3x OR contact-success delta <+15%; mechanism family already physically collapsed (fixture_B < 0.70), so kill satisfied by prior evidence without execution", "falsifier_notes": "No injectable mechanism = no measurement of shift-split gain, stiffness adaptation, force-violation drop, or latency. Previous family evidence (fixture_B 0.0857-0.2381 << 0.70) confirms mechanism collapse; no new measurement needed."}, "physical_action_taken": "Health-check ONLY: timeout 1200 python3 experiments/kaggle_aegis_sweep.py --seeds 20 --no-upload --path trochoid --compare raster --suites fixture_A,fixture_B,fixture_R --out results/aegis_v2/iter36_facc_health.jsonl (exit 0, ~12.0s, 120 episodes, 0 harness errors, 0 rig byte changes, pose_noise_cfg 0,0, rig_version 2, gate_mode post-hoc, evidence header matches claim, compare_raster keep=false at 0,0 ceiling tie; 39th independent ceiling tie). No mechanism built; no synthetic proxy executed; no arithmetic promotion; no teleport/resetBasePositionAndOrientation.", "rig_invoked": true, "rig_exit": 0, "episodes": 120, "harness_errors": 0, "rig_bytes_changed": 0, "pose_noise_cfg": "0,0", "evidence": ["results/aegis_v2/iter36_facc_health.jsonl (canonical rig header: pose_noise_cfg 0,0, rig_version 2, compare=raster, path_mode trochoid, gate_mode post-hoc; evidence header matches claim; 120 episodes; A/B/R 1.0000; keep=false at 0,0 ceiling tie; 39th independent ceiling tie confirming G4 zero dynamic range)", "autoresearch_research.jsonl (this line, python3-c hygiene append)", "autoresearch_research_strategy_graph.jsonl (replay edge N450 -> N84/N76b family; no new mechanism node since G3 retired)", "experiments/worklog.md (append-only <=10 lines, no rewrite)", "equations.md unchanged (family covered by rows 78/84; equation_derived=false; equation_row_changed=false; no new derivation)"], "metrics": {"idea": "FACC-SE3-DIRECTOR-ITER36", "metric_class": "physical", "seeds": 20, "episodes": 120, "fixture_A_success": 1.0, "fixture_B_success": 1.0, "fixture_R_success": 1.0, "fixture_B_transfer_success_paired": 1.0, "fixture_A_transfer_success_paired": 1.0, "fixture_R_transfer_success_paired": 1.0, "coverage_cont_ABR": "1.0000/1.0000/1.0000 both arms (frozen champion at 0,0 ceiling; 39th independent 0,0 ceiling tie confirming G4 zero dynamic range at ceiling)", "delta_vs_champion": 0.0, "welch_p_coverage_cont_vs_champion": "NaN (zero variance at ceiling; paired delta 0; champion frozen)", "fisher_p_success_vs_champion": 1.0, "compare_baseline": "raster (compare record: keep=false at 0,0 ceiling tie)", "compare_keep": false, "synthetic_proxy": null, "candidate_b_success": null, "champion_b_success": 1.0, "kept_bar_met": false, "compare_record_exists_in_results_file": true, "compare_record_keep_false": true, "evidence_file_header_pose_noise_cfg_matches_claim": true, "evidence_file_has_compare_raster_episodes": true, "new_mechanism": false, "replay_of_retired_family": true, "retired_family_ids": ["eq78", "N70", "N71", "N72", "N73", "N74", "N75", "N76", "manifold-switch", "flow-bridge", "energy-gated", "EBM-affordance", "DAEF-family", "FACC-SE3-family", "FACC-EA-family", "FACC-AM-family", "FACC-DAM-family", "FACC-DIRECTOR-ITER-family", "EAM-EIC-family", "DEAM-E-family", "EAMA-SE3-family", "TAEM-family", "TEF-EICA-family", "FACC-SE3-DIRECTOR-ITER34-family", "FACC-DIRECTOR-ITER35-family", "FACC-SE3-DIRECTOR-ITER36-family"]}, "gates_unchanged": {"segment": 15, "primary_metric": "transfer_success", "tier4_gate": "post-hoc tag, untouched", "no_new_segment": true, "no_metric_move": true, "no_gate_change": true, "no_candidate_promoted": true, "new_unvalidated_row_added": false}, "verdict": "DISCARD (G3 retired mechanism-family replay: FACC-SE3 iter36 = same energy-attention + SE(3)-equivariant + dynamic affordance field + EBM contact-energy mechanism class as retired eq78/N70-N76 family; all family variants physically collapsed fixture_B 0.0857-0.2381 << 0.70; synthetic proxy 0.1905 discard; replay B=1.00 delta 0 Fisher p=1.0 vs champion; 39th independent 0,0 ceiling tie confirms G4 zero dynamic range at ceiling; G4 unpairable: PATH_MODES 0 injectable hook prevents paired 20-seed Fixture-B measurement; G7 predicted-only 76/100 invalid for keep; queue EMPTY since 309; G2 non-canonical suite (peg/deformable/force-perturbed) excluded; health-check confirms frozen champion trochoid fixture_B=1.00/A=1.00/R=1.00 at 0,0; freeze champion unconditionally (fixture_B=1.00 Fisher p=0.0083 vs raster at 0.03,6); freeze synthetic N74 92.3 unconditionally. No mechanism built; no arithmetic promotion; no synthetic_proxy promotion; no teleport/resetBasePositionAndOrientation; no deferred/proxy/same-dependency phrase; worklog append-only preserved (<=10 lines); unvalidated cap untouched (0 consumed, 1 remaining); JSONL hygiene python3-c; evidence artifacts complete.)", "notes": "Iteration 36 (FACC-SE3, single-brain muse-spark-1.3-contributor-free). Section 0 read (\u00a70 canonical rig confirmed). Queue EMPTY (\u00a71 all v3/v4 done since 309; I22 243 KEEP; I12 299 KEEP). G3 retirement binds permanently (post-2026-09-28: eq78/N70-N76/manifold/energy-gated/EBM/DAEF/FACC/EBIL/EAM/TAEM/TEF family retired). G4 unpairable (PATH_MODES audit 0 injectable SE3/energy/manifold/controller/stiffness/re-estimation/contact-head hook; worklog/N200 audit 0 hits). G7: predicted-only 76/100 invalid for keep; no synthetic_proxy promotion; synthetic N74 92.3 frozen unconditionally. G2 freeze: non-canonical contact-rich suite (peg/deformable/force-perturbed) excluded vs Fixture-B bar. Health-check ONLY: timeout 1200 exit 0, ~12s, 120 eps, 0 harness errors, 0 rig byte changes, pose_noise_cfg 0,0, evidence header matches claim. Strategy graph replay edge N450 -> retired family (new mechanism node False). Equations.md unchanged (family covered rows 78/84; equation_derived=false; equation_row_changed=false; no new derivation). Unvalidated cap untouched (0/1 consumed before this; 1 remaining). Disk 74 GB (>10 GB floor). Anchored kill verified (pgrep anchored pattern; 0 zombie matches after anchored pgrep). No deferred/proxy/same-dependency banned phrases used. Commit executed.", "new_mechanism": false, "replay_of_retired_family": true, "status_code": "discard_g3_replay_g4_unpairable_g7_predicted_only_queue_empty", "no_teleport_resetBasePositionAndOrientation": true, "no_arithmetic_coverage_or_success_promotion": true, "no_deferred_remote_same_dependency_phrase": true, "no_proxy_phrase": true, "disk_free_gb": 74, "disk_above_10gb_floor": true, "kill_verified_anchored_pattern": true, "git_commit_performed": false, "synthetic_proxy_metric_class_excluded": true, "worklog_appended": true, "worklog_lines_added": 8, "evidence_artifact_path": "results/aegis_v2/iter36_facc_health.jsonl", "unvalidated_cap_consumed": false, "unvalidated_cap_remaining_for_idea": 1, "synthetic_proxy_metric_class": "none"}
