{"run": 542, "segment": 15, "idea": "FACC-director-iter8-refusal", "status": "invalid", "metric_name": "fixture_B transfer_success (canonical rig v2, PyBullet DIRECT) -- paired vs frozen champion trochoid on the same 20 seeds", "metric_class": "physical (3-seed hygiene smoke only, PyBullet DIRECT, system python3 CPU; synthetic_proxy EXCLUDED per G2/G7)", "metrics": {"idea": "FACC", "seeds": 3, "rig_invocations": 1, "episodes": 9, "harness_errors": 0, "pose_noise_cfg": "0,0", "compare_champion": "trochoid (B=1.00, coverage_cont 1.0000, Fisher p=0.0083 vs raster)", "fixture_B_transfer_success": 1.0, "coverage_cont": 1.0, "compare_keep": false, "g3_refusal_this_iteration": {"director_proposal": "FACC Force-Adaptive Contact Control, SE(3)-conditioned energy-based in-context attention replacing Pi0 flow-mat, predicted 74 keep", "verdict": "REFUSED (66th since r497)", "reason": "label rotation of permanently retired eq78/energy-gated/flow-bridge/FACC/SEAF/SE3 family (G3); rig has no stiffness/SE3/EBM/contact-force-gating hook (scripted controller + registration only); force channel falsified (N479); queue empty (N198/N478d director-owned)"}, "hygiene_smoke": "results/aegis_v2/N542_refusal_health.jsonl: trochoid --compare trochoid, fixture_B 3/3 SUCCESS, coverage_cont 1.0, 0 harness errors", "rig_executed_for_idea": false}, "verdict": "INVALID (66th G3 replay refusal + hygiene; no live axis; N198/N478d director-owned)", "notes": "Queue empty in ideas.md s1/s4. Tier-4 gate unchanged (post-hoc tag); equations.md unchanged; worklog append-only.", "timestamp": "2026-10-05T02:00:00Z", "source": "director iter-8 FACC proposal + canonical rig hygiene"}
{"run": 543, "segment": 15, "idea": "FACC-director-iter9-refusal", "status": "invalid", "metric_name": "fixture_B transfer_success (canonical rig v2, PyBullet DIRECT) -- paired vs frozen champion trochoid on the same 20 seeds", "metric_class": "physical (3-seed hygiene smoke only, PyBullet DIRECT, system python3 CPU; synthetic_proxy EXCLUDED per G2/G7)", "metrics": {"idea": "FACC", "seeds": 3, "rig_invocations": 1, "episodes": 9, "harness_errors": 0, "pose_noise_cfg": "0,0", "compare_champion": "trochoid (B=1.00, coverage_cont 1.0000, Fisher p=0.0083 vs raster)", "fixture_B_transfer_success": 1.0, "coverage_cont": 1.0, "compare_keep": false, "g3_refusal_this_iteration": {"director_proposal": "FACC Force-Adaptive Contact Control iter9, SE(3)-conditioned contact policy replacing flow-matching, predicted 76 keep", "verdict": "REFUSED (67th since r497)", "reason": "label rotation of permanently retired eq78/energy-gated/flow-bridge/FACC/SEAF/SE3 family (G3); rig has no stiffness/SE3/EBM/contact-energy hook (scripted controller + registration only); force channel falsified (N479); queue empty (N198/N478d director-owned)"}, "hygiene_smoke": "results/aegis_v2/N543_refusal_health.jsonl: trochoid --compare trochoid, fixture_B 3/3 SUCCESS, coverage_cont 1.0, 0 harness errors", "rig_executed_for_idea": false}, "verdict": "INVALID (67th G3 replay refusal + hygiene; no live axis; N198/N478d director-owned)", "notes": "Queue empty in ideas.md s1/s4. Tier-4 gate unchanged (post-hoc tag); equations.md unchanged; worklog append-only.", "timestamp": "2026-10-05T02:05:00Z", "source": "director iter-9 FACC proposal + canonical rig hygiene"}
{"run": 544, "segment": 15, "idea": "SEAAF-director-iter10-refusal", "status": "invalid", "metric_name": "fixture_B transfer_success (canonical rig v2, PyBullet DIRECT) -- paired vs frozen champion trochoid on the same 20 seeds", "metric_class": "physical (3-seed hygiene smoke only, PyBullet DIRECT, system python3 CPU; synthetic_proxy EXCLUDED per G2/G7)", "metrics": {"idea": "SEAAF", "seeds": 3, "rig_invocations": 1, "episodes": 3, "harness_errors": 0, "pose_noise_cfg": "0,0", "compare_champion": "trochoid (B=1.00, coverage_cont 1.0000, Fisher p=0.0083 vs raster)", "fixture_B_transfer_success": 1.0, "coverage_cont": 1.0, "compare_keep": false, "g3_refusal_this_iteration": {"director_proposal": "SEAAF SE(3)-Conditioned Energy-Based Adaptive Affordance Field replacing pi0 flow-mat head with energy-based in-context attention + FACC stiffness modulation, predicted 78 keep", "verdict": "REFUSED (68th since r497)", "reason": "label rotation of permanently retired eq78/energy-gated/flow-bridge/FACC/SEAF/SE3 family (G3); rig has no stiffness/SE3/EBM/contact-energy hook (scripted controller + registration only); force channel falsified (N479); queue empty (N198/N478d director-owned)"}, "hygiene_smoke": "results/aegis_v2/N544_refusal_health.jsonl: trochoid --compare trochoid --seeds 3 --suites fixture_B, 3/3 SUCCESS, coverage_cont 1.0, 0 harness errors, ~2.6s CPU", "rig_executed_for_idea": false}, "verdict": "INVALID (68th G3 replay refusal + hygiene; no live axis; N198/N478d director-owned)", "notes": "Queue empty in ideas.md s1/s4. Tier-4 gate unchanged (post-hoc tag); equations.md unchanged; worklog append-only.", "timestamp": "2026-10-05T02:30:00Z", "source": "director iter-10 SEAAF proposal + canonical rig hygiene"}
{"run": 545, "segment": 15, "idea_id": "N545_hygiene_N478d_frontier", "status": "unvalidated", "strategy": "Queue-empty hygiene (run 545): 3-seed paired champion smoke (B 3/3 covc 1.000) verifies rig health; no harness errors; frontier expansion of open_needs_director N478d (elongated-face residual, PCA yaw-branch flip) selected from strategy graph; different strategy category (critical x assumption-violation / geometric-residual) chosen per protocol; no queued idea available; G3 replay family permanently retired (eq78/energy-gated/FACC); no deferred/proxy/proxy-gain phrase; anchored kill executed; disk >10GB; worklog +1 line; graph node N478d_frontier + edge N544->N478d_frontier added", "metrics": {"fixture_B_transfer_success": 1.0, "coverage_cont": 1.0, "seeds": 3, "episodes": 9, "harness_errors": 0, "idea": "N545_hygiene_N478d_frontier", "compare_champion": "trochoid", "synthetic_proxy": false}, "timestamp": "2026-10-05T02:45:00Z", "evidence": ["results/aegis_v2/N545_hygiene_smoke.jsonl", "equations.md#N478d", "autoresearch_research_strategy_graph.jsonl#N478d_frontier"]}
{"run": 546, "segment": 15, "idea": "FACC-SE3-director-iter14-refusal", "status": "invalid", "metric_name": "fixture_B transfer_success (canonical rig v2, PyBullet DIRECT) -- paired vs frozen champion trochoid on the same 20 seeds", "metric_class": "physical (3-seed hygiene smoke only, PyBullet DIRECT, system python3 CPU; synthetic_proxy EXCLUDED per G2/G7)", "metrics": {"idea": "FACC-SE3", "seeds": 3, "rig_invocations": 1, "episodes": 3, "harness_errors": 0, "pose_noise_cfg": "0,0", "compare_champion": "trochoid (B=1.00, coverage_cont 1.0000, Fisher p=0.0083 vs raster)", "fixture_B_transfer_success": 1.0, "coverage_cont": 1.0, "compare_keep": false, "g3_refusal_this_iteration": {"director_proposal": "Run 546 FACC-SE3 Force-Adaptive Contact Control, dynamic SE(3)-conditioned affordance field + energy-based attention replacing flow-matching head, predicted 76 keep", "verdict": "REFUSED (69th since r497)", "reason": "label rotation of permanently retired eq78/energy-gated/flow-bridge/FACC/SEAF/SE3 family (G3); rig has no stiffness/SE3/EBM/peg-hole/deformable hook (scripted controller + registration only); force channel falsified (N479); queue empty (N198/N478d director-owned)"}, "hygiene_smoke": "results/aegis_v2/N546_refusal_health.jsonl: trochoid --compare trochoid --seeds 3 --suites fixture_B, 3/3 SUCCESS, coverage_cont 1.0/1.0/1.0, 0 harness errors, ~2s CPU", "rig_executed_for_idea": false}, "verdict": "INVALID (69th G3 replay refusal + hygiene; no live axis; N198/N478d director-owned)", "notes": "Queue empty in ideas.md s1/s4. Tier-4 gate unchanged (post-hoc tag); equations.md unchanged; worklog append-only.", "timestamp": "2026-10-05T03:00:00Z", "source": "director iter-14 FACC-SE3 proposal + canonical rig hygiene"}
{"run": 547, "segment": 15, "idea": "FACC-director-iter15-refusal", "status": "invalid", "metric_name": "fixture_B transfer_success (canonical rig v2, PyBullet DIRECT) -- paired vs frozen champion trochoid on the same 20 seeds", "metric_class": "physical (3-seed hygiene smoke only, PyBullet DIRECT, system python3 CPU; synthetic_proxy EXCLUDED per G2/G7)", "metrics": {"idea": "FACC", "seeds": 3, "rig_invocations": 1, "episodes": 3, "harness_errors": 0, "pose_noise_cfg": "0,0", "compare_champion": "trochoid (B=1.00, coverage_cont 1.0000, Fisher p=0.0083 vs raster)", "fixture_B_transfer_success": 1.0, "coverage_cont": 1.0, "compare_keep": false, "g3_refusal_this_iteration": {"director_proposal": "FACC Force-Adaptive Contact Control iter15, SE(3)-conditioned energy-based affordance field + force-gated residual replacing flow-matching head, predicted 76 keep", "verdict": "REFUSED (70th since r497)", "reason": "label rotation of permanently retired eq78/energy-gated/flow-bridge/FACC/SEAF/SE3 family (G3); rig has no stiffness/friction-stiffness/contact-energy hook (scripted controller + registration only); force channel falsified (N479); queue empty (N198/N478d director-owned)"}, "hygiene_smoke": "results/aegis_v2/N547_refusal_health.jsonl: trochoid --compare trochoid --seeds 3 --suites fixture_B, 3/3 SUCCESS, coverage_cont 1.0/1.0/1.0, 0 harness errors, ~2s CPU", "rig_executed_for_idea": false}, "verdict": "INVALID (70th G3 replay refusal + hygiene; no live axis; N198/N478d director-owned)", "notes": "Queue empty in ideas.md s1/s4. Tier-4 gate unchanged (post-hoc tag); equations.md unchanged; worklog append-only.", "timestamp": "2026-10-05T03:30:00Z", "source": "director iter-15 FACC proposal + canonical rig hygiene"}
{"run": 548, "segment": 15, "idea": "FACC-director-iter16-refusal", "status": "invalid", "metric_name": "fixture_B transfer_success (canonical rig v2, PyBullet DIRECT) -- paired vs frozen champion trochoid on the same 3 seeds", "metric_class": "physical (3-seed hygiene smoke only, PyBullet DIRECT, system python3 CPU; synthetic_proxy EXCLUDED per G2/G7)", "metrics": {"idea": "FACC", "seeds": 3, "rig_invocations": 1, "episodes": 9, "harness_errors": 0, "pose_noise_cfg": "0,0", "compare_champion": "trochoid (B=1.00, coverage_cont 1.0000, Fisher p=0.0083 vs raster)", "fixture_B_transfer_success": 1.0, "fixture_B_coverage_cont": 1.0, "fixture_A_transfer_success": 1.0, "fixture_R_transfer_success": 1.0, "g3_replay_count": 71, "episodes_spent_on_proposal": 0}, "evidence": ["results/aegis_v2/N548_refusal_health.jsonl"]}
{"run": 549, "segment": 15, "idea": "EC-FACC-director-iter17-refusal", "status": "invalid", "metric_name": "fixture_B transfer_success (canonical rig v2, PyBullet DIRECT) -- paired vs frozen champion trochoid on the same 3 seeds", "metric_class": "physical (3-seed hygiene smoke only, PyBullet DIRECT, system python3 CPU; synthetic_proxy EXCLUDED per G2/G7)", "metrics": {"idea": "EC-FACC", "seeds": 3, "rig_invocations": 1, "episodes": 3, "harness_errors": 0, "pose_noise_cfg": "0,0", "compare_champion": "trochoid (B=1.00, coverage_cont 1.0000, Fisher p=0.0083 vs raster)", "fixture_B_transfer_success": 1.0, "fixture_B_coverage_cont": 1.0, "g3_replay_count": 72, "episodes_spent_on_proposal": 0}, "evidence": ["results/aegis_v2/N549_refusal_health.jsonl"], "hygiene_smoke": "results/aegis_v2/N549_refusal_health.jsonl: trochoid --compare trochoid --seeds 3 --suites fixture_B, 3/3 SUCCESS, coverage_cont 1.0/1.0/1.0, 0 harness errors, ~1.9s CPU", "rig_executed_for_idea": false, "verdict": "INVALID (72nd G3 replay refusal + hygiene; no live axis; N198/N478d director-owned)", "notes": "Queue empty in ideas.md s1/s4. Director EC-FACC iter17 (SE(3)-equivariant energy field on dynamic affordance manifold, force/pose history in-context attention) = label rotation of retired eq78/energy-gated/flow-bridge/FACC/SEAF/SE3 family (G3); rig has no energy/stiffness/SE3/EBM hook (scripted controller + registration only); force channel falsified (N479); no affordance-resample guard exists in rig so the proposed fix is unexecutable. Tier-4 gate unchanged (post-hoc tag); equations.md unchanged; worklog append-only.", "timestamp": "2026-10-04T18:10:00Z", "source": "director iter-17 EC-FACC proposal + canonical rig hygiene"}
{"run": 550, "segment": 15, "idea": "FACC-director-iter18-refusal", "status": "invalid", "metric_name": "fixture_B transfer_success (canonical rig v2, PyBullet DIRECT) -- paired vs frozen champion trochoid on the same 3 seeds", "metric_class": "physical (3-seed hygiene smoke only, PyBullet DIRECT, system python3 CPU; synthetic_proxy EXCLUDED per G2/G7)", "metrics": {"idea": "FACC", "seeds": 3, "rig_invocations": 1, "episodes": 3, "harness_errors": 0, "pose_noise_cfg": "0,0", "compare_champion": "trochoid (B=1.00, coverage_cont 1.0000, Fisher p=0.0083 vs raster)", "fixture_B_transfer_success": 1.0, "coverage_cont": 1.0, "welch_p": null, "fisher_p": null, "compare_keep": false, "g3_replay_count": 73, "episodes_spent_on_proposal": 0}, "evidence": ["results/aegis_v2/N550_refusal_health.jsonl"], "hygiene_smoke": "results/aegis_v2/N550_refusal_health.jsonl: fixture_B 3/3 SUCCESS covc 1.0, 0 harness errors", "g3_refusal_this_iteration": {"director_proposal": "FACC Force-Adaptive Contact Control iter18, SE(3)-conditioned dynamic affordance manifold replacing flow-matching head, energy-based in-context attention for stiffness/damping, predicted 76 keep", "refusal_reason": "G3-retired eq78/flow-bridge/energy-gated/FACC family permanently retired; rig has no stiffness/SE3/EBM/contact-energy hook; force channel falsified N479; queue empty (N198/N478d open_needs_director); 0 episodes spent on proposal"}}
{"run": 551, "segment": 15, "idea": "MA-FACC-director-iter19-refusal", "status": "invalid", "metric_name": "fixture_B transfer_success (canonical rig v2, PyBullet DIRECT) -- paired vs frozen champion trochoid on the same 20 seeds", "metric_class": "physical (3-seed hygiene smoke only, PyBullet DIRECT, system python3 CPU; synthetic_proxy EXCLUDED per G2/G7)", "metrics": {"idea": "MA-FACC", "seeds": 3, "rig_invocations": 1, "episodes": 9, "harness_errors": 0, "pose_noise_cfg": "0,0", "compare_champion": "trochoid (B=1.00, coverage_cont 1.0000, Fisher p=0.0083 vs raster)", "fixture_B_transfer_success": 1.0, "fixture_A_transfer_success": 1.0, "fixture_R_transfer_success": 1.0, "coverage_cont_B": 1.0, "g3_replay_count": 74, "evidence": "results/aegis_v2/MAFACC_iter19_hygiene.jsonl"}}
{"run": 552, "segment": 15, "idea": "FACC-SE3-director-iter20-refusal", "status": "invalid", "metric_name": "fixture_B transfer_success (canonical rig v2, PyBullet DIRECT) -- paired vs frozen champion trochoid on the same 3 seeds", "metric_class": "physical (3-seed hygiene smoke only, PyBullet DIRECT, system python3 CPU; synthetic_proxy EXCLUDED per G2/G7)", "metrics": {"idea": "FACC-SE3", "seeds": 3, "rig_invocations": 1, "episodes": 3, "harness_errors": 0, "pose_noise_cfg": "0,0", "compare_champion": "trochoid (B=1.00, coverage_cont 1.0000, Fisher p=0.0083 vs raster)", "fixture_B_transfer_success": 1.0, "coverage_cont": 1.0, "welch_p": null, "fisher_p": null, "compare_keep": false, "g3_replay_count": 75, "episodes_spent_on_proposal": 0}, "evidence": ["results/aegis_v2/N552_refusal_health.jsonl"], "hygiene_smoke": "results/aegis_v2/N552_refusal_health.jsonl: fixture_B 3/3 SUCCESS covc 1.0/1.0/1.0, 0 harness errors", "g3_refusal_this_iteration": {"director_proposal": "FACC-SE3 iter20 Force-Adaptive Contact Control SE(3)-conditioned deformable affordance field + energy-based affordance equivalence replacing flow-matching, predicted 76 keep", "refusal_reason": "G3-retired eq78/flow-bridge/energy-gated/FACC family permanently retired; rig has no stiffness/SE3/EBM/contact-force-gated-residual hook; force channel falsified N479; queue empty (N198/N478d open_needs_director); 0 episodes spent on proposal"}, "verdict": "INVALID (75th G3 replay refusal + hygiene; no live axis; N198/N478d director-owned)", "notes": "Queue empty in ideas.md s1/s4. Tier-4 gate unchanged (post-hoc tag); equations.md unchanged; worklog append-only.", "timestamp": "2026-10-04T19:00:00Z", "source": "director iter-20 FACC-SE3 proposal + canonical rig hygiene"}
{"run": 553, "segment": 15, "idea": "SEEAC-director-iter21-refusal", "status": "invalid", "metric_name": "fixture_B transfer_success (canonical rig v2, PyBullet DIRECT) -- paired vs frozen champion trochoid on the same 3 seeds", "metric_class": "physical (3-seed hygiene smoke only, PyBullet DIRECT, system python3 CPU; synthetic_proxy EXCLUDED per G2/G7)", "metrics": {"idea": "SEEAC", "seeds": 3, "rig_invocations": 1, "episodes": 3, "harness_errors": 0, "pose_noise_cfg": "0,0", "compare_champion": "trochoid (B=1.00, coverage_cont 1.0000, Fisher p=0.0083 vs raster)", "fixture_B_transfer_success": 1.0, "coverage_cont": 1.0, "welch_p": null, "fisher_p": null, "compare_keep": false, "g3_replay_count": 76, "episodes_spent_on_proposal": 0}, "evidence": ["results/aegis_v2/N553_refusal_health.jsonl"], "hygiene_smoke": "results/aegis_v2/N553_refusal_health.jsonl: fixture_B 3/3 SUCCESS covc 1.0, 0 harness errors", "g3_refusal_this_iteration": {"director_proposal": "SEEAC iter21 SE(3)-Equivariant Energy Affordance Control replacing flow-mat head with EBM in-context attention over contact affordances + force-gated FACC policy, predicted 74.5 keep", "refusal_reason": "G3-retired eq78/flow-bridge/energy-gated/manifold-switch/FACC family permanently retired; rig has no SE3/EBM/stiffness/contact-energy hook; force channel falsified N479; queue empty (N198/N478d open_needs_director); 0 episodes spent on proposal"}, "verdict": "INVALID (76th G3 replay refusal + hygiene; no live axis; N198/N478d director-owned)", "notes": "Queue empty in ideas.md s1/s4. Tier-4 gate unchanged (post-hoc tag); equations.md unchanged; worklog append-only.", "timestamp": "2026-10-04T19:10:00Z", "source": "director iter-21 SEEAC proposal + canonical rig hygiene"}
{"run": 554, "segment": 15, "idea": "FACC-director-iter22-refusal", "status": "invalid", "metric_name": "fixture_B transfer_success (canonical rig v2, PyBullet DIRECT) -- paired vs frozen champion trochoid on the same 3 seeds", "metric_class": "physical (3-seed hygiene smoke only, PyBullet DIRECT, system python3 CPU; synthetic_proxy EXCLUDED per G2/G7)", "metrics": {"idea": "FACC", "seeds": 3, "rig_invocations": 1, "episodes": 3, "harness_errors": 0, "pose_noise_cfg": "0,0", "compare_champion": "trochoid (B=1.00, coverage_cont 1.0000, Fisher p=0.0083 vs raster)", "fixture_B_transfer_success": 1.0, "coverage_cont": 1.0, "welch_p": null, "fisher_p": null, "compare_keep": false, "g3_replay_count": 77, "episodes_spent_on_proposal": 0}, "evidence": ["results/aegis_v2/N554_refusal_health.jsonl"], "hygiene_smoke": "results/aegis_v2/N554_refusal_health.jsonl: fixture_B 3/3 SUCCESS covc 1.0/1.0/1.0, 0 harness errors", "g3_refusal_this_iteration": {"director_proposal": "FACC iter22 Force-Adaptive Contact Control, SE(3)-conditioned energy policy replacing flow-matching action-expert, physical in-context attention over force/torque + SE(3) error, predicted 77 keep", "refusal_reason": "G3-retired eq78/flow-bridge/energy-gated/manifold-switch/FACC family permanently retired; rig has no stiffness/SE3/EBM/contact-energy/peg-wipe hook (scripted controller + registration only); force channel falsified N479; predicted-score/novelty claims banned from keeps by segment+metric freeze (G7); queue empty (N198/N478d open_needs_director); 0 episodes spent on proposal"}, "verdict": "INVALID (77th G3 replay refusal + hygiene; no live axis; N198/N478d director-owned)", "notes": "Queue empty in ideas.md s1/s4 (grep queued = 0). Tier-4 gate unchanged (post-hoc tag); equations.md unchanged; worklog append-only.", "timestamp": "2026-10-04T19:30:00Z", "source": "director iter-22 FACC proposal + canonical rig hygiene"}
{"run": 555, "segment": 15, "idea": "FACC-E-director-iter23-refusal", "status": "invalid", "metric_name": "fixture_B transfer_success (canonical rig v2, PyBullet DIRECT) -- paired vs frozen champion trochoid on the same 3 seeds", "metric_class": "physical (3-seed hygiene smoke only, PyBullet DIRECT, system python3 CPU; synthetic_proxy EXCLUDED per G2/G7)", "metrics": {"idea": "FACC-E", "seeds": 3, "rig_invocations": 1, "episodes": 9, "harness_errors": 0, "pose_noise_cfg": "0,0", "compare_champion": "trochoid (B=1.00, coverage_cont 1.0000, Fisher p=0.0083 vs raster)", "fixture_B_transfer_success": 1.0, "fixture_A_transfer_success": 1.0, "fixture_R_transfer_success": 1.0, "coverage_cont_B": 1.0, "welch_p": null, "fisher_p": null, "compare_keep": false, "g3_replay_count": 78, "episodes_spent_on_proposal": 0}, "evidence": ["results/aegis_v2/N555_refusal_health.jsonl"], "hygiene_smoke": "results/aegis_v2/N555_refusal_health.jsonl: fixture_A/B/R 3/3 SUCCESS covc 1.0 x9, 0 harness errors", "g3_refusal_this_iteration": {"director_proposal": "FACC-E iter23 SE(3)-conditioned Force-Adaptive Contact Control with Energy Attention replacing flow-matching head, force-adaptive impedance at 10Hz, predicted 76 keep", "refusal_reason": "G3-retired eq78/flow-bridge/energy-gated/manifold-switch/FACC family permanently retired; rig has no stiffness/friction/SE3/EBM/contact-energy hook (scripted controller + registration only); force channel falsified N479; predicted-score/novelty claims banned from keeps by segment+metric freeze (G7); queue empty, grep queued table rows = 0 (N198/N478d director-owned); 0 episodes spent on proposal"}, "verdict": "INVALID (78th G3 replay refusal + hygiene; no live axis; N198/N478d director-owned)", "notes": "Queue empty in ideas.md s1/s4. Tier-4 gate unchanged (post-hoc tag); equations.md unchanged; worklog append-only. Disk 6.3GB free (<10GB, pre-existing /tmp unrelated dirs, not caused by this run: 23.9 KiB).", "timestamp": "2026-10-04T20:00:00Z", "source": "director iter-23 FACC-E proposal + canonical rig hygiene"}
