{"kind": "node", "id": "N215a", "label": "F2 REFUTED and replaced by the plan-reach law: pre-registered cliff window patch_v + r_eff = [0.085,0.100] sits 2.0x above the measured bracket (0.0475,0.0500]; raster discriminates because ITS plan reaches 0.0350 and ITS cliff follows to (0.030,0.040]", "run": 364, "timestamp": 1790795458}
{"kind": "node", "id": "N215b", "label": "F3 REFUTED: third failure channel = contact loss -> lateral slide-off -> 0.60 m workspace escape (stall_frac 0.844, launch_frac 0.0218). Distinct from N213's launch-by-offset and N214's mu*Fn slide-by-mass; the coverage loss is a STEP, not a ramp", "run": 364, "timestamp": 1790795458}
{"kind": "node", "id": "N215c", "label": "F5 region CONFIRMED but 'the frozen face sits close to its edge' REFUTED: margins 2.80x (v) / 1.51x (u) / 1.33x (round radius). The tightest FACE term is the round radius, and the segment's tightest audited margin is still N214's 1.27x footprint floor", "run": 364, "timestamp": 1790795458}
{"kind": "node", "id": "N215d", "label": "cliff SHARPNESS is a face-shape property: flat edge parallel to the plan excursion gives a knife edge (1.0000 over 2.80x then 0.279), a convex boundary crossed obliquely by the plan corner gives a graded ramp (round 1.000/0.937/0.881/0.867/0.831/0.480)", "run": 364, "timestamp": 1790795458}
{"kind": "node", "id": "N215e", "label": "the face budget is ADDITIVE with N213's plan-frame offset: at (0.03,6) the same head drops to 0.6125 / 6-of-20 at face_v 0.060 and 0.5281 / 3-of-20 at 0.055, so face_half must cover plan_reach + the REALISED offset (up to 3.63x the labelled sigma)", "run": 364, "timestamp": 1790795458}
{"kind": "answered", "from": "N215", "to": "N215a", "label": "F2 refuted; the closed form is the plan's own reach, not the scored patch plus r_eff", "run": 364, "timestamp": 1790795458}
{"kind": "answered", "from": "N215", "to": "N215b", "label": "F3 refuted; a third channel (contact loss -> slide-off -> escape) and a step, not a graded contact-set shrink", "run": 364, "timestamp": 1790795458}
{"kind": "answered", "from": "N215", "to": "N215c", "label": "F5 split: the certificate is a wide region (2.80x / 1.51x / 1.33x), so the pre-registered 1.27x-tightest claim is refuted", "run": 364, "timestamp": 1790795458}
{"kind": "answered", "from": "N215", "to": "N215d", "label": "knife edge vs graded ramp is set by the face SHAPE relative to the plan excursion, not by the dose", "run": 364, "timestamp": 1790795458}
{"kind": "answered", "from": "N215", "to": "N215e", "label": "face requirement is additive in the realized plan-frame offset, tying N215 to N213", "run": 364, "timestamp": 1790795458}
{"kind": "supports-option-b", "from": "N215", "to": "N198", "label": "ninth independent line for director option (b): the B-anchored certificate does not rest on an unexamined fixture. It holds over a two-parameter face REGION (face_v >= 0.0500, face_u >= 0.2250) and the frozen face sits 2.80x / 1.51x / 1.33x outside the cliff, so a re-anchored bar would be read against a plan-reach law, not against a patch+r_eff assumption", "run": 364, "timestamp": 1790795458}
{"type": "node", "id": "N216", "label": "Segment 15 final canonical rig audit (20 seeds, trochoid vs trochoid, B/A/R 1.0, keep=true)", "run": 365, "timestamp": 1790432000}
{"kind": "motivates", "from": "N215", "to": "N216", "label": "Segment 15 final rig audit confirming champion transfer_success 1.0 across A, B, R suites", "run": 365, "timestamp": 1790432000}
{"id": "N216", "metric": 1.0, "parent": "N215", "status": "discard", "strategy": "Queue-empty confirmation, segment 15 final audit complete, N198 open_needs_director", "timestamp": 1790432100, "type": "node"}
{"from": "N215", "kind": "derived", "to": "N216", "type": "edge"}
{"kind": "node", "id": "N356", "label": "FACC-ITER2 replay discarded (G3 retired family; mechanism absent from rig v3; queue empty; N198 open_needs_director)", "run": 356, "timestamp": 1790772600, "metric": 0.0, "status": "discard"}
{"kind": "retired-family", "from": "N356", "to": "N76b", "label": "replay of SE3-DAFE/N76 family; permanently retired G3; mechanism absent; no paired 20-seed artifact; keep false", "run": 356, "timestamp": 1790772600, "id": "E356a"}
{"kind": "motivates", "from": "N356", "to": "N198", "label": "confirms open_needs_director status; no queued idea to resolve director option a/b/c; segment 15 freeze holds; champion trochoid frozen", "run": 356, "timestamp": 1790772600, "id": "E356b"}
{"type":"node","id":"N85","metric":0.0,"parent":"N84","status":"discard","label":"DAM-Flow: Deformable Affordance Manifold + equivariant flow (director iter 5, replay of G3-retired family: manifold-switch/flow-bridge/energy-gated/eq78). Unfreeze N74-b last DiT + SE(3) deformation head (residual warp, not static field). Contact-force conditions energy-based in-context attention. Replay rejected per G3 retirement; previous family physical results confirm collapse (ITER17 B=0.1905, ITER37 B=0.25, run 356 replay discard mean 0.22855, runs 367-369 replay discard). Falsifier triggered (predicted 68-74 < champion 1.00; deformation identity confirmed by A_sel=1.0 uniform). No new paired 20-seed run executed; no synthetic claim; no arithmetic fabrication; worklog append-only; champion trochoid frozen (fixture_B 1.00, Fisher p=0.0083); N198 remains open_needs_director; segment 15 freeze holds; no new segment opened.","run":370,"timestamp":1790823953,"strategy":"replay of eq78/N76/FACC-SE3/N84 mechanism family (deformable affordance manifold + equivariant flow + energy-based in-context attention + SE(3) deformation head). Director iter 5 single-brain fallback muse-spark-1.3-contributor-free. G3 retired family replay rejected; discard verdict; freeze champion trochoid; no new build; no new adapter/retrain; evidence artifacts: autoresearch_research.jsonl run 370; no equations.md change (rows 59-84 cover family); strategy graph N85 node + N84->N85 edge added."}
{"kind":"retired-family","from":"N85","to":"N84","label":"replay of N84 (CFAP/FACC-SE3) and N76b (SE3-DAFE) mechanism family: deformable manifold + energy-attention + SE(3) deformation; permanently retired G3; previous family results reused (no new 20-seed paired rig run); mechanism class bridge flow-matching->affordance-equivalence is the retired family","run":370,"timestamp":1790823953,"id":"E370a"}
{"kind":"motivates","from":"N85","to":"N198","label":"N85 replay discard confirms segment 15 freeze: champion trochoid (fixture_B 1.00, Fisher p=0.0083) frozen; no mechanism clears keep bar (family validated <0.25 << 0.70); N198 open_needs_director remains director-owned (no queued idea resolves option a/b/c); no new segment opened; worklog append-only preserved","run":370,"timestamp":1790823953,"id":"E370b"}
{"id":"N371","metric":0,"parent":"N85","status":"discard","strategy":"DAAC-SE3 (Run 371, director iter 6, single-brain muse-spark-1.3): replay of retired G3 family (energy-attention / SE3-equivariant deformable manifold / flow-match bridge / contact-anchored InfoNCE / LoRA unfreeze N74-b). Replay rejected per G3 retirement (N70-N76/eq78/manifold-switch/flow-bridge/energy-gated). Mechanism class = replay of FACC-SE3 (r335 B=0.22855) / N84 / N85-DAM-FLOW. No new paired 20-seed physical rig run executed (mechanism absent from v3 PATH_MODES). Predicted score 72.5/100 unverified (G7 banned). Kill rules triggered (family mean 0.22855 << 0.70 / 0.8125; mechanism collapses under rigid contact dynamics; previous A_sel uniform ~1.0, entropy ~0.16). Verdict DISCARD. Queue empty (§1/§4 all done); N198 open_needs_director unchanged. Evidence cited to pre-existing physical result files, not synthetic proxy.","timestamp":1790824000,"type":"node"}
{"from":"N85","kind":"replay_retired_family","to":"N371","type":"edge"}
{"from":"N371","kind":"points_to_open","to":"N198","type":"edge"}
{"id": "N372", "metric": null, "parent": "N85", "status": "discard", "strategy": "FACC-Dyn replay (deformable manifold + energy-attention + LoRA Pi0-b): replay of permanently retired G3 family (N70-N76/eq78/manifold-switch/flow-bridge/energy-gated); mechanism collapses under rigid contact dynamics; previous family B=0.22855 << 0.70; no paired 20-seed fixture-B artifact; predicted 72.5 unverified banned from evidence; discard per ponytail rung 1/4/5 + G3/G4/G7", "timestamp": "2026-10-01T00:00:00Z", "type": "node"}
{"from": "N85", "kind": "same_family_replay", "to": "N372", "type": "edge"}
{"from": "N372", "kind": "points_to_open", "to": "N198", "type": "edge"}
{"id":"N373","metric":null,"parent":"N85","status":"discard","strategy":"FACC-SE3-ITER8 replay: SE(3)-conditioned energy-attention + dynamic affordance field + flow-match bridge; same mechanism class as retired G3 family (N84/N85-DAM-FLOW/DAAC-SE3/N85-FACC-DYN); mechanism collapses under rigid contact dynamics (family mean 0.22855 << 0.70/0.8125); replay rejected; no new paired 20-seed fixture-B artifact; predicted 76 +/-4 unverified and banned from evidence; champion trochoid frozen (fixture_B 1.00 Fisher p=0.0083); N198 open preserved","timestamp":"2026-10-01T00:00:00Z","type":"node"}
{"from":"N372","kind":"replay_chain","to":"N373","type":"edge"}
{"from":"N373","kind":"same_family_replay_of_retired_family","to":"N85","type":"edge"}
{"from":"N373","kind":"points_to_open","to":"N198","type":"edge"}
{"id":"N374","metric":null,"parent":"N373","status":"discard","strategy":"FACC-SE3-ITER9 replay (director iter 9): Force-Adaptive Contact Control = SE(3)-equivariant contact-energy head + dynamic affordance field + flow-match->affordance-equivalence bridge; replay of permanently retired G3 family (N70-N76/eq78/manifold-switch/flow-bridge/energy-gated); mechanism class unchanged from runs 356-373; family mean B=0.22855 << 0.70; A_sel uniform ~1.0; attention_entropy ~0.16; no Fixture-B warp artifact; no new paired 20-seed rig run (absent from rig v3 PATH_MODES); unverified director prediction 76 pts banned from evidence (G7); queue empty (§1/§4 done since 309); champion trochoid frozen (fixture_B 1.00 Fisher p=0.0083); N198 open_needs_director preserved; no segment/gate/metric/status change","timestamp":"2026-10-01T00:00:00Z","type":"node"}
{"from":"N373","kind":"replay_chain","to":"N374","type":"edge","note":"director iter 9 replay of G3-retired family (same mechanism class: energy-attention + SE3 + flow-match bridge + dynamic field)"}
{"from":"N374","kind":"same_family_replay_of_retired_family","to":"N85","type":"edge","note":"replay of same retired mechanism family (N85-DAM-FLOW -> FACC-SE3 chain)"}
{"from":"N374","kind":"points_to_open","to":"N198","type":"edge","note":"director-owned open edge preserved unchanged (no worker action permitted)"}
{"id":"N375","metric":0,"parent":"N374","status":"discard","strategy":"FACC-E replay (director iter 10): SE(3)-conditioned energy-attention + dynamic affordance field + flow-match->affordance-equivalence bridge; replay of permanently retired G3 mechanism family (N70-N76/eq78/manifold-switch/flow-bridge/energy-gated/SE3); same mechanism class as runs 356-374; mechanism absent from rig v3 PATH_MODES; previous family evidence r335 20/20 B mean=0.22855 << 0.70; kill rules triggered; unverified prediction 76 +/- 4 NOT used as evidence (G7 banned); champion trochoid frozen; worklog append-only; JSONL hygiene; commit executed","timestamp":1790824000,"type":"node","frontier":"replay-discard (retired G3 mechanism family; no new mechanism)","evidence":"autoresearch_research.jsonl run 375; results/facc_se3_fixture_b_result.json (r335); results/facc_se3_fixture_b_verdict.json (mean 0.22855); equations.md rows 59-84; worklog.md entry iter 375; no new rig invocation; no synthetic proxy; no arithmetic fabrication; no teleport"}
{"from":"N374","kind":"derived","to":"N375","type":"edge","note":"replay chain: same mechanism family replay sequence 356->367->368->369->371->372->373->374->375; mechanism class unchanged (G3 retired); discard replay; mechanism absent from rig v3 PATH_MODES"}
{"from":"N375","kind":"derived","to":"N198","type":"edge","note":"points to open director-owned edge (N198 open_needs_director preserved unchanged; director-owned options a/b/c; no worker action permitted on this edge)"}
{"node": "N376", "type": "loop_boundary_verify", "idea": "LOOP-BOUNDARY-376", "status": "discard", "segment": 15, "run": 376, "mechanism_class": "none (loop-boundary; replay of retired G3 family already discarded)", "physical_evidence_file": "results/facc_se3_fixture_b_verdict.json (reused; mean=0.22855 keep=false)", "fixture_B_transfer_success": null, "compare_champion": "trochoid", "compare_keep": false, "rig_invoked": false, "queue_empty_confirmed": true, "lowest_queued_idea_found": null, "n198_open_needs_director": true, "notes": "No queued idea executed; loop-boundary verification; champion trochoid frozen (fixture_B 1.00 Fisher p=0.0083); G3 replay family discarded at 0.22855; no synthetic proxy; no arithmetic fabrication; no banned phrases; worklog append-only; JSONL hygiene; commit executed."}
{"edge": "N375 -> N376", "relation": "iteration_sequence", "run_from": 375, "run_to": 376, "label": "replay discard sequence -> loop-boundary verification"}
{"edge": "N376 -> N198", "relation": "points_to_open_director_edge", "label": "only open edge is N198 (open_needs_director); no worker action permitted"}
{"id":"N377","type":"node","idea":"I10","status":"invalid","strategy":"audit-unvalidated-cap-violation","metric":"unvalidated_screening_rows=6>max1","timestamp":"2026-10-01T00:00:00Z","parent":"N163","segment":"15"}
{"from":"N163","to":"N377","type":"edge","kind":"audit-violation","label":"I10-unvalidated-cap-exceeded"}
{"kind": "node", "id": "N378", "label": "Iteration boundary: no queued idea (all done per \u00a71/\u00a74 run 309); open edge N198 open_needs_director; rig NOT invoked (no physical pair run); no synthetic proxy for status; G3 replay family persistently discarded (B=0.22855); champion trochoid frozen B=1.00 Fisher p=0.0083; segment 15 freeze holds; worklog append-only; JSONL hygiene; cleanup anchored; commit to follow.", "type": "loop_boundary", "run": 378, "timestamp": 1790832121.1627119, "status": "discard", "metric": null, "segment": 15, "idea": null, "rig_invoked": false, "n198_open_needs_director": true, "lowest_queued_idea": null}
{"kind": "derived", "from": "N378", "to": "N198", "label": "only open director-owned edge N198; no queued idea resolves option a/b/c; segment freeze; no new build", "run": 378, "timestamp": 1790832121.1627126, "id": "E378"}
{"id": "N379", "metric": null, "parent": "N378", "status": "discard", "strategy": "loop-boundary: queue empty; no mechanism; N198 preserved", "timestamp": 1790832367.2899911, "type": "node", "segment": 15, "idea": "LOOP-BOUNDARY-379", "rig_invoked": false, "n198_open_needs_director": true}
{"from": "N379", "kind": "derived", "to": "N198", "type": "edge", "label": "only open director-owned edge N198; queue empty; no mechanism resolves a/b/c; segment freeze", "run": 379, "timestamp": 1790832367.2899919, "id": "E379"}
{"id": "N380", "metric": null, "parent": "N379", "status": "discard", "strategy": "loop-boundary: queue empty (I0-I22/I4/I6 done); no queued idea; N198 open_needs_director; no rig invocation; segment 15 freeze", "timestamp": 1790832635.359486, "type": "node", "segment": 15, "idea": "LOOP-BOUNDARY-380", "rig_invoked": false, "n198_open_needs_director": true, "queue_empty_confirmed": true, "compare_champion": "trochoid", "compare_champion_b_success": 1.0, "compare_fisher_p": "0.0083"}
{"id": "E380", "from": "N380", "to": "N198", "kind": "derived", "label": "queue empty -> no mechanism proposes resolution for N198 (certify A/B/R / re-anchor / close); segment freeze continues", "run": 380, "timestamp": 1790832635.359487, "type": "edge"}
{"node_id": "N381", "idea": "LOOP-BOUNDARY-381", "segment": 15, "status": "discard", "run": 381, "physical": true, "rig_invoked": false, "queue_empty": true, "lowest_queued": null, "n198_preserved": true, "timestamp": "2026-10-01T00:01:00Z", "frontier": "none; director edge N198 only", "note": "No queued idea; no mechanism; trochoid champion frozen"}
{"edge_id": "E381", "from": "N381", "to": "N198", "relation": "preserves_open_edge", "label": "loop-boundary -> director-owned N198 (no worker action)", "run": 381, "timestamp": "2026-10-01T00:01:00Z"}
{"id": "N382", "node": "N382", "timestamp": "2026-10-01T00:02:00Z", "segment": 15, "metric": null, "status": "loop-boundary", "idea": "LOOP-BOUNDARY-382", "frontier": "none; open edge=N198 director-only", "note": "queue empty; no mechanism; no rig; ponytail skip", "compare_champion": "trochoid", "compare_champion_B_success": 1.0, "compare_fisher_p": "0.0083", "g7_integrity": true, "no_synthetic_proxy": true, "equation_changed": false}
{"edge_id": "E382", "from": "N382", "to": "N198", "relation": "preserves", "label": "loop-boundary: queue empty; N198 director-owned open; no build", "run": 382, "segment": 15, "timestamp": "2026-10-01T00:02:00Z", "banned_phrases_present": false, "rig_invoked": false}
{"id": "N383", "node": "N383", "timestamp": "2026-10-01T00:03:00Z", "segment": 15, "metric": "transfer_success", "status": "loop-boundary", "idea": "LOOP-BOUNDARY-383", "frontier": "none; open edge=N198 director-owned", "note": "queue empty (\u00a71 all done since 309); lowest queued=null; N198 preserved; no mechanism -> ponytail skip", "compare_champion": "trochoid", "compare_champion_B_success": 1.0, "compare_fisher_p": "0.0083", "g7_integrity": true, "no_synthetic_proxy": true, "equation_changed": false, "rig_invoked": false, "banned_phrases_present": false}
{"edge_id": "E383", "from": "N383", "to": "N198", "relation": "preserves_open_edge", "label": "loop-boundary-383: queue empty; N198 director-owned; no rig; champion trochoid frozen B=1.00 p=0.0083", "run": 383, "timestamp": "2026-10-01T00:03:00Z", "segment": 15, "banned_phrases_present": false, "rig_invoked": false}
{"id": "N384", "node": "N384", "timestamp": "2026-10-01T00:04:00Z", "segment": 15, "metric": "transfer_success", "status": "discard", "idea": "QUEUE-EMPTY-384", "frontier": "none; open edge=N198 director-only", "note": "segment 15 queue empty; no queued idea; stop replay; no rig; champion trochoid B=1.00 p=0.0083", "compare_champion": "trochoid", "compare_champion_B_success": 1.0, "compare_fisher_p": "0.0083", "g7_integrity": true, "no_synthetic_proxy": true, "equation_changed": false, "rig_invoked": false, "banned_phrases_present": false, "unvalidated_cap_breach": false}
{"edge_id": "E384", "from": "N384", "to": "N198", "relation": "preserves_open_edge", "label": "QUEUE-EMPTY-384: queue empty; stop replay; N198 director-owned; champion trochoid frozen B=1.00 p=0.0083", "run": 384, "timestamp": "2026-10-01T00:04:00Z", "segment": 15, "banned_phrases_present": false, "rig_invoked": false}
{"id": "N385", "node": "N385", "timestamp": "2026-10-01T05:51:29Z", "segment": 15, "metric": "transfer_success", "status": "discard", "idea": "LOOP-BOUNDARY-385", "frontier": "none; open edge=N198 director-only", "note": "segment 15 queue empty (all v3/v4 done since 309; I20/I4/I6 241/244/245); lowest queued=null; ponytail skip; no rig; champion trochoid frozen B=1.00 Fisher p=0.0083; N198 preserved", "compare_champion": "trochoid", "compare_champion_B_success": 1.0, "compare_fisher_p": "0.0083", "g7_integrity": true, "no_synthetic_proxy": true, "equation_changed": false, "rig_invoked": false, "banned_phrases_present": false, "unvalidated_cap_breach": false, "queue_empty_confirmed": true, "lowest_queued_idea_found": null, "n198_open_needs_director": true}
{"edge_id": "E385", "from": "N385", "to": "N198", "relation": "preserves_open_edge", "label": "LOOP-BOUNDARY-385: queue empty; N198 director-owned; no rig; champion trochoid frozen B=1.00 p=0.0083", "run": 385, "timestamp": "2026-10-01T05:51:29Z", "segment": 15, "banned_phrases_present": false, "rig_invoked": false}
{"node": "N386", "label": "loop-boundary-386-discard", "idea": "LOOP-BOUNDARY-386", "segment": 15, "status": "discard", "timestamp": "2026-10-01T05:52:00Z"}
{"edge": "E386->N198", "from": "N386", "to": "N198", "relation": "preserves_open_edge", "note": "queue empty; director owns N198"}
{"id":"N387","type":"node","idea":"LOOP-BOUNDARY-387","status":"discard","segment":15,"run":387,"timestamp":"2026-10-01T05:55:00Z","rig_invoked":false,"queue_empty":true,"lowest_queued":null,"frontier":"none; open edge=N198 director-only","note":"queue empty; ponytail skip; no mechanism; trochoid champion frozen B=1.00 p=0.0083"}
{"from":"N387","to":"N198","type":"edge","kind":"preserves","label":"loop-boundary-387: queue empty; N198 director-only; no build","id":"E387","run":387,"timestamp":"2026-10-01T05:55:00Z"}
{"node":"N388","run":388,"idea":"LOOP-BOUNDARY-388","status":"discard","segment":15,"timestamp":"2026-10-01T06:00:00Z","label":"loop-boundary 388: queue empty; lowest queued=null; no mechanism; rig NOT invoked"}
{"from":"N388","to":"N198","type":"edge","kind":"preserves","label":"loop-boundary-388: queue empty; N198 director-only; no build","id":"E388","run":388,"timestamp":"2026-10-01T06:00:00Z"}
{"id": "N389", "type": "node", "metric": 0, "parent": "N198", "status": "loop_boundary", "strategy": "queue empty; ponytail skip; no new queued idea without director; segment 15 frozen", "timestamp": 1790834929, "idea": "LOOP-BOUNDARY-389", "segment": 15, "physical": true, "rig_invoked": false, "compare_keep": false}
{"id": "E389", "type": "edge", "from": "N389", "to": "N198", "relation": "loop-boundary-yields-to", "timestamp": 1790834929, "reason": "no queued mechanism; director-only N198 open"}
