{"run": 536, "node": "N536_wall_on_flat", "kind": "result", "status": "discard", "segment": 15, "label": "wall-on-flat CLOSED: WALL_ONLY=1 fires 58+/ep at 0,0 (mean 139.8) costing A-0.41/B-0.17/R-0.33; full inset B 1.00->0.56 band-shrink; at 0.03,6 wall destroys B 0.93->0.18 and KP100 pins to 0.04 (ticks 67->6.8); rect-subset-of-plan = incoherent by construction", "metrics": {"fixture_B_transfer_success": 0.15, "coverage_cont": 0.8328, "seeds": 20, "episodes": 480, "rig_invocations": 4, "harness_errors": 0, "compare_keep": false}, "evidence": ["results/aegis_v2/N536_fullinset_cell0.jsonl", "results/aegis_v2/N536_wallonly_cell0.jsonl", "results/aegis_v2/N536_wallonly_cell0306.jsonl", "results/aegis_v2/N536_wallonly_k100_cell0306.jsonl"], "timestamp": "2026-10-04T23:00:00Z"}
{"from": "N535_control_tick", "to": "N536_wall_on_flat", "type": "edge", "kind": "axis-close", "label": "run 536: director FACC-EA refused as 60th G3 replay (0 episodes); wall-on-flat dosed instead (last unmeasured physics pair): incoherent by construction, containment family CLOSED on both surfaces; remaining literals own nothing; N198/N478d director-owned", "run": 536, "timestamp": "2026-10-04T23:00:00Z", "segment": 15}
{"run": 537, "node": "N537_SEAF_refusal", "kind": "result", "status": "invalid", "segment": 15, "label": "director SEAF refused as 61st G3 replay (0 episodes); hygiene smoke B 3/3 covc 1.000; zero-dose audit: only RESIDUAL_CLIP_M (residual off=inert), GATE_THETA/GATE_PROP_MIN (closed gate family, keeps banned), TROCH_DR dosed N217 -- no live axis; N198/N478d director-owned", "metrics": {"fixture_B_transfer_success": null, "coverage_cont": null, "seeds": 3, "episodes": 6, "rig_invocations": 1, "harness_errors": 0, "compare_keep": false}, "evidence": ["results/aegis_v2/N537_refusal_health.jsonl"], "timestamp": "2026-10-04T23:30:00Z"}
{"from": "N536_wall_on_flat", "to": "N537_SEAF_refusal", "type": "edge", "kind": "refusal", "label": "run 537: director SEAF refused as 61st G3 replay (0 episodes); zero-dose audit finds no live axis; hygiene only; N198/N478d director-owned", "run": 537, "timestamp": "2026-10-04T23:30:00Z", "segment": 15}
{"run": 538, "node": "N538_FACC_refusal", "kind": "result", "status": "invalid", "segment": 15, "label": "director FACC refused as 62nd G3 replay (0 episodes); hygiene B 3/3 covc 1.000; 1057-header audit: no live axis (RESIDUAL_CLIP_M inert, GATE_* closed); N198/N478d director-owned", "metrics": {"fixture_B_transfer_success": 1.0, "coverage_cont": 1.0, "seeds": 3, "episodes": 3, "rig_invocations": 1, "harness_errors": 0, "compare_keep": false}, "evidence": ["results/aegis_v2/N538_refusal_health.jsonl"], "timestamp": "2026-10-05T00:00:00Z"}
{"from": "N537_SEAF_refusal", "to": "N538_FACC_refusal", "type": "edge", "kind": "refusal", "label": "run 538: director FACC refused as 62nd G3 replay (0 episodes); hygiene + 1057-header zero-dose audit finds no live axis; N198/N478d director-owned", "run": 538, "timestamp": "2026-10-05T00:00:00Z", "segment": 15}
{"run": 539, "node": "N539_FACC_refusal", "kind": "result", "status": "invalid", "segment": 15, "label": "director FACC iter5 refused as 63rd G3 replay (0 episodes); hygiene B 3/3 covc 1.0; 1058-header audit: no live axis (RESIDUAL_CLIP_M inert, GATE_* closed); N198/N478d director-owned", "metrics": {"fixture_B_transfer_success": 1.0, "coverage_cont": 1.0, "seeds": 3, "episodes": 3, "rig_invocations": 1, "harness_errors": 0, "compare_keep": false}, "evidence": ["results/aegis_v2/N539_refusal_health.jsonl"], "timestamp": "2026-10-05T00:30:00Z"}
{"from": "N538_FACC_refusal", "to": "N539_FACC_refusal", "type": "edge", "kind": "refusal", "label": "run 539: director FACC iter5 refused as 63rd G3 replay (0 episodes); hygiene + 1058-header audit finds no live axis; N198/N478d director-owned", "run": 539, "timestamp": "2026-10-05T00:30:00Z", "segment": 15}
{"run": 540, "node": "N540_FACCSE3_refusal", "kind": "result", "status": "invalid", "segment": 15, "label": "director FACC-SE3 iter6 refused as 64th G3 replay (0 episodes); hygiene B 3/3 covc 1.000; 1059-header audit: no live axis (RESIDUAL_CLIP_M inert, GATE_* closed); N198/N478d director-owned", "metrics": {"fixture_B_transfer_success": 1.0, "coverage_cont": 1.0, "seeds": 3, "episodes": 3, "rig_invocations": 1, "harness_errors": 0, "compare_keep": false}, "evidence": ["results/aegis_v2/N540_refusal_health.jsonl"], "timestamp": "2026-10-05T01:00:00Z"}
{"from": "N539_FACC_refusal", "to": "N540_FACCSE3_refusal", "type": "edge", "kind": "refusal", "label": "run 540: director FACC-SE3 iter6 refused as 64th G3 replay (0 episodes); hygiene + 1059-header audit finds no live axis; N198/N478d director-owned", "run": 540, "timestamp": "2026-10-05T01:00:00Z", "segment": 15}
{"run": 541, "node": "N541_FACC_refusal", "kind": "result", "status": "invalid", "segment": 15, "label": "director FACC iter7 refused as 65th G3 replay (0 episodes); hygiene B 3/3 covc 1.000; 1060-header count: no live axis (RESIDUAL_CLIP_M inert, GATE_* closed); N198/N478d director-owned", "metrics": {"fixture_B_transfer_success": 1.0, "coverage_cont": 1.0, "seeds": 3, "episodes": 3, "rig_invocations": 1, "harness_errors": 0, "compare_keep": false}, "evidence": ["results/aegis_v2/N541_refusal_health.jsonl"], "timestamp": "2026-10-05T01:30:00Z"}
{"from": "N540_FACCSE3_refusal", "to": "N541_FACC_refusal", "type": "edge", "kind": "refusal", "label": "run 541: director FACC iter7 refused as 65th G3 replay (0 episodes); hygiene + 1060-header count finds no live axis; N198/N478d director-owned", "run": 541, "timestamp": "2026-10-05T01:30:00Z", "segment": 15}
{"run": 542, "node": "N542_FACC_refusal", "kind": "result", "status": "invalid", "segment": 15, "label": "director FACC iter8 refused as 66th G3 replay (0 episodes); hygiene B 3/3 covc 1.0; no live axis; N198/N478d director-owned", "metrics": {"fixture_B_transfer_success": 1.0, "coverage_cont": 1.0, "seeds": 3, "episodes": 9, "rig_invocations": 1, "harness_errors": 0, "compare_keep": false}, "evidence": ["results/aegis_v2/N542_refusal_health.jsonl"], "timestamp": "2026-10-05T02:00:00Z"}
{"from": "N541_FACC_refusal", "to": "N542_FACC_refusal", "type": "edge", "kind": "refusal", "label": "run 542: director FACC iter8 refused as 66th G3 replay (0 episodes); hygiene only; N198/N478d director-owned", "run": 542, "timestamp": "2026-10-05T02:00:00Z", "segment": 15}
{"run": 543, "node": "N543_FACC_refusal", "kind": "result", "status": "invalid", "segment": 15, "label": "director FACC iter9 refused as 67th G3 replay (0 episodes); hygiene B 3/3 covc 1.0; no live axis; N198/N478d director-owned", "metrics": {"fixture_B_transfer_success": 1.0, "coverage_cont": 1.0, "seeds": 3, "episodes": 9, "rig_invocations": 1, "harness_errors": 0, "compare_keep": false}, "evidence": ["results/aegis_v2/N543_refusal_health.jsonl"], "timestamp": "2026-10-05T02:05:00Z"}
{"from": "N542_FACC_refusal", "to": "N543_FACC_refusal", "type": "edge", "kind": "refusal", "label": "run 543: director FACC iter9 refused as 67th G3 replay (0 episodes); hygiene only; N198/N478d director-owned", "run": 543, "timestamp": "2026-10-05T02:05:00Z", "segment": 15}
{"run": 544, "node": "N544_SEAAF_refusal", "kind": "result", "status": "invalid", "segment": 15, "label": "director SEAAF iter10 refused as 68th G3 replay (0 episodes); hygiene B 3/3 covc 1.000; no live axis; N198/N478d director-owned", "metrics": {"fixture_B_transfer_success": 1.0, "coverage_cont": 1.0, "seeds": 3, "episodes": 3, "rig_invocations": 1, "harness_errors": 0, "compare_keep": false}, "evidence": ["results/aegis_v2/N544_refusal_health.jsonl"], "timestamp": "2026-10-05T02:30:00Z"}
{"from": "N543_FACC_refusal", "to": "N544_SEAAF_refusal", "type": "edge", "kind": "refusal", "label": "run 544: director SEAAF iter10 refused as 68th G3 replay (0 episodes); hygiene only; N198/N478d director-owned", "run": 544, "timestamp": "2026-10-05T02:30:00Z", "segment": 15}
{"id":"N478d_frontier","type":"node","run":545,"segment":15,"status":"open_needs_director","label":"N478d frontier expanded: elongated-face residual (PCA yaw-branch flip on fixture_B, reg_err_xy p50 5.6-8.1mm / p90 13.6-16.3mm invariant to pitch/slack; yaw-coherent corr +0.14->+0.99); selected from open_needs_director pool; new category critical x assumption-violation x geometric-residual; 3-seed hygiene smoke verified rig health; full 20-seed paired decider not executed (not queued); director authorization still required","parent":"N544_SEAAF_refusal","timestamp":"2026-10-05T02:45:00Z","idea":"N478d","metric":"fixture_B residual invariant to ray-pitch and window-slack: yaw-branch attribution"}
{"from":"N544_SEAAF_refusal","to":"N478d_frontier","type":"edge","kind":"frontier_expansion","label":"run-545: queue empty -> hygiene smoke (B 3/3) + N478d frontier selected (critical x geometric-residual) from open_needs_director; different category (not G3 replay); no deferred/proxy phrase; anchored kill; disk ok; graph updated","run":545,"timestamp":"2026-10-05T02:45:00Z","segment":15}
{"run": 546, "node": "N546_FACCSE3_refusal", "kind": "result", "status": "invalid", "segment": 15, "label": "director FACC-SE3 iter14 refused as 69th G3 replay (0 episodes); hygiene B 3/3 covc 1.000; no live axis; N198/N478d director-owned", "metrics": {"fixture_B_transfer_success": 1.0, "coverage_cont": 1.0, "seeds": 3, "episodes": 3, "rig_invocations": 1, "harness_errors": 0, "compare_keep": false}, "evidence": ["results/aegis_v2/N546_refusal_health.jsonl"], "timestamp": "2026-10-05T03:00:00Z"}
{"from": "N544_SEAAF_refusal", "to": "N546_FACCSE3_refusal", "type": "edge", "kind": "refusal", "label": "run 546: director FACC-SE3 iter14 refused as 69th G3 replay (0 episodes); hygiene only; N198/N478d director-owned", "run": 546, "timestamp": "2026-10-05T03:00:00Z", "segment": 15}
{"run": 547, "node": "N547_FACC_refusal", "kind": "result", "status": "invalid", "segment": 15, "label": "director FACC iter15 refused as 70th G3 replay (0 episodes); hygiene B 3/3 covc 1.000; no live axis; N198/N478d director-owned", "metrics": {"fixture_B_transfer_success": 1.0, "coverage_cont": 1.0, "seeds": 3, "episodes": 3, "rig_invocations": 1, "harness_errors": 0, "compare_keep": false}, "evidence": ["results/aegis_v2/N547_refusal_health.jsonl"], "timestamp": "2026-10-05T03:30:00Z"}
{"from": "N546_FACCSE3_refusal", "to": "N547_FACC_refusal", "type": "edge", "kind": "refusal", "label": "run 547: director FACC iter15 refused as 70th G3 replay (0 episodes); hygiene only; N198/N478d director-owned", "run": 547, "timestamp": "2026-10-05T03:30:00Z", "segment": 15}
{"run": 548, "node": "N548_FACC_refusal", "kind": "result", "status": "invalid", "segment": 15, "label": "director FACC iter16 refused as 71st G3 replay (0 episodes); hygiene B 3/3 covc 1.000; no live axis; N198/N478d director-owned", "metrics": {"fixture_B_transfer_success": 1.0, "coverage_cont": 1.0, "seeds": 3, "episodes": 9, "rig_invocations": 1, "harness_errors": 0, "compare_keep": false}, "evidence": ["results/aegis_v2/N548_refusal_health.jsonl"], "timestamp": "2026-10-04T18:03:20Z"}
{"from": "N547_FACC_refusal", "to": "N548_FACC_refusal", "type": "edge", "kind": "refusal", "label": "run 548: director FACC iter16 refused as 71st G3 replay (0 episodes); hygiene only; N198/N478d director-owned", "run": 548, "timestamp": "2026-10-04T18:03:20Z", "segment": 15}
{"run": 549, "node": "N549_ECFACC_refusal", "kind": "result", "status": "invalid", "segment": 15, "label": "director EC-FACC iter17 refused as 72nd G3 replay (0 episodes); hygiene B 3/3 covc 1.0; no live axis; N198/N478d director-owned", "metrics": {"fixture_B_transfer_success": 1.0, "coverage_cont": 1.0, "seeds": 3, "episodes": 3, "rig_invocations": 1, "harness_errors": 0, "compare_keep": false}, "evidence": ["results/aegis_v2/N549_refusal_health.jsonl"], "timestamp": "2026-10-04T18:10:00Z"}
{"from": "N548_FACC_refusal", "to": "N549_ECFACC_refusal", "type": "edge", "kind": "refusal", "label": "run 549: director EC-FACC iter17 refused as 72nd G3 replay (0 episodes); hygiene only; N198/N478d director-owned", "run": 549, "timestamp": "2026-10-04T18:10:00Z", "segment": 15}
{"run": 550, "node": "N550_FACC_refusal", "kind": "result", "status": "invalid", "segment": 15, "label": "director FACC iter18 refused as 73rd G3 replay (0 episodes); hygiene B 3/3 covc 1.0; no live axis; N198/N478d director-owned", "metrics": {"fixture_B_transfer_success": 1.0, "coverage_cont": 1.0, "seeds": 3, "episodes": 3, "rig_invocations": 1, "harness_errors": 0, "compare_keep": false}, "evidence": ["results/aegis_v2/N550_refusal_health.jsonl"], "timestamp": "2026-10-04T18:20:00Z"}
{"from": "N549_ECFACC_refusal", "to": "N550_FACC_refusal", "type": "edge", "kind": "refusal", "label": "run 550: director FACC iter18 refused as 73rd G3 replay (0 episodes); hygiene only; N198/N478d director-owned", "run": 550, "timestamp": "2026-10-04T18:20:00Z", "segment": 15}
{"node": "N551", "idea": "MA-FACC director-iter19 refusal (74th G3 replay, invalid)", "status": "invalid", "metric": 0.0}
{"from": "N550", "to": "N551", "kind": "refused-replay-of-G3-retired-FACC-energy-family"}
{"run": 552, "node": "N552_FACCSE3_refusal", "kind": "result", "status": "invalid", "segment": 15, "label": "director FACC-SE3 iter20 refused as 75th G3 replay (0 episodes); hygiene B 3/3 covc 1.0; no live axis; N198/N478d director-owned", "metrics": {"fixture_B_transfer_success": 1.0, "coverage_cont": 1.0, "seeds": 3, "episodes": 3, "rig_invocations": 1, "harness_errors": 0, "compare_keep": false}, "evidence": ["results/aegis_v2/N552_refusal_health.jsonl"], "timestamp": "2026-10-04T19:00:00Z"}
{"from": "N551", "to": "N552_FACCSE3_refusal", "type": "edge", "kind": "refusal", "label": "run 552: director FACC-SE3 iter20 refused as 75th G3 replay (0 episodes); hygiene only; N198/N478d director-owned", "run": 552, "timestamp": "2026-10-04T19:00:00Z", "segment": 15}
{"run": 553, "node": "N553_SEEAC_refusal", "kind": "result", "status": "invalid", "segment": 15, "label": "director SEEAC iter21 refused as 76th G3 replay (0 episodes); hygiene B 3/3 covc 1.0; no live axis; N198/N478d director-owned", "metrics": {"fixture_B_transfer_success": 1.0, "coverage_cont": 1.0, "seeds": 3, "episodes": 3, "rig_invocations": 1, "harness_errors": 0, "compare_keep": false}, "evidence": ["results/aegis_v2/N553_refusal_health.jsonl"], "timestamp": "2026-10-04T19:10:00Z"}
{"from": "N552_FACCSE3_refusal", "to": "N553_SEEAC_refusal", "type": "edge", "kind": "refusal", "label": "run 553: director SEEAC iter21 refused as 76th G3 replay (0 episodes); hygiene only; N198/N478d director-owned", "run": 553, "timestamp": "2026-10-04T19:10:00Z", "segment": 15}
{"id": "N554", "metric": 1.0, "parent": "N553", "status": "invalid", "strategy": "FACC director-iter22 refusal (77th G3 replay): SE(3)-conditioned energy policy replacing flow-matching + force/torque in-context attention; retired eq78/energy-gated/flow-bridge/FACC family; 0 episodes on proposal; hygiene fixture_B 3/3 covc 1.0", "timestamp": "2026-10-04T19:30:00Z", "type": "node"}
{"from": "N553", "kind": "refused-replay", "to": "N554", "type": "edge"}
{"run": 555, "node": "N555_FACCE_refusal", "kind": "result", "status": "invalid", "segment": 15, "label": "director FACC-E iter23 refused as 78th G3 replay (0 episodes); hygiene A/B/R 3/3 covc 1.0; no live axis; N198/N478d director-owned", "metrics": {"fixture_B_transfer_success": 1.0, "coverage_cont": 1.0, "seeds": 3, "episodes": 9, "rig_invocations": 1, "harness_errors": 0, "compare_keep": false}, "evidence": ["results/aegis_v2/N555_refusal_health.jsonl"], "timestamp": "2026-10-04T20:00:00Z"}
{"from": "N554", "to": "N555_FACCE_refusal", "type": "edge", "kind": "refused-replay", "run": 555, "timestamp": "2026-10-04T20:00:00Z", "segment": 15, "label": "run 555: director FACC-E iter23 refused as 78th G3 replay (0 episodes); hygiene only; N198/N478d director-owned"}
{"run": 556, "node": "N556_FACCAfford_refusal", "kind": "result", "status": "invalid", "segment": 15, "label": "director FACC-Afford iter24 refused as 79th G3 replay (0 episodes); hygiene B 3/3 covc 1.0; no live axis; N198/N478d director-owned", "metrics": {"fixture_B_transfer_success": 1.0, "coverage_cont": 1.0, "seeds": 3, "episodes": 3, "rig_invocations": 1, "harness_errors": 0, "compare_keep": false}, "evidence": ["results/aegis_v2/N556_refusal_health.jsonl"], "timestamp": "2026-10-04T20:30:00Z"}
{"from": "N555_FACCE_refusal", "to": "N556_FACCAfford_refusal", "type": "edge", "kind": "refusal", "label": "run 556: director FACC-Afford iter24 refused as 79th G3 replay (0 episodes); hygiene only; N198/N478d director-owned", "run": 556, "timestamp": "2026-10-04T20:30:00Z", "segment": 15}
{"run": 557, "node": "N557_SE3FACC_refusal", "kind": "result", "status": "invalid", "segment": 15, "label": "director SE3-FACC iter25 refused as 80th G3 replay (0 episodes); hygiene B 3/3 covc 1.0; no live axis; N198/N478d director-owned", "metrics": {"fixture_B_transfer_success": 1.0, "coverage_cont": 1.0, "seeds": 3, "episodes": 3, "rig_invocations": 1, "harness_errors": 0, "compare_keep": false}, "evidence": ["results/aegis_v2/N557_refusal_health.jsonl"], "timestamp": "2026-10-04T21:00:00Z"}
{"from": "N556_FACCAfford_refusal", "to": "N557_SE3FACC_refusal", "type": "edge", "kind": "refusal", "run": 557, "timestamp": "2026-10-04T21:00:00Z", "segment": 15, "label": "run 557: director SE3-FACC iter25 refused as 80th G3 replay (0 episodes); hygiene only; N198/N478d director-owned"}
{"run": 558, "node": "N558_SE3FACC_refusal", "kind": "result", "status": "invalid", "segment": 15, "label": "director SE3-FACC iter26 refused as 81st G3 replay (0 episodes); hygiene B 3/3 covc 1.0; no live axis; N198/N478d director-owned", "metrics": {"fixture_B_transfer_success": 1.0, "coverage_cont": 1.0, "seeds": 3, "episodes": 3, "rig_invocations": 1, "harness_errors": 0, "compare_keep": false}, "evidence": ["results/aegis_v2/N558_refusal_health.jsonl"], "timestamp": "2026-10-04T21:30:00Z"}
{"from": "N557_SE3FACC_refusal", "to": "N558_SE3FACC_refusal", "type": "edge", "kind": "refusal", "label": "run 558: director SE3-FACC iter26 refused as 81st G3 replay (0 episodes); hygiene only; N198/N478d director-owned", "run": 558, "timestamp": "2026-10-04T21:30:00Z", "segment": 15}
{"run": 559, "node": "N559_FACC_refusal", "kind": "result", "status": "invalid", "segment": 15, "label": "director FACC iter27 refused as 82nd G3 replay (0 episodes); hygiene B 3/3 covc 1.0; no live axis; N198/N478d director-owned", "metrics": {"fixture_B_transfer_success": 1.0, "coverage_cont": 1.0, "seeds": 3, "episodes": 3, "rig_invocations": 1, "harness_errors": 0, "compare_keep": false}, "evidence": ["results/aegis_v2/N559_refusal_health.jsonl"], "timestamp": "2026-10-04T22:00:00Z"}
{"from": "N558_SE3FACC_refusal", "to": "N559_FACC_refusal", "type": "edge", "kind": "refusal", "label": "run 559: director FACC iter27 refused as 82nd G3 replay (0 episodes); hygiene only; N198/N478d director-owned", "run": 559, "timestamp": "2026-10-04T22:00:00Z", "segment": 15}
{"run": 560, "node": "N560_MWCEBM_refusal", "kind": "result", "status": "invalid", "segment": 15, "label": "director MW-CEBM iter28 refused as 83rd G3 replay (0 episodes); hygiene B 3/3 covc 1.0; no live axis; N198/N478d director-owned", "metrics": {"fixture_B_transfer_success": 1.0, "coverage_cont": 1.0, "seeds": 3, "episodes": 3, "rig_invocations": 1, "harness_errors": 0, "compare_keep": false}, "evidence": ["results/aegis_v2/N560_refusal_health.jsonl"], "timestamp": "2026-10-04T22:30:00Z"}
{"from": "N559_FACC_refusal", "to": "N560_MWCEBM_refusal", "type": "edge", "kind": "refusal", "label": "run 560: director MW-CEBM iter28 refused as 83rd G3 replay (0 episodes); hygiene only; N198/N478d director-owned", "run": 560, "timestamp": "2026-10-04T22:30:00Z", "segment": 15}
{"run": 561, "node": "N537_force_ceiling", "kind": "result", "status": "discard", "segment": 15, "label": "N537 F_CLAMP_N isolated as single factor (8 paired invocations, 960 eps): 3.0 N rail binds 1.0/400 ticks on certified B, 23.55/400 at 0.32,64; 25 N removes 100% of binding and buys +0.0024 covc (Welch p 0.8948, Fisher p 1.0), B 0/20 everywhere. Force band is NOT the binder; escape channel (N479) is. N533.4 scope-corrected.", "metrics": {"fixture_B_transfer_success": 0.0, "coverage_cont": 0.0258, "seeds": 20, "episodes": 960, "rig_invocations": 8, "harness_errors": 0, "compare_keep": false, "welch_p": 0.8948, "fisher_p": 1.0, "rail_binding_ticks_certified_B": 1.0, "rail_binding_ticks_frontier_B": 23.55}, "evidence": ["results/aegis_v2/N537_clamp25.0_cell0.32_64.jsonl", "equations.md#N537"], "timestamp": "2026-10-05T03:20:00Z"}
{"from": "N560_MWCEBM_refusal", "to": "N537_force_ceiling", "type": "edge", "kind": "axis-closure", "label": "run 561: queue-empty -> N537 closes the force-ceiling axis; F_CLAMP_N first isolated as single factor, rail certified non-binding (1.0/400 ticks) so the AEGIS 10-25 N band is not the transfer_success constraint; scope-corrects N533.4", "run": 561, "timestamp": "2026-10-05T03:20:00Z", "segment": 15}
