{"run": 225, "segment": 15, "status": "discard", "idea": "I2", "timestamp": "2026-09-28T00:00:00Z", "description": "T218 band-local upper-tail dual-floored hard-score pooled-0 + 10% global anchor (director iter 43). s=max(0,w191-[0.9*med_b+0.1*med_g])/(1.4826*max(MAD_b,0.1*MAD_glob,floor)+eps), floor=(10*eps+40*med_noise)/sqrt(n_b), eps=1e-9, med_noise=0.005 slip floor => floor_b=0.0316; raw MAD_b (no EB); frozen I7+I10; zero rig edits; frozen R173 files. Bands 0+1 INFEASIBLE -> all-reject fallback -> DEGENERATE pooled 100.0 (n_adm 0/120; heldB 0.0; cov 0.0 vs 0.9883 regression; same artifact as T210/T211/T214/T215/T217). Floor binds 0/3, gfloor 0/3, collapse 0/3 (no MAD collapse, 8th falsification). MAD0 synthetic finite (4.51/10u, floor caps); zero inf/NaN PASS; rank corr vs T217 0.9817 (anchor+floor near-inert at n=40). LOBO var 20.0 FAILS <15 (leave-2 refit jumps 53.33->73.33, operating point unstable). n_b=10/20 subsample refits infeasible -> degenerate. Pooled-1 abl 53.33 (no win vs artifact, ties T213/T216 plateau). Director 85-95pts/keep>=70 MISSED (keep 0.0). DISCARD; KILL dual-floor+anchor line; I2 stays CLOSED; next queued I8.", "rig": "experiments/kaggle_aegis_sweep.py", "command": "POST-HOC ONLY, zero rig edits, no rig run; timeout 300 python3 results/aegis_v2/I2_r218_analysis.py on frozen R173 files", "compare_champion": "trochoid", "metric": 100.0, "metric_unit": "pooled failure-recall pts held (G2 primary cited via runA keep B 1.00; degenerate all-reject artifact in metrics)", "metrics": {"idea": "I2", "variant": "T218 dual-floored upper-tail + 10pct global anchor s=max(0,w191-c*)/den pooled-0", "seeds": 20, "gate_mode": "post-hoc", "feasible_bands": 1, "center_star": [81.9501, 75.0578, 66.4905], "MAD_band": [12.9517, 13.4071, 18.3332], "floor_b": 0.0316, "gfloor_01": 1.4949, "floor_binds": [false, false, false], "collapse_frac": 0.0, "TAU_band2": 0.2889, "rank_corr_vs_T217": 0.9817, "lobo_var_pts": 20.0, "lobo_pass": false, "subsample_var_pts": 0.0, "mad0_finite": true, "pooled1_pts": 53.33, "pooled1_wins": false, "heldB_keep_pct": 0.0, "pooled_failure_recall": 1.0, "score_recall_pts": 100.0, "degenerate_all_reject": true, "pooled_n_adm": 0, "vs_T207_pts": 40.0, "cov_regression": true, "archive_adm_frac": 0.0, "evidence": ["results/aegis_v2/I2_r218_analysis.py", "results/aegis_v2/I2_r218_result.json"]}}
{"run": 226, "segment": 15, "status": "discard", "idea": "I2", "timestamp": "2026-09-28T00:00:00Z", "metric": 100.0, "metrics": {"idea": "T219", "recall_pts": 100.0, "keep_pct": 0.0, "n_adm": 0, "feasible": false, "zero_inf_nan": true, "lobo_var_pts": 13.34, "rank_corr_soft_hard": 1.0, "floor_binds": 0.0, "cov_ok": false}, "description": "T219 band-local upper-tail asymmetric upper-MAD EB-lite single-floor soft-score pooled-0 + 20pct global anchor (director iter 44). s=max(0,w191-med*)/(1.4826*max(MADup*,floor)), med*=0.8*med_b+0.2*med_g, MADup*=w*MADup_b+(1-w)*MADup_g, w=n_b/(n_b+20), floor=max(5,0.5*MADup_g)=8.9298, p=1-exp(-s); per-band ROC TAU_p; frozen I7+I10; zero rig edits; frozen R173 files. Bands 0+1 INFEASIBLE -> all-reject fallback -> DEGENERATE pooled 100.0 (n_adm 0/120; heldB 0.0; cov 0.0 vs 0.9883 regression); band2 TAU_p*=0.3157 feasible alone. Skew up/low=[1.479,1.024,0.148] (no consistent upper-loose direction); floor 0/3 binds, collapse 0/3 (no MAD collapse, 9th falsification); MADup0 synthetic finite p=0.53/10u; anchor0 + symmetric abls both infeasible-degenerate (delta 0.0); soft-vs-hard rank 1.0/agree 1.0 (monotonic, inert); LOBO var 13.34 PASS; n=10/20 refits infeasible; pooled-1 abl 60.0 (no win). Verdict DISCARD (predicted 75-85pts/keep>=70 MISSED, keep 0.0). KILL upper-tail asymmetric line (max(0,.) destroys band 0/1 separability 9th time; floors never bind on real data). I2 stays CLOSED; next queued I8. Tier-2 binding. Evidence: results/aegis_v2/I2_r219_analysis.py, I2_r219_result.json. Equations.md ROW T219. Graph N181->N182."}
{"run": 227, "segment": 15, "status": "discard", "idea": "I2", "timestamp": "2026-09-28T00:00:00Z", "description": "T220 cross-band pooled two-tail IQR soft-score pooled-8 + 50% global anchor (director iter 45). s=min(|w191-[0.5*med_b+0.5*med_g]|/(0.7413*max(IQR_pool,floor_g)),6), admit iff s<=TAU* (single global TAU, 8-pt success-quantile grid); bands=CALIB jerk tertiles E1=0.003652/E2=0.009075; frozen I7+I10; zero rig edits; frozen R173 files. Fit: IQR_pool=30.8053 (lin 30.5289), floor_g=5.0 binds 0, scale=22.8359, centers=[78.55,74.73,69.97]; best-grid calib recall 0.4706<0.65 at Q0.5 -> INFEASIBLE -> all-reject fallback -> DEGENERATE pooled 100.0 (n_adm 0/120; heldB 0.0; cov 0.0 vs 0.9883 regression). All 5 ablations infeasible-degenerate (anchor0/anchor1/MAD-scale/no-clip/upper-only delta 0.0); LOBO all-infeasible var 0.0; zero inf/NaN PASS; IQR0 synthetic finite. Director 55pm12pts MISSED (100.0 artifact); ABORT-IF FIRES (pts>=70): KILL robust-z family; next rank/quantile. I2 stays CLOSED.", "rig": "experiments/kaggle_aegis_sweep.py", "command": "POST-HOC ONLY, zero rig edits, no rig run; timeout 300 python3 results/aegis_v2/I2_r220_analysis.py on frozen R173 files (grid-direction bugfix: success-quantile candidates for admit-<=)", "compare_champion": "trochoid", "metric": 100.0, "metric_unit": "pooled failure-recall pts held (G2 primary cited via runA keep B 1.00; degenerate all-reject artifact in metrics)", "metrics": {"idea": "I2", "variant": "T220 cross-band pooled two-tail IQR s=min(|w191-c*|/(0.7413*max(IQR,floor_g)),6) pooled-8", "seeds": 20, "gate_mode": "post-hoc", "path": "fitted-frozen", "IQR_pool": 30.8053, "IQR_linear": 30.5289, "floor_g": 5.0, "floor_binds": false, "scale": 22.8359, "center_star": [78.5545, 74.7255, 69.9659], "TAU_STAR": null, "feasible": false, "best_grid_calib_recall": 0.4706, "heldB_keep_pct": 0.0, "pooled_failure_recall": 1.0, "score_recall_pts": 100.0, "degenerate_all_reject": true, "abl_all_infeasible": true, "lobo_var_pts": 0.0, "zero_inf_nan": true, "cov_ok": false, "archive_adm_frac": 0.0, "line_keep": false, "abort_if_fired": true, "robust_z_killed": true, "next": "rank/quantile", "evidence": ["results/aegis_v2/I2_r220_analysis.py", "results/aegis_v2/I2_r220_result.json"]}}
{"run": 228, "segment": 15, "status": "discard", "idea": "I2", "timestamp": "2026-09-28T00:00:00Z", "description": "T221 band-local median-only symmetric IQR hard-score pooled-0 + 0pct global, zero floors, no EB/MAD (director iter 46). s=max(0,|w191-med_b|-1.5*IQR_b); admit iff s<=TAU*_b (per-band 8-pt success-quantile grid); frozen I7+I10; zero rig edits, frozen R173 files. Center-isolation: med_b=[82.80,75.14,65.62], IQR_b=[29.31,23.28,74.34], fence halfwidth=[43.97,34.92,111.52]; central frac 1.0 calib+held ALL bands, succ/fail s-deciles all 0.0 -> s identically 0, zero separation. All 3 bands INFEASIBLE -> all-reject fallback -> DEGENERATE pooled 100.0 (n_adm 0/120; heldB 0.0; cov 0.0 vs 0.9883 regression). All 5 ablations infeasible-degenerate delta 0.0 (anchor10/20/50, soft-IQR, pooled-8). LOBO all-infeasible var 0.0; finite PASS; w191 var>0 PASS but score var=0. Director 55-68pts MISSED (100.0 artifact). DISCARD; CENTER-COLLAPSED confirmed -> next T222 lower-tail-only diagnostic. I2 stays CLOSED.", "rig": "experiments/kaggle_aegis_sweep.py", "command": "POST-HOC ONLY, zero rig edits, no rig run; timeout 300 python3 results/aegis_v2/I2_r221_analysis.py on frozen R173 files", "compare_champion": "trochoid", "metric": 100.0, "metric_unit": "pooled failure-recall pts held (G2 primary cited via runA keep B 1.00; degenerate all-reject artifact in metrics)", "metrics": {"idea": "T221", "recall_pts": 100.0, "keep_pct": 0.0, "n_adm": 0, "feasible": false, "zero_inf_nan": true, "lobo_var_pts": 0.0, "w191_var_gt0": true, "central_frac_all_bands": 1.0, "abl_delta_all": 0.0, "cov_ok": false}}
{"run": 229, "segment": 15, "status": "discard", "idea": "I2", "timestamp": "2026-09-28T00:00:00Z", "description": "T222 band-local median-only symmetric hard-keep control pooled-0 + 0pct global, single floor, zero extra filters (director iter 47). s=|wraw-med_b| raw (no C99 clip, no fence/scale/soft/EB/MAD); admit iff s<=TAU*_b (per-band 8-pt success grid); frozen I7+I10; zero rig edits, frozen R173 files. Band0 feasible (TAU*=15.77, calib 0.6667/0.087) but bands 1+2 INFEASIBLE -> all-reject fallback -> DEGENERATE pooled 100.0 (n_adm 0/120; heldB 0.0; cov 0.0 vs 0.9883 regression). s var>0 (pooled 317.45; succ/fail q50 15.02/15.96 near-identical, fail_q90 65.62 vs succ 35.08 heavier fail tail yet inside-grid inseparable: fails central); zero inf/NaN PASS; discard counter 6; streak NOT broken (keep 0.0<5). anchor20/anchor50/pooled8 abls all infeasible-degenerate delta 0.0; LOBO all-infeasible var 0.0. Director 65-75pts/keep10-20 MISSED. DISCARD; KILL raw-deviation line; I2 stays CLOSED.", "rig": "experiments/kaggle_aegis_sweep.py", "command": "POST-HOC ONLY, zero rig edits, no rig run; timeout 300 python3 results/aegis_v2/I2_r222_analysis.py on frozen R173 files", "compare_champion": "trochoid", "metric": 100.0, "metric_unit": "pooled failure-recall pts held (G2 primary cited via runA keep B 1.00; degenerate all-reject artifact in metrics)", "metrics": {"idea": "T222", "recall_pts": 100.0, "keep_pct": 0.0, "n_adm": 0, "feasible": false, "band0_TAU": 15.7692, "zero_inf_nan": true, "s_pooled_var": 317.4525, "succ_q50": 15.0245, "fail_q50": 15.9621, "discard_counter": 6, "streak_broken": false, "lobo_var_pts": 0.0, "abl_delta_all": 0.0, "cov_ok": false}}
{"run": 230, "segment": 15, "status": "discard", "idea": "I2", "timestamp": "2026-09-28T00:00:00Z", "description": "T223 band-local median asymmetric upper-only IQR soft-clip pooled-4 + 25pct global anchor (director iter 48). s=max(0,wraw-thr_b), thr_b=max(0.75*med_b+0.25*med_g+1.5*IQRup_b,med_b), p=1-exp(-s/max(IQRup_b,eps)); per-band 4-pt success grid; frozen I7+I10; zero rig edits; frozen R173 files. All 3 bands INFEASIBLE (thr 106.48/89.66/80.88 far above med 82.80/75.14/65.62; frac_zero 1.0/0.75/0.80; succ/fail p-deciles all 0.0) -> all-reject fallback -> DEGENERATE pooled 100.0 (n_adm 0/120; heldB 0.0; cov 0.0 vs 0.9883 regression). Floor-at-med binds 0/3; zero inf/NaN PASS; discard counter 7; streak NOT broken (keep 0.0<5). anchor0/symmetric/hard/grid8/pooled4-globalTAU abls all infeasible-degenerate delta 0.0; LOBO all-infeasible var 0.0. Director 72-78keep/60-80pts MISSED. DISCARD; ABORT-IF FIRES (still 100pts): frontier exhausted, pivot to winsorize-all T224. I2 stays CLOSED.", "rig": "experiments/kaggle_aegis_sweep.py", "command": "POST-HOC ONLY, zero rig edits, no rig run; timeout 300 python3 results/aegis_v2/I2_r223_analysis.py on frozen R173 files", "compare_champion": "trochoid", "metric": 100.0, "metric_unit": "pooled failure-recall pts held (G2 primary cited via runA keep B 1.00; degenerate all-reject artifact in metrics)", "metrics": {"idea": "T223", "recall_pts": 100.0, "keep_pct": 0.0, "n_adm": 0, "feasible": false, "zero_inf_nan": true, "lobo_var_pts": 0.0, "thr_band": [106.4783, 89.6553, 80.8777], "frac_zero": [1.0, 0.75, 0.8], "floor_binds": 0, "abl_delta_all": 0.0, "cov_ok": false}}
{"run": 231, "segment": 15, "status": "discard", "idea": "I2", "timestamp": "2026-09-28T00:00:00Z", "description": "T224 band-local median asymmetric upper-only IQR soft-clip pooled-2 + 10pct anchor + light EB k=2 (director iter 49). s=max(0,wraw-thr_b), thr_b=max(0.9*med_b+0.1*med_g+1.5*IQRup*_b,med_b), IQRup*_b=(40*IQRup_b+2*IQRup_g)/42, p=1-exp(-s/max(IQRup*_b,eps)); per-band 2-pt grid Q{0.65,0.8}; frozen I7+I10; zero rig edits; frozen R173 files. Interpolation hypothesis FALSIFIED: thr 107.79/90.34/80.21 HIGHER than T223 (anchor cut raises center for above-global bands; EB k=2 near-identity, delta +0.02/+0.37/+0.43). frac_zero 1.0/0.75/0.80; fail p-deciles all 0.0 vs succ q90 0.54 (fails MORE central - inverted separability, upper-only direction wrong). All 3 bands INFEASIBLE -> all-reject degenerate pooled 100.0 (n_adm 0/120; heldB 0.0; cov 0.0 vs 0.9883 regression). 9-cell ablation pooled{8,2,4}xglobal{0,10,25} + bonus 15pct stop-rule cell: ALL 10 infeasible-degenerate delta 0.0 (15pct bump pre-answered: also fails). LOBO all-infeasible var 0.0; zero inf/NaN PASS; discard counter 8. Director 92-96pts/keep72-78 MISSED. DISCARD; KILL upper-only max(0,.) line (11th infeasibility); I2 stays CLOSED.", "rig": "experiments/kaggle_aegis_sweep.py", "command": "POST-HOC ONLY, zero rig edits, no rig run; timeout 300 python3 results/aegis_v2/I2_r224_analysis.py on frozen R173 files", "compare_champion": "trochoid", "metric": 100.0, "metric_unit": "pooled failure-recall pts held (G2 primary cited via runA keep B 1.00; degenerate all-reject artifact in metrics)", "metrics": {"idea": "T224", "recall_pts": 100.0, "keep_pct": 0.0, "n_adm": 0, "feasible": false, "zero_inf_nan": true, "lobo_var_pts": 0.0, "abl_cells_infeasible": "10/10", "stop_rule_15pct_bonus": "infeasible-degenerate", "cov_ok": false}}
{"run": 232, "segment": 15, "status": "discard", "idea": "I2", "timestamp": "2026-09-29T00:00:00Z", "description": "T225 FACC-Lite SE(3)-conditioned force-adaptive residual gate (director iter 50). Freeze T224 band-local median+IQR soft-clip (thr_b=[107.7861,90.3420,80.2145], asserted bit-identical to T224); replace s_base=max(0,wraw-thr_b) with s(e)=(1+alpha*E(e))*s_base, E = sigmoid(z(log-partition free energy of a d=10 SE(3)+contact residual against a 103-episode CALIB-success in-context bank, sigma2 median-heuristic 0.32827)); p=1-exp(-s/max(IQRup*_b,eps)); admit iff p<=TAU*_b (per-band ROC on pooled-2 Q{0.65,0.8}); frozen I7+I10; zero rig edits; frozen R173 files. All 3 bands INFEASIBLE for every alpha in {0,0.25,0.5,1,2,4} and for both pooled-0 (8-pt) and pooled-2 grids -> all-reject fallback -> DEGENERATE pooled 100.0 (n_adm 0/120; heldB keep 0.0; coverage 0.0 vs 0.9883 regression); discard counter 9. FOUR falsifications: P1 zero-support collapse (thr_0=107.7861 > wraw hard ceiling 100.0=1/(0.005+0.005) -> s_base=0 for EVERY band-0 episode in CALIB and HELD -> s=0 for all alpha, all finite E; the energy head cannot act on a zero score); P2 threshold-invariant (global thr multiplier infeasible at all 3 bands for every m in [0.05,1.00], first_feasible_m=None, recoverable=False -> not a tuning artifact); P3 INVERSION decisive (auc_hi_is_fail=P(fail scores HIGHER than succ)=[0.500,0.361,0.379], mean 0.4133<0.5 -> failures occupy the LOW-s tail, successes the HIGH-s; s=(1+alpha*E)*s_base is monotone non-decreasing in s_base so it can only promote already-high (successful) episodes and can never catch a low-s failure; Spearman(s_base,s_alpha1)=0.9992, only 27/120 held reordered); P4 energy head not orthogonal (auc_hi_is_fail on E alone=0.4847, chance level; E runs correctly, calib [0.0613,1.0] held [0.0842,0.9999], finite, var>0, but carries no usable separation). Violated-manifold split (CALIB-fitted cut: SE3 norm>0.19201 OR |fn_mean-0.4966|>1.5*IQR=0.10305) gives violation slice n=7 (4 fails) and tie slice n=113 (11 fails), both recall 100.0 with n_adm 0 -> the director win-the-violation-slice leg is NOT met (no discrimination exists to win with); E-permuted 6/6 infeasible; LOBO 3/3 infeasible var 0.0; zero inf/NaN PASS (0/120+0/120+0/120); alpha=0 reproduces T224 bit-identically. Director predicted 38-45pts keep MISSED (keep 0.0). Fail-branch FIRES (pts 100.0 > 70) -> KILL the FACC line. FALSIFIED on physical rig data, not merely unvalidated. I2 stays CLOSED.", "rig": "experiments/kaggle_aegis_sweep.py", "command": "POST-HOC ONLY, zero rig edits, no rig run; timeout 1200 python3 results/aegis_v2/I2_r225_analysis.py on frozen R173 files", "compare_champion": "trochoid", "metric": 100.0, "metric_unit": "pooled failure-recall pts held (G2 primary cited via runA keep B 1.00; DEGENERATE all-reject artifact, keep 0.0)", "metrics": {"idea": "T225", "variant": "FACC-Lite SE(3)-conditioned force-adaptive residual s=(1+alpha*E)*s_base", "seeds": 20, "gate_mode": "post-hoc", "path": "fitted-frozen", "alpha_grid": [0, 0.25, 0.5, 1, 2, 4], "alpha_sweep_feasible": "0/6", "pooled0_x_alpha_feasible": "0/12", "E_permuted_feasible": "0/6", "lobo_feasible": "0/3", "zero_inf_nan": true, "E_off_bit_identical_to_T224": true, "E_channels": ["se3_x", "se3_y", "se3_z", "se3_rx", "se3_ry", "se3_rz", "slip_m", "fn_mean", "fn_p95", "stick_frac"], "E_bank_size": 103, "E_sigma2": 0.32827025, "E_calib_range": [0.0613, 1.0], "E_held_range": [0.0842, 0.9999], "E_head_params": 2, "s_base_frac_zero_calib": 0.85, "s_base_frac_zero_held": 0.775, "s_base_per_band_frac_zero": [1.0, 0.75, 0.8], "wraw_hard_ceiling": 100.0, "thr_band_frozen_T224": [107.7861, 90.342, 80.2145], "thr_gt_wraw_ceiling_band0": true, "P1_zero_support_collapse": true, "P2_first_feasible_m": null, "P2_recoverable": false, "P2_m_sweep_infeasible_all": "m in [0.05,1.00], 20 steps, 3 bands", "P3_auc_hi_is_fail_per_band": [0.5, 0.3611, 0.3788], "P3_mean_auc_hi_is_fail_T225": 0.4133, "P3_inverted": true, "P3_spearman_s_base_vs_alpha1": 0.999187, "P3_n_held_reordered_alpha1": 27, "P4_mean_auc_hi_is_fail_E_alone": 0.4847, "viol_cut": {"SE3_CAL_MAX": 0.19201, "FN_MED": 0.4966, "FN_IQR": 0.0687, "FN_BAND_1p5IQR": 0.10305}, "viol_slice_n": 7, "viol_slice_n_fails": 4, "tie_slice_n": 113, "tie_slice_n_fails": 11, "viol_win_leg_met": false, "heldB_keep_pct": 0.0, "heldB_n_adm": 0, "cov_adm": 0.0, "cov_all": 0.9883, "cov_ok": false, "pooled_failure_recall_pts": 100.0, "degenerate_all_reject": true, "n_adm": 0, "archive_adm_frac": 0.0, "discard_counter": 9, "director_predicted_keep_38_45": 0.0, "runA_keep_cited": true, "runA_fixture_B": {"succ_a": 15, "succ_b": 20, "welch_p": 0.00010868123615477709, "fisher_p": 0.047124047124047136}, "held_fixture_B_unchanged": {"succ_a": 17, "succ_b": 19, "welch_p": 0.15104392492969054, "fisher_p": 0.604989604989505}, "synthetic_proxy": null, "evidence": ["results/aegis_v2/I2_r225_analysis.py", "results/aegis_v2/I2_r225_result.json"]}, "evidence_file": "results/aegis_v2/I2_r225_result.json", "integrity_g7": true, "banned_phrases_checked": true, "timeout_s": 1200, "cleanup_anchored_kill": true, "remote_gpu_deferred": false, "verdict": "DISCARD (keep 0.0 < 70; degenerate all-reject artifact; director fail-branch FIRES at 100.0 > 70 -> KILL FACC line; FALSIFIED not merely unvalidated; I2 stays CLOSED; next queued I8)"}
