{"run": 534, "segment": 15, "idea": "N534-workspace-limit", "status": "discard", "metric_name": "fixture_B transfer_success (canonical rig v2, PyBullet DIRECT) -- paired vs frozen champion trochoid on the same 20 seeds", "metric_class": "physical (3120 episodes, 26 rig invocations, PyBullet DIRECT, system python3 CPU; synthetic_proxy EXCLUDED per G2/G7)", "metrics": {"idea": "N534", "axis": "workspace stray rail / episode-abort radius", "knob": "AEGIS_WS_LIMIT_M", "seeds": 20, "rig_invocations": 26, "episodes": 3120, "harness_errors": 0, "pose_noise_cfg": "0,0 + 0.03,6 + 0.32,64 + 0.40,80", "compare_champion": "trochoid (B=1.00, coverage_cont 1.0000, Fisher p=0.0083 vs raster)", "fixture_A_transfer_success": 1.0, "fixture_B_transfer_success": 1.0, "fixture_R_transfer_success": 1.0, "coverage_cont": 1.0, "null_law": "coverage_cont EXACTLY invariant over WS_LIMIT_M in [0.25,1.50] (6.0x) at 0,0 and [0.30,1.50] at 0.03,6, paired delta +0.0000", "containment_bracket_m": [0.2, 0.25], "frozen_margin_x": 2.59, "fourth_head_floor_m": 0.29, "slip_echo": "slip_m ~ escaped-tick-fraction x R, invalid as cross-dose metric", "frontier_termination": "5x rail (3.00 m) at 0.32,64/0.40,80 leaves coverage BIT-IDENTICAL (B 0.0234, delta +0.0000), excursion unbounded 2.998 m", "welch_p": null, "fisher_p": 1.0, "compare_keep": false, "keep_unreachable_reason": "candidate equals its own paired baseline on every non-binding cell (delta +0.0000); binding cells are regressions by construction (termination, not capability)", "synthetic_proxy": false, "remote_gpu_used": false, "banned_phrases": [], "rig_scored_quantities_touched": false, "gate_changed": false, "metric_changed": false, "segment_changed": false, "no_teleport": true, "no_arithmetic_coverage": true, "g3_refusal_this_iteration": {"director_proposal": "retired-family replay (refused, 58th since r497)", "episodes_spent_on_proposal": 0}, "pre_registered_in_source": "autoresearch_research.ideas.md N534 section (written before the first dose was run)", "evidence_files": ["results/aegis_v2/N534_ws0.25_cell0.jsonl", "results/aegis_v2/N534_ws1.50_cell0306.jsonl", "results/aegis_v2/N534_ws3.00_cell3264.jsonl", "results/aegis_v2/N534_ws0.15_cell0.jsonl"]}, "compare": {"champion": "trochoid", "candidate": "N534 arms", "compare_run": true, "keep": false, "welch_p_coverage_cont": null, "fisher_p_success": 1.0, "reason": "every non-binding cell ties the paired baseline exactly (delta +0.0000); the rail is a safety envelope, not a lever. Verdict DISCARD of the lever with 4 measurement certificates kept."}, "verdict": "DISCARD (lever) / KEEP (4 certificates: NULL law, CONTAINMENT law with measured margin, SLIP ECHO, frontier TERMINATION). Paper fourth head floor R >~ 0.29 m. WS_LIMIT_M axis CLOSED.", "notes": "Queue empty in ideas.md s1/s4 (N198 + N478d director-owned). Only physics-path literal never varied is now TICK_S = 0.05 s. Tier-4 gate unchanged (post-hoc tag); equations.md ROW N534; worklog append-only.", "timestamp": "2026-10-04T22:00:00Z", "source": "autoresearch_research.ideas.md N534 pre-registration + 26 paired rig invocations"}
{"run": 535, "segment": 15, "idea": "N535-control-tick", "status": "discard", "metric_name": "fixture_B transfer_success (canonical rig v2, PyBullet DIRECT) -- paired vs frozen champion trochoid on the same 20 seeds", "metric_class": "physical (360 episodes, 3 rig invocations, PyBullet DIRECT, system python3 CPU; synthetic_proxy EXCLUDED per G2/G7)", "metrics": {"idea": "N535", "axis": "control-tick period", "knob": "AEGIS_TICK_S", "seeds": 20, "rig_invocations": 3, "episodes": 360, "harness_errors": 0, "pose_noise_cfg": "0,0 (2 arms) + 0.03,6 (1 arm)", "compare_champion": "trochoid (B=1.00, coverage_cont 1.0000, Fisher p=0.0083 vs raster)", "fixture_A_transfer_success": 0.3, "fixture_B_transfer_success": 0.55, "fixture_R_transfer_success": 0.35, "coverage_cont": 0.6, "tick0025_cell0": {"A": "20/20 1.0000", "B": "20/20 1.0000", "R": "20/20 1.0000", "delta": 0.0, "fisher_p": 1.0}, "tick010_cell0": {"A": "6/20 0.3625 esc 0.70", "B": "11/20 0.6000 esc 0.40", "R": "7/20 0.4711 esc 0.65", "delta_B": -0.4, "welch_p_B": 0.0020948217639623606, "fisher_p_B": 0.0012285012285012285}, "tick010_cell0306": {"B": "7/20 0.5563 vs baseline 15/20 0.9266", "delta_B": -0.3703, "welch_p_B": 0.002472345168055701}, "welch_p": 0.0020948217639623606, "fisher_p": 0.0012285012285012285, "compare_keep": false, "keep_unreachable_reason": "fast dose ties its own paired baseline at ceiling (Fisher p=1.0); slow dose B=0.55/0.35 < 0.70 with significant regression", "synthetic_proxy": false, "remote_gpu_used": false, "banned_phrases": [], "rig_scored_quantities_touched": false, "gate_changed": false, "metric_changed": false, "segment_changed": false, "no_teleport": true, "no_arithmetic_coverage": true, "g3_refusal_this_iteration": {"director_proposal": "SFA2-EF (SE(3)-equivariant force-adaptive affordance energy flow, predicted 76 keep)", "verdict": "REFUSED (59th since r497)", "reason": "label rotation of the permanently retired eq78/energy-gated/flow-bridge/FACC/SEAF family (G3); rig has no injectable stiffness/SE3/EBM hook; force channel already falsified (N479); queue empty", "episodes_spent_on_proposal": 0}, "pre_registered_in_source": "experiments/kaggle_aegis_sweep.py N535 block (written before the first dose was run)", "predictions": {"N535.1": "CONFIRMED: 0.10 breaks all suites at both cells, 0.025 ties at ceiling", "N535.2": "CONFIRMED: escapes lead (0.40-0.70), coverage follows via termination; press_mean 0.225 vs 0.5"}, "evidence_files": ["results/aegis_v2/N535_tick0025_cell0.jsonl", "results/aegis_v2/N535_tick010_cell0.jsonl", "results/aegis_v2/N535_tick010_cell0306.jsonl"]}, "compare": {"champion": "trochoid", "candidate": "N535 arms", "compare_run": true, "keep": false, "welch_p_coverage_cont": 0.0020948217639623606, "fisher_p_success": 0.0012285012285012285, "reason": "fast dose is its own baseline (delta 0, Fisher 1.0); slow dose is a paired-significant regression on every suite. Verdict DISCARD of the lever with the rate-law and 20 Hz-sufficiency certificates kept."}, "verdict": "DISCARD (lever) / KEEP (certificates: 40 Hz bit-identical so 20 Hz not aliasing the servo; 10 Hz rate law, direction consistent with N214 tick term, linear 0.194 s estimate honestly bounded as ~2x loose; escape-termination channel). Control-period axis CLOSED.", "notes": "Queue empty in ideas.md s1/s4 (N198 + N478d director-owned). Remaining never-dosed literals are containment/gate-edge/path-sampling only, none owning the primary metric. Tier-4 gate unchanged (post-hoc tag); equations.md ROW N535; worklog append-only.", "timestamp": "2026-10-04T22:30:00Z", "source": "autoresearch_research.ideas.md s0 audit trail (N534 row names TICK_S as the last unvaried physics literal) + 3 paired rig invocations"}
{"run": 536, "segment": 15, "idea": "N536-wall-on-flat", "status": "discard", "metric_name": "fixture_B transfer_success (canonical rig v2, PyBullet DIRECT) -- paired vs frozen champion trochoid on the same 20 seeds", "metric_class": "physical (480 episodes, 4 rig invocations, PyBullet DIRECT, system python3 CPU; synthetic_proxy EXCLUDED per G2/G7)", "metrics": {"idea": "N536", "axis": "containment wall on flat (INSET_M/WALL_ONLY/WALL_KP; 0 flat doses in 1051 headers, I14 bowl-only)", "seeds": 20, "rig_invocations": 4, "episodes": 480, "harness_errors": 0, "pose_noise_cfg": "0,0 (2 arms) + 0.03,6 (2 arms)", "compare_champion": "trochoid (B=1.00, coverage_cont 1.0000, Fisher p=0.0083 vs raster)", "fixture_A_transfer_success": 0.0, "fixture_B_transfer_success": 0.15, "fixture_R_transfer_success": 0.05, "coverage_cont": 0.8328, "full_inset_cell0_B": {"success": "0/20", "covc": 0.5586, "delta": -0.4414, "welch_p": 3.648102895615239e-16, "fisher_p": 1.4508889103849688e-11}, "wallonly_cell0": {"A": "0/20 0.5859", "B": "3/20 0.8328", "R": "1/20 0.6654", "B_delta": -0.1672, "B_welch_p": 0.005391701371545235, "B_fisher_p": 2.5695242602917804e-08, "wall_ticks_mean": 139.8, "wall_ticks_min": 58}, "wallonly_cell0306": {"A": "0/20 0.2437", "B": "0/20 0.1812", "R": "0/20 0.0922", "B_delta": -0.7453, "B_welch_p": 1.05e-09, "wall_ticks_mean": 67.0}, "wallonly_k100_cell0306": {"A": "0/20 0.0641", "B": "0/20 0.0383", "R": "0/20 0.0031", "B_delta": -0.8883, "B_welch_p": 9.68e-19, "wall_ticks_mean": 6.8}, "baseline_cell0306": {"A": "15/20 0.9438", "B": "15/20 0.9266", "R": "12/20 0.8680"}, "predictions": {"N536.1": "REFUTED: wall fires 58+ ticks/ep at 0,0 (mean 139.8), costs A/B/R coverage, all p<0.01 -- rect subset of plan band, fights own plan", "N536.2": "CONFIRMED: full inset collapses B to 0.5586 (p=3.6e-16) -- knob live, band-shrink arithmetic", "N536.3": "ANSWERED: fires (67/ep) + destroys (B 0.93->0.18, p=1.1e-09) -- no separable containment help", "N536.4": "ANSWERED: KP 4x pins head (ticks 67->6.8, covc 0.18->0.04) -- not a transient term"}, "welch_p": 9.68e-19, "fisher_p": 7.71e-07, "compare_keep": false, "keep_unreachable_reason": "every wall arm is a paired-significant REGRESSION on all suites at both cells; wall-only incoherent by construction (rect C plan band)", "synthetic_proxy": false, "remote_gpu_used": false, "banned_phrases": [], "rig_scored_quantities_touched": false, "gate_changed": false, "metric_changed": false, "segment_changed": false, "no_teleport": true, "no_arithmetic_coverage": true, "g3_refusal_this_iteration": {"director_proposal": "FACC-EA -- Force-Adaptive Contact Control with Energy-based Affordance attention replacing flow-matching (predicted 76 keep)", "verdict": "REFUSED (60th since r497)", "reason": "label rotation of the permanently retired eq78/energy-gated/flow-bridge/FACC/DAFE/SEAF family (G3); rig has no injectable stiffness/SE3/EBM hook (scripted controller + registration only); force channel already falsified (N479); queue empty", "episodes_spent_on_proposal": 0}, "novelty_check": "not applicable: no novelty claim is made and the status is discard (measured containment axis, not a mechanism proposal)", "pre_registered_in_source": "experiments/kaggle_aegis_sweep.py N536 block (written before the first dose was run)", "evidence_files": ["results/aegis_v2/N536_fullinset_cell0.jsonl", "results/aegis_v2/N536_wallonly_cell0.jsonl", "results/aegis_v2/N536_wallonly_cell0306.jsonl", "results/aegis_v2/N536_wallonly_k100_cell0306.jsonl"]}, "compare": {"champion": "trochoid", "candidate": "N536 wall arms", "compare_run": true, "keep": false, "welch_p_coverage_cont": 9.68e-19, "fisher_p_success": 7.71e-07, "reason": "all 4 wall cells are paired-significant regressions (wall fights plan at 0,0; fights offset plan harder at noise; stiffening pins). Verdict DISCARD of the lever with the flat-complement closure certificate kept."}, "verdict": "DISCARD (lever) / KEEP (closure certificate: wall-on-flat incoherent by construction -- rect subset of plan band; full-inset cost is band-shrink arithmetic; gain dose pins. Containment family CLOSED on both surfaces with I14.)", "notes": "Queue empty in ideas.md s1/s4 (N198 + N478d director-owned). Remaining never-dosed literals own nothing (residual off; gate family closed I20). Tier-4 gate unchanged (post-hoc tag); equations.md ROW N536; worklog append-only.", "timestamp": "2026-10-04T23:00:00Z", "source": "1051-header dose audit (INSET/WALL 0 flat doses) + 4 paired rig invocations"}
{"run": 537, "segment": 15, "idea": "SEAF-director-iter3-refusal", "status": "invalid", "metric_name": "fixture_B transfer_success (canonical rig v2, PyBullet DIRECT) -- paired vs frozen champion trochoid on the same 20 seeds", "metric_class": "physical (3-seed hygiene smoke only, PyBullet DIRECT, system python3 CPU; synthetic_proxy EXCLUDED per G2/G7)", "metrics": {"idea": "SEAF", "seeds": 3, "rig_invocations": 1, "episodes": 6, "harness_errors": 0, "pose_noise_cfg": "0,0", "compare_champion": "trochoid (B=1.00, coverage_cont 1.0000, Fisher p=0.0083 vs raster)", "fixture_A_transfer_success": null, "fixture_B_transfer_success": null, "fixture_R_transfer_success": null, "coverage_cont": null, "welch_p": null, "fisher_p": null, "compare_keep": false, "keep_unreachable_reason": "G3-retired family replay (SE(3)-energy affordance flow / FACC / flow-bridge / energy-gated, eq78); no stiffness/SE3/EBM hook in rig; force channel falsified N479; queue empty so no paired 20-seed decider runnable for this proposal", "synthetic_proxy": false, "remote_gpu_used": false, "banned_phrases": [], "rig_scored_quantities_touched": false, "gate_changed": false, "metric_changed": false, "segment_changed": false, "no_teleport": true, "no_arithmetic_coverage": true, "g3_refusal_this_iteration": {"director_proposal": "SEAF (SE(3)-Equivariant Energy Affordance Flow, predicted 76-82 keep)", "verdict": "REFUSED (61st since r497)", "reason": "label rotation of permanently retired eq78/energy-gated/flow-bridge/FACC/SE3-contact-energy family (G3); info-theoretic energy head + force-conditioned flow = N479-falsified press channel + I19/I20-closed gate family; queue empty (N198/N478d director-owned)"}, "hygiene_smoke": "results/aegis_v2/N537_refusal_health.jsonl: trochoid --compare trochoid, fixture_B, 3/3 SUCCESS, coverage_cont 1.0000, 0 harness errors, 1.9s CPU", "rig_executed_for_idea": false}}
{"run": 538, "segment": 15, "idea": "FACC-director-iter4-refusal", "status": "invalid", "metric_name": "fixture_B transfer_success (canonical rig v2, PyBullet DIRECT) -- paired vs frozen champion trochoid on the same 20 seeds", "metric_class": "physical (3-seed hygiene smoke only, PyBullet DIRECT, system python3 CPU; synthetic_proxy EXCLUDED per G2/G7)", "metrics": {"idea": "FACC", "seeds": 3, "rig_invocations": 1, "episodes": 3, "harness_errors": 0, "pose_noise_cfg": "0,0", "compare_champion": "trochoid (B=1.00, coverage_cont 1.0000, Fisher p=0.0083 vs raster)", "fixture_B_transfer_success": 1.0, "coverage_cont": 1.0, "welch_p": null, "fisher_p": null, "compare_keep": false, "g3_refusal_this_iteration": {"director_proposal": "FACC SE(3) contact-frame policy replacing flow-mat (predicted 76 keep)", "verdict": "REFUSED (62nd since r497)", "reason": "label rotation of permanently retired eq78/energy-gated/flow-bridge/FACC/SEAF family (G3); bridges flow-matching->affordance-equivalence already closed at N76/I18; force channel falsified (N479); queue empty (N198/N478d director-owned)"}, "hygiene_smoke": "results/aegis_v2/N538_refusal_health.jsonl: trochoid --compare trochoid, fixture_B, 3/3 SUCCESS, coverage_cont 1.0000/1.0000/1.0000, 0 harness errors, ~2s CPU", "zero_dose_audit": "1057 headers: only RESIDUAL_CLIP_M (0 doses, residual off=inert), GATE_THETA/GATE_PROP_MIN (I19/I20-closed gate family, keeps banned) undosed; TROCH_DR/BASE_DS dosed N532; no live axis", "rig_executed_for_idea": false}, "verdict": "INVALID (62nd G3 replay refusal + hygiene + zero-dose audit; no live axis; N198/N478d director-owned)", "notes": "Queue empty in ideas.md s1/s4. Tier-4 gate unchanged (post-hoc tag); equations.md unchanged; worklog append-only.", "timestamp": "2026-10-05T00:00:00Z", "source": "director iter-4 FACC proposal + canonical rig hygiene + 1057-header dose audit"}
{"run": 539, "segment": 15, "idea": "FACC-director-iter5-refusal", "status": "invalid", "metric_name": "fixture_B transfer_success (canonical rig v2, PyBullet DIRECT) -- paired vs frozen champion trochoid on the same 20 seeds", "metric_class": "physical (3-seed hygiene smoke only, PyBullet DIRECT, system python3 CPU; synthetic_proxy EXCLUDED per G2/G7)", "metrics": {"idea": "FACC", "seeds": 3, "rig_invocations": 1, "episodes": 3, "harness_errors": 0, "pose_noise_cfg": "0,0", "compare_champion": "trochoid (B=1.00, coverage_cont 1.0000, Fisher p=0.0083 vs raster)", "fixture_B_transfer_success": 1.0, "coverage_cont": 1.0, "compare_keep": false, "g3_refusal_this_iteration": {"director_proposal": "FACC Force-Adaptive Contact Control replacing flow-matching head, SE(3)-conditioned residual on frozen pi0, predicted 78 keep", "verdict": "REFUSED (63rd since r497)", "reason": "label rotation of permanently retired eq78/energy-gated/flow-bridge/FACC/SEAF family (G3); rig has no stiffness/SE3/EBM/peg-insert hook (scripted controller + registration only); force channel falsified (N479); queue empty (N198/N478d director-owned)"}, "hygiene_smoke": "results/aegis_v2/N539_refusal_health.jsonl: trochoid --compare trochoid, fixture_B, 3/3 SUCCESS, coverage_cont 1.0, 0 harness errors, ~2s CPU", "zero_dose_audit": "1058 headers: only RESIDUAL_CLIP_M (residual off=inert), GATE_THETA/GATE_PROP_MIN (I19/I20-closed gate family, keeps banned) undosed; no live axis", "rig_executed_for_idea": false}, "verdict": "INVALID (63rd G3 replay refusal + hygiene + header audit; no live axis; N198/N478d director-owned)", "notes": "Queue empty in ideas.md s1/s4. Tier-4 gate unchanged (post-hoc tag); equations.md unchanged; worklog append-only.", "timestamp": "2026-10-05T00:30:00Z", "source": "director iter-5 FACC proposal + canonical rig hygiene + 1058-header audit"}
{"run": 540, "segment": 15, "idea": "FACC-SE3-director-iter6-refusal", "status": "invalid", "metric_name": "fixture_B transfer_success (canonical rig v2, PyBullet DIRECT) -- paired vs frozen champion trochoid on the same 20 seeds", "metric_class": "physical (3-seed hygiene smoke only, PyBullet DIRECT, system python3 CPU; synthetic_proxy EXCLUDED per G2/G7)", "metrics": {"idea": "FACC-SE3", "seeds": 3, "rig_invocations": 1, "episodes": 3, "harness_errors": 0, "pose_noise_cfg": "0,0", "compare_champion": "trochoid (B=1.00, coverage_cont 1.0000, Fisher p=0.0083 vs raster)", "fixture_B_transfer_success": 1.0, "coverage_cont": 1.0, "compare_keep": false, "g3_refusal_this_iteration": {"director_proposal": "FACC-SE3 Force-Adaptive Contact Control SE(3)-conditioned, energy-based affordance field + adaptive stiffness replacing flow-matching, predicted 78 keep", "verdict": "REFUSED (64th since r497)", "reason": "label rotation of permanently retired eq78/energy-gated/flow-bridge/FACC/SEAF/SE3 family (G3); rig has no stiffness/SE3/EBM/peg-insert hook (scripted controller + registration only); force channel falsified (N479); queue empty (N198/N478d director-owned)"}, "hygiene_smoke": "results/aegis_v2/N540_refusal_health.jsonl: trochoid --compare trochoid, fixture_B, 3/3 SUCCESS, coverage_cont 1.0, 0 harness errors", "zero_dose_audit": "1059 headers, 78 distinct compare_env: only RESIDUAL_CLIP_M (residual off=inert), GATE_THETA/GATE_PROP_MIN (I19/I20-closed gate family, keeps banned) undosed; no live axis", "rig_executed_for_idea": false}, "verdict": "INVALID (64th G3 replay refusal + hygiene + header audit; no live axis; N198/N478d director-owned)", "notes": "Queue empty in ideas.md s1/s4. Tier-4 gate unchanged (post-hoc tag); equations.md unchanged; worklog append-only.", "timestamp": "2026-10-05T01:00:00Z", "source": "director iter-6 FACC-SE3 proposal + canonical rig hygiene + 1059-header audit"}
{"run": 541, "segment": 15, "idea": "FACC-director-iter7-refusal", "status": "invalid", "metric_name": "fixture_B transfer_success (canonical rig v2, PyBullet DIRECT) -- paired vs frozen champion trochoid on the same 20 seeds", "metric_class": "physical (3-seed hygiene smoke only, PyBullet DIRECT, system python3 CPU; synthetic_proxy EXCLUDED per G2/G7)", "metrics": {"idea": "FACC", "seeds": 3, "rig_invocations": 1, "episodes": 3, "harness_errors": 0, "pose_noise_cfg": "0,0", "compare_champion": "trochoid (B=1.00, coverage_cont 1.0000, Fisher p=0.0083 vs raster)", "fixture_B_transfer_success": 1.0, "coverage_cont": 1.0, "compare_keep": false, "g3_refusal_this_iteration": {"director_proposal": "FACC SE(3)-Conditioned Force-Adaptive Contact Control, EBM replacing pi0 flow-matching head, predicted 76 keep", "verdict": "REFUSED (65th since r497)", "reason": "label rotation of permanently retired eq78/energy-gated/flow-bridge/FACC/SEAF/SE3 family (G3); rig has no stiffness/SE3/EBM/contact-insert hook (scripted controller + registration only); force channel falsified (N479); queue empty (N198/N478d director-owned)"}, "hygiene_smoke": "results/aegis_v2/N541_refusal_health.jsonl: trochoid --compare trochoid, fixture_B, 3/3 SUCCESS, coverage_cont 1.0, 0 harness errors", "zero_dose_audit": "1060 headers (+1 hygiene since r540): no new axis; only RESIDUAL_CLIP_M (residual off=inert), GATE_THETA/GATE_PROP_MIN (I19/I20-closed gate family, keeps banned) undosed; no live axis", "rig_executed_for_idea": false}, "verdict": "INVALID (65th G3 replay refusal + hygiene + header count; no live axis; N198/N478d director-owned)", "notes": "Queue empty in ideas.md s1/s4. Tier-4 gate unchanged (post-hoc tag); equations.md unchanged; worklog append-only.", "timestamp": "2026-10-05T01:30:00Z", "source": "director iter-7 FACC proposal + canonical rig hygiene + 1060-header count"}
