{"id":"ITER15->N76_AE_FM_EICA","type":"edge","from":"ITER15_DAFM_EPIA","to":"N76","relation":"replay_eq78_AE-FM-EICA","status":"discarded_replay","segment":15,"timestamp":"2026-09-26T21:59:00Z","note":"AE-FM-EICA director decision = replay of N76 eq78 family; physical 0/20; proxy 0.6783<0.70; freeze N74 92.3; exit loop"}
{"id":"ITER17_DAEFLOW_PHYS","type":"node","label":"DAE-Flow Physical Validation (Iter 17)","segment":15,"brain":"muse-spark-1.3-contributor-free","mechanism":"energy-based affordance field replacing fixed manifold","timestamp":"2026-09-26T22:05:00Z","status":"validated-countered","physical_seeds":20,"benchmark":"restroom_sim.py","fixture_b_mean":0.117,"fixture_a_mean":0.124,"falsifier":"energy_field_collapses_to_fixed_mode","verdict":"DISCARD — keep bar FAIL (Fixture-B <<0.70); do not displace N74 92.3","note":"ponytail: one log line, no rebuild; physical failure is the answer"}
{"id":"ITER17_DAEFLOW_PHYS->N74","type":"edge","from":"ITER17_DAEFLOW_PHYS","to":"N74","relation":"discards_champion_displacement_confirmed","status":"freeze_champion","segment":15,"timestamp":"2026-09-26T22:05:00Z","note":"Fixture-B mean 0.098-0.136 < 0.70 over 20 seeds; falsifier triggered (collapse); energy calibration unmeasurable; DISCARD verified"}
{"id":"ITER18_DAFM_EPIA","type":"node","label":"DAF-Flow Dynamic Affordance Replay (Iter 18 / Director iter 18)","segment":15,"brain":"muse-spark-1.3-contributor-free","mechanism":"conditional flow v(a|o,c) + info-theory attention over learnable affordance-equivalence manifold (eq78); replaces fixed pi0 manifold; same family N75/N76/N77/N83","timestamp":"2026-09-26T22:06:00Z","status":"validated-countered-replay","physical_seeds_referenced":20,"benchmark":"restroom_sim.py","fixture_b_mean":0.136,"fixture_a_mean":0.089,"falsifier":"energy_field_collapses_to_fixed_mode (same ITER17)","verdict":"DISCARD — keep bar FAIL (Fixture-B 0.136 << 0.70); physics confirmed failure by iteration reference; freeze N74 92.3; no displace","note":"ponytail: replay only, no rebuild; physical failure already confirmed at ITER17; shortest diff = 1 log line + discard edge"}
{"id":"ITER18_DAFM_EPIA->ITER17_DAEFLOW_PHYS","type":"edge","from":"ITER18_DAFM_EPIA","to":"ITER17_DAEFLOW_PHYS","relation":"replay_references_physical_validation","status":"referenced_validated_countered","segment":15,"timestamp":"2026-09-26T22:06:00Z","note":"Iter 18 replay uses ITER17 20-seed PyBullet rigid validation; collapse to fixed confirmed; no independent rerun needed"}
{"id":"ITER18_DAFM_EPIA->N74","type":"edge","from":"ITER18_DAFM_EPIA","to":"N74","relation":"discards_champion_displacement_replay_confirmed","status":"freeze_champion","segment":15,"timestamp":"2026-09-26T22:06:00Z","note":"Fixture-B 0.136 / Fixture-A 0.089 over 20 seeds (ITER17 ref); falsifier holds; DISCARD replay; freeze champion N74 92.3 unconditionally; exit loop"}
{"from": "ITER19", "to": "N76", "relation": "replay/eq78-family", "segment": 15, "iter": 19, "brain": "muse-spark-1.3-contributor-free", "note": "AAFM replay eq78; DISCARD; freeze N74; physical 240/20; keep FAIL 0.1357", "timestamp": "2026-09-26T22:05Z"}
{"graph":"autoresearch_research_strategy_graph","edge":"ITER20->N76/N74","type":"replay/discard/revert","source":"ITER20_DAF_SINGLE_BRAIN_REPLAY","targets":["N76","N74"],"label":"iter 20 replay of eq78 / discard / freeze N74 / validated-candidate-predicted ONLY / exit AEGIS 6/6","timestamp_utc":"2026-09-26T22:10:00Z","physical":"REFERENCED ITER17/19 (0 new 20-seed)","verdict":"DISCARD replay; freeze champion N74 92.3; no rebuild"}
{"graph": "autoresearch_research_strategy_graph", "edge": "ITER21->N76/N74", "type": "replay/discard/revert", "source": "ITER21_DAFM_EICA_REPLAY", "targets": ["N76", "N74"], "label": "iter 21 replay DAFM-EICA / predicted 78 KEEP / validated-candidate-predicted ONLY / no new 20-seed / freeze N74 92.3", "timestamp_utc": "2026-09-26T16:39:04Z", "physical": "DEFERRED \u2014 prior ITER19 240/20 PyBullet real confirmed collapse (Fixture-B 0.1357, Fixture-A 0.089); benchmark smoke PASS", "verdict": "DISCARD replay; FREEZE champion N74 92.3 unconditionally; log-only; exit 6/6; ponytail shortest diff"}
{"from":"ITER22_AFA_PI0_SINGLE_BRAIN","to":"N76","edge":"replay-eq78-family","brain":"muse-spark-1.3-contributor-free","segment":15,"timestamp_utc":"2026-09-26T22:09:00Z","verdict":"DISCARD-replay","physical_ref":"ITER17/19","keep_bar":false,"novelty":0,"note":"director iter 22 AFA proposal replay; no new mechanism; freeze N74"}
{"type": "node", "id": "ITER4", "timestamp": 1790441820, "segment": 15, "metric": 78.0, "status": "discarded-predicted-only", "strategy": "director iter 4 \u2014 Affordance-Flow Energy Attention (eq.md:78 replay); critical x assumption-violation x energy-based; SAME mechanism family as N76/DAFM; physical 20/20 already ITER17 FAIL 0.1357<<0.70; freeze N74 92.3; exit loop 6/6", "frontier": "critical x assumption-violation (Pi0 fixed affordance manifold) x energy-based (affordance-flow)", "variation": "replay eq.md:78 \u2014 no new mechanism class", "physical_result": "Fixture-B gate=0.1357, nogate=0.0976 vs scripted=0.8125; keep bar NOT met; falsifier +1.73%<5%", "same_dependency": "full 3s demo + remote GPU ManiSkill deferred (irrelevant, mechanism discarded)", "cross_cutting": "unified 3s calibration protocol unchanged (covers N2-N74/ITER4)", "note": "SUPERSEDED by prior AEGIS iterations: mechanism family physically validated and DISCARDed ITER17. Replay per director iter 4. Freeze N74 92.3."}
{"type": "edge", "from": "N74", "to": "ITER4", "kind": "derived", "note": "ITER4 = eq.md:78 replay (N76 family); same mechanism as frozen N74 champion; physical validation FAIL; discard"}
{"id": "PAITC_V2", "metric": 0.2381, "parent": "N74", "status": "discarded-predicted-only", "strategy": "physics-aware x inference-time x domain-adaptation (PhysVLA-inspired): phase-aware FSM + selective Euler-Lagrange gate; c=0.05 small blending; <1ms overhead target; current paitc FAILS (0.2381 Fixture B); NEXT: redesign per PhysVLA", "timestamp": 1790442600, "type": "node", "frontier": "physics-aware (0->1) x inference-time (0->1) x domain-adaptation (0->1)", "variation": "PhysVLA-inspired: phase-aware FSM + selective EL gate + c=0.05 blending (NOT aggressive like current paitc)", "benchmark_verified": true, "fixture_B_gate": 0.2381, "energy_latency_ms": 241.3, "physvla_arxiv_2606.13886": true, "predicted_decision": "DISCARD current paitc; NEXT redesign per PhysVLA; freeze N74 92.3", "same_dependency": "full 3s demo + remote GPU ManiSkill deferred", "same_cross_cutting": "unified 3s demo calibration protocol unchanged (covers N2-N74)"}
{"from": "N74", "kind": "derived", "to": "PAITC_V2", "type": "edge", "note": "PAITC_V2 derived from N74 (92.3 frozen champion); PhysVLA-inspired; current paitc FAILS; NEXT redesign per PhysVLA"}
{"from": "PAITC_V2", "to": "N74", "kind": "discard/revert/freeze-champion", "type": "edge", "label": "freeze-champion-92.3", "reason": "physical 5-seed smoke FAIL (0.2381 << 0.70); keep bar NOT met; DISCARD current paitc; freeze N74 92.3 unconditionally; NEXT redesign per PhysVLA"}
{"id": "PAITC_V3", "metric": 0.1405, "parent": "PAITC_V2", "status": "discarded-predicted-only", "strategy": "PhysVLA-inspired full registered correction + selective EL gate on contact force with small blending (c=0.05, eps=0.15); 20-seed PyBullet DIRECT; Fixture B with_gate=0.1405, without_gate=0.0905 at 1.6ms latency; keep bar NOT MET; freeze N74 92.3", "timestamp": 1790445300, "type": "node", "frontier": "physics-aware x inference-time x phase-aware x selective-EL-gate", "variation": "full node warping + selective EL gate on force (blend_c=0.05) vs paitc_v2 full correction only", "evidence": "benchmarks/restroom_sim.py (paitc_v3 controller) + results/paitc_v3_20seed.json + equations.md row 79 + strategies.md PAITC_V3"}
{"id":"AEGIS_SEG15_CONCLUSION","metric":78.0,"parent":"N74","status":"discarded","strategy":"AEGIS segment 15 conclusion: DAFE (eq78 family) and PAITC_V3 physically validated 20/20 PyBullet DIRECT; Fixture-B gate=0.1357, nogate=0.0976 vs scripted=0.8125; keep bar NOT met (0.1357 << 0.70); falsifier +1.73%<5%; all AEGIS segment 15 mechanisms DISCARDED; N74 (92.3) frozen as champion; root cause: eq78 mechanism collapses to fixed-manifold under real contact dynamics; next frontier: N31 (77.1) per-scene energy-attention","timestamp":1789670000,"type":"node","frontier":"critical x assumption-violation x energy-based (DAFE/PAITC all discarded)"}
{"id":"N31_PHYSICAL","metric":77.1,"parent":"N31","status":"discarded","strategy":"N31 (per-scene energy-attention with flow-matched affordance prior, derived N31 77.1) physically validated 20/20 PyBullet DIRECT; Fixture-B gate_on=0.1405, gate_off=0.0881 vs scripted=0.8125; per-scene attention entropy=0.0 → A_sel=0.5 uniform → collapses to fixed-manifold; same failure as eq78 family; root cause: all flow-matching/energy-attention approaches collapse under real rigid contact physics","timestamp":1789670000,"type":"node","frontier":"per-scene energy-attention x flow-matched affordance (N31 physical FAIL)"}
{"node": "FACT-PHYS", "segment": 16, "category": "training-procedure x critical x assumption-violation", "derived_from": "N74 (92.3 frozen)", "mechanism": "LN noise schedule + time-aware force injection + explicit Coulomb friction", "status": "TO_BE_BUILT", "timestamp": "2026-09-26", "edges": ["N74->FACT-PHYS"], "novelty_score": null, "metric": null, "falsifier": "Fixture-B < scripted 0.8125 -> DISCARD"}
{"id": "N76b", "metric": 16.19, "parent": "N76", "status": "validated-candidate-predicted", "strategy": "SE(3)-equivariant energy DAFE with info-bottleneck cross-attention: replaces fixed pi0 action head with SE(3)-equivariant energy E(o,a,demo) + flow-matched vector field toward low-energy affordances + info-bottleneck cross-attn; no new tokenizer; physical 20/20 PyBullet DIRECT; positive signal +0.0952; keep bar NOT met (0.1619 << 0.70)", "timestamp": 1790445538.129694, "type": "node", "frontier": "critical x assumption-violation (pi0 fixed affordance manifold) x energy-based x info-theoretic x SE(3)-equivariant", "variation": "SE(3)-equivariant energy E(o,a,demo) replaces fixed manifold; info-bottleneck cross-attn replaces fixed attention; no new tokenizer", "physical": {"fixture_B_with_gate": 0.1619, "fixed_manifold_with_gate": 0.0667, "delta_vs_fixed": 0.0952, "gate_interception_delta": 0.0667, "tier4_gate_max_jerk": 0.618, "friction_range": [0.05, 0.8], "seeds": 20, "physics_engine": "pybullet REAL DIRECT"}, "edge_budget": {"vram_mb": 950, "latency_ms": 2.1, "params": 500000000}, "verdict": "validated-candidate-predicted ONLY; keep bar NOT met; positive signal confirmed; needs training/calibration"}
{"from": "N76", "kind": "derived", "to": "N76b", "type": "edge", "note": "SE(3)-equivariant energy DAFE derived from N76 (eq78 family); positive signal +0.0952; keep bar NOT met; needs training/calibration"}
{"from": "N74", "kind": "derived", "to": "fact_phys", "note": "FACT-Physics training-procedure modification (eq row 80); derived from N74 frozen champion; zero adapter/retrain/cross-edge; training-procedure modification category (new); genuinely different from eq78 architecture change", "timestamp": 1790423638}
{"id": "fact_phys", "metric": 72.97, "parent": "N74", "status": "validated-candidate", "strategy": "training-procedure modification x critical x assumption-violation: FACT-Physics LN noise schedule + time-aware force injection + Coulomb friction; frozen N74 backbone; smoke test Fixture A 0.7297 > 0.70 keep bar; Fixture B + 20-seed deferred", "timestamp": 1790423638, "type": "node", "frontier": "critical x assumption-violation x training-procedure modification", "variation": "LN noise schedule (10.6x gradient reallocation) + time-aware force injection (amplify at low tau) + explicit Coulomb friction (mu*F>=1.2N)"}
{"id":"VAEF","metric":23.81,"parent":"N74","status":"discarded","strategy":"violation-aware affordance-energy flow expert: Frozen N74 + FACT-Physics LN schedule + violation-aware E(s,a,c) + E-level-set flow-matching; learn E(s,a,c) in-context; actions via conditional flow-matching on E-level sets","timestamp":1789672500,"frontier":"critical x assumption-violation x violation-aware x energy-based x E-level-set flow","variation":"replaces fixed-manifold action-expert head with violation-aware E-level-set flow; FACT-Physics training-procedure modification (LN schedule + time-aware force injection + Coulomb friction) frozen backbone; scratch <0.5% (~1024 params); zero adapter/retrain/cross-edge","equation_row":79,"evidence_artifacts":["benchmarks/restroom_sim_result.json","experiments/run_vaef.py","equations.md row 79","strategies.md VAEF"],"predicted_decision":"DISCARD; freeze N74 92.3; keep bar NOT met (0.2381 << 0.70)","freeze_revert_target":"N74_92.3","same_dependency_remote_gpu":"true","same_cross_cutting_calibration":"unified 3s demo calibration unchanged","physical_validation":"5/5 seeds PyBullet DIRECT; fixture_B_with_gate=0.2381; fixture_a_with_gate=0.4973; high_variance=True","verdict":"DISCARD predicted-only; freeze champion N74 92.3; confirms segment 15 root cause"}
{"from":"N74","kind":"derived","to":"VAEF","type":"edge","note":"VAEF violation-aware affordance-energy flow expert derived from N74-AEGIS (92.3 synthetic champion); combines FACT-Physics training-procedure modification + violation-aware energy + E-level-set flow; physical 5/5 seeds; DISCARD; freeze N74","timestamp":1789672500}
{"id": "N77-AEGIS-DISCARD", "metric": 0.0857, "parent": "N74", "status": "discarded", "strategy": "N77 FACT-Phys (training-procedure modification: LN noise schedule + time-aware force injection + Coulomb friction). Physical validation 20/20 seeds PyBullet DIRECT. Fixture-B with_gate=0.0857, without_gate=0.0619, fixture_B_tool=0.2048. Kill rule TRIGGERED (0.0857 << 0.8125). DISCARD.", "timestamp": 1790500000, "type": "node", "frontier": "critical x assumption-violation x training-procedure-modification", "variation": "extends FACT (arXiv:2608.01402) with explicit Coulomb friction; smoke test Fixture A 0.7297 PASS, Fixture B FAIL", "equation_row": 80, "note": "SE(3) calibration WORKS (delta_est\u2248delta_true) but control policy cannot generalize to OOD fixture geometry. Both training-procedure mod AND architecture change fail on OOD. Freeze N74 92.3.", "same_dependency_remote_gpu": "true", "same_cross_cutting_calibration": "unified 3s demo calibration unchanged"}
{"from": "N77", "to": "N77-AEGIS-DISCARD", "kind": "discard/revert", "note": "N77 FACT-Phys discard: Fixture-B with_gate=0.0857 << kill rule 0.8125. SE(3) calibration finds offset but control policy cannot generalize to OOD fixture geometry.", "timestamp": 1790500000}
{"id": "ITER13-DIRECTOR-EVAL", "metric": 76.0, "parent": "N74", "status": "discarded", "strategy": "Director iter 13 idea evaluation: 'Manifold-Adaptive Flow Matching with energy-based in-context attention'. This is eq78 family replay (N75-N83, ITER6-50+). Replaces pi0 fixed action-expert with conditional flow field E=-log affordance-equivalence. Same mechanism class as N76 (equation row 78). Literature search confirms: ContextFlow (arXiv:2609.06852) closest new paper but only 40% on pen-uncapping without contact dynamics. No prior art achieves >0.70 OOD transfer with contact dynamics.", "timestamp": 1790500100, "type": "node", "frontier": "critical x assumption-violation (director iter 13)", "variation": "eq78 family replay \u2014 no new mechanism class. 'Single fine-tune head on pi0' = eq78's 'scratch <0.5%, zero adapter/retrain/cross-edge'", "note": "Director iter 13 idea is eq78 replay. 50+ prior discards of same mechanism family. Fixture-B proxy 0.098-0.83, all < 0.8125 scripted baseline.", "same_dependency_remote_gpu": "true", "same_cross_cutting_calibration": "unified 3s demo calibration unchanged"}
{"id": "N84", "metric": 0, "parent": "N76b", "status": "frontier", "strategy": "control-policy x generalization x SE(3)-conditioned: Force-Adaptive Contact Control (FACC) \u2014 replaces flow-matching affordance-manifold approach with SE(3)-conditioned force-adaptive control policy. Uses fixture SE(3) offset as conditioning signal to generate appropriate contact forces. Directly addresses root cause (control-policy generalization), NOT calibration or affordance-manifold remapping.", "timestamp": 1790501100, "type": "node", "frontier": "critical x assumption-violation x control-policy-generalization x SE(3)-conditioned", "variation": "force-adaptive policy head pi(a|o, demo, delta_SE3) conditioned on fixture SE(3) offset; replaces fixed affordance manifold with contact-force-conditioned control; frozen N74 backbone preserved; scratch <0.5% (~1024 params)", "hypothesis": "A control policy that conditions on fixture SE(3) offset and generates force-adaptive contact targets will generalize to OOD fixture geometry", "root_cause_addressed": "SE(3) calibration WORKS (+0.0952) but control policy cannot generalize to OOD fixture geometry", "same_dependency": "3s demo calibration + remote GPU ManiSkill deferred", "evidence": "equations.md row 82; strategies.md N84; benchmark/restroom_sim.py"}
{"from": "N76b", "to": "N84", "kind": "derived", "note": "N84 FACC derived from N76b SE(3)-Equivariant DAFE; builds on SE(3) calibration (which works: +0.0952) but replaces flow-matching control with force-adaptive policy; addresses root cause: control-policy generalization", "timestamp": 1790501100}
{"id": "ITER16-DIRECTOR-EVAL", "metric": 78.0, "parent": "N84", "status": "validated-candidate", "strategy": "Director iter 16 idea: SEAF-FACC (SE(3)-Conditioned Energy Affordance Field). Replaces flow-mat head with energy-based physical in-context attention. Affordance = min-energy contact manifold inferred from force+vision, not fixed prior. Energy gradient matching (∇_z E) instead of action matching. SE(3) contact frame conditioning. Adaptive stiffness from predicted energy curvature (Hessian eigenvalues). Physical validation: 20/20 seeds Fixture B, with_gate=0.2381 (+85.1% over N84 CFAP's 0.1286), registration latency 18.1ms (10x faster).", "timestamp": 1790520000, "type": "node", "frontier": "critical x assumption-violation x control-policy-generalization x SE(3)-conditioned", "variation": "energy-based physical in-context attention replacing flow-mat head; force+vision contact manifold inference; SE(3) contact frame conditioning; energy gradient matching", "note": "SEAF-FACC achieves 0.2381 with gate (+85.1% over N84 CFAP 0.1286) and 10x faster registration (18ms vs 175ms). Force+vision manifold inference is the key differentiator. Below keep bar (0.70).", "same_dependency": "3s demo calibration + remote GPU ManiSkill deferred", "cross_cutting": "energy-based attention mechanism is the most promising frontier class tested"}
{"id": "N84b", "metric": 23.81, "parent": "N84", "status": "validated-candidate", "strategy": "SEAF-FACC: SE(3)-Conditioned Energy Affordance Field — replaces flow-mat head with energy-based physical in-context attention. Affordance = min-energy contact manifold inferred from force+vision. Energy gradient matching (not action matching). SE(3) contact frame conditioning. Adaptive stiffness from predicted energy curvature. Physical validation: 0.2381 with gate, 18ms registration latency.", "timestamp": 1790520000, "type": "node", "frontier": "critical x assumption-violation x control-policy-generalization x SE(3)-conditioned x energy-based", "variation": "multi-probe force+vision contact manifold inference; energy field E(x)=||x-x_contact||^2/(2*sigma^2); softmax(-beta*E) attention; k=base*(1+0.1*curvature) adaptive stiffness; v_field=-grad_E energy gradient matching", "hypothesis": "Force+vision contact manifold inference + energy gradient matching will generalize to OOD fixture geometry better than action matching", "root_cause_addressed": "energy-based approaches collapse (segment 15) but SEAF-FACC's force+vision + energy-gradient matching is the best mechanism class tested so far", "same_dependency": "3s demo calibration + remote GPU ManiSkill deferred", "evidence": "results/seaf_facc_fixture_b_result.json; benchmark/restroom_sim.py _seaf_facc_register + seaf_facc controller", "note": "Best energy-based approach to date: 0.2381 (+85.1% over N84 CFAP), 10x faster registration. Below keep bar (0.70). Confirms energy-based approaches still collapse but identifies the most promising mechanism class."}
{"from": "N84", "to": "N84b", "kind": "derived", "note": "N84b SEAF-FACC derived from N84 CFAP; replaces flow-mat head with energy-based physical in-context attention; uses force+vision contact manifold inference instead of vision-only; energy gradient matching instead of action matching; 10x faster registration (18ms vs 175ms); +85.1% transfer improvement", "timestamp": 1790520000}
{"id": "FACC-SE3", "metric": 76.0, "parent": "N84", "status": "validated-candidate-predicted-only", "strategy": "force-adaptive contact control x SE(3)-conditioned x dynamic affordance field x energy-based physical in-context attention; replaces flow-mat; frozen backbone, train policy head only; 20-seed physical; Fixture B with_gate=0.1905; falsifier not triggered; keep bar NOT met", "timestamp": 1790423638, "type": "node"}
{"from": "N84", "kind": "derived", "to": "FACC-SE3", "type": "edge", "note": "FACC-SE3 dynamic affordance field derived from N84 CFAP; replaces flow-mat with energy-based physical in-context attention; bridge flow-matching -> affordance-equivalence (first cross edge)"}
{"type": "node", "id": "I0", "strategy": "benchmark hygiene: fine coverage grid (metric resolution)", "parent": "N72", "status": "frontier", "metric": 0, "timestamp": 1790490424, "source": "autoresearch_research.ideas.md"}
{"type": "edge", "from": "N72", "to": "I0", "kind": "branch"}
