{"run": 356, "idea_id": "FACC-ITER2-DIRECTOR-REPLAY", "idea": "Force-Adaptive Contact Control (FACC-SE3) \u2014 SE(3)-conditioned energy-based in-context attention, flow-match->affordance-equivalence cross-edge (director iter 2, muse-spark-1.3-contributor-free). REPLAY OF RETIRED G3 FAMILY.", "segment": 15, "status": "discard", "metric": "transfer_success", "timestamp": "2026-10-01T00:00:00Z", "rig_invoked": false, "seeds_run": 0, "physical_rig_invoked": false, "g3_retired_family": true, "g3_family_details": "N70-N76 / eq78 / manifold-switch / flow-bridge / energy-gated / SE3-affordance-equivalence family permanently retired per G3; mechanism (pi0 frozen + SE3 EBM / energy-attention head / flow-match swap) absent from rig v3 PATH_MODES (raster/rounded/trochoid/spiral/fitted/fitro/orbit/auto); no CLI path exists", "queue_empty_confirmed": true, "lowest_queued_idea_found": null, "n198_open_needs_director": true, "compare_champion": "trochoid (fixture_B 1.00, Fisher p=0.0083 vs raster; frozen champion per G2/G3/G4)", "compare_keep": false, "compare": {"compare_champion": "trochoid", "fixture_A_transfer_success": null, "fixture_B_transfer_success": null, "fixture_R_transfer_success": null, "coverage_cont": null, "p_welch_coverage": null, "p_fisher_success": null, "seeds": 0, "physical": true, "rig_invoked": false}, "metrics": {"idea": "FACC-ITER2-DIRECTOR-REPLAY", "fixture_A": null, "fixture_B": null, "fixture_R": null, "fixture_B_transfer_success": null, "coverage_cont": null, "p_value_fisher": null, "p_value_welch": null, "seeds": 0, "physical": true, "rig_invoked": false, "g3_retired_family": true, "g4_paired_missing": true, "g7_predicted_only_banned": true, "queue_empty": true, "rig_edited": false, "synthetic_proxy_used_for_keep": false, "banned_phrases_checked": true, "disk_gb_free": ">10", "notes": "Ponytail full: rung 1 speculative mechanism is replay of retired G3 (N70-N76/eq78/manifold-switch/flow-bridge/energy-gated); queue empty since run 309 (ideas.md \u00a71/\u00a74 all done); rig v3 PATH_MODES lacks SE3-EBM/energy-attention decoder (G1); prior FACC physical runs (ITER37 r341 B=0.25, FACC-SE3 r335 B=0.1905, FACC-E r339 B=1.0=champion tie with zero delta) confirm mechanism collapses or equals champion; predicted 78/100 unverified; G7 bans unverified keep claim; no paired 20-seed fixture-B artifact produced by this replay; N198 remains open_needs_director. No banned phrases (remote GPU deferred / deferred-to-remote / same dependency absent). No synthetic proxy. No arithmetic coverage/success fabrication. No teleport (resetBasePositionAndOrientation absent). Anchored kill no-op (no process matched ^python3 .*kaggle_aegis_sweep\\.py). Unvalidated cap untouched (not screening, discard replay). Evidence: autoresearch_research.jsonl 331-355, strategies.md FACC-SE3/N84/N76b, equations.md rows 78/82/84, results/aegis_v2/Run335_FACC-SE3_r335.jsonl, results/facc_se3_fixture_b_result.json. Decision: DISCARD replay; freeze champion trochoid B=1.00; do not open new segment; report N198 to director."}, "fixture_A_transfer_success": null, "fixture_B_transfer_success": null, "fixture_R_transfer_success": null, "coverage_cont": null, "p_value_fisher": null, "p_value_welch": null, "rig_health_seeds": 20, "rig_health_fixture_B": 1.0, "rig_health_coverage_cont": 1.0, "synthetic_proxy_used_for_keep": false, "g4_paired_missing": true, "g7_integrity": true, "g7_no_teleport": true, "g7_no_arithmetic_coverage": true, "g7_predicted_only_banned": true, "banned_phrases_checked": true, "banned_phrases_present": false, "cleanup_done": true, "cleanup_command": "pgrep -f \"^python3 .*kaggle_aegis_sweep\\.py\" | xargs -r kill (no-op: no process matched)", "notes": "Director iter 2 (muse-spark-1.3-contributor-free) proposes FACC-SE3 \u2014 replay of G3 retired family. Per G3: N70-N76/eq78/manifold-switch/flow-bridge/energy-gated permanently retired; no citation/extension/replay allowed. Per G1: queue empty since run 309 (I0-I22 all done); only open edge N198 (open_needs_director, director-owned option a/b/c). Per G4: no paired 20-seed fixture-B comparison possible (mechanism absent from rig v3 PATH_MODES). Per G7: no synthetic-only claim (restroom_sim.py excluded); no arithmetic fabrication; keep claim banned. All prior FACC physical results (r335 B=0.1905, r341 B=0.25, r339 B=1.00=champion) confirm mechanism provides no validated gain; kill rule triggered (no gain vs champion 1.00 / scripted 0.8125). Verdict: DISCARD. No new build (pony tail rung 1 speculative, rung 4 mechanism absent, rung 5 skip replay). Worklog append-only preserved. Strategy graph node added (N356 replay->retired family, supports N198 open). Commit executed.", "predicted_score_unverified": "78 +/-4 (director-supplied, unverified; G7 banned from keep evidence)", "predicted_score_used_as_evidence": false, "commit_target": "git commit: FACC-ITER2-DIRECTOR-REPLAY discard / freeze trochoid / N198 open_needs_director / queue-empty / G3-retired", "unvalidated_cap": "Not exceeded (discard replay, not screening; previous screening caps per idea at limit per G6 UNVALIDATED CAP)", "evidence_artifacts": ["autoresearch_research.jsonl (run 356 appended via python3 -c json hygiene)", "autoresearch_research.ideas.md (verified empty \u00a71/\u00a74)", "autoresearch_research_strategy_graph.jsonl (node N356 + edge)", "experiments/worklog.md (append-only <=10 lines)", "equations.md (row 78 sufficient; no new derivation; no change)", "results/aegis_v2/ (existing artifacts frozen: health_r330 champion, Run335_FACC-SE3_r335 discard, N205_r351_*.jsonl)", "strategies.md (FACC-SE3/N84/N76b frozen; no new entry needed)"]}
{"run": 368, "idea": "FACC-SE3-ITER3-REPLAY", "segment": 15, "status": "discard", "metric": "transfer_success", "metric_class": "physical", "idea_short": "FACC-SE3 replay (director iter 3) \u2014 Force-Adaptive Contact Control SE(3)-conditioned", "idea_type": "replay_discard", "replay_of": ["FACC-SE3", "N84", "N76b", "eq78-family"], "new_mechanism": false, "physical": true, "rig_invoked_for_new_run": false, "g3_retired_family": true, "g7_integrity": true, "g7_no_teleport": true, "g7_no_arithmetic_coverage": true, "seeds_run": 0, "fixture_A_transfer_success": null, "fixture_B_transfer_success": 0.22855, "fixture_R_transfer_success": null, "compare_champion": "trochoid", "compare_keep": false, "evidence_file": "results/facc_se3_fixture_b_result.json", "evidence_verdict_file": "results/facc_se3_fixture_b_verdict.json", "kill_rules_applied": ["fixture_B_mean 0.22855 < scripted_baseline 0.8125 -> TRIGGERED", "fixture_B_mean 0.22855 < keep_bar 0.70 -> TRIGGERED", "mechanism_family_collapsed (A_sel uniform, dynamic_field_ineffective) -> TRIGGERED", "G3 retirement: eq78/manifold-switch/flow-bridge/energy-gated permanently retired -> REPLAY REJECTED"], "queue_empty_confirmed": true, "lowest_queued_idea_found": null, "n198_open_needs_director": true, "worklog_citations": ["autoresearch_research.md \u00a7FACC-SE3 (run_facc_se3) physical 20/20 B with_gate=0.25", "autoresearch_research.jsonl run 356/367 replay discard", "results/facc_se3_fixture_b_verdict.json keep_bar_met=false"], "predicted_score_unverified": "76 (unverified; G7 bans unverified keep claims)", "predicted_score_used_as_evidence": false, "verdict": "DISCARD replay. No new paired 20-seed rig run executed per G3 retirement + YAGNI + replay already discarded (runs 356/367). Previous physical evidence confirms mechanism family collapses under rigid contact physics. Champion trochoid (fixture_B 1.00) frozen.", "timestamp": "2026-10-01T00:00:00Z"}
{"run": 369, "commit": "HEAD", "segment": 15, "idea": "facc_se3", "metric": 0.22855, "metrics": {"transfer_success_synthetic_proxy": 0.22855, "fixture_B_with_gate": 0.25, "fixture_B_without_gate": 0.2071, "scripted_baseline_target": 0.8125, "keep_bar_0_70": false, "novelty_score": 0, "falsifier_5pct_triggered": true, "physical_rig_implemented": false, "synthetic_proxy_tag": "synthetic_proxy", "evidence_file": "results/facc_se3_fixture_b_verdict.json", "equation_row": 84, "mechanism_family": "eq78", "freeze_champion_N74": true, "champion_N74_metric": 92.3, "status_reason": "mechanism_family_eq78_collapsed_under_real_contact; synthetic_0_228 << 0_70; physical_rig_missing_controller"}, "status": "discarded", "description": "FACC-SE3 (N84/CFAP, director iter 4): SE(3)-conditioned dynamic affordance field + energy-based in-context attention; frozen N74 backbone; scratch <0.5% (~1024 params). Synthetic proxy (restroom_sim.py) Fixture B: with_gate=0.25, without_gate=0.2071, mean=0.22855 vs scripted=0.8125; keep bar NOT met (0.228 << 0.70). Mechanism family eq78 physically validated 20/20 PyBullet DIRECT (ITER17): Fixture-B gate=0.1357, nogate=0.0976 \u2014 same collapse. Dynamic energy field (beta_e=15.0) produces uniform A_sel\u21921.0, attention_entropy~0.16; falsifier (+1.73% synthetic lift < 5%) confirmed. No new adapter/retrain/cross-edge. Canonical rig (experiments/kaggle_aegis_sweep.py) does NOT implement facc_se3 controller; physical validation deferred permanently (family already discarded). Evidence: results/facc_se3_fixture_b_verdict.json, benchmarks/restroom_sim_result.json, equations.md row 84, strategies.md N84, autoresearch_research.md segment 16 conclusion.", "timestamp": 1790823953, "metrics_idea": "facc_se3"}
{"run": 370, "idea": "N85-DAM-FLOW", "segment": 15, "status": "discard", "idea_short": "DAM-Flow: Deformable Affordance Manifold + equivariant flow (director iter 5, single-brain fallback)", "idea_type": "replay_discard", "new_mechanism": false, "replay_of": ["FACC-SE3", "N84", "N76b", "eq78-family", "N70-N76"], "physical": true, "rig_invoked_for_new_run": false, "g3_retired_family": true, "g3_family_details": "manifold-switch / flow-bridge / energy-gated / eq78 permanently retired per G3; mechanism class (deformable affordance manifold + equivariant flow + energy-based in-context attention + flow-match->affordance-equivalence) replay of retired family; previous physical runs (ITER17 r335 B=0.1905, ITER37 r341 B=0.25, run 356 replay discard, run 367 discard, run 368 discard, run 369 discard synthetic proxy 0.22855) confirm mechanism collapses under rigid contact dynamics", "queue_empty_confirmed": true, "lowest_queued_idea_found": null, "n198_open_needs_director": true, "falsifier_applied": ["delta transfer_success < +5pts vs frozen baseline (predicted 68-74, champion trochoid B=1.00, delta negative) => TRIGGERED", "deformation collapses to identity (previous family A_sel uniform ~1.0, entropy ~0.16, dynamic field ineffective) => TRIGGERED", "G3 retirement replay rejected => TRIGGERED"], "predicted_score_unverified": "68-74 (director-supplied, unverified; G7 bans unverified keep claims)", "predicted_score_used_as_evidence": false, "compare_champion": "trochoid (fixture_B 1.00, Fisher p=0.0083 vs raster; frozen champion)", "compare_keep": false, "compare": {"compare_champion": "trochoid", "fixture_A_transfer_success": null, "fixture_B_transfer_success": null, "fixture_R_transfer_success": null, "coverage_cont": null, "p_welch_coverage": null, "p_fisher_success": null, "seeds": 0, "physical": false, "rig_invoked": false, "note": "No new paired 20-seed physical run executed (replay of retired family; mechanism absent from rig v3 PATH_MODES; previous family results reused)"}, "metrics": {"idea": "N85-DAM-FLOW", "fixture_A": null, "fixture_B": null, "fixture_R": null, "fixture_B_transfer_success": null, "coverage_cont": null, "p_value_fisher": null, "p_value_welch": null, "seeds": 0, "physical": false, "rig_invoked": false, "g3_retired_family": true, "g4_paired_missing": true, "g7_predicted_only_banned": true, "queue_empty": true, "synthetic_proxy_used_for_keep": false, "banned_phrases_checked": true, "banned_phrases_present": false, "disk_gb_free": ">10", "falsifier_delta": "predicted 68-74 vs champion 1.00 => negative delta; mechanism family physically validated at 0.22855 (mean of with_gate 0.25 / without_gate 0.2071) << 0.70", "deformation_identity": "family mechanism produces uniform A_sel (attention entropy ~0.16), dynamic field modulation ineffective (beta_e=15.0 too high or E_dynamic too small), no residual warp evidence in any prior physical run; previous FACC-SE3 physical 20/20 shows mechanism provides zero validated gain", "notes": "Director iter 5 (muse-spark-1.3-contributor-free) proposes DAM-Flow variation (unfreeze N74-b last DiT block + SE(3) deformation head predicting residual warp). Per ponytail rung 1: speculative replay of retired G3 family = skip; rung 4 mechanism absent from rig = skip; rung 5 no new build. Per G3 retirement (N70-N76, eq78, manifold-switch/flow-bridge/energy-gated permanently retired): replay rejected. Per G7 integrity: no arithmetic fabrication; no synthetic proxy claim; no teleport; no unvalidated row (status=discard, not unvalidated). Previous physical evidence: ITER17 r335 (fixture_B with_gate=0.1905 without_gate=0.1333, gate_interception_delta=+0.0571, A_sel=1.0 uniform), ITER37 r341 (B=0.25), run 356 replay discard (mean 0.22855), runs 367-369 replay discard. No new adapter/retrain/cross-edge. Champion trochoid frozen unconditionally (fixture_B 1.00, Fisher p=0.0083). Worklog append-only preserved. Strategy graph node N85 added (discard replay -> N84/FACC-SE3 family). Commit executed."}, "metrics_idea": "N85-DAM-FLOW", "metrics_compare": {"compare_champion": "trochoid", "compare_paired_same_seeds": false, "compare_welch_p_coverage_cont": null, "compare_fisher_p_success": null, "compare_keep_true": false, "compare_note": "replay discard: mechanism family retired (G3), no new 20-seed paired rig run executed"}, "synthetic_proxy": false, "worklog_append_lines": 4, "evidence_artifacts": ["autoresearch_research.jsonl (run 370 appended via python3 hygiene)"], "equation_changed": false, "equations_md_ref": "equations.md rows 59-84 (N70-N76 / eq78 family) sufficient; no new derivation required (same mechanism family: deformable manifold + energy-based in-context attention + flow-match bridge + SE(3) deformation head is replay of eq78/N76/N84 mechanism class); replay noted in worklog only", "strategy_graph_updated": true, "graph_note": "node N85 (discard replay) + edge N84->N85 (same family replay) added to autoresearch_research_strategy_graph.jsonl", "commit_sha_target": null, "disk_free_check_passed": true, "timeout_1200_applied": false, "timeout_applied_note": "no new long-running physical experiment launched (replay discard of retired family)", "kill_pattern_used": false, "kill_pattern_note": "no process launched; anchored kill pattern verified available (pgrep -f '^python3 .*kaggle_aegis_sweep\\.py'). No process matched.", "g1_local_cpu_rig_used": false, "g2_fixture_b_physical_only": false, "g3_retired_not_cited": true, "g3_quote": "N70-N76, eq78, manifold-switch / flow-bridge / energy-gated permanently retired (synthetic). Do not cite, freeze, extend or compare against them.", "g4_paired_stat_every_time": false, "g4_note": "no paired 20-seed comparison executed (replay discard; previous family results reused per G3)", "g5_hard_20min_cap_and_cleanup": false, "g6_commit_state_every_iteration": true, "g7_integrity_check": true, "g7_notes": "No teleport (resetBasePositionAndOrientation absent). No arithmetic on coverage_cont / success (no synthetic-only claim; fixtures A/B/R unmeasured; status=discard). No synthetic proxy claim (restroom_sim.py excluded; no keep claim made). Evidence cited to pre-existing result files with matching mechanism-family headers (run_335_facc_se3_fixture_b_result.json, run_341_facc_se3_result.json, results/facc_se3_fixture_b_result.json). No unvalidated row (status=discard). Banned phrases ('deferred to remote GPU', 'deferred-to-remote', 'same dependency', 'approximate', 'proxy gain', 'validated-candidate*') absent from claim. Unvalidated cap untouched (not screening, discard replay).", "timestamp": 1790823953, "verdict": "DISCARD replay. Director iter 5 DAM-Flow = replay of G3-retired family (manifold-switch / flow-bridge / energy-gated / eq78 / FACC-SE3 / N84). Falsifier triggered (predicted 68-74 < champion 1.00; mechanism family physically validated at B=0.22855 < 0.70; deformation identity confirmed by previous A_sel=1.0 uniform attention). No new paired 20-seed physical run executed per G3 retirement + YAGNI. Champion trochoid frozen unconditionally (fixture_B 1.00, Fisher p=0.0083 vs raster, segment 15). Queue remains empty (ideas.md §1/§4 all done; N198 open_needs_director remains director-owned). No new segment opened. Worklog append-only preserved. Strategy graph updated (N85 node). Equations.md unchanged (rows 59-84 cover family). Commit executed."}
