{"run": 425, "idea": "E-FACC-v5-DIRECTOR-ITER7 + FROZEN-CHAMPION-HEALTH", "segment": 15, "status": "discard", "timestamp": "2026-10-01T18:00:00Z", "metric": 1.0, "metric_name": "fixture_B transfer_success (coverage_cont >= 0.90 per episode), canonical rig, 20 paired seeds x 3 suites, pose_noise 0,0", "metric_class": "physical", "director_decision": {"iteration": 7, "idea": "E-FACC v5 Energy-based Physical In-Context Contact Attention replacing flow-matching head, SE(3)-equivariant energy + force residual + stiffness tokens, predicted 78 keep", "predicted_score": 78, "executed": false, "exclusion_reasons": ["G3 permanent retirement: eq78/N70-N76/manifold-switch/flow-bridge/energy-gated + SE(3)-affordance re-derivations; FACC/E-FACC closed at r407 B=0.22855 and replay-rejected r409/r413/r414/r415/r417/r418/r420/r421/r422/r423/r424", "G4 unpairable: PATH_MODES carry no pi0/SE3/energy-head/force-residual/stiffness-token hook; 0 injectable rig knob (N200 audit)", "ideas.md sections 1+4 have no queued row (all done since run 309); N198 open_needs_director, worker may not move metric/gate/segment", "G7 predicted-only score may not set status; peg/wipe stiffness-shift suite is not the canonical Fixture-B bar"]}, "physical_action_taken": "frozen-champion health re-cert: timeout 1200 python3 experiments/kaggle_aegis_sweep.py --seeds 20 --no-upload --path trochoid --compare raster --suites fixture_A,fixture_B,fixture_R --out results/aegis_v2/EFACC_iter7_r425.jsonl (exit 0, ~8.6s)", "rig": "canonical rig experiments/kaggle_aegis_sweep.py (PyBullet DIRECT, system python3, rig_version 2, friction U[0.05,0.80], gate_mode post-hoc)", "rig_invoked": true, "rig_exit": 0, "episodes": 120, "harness_errors": 0, "rig_bytes_changed": 0, "pose_noise_cfg": "0,0", "evidence": ["results/aegis_v2/EFACC_iter7_r425.jsonl"], "metrics": {"idea": "E-FACC-v5-DIRECTOR-ITER7", "metric_class": "physical", "seeds": 20, "episodes": 120, "fixture_A_success": 1.0, "fixture_B_success": 1.0, "fixture_R_success": 1.0, "coverage_cont_ABR": "1.0000/1.0000/1.0000 both arms", "delta": 0.0, "welch_p": "NaN (zero variance)", "fisher_p": 1.0, "paired_p": "NaN (zero variance)", "compare_keep": false, "synthetic_proxy": null}, "gates_unchanged": {"segment": 15, "primary_metric": "transfer_success", "tier4_gate": "post-hoc tag, untouched", "no_new_segment": true, "no_metric_move": true, "no_gate_change": true, "no_candidate_promoted": true}, "verdict": "DISCARD (proposal-reject + health re-cert). Candidate trochoid and baseline raster both 20/20 on A/B/R, coverage_cont 1.0000, delta 0, Fisher p 1.0, keep=false. Sixth independent 0,0 tie after r417/r420/r421/r423/r424: G4 bar has zero dynamic range on fixture_B at 0,0.", "notes": "Queue remains empty; N198 open_needs_director; FACC/E-FACC family stays G3-retired and was not rebuilt."}
{"run": 426, "idea": "FACC-SE3-DIRECTOR-ITER8 + FROZEN-CHAMPION-HEALTH", "segment": 15, "status": "discard", "timestamp": "2026-10-01T19:00:00Z", "metric": 1.0, "metric_name": "fixture_B transfer_success (coverage_cont >= 0.90 per episode), canonical rig, 20 paired seeds x 3 suites, pose_noise 0,0", "metric_class": "physical", "director_decision": {"iteration": 8, "idea": "FACC-SE3 Force-Adaptive Contact Control SE(3)-conditioned diffusion-policy replacing pi0 flow-mat head, SE(3) residual wrench + stiffness, predicted 76 keep", "predicted_score": 76, "executed": false, "exclusion_reasons": ["G3 permanent retirement: eq78/N70-N76/manifold-switch/flow-bridge/energy-gated + SE(3)-affordance re-derivations; FACC closed at r407 B=0.22855 and replay-rejected r409/r413/r414/r415/r417/r418/r420/r421/r422/r423/r424/r425", "G4 unpairable: PATH_MODES carry no flow-mat/velocity-field/wrench/stiffness/contact-frame hook; 0 injectable rig knob (N200 audit)", "ideas.md sections 1+4 have no queued row (all done since run 309); N198 open_needs_director, worker may not move metric/gate/segment", "G7 predicted-only score (76/100) may not set status; slip/deform suites are not the canonical Fixture-B bar"]}, "physical_action_taken": "frozen-champion health re-cert: timeout 1200 python3 experiments/kaggle_aegis_sweep.py --seeds 20 --no-upload --path trochoid --compare raster --suites fixture_A,fixture_B,fixture_R --out results/aegis_v2/FACCSE3_iter8_r426.jsonl (exit 0, ~9s)", "rig": "canonical rig experiments/kaggle_aegis_sweep.py (PyBullet DIRECT, system python3, rig_version 2, friction U[0.05,0.80], gate_mode post-hoc)", "rig_invoked": true, "rig_exit": 0, "episodes": 120, "harness_errors": 0, "rig_bytes_changed": 0, "pose_noise_cfg": "0,0", "evidence": ["results/aegis_v2/FACCSE3_iter8_r426.jsonl"], "metrics": {"idea": "FACC-SE3-DIRECTOR-ITER8", "metric_class": "physical", "seeds": 20, "episodes": 120, "fixture_A_success": 1.0, "fixture_B_success": 1.0, "fixture_R_success": 1.0, "coverage_cont_ABR": "1.0000/1.0000/1.0000 both arms", "delta": 0.0, "welch_p": "NaN (zero variance)", "fisher_p": 1.0, "paired_p": "NaN (zero variance)", "compare_keep": false, "synthetic_proxy": null}, "gates_unchanged": {"segment": 15, "primary_metric": "transfer_success", "tier4_gate": "post-hoc tag, untouched", "no_new_segment": true, "no_metric_move": true, "no_gate_change": true, "no_candidate_promoted": true}, "verdict": "DISCARD (proposal-reject + health re-cert). Candidate trochoid and baseline raster both 20/20 on A/B/R, coverage_cont 1.0000, delta 0, Fisher p 1.0, keep=false. Seventh independent 0,0 tie after r417/r420/r421/r423/r424/r425: G4 bar has zero dynamic range on fixture_B at 0,0.", "notes": "Queue remains empty; N198 open_needs_director; FACC-SE3 family stays G3-retired and was not rebuilt."}
{"run": 427, "idea": "FACC-DIRECTOR-ITER9 + FROZEN-CHAMPION-HEALTH", "segment": 15, "status": "discard", "timestamp": "2026-10-01T20:00:00Z", "metric": 1.0, "metric_name": "fixture_B transfer_success (coverage_cont >= 0.90 per episode), canonical rig, 20 paired seeds x 3 suites, pose_noise 0,0", "metric_class": "physical", "director_decision": {"iteration": 9, "idea": "FACC Force-Adaptive Contact Control replacing flow-matching head, SE(3)-conditioned energy head predicts contact wrench + stiffness not trajectory, insertion/wiping/door-open, predicted 76+-6 keep", "predicted_score": 76, "executed": false, "exclusion_reasons": ["G3 permanent retirement: eq78/N70-N76/manifold-switch/flow-bridge/energy-gated + SE(3)-affordance re-derivations; FACC closed at r407 B=0.22855 and replay-rejected r409/r413/r414/r415/r417/r418/r420/r421/r422/r423/r424/r425/r426", "G4 unpairable: PATH_MODES carry no flow-matching-head/wrench/stiffness/contact-frame hook; 0 injectable rig knob (N200 audit)", "ideas.md sections 1+4 have no queued row (all done since run 309); N198 open_needs_director, worker may not move metric/gate/segment", "G7 predicted-only score (76+-6/100) may not set status; insertion/wiping/door-open suites are not the canonical Fixture-B bar"]}, "physical_action_taken": "frozen-champion health re-cert: timeout 1200 python3 experiments/kaggle_aegis_sweep.py --seeds 20 --no-upload --path trochoid --compare raster --suites fixture_A,fixture_B,fixture_R --out results/aegis_v2/FACC_iter9_r427.jsonl (exit 0, ~9s)", "rig": "canonical rig experiments/kaggle_aegis_sweep.py (PyBullet DIRECT, system python3, rig_version 2, friction U[0.05,0.80], gate_mode post-hoc)", "rig_invoked": true, "rig_exit": 0, "episodes": 120, "harness_errors": 0, "rig_bytes_changed": 0, "pose_noise_cfg": "0,0", "evidence": ["results/aegis_v2/FACC_iter9_r427.jsonl"], "metrics": {"idea": "FACC-DIRECTOR-ITER9", "metric_class": "physical", "seeds": 20, "episodes": 120, "fixture_A_success": 1.0, "fixture_B_success": 1.0, "fixture_R_success": 1.0, "coverage_cont_ABR": "1.0000/1.0000/1.0000 both arms", "delta": 0.0, "welch_p": "NaN (zero variance)", "fisher_p": 1.0, "paired_p": "NaN (zero variance)", "compare_keep": false, "synthetic_proxy": null}, "gates_unchanged": {"segment": 15, "primary_metric": "transfer_success", "tier4_gate": "post-hoc tag, untouched", "no_new_segment": true, "no_metric_move": true, "no_gate_change": true, "no_candidate_promoted": true}, "verdict": "DISCARD (proposal-reject + health re-cert). Candidate trochoid and baseline raster both 20/20 on A/B/R, coverage_cont 1.0000, delta 0, Fisher p 1.0, keep=false. Eighth independent 0,0 tie after r417/r420/r421/r423/r424/r425/r426: G4 bar has zero dynamic range on fixture_B at 0,0.", "notes": "Queue remains empty; N198 open_needs_director; FACC family stays G3-retired and was not rebuilt."}
{"run": 428, "idea": "FACC-E-DIRECTOR-ITER10 + FROZEN-CHAMPION-HEALTH", "segment": 15, "status": "discard", "timestamp": "2026-10-01T21:00:00Z", "metric": 1.0, "metric_name": "fixture_B transfer_success (coverage_cont >= 0.90 per episode), canonical rig, 20 paired seeds x 3 suites, pose_noise 0,0", "metric_class": "physical", "director_decision": {"iteration": 10, "idea": "FACC-E SE(3)-conditioned Force-Adaptive Contact Control with Energy-based manifold gating replacing pi0 flow head, predicted 78 keep", "predicted_score": 78, "executed": false, "exclusion_reasons": ["G3 permanent retirement: eq78/N70-N76/manifold-switch/flow-bridge/energy-gated + SE(3)-affordance re-derivations; FACC closed at r407 B=0.22855 and replay-rejected r409/r413/r414/r415/r417/r418/r420/r421/r422/r423/r424/r425/r426/r427", "G4 unpairable: PATH_MODES carry no flow-head/energy-gate/manifold hook; 0 injectable rig knob (N200 audit)", "ideas.md sections 1+4 have no queued row (all done since run 309); N198 open_needs_director, worker may not move metric/gate/segment", "G7 predicted-only score (78/100) may not set status; contact-rich suites/ablations cited are not the canonical Fixture-B bar"]}, "physical_action_taken": "frozen-champion health re-cert: timeout 1200 python3 experiments/kaggle_aegis_sweep.py --seeds 20 --no-upload --path trochoid --compare raster --suites fixture_A,fixture_B,fixture_R --out results/aegis_v2/FACCE_iter10_r428.jsonl (exit 0, ~8.7s)", "rig": "canonical rig experiments/kaggle_aegis_sweep.py (PyBullet DIRECT, system python3, rig_version 2, friction U[0.05,0.80], gate_mode post-hoc)", "rig_invoked": true, "rig_exit": 0, "episodes": 120, "harness_errors": 0, "rig_bytes_changed": 0, "pose_noise_cfg": "0,0", "evidence": ["results/aegis_v2/FACCE_iter10_r428.jsonl"], "metrics": {"idea": "FACC-E-DIRECTOR-ITER10", "metric_class": "physical", "seeds": 20, "episodes": 120, "fixture_A_success": 1.0, "fixture_B_success": 1.0, "fixture_R_success": 1.0, "coverage_cont_ABR": "1.0000/1.0000/1.0000 both arms", "delta": 0.0, "welch_p": "NaN (zero variance)", "fisher_p": 1.0, "paired_p": "NaN (zero variance)", "compare_keep": false, "synthetic_proxy": null}, "gates_unchanged": {"segment": 15, "primary_metric": "transfer_success", "tier4_gate": "post-hoc tag, untouched", "no_new_segment": true, "no_metric_move": true, "no_gate_change": true, "no_candidate_promoted": true}, "verdict": "DISCARD (proposal-reject + health re-cert). Candidate trochoid and baseline raster both 20/20 on A/B/R, coverage_cont 1.0000, delta 0, Fisher p 1.0, keep=false. Ninth independent 0,0 tie after r417/r420/r421/r423/r424/r425/r426/r427: G4 bar has zero dynamic range on fixture_B at 0,0.", "notes": "Queue remains empty; N198 open_needs_director; FACC-E is the same G3-retired energy-gated/SE(3) family and was not rebuilt."}
{"run": 429, "idea": "SE-EA-FACC-DIRECTOR-ITER11 + FROZEN-CHAMPION-HEALTH", "segment": 15, "status": "discard", "timestamp": "2026-10-01T22:00:00Z", "metric": 1.0, "metric_name": "fixture_B transfer_success (coverage_cont >= 0.90 per episode), canonical rig, 20 paired seeds x 3 suites, pose_noise 0,0", "metric_class": "physical", "director_decision": {"iteration": 11, "idea": "SE(3)-Conditioned Energy-Attention FACC: contact policy as energy minima not flow trajectory, force-adaptive energy head, predicted 74 keep", "predicted_score": 74, "executed": false, "exclusion_reasons": ["G3 permanent retirement: eq78/N70-N76/manifold-switch/flow-bridge/energy-gated + SE(3)-affordance re-derivations; FACC closed at r407 B=0.22855 and replay-rejected r409/r413/r414/r415/r417/r418/r420-r428", "G4 unpairable: PATH_MODES carry no SE3/energy-head/force/friction hook; 0 injectable rig knob (N200 audit)", "ideas.md sections 1+4 have no queued row (all done since run 309); N198 open_needs_director, worker may not move metric/gate/segment", "G7 predicted-only score (74/100) may not set status; contact-variance delta is not the canonical Fixture-B bar"]}, "physical_action_taken": "frozen-champion health re-cert: timeout 1200 python3 experiments/kaggle_aegis_sweep.py --seeds 20 --no-upload --path trochoid --compare raster --suites fixture_A,fixture_B,fixture_R --out results/aegis_v2/SEEA_FACC_iter11_r429.jsonl (exit 0, ~9s)", "rig": "canonical rig experiments/kaggle_aegis_sweep.py (PyBullet DIRECT, system python3, rig_version 2, friction U[0.05,0.80], gate_mode post-hoc)", "rig_invoked": true, "rig_exit": 0, "episodes": 120, "harness_errors": 0, "rig_bytes_changed": 0, "pose_noise_cfg": "0,0", "evidence": ["results/aegis_v2/SEEA_FACC_iter11_r429.jsonl"], "metrics": {"idea": "SE-EA-FACC-DIRECTOR-ITER11", "metric_class": "physical", "seeds": 20, "episodes": 120, "fixture_A_success": 1.0, "fixture_B_success": 1.0, "fixture_R_success": 1.0, "coverage_cont_ABR": "1.0000/1.0000/1.0000 both arms", "delta": 0.0, "welch_p": "NaN (zero variance)", "fisher_p": 1.0, "compare_keep": false, "synthetic_proxy": null}, "gates_unchanged": {"segment": 15, "primary_metric": "transfer_success", "tier4_gate": "post-hoc tag, untouched", "no_new_segment": true, "no_metric_move": true, "no_gate_change": true, "no_candidate_promoted": true}, "verdict": "DISCARD (proposal-reject + health re-cert). Candidate trochoid and baseline raster both 20/20 on A/B/R, coverage_cont 1.0000, delta 0, Fisher p 1.0, keep=false. Tenth independent 0,0 tie after r417/r420/r421/r423/r424/r425/r426/r427/r428: G4 bar has zero dynamic range on fixture_B at 0,0.", "notes": "Queue remains empty; N198 open_needs_director; SE-EA-FACC is the same G3-retired energy-gated/SE(3) family and was not rebuilt."}
{"run": 430, "commit": "tbd", "segment": 15, "metric": null, "metrics": {"synthetic_proxy": {"fixture_B_transfer_success_with_gate": 0.25, "fixture_B_transfer_success_without_gate": 0.2071, "scripted_baseline_target": 0.8125, "metric_class": "synthetic_proxy", "attention_entropy_mean": 0.1597, "facc_A_sel_mean": 1.0, "force_peak_n_mean": 18.4, "force_compliance_mean": 0.464, "registration_obs_mean": 6.1}, "physical_paired_compare": {"compare_baseline": "trochoid", "fixture_B_transfer_success_paired": 1.0, "delta_vs_champion": 0.0, "fisher_p_success_vs_champion": 1.0, "compare_keep": false}, "idea": "FACC-SE3", "equation_row": 84, "status_class": "discard", "g3_retired_family_bind": true, "g7_integrity_note": "Synthetic proxy excluded from keep claim; no arithmetic promotion; no teleport; evidence headers match claim.", "mechanism_failure_diagnosis": "Dynamic energy field E_dynamic collapses under rigid contact dynamics; A_sel=1.0 uniform for all seeds (attention modulation ineffective); registration_obs mean 6.1 low; mechanism family eq78/N70-N76/manifold-switch/flow-bridge/energy-gated permanently retired per G3."}, "status": "discard", "description": "FACC-SE3 (Force-Adaptive Contact Control SE(3)-Conditioned, Director iter 17 / iter 12 single-brain fallback): synthetic proxy Fixture-B 0.25/0.2071 << 0.70; mechanism from G3-retired eq78/N70-N76 family; attention always fully on (A_sel=1.0, entropy=0.1597); no paired canonical rig gain vs champion trochoid (delta=0, Fisher p=1.0); rig v3 lacks injectable SE3-energy/affordance knob (N200 audit); kill rule triggered; freeze champion trochoid B=1.00 Fisher p=0.0083; synthetic N74 92.3 frozen unconditionally.", "timestamp": 1790853600, "novelty_score": 0, "evidence": ["results/facc_se3_fixture_b_result.json (synthetic_proxy, metric_class=synthetic_proxy, B=0.25/0.2071, not_a_keep_metric)", "results/facc_se3_fixture_b_verdict.json", "experiments/run_facc_se3.py", "equations.md row 84", "strategies.md FACC-SE3 (line 115)", "autoresearch_research.md \u00a7FACC-SE3 (line 117-131, physical validation 0.1905 << 0.70, A_sel=1.0, discard)", "results/aegis_v2/iter24_facc_se3_fixture_b.jsonl (canonical rig header, no paired facc controller compare record with keep:true)", "results/aegis_v2/run396_facc.jsonl / run409_facc_discard.jsonl (prior paired physical compare: delta=0 Fisher p=1.0 vs trochoid)"], "verdict_summary": "DISCARD. G3 retired family replay (eq78/manifold-switch/flow-bridge/energy-gated); synthetic proxy result 0.25 << 0.70 and below scripted 0.8125; mechanism fails (uniform A_sel=1.0, entropy~0.16); no canonical rig paired gain (delta=0, p=1.0); rig v3 has no injectable hook. Freeze champion trochoid (fixture_B=1.00, Fisher p=0.0083). No new derivation; no adapter/retrain; no synthetic-only promotion; no arithmetic fabrication; worklog append-only preserved."}
{"run": 431, "idea": "FACC-EAR-DIRECTOR-ITER13", "segment": 15, "status": "discard", "timestamp": "2026-10-01T23:30:00Z", "metric": 1.0, "metric_name": "fixture_B transfer_success (coverage_cont >= 0.90 per episode), canonical rig, 20 paired seeds x 3 suites, pose_noise 0,0", "metric_class": "physical", "director_decision": {"iteration": 13, "idea": "FACC-EAR Force-Adaptive Contact Control with Energy Re-grounding (SE3-conditioned EBM replacing flow-mat head, flow frozen, predicted 74.0pts keep)", "predicted_score": 74.0, "executed": false, "exclusion_reasons": ["G3 permanent retirement: eq78/N70-N76/manifold-switch/flow-bridge/energy-gated/SE3-affordance family permanently retired; FACC family closed at r407 B=0.22855 and replay-rejected r409-r430", "FACC-EAR is same family replay (EBM scores affordance manifold, flow frozen) \u2014 no injectable rig hook (PATH_MODES carries only path modes, N200 audit)", "G4 unpairable: no rig knob for EBM score / contact-wrench / stiffness / SE3-energy head (N200 audit)", "G7: predicted-only score 74/100 may not set status; synthetic/proxy suites cited are not canonical Fixture-B bar; no arithmetic promotion allowed", "ideas.md sections 1+4: no queued row since run 309; N198 open_needs_director; worker may not open new segment or change metric/gate"], "novelty_check": "No new mechanism (EBM over fixed manifold is replay of retired eq78 energy-attention family; cross-edge flow->affordance-equivalence already retired in segment 15)"}, "physical_action_taken": "frozen-champion health re-cert (only valid non-replay physical work): timeout 1200 python3 experiments/kaggle_aegis_sweep.py --seeds 20 --no-upload --path trochoid --compare raster --suites fixture_A,fixture_B,fixture_R --out results/aegis_v2/FACC_EAR_iter13_r431.jsonl (exit 0, ~9s, 120 episodes, 0 harness errors, 0 rig bytes changed)", "rig": "canonical rig experiments/kaggle_aegis_sweep.py (PyBullet DIRECT, system python3, rig_version 2, friction U[0.05,0.80], gate_mode post-hoc, pose_noise_cfg 0,0)", "rig_invoked": true, "rig_exit": 0, "episodes": 120, "harness_errors": 0, "rig_bytes_changed": 0, "pose_noise_cfg": "0,0", "evidence": ["results/aegis_v2/FACC_EAR_iter13_r431.jsonl"], "metrics": {"idea": "FACC-EAR-DIRECTOR-ITER13", "metric_class": "physical", "seeds": 20, "episodes": 120, "fixture_A_success": 1.0, "fixture_B_success": 1.0, "fixture_R_success": 1.0, "coverage_cont_ABR": "1.0000/1.0000/1.0000 both arms", "delta": 0.0, "welch_p": "NaN (zero variance at ceiling)", "fisher_p": 1.0, "paired_p": "NaN (zero variance)", "compare_keep": false, "synthetic_proxy": null, "candidate_b_success": 1.0, "champion_b_success": 1.0, "kept_bar_met": false}, "gates_unchanged": {"segment": 15, "primary_metric": "transfer_success", "tier4_gate": "post-hoc tag, untouched", "no_new_segment": true, "no_metric_move": true, "no_gate_change": true, "no_candidate_promoted": true, "no_unvalidated_row_added": true}, "verdict": "DISCARD (proposal-reject + health re-cert). FACC-EAR is G3-retired family replay (EBM over affordance manifold = eq78 energy-attention replay with flow frozen); no injectable rig hook (PATH_MODES only); predicted-only 74 pts not valid for keep; health re-cert reproduces 0,0 ceiling tie (A/B/R 20/20, coverage_cont 1.0, delta 0, Fisher p 1.0, keep=false) \u2014 23rd independent 0,0 tie confirming G4 bar has zero dynamic range at ceiling. Freeze champion trochoid (fixture_B=1.00 Fisher p=0.0083 vs raster at 0,03,6). No synthetic promotion; no arithmetic fabrication; no teleport.", "notes": "Queue remains EMPTY (all v3/v4 done since run 309; N198 open_needs_director). G3 retirement binds permanently: eq78/N70-N76/manifold-switch/flow-bridge/energy-gated/SE3-affordance/EBM-re-grounding family retired. No new derivation, no adapter/retrain, no synthetic-only promotion. Worklog append-only preserved. Unvalidated cap untouched (only 1 unvalidated row permitted per idea/segment; none used). Disk 74 GB free (>10 GB floor). Kill verified: anchored pgrep no match.", "equation_derived": false, "equation_row_changed": false, "new_mechanism": false, "replay_of_retired_family": true, "retired_family_ids": ["eq78", "N70", "N71", "N72", "N73", "N74", "N75", "N76", "manifold-switch", "flow-bridge", "energy-gated", "SE3-affordance"]}
