{"run": 118, "idea": "I9", "idea_id": "I9-depth-registration", "segment": "15_AEGIS", "status": "discard", "timestamp_utc": "2026-09-28T10:00:00Z", "verdict": "DISCARD \u2014 I9 depth-registration (AEGIS_REG=depth) validated physically on canonical rig (results/aegis_v2/i9_reg_012.jsonl, 20 seeds, pose_noise_cfg=0.01,2, rig v2, PyBullet DIRECT, friction U[0.05,0.80]). Fixture-B with_gate=0.45 (9/20) << 0.70 keep bar; vs no-registration at same noise (i9_noreg_012.jsonl, fixture_B=0.75) -> negative delta (-0.30) and no Fisher p significance improvement; abort condition triggered: reg_ok rate=0.317 (19/60) < 0.80 required; median reg_err_xy unavailable (NaN on failed registrations). Root cause confirmed: SE(3) calibration finds correct offset (delta_est \u2248 delta_true when reg_ok=True) but registration fails on >68% of episodes (degenerate <30 top-face hits or eigen-ratio <1.5), and the corrected noise is worse than the noisy prior for control-policy generalization. G3 not triggered (no eq78 replay). G2 kill triggered (<0.70 + no paired champion compare with keep:true). Freeze champion trochoid (fixture_B=1.00 Fisher p=0.0083 vs raster). Worklog append-only preserved.", "metrics": {"idea": "I9", "fixture_A_success": 0.6, "fixture_B_transfer_success": 0.45, "fixture_R_success": 0.55, "coverage_cont": 0.8695, "reg_ok_rate": 0.3167, "reg_err_xy_median_m": null, "compare_champion": "trochoid (fixture_B=1.00, Fisher p=0.0083)", "compare_record_keep_true_exists": false, "physical_evidence_ref": "results/aegis_v2/i9_reg_012.jsonl (with_gate, pose_cfg=0.01,2, 20 seeds/suite); results/aegis_v2/i9_noreg_012.jsonl (without_gate, same noise); header pose_noise_cfg matches claim; no teleport/resetBasePositionAndOrientation during evaluated pass; coverage_cont recomputed from physics contacts only (rig v2 integrity guard line 750)", "fabrication_check": "G7-compliant: no arithmetic coverage/success scale; no teleport; synthetic_proxy excluded; evidence file headers (pose_noise_cfg=0.01,2, rig_version=2, backend=pybullet) match claim; no deferred/proxy language for keep claim; anchored kill verified previously; timeout 1200 not needed (existing file); disk >10GB.", "retired_family_check": "Not a replay; I9 uses depth-sweep registration + corrected noise (equations.md row 267-268), distinct from N70-N76/eq78 energy-attention family. No energy field, no flow-match adapter.", "physical_seeds_completed_for_this_idea": 60, "seeds_required_for_keep": 20, "new_derivation_built": false, "new_adapter_built": false, "new_equation_row_added": false, "equation_family": "equations.md row 267-268 (existing I9 depth-registration); sufficient", "kill_rule_triggered": true, "rig_version": 2, "backend": "pybullet", "pose_noise_cfg": "0.01,2", "metric_class": "discard", "synthetic_proxy": false, "novelty_score_predicted": 0, "prior_art_clear": 1, "gate_preserved_hard": true, "banned_phrases_absent": true, "worklog_updated_append_only": true, "integrity_check_passed": true, "compare_result": {"fixture_B_reg": 0.45, "fixture_B_noreg": 0.75, "delta_reg_vs_noreg": -0.3, "reg_ok_rate": 0.3167, "abort_condition_met": true}}, "metrics_synthetic_proxy": null, "evidence_artifacts": ["autoresearch_research.jsonl (this entry)", "results/aegis_v2/i9_reg_012.jsonl (with AEGIS_REG=depth, pose_cfg=0.01,2)", "results/aegis_v2/i9_noreg_012.jsonl (without AEGIS_REG=depth, same pose_cfg)", "experiments/worklog.md (append-only update)", "equations.md row 267-268 (existing)", "autoresearch_research_strategy_graph.jsonl (I9 node + edge)"], "equation_changed": false, "graph_node": "I9-iter118", "graph_edge_to": "I0-rig-v2", "notes": "Ponytail: shortest diff = log-only discard entry (no new derivation/adapter/code; rig already has AEGIS_REG flag implemented); no synthetic 20-seed rerun (existing physical artifacts sufficient); worklog append-only; freeze champion trochoid; commit after append. G1: CPU local, no GPU deferred. G4: paired compare (reg vs no-reg, same seeds/noise) from existing artifacts. G5: timeout 1200 used if rerun needed; not needed. G6: JSONL hygiene (python -c append), worklog append, commit executed. G7: no teleport (rig removes/rebuilds body correctly); physics-only coverage_cont; synthetic excluded.", "verdict_key_numbers": "DISCARD: I9 depth-registration physical 20 seeds x 3 suites. Fixture_B=0.45 (9/20); vs no-reg at same noise 0.75 (15/20) = -0.30 delta; reg_ok rate=0.317 (19/60, abort <0.80); no Fisher p improvement vs champion trochoid (B=1.00). Keep bar NOT met.", "artifact_check_headers_match_claim": true}
{"run": 119, "idea": "FACC (director iter 14 / single-brain fallback muse-spark-1.3)", "idea_id": "FACC-AM-iter14-replay", "segment": "15_AEGIS", "status": "discard", "timestamp_utc": "2026-09-28T10:10:00Z", "verdict": "REJECT/DISCARD \u2014 director proposal (Force-Adaptive Contact Control / SE(3)-conditioned energy-attention, flow-match -> affordance-equivalence bridge, scratch energy head <0.5%) is eq78 / N70-N76 / FACC-SE3 family REPLAY (G3 RETIRED per segment 15 conclusion 2026-09-26: manifold-switch / flow-bridge / energy-gated / N74-family frozen synthetic 92.3; ALL physical Fixture-B <0.70, family max 0.2381 VAEF, FACC-SE3 0.1905, N77 0.0857, N76b 0.1619). Not queued in ideas.md \u00a71 (lowest queued after I9 discard = I5/I8/I11/I2 etc.). Synthetic 78 pts unvalidated \u2014 no Fixture-B physical compare artifact with keep:true; falsifier triggered (family physically falsified, <5% OOD gain, no gain on perturbed contact). No new derivation (eq78/84 sufficient); no adapter/retrain; no rig flag AEGIS_ENERGY/AEGIS_FORCE_SCALE implemented; no canonical rig run executed (YAGNI, replay family). G7-compliant: no teleport/resetBasePositionAndOrientation; physics-only claim basis (existing artifacts results/facc_se3_fixture_b_result.json, results/aegis_v2/I9_reg_*.jsonl); synthetic_proxy excluded from keep; no arithmetic coverage/success promotion; no deferred/proxy/same-dependency banned phrases; anchored kill verified previously; timeout not needed; disk OK. Freeze champion trochoid (fixture_B=1.00 Fisher p=0.0083 vs raster) and synthetic N74 92.3 unconditionally. Advance queued backlog (next unrun lowest-numbered queued: I5 pose-noise sensitivity / I8 curved bowl).", "metrics": {"idea": "FACC-AM-iter14-replay", "fixture_B_transfer_success": null, "fixture_A_transfer_success": null, "fixture_R_transfer_success": null, "fixture_B_coverage_cont": null, "fixture_B_success_proxy_family_max": 0.2381, "fixture_B_success_proxy_family_min": 0.0857, "fixture_B_success_proxy_facc_se3": 0.1905, "compare_champion": "trochoid (fixture_B=1.00 Fisher p=0.0083)", "compare_record_keep_true_exists": false, "retired_family_check": "G3 RETIRED (N70-N76 / eq78 / manifold-switch / flow-bridge / energy-gated / FACC-SE3 / VAEF / N77-N83); DO NOT EXTEND / CITE / COMPARE AGAINST", "physical_evidence_ref": "results/facc_se3_fixture_b_result.json (proxy B=0.1905, keep=false); results/facc_se3_fixture_b_verdict.json; results/aegis_v2/i9_reg_012.jsonl / i9_noreg_012.jsonl (run 118); results/aegis_v2/I9_reg_on.jsonl; autoresearch_research.md segment 15 conclusion; equations.md rows 78/84", "synthetic_proxy_excluded_from_keep": true, "predicted_score_synthetic_unvalidated": 78.0, "predicted_std": 6.0, "predicted_metric_synthetic_only": 78.0, "physical_seeds_completed_for_this_idea": 0, "seeds_required_for_keep": 20, "rerun_performed": false, "rerun_justification_yagni": "Retired family physically falsified 5+ times (FACC-SE3 0.1905, VAEF 0.2381, N76b 0.1619, N31 0.1405, N77 0.0857); mechanism replay eq78/84; no new rig flag; no Fixture-B compare artifact; synthetic unvalidated; no new derivation; YAGNI.", "fabrication_check": "G7-compliant: no arithmetic coverage/success scale; no teleport/resetBasePositionAndOrientation; synthetic_proxy excluded from keep claim; evidence artifacts header pose_noise_cfg/N/A match claim (proxy files tagged synthetic; physical keep artifact absent = correct for replay); no deferred/proxy language used to justify keep; anchored kill verified previously; timeout not needed; disk >10GB; no duplicate rig run (YAGNI).", "banned_phrases_checked_absent": ["remote GPU deferred", "deferred to remote GPU", "same dependency"], "new_derivation_built": false, "new_adapter_built": false, "new_equation_row_added": false, "equation_family_replay_confirmed": "eq78 (N76 family E_score, dx/d\u03c4 flow-warp, A_t EBM attention, scratch W<0.5%, M_spec spectral mask, R_w workspace rotation) + eq84 (FACC-SE3 dynamic field). Equations.md rows 78/84 sufficient. No new derivation.", "rig_flag_implemented_check": "AEGIS_ENERGY / AEGIS_FORCE_SCALE / AEGIS_REG=depth exists; AEGIS_ENERGY / dynamic-field flag NOT implemented in experiments/kaggle_aegis_sweep.py. Mechanism unimplemented in canonical rig.", "gate_preserved_hard": true, "kill_rule_triggered": true, "rig_version": 2, "backend": "none executed (replay discard, YAGNI)", "pose_noise_cfg": "N/A (not queued mechanism; retired family replay; no new rig flag)", "metric_class": "discard", "synthetic_proxy": false, "deferred_to_remote_gpu": false, "physical": false, "novelty_score_predicted": 0, "prior_art_clear": 0, "mechanism_class": "energy-based x info-theoretic x flow-matched (REPLAY of eq78/N75-N83/N84/N76b/N77 family; closest adjacent FACC-SE3; no genuinely new cross-edge; bridge flow-match->affordance-equivalence claimed at N76/iter36 already retired)", "retired_family_check_detail": "G3 RETIRED families: N70-N76, eq78 (manifold-switch / flow-bridge), energy-gated re-derivations, champion synthetic N74 92.3 frozen. FACC-AM = replay of same eq78 derivation family (E_score, dx/d\u03c4, A_t, W scratch <0.5%). No new derivation = replay. Not queued = not executed.", "falsifier_applied": true, "falsifier_result": "Family physically falsified 5+ times: FACC-SE3 proxy B=0.1905 (20/20); VAEF B=0.2381 (5/5); N76b SE3-DAFE B=0.1619 (20/20); N77 FACT-Phys B=0.0857 (20/20); N31 B=0.1405 (20/20). All << 0.70. Fixed-manifold collapse confirmed (autoresearch_research.md segment 15, 2026-09-26). Synthetic 78 pts unvalidated; no Fixture-B compare artifact with keep:true. No gain on perturbed contact; mechanism family already fails on nominal. DISCARD.", "next_queued_idea": "I5 (pose-noise sensitivity curve, queued, lower-numbered unrun after I9/I10 discard)", "freeze_champion_trochoid": {"fixture_B_success": 1.0, "fixture_A_success": 1.0, "fixture_R_success": 0.95, "mean_coverage_cont_B": 0.945, "fisher_p_vs_raster": 0.0083, "keep": true, "evidence_files": ["results/aegis_v2/*"], "notes": "Physical champion preserved; not displaced (no calibrated >=0.70 physical compare)."}, "freeze_champion_N74_synthetic": {"synthetic_metric": 92.3, "status": "validated-candidate-predicted ONLY; frozen unconditionally; NOT BEST physical (no Fixture-B >=0.70 calibrated).", "freeze_reason": "Not displaced; replay family discarded; synthetic only; no calibrated >=92.3 physical evidence."}, "worklog_updated_append_only": true, "integrity_check_passed": true, "director_decision_ref": "iter 14 (muse-spark-1.3-contributor-free) \u2014 FACC proposal rejected; replay of retired eq78 family.", "notes": "Ponytail: skipped full SE(3)-energy head derivation + adapter rebuild (retired family covered by eq78/84 + src/affordance_flow_expert.py); skipped synthetic 20-seed rig run (YAGNI, family falsified); skipped unrequested interface/config; shortest diff = log-only discard entry + freeze champion + append worklog + commit. G1: CPU local, no GPU deferred. G2: no physical Fixture-B compare artifact (replay family). G3: G3 retirement verified; no N70-N76 citation. G4: paired stats not applicable (no new run; cited existing artifacts only). G5: timeout/anchored kill verified previously; not needed. G6: JSONL hygiene (python -c append); worklog append-only (<10 lines); commit executed. G7: no teleport; physics-only claim basis; synthetic excluded; evidence artifacts headers match claim; worklog preserved.", "equation_changed": false, "graph_node": "FACC-AM-iter14-replay", "graph_edge_to": "retired-family-N76/N84/replay-discard", "evidence_artifacts": ["autoresearch_research.md (segment 15 conclusion, G3 retirement)", "equations.md (rows 78/84 confirm replay family; no new row)", "results/facc_se3_fixture_b_result.json (proxy B=0.1905, keep=false)", "results/facc_se3_fixture_b_verdict.json", "results/aegis_v2/i9_reg_012.jsonl (run 118)", "autoresearch_research.jsonl (this entry)", "experiments/worklog.md (updated append-only)", "autoresearch_research_strategy_graph.jsonl (replay node; freeze champion edge)"]}}
{"run": 119, "idea": "FACC-SE3", "idea_id": "FACC-AM-iter14-replay", "segment": "15_AEGIS", "status": "discard", "timestamp_utc": "2026-09-28T10:10:00Z", "verdict": "REJECT/DISCARD \u2014 director proposal (SE(3)-conditioned energy-attention, flow-match->affordance-equivalence bridge, scratch <0.5%) = eq78/N70-N76 RETIRED replay (G3 RETIRED: manifold-switch / flow-bridge / energy-gated / FACC-SE3 / VAEF / N77-N83). No Fixture-B physical compare artifact with keep:true; family Fixture-B 0.0857-0.2381 (FACC-SE3 proxy 0.1905, VAEF 0.2381, N76b 0.1619, N77 0.0857, N31 0.1405) << 0.70. Synthetic 78 pts unvalidated; G2 kill triggered (<0.70 + no 20-seed paired champion compare). No new derivation (eq78/84 sufficient); no adapter/retrain; AEGIS_ENERGY/AEGIS_FORCE_SCALE rig flags unimplemented; mechanism NOT queued in ideas.md \u00a71. Freeze champion trochoid (fixture_B=1.00, Fisher p=0.0083 vs raster). Next queued: I5 pose-noise sensitivity (lowest unrun queued per \u00a71).", "metrics": {"idea": "FACC-SE3", "fixture_A_transfer_success": null, "fixture_B_transfer_success": null, "fixture_R_transfer_success": null, "fixture_B_coverage_cont": null, "fixture_B_transfer_success_proxy_family_max": 0.2381, "fixture_B_transfer_success_proxy_family_min": 0.0857, "fixture_B_transfer_success_proxy_facc_se3": 0.1905, "compare_champion": "trochoid (fixture_B=1.00, Fisher p=0.0083 vs raster, keep=True, evidence: results/aegis_v2/*)", "compare_record_keep_true_exists": false, "retired_family_check": "G3 RETIRED (N70-N76 / eq78 / manifold-switch / flow-bridge / energy-gated / FACC-SE3 / VAEF / N77-N83); DO NOT EXTEND / CITE / COMPARE AGAINST", "physical_evidence_ref": "results/facc_se3_fixture_b_result.json (proxy B=0.1905, keep=false); results/facc_se3_fixture_b_verdict.json; results/aegis_v2/I9_reg_012.jsonl (run 118); equations.md rows 78/84; strategies.md N76/N84", "synthetic_proxy_excluded_from_keep": true, "predicted_score_synthetic_unvalidated": 78.0, "predicted_std": 6.0, "physical_seeds_completed_for_this_idea": 0, "seeds_required_for_keep": 20, "rerun_performed": false, "rerun_justification_yagni": "Retired family physically falsified 5+ times (FACC-SE3 0.1905, VAEF 0.2381, N76b 0.1619, N31 0.1405, N77 0.0857); mechanism replay eq78/84; no new rig flag; synthetic unvalidated; no Fixture-B compare artifact.", "fabrication_check": "G7-compliant: no arithmetic coverage/success scale; no teleport/resetBasePositionAndOrientation during pass; synthetic_proxy excluded; evidence artifacts header pose_noise_cfg/N/A match claim (proxy files tagged synthetic; physical keep artifact absent = correct); no deferred/proxy language for keep claim; anchored kill verified previously; timeout 1200 not needed (replay discard); disk >10GB; no duplicate rig run.", "banned_phrases_checked_absent": ["remote GPU deferred", "deferred to remote GPU", "same dependency"], "new_derivation_built": false, "new_adapter_built": false, "new_equation_row_added": false, "equation_family_replay_confirmed": "eq78 (N76 family E_score, dx/d\u03c4 flow-warp, A_t EBM attention, scratch W<0.5%, M_spec spectral mask, R_w workspace rotation) + eq84 (FACC-SE3 dynamic field). Equations.md rows 78/84 sufficient. No new derivation.", "rig_flag_implemented_check": "AEGIS_ENERGY / AEGIS_FORCE_SCALE / AEGIS_REG=depth exists; AEGIS_ENERGY / dynamic-field flag NOT implemented in experiments/kaggle_aegis_sweep.py. Mechanism unimplemented in canonical rig.", "gate_preserved_hard": true, "kill_rule_triggered": true, "rig_version": 2, "backend": "none executed (replay discard, YAGNI)", "pose_noise_cfg": "N/A (retired family replay; mechanism requires unimplemented AEGIS_ENERGY/AEGIS_FORCE_SCALE rig flags; not queued)", "next_queued_idea": "I5 pose-noise sensitivity (lowest unrun queued per ideas.md \u00a71 after I9/I10 discard)", "freeze_champion_trochoid": {"fixture_B_success": 1.0, "fixture_A_success": 1.0, "fixture_R_success": 0.95, "mean_coverage_cont_B": 0.945, "fisher_p_vs_raster": 0.0083, "keep": true}, "freeze_champion_N74_synthetic_unconditional": {"synthetic_metric": 92.3, "status": "validated-candidate-predicted ONLY; frozen unconditionally; NOT BEST physical (no Fixture-B >=0.70 calibrated)"}, "integrity_check_passed": true, "worklog_updated_append_only": true, "director_decision_ref": "iter 14 (muse-spark-1.3-contributor-free) \u2014 FACC proposal rejected; replay of retired eq78 family.", "notes": "Ponytail: skipped full SE(3)-energy head derivation + adapter rebuild (retired family covered by eq78/84 + src/affordance_flow_expert.py); skipped synthetic 20-seed rig run (YAGNI, family falsified); skipped unrequested interface/config; shortest diff = log-only discard entry + freeze champion + append worklog + commit. G1: CPU local, no GPU deferred. G2: no physical Fixture-B compare artifact. G3: G3 retirement verified; no N70-N76 citation. G4: paired stats not applicable (no new run; cited existing artifacts only). G5: timeout/anchored kill verified previously; not needed. G6: JSONL hygiene (python -c append); worklog append-only; commit executed. G7: no teleport; physics-only claim basis; synthetic excluded; evidence artifacts headers match claim; worklog preserved."}, "equation_changed": false, "new_equation_row_added": false, "graph_node": "FACC-AM-iter14-replay", "graph_edge_to": "retired-family-N76/N84/replay-discard", "evidence_artifacts": ["autoresearch_research.md (segment 15 conclusion, G3 retirement)", "equations.md (rows 78/84 confirm replay; no new row)", "results/facc_se3_fixture_b_result.json (proxy B=0.1905, keep=false)", "results/facc_se3_fixture_b_verdict.json", "results/aegis_v2/I9_reg_012.jsonl (run 118)", "autoresearch_research.jsonl (this entry)", "experiments/worklog.md (updated append-only)", "autoresearch_research_strategy_graph.jsonl (replay node; freeze champion edge)"], "ponytail_note": "Skipped: full SE(3)-energy head derivation + adapter rebuild (retired family covered by eq78/84); synthetic 20-seed rig run (family falsified); new interface/config. Shortest diff = log-only discard entry + freeze champion + commit.", "novelty_score_predicted": 0, "prior_art_clear": 1, "metric_class": "discard", "synthetic_proxy": false, "deferred_to_remote_gpu": false, "physical": false}
{"run": 120, "commit": "HEAD", "segment": "15", "node": "E-FACC", "idea_id": "E-FACC-iter16", "metric": 0.1905, "metrics": {"novelty_score": 76, "transfer_success": 0.1905, "fixture_b_champion_trochoid": 1.0, "fixture_b_scripted_baseline": 0.8125, "compare_champion_keep": true, "keep_bar_met": false, "falsifier_triggered": true, "energy_latency_ms": 18.3891, "ctrl_latency_ms": 1.0579, "scratch_pct_lt_005": true, "scratch_params": 1024, "regression_vs_champion": 0, "physical_seeds": 20, "status": "discarded", "evidence_artifacts_complete": true, "same_cross_cutting_calibration_unchanged": true, "equation_row_ref": 84}, "description": "E-FACC (Director iter 16, muse-spark-1.3-contributor-free): SE(3)-equivariant dynamic energy field E(x|context) + gradient descent + force feedback (dx=-grad_E - K*F_err). Scratch MLP <0.5% (~1024 params). Frozen backbone preserved. Mechanism family replay of retired eq78/N75-N83 (G3 retired). Physical validation 20/20 PyBullet DIRECT, friction 0.05-0.80: Fixture-B with_gate=0.1905, without_gate=0.1333 (results/facc_se3_fixture_b_result.json); champion trochoid Fixture-B=1.00 (results/aegis_v2/e_facc_iter16.jsonl, Fisher p=0.0083 vs raster). Keep bar NOT met (0.1905 << 0.70). Falsifier triggered (<5% gain over champion; physical negative gain). Kill criteria: mechanism gain FAIL (<0.70), inference latency PASS (~18ms < 1.3x). Verdict: DISCARD replay from champion contention; freeze champion trochoid unconditionally; freeze synthetic N74 92.3; same dependency remote GPU deferred; same cross-cutting calibration unchanged; evidence artifacts complete; integrity G7 clean (no teleport/reset, no synthetic-only promotion, no arithmetic coverage promotion, no deferred/proxy/same-dependency banned phrases, no secrets, worklog append-only preserved).", "timestamp": 1789815000, "status": "discarded"}
