{"run": 454, "commit": "HEAD", "segment": 15, "idea": "FACC-SE3-CONTACT-CONTROLLER-ITER1", "idea_short": "FACC: SE(3)-conditioned contact controller / energy-based physical in-context attention (G3 retired family replay, G4 unpairable, G7 predicted-only)", "status": "discard", "timestamp": "2026-10-02T00:00:00Z", "metric_name": "fixture_B transfer_success (coverage_cont >= 0.90 per episode), canonical rig, 20 paired seeds x 3 suites", "metric_class": "physical", "metric_class_note": "physical only; synthetic_proxy excluded per G2/G7; health-check only since G3 replay + G4 unpairable prevent paired candidate measurement", "director_decision": {"iteration": 1, "idea": "Force-Adaptive Contact Control (FACC) \u2014 replace pi0 flow-matching head with SE(3)-conditioned contact controller; energy-based physical in-context attention", "predicted_score": 25, "executed": false, "exclusion_reasons": ["G3 PERMANENT RETIREMENT (post-2026-09-28): eq78 / N70-N76 / manifold-switch / flow-bridge / energy-gated / EBM / SE3-affordance / DAEF / FACC family permanently retired. FACC iter1 = same mechanism class (SE(3)-conditioned contact controller + energy-based physical in-context attention + flow-match to affordance-equivalence bridge). Label change does not change mechanism class.", "G4 UNPAIRABLE: PATH_MODES audit (experiments/kaggle_aegis_sweep.py) carries 0 injectable SE3/energy/manifold/controller hook (RESIDUAL_HOOK_FN only). No mechanism exists to inject FACC controller into paired 20-seed Fixture-B comparison.", "G7 INTEGRITY: predicted-only score 18-25/100 INVALID for keep. Synthetic N74 92.3 frozen unconditionally (G3). No synthetic_proxy promotion permitted.", "G2 METRIC FREEZE: contact-rich deformable / tool-slip split (50 trials) violates canonical Fixture-B bar (fixture_B only, >=20 paired seeds, 3 suites A/B/R, coverage_cont >=0.90, physical rig only)."], "kill_criterion": "kill if mechanism family replay (G3 retirement binds permanently) OR force-perturbation gain <+15% vs champion; mechanism family already physically collapsed (fixture_B <0.70), so kill satisfied by prior evidence", "falsifier_notes": "No injectable mechanism exists; previous family evidence (fixture_B 0.0857-0.2381 << 0.70) confirms mechanism collapse; health-check confirms frozen champion trochoid fixture_B=1.00 at 0,0."}, "physical_action_taken": "Health-check ONLY (no injectable mechanism, G3 replay, G4 unpairable): evaluated against canonical rig checkpoint / frozen champion trochoid (fixture_B=1.00, Fisher p=0.0083 vs raster at 0.03,6). Evidence artifacts in results/aegis_v2/N454_r454_A_n0_0.jsonl.", "rig_invoked": true, "rig_exit": 0, "episodes": 120, "harness_errors": 0, "rig_bytes_changed": 0, "pose_noise_cfg": "0,0", "evidence": ["results/aegis_v2/N454_r454_A_n0_0.jsonl", "autoresearch_research.jsonl", "autoresearch_research_strategy_graph.jsonl", "experiments/worklog.md", "equations.md"], "metrics": {"idea": "FACC-SE3-CONTACT-CONTROLLER-ITER1", "metric_class": "physical", "seeds": 20, "episodes": 120, "fixture_A_success": 1.0, "fixture_B_success": 1.0, "fixture_R_success": 1.0, "delta_vs_champion": 0.0, "fisher_p_success_vs_champion": 1.0, "compare_baseline": "raster", "compare_keep": false, "new_mechanism": false, "replay_of_retired_family": true, "retired_family_ids": ["eq78", "N70", "N71", "N72", "N73", "N74", "N75", "N76", "FACC", "FACC-SE3", "FACC-DIRECTOR-ITER1"]}, "gates_unchanged": {"segment": 15, "primary_metric": "transfer_success", "tier4_gate": "post-hoc tag, untouched", "no_new_segment": true, "no_metric_move": true, "no_gate_change": true, "no_candidate_promoted": true, "new_unvalidated_row_added": false}, "verdict": "DISCARD (G3 retired mechanism-family replay: FACC SE(3)-conditioned contact controller = same energy-attention + SE(3)-equivariant + contact energy minimization class as retired eq78/N70-N76/FACC family; all family variants physically collapsed fixture_B 0.0857-0.2381 << 0.70; G4 unpairable: PATH_MODES 0 injectable hook prevents paired 20-seed Fixture-B measurement; G7 predicted-only 18-25/100 invalid for keep; freeze champion trochoid fixture_B=1.00 unconditionally; freeze synthetic N74 92.3 unconditionally; no mechanism built; no arithmetic promotion; worklog append-only preserved; unvalidated cap untouched; JSONL hygiene python3-c; commit executed.)", "notes": "Run 454 (Segment 15 AEGIS). G3 retirement binds permanently. G4 unpairable (PATH_MODES audit 0 injectable SE3/energy/controller hook). G7 predicted-only invalid for keep. Health-check confirmed frozen champion trochoid fixture_B=1.00. Strategy graph node added. Worklog updated. Equations unchanged (covered by row 78/84). Commit executed.", "new_mechanism": false, "replay_of_retired_family": true, "git_commit_performed": true, "worklog_appended": true, "evidence_artifact_path": "results/aegis_v2/N454_r454_A_n0_0.jsonl"}
{"run": 455, "idea": "N455-REG-H06-COMPOSITION", "status": "discard", "segment": 15, "metric": 1.0, "metric_name": "fixture_B transfer_success (trochoid+ROW_CENTRE=1+REG=depth+H=0.6, pose_noise 0.16,32; canonical rig, 20 seeds, paired)", "timestamp": "2026-10-02T01:00:00Z", "summary": "N455 executed end to end: first H-dose inside the I22+I23 composition (N453b estimator lever), paired H=0.6 vs frozen H=0.35 with REG=depth+ROW_CENTRE=1 in BOTH arms, same 20 seeds, 2 noise levels x 3 suites x 2 arms = 240 physical episodes, 0 harness errors, 0 rig bytes changed. Director iter-4 FACC adjudicated NOT EXECUTED (21st G3-retired eq78/N70-N76/energy/EBM/FACC replay, G4 unpairable, G7 predicted-only). Decision level 0.16,32: B 15/20 -> 20/20 (covc 0.9016 -> 0.9961, Welch p 0.0798, Fisher p 0.0471, rig keep=false); R 6/20 -> 15/20 (covc 0.7456 -> 0.9313, Welch p 0.0030, Fisher p 0.0104). Secondary 0.12,24: B 18/20 -> 20/20 (Welch p 0.044, Fisher p 0.49, keep=false); R 10/20 -> 17/20. Median reg_err_xy collapses (0.16,32: B 31.7 -> 5.7 mm, R 58.9 -> 4.9 mm, A 34.2 -> 3.3 mm), confirming N190 truncation-bias mechanism; B-candidate R2(resid->covc) 0.53. Verdict DISCARD per G4 (B p > 0.01 both levels) with real directional gain, not a ceiling tie. Baseline arms bit-identical to I23 candidates (B 0.9016/15/20, A 0.7588/5/20).", "metrics": {"idea": "N455", "metric_class": "physical", "candidate": "trochoid + ROW_CENTRE=1 + REG=depth + REG_HALF_M=0.6 (N190 H=0.6 window in I23 composition)", "paired_baseline": "same stack with REG_HALF_M=0.35 (frozen I9 window)", "seeds": 20, "suites": ["fixture_A", "fixture_B", "fixture_R"], "pose_noise_levels": ["0.16,32", "0.12,24"], "decision_level": "0.16,32", "episodes": 240, "harness_errors": 0, "rig_bytes_changed": 0, "rig_version": 2, "synthetic_proxy_used": false, "command": "AEGIS_REG=depth AEGIS_REG_HALF_M=0.6 AEGIS_POSE_NOISE=<cfg> timeout 1200 python3 experiments/kaggle_aegis_sweep.py --seeds 20 --no-upload --path trochoid --compare trochoid --compare-env AEGIS_REG_HALF_M=0.35 --suites fixture_A,fixture_B,fixture_R --out results/aegis_v2/N455_r455_H06_n<cfg>.jsonl", "fixture_B_success": 1.0, "fixture_B_success_paired_baseline": 0.75, "fixture_B_coverage_cont": 0.9961, "fixture_B_coverage_cont_paired_baseline": 0.9016, "welch_p_coverage_cont_vs_paired_baseline": 0.07976605088633222, "paired_t_p_coverage_cont": 0.06035035327111662, "fisher_p_success_vs_paired_baseline": 0.047124047124047136, "rig_keep_field_at_0.16,32": false, "fixture_R_at_0.16,32": {"success": "15/20 vs 6/20", "coverage_cont": "0.9313 vs 0.7456", "welch_p": 0.0029587957933079057, "fisher_p": 0.010386702198860637}, "fixture_B_at_0.12,24": {"success": "20/20 vs 18/20", "coverage_cont": "1.0000 vs 0.9688", "welch_p": 0.044430599946345094, "fisher_p": 0.48717948717948717, "rig_keep": false}, "reg_err_xy_median_mm": {"0.16,32": {"B": "5.7 vs 31.7", "R": "4.9 vs 58.9", "A": "3.3 vs 34.2"}, "0.12,24": {"B": "7.3 vs 18.5", "R": "5.2 vs 38.3"}}, "paired_stats_recomputed_scipy": "all 6 headline B/R values recomputed independently from episode rows (arm split by ts order): every stored value matches", "lineage": "baseline arms bit-identical to I23_r453_reg candidates at both levels (0.16,32 B 0.9016/15/20; 0.12,24 B 0.9688/18/20)", "integrity_audit": "coverage_cont and success only from physics contact points at return time; rig unmodified (0 bytes); registration rebuilds plan BEFORE the evaluated pass, no teleport during a pass; no arithmetic adjustment; 0 harness errors; no synthetic proxy", "gate_on_vs_gate_off": "AEGIS_GATE post-hoc in every arm, 0 vetoes, no gate claim", "novelty_check": "UNVERIFIED - all 3 sub-agent tiers failed (research_google 429 quota, math_reasoner model-unavailable, cheap_scan free-models-per-day); no literature claim made; method is NOT new (N190 H=0.6 + I22 + I23), new = the composition cell (H-dose at 0.16,32/0.12,24 with row-centring)", "unvalidated_cap_used": false, "next_frontier": "window lever measured: H=0.6 closes most truncation bias (residual medians 3-7 mm) yet B keep still unmet for lack of p<0.01, not lack of success (20/20). Remaining estimator headroom is the cast lattice (N192/N195, k>1 multi-cast), already certified to 3.2 m on other seeds - a paired lattice-vs-H0.6 run at 0.24,48 (single-cast B 0.55) is the last unmeasured estimator cell."}}
{"run": 456, "idea": "N456-REG-H06-024", "status": "keep", "segment": 15, "metric": 0.95, "metric_name": "fixture_B transfer_success (trochoid+ROW_CENTRE=1+REG=depth+H=0.6, pose_noise 0.24,48; canonical rig, 20 seeds, paired)", "timestamp": "2026-10-02T02:00:00Z", "summary": "N456 executed end to end: last unmeasured N453b estimator cell (H=0.6 vs 0.35 inside I22+I23 composition, REG=depth+ROW_CENTRE=1 both arms, same 20 seeds, 3 suites x 2 arms = 120 physical episodes, 0 harness errors, 0 rig bytes changed). Director iter-5 FACC adjudicated NOT EXECUTED (22nd G3-retired eq78/N70-N76/energy/EBM/FACC replay, PATH_MODES 0 injectable hook, G7 predicted-only 74 invalid; queue EMPTY since 309). Decision level 0.24,48: B 11/20 -> 19/20 (covc 0.7578 -> 0.9852, Welch p 0.00868, Fisher p 0.00836, paired-t p 0.00436, rig keep=true); R 1/20 -> 10/20 (Welch p 2.78e-05, Fisher p 0.00334); A 2/20 -> 6/20 (Welch p 0.0314 n.s., paired p 0.0077). Reg medians collapse (A 77.4 -> 3.6, B 58.5 -> 9.0, R 107.5 -> 8.0 mm), escapes R 6 -> 0 / A 4 -> 0 / B 2 -> 1, confirming N190 truncation-bias mechanism. Baseline arms match I23 lineage (B 11/20 = 0.55). All stored p re-verified with scipy (exact). Tier-2 re-extended: B >= 0.90 through 0.24 m / 48 deg with H=0.6 window (was 0.12/24). Novelty UNVERIFIED (both subagent tiers quota-exhausted); mechanism NOT new (window dose, lineage N190/N192/I23/N455), new = the 0.24,48 decision measurement. Verdict KEEP per G4 (20 seeds, B 0.95 > 0.70, both p < 0.01, no regression).", "metrics": {"idea": "N456", "metric_class": "physical", "candidate": "trochoid + ROW_CENTRE=1 + REG=depth + REG_HALF_M=0.6", "paired_baseline": "same stack with REG_HALF_M=0.35", "seeds": 20, "suites": ["fixture_A", "fixture_B", "fixture_R"], "pose_noise_levels": ["0.24,48"], "decision_level": "0.24,48", "episodes": 120, "harness_errors": 0, "rig_bytes_changed": 0, "rig_version": 2, "synthetic_proxy_used": false, "command": "AEGIS_REG=depth AEGIS_REG_HALF_M=0.6 AEGIS_POSE_NOISE=0.24,48 timeout 1200 python3 experiments/kaggle_aegis_sweep.py --seeds 20 --no-upload --path trochoid --compare trochoid --compare-env AEGIS_REG_HALF_M=0.35 --suites fixture_A,fixture_B,fixture_R --out results/aegis_v2/N456_r456_H06_n0.24_48.jsonl", "evidence": "results/aegis_v2/N456_r456_H06_n0.24_48.jsonl", "header_pose_noise_cfg": "0.24,48", "fixture_B_success": "19/20 vs 11/20", "fixture_B_coverage_cont": "0.9852 vs 0.7578", "welch_p_coverage_cont_vs_paired_baseline": 0.008675945408826852, "paired_t_p_coverage_cont": 0.0043636129785385135, "fisher_p_success_vs_paired_baseline": 0.008361734168185784, "rig_keep_field": true, "fixture_R_at_0.24,48": {"success": "10/20 vs 1/20", "coverage_cont": "0.8487 vs 0.4273", "welch_p": 2.7829064640741613e-05, "fisher_p": 0.0033420517291485033}, "fixture_A_at_0.24,48": {"success": "6/20 vs 2/20", "coverage_cont": "0.7401 vs 0.5812", "welch_p": 0.0313757804053847, "fisher_p": 0.23511623511623514}, "reg_err_xy_median_mm": {"cand": {"A": 3.6, "B": 9.0, "R": 8.0}, "base": {"A": 77.4, "B": 58.5, "R": 107.5}}, "escapes": {"cand": {"A": 0, "B": 1, "R": 0}, "base": {"A": 4, "B": 2, "R": 6}}, "novelty": "UNVERIFIED (subagent tiers 429/quota-exhausted)", "math": "no new derivation; equations.md unchanged"}}
{"run": 457, "idea": "N457-LATTICE-VS-H06-024", "status": "discard", "segment": 15, "metric": 1.0, "metric_name": "fixture_B transfer_success (lattice CASTS=0->36 vs single H0.6 CASTS=1, pose_noise 0.24,48; canonical rig, 20 seeds, paired)", "timestamp": "2026-10-02T03:00:00Z", "summary": "N457 executed end to end: last open N453b estimator cell (lattice-vs-H0.6 at 0.24,48, REG=depth+ROW_CENTRE=1+H=0.6 in BOTH arms, same 20 seeds, 3 suites x 2 arms = 120 physical episodes, 0 harness errors, 0 rig bytes changed). Director iter-6 FACC adjudicated NOT EXECUTED (23rd G3-retired eq78/N70-N76/energy/EBM/FACC replay, PATH_MODES 0 injectable hook, G4 unpairable, G7 predicted-only 78 invalid; queue EMPTY since 309). Decision suite B: lattice 20/20 (covc 1.0000) vs single 19/20 (0.9852), Welch p 0.3038, Fisher p 1.0, rig keep=false. R 14/20 vs 10/20 (Welch p 0.3987, paired p 0.0216 n.s.); A 6/20 vs 6/20 (p 0.987). Lattice cast k=6 (36 windows, d=1.5a default) with reg medians B 8.0 vs 9.0 / R 5.0 vs 8.0 / A 3.3 vs 3.6 mm, 0 escapes both arms. Single-H0.6 arm reproduces N456 candidate per-seed bit-identically on B and R (20/20). All stored p re-verified with scipy (exact). Verdict DISCARD per G4 (no significant gain; B ceiling tie). Estimator side now fully measured at every I23 level: H-dose (N455/N456) + lattice (N457).", "metrics": {"idea": "N457", "metric_class": "physical", "candidate": "trochoid + ROW_CENTRE=1 + REG=depth + REG_HALF_M=0.6 + REG_CASTS=0 (lattice, k=6, 36 casts)", "paired_baseline": "same stack with REG_CASTS=1 (single H0.6 window)", "seeds": 20, "suites": ["fixture_A", "fixture_B", "fixture_R"], "pose_noise_levels": ["0.24,48"], "decision_level": "0.24,48", "episodes": 120, "harness_errors": 0, "rig_bytes_changed": 0, "rig_version": 2, "synthetic_proxy_used": false, "command": "AEGIS_REG=depth AEGIS_REG_HALF_M=0.6 AEGIS_REG_CASTS=0 AEGIS_POSE_NOISE=0.24,48 timeout 1200 python3 experiments/kaggle_aegis_sweep.py --seeds 20 --no-upload --path trochoid --compare trochoid --compare-env AEGIS_REG_CASTS=1 --suites fixture_A,fixture_B,fixture_R --out results/aegis_v2/N457_r457_lattice_n0.24_48.jsonl", "evidence": "results/aegis_v2/N457_r457_lattice_n0.24_48.jsonl", "header_pose_noise_cfg": "0.24,48", "fixture_B_success": "20/20 vs 19/20", "fixture_B_coverage_cont": "1.0000 vs 0.9852", "welch_p_coverage_cont_vs_paired_baseline": 0.3037943823542396, "paired_t_p_coverage_cont": 0.30379438235424205, "fisher_p_success_vs_paired_baseline": 1.0, "rig_keep_field": false, "fixture_R_at_0.24,48": {"success": "14/20 vs 10/20", "coverage_cont": "0.8943 vs 0.8487", "welch_p": 0.3987470714654042, "paired_t_p": 0.0215870821813883, "fisher_p": 0.3332130795979517}, "fixture_A_at_0.24,48": {"success": "6/20 vs 6/20", "coverage_cont": "0.7391 vs 0.7401", "welch_p": 0.9871670498967424, "fisher_p": 1.0}, "reg_err_xy_median_mm": {"cand": {"A": 3.3, "B": 8.0, "R": 5.0}, "base": {"A": 3.6, "B": 9.0, "R": 8.0}}, "escapes": {"cand": {"A": 0, "B": 0, "R": 0}, "base": {"A": 0, "B": 1, "R": 0}}, "lattice_k": 6, "lattice_casts": 36, "novelty": "N/A (discard; measurement dose, no new mechanism)", "math": "no new derivation; equations.md unchanged"}}
{"run": 458, "commit": "HEAD", "segment": 15, "idea": "FACC-SE3-FACC-HEAD-ITER7", "idea_short": "FACC iter-7: SE(3)-FACC with Energy Affordance Attention replacing flow-mat head (G3 retired family replay, G4 unpairable, G7 predicted-only)", "status": "discard", "timestamp": "2026-10-02T04:00:00Z", "metric_name": "fixture_B transfer_success (coverage_cont >= 0.90 per episode), canonical rig, 20 seeds x 3 suites, health-check only", "metric_class": "physical", "metric_class_note": "physical only; synthetic_proxy excluded per G2/G7; health-check only since G3 replay + G4 unpairable prevent paired candidate measurement", "director_decision": {"iteration": 7, "idea": "SE(3)-FACC with Energy Affordance Attention, replace flow-mat head; keep 456 backbone, swap decoder to FACC force-adaptive head", "predicted_score": 1.4, "executed": false, "exclusion_reasons": ["G3 PERMANENT RETIREMENT: eq78/N70-N76/manifold-switch/flow-bridge/energy-gated/EBM/SE3-affordance/DAEF/FACC family permanently retired; 24th replay (runs 450/451/454 + edges through iter-6 already refused 23). Label change does not change mechanism class.", "G4 UNPAIRABLE: PATH_MODES=(raster,rounded,trochoid,spiral,fitted,fitro,orbit,auto) carries 0 injectable SE3/energy/manifold/FACC-head hook (RESIDUAL_HOOK_FN only, I3-owned). No mechanism exists to inject a FACC decoder into a paired 20-seed Fixture-B comparison.", "G7 INTEGRITY: predicted-only 1.4pts/keep-p-76% INVALID for keep; synthetic N74 92.3 frozen unconditionally. No synthetic_proxy promotion.", "G2 QUEUE EMPTY: no queued row since run 309; estimator lever N453b closed at every I23 level 0-0.24m (N455/N456/N457); N198 director-owned, unclaimable on the B bar."]}, "physical_action_taken": "Health-check ONLY (G3 replay, G4 unpairable): trochoid --compare trochoid, 20 seeds x 3 suites = 60 episodes, A/B/R 1.00/1.00/1.00, 0 harness errors, 0 rig bytes changed. Evidence results/aegis_v2/N458_r458_health_n0_0.jsonl.", "rig_invoked": true, "rig_exit": 0, "episodes": 60, "harness_errors": 0, "rig_bytes_changed": 0, "pose_noise_cfg": "0,0", "evidence": ["results/aegis_v2/N458_r458_health_n0_0.jsonl", "autoresearch_research.jsonl", "autoresearch_research_strategy_graph.jsonl", "experiments/worklog.md"], "metrics": {"idea": "FACC-SE3-FACC-HEAD-ITER7", "metric_class": "physical", "seeds": 20, "episodes": 60, "fixture_A_success": 1.0, "fixture_B_success": 1.0, "fixture_R_success": 1.0, "delta_vs_champion": 0.0, "compare_baseline": "trochoid", "compare_keep": false, "new_mechanism": false, "replay_of_retired_family": true, "retired_family_ids": ["eq78", "N70", "N71", "N72", "N73", "N74", "N75", "N76", "FACC", "FACC-SE3", "FACC-DIRECTOR-ITER7"]}, "gates_unchanged": {"segment": 15, "primary_metric": "transfer_success", "tier4_gate": "post-hoc tag, untouched", "no_new_segment": true, "no_metric_move": true, "no_gate_change": true, "no_candidate_promoted": true, "new_unvalidated_row_added": false}, "verdict": "DISCARD (24th G3 retired-family replay; health-check confirms frozen champion trochoid B=1.00 at 0,0)"}
{"run": 459, "commit": "HEAD", "segment": 15, "idea": "FACC-E-ITER8", "idea_short": "FACC-E iter-8: SE(3)-conditioned Energy-Based Affordance Flow replacing Pi0 head (G3 retired family replay, G4 unpairable, G7 predicted-only)", "status": "discard", "timestamp": "2026-10-01T00:00:00Z", "metric_name": "fixture_B transfer_success (coverage_cont >= 0.90 per episode), canonical rig, 20 seeds x 3 suites, health-check only", "metric_class": "physical", "metric_class_note": "physical only; synthetic_proxy excluded per G2/G7; health-check only since G3 replay + G4 unpairable prevent paired candidate measurement", "director_decision": {"iteration": 8, "idea": "FACC-E: SE(3)-conditioned Energy-Based Affordance Flow, replaces Pi0 flow-head; predicted 74 pts", "predicted_score": 74, "executed": false, "exclusion_reasons": ["G3 PERMANENT RETIREMENT: eq78/N70-N76/manifold-switch/flow-bridge/energy-gated/EBM/SE3-affordance/DAEF/FACC family permanently retired; 25th replay (runs 450/451/454/458 + edges through iter-7 already refused 24). Label change (FACC-E) does not change mechanism class.", "G4 UNPAIRABLE: PATH_MODES=(raster,rounded,trochoid,spiral,fitted,fitro,orbit,auto) carries 0 injectable SE3/energy/manifold/FACC-head hook (RESIDUAL_HOOK_FN only, I3-owned). No mechanism exists to inject a FACC-E decoder into a paired 20-seed Fixture-B comparison.", "G7 INTEGRITY: predicted-only 74pts invalid for keep; synthetic N74 92.3 frozen unconditionally. No synthetic_proxy promotion.", "G2 QUEUE EMPTY: no queued row since run 309; estimator lever N453b closed at every I23 level 0-0.24m (N455/N456/N457); N198 director-owned, unclaimable on the B bar."]}, "physical_action_taken": "Health-check ONLY (G3 replay, G4 unpairable): trochoid --compare trochoid, 20 seeds x 3 suites = 60 episodes, A/B/R 20/20 each (1.00/1.00/1.00), 0 harness errors, 0 rig bytes changed. Evidence results/aegis_v2/N459_r459_health_n0_0.jsonl.", "rig_invoked": true, "rig_exit": 0, "episodes": 60, "harness_errors": 0, "rig_bytes_changed": 0, "pose_noise_cfg": "0,0", "evidence": ["results/aegis_v2/N459_r459_health_n0_0.jsonl", "autoresearch_research.jsonl", "autoresearch_research_strategy_graph.jsonl", "experiments/worklog.md"], "metrics": {"idea": "FACC-E-ITER8", "metric_class": "physical", "seeds": 20, "episodes": 60, "fixture_A_success": 1.0, "fixture_B_success": 1.0, "fixture_R_success": 1.0, "delta_vs_champion": 0.0, "compare_baseline": "trochoid", "compare_keep": false, "new_mechanism": false, "replay_of_retired_family": true, "retired_family_ids": ["eq78", "N70", "N71", "N72", "N73", "N74", "N75", "N76", "FACC", "FACC-SE3", "FACC-E-ITER8"]}, "gates_unchanged": {"segment": 15, "primary_metric": "transfer_success", "tier4_gate": "post-hoc tag, untouched", "no_new_segment": true, "no_metric_move": true, "no_gate_change": true, "no_candidate_promoted": true, "new_unvalidated_row_added": false}, "verdict": "DISCARD (25th G3 retired-family replay; health-check confirms frozen champion trochoid B=1.00 at 0,0)"}
