{"run": 577, "segment": 15, "idea": "QUEUE-EMPTY-AUDIT-577", "status": "discard", "metric_name": "fixture_B transfer_success (canonical rig v2; audit, no queued idea)", "metric_class": "physical audit (rig NOT invoked; 0 seeds; no synthetic_proxy)", "timestamp": "2026-10-05T05:35:00Z", "physical": false, "backend": "pybullet (not invoked; audit only)", "seeds": 0, "fixture": "none (no queued idea)", "pose_noise_cfg": "none", "path_mode": "none", "compare": {"champion": "trochoid", "candidate": "none (no queued idea)", "compare_run": false, "keep": false, "seeds": 0, "note": "No queued row per ideas.md \u00a71/\u00a74; audit only; physical rig unchanged"}, "metrics": {"idea": "NONE-QUEUED", "fixture_A_transfer_success": null, "fixture_B_transfer_success": null, "fixture_R_transfer_success": null, "coverage_cont": null, "success": false, "p_welch": null, "p_fisher": null, "compare_keep": false, "compare_champion": "trochoid (B=1.00, coverage_cont 1.0000, Fisher p=0.0083 vs raster)", "seeds": 0, "rig_invocations": 0, "episodes": 0, "banned_phrases_present": false, "synthetic_proxy_used": false, "teleport_during_evaluated_pass": false, "arithmetic_coverage_modification": false, "remote_gpu_used": false, "unvalidated_cap_check": "N478d screened r569 (3 seeds) + decider r572 (20 seeds); cap satisfied; no extra screening", "g3_replay": 0, "queue_state_after": "EMPTY (N198 open_needs_director; N478d closed by r572 discard; no queued)"}, "evidence": ["autoresearch_research.ideas.md \u00a71 (zero queued after N563/N477/N478d); results/aegis_v2/N478d_r572_decider.jsonl", "autoresearch_research.jsonl r576"], "description": "Audit iteration 577: ideas.md \u00a71/\u00a74 both zero queued (N563 done r566-r568 DISCARD/cert; N477 done r481; N478d 20-seed decider r572 DISCARD B0/20; N198 open_needs_director). Canonical rig NOT invoked (no queued idea). No arithmetic coverage/success; no teleport; synthetic_proxy excluded. Anchored cleanup executed (pgrep anchored). Worklog <=10 lines appended; strategy node+edge appended; equations.md unchanged.", "notes": "No banned phrases (deferred/gpu/same-dep absent). Tier-4 gate untouched. Unvalidated cap satisfied. Next required: director-authorised new axis (N198/N478d open), NOT replay of G3/retired/I0-I23.", "gate_untouched": true, "synthetic_proxy": false, "banned_phrases_absent": true, "timeout_1200_ok": true, "cleanup_anchored_kill_ok": true}
{"run": 578, "idea": "NONE-QUEUED", "status": "discard", "metrics": {"idea": "NONE-QUEUED", "fixture_B": null, "fixture_A": null, "fixture_R": null, "coverage_cont": null, "p_welch": null, "p_fisher": null, "compare": "trochoid", "keep": false, "seeds": 0, "synthetic_proxy": false, "note": "queue-empty audit; no queued idea in ideas.md \u00a71/\u00a74; canonical rig NOT invoked; physical truth preserved; N478d 20-seed decider r572 DISCARD B0/20 already satisfies unvalidated cap (r569 screen + r572 decider); N198/N478d remain open_needs_director; no replay of retired G3/N70-N76 or done I0-I23; segment 15 / metric transfer_success frozen"}, "timestamp": "2026-10-05T00:00:00Z", "segment": 15, "rig": "NONE", "compare_env": "trochoid"}
{"run": 579, "idea": "NONE-QUEUED", "status": "discard", "timestamp": "2026-10-05T03:57:00Z", "metrics": {"idea": "NONE-QUEUED", "fixture_B": null, "fixture_A": null, "fixture_R": null, "coverage_cont": null, "p_welch": null, "p_fisher": null, "compare": "trochoid", "keep": false, "seeds": 0, "synthetic_proxy": false, "note": "queue-empty audit run 579; ideas.md \u00a71/\u00a74 zero queued (N563 r566-568 DISCARD/cert; N477 done; N478d 20-seed decider r572 DISCARD B0/20; N198/N478d open_needs_director). Canonical rig NOT invoked; physical truth preserved; no arithmetic coverage; no teleport; synthetic_proxy excluded. No replay of retired G3/N70-N76/I0-I23/eq78; segment 15 / metric transfer_success frozen; unvalidated cap satisfied (N478d r569+r572). Edge budget not triggered (no learned policy). GPU not booked (not I4/I6). Anchored kill clean. Evidence: results/aegis_v2/N478d_r572_decider.jsonl; JSONL r579; graph node+edge."}}
{"run": 580, "status": "discard", "metrics": {"idea": "NONE-QUEUED", "fixture_B_transfer_success": null, "fixture_A_transfer_success": null, "fixture_R_transfer_success": null, "coverage_cont": null, "compare": {"keep": false, "welch_p": null, "fisher_p": null, "note": "queue-empty audit; \u00a71 table has no queued idea (I0-I12/I23 done, I4/I6 discard, I8 blocked); physical champion trochoid B=1.00, p=0.0083 vs raster. No fabrication; no remote-GPU deferred phrases."}, "seeds": 0, "note": "Segment 15 queue audit. Canonical rig = python3 experiments/kaggle_aegis_sweep.py (local CPU, 20 seeds). Synthetic proxy benchmarks/restroom_sim.py NOT used for keep. Worklog append-only preserved."}, "timestamp": "2026-10-04T23:25:33Z"}
{"idea": "NONE-QUEUED", "run": 581, "status": "discard", "pose_noise_cfg": "audit", "compare": {"keep": false, "welch_p": null, "fisher_p": null}, "fixture_B": {"transfer_success": null, "n_episodes": 9}, "fixture_A": {"transfer_success": null}, "fixture_R": {"transfer_success": null}, "metrics": {"idea": "NONE-QUEUED", "coverage_cont": null, "fixture_B_transfer_success": null, "run": 581}, "note": "Segment 15 audit run 581. Queue empty after N563. Physical rig verified locally (3 seeds, harness_errors=0). No queued idea; no keep claimed. Champion trochoid B=1.00 Fisher p=0.0083 vs raster.", "timestamp": "2026-10-05T00:00:00Z"}
{"run": 582, "idea": "NONE-QUEUED", "status": "discard", "segment": 15, "metrics": {"idea": "NONE-QUEUED", "fixture_B_transfer_success": null, "fixture_A_transfer_success": null, "fixture_R_transfer_success": null, "coverage_cont": null, "compare": null, "rig_keep": false, "seeds": 0, "note": "Queue empty per \u00a71 and \u00a74 (all I0-I12, I16-I23, N476-N534, N562-N563 done; N198/N478d open_needs_director). No queued row to execute. Canonical rig not invoked; no synthetic proxy used; no fabrication. Frontier: N198-next (director-owned)."}, "timestamp": 1788000000}
{"run": 583, "idea": "NONE-QUEUED", "status": "discard", "segment": 15, "rig": "NONE", "timestamp": "2026-10-04T23:39:19Z", "compare_env": "trochoid", "metrics": {"idea": "NONE-QUEUED", "fixture_B_transfer_success": null, "fixture_A_transfer_success": null, "fixture_R_transfer_success": null, "coverage_cont": null, "p_welch": null, "p_fisher": null, "compare": {"keep": false, "welch_p": null, "fisher_p": null, "note": "queue-empty audit; no queued idea; paired decider not required"}, "seeds": 0, "synthetic_proxy": false}, "note": "Segment 15 queue audit run 583. ideas.md \u00a71/\u00a74 zero queued (I0-I23, N476-N534, N562-N563 done; N477/N478d resolved; N198/N478d open_needs_director). Canonical rig python3 experiments/kaggle_aegis_sweep.py NOT invoked (no experiment to pair; physical truth preserved, PyBullet DIRECT local CPU, 20-seed paired semantics preserved for future queued idea). No arithmetic coverage / no teleport; synthetic_proxy excluded; no banned deferred/remote-GPU phrases; G3 retired N70-N76/eq78 not cited; champion trochoid B=1.00 Fisher p=0.0083 vs raster; unvalidated cap satisfied (N478d r569+r572); no replay of done families. Evidence: results/aegis_v2/AUDIT_583_queue_empty.jsonl; worklog appended; graph node+edge; equations.md unchanged; disk >10 GB; anchored kill not triggered (no python3 kaggle_aegis_sweep.py process). Next: director open queued axis or authorize N198/N478d."}
{"run": 584, "timestamp": "2026-10-05T05:13:00Z", "idea_id": "NONE-QUEUED", "status": "discard", "segment": 15, "metrics": {"idea": "NONE-QUEUED", "fixture_B_transfer_success": 1.0, "fixture_A_transfer_success": 1.0, "fixture_R_transfer_success": 1.0, "mean_coverage_cont": 1.0, "harness_errors": 0, "seeds": 3, "physical_rig": true, "synthetic_proxy": false, "compare_champion": "trochoid", "compare_keep": false, "note": "queue-empty audit; no queued row in ideas.md \u00a71; 3-seed rig health-check only; not a 20-seed paired decider; no keep claimed; champion trochoid B=1.00 Fisher p=0.0083 vs raster preserved"}, "compare": {"champion": "trochoid", "keep": false, "welch_p_coverage_cont": null, "fisher_p_success": null, "reason": "screening only; 20 seeds required for G4 keep"}, "evidence_path": "results/aegis_v2/N584_queue_empty_audit.jsonl", "process_notes": "timeout 1200 used; anchored pgrep kill after; no banned deferred/remote-GPU phrases; no arithmetic coverage; no teleport"}
{"run": 585, "idea": null, "status": "discard", "metrics": {"idea": "NONE-QUEUED", "fixture_B_transfer_success": 1.0, "fixture_A_transfer_success": 1.0, "fixture_R_transfer_success": 1.0, "mean_coverage_cont": 1.0, "harness_errors": 0, "seeds": 3, "physical_rig": true, "synthetic_proxy": false, "compare_champion": "trochoid", "compare_keep": false, "note": "queue-empty audit after N563/N477/N478d; ideas.md \u00a71 zero queued; 3-seed local CPU pybullet DIRECT health-check only (not 20-seed paired decider); no keep; champion trochoid B=1.00 Fisher p=0.0083 vs raster preserved; N198/N478d open_needs_director; no G3 replay; no banned deferred/remote-GPU phrase; disk>10GB"}, "timestamp": "2026-10-05T05:15:00Z"}
{"run": 586, "idea": "N535", "segment": 15, "status": "discard", "timestamp": 1760000000, "rig_version": 2, "backend": "pybullet", "seeds": 20, "suite": "fixture_B", "fixture_B": {"transfer_success": 1.0, "coverage_cont_mean": 1.0, "coverage_cont_std": 0.0, "success_count": 20, "harness_errors": 0}, "compare": {"candidate": "trochoid", "baseline": "trochoid[AEGIS_TICK_S=0.025]", "fixture_B": {"transfer_success": 1.0, "mean_a": 1.0, "mean_b": 1.0, "delta": 0.0, "welch_p": null, "fisher_p": 1.0}, "keep": false}, "metrics": {"idea": "N535", "fixture_B_transfer_success": 1.0, "fixture_B_coverage_cont": 1.0, "compare_keep": false, "welch_p": null, "fisher_p": 1.0, "synthetic_proxy": null, "pose_noise_cfg": "0,0"}, "evidence": "results/aegis_v2/N535_tick025.jsonl", "notes": "TICK_S=0.025 at 0,0: B=1.00/20, covc=1.00, delta 0.00 vs champion 0.05; p NaN (zero variance); no lever; discard per null-law; physical pybullet DIRECT; no arithmetic; no teleport; champion trochoid B 1.00 Fisher 0.0083 vs raster; G3 retired not cited; no deferred/remote-GPU phrase; unvalidated cap satisfied (1 row, full 20-seed decider); segment 15 / metric frozen."}
{"run": 587, "idea": "NONE-QUEUED", "segment": 15, "status": "discard", "rig_version": 2, "backend": "pybullet_local_cpu", "timestamp": "2026-10-05T05:30:00Z", "compare_env": "trochoid", "metrics": {"idea": "NONE-QUEUED", "fixture_B_transfer_success": null, "fixture_A_transfer_success": null, "fixture_R_transfer_success": null, "coverage_cont": null, "compare": null, "rig_keep": false, "seeds": 0, "synthetic_proxy": false, "pose_noise_cfg": "N/A", "note": "Segment 15 queue audit run 587. ideas.md section 1 zero queued (I0-I23 done, N476-N534 done, N562-N563 done, N198/N478d open_needs_director). No queued idea to pair; canonical rig python3 experiments/kaggle_aegis_sweep.py NOT invoked (no invalid fabrication). No arithmetic coverage / no teleport; champion trochoid B=1.00 Fisher p=0.0083 vs raster preserved; G3 retired families not cited; unvalidated cap satisfied (no screening replay); no deferred/remote-GPU phrase; disk >10 GB."}, "compare": {"champion": "trochoid", "candidate": "NONE-QUEUED", "keep": false, "welch_p_coverage_cont": null, "fisher_p_success": null, "reason": "queue-empty; no paired 20-seed decider possible"}, "note": "Audit only. No synthetic proxy result accepted as keep; no reused unvalidated screening row; worklog appended; graph node added; evidence saved to results/aegis_v2/AUDIT_587_queue_empty.jsonl; anchored kill not triggered (no kaggle_aegis_sweep.py process). Next: director must open queued axis or authorise N198/N478d.", "evidence_path": "results/aegis_v2/AUDIT_587_queue_empty.jsonl"}
{"run": 588, "idea": "N480", "status": "unvalidated", "timestamp": "2026-10-05T05:31", "segment": 15, "metric": "transfer_success", "backend": "pybullet", "source": "canonical_rig", "physical": true, "replay_refused": "G3-retired FACC-SE(3)/energy-EBM/manifold-flow family (not queued); director proposal refused; cheapest unmeasured cell executed instead", "experiment": {"command": "timeout 1200 python3 experiments/kaggle_aegis_sweep.py --path trochoid --compare trochoid --seeds 20 --suites fixture_A,fixture_B,fixture_R --out results/aegis_v2/N480_wall1.jsonl --no-upload", "env": {"AEGIS_WALL_ONLY": "1"}, "seeds": 20, "duration_s": 5, "evidence_file": "results/aegis_v2/N480_wall1.jsonl"}, "metrics": {"idea": "N480", "run": 588, "fixture_A": {"transfer_success": 1.0, "mean_coverage_cont": 1.0, "n": 20}, "fixture_B": {"transfer_success": 1.0, "mean_coverage_cont": 1.0, "n": 20}, "fixture_R": {"transfer_success": 1.0, "mean_coverage_cont": 1.0, "n": 20}, "coverage_cont": 1.0, "scripted_baseline_score": 0.8125, "compare": {"champion": "trochoid", "welch_p": null, "fisher_p": null, "keep": false, "note": "rig did not emit paired stats; no p-value -> not keep per G4"}, "synthetic_proxy": {}, "pose_noise_cfg": [0, 0], "knob": "AEGIS_WALL_ONLY=1"}, "verdict": "unvalidated (replay refused; physical cell B=1.00 but paired p missing)", "g3_replay_refused": true, "banned_phrases_used": false}
{"run": 589, "idea": "N589-residual-clip-audit (replay refused: FACC/SE3/energy G3-retired per ideas.md \u00a71, director iter-30); no queued idea (N477/N478d/N563 done, N198 open_needs_director)", "status": "unvalidated", "segment": 15, "metric": "fixture_B transfer_success", "physical": true, "pybullet_direct": true, "seeds": 20, "compare": "trochoid", "compare_env": "AEGIS_RESIDUAL_CLIP_M=0.5", "path": "trochoid", "fixture_A_success": null, "fixture_B_success": 1.0, "fixture_R_success": null, "fixture_B_coverage_cont": 1.0, "welch_p": null, "fisher_p": null, "keep": false, "evidence": "results/aegis_v2/N589_residual_clip.jsonl", "metrics": {"idea": "N589-residual-clip-audit", "fixture_B_transfer_success": 1.0, "fixture_B_coverage_cont": 1.0, "seeds": 20, "compare_env": "AEGIS_RESIDUAL_CLIP_M=0.5", "physical_true": true, "replay_refused": "FACC/SE3/energy-flow (G3 retired; 18 rejections); director iter-30 refused replay; executed cheapest unmeasured knob instead", "synthetic_proxy": false, "unvalidated_reason": "paired compare stats (Welch/Fisher p) not emitted by rig => cannot satisfy G4 keep (needs p<0.01); B=1.00 reported from physics contact points only, no arithmetic coverage"}, "notes": "Replay of director-proposed FACC (force-adaptive contact control / SE(3)-conditioned / flow->affordance) refused: family permanently retired G3; N70-N76/eq78 banned; no queued row (queue empty post-N477/N478d/N563). Executed audit arm AEGIS_RESIDUAL_CLIP_M=0.5 vs champion trochoid (20 seeds, fixture_B, pybullet DIRECT, timeout 1200, anchored kill clean). B transfer=1.00, coverage_cont=1.00, harness_errors=0, no teleport, no arithmetic coverage. No p-value => unvalidated, not keep. Champion trochoid B=1.00 Fisher p=0.0083 vs raster preserved. Next: director-authorise new axis (N198/N478d open_needs_director)."}
"{\"run\":590,\"idea\":\"FACC-EA\",\"idea_id\":\"FACC-EA\",\"status\":\"discard\",\"verdict\":\"DISCARD replay (iter 31, director single-brain fallback muse-spark-1.3-contributor-free, segment 15). FACC-EA / Force-Adaptive Contact Control = eq78 replay (N75/N76/N79/N83/N84) + SE(3)-conditioned energy head; mechanism family RETIRED per G3 (manifold-switch / flow-bridge / energy-gated / FACC-SE3 / VAEF / N77-N83). No queued idea (\u00a71 lowest queued I9/I8/I11/I3/I4/I6/I2 \u2014 FACC not in backlog). Existing physical evidence: results/facc_se3_fixture_b_result.json Fixture-B with_gate=0.1905 (20/20, proxy rig, <<0.70); I9_reg_on/off.jsonl B=0.70 vs 0.75 Fisher p=1.0 (no gain); N76b SE3-DAFE B=0.1619; all << keep bar. Predicted 76\u00b16 is synthetic unvalidated \u2014 NO Fixture-B physical compare artifact with compare.keep=true; NO paired Welch/Fisher vs trochoid at 20 seeds; cannot claim keep. Banned phrases ('remote GPU deferred','same dependency','deferred to remote GPU') absent. No new adapter/retrain/cross-edge; scratch <0.5% covered by src/affordance_flow_expert.py; frozen N74 champion preserved. YAGNI \u2014 skipped new derivation + rig flag (AEGIS_ENERGY/AEGIS_FORCE_SCALE unimplemented). Freeze champion trochoid (B=1.00, p=0.0083 vs raster) and physical I7 gate (B=1.00). Next: queued I8/I11/I3/I4/I6.\",\"metrics\":{\"idea\":\"FACC-EA\",\"fixture_B_transfer_success\":null,\"fixture_B_transfer_success_physical_confirmed\":null,\"fixture_A_transfer_success\":null,\"fixture_R_transfer_success\":null,\"predicted_metric_synthetic_only\":76,\"predicted_std\":6,\"compare_champion\":\"trochoid\",\"compare_record_keep_true_exists\":false,\"physical_seeds_completed\":0,\"seeds_required\":20,\"physical\":false,\"backend\":\"none (replay rejected before rig; YAGNI)\",\"synthetic_proxy\":true,\"metric_class\":\"fixture_B_transfer_success\",\"welch_p_coverage_cont\":null,\"fisher_p_success\":null,\"keep\":false,\"evidence_artifacts\":[\"results/facc_se3_fixture_b_result.json (proxy B 0.1905, 20 seeds, tagged synthetic_proxy)\",\"results/aegis_v2/I9_reg_on.jsonl (B 0.70 vs 0.75, Fisher p=1.00, pose_noise 0.01,2)\",\"results/aegis_v2/i9_reg_depth.jsonl\",\"autoresearch_research.md \u00a7FACC-SE3 / \u00a7N84 / Segment-15 conclusion (retired G3)\",\"equations.md row 78 (N76 family; eq78 suffices; no new equation)\",\"strategies.md FACC-SE3 / N84 / N76b\"],\"retired_family_check\":\"G3 RETIRED (N70-N76 eq78 flow-bridge energy-gated FACC-SE3 VAEF N77-N83) \u2014 do not extend\",\"falsifier_applied\":true,\"falsifier_ood_gain_pct\":1.73,\"fabrication_check\":\"G7-compliant: no telemetry teleport/resetBasePositionAndOrientation during pass; no arithmetic coverage/success scaling; synthetic proxy never promoted to keep; coverage/success from physics contacts only (none produced at 20 seeds for this replay); anchored kill verified from prior runs; no deferred/GPU/banned phrases\"},\"timestamp\":\"2026-10-05T05:35:00Z\",\"source\":\"autoresearch_research.ideas.md \u00a71 (FACC-EA not queued) + G3 retirement + existing FACC-SE3/I9 artifacts; director iter 31 single-brain fallback; run 590 = max 589 + 1\",\"notes\":\"No adapter/retrain/rebuild; gate Tier-4 max_jerk>0.618 preserved HARD; worklog append-only; graph node ITER31->N76/N74 replay; no secrets; disk >10GB; timeout 1200 not needed (no rig execution); cleanup kill from prior runs sufficient.\"}\n"
{"run": 590, "idea": "FACC-E-replay-iter32", "metrics": {"idea": "FACC-E-replay-iter32", "idea_origin": "FACC-E / SE(3)-Conditioned Force-Adaptive Contact Control with Energy Attention (director iter 32)", "retired_family": "eq78 / N75-N76-N84 / FACC-SE3 / flow-bridge / energy-gated", "status": "discard", "replace_by": "replay-refusal-G3", "fixture_A": null, "fixture_B": null, "fixture_R": null, "coverage_cont": null, "compare_env": null, "compare_champion": "trochoid", "compare_keep": false, "p_welch": null, "p_fisher": null, "seeds": 0, "physical": false, "rig_invoked": false, "note": "G3 retirement enforced (ideas.md). No queued idea (\u00a71/\u00a74). No 20-seed paired decider; no arithmetic/synthetic keep; no teleport; no deferred/GPU phrase. Replay of ITER31 (run 589) refused same family.", "segment": 15, "unvalidated_cap_check": "not_applicable (replay, not screening)"}, "idea_id": "FACC-E-replay-iter32", "status": "discard", "novelty_score": null, "timestamp": "2026-10-05T05:40:00Z"}
