{"id":"N448","parent":"N447","status":"replay-discard","strategy":"FACC-SE3-DIRECTOR-ITER34 replay of retired G3 energy-gated/manifold-switch/flow-bridge/EBM/DAEF/FACC-family: SE(3)-conditioned dynamic energy field + flow-match deformed manifold; label change does not change mechanism class; PATH_MODES 0 injectable hook (N200 audit); queue EMPTY since 309; G3 retirement binds permanently; G4 unpairable; G7 predicted-only 74 pts invalid; G2 non-canonical user-cited suite excluded; health-cert only frozen champion trochoid fixture_B=fixture_A=fixture_R=1.0000 at 0,0; discard; evidence results/aegis_v2/iter34_facc_health.jsonl","timestamp":"2026-10-01T18:00:00Z","type":"node","metric":0}
{"from":"N447","kind":"replay-discard","to":"N448","type":"edge","timestamp":"2026-10-01T18:00:00Z","note":"G3 replay edge: FACC-SE3 iter34 -> retired family N84/N76b; no injectable mechanism; no new node needed (family retired)"}
{"from":"N449","kind":"replay","to":"N84","type":"edge","note":"FACC-DIRECTOR-ITER35 replay of retired eq78/N70-N76/EBM/energy-gated/family; no new mechanism node; G3 retirement binds permanently; G4 PATH_MODES 0 injectable hook; discard per health-check only (fixture_B 1.00 ceiling tie, Fisher p=1.0 vs champion trochoid)"}
{"from": "N450", "kind": "replay-discard", "to": "N84", "type": "edge", "note": "FACC-SE3 iter36 replay of retired eq78/N70-N76/manifold/energy-gated/EBM/DAEF/FACC-family; G3 retirement binds; G4 PATH_MODES 0 injectable hook; G7 predicted-only 76 invalid; queue EMPTY; health-check only frozen champion B=1.00/A=1.00/R=1.00; discard; evidence results/aegis_v2/iter36_facc_health.jsonl; no new mechanism node; equations.md unchanged (rows 78/84); unvalidated cap untouched"}
{"id": "N450", "parent": "N84", "status": "replay-discard", "strategy": "FACC-SE3-DIRECTOR-ITER36 replay of retired G3 energy-gated/manifold-switch/flow-bridge/EBM/DAEF/FACC-family: SE(3)-conditioned dynamic energy field E_dynamic(x,t) + 2k-param EBM; label change does not change mechanism class; PATH_MODES 0 injectable hook prevents paired measurement; queue EMPTY since 309; G7 predicted-only 76 invalid; G2 non-canonical suite excluded; discard; health-check frozen champion ceiling tie; evidence results/aegis_v2/iter36_facc_health.jsonl", "timestamp": "2026-10-01T20:00:00Z", "type": "node", "metric": 0, "segment": 15}
{"from": "N451", "kind": "replay-discard", "to": "N84", "type": "edge", "note": "FACC-DIRECTOR-ITER37 replay of retired eq78/N70-N76/manifold/energy-gated/EBM/DAEF/FACC-family; G3 retirement binds; G4 PATH_MODES 0 injectable hook; G7 predicted-only 78 invalid; queue EMPTY; health-check only frozen champion ceiling tie; discard; no new mechanism node since G3 retired; evidence results/aegis_v2/iter37_facc_health.jsonl", "timestamp": "2026-10-01T21:00:00Z"}
{"id": "N451", "parent": "N450", "status": "replay-discard", "strategy": "FACC-DIRECTOR-ITER37 replay of retired G3 energy-gated/manifold-switch/flow-bridge/EBM/DAEF/FACC-family: SE(3)-conditioned dynamic energy field E_dynamic(x,t) with contact-physics energy; 2k-param EBM; frozen vision backbone; scratch ~1024 params; predicted 78 pts invalid; no injectable PATH_MODES hook (audit 0 hits); queue EMPTY since 309; G2 non-canonical user-cited suite excluded; health-check only frozen champion B=1.00/A=1.00/R=1.00 at 0,0 (40th independent ceiling tie); discard; evidence results/aegis_v2/iter37_facc_health.jsonl; equations.md unchanged (rows 78/84); unvalidated cap untouched (1 remaining); worklog append-only <=10 lines; commit executed.", "timestamp": "2026-10-01T21:00:00Z", "type": "node", "metric": 0}
{"id":"N452","parent":"N451","type":"node","status":"characterized","segment":15,"metric":0.45,"timestamp":"2026-10-01T22:00:00Z","label":"Pose-noise dose ladder of the CERTIFIED champion stack, first measurement above 0.01,2. trochoid+AEGIS_ROW_CENTRE=1 vs paired AEGIS_ROW_CENTRE=0.0, 20 seeds x 3 suites x 6 levels, 1440 physical episodes, 0 rig bytes changed. 0,0 and 0.01,2 arms BIT-IDENTICAL to run 243 (B 1.0000/0.9453 p 5.26e-06; 0.9961/0.9398 p 1.06e-04). fixture_B success 1.00 / 1.00 / 0.95 / 0.75 / 0.45 / 0.00 at 0,0 / 0.01,2 / 0.02,4 / 0.03,6 / 0.05,10 / 0.08,16.","findings":["I22 row-centring is a CEILING-ONLY term: fixture_B delta monotone non-increasing in sigma (+0.0547, +0.0563, +0.0508, +0.0445, +0.0320).","The escape/launch channel is empty (0/20 both arms) through 0.03,6, first non-empty at 0.05,10, dominant at 0.08,16 (5-7/20 escapes, 6-7 launches, mean slip 0.15-0.21 m vs the 0.0106 m plateau). Above ~0.05 m labelled sigma coverage_cont is no longer a path metric -- N213 two-regime claim confirmed and localised.","REFUTES N199.3: the k/128-EVEN six-value quantum is not a general law. Distinct coverage_cont values per level = 6 / 23 / 30 / 40 / 61 / 65. The metric is NOT coarse; the CONTROLLER is saturated at 0,0.","G4 dynamic range lives at 0.02-0.08 m, not at 0,0. This is a measurement-only answer path to N198 that touches no metric, no gate and no segment.","REFUTED: the I22 keep does not extend above 0.01,2 (no level clears p<0.01 on fixture_B; Welch 0.0176 / Fisher 0.020 / paired t 0.0447 at 0.02,4).","Tier-2 requirement of the SHIPPED stack = sigma_pose < 0.02 m / 4 deg, 4x looser than the frozen I5 figure (0.005 m / 1 deg)."],"status_note":"row logged as discard because no level above 0.01,2 meets the G4 bar on fixture_B; the payload is the characterization","evidence":"results/aegis_v2/N452_r452_stackladder_n{0_0,0.01_2,0.02_4,0.03_6,0.05_10,0.08_16}.jsonl"}
{"id":"N452a","parent":"N452","type":"node","status":"open","segment":15,"metric":null,"timestamp":"2026-10-01T22:00:00Z","label":"I23 -- the only untested lever with live dynamic range. The certified stack (trochoid + row-centre) breaks between 0.03,6 (B 0.75) and 0.05,10 (B 0.45), and the depth-registration term AEGIS_REG=depth (I9, run 130 200-seed KEEP at 0.03,6 for the PRE-I22 path, B 0.60 -> 1.00) has never been composed with row-centring. AEGIS_REG is env-only and is NOT in KNOB_GLOBALS, so the pairing must be done as two same-seed processes plus a compare script, or AEGIS_REG must be added to KNOB_GLOBALS (env + --compare-env only, no plan/force/scoring byte). Target level 0.05,10 where NO arm currently clears the bar. 6 runs, about 1 min. Pre-register: registration error is a plan-frame error, so it should recover the 0.02-0.05 m band but NOT the 0.08,16 escapes, which are a dynamics channel."}
{"from":"N451","to":"N84","kind":"replay-discard","type":"edge","timestamp":"2026-10-01T22:00:00Z","note":"FACC-DIRECTOR-ITER38 replay of the retired eq78/N70-N76/energy-gated/SE3/EBM/DAEF/FACC family; G3 retirement binds; G7 predicted-only 78 invalid; queue EMPTY; no injectable PATH_MODES hook. 16th consecutive replay in iters 22-37 produced zero new measurement -- this iteration spent the budget on the pose-noise ladder instead (N452)."}
{"from":"N451","to":"N452","kind":"measure-instead-of-replay","type":"edge","timestamp":"2026-10-01T22:00:00Z","note":"Loop break: instead of the 41st identical 0,0 ceiling health-check, ran the first paired pose-noise dose ladder of the certified stack above its certified region. G-rules respected (no metric, gate, segment or rig-byte change)."}
{"from":"N452","to":"N452a","kind":"opens","type":"edge","timestamp":"2026-10-01T22:00:00Z","note":"The ladder localises the breakdown to the 0.03,6 -> 0.05,10 band and leaves exactly one untested composition (registration x row-centring) with dynamic range behind it. Queued as I23 for the director."}
{"type": "node", "id": "N453", "label": "I23 KEEP: registration x row-centring re-extends fixture_B from 0.02 m / 4 deg to 0.12 m / 24 deg", "timestamp": "2026-10-01T23:45:00Z", "idea": "I23", "status": "keep", "metric": 1.0, "metric_class": "physical", "detail": "trochoid + AEGIS_ROW_CENTRE=1 + AEGIS_REG=depth vs the paired certified stack (AEGIS_REG=0), 20 seeds x 3 suites x 8 pose-noise levels = 960 physical episodes, 0 harness errors, 0 rig bytes changed. fixture_B transfer_success 1.00/1.00/1.00/1.00/0.95/0.90/0.75/0.55 at 0,0/0.02,4/0.03,6/0.05,10/0.08,16/0.12,24/0.16,32/0.24,48 vs 1.00/0.95/0.75/0.45/0.00/0.00/0.00/0.00 paired. At 0.05,10: B coverage_cont 0.7820 -> 0.9977, Welch p 1.41e-04, Fisher p 1.45e-04, rig keep=true. Z3 refuted and its masking reading refuted by counters (escapes 6->0, launches 6->0, z-exc 0.628->0.000 m, slip 0.1535->0.0106 m = the 0,0 plateau).", "evidence": ["results/aegis_v2/I23_r453_reg_n0.05_10.jsonl", "results/aegis_v2/I23_r453_reg_n0.08_16.jsonl", "results/aegis_v2/I23_r453_reg_n0.12_24.jsonl", "results/aegis_v2/I23_r453_reg_n0.24_48.jsonl"]}
{"type": "node", "id": "N453a", "label": "The escape/launch channel is PLAN-FRAME caused, not a second dynamics regime", "timestamp": "2026-10-01T23:45:00Z", "idea": "I23", "status": "finding", "detail": "On fixture_B the launch channel is empty for every level whose post-registration residual reg_err_xy median is <= 18.5 mm (0,0 .. 0.12,24) and non-empty at 31.7 mm (0.16,32) and 58.5 mm (0.24,48). Pooled over 160 fixture_B candidate episodes R2(reg_err_xy -> coverage_cont) = 0.7589 vs R2(labelled sigma) = 0.1989, and within a level (label removed) R2 = 0.56-0.83. This corrects N213's two-regime reading: the 'dynamics regime' is the plan-frame error exceeding the face inradius, so it is removable by registration rather than a separate physical limit.", "evidence": ["results/aegis_v2/I23_r453_reg_n0.16_32.jsonl", "results/aegis_v2/I23_r453_reg_n0.24_48.jsonl"]}
{"type": "node", "id": "N453b", "label": "FRONTIER: the depth estimator is the new binding floor", "timestamp": "2026-10-01T23:45:00Z", "idea": "I23", "status": "open", "detail": "reg_err_xy p90 rises 14.6 mm (0,0) -> 23.4 (0.05,10) -> 43.2 (0.08,16) -> 72.8 (0.12,24) -> 95.5 (0.16,32) -> 176.1 mm (0.24,48) and coverage_cont tracks it. The next lever is the ESTIMATOR (ray count, extent-midpoint vs mean, cast window REG_HALF_M), not the path family: path composition is closed (I18) and the controller is at ceiling. N198 option (b) no longer needs a metric change because the primary metric now has dynamic range out to 0.12 m."}
{"type": "edge", "from": "N452a", "to": "N453", "kind": "executes", "timestamp": "2026-10-01T23:45:00Z", "note": "I23 executed: the queued registration x row-centring composition at the 0.03,6 -> 0.05,10 band N452 localised. KEEP."}
{"type": "edge", "from": "N453", "to": "N453a", "kind": "explains", "timestamp": "2026-10-01T23:45:00Z", "note": "The keep's mechanism: registration removes the plan-frame error that both cost coverage and put the pad over the face boundary, so the launch channel empties instead of being masked."}
{"type": "edge", "from": "N453", "to": "N453b", "kind": "opens", "timestamp": "2026-10-01T23:45:00Z", "note": "New frontier: estimator resolution, measured in mm of post-registration residual, is the binding term above 0.12 m."}
{"type": "edge", "from": "N453", "to": "N198", "kind": "informs", "timestamp": "2026-10-01T23:45:00Z", "note": "Answers N198 option (b) by measurement instead of proposal: fixture_B is no longer saturated outside 0.02 m, so the keep bar has dynamic range and needs no metric change. N198 remains director-owned."}
{"type": "edge", "from": "N453", "to": "retired-FACC-family", "kind": "replay-refused", "timestamp": "2026-10-01T23:45:00Z", "note": "Director iter-39 FACC proposal adjudicated NOT EXECUTED: 18th replay of the G3-retired family, 0 injectable PATH_MODES hook (G4 unpairable), predicted-only score invalid for a keep (G7). The 19th such replay would be identical."}
{"id": "FACC-SE3-CONTACT-CONTROLLER-ITER1", "type": "node", "parent": "trochoid", "status": "discarded", "strategy": "Director iter 1 FACC: SE(3)-conditioned contact controller + energy-based physical in-context attention \u2014 eq78/N70-N76/FACC family replay (G3 retired); previous family physical Fixture-B 0.0857-0.2381 < 0.70; G4 unpairable (PATH_MODES 0 injectable hook); G7 predicted-only 18-25 invalid; freeze champion trochoid fixture_B=1.00 / synthetic N74 92.3 unconditionally.", "timestamp": "2026-10-02T00:00:00Z", "run": 454}
{"from": "trochoid", "to": "FACC-SE3-CONTACT-CONTROLLER-ITER1", "type": "edge", "kind": "rejected-retired-replay", "label": "FACC SE(3)-contact controller replay of eq78/N70-N76 family; G3 retired; G4 unpairable; G7 predicted-only; discard; freeze champion trochoid", "timestamp": "2026-10-02T00:00:00Z", "run": 454}
{"type": "node", "id": "N455", "label": "H-dose in composition: H=0.6 vs 0.35 at 0.16,32/0.12,24", "timestamp": "2026-10-02T01:00:00Z", "idea": "N455", "status": "discard", "detail": "B 15/20->20/20 (Welch p 0.0798, Fisher p 0.0471, keep=false); R 6/20->15/20 (Welch p 0.0030). Median reg_err B 31.7->5.7 mm, R 58.9->4.9 mm. Truncation-bias mechanism confirmed; G4 bar unmet on p, not on success."}
{"type": "edge", "from": "N453b", "to": "N455", "kind": "executes", "timestamp": "2026-10-02T01:00:00Z", "note": "First N453b estimator lever measured inside the I22+I23 composition instead of a 0,0 health-check."}
{"type": "edge", "from": "N455", "to": "N198", "kind": "informs", "timestamp": "2026-10-02T01:00:00Z", "note": "Window lever moves B 0.75->1.00 directionally but p=0.047 misses G4; R moves significantly (p=0.003). B-anchored bar still the binder; lattice-vs-H0.6 at 0.24,48 is the last unmeasured estimator cell."}
{"type": "edge", "from": "director-iter-4-FACC", "to": "retired-FACC-family", "kind": "replay-refused", "timestamp": "2026-10-02T01:00:00Z", "note": "21st G3-retired eq78/N70-N76/energy/EBM/FACC replay; 0 injectable PATH_MODES hook (G4 unpairable); predicted-only score invalid for keep (G7). Not executed."}
{"type": "node", "id": "N456", "label": "H-dose decision at 0.24,48: H=0.6 vs 0.35 in composition", "timestamp": "2026-10-02T02:00:00Z", "idea": "N456", "status": "keep", "detail": "B 11/20->19/20 (covc 0.7578->0.9852, Welch p 0.00868, Fisher p 0.00836, rig keep=true); R 1/20->10/20 (Welch p 2.78e-05); reg medians A 77.4->3.6 B 58.5->9.0 R 107.5->8.0 mm; escapes R 6->0 A 4->0. Tier-2 B>=0.90 through 0.24m/48deg with H=0.6."}
{"type": "edge", "from": "N455", "to": "N456", "kind": "executes", "timestamp": "2026-10-02T02:00:00Z", "note": "Last unmeasured N453b estimator cell (0.24,48); same H-dose command as N455, one level."}
{"type": "edge", "from": "N456", "to": "N198", "kind": "informs", "timestamp": "2026-10-02T02:00:00Z", "note": "Estimator lever now measured at every I23 level 0-0.24m: H=0.6 clears B>=0.90 through 0.24/48. B-anchored bar still the binder only above 0.24m; lattice-vs-H0.6 pitch cell remains."}
{"type": "edge", "from": "director-iter-5-FACC", "to": "retired-FACC-family", "kind": "replay-refused", "timestamp": "2026-10-02T02:00:00Z", "note": "22nd G3-retired eq78/N70-N76/energy/EBM/FACC replay; 0 injectable PATH_MODES hook (G4 unpairable); predicted-only 74 invalid for keep (G7). Not executed."}
{"type": "node", "id": "N457", "label": "Lattice-vs-H0.6 decision at 0.24,48: CASTS=0(36) vs 1", "timestamp": "2026-10-02T03:00:00Z", "idea": "N457", "status": "discard", "detail": "B 20/20 vs 19/20 (covc 1.0000 vs 0.9852, Welch p 0.3038, Fisher p 1.0, rig keep=false); R 14/20 vs 10/20 (paired p 0.0216 n.s.); reg medians B 8.0 vs 9.0 R 5.0 vs 8.0 mm; single arm bit-identical to N456 on B/R. Estimator side fully measured at every I23 level."}
{"type": "edge", "from": "N456", "to": "N457", "kind": "executes", "timestamp": "2026-10-02T03:00:00Z", "note": "Last open N453b estimator cell (lattice-vs-H0.6 at 0.24,48); same paired single-knob command as N455/N456."}
{"type": "edge", "from": "N457", "to": "N198", "kind": "informs", "timestamp": "2026-10-02T03:00:00Z", "note": "Estimator lever now closed at every I23 level 0-0.24m: H-dose kept once (0.24,48), lattice a measured no-op on the B bar. Nothing registrable left adjudicable on B; yaw-side (N193 auto/orbit) still provably unclaimable under B anchor."}
{"type": "edge", "from": "director-iter-6-FACC", "to": "retired-FACC-family", "kind": "replay-refused", "timestamp": "2026-10-02T03:00:00Z", "note": "23rd G3-retired eq78/N70-N76/energy/EBM/FACC replay; 0 injectable PATH_MODES hook (G4 unpairable); predicted-only 78 invalid for keep (G7). Not executed."}
{"type": "edge", "from": "director-iter-7-FACC", "to": "retired-FACC-family", "kind": "replay-refused", "timestamp": "2026-10-02T04:00:00Z", "note": "24th G3-retired eq78/N70-N76/energy/EBM/FACC replay (SE3-FACC head swap on 456 backbone); 0 injectable PATH_MODES hook (G4 unpairable); predicted-only 1.4pts invalid for keep (G7). Not executed."}
{"type": "node", "id": "N458", "label": "FACC iter-7 refused + trochoid health-check at 0,0", "timestamp": "2026-10-02T04:00:00Z", "idea": "FACC-SE3-FACC-HEAD-ITER7", "status": "discard", "detail": "Health-check 60 eps A/B/R 1.00/1.00/1.00, 0 errors, 0 rig bytes; queue empty since 309, estimator closed (N455/N456/N457), N198 director-owned."}
{"type": "edge", "from": "director-iter-8-FACC-E", "to": "retired-FACC-family", "kind": "replay-refused", "timestamp": "2026-10-01T00:00:00Z", "note": "25th G3-retired eq78/N70-N76/energy/EBM/FACC replay (FACC-E SE3 affordance-flow head swap, predicted 74); 0 injectable PATH_MODES hook (G4 unpairable); predicted-only invalid for keep (G7). Not executed."}
{"type": "node", "id": "N459", "label": "FACC-E iter-8 refused + trochoid health-check at 0,0", "timestamp": "2026-10-01T00:00:00Z", "idea": "FACC-E-ITER8", "status": "discard", "detail": "Health-check 60 eps A/B/R 1.00/1.00/1.00, 0 errors, 0 rig bytes; queue empty since 309, estimator closed (N455/N456/N457), N198 director-owned."}
{"type": "edge", "from": "director-iter-9-FACC-SE3", "to": "retired-FACC-family", "kind": "replay-refused", "timestamp": "2026-10-01T00:00:00Z", "note": "26th G3-retired eq78/N70-N76/energy/EBM/FACC replay (FACC-SE3 energy-affordance head swap, predicted 78); 0 injectable PATH_MODES hook (G4 unpairable); predicted-only invalid for keep (G7). Not executed."}
{"type": "node", "id": "N460", "label": "FACC-SE3 iter-9 refused + trochoid health-check at 0,0", "timestamp": "2026-10-01T00:00:00Z", "idea": "FACC-SE3-ITER9", "status": "discard", "detail": "Health-check 60 eps A/B/R 1.00/1.00/1.00, 0 errors, 0 rig bytes; queue empty since 309, estimator closed (N455/N456/N457), N198 director-owned."}
{"type": "node", "id": "N461", "label": "FACC iter-10 refused + trochoid health-check at 0,0", "timestamp": "2026-10-01T00:00:00Z", "idea": "FACC-ITER10", "status": "discard", "detail": "Health-check 60 eps A/B/R 1.00/1.00/1.00, 0 errors, 0 rig bytes; queue empty since 309, estimator closed (N455/N456/N457), N198 director-owned."}
{"type": "edge", "from": "director-iter-10-FACC", "to": "retired-FACC-family", "kind": "replay-refused", "timestamp": "2026-10-01T00:00:00Z", "note": "27th G3-retired eq78/N70-N76/energy/EBM/FACC replay (FACC SE3-conditioned residual head swap, predicted 73); 0 injectable PATH_MODES hook (G4 unpairable); predicted-only invalid for keep (G7). Not executed."}
{"type": "node", "id": "N462", "label": "SE3-EBAA iter-11 refused + trochoid health-check at 0,0", "timestamp": "2026-10-01T00:00:00Z", "idea": "SE3-EBAA-ITER11", "status": "discard", "detail": "Health-check 60 eps A/B/R 1.00/1.00/1.00, 0 errors, 0 rig bytes; queue empty since 309, estimator closed (N455/N456/N457), N198 director-owned."}
{"type": "edge", "from": "director-iter-11-SE3-EBAA", "to": "retired-FACC-family", "kind": "replay-refused", "timestamp": "2026-10-01T00:00:00Z", "note": "28th G3-retired eq78/N70-N76/energy/EBM/FACC replay (SE3-EBAA EBM+Langevin head swap, predicted 74); 0 injectable PATH_MODES hook (G4 unpairable); predicted-only invalid for keep (G7). Not executed."}
{"type": "node", "id": "N463", "label": "FACC-E iter-12 refused + trochoid health-check at 0,0", "timestamp": "2026-10-01T00:00:00Z", "idea": "FACC-E-ITER12", "status": "discard", "detail": "Health-check 60 eps A/B/R 1.00/1.00/1.00, 0 errors, 0 rig bytes; queue empty since 309, estimator closed (N455/N456/N457), N198 director-owned."}
{"type": "edge", "from": "director-iter-12-FACC-E", "to": "retired-FACC-family", "kind": "replay-refused", "timestamp": "2026-10-01T00:00:00Z", "note": "29th G3-retired eq78/N70-N76/energy/EBM/FACC replay (FACC-E SE3-conditioned force-adaptive contact control, predicted 78); 0 injectable PATH_MODES hook (G4 unpairable); predicted-only invalid for keep (G7). Not executed."}
{"type": "node", "id": "N464", "label": "FACC-E iter-13 refused + trochoid health-check at 0,0", "timestamp": "2026-10-01T00:00:00Z", "idea": "FACC-E-ITER13", "status": "discard", "detail": "Health-check 60 eps A/B/R 1.00/1.00/1.00, 0 errors, 0 rig bytes; queue empty since 309, estimator closed (N455/N456/N457), N198 director-owned."}
{"type": "edge", "from": "director-iter-13-FACC-E", "to": "retired-FACC-family", "kind": "replay-refused", "timestamp": "2026-10-01T00:00:00Z", "note": "30th G3-retired eq78/N70-N76/energy/EBM/FACC replay (FACC-E SE3-conditioned force-adaptive contact control, predicted 76); 0 injectable PATH_MODES hook (G4 unpairable); predicted-only invalid for keep (G7). Not executed."}
{"type": "node", "id": "N465", "label": "FACC iter-14 refused + trochoid health-check at 0,0", "timestamp": "2026-10-01T00:00:00Z", "idea": "FACC-ITER14", "status": "discard", "detail": "Health-check 60 eps A/B/R 1.00/1.00/1.00, 0 errors, 0 rig bytes; queue empty since 309, estimator closed (N455/N456/N457), N198 director-owned."}
{"type": "edge", "from": "director-iter-14-FACC", "to": "retired-FACC-family", "kind": "replay-refused", "timestamp": "2026-10-01T00:00:00Z", "note": "31st G3-retired eq78/N70-N76/energy/EBM/FACC replay (FACC SE3-conditioned contact control replacing flow-matching, predicted 78); 0 injectable PATH_MODES hook (G4 unpairable); predicted-only invalid for keep (G7). Not executed."}
