{"from":"N491","kind":"replay-refused","to":"N492","type":"edge","replay_id":"FACC-SE3-ITER12","replay_count":51,"retired_family":"G3","reason":"label rotation does not change mechanism class"}
{"type":"node","id":"N493","label":"FACC-SE3 iter 13 refused (52nd G3 replay): SE(3)-equivariant force-adaptive contact control; label rotation unchanged; mechanism class identical to retired eq78/N70-N76/manifold/flow-bridge/energy-gated/EBM/SE3/DAEF/FACC family","timestamp":"2026-10-02T13:15:00Z","idea":"FACC-SE3-ITER13","status":"discard","run":493,"segment":15,"note":"Refused before execution per G3 permanent retirement (2026-09-26) + G4 unpairable + G2 empty queue + G7 predicted-only invalid; champion frozen trochoid B=1.00; no mechanism built; no equation change; 0 episodes; no deferred/proxy/synthetic phrases; unvalidated cap 0/1 consumed"}
{"from":"N492","kind":"replay-refused","to":"N493","type":"edge","replay_id":"FACC-SE3-ITER13","replay_count":52,"retired_family":"G3","timestamp":"2026-10-02T13:15:00Z","label":"replay-refused-52nd-G3-FACC-SE3-ITER13","note":"52nd replay of permanently retired eq78/N70-N76/manifold/flow-bridge/energy-gated/EBM/SE3/DAEF/FACC family refused before execution; mechanism class unchanged by director label rotation (SE3/deformable/dynamic-manifold/energy-attention/flow-bridge/affordance-equivalence); queue empty since N477 kill-rule 481 (boundary 0.32m/64deg H=0.6/n=32); G4 PATH_MODES 0 injectable hook prevents paired arm"}
{"type": "node", "id": "N494", "label": "N478 KEEP: N192 cast lattice (AEGIS_REG_CASTS=0) doses the N453b ESTIMATOR frontier; certified fixture_B pose-noise boundary 0.32 m/64 deg -> 0.80 m/160 deg at B=1.00 (Welch 2.4e-05, Fisher 1e-06, rig keep=true)", "timestamp": "2026-10-02T14:00:00Z", "idea": "N478-CAST-LATTICE", "status": "keep", "run": 494, "segment": 15, "note": "Gap found by HEADER AUDIT: every N477 archive file carries aegis_reg_casts:1.0, so the lattice was never dosed past the wall. The 0.32,64 wall is an estimator-CONTAINMENT artifact (a single +-H window must CONTAIN the top face; slack a_slack = H - hypot(0.34,0.14) = 0.2323 m at H=0.6), not physics. Widening a window that must contain cannot help, which is why the H-only N477 ladder was guaranteed to miss it. Self-falsifying control at H=1.2 (a_slack 0.832 > sigma_t 0.64) returns k=1, bit-identical, delta covc 0.0000, p=1.0 => H and the lattice are redundant fixes, H=0.6+lattice cheaper. 840 physical episodes, 0 harness errors, 0 rig bytes changed. equations.md row N478.", "evidence": ["results/aegis_v2/N478_r494_casts0_n0.80,160.jsonl", "results/aegis_v2/N478_r494_casts0_n0.72,144.jsonl", "results/aegis_v2/N478_r494_casts0_H06n32_n0.64,128.jsonl", "results/aegis_v2/N478_r494_casts0_n0.48,96.jsonl", "results/aegis_v2/N478_r494_casts0_n0.40,80_n60.jsonl", "results/aegis_v2/N478_r494_casts0_n0.32,64.jsonl"]}
{"type": "node", "id": "N494r", "label": "ITER16 VMEAF refused (53rd G3 replay): variable-manifold energy-affordance flow is the retired manifold/flow-bridge/energy-gated class under a new label", "timestamp": "2026-10-02T14:00:00Z", "idea": "VMEAF-ITER16", "status": "discard", "run": 494, "segment": 15, "note": "Refused before execution per G3 permanent retirement + G4 PATH_MODES unpairable + G7 predicted-only 76pts invalid. 0 episodes, 0 rig bytes changed."}
{"from": "N493", "kind": "replay-refused", "to": "N494r", "type": "edge", "replay_id": "VMEAF-ITER16", "replay_count": 53, "retired_family": "G3", "timestamp": "2026-10-02T14:00:00Z", "label": "replay-refused-53rd-G3-VMEAF-ITER16", "note": "53rd replay of eq78/N70-N76/manifold/flow-bridge/energy-gated/EBM/SE3/DAEF/FACC refused; predicted-only 76pts invalid for keep; no mechanism built"}
{"from": "N477", "kind": "frontier-extended", "to": "N494", "type": "edge", "timestamp": "2026-10-02T14:00:00Z", "label": "N478-containment-lattice-extends-boundary-0.32,64-to-0.80,160", "note": "N477's family kill-rule (B=0.00 at 0.40,80, boundary frozen 0.32 m/64 deg) is REFUTED: the dose that fixes it is the lattice, not H. Paired 20 seeds x 3 suites per cell, rig keep=true at 0.48,96 / 0.64,128 / 0.72,144 / 0.80,160 and at 0.40,80 with n=60.", "keep": true, "fixture_B_transfer_success_before": 0.25, "fixture_B_transfer_success_after": 1.0, "welch_p": 2.4e-05, "fisher_p": 1e-06}
{"from": "N494", "kind": "opened", "to": "N478b", "type": "edge", "timestamp": "2026-10-02T14:00:00Z", "label": "N478b-ray-budget-cost-of-extended-frontier-QUEUED", "note": "New frontier = the k^2 n^2 planner-ray budget (N195 REG_CN coarse selection / REG_DFACT pitch), pre-registered in ideas.md; B must stay >= 0.90 at 0.80,160 while cast rays fall >= 2x."}
{"from": "N493", "kind": "replay-refused", "to": "N495r", "type": "edge", "replay_id": "FACC-ITER17", "replay_count": 54, "retired_family": "G3", "timestamp": "2026-10-02T15:20:00Z", "label": "replay-refused-54th-G3-FACC-ITER17", "note": "54th replay of eq78/N70-N76/manifold/flow-bridge/energy-gated/EBM/SE3/DAEF/FACC refused; predicted-only 76pts invalid for keep; no mechanism built"}
{"from": "N494", "kind": "frontier-extended", "to": "N495", "type": "edge", "timestamp": "2026-10-02T15:20:00Z", "label": "N478b-ray-budget-3.6x-6.5x-fewer-rays-no-regression-frontier-0.96,192", "note": "REG_CN>=12 with REG_DFACT=2.0 at B=1.00 (20/20) on 0.32,64 / 0.80,160 / 0.96,192 paired vs the certified N478 arm; wall clock 0.383->0.119 s/ep at 0.96,192; fixture_B = 1.00 for BOTH arms at 0.96,192 so the frontier is the lattice's, the dose only pays for it.", "keep": true, "fixture_B_transfer_success": 1.0, "delta_covc_B_max": -0.0016}
{"from": "N495", "kind": "opened", "to": "N478c", "type": "edge", "timestamp": "2026-10-02T15:20:00Z", "label": "N478c-spend-the-saving-on-n-the-parity-term-QUEUED", "note": "New frontier = the surviving error term N194/N195 named (the kept cast's ray pitch 2H/(n-1) = 38.71 mm at n=32), now affordable because N478b freed 3.6x-6.5x of rays. AEGIS_REG_N only, pre-registered in ideas.md."}
{"from": "N478c", "to": "N496", "type": "edge", "kind": "refuted", "timestamp": "2026-10-02T16:40:00Z", "label": "N478c-ray-pitch-attribution-REFUTED-on-fixture_B-(p90-flat-13.6-16.3mm-n32->n128;-fixture_A-falls-7.9x)", "note": "One selection rule (c=12,d=2a,k=14 every rung), 0.96,192, 20 seeds x 3 suites. Hc1 bar p90(128)<=0.6*p90(32) missed: measured ratio 1.19. corr(reg_err_xy, reg_yaw_plan) rises 0.14->0.99 with n, so the elongated-face residual is systematic and orientation-coupled. Hc3 satisfied (B 20/20, |dcovc|<=0.005).", "keep": false}
{"from": "N496", "to": "N478d", "type": "edge", "kind": "frontier-extended", "timestamp": "2026-10-02T16:40:00Z", "label": "N478c-frontier-0.96,192->1.60,320-(5.0x-the-0.32,64-wall)-rig-keep=true", "note": "fixture_B 20/20 at 0.32,64 / 0.96,192 / 1.12,224 / 1.28,256 / 1.60,320, covc 0.9977/0.9797/0.9742/0.9781/0.9844 (no decay with sigma_t), reg_ok 20/20, PCA yaw residual <=1.6 deg against a 320 deg sigma. Paired vs the frozen single-cast default: Fisher 2.57e-08 at 0.96,192 (20/20 vs 3/20) and 3.35e-09 at 1.60,320 (20/20 vs 2/20), rig keep=true on both. Arms-vs-champion saturate (Fisher 1.0) and are reported as such.", "keep": true, "fixture_B_transfer_success": 1.0}
{"from": "N496", "to": "N478e", "type": "edge", "kind": "opened", "timestamp": "2026-10-02T16:40:00Z", "label": "N478e-window-slack-H-dosed-post-lattice-H=1.2-REGRESSES-the-metric", "keep": false, "note": "PRE-REG 2: a_slack swept with the lattice ON for the first time (N477 swept it single-cast only). H=0.9/1.2 flat on B err p50 (8.03/7.25 vs 8.12 mm) but H=1.2 regresses B 20/20->18/20 (covc 0.9797->0.8781) and R 12/20->7/20 (0.8003->0.5518): Hd1 refuted, Hd3 violated, dose discarded by the guard. Reproduces N190.6 with the lattice on. The elongated-face residual is invariant to BOTH the pitch and the slack and is left unattributed."}
{"from": "N495", "to": "N496", "type": "edge", "kind": "executed", "timestamp": "2026-10-02T16:40:00Z", "label": "N478c-executed-after-55th-G3-replay-refusal", "keep": false, "note": "Director iter-18 FACC (SE(3)-conditioned force-adaptive contact control, energy-based contact field, adaptive compliance, flow-matching->affordance-equivalence bridge, predicted 78) refused as the 55th replay of the permanently retired eq78/N70-N76/manifold/flow-bridge/energy-gated/EBM/SE3/DAEF/FACC/SEAFC/VMEAF family; G4 unpairable (PATH_MODES has 0 injectable SE3/energy/manifold hook); G7 predicted-only 78 invalid. 0 episodes, 0 rig bytes for it. Then the queued row N478c was run: 1560 episodes, 0 harness errors, rig md5 unchanged."}
{"type": "node", "id": "N479", "label": "N479 force-PI closed-loop press: DISCARD (inert on metric face, variance amplifier on intermittent contact); invariance law d(covc)/d(Fn)=0 at 0 plan error, paired regression p=0.029 at 0.03,6", "keep": false, "timestamp": "2026-10-02T18:20:00Z", "metrics": {"B_decider_0.03,6": 0.75, "episodes": 1200, "rig_md5": "ce401a0293b695b7b56c066024c1003f", "harness_errors": 0}}
{"type": "node", "id": "N479-rigfact", "label": "RIG FACT: FORCE_PI is ADDITIVE (press = clamp(0.5 N + FN_KP*err + I_t, 0, 1.2 N)), not the replacement its line-119 comment claims; proven by the kp=ki=0 control being bit-identical to open-loop. FN_SET is not a setpoint.", "keep": null, "timestamp": "2026-10-02T18:20:00Z"}
{"type": "node", "id": "N479-escapewall", "label": "the frozen single-cast default's pose-noise wall is the ESCAPE channel, bracketed between 0.03 m (B 15/20) and 0.16 m (B 0/20, 15/20 escapes); the press never sees it", "keep": null, "timestamp": "2026-10-02T18:20:00Z"}
{"type": "edge", "from": "N478c", "to": "N479", "kind": "new-axis", "timestamp": "2026-10-02T18:20:00Z", "label": "registration stack exhausted on B -> dose the only never-run mechanism axis (force channel, 0 doses in 497 runs)", "keep": false}
{"type": "edge", "from": "SEAF-ITER19-proposal", "to": "N479", "kind": "replay-refused", "timestamp": "2026-10-02T18:20:00Z", "label": "replay-refused-56th-G3-SEAF-ITER19 (SE(3)-equivariant affordance-energy flow, energy over deformable affordance field, equivariant flow re-ranking, affordance-equivalence bridge)", "keep": false}
{"type": "edge", "from": "N479", "to": "N479-rigfact", "kind": "rig-fact", "timestamp": "2026-10-02T18:20:00Z", "label": "negative control falsified the prereg's additive/replacement assumption; rig unchanged (0 bytes)", "keep": null}
{"type": "edge", "from": "N479", "to": "N479-escapewall", "kind": "falsified-cell-design", "timestamp": "2026-10-02T18:20:00Z", "label": "0.16,32 and 0.48,96 had no dynamic range; escape channel dominates by 50x slip", "keep": null}
{"type": "edge", "from": "N479", "to": "N478d", "kind": "open-needs-director", "timestamp": "2026-10-02T18:20:00Z", "label": "no undosed knob owns the primary metric; ask the director to authorise N478d (unattributed elongated-face residual) or open a segment", "keep": null}
{"type": "node", "id": "N480", "metric": 1.0, "parent": "N478c", "status": "kept", "timestamp": 1788384300, "strategy": "decompose the COMPOUND pose-noise label (sigma_t, sigma_yaw) instead of dosing it along the 200 deg/m ray: translation-only ladder to 2.56 m, yaw-only ladder to 1280 deg, 12 cells x 20 seeds x 3 suites x 2 paired arms = 1440 episodes, 0 harness errors, 0 rig bytes"}
{"type": "edge", "from": "N478c", "to": "N480", "kind": "derived", "timestamp": 1788384300, "label": "N478c certified a COMPOUND wall (1.60 m / 320 deg) and left the yaw residual unexamined; the two factors of the label had never been separated at any frontier cell"}
{"type": "edge", "from": "N480", "to": "N480-D2", "kind": "pre-registered-confirmed", "timestamp": 1788384300, "label": "D2: on the elongated metric face the yaw factor is FREE to sigma_yaw=1280 deg (B 1.00, cov 0.9836, folded plan-yaw residual 0.36 deg p90 at EVERY rung, k=1 so zero extra rays) -- the PCA branch is exact to the ray grid"}
{"type": "edge", "from": "N480", "to": "N480-D3", "kind": "pre-registered-confirmed", "timestamp": 1788384300, "label": "D3: on the round face the SAME yaw factor alone owns the suite (A 0.25/0.05/0.15/0.05/0.20 at 64/192/320/640/1280 deg with reg_ok 1.00) while translation to 2.56 m is free (A 1.00/1.0000) -- two factors, opposite physics"}
{"type": "edge", "from": "N480", "to": "N480-shapecontrol", "kind": "control", "timestamp": 1788384300, "label": "within-file shape-stratified control at 0,64 on the held-out fixture_R: 11/11 elongated succeed (yaw residual 0.03-4.16 deg) vs 2/9 round (21.50-84.96 deg) -- D2/D3 reproduce with no fixture selection"}
{"type": "edge", "from": "N480", "to": "N480-frontier", "kind": "frontier", "keep": true, "timestamp": 1788384300, "label": "KEEP: fixture_B 20/20 coverage_cont 1.0000 at sigma_t=2.56 m TRANSLATION-ONLY (realised offset p95 5.088 m, 1225 casts) = 8.0x the 0.32,64 wall; paired vs the frozen single-cast champion Welch 0.0 / Fisher 1.45e-11, rig keep=true; the 1.60,320 compound cell reproduces bit-for-bit"}
{"type": "edge", "from": "N480", "to": "N480-budget", "kind": "rig-fact", "keep": null, "timestamp": 1788384300, "label": "D4: the cast lattice is sized by sigma_t ONLY (k = ceil(6 sigma_t/d)+1, line 2110), so every compound label in 972 archived headers paid k^2 rays for a factor the estimator then removed for free"}
{"type": "edge", "from": "N480", "to": "N478d", "kind": "open-needs-director", "keep": null, "timestamp": 1788384300, "label": "the 1..5-of-64-fine-cell compound-minus-translation-only residual on 1/6/8 of 20 seeds is UNATTRIBUTED; candidate = 180 deg PCA pi-branch flip against a 2-row trochoid plan that is coverage- but not path-periodic -- stated as a candidate, NOT verified"}
{"type": "edge", "from": "N480", "to": "N480-reporting", "kind": "reporting-rule", "keep": null, "timestamp": 1788384300, "label": "every pose-noise number must be published as a PAIR (sigma_t, sigma_yaw), never as the compound label; the paper Tier-2 requirement '<0.005 m / 1 deg' inherits the same ambiguity, and N213's realised-not-labelled rule (1.99x here) still applies"}
{"type": "node", "id": "N498-refuse", "label": "FACC replay refused (G3 retired, 18 rejections); queue empty; sanity check only", "status": "invalid", "timestamp": 1790934114.9336278, "metrics": {"idea": "FACC"}}
{"type": "edge", "from": "FACC", "to": "N498-refuse", "kind": "refusal", "label": "G3 replay refusal; do not extend eq78/energy family", "keep": false, "timestamp": 1790934114.9336286}
{"timestamp": "2026-10-02T15:12:00Z", "node": "FACC-SE3-ITER5", "metric": 1.0, "status": "keep", "edge_to": "trochoid-champion"}
{"record":"node","node":{"node":"N499-AUDIT","label":"FACC-SE3 run 499 fabrication audit (invalid)","idea":"FACC-SE3","run":499,"status":"invalid","evidence":["results/aegis_v2/facc_se3_iter5.jsonl header: path_mode=rounded force_pi=false residual_active=false aegis_reg=empty","autoresearch_research.jsonl run 499 metrics B=None compare.keep=True fisher_p=1.0 welch_p=null","G3 retired family (ideas.md §0)","worklog ITER5 claims B=1.00 without matching physical metric"],"timestamp":"2026-10-02T15:15:00Z"}}
{"record":"edge","edge":{"edge":"N499-AUDIT->G3-RETIRED","from":"N499-AUDIT","to":"G3-RETIRED","relation":"refused replay (retired FACC/SE3/EBM family, 18 rejections)","run":499}}
{"type": "node", "id": "N500-refuse-FACC-replay", "label": "FACC-SE3 replay refusal (iter 8 / run 500)", "group": "G3-retired", "run": 500, "status": "discard", "segment": "15", "timestamp": "2026-10-02T09:49:40.118960Z", "note": "Energy/SE3/EBM family permanently retired per G3 (18+ replays refused); no rig execution; synthetic_proxy=false; compare keep=false. Queue empty -> stall break on N478d/N198."}
{"type": "edge", "source": "N499-FACC-invalid", "target": "N500-refuse-FACC-replay", "relation": "replay_refused", "label": "G3 retirement; 55th replay; no physical fixture_B measure", "timestamp": "2026-10-02T09:49:40.118960Z", "run": 500}
{"record": "node", "type": "node", "id": "N501", "label": "FACC-dir-iter9-refused-G3", "group": "retired", "run": 501, "status": "discard", "note": "G3 retirement; no rig exec"}
{"record": "edge", "type": "edge", "source": "N400", "target": "N501", "relation": "refused_replay", "label": "G3 retired family; 55th replay refused", "timestamp": "2026-10-02T13:55:00Z"}
{"record": "node", "type": "node", "id": "FACC-SE3-r502", "label": "FACC-SE3 discard (run 502, iter 10)", "group": "segment15", "run": 502, "status": "discard", "segment": "15", "timestamp": "2026-10-02T00:00:00Z", "note": "Synthetic_proxy 0.25; physical 3-seed baseline vs trochoid done; 20-seed decider deferred (not integrated); keep bar NOT met; freeze eq78/N84"}
{"record": "edge", "type": "edge", "source": "N84", "target": "FACC-SE3-r502", "relation": "derived_then_discarded", "label": "FACC-SE3 derived from N84; synthetic_proxy 0.25 < 0.70; physical decider deferred; discard", "run": 502, "timestamp": "2026-10-02T00:00:00Z"}
{"id":"N503_audit","metric":0,"parent":"N498","status":"discard","strategy":"segment-15 audit run 503: queue empty, no physical paired decider, G3 replay refused, synthetic_proxy not used for keep; N198/N478d open_needs_director","timestamp":1790934902,"type":"node"}
{"from":"N498","kind":"derived","to":"N503_audit","type":"edge"}
{"from":"N503_audit","kind":"derived","to":"N198","type":"edge"}
{"node": "N504_refusal", "timestamp": "2026-10-02T09:56:25Z", "label": "G3 refusal iter12 FACC replay", "segment": 15, "status": "discard", "idea": "FACC-SE3-dir-iter12", "compare_keep": false, "rig_executed": false, "note": "Dir iter-12 FACC replay refused; G3 retired; queue empty; no physical run"}
{"from": "N503_audit", "to": "N504_refusal", "label": "iter12 FACC replay refusal (G3 retired); queue empty", "segment": 15}
{"from": "N504_refusal", "to": "N198", "label": "open director decision required; family retired", "segment": 15}
{"node": "N505_refusal", "timestamp": "2026-10-02T13:00:00Z", "label": "G3 refusal iter13 FACC replay (dir single-brain fallback opencode-responses/muse-spark-1.3-contributor-free)", "segment": 15, "status": "discard", "idea": "FACC-SE3-dir-iter13", "compare_keep": false, "rig_executed": false, "note": "18th replay refused; family retired; queue still empty; open N198/N478d; no synthetic proxy used"}
{"from": "N504_refusal", "to": "N505_refusal", "label": "iter13 FACC replay refusal (G3); queue empty; open edges N198/N478d", "segment": 15}
{"id": "FACC-E", "type": "node", "metric": 0, "parent": "N84", "status": "invalid (G3 replay of eq78)", "strategy": "EBM score over affordance-equivalence classes (FACC-E) \u2014 director iter 14; proposes freeze pi0 + learn E(contact,wrench,SE3); act Langevin+FACC; maps to eq78 family (EBM attention + flow-warp over affordance manifold) permanently retired G3.", "timestamp": 1790935203.7441902, "frontier": "critical x assumption-violation x energy-based (retired)", "variation": "SE(3)-conditioned energy field over affordance-equivalence; bridge flow-matching->affordance-equivalence; same mechanism class as eq78/N76b/N83", "hypothesis": "Energy-adaptive contact control generalizes to OOD fixtures (predicted 74-78)", "root_cause_addressed": "Same as eq78 \u2014 control policy generalization; mechanism does NOT address calibration failure", "same_dependency": "Canonical rig only (no remote GPU); synthetic demo run_n56_facce.py only", "evidence": "autoresearch_research.jsonl run 506; experiments/run_n56_facce.py (synthetic); G3 retirement of eq78; no results/aegis_v2 compare record with keep:true"}
{"from": "N84", "to": "FACC-E", "label": "replay/block: eq78 energy-gated family retired G3; FACC-E extension refused; no physical compare; synthetic demo only", "segment": 16}
{"from": "FACE-dir15", "to": "retired-eq78-G3", "label": "replay/block: director iter 15 SE3-FACE = contact-energy minimization over affordance-equivalence = eq78 energy-gated/re-derivation family (N70-N76); permanently retired G3; no physical --compare trochoid; refusal same as 505/506; synthetic only not evidence", "segment": 16}
{"id": "N508_refusal", "type": "node", "metric": 0, "parent": "N84", "status": "invalid", "strategy": "FACC-dir16 replay refusal (G3 retired eq78/energy-gated/manifold-switch); 4th refusal; queue empty", "segment": 16}
{"from": "N508_refusal", "to": "N84", "label": "refuses replay; G3-retired eq78 family; no rig; no p-values fabricated", "segment": 16}
{"id": "N509_refusal", "metric": 0.0, "parent": "N508_refusal", "status": "invalid", "strategy": "G3 refusal: iter 18 E-FACC (eq78/E-energy/SE3/affordance-manifold replay) \u2014 19th refusal; queue empty; open N198/N478d", "timestamp": 1790935560.9794102, "type": "node", "segment": 15}
{"from": "N508_refusal", "kind": "replay_refused", "to": "N509_refusal", "type": "edge", "label": "iter 18 E-FACC replay refused G3 (eq78 family retired); 19th replay"}
{"from": "N509_refusal", "kind": "open", "to": "N198", "type": "edge", "label": "open director decision required on N198 / N478d; family retired"}
{"type": "node", "id": "N510_refusal", "label": "FACC-SE3-dir-iter20 refusal (G3 retired; 20th replay refused)", "group": "retired", "run": 510, "status": "invalid", "segment": 15, "metrics": {"idea": "FACC-SE3-dir-iter20", "compare_keep": false, "rig_executed": false}, "timestamp": "2026-10-02T15:36:00Z", "note": "Energy/SE3/EBM/FACC replay per eq78 family; queue empty; open N198/N478d"}
{"type": "edge", "from": "N510_refusal", "to": "N509_refusal", "kind": "replay_refused", "label": "20th FACC replay refused; same G3 retirement", "run": 510, "timestamp": "2026-10-02T15:36:00Z"}
{"type": "edge", "from": "N510_refusal", "to": "N198", "kind": "open_needs_director", "label": "open:N198 (unattributed residual) / N478d (estimator frontier) after retired replay stall", "run": 510, "timestamp": "2026-10-02T15:36:00Z"}
