{"run": 361, "status": "keep", "title": "N212-TIME-DOSE: validity audit of the tick budget T_MAX=400 (the commanded scrub speed), the last unvaried term in the control chain", "segment": 15, "primary_metric": "transfer_success", "tier4_gate": "frozen", "metrics": {"idea": "N212-TIME-DOSE", "claim_type": "validity_audit", "new_mechanism": false, "physical": true, "rig_invoked": "experiments/kaggle_aegis_sweep.py (PyBullet DIRECT, system python3, local CPU)", "backend": "pybullet", "sim_hz": 240.0, "solver_iters": 80.0, "control_period_s": 0.05, "path_modes": ["trochoid", "raster"], "pose_noise_cfg": ["0,0", "0.03,6"], "seeds": 20, "suites": ["fixture_A", "fixture_B", "fixture_R"], "dose_ladder_ticks": [12, 25, 50, 100, 200, 400, 800, 1600], "dose_ladder_band": "32x (0.65 s .. 85.65 s fixture_B cycle)", "arms": 21, "episodes_total": 2520, "harness_errors": 0, "rig_keep_any_arm": false, "paired_baseline": "the in-rig --compare-env AEGIS_STEPS=400 champion, same 20 seeds, same friction/tool/noise/customer in every arm", "keep_claimed_on_primary_metric": false, "fixture_B": {"frozen_0_0": {"coverage_cont": 1.0, "success": "20/20", "n_ticks": 400, "v_cmd_mm_s": 42.5, "cycle_s": 21.4}, "ladder_0_0_coverage_cont": {"12": 0.618, "25": 1.0, "50": 1.0, "100": 1.0, "200": 1.0, "400": 1.0, "800": 1.0, "1600": 1.0}, "ladder_0_0_success": {"12": "0/20", "25": "20/20", "50": "20/20", "100": "20/20", "200": "20/20", "400": "20/20", "800": "20/20", "1600": "20/20"}, "ladder_0p03_6_coverage_cont": {"12": 0.5586, "25": 0.8875, "50": 0.9187, "100": 0.9227, "200": 0.9266, "400": 0.9266, "800": 0.9281, "1600": 0.9281}, "ladder_0p03_6_success": {"12": "0/20", "25": "12/20", "50": "15/20", "100": "15/20", "200": "15/20", "400": "15/20", "800": "15/20", "1600": "15/20"}}, "fixture_A": {"frozen": 1.0, "ladder_0_0": {"12": 0.4688, "25": 0.9401, "50": 1.0, "100": 1.0, "400": 1.0, "1600": 1.0}}, "fixture_R": {"frozen": 1.0, "ladder_0_0": {"12": 0.4893, "25": 0.9698, "50": 1.0, "100": 1.0, "400": 1.0, "1600": 1.0}}, "p_welch_coverage": {"0.03,6_n50": 0.793, "0.03,6_n100": 0.894, "0.03,6_n200": 1.0, "0.03,6_n800": 0.957, "0.03,6_n1600": 0.957, "0.03,6_n25": 0.223, "0.03,6_n12": 8.78e-12}, "p_fisher_success": {"0.03,6_n50": 1.0, "0.03,6_n100": 1.0, "0.03,6_n25": 0.501, "0.03,6_n12": 7.71e-07}, "N212.1_D1_confirmed": "the certification is dose-robust: n in {100,200,400,800,1600} at pose noise 0,0 gives coverage_cont 1.0000 and 20/20 on A, B and R, and fixture_B is exactly 1.0000 (spread 0.0000) over n in [50,1600] -- a 16x cycle-time band (5.35 s .. 85.65 s) with zero change in the metric", "N212.2_D2_refuted": "cross-track PD lag is not the binder: v_crit = sqrt((r_eff/2)KP R/m) = 0.286 m/s, the fastest CLEAN dose commands 170.1 mm/s = 0.59x v_crit at coverage_cont 1.0000, the losing n=12 arm commands 1399.7 mm/s = 4.9x v_crit, and D2's own n=50 (marginal) and n=25 (degraded) predictions are both 1.0000/20-of-20 on fixture_B", "N212.3_D3_refuted_but_its_criterion_is_the_binder": "over 30 (arm,suite) cells at 0,0 across BOTH path modes every cell with realised step s=L/steps <= 0.486*(2 r_eff) reads EXACTLY 1.0000 and every cell with s >= 0.601*(2 r_eff) loses coverage, disjoint with no counter-example; the clean frontier is 0.481 for trochoid (path 0.9098 m) and 0.486 for raster (path 0.8500 m) -- the same threshold in a length unit from two path lengths, so the binder is sampled contact spacing, not the path, the servo or the force. Corrections to the pre-registration: the 1-D tiling bound s=2 r_eff=0.070 m is 1.7x looser than the measured threshold (the 0.025 m cell grid sets it), and the frozen dose s/(2 r_eff)=0.030 sits 16x below the fastest clean dose", "N212.4_D4_refuted": "the slow end loses coverage rather than time: at n=12 fixture_B goes 1.0000/20-of-20 -> 0.6180/0-of-20 with slip_m 0.0106 -> 0.1780 (x16.8) and stick_frac -> 0.0000; the usable band is bounded on both sides and the frozen point sits near the log-dose middle (16x from the sampling cliff, 4x from the cycle floor)", "N212.5_responsive_band_saturates": "at 0.03,6 fixture_B is monotone increasing in the dose and saturates at 0.9281 for n >= 800 (v_cmd <= 21.3 mm/s); the frozen 0.9266 sits 0.0015 under the saturated value with Welch p 0.79-1.0 and Fisher p 1.0 vs the paired champion at every dose in [50,1600], so I12's 200-seed matrix and N211's kernel audit read a plateau, not a single-speed artefact", "integrity": {"identity_vs_Run350": "60/60 episodes success identical, max |d coverage_cont| = 0.0", "cross_process_repro": "the in-rig frozen baseline arm reproduces with spread 0.0 across 21 separate processes (8 trochoid 0,0 / 7 trochoid 0.03,6 / 4 raster 0.03,6 / 2 raster 0,0) -- extends N210.5", "teleport_used": false, "arithmetic_coverage_or_success": false, "predicted_score_claim": false, "unvalidated_rows": 0, "gpu_booked": false, "downloads": "none", "disk_free_gb": 74, "restroom_sim_used": false, "g3_retired_family_touched": false}, "rig_change": "one knob AEGIS_STEPS (default 400 = the frozen literal) + an int coercion for it + candidate_steps in the summary (the --compare-env baseline rewrites T_MAX, so meta['steps'] alone would mislabel the baseline dose). No force, scoring, geometry, phase or tick term touched", "pre_registration": "D1-D4 were written into the rig source (KNOB_GLOBALS comment) before the first run; the diff was uncommitted at run time, so the pre-registration record is the rig comment plus .autoresearch-loop.log, and it is reproduced verbatim in equations.md ROW N212", "recovered_iteration": "18 of the 21 arms were produced by the run-361 iteration that died before logging (no JSONL row, no worklog, no graph node, no commit; its analysis script never reached disk). This iteration re-derived every number from the archived JSONL with experiments/N212_dose_axis_audit.py, added the 3 missing arms (raster n=12 @0.03,6, raster n=12 and n=25 @0,0) to complete the ladder and make the cross-mode cliff test exact at zero pose noise, and logged the result for the first time", "verdict_detail": "KEEP as a validity audit only. No keep is claimed on the primary metric and rig keep=false in all 21 arms by construction: every candidate is a dose, not a better plan, and the paired champion is at ceiling. The payload is a NEGATIVE-plus-robustness result: the certified fixture_B transfer is a plateau in commanded speed, and the failure mode at the fast end is named and quantified (contact sampling denser than ~0.6 x 2 r_eff) with the servo, the normal force and the path mode excluded as binders", "n198": "sixth independent line for director option (b): the evidence under the B-anchored bar is not a single-speed artefact either -- the B=1.00 point is a 16x-wide plateau in the tick budget, and the only failure direction is a quantified sampling limit, not a hidden tuning point. Raised without a segment, metric or gate change", "artifacts": ["results/aegis_v2/N212_r361_0_identity_trochoid.jsonl", "results/aegis_v2/N212_r361_1_ceiling_n{12,25,50,100,200,800,1600}.jsonl", "results/aegis_v2/N212_r361_2_noisy_n{12,25,50,100,200,800,1600}.jsonl", "results/aegis_v2/N212_r361_3_raster_noisy_n{12,25,100,1600}.jsonl", "results/aegis_v2/N212_r361_4_raster_clean_n{12,25}.jsonl", "results/aegis_v2/N212_r361_audit.txt", "experiments/N212_dose_axis_audit.py (10 claim groups as asserts, all pass)", "equations.md ROW N212"], "synthetic_proxy": "not used; restroom_sim never invoked"}}
{"run": 362, "idea": "N213-POSE-OFFSET-AXIS", "status": "keep", "metric": "transfer_success", "metric_class": "physical", "novelty_score": null, "title": "N213-POSE-OFFSET-AXIS: validity audit of POSE_NOISE, the only DECLARED factor never probed and the one the paper's robustness claim is written in -- it is a Gaussian DRAW, not a level", "segment": 15, "summary": "Validity audit (new_mechanism=false) of the rig's POSE-NOISE-OFFSET axis. Every labelled pose-noise level in runs 1-361 is a mixture over realized offsets spanning 0..3.63 sigma from n=20 unbounded Gaussian draws, so the offset that moves coverage_cont had never been held at a controlled magnitude. Two frozen-default plan-frame knobs (AEGIS_POSE_FIX_U/V) turn the axis into a controlled dose: 21 held-offset arms + 3 stochastic levels at 100 seeds, 21 arms paired in-rig on the SAME 20 seeds. P1 CONFIRMED (realized max 3.63x the labelled sigma at all three levels). P2 CONFIRMED inside the coverage regime: over 600 episodes with |offset|<=0.08 m, ZERO escapes, ZERO stall, ZERO z-excursion, max |d slip_m| 1.8e-4 m -- a held offset is a PLAN-FRAME error, and the slip channel the segment's mechanism rests on is dead here. Beyond the face boundary the dynamics DO answer (max |d fn_mean| 2.54 N, |d slip_m| 0.597 m): the axis has TWO regimes. The escape boundary is closed-form exact on 6 (suite,axis,sign) cells and on fixture_R it splits by FACE TYPE, not by suite (v=+0.12: 0/9 round vs 11/11 elongated) -- 4/4 as predicted. P3 (the theta* scale) REFUTED on every crossed cell, pred/meas 0.25x..8.30x (median 4.12x), while its ORDERING survives. P4 anisotropy CONFIRMED at 2.66x (A) / 2.61x (B) against the pre-registered 2.7x / 2.5x. P5 sign asymmetry REFUTED: at |dv|=0.05 the -v arm reads 0.7688 vs +v 0.8187 on A, the OPPOSITE of the predicted direction. P6 CONFIRMED: pooled over 300 fixture_B episodes the label alone explains R^2 0.3323 vs the realized draw's 0.6277, and adding it buys -0.026 R^2. rig keep=false in EVERY arm BY CONSTRUCTION and NO keep is claimed on the primary metric.", "metrics": {"idea": "N213-POSE-OFFSET-AXIS", "claim_type": "validity_audit", "new_mechanism": false, "physical": true, "rig_invoked": "experiments/kaggle_aegis_sweep.py (PyBullet DIRECT, system python3, local CPU)", "backend": "pybullet", "sim_hz": 240.0, "solver_iters": 80.0, "path_mode": "trochoid", "steps": 400, "seeds": 20, "suites": ["fixture_A", "fixture_B", "fixture_R"], "pose_noise_cfg": ["0,0", "0.01,2", "0.03,6", "0.05,10"], "arms_held_offset": 21, "arms_stochastic": 3, "arm_files": 29, "episodes_total": 4260, "harness_errors": 0, "rig_keep_any_arm": false, "keep_claimed_on_primary_metric": false, "paired_baseline": "in-rig --compare-env AEGIS_POSE_FIX_U=0,AEGIS_POSE_FIX_V=0, the SAME 20 seeds -> same friction/tool/noise/customer in every arm (G4)", "A1_identity": {"bit_identical_to_run350": true, "episodes": 60, "max_delta_coverage_success": 0.0, "max_delta_force_channels_N": 0.154, "note": "the scored pair is bit-reproducible across processes; every force-derived channel is not (N210.5's 0.154 N floor), re-measured here, so paired contrasts stay exact"}, "P1_label_is_not_a_dose": {"realized_max_over_labelled_sigma": 3.63, "per_axis_realized_abs_dx_range": {"0.01": [0.0, 0.0351], "0.03": [0.0001, 0.1052], "0.05": [0.0002, 0.1754]}, "verdict": "CONFIRMED -- 'sigma_t = 0.03 m' rows are a 0..0.109 m mixture"}, "P2_mechanism_is_geometric": {"verdict": "CONFIRMED inside the coverage regime; the axis has TWO regimes", "episodes_coverage_regime": 600, "abs_offset_bound_m": 0.08, "escapes": 0, "stall_episodes": 0, "z_excursion_episodes": 0, "max_abs_d_slip_m": 0.000176, "max_abs_d_fn_N_in_regime": 0.1605, "max_abs_d_fn_N_beyond_face": 2.538, "max_abs_d_slip_m_beyond_face": 0.597, "note": "the force channel answers only where the PAD overhangs the face edge (max 0.161 N at u+0.00 v+0.08 fixture_A tool 0); the slip channel the segment's mechanism rests on is DEAD in the coverage regime"}, "P3_theta_star_scale": {"verdict": "REFUTED on every crossed cell; the ORDERING survives", "pred_over_meas_min": 0.25, "pred_over_meas_max": 8.3, "pred_over_meas_median": 4.12, "crossed_cells": 18, "pad_order_holds_on_all_crossed_cells": true, "measured_theta_star_m": {"fixture_A": {"u+": [0.0895, 0.0963, 0.1008], "v+": [0.0312, 0.0362, 0.0476], "v-": [0.0192, 0.0209, 0.0253]}, "fixture_B": {"u+": [0.0732, 0.08, 0.0936], "v+": [0.0253, 0.0307, 0.0407], "v-": [0.0145, 0.0153, 0.0256]}}, "note": "per tool 0/1/2 (sponge/brush/mop); the two corrections bracket the truth from both sides -- the pad-corner assumption is too loose, the measured-contact-band form too tight -- so NO closed form for the scale is claimed"}, "P4_anisotropy": {"verdict": "CONFIRMED", "theta_u_over_theta_v_brush": {"fixture_A": 2.66, "fixture_B": 2.61}, "pre_registered": {"fixture_A": 2.7, "fixture_B": 2.5}, "note": "the across-patch (v) axis is the binder"}, "P5_sign_asymmetry": {"verdict": "REFUTED -- the sign runs the OPPOSITE way to the prediction", "cov_at_abs_dv_0p05_fixture_A": {"v+": 0.8187, "v-": 0.7688}, "cov_at_abs_dv_0p10_fixture_A": {"v+": 0.4849, "v-": 0.4354}, "predicted": "+v is the tight sign by 0.03 m on every suite"}, "P6_label_carries_no_mechanism": {"verdict": "CONFIRMED", "pooled_fixture_B_episodes": 300, "r2_realized_offset": 0.6277, "r2_label_alone": 0.3323, "r2_realized_plus_label": 0.6014, "delta_r2_buys": -0.0263, "per_level_label_fit": "undefined by construction (the label is constant within a level, sxx = 0)", "slope_realized_per_m": -5.48}, "escape_boundary_closed_form": {"verdict": "exact to the ladder step on 6 (suite, axis, sign) cells; a FACE property", "bracketed_cells": 6, "fixture_R_splits_by_FACE_TYPE": {"v+0.10": {"round": "0/9", "elongated": "0/11"}, "v+0.12": {"round": "0/9", "elongated": "11/11"}, "u-0.10": {"round": "5/9", "elongated": "0/11"}}, "cells_as_predicted": "4/4"}, "kernel_cross_check_true_rect_footprint": {"note": "the along-patch penalty is mostly the KERNEL (N211's inscribed DISC standing in for a RECTANGULAR pad), the across-patch penalty is REAL", "u+0.10_fixture_A": {"frozen": 0.8937, "rect": 0.9453, "succ_frozen": 0.35, "succ_rect": 1.0}, "v+0.05_fixture_B": {"frozen": 0.714, "rect": 0.8094, "succ_frozen": 0.0, "succ_rect": 0.3}}, "monotonicity": "coverage_cont monotone in |offset| on both axes and both signs, all 3 suites", "fixture_B_anchor_candidate_arm": {"u+0.000 v+0.000": {"cov": 1.0, "succ": "20/20", "keep": false}, "u+0.050 v+0.000": {"cov": 0.982, "succ": "20/20", "welch_p": 5.08e-05, "keep": false}, "u+0.000 v+0.020": {"cov": 0.9711, "succ": "20/20", "welch_p": 0.000342, "keep": false}, "u+0.100 v+0.000": {"cov": 0.85, "succ": "2/20", "welch_p": 4.31e-16, "keep": false}, "u+0.000 v+0.050": {"cov": 0.714, "succ": "0/20", "welch_p": 8.46e-14, "keep": false}, "u+0.200 v+0.000": {"cov": 0.2109, "succ": "0/20", "welch_p": 3.14e-22, "keep": false}}, "rig_change": "2 DIAGNOSTIC knobs AEGIS_POSE_FIX_U / AEGIS_POSE_FIX_V, both default 0.0, in the plan frame only (scrub_waypoints), registered in KNOB_GLOBALS; scrub_grid and _coverage_cont untouched, nothing teleported, default arm bit-identical to run 350", "g_rules": "G1 local CPU rig, no GPU, nothing downloaded; G2 physical fixture_B only, no synthetic proxy; G3 retired families untouched; G4 every arm paired on the SAME 20 seeds; G5 timeout 1200 + anchored kill only; G6 JSONL via the json.loads-append helper, worklog append-only, artifacts + graph + equations committed; G7 no teleport, no arithmetic coverage/success, no predicted-score claim, no unvalidated row, no novelty_score", "artifacts": "results/aegis_v2/N213_r362_*.jsonl (29 files), results/aegis_v2/N213_r362_audit.txt, experiments/N213_offset_axis_audit.py (9 claim groups as asserts, all pass), experiments/N213_offset_axis.sh, experiments/N213_contact_reach_probe.py, equations.md ROW N213", "recovery_note": "the run-362 rig sweep, the 29 arm files, the probe and the equations row were already on disk when this iteration started (the previous run died before logging); every number here is re-derived from the archived JSONL by the audit script, and three defects in that script were found and fixed rather than worked around -- crossing() walked the -v ladders in descending magnitude so it never bracketed, the per-level label OLS divided by sxx = 0, and the A9/G4 records read compare['per_suite'] when the rig writes suites at the top level"}, "synthetic_proxy": null}
