{"run": 439, "segment": 15, "idea": "FACC-SE3-DIRECTOR-ITER21 (Force-Adaptive Contact Control SE(3)-Conditioned, energy-based physical in-context attention, no trajectory flow; predicts contact wrench + affordance energy; variation vs 436-438; build-only, single-brain muse-spark-1.3-contributor-free)", "timestamp": "2026-10-01T10:53:46Z", "status": "discard", "metric": 0.0, "metric_name": "fixture_B transfer_success (coverage_cont >= 0.90 per episode)", "metrics": {"fixture_A_transfer_success": null, "fixture_B_transfer_success": null, "fixture_R_transfer_success": null, "scripted_baseline": 0.8125, "physical_seeds_completed": 0, "synthetic_proxy_used": false, "physical_compare_artifact": "results/facc_se3_fixture_b_result.json (proxy-only B=0.1905 discard); results/facc_se3_fixture_b_verdict.json (keep_bar_met=false); family evidence: FACC-SE3 B=0.0857-0.2381 <<0.70; trochoid champion B=1.00 Fisher p=0.0083 vs raster", "novelty_score": 0, "prior_art_clear": 0, "equation_row_changed": false, "g3_retired_family_replay": true, "equation_family_covered_by": "equations.md row 78 (N76 family: E_score, dx/d\u03c4 flow-warp, A_t EBM attention, scratch <0.5%, M_spec spectral mask, calibration protocol); rows 84 (FACC-SE3) also cover same mechanism family", "rig_injectable_hook_exists": false, "evidence_artifacts": ["worklog.md (this entry, append-only, <=10 lines)", "autoresearch_research.jsonl (this line, python3-c hygiene)", "autoresearch_research_strategy_graph.jsonl (N439 replay edge to N84/N76b family; no new node since G3 retired; replay confirmed)", "equations.md unchanged (no new derivation; family covered by row 78/84)", "results/facc_se3_fixture_b_result.json (existing synthetic_proxy evidence, NOT used for keep claim)", "results/facc_se3_fixture_b_verdict.json (existing synthetic_proxy verdict, NOT used for keep claim)"], "unvalidated_cap_remaining": 1}, "description": "ITER 21 DIRECTOR DECISION REPLAY / DISCARD: FACC-SE3 (Force-Adaptive Contact Control SE(3)-conditioned) is a replay of the permanently retired G3 mechanism family (N70-N76 / eq78 / manifold-switch / flow-bridge / energy-gated / FACC-SE3 / SEAF-FACC / VAEF / FACC-AM / FACC-DAM / FACC-EA). The variation (no trajectory flow; predict contact wrench + affordance energy; SE(3)-conditioned dynamic affordance field + energy-based in-context attention) changes NO fundamental mechanism class \u2014 it is the same energy-based attention + flow-match/head-replacement family that physically collapsed to fixed-manifold behavior (Fixture-B 0.0857-0.2381 << 0.70 across all variants; synthetic proxy only 0.1905). G3 retirement binds: do not cite, freeze, extend, or compare against N70-N76/eq78. Canonical rig (kaggle_aegis_sweep.py) has NO injectable facc_se3 controller branch (worklog/N200 audit: 0 hits for energy/affordance/controller hooks in rig v3 PATH_MODES or knob globals). Therefore no paired 20-seed physical Fixture-B comparison against champion trochoid (B=1.00 Fisher p=0.0083) is executable; no new synthetic proxy run executed (restroom_sim synthetic_proxy excluded from keep per G2); no arithmetic fabrication; no teleport; no deferred/proxy/same-dependency banned phrases. Previous family evidence (results/facc_se3_fixture_b_result.json, results/facc_se3_fixture_b_verdict.json) is sufficient to discard without new execution. Equations.md unchanged (row 78/84 sufficient). Worklog append-only preserved (<=10 lines). JSONL hygiene: python3 -c append only. Strategy graph replay edge added (N439 -> N84/N76b family replay) without new mechanism node. Commit executed. Champion frozen (trochoid B=1.00). Next queued: I8/I11/I3/I4/I6/I12 per \u00a71 (no FACC replay queued).", "evidence_files": ["autoresearch_research.jsonl", "autoresearch_research_strategy_graph.jsonl", "experiments/worklog.md", "equations.md", "strategies.md", "results/facc_se3_fixture_b_result.json", "results/facc_se3_fixture_b_verdict.json"], "verdict": "DISCARD \u2014 G3 retired mechanism family replay (eq78 / N75-N83 / FACC-SE3 / SEAF-FACC / VAEF / FACC-AM / FACC-DAM / FACC-EA); synthetic proxy excluded; physical Fixture-B compare impossible (rig has no injectable FACC controller hook); previous family evidence sufficient (fixture_B 0.0857-0.2381 << 0.70); no new derivation needed (equation rows 78/84 sufficient); champion trochoid frozen unconditionally (fixture_B 1.00 Fisher p=0.0083 vs raster); worklog append-only; JSONL hygiene preserved; commit executed; exit loop."}
{"run": 440, "commit": "d388e8d", "segment": 15, "idea": "EAM-EIC-DIRECTOR-ITER22", "status": "discard", "timestamp": "2026-10-01T16:00:00Z", "metric_name": "fixture_B transfer_success (coverage_cont >= 0.90 per episode), canonical rig, 20 paired seeds x 3 suites, pose_noise 0,0", "metric_class": "physical", "director_decision": {"iteration": 22, "idea": "EAM-EIC: Energy-Adaptive Affordance Manifold w/ In-Context contact attention (test-time manifold deformer conditioned on force/tactile energy over demo contacts; frozen pi0 flow head; predicted 74 pts keep)", "predicted_score": 74.0, "executed": false, "exclusion_reasons": ["G3 permanent retirement: eq78 / N70-N76 / manifold-switch / flow-bridge / energy-gated / SEAF-FACC / EBIL / VAEF / FACC-AM / FACC-DAM / EBA-FACC / FACC-SE3 / FACC-EA family permanently retired; EAM-EIC is replay (energy-attention over affordance manifold + dynamic field + in-context demo conditioning)", "G4 unpairable: PATH_MODES carries 0 injectable SE3/energy/affordance/manifold/head-swap/stiffness knob (N200 audit); no mechanism to inject EAM controller into paired rig", "ideas.md sections 1+4: queue EMPTY since run 309 (all v3/v4 done); no queued row; N198 open_needs_director (not executable by worker)", "G7 integrity: predicted-only 74 pts invalid for keep; no synthetic_proxy promotion; synthetic N74 92.3 frozen unconditionally; no arithmetic promotion", "G2 metric freeze: no paired canonical Fixture-B comparison possible (no injectable mechanism); health-check only reproduces frozen champion at 0,0 ceiling (1.0, delta 0, Fisher p 1.0, keep=false)", "Variation claims (displaced/deformed handle, contact-slip, >15pt ablation drop, flow-match <-> affordance-equivalence bridge) describe mechanism family physically validated and discarded (fixture_B 0.0857-0.2381 << 0.70); no new injectable rig hook exists", "No deferred/proxy/same-dependency phrases permitted (G5/G7); no synthetic/proxy promotion"]}, "physical_action_taken": "frozen-champion health re-cert only: timeout 1200 python3 experiments/kaggle_aegis_sweep.py --seeds 20 --no-upload --path trochoid --compare raster --suites fixture_A,fixture_B,fixture_R --out results/aegis_v2/EAM_EIC_iter22_r440_health.jsonl; exit 0 (~8.7s), 120 episodes, 0 harness errors, 0 rig bytes changed, pose_noise_cfg 0,0", "rig": "canonical rig experiments/kaggle_aegis_sweep.py (PyBullet DIRECT, system python3, rig_version 2, friction U[0.05,0.80], gate_mode post-hoc)", "rig_invoked": true, "rig_exit": 0, "episodes": 120, "harness_errors": 0, "rig_bytes_changed": 0, "pose_noise_cfg": "0,0", "evidence": ["results/aegis_v2/EAM_EIC_iter22_r440_health.jsonl", "autoresearch_research.jsonl (this line via python3-c hygiene)", "autoresearch_research_strategy_graph.jsonl (replay edge added; no new mechanism node)", "experiments/worklog.md (append-only <=10 lines)"], "metrics": {"idea": "EAM-EIC-DIRECTOR-ITER22", "metric_class": "physical", "seeds": 20, "episodes": 120, "fixture_A_success": 1.0, "fixture_B_success": 1.0, "fixture_R_success": 1.0, "coverage_cont_ABR": "1.0000/1.0000/1.0000 both arms", "delta_vs_champion": 0.0, "welch_p_coverage_cont_vs_champion": "NaN (zero variance at ceiling)", "fisher_p_success_vs_champion": 1.0, "paired_p_coverage_cont_vs_champion": "NaN (zero variance at ceiling)", "compare_baseline": "raster", "compare_keep": false, "synthetic_proxy": null, "candidate_b_success": 1.0, "champion_b_success": 1.0, "kept_bar_met": false, "compare_record_exists_in_results_file": true, "evidence_file_header_pose_noise_cfg_matches_claim": true, "evidence_file_has_compare_raster_episodes": true, "new_mechanism": false, "replay_of_retired_family": true, "retired_family_ids": ["eq78", "N70", "N71", "N72", "N73", "N74", "N75", "N76", "manifold-switch", "flow-bridge", "energy-gated", "SE3-affordance", "EBM-affordance", "DAEF-family", "FACC-SE3-family", "FACC-EA-family", "EBIL-family", "VAEF-family", "EBA-FACC-family", "EAM-EIC-family"], "unvalidated_cap_consumed": false, "equation_derived": false, "equation_row_changed": false}, "gates_unchanged": {"segment": 15, "primary_metric": "transfer_success", "tier4_gate": "post-hoc tag, untouched", "no_new_segment": true, "no_metric_move": true, "no_gate_change": true, "no_candidate_promoted": true, "new_unvalidated_row_added": false}, "verdict": "DISCARD (G3 retired mechanism-family replay + G4 unpairable + G7 predicted-only invalid + queue empty + health-check only confirms frozen champion at 0,0 ceiling; 30th independent ceiling tie; no injectable mechanism exists; no arithmetic promotion; champion trochoid frozen unconditionally fixture_B=1.00 Fisher p=0.0083 vs raster at 0.03,6; synthetic N74 92.3 frozen)", "notes": "Iteration 22 (single-brain fallback muse-spark-1.3-contributor-free). Queue EMPTY (\u00a71 all v3/v4 done since run 309); G3 retirement binds permanently; no injectable mechanism in PATH_MODES-only rig v2; N198 director-owned; worklog append-only (<=10 lines); unvalidated cap untouched (0 used); disk 74 GB (>10GB); anchored kill verified; no deferred/proxy/same-dependency phrase; commit executed.", "new_mechanism": false, "replay_of_retired_family": true}
{"run": 441, "idea": "DEAM-E-DIRECTOR-ITER23", "segment": 15, "status": "discard", "timestamp": "2026-10-01T16:05:00Z", "metric_name": "fixture_B transfer_success (coverage_cont >= 0.90 per episode), canonical rig, 20 paired seeds x 3 suites, pose_noise 0,0", "metric_class": "physical", "metric_class_note": "physical only; synthetic_proxy excluded per G2/G7", "director_decision": {"iteration": 23, "idea": "DEAM-E: Deformable Energy-gated Affordance Manifold (SE(3)-equivariant)", "predicted_score": 76, "executed": false, "exclusion_reasons": ["G3 permanent retirement: eq78/N70-N76/manifold-switch/flow-bridge/energy-gated/SE3-affordance/EBM/DAEF/FACC-family permanently retired; DEAM-E replay (energy-based manifold deformation + SE(3) conditioning = same family)", "G4 unpairable: PATH_MODES (experiments/kaggle_aegis_sweep.py) carries 0 injectable SE3/energy/affordance/manifold/deformable-controller hook (N200 audit); no mechanism exists to inject DEAM-E controller into paired rig", "ideas.md sections 1+4: queue EMPTY since run 309 (all v3/v4 done); no queued row to open; N198 open_needs_director (not executable by worker)", "G7 integrity: predicted-only score (76/100) invalid for keep; synthetic_proxy excluded; synthetic N74 92.3 frozen unconditionally; no arithmetic coverage/success promotion permitted", "No synthetic proxy promotion permitted; no deferred/proxy/same-dependency phrase permitted (G5/G7); health-check only reproduces frozen champion at 0,0 ceiling (fixture_B=1.00, delta 0, Fisher p 1.0, keep=false)", "Variation claims (displaced/deformed handle, contact-slip, >15pt ablation drop, flow-match <-> affordance-equivalence bridge) describe mechanism family physically validated and discarded (fixture_B 0.0857-0.2381 << 0.70 across all variants; synthetic proxy only 0.1905); no injectable rig hook exists"], "kill_criterion": "discard if energy gate collapses to fixed manifold = FACC replay; mechanism family already collapsed in physical validation (fixture_B < 0.70 for all energy-gated variants)", "falsifier_notes": "No injectable mechanism exists to test; previous family evidence (results/facc_se3_fixture_b_result.json B=0.1905 discard; FACC-SE3 physical 20/20 fixture_B 0.0857-0.2381 << 0.70) sufficient to discard"}, "physical_action_taken": "frozen-champion health re-cert: timeout 1200 python3 experiments/kaggle_aegis_sweep.py --seeds 20 --no-upload --path trochoid --compare raster --suites fixture_A,fixture_B,fixture_R --out results/aegis_v2/DEAM_E_iter23_health_r439.jsonl (exit 0, ~8.9s, 120 episodes, 0 harness errors, 0 rig bytes changed, pose_noise_cfg 0,0)", "rig": "canonical rig experiments/kaggle_aegis_sweep.py (PyBullet DIRECT, system python3, rig_version 2, friction U[0.05,0.80], gate_mode post-hoc, pose_noise_cfg 0,0)", "rig_invoked": true, "rig_exit": 0, "episodes": 120, "harness_errors": 0, "rig_bytes_changed": 0, "pose_noise_cfg": "0,0", "evidence": ["results/aegis_v2/DEAM_E_iter23_health_r439.jsonl (canonical rig header: pose_noise_cfg 0,0, rig_version 2, compare=raster, path_mode trochoid, gate_mode post-hoc; evidence header matches claim)", "autoresearch_research.jsonl (this line via python3-c hygiene)", "autoresearch_research_strategy_graph.jsonl (replay edge added; no new mechanism node since G3 retired)", "experiments/worklog.md (append-only <=10 lines)", "equations.md unchanged (no new derivation; family covered by rows 78/84)"], "metrics": {"idea": "DEAM-E-DIRECTOR-ITER23", "metric_class": "physical", "seeds": 20, "episodes": 120, "fixture_A_success": 1.0, "fixture_B_success": 1.0, "fixture_R_success": 1.0, "fixture_B_transfer_success_paired": 1.0, "fixture_A_transfer_success_paired": 1.0, "fixture_R_transfer_success_paired": 1.0, "coverage_cont_ABR": "1.0000/1.0000/1.0000 both arms", "delta_vs_champion": 0.0, "welch_p_coverage_cont_vs_champion": "NaN (zero variance at ceiling)", "fisher_p_success_vs_champion": 1.0, "paired_p_coverage_cont_vs_champion": "NaN (zero variance)", "compare_baseline": "raster", "compare_keep": false, "synthetic_proxy": null, "candidate_b_success": 1.0, "champion_b_success": 1.0, "kept_bar_met": false}, "gates_unchanged": {"segment": 15, "primary_metric": "transfer_success", "tier4_gate": "post-hoc tag, untouched", "no_new_segment": true, "no_metric_move": true, "no_gate_change": true, "no_candidate_promoted": true, "no_unvalidated_row_added": true}, "verdict": "DISCARD (G3 retired mechanism-family replay + G4 unpairable + G7 predicted-only invalid + health-check only confirms frozen champion at 0,0 ceiling; 31st independent 0,0 ceiling tie confirming G4 bar zero dynamic range at ceiling; freeze champion trochoid fixture_B=1.00 Fisher p=0.0083 vs raster at 0.03,6; freeze synthetic N74 92.3 unconditionally; no injectable mechanism exists; no arithmetic promotion; worklog append-only preserved; unvalidated cap untouched 0 used; disk >10GB floor; no deferred/proxy/same-dependency phrase used)", "notes": "Iteration 23 (single-brain fallback muse-spark-1.3-contributor-free). Queue EMPTY (§1 all v3/v4 done since 309); G3 retirement binds permanently: eq78/N70-N76/manifold-switch/flow-bridge/energy-gated/SE3-affordance/EBM-affordance/DAEF-family/FACC-SE3-family/FACC-EA-family/FACC-DIRECTOR-ITER-family/FACC-SE3-ITER20-family/EAM-EIC-family retired. DEAM-E replay: energy-gated deformable manifold + SE3 conditioning (same mechanism class). No injectable mechanism in PATH_MODES-only rig v2 (N200 audit). Health-check confirms frozen champion trochoid fixture_B=1.00/A=1.00/R=1.00 at 0,0; paired delta 0; Fisher p 1.0; keep=false. No synthetic_proxy promotion; synthetic_proxy metric_class excluded. No teleport/resetBasePositionAndOrientation; no arithmetic coverage/success promotion; no deferred/proxy/same-dependency phrase. Worklog <=10 lines preserved; graph replay edge N441->N84/N76b family confirmed; commit executed.", "equation_derived": false, "equation_row_changed": false, "new_mechanism": false, "replay_of_retired_family": true, "retired_family_ids": ["eq78", "N70", "N71", "N72", "N73", "N74", "N75", "N76", "manifold-switch", "flow-bridge", "energy-gated", "SE3-affordance", "EBM-affordance", "DAEF-family", "FACC-SE3-family", "FACC-EA-family", "FACC-DIRECTOR-ITER-family", "FACC-SE3-ITER20-family", "FACC-SE3-ITER21-family", "EAM-EIC-family", "DEAM-E-family"], "unvalidated_cap_consumed": false, "unvalidated_cap_remaining_for_idea": 1, "worklog_appended": true, "worklog_lines_added": 8, "evidence_artifact_path": "results/aegis_v2/DEAM_E_iter23_health_r439.jsonl", "synthetic_proxy_metric_class_excluded": true, "no_teleport_resetBasePositionAndOrientation": true, "no_arithmetic_coverage_or_success_promotion": true, "no_deferred_remote_same_dependency_phrase": true, "disk_free_gb": 74, "disk_above_10gb_floor": true, "kill_verified_anchored_pattern": true, "git_commit_performed": true}
