{"id": "N210", "kind": "node", "run": 359, "segment": 15, "status": "keep", "timestamp": 1790786437, "claim_type": "validity_audit", "description": "The NORMAL-FORCE axis was a bare literal, not a knob: the commanded press was KP_PRESS*KP*PRESS_M = 0.500 N in every run 1-358 and FN_SET_N is inert at the frozen FORCE_PI=0. Liveness control: realized fn_mean / commanded press = 1.000 on every unclamped arm over 0.05-25 N (500x). Dynamic range is ONE-SIDED: coverage_cont and success are flat (1.0000, 20/20 on A/B/R) from 0.05 N to 1.0 N, the knee is 1.5-2 N (B 0.9969/0.9844), and at the AEGIS spec band the same champion scores B 0.5562 (10 N, 0/20, Welch p 5.3e-09, Fisher 1.5e-11) and B 0.1813 (25 N, 0/20). keep=false in every arm BY CONSTRUCTION; no keep is claimed on the primary metric."}
{"id": "N210a", "kind": "node", "run": 359, "segment": 15, "status": "keep", "timestamp": 1790786437, "claim_type": "finding", "description": "Mechanism in closed form: slip_m = mu_realized*Fn/KP + 0.0026 m floor. The head is force-driven, its only tangential drive is kp*e, and Coulomb transmits at most mu*Fn, so the steady sliding residual IS the friction load over the gain. Measured/predicted 0.72-1.11 per (arm,suite) cell, per-episode median 1.02, over 180 Coulomb-regime episodes; pearson(mu, slip) = 0.982 at 25 N. Corollary: one fine cell (25 mm) at the top of the realized band needs KP >= 288 N/m at 10 N and 720 N/m at 25 N, i.e. 12x and 29x the frozen KP=25."}
{"id": "N210b", "kind": "node", "run": 359, "segment": 15, "status": "keep", "timestamp": 1790786437, "claim_type": "finding", "description": "The obvious escape does not exist in this architecture, and the force axis is coupled to the gain. (i) Through the frozen F_CLAMP_N=3.0 a 25 N press realizes 3.84 N (|F| 25.6 N, rail bound 311/400 ticks) -> the 10-25 N spec band is unreachable by arithmetic, but LIFTING the rail only moves B 0.1242 -> 0.1813, so the rail is not what pins the rig at 0.5 N. (ii) At the UNCHANGED 0.5 N press, KP x4 already breaks the operating point (A covc 0.2094, 2/20, 18/20 workspace escapes, 0.106 m z-excursion), non-monotonically in gain, and fixture_B fn_mean rises 0.496 -> 1.3-2.0 N because the vertical kp*(tgt_z-cur_z) term acts on the same contact."}
{"id": "N210c", "kind": "node", "run": 359, "segment": 15, "status": "keep", "timestamp": 1790786437, "claim_type": "methodology", "description": "Two transferable rules. (1) The metric is bit-reproducible and the force channel is not: coverage_cont and success matched Run350 on 120/120 episodes after both rig patches, while fn_mean moved by up to 0.154 N at identical mu and press. Force claims therefore need effect sizes well above 0.15 N, and a knob that only shows up in fn_* needs a cross-process reproducibility check before its number is believed. Within one process the --compare-env arms are bit-identical in fn_mean, so paired contrasts stay exact. (2) A force ladder must carry CONTACT_K with it (K = 2000*Fn) to hold the frozen 0.5 mm penetration, otherwise a rising force silently becomes a rising penetration and the geometry, not the force, is being swept."}
{"from": "N209", "to": "N210", "kind": "extends", "run": 359, "timestamp": 1790786437, "label": "validity audit of the contact MODEL's force axis, after the combine rule (N209) -- and the two are the same law: N209 fixes mu_realized, N210 shows the metric's loss is mu_realized*Fn/KP"}
{"from": "N210", "to": "N210a", "kind": "explains", "run": 359, "timestamp": 1790786437, "label": "the one-sided dynamic range is the slip law: coverage dies when mu*Fn/KP exceeds the patch, so the collapse tracks the SAMPLED friction episode by episode (pearson 0.982)"}
{"from": "N210a", "to": "N210b", "kind": "motivates", "run": 359, "timestamp": 1790786437, "label": "the corollary (KP >= mu*Fn/FINE_M) names the only in-rig escape, and measuring it is what kills it"}
{"from": "N210", "to": "N210c", "kind": "adopted", "run": 359, "timestamp": 1790786437, "label": "cross-process force reproducibility check + stiffness-carrying force ladder adopted for every future force-axis claim"}
{"from": "N210", "to": "N198", "kind": "supports-option-b", "run": 359, "timestamp": 1790786437, "label": "fourth independent line for director option (b): N207 (no force dynamic range across rates), N208 (rates x iterations), N209 (declared friction factor has no dynamic range) and now N210 -- the certified B=1.00 sits in a 3-4x window BELOW a knee, and at the spec force band the same champion scores 0/20. The bar's fixture is a low-force, fixed-gain point. Raised without a segment, metric or gate change."}
{"id": "N211", "type": "node", "status": "keep", "run": 360, "timestamp": 1790787315, "label": "N211: validity audit of the rig's SCORING KERNEL (run 360) - the last frozen term in the measurement chain after N207/N208/N209/N210"}
{"id": "N211a", "type": "node", "status": "keep", "run": 360, "timestamp": 1790787315, "label": "the certification is kernel-independent: fixture_B transfer_success 1.00 / 20-of-20 under all 6 footprint-modelling kernels, so the KEEP is not a measurement artifact"}
{"id": "N211b", "type": "node", "status": "keep", "run": 360, "timestamp": 1790787315, "label": "the frozen inscribed-disc kernel is a STRICT LOWER BOUND on footprint occupancy (rect >= disc on 420/420 episodes, geometric containment): the reported pose-noise robustness is conservative (0.03,6 fixture_B 15/20 -> 17/20)"}
{"id": "N211c", "type": "node", "status": "retired", "run": 360, "timestamp": 1790787315, "label": "the grid pitch is converged (|p2-p4| <= 0.0045) and the pts[::2] contact stride is PROVABLY dead at T_MAX=400 (0/420 episodes, max 334 contacts): two of the three kernel literals are not live factors"}
{"from": "N210", "to": "N211", "kind": "motivates", "run": 360, "timestamp": 1790787315, "label": "validity audit of the METRIC, after the combine rule (N209) and the force axis (N210): every coverage number in the segment was produced by three literals nobody varied"}
{"from": "N211", "to": "N211a", "kind": "answered", "run": 360, "timestamp": 1790787315, "label": "the certification survives the kernel: min over kernels of fixture_B coverage_cont = 1.0000, success 20/20 everywhere except the footprint-free kernel"}
{"from": "N211", "to": "N211b", "kind": "answered", "run": 360, "timestamp": 1790787315, "label": "min(hu,hv) < hu,hv makes the disc a subset of the pad rectangle, so the frozen kernel can only under-report; the conservative direction is a theorem, not a measurement"}
{"from": "N211", "to": "N211c", "kind": "retired", "run": 360, "timestamp": 1790787315, "label": "pitch converged + stride dead: the remaining kernel freedom is the footprint model alone"}
{"from": "N211a", "to": "N198", "kind": "supports-option-b", "run": 360, "timestamp": 1790787315, "label": "fifth independent line for director option (b): the saturated primary metric is not a kernel artifact either - B=1.00 at 0,0 holds under every footprint model, and the responsive band (0.03,6) is where all the declared factors live. Raised without a segment, metric or gate change."}
{"id": "N212", "type": "node", "status": "answered", "run": 361, "timestamp": 1790789898, "label": "the TIME DOSE T_MAX=400 was a bare literal in all 560 archived headers and it IS the commanded scrub speed (v_cmd = L/(steps*0.05 s) = 42.5 mm/s on fixture_B, the paper's cycle-time number): the segment was certified at ONE point in speed space. Ladder 12..1600 ticks, 21 arms, 2520 physical episodes, every arm paired in-rig to the frozen champion on the same seeds"}
{"id": "N212a", "type": "node", "status": "answered", "run": 361, "timestamp": 1790789898, "label": "D1 CONFIRMED / the certification is a SPEED PLATEAU not a point: coverage_cont 1.0000 and 20-of-20 on A, B and R for n in {100,200,400,800,1600}, exactly 1.0000 on B over n in [50,1600] (16x cycle-time band, 5.35 s .. 85.65 s); at 0.03,6 B is monotone in the dose and SATURATES at 0.9281 for n>=800, the frozen 0.9266 within 0.0015 (Welch p 0.79-1.0, Fisher p 1.0)"}
{"id": "N212b", "type": "node", "status": "retired", "run": 361, "timestamp": 1790789898, "label": "D2 (cross-track PD lag under loop curvature, v_crit = 0.286 m/s, n_crit ~ 54) REFUTED: the fastest CLEAN dose is 0.59x v_crit at coverage 1.0000, the losing n=12 arm is 4.9x v_crit, and D2's own n=50/n=25 predictions are both 1.0000/20-of-20. D3 REFUTED as stated (predicted no loss in the ladder) and D4 REFUTED (n=12 -> 0.6180/0-of-20, slip x16.8) -- 1 of 4 pre-registered predictions held"}
{"id": "N212c", "type": "node", "status": "answered", "run": 361, "timestamp": 1790789898, "label": "the real binder is SAMPLED CONTACT SPACING: with s = L/steps and r_eff = 0.035 m, every one of 30 (arm,suite) cells at 0,0 with s <= 0.486*(2 r_eff) reads exactly 1.0000 and every cell with s >= 0.601*(2 r_eff) loses coverage, disjoint; the clean frontier is 0.481 for trochoid (path 0.9098 m) and 0.486 for raster (path 0.8500 m) -- one threshold in a length unit from two path lengths, so it is not the path, the servo or the force. Measured threshold is 1.7x tighter than the 1-D tiling bound s = 2 r_eff; the frozen dose is 16x below the fastest clean dose"}
{"from": "N211", "to": "N212", "kind": "motivates", "run": 361, "timestamp": 1790789898, "label": "validity audit of the CONTROL DOSE, after the combine rule (N209), the force axis (N210) and the scoring kernel (N211): the tick budget is the commanded speed and was never varied, so the segment's cycle-time and coverage numbers sat at one unprobed operating point"}
{"from": "N212", "to": "N212a", "kind": "answered", "run": 361, "timestamp": 1790789898, "label": "D1: dose-robustness of the certified point, confirmed over a 16x cycle-time band and shown to saturate in the responsive 0.03,6 band too"}
{"from": "N212", "to": "N212b", "kind": "retired", "run": 361, "timestamp": 1790789898, "label": "the two mechanism predictions (D2 servo lag, D3 'sampling is not the binder') and D4 (slow end is free) are refuted by the ladder; only D1 survives"}
{"from": "N212", "to": "N212c", "kind": "answered", "run": 361, "timestamp": 1790789898, "label": "the dose response is one length threshold in the realised per-tick step, shared by two path modes, which names the fast-end failure mode and excludes the servo, the normal force and the path"}
{"from": "N212a", "to": "N198", "kind": "supports-option-b", "run": 361, "timestamp": 1790789898, "label": "sixth independent line for director option (b): the B-anchored evidence is not a single-speed artefact - the certified fixture_B transfer is a 16x-wide plateau in the tick budget, and its only failure direction is a quantified sampling limit (0.6 x 2 r_eff) rather than a hidden tuning point. Raised without a segment, metric or gate change"}
{"id": "N213", "type": "node", "status": "answered", "run": 362, "timestamp": 1790791668, "label": "N213-POSE-OFFSET-AXIS (validity audit, new_mechanism=false): POSE_NOISE is the last DECLARED factor never probed and the one the robustness claim is written in, and it is a Gaussian DRAW, not a level. 21 held-offset arms + 3 stochastic levels at 100 seeds, 4260 physical episodes, every arm paired in-rig on the SAME 20 seeds. rig keep=false in every arm by construction."}
{"id": "N213a", "type": "node", "status": "answered", "run": 362, "timestamp": 1790791668, "label": "P1+P2 CONFIRMED: the label is a 0..3.63 sigma mixture at all three levels (realized max 3.63x the labelled sigma), and inside the coverage regime (|offset|<=0.08 m, 600 episodes) a held offset moves coverage_cont with ZERO escapes, ZERO stall, ZERO z-excursion and max |d slip_m| 1.8e-4 m -- the slip channel the segment's mechanism rests on is DEAD here. Beyond the face boundary the dynamics do answer (|d fn_mean| 2.54 N, |d slip_m| 0.597 m): the axis has TWO regimes, not one."}
{"id": "N213b", "type": "node", "status": "answered", "run": 362, "timestamp": 1790791668, "label": "the escape boundary is a FACE property, closed-form exact to the ladder step on 6 (suite, axis, sign) cells, and on the mixed customer suite fixture_R it splits by FACE TYPE not by suite (v=+0.12 -> 0/9 round vs 11/11 elongated; u=-0.10 -> 5/9 round vs 0/11 elongated), 4/4 as predicted."}
{"id": "N213c", "type": "node", "status": "retired", "run": 362, "timestamp": 1790791668, "label": "P3 (the theta* scale) REFUTED on all 18 crossed cells, pred/meas 0.25x..8.30x (median 4.12x): the pad-corner closed form is too loose and the measured-contact-band correction too tight, so NO closed form for the scale is claimed. Its ORDERING survives. P5 (the +v sign is the tight one) REFUTED with the sign REVERSED: at |dv|=0.05 fixture_A reads v- 0.7688 vs v+ 0.8187."}
{"id": "N213d", "type": "node", "status": "answered", "run": 362, "timestamp": 1790791668, "label": "P4 CONFIRMED and P6 CONFIRMED: the across-patch (v) axis is the binder at theta_u/theta_v = 2.66 (A) / 2.61 (B) against the pre-registered 2.7 / 2.5, and pooled over 300 fixture_B episodes the LABEL alone explains R^2 0.3323 against the REALIZED draw's 0.6277 while adding it buys -0.026 R^2 (within a level the label is constant, so the per-level fit is undefined by construction)."}
{"from": "N212", "to": "N213", "kind": "motivates", "run": 362, "timestamp": 1790791668, "label": "validity audit of the POSE-NOISE-OFFSET axis, after the rate (N207), iteration (N208), friction (N209), force (N210), kernel (N211) and dose (N212) audits: the last unvaried term is the only one that is a DISTRIBUTION rather than a constant, and it is the term the paper's Tier-2 robustness claim is written in."}
{"from": "N213", "to": "N213a", "kind": "answered", "run": 362, "timestamp": 1790791668, "label": "P1 (the label is not a dose) and P2 (the mechanism is geometric, not dynamic) both confirmed, and P2 splits the axis into a coverage regime and a launch regime."}
{"from": "N213", "to": "N213b", "kind": "answered", "run": 362, "timestamp": 1790791668, "label": "the launch boundary is closed-form from the face extent minus the measured plan reach, and it is a property of the FACE geometry, which is why fixture_R splits by face type."}
{"from": "N213", "to": "N213c", "kind": "retired", "run": 362, "timestamp": 1790791668, "label": "the pre-registered theta* scale and the predicted sign asymmetry are both refuted; the two closed-form corrections bracket the measured crossings from opposite sides, so the scale is left UNCLAIMED rather than re-fitted to the data it was meant to predict."}
{"from": "N213", "to": "N213d", "kind": "answered", "run": 362, "timestamp": 1790791668, "label": "the anisotropy that survives is a ratio of two MEASURED crossings (2.6-2.7x), and the mechanism is the realized offset rather than the labelled sigma."}
{"from": "N213d", "to": "N198", "kind": "supports-option-b", "run": 362, "timestamp": 1790791668, "label": "seventh independent line for director option (b): the B-anchored evidence is not resting on a single pose-noise level. The certified fixture_B transfer survives a held +v offset of 0.020 (0.9711, 20/20) and +u 0.050 (0.9820, 20/20), and the response is a smooth monotone function of a CONTROLLED offset rather than of a label whose realized spread was never reported. Raised without a segment, metric or gate change."}
{"type": "node", "id": "N214", "label": "N214-PAD-FOOTPRINT-AXIS (validity audit, new_mechanism=false): the TOOL BODY is the last unvaried term -- in runs 1-362 the head changed only through tool_id = seed % 3, which moves the footprint (r_eff 0.035/0.040/0.050), the mass (0.080/0.105/0.092 kg) and the thickness together AND aliases them with the seed, yet r_eff is the term every coverage law in the segment is written in (the N211 dilation, the N212 frontier s <= 0.486*2 r_eff, the 'raster fails = tool 0' claim). Three absolute diagnostic knobs (AEGIS_PAD_HU_M / AEGIS_PAD_HV_M / AEGIS_PAD_MASS, default 0.0 = the frozen per-tool value) turn the head into a controlled dose; in-plane extents and mass only, thickness/press/path/kernel untouched. 35 arms, 2100 episodes, every arm paired in-rig on the SAME 20 seeds, identity arm bit-identical to Run350. TWO FLOORS FOUND, both on terms nobody had varied: coverage needs r_eff >= 0.0275 m (0.025 reads 0.9062 = 29/32 cells, 0.0175 reads 0.6414 / 0-of-20) and the ESCAPE channel needs m >= 0.055 kg (0.050 leaves 2 escapes, 0.045 loses the face on 20/11/15 of A/B/R while fixture_B coverage stays 1.0000). The frozen head sits 1.27x above the footprint floor and 1.45x above the mass floor.", "status": "answered", "run": 363, "timestamp": 1790792800}
{"type": "node", "id": "N214a", "label": "Q3 REFUTED and the naive binder REPLACED: the 1-D strip law 2*r_eff*L >= A_window predicts the cliff at r_eff = 0.0110 m and the measured cliff is 0.0275 m, 2.3x tighter, so AREA is not the binder -- the last uncovered CELL is, and its distance to the contact polyline lies in (0.025, 0.0275] with the SAME value on fixture_A, fixture_B and fixture_R, i.e. a property of the path and the scored window, not of the fixture. N212's contact-spacing law is a different term and is not what fails here.", "status": "answered", "run": 363, "timestamp": 1790792800}
{"type": "node", "id": "N214b", "label": "Q4 REFUTED and INVERTED into a floor: mass is not in the coverage law but it has a hard floor on the ESCAPE channel, because success = (not escaped) and coverage_cont >= 0.90 -- at 0.045 kg fixture_B reads coverage_cont 1.0000 with mean slip 0.016 m and still only 9/20. The floor is set by the 20 Hz CONTROL TICK, not by the integrator: N207's own criterion m >= K dt^2 = 0.0174 kg sits 2.9x BELOW the last escaping mass (0.050 kg) while the servo-bandwidth form m >= K(TICK_S/2pi)^2 = 0.0633 kg sits 1.15x above the last clean one (0.055 kg). An 8x rate recovers only part of the 0.030 kg loss (B success 4/20 -> 10/20), so the floor is dynamics with a solver-dependent component.", "status": "answered", "run": 363, "timestamp": 1790792800}
{"type": "node", "id": "N214c", "label": "Q1 REFUTED: a SQUARE pad does not make the rect and disc kernels the same set (rect - frozen = 0.0876/0.0938/0.0907 on A/B/R at r_eff 0.025), because the disc is INSCRIBED in the square, so the gap is the pad's corner area and exists for every pad. It vanishes exactly where coverage saturates (0.0000 at r_eff >= 0.0275), which is the sharpest form of N211's lower-bound statement: the shipped kernel is conservative ONLY below saturation.", "status": "retired", "run": 363, "timestamp": 1790792800}
{"type": "node", "id": "N214d", "label": "Q2 PARTLY CONFIRMED and the anisotropy REFUTED: at r_eff 0.035 every kernel saturates at 1.0000 for the square pad and for elongation along u or across v (max |delta| 0.0000), while at the cliff the true-footprint kernel goes to 1.0000 for EITHER elongation and the frozen disc kernel moves only -0.0195..+0.0144 through the physics -- with an inconsistent sign across suites (A +0.0104, B -0.0195, R +0.0144). A square pad is simply the WORST footprint; which axis you elongate is not a claim.", "status": "retired", "run": 363, "timestamp": 1790792800}
{"type": "node", "id": "N214e", "label": "Q5/Q6 CONFIRMED: the two modes fail through DIFFERENT channels at a small pad -- every raster failure is an escape (ras_sq025 A 2 / R 2, ras_sq0175 A 8 / B 1 / R 4) while the trochoid loses coverage and stays escape-free, so a small pad costs the trochoid coverage and the raster stability. And the pooled 20-seed certificate's three footprints agree to spread 0.0000 per tool, so decomposing the aliased tool axis costs nothing.", "status": "answered", "run": 363, "timestamp": 1790792800}
{"kind": "motivates", "from": "N213", "to": "N214", "label": "validity audit of the TOOL BODY, after the rate (N207), iteration (N208), friction (N209), force (N210), kernel (N211), dose (N212) and pose-noise (N213) audits: the head is the last unvaried term and it is aliased with the seed", "run": 363, "timestamp": 1790792800}
{"kind": "answered", "from": "N214", "to": "N214a", "label": "Q3 refuted; the 1-D strip bound is 2.3x too loose and the real binder is a local covering radius shared by all three suites", "run": 363, "timestamp": 1790792800}
{"kind": "answered", "from": "N214", "to": "N214b", "label": "Q4 refuted and inverted: mass carries an escape floor set by the control tick, 2.9x above the integrator's own limit", "run": 363, "timestamp": 1790792800}
{"kind": "retired", "from": "N214", "to": "N214c", "label": "Q1 (a square pad equates the rect and disc kernels) is refuted; the disc is inscribed, so the gap is the corner area and lives only below saturation", "run": 363, "timestamp": 1790792800}
{"kind": "retired", "from": "N214", "to": "N214d", "label": "Q2's elongation anisotropy is refuted (inconsistent sign); only the saturation claim survives", "run": 363, "timestamp": 1790792800}
{"kind": "answered", "from": "N214", "to": "N214e", "label": "Q5 and Q6 confirmed: raster fails by escaping and trochoid by coverage, and the per-tool spread of the pooled certificate is 0.0000", "run": 363, "timestamp": 1790792800}
{"kind": "supports-option-b", "from": "N214b", "to": "N198", "label": "eighth independent line for director option (b): the B-anchored certificate is not resting on an unexamined head. It holds for every pad down to r_eff 0.0275 (0.786 of the smallest frozen pad) and every mass from 0.055 kg up, so the evidence is a two-parameter REGION, and the two floors (1.27x footprint, 1.45x mass) are the quantified margins a re-anchored bar would have to be read against", "run": 363, "timestamp": 1790792800}
{"kind": "node", "id": "N215", "label": "FIXTURE-FACE axis audited: the face must contain the COMMANDED PLAN's own excursion, not patch+r_eff. fixture_B certifies 1.0000/20-20 for face_v in [0.0500,0.140] (2.80x) and face_u in [0.2250,0.340] (1.51x); round radius cliff (0.230,0.240] = 1.33x. F1+F4 confirmed, F2+F3+F5b refuted", "run": 364, "timestamp": 1790795458}
