{"run": 379, "idea": "LOOP-BOUNDARY-379", "idea_short": "loop boundary: queue empty; no new idea; N198 preserved", "segment": 15, "status": "discard", "metric": "transfer_success", "metric_class": "physical", "idea_type": "loop_boundary", "new_mechanism": false, "replay_of": [], "physical": true, "segment_opened": false, "segment_changed": false, "rig_invoked_for_new_run": false, "g3_retired_family": false, "g3_family_details": null, "queue_empty_confirmed": true, "lowest_queued_idea_found": null, "n198_open_needs_director": true, "compare_champion": "trochoid", "compare_champion_fixture_B_success": 1.0, "compare_fisher_p": "0.0083", "compare_keep": false, "metrics": {"idea": "LOOP-BOUNDARY-379", "fixture_A_transfer_success": null, "fixture_B_transfer_success": null, "fixture_R_transfer_success": null, "fixture_B_family_mean_physical": null, "fixture_B_family_mean_synthetic": null, "coverage_cont": null, "p_value_fisher": null, "p_value_welch": null, "seeds_run": 0, "seeds_physical_run_executed": 0, "rig_invoked": false, "synthetic_proxy": false, "synthetic_proxy_tag": null, "synthetic_proxy_used_for_keep": false}, "metrics_idea": "LOOP-BOUNDARY-379", "metrics_compare": {"compare_champion": "trochoid", "compare_paired_same_seeds": false, "compare_welch_p_coverage_cont": null, "compare_fisher_p_success": null, "compare_keep_true": false, "compare_note": "No paired 20-seed run (queue empty); champion trochoid frozen fixture_B=1.00 Fisher p=0.0083"}, "synthetic_proxy": false, "worklog_append_lines": 4, "worklog_citations": ["autoresearch_research.ideas.md \u00a70/\u00a71 (queue empty since 309; I20/I4/I6 done 241/244/245)", "autoresearch_research.md N198 open_needs_director (director-owned; no worker action)", "results/aegis_v2 (no new artifact; previous trochoid champion preserved)", "autoresearch_research.jsonl runs 375-378 replay/loop-boundary"], "evidence_artifacts": ["autoresearch_research.jsonl (run 379 appended via python3 -c hygiene)", "autoresearch_research_strategy_graph.jsonl (N379 + E379->N198)", "experiments/worklog.md (append-only <=10 lines)", "equations.md (unchanged; no new derivation)"], "equation_changed": false, "equations_md_ref": null, "strategy_graph_updated": true, "graph_note": "node N379 loop-boundary discard + edge E379 to N198; previous N378 preserved; no new mechanism; segment 15 frozen", "commit_sha_target": null, "timeout_1200_applied": false, "timeout_applied_note": "No experiment launched; timeout preserved; anchored kill executed as no-op", "kill_pattern_used": true, "kill_pattern_note": "pgrep -f '^python3 .*kaggle_aegis_sweep\\.py' | xargs -r kill; 0 matches; clean", "g1_local_cpu_rig_used": false, "g1_local_cpu_rig_note": "No new canonical rig invocation (queue empty); experiments/kaggle_aegis_sweep.py unchanged", "g2_fixture_b_physical_only": true, "g2_fixture_b_note": "No synthetic proxy claim; restroom_sim.py excluded; fixture_B not measured (null); previous trochoid physical evidence reused", "g3_retired_not_cited_as_champion": true, "g3_quote_check": true, "g4_paired_stat_done": false, "g4_paired_stat_note": "No paired 20-seed comparison (no mechanism proposed); champion trochoid Fisher p=0.0083 frozen", "g5_hard_20min_cap_and_cleanup": true, "g5_note": "No experiment launched; cleanup no-op; anchored kill verified", "g6_commit_state_every_iteration": true, "g6_notes": "JSONL hygiene via python3 -c; worklog append-only; artifacts saved; git add + commit executed", "g6_jsonl_hygiene_method": "python3 -c hygiene", "g6_worklog_append_only_verified": true, "g6_artifacts_saved": ["autoresearch_research.jsonl", "autoresearch_research_strategy_graph.jsonl", "experiments/worklog.md", "equations.md", "results/aegis_v2"], "g7_integrity_check": true, "g7_no_teleport": true, "g7_no_arithmetic_coverage": true, "g7_no_synthetic_proxy_for_keep": true, "g7_evidence_artifact_headers_match_claim": true, "g7_unverified_predicted_not_evidence": true, "predicted_score_unverified": null, "predicted_score_used_as_evidence": false, "unvalidated_row_added": false, "unvalidated_cap_note": "Not exceeded (status=discard loop-boundary; not unvalidated; cap untouched)", "banned_phrases_checked": true, "banned_phrases_present": false, "disk_gb_free": ">10 (119G)", "verdict_summary": "LOOP-BOUNDARY (run 379). Queue empty per ideas.md \u00a70/\u00a71/\u00a74 (all v3/v4 done since 309; I20/I4/I6 at 241/244/245). Lowest queued = null. No mechanism proposed; no rig invocation; no paired 20-seed fixture-B run. N198 open_needs_director preserved; segment 15 frozen; metric stays transfer_success; champion trochoid frozen (fixture_B 1.00 Fisher p=0.0083). G7: no teleport, no arithmetic fabrication, no synthetic proxy claim, no unvalidated cap breach. Ponytail: speculative replay skipped; no build needed.", "timestamp": "2026-10-01T00:00:01Z", "frontier": "critical x assumption-violation x control-policy-generalization (N198 director-owned only open edge; no new mechanism; replay of retired G3 family already discarded)", "mechanism_class": "none (loop-boundary verification)", "new_equation_row": null, "edge_budget_params_m": null, "edge_budget_vram_mb": null, "edge_budget_latency_ms": null, "edge_budget_check": "No new adapter/retrain/cross-edge built; replay of retired G3 family discarded at 0.22855 << 0.70; previous budget frozen"}
{"run": 380, "idea": "LOOP-BOUNDARY-380", "idea_short": "loop-boundary: queue empty; N198 open_needs_director; no rig invocation", "segment": 15, "status": "discard", "metric": "transfer_success", "metric_class": "physical", "idea_type": "loop_boundary", "new_mechanism": false, "replay_of": [], "physical": true, "segment_opened": false, "segment_changed": false, "rig_invoked_for_new_run": false, "g3_retired_family": false, "g3_family_details": null, "queue_empty_confirmed": true, "lowest_queued_idea_found": null, "n198_open_needs_director": true, "compare_champion": "trochoid", "compare_champion_fixture_B_success": 1.0, "compare_fisher_p": "0.0083", "compare_keep": false, "metrics": {"idea": "LOOP-BOUNDARY-380", "fixture_A_transfer_success": null, "fixture_B_transfer_success": null, "fixture_R_transfer_success": null, "coverage_cont": null, "success": null, "queue_empty": true, "rig_invoked": false, "canonical_rig": "experiments/kaggle_aegis_sweep.py", "physical_truth_source": "autoresearch_research.ideas.md \u00a70 / \u00a71 / \u00a74 (all done since run 309); N198 director-owned", "disk_free_gb_approx": 74, "banned_phrases_present": false, "unvalidated_screening_rows_added": 0, "unvalidated_cap_breach": false}}
{"run": 381, "idea": "LOOP-BOUNDARY-381", "idea_short": "loop-boundary: queue empty; N198 preserved; no rig", "segment": 15, "status": "discard", "metric": "transfer_success", "metric_class": "physical", "idea_type": "loop_boundary", "new_mechanism": false, "replay_of": [], "physical": true, "segment_opened": false, "segment_changed": false, "rig_invoked_for_new_run": false, "g3_retired_not_cited_as_champion": true, "compare_champion": "trochoid", "compare_champion_fixture_B_success": 1.0, "compare_fisher_p": "0.0083", "compare_keep": false, "metrics": {"idea": "LOOP-BOUNDARY-381", "fixture_A_transfer_success": null, "fixture_B_transfer_success": null, "fixture_R_transfer_success": null, "fixture_B_family_mean_physical": null, "coverage_cont": null, "p_value_fisher": null, "p_value_welch": null, "seeds_run": 0, "seeds_physical_run_executed": 0, "queue_empty": true, "lowest_queued_idea_found": null, "n198_open_needs_director": true}, "metrics_idea": "LOOP-BOUNDARY-381", "metrics_compare": {"compare_champion": "trochoid", "compare_paired_same_seeds": false, "compare_welch_p_coverage_cont": null, "compare_fisher_p_success": null, "compare_keep_true": false, "compare_note": "No paired 20-seed run; queue empty per ideas.md; champion frozen"}, "synthetic_proxy": false, "worklog_append_lines": 2, "worklog_citations": ["autoresearch_research.ideas.md \u00a70/\u00a71 (queue empty since 309; I20/I4/I6 done 241/244/245)", "N198 open_needs_director (director-owned; worker skips)"], "evidence_artifacts": ["autoresearch_research.jsonl run 381 (hygiene append)", "autoresearch_research_strategy_graph.jsonl (N381+edge to N198)", "experiments/worklog.md (append-only 2 lines)", "results/aegis_v2/ (no new physical artifact; loop-boundary only)"], "equation_changed": false, "banned_phrases_present": false, "timeout_1200_applied": false, "timeout_applied_note": "No experiment; cleanup preserved; anchored kill executed", "kill_pattern_used": true, "kill_pattern_note": "pgrep -f '^python3 .*kaggle_aegis_sweep\\.py' | xargs -r kill; 0 matches; no self-kill", "g1_local_cpu_rig_used": false, "g1_local_cpu_rig_note": "No invocation (no queued idea); canonical rig unchanged", "g2_fixture_b_physical_only": true, "g2_note": "No synthetic claim; bathroom proxy excluded; fixture_B only from physical runs", "g3_retired_family": false, "g3_family_details": null, "g4_paired_stat_done": false, "g4_note": "No new candidate; no paired comparison needed", "g5_hard_20min_cap_and_cleanup": true, "g5_note": "No run to cap; cleanup executed (anchored)", "g6_commit_state_every_iteration": true, "g6_notes": "JSONL hygiene; worklog append-only; strategy graph updated; git commit done", "g7_integrity_check": true, "g7_no_teleport": true, "g7_no_arithmetic_coverage": true, "g7_no_synthetic_proxy_for_keep": true, "disk_gb_free_approx": 74, "timestamp": "2026-10-01T00:01:00Z", "verdict_summary": "LOOP-BOUNDARY 381. Queue empty (all v3/v4 done since 309; I20/I4/I6 at 241/244/245). N198 open_needs_director preserved. No mechanism -> no rig -> no keep claim. Champion trochoid frozen fixture_B=1.00 Fisher p=0.0083. G1-G7 all satisfied; ponytail: nothing to build.", "frontier": "none (loop-boundary); open edge = N198 director-owned only", "mechanism_class": "none"}
{"run": 382, "idea": "LOOP-BOUNDARY-382", "idea_short": "loop-boundary: queue empty; N198 preserved; no rig; ponytail skip", "segment": 15, "status": "discard", "metric": "transfer_success", "metric_class": "physical", "idea_type": "loop_boundary", "new_mechanism": false, "replay_of": [], "physical": true, "segment_opened": false, "segment_changed": false, "rig_invoked_for_new_run": false, "g3_retired_family": false, "g3_family_details": null, "queue_empty_confirmed": true, "lowest_queued_idea_found": null, "n198_open_needs_director": true, "compare_champion": "trochoid", "compare_champion_fixture_B_success": 1.0, "compare_fisher_p": "0.0083", "compare_keep": false, "metrics": {"idea": "LOOP-BOUNDARY-382", "fixture_A_transfer_success": null, "fixture_B_transfer_success": null, "fixture_R_transfer_success": null, "coverage_cont": null, "success": null, "queue_empty": true, "rig_invoked": false, "canonical_rig": "experiments/kaggle_aegis_sweep.py", "physical_truth_source": "autoresearch_research.ideas.md \u00a70/\u00a71 (all done since run 309); N198 director-owned", "disk_free_gb_approx": 74, "banned_phrases_present": false, "unvalidated_screening_rows_added": 0, "unvalidated_cap_breach": false, "metrics_idea": "LOOP-BOUNDARY-382", "metrics_compare": {"compare_champion": "trochoid", "compare_paired_same_seeds": false, "compare_welch_p_coverage_cont": null, "compare_fisher_p_success": null, "compare_keep_true": false, "compare_note": "No paired 20-seed run; queue empty per ideas.md; champion frozen"}, "synthetic_proxy": false}, "worklog_append_lines": 2, "worklog_citations": ["autoresearch_research.ideas.md \u00a70/\u00a71 (queue empty since 309; I20/I4/I6 done 241/244/245)", "N198 open_needs_director preserved; worker skips spec build"], "evidence_artifacts": ["autoresearch_research.jsonl run 382 (hygiene append)", "autoresearch_research_strategy_graph.jsonl (N382+edge to N198)", "experiments/worklog.md (append-only 2 lines)", "results/aegis_v2/ unchanged (loop-boundary)"], "equation_changed": false, "g1_local_cpu_rig_used": false, "g1_note": "No queued idea -> no invocation; pybullet rig unchanged", "g2_fixture_b_physical_only": true, "g4_paired_stat_done": false, "g5_hard_20min_cap_and_cleanup": true, "g5_note": "No run; anchored kill pgrep '^python3 .*kaggle_aegis_sweep\\.py' | xargs -r kill executed (0 matches)", "g6_commit_state_every_iteration": true, "g7_integrity_check": true, "g7_no_teleport": true, "g7_no_arithmetic_coverage": true, "timeout_1200_applied": false, "kill_pattern_used": true, "timestamp": "2026-10-01T00:02:00Z", "verdict_summary": "LOOP-BOUNDARY 382. Queue empty (all v3/v4 done since 309). N198 open_needs_director preserved. No mechanism -> no rig -> no synthetic claim -> no keep. Champion trochoid frozen B=1.00 Fisher p=0.0083. G1-G7 satisfied; ponytail: skip build, nothing to add.", "frontier": "none; open edge = N198 director-only", "mechanism_class": "none"}
{"run": 383, "idea": "LOOP-BOUNDARY-383", "idea_short": "loop-boundary: queue empty; N198 preserved; no rig", "segment": 15, "status": "discard", "metric": "transfer_success", "metric_class": "physical", "idea_type": "loop_boundary", "new_mechanism": false, "replay_of": [], "physical": true, "segment_opened": false, "segment_changed": false, "rig_invoked_for_new_run": false, "g3_retired_not_cited_as_champion": true, "compare_champion": "trochoid", "compare_champion_fixture_B_success": 1.0, "compare_fisher_p": "0.0083", "compare_keep": false, "metrics": {"idea": "LOOP-BOUNDARY-383", "fixture_A_transfer_success": null, "fixture_B_transfer_success": null, "fixture_R_transfer_success": null, "fixture_B_family_mean_physical": null, "coverage_cont": null, "p_value_fisher": null, "p_value_welch": null, "seeds_run": 0, "seeds_physical_run_executed": 0, "queue_empty": true, "lowest_queued_idea_found": null, "n198_open_needs_director": true}, "metrics_idea": "LOOP-BOUNDARY-383", "metrics_compare": {"compare_champion": "trochoid", "compare_paired_same_seeds": false, "compare_welch_p_coverage_cont": null, "compare_fisher_p_success": null, "compare_keep_true": false, "compare_note": "No queued idea; no paired 20-seed run; champion frozen per ideas.md \u00a70"}, "synthetic_proxy": false, "worklog_append_lines": 2, "worklog_citations": ["autoresearch_research.ideas.md \u00a70/\u00a71 (queue empty since 309; all v3/v4 done; I20/I4/I6 at 241/244/245)", "N198 open_needs_director preserved (director-only; worker skips)"], "evidence_artifacts": ["autoresearch_research.jsonl run 383 (hygiene append)", "autoresearch_research_strategy_graph.jsonl N383+E383->N198", "experiments/worklog.md (append-only 2 lines)", "results/aegis_v2/ unchanged (loop-boundary only)"], "equation_changed": false, "banned_phrases_present": false, "timeout_1200_applied": false, "timeout_applied_note": "No experiment; cleanup preserved; anchored kill executed (0 matches)", "kill_pattern_used": true, "kill_pattern_note": "pgrep -f '^python3 .*kaggle_aegis_sweep\\.py' | xargs -r kill; 0 matches; no self-kill", "g1_local_cpu_rig_used": false, "g1_local_cpu_rig_note": "No queued idea -> no invocation; canonical rig experiments/kaggle_aegis_sweep.py unchanged; physical truth = PyBullet DIRECT system python3", "g2_fixture_b_physical_only": true, "g2_note": "No synthetic claim; fixtures A/B/R only from physical rig; benchmark proxy excluded from keep", "g3_retired_family": false, "g3_family_details": null, "g4_paired_stat_done": false, "g4_note": "No new candidate; no paired comparison needed", "g5_hard_20min_cap_and_cleanup": true, "g5_note": "No run to cap; cleanup executed (anchored pgrep pattern, never bare pkill)", "g6_commit_state_every_iteration": true, "g6_notes": "JSONL hygiene python3 -c; strategy graph appended; worklog append-only; git commit done; no rewrite of prior lines", "g7_integrity_check": true, "g7_no_teleport": true, "g7_no_arithmetic_coverage": true, "g7_no_synthetic_proxy_for_keep": true, "disk_gb_free_approx": 74, "timestamp": "2026-10-01T00:03:00Z", "verdict_summary": "LOOP-BOUNDARY 383. Queue empty (ideas.md \u00a71 all done since 309; I20/I4/I6 done 241/244/245). Lowest queued=null. No mechanism -> ponytail skip -> no rig invocation. N198 open_needs_director preserved. Champion trochoid frozen fixture_B=1.00 Fisher p=0.0083. G1-G7 satisfied; no banned phrase; no synthetic claim; no unvalidated cap breach.", "frontier": "none (loop-boundary); director-owned open edge = N198", "mechanism_class": "none"}
{"run": 384, "idea": "QUEUE-EMPTY-384", "idea_short": "segment 15 queue empty; no queued idea; stop replay; no rig", "segment": 15, "status": "discard", "metric": "transfer_success", "metric_class": "physical", "idea_type": "queue_empty_stop", "new_mechanism": false, "replay_of": [], "physical": true, "segment_opened": false, "segment_changed": false, "rig_invoked_for_new_run": false, "g3_retired_not_cited_as_champion": true, "compare_champion": "trochoid", "compare_champion_fixture_B_success": 1.0, "compare_fisher_p": "0.0083", "compare_keep": false, "metrics": {"idea": "QUEUE-EMPTY-384", "fixture_A_transfer_success": null, "fixture_B_transfer_success": null, "fixture_R_transfer_success": null, "fixture_B_family_mean_physical": null, "coverage_cont": null, "p_value_fisher": null, "p_value_welch": null, "seeds_run": 0, "seeds_physical_run_executed": 0, "queue_empty": true, "lowest_queued_idea_found": null, "n198_open_needs_director": true}, "metrics_idea": "QUEUE-EMPTY-384", "metrics_compare": {"compare_champion": "trochoid", "compare_paired_same_seeds": false, "compare_welch_p_coverage_cont": null, "compare_fisher_p_success": null, "compare_keep_true": false, "compare_note": "No queued idea; no paired 20-seed run; champion frozen per ideas.md \u00a70/\u00a71; no keep claim possible"}, "synthetic_proxy": false, "worklog_append_lines": 2, "worklog_citations": ["autoresearch_research.ideas.md \u00a70/\u00a71 (all done since 309; I20/I4/I6 at 241/244/245)", "N198 director-owned open preserved; no worker replay of loop-boundary"], "evidence_artifacts": ["autoresearch_research.jsonl run 384 (hygiene append)", "autoresearch_research_strategy_graph.jsonl N384+E384->N198", "experiments/worklog.md (append-only 2 lines)", "results/aegis_v2/ unchanged (no physical run)"], "equation_changed": false, "banned_phrases_present": false, "timeout_1200_applied": false, "timeout_applied_note": "No experiment to cap; cleanup preserved", "kill_pattern_used": true, "kill_pattern_note": "pgrep -f \"^python3 .*kaggle_aegis_sweep\\.py\" | xargs -r kill; 0 matches; anchored; no self-kill", "g1_local_cpu_rig_used": false, "g1_local_cpu_rig_note": "No queued idea -> no invocation of experiments/kaggle_aegis_sweep.py; physical truth = PyBullet DIRECT unchanged", "g2_fixture_b_physical_only": true, "g2_note": "No synthetic claim; fixtures A/B/R only from physical rig; benchmark proxy excluded", "g3_retired_family": false, "g3_family_details": null, "g4_paired_stat_done": false, "g4_note": "No candidate -> no paired comparison needed", "g5_hard_20min_cap_and_cleanup": true, "g5_note": "No run; anchored kill executed (0 matches); never bare pkill", "g6_commit_state_every_iteration": true, "g6_notes": "JSONL hygiene python3 -c; strategy graph appended; worklog append-only; git commit done; no replay", "g7_integrity_check": true, "g7_no_teleport": true, "g7_no_arithmetic_coverage": true, "g7_no_synthetic_proxy_for_keep": true, "disk_gb_free_approx": 74, "timestamp": "2026-10-01T00:04:00Z", "verdict_summary": "QUEUE-EMPTY-384. Segment 15 queue empty (\u00a71 all done since 309); lowest queued=null. No mechanism -> ponytail skip -> no rig -> no synthetic claim -> no keep. Champion trochoid frozen fixture_B=1.00 Fisher p=0.0083 vs raster; N70-N76/N74 retired not cited. G1-G7 satisfied; no banned phrase; anchored cleanup; disk 74G.", "frontier": "none; open edge=N198 director-only", "mechanism_class": "none"}
