{"run": 356, "segment": 15, "status": "keep", "idea": "N207-SOLVER-CONVERGENCE", "metric": 1.0, "metric_name": "fixture_B transfer_success (coverage_cont >= 0.90 per episode), canonical rig, 20 seeds, pose_noise 0,0", "metric_unit": "fixture_B transfer_success of the trochoid champion at AEGIS_SIM_HZ=120/480/960/1920, each paired against SIM_HZ=240 on the SAME seeds", "rig": "experiments/kaggle_aegis_sweep.py (PyBullet DIRECT, system python3, friction U[0.05,0.80], gate_mode=post-hoc); pts_source=physics_contact; every coverage_cont/success recomputed from physics contacts at return time; no teleport, no arithmetic coverage", "command": "AEGIS_SIM_HZ=<hz> timeout 1200 python3 experiments/kaggle_aegis_sweep.py --seeds 20 --no-upload --path trochoid --compare trochoid --compare-env AEGIS_SIM_HZ=240 --suites fixture_A,fixture_B,fixture_R --out results/aegis_v2/N207_r356*_r356.jsonl", "compare_champion": "in-rig --compare trochoid --compare-env AEGIS_SIM_HZ=240 on the SAME 20 seeds -> identical friction/tool/customer draw; the baseline arm IS the frozen 240 Hz rig", "metrics": {"idea": "N207-SOLVER-CONVERGENCE", "seeds": 20, "physical": true, "rig_invoked": true, "fixture_A": 1.0, "fixture_B": 1.0, "fixture_R": 1.0, "coverage_cont": {"120": {"A": 1.0, "B": 1.0, "R": 1.0}, "240": {"A": 1.0, "B": 1.0, "R": 1.0}, "480": {"A": 1.0, "B": 1.0, "R": 1.0}, "960": {"A": 1.0, "B": 1.0, "R": 1.0}, "1920": {"A": 1.0, "B": 1.0, "R": 1.0}}, "coverage_cont_max_shift_over_8x_rate_range": 0.001, "success_all_rates": "20/20 on A, B, R at 120/240/480/960/1920 Hz", "nonsaturated_control_raster_0.03,6": {"240": {"A": 0.9396, "succ": 15}, "960": {"A": 0.9391, "succ": 15}, "240_R": 0.9289, "960_R": 0.9289, "succ_R": "13 -> 13"}, "force_compliance_by_rate": {"120": {"A": 0.306, "B": 1.0, "R": 0.6927}, "240": {"A": 0.4864, "B": 1.0, "R": 0.7548}, "480": {"A": 0.6996, "B": 1.0, "R": 0.8674}, "960": {"A": 0.8329, "B": 1.0, "R": 0.9283}, "1920": {"A": 0.9012, "B": 1.0, "R": 0.9539}}, "force_compliance_240Hz_shortfall": {"fixture_A": -0.415, "fixture_R": -0.199}, "richardson_order_force_compliance": {"fixture_A": 0.97, "fixture_R": 1.25}, "fn_mean_by_rate_A": [0.32555, 0.43173, 0.47323, 0.49304, 0.49387], "fn_std_by_rate_A": [0.32705, 0.36229, 0.28755, 0.20879, 0.14108], "fn_mean_by_rate_R": [0.40373, 0.4606, 0.48372, 0.49287, 0.49402], "fn_std_by_rate_R": [0.13537, 0.17456, 0.13427, 0.09544, 0.07361], "fixture_B_force_flat_at_every_rate": {"fn_std": 0.0089, "force_compliance": 1.0}, "contact_stability_number_sqrt_K_m_dt": {"120": 0.932, "240": 0.466, "480": 0.233, "960": 0.116, "1920": 0.058}, "p_welch_coverage": null, "p_fisher_success": null, "p_note": "rig keep=false for every rate arm BY CONSTRUCTION: the primary metric is saturated at 1.0000 on both sides of every pair, so delta=0 and Fisher p=1.0. This run does not seek a keep on the primary metric; it is a validity audit. The paired records are in the artifacts.", "n207_1_certification_not_an_artifact": true, "n207_2_prior_force_evidence_retired": true, "n207_3_mechanism_contact_ringing": true, "n207_4_force_axis_has_no_dynamic_range_at_any_rate": true, "g1_local_cpu_rig": true, "g2_only_physical": true, "g3_retired_family_touched": false, "g4_paired_20_seeds": true, "g5_timeout_1200_anchored_kill": true, "g6_committed": true, "g7_no_teleport_no_arithmetic_coverage": true, "knob_bug_found_and_fixed": "substeps_for(sim_hz=SIM_HZ) bound the default at def time, so --compare-env was inert; produced a fake fixture_A covc 0.3625 keep=true Welch 1.07e-05. Artifact deleted, not logged. Rule: knobs reachable from both env and --compare-env must read their global at CALL time and be bit-identity-checked against a known-good artifact.", "retires_as_force_evidence": ["N202.2 pooled 25.3% force-violation rate", "N202.4 non-monotone-in-friction compliance", "N205.2 rounded vs raster force deltas", "N205.3 fitro force deltas", "N205.4 fixture-vs-path spread MAGNITUDES"], "novelty_score_banned": true, "sota_gap_claim": false, "validated_candidate_prefix": false}, "description": "N207 SOLVER-RATE CONVERGENCE. Category: rig validity / numerical verification -- a frontier un-attacked in runs 1-355, chosen because the queue was empty since run 309 and the last two iterations produced no new state. All 355 prior runs used exactly ONE integrator setting (240 Hz, 12 substeps per 20 Hz control tick); the rig header itself records the contact stability number sqrt(CONTACT_K/m)*dt = 0.466 at 240 Hz, i.e. UNDER HALF the explicit limit, so the certified fixture_B 1.00 had never been refined. New knob AEGIS_SIM_HZ (default 240, byte-identical) changes ONLY setTimeStep and the substep count per tick; the 20 Hz control tick, commanded arclength speed, phase labels, press law and tick budget are identical at every rate. Sweep 120/240/480/960/1920 Hz x 20 seeds x {A,B,R}, each rate paired in-rig against the frozen 240 Hz champion on the SAME seeds. RESULT 1 (VALIDATES the standing certification): coverage_cont is solver-independent -- an 8x rate range moves it by <1e-3 on all three suites with success 20/20 everywhere, and a non-saturated control (raster at pose noise 0.03,6, where A=0.9396/15-20 and R=0.9289/13-20) reproduces to 0.9391/15-20 and 0.9289/13-20. The champion B=1.00 does not rest on the discretisation; N197/N199 stand. RESULT 2 (FALSIFIES a prior result in this segment): force_compliance is NOT converged at 240 Hz -- strictly monotone in the rate (A 0.3060->0.9012, R 0.6927->0.9539), Richardson order ~1.0/~1.25, 240 Hz sitting -0.415 (A) and -0.199 (R) below the limit. The pooled 25.3% force-violation rate and every force reading built on it (N202.2, N202.4, N205.2-N205.4 magnitudes) are therefore measured at an unconverged operating point and are RETIRED as force evidence; the DIRECTION of N205.4 survives. RESULT 3 (mechanism): under-resolved contact rings -- fn_std falls >2x with the rate while fn_mean rises to within 0.02 N of the 0.5 N setpoint, so the 240 Hz head under-presses and overshoots the band. RESULT 4 (why it was invisible): fixture_B is dead flat (fn_std 0.0089, force_compliance 1.0 at EVERY rate) and the G4 bar reads B -- every force result in this segment is measured on the one suite where the integrator does not matter and reported from the one where the metric has no dynamic range; the force axis has no usable dynamic range at any rate. METHODOLOGY: the knob was first written with a default argument, so --compare-env was silently inert and produced a plausible keep=true Welch 1.07e-05 on a fake fixture_A covc of 0.3625; the artifact was deleted rather than logged, and the audit script now asserts bit-identity of the paired arm.", "artifacts": ["results/aegis_v2/N207_r356_simhz120_r356.jsonl", "results/aegis_v2/N207_r356_simhz480_r356.jsonl", "results/aegis_v2/N207_r356_simhz960_r356.jsonl", "results/aegis_v2/N207_r356c_simhz1920_r356.jsonl", "results/aegis_v2/N207_r356b_covc_raster_960_r356.jsonl", "experiments/N207_solver_audit.py"], "equations_row": "N207", "strategy_graph_nodes": ["N207", "N207b", "N207c", "N207d"], "n198_still_open_needs_director": true, "segment_15_frozen": true, "primary_metric_frozen": true, "tier4_gate_frozen": true, "timestamp": "2026-09-30T23:30:00Z"}
{"run": 357, "segment": 15, "status": "keep", "idea": "N208-SOLVER-ITERATIONS", "metric": 1.0, "metric_name": "fixture_B transfer_success (coverage_cont >= 0.90 per episode), canonical rig, 20 seeds, pose_noise 0,0", "metric_unit": "fixture_B transfer_success of the trochoid champion over the full discretisation dose (5 rates x 3 solver-iteration budgets, 20 seeds, suites A/B/R, every arm paired against the frozen 240 Hz / 80-iteration rig on the SAME seeds)", "rig": "experiments/kaggle_aegis_sweep.py (PyBullet DIRECT, system python3, friction U[0.05,0.80], gate_mode=post-hoc); pts_source=physics_contact; coverage_cont/success recomputed from physics contacts at return time; no teleport, no arithmetic coverage, no synthetic proxy", "command": "AEGIS_SIM_HZ=<hz> AEGIS_SOLVER_ITERS=<iters> timeout 1200 python3 experiments/kaggle_aegis_sweep.py --seeds 20 --no-upload --path <trochoid|rounded|fitro> --compare <trochoid|rounded|raster> --compare-env AEGIS_SIM_HZ=240,AEGIS_SOLVER_ITERS=80 --suites fixture_A,fixture_B,fixture_R --out results/aegis_v2/N208_r357*.jsonl  (7 runs, all exit 0, 0 harness errors, 8.3-32.5 s each)", "compare_champion": "in-rig --compare-env AEGIS_SIM_HZ=240,AEGIS_SOLVER_ITERS=80 on the SAME 20 seeds -> identical friction/tool/customer draw; the baseline arm IS the frozen rig and reproduces run 350/351/356 to <5e-4 on every tracked channel (N207d bit-identity check)", "metrics": {"idea": "N208-SOLVER-ITERATIONS", "seeds": 20, "physical": true, "rig_invoked": true, "new_mechanism": false, "claim_type": "validity_audit", "fixture_A": 1.0, "fixture_B": 1.0, "fixture_R": 1.0, "question": "N207 attributed the force non-convergence to contact ringing but could not separate an integration-RATE cause from a solver-ITERATION cause, because numSolverIterations was the bare literal 80 in all of runs 1-356. The two causes have opposite engineering readings (16x wall clock vs a free knob).", "knob": "AEGIS_SOLVER_ITERS (default 80 = the frozen value, byte-identical arm; registered in KNOB_GLOBALS; read at CALL time per the N207d rule; orthogonal to AEGIS_SIM_HZ by construction). Header now records sim_hz / substeps / solver_iters.", "force_compliance_by_rate_and_iters": {"240/80": {"A": 0.48636, "B": 1.0, "R": 0.75479, "wall_s_per_120eps": 8.3}, "240/320": {"A": 0.48636, "B": 1.0, "R": 0.75479, "wall_s_per_120eps": 8.4}, "240/1280": {"A": 0.48636, "B": 1.0, "R": 0.75479, "wall_s_per_120eps": 8.4}, "960/1280": {"A": 0.83293, "B": 1.0, "R": 0.92829, "wall_s_per_120eps": 13.2}, "3840/80": {"A": 0.93339, "B": 1.0, "R": 0.97125, "wall_s_per_120eps": 32.5}}, "n208_1_cause_is_the_RATE": {"claim": "a 16x iteration budget at a FIXED 240 Hz is EPISODE-IDENTICAL; the non-convergence is an explicit-integration (dt) effect with no free recovery knob", "d_force_compliance_A_240Hz_iters80_to_1280": 0.0, "d_force_compliance_R_240Hz_iters80_to_1280": 0.0, "d_fn_mean_A": 0.0, "d_fn_mean_R": 0.0, "episode_identity": "all 4 tracked channels x 60 episodes bit-identical at 1e-5; wall clock unchanged (8.3 vs 8.4 s)", "rate_interaction": "960 Hz at 1280 iters reproduces 960 Hz at 80 iters to <0.01 -> the two axes do not interact", "cost_of_convergence": "3.9x wall clock (3840 Hz 32.5 s vs 240 Hz 8.3 s per 120 episodes)"}, "n208_1b_positive_control": {"script": "experiments/N208_iter_positive_control.py", "claim": "numSolverIterations demonstrably reaches the engine AND this contact converges by 8 passes, so the inert dose is a property of the contact (2 bodies, 1 contact pair), not an ignored knob", "max_abs_dz_vs_1280_iters": {"1": 0.0002438, "2": 2.958e-05, "4": 7.31e-07, "8": 0.0, "80": 0.0, "1280": 0.0}, "verdict": "ASSERT PASSED (live parameter, 80 already 10x converged)"}, "n208_2_1920Hz_was_NOT_the_asymptote": {"correction_to": "N207.2 which called 1920 Hz the converged limit", "force_compliance_A": {"240": 0.4864, "480": 0.6996, "960": 0.8329, "1920": 0.9012, "3840": 0.9334}, "force_compliance_R": {"240": 0.7548, "480": 0.8674, "960": 0.9283, "1920": 0.9539, "3840": 0.9713}, "increments_A": [0.2132, 0.1334, 0.0683, 0.0322], "richardson_order_A": 0.91, "increments_R": [0.1126, 0.0609, 0.0256, 0.0174], "richardson_order_R": 0.9, "no_arm_is_flat": true, "geometric_tail_estimate": {"A": 0.9621, "R": 1.0078, "claim": "extrapolation only, NOT a convergence claim"}, "fn_mean_has_arrived": "A 0.4939->0.4920, R 0.4940->0.4950, within 0.006 N of the 0.5 N setpoint at 1920 vs 3840 Hz", "fn_std_has_not": "A 0.1411->0.1150, R 0.0736->0.0609 -- the ringing amplitude is still falling"}, "n208_3_retired_force_deltas_were_discretisation_error": {"design": "both N205 contrasts re-measured at 1920 Hz with BOTH arms refined, paired, 20 seeds, same suites; 240 Hz paired p reproduce N205.2/N205.3 exactly", "rounded_minus_raster": {"A": {"d_240": -0.0432, "p_240": 0.08, "d_1920": -0.0106, "p_1920": 0.231, "shrink": 4.1, "sign": "same"}, "R": {"d_240": -0.0179, "p_240": 0.1, "d_1920": -0.0008, "p_1920": 0.825, "shrink": 23.3, "sign": "same"}, "B": {"d_240": 0.0, "d_1920": 0.0, "note": "fixture_B is force-invariant at every rate and every iteration budget"}}, "fitro_minus_trochoid": {"A": {"d_240": 0.0133, "p_240": 0.447, "d_1920": 0.0091, "p_1920": 0.123, "shrink": 1.5, "sign": "same"}, "R": {"d_240": 0.0208, "p_240": 0.036, "d_1920": 0.0035, "p_1920": 0.473, "shrink": 5.9, "sign": "same"}, "B": {"d_240": 0.0, "d_1920": 0.0}}, "verdict": "every delta SHRINKS toward zero under refinement, none flips sign, and the only nominally significant force finding in the segment (fitro on R, paired p 0.036) loses significance at 8x refinement. N207.2's retirement of the force-side conclusions is confirmed WITH a mechanism and a magnitude.", "control": "coverage_cont does NOT shrink (every arm 1.0000, contrast deltas <5e-3), so the shrinking is attributable to the integrator, not to a different sample", "survives": "N205.4's DIRECTION (flat/sloped split is a property of the fixtures): B force_compliance 1.0000 and fn_std 0.0089 at every rate AND every iteration budget"}, "n208_4_coverage_solver_independent_over_the_2D_dose": {"coverage_cont": "1.0000 and 20/20 success in EVERY arm (5 rates x 3 iteration budgets, 20 seeds x {A,B,R})", "extends": "N207.1, which validated the certification over rates only"}, "n208_5_reporting_rule_adopted": "force_compliance may only be quoted with sim_hz / solver_iters in the caption (both now in the rig header). A 240 Hz force number is a LOWER BOUND on the band fraction, not a measurement. N202.2's pooled 25.3% force-violation rate must not appear as a physical result; any remaining force table is reported at >=1920 Hz.", "p_welch_coverage": {"fixture_B": 1.0, "note": "rig keep=false in every arm BY CONSTRUCTION: coverage_cont is 1.0000 on both sides of every paired contrast (saturated), delta 0, Fisher p 1.0. This is a validity audit, not a candidate; NO keep is claimed on the primary metric."}, "p_fisher_success": {"fixture_B": 1.0, "succ_a": 20, "succ_b": 20}, "keep_field_rig": false, "keep_bar": ">=20 seeds AND B transfer_success > 0.70 AND p<0.01 vs the paired champion -- NOT met on the primary metric and not claimed; the audit's claims are the 20-seed paired invariance asserts in experiments/N208_solver_iters_audit.py", "g1_local_cpu_rig": true, "g2_only_physical_fixture_B_transfer": true, "g3_retired_family_touched": false, "g4_paired_20_seeds": true, "g5_timeout_1200_anchored_kill": true, "g6_committed": true, "g7_no_teleport_no_arithmetic_coverage": true, "synthetic_proxy": false, "retires_as_force_evidence": ["N202.2 pooled 25.3% force-violation rate (mechanism + magnitude now measured)", "N205.2 rounded vs raster force deltas (4.1x / 23.3x shrink to zero)", "N205.3 fitro force deltas (1.5x / 5.9x shrink; the p 0.036 result loses significance)", "N205.4 fixture-vs-path spread MAGNITUDES (direction survives)"], "novelty_score_banned": true, "sota_gap_claim": false, "validated_candidate_prefix": false}, "description": "N208 separates N207's two indistinguishable causes for the force non-convergence. The solver ITERATION budget was the bare literal 80 in all of runs 1-356, so the residual was either the integration RATE or the ITERATION count. A new knob AEGIS_SOLVER_ITERS (default 80 = frozen, call-time read, orthogonal to SIM_HZ) settles it: 4x and 16x the iterations at a fixed 240 Hz are EPISODE-IDENTICAL on every tracked channel with unchanged wall clock, and 960 Hz at 16x iterations reproduces 960 Hz at 80 -- the non-convergence is entirely explicit-integration ringing, with NO free recovery knob and a 3.9x wall-clock price for convergence. A positive control proves the parameter is live (1 pass differs by 2.44e-04 m) and that this 2-body contact converges by 8 passes, so 80 was already 10x converged. Two further results: 3840 Hz shows 1920 Hz was NOT the asymptote N207 called it (A 0.9012->0.9334, R 0.9539->0.9713, order ~0.90, no arm flat), and the force deltas N207 retired were largely discretisation error that CONVERGES TO ZERO -- every N205 contrast shrinks 1.5-23.3x and loses significance, with coverage_cont as the control that does not shrink. coverage_cont is solver-independent over the full 2D dose, so the champion's B = 1.00 does not rest on any axis of the discretisation this rig can vary. Validity audit, new_mechanism=false, no keep claimed on the primary metric.", "artifacts": ["results/aegis_v2/N208_r357_control_240x80_r357.jsonl", "results/aegis_v2/N208_r357a_iters320_r357.jsonl", "results/aegis_v2/N208_r357b_iters1280_r357.jsonl", "results/aegis_v2/N208_r357c_simhz3840_r357.jsonl", "results/aegis_v2/N208_r357d_960_iters1280_r357.jsonl", "results/aegis_v2/N208_r357e_rounded_1920_r357.jsonl", "results/aegis_v2/N208_r357f_fitro_1920_r357.jsonl", "experiments/N208_solver_iters_audit.py", "experiments/N208_iter_positive_control.py", "equations.md ROW N208"], "equations_row": "N208", "strategy_graph_nodes": ["N208", "N208a", "N208b", "N208c", "N208d"], "n198_still_open_needs_director": true, "segment_15_frozen": true, "primary_metric_frozen": true, "tier4_gate_frozen": true, "timestamp": "2026-09-30T23:40:00Z"}
