{"id":"N696-refuse-FACC-iter14","metric":0,"parent":"N695-refuse-FACC-iter13","status":"invalid","strategy":"refuse-G3-replay-iter14; director FAAA proposal (SE3-conditioned FACC / energy-based physical in-context attention / affordance-equivalence; predicts KEEP 82); family permanently retired (N70-N76, eq78, N74 synthetic); 16th replay (682-696); queue empty; no queued idea; no physical rig; refusal prevents G7-invalid fabricated KEEP","timestamp":1791212400,"type":"node","segment":15,"run":696,"idea":"FAAA/FACC-SE3","compare_keep":false,"rig_invoked":false,"synthetic_proxy":false,"banned_phrases_absent":true}
{"from":"N695-refuse-FACC-iter13","to":"N696-refuse-FACC-iter14","kind":"refused-replay","type":"edge","note":"Iter-14 single-brain fallback refused (muse-spark-1.3-contributor-free); 16th replay; FD=retired; open N198/N478d/N478e need director auth"}
{"from":"N696-refuse-FACC-iter14","to":"N74","kind":"retired-family-reference","type":"edge","note":"Ref to permanently retired synthetic champion N74 92.3; not cited in claim; family frozen"}
{"id":"N697-refuse-FACC-iter15","metric":0,"parent":"N696-refuse-FACC-iter14","status":"invalid","strategy":"refuse-G3-replay-iter15; director FACP proposal (SE3-conditioned force-adaptive contact policy / dynamic affordance manifold / energy-based physical in-context attention / flow-match->affordance-equivalence); predicts KEEP 78/100; permanently retired manifold-switch/flow-bridge/energy-gated family (N70-N76, eq78); 17th replay (682-697); queue empty; no queued idea; canonical rig unpairable (no pi0/head); refusal prevents G7-invalid fabricated KEEP; champion trochoid B=1.00 verified","timestamp":1791212400,"type":"node","segment":15,"run":697,"idea":"FACP/FACC-SE3-dynamic","compare_keep":false,"rig_invoked":false,"synthetic_proxy":false,"banned_phrases_absent":true,"no_remote_gpu_deferred_phrase":true,"no_same_dependency_deferred":true,"g3_retired_families_not_cited":true}
{"from":"N696-refuse-FACC-iter14","to":"N697-refuse-FACC-iter15","kind":"refused-replay","type":"edge","note":"Iter-15 single-brain fallback refused (muse-spark-1.3 contributor-free); 17th replay; FD=retired; open N198/N478d/N478e require director auth; no physical invocation; no synthetic claim"}
{"from":"N697-refuse-FACC-iter15","to":"N74","kind":"retired-family-reference","type":"edge","note":"Reference to permanently retired synthetic champion N74 92.3; family frozen; not cited in claim; G3 hard"}
{"run":698,"node":"N698-refuse-FACC-iter16","kind":"node","type":"refusal","idea":"FACC / SE(3)-Conditioned Force-Adaptive Contact Control (director iter 16, single-brain fallback: opencode-responses/muse-spark-1.3-contributor-free)","status":"invalid","segment":15,"family":"energy-gated / FACC / EBM / SE3 / manifold-switch (G3 retired)","quant":"predicted KEEP 78/100; refused 17th replay (runs 682-698)","physical_rig_invoked":false,"compare_champion":"trochoid","compare_env":"0,0 (refused replay)","compare_keep":false,"evidence":"results/aegis_v2/n698_facc_replay_refusal.jsonl","note":"G3 hard retirement; no synthetic claim; director iter-16 refused; queue empty; force-axis N479 DISCARD; pose-noise frontier 0.32,64->0.80,160 certified; no new axis executed."}
{"from":"N697-refuse-FACC-iter15","to":"N698-refuse-FACC-iter16","kind":"refused-replay","type":"edge","note":"Iter-16 single-brain fallback refused (muse-spark-1.3 contributor-free); 17th replay in cycle; FD=retired (N70-N76/eq78); open N198/N478d/N478e require director auth; no physical invocation; no synthetic claim; queue empty (§0)."}
{"run":699,"node":"N699-refuse-FACC-iter17","kind":"node","type":"refusal","idea":"FACC / SE(3)-Conditioned Force-Adaptive Contact Control w/ Energy-Based Physical In-Context Attention (director iter 17, single-brain fallback: opencode-responses/muse-spark-1.3-contributor-free)","status":"invalid","segment":15,"family":"energy-gated / FACC / EBM / SE3 / manifold-switch / flow-bridge (G3 retired)","quant":"predicted KEEP 78/100; refused; 18th replay (runs 682-699); 0 seeds; 0 episodes; rig uninvoked","physical_rig_invoked":false,"compare_champion":"trochoid","compare_env":"0,0 (refused replay)","compare_keep":false,"evidence":"results/aegis_v2/n699_facc_replay_refusal.jsonl","note":"G3 hard retirement (N70-N76, eq78, synthetic N74 92.3 frozen); queue empty (§0); lowest queued absent (§1); 18th refusal of same family this segment; no executable arm in kaggle_aegis_sweep.py; refusal prevents G7-invalid claim; open director-owned N198/N478d/N478e not replayable; force-axis N479 DISCARD; pose-noise certified 0.32,64-0.80,160; no synthetic proxy; cleanup done (anchored reap, no orphan >40min, disk ~71GB)."}
{"from":"N698-refuse-FACC-iter16","to":"N699-refuse-FACC-iter17","kind":"refused-replay","type":"edge","note":"Iter-17 single-brain fallback refused (opencode-responses/muse-spark-1.3-contributor-free); 18th replay of eq78/FACC/SE3/energy-gated; family permanently retired (G3); queue empty; no queued idea; no physical invocation; refusal upheld; open N198/N478d/N478e need director auth, not replay."}
{"from":"N699-refuse-FACC-iter17","to":"N74","kind":"retired-family-reference","type":"edge","note":"Reference to permanently retired synthetic champion N74 92.3; family frozen by G3; never cited in claim; not extended; refusal only."}
{"from":"N699-refuse-FACC-iter17","to":"N700-refuse-FACC-iter18","kind":"refused-replay","type":"edge","note":"Iter-18 single-brain fallback refused (opencode-responses/muse-spark-1.3-contributor-free); 19th replay of eq78/FACC/SE3/energy-gated; family permanently retired (G3); queue empty (§0 §1); no queued idea; rig uninvoked; refusal upheld; open N198/N478d/N478e need director auth, not replay."}
{"from":"N700-refuse-FACC-iter18","to":"N74","kind":"retired-family-reference","type":"edge","note":"Reference to permanently retired synthetic champion N74 92.3; family frozen by G3; never cited in claim; not extended; refusal only."}
{"id": "N700-refuse-FACC-iter18", "kind": "node", "label": "FACC replay refusal iter 18", "status": "invalid", "segment": 15, "metric": "fixture_B_transfer_success", "run": 700, "family": "eq78/FACC/SE3/energy-gated", "retired_by": "G3", "physical_episodes": 0, "compare_keep": false}
{"id": "N700-refusal-logic", "kind": "node", "label": "G3 refusal logic (iter 18) length: refusal is mechanism; replay is not a lever", "status": "locked"}
{"id": "FACC-SE3", "metric": 78.0, "parent": "N84", "status": "unvalidated", "strategy": "Force-Adaptive Contact Control SE3: dynamic affordance field energy E_dynamic + A_sel softmax over contact physics; bridge flow-match->affordance-equivalence; head-swap only; physical 20-seed fixture_B vs trochoid=identical (covc=1.00, delta 0, p=1.0) because scripted controller unchanged; actual dynamic head NOT injected; no keep", "timestamp": 1791213174.2492793, "type": "node", "idea": "FACC-SE3", "segment": 15, "physical_file": "results/aegis_v2/facc_se3_iter19.jsonl", "compare_champion": "trochoid", "keep": false, "novelty_score": 78}
{"from": "N84", "to": "FACC-SE3", "kind": "derived", "label": "energy-based cross-edge; dynamic field replaces fixed pi0 head; first bridge flow-matching->affordance-equivalence", "timestamp": 1791213174.2492802, "idea": "FACC-SE3", "physical_status": "unvalidated"}
{"id": "I84-FACC-EA", "metric": 0.0, "parent": "N84", "status": "unvalidated", "strategy": "FACC-EA force-adaptive contact control + SE(3)-conditioned dynamic affordance energy; synthetic proxy excluded; physical rig integration pending; keep bar 0.70 not met", "timestamp": 1791213308, "type": "node"}
{"from": "N84", "kind": "derived", "to": "I84-FACC-EA", "type": "edge"}
{"id": "ITER21-FACC-DIRECTOR-702", "run": 702, "idea_tag": "N198/FACC-director-decision (NOT queued; open_needs_director)", "status": "discard", "kind": "node", "type": "director_proposal_unexecuted", "queue_empty_confirmed": true, "predicted_score": 78, "physical_run": false, "compare_keep": false, "unvalidated_cap_ok": true, "banned_phrases_absent": true, "note": "Segment 15. No queued idea in v3/v4 tables (confirmed by \u00a70 and JSONL max run 701). Director FACC (SE3-conditional force-adaptive, energy-attention, flow->affordance-equivalence bridge) remains director-owned; not executed. Canonical rig local CPU only; no remote GPU deferred phrase used.", "value_predicted": 78, "value_verified": null, "falsifies_pi0_fixed_manifold": true, "segment": 15, "protocol_version": "v3"}
{"from": "FRONTIER-FACC-SE3-701", "to": "ITER21-FACC-DIRECTOR-702", "kind": "edge", "type": "director_proposal_link", "note": "Iter 21 (single-brain fallback). Queue empty => proposal logged but not run; no physical Fixture-B evidence artifact.", "run_from": 701, "run_to": 702}
{"id": "ITER22-FACC-DIRECTOR-703", "run": 703, "idea_tag": "I84-FACC-EA / muse-spark-1.3 (AAEF, FACC replaces flow-matching)", "status": "discard", "kind": "node", "type": "director_decision_unexecuted_mechanism_absent_from_rig", "queue_empty_confirmed": true, "predicted_score": 78, "physical_run": false, "compare_keep": false, "unvalidated_cap_ok": false, "unvalidated_cap_used": "701+497", "banned_phrases_absent": true, "note": "Iter 22 single-brain fallback. \u00a70 queue empty. Unvalidated cap exceeded (FACC-SE3 701 + I84 497); FACC controller not in kaggle_aegis_sweep.py; synthetic proxy excluded (G2); no paired 20-seed decider possible; G7 integrity preserved (no arithmetic coverage, no teleport). Champion trochoid B=1.00 / Fisher 0.0083 frozen. No deferred phrase (G1). Open N198/N478d/N478e stay director-owned.", "value_predicted": 78, "value_verified": null, "segment": 15, "protocol_version": "v3", "equation_changed": false}
{"from": "ITER21-FACC-DIRECTOR-702", "to": "ITER22-FACC-DIRECTOR-703", "kind": "edge", "type": "director_decision_sequence_refused", "note": "Iter 22 extends iterator 21 refusal; mechanism still absent from physical rig; unvalidated cap now exceeded; no synthetic claim; discard prevails.", "run_from": 702, "run_to": 703}
{"id": "ITER23-FACC-DIRECTOR-704", "run": 704, "idea_tag": "N198/director-FACC-iter23 (muse-spark-1.3-contributor-free / SE(3)-FACC/energy-gated)", "status": "invalid", "kind": "node", "type": "director_decision_refused_replay_20", "queue_empty_confirmed": true, "predicted_score": 78, "physical_run": false, "compare_keep": false, "unvalidated_cap_ok": false, "unvalidated_cap_used": "701+497 (cap exceeded)", "banned_phrases_absent": true, "note": "Iter 23 single-brain fallback (opencode-responses/muse-spark-1.3-contributor-free). 20th replay refusal of eq78/FACC/SE3/energy-gated family (G3 permanently retired: N70-N76, eq78, synthetic champion N74 frozen). Queue empty (\u00a70 \u00a71 \u00a74). No queued idea; mechanism (SE(3)-equivariant diffusion head + energy-based in-context attention) absent from kaggle_aegis_sweep.py; no paired 20-seed Fixture-B decider possible. Synthetic proxy (restroom_sim) excluded per G1/G2. No arithmetic coverage, no teleport (G7). Canonical rig local CPU; no remote GPU/deferred phrase. Champion trochoid B=1.00 / Fisher p=0.0083 verified; open N198/N478d/N478e remain director-owned, not replayable.", "value_predicted": 78, "value_verified": null, "segment": 15, "protocol_version": "v3", "equation_changed": false}
{"from": "ITER22-FACC-DIRECTOR-703", "to": "ITER23-FACC-DIRECTOR-704", "kind": "edge", "type": "director_decision_sequence_refused_20th", "note": "Iter 23 refusal; replay family permanently retired; unvalidated cap exceeded; mechanism never entered rig; refusal upheld; no synthetic claim.", "run_from": 703, "run_to": 704}
{"id": "ITER24-FACC-DIRECTOR-705", "run": 705, "idea_tag": "FACC iter-1 single-brain fallback (SE3-conditioned residual over affordance-equivalence classes)", "status": "invalid", "kind": "node", "type": "director_decision_refused_replay_21", "queue_empty_confirmed": true, "predicted_score": 82, "physical_run": false, "compare_keep": false, "segment": 15, "protocol_version": "v3", "note": "21st replay refusal of eq78/FACC/SE3/energy-gated family (G3 retired: N70-N76, eq78, N74 frozen). Queue empty (s0 run 497; s1 no queued; N198/N478d/N478e director-owned). No rig invocation; no synthetic claim; no equation change."}
{"from": "ITER23-FACC-DIRECTOR-704", "to": "ITER24-FACC-DIRECTOR-705", "kind": "edge", "type": "director_decision_sequence_refused_21st", "run_from": 704, "run_to": 705, "note": "Iter-1 (new cycle) FACC proposal refused; same retired family; queue still empty; no physical invocation."}
{"id": "ITER25-FACC-DIRECTOR-706", "run": 706, "idea_tag": "FACC-E iter-2 single-brain fallback (SE3-conditioned EBM scorer replacing pi0 flow-match head)", "status": "invalid", "kind": "node", "type": "director_decision_refused_replay_22", "queue_empty_confirmed": true, "predicted_score": 82, "physical_run": false, "compare_keep": false, "segment": 15, "protocol_version": "v3", "note": "22nd replay refusal of eq78/FACC/SE3/energy-gated family (G3 retired: N70-N76, eq78, N74 frozen). Queue empty (s0 run 497; s1 no queued; N198/N478d/N478e director-owned). No rig invocation; no synthetic claim; no equation change."}
{"from": "ITER24-FACC-DIRECTOR-705", "to": "ITER25-FACC-DIRECTOR-706", "kind": "edge", "type": "director_decision_sequence_refused_22nd", "run_from": 705, "run_to": 706, "note": "Iter-2 (new cycle) FACC-E proposal refused; same retired family; queue still empty; no physical invocation."}
{"id": "ITER26-FACC-DIRECTOR-707", "run": 707, "idea_tag": "FACC-ADF iter-3 single-brain fallback (affordance-deformation field + force-gated residual replacing flow-matching head)", "status": "invalid", "kind": "node", "type": "director_decision_refused_replay_23", "queue_empty_confirmed": true, "predicted_score": 78, "physical_run": false, "compare_keep": false, "segment": 15, "protocol_version": "v3", "note": "23rd replay refusal of eq78/FACC/SE3/energy-gated family (G3 retired: N70-N76, eq78, N74 frozen). Queue empty (s0 run 497; s1 no queued; N198/N478d/N478e director-owned). No rig invocation; no synthetic claim; no equation change."}
{"from": "ITER25-FACC-DIRECTOR-706", "to": "ITER26-FACC-DIRECTOR-707", "kind": "edge", "type": "director_decision_sequence_refused_23rd", "run_from": 706, "run_to": 707, "note": "Iter-3 FACC-ADF proposal refused; same retired family; queue still empty; no physical invocation."}
{"id": "ITER27-FACC-DIRECTOR-708", "run": 708, "idea_tag": "FACC iter-4 single-brain fallback (SE3-conditioned contact policy replacing flow-matching head)", "status": "invalid", "kind": "node", "type": "director_decision_refused_replay_24", "queue_empty_confirmed": true, "predicted_score": 78, "physical_run": false, "compare_keep": false, "segment": 15, "protocol_version": "v3", "note": "24th replay refusal of eq78/FACC/SE3/energy-gated family (G3 retired: N70-N76, eq78, N74 frozen). Queue empty (s0 run 497; s1 no queued; N198/N478d/N478e director-owned). No rig invocation; no synthetic claim; no equation change."}
{"from": "ITER26-FACC-DIRECTOR-707", "to": "ITER27-FACC-DIRECTOR-708", "kind": "edge", "type": "director_decision_sequence_refused_24th", "run_from": 707, "run_to": 708, "note": "Iter-4 FACC proposal refused; same retired family; queue still empty; no physical invocation."}
{"id": "ITER28-FACC-DIRECTOR-709", "run": 709, "idea_tag": "FACC iter-5 single-brain fallback (SE3-conditioned energy-based in-context attention replacing flow-matching head)", "status": "invalid", "kind": "node", "type": "director_decision_refused_replay_25", "queue_empty_confirmed": true, "predicted_score": 78, "physical_run": false, "compare_keep": false, "segment": 15, "protocol_version": "v3", "note": "25th replay refusal of eq78/FACC/SE3/energy-gated family (G3 retired: N70-N76, eq78, N74 frozen). Queue empty (s0 run 497; s1 no queued; N198/N478d/N478e director-owned). No rig invocation; no synthetic claim; no equation change."}
{"from": "ITER27-FACC-DIRECTOR-708", "to": "ITER28-FACC-DIRECTOR-709", "kind": "edge", "type": "director_decision_sequence_refused_25th", "run_from": 708, "run_to": 709, "note": "Iter-5 FACC proposal refused; same retired family; queue still empty; no physical invocation."}
{"id": "ITER29-FACC-DIRECTOR-710", "run": 710, "idea_tag": "FACC-SE3 iter-6 single-brain fallback (SE3-conditioned EBM action-expert replacing flow-matching head)", "status": "invalid", "kind": "node", "type": "director_decision_refused_replay_26", "queue_empty_confirmed": true, "predicted_score": 82, "physical_run": false, "compare_keep": false, "segment": 15, "protocol_version": "v3", "note": "26th replay refusal of eq78/FACC/SE3/energy-gated family (G3 retired: N70-N76, eq78, N74 frozen). Queue empty (s0 run 497; s1 no queued; N198/N478d/N478e director-owned). No rig invocation; no synthetic claim; no equation change."}
{"from": "ITER28-FACC-DIRECTOR-709", "to": "ITER29-FACC-DIRECTOR-710", "kind": "edge", "type": "director_decision_sequence_refused_26th", "run_from": 709, "run_to": 710, "note": "Iter-6 FACC-SE3 proposal refused; same retired family; queue still empty; no physical invocation."}
{"id": "ITER30-FACC-DIRECTOR-711", "run": 711, "idea_tag": "FACC iter-7 single-brain fallback (SE3-conditioned energy-based in-context attention replacing flow-matching head)", "status": "invalid", "kind": "node", "type": "director_decision_refused_replay_27", "queue_empty_confirmed": true, "predicted_score": 82, "physical_run": false, "compare_keep": false, "segment": 15, "protocol_version": "v3", "note": "27th replay refusal of eq78/FACC/SE3/energy-gated family (G3 retired: N70-N76, eq78, N74 frozen). Queue empty (s0 run 497; s1 no queued; N198/N478d/N478e director-owned). No rig invocation; no synthetic claim; no equation change."}
{"from": "ITER29-FACC-DIRECTOR-710", "to": "ITER30-FACC-DIRECTOR-711", "kind": "edge", "type": "director_decision_sequence_refused_27th", "run_from": 710, "run_to": 711, "note": "Iter-7 FACC proposal refused; same retired family; queue still empty; no physical invocation."}
{"id": "ITER31-FACC-DIRECTOR-712", "run": 712, "idea_tag": "FACC iter-8 single-brain fallback (SE3-conditioned energy-based in-context attention replacing flow-matching head)", "status": "invalid", "kind": "node", "type": "director_decision_refused_replay_28", "queue_empty_confirmed": true, "predicted_score": 78, "physical_run": false, "compare_keep": false, "segment": 15, "protocol_version": "v3", "note": "28th replay refusal of eq78/FACC/SE3/energy-gated family (G3 retired: N70-N76, eq78, N74 frozen). Queue empty (s0 run 497; s1 no queued; N198/N478d/N478e director-owned). No rig invocation; no synthetic claim; no equation change."}
{"from": "ITER30-FACC-DIRECTOR-711", "to": "ITER31-FACC-DIRECTOR-712", "kind": "edge", "type": "director_decision_sequence_refused_28th", "run_from": 711, "run_to": 712, "note": "Iter-8 FACC proposal refused; same retired family; queue still empty; no physical invocation."}
{"id": "ITER32-FACC-DIRECTOR-713", "run": 713, "idea_tag": "FACC-E iter-9 single-brain fallback (energy-based affordance attention replacing flow-matching head)", "status": "invalid", "kind": "node", "type": "director_decision_refused_replay_29", "queue_empty_confirmed": true, "predicted_score": 78, "physical_run": false, "compare_keep": false, "segment": 15, "protocol_version": "v3", "note": "29th replay refusal of eq78/FACC/SE3/energy-gated family (G3 retired: N70-N76, eq78, N74 frozen). Queue empty (s0 run 497; s1 no queued; N198/N478d/N478e director-owned). No rig invocation; no synthetic claim; no equation change."}
{"from": "ITER31-FACC-DIRECTOR-712", "to": "ITER32-FACC-DIRECTOR-713", "kind": "edge", "type": "director_decision_sequence_refused_29th", "run_from": 712, "run_to": 713, "note": "Iter-9 FACC-E proposal refused; same retired family; queue still empty; no physical invocation."}
{"id": "ITER33-FACC-DIRECTOR-714", "run": 714, "idea_tag": "FACC iter-10 single-brain fallback (SE(3)-conditioned dynamic manifold, energy-based attention replacing flow-matching head)", "status": "invalid", "kind": "node", "type": "director_decision_refused_replay_30", "queue_empty_confirmed": true, "predicted_score": 82, "physical_run": false, "compare_keep": false, "segment": 15, "protocol_version": "v3", "note": "30th replay refusal of eq78/FACC/SE3/energy-gated family (G3 retired: N70-N76, eq78, N74 frozen). Queue empty; no physical invocation."}
{"from": "ITER32-FACC-DIRECTOR-713", "to": "ITER33-FACC-DIRECTOR-714", "kind": "edge", "type": "director_decision_sequence_refused_30th", "run_from": 713, "run_to": 714, "note": "Iter-10 FACC proposal refused; same retired family; queue still empty; no physical invocation."}
{"id": "ITER34-FACC-DIRECTOR-715", "run": 715, "idea_tag": "FACC iter-11 single-brain fallback (SE3-conditioned energy policy replacing flow-matching head)", "status": "invalid", "kind": "node", "type": "director_decision_refused_replay_31", "queue_empty_confirmed": true, "predicted_score": 81, "physical_run": false, "compare_keep": false, "segment": 15, "protocol_version": "v3", "note": "31st replay refusal of eq78/FACC/SE3/energy-gated family (G3 retired: N70-N76, eq78, N74 frozen). Queue empty; no physical invocation."}
{"from": "ITER33-FACC-DIRECTOR-714", "to": "ITER34-FACC-DIRECTOR-715", "kind": "edge", "type": "director_decision_sequence_refused_31st", "run_from": 714, "run_to": 715, "note": "Iter-11 FACC proposal refused; same retired family; queue still empty; no physical invocation."}
