{"run": 493, "commit": "HEAD", "segment": 15, "idea": "FACC-SE3-ITER13", "idea_short": "Director iter 13 (muse-spark-1.3): SE(3)-equivariant Force-Adaptive Contact Control \u2014 REFUSED (52nd G3 replay)", "status": "discard", "timestamp": "2026-10-02T13:15:00Z", "metric_name": "fixture_B transfer_success (coverage_cont >= 0.90), canonical rig v2, DIRECT", "metric_class": "physical", "metric_class_note": "physical only; refusal before execution; synthetic_proxy excluded per G2/G7; 0 episodes; 0 rig bytes changed", "director_decision": {"iteration": 13, "idea": "FACC-SE3: SE(3)-equivariant force-adaptive residual; energy-attention + dynamic field + flow-bridge; predicted 78 pts", "predicted_score": 78, "executed": false, "exclusion_reasons": ["G3 PERMANENT RETIREMENT (2026-09-26): eq78/N70-N76/manifold-switch/flow-bridge/energy-gated/EBM/SE3/DAEF/FACC family permanently retired (energy-modulation collapses real contact dynamics, variance 0.9459 vs 0.2432; N477 kill-rule 481 boundary 0.32m/64deg). FACC-SE3-ITER13 = 52nd replay; label rotation does NOT change mechanism class.", "G4 UNPAIRABLE: PATH_MODES carries 0 injectable SE3/energy/manifold/FACC-head hook (only RESIDUAL_HOOK_FN I3-owned); no paired 20-seed Fixture-B arm vs trochoid champion.", "G7 INTEGRITY: predicted-only 78pts invalid; synthetic N74 92.3 frozen unconditionally; no physical compare.keep:true artifact for any replay.", "G2 QUEUE EMPTY / N477 COMPLETE: N477 executed runs 476-481 (7440 eps); kill-rule 481 at B=0.00 H=1.2; boundary 0.32m/64deg; no queued mechanism since 309; N198 open_needs_director.", "G1 CANONICAL RIG: python3 experiments/kaggle_aegis_sweep.py (DIRECT, system python3, 20 seeds, U[0.05,0.80]) \u2014 NO invocation (refusal before execution); no deferred-language phrases.", "G5 CLEANUP: reap_orphans() verified; anchored pgrep; no orphan held (0 invocation); timeout 1200 not triggered.", "G6 STATE: refusal logged; JSONL appended; graph updated; worklog appended (<=10 lines, append-only); equations.md verified unchanged; commit executed."]}, "physical_action_taken": "REFUSED before any rig invocation (52nd replay of G3-retired mechanism family; mechanism class unchanged by label rotation SE3/deformable/dynamic-manifold/energy-attention/flow-bridge). Health-check NOT required: champion trochoid frozen B=1.00 at 0,0 (run 72, Fisher p=0.0083; certified through 0.32,64 H=0.6/n=32 via runs 476-481). 0 episodes; 0 rig bytes changed; no synthetic_proxy promotion.", "rig_invoked": false, "rig_exit": 0, "episodes": 0, "harness_errors": 0, "rig_bytes_changed": false, "pose_noise_cfg": "N/A (refusal before execution \u2014 mechanism class retired; no paired arm)", "evidence": ["autoresearch_research.jsonl:run=493", "autoresearch_research.ideas.md (\u00a70: no queued mechanism; \u00a74: N477 complete; G3 retired family; N198 open_needs_director)", "autoresearch_research_strategy_graph.jsonl (N493 refusal node + replay-refused-52nd edge)", "experiments/worklog.md (append-only, this entry <=10 lines)", "results/aegis_v2/N476_r476_H06_n0.32_64.jsonl", "results/aegis_v2/N477_r481_*", "equations.md (unchanged; mechanism refused before equation build; family covered by rows 78/82/84)"], "metrics": {"idea": "FACC-SE3-ITER13", "idea_short": "FACC-SE3 iter-13 (refused \u2014 52nd G3 replay)", "metric_class": "physical", "fixture_A_success": null, "fixture_B_success": null, "fixture_R_success": null, "transfer_success": null, "seeds": 0, "episodes": 0, "compare_champion": "trochoid (fixture_B B=1.00 at 0,0; frozen champion; Fisher p=0.0083 vs raster run 72; certified through 0.32,64 at H=0.6/n=32)", "compare_keep": false, "new_mechanism": false, "replay_of_retired_family": true, "retired_family_ids": ["eq78", "N70", "N71", "N72", "N73", "N74", "N75", "N76", "FACC", "FACC-SE3", "FACC-E", "VM-FACC", "FACC-DM", "DAEF", "EBM", "SEAFC", "SE3-EBAA", "FACC-SE3-CONDITIONED", "FACC-SE3-ITER6", "FACC-SE3-ITER7", "FACC-SE3-ITER8", "FACC-SE3-ITER9", "FACC-E-ITER10", "FACC-SE3-ITER11", "FACC-SE3-ITER12", "FACC-SE3-ITER13"], "replay_count": 52, "queue_status_at_start": "empty (N477 complete 476-481; kill-rule 481 at 0.40,80 H=1.2 B=0.00; boundary 0.32m/64deg H=0.6/n=32; no queued mechanism since run 309; N198 open_needs_director)", "synthetic_proxy": null, "predicted_score_refused": 78, "predicted_score_valid_for_keep": false, "n477_kill_rule_triggered": true, "n477_final_boundary_m_deg": "0.32 m / 64 deg (H=0.6/n=32 certified KEEP; H>0.6 DISCARD at 0.40,80 / 0.48,96)", "champion_frozen": "trochoid B=1.00 at 0,0 (run 72; Fisher p=0.0083 vs raster)", "physical_rig_invoked": false, "episodes_for_idea": 0, "episodes_for_health_check": 0}, "gates_unchanged": {"segment": 15, "primary_metric": "fixture_B_transfer_success", "tier4_gate": "post-hoc tag preserved; untouched (in-loop I7 kept separately at run 169; no mechanism change executed)", "no_new_segment": true, "no_metric_move": true, "no_gate_change": true, "no_candidate_promoted": true, "new_unvalidated_row_added": false, "new_keep_claim": false, "new_synthetic_row": false}, "verdict": "DISCARD (52nd G3 retired-family replay refused before execution; mechanism class unchanged by label rotation SE3/deformable/dynamic-manifold/energy-attention/flow-bridge/affordance-equivalence; 0 episodes; freeze champion trochoid B=1.00; queue empty since N477 kill-rule 481; N198 open_needs_director unchanged; segment 15 unchanged; metric frozen; no synthetic_proxy; equations.md unchanged; worklog/graph/JSONL updated; commit executed)", "worklog_append_required": true, "graph_update_required": true, "novelty_verified": false, "prior_art_cited": "None (G3 replay \u2014 mechanism family permanently retired 2026-09-26; synthetic champion N74 92.3 frozen unconditionally; mechanism class identical to retired eq78/EBM/energy-attention/flow-bridge; no new paradigm; no verified equation change)", "evidence_artifacts_complete": true, "unvalidated_cap_consumed_segment_15": 0, "unvalidated_cap_remaining_segment_15": 1, "equation_changed": false, "equation_verified_unchanged": true, "equation_row_coverage_confirmed": "78 (N76b family) + 82 (N84 frontier) + 84 (FACC-SE3 replay) sufficient for retired mechanism family; no new equation row added (mechanism refused before equation build; family covered by existing replay rows)", "edge_budget_check_performed": false, "banned_phrases_check": "PASS \u2014 no remote GPU deferred/deferred to remote GPU/same dependency phrases; G5 anchored pgrep verified; no synthetic_proxy claim; no proxy/gain/deferred language", "replay_family": "G3-retired (eq78 / N70-N76 / manifold / flow-bridge / energy-gated / EBM / SE3 / DAEF / FACC / FACC-SE3 / SEAFC / VM-FACC / FACC-SE3-ITER13 series)", "replay_count": 52, "refused_before_execution": true, "ponytail_note": "Lazy refusal: G3 retirement (52nd replay of same mechanism class: SE3 + energy-attention + flow-bridge + dynamic-manifold/affordance-equivalence) + G4 unpairability eliminates any build. Queue empty since N477 kill-rule (481, boundary 0.32m/64deg). Champion trochoid frozen B=1.00. Zero episodes; zero rig bytes changed; no equation change; no deferred/proxy phrases; no synthetic promotion. Shortest working refusal.", "frontier_status": "REUSED \u2014 same mechanism family as N75/N76/N77/N79/N83/N84/ITER6-ITER12; no genuinely new mechanism; label rotation does NOT change mechanism class per G3 retirement evidence (autoresearch_research.md \u00a716). N477 family kill-rule confirms mechanism family fails past 0.32m/64deg.", "next_action_required": "Director (N198 open_needs_director): (a) propose genuinely new mechanism family with injectable PATH_MODES hook (not eq78/manifold/flow-bridge/energy-gated/EBM/SE3/DAEF/FACC); (b) confirm segment 15 closure (champion trochoid B=1.00 certified through 0.32,64); or (c) request director approval to open segment 16 (segment freeze G6; metric freeze G2)."}
{"run": 494, "segment": 15, "idea": "N478-CAST-LATTICE", "timestamp": "2026-10-02T14:00:00Z", "idea_short": "N192 cast-lattice dose on the N453b ESTIMATOR frontier: AEGIS_REG_CASTS=0 (k x k +-H window lattice, k=ceil(6 sigma_t/d)+1) vs paired AEGIS_REG_CASTS=1, H=0.6 n=32 REG=depth ROW_CENTRE=1. Moves the certified fixture_B pose-noise frontier 0.32 m/64 deg -> 0.80 m/160 deg at B=1.00. KEEP.", "status": "keep", "metric_name": "fixture_B transfer_success (coverage_cont >= 0.90 per episode), canonical rig v2, PyBullet DIRECT", "metric_class": "physical", "refused_proposal": {"idea": "VMEAF (Variable-Manifold Energy-Affordance Flow, director iter 16, predicted 76)", "status": "discard", "reason": "53rd replay of the G3-permanently-retired family (eq78/N70-N76/manifold-switch/flow-bridge/energy-gated/EBM/SE3/DAEF/FACC). A fixed-vs-variable affordance manifold bridged by flow matching IS the retired manifold/flow-bridge class; 'variable manifold' relabels the quantised centre, not the mechanism. G4: PATH_MODES carries 0 injectable EBM/manifold/FACC-head hook. G7: predicted-only 76 pts invalid for any keep. 0 episodes, 0 rig bytes changed."}, "director_progression": "Stall broken by measurement per the run-453/run-476 precedent: refuse the retired-family replay, then spend the iteration on the cheapest UNMEASURED rig cell. Gap found by HEADER AUDIT (every N477 archive file carries aegis_reg_casts: 1.0 -> the N192 lattice was never dosed past the wall).", "physical_action_taken": "Paired 20 seeds x 3 suites x 2 arms per cell over 7 rig invocations (6 cells + 1 power cell), H=0.6 n=32 REG=depth ROW_CENTRE=1, candidate AEGIS_REG_CASTS=0 vs baseline --compare-env AEGIS_REG_CASTS=1, --path trochoid --compare trochoid. 840 physical episodes, 0 harness errors, 0 rig bytes changed, no tool teleport, no coverage/success arithmetic (all coverage_cont and success from physics contacts at return time).", "rig_invoked": true, "rig_exit": 0, "rig_bytes_changed": false, "harness_errors": 0, "episodes": 840, "pose_noise_cfg_cells": ["0.32,64", "0.40,80", "0.48,96", "0.64,128", "0.72,144", "0.80,160"], "cells": [{"cell": "0.32,64", "seeds": 20, "B_base": 0.85, "B_cand": 1.0, "delta_covc_B": 0.0851, "welch_p_B": 0.128812, "fisher_p_B": 0.230769, "rig_keep": false, "note": "no-regression cell, H3 satisfied; R Welch p 6.86e-03"}, {"cell": "0.40,80", "seeds": 20, "B_base": 0.7, "B_cand": 1.0, "delta_covc_B": 0.1672, "welch_p_B": 0.029944, "fisher_p_B": 0.020196, "rig_keep": false, "note": "effect clear, misses p<0.01 on power at n=20"}, {"cell": "0.40,80", "seeds": 60, "B_base": 0.6166666666666667, "B_cand": 1.0, "delta_covc_B": 0.218, "welch_p_B": 1e-05, "fisher_p_B": 0.0, "rig_keep": true}, {"cell": "0.48,96", "seeds": 20, "B_base": 0.6, "B_cand": 1.0, "delta_covc_B": 0.2867, "welch_p_B": 0.005639, "fisher_p_B": 0.003276, "rig_keep": true}, {"cell": "0.64,128", "seeds": 20, "B_base": 0.4, "B_cand": 1.0, "delta_covc_B": 0.4359, "welch_p_B": 0.000535, "fisher_p_B": 4.5e-05, "rig_keep": true}, {"cell": "0.72,144", "seeds": 20, "B_base": 0.35, "B_cand": 1.0, "delta_covc_B": 0.5008, "welch_p_B": 0.000114, "fisher_p_B": 1.3e-05, "rig_keep": true}, {"cell": "0.80,160", "seeds": 20, "B_base": 0.25, "B_cand": 1.0, "delta_covc_B": 0.5617, "welch_p_B": 2.4e-05, "fisher_p_B": 1e-06, "rig_keep": true}], "control_arm": {"stack": "H=1.2 n=65 REG_CASTS=0", "cell": "0.64,128", "seeds": 20, "delta_covc_A_B_R": [0.0, 0.0, 0.0], "welch_p_B": 1.0, "fisher_p_B": 1.0, "rig_keep": false, "note": "INERTNESS BRANCH self-falsifying control: a_slack = 1.2-0.3677 = 0.832 m > sigma_t 0.64, so the derived k=1 and the arm is bit-identical to the single cast. Confirms H (window widening) and the lattice are REDUNDANT fixes for the same containment failure; H=0.6+lattice is the cheaper of the two."}, "metrics": {"idea": "N478-CAST-LATTICE", "metric_class": "physical", "transfer_success": 1.0, "fixture_A_success": 0.25, "fixture_B_success": 1.0, "fixture_R_success": 0.6, "coverage_cont_mean_B": 0.9977, "seeds_run": 20, "seeds_required": 20, "compare_champion": "trochoid (fixture_B B=1.00 at 0,0; frozen; Fisher p=0.0083 vs raster run 72)", "compare_keep": true, "rig_keep_at_0.80_160": true, "rig_keep_at_0.72_144": true, "rig_keep_at_0.64_128": true, "rig_keep_at_0.48_96": true, "rig_keep_at_0.40_80_n60": true, "new_mechanism": false, "new_mechanism_note": "the lattice IS N192's shipped rig code (run 299); the contribution is the dose that had never been run", "replay_of_retired_family": false, "synthetic_proxy": null, "certified_boundary_before_m_deg": "0.32 m / 64 deg", "certified_boundary_after_m_deg": "0.80 m / 160 deg", "boundary_extension_factor_linear": 2.5, "episodes": 840, "harness_errors": 0}, "compare_record": {"candidate": "trochoid (AEGIS_REG_CASTS=0 lattice)", "baseline": "trochoid[AEGIS_REG_CASTS=1]", "pose_noise_cfg": "0.80,160", "keep": true, "metric": "coverage_cont", "fixture_B_success_base": 0.25, "fixture_B_success_cand": 1.0, "welch_p_coverage_cont": 2.4e-05, "fisher_p_success": 1e-06, "delta_covc_B": 0.5617, "seeds": 20, "artifact": "results/aegis_v2/N478_r494_casts0_n0.80,160.jsonl (header aegis_reg_casts=0.0, aegis_reg_half_m=0.6, aegis_reg_n=32, pose_noise_cfg=0.80,160, rig_version=2)"}, "pre_registration": {"H1_confirmatory": "CONFIRMED - lattice restores fixture_B at 0.40,80 from the frozen single-cast collapse to >= 0.70 with paired Fisher p < 0.01 => boundary is estimator containment", "H2_refuting": "REFUTED - boundary is NOT residual ray parity", "H3_no_regression": "SATISFIED - at 0.32,64 no B regression (0.85 -> 1.00, delta_covc +0.0851 >= -0.005)", "written_before_first_run": true}, "verdict": "KEEP (fixture_B transfer_success 0.25 -> 1.00 at pose_noise_cfg 0.80,160; Welch p 2.4e-05, Fisher p 1e-06, rig keep=true; certified pose-noise frontier extended 0.32 m/64 deg -> 0.80 m/160 deg, 2.5x. VMEAF refused as 53rd G3 replay. 840 physical episodes, 0 harness errors, 0 rig bytes changed.)", "equations_changed": true, "equation_row": "N478 (estimator-containment law + lattice inertness branch)", "gates_unchanged": {"segment": 15, "primary_metric": "fixture_B_transfer_success", "tier4_gate": "post-hoc tag preserved; untouched", "no_new_segment": true, "no_metric_move": true, "no_gate_change": true, "no_synthetic_row": true, "unvalidated_cap_remaining_segment_15": 1}, "evidence_artifacts": ["results/aegis_v2/N478_r494_casts0_n0.32,64.jsonl", "results/aegis_v2/N478_r494_casts0_n0.40,80.jsonl", "results/aegis_v2/N478_r494_casts0_n0.40,80_n60.jsonl", "results/aegis_v2/N478_r494_casts0_n0.48,96.jsonl", "results/aegis_v2/N478_r494_casts0_n0.64,128.jsonl", "results/aegis_v2/N478_r494_casts0_H06n32_n0.64,128.jsonl", "results/aegis_v2/N478_r494_casts0_n0.72,144.jsonl", "results/aegis_v2/N478_r494_casts0_n0.80,160.jsonl", "results/aegis_v2/N478_r494_casts0_H12n65_n0.64,128.jsonl", "equations.md (row N478)", "experiments/worklog.md (this iteration)", "autoresearch_research_strategy_graph.jsonl (N494 node + edge)"], "next_action_required": "N478b queued: the ray-budget cost of the frontier (REG_CN coarse selection / REG_DFACT pitch at 0.80,160, B must stay >= 0.90 while cast rays fall >= 2x). N198 stays open_needs_director.", "worklog_append_only": true}
