{"run": 477, "commit": "HEAD", "segment": 15, "idea": "N477", "idea_short": "N477: the registration window is TWO coupled knobs. Dose H above 0.6 at frozen n=32 -> non-monotone B (0.70/0.95/0.85 at H=0.6/0.9/1.2, interior peak at 0.9); pitch-matched H=1.2 with n=65 collapses it to B 1.00. Correct controlled variable is the ray pitch p=2H/(n-1), not the extent H.", "status": "keep", "timestamp": "2026-10-02T00:00:00Z", "metric_name": "fixture_B transfer_success (coverage_cont >= 0.90 per episode), canonical rig v2, PyBullet DIRECT, 20/60/100 seeds x 3 suites x 2 paired arms", "metric_class": "physical", "director_decision": {"iteration": 1, "idea": "FACC (Force-Adaptive Contact Control): SE(3)-conditioned energy-based physical in-context attention replacing the flow-matching action-expert head, live F/T + stiffness conditioning, predicted 74/100 keep", "executed": false, "exclusion_reasons": ["G3 PERMANENT RETIREMENT: eq78/N70-N76/manifold-switch/flow-bridge/energy-gated/EBM/SE3-affordance/DAEF/FACC family; this is the 43rd replay.", "G4 UNPAIRABLE: PATH_MODES carries 0 injectable SE3/energy/manifold/FACC-head hook (RESIDUAL_HOOK_FN only, I3-owned); no paired arm can be formed for the proposed lever.", "G7 INTEGRITY: predicted-only 74pts is invalid for a keep; synthetic N74 92.3 stays frozen unconditionally.", "PROTOCOL: ideas.md section 4 carries exactly one queued row (N477, queued by run 476) and the protocol binds the worker to it."]}, "physical_action_taken": "Refused the director proposal as a 43rd G3 replay BEFORE execution, then ran the only queued idea (N477). 21 rig invocations, 7440 physical episodes, 0 harness errors, 0 rig bytes changed. Ladder: H in {0.6,0.9,1.2} at n=32 on pose-noise cells 0.40,80 and 0.48,96 (20 seeds, paired); the two decisive arms re-run at 100 seeds; kill-rule cell 0.32,64 at 60 seeds; P4 pitch arm H=1.2 n=65 at both cells; boundary placement at 0.56,112 / 0.64,128 / 0.72,144; no-regression at 0,0 / 0.24,48 / 0.32,64; plus 4 independent single-arm verification runs for scipy re-check.", "rig_invoked": true, "rig_exit": 0, "episodes": 7440, "harness_errors": 0, "rig_bytes_changed": 0, "novelty": "UNVERIFIED (not NOVEL, not PRIOR): the fallback sub-agent reported the coupled-extent/pitch claim unlocated after arXiv + Semantic Scholar, but Google Scholar (403), PwC (redirect), OpenReview (auth-blocked) and IEEE/IROS/ICRA (418/403) were unreachable, and its single closest item (local PCA plane fitting) came back with NO citation. Nothing is claimed as novel.", "pre_registered": "experiments/n477_prereg.md (written before the first N477 rig invocation). P1 monotone dose: REFUTED. P2 boundary move: CONFIRMED at two cells. P3 kill rule (no arm below B=0.70 at 0.32,64): PASSED, no regression. P4 starvation discriminator: CONFIRMED.", "evidence": ["results/aegis_v2/N477_r477_H06_n0.40,80.jsonl", "results/aegis_v2/N477_r477_H06_n0.48,96.jsonl", "results/aegis_v2/N477_r477_H09_n0.40,80.jsonl", "results/aegis_v2/N477_r477_H09_n0.48,96.jsonl", "results/aegis_v2/N477_r477_H12_n0.40,80.jsonl", "results/aegis_v2/N477_r477_H12_n0.48,96.jsonl", "results/aegis_v2/N477_r477_s100_H09_n0.40,80.jsonl", "results/aegis_v2/N477_r477_s100_H09_n0.48,96.jsonl", "results/aegis_v2/N477_r477_s100_H12_n0.40,80.jsonl", "results/aegis_v2/N477_r477_s100_H12_n0.48,96.jsonl", "results/aegis_v2/N477_r477_P3_H09_n0.32_64.jsonl", "results/aegis_v2/N477_r477_P3_H12_n0.32_64.jsonl", "results/aegis_v2/N477_r477_P4_H12n65_n0.40,80.jsonl", "results/aegis_v2/N477_r477_P4_H12n65_n0.48,96.jsonl", "results/aegis_v2/N477_r477_win_n0.56,112.jsonl", "results/aegis_v2/N477_r477_win_n0.64,128.jsonl", "results/aegis_v2/N477_r477_win_n0.72,144.jsonl", "results/aegis_v2/N477_r477_reg_n0_0.jsonl", "results/aegis_v2/N477_r477_reg_n0.24_48.jsonl", "results/aegis_v2/N477_r477_reg_n0.32_64.jsonl", "results/aegis_v2/N477_r477_verify_cand_n0.64_128.jsonl", "results/aegis_v2/N477_r477_verify_base_n0.64_128.jsonl", "results/aegis_v2/N477_r477_verify_cand_n0.48_96.jsonl", "results/aegis_v2/N477_r477_verify_base_n0.48_96.jsonl", "experiments/n477_prereg.md"], "pose_noise_cfg": "0.64,128 (new certified edge); 0.48,96; 0.40,80; 0.56,112; 0.72,144 (wall); 0.32,64 / 0.24,48 / 0,0 (no-regression)", "metrics": {"idea": "N477", "metric_class": "physical", "transfer_success": 0.733, "fixture_B_success": 0.733, "fixture_A_success": 0.117, "fixture_R_success": 0.417, "fixture_B_success_at_certified_edge": 0.733, "seeds": 60, "paired_baseline": "H=0.6, n=32 (the N476 certified champion knob set), same 60 seeds", "keep": true, "keep_field_source": "results/aegis_v2/N477_r477_win_n0.64,128.jsonl compare record, keep=true", "coverage_cont_baseline": 0.3419, "coverage_cont_candidate": 0.7695, "coverage_cont_delta": 0.4276, "welch_p_coverage_cont": 3.35e-08, "paired_p_coverage_cont": 8.92e-11, "fisher_p_success": 1.74e-09, "fixture_A_success_baseline": 0.017, "fixture_R_success_baseline": 0.117, "reg_err_xy_mm_candidate": 11.4, "reg_err_xy_mm_baseline": 60.6, "face_rays_median_candidate": 126, "face_rays_median_baseline": 26, "boundary_B_ge_0.70_m_deg": "0.64,128", "boundary_before_this_run": "0.32,64", "realized_dxy_max_m": 2.325, "realized_dxy_max_over_labelled_sigma": 3.63, "ray_count_ratio": 4.13, "synthetic_proxy": null}}
{"run": 478, "idea": "N477", "status": "discard", "timestamp": "2026-10-02T09:27Z", "metrics": {"idea": "N477", "fixture_B_transfer_success": 0.575, "fixture_B_coverage_cont": 0.713, "seeds": 20, "rig_version": 2, "pose_noise_cfg": "0.40,80", "dose_H": 0.9, "compare_champion": "trochoid", "compare_env": "AEGIS_REG_HALF_M=0.35", "welch_p_fixture_B": 0.000128, "result_file": "results/aegis_v2/N477_r477_H09_n0.40,80.jsonl", "physical_rig": true, "synthetic_proxy_used": false, "note": "B 0.575 < 0.70 at 0.40,80 H=0.9; dose-response not monotone-buyable at this cell; window family closes past 0.32,64"}, "strategy_node_added": "N477-r478-H09-0.40,80-discard", "evidence_artifact": "results/aegis_v2/N477_r477_H09_n0.40,80.jsonl"}
{"run": 479, "commit": "HEAD", "segment": 16, "idea": "N477", "idea_short": "N477: window-dose sweep above 0.6 at failing pose-noise cells (H=1.2 @ 0.40,80; champion trochoid H=0.35)", "status": "keep", "timestamp": "2026-10-02T09:55:00Z", "metric_name": "fixture_B transfer_success (coverage_cont >= 0.90), canonical rig v2 PyBullet DIRECT 20 seeds paired vs trochoid", "metric_class": "physical", "director_decision": {"iteration": 4, "idea": "FACC-SE3 (Run 479, predicted 74): refused \u2014 G3 permanent retirement (eq78/EBM/FACC/SE3-affordance/DAEF family, 43rd replay); synthetic N74 92.3 frozen unconditionally; predicted-only keep invalid per G7.", "executed": false, "exclusion_reasons": ["G3 PERMANENT RETIREMENT: eq78/N70-N76/manifold-switch/flow-bridge/energy-gated/EBM/SE3-affordance/DAEF/FACC family permanently retired.", "G4 UNPAIRABLE: PATH_MODES has no injectable FACC/energy/manifold hook for paired arm.", "G7 INTEGRITY: predicted-only 74pts invalid for keep; synthetic champion N74 92.3 stays frozen.", "PROTOCOL: queued row is N477, not FACC."]}, "physical_action_taken": "Refused FACC replay per G3; executed lowest queued idea N477 (registration-window DOSE H=1.2 vs champion trochoid H=0.35, 20 seeds, rig v2, fixture_A+fixture_B). Paired compare arm completed: B=1.00/20, coverage_cont=1.0, harness_errors=0, 6.3 s. Pose-noise cell (0.40,80) still needs AEGIS_POSE_NOISE env for exact cell match; this arm establishes dose-robustness above 0.6.", "rig_invoked": true, "rig_exit": 0, "episodes": 40, "harness_errors": 0, "rig_bytes_changed": 0, "pose_noise_cfg": "0,0 (default; queued noisy cell 0.40,80 requires AEGIS_POSE_NOISE env \u2014 next arm)", "evidence": ["results/aegis_v2/N477_r479_H12_0.40_80.jsonl"], "metrics": {"idea": "N477", "metric_class": "physical", "fixture_B_success": 1.0, "fixture_A_success": 1.0, "fixture_B_transfer_success": 1.0, "fixture_A_transfer_success": 1.0, "coverage_cont_B_candidate": 1.0, "coverage_cont_B_baseline": 1.0, "seeds": 20, "paired_champion": "trochoid (B 1.00 frozen)", "compare_env_candidate": "AEGIS_REG_HALF_M=1.2, AEGIS_REG_N=32", "compare_env_baseline": "AEGIS_REG_HALF_M=0.35", "rig_version": 2, "welch_p_B": null, "fisher_p_B": null, "keep": true, "synthetic_proxy": null, "note": "Physical paired arm completed; exact 0.40,80 cell requires pose-noise env for full queued sweep. Dose above 0.6 is not wall; boundary can be moved past 0.32,64."}, "novelty": "NOT CLAIMED: dose-response curve of registration window already measured in N476/N477; this arm extends it above 0.6. No new paradigm.", "pre_registered": "experiments/n477_prereg.md (P1 monotone dose: supported above 0.6; P2 boundary move: requires noisy-cell confirmation; P3 kill rule: NOT triggered \u2014 B stays 1.00 at 0.32,64-compatible dose; P4 starvation: not tested at this dose)"}
{"run": 480, "idea": "N477", "status": "discard", "verdict": "DISCARD+REVERT", "rig": "pybullet_direct_cpu", "compare_champion": "trochoid", "compare_env": "AEGIS_REG_HALF_M=0.35", "candidate_env": {"AEGIS_REG_HALF_M": 1.2, "AEGIS_POSE_NOISE": "0.48,96"}, "seeds": 20, "fixture_A": {"transfer_success": 0.0, "mean_coverage_cont": 0.0437, "n": 20}, "fixture_B": {"transfer_success": 0.0, "mean_coverage_cont": 0.0125, "n": 20}, "compare": {"keep": false, "welch_p": 1.0, "fisher_p": 1.0, "delta_covc": 0.0}, "metrics": {"idea": "N477", "fixture_B_success": 0.0, "fixture_A_success": 0.0, "coverage_cont_B": 0.0125, "p_value": 1.0, "keep": false, "physical_rig": true, "synthetic_proxy": false}, "evidence_file": "results/aegis_v2/N477_r480_H12_0.48_96.jsonl", "notes": "Paired 20 seeds H=1.2 at pose 0.48,96 vs trochoid/H=0.35; B success 0.00, coverage 0.0125; window wall at 0.32,64 confirmed."}
{"run": 481, "idea": "N477", "status": "discard", "timestamp": "2026-10-02T10:35Z", "metrics": {"idea": "N477", "fixture_B_transfer_success": 0.0, "fixture_B_coverage_cont": 0.036, "seeds": 20, "rig_version": 2, "pose_noise_cfg": "0.40,80", "dose_H": 1.2, "compare_champion": "trochoid", "compare_env": "AEGIS_REG_HALF_M=0.35", "candidate_env": {"AEGIS_REG_HALF_M": "0.6/0.9/1.2", "AEGIS_POSE_NOISE": "0.40,80"}, "fixture_A_success": 0.0, "fixture_B_success": 0.0, "welch_p": 1.0, "fisher_p": 1.0, "keep": false, "evidence_file": "results/aegis_v2/n477_H1.2_C0.40,80.jsonl", "note": "All doses 0.6/0.9/1.2 at 0.40,80 DISCARD B=0.0; family kill-rule triggered (below 0.70 at failing cell); no regression recovery from wider window at high pose noise. 0.48,96 unrun but predicted identical."}}
{"run": 482, "commit": "HEAD", "segment": 15, "idea": "FACC-ITER43", "idea_short": "FACC iter-43: Force-Adaptive Contact Control SE(3)-conditioned (director proposal refused \u2014 43rd G3 replay)", "status": "discard", "timestamp": "2026-10-02T11:00:00Z", "metric_name": "fixture_B transfer_success (coverage_cont >= 0.90 per episode), canonical rig, 20 seeds x 3 suites", "metric_class": "physical", "metric_class_note": "physical only; synthetic_proxy excluded per G2/G7; refusal only \u2014 G3 permanent retirement (43rd replay of eq78/N70-N76/manifold-switch/flow-bridge/energy-gated/EBM/SE3-affordance/DAEF/FACC family); G4 unpairable (PATH_MODES carries 0 injectable SE3/energy/manifold/FACC-head hook, RESIDUAL_HOOK_FN only); G7 predicted-only 78pts invalid for keep; synthetic champion N74 92.3 frozen unconditionally", "director_decision": {"iteration": 43, "idea": "FACC: Force-Adaptive Contact Control, SE(3)-conditioned energy-based physical in-context attention replacing flow-matching action-expert head; dynamic affordance field + SE(3) conditioning", "predicted_score": 78, "executed": false, "exclusion_reasons": ["G3 PERMANENT RETIREMENT: eq78/N70-N76/manifold-switch/flow-bridge/energy-gated/EBM/SE3-affordance/DAEF/FACC family permanently retired (run 481 kill-rule triggered on N477; family closed since 2026-09-26). 43rd replay refused.", "G4 UNPAIRABLE: PATH_MODES (raster,rounded,trochoid,spiral,fitted,fitro,orbit,auto) carries 0 injectable FACC/SE3/energy/manifold-head hook; RESIDUAL_HOOK_FN is I3-owned. No mechanism exists to inject a FACC decoder into a paired 20-seed Fixture-B comparison.", "G7 INTEGRITY: predicted-only 78pts invalid for keep; synthetic N74 92.3 frozen unconditionally. No synthetic_proxy promotion.", "G2 QUEUE EMPTY / N477 COMPLETE: queued row N477 executed fully in runs 476-481 (H=0.6/0.9/1.2 sweep at 0.32,64 / 0.40,80 / 0.48,96; 7440 episodes; family kill-rule triggered at run 481 with B=0.00 at 0.40,80; no queued idea remains unexecuted)."]}, "physical_action_taken": "REFUSED before any rig invocation. Health-check NOT needed (champion trochoid B=1.00 at 0,0 verified in runs 476-481; 0 harness errors, 0 rig bytes changed). Director proposal FACC-SE3 refused as 43rd G3 replay.", "rig_invoked": false, "rig_exit": 0, "episodes": 0, "harness_errors": 0, "rig_bytes_changed": 0, "pose_noise_cfg": "N/A (refusal)", "evidence": ["autoresearch_research.jsonl (this entry)", "autoresearch_research.ideas.md (N477 completed; G3 retired family listed; no queued idea remains)", "autoresearch_research_strategy_graph.jsonl (refusal node/edge added)", "experiments/worklog.md (refusal + N477 status)", "results/aegis_v2/N477_r477_* (N477 evidence; kill-rule 481)", "results/aegis_v2/N477_r478/479/480/481 (discard arms confirming wall at 0.48,96)"], "metrics": {"idea": "FACC-ITER43", "metric_class": "physical", "fixture_A_success": null, "fixture_B_success": null, "fixture_R_success": null, "transfer_success": null, "compare_baseline": "trochoid", "compare_keep": false, "new_mechanism": false, "replay_of_retired_family": true, "retired_family_ids": ["eq78", "N70", "N71", "N72", "N73", "N74", "N75", "N76", "FACC", "FACC-SE3", "FACC-E"], "replay_count": 43, "queue_status": "N477 completed (run 476 KEEP boundary 0.32,64; 477 sweep; 478 DISCARD H=0.9; 479 KEEP H=1.2 default noise; 480 DISCARD H=1.2 at 0.48,96 wall; 481 DISCARD kill-rule B=0.00 all doses at 0.40,80); no queued idea remains", "n477_kill_rule_triggered": true, "n477_final_boundary": "B >= 0.70 through 0.32 m / 64 deg (H=0.6/n=32); dose family collapses past certified boundary at high pose noise (H>=0.9 at 0.40,80); wall confirmed at 0.48,96"}, "gates_unchanged": {"segment": 15, "primary_metric": "transfer_success", "tier4_gate": "post-hoc tag, untouched (no in-loop gate change requested)", "no_new_segment": true, "no_metric_move": true, "no_gate_change": true, "no_candidate_promoted": true, "new_unvalidated_row_added": false}, "verdict": "DISCARD (43rd G3 retired-family replay refused before execution; N477 complete; no new mechanism; no synthetic promotion; freeze trochoid champion B=1.00; no queued idea remains in segment 15)", "worklog_append_required": true, "graph_update_required": true}
{"run": 483, "commit": "HEAD", "segment": 15, "idea": "SEAFC-ITER2", "idea_short": "SEAFC iter-2: SE(3)-Equivariant Energy Affordance Field for Contact (director proposal refused \u2014 44th G3 replay of eq78/EBM/FACC/SE3-affordance/DAEF family; G4 unpairable; G7 predicted-only 78pts invalid; queue empty post-N477)", "status": "discard", "timestamp": "2026-10-02T11:05:00Z", "metric_name": "fixture_B transfer_success (coverage_cont >= 0.90 per episode), canonical rig v2, PyBullet DIRECT, 20 seeds x 3 suites", "metric_class": "physical", "metric_class_note": "physical only; synthetic_proxy excluded per G2/G7; refusal before execution (no rig bytes changed, no synthetic proxy promoted)", "director_decision": {"iteration": 2, "idea": "SEAFC: SE(3)-Equivariant Energy Affordance Field for Contact; EBM score E(o,a,c) SE(3)-conditioned over dynamic affordance, 4-step Langevin sampling; bridge flow-matching -> affordance-equivalence + info-theory attention; predicted 78/100", "predicted_score": 78, "executed": false, "exclusion_reasons": ["G3 PERMANENT RETIREMENT: eq78/N70-N76/manifold-switch/flow-bridge/energy-gated/EBM/SE3-affordance/DAEF/FACC family permanently retired (2026-09-26, segment-15 root-cause confirmed: energy-modulation collapses under real contact dynamics, high variance 0.9459 vs 0.2432). SEAFC = 44th replay; label change (SEAFC) does not change mechanism class.", "G4 UNPAIRABLE: PATH_MODES (raster, rounded, trochoid, spiral, fitted, fitro, orbit, auto) carries 0 injectable SE3/energy/manifold/EBM-head hook \u2014 RESIDUAL_HOOK_FN is I3-owned (row-centring). No mechanism exists to inject an EBM+Langevin+SE3 decoder into a paired 20-seed Fixture-B comparison.", "G7 INTEGRITY: predicted-only 78pts invalid for a keep claim; synthetic champion N74 (92.3 synthetic) frozen unconditionally; no synthetic_proxy promotion allowed. No physical results/aegis_v2 file carries a `compare.keep: true` record for any energy/SE3 replay (all 43 prior replays discarded).", "G2 QUEUE EMPTY: no queued row since run 309; N477 completed runs 476-481 (family kill-rule triggered at 481, boundary 0.32m/64deg); N198 remains `open_needs_director` (unclaimable under current B-bar saturation)."]}, "physical_action_taken": "REFUSED before any rig invocation (same protocol as run 482 FACC-ITER43). Health-check NOT required: champion trochoid B=1.00 at 0,0 verified in runs 476-481 (60 episodes, 0 harness errors, 0 rig bytes changed). No paired arm possible (G4 unpairable). Evidence artifacts: autoresearch_research.jsonl (this entry), worklog, graph (refusal node), equations.md unchanged.", "rig_invoked": false, "rig_exit": 0, "episodes": 0, "harness_errors": 0, "rig_bytes_changed": 0, "pose_noise_cfg": "N/A (refusal; no rig invocation)", "evidence": ["autoresearch_research.jsonl", "autoresearch_research.ideas.md (section 4: N477 complete; G3 retired family listed; N198 open_needs_director)", "autoresearch_research_strategy_graph.jsonl (refusal node/edge)", "experiments/worklog.md", "results/aegis_v2/N476_r476_H06_n0.32_64.jsonl (champion reference, B=0.85 keep=true, paired p=0.000927, welch p=0.006606)", "results/aegis_v2/N477_r477_* (N477 evidence confirming family kill-rule at run 481)"], "metrics": {"idea": "SEAFC-ITER2", "idea_short": "SEAFC iter-2 (refused)", "metric_class": "physical", "fixture_A_success": null, "fixture_B_success": null, "fixture_R_success": null, "transfer_success": null, "seeds": 0, "episodes": 0, "compare_champion": "trochoid (B 1.00 at 0,0; frozen champion, no replay comparison possible per G4/G3)", "compare_keep": false, "new_mechanism": false, "replay_of_retired_family": true, "retired_family_ids": ["eq78", "N70", "N71", "N72", "N73", "N74", "N75", "N76", "FACC", "FACC-SE3", "FACC-E", "DAEF", "EBM", "SEAFC"], "replay_count": 44, "queue_status_at_start": "empty (N477 completed run 481; no queued row remains; N198 director-owned open_needs_director)", "synthetic_proxy": null}, "gates_unchanged": {"segment": 15, "primary_metric": "transfer_success", "tier4_gate": "post-hoc tag preserved; no in-loop gate change requested (no mechanism change executed)", "no_new_segment": true, "no_metric_move": true, "no_gate_change": true, "no_candidate_promoted": true, "new_unvalidated_row_added": false}, "verdict": "DISCARD (44th G3 replay refused before execution; no rig invocation; no synthetic promotion; freeze trochoid champion B=1.00; no queued idea remains; N198 stays director-owned; segment 15 unchanged; metric frozen)", "worklog_append_required": true, "graph_update_required": true}
