{"run": 191, "segment": 15, "status": "keep", "idea": "I2", "timestamp": "2026-09-28T00:00:00Z", "description": "T191 = T188 base + joint eps*+cap POST-HOC ONLY + frozen I7+I10 (director iter 16). Weight w=min(T173/(max(slip,0.005)+0.005),C99), C99=100.0 train-p99 == raw max, damping ON, fric-free, T173-only. Zero rig edits, offline on frozen R173 files; theta 0.014133 bit-identical; I7 binds 0. Cap degenerate: all grid quantiles equal raw max at every eps; binds 0/120 all splits. Held-out pooled: P_w(fail) 0.1153 vs T173 0.1078 = lift -0.75 (diode stands); vs T188 -0.19. Score_w 88.47>=70; ESS 96.74; rankIC 0.0201; cov ok; archive 0.0. Grid monotone larger-eps-better; dampOFF+capped bit-identical (cap masks floor removal). KEEP per iff rule; director +2.0pt prediction FAILS; shrinker+winsor line EXHAUSTED, fail path: unfreeze I10 only next. Tier-2 binding.", "rig": "experiments/kaggle_aegis_sweep.py", "command": "POST-HOC ONLY, zero rig edits, no rig run; timeout 1200 python3 results/aegis_v2/I2_r191_analysis.py on frozen R173 files", "compare_champion": "trochoid", "metric": 1.0, "metric_unit": "transfer_success Fixture-B fitted Run-A decider (G2 primary; tag lift -0.75pts vs T173 / -0.19pts vs T188 in metrics)", "metrics": {"idea": "I2", "variant": "T191 = T188 base + joint eps*+cap w=min(T173/(max(slip,0.005)+0.005),C99)", "seeds": 20, "gate_mode": "post-hoc", "path": "fitted-frozen", "decider_noise": "0.01,2", "archive_noise": "2.0-offline-only", "overrides": "none", "inloop_veto": false, "theta_bitidentical_172_173": true, "P50_frozen_director": 0.008, "P50_train_recomputed": 0.008106, "eps_star": 0.005, "eps_star_rule": "director iter-16 joint-tune decider; grid log-only", "C99_train_adm": 100.0, "C99_raw_max": 100.0, "cap_degenerate_all_quantiles_eq_max": true, "grid_eps": [0.002, 0.005, 0.008, 0.01], "grid_Cq": [0.95, 0.975, 0.99, 0.995], "grid_lifts_vs_T173": {"eps0.002": -0.94, "eps0.005": -0.75, "eps0.008": -0.62, "eps0.01": -0.56}, "fric_term": "none", "damping": "ON (OFF+capped ablation bit-identical, cap-masked)", "i7_binds_heldout": 0, "runA_B": [1.0, 0.75], "runA_welch_p": 0.00010868123615477709, "runA_keep_cited": true, "held_T173_p_fail_given_adm": 0.1078, "held_T191_p_fail_weighted": 0.1153, "lift_T191_vs_T173_pts": -0.75, "lift_T191_vs_T188_pts": -0.19, "lift_T191_vs_T173_train_pts": 0.58, "held_T191_score_w": 88.47, "held_T191_ess": 96.74, "held_T191_rankIC_success": 0.0201, "turnover_T191_vs_T188_held_mean_max": [19.0978, 33.3333], "turnover_T191_vs_dampOFF_held": [0.0, 0.0, 0], "caphit_all_splits": 0, "cov_ok": true, "archive_valid_mass_rate": 0.0, "director_predicted_score_ge_75": 88.47, "director_predicted_lift_20pts": -0.75, "shrinker_winsor_family": "EXHAUSTED (eps/floor/cap mapped, all diode-blocked)", "next_proposal_only": "iter-17 unfreeze I10 only", "evidence": ["results/aegis_v2/I2_r191_analysis.py", "results/aegis_v2/I2_r191_result.json"]}, "evidence_file": "results/aegis_v2/I2_r191_result.json", "integrity_g7": true, "banned_phrases_checked": true, "timeout_s": 1200, "cleanup_anchored_kill": true, "remote_gpu_deferred": false, "verdict": "KEEP per pre-reg iff rule (runA B 1.00 Welch p=1.1e-4 cited + score_w 88.47>=70 + no coverage regression); director lift prediction FAILS (-0.75); cap degenerate; Tier-2 accuracy stays binding."}
{"run": 192, "segment": 15, "status": "keep", "idea": "I2", "timestamp": "2026-09-28T00:00:00Z", "description": "T192 = T191 joint weight IN-SELECTION + frozen I7+I10 (director iter 17). Admit iff w>=TAU50=68.0452 (median over calib fitted-B admitted n=16, train-locked); same eps*=0.005, floor 0.005, C99=100.0 degenerate; fric-free, T173-only. Zero rig edits, offline admission on frozen R173 files (timing-only delta vs 189-191). Held fitted-B n=20 raw 0.95: admits 8/20 all-success, gated yield 0.40 (-55pts); precision 1.0; score_sel 100>=70; cov ok; rank-shift mass 0.40; P(w=C99)=0; slip adm/rej med 0.0045/0.0129; TAU grid 0.55/0.40/0.35 monotone; archive adm 0.0. KEEP per iff-rule. Director 0.68-0.75 magnitude MISSED, invariance-break CONFIRMED; literal kill not fired; family EXHAUSTED as improvement (vetoes successes only); pivot to selection/threshold frontier. Tier-2 binding.", "rig": "experiments/kaggle_aegis_sweep.py", "command": "IN-SELECTION admission (timing-only), zero rig edits, no rig run; timeout 300 python3 results/aegis_v2/I2_r192_analysis.py on frozen R173 files", "compare_champion": "trochoid", "metric": 1.0, "metric_unit": "transfer_success Fixture-B fitted Run-A decider (G2 primary; gated yield 0.40 in metrics)", "metrics": {"idea": "I2", "variant": "T192 in-selection w=min(T173/(max(slip,0.005)+0.005),C99), Admit iff w>=TAU50", "seeds": 20, "gate_mode": "post-hoc", "path": "fitted-frozen", "decider_noise": "0.01,2", "archive_noise": "2.0-offline-only", "overrides": "none", "inloop_veto": false, "theta_bitidentical_172_173": true, "eps_star": 0.005, "slip_floor": 0.005, "C99_train_adm": 100.0, "C99_degenerate": true, "TAU50_train_median_calB_adm": 68.0452, "calB_adm_n": 16, "i7_binds_heldB": 0, "runA_B": [1.0, 0.75], "runA_welch_p": 0.00010868123615477709, "runA_keep_cited": true, "heldB_raw_keep": 0.95, "heldB_T173_adm": 16, "gated_yield_sel": 0.4, "sensitivity_yield_drop_pts": 55.0, "score_sel_pts": 100.0, "precision_adm": 1.0, "rank_shift_mass_vs_T173": 0.4, "caphit_p_hit_all_splits": 0.0, "slip_adm_med": 0.0045, "slip_rej_med": 0.0129, "grid_yield_p25_p50_p75": [0.55, 0.4, 0.35], "archive_adm_frac": 0.0, "cov_ok": true, "kill_fires_keep_still_raw": false, "director_predicted_yield_068_075": 0.4, "verdict_rule": {"runA_keep": true, "score_sel_ge_70": true, "no_cov_regression": true}}, "evidence_file": "results/aegis_v2/I2_r192_result.json", "integrity_g7": true, "banned_phrases_checked": true, "timeout_s": 300, "cleanup_anchored_kill": true, "remote_gpu_deferred": false, "verdict": "KEEP per pre-reg iff rule (runA B 1.00 Welch p=1.1e-4 cited + score_sel 100>=70 + no regression); invariance BROKEN (-55pts, first move off flat 1.0); director magnitude MISSED (0.40 vs 0.68-0.75); family EXHAUSTED as improvement; pivot to selection/threshold frontier."}
{"run": 193, "segment": 15, "status": "keep", "idea": "I2", "timestamp": "2026-09-28T00:00:00Z", "description": "T193 = T191 joint weight IN-SELECTION, TAU30 decider + TAU25 buffer (director iter 18). Admit iff w>=TAU30=55.9211 (30th pct over calib fitted-B admitted n=16, train-locked); same eps*=0.005, floor 0.005, C99=100.0 degenerate; fric-free, T173-only. Zero rig edits, offline admission on frozen R173 files (threshold-only delta vs T192). Held fitted-B n=20 raw 0.95: TAU30 admits 11/20 all-success, gated yield 0.55 (-40pts); TAU25 buffer bit-identical 11/20 (no held mass in [52.40,55.92)); TAU50 ref 8/20=0.40. Tail recovery +15pts vs T192; precision 1.0 at every TAU (vetoes successes only); score_sel 100>=70; cov ok; rank-shift mass 0.25; caphit 0; archive adm 0.0. KEEP per iff-rule. Director keep-70-73/score-68.5-69.5 magnitude MISSED (keep 55, score 100); direction confirmed (relaxation recovers 3 successes). Selection/threshold frontier still zero outcome signal; pivot to non-slip selector next. Tier-2 binding.", "rig": "experiments/kaggle_aegis_sweep.py", "command": "IN-SELECTION admission (threshold-only), zero rig edits, no rig run; timeout 300 python3 results/aegis_v2/I2_r193_analysis.py on frozen R173 files", "compare_champion": "trochoid", "metric": 1.0, "metric_unit": "transfer_success Fixture-B fitted Run-A decider (G2 primary; gated yield 0.55 in metrics)", "metrics": {"idea": "I2", "variant": "T193 in-selection w=min(T173/(max(slip,0.005)+0.005),C99), Admit iff w>=TAU30", "seeds": 20, "gate_mode": "post-hoc", "path": "fitted-frozen", "decider_noise": "0.01,2", "archive_noise": "2.0-offline-only", "overrides": "none", "inloop_veto": false, "theta_bitidentical_172_173": true, "eps_star": 0.005, "slip_floor": 0.005, "C99_train_adm": 100.0, "C99_degenerate": true, "TAU30_train_p30_calB_adm": 55.9211, "TAU25_buffer": 52.3987, "TAU50_ref": 68.0452, "calB_adm_n": 16, "i7_binds_heldB": 0, "runA_B": [1.0, 0.75], "runA_welch_p": 0.00010868123615477709, "runA_keep_cited": true, "heldB_raw_keep": 0.95, "heldB_T173_adm": 16, "gated_yield_TAU30": 0.55, "gated_yield_TAU25": 0.55, "gated_yield_TAU50": 0.4, "keep_pct_TAU30": 55.0, "n_adm_TAU30": 11, "sensitivity_yield_drop_pts": 40.0, "tail_recovery_vs_T192_yield_pts": 15.0, "score_sel_pts": 100.0, "precision_adm": 1.0, "rank_shift_mass_vs_T173": 0.25, "caphit_p_hit_all_splits": 0.0, "slip_adm_med": 0.0055, "slip_rej_med": 0.0159, "TAU30_vs_TAU25_degenerate_held": true, "archive_adm_frac": 0.0, "cov_ok": true, "director_predicted_keep_70_73": 11, "director_predicted_score_685_695": 100.0, "verdict_rule": {"runA_keep": true, "score_sel_ge_70": true, "no_cov_regression": true}}, "evidence_file": "results/aegis_v2/I2_r193_result.json", "integrity_g7": true, "banned_phrases_checked": true, "timeout_s": 300, "cleanup_anchored_kill": true, "remote_gpu_deferred": false, "verdict": "KEEP per pre-reg iff rule (runA B 1.00 Welch p=1.1e-4 cited + score_sel 100>=70 + no regression); director magnitude MISSED (keep 55 vs 70-73, score 100 vs 68.5-69.5); threshold relaxation recovers 3 successes, still vetoes successes only; pivot to non-slip selector."}
{"run": 194, "segment": 15, "status": "discard", "idea": "I2", "timestamp": "2026-09-28T00:00:00Z", "description": "T194 per-tool conformal admission POST-HOC ONLY + frozen I7+I10 (director iter 19). Admit iff T173 AND jerk<=THETA[tool], THETA[t]=90pct calib-SUCCESS jerk per tool (t0 0.01994 n=30, t1 0.00769 n=33, t2 0.01276 n=40, all n>=20 no merge); zero rig edits, frozen R173 files, single eval.", "rig": "experiments/kaggle_aegis_sweep.py", "command": "POST-HOC admission (non-slip selector), zero rig edits, no rig run; timeout 300 python3 results/aegis_v2/I2_r194_analysis.py on frozen R173 files", "compare_champion": "trochoid", "metric": 1.0, "metric_unit": "transfer_success Fixture-B fitted Run-A decider (G2 primary; gated held recall 0.333 in metrics)", "metrics": {"idea": "I2", "variant": "T194 per-tool conformal jerk admission", "seeds": 20, "gate_mode": "post-hoc", "path": "fitted-frozen", "decider_noise": "0.01,2", "archive_noise": "2.0-offline-only", "overrides": "none", "inloop_veto": false, "theta_tool": {"0": 0.01994, "1": 0.00769, "2": 0.01276}, "n_calib_succ_tool": {"0": 30, "1": 33, "2": 40}, "i7_binds_held": 0, "stall_binds_held": 0, "stall_degenerate_all_zero": true, "runA_B": [1.0, 0.75], "runA_welch_p": 0.00010868123615477709, "runA_keep_cited": true, "held_p_fail_adm": 0.1042, "held_p_fail_t173": 0.1078, "lift_vs_t173_pts": 0.37, "lift_bar_pts": 1.0, "recall_sel": 0.333, "score_sel_pts": 33.33, "cov_adm": 0.9089, "cov_t173": 0.9099, "archive_adm_frac": 0.0, "verdict_rule": {"runA_keep": true, "score_sel_ge_70": false, "recall_ge_70": false, "lift_ge_bar": false}}, "evidence_file": "results/aegis_v2/I2_r194_result.json", "integrity_g7": true, "banned_phrases_checked": true, "timeout_s": 300, "cleanup_anchored_kill": true, "remote_gpu_deferred": false, "verdict": "DISCARD (score_sel 33.3<70, recall 0.333<70, lift +0.37<1.0 bar); tool-conditioned jerk carries no outcome signal; stall degenerate all-zero; non-slip line exhausted; I2 CLOSED, next queued I8."}
{"run": 201, "idea": "I16", "status": "discard", "timestamp": 1790612303, "segment": 15, "verdict": "DISCARD I16 trochoid hyper-sweep (amp x loop-rate, 20 seeds B+R, paired seeds): champion A=0.015/W=33.3 unbeaten overall (B 20/20 cov 0.950, R 19/20). A=0.022/W=33.3 raises B cov to 0.965 but COLLAPSES R to 6/20 (0.348) \u2014 loop-amplitude vs fixture-size fragility, new finding. Plateau confirmed around champion. Evidence results/aegis_v2/i16_A*_W*.jsonl.", "metric": 0.95, "metrics": {"idea": "I16", "champion_B": "20/20", "champion_R": "19/20", "best_alt_B_cov": 0.965, "best_alt_R": "6/20"}}
{"run": 202, "segment": 15, "status": "discard", "idea": "I2", "timestamp": "2026-09-28T00:00:00Z", "description": "T195 conditional-buffer admission, hybrid 193+194 (director iter 20). Admit iff w191>=TAU50=68.0452 OR (w191>=TAU30=55.9211 AND jerk<=THETA[tool]), all thresholds train-locked bit-identical, frozen I7+I10, zero rig edits, frozen R173 files. HeldB yield 0.50 (+10pts vs T192, buffer kill not fired, precision 1.0, cov ok); pooled P(fail|admit) 0.1190 vs T173 0.1078 (lift -1.12, diode stands); failure-recall 0.333=T194 (director 71.2 MISSED); archive 0.0. Kill FIRES: tool-1 p_fail_adm 0.20 > T194 0.1471. DISCARD; I2 stays CLOSED; next I8.", "metric": 33.33, "metrics": {"idea": "I2", "variant": "T195 hybrid 193+194", "seeds": 20, "gate_mode": "post-hoc", "path": "fitted-frozen", "heldB_yield": 0.5, "buffer_add_pts_vs_192": 10.0, "pooled_p_fail_adm": 0.119, "failure_recall": 0.3333, "score_recall_pts": 33.33, "tool1_p_fail_adm": 0.2, "tool1_T194_baseline": 0.1471, "kill_tool_violation": true, "archive_adm_frac": 0.0, "theta_bitidentical": true, "TAU50": 68.0452, "TAU30": 55.9211}}
{"run": 203, "segment": 15, "status": "discard", "idea": "I2", "timestamp": "2026-09-28T00:00:00Z", "description": "T196 per-tool conformal admission, relaxed hybrid 194+202 (director iter 21). Admit iff w191>=TAU_tool[t] OR (w191>=TAU30_tool[t] AND jerk<=THETA[t]) with TAU_tool=Q10 calib-success w per tool (90pct recall) and TAU30_tool=Q30 calib-admitted w per tool, THETA bit-identical, frozen I7+I10, zero rig edits, frozen R173 files. HeldB yield 0.60 (+10pts vs T195, precision 1.0, cov ok); pooled failure-recall 0.40 vs T194 0.333 (+6.7pts direction confirmed, director 68-73 MISSED); selective-risk lift +0.31 first positive since T181. Abort FIRES (40<50) + tool-1 kill FIRES (0.1667>0.1471). DISCARD; I2 stays CLOSED; next I8.", "metric": 40.0, "metrics": {"idea": "I2", "variant": "T196 per-tool conformal", "seeds": 20, "gate_mode": "post-hoc", "path": "fitted-frozen", "heldB_yield": 0.6, "pooled_p_fail_adm": 0.1047, "failure_recall": 0.4, "score_recall_pts": 40.0, "lift_vs_T173_pts": 0.31, "tool1_p_fail_adm": 0.1667, "tool1_T194_baseline": 0.1471, "kill_tool_violation": true, "abort_lt_50": true, "archive_adm_frac": 0.0, "TAU_tool": {"0": 65.6704, "1": 61.6743, "2": 47.7216}, "TAU30_tool": {"0": 69.7876, "1": 70.6862, "2": 65.0841}}}
{"run": 204, "segment": 15, "status": "discard", "idea": "I2", "timestamp": "2026-09-28T00:00:00Z", "description": "T197 buffered per-tool conformal admission, union 202x203 (director iter 22). Admit iff w191>=TAU50_tool[t] OR (w191>=TAU30_tool[t] AND jerk<=THETA[t]) with TAU50_tool=median calib-admitted w per tool (t0 76.30, t1 76.27, t2 75.48), TAU30_tool bit-identical to T196, THETA bit-identical to T194, frozen I7+I10, zero rig edits, frozen R173 files. HeldB yield 0.40 (buffer zone EMPTY 0 eps, adds 0.0pts; per-tool -10pts vs global-TAU ablation); pooled failure-recall 0.4667 vs T194 0.333 (+13.3pts by strictness, n_adm 61 vs 96) but selective-risk lift -2.33 (p_fail 0.1311 vs T173 0.1078, diode stands, worst in T-series); no-buffer ablation identical recall 46.67 (buffer inert pooled too); global-TAU ablation 33.33=T194. Abort FIRES (46.67<50) + tool-1 kill FIRES 3rd time (0.25>0.1471). Director 52-58 MISSED; freeze branch (<45) narrowly missed at 46.67. DISCARD; I2 stays CLOSED; next I8.", "metric": 46.67, "metrics": {"idea": "I2", "variant": "T197 buffered per-tool conformal", "seeds": 20, "gate_mode": "post-hoc", "path": "fitted-frozen", "heldB_yield": 0.4, "buffer_zone_n_heldB": 0, "buffer_add_yield_pts": 0.0, "pertool_vs_global_yield_pts": -10.0, "pooled_p_fail_adm": 0.1311, "selective_risk_lift_vs_T173_pts": -2.33, "failure_recall": 0.4667, "score_recall_pts": 46.67, "ablation_no_buffer_recall": 0.4667, "ablation_global_TAU_recall": 0.3333, "tool1_p_fail_adm": 0.25, "tool1_T194_baseline": 0.1471, "tool1_kill_3rd_consecutive": true, "kill_tool_violation": true, "abort_lt_50": true, "director_freeze_lt_45": false, "per_tool_medians_spread_pct": 1.1, "why_falsified": "per-tool w medians within 1pct, no cross-tool scale variance to fix", "archive_adm_frac": 0.0, "TAU50_tool": {"0": 76.3023, "1": 76.2673, "2": 75.4775}}}
{"run": 205, "segment": 15, "status": "discard", "idea": "I2", "timestamp": "2026-09-28T00:00:00Z", "description": "T198 shrunk-buffered per-tool union (director iter 23). Admit iff w191>=TAU50*_tool[t] OR (w191>=TAU30*_tool[t] AND jerk<=THETA[t]) with TAU*_tool[t]=lam[t]*TAU_global+(1-lam[t])*TAU_tool[t], lam=20/(n_t+20) (t0 0.4082 n=29, t1 0.3333 n=40, t2 0.3390 n=39); shrunk TAU50*={72.93,73.53,72.96} TAU30*={64.13,65.76,61.98}; THETA bit-identical T194; frozen I7+I10; zero rig edits; frozen R173 files. HeldB yield 0.50 (+10pts vs T197; buffer ACTIVE 2/2 pass, +10pts vs no-buffer); pooled recall 40.0 vs T197 46.67 (-6.7pts, n_adm 71 vs 61); selective-risk lift -1.90 (diode stands); per-tool FPR t0 0.2222/t1 0.2083/t2 0.0; archive 0.0. Kill FIRES (40.0<=46.67). DISCARD; I2 stays CLOSED; next I8.", "rig": "experiments/kaggle_aegis_sweep.py", "command": "POST-HOC ONLY, zero rig edits, no rig run; timeout 300 python3 results/aegis_v2/I2_r198_analysis.py on frozen R173 files", "compare_champion": "trochoid", "metric": 40.0, "metric_unit": "transfer_success Fixture-B fitted Run-A decider (G2 primary; pooled failure-reject recall 40.0 in metrics)", "metrics": {"idea": "I2", "variant": "T198 shrunk-buffered per-tool union", "seeds": 20, "gate_mode": "post-hoc", "path": "fitted-frozen", "lam_tool": {"0": 0.4082, "1": 0.3333, "2": 0.339}, "TAU50_shrunk": {"0": 72.9321, "1": 73.5266, "2": 72.9581}, "TAU30_shrunk": {"0": 64.1278, "1": 65.7645, "2": 61.978}, "heldB_yield": 0.5, "heldB_keep_pct": 50.0, "pooled_failure_recall": 0.4, "score_recall_pts": 40.0, "vs_T197_yield_pts": 10.0, "vs_T197_recall_pts": -6.67, "selective_risk_lift_vs_T173_pts": -1.9, "per_tool_FPR": {"0": 0.2222, "1": 0.2083, "2": 0.0}, "ablation_no_shrink_T197_recall": 46.67, "ablation_no_buffer_recall": 46.67, "vs_T197_wins": 2, "vs_T197_losses": 1, "kill_le_204": true, "kill_keep_lt_40": false, "kill_loses_2of3": false, "archive_adm_frac": 0.0, "evidence": ["results/aegis_v2/I2_r198_analysis.py", "results/aegis_v2/I2_r198_result.json"]}}
{"run": 206, "segment": 15, "status": "discard", "idea": "I2", "timestamp": "2026-09-28T00:00:00Z", "description": "T199 global-only ablation (director iter 24). Admit iff w191>=TAU50_global=68.0452, zero per-tool tables, zero jerk gate; pooled 194+202 calib=recomputed train-locked bit-identical (theta_marg/C99/TAU/per-tool refs all bit-identical); frozen I7+I10; zero rig edits; frozen R173 files. HeldB yield 0.40 (=T197, -10 vs T198; precision 1.0; cov ok); pooled recall 46.67=T197 exactly (n_adm 60 vs 61), +6.67 vs T198; selective-risk lift -2.55 diode stands; FP-tool variance 0.011285 drops vs T197 0.012189 (-7.4%) but not vs T198 0.010328; archive 0.0. Win (>48 + var drop) FAILS on pts (46.67, director 52-58 MISSED). DISCARD; per director fail-branch: ABANDON w191-admission frontier entirely (global=per-tool: tables fit noise, signal plateaus at 46.67), move to new feature.", "rig": "experiments/kaggle_aegis_sweep.py", "command": "POST-HOC ONLY, zero rig edits, no rig run; timeout 300 python3 results/aegis_v2/I2_r199_analysis.py on frozen R173 files", "compare_champion": "trochoid", "metric": 46.67, "metric_unit": "transfer_success Fixture-B fitted Run-A decider (G2 primary; pooled failure-reject recall 46.67 in metrics)", "metrics": {"idea": "I2", "variant": "T199 global-only ablation", "seeds": 20, "gate_mode": "post-hoc", "path": "fitted-frozen", "TAU50_global": 68.0452, "heldB_yield": 0.4, "heldB_keep_pct": 40.0, "pooled_failure_recall": 0.4667, "score_recall_pts": 46.67, "vs_T197_recall_pts": 0.0, "vs_T198_recall_pts": 6.67, "selective_risk_lift_vs_T173_pts": -2.55, "FP_tool_variance": 0.011285, "FP_var_T197": 0.012189, "FP_var_T198": 0.010328, "var_drops_vs_T197": true, "win_gt_48": false, "archive_adm_frac": 0.0, "frontier_abandoned": true, "evidence": ["results/aegis_v2/I2_r199_analysis.py", "results/aegis_v2/I2_r199_result.json"]}}
