{"type": "node", "id": "N198-next", "run": 238, "segment": 15, "idea": "I18", "status": "frontier", "parent": "N197-I21", "metric": null, "verdict": "OPEN. Next executable queued idea is I18 (trochoid loops x the fixed fitted pitch), now unblocked by I21. Pre-registered caution from N197: `fitted` already sits at the analytic coverage ceiling 1.0000 on all six suite x tool cells, and the ceiling table predicts the composition also reaches 1.0000, so a coverage tie must be scored as a DISCARD and only a non-coverage (cycle-time) win can justify a keep. I8 remains BLOCKED/unblock-exhausted."}
{"type": "node", "id": "N199-I18", "run": 239, "segment": 15, "idea": "I18", "status": "discard", "parent": "N198-next", "metric": 1.0, "verdict": "DISCARD (dominated by its own part), rig mechanical keep=true against the champion. `fitro` = `fitted`'s footprint-aware row plan x the champion trochoid loops, added as ONE path mode with the loop operator shared verbatim (regression: champion bit-identical, 2280 fields x 60 eps, 0 diffs outside wall_s). Pre-counted in closed form first: ceiling(fitro) 0.9479-1.0000 vs ceiling(fitted) 1.0000 on all six suite x tool cells, L x1.013. Physical paired decider, 20 seeds x 3 suites, pose_noise 0,0, --compare trochoid: it DOES beat the champion on coverage_cont on every suite (A +0.0365 Welch p 3.92e-05, B +0.0383 p 6.87e-04, R +0.0339 p 1.71e-03, Fisher p 1.0 both saturated at 20/20, harness_errors 0) -- but against `fitted` on the same seeds it is -0.0281 / -0.0164 / -0.0234 (1.0000 -> 0.9719 / 0.9836 / 0.9766) and 1.3-4% longer, so the win only re-treads ground `fitted` already holds at the ceiling: exactly the N197/N198 pre-registration, scored DISCARD. MECHANISM: the loop operator (u0 + A cos w - A, v0 + A sin w) carries delta_u in [-2A,0] with MEAN -A = -0.015 m, so it drags the fitted band off-centre and re-opens I21's span defect as a thin interior v-line (1-5 cells of 64/96, 0.000-0.0073 m past r_eff). Mesh refuted: 10x denser phase sampling leaves every ceiling bit-identical. Physics channel empty: slip delta <= 1.4e-5 m, force_compliance delta <= 0.008 (B identical). Class-level: a-priori domination closes the compose-two-pieces family -- a plan at ceiling 1.0 with the shortest arclength cannot be improved by any non-zero-length offset.", "timestamp": "2026-09-29T11:05:00Z"}
{"type": "edge", "from": "N198-next", "to": "N199-I18", "kind": "executed", "run": 239, "idea": "I18", "label": "I18 executed as the lowest-numbered queued idea executable in the canonical rig after I21 unblocked it. Director's iter-9 FACC proposal (SE(3)-conditioned contact-energy scorer replacing the pi0 flow-matching head, predicted 78 pts) ADJUDICATED NOT EXECUTED on the run 234-237 precedent: unpairable in the canonical rig (G4), no local pi0 and checkpoints may never be downloaded, G3 retires energy-gated/flow-bridge re-derivations, and the FACC line is closed twice already (T225 r232, T226 r233); its own text scores 4.5 pts 'not BEST'. Zero screens, zero unvalidated rows: one 20-seed x 3-suite paired decider plus a no-physics closed-form pre-count.", "timestamp": "2026-09-29T11:05:00Z"}
{"type": "edge", "from": "N199-I18", "to": "N200-next", "kind": "derived", "run": 239, "idea": "I19", "label": "Class-level close of the path family, stated so it is not re-derived: once a plan attains the coverage ceiling (fitted: 1.0000, realised physically 20/20 at ceiling on all three suites) with the SHORTEST arclength measured (0.8939 m on B), every composition of it with an extra-length operator is dominated a priori (ceiling(P0 (+) delta) <= ceiling(P0) = 1, L(P0 (+) delta) >= L(P0)), and every pure path variant is a re-run of I16's plateau (run 201) or I17's retrace falsification (run 237). So no further path idea is proposed. Next executable queued idea is I19 (advisory slowdown gate: halve commanded speed on a veto, never retract) with I20 (proportional force-cap) behind it; I8 stays BLOCKED / unblock-exhausted, and its standing proposal remains curvature-aware servo re-tuning, not another path.", "timestamp": "2026-09-29T11:05:00Z"}
{"type": "node", "id": "N200-next", "run": 240, "segment": 15, "idea": "I19", "status": "frontier", "parent": "N199-I18", "metric": null, "verdict": "OPEN. Next executable queued idea is I19 (advisory slowdown gate). Pre-registered: at pose_noise 0,0 the champion's commanded force is smooth, so the trigger may not fire at all (no-op) -- therefore I19 is run at BOTH 0,0 and 0.01,2, the condition where run 167 logged 352 vetoes. Falsifiable in advance: if the response changes coverage_cont by 0.0000 and never fires in the scrub phase, the whole gate-rethink family (I19, I20) is closed with a cause. I8 remains BLOCKED/unblock-exhausted; path family closed by I18."}
{"type": "node", "id": "N201-I19", "run": 240, "segment": 15, "idea": "I19", "status": "discard", "parent": "N200-next", "metric": 1.0, "verdict": "DISCARD, and the cause transfers to the last gate idea. Two paired 20-seed x 3-suite runs (pose_noise 0,0 and 0.01,2), candidate AEGIS_GATE_ADVISORY=1 vs paired baseline =0 on identical seeds, harness_errors 0, rig keep=false on BOTH records: coverage_cont delta 0.0000 on all six suite x noise cells (Welch p=1.0, Fisher p=1.0), success 20/20/19/20 -> unchanged at 0,0 and 15/15/13 -> unchanged at 0.01,2. The gate FIRED (47-50 vetoes on B, 187-195 slowed ticks = 4.7 lost tick-equivalents of a 0.9098 m path) and changed nothing: it never fired where the work is. Across 120 candidate episodes and 190 vetoes, veto_scrub = 0 and veto_scrub_contact = 0 on every suite x noise cell (0/20 episodes with a contact-phase veto anywhere). ROOT CAUSE: GATE_MAX_JERK=0.618 is the threshold of the EPISODE statistic (mean of squared vector second differences; champion 0.0028-0.0098, max 0.0200) but is applied in-loop to a PER-TICK absolute second difference of the commanded force MAGNITUDE in newtons on a 3.0 N clamp (measured per-tick max 0.671-4.741, all in the pre-contact approach ramp) -- a units mismatch that makes the trigger ~30x looser than the real signal and ~30x tighter on transients. The slowdown therefore cannot touch the swept patch, and the r_eff=0.035 m dilation of _coverage_cont absorbs the small arclength it does cost. I19's own bar is also unmet: R success unchanged but slip -3e-6 m (p=0.281) and fn_p95 +0.0148 N (p=0.398, worse). Director iter-10 FACC (adaptive affordance manifold + SE(3) contact-energy attention) adjudicated NOT executed, per the run 234-239 precedent: unpairable in the canonical rig (G4), no local pi0 and no local checkpoints, G3 retires energy-gated/flow-bridge re-derivations, and the FACC line is already closed twice on physical data (r232, r233)."}
{"type": "edge", "from": "N200-next", "to": "N201-I19", "kind": "executed", "run": 240, "idea": "I19", "label": "I19 executed as the lowest-numbered queued idea executable in the canonical rig. Director's iter-10 build (SE(3)-conditioned FACC, adaptive affordance manifold + energy-based physical in-context attention, predicted 2.8/74) ADJUDICATED NOT EXECUTED on the run 234-237/239 precedent. Run at 2 pose-noise conditions x 3 suites x 20 seeds x 2 paired arms = 240 episodes, plus a default-env regression rerun (60 eps, 0 diffs in any scored field). Zero screens, zero unvalidated rows: two full 20-seed paired deciders, both executed and both scored.", "timestamp": "2026-09-29T11:35:00Z"}
{"type": "edge", "from": "N201-I19", "to": "N202-next", "kind": "derived", "run": 240, "idea": "I20", "label": "Class-level close of the gate-rethink family, stated so it is not re-derived: an in-loop RESPONSE is only as good as its TRIGGER, and this trigger has 0 scrub-phase occurrences in 120 measured episodes (I19.2). Since success = coverage_cont >= 0.90 computed from physics contacts inside the scrub, and slip/fn_p95/jerk all move by <1e-2 relative, no response keyed to the pre-contact approach ramp (slowdown, dwell, proportional force-cap, retraction) can move the primary metric. I20 is therefore PRE-FALSIFIED and worth only a record run; a keep would require a NEW TRIGGER -- the per-tick jerk of the force commanded while ph=='scrub' AND in contact, thresholded at the scale the scrub exhibits (measured scrub episode jerk 0.003-0.020, i.e. a threshold ~2 orders below 0.618) -- which is a new trigger, not a new response, and is the only admissible version of this idea left. Path family stays closed (I18 domination); I8 stays BLOCKED / unblock-exhausted; no new path, containment, press or gate wrapper is proposed.", "timestamp": "2026-09-29T11:35:00Z"}
{"type": "edge", "from": "N202-next", "to": "N203-I20", "kind": "tested", "run": 241, "idea": "I20", "label": "I20 proportional force-cap gate, run on the canonical rig with the NEW scrub-contact trigger that I19.5 left as the one admissible redefinition. Theta calibrated from physics, not guessed: the trigger quantity logged on the frozen champion arm has a GLOBAL MAX of 0.6001 over 60 episodes, so GATE_MAX_JERK=0.618 sits ABOVE the entire scrub-contact distribution - the I19 inert-trigger finding confirmed on physics rather than asserted. Six arms at 0,0 (theta 0.01/0.05/0.15 x floor 0.15/0.30/0.60) plus a jerk-FREE static control, repeated at 0.01,2. RESULT keep=false everywhere.", "key_numbers": "B coverage_cont 0.9453 -> 0.9492 best (Welch p=0.754, 20/20 -> 20/20, Fisher p=1.0); A 0.9354 -> 0.9354 (p=1.0); R 0.9427 -> 0.9471 (p=0.754, 19/20 -> 20/20); at 0.01,2 B 0.9398 -> 0.9437 with 15/20 -> 15/20. slip 0.01059 -> 0.00549 m (Welch p=1.5e-04) but force_compliance 1.000 -> 0.213. mean press_scale on triggered ticks = GATE_PROP_MIN to 4 decimals in all six arms. Spearman slip~press rho=+0.77 (p=0.072) vs slip~theta rho=+0.15 (p=0.774).", "status": "discard", "metric": 0.9492, "evidence": "results/aegis_v2/I20_r241_*"}
{"type": "node", "id": "N203-I20", "run": 241, "idea": "I20", "status": "discard", "metric": 0.9492, "label": "Proportional force-cap gate: the CONTINUUM does not exist without memory. A one-tick trigger is only evaluated on ticks that already exceed it, and on those ticks clip(1-(j-0.7t)/(0.3t), s_min, 1) is already at s_min - measured mean press_scale = 0.3000/0.3000/0.3000/0.3000/0.6000/0.1500 across the six arms, equal to GATE_PROP_MIN in every one. So bang-bang vs proportional, the axis both I19 and I20 were framed on, is not a distinction this loop can express. And the new trigger I19.5 left open is not a control signal: flat across a 15x dose range, with a jerk-FREE static arm (theta=1e-4) reproducing its whole effect (slip 0.00641 vs 0.00664, covc 0.9476 vs 0.9461). The slip gain is a tautology of the reduced press, paid for with force_compliance 1.000 -> 0.213 - the same normal-force floor as I11 (run 235), where N >= m g on a 0.08-0.105 kg foam head means pressing less can only drop the head out of the contact band.", "closure": "Gate-rethink family (I19, I20) CLOSED on physical data. A further gate must key on a quantity that is BOTH stateful AND causally upstream of coverage_cont - in this rig that is the path plan, not the force loop.", "self_inflicted_bug_logged": "clip was first written min(lo, max(0,x)) making GATE_PROP_MIN a CEILING and driving the press to 0.0; corrected to max(lo, min(hi,x)), assertion added, pre-fix files preserved as I20_r241_BUG_clipceiling_*.jsonl, all quoted numbers from post-fix runs."}
{"type": "edge", "from": "N203-I20", "to": "N204-next", "kind": "derived", "run": 241, "idea": "next", "label": "Two class-level closes, in order, so neither is re-derived. (1) RESPONSE SHAPE IS NOT A DESIGN VARIABLE without memory: a memoryless one-tick law is evaluated only on triggered ticks and lands on its own floor, so I19 and I20 differ only in a label. (2) The force-loop gate is closed: the scrub-contact trigger is measurably flat, a jerk-free static press cut reproduces it, and the mechanism it exposes - slip falls as press falls - is the I11 normal-force floor again (run 235), which the rig mass/geometry fix, not a gate, has to address. The next force-loop idea must add MEMORY (an IIR envelope over j) and key on a quantity causally upstream of coverage_cont; the next path idea must stay on the champion, whose coverage is already at ceiling 1.0000 on fixture-B (I21) with the open gap being pose noise (I9/Tier-2 registration, I5) rather than footprint."}
{"type": "edge", "from": "N204-next", "to": "N205-I3", "kind": "tested", "run": 242, "idea": "I3", "label": "I3 residual PPO on the champion: a = a_trochoid + clip(pi(o), +-0.02 m) in the fixture frame, 6405-param net, trained 200408 scrub ticks on fixture_A+B at 1cm/2deg with fixture_R held out, deployed through the rig's own RESIDUAL_HOOK_FN (zero rig edits) and scored by the rig's own paired --compare record at pose_noise 0,0 AND 0.01,2, 20 seeds x 3 suites x 2 arms each. RESULT: the rig says keep=true (B coverage_cont 0.9398 -> 0.9961, Welch p 1.04e-04) and the idea is scored DISCARD, on three independent measurements.", "key_numbers": "PPO arm 0.01,2: A 0.9896/20, B 0.9961/20, R 0.9815/19 (R Fisher p 0.043596); 0,0: all 1.0000, 20/20. Net action over 2e4 plausible obs: mean (du,dv)=(-0.0115,+0.0192), sd (0.0052,0.0017), ||E a||/E||a||=0.976. Zero-parameter constant (0,+0.025) BEATS it everywhere: 0,0 B 1.0000 R 20/20 (Welch p 5.26e-06); 0.01,2 A 0.9917 B 0.9992/20 R 0.9826/20 with R Fisher p 0.008316. Controls: INERT hook-ignored delta 0.0000 keep=false (plumbing inert); zero-mean jitter RMS 7mm B 0.9563 at jerk 0.369 (27x) so the gain is NOT extra swept area; u+0.020 and u-0.015 keep=false; v MIRROR -0.025 B 0.7680, 3/20, keep=false.", "status": "discard", "metric": 1.0, "evidence": "results/aegis_v2/I3_r242_*"}
{"type": "node", "id": "N205-I3", "run": 242, "idea": "I3", "status": "discard", "metric": 1.0, "label": "A residual policy on a force-driven plan can only return the plan's own constants, and here the constant is closed-form. Three measurements say it. (1) The deployed 6405-param net is 97.6% its own mean action: mean (du,dv) = (-0.0115, +0.0192). (2) A zero-parameter constant at the closed-form value beats it on all three suites at both noise conditions and at 0 params / 0 VRAM / 0 ms. (3) The I3 spec's own bar is not met: R >= 0.95 yes, but Fisher p = 0.043596, and 6 discordant fail->success pairs cannot reach p<0.01 at 20 seeds (5 -> 0.047124, 7 -> 0.008316); the constant cleared 7. The 2026-09-28 freeze independently bans learned/adaptive variants from keeps.", "closure": "THE MECHANISM IS A PLANNER BUG, NOT A LEARNING PROBLEM. scrub_uv builds rows = [v0 + r*CELL_M] with v0 = -side/2, so the band is anchored at the -v EDGE, while scrub_grid is anchored the same way: plan_centre = patch_centre - CELL_M/2 exactly, for every side and nv. On fixture_B that is nv=2, rows [-0.060,-0.010], plan v span [-0.0750,+0.0049] against fine cell v centres up to +0.0275, and 100% of the champion's misses (analytic ceiling 0.9219/0.9531/1.0000 for r_eff 0.035/0.04/0.05) sit on the TOP v row. The centring law is dv* = CELL_M/2 = +0.025 m, and it is a PLATEAU, not a knife edge (+-0.010 on both suites, all three pads), which is what makes it a centring law rather than a tuned offset.", "pre_transfer": "A defect that is expressible in closed form must be fixed in the planner: a policy that must rediscover CELL_M/2 pays 6405 params, a 200k-step training run and a stochastic decider to land on 77% of a number the geometry already fixes. I3 closes the residual-PPO family; the physical effect is real and is handed to I22 as a plan-time fix, pre-registered from the arms already on disk.", "self_inflicted_bug_inherited": "The first trainer's GAE had no gamma on the lambda term (multiplier GAMMA+LAM = 1.94 > 1) -> advantage inf -> NaN weights -> np.clip(NaN) deployed as a constant +0.02 m in BOTH axes. Found by the previous worker, fixed to the textbook GAE, assertion added, pre-fix artefacts preserved as I3_r241_BUG_gae_nan_*; every number here is post-fix."}
{"type": "edge", "from": "N205-I3", "to": "N206-next", "kind": "derived", "run": 242, "idea": "next", "label": "Three closures, in the order they should not be re-derived. (1) A learned residual on a hand-written plan has nothing to learn that the plan does not already determine; when the action collapses to 97.6% of its mean and a constant beats it, the honest verdict is that the PLAN is wrong, not that the policy needs more capacity or more steps. (2) The row-anchor defect is a general PLANNER class, not a fixture-B quirk: any path built as [v0 + r*CELL_M] from v0 = -side/2 sits exactly CELL_M/2 low in v for every patch size, so the fix is one term in the row list -- I22, pre-registered, no policy, and it should also cut the mean_jerk 0.0135 -> ~0.0104 that every command-offset arm pays for stepping the target 2.5 cm at the scrub entry. (3) Two measurement rules that this iteration needed and that earlier rows did not have: an INERT control (hook present, output ignored) to prove the injection plumbing is inert before believing any delta, and a dose-response with a MIRROR arm, which is what turned 'a +v offset helps' into 'the plan is half a cell off-centre'."}
{"type": "edge", "from": "N206-next", "to": "N207-I22", "kind": "tested", "run": 243, "idea": "I22", "label": "I22 row-centring: the I3 planner bug fixed AT PLAN TIME. One term in the row list -- rows = v0 + (r + 0.5*ROW_CENTRE)*CELL_M -- behind the compare knob AEGIS_ROW_CENTRE (1 = the fix, 0 = the frozen expression). Pre-count on the rig's own _coverage_cont, no physics: champion ceiling 0.9219 -> 1.0000 (B) and 0.9062 -> 1.0000 (A) at r_eff 0.035, path_len_ratio 1.000000, max_turn_deg unchanged (17.63/45.37 vs the 60 deg bound). Paired 20 seeds x 3 suites x 2 arms vs --compare-env AEGIS_ROW_CENTRE=0.0, harness_errors 0: 0,0 A 0.9354->1.0000 (p 1.35e-09) / B 0.9453->1.0000 (p 5.26e-06) / R 0.9427->1.0000 (p 1.24e-06), std 0.0, 20/20/19->20/20/20; 0.01,2 A 0.9307->0.9964 (p 7.14e-06) / B 0.9398->0.9961 (p 1.06e-04) / R 0.9068->0.9859 (p 4.71e-04), 15/15/13 -> 20/20/20 with R Fisher p 0.008316. rig keep=true on both records. Baseline arm BIT-IDENTICAL to run 242's champion compare arm (60 eps x 81 fields, 0 diffs) and to v2_trochoid_0,0.jsonl (60 eps x 31 shared fields, 0 diffs). Dose-response at 0.01,2: ROW_CENTRE 0.4/0.6/1.0/1.4/2.0 -> R 17/20, 18/20, 20/20, 20/20, 16/20; peak exactly at dv = CELL_M/2, saturation band [0.6,1.4] = +-0.010 m, so a plateau not a tuned offset. spiral/fitted/fitro polylines unchanged. One I3 prediction REFUTED: mean_jerk reaches the predicted 0.0104 but does not FALL vs the champion (0.01034 vs 0.01038) -- an isometric translation cannot change force second differences.", "key_numbers": "0,0: A/B/R 1.0000/1.0000/1.0000 (std 0.0, min per-episode 1.0000); 0.01,2: A 0.9964 B 0.9961 R 0.9859, 20/20 x3, R Fisher p 0.008316. Coverage deltas +0.0646/+0.0547/+0.0573 (0,0) and +0.0656/+0.0563/+0.0792 (0.01,2). Path length identical (0.9098 m on B both arms). jerk B 0.00976 vs 0.00979; force_compliance A 0.4864 vs 0.4778, R 0.7548 vs 0.7536.", "status": "keep", "metric": 1.0, "evidence": "results/aegis_v2/I22_r243_*"}
{"type": "node", "id": "N207-I22", "run": 243, "idea": "I22", "status": "keep", "metric": 1.0, "label": "The residual-PPO line ends where it should: the 6405-parameter policy was re-discovering a CONSTANT, and the constant was a one-term defect in the row list. Placing the rows on the CENTRES of the coarse cells they are meant to sweep (dv* = CELL_M/2 = +0.025 m, I22.1) lifts the champion from 0.9453 to the scoring ceiling 1.0000 on all three suites at 0,0 and takes the held-out customer fixture_R from 0.9068 to 0.9859 at 1cm/2deg with 20/20. It is not a tuned offset: the saturation band is dv in [+0.015,+0.035] on both suites and the dose peaks exactly at the closed-form value. And it is free: an isometric translation of the plan, so path_len_m and the C1 metric are unchanged to every digit.", "closure": "A path plan is a statement about which cells must be swept, and the rig's own scorer defines those cells as org + (j+0.5)*CELL_M. `rows = [v0 + r*CELL_M]` from v0 = -side/2 puts every row on a cell's LOWER EDGE, so the whole band sits CELL_M/2 low in v for every patch size -- the top v row is then covered only by the loop amplitude's r_eff dilation, which is why the champion's analytic ceiling is 0.9219/0.9531/1.0000 rather than 1.0. This is the second independent planner defect I21 found (that one was the row COUNT); both land on the same ceiling from opposite directions, which is convergent evidence that the span/anchor condition, not the path MODE, was the binding constraint. It is a PLANNER class: raster and rounded gain the same 0.7500/0.8333 -> 1.0000 with identical arclength, while spiral/fitted/fitro are bit-identical under the knob.", "evidence": "results/aegis_v2/I22_r243_rowcentre_n00.jsonl, I22_r243_rowcentre_n012.jsonl, I22_r243_dose_rc*_n012.jsonl, I22_r243_analytic.json, I22_r243_analysis.txt; equations.md ROW I22"}
