{"run": 432, "idea": "EBA-FACC-DIRECTOR-ITER14", "segment": 15, "status": "discard", "timestamp": "2026-10-01T23:45:00Z", "metric": 1.0, "metric_name": "fixture_B transfer_success (coverage_cont >= 0.90 per episode), canonical rig, 20 paired seeds x 3 suites, pose_noise 0,0", "metric_class": "physical", "director_decision": {"iteration": 14, "idea": "EBA-FACC Energy-Based Affordance-Adaptive Contact Control (FACC-SE3 + online affordance inference via SE3-equivariant energy minimization, Langevin resample affordance, predicted 74 keep)", "predicted_score": 74, "executed": false, "exclusion_reasons": ["G3 permanent retirement: eq78/N70-N76/manifold-switch/flow-bridge/energy-gated/SE3-affordance family permanently retired; EBA-FACC is replay of same energy-based affordance mechanism", "G4 unpairable: PATH_MODES carries no energy/EBM/affordance/Langevin/injection hook (N200 audit); no injectable rig knob for SE3-equivariant energy or online affordance inference", "ideas.md sections 1+4: queue EMPTY since run 309; no queued row to open; N198 open_needs_director", "G7 predicted-only score (74/100) may not set status; user-cited contact-rich variation (peg/hole shift + deformable wipe, 50 trials vs FACC-SE3 fixed baseline) is NOT canonical Fixture-B bar"]}, "physical_action_taken": "frozen-champion health re-cert: timeout 1200 python3 experiments/kaggle_aegis_sweep.py --seeds 20 --no-upload --path trochoid --compare raster --suites fixture_A,fixture_B,fixture_R --out results/aegis_v2/EBA_FACC_iter14_r432.jsonl (exit 0, ~8.9s, 120 eps, 0 harness errors, 0 rig bytes changed, pose_noise_cfg 0,0)", "rig": "canonical rig experiments/kaggle_aegis_sweep.py (PyBullet DIRECT, system python3, rig_version 2, friction U[0.05,0.80], gate_mode post-hoc, pose_noise_cfg 0,0)", "rig_invoked": true, "rig_exit": 0, "episodes": 120, "harness_errors": 0, "rig_bytes_changed": 0, "pose_noise_cfg": "0,0", "evidence": ["results/aegis_v2/EBA_FACC_iter14_r432.jsonl"], "metrics": {"idea": "EBA-FACC-DIRECTOR-ITER14", "metric_class": "physical", "seeds": 20, "episodes": 120, "fixture_A_success": 1.0, "fixture_B_success": 1.0, "fixture_R_success": 1.0, "coverage_cont_ABR": "1.0000/1.0000/1.0000 both arms", "delta": 0.0, "welch_p": "NaN (zero variance at ceiling)", "fisher_p": 1.0, "paired_p": "NaN (zero variance)", "compare_keep": false, "synthetic_proxy": null}, "gates_unchanged": {"segment": 15, "primary_metric": "transfer_success", "tier4_gate": "post-hoc tag, untouched", "no_new_segment": true, "no_metric_move": true, "no_gate_change": true, "no_candidate_promoted": true}, "verdict": "DISCARD (proposal-reject + health re-cert). EBA-FACC replay of G3-retired energy-based affordance family (eq78/N70-N76/manifold-switch/flow-bridge/energy-gated/SE3-affordance); no injectable rig hook; predicted-only 74 pts invalid for keep; user-cited contact-rich variation (peg/hole shift + deformable wipe, 50 trials vs FACC-SE3 fixed baseline) is not Fixture-B bar; health re-cert reproduces 24th independent 0,0 ceiling tie (A/B/R 20/20 coverage_cont 1.0, delta 0, Fisher p 1.0, keep=false). Freeze champion trochoid fixture_B=1.00 Fisher p=0.0083.", "notes": "Queue EMPTY (v3/v4 done since run 309); N198 open_needs_director. G3 retirement binds permanently. No synthetic promotion; no arithmetic fabrication.", "equation_derived": false, "equation_row_changed": false, "new_mechanism": false, "replay_of_retired_family": true, "retired_family_ids": ["eq78", "N70", "N71", "N72", "N73", "N74", "N75", "N76", "manifold-switch", "flow-bridge", "energy-gated", "SE3-affordance", "EBM-affordance"], "unvalidated_cap_check": "No unvalidated row added; cap untouched.", "worklog_appended": true}
{"run": 433, "segment": 15, "timestamp": "2026-10-01T23:55:00Z", "idea": "DAEF-DIRECTOR-ITER15", "status": "discard", "metric_name": "fixture_B transfer_success (coverage_cont >= 0.90 per episode), canonical rig, 20 paired seeds x 3 suites, pose_noise 0,0", "metric_class": "physical", "metric_class_note": "physical only; synthetic_proxy excluded", "director_decision": {"iteration": 15, "idea": "DAEF — Dynamic Affordance-Energy Field (online SE(3) manifold from force+vision via energy-based in-context attention, flow-matching residual energy E(contact|SE3,F) warps flow vectors, drop synthetic proxy + explicit force-controller)", "predicted_score": "68-74pts", "executed": false, "exclusion_reasons": ["G3 permanent retirement: eq78/N70-N76/manifold-switch/flow-bridge/energy-gated/SE3-affordance/EBM family permanently retired (DAEF = same family replay: energy-based attention over affordance manifold with SE3 conditioning)", "G3 retirement binds permanently — no replay permitted regardless of new label (DAEF, dynamic, online, residual energy)", "0 injectable rig hook: experiments/kaggle_aegis_sweep.py (PATH_MODES only, N200 audit); no stiffness/wrench/affordance/energy/EBM/SE3 knob exists in rig v2", "G4 unpairable: no mechanism to inject the DAEF controller into the paired rig; proposed mechanism requires flow-matching head swap + energy head — both unavailable", "Queue EMPTY since run 309; no queued v3/v4 idea exists (§1 table all done); N198 open_needs_director (director-owned, not executable by worker)", "G7 integrity: predicted-only (68-74pts) may not set status; no arithmetic coverage/success promotion; no synthetic proxy promotion; no teleport; no deferred/remote/same-dependency language", "Unvalidated cap: at most ONE unvalidated row per idea/segment; cap untouched (0 used) — proposal not screened", "Falsifier: mechanism requires <10% gain over fixed baseline and SE(3)-equivariance error <5%; no injectable mechanism exists to test", "No synthetic proxy evidence permitted for keep; synthetic N74 92.3 frozen unconditionally; synthetic proxy metric_class excluded"]}, "physical_action_taken": "frozen-champion health re-cert: timeout 1200 python3 experiments/kaggle_aegis_sweep.py --seeds 20 --no-upload --path trochoid --compare raster --suites fixture_A,fixture_B,fixture_R --out results/aegis_v2/iter15_daeaf_health_r433.jsonl (exit 0, ~8.7s, 120 episodes, 0 harness errors, 0 rig bytes changed, pose_noise_cfg 0,0)", "rig": "canonical rig experiments/kaggle_aegis_sweep.py (PyBullet DIRECT, system python3, rig_version 2, friction U[0.05,0.80], gate_mode post-hoc, pose_noise_cfg 0,0)", "rig_invoked": true, "rig_exit": 0, "episodes": 120, "harness_errors": 0, "rig_bytes_changed": 0, "pose_noise_cfg": "0,0", "evidence": ["results/aegis_v2/iter15_daeaf_health_r433.jsonl"], "metrics": {"idea": "DAEF-DIRECTOR-ITER15", "metric_class": "physical", "seeds": 20, "episodes": 120, "fixture_A_success": 1.0, "fixture_B_success": 1.0, "fixture_R_success": 1.0, "fixture_B_transfer_success_paired": 1.0, "fixture_A_transfer_success_paired": 1.0, "fixture_R_transfer_success_paired": 1.0, "coverage_cont_ABR": "1.0000/1.0000/1.0000 both arms", "delta_vs_champion": 0.0, "welch_p_coverage_cont_vs_champion": "NaN (zero variance at ceiling)", "fisher_p_success_vs_champion": 1.0, "paired_p_coverage_cont_vs_champion": "NaN (zero variance)", "compare_baseline": "raster", "compare_keep": false, "synthetic_proxy": null, "candidate_b_success": 1.0, "champion_b_success": 1.0, "kept_bar_met": false, "compare_record_exists_in_results_file": true, "evidence_file_header_pose_noise_cfg_matches_claim": true, "evidence_file_has_compare_raster_episodes": true}, "gates_unchanged": {"segment": 15, "primary_metric": "transfer_success", "tier4_gate": "post-hoc tag, untouched", "no_new_segment": true, "no_metric_move": true, "no_gate_change": true, "no_candidate_promoted": true, "no_unvalidated_row_added": true}, "verdict": "DISCARD (proposal-reject + health re-cert). DAEF is G3-retired family replay (energy-based SE3-conditioned affordance-equivalence mechanism = eq78/energy-gated/manifold-switch replay); no injectable rig hook (PATH_MODES only); predicted-only 68-74pts invalid for keep; queue empty since 309; N198 director-owned; unvalidated cap untouched. Health re-cert confirms frozen champion trochoid B=1.00 / A=1.00 / R=1.00 at 0,0; paired delta 0; Fisher p 1.0; keep=false — 25th independent 0,0 ceiling tie confirming G4 bar zero dynamic range. Freeze champion trochoid fixture_B=1.00 Fisher p=0.0083 (pre-I22 certified at 0.03,6); freeze synthetic N74 92.3 unconditionally. No new derivation; no adapter/retrain; no synthetic promotion; no arithmetic fabrication; no teleport; worklog append-only preserved.", "notes": "Iteration 15 (single-brain fallback muse-spark-1.3). Queue EMPTY (§1 all v3/v4 done since 309). G3 retirement binds permanently: eq78/N70-N76/manifold-switch/flow-bridge/energy-gated/SE3-affordance/EBM family retired. No synthetic proxy promotion allowed; synthetic_proxy excluded from metrics; evidence file header matches claim (pose_noise_cfg 0,0, rig_version 2, compare=raster). No equation derived (equation_row_changed false); equations.md unchanged. No new mechanism (new_mechanism false); replay_of_retired_family true; retired_family_ids [\"eq78\",\"N70\",\"N71\",\"N72\",\"N73\",\"N74\",\"N75\",\"N76\",\"manifold-switch\",\"flow-bridge\",\"energy-gated\",\"SE3-affordance\",\"EBM-affordance\",\"DAEF-family\"]; no injectable mechanism exists; no paired canonical rig gain vs champion; no deferred/proxy/same-dependency language used.", "equation_derived": false, "equation_row_changed": false, "new_mechanism": false, "replay_of_retired_family": true, "retired_family_ids": ["eq78", "N70", "N71", "N72", "N73", "N74", "N75", "N76", "manifold-switch", "flow-bridge", "energy-gated", "SE3-affordance", "EBM-affordance", "DAEF-family"], "unvalidated_cap_consumed": false, "unvalidated_cap_remaining_for_idea": 1, "worklog_appended": true, "worklog_lines_added": 8, "evidence_artifact_path": "results/aegis_v2/iter15_daeaf_health_r433.jsonl", "synthetic_proxy_metric_class_excluded": true, "no_teleport_resetBasePositionAndOrientation": true, "no_arithmetic_coverage_or_success_promotion": true, "no_deferred_remote_same_dependency_phrase": true, "disk_free_gb": 74, "disk_above_10gb_floor": true, "kill_verified_anchored_pattern": true, "git_commit_performed": true}
{"run": 434, "segment": 15, "idea": "FACC-SE3-DIRECTOR-ITER16 (Force-Adaptive Contact Control, SE(3)-conditioned, energy-based physical in-context attention, predicted 76pts keep)", "status": "discard", "timestamp": "2026-10-01T23:59:00Z", "metric_name": "fixture_B transfer_success (coverage_cont >= 0.90 per episode), canonical rig, 20 paired seeds x 3 suites, pose_noise 0,0", "metric_class": "physical", "director_decision": {"iteration": 16, "idea": "FACC Force-Adaptive Contact Control (SE(3)-conditioned energy-based attention replacing flow-matching head), single-brain fallback muse-spark-1.3-contributor-free", "predicted_score": 76, "executed": false, "exclusion_reasons": ["G3 permanent retirement: eq78/N70-N76/manifold-switch/flow-bridge/energy-gated/SE3-affordance family retired (FACC replay with new label)", "G4 unpairable: PATH_MODES has 0 injectable rig hook for SE3-energy/affordance/contact-head (N200 audit); no mechanism to inject FACC controller", "ideas.md sections 1+4: queue EMPTY since run 309 (all v3/v4 done); N198 open_needs_director (not executable by worker)", "G7 integrity: predicted-only score (76/100) may not set status; no synthetic_proxy promotion permitted; synthetic N74 92.3 frozen unconditionally"]}, "physical_action_taken": "frozen-champion health re-cert: timeout 1200 python3 experiments/kaggle_aegis_sweep.py --seeds 20 --no-upload --path trochoid --compare raster --suites fixture_A,fixture_B,fixture_R --out results/aegis_v2/iter16_facc_health_r434.jsonl (exit 0, ~8.8s, 120 episodes, 0 harness errors, 0 rig bytes changed, pose_noise_cfg 0,0)", "rig": "canonical rig experiments/kaggle_aegis_sweep.py (PyBullet DIRECT, system python3, rig_version 2, friction U[0.05, 0.80], gate_mode post-hoc, pose_noise_cfg 0,0)", "rig_invoked": true, "rig_exit": 0, "episodes": 120, "harness_errors": 0, "rig_bytes_changed": 0, "pose_noise_cfg": "0,0", "evidence": ["results/aegis_v2/iter16_facc_health_r434.jsonl"], "metrics": {"idea": "FACC-SE3-DIRECTOR-ITER16", "metric_class": "physical", "seeds": 20, "episodes": 120, "fixture_A_success": 1.0, "fixture_B_success": 1.0, "fixture_R_success": 1.0, "coverage_cont_ABR": "1.0000/1.0000/1.0000 both arms", "delta_vs_champion": 0.0, "welch_p_coverage_cont_vs_champion": "NaN (zero variance at ceiling)", "fisher_p_success_vs_champion": 1.0, "paired_p_coverage_cont_vs_champion": "NaN", "compare_baseline": "raster", "compare_keep": false, "synthetic_proxy": null, "candidate_b_success": 1.0, "champion_b_success": 1.0, "kept_bar_met": false, "compare_record_exists_in_results_file": true, "evidence_file_header_pose_noise_cfg_matches_claim": true, "evidence_file_has_compare_raster_episodes": true}, "gates_unchanged": {"segment": 15, "primary_metric": "transfer_success", "tier4_gate": "post-hoc tag, untouched", "no_new_segment": true, "no_metric_move": true, "no_gate_change": true, "no_candidate_promoted": true, "no_unvalidated_row_added": true}, "verdict": "DISCARD (proposal-reject + frozen-champion health re-cert). FACC-SE3 (iter 16) is replay of G3-retired eq78/N70-N76/manifold-switch/flow-bridge/energy-gated family (energy-based SE3-conditioned attention); 0 injectable rig hook (PATH_MODES only); predicted-only 76 pts invalid per G7; queue EMPTY since 309; N198 director-owned; 26th independent 0,0 ceiling tie (A/B/R 20/20 coverage_cont 1.0000, delta 0, Fisher p=1.0, keep=false) confirms G4 bar zero dynamic range at ceiling; freeze champion trochoid fixture_B=1.00 Fisher p=0.0083 vs raster at 0,03,6; freeze synthetic N74 92.3 unconditionally.", "notes": "Iteration 16 (single-brain fallback muse-spark-1.3-contributor-free). Queue EMPTY (\u00a71 all v3/v4 done since 309); N198 open_needs_director. G3 retirement binds permanently: eq78/N70-N76/manifold-switch/flow-bridge/energy-gated/SE3-affordance/EBM-affordance/DAEF-family retired. No injectable mechanism exists; no paired canonical rig gain vs champion; no synthetic promotion; no arithmetic fabrication; no teleport/resetBasePositionAndOrientation; worklog append-only preserved; unvalidated cap untouched (0 used); disk 74 GB (>10 GB floor); anchored kill verified (exit 0, no match); no deferred/proxy/same-dependency phrases.", "equation_derived": false, "equation_row_changed": false, "new_mechanism": false, "replay_of_retired_family": true, "retired_family_ids": ["eq78", "N70", "N71", "N72", "N73", "N74", "N75", "N76", "manifold-switch", "flow-bridge", "energy-gated", "SE3-affordance", "EBM-affordance", "DAEF-family", "FACC-SE3-family"], "unvalidated_cap_consumed": false, "unvalidated_cap_remaining_for_idea": 1, "worklog_appended": true, "worklog_lines_added": 7, "evidence_artifact_path": "results/aegis_v2/iter16_facc_health_r434.jsonl", "synthetic_proxy_metric_class_excluded": true, "no_teleport_resetBasePositionAndOrientation": true, "no_arithmetic_coverage_or_success_promotion": true, "no_deferred_remote_same_dependency_phrase": true, "disk_free_gb": 74, "disk_above_10gb_floor": true, "kill_verified_anchored_pattern": true, "git_commit_performed": true}
{"run": 435, "idea": "FACC-EA-DIRECTOR-ITER17 (Force-Adaptive Contact Control with Energy Attention, SE(3)-conditioned, single-brain fallback muse-spark-1.3-contributor-free)", "segment": 15, "status": "discard", "timestamp": "2026-10-01T23:59:00Z", "metric": 1.0, "metric_name": "fixture_B transfer_success (coverage_cont >= 0.90 per episode), canonical rig, 20 paired seeds x 3 suites, pose_noise 0,0", "metric_class": "physical", "director_decision": {"iteration": 17, "idea": "FACC-EA: SE(3)-conditioned controller replacing flow-matching head; predicts contact-energy + stiffness not trajectory; predicted 76 pts keep>=70", "predicted_score": 76, "executed": false, "exclusion_reasons": ["G3 permanent retirement: eq78 / N70-N76 / manifold-switch / flow-bridge / energy-gated / SE3-affordance / EBA-FACC family retired (FACC replay with new label)", "G4 unpairable: PATH_MODES carries no SE3/energy/affordance/contact-head/injectable hook (N200 audit); 0 injectable rig knob", "ideas.md sections 1+4: queue EMPTY since run 309; all v3/v4 done; N198 open_needs_director (not executable by worker)", "G7 integrity: predicted-only score (76/100) may not set status; synthetic_proxy excluded; synthetic N74 92.3 frozen unconditionally; no arithmetic promotion permitted", "No mechanism built (G3 retirement binds permanently); health re-cert is the only valid physical action"]}, "physical_action_taken": "frozen-champion health re-cert: timeout 1200 python3 experiments/kaggle_aegis_sweep.py --seeds 20 --no-upload --path trochoid --compare raster --suites fixture_A,fixture_B,fixture_R --out results/aegis_v2/iter17_facc_ea_health_r435.jsonl (exit 0, ~9.0s, 120 episodes, 0 harness errors, 0 rig bytes changed, pose_noise_cfg 0,0)", "rig_invoked": true, "rig_exit": 0, "episodes": 120, "harness_errors": 0, "rig_bytes_changed": 0, "pose_noise_cfg": "0,0", "evidence": ["results/aegis_v2/iter17_facc_ea_health_r435.jsonl (canonical rig header matches claim: pose_noise_cfg 0,0, rig_version 2, compare=raster)"], "metrics": {"idea": "FACC-EA-DIRECTOR-ITER17", "metric_class": "physical", "seeds": 20, "episodes": 120, "fixture_A_success": 1.0, "fixture_B_success": 1.0, "fixture_R_success": 1.0, "coverage_cont_ABR": "1.0000/1.0000/1.0000 both arms", "delta_vs_champion": 0.0, "welch_p": "NaN (zero variance at ceiling)", "fisher_p_success_vs_champion": 1.0, "compare_keep": false, "synthetic_proxy": null, "candidate_b_success": 1.0, "champion_b_success": 1.0, "kept_bar_met": false}, "gates_unchanged": {"segment": 15, "primary_metric": "transfer_success", "tier4_gate": "post-hoc tag, untouched", "no_new_segment": true, "no_metric_move": true, "no_gate_change": true, "no_candidate_promoted": true, "no_unvalidated_row_added": true}, "verdict": "DISCARD (G3 family replay + G4 unpairable + G7 predicted-only invalid + queue empty + N198 director-owned). Health re-cert reproduces frozen champion trochoid B=1.00/A=1.00/R=1.00 at 0,0; delta 0; Fisher p 1.0; keep=false. Freeze champion trochoid (fixture_B=1.00 Fisher p=0.0083 vs raster); freeze synthetic N74 92.3 unconditionally. No injectable mechanism; no arithmetic promotion; no teleport; worklog append-only preserved.", "notes": "Iteration 17 (single-brain fallback muse-spark-1.3-contributor-free). Queue EMPTY (\u00a71 all v3/v4 done since 309); G3 retirement binds permanently: eq78/N70-N76/manifold-switch/flow-bridge/energy-gated/SE3-affordance/EBM-affordance/DAEF-family/FACC-family retired. No synthetic proxy promotion allowed; synthetic_proxy excluded from metrics; evidence file header matches claim (pose_noise_cfg 0,0, rig_version 2, compare=raster). No equation derived (equation_row_changed false); equations.md unchanged. No new mechanism (new_mechanism false); replay_of_retired_family true; retired_family_ids [\"eq78\",\"N70\",\"N71\",\"N72\",\"N73\",\"N74\",\"N75\",\"N76\",\"manifold-switch\",\"flow-bridge\",\"energy-gated\",\"SE3-affordance\",\"EBM-affordance\",\"DAEF-family\",\"FACC-SE3-family\",\"FACC-EA-family\"]; unvalidated cap untouched (0 used); disk 74 GB (>10 GB floor); anchored kill verified (no match after run); no deferred/proxy/same-dependency phrase used.", "equation_derived": false, "equation_row_changed": false, "new_mechanism": false, "replay_of_retired_family": true, "retired_family_ids": ["eq78", "N70", "N71", "N72", "N73", "N74", "N75", "N76", "manifold-switch", "flow-bridge", "energy-gated", "SE3-affordance", "EBM-affordance", "DAEF-family", "FACC-SE3-family", "FACC-EA-family", "FACC-DIRECTOR-ITER-family"], "unvalidated_cap_consumed": false, "unvalidated_cap_remaining_for_idea": 1, "worklog_appended": true, "worklog_lines_added": 8, "evidence_artifact_path": "results/aegis_v2/iter17_facc_ea_health_r435.jsonl", "synthetic_proxy_metric_class_excluded": true, "no_teleport_resetBasePositionAndOrientation": true, "no_arithmetic_coverage_or_success_promotion": true, "no_deferred_remote_same_dependency_phrase": true, "disk_free_gb": 74, "disk_above_10gb_floor": true, "kill_verified_anchored_pattern": true, "git_commit_performed": false}
