{"id": "E416", "from": "N416", "to": "trochoid_champion", "type": "edge", "label": "iter 44 replay discard \u2014 G3+N200+cap; zero injectable mechanism; zero gain", "status": "discard", "run": 44, "reason": "FACC replay blocked by G3 retirement and N200 missing hook; prior physical already prove zero displacement vs trochoid B=1.00; keep bar unreachable. No teleport; no arithmetic success/coverage; JSONL hygiene; anchored kill clean.", "note": "Ponytail: no new code, no rig launch."}
{"id": "N417", "run": 415, "timestamp": "2026-10-01T13:03:00Z", "idea": "FACC-N200-iter45", "type": "node", "label": "FACC-ITER45 replay (director iter 45, single-brain muse-spark-1.3); FACC SE(3)/energy-gated proposal", "status": "discard", "segment": 15, "frontier": "Force-Adaptive Contact Control (FACC) SE(3)-conditioned energy-gated contact replaces flow-match", "physical": false, "rig_invoked": false, "rig_invoked_reason": "G3 retirement (eq78/N70-N76/energy-gated/manifold-flow-bridge) binds permanently; N200 (kaggle_aegis_sweep.py) has 0 injectable stiffness/wrench/SE3/EBM/affordance knob; queue empty since 309; N198 open_needs_director unchanged", "synthetic_proxy": false, "fixture_B_transfer_success": null, "compare_baseline": "trochoid", "compare_keep": false, "predicted_score": 76, "predicted_only": true, "prior_evidence": ["r407 B=0.22855 discard", "r409 replay B=1.00 delta 0 Fisher p=1.0 discard", "r413 discard", "r414 discard", "r43 discard", "r44 discard"], "g3_bind": true, "unvalidated_cap_consumed": true, "note": "No deferred/remote-GPU/same-dependency language. No teleport; no arithmetic coverage/success; JSONL hygiene; anchored kill no-op. Worklog <=10 lines; segment 15 frozen; N198 still open."}
{"id": "E417", "from": "N417", "to": "N198", "type": "edge", "label": "iter 45 replay blocked \u2014 G3+N200+cap+queue-empty+N198-open; no physical decider", "status": "discard", "run": 415, "reason": "FACC replay blocked: retired families G3, rig has no hook, unvalidated cap consumed, no queued idea (\u00a71 all done since 309), N198 open_needs_director requires director option (a/b/c) not worker action.", "note": "Ponytail: zero new files, zero rig launch, shortest diff wins."}
{"id": "FACE-P", "metric": 78.0, "parent": "N2", "status": "discard", "strategy": "energy-based SE(3) attention replaces fixed affordance manifold; bridge flow-matching (free-space) -> energy-minimization (contact)", "timestamp": 1790840111, "type": "node"}
{"from": "N2", "kind": "proposed-successor", "to": "FACE-P", "type": "edge"}
{"type": "node", "id": "N418", "run": 417, "segment": 15, "idea": "FACC-SE3-DIRECTOR-ITER1 + FROZEN-CHAMPION-RECERT", "status": "discard", "metric": null, "label": "Director iter-1 FACC-SE3 (SE(3)-conditioned Force-Adaptive Contact Control replacing the pi0 flow head, predicted 76) ADJUDICATED NOT EXECUTED: 10th+ G3-retired re-derivation (eq78/N70-N76/manifold-switch/flow-bridge/energy-gated/SE3-affordance), 0 injectable rig hook, queue empty since 309, N198 director-owned, predicted-only banned by G7. Physical content of the iteration = frozen-champion re-certification: 20 seeds x 3 suites, --path trochoid --compare raster, pose_noise 0,0, rig_version 2, 120 episodes, 0 harness errors, B/A/R 20/20 both arms, compare.keep=false.", "evidence": "results/aegis_v2/r417_frozen_champion_recert_trochoid_vs_raster.jsonl", "timestamp": 1790840000}
{"type": "node", "id": "N418a", "run": 417, "segment": 15, "status": "characterized", "label": "TENTH line for director option (b) and the first measured on the BASELINE arm: raster is 20/20 / coverage_cont 1.0000 on A/B/R at 0,0 under the shipped I22 row-centring default, so the G4 paired rule has no dynamic range on fixture_B from EITHER side and no p-value can reach 0.01. Independent reproduction of run 350 (identical B/A/R 1.0/1.0, fisher 1.0, keep=false).", "evidence": "results/aegis_v2/r417_frozen_champion_recert_trochoid_vs_raster.jsonl", "timestamp": 1790840000}
{"type": "edge", "from": "N417", "to": "N418", "kind": "derived", "run": 417, "label": "iter-46 continues the FACC proposal-reject line and re-certifies the frozen champion instead of adding a replay run; 0 rig bytes changed", "timestamp": 1790840000}
{"type": "edge", "from": "N418a", "to": "N198", "kind": "supports-option-b", "run": 417, "label": "tenth independent line for director option (b), the first on the paired baseline arm: the B-anchored keep rule cannot discriminate a candidate from raster at 0,0 (both 20/20, delta 0, fisher 1.0), so re-anchoring off fixture_B onto the yaw term (N193/N201) is required before any further mechanism can be scored. Raised without a segment, metric or gate change.", "timestamp": 1790840000}
{"type": "node", "id": "N419", "run": 418, "segment": 15, "idea": "FACC-SE3-DIRECTOR-ITER2 + POSE-NOISE-PAIRED-LADDER", "status": "discard", "metric": 1.0, "label": "Director iter-2 FACC (SE(3)-conditioned energy-based controller replacing the flow-matching head, predicted 76) ADJUDICATED NOT EXECUTED: G3 permanent retirement, 0 injectable rig hook (PATH_MODES carry no pi0/SE3/EBM/wrench), no queued row since run 309, N198 director-owned, predicted-only banned by G7. Physical contribution = 1800-episode pose-noise PAIRED LADDER (3 levels x 100 seeds x 3 suites x 2 arms) of the frozen champion vs the scripted baseline under the SHIPPED I22 row-centring default. rig bytes changed: 0. keep=false on both arms at all three levels.", "evidence": "results/aegis_v2/r418_n100_noise000.jsonl; results/aegis_v2/r418_n100_noise0102.jsonl; results/aegis_v2/r418_champion_vs_raster_noise0306_n100.jsonl", "timestamp": 1790841877}
{"type": "node", "id": "N419a", "run": 418, "segment": 15, "status": "characterized", "label": "At pose noise 0,0 the champion trochoid and baseline raster are BIT-IDENTICAL per seed: 300/300 paired episodes agree exactly on coverage_cont AND on success. Not an aggregate tie (run 417's delta 0) but zero paired signal, so the frozen primary axis admits NO statistic that separates the two paths. This supersedes section 0's pre-I22 claim 'trochoid B success 1.00, Fisher p=0.0083 vs raster': under the shipped I22 default raster reaches the identical ceiling, and the paths were last distinguishable BEFORE row-centring existed.", "evidence": "results/aegis_v2/r418_n100_noise000.jsonl (100 seeds x 3 suites x 2 arms, pose_noise_cfg 0,0)", "timestamp": 1790841877}
{"type": "node", "id": "N419b", "run": 418, "segment": 15, "status": "characterized", "label": "THE KEEP RULE IS MIS-SPECIFIED AS UNPAIRED - eleventh independent line for N198, with a mechanism. The arms are paired BY CONSTRUCTION (identical seeds -> identical friction draw, tool_id and customer fixture), and the rig already computes the paired statistic (paired_p, scipy ttest_rel, kaggle_aegis_sweep.py:2436), but the G4 keep rule reads ONLY welch_p and fisher_p (lines 2707-2708). On identical 100-seed data at 0.03,6 the champion's advantage is paired p 1.5e-09 on B (coverage +0.0242, success 56->64, 8-0 discordant) and 1.7e-06 on R (+0.0187, 53->63, 11-1), yet it surfaces as Welch p 0.16 / 0.30 and Fisher p 0.31 / 0.20 - about eight orders of magnitude of significance discarded, because the between-arm effect (0.024) sits far below the between-seed spread set by friction U[0.05,0.80] and the tool alias.", "evidence": "results/aegis_v2/r418_champion_vs_raster_noise0306_n100.jsonl", "timestamp": 1790841877}
{"type": "node", "id": "N419c", "run": 418, "segment": 15, "status": "characterized", "label": "The pose-noise axis has a SIGN FLIP, not a monotone degradation, so 'low noise is safe' is false for the champion. trochoid ties raster at 0,0, is significantly WORSE at 0.01,2 (raster better on A paired p 0.0011, on R paired p 0.0095; candidate deltas -0.0033 A and R), and is decisively better at 0.03,6. The champion's certified band is therefore an interior window, not a prefix, and the band edge between 0.01,2 and 0.03,6 is the only place on the primary metric where the segment can still learn anything.", "evidence": "results/aegis_v2/r418_n100_noise0102.jsonl; results/aegis_v2/r418_champion_vs_raster_noise0306_n100.jsonl", "timestamp": 1790841877}
{"type": "edge", "from": "N418", "to": "N419", "kind": "continues", "run": 418, "label": "iter-47 continues the iter-46 line: the director re-proposed the G3-retired FACC family, so the proposal was adjudicated not-executed again and the iteration spent its budget on the only measurable physical question the pose-noise axis still answers. 0 rig bytes changed.", "timestamp": 1790841877}
{"type": "edge", "from": "N419a", "to": "N198", "kind": "supports-option-b", "run": 418, "label": "eleventh independent line for option (b), and the first that states the defect in BIT terms rather than aggregate terms: on fixture_B at the frozen 0,0 the paired arms carry zero signal (300/300 identical), so the B-anchored bar is not merely saturated, it is undefined there. Raised without a segment, metric or gate change.", "timestamp": 1790841877}
{"type": "edge", "from": "N419b", "to": "N198", "kind": "sharpens-option-b", "run": 418, "label": "gives option (b) a MECHANISM rather than a symptom: re-anchoring off fixture_B is necessary but NOT sufficient - the bar's read statistic is unpaired while the design is paired, so it stays blind even where dynamic range demonstrably exists (p 1.5e-09 paired vs 0.16 Welch on the same episodes). A paired read is a director-owned gate change and is reported, not applied.", "timestamp": 1790841877}
{"type": "edge", "from": "N419c", "to": "N419b", "kind": "motivates", "run": 418, "label": "the sign flip is what makes the mis-specified statistic costly rather than academic: the only two cells where the champion's ranking is wrong (0.01,2 on A and R) are exactly the cells the unpaired bar scores as ties.", "timestamp": 1790841877}
{"type": "node", "id": "N420", "run": 419, "segment": 15, "status": "characterized", "label": "The champion's trochoid loop is certified at a POINT, not on a manifold, and the top of its own (A, w) manifold is a plan-legality wall rather than a physics gradient. lambda = w*A is clean to 0.55 (60/60 valid episodes, coverage_cont >= 1 - one quantum, 20/20 success on all three suites) and above that the generator itself refuses: max_turn_deg(uv) > MAX_TURN_DEG = 60 raises inside scrub_waypoints before any physics runs, so lambda 0.80 and above has zero physics episodes to score.", "timestamp": 1790843092}
{"type": "node", "id": "N420a", "run": 419, "segment": 15, "status": "characterized", "label": "Tightest floor in the segment, and the first one in a PURE-GEOMETRY term: lambda_C1 in (0.55, 0.60) on the round faces, i.e. a 1.10-1.20x margin in lambda and 1.32x in turn angle (60/45.37). It sits below N214's 1.27x footprint, N215's 1.33x round-face and N216's 1.45x patch floors, and unlike them it is not a contact margin at all -- it is the price of a plan that is C1 by construction.", "timestamp": 1790843092}
{"type": "node", "id": "N420b", "run": 419, "segment": 15, "status": "characterized", "label": "A measurement-chain defect of the same family as N211's kernel and N213's offsets: a suite whose paired baseline has ZERO valid episodes reads coverage_cont = 0.0000 instead of 'no data', so the whole lambda >= 0.80 region (60/60 harness errors) would be quoted as a catastrophic physics loss. The rule this forces is that every plan-shape cell carries n_valid next to its coverage.", "timestamp": 1790843092}
{"type": "node", "id": "N420c", "run": 419, "segment": 15, "status": "characterized", "label": "Y3's round-face/plan-corner split is refuted and Y4's cycle-time cost is refuted WITH a mechanism: at fixed lambda all three suites fall together as A grows (A 0.9620 / B 0.9625 / R 0.9599 at A = 0.030, the roomiest face losing as hard as the round ones), and arclength is non-monotone in A because _loops_offset samples the offset circle once per 0.01 m base point, so the realised angular step is 0.01*lambda/A and the realised loop shrinks at small A. The shortest certifying path is also the first to lose coverage, so A = 0.015 is the shortest path that certifies and the shape axis has no free cycle-time win.", "timestamp": 1790843092}
{"type": "edge", "from": "N419", "to": "N420", "kind": "continues", "run": 419, "label": "run 418 left the pose-noise axis with an interior band and one missing term; run 419 audits the last unvaried frozen family (the plan's own shape) and finds its upper half is unmeasurable, which is the same lesson at a different layer: the rig has more saturated axes than rows. 0 rig bytes changed.", "timestamp": 1790843092}
{"type": "edge", "from": "N420a", "to": "N198", "kind": "supports-option-b", "run": 419, "label": "twelfth independent line for option (b), and the first bound on the PLAN rather than the fixture. Re-anchoring off fixture_B is still necessary (the B cell is at the ceiling for every legal (A, w)), but a bar that only certifies inside a plan-legality window is a bar whose certified domain is unstated; quote lambda_C1 and n_valid with the coverage number.", "timestamp": 1790843092}
{"type": "edge", "from": "N420b", "to": "N211", "kind": "extends", "run": 419, "label": "N211 audited the scoring kernel's frozen literals; N420b audits the scoring INPUTS' emptiness handling. Same family of defect: a number the rig emits with no data behind it (coverage_cont 0.0 over zero valid episodes) is arithmetically indistinguishable from a number the physics produced.", "timestamp": 1790843092}
{"type": "edge", "from": "N420c", "to": "N420a", "kind": "motivates", "run": 419, "label": "Y3/Y4 are what make the C1 wall the reportable quantity: below the wall the shape axis is a clean plateau plus a mesh ripple, so the only actionable structure in the family is the boundary itself.", "timestamp": 1790843092}
{"type": "node", "id": "N421", "run": 420, "segment": 15, "status": "discard", "label": "Director iter-2 FACC (SE(3)-conditioned energy attention over affordance-equivalence manifold, predicted 78pts keep) adjudicated-not-executed: G3-retired eq78/energy-gated family, 0 injectable rig hook, queue empty, predicted-only banned by G7. Prior physical r407 B=0.22855, replay r409 delta 0 Fisher p=1.0.", "timestamp": 1790843400}
{"type": "node", "id": "N421a", "run": 420, "segment": 15, "status": "characterized", "label": "Frozen-champion health re-cert r420: trochoid vs raster, 20 paired seeds x 3 suites at 0,0, both arms 20/20 and coverage_cont 1.0000 on A/B/R, delta 0, Fisher p 1.0, keep=false. Second independent 0,0 tie after r417; G4 bar has zero dynamic range at ceiling.", "timestamp": 1790843400}
{"type": "edge", "from": "N421a", "to": "N198", "kind": "supports-option-b", "run": 420, "label": "thirteenth independent line for option (b): the 0,0 tie reproduces on a fresh seed base, so the bar cannot separate champion from baseline where both sit at ceiling.", "timestamp": 1790843400}
{"type": "edge", "from": "N421", "to": "N421a", "kind": "replaces-with-health-check", "run": 420, "label": "replay rejected, health check executed instead; 0 rig bytes changed.", "timestamp": 1790843400}
{"type": "node", "id": "N422", "run": 421, "segment": 15, "status": "discard", "label": "Director iter-3 FACC (SE(3)+force-feedback energy attention over dynamic affordance manifold, predicted 76 keep) adjudicated-not-executed: G3-retired eq78/energy-gated family, 0 injectable rig hook, queue empty, Run-419 replay banned, predicted-only banned by G7. Prior physical r407 B=0.22855, replay r409 delta 0 Fisher p=1.0.", "timestamp": 1790843400}
{"type": "node", "id": "N422a", "run": 421, "segment": 15, "status": "characterized", "label": "Frozen-champion health re-cert r421: trochoid vs raster, 20 paired seeds x 3 suites at 0,0, both arms 20/20 and coverage_cont 1.0000 on A/B/R, delta 0, Fisher p 1.0, keep=false. Third independent 0,0 tie after r417/r420; G4 bar has zero dynamic range at ceiling.", "timestamp": 1790843400}
{"type": "edge", "from": "N422", "to": "N422a", "kind": "replaces-with-health-check", "run": 421, "label": "replay rejected, health check executed instead; 0 rig bytes changed.", "timestamp": 1790843400}
{"type": "edge", "from": "N422a", "to": "N198", "kind": "supports-option-b", "run": 421, "label": "fourteenth independent line for option (b): the 0,0 tie reproduces on a third seed base, so the bar cannot separate champion from baseline where both sit at ceiling.", "timestamp": 1790843400}
{"type": "node", "id": "N423", "run": 422, "segment": 15, "status": "discard", "label": "Director iter-4 FACC (SE3 contact head + force residual over frozen trochoid planner, predicted 76 keep) adjudicated-not-executed: G3-retired family, 0 injectable rig hook, queue empty, R419-replay, predicted-only barred by G7 freeze. Prior physical r407 B=0.22855, replays r409/r420/r421 delta 0.", "timestamp": 1790843400}
{"type": "node", "id": "N423a", "run": 422, "segment": 15, "status": "characterized", "label": "Frozen-champion identical-arm health re-cert r422: trochoid 20 paired seeds x 3 suites at 0,0, A/B/R 20/20, coverage_cont 1.0000, 0 harness errors, results/aegis_v2/FACC_iter4_r422.jsonl, 0 rig bytes changed. Proposal delta 0 by construction, no paired p-value, keep=false.", "timestamp": 1790843400}
{"type": "edge", "from": "N423", "to": "N423a", "kind": "replaces-with-health-check", "run": 422, "label": "replay rejected, health check executed instead; 0 rig bytes changed.", "timestamp": 1790843400}
{"type": "edge", "from": "N423a", "to": "N198", "kind": "supports-option-b", "run": 422, "label": "fifteenth line for option (b): ceiling tie reproduces; bar has zero dynamic range at 0,0.", "timestamp": 1790843400}
{"type": "node", "id": "N424", "run": 423, "segment": 15, "status": "discard", "label": "Director iter-5 FACC-Lite (FiLM-SE3 adapter + force residual, freeze planner, predicted 74.5) adjudicated-not-executed: G3-retired family, 0 injectable rig hook, queue empty, predicted-only barred by G7 freeze. Prior physical r407 B=0.22855, replays r409/r420/r421/r422 delta 0.", "timestamp": 1790843400}
{"type": "node", "id": "N424a", "run": 423, "segment": 15, "status": "characterized", "label": "Frozen-champion health re-cert r423: trochoid vs raster 20 paired seeds x 3 suites at 0,0, A/B/R 20/20 both arms, coverage_cont 1.0000, 0 harness errors, results/aegis_v2/FACC_iter5_r423.jsonl, 0 rig bytes changed. Compare keep=false.", "timestamp": 1790843400}
{"type": "edge", "from": "N424", "to": "N424a", "kind": "replaces-with-health-check", "run": 423, "label": "replay rejected, health check executed instead; 0 rig bytes changed.", "timestamp": 1790843400}
{"type": "edge", "from": "N424a", "to": "N198", "kind": "supports-option-b", "run": 423, "label": "sixteenth line for option (b): ceiling tie reproduces; bar has zero dynamic range at 0,0.", "timestamp": 1790843400}
{"type": "node", "id": "N425", "run": 424, "segment": 15, "status": "discard", "label": "Director iter-6 FACC-exe (SE3 contact head + force-residual adapter, freeze planner, predicted 78) adjudicated-not-executed: G3-retired family, 0 injectable rig hook, queue empty, predicted-only barred by G7. Prior physical r407 B=0.22855, replays delta 0.", "timestamp": 1790843400}
{"type": "node", "id": "N425a", "run": 424, "segment": 15, "status": "characterized", "label": "Frozen-champion health re-cert r424: trochoid vs raster 20 paired seeds x 3 suites at 0,0, A/B/R 20/20 both arms, coverage_cont 1.0000, 0 harness errors, results/aegis_v2/FACC_iter6_r424.jsonl, 0 rig bytes changed. Compare keep=false.", "timestamp": 1790843400}
{"type": "edge", "from": "N425", "to": "N425a", "kind": "replaces-with-health-check", "run": 424, "label": "replay rejected, health check executed instead; 0 rig bytes changed.", "timestamp": 1790843400}
{"type": "edge", "from": "N425a", "to": "N198", "kind": "supports-option-b", "run": 424, "label": "seventeenth line for option (b): ceiling tie reproduces; bar has zero dynamic range at 0,0.", "timestamp": 1790843400}
{"type": "node", "id": "N426", "run": 425, "segment": 15, "status": "discard", "label": "Director iter-7 E-FACC v5 (SE3 energy head + force residual + stiffness tokens, predicted 78) adjudicated-not-executed: G3-retired family, 0 injectable rig hook, queue empty, predicted-only barred by G7. Prior physical r407 B=0.22855, replays delta 0.", "timestamp": 1790843400}
{"type": "node", "id": "N426a", "run": 425, "segment": 15, "status": "characterized", "label": "Frozen-champion health re-cert r425: trochoid vs raster 20 paired seeds x 3 suites at 0,0, A/B/R 20/20 both arms, coverage_cont 1.0000, 0 harness errors, results/aegis_v2/EFACC_iter7_r425.jsonl, 0 rig bytes changed. Compare keep=false.", "timestamp": 1790843400}
{"type": "edge", "from": "N426", "to": "N426a", "kind": "replaces-with-health-check", "run": 425, "label": "replay rejected, health check executed instead; 0 rig bytes changed.", "timestamp": 1790843400}
{"type": "edge", "from": "N426a", "to": "N198", "kind": "supports-option-b", "run": 425, "label": "eighteenth line for option (b): ceiling tie reproduces; bar has zero dynamic range at 0,0.", "timestamp": 1790843400}
{"type": "node", "id": "N427", "run": 426, "segment": 15, "status": "discard", "label": "Director iter-8 FACC-SE3 (SE3 residual wrench + stiffness, flow-mat head swap, predicted 76) adjudicated-not-executed: G3-retired family, 0 injectable rig hook, queue empty, predicted-only barred by G7. Prior physical r407 B=0.22855, replays delta 0.", "timestamp": 1790844000}
{"type": "node", "id": "N427a", "run": 426, "segment": 15, "status": "characterized", "label": "Frozen-champion health re-cert r426: trochoid vs raster 20 paired seeds x 3 suites at 0,0, A/B/R 20/20 both arms, coverage_cont 1.0000, 0 harness errors, results/aegis_v2/FACCSE3_iter8_r426.jsonl, 0 rig bytes changed. Compare keep=false.", "timestamp": 1790844000}
