{"run": 303, "segment": 15, "status": "keep", "idea": "N192", "timestamp": "2026-09-30T17:40:00Z", "commit": "HEAD", "metric": 1.0, "metric_name": "fixture_B transfer_success (coverage_cont >= 0.90 per episode), canonical rig, 100 seeds, pose_noise 0.28,56", "metric_unit": "fixture_B transfer_success of the AEGIS_REG=depth AEGIS_REG_HALF_M=0.6 AEGIS_REG_CASTS=0 arm (k=6 cast lattice, 36 casts)", "rig": "experiments/kaggle_aegis_sweep.py (PyBullet DIRECT, system python3, rig_version 2, friction U[0.05,0.80], gate_mode=post-hoc); pts_source=physics_contact; every coverage_cont/success recomputed from physics contacts at return time; no teleport, no arithmetic coverage", "command": "AEGIS_POSE_NOISE=<sigma> AEGIS_REG=depth AEGIS_REG_HALF_M=0.6 AEGIS_REG_CASTS=0 timeout 1200 python3 experiments/kaggle_aegis_sweep.py --seeds 100 --no-upload --path trochoid --compare trochoid --compare-env AEGIS_REG_CASTS=1 --suites fixture_A,fixture_B,fixture_R --out results/aegis_v2/N192_r303_s100_<sigma>.jsonl", "compare_champion": "in-rig --compare trochoid + --compare-env AEGIS_REG_CASTS=1 on the SAME 100 seeds -> identical friction / tool / customer draw / pose noise / ray grid; the baseline arm IS the shipped N190 champion (H=0.6, REG_EST=mean), reproduced bit-identically to run 302's frozen arm (B 84/100, covc 0.9153)", "metrics": {"idea": "N192", "director_iteration": 48, "director_directive_adjudication": {"spec": "FACC: SE(3)-conditioned Force-Adaptive Contact Control replacing the flow-matching expert; energy-based in-context contact attention scores affordance candidates by contact energy; bridge flow-matching -> affordance-equivalence; validation on contact-rich + SE(3)-perturbed splits; predicted 0.88 pts, keep", "executed": false, "exclusion_reasons": ["G3 retired family: manifold-switch / flow-bridge / energy-gated, 57th re-derivation. FACC closed on physical data at r232/r233; FACC-E adjudicated not executed at r300; the iter-47 FACC at r301/r302 again not executed. A re-derivation of a closed family cannot be a frontier node.", "G4 unpairable: the scrub rig has no pi0 action expert, no SE(3) energy-attention keypoint and no wrench-conditioned action head; the rig's only comparable knob is the planning-pose error, which is not SE(3) contact force. Adding such a head would be fabrication under G7.", "G7: predicted-only keep is banned; no keep may rest on a score the rig never produced."], "action_taken": "ran the live frontier node N192 instead, opened by the N191->N192 edge ('the floor is the ray window's CONTAINMENT threshold; N192 must change the SENSOR, not the estimator')"}, "mechanism": "N191 refuted every estimator variable and attributed the pose-noise floor to the ray window's CONTAINMENT of the top face (N190.3). Widening H is closed (H=0.9 loses to H=0.6, N190.6). N192 therefore changes the SENSOR: a k x k lattice of +-H windows at pitch d = 1.5a (a = H - hypot(0.34,0.14) = 0.2323 m = the inf-norm containment slack), whose union covers the plausible-centre set (half-extent 3 sigma), keeping only the ONE cast that best contains the face. The containing cast is identified by its TOP-POINT COUNT (maximal exactly when the window holds the whole face; 123 points = the full-face grid count); ties go to the cast nearest the prior, so k=1 is the frozen code path bit-identically. A containing cast's point set is UNTRUNCATED, so the frozen mean estimator and the frozen PCA yaw are reused verbatim and the N190.3 truncation-bias term is identically zero for the selected cast. k = ceil(4 sigma / a) + 1 -> 6 (36 casts) at 0.24/0.28 m, 7 (49) at 0.32 m, 1 (frozen, bit-identical) while sigma <= a.", "fixture_B_paired": {"0.03,6": {"k": 1, "covc_frozen": 1.0, "covc_dose": 1.0, "succ_frozen": 100, "succ_dose": 100, "welch_p": null, "fisher_p": 1.0, "rig_keep": false, "note": "dose inert (sigma <= a): bit-identical, nothing to fix"}, "0.20,40": {"k": 1, "covc_frozen": 0.9877, "covc_dose": 0.9877, "succ_frozen": 95, "succ_dose": 95, "welch_p": null, "fisher_p": 1.0, "rig_keep": false, "note": "dose inert (sigma <= a): bit-identical; 2 seeds still reach reg_err_xy 170 mm from the Gaussian tail"}, "0.24,48": {"k": 6, "covc_frozen": 0.953, "covc_dose": 0.9984, "succ_frozen": 91, "succ_dose": 100, "welch_p": 0.006834, "fisher_p": 0.003237, "paired_p": 0.006557, "rig_keep": true}, "0.28,56": {"k": 6, "covc_frozen": 0.9153, "covc_dose": 0.9984, "succ_frozen": 84, "succ_dose": 100, "welch_p": 0.0002508, "fisher_p": 1.591e-05, "paired_p": 0.0002555, "rig_keep": true}, "0.32,64": {"k": 7, "covc_frozen": 0.8633, "covc_dose": 0.9953, "succ_frozen": 72, "succ_dose": 100, "welch_p": 6.359e-06, "fisher_p": 8.25e-10, "paired_p": 6.612e-06, "rig_keep": true}}, "fixture_A_held_out": {"0.24,48": {"covc": [0.7152, 0.7516], "succ": [21, 25], "welch_p": 0.1869, "fisher_p": 0.6145}, "0.28,56": {"covc": [0.6521, 0.7225], "succ": [17, 21], "welch_p": 0.02711, "fisher_p": 0.5891}, "0.32,64": {"covc": [0.6137, 0.6979], "succ": [12, 15], "welch_p": 0.007583, "fisher_p": 0.6796}}, "fixture_R_held_out": {"0.24,48": {"covc": [0.8347, 0.8628], "succ": [56, 60], "welch_p": 0.3041, "fisher_p": 0.6675}, "0.28,56": {"covc": [0.7893, 0.8473], "succ": [51, 61], "welch_p": 0.07024, "fisher_p": 0.1997}, "0.32,64": {"covc": [0.7419, 0.8343], "succ": [46, 59], "welch_p": 0.008781, "fisher_p": 0.08903}}, "reg_err_xy_mm_on_B": {"0.28,56_dose": {"median": 7.5, "p90": 19.2, "max": 23.32}, "0.28,56_frozen": {"median": 11.66, "p90": 89.72, "max": 241.82}, "0.32,64_dose": {"median": 7.08, "p90": 17.78, "max": 25.95}, "0.32,64_frozen": {"median": 13.75, "p90": 113.07, "max": 222.95}, "flat_in_sigma_median_dose": [7.13, 8.61, 7.2, 7.5, 7.08]}, "mechanism_evidence": {"offcentre_winner_count": {"0.24,48": "100/100", "0.28,56": "100/100", "0.32,64": "89/100", "k=1 levels": "0/100"}, "winning_cast_point_count_median": {"dose": 123, "frozen": [118, 119, 120]}, "reg_ok": {"0.28,56_dose": "100/100", "0.28,56_frozen": "97/100"}, "failure_attribution_B_0.28_56": "all 13 frozen-arm B failures had reg_err_xy > 25 mm; all 13 are removed and 0 remain", "harness_errors": 0, "episodes": 3000, "wall_s_per_episode": {"36_casts": 0.1, "single_cast": 0.15}, "edge_budget": "not engaged: 0 parameters, 0 VRAM, planner-side sensor schedule, not a learned policy"}, "regression": {"k=1_arm": "20 episodes fixture_B, 0 field diffs vs the pre-edit rig (excluding the 3 new log fields and timing)", "default_OFF": "20 episodes fixture_B with AEGIS_REG unset, 0 field diffs vs git HEAD's rig", "post_header_edit_rerun": "all five noise levels re-run and every number reproduced bit-identically"}, "rig_edits": "1 env knob AEGIS_REG_CASTS (1 = frozen single cast, 0 = derived lattice), 1 loop around the existing cast, 3 log fields (reg_casts, reg_cast_win_m, reg_cast_pts), 1 header field. No force, solver or scoring term touched.", "limits": ["the sigma <= a -> k=1 shortcut is a design claim on the scale, not a guarantee: e is unbounded Gaussian, and at sigma = 0.20 the inf-ball exceeds a in ~44% of draws (2 seeds reach reg_err_xy 170 mm; B stays 95/100, no regression). The honest next lever is activating on k*sigma and shrinking the covering radius d at fixed ray budget.", "fixture_A (round) is NOT rescued: 0.21 at 0.28 m despite the best registration measured (reg_err_xy median 2.09 mm, p90 4.30 mm, 0 of 79 failures above 25 mm). A's failure is monotone in the YAW term alone (98/29/25/21/15 successes at 6/40/48/56/64 deg) and yaw is genuinely unobservable on a rotationally symmetric face, so the residual sits in a plan-frame term the sensor cannot see -> N193."], "evidence": ["results/aegis_v2/N192_r303_s100_0.28,56.jsonl", "results/aegis_v2/N192_r303_s100_0.24,48.jsonl", "results/aegis_v2/N192_r303_s100_0.32,64.jsonl", "results/aegis_v2/N192_r303_s100_0.20,40.jsonl", "results/aegis_v2/N192_r303_s100_0.03,6.jsonl", "results/aegis_v2/N192_regression_k1.jsonl", "results/aegis_v2/N192_readout.py", "equations.md ROW N192"]}, "novelty_score": null, "notes": "Tier-4 gate untouched (post-hoc tag, gate_mode=post-hoc in every header). No GPU, no dataset, no download. Segment 15, primary metric transfer_success, status vocabulary keep|discard|crash|unvalidated|invalid respected."}
{"run": 304, "segment": 15, "status": "discard", "idea": "N193", "timestamp": "2026-09-30T19:05:00Z", "commit": "HEAD", "metric": 1.0, "metric_name": "fixture_B transfer_success (coverage_cont >= 0.90 per episode), canonical rig, 100 seeds, pose_noise 0.28,56", "metric_unit": "fixture_B transfer_success of the AEGIS_PATH=auto arm (invariant plan on rotationally symmetric faces, rect plan elsewhere)", "rig": "experiments/kaggle_aegis_sweep.py (PyBullet DIRECT, system python3, rig_version 2, friction U[0.05,0.80], gate_mode=post-hoc); pts_source=physics_contact; every coverage_cont/success recomputed from physics contacts at return time; no teleport, no arithmetic coverage", "command": "AEGIS_POSE_NOISE=<sigma> AEGIS_REG=depth AEGIS_REG_HALF_M=0.6 AEGIS_REG_CASTS=0 timeout 1200 python3 experiments/kaggle_aegis_sweep.py --seeds 100 --no-upload --path auto --compare trochoid --suites fixture_A,fixture_B,fixture_R --out results/aegis_v2/N193_r304_auto_s100_<sigma>.jsonl", "compare_champion": "in-rig --compare trochoid on the SAME 100 seeds -> identical friction / tool / customer draw / pose noise / ray grid; the baseline arm IS the shipped N192 champion (H=0.6, REG_CASTS=0 lattice), verified BIT-IDENTICAL on 300/300 episodes to run 303's lattice arm at 0.28,56 and at 0.32,64", "metrics": {"idea": "N193", "director_iteration": 50, "director_directive_adjudication": {"spec": "FACC: SE(3)-conditioned Force-Adaptive Contact Control replacing the flow-matching head; dynamic affordance field + energy-based physical in-context attention; bridges flow-matching -> affordance-equivalence; validated on contact-rich SE(3) perturbation + unseen stiffness/friction; metric success + force-violation rate vs the run-303 baseline; predicted 1.15 pts keep", "executed": false, "exclusion_reasons": ["G3 retired family: manifold-switch / flow-bridge / energy-gated, 58th re-derivation. FACC is closed twice on physical data (T225 r232 all-reject degeneracy, T226 r233 78/78 infeasible); FACC-E adjudicated NOT EXECUTED at r300; the same FACC spec was adjudicated not executed at r301, r302 and r303.", "G4 unpairable: the scrub rig has no pi0 action expert, no SE(3) energy-attention keypoint and no wrench-conditioned action head. The only SE(3) quantity the rig can pair on is the PLANNING-POSE error, which is not contact force; adding a force-conditioned head would be fabrication under G7. There is also no stiffness axis in the rig to sweep (contacts are fixed at CONTACT_K 1e3).", "G7: predicted-only keep is banned, and the 'force-violation rate' metric does not exist in the rig (the force fields are fn_mean / force_compliance / launch_frac)."], "action_taken": "ran the live frontier node N193 instead, exactly as the N192->N193 edge prescribed ('decide, with a discriminating rig run, whether fixture_A's yaw-monotone failure is a physical failure or a fixture-frame convention in the plan/coverage pairing')"}, "hypothesis": "fixture_A's yaw-monotone failure (21/100 at 0.28 m/56 deg with the best registration ever measured) is a plan/score FRAME PAIRING artefact, not physics -- a rect plan built in a frame whose yaw is wrong against a rect target in the true frame.", "verdict": "HYPOTHESIS CONFIRMED, per-episode, to 0.2%. NOT A G4 KEEP: rig compare.keep = false at every level because G4's bar is anchored on fixture_B, where this dose is a bit-identical no-op at ceiling. The dose is CONFIRMED, not falsified -- do not re-derive or re-bench it.", "why_fixture_B_cannot_move": "N193.3 dichotomy: a rotation-invariant plan containing the patch exists inside the face iff inradius(face) >= circumradius(patch) = hypot(0.20, 0.06) = 0.2088 m. fixture_B's top face has inradius 0.14 m, so the minimal invariant set does not fit -- and on that face the yaw IS observable from PCA (reg_yaw_plan median 0.57 deg vs a 41.23 deg prior), so no invariant plan is needed. fixture_A: 0.32 >= 0.2193 m, fits.", "the_law": "coverage_cont(theta) = |P \u2229 (R_theta P (+) D_r_eff)| / |P| is purely geometric (equations.md N193.1); the rig's own kernel predicts the measured number with mean residual -0.0019 (r 0.9978) on A at 0.28,56 and -0.0018 (r 0.9969) at 0.32,64, and exactly 0.0000 for the invariant arm. A rect plan's yaw budget is theta* ~ 17 deg (0.9271 at 14/16 deg, 0.8958 at 18 deg) for the smallest pad r_eff 0.035 m; the operating prior is 56 deg, 3.3x over.", "unobservable_yaw_is_a_floor": "on a rotationally symmetric face the likelihood is invariant in theta, so the posterior IS the prior and no estimator can reduce it -- the rig keeps the full prior error by construction (yaw_est = None -> dyaw_corr = true_pert[2]). Measured reg_yaw_plan_deg median at 0.28,56: A 39.74 == prior 39.74 (uncorrected), B 0.57 vs prior 41.23 (PCA corrected), R 15.17 = 47.09 on its round customers / 1.05 on its elongated ones. reg_err_xy identical in both arms (A median 2.09 mm, p90 4.30 mm, reg_ok 100/100) -- translation was never the problem.", "dose": "PATH_MODES += orbit (Archimedean spiral on the minimal invariant disc, turn pitch CELL_M, r0 = CELL_M/4) and auto (one conditional: invariant plan iff the registration cannot observe the yaw, else the rect plan). No force / solver / scoring / fixture term touched; no teleport.", "r0_is_measured_not_tuned": "max distance from a metric fine cell (0.025 m pitch, 96 cells on A) to the spiral: 0.0249 m at p/4, 0.0248 m at r0=0, 0.0369 m at p/2 -- the smallest pad's r_eff is 0.035 m, so p/2 does not cover the patch. Shipped p/4 has 0.0101 m of margin.", "paired_physical_100_seeds": {"0.28,56": {"fixture_A": {"covc": [0.7225, 1.0], "succ": [21, 99], "welch_p": 5.022153728622934e-29, "paired_p": 5.022153728622791e-29, "fisher_p": 2.4855554847617e-34}, "fixture_B": {"covc": [0.9984, 0.9984], "succ": [100, 100], "welch_p": 1.0, "fisher_p": 1.0, "note": "BIT-IDENTICAL, 100/100 episodes"}, "fixture_R": {"covc": [0.8473, 0.9969], "succ": [61, 100], "welch_p": 1.5411101097741652e-11, "paired_p": 2.1739059802597965e-11, "fisher_p": 3.539341290364797e-14}, "fixture_R_split_by_customer_shape": {"round": {"succ": [15, 54], "n": 54, "covc": [0.723, 1.0]}, "elongated": {"succ": [46, 46], "n": 46, "covc": [0.9932, 0.9932]}}, "episodes": 600, "harness_errors": 0, "rig_keep": false}, "0.32,64": {"fixture_A": {"covc": [0.6979, 1.0], "succ": [15, 100], "welch_p": 5.158704387898275e-32, "fisher_p": 5.294015161205783e-41}, "fixture_B": {"covc": [0.9953, 0.9953], "succ": [100, 100], "welch_p": 1.0, "fisher_p": 1.0, "note": "BIT-IDENTICAL, 100/100 episodes"}, "fixture_R": {"covc": [0.8343, 0.9973], "succ": [59, 100], "welch_p": 6.726208531102395e-12, "paired_p": 8.925693397371502e-12, "fisher_p": 5.028722485533832e-15}, "episodes": 600, "harness_errors": 0, "rig_keep": false}, "0,0": {"fixture_A": [1.0, 1.0], "fixture_B": [1.0, 1.0], "fixture_R": [1.0, 1.0], "succ": "100/100/100 both arms", "welch_p": null, "fisher_p": 1.0, "rig_keep": false, "note": "no cost, no gain: the rect plan is already perfect at zero pose error -- the invariant plan is paid for and not needed there"}, "attribution_per_episode": {"fixture_A/trochoid@0.28,56": {"measured_covc": 0.7225, "analytic_covc": 0.7244, "mean_resid": -0.0019, "max_resid": 0.0313, "r": 0.9978}, "fixture_A/trochoid@0.32,64": {"measured_covc": 0.6979, "analytic_covc": 0.6997, "mean_resid": -0.0018, "max_resid": 0.0417, "r": 0.9969}, "fixture_A/auto@0.28,56": {"measured_covc": 1.0, "analytic_covc": 1.0, "mean_resid": 0.0, "max_resid": 0.0}, "caveat": "the analytic predictor ignores the PCA yaw correction, so it is a predictor only where no correction happens (round faces); on B/R it under-predicts by design and is NOT claimed there"}}, "cost_stated": "the price of yaw ignorance is the disc: |D_R|/|P| = 2.10, commanded arclength 3.025 m vs 1.412 m (+114%), ticks 931 vs 434 at the SAME commanded speed -- so no extra slip (0.0071 vs 0.0075 m), no extra jerk (0.00257 vs 0.00272) and stick_frac 0.0000 vs 0.0069. The cost is paid even at 0,0 pose noise, which is the one real argument against unconditional use; the honest break-even is the prior yaw sigma vs ~17 deg.", "limits": ["fixture_B is provably out of reach of this dose (N193.3) and at ceiling anyway, so the keep-bar is unreachable from this direction", "the coverage metric scores UNDER-coverage only, so a plan that scrubs beyond the target patch is not penalised -- part of the win is bought with 2.1x the swept area, and a real cell that forbids over-scrubbing would see a smaller gain", "the dispatch reads spec['tank_shape'] as the rig's stand-in for the PCA roundness observable; on a real cell the same conditional reads the observed aspect ratio, which the registration already computes", "no stiffness or friction-generalisation claim: the sweep stays inside U[0.05,0.80] with fixed contact stiffness"], "rig_edits": "2 PATH_MODES entries (orbit, auto) + one early branch in scrub_uv + comment corrections; no force, solver, scoring, fixture or coverage term touched", "regression": "default-OFF (--path raster, 20 seeds x 3 suites, 0.28,56): 60 episodes, 0 field diffs vs git HEAD's rig; the paired trochoid arm of this run is bit-identical on 300/300 episodes to run 303's shipped lattice arm at both active levels", "rig_wall_s": {"0,0": 91.0, "0.28,56": 91.5, "0.32,64": 92.0}, "synthetic_proxy_used": false, "evidence": ["results/aegis_v2/N193_r304_auto_s100_0,0.jsonl", "results/aegis_v2/N193_r304_auto_s100_0.28,56.jsonl", "results/aegis_v2/N193_r304_auto_s100_0.32,64.jsonl", "results/aegis_v2/N193_orbit_0.0_0.jsonl", "results/aegis_v2/N193_orbit_0.28_56.jsonl", "results/aegis_v2/N193_orbit_0.32_64.jsonl", "results/aegis_v2/N193_yawonly_orbit_t0.jsonl", "results/aegis_v2/N193_yawonly_orbit_t20.jsonl", "results/aegis_v2/N193_yawonly_orbit_t40.jsonl", "results/aegis_v2/N193_yawonly_orbit_t56.jsonl", "results/aegis_v2/N193_yawonly_orbit_t64.jsonl", "results/aegis_v2/N193_yawonly_trochoid_t56.jsonl", "results/aegis_v2/N193_regression_defaultOFF_post.jsonl", "results/aegis_v2/N193_regression_defaultOFF_head.jsonl", "experiments/N193_probe.py", "experiments/N193_readout.py", "results/N193_probe.json", "results/N193_readout.json"], "equation_row": "equations.md ROW N193 (N193.1 corner-loss law, N193.2 floor-not-noise, N193.3 existence dichotomy, N193.4 plan+cost, N193.5 paired matrix, N193.6 per-episode attribution, N193.7 status)", "frontier_after": "N194: the G4 keep-bar itself is exhausted -- fixture_B is 100/100 up to 0.32 m/64 deg and cannot be improved, so no future KEEP can come from B. The reachable keep-bar is the pose-noise range where B itself degrades; the N192 (b) limit (activate the cast lattice on k*sigma with a shorter covering radius d at fixed ray budget) is the only knob that can move B again, and it must be dosed where the frozen arm is below 0.70."}, "novelty_score": null, "notes": "Iteration 50. Director FACC adjudicated NOT EXECUTED (58th G3-retired re-derivation; G4-unpairable; predicted-only; no stiffness axis and no force-violation metric in the rig). Ran the live frontier node N193. Verdict: hypothesis CONFIRMED per-episode (analytic frame-pairing law predicts the measured coverage_cont to 0.2%), physical effect large and paired (A 0.21->0.99, held-out R 0.61->1.00, p 1e-11..1e-34, 0 harness errors in 1800 episodes), but rig compare.keep = false because the bar is anchored on fixture_B where the dose is a provable no-op at ceiling. Logged as discard-from-champion-contention, NOT falsified; see metrics.verdict and metrics.frontier_after."}
