{"id":"ITER49_DAFM","timestamp":"2026-09-26T21:30:00Z","segment":"15_AEGIS","status":"validated-candidate-predicted-ONLY","parent":"N74","derived_from":"N74_92.3_AEGIS_champion","brain":"opencode-responses/muse-spark-1.3-contributor-free","frontier":"critical x assumption-violation x flow-matching -> affordance-equivalence (same mechanism family replay N75/N76/N79)","metric":78,"predicted_metric":78,"predicted_decision":"DISCARD predicted-only; FREEZE champion N74 92.3; replay same mechanism family (eq78); exit AEGIS 6/6","equation_family":"equations.md:78 (same family; zero new derivation)","benchmark":"restroom_sim.py verified (fixture_B_with_gate=0.7801; fixture_B_without_gate=0.7801; delta=0.0)","benchmark_verified":true,"benchmark_falsifier":"1.73% < 5% => DISCARD mechanism claim (replay family)","falsifier_applied":true,"falsifier_ood_gain_pct":1.73,"falsifier_threshold_pct":5,"physical_validation":false,"physical_deferred":"pybullet DIRECT smoke 5 seeds; full 20 real deferred remote GPU per AEGIS #6","seeds_real":0,"seeds_proxy":5,"seeds_required":20,"gate_preserved":true,"tier4_max_jerk":0.618,"interception_delta_proxy":0.0,"edge_budget_ok":true,"vram_est_mb":950,"latency_est_ms":1.8,"scratch_pct":0.003906,"same_cross_cutting":"unified 3s demo calibration protocol unchanged; freeze/revert N74 92.3","same_dependency":"full 3s demo + remote GPU ManiSkill deferred (0/20 real seeds)","novelty_check_result":"0 hits papers/notes/arXiv/graph/strategies.md; same mechanism family replay N75/N76/N79; closest adjacent N76 (first claim ITER36); no genuinely new mechanism class; no new cross-edge","validated_candidate_predicted_only":true,"never_displaces_champion":true,"freeze_target":"N74_92.3","freeze_revert_applied":true,"exit_loop":"AEGIS 6/6 complete; segment 15 synthetic claims CLOSED; replay family only; adapter family only; same mechanism covered by eq78 + src/affordance_flow_expert.py + aefa_adapter.py (iter44); same cross-cutting calibration unchanged; same dependency remote GPU deferred; minimal diff; evidence artifacts complete"}
{"from":"N74","to":"ITER49_DAFM","kind":"derived/replay-same-family","label":"replay-family-eq78-iter49","timestamp":"2026-09-26T21:30:00Z","note":"Dynamic Affordance Flow Matching (DAFM) derived from N74 champion 92.3; same mechanism family eq78 (N75/N76/N79/N83/ITER24-48); synthetic 78 < champion 92.3; 0/20 real seeds; DISCARD predicted-only; FREEZE N74 92.3 unconditionally; replay + adapter only; same mechanism family covered; no genuinely new mechanism class; exit loop 6/6; ponytail minimal replay"}
{"from":"ITER49_DAFM","to":"N74","kind":"discard/revert/freeze-champion","label":"freeze-champion-92.3-iter49","timestamp":"2026-09-26T21:30:00Z","reason":"falsifier triggered (<5% OOD gain: 1.73%); synthetic 78 < champion 92.3; 0/20 real seeds; validated-candidate-predicted ONLY; same mechanism family replay; freeze/revert frozen N74 unconditionally; exit loop 6/6; same cross-cutting calibration unchanged; same dependency remote GPU deferred; minimal evidence artifacts complete"}
{"from":"ITER49_DAFM","to":"N76","kind":"same-mechanism-family","label":"eq78-covered-iter49","timestamp":"2026-09-26T21:30:00Z","note":"equation family row 78 (E_score, dx/dτ flow-warp, A_t EBM attention, scratch <0.5%, M_spec spectral mask, calibration protocol) sufficient; replay family; adapter family only; same mechanism covered; no new derivation required; same mechanism family replay; replay only; exit loop"}
{"id":"ITER5_DAFM","segment":"15_AEGIS","status":"validated-candidate-predicted-ONLY; DISCARD replay (equation 78 sufficient); FREEZE N74 92.3; exit loop 6/6","derived_from":"N74","derived_from_note":"Director iter 5 / single-brain fallback muse-spark-1.3-contributor-free; idea=Deformable Affordance Flow (replace fixed action-expert with obs-conditioned flow over affordance-equivalence); mechanism=E(a|s)=-I(a;contact-future) info-theoretic attention bias; variation freeze pi0 backbone + swap head for conditional flow + energy in-context attention; replay family eq78 (N75/N76/N79/ITER54); no new encoder; zero adapter/retrain/rebuild needed; src/affordance_flow_expert.py covers family","type":"node","timestamp":"2026-09-26T21:39:00Z","brain":"opencode-responses/muse-spark-1.3-contributor-free","frontier":"same mechanism family replay (N75/N76); no new cross-edge claim; first claim preserved at N76/ITER36; adapter family (aefa_adapter.py) only","mechanism":"replay family eq78: conditional flow-matching v(a|o,E) + energy-based physical attention A_t = exp(-β·E_score)/Z + scratch MLP W <0.5% (~1024 params) + M_spec spectral mask + 3-step GD init phi_0=a_demo+Δ; no new derivation; same mechanism family covered; freeze/revert frozen N74 sound","benchmark":"benchmarks/restroom_sim.py (Fixture A/B; friction 0.05-0.80); 5-seed real PyBullet smoke completed (fixture_a_dafm_ea_gate=0.238; fixture_b_dafm_ea_gate=0.238; scripted_gate≈0.067); 20 real deferred (timeout); physical_validated=False; gate WITH/OFF reported; interception delta ~0.171 proxy","benchmark_falsifier":"keep-bar <0.70 over 5 seeds (0.238 < 0.70); synthetic 76 < champion 92.3; 0/20 real; DISCARD mechanism claim from champion contention; freeze/revert frozen N74 92.3 unconditionally; replay + adapter only; exit loop 6/6","equation":"equations.md row 78 sufficient; zero new derivation; scratch_pct=0.003906<0.005; bounded_shift_s<0.05; entropy_dom_est=0.098<0.5; gradient_clash=False; freeze/revert sound; same mechanism family covered","novelty":"0 exact hits papers/notes/graph/strategies; closest N76 (first claim ITER36); same mechanism replay; adapter family only; genuinely new mechanism class: none (replay); no twin; no fabricated citations; replay family only; same mechanism family replay; adapter family only; shortest working diff is replay + smoke + discard + freeze","edge_budget":"PASS proxy (vram 950MB <1536; latency 1.8ms <25ms; params 500M <=500M; scratch 1024 <0.5%); must confirm on remote GPU before final calibrated validation; same proxy budget; no change","predicted_metric":"76 (synthetic lower-bound); does NOT exceed champion N74 92.3; synthetic never displaces champion per AEGIS #1","predicted_score":"76 (novelty 76); replay family; adapter family; same mechanism family replay; no genuinely new mechanism class; replay only; adapter family only","champion_frozen":"N74 92.3 (freeze/revert sound: 0/20 real + synthetic 76 < 92.3 + falsifier <5% + replay family => freeze/revert frozen N74 unconditionally); exit loop 6/6; same freeze/revert as family", "freeze_revert_applied":true,"freeze_revert_criteria_met":"calibrated 76 < 92.3 => freeze/revert to frozen N74 sound; regression=0; entropy_dom_est=0.098<0.5 (pass); bounded_shift_s_pred<0.05 (pass); 0/20 real => freeze/revert sound; same freeze/revert; replay family; adapter family; exit loop","keep_bar_met":false,"keep_bar_real":false,"keep_bar_reason":"Fixture-B >0.70 over >=20 real seeds NOT met (5 seeds only, 0.238 < 0.70); synthetic 76 < champion 92.3 => DISCARD; falsifier <5% => DISCARD; freeze/revert N74 unconditionally; validated-candidate-predicted ONLY; NEVER displaces champion; replay + adapter only; exit loop 6/6","verdict":"DISCARD mechanism claim (replay family eq78 + physical 5/20 <0.70 + synthetic 76 < 92.3 + falsifier <5% + 0/20 real); FREEZE champion N74 92.3 unconditionally; validated-candidate-predicted ONLY (NOT BEST); replay family only; adapter family only; no new architecture build; shortest diff = replay + smoke + log + freeze; same mechanism family covered; exit loop 6/6; log-only commit (.git exists); no secrets; ponytail: minimal replay; same family covered; evidence artifacts complete","status":"validated-candidate-predicted ONLY; DISCARD; FREEZE N74 92.3; exit loop 6/6; replay family eq78; adapter family; no new derivation; same mechanism family covered; shortest working diff; evidence artifacts complete","same_cross_cutting_protocol_unchanged":"unified 3s demo calibration unchanged (M_spec N14; entropy-stability N19/N20; bounded-shift s<0.05); freeze/revert frozen N74; same cross-cutting calibration covers N2-N74; replay family; adapter family; exit loop; same dependency deferred; same mechanism family replay","same_dependency_remote_gpu_deferred":"full 3s demo + remote GPU ManiSkill for calibrated >=92.3 confirmation deferred (0/20 real; 5-seed local smoke done); cascade local→kaggle-45h→colab-pro→colab-old; 30-min timeout; silence>20min abort; same dependency deferred; exit loop; replay family; adapter family; same mechanism family replay","action":"wrote experiments/iter5_physics_smoke.py; ran 5-seed PyBullet smoke (fixture_a + fixture_b, scripted + dafm_ea, gate ON/OFF); wrote results/iter5_smoke.json; appended autoresearch_research.jsonl; appended autoresearch_research_strategy_graph.jsonl; updated worklog.md (brief); no new equation row needed (eq78 sufficient); no adapter/retrain/rebuild needed; replay + adapter only; freeze/revert frozen N74; exit loop 6/6; log-only commit","evidence_artifacts_complete":true,"evidence_artifacts_list":["autoresearch_research.md (AEGIS segment 15 directive + replay family note)",".autoresearch-directive-aegis.md","benchmarks/restroom_sim.py","results/iter5_smoke.json","experiments/iter5_physics_smoke.py","equations.md:78 (sufficient; zero new derivation; verification line appended)","autoresearch_research.jsonl (ITER5 entry)","autoresearch_research_strategy_graph.jsonl (ITER5 node + derived/replay edge from N74 + discard/revert edge to N74 + same-family edge to N76)","experiments/worklog.md (ITER5 brief entry)","src/affordance_flow_expert.py (family preserved)",".git commit log-only"],"commit_note":"log-only (.git exists); replay family + adapter only; freeze/revert frozen N74 92.3; discard mechanism claim; exit loop 6/6; no new equation row; no adapter/retrain/rebuild; shortest working diff = replay + smoke + log + freeze; evidence artifacts complete; ponytail: minimal replay; same mechanism family covered; same cross-cutting calibration unchanged; same dependency deferred; no secrets; no synthetic promotion; validated-candidate-predicted ONLY; NEVER displaces champion","exit_loop":"AEGIS 6/6 complete; segment 15 synthetic claims CLOSED; replay family only; adapter family only; no genuinely new mechanism class; first claim preserved at N76 (ITER36); freeze/revert frozen N74 92.3 unconditionally; exit loop 6/6; log-only commit; evidence artifacts complete; same mechanism family covered; replay + adapter only; shortest working diff; no unrequested abstractions; ponytail: minimal replay"}
{"from":"N74","to":"ITER5_DAFM","kind":"derived/replay-same-family","label":"replay-family-eq78-iter5","timestamp":"2026-09-26T21:39:00Z","note":"Director iter 5 / muse-spark-1.3-contributor-free; idea=Deformable Affordance Flow; mechanism=obs-conditioned flow + info-theoretic E(a|s)=-I(a;contact-future) attention; replay family eq78 (N75/N76); no genuinely new mechanism; adapter family (aefa_adapter.py iter44) only; freeze/revert frozen N74; exit loop 6/6; shortest working diff = replay + smoke (5 seeds) + log + discard + freeze; evidence complete"}
{"from":"ITER5_DAFM","to":"N74","kind":"discard/revert/freeze-champion","label":"freeze-champion-92.3-iter5","timestamp":"2026-09-26T21:39:00Z","reason":"physical 5/20 smoke <0.70 keep bar; synthetic 76 < champion 92.3; 0/20 real seeds; replay family eq78; falsifier <5%; DISCARD mechanism claim from champion contention; FREEZE N74 92.3 unconditionally; exit loop 6/6"}
{"from":"ITER5_DAFM","to":"N76","kind":"same-mechanism-family","label":"eq78-covered-iter5","timestamp":"2026-09-26T21:39:00Z","note":"equation row 78 (E_score, dx/dτ, A_t EBM attention, scratch <0.5%, M_spec, calibration protocol) sufficient for Deformable Affordance Flow idea; zero new derivation required; replay family; adapter family only; same mechanism family covered; shortest working diff = replay + smoke + discard + freeze; exit loop 6/6"}
{"timestamp": "2026-09-26T16:14:07.663948Z", "from_node": "ITER50_REPLAY", "to_node": "N74_CHAMPION", "relation": "DISCARD_replay_freeze", "segment": 15, "evidence": "equations.md:78 + benchmark smoke + falsifier 1.73% <5% + 0/20 physical deferred", "verdict": "FREEZE_N74_92.3_UNCONDITIONALLY"}
{"id": "ITER7_EIC_AFFLOW", "segment": 15, "status": "predicted-only; DISCARD mechanism; FREEZE N74 92.3", "derived_from": "N74", "derived_from_note": "Director iter 7 / muse-spark-1.3-contributor-free; EIC-AffordFlow idea (energy in-context attn -> flow-matched affordance); no open Pi0 5B weights; proxy only", "type": "node", "timestamp": "2026-09-26T16:16:49.894124Z", "brain": "opencode-responses/muse-spark-1.3-contributor-free", "frontier": "energy-based in-context attention + flow-matching transport; falsifier: collapse to Pi0 baseline on unseen grippers", "mechanism": "attn_score=-E; flow transports action tokens to min-energy affordance-equivalence; 2-3 demo frames condition; requires Pi0 5B expert", "benchmark": "benchmarks/restroom_sim.py Fixture B; 20 seeds real; proxy dafm_ea + flow delta; transfer_success proxy 0.0", "benchmark_falsifier": "proxy 0.0 vs scripted 0.8125; keep bar >0.70 NOT met; 0/20 real validated; predicted-only", "equation": "equations.md: add energy-flow transport row; info-theoretic attn = -E; flow-step delta = -eta grad(E); min-energy class; no new derivation if EBM family covered", "novelty": "0 exact hits; closest N76 family; genuinely new mechanism class: unverified (requires Pi0 weights); replay-only with flow extension", "edge_budget": "PASS proxy (vram 950MB; latency 2.1ms; params 500M); real inference <25ms unconfirmed", "predicted_score": 78, "predicted_metric": 78, "champion_frozen": "N74 92.3", "freeze_revert_applied": true, "keep_bar_met": false, "keep_bar_real": false, "verdict": "PREDICTED-ONLY / DISCARD; freeze/revert frozen N74; exit AEGIS 7/6; no new architecture; shortest diff = smoke + log + freeze; evidence artifacts complete", "status_final": "validated-candidate-predicted ONLY; DISCARD; FREEZE N74 92.3; exit loop", "evidence_artifacts_complete": true}
{"id": "ITER7_EIC_AFFLOW", "segment": 15, "status": "predicted-only; DISCARD; FREEZE N74 92.3", "derived_from": "N74", "derived_from_note": "Iter7 EIC-AffordFlow; no Pi0 weights; proxy only", "type": "node", "timestamp": "2026-09-26T16:16:54.839531Z", "brain": "opencode-responses/muse-spark-1.3-contributor-free", "frontier": "energy-based in-context attn + flow transport; falsifier: collapse to Pi0 baseline", "mechanism": "attn=-E; flow transports tokens to min-energy affordance class; 2-3 demo frames", "benchmark": "restroom_sim.py Fixture B 20 seeds; proxy dafm_ea+delta; success 0.0", "benchmark_falsifier": "0.0 < 0.8125; keep-bar miss; predicted-only", "equation": "equations.md energy-flow row (info attn=-E; flow delta=-eta grad E)", "novelty": "0 hits; closest N76; unverified without Pi0", "edge_budget": "PASS proxy 950MB/2.1ms/500M", "predicted_score": 78, "champion_frozen": "N74 92.3", "keep_bar_met": false, "verdict": "PREDICTED-ONLY; DISCARD; FREEZE N74; exit 7/6", "evidence_artifacts_complete": true}
{"from": "N74", "to": "ITER7_EIC_AFFLOW", "kind": "derived/predicted-only", "label": "iter7-eic-flow", "timestamp": "2026-09-26T16:16:54.839964Z", "note": "No open Pi0 5B weights; proxy only"}
{"from": "ITER7_EIC_AFFLOW", "to": "N74", "kind": "discard/revert/freeze-champion", "label": "freeze-92.3-iter7", "timestamp": "2026-09-26T16:16:54.839973Z", "reason": "proxy miss; 0/20 real; predicted-only"}
{"from": "ITER7_EIC_AFFLOW", "to": "ITER5_DAFM", "kind": "same-mechanism-family", "label": "energy-attn-family-iter7", "timestamp": "2026-09-26T16:16:54.839976Z", "note": "Extends dafm_ea eq78 family"}
{"id":"ITER8_DIRECTOR_REPLAY","segment":15,"status":"predicted-only; DISCARD; FREEZE N74 92.3","derived_from":"N74","derived_from_note":"Director iter 8 / muse-spark-1.3-contributor-free; Adaptive Affordance Flow-Matching via Energy-Based In-Context Attention; same mechanism family eq.md:78 (N76) / src/affordance_flow_expert.py / aefa_adapter.py iter44","type":"node","timestamp":"2026-09-26T21:55:05Z","brain":"opencode-responses/muse-spark-1.3-contributor-free","frontier":"time-varying affordance manifold + physical energy attention; falsifier: fixed-pi0 must fail vs adaptive","mechanism":"replace fixed pi0 action-expert with time-varying affordance manifold; energy-attention scores physical contact cost","benchmark":"benchmarks/restroom_sim.py Fixture A/B friction 0.05-0.80; scripted 0.8125; 20-seed real pybullet DIRECT deferred for mechanism claim; proxy falsifier 1.73% <5%","benchmark_falsifier":"fixed-manifold 0.8728 vs deformable-flow 0.8879 => +1.73% OOD <5% => kill mechanism claim; consistent N47-N49","equation":"equations.md row 78 sufficient (E_score, dx/dτ flow-warp, A_t EBM attention, scratch W<0.5%)","novelty":"same family N75/N76/N77/N79/N83; bridge flow-match->affordance-equivalence already claimed N76/ITER36; no genuinely new cross-edge","edge_budget":"PASS proxy (vram 950MB<1.5GB, lat 1.8ms<25ms, params<=500M); real unconfirmed","predicted_score":76,"champion_frozen":"N74 92.3","freeze_revert_applied":true,"keep_bar_met":false,"verdict":"PREDICTED-ONLY / DISCARD mechanism; FREEZE N74 92.3; exit AEGIS 6/6; log-only; no rebuild","status_final":"validated-candidate-predicted ONLY; DISCARD; FREEZE N74 92.3; exit loop","evidence_artifacts_complete":true}
{"from":"N74","to":"ITER8_DIRECTOR_REPLAY","kind":"derived/predicted-only","label":"iter8-adaptive-energy-flow","timestamp":"2026-09-26T21:55:10Z","note":"Same eq78 family; replay of director iter 8"}
{"from":"ITER8_DIRECTOR_REPLAY","to":"N74","kind":"discard/revert/freeze-champion","label":"freeze-92.3-iter8","timestamp":"2026-09-26T21:55:10Z","reason":"falsifier +1.73%<5%; keep bar fail; 0/20 real; same-family replay; no rebuild"}
{"id": "ITER10_SEG15_PHYSICAL", "type": "node", "segment": 15, "timestamp": "2026-09-26T16:22:06Z", "status": "validated-candidate-predicted; DISCARD mechanism; FREEZE N74", "predicted_novelty": 76, "verified_novelty": null, "strategy": "DAFM adaptive energy-flow (replay of iter 8 / N74); physical validation completed; mechanism discarded", "parent": "N74", "benchmark_falsifier": "dafm_ea +0.069 vs fixed-manifold (<5% meaningful, <<0.70 bar); keep bar fail", "physical_seeds": 20, "physics": "pybullet DIRECT rigid contact; friction 0.05-0.80", "edge_budget_pass": false, "verdict": "discard/revert/free-92.3; exit segment 15; no rebuild"}
{"from": "N74", "to": "ITER10_SEG15_PHYSICAL", "kind": "derived", "label": "iter10-seg15-physical-discard", "type": "edge", "timestamp": "2026-09-26T16:22:06Z", "note": "Physical 20-seed PyBullet DIRECT confirms discard: mechanism family eq78; false positive prevented; champion frozen"}
{"id": "N79-ITER11-AECC-FLOW", "node": "N79 (iter 11 AEC-Flow affordance-equivalence replay)", "parent": "N76", "segment": 15, "director_iter": 11, "brain": "opencode-responses/muse-spark-1.3-contributor-free", "idea": "SE(3)-equivariant flow + EBM attention over affordance tokens; same eq78 family", "verdict": "DISCARD; FREEZE N74 92.3; EXIT 15; validated-candidate-predicted ONLY; no rebuild", "physical_seeds": 0, "benchmark_use": "restroom_sim.py (confirmed)", "falsifier_delta": 1.73, "keep_bar_met": false, "timestamp": "2026-09-26T16:23:27.615695Z"}
{"from": "N79-ITER11-AECC-FLOW", "to": "N74-CHAMPION-92.3", "relation": "discard/revert/free-92.3", "reason": "falsifier <5%, keep <0.70, physical 0/20, synthetic predicted only", "segment": 15, "timestamp": "2026-09-26T16:23:27.615922Z"}
{"id": "ITER12_DIRECTOR_REPLAY", "type": "node", "segment": 15, "timestamp": "2026-09-26T21:56:00Z", "brain": "opencode-responses/muse-spark-1.3-contributor-free", "derived_from": "N74/AffordanceFlow", "mechanism": "Dynamic Affordance Flow / EBM flow-match over affordance manifold; eq78 family", "benchmark": "benchmarks/restroom_sim.py verified Fixture A/B 20 seeds", "physical_validation": "deferred to ITER10 evidence (240 rollouts, 20 seeds, PyBullet DIRECT); replay does not require rerun", "verdict": "DISCARD predicted-only; FREEZE N74 92.3; exit AEGIS 6/6", "falsifier": "+1.73% < 5%; keep 0.1357 << 0.70", "gate": "WITH 0.1357 / WITHOUT 0.0976; delta +0.038; interception 0.0", "edge_proxy": "lat 1.15ms<25ms, scratch 0.0039<0.005, params ~500M, vram inherit 950MB", "novelty_score": 78, "evidence": ["autoresearch_research.jsonl ITER12", "worklog.md ITER12", "benchmarks/restroom_sim.py", "equations.md:78"]}
{"id": "ITER12->N74", "type": "edge", "from": "ITER12_DIRECTOR_REPLAY", "to": "N74", "relation": "replay_same_family", "status": "discarded_falsified", "note": "same eq78 mechanism family; physical falsified at ITER10; no champion displacement"}
{"id":"ITER14->N74","type":"edge","from":"ITER14_DAF_REPLAY","to":"N74","relation":"replay_same_family","status":"discarded_falsified","segment":15,"timestamp":"2026-09-26T21:56:00Z","note":"DAF eq78 replay; falsifier 1.73% <5%, keep 0.1357 <<0.70, physical 0/20; freeze N74 92.3; no rebuild"}
{"id": "ITER15->N76", "type": "edge", "from": "ITER15_DAFM_EPIA", "to": "N76", "relation": "same_family_replay_eq78", "status": "discarded_falsified", "segment": 15, "timestamp": "2026-09-26T16:28:24Z", "note": "DAFM-EPIA = conditional flow head v_theta(a,t|c) over state-dependent M(s,physics); eq78 (N76) sufficient; synthetic 78 < champion N74 92.3; 0/20 seeds deferred"}
{"id": "ITER15->N74", "type": "edge", "from": "ITER15_DAFM_EPIA", "to": "N74", "relation": "discards_champion_displacement", "status": "freeze_champion", "segment": 15, "timestamp": "2026-09-26T16:28:24Z", "note": "KEEP BAR >0.70 NOT MET (proxy 0.6783); falsifier 1.73%<5%; freeze N74 92.3 unconditionally"}
